大武口区金沙河水泥制品厂,92640202MA75XRD94G,2006-03-27,个体工商户,苏金强,"N/A","彩砖、道路砖加工、销售(依法须经批准的项目，经相关部门批准后方可开展经营活动)",宁夏,石嘴山,"工业园区110国道"
宁夏东方爱尔门窗有限公司,9164000077493494XF,2006-03-27,N/A,秦东方,"116(万)","铝合金门窗、塑钢门窗加工、制作、安装",宁夏,银川,"宁夏银川市金凤区清化巷123号"
银川舒然商贸有限公司,91640100774935440M,2006-03-27,N/A,胡军,"200(万)","食品销售；日用百货、洗涤化妆品、服装鞋帽、床上用品、家用电器、电子器材、五金交电、水暖配件、建筑材料、金属材料、玩具、办公用品及耗材、农副产品、生产资料",宁夏,银川,"银川市宁夏日用百货副食品批发市场7-12号"
平罗县凯丰农资有限公司邵家桥经营部,91640221MA75Y1E44Y,2006-03-27,N/A,余林,"N/A","农药（不含杀鼠剂）、化肥、农膜、农用药械、中小农具、五金建村、农副产品（不含粮食）销售",宁夏,石嘴山,"平罗县头闸镇邵家桥经营部"
平罗县三洋商贸有限公司,916402217508043076,2006-03-27,N/A,王若愚,"10(万)","汽车(不含小轿车)、农用车、摩托车、拖拉机及其配件、柴油机、农业机械、工程机械、飞碟牌载货汽车的销售",宁夏,石嘴山,"平罗县凌云科技园4区-02号"
银川市规划建筑设计研究院建筑环境装饰设计有限公司,91640100774935109C,2006-03-28,N/A,程众,"100(万)","室内装饰设计；建筑效果图制作；标书制作；设计资料装帧；建筑设计效果图制作(依法须经批准的项目，经相关部门批准后方可开展经营活动)",宁夏,银川,"银川市兴庆区进宁北街188号"
宁夏源泉农林生态科技有限公司,91640500774935301K,2006-03-28,N/A,张思思,"1,500(万)","沙棘、枸杞、水果种植、销售；食品生产、销售（凭许可证中的期限和范围经营）；农产品干燥机械",宁夏,中卫,"中卫市沙坡头区兴仁镇西里村"
中宁县聚远工贸有限公司,91640521774935299D,2006-03-28,N/A,夏学礼,"600(万)","外墙保温材料生产、销售；炉渣砖、钢材、水泥、五金、石膏板、彩钢板销售；土石方工程、再生塑料颗粒加工、销售；焦碳加工、销售；煤加工销售；PVC管加工、销售；绿化工程；钢结构加工；普通货物运输；泡沫包装箱加工、销售；枸杞产品、农副产品、蔬菜加工、销售；纸箱、塑料制品生产、销售；白灰销售。",宁夏,中卫,"宁夏回族自治区中宁县余丁乡时庄村"
同心县众用油料加工厂,9164032455417183XT,2006-03-28,个人独资企业,杨廷武,"N/A","食用油生产、销售(依法须经批准的项目，经相关部门批准后方可开展经营活动)",宁夏,吴忠,"宁夏回族自治区宁夏吴忠市同心县商城"
宁夏汉唐物业服务有限公司,91640200774935205T,2006-03-28,N/A,李杰煌,"100(万)","物业管理（三级）；餐饮服务（需取得食品经营许可证后方可开展经营活动）",宁夏,石嘴山,"宁夏石嘴山市大武口区永乐南路"
宁夏天剑商贸有限公司,91640121774935053N,2006-03-28,N/A,周建萍,"200(万)","电子产品、数控机械、润滑油、汽车（不含小轿车）、五金、环保夜光照明材料、环保设备（含家用设备）、电器、电工材料、标牌、建筑材料销售；建筑机械设备销售及租赁；房屋租赁及中介服务；三类机动车维修（车身清洁维护）；停车服务；汽车租赁；食品、化妆品、日用品、酒类、保健品、进口食品、进口化妆品、进口日用品的批发、零售；电子商务；广告策划、宣传、营销；连锁店铺加盟及经营",宁夏,银川,"宁夏永宁县杨和镇杨和南街11号"
宁夏蓝雅广告有限公司,91640000774938174L,2006-03-29,N/A,崔亮,"150(万)","设计、制作、代理、发布国内各类户外广告，印刷品广告业务；商品信息咨询服务；计算机软件开发、销售；办公设备批发、零售；企业形象策划；庆典活动策划。(依法须经批准的项目，经相关部门批准后方可开展经营活动)",宁夏,银川,"宁夏银川市兴庆区仁义巷1号二楼（原财政局办公楼）"
青铜峡市农村信用合作联社连湖信用社,91640381MA75WCT067,2006-03-29,N/A,黄明波,"N/A","办理存款、贷款、票据贴现、国内结算业务；办理个人储蓄业务；代理其他银行的金融业务；代理收付款项及受托代办保险业务；买卖政府债券、金融债券；代理发行、代理兑付、承销政府债券；提供保管箱业务；从事同行业拆借；经银行业务监督委员会批准开办的其他业务.**(依法须经批准的项目，经相关部门批准后方可开展经营活动)",宁夏,吴忠,"青铜峡市连湖农场农贸市场大门口南侧"
宁夏双维绒制品有限公司,91640300774935344N,2006-03-29,N/A,马维东,"3,000(万)","绒毛及其制品加工、销售；仓储租赁（不含危险品及易燃易爆物品）",宁夏,吴忠,"吴忠市金积工业园区毛纺织产业园"
固原经济开发区润泽粮油有限公司,91640400774938027P,2006-03-29,N/A,王黎君,"300(万)","油籽、小杂粮、豆制品加工及销售；五金、日用杂品、粮油、面粉销售",宁夏,固原,"宁夏回族自治区固原经济开发区同康路"
宁夏中意机械技术有限公司,916400007749369026,2006-03-29,N/A,韩信,"220(万)","机械加工及技术服务；管件、非标准件、密封材料、橡胶制品加工、销售；批发、零售轴承、五金交电、水暖配件、阀门、机电设备、劳保用品、棉麻日杂、电线电缆、日用百货、体育用品、化工产品、工程机械、办公用品、计算机及耗材、保温材料、橡胶制品、密封材料、建筑材料、润滑油、防冻液、消防器材；计算机维修。",宁夏,银川,"宁夏银川市金凤区北京中路860号芳草园公建楼09号营业房"
青铜峡市农村信用合作联社蒋顶信用社,91640381MA75W5J97K,2006-03-29,N/A,魏立华,"N/A","办理存款、贷款、票据贴现、国内结算业务；办理个人储蓄业务；代理其他银行的金融业务；代理收付款项及受托代办保险业务；买卖政府债券、金融债券；代理发行、代理兑付、承销政府债券；提供保管箱业务；从事同行业拆借；经银行业务监督委员会批准开办的其他业务.**(依法须经批准的项目，经相关部门批准后方可开展经营活动)",宁夏,吴忠,"宁夏回族自治区青铜峡市瞿靖镇蒋顶街"
青铜峡市农村信用合作联社叶盛信用社,91640381MA75W7U17W,2006-03-29,N/A,张忠明,"N/A","办理存款、贷款、票据贴现、国内结算业务；办理个人储蓄业务；代理其他银行的金融业务；代理收付款项及受托代办保险业务；买卖政府债券、金融债券；代理发行、代理兑付、承销政府债券；提供保管箱业务；从事同行业拆借；经银行业务监督委员会批准开办的其他业务.**(依法须经批准的项目，经相关部门批准后方可开展经营活动)",宁夏,吴忠,"宁夏回族自治区青铜峡市叶盛镇"
青铜峡市农村信用合作联社商城信用社,91640381MA75W6EL6C,2006-03-29,N/A,丁良英,"N/A","办理存款、贷款、票据贴现、国内结算业务；办理个人储蓄业务；代理其他银行的金融业务；代理收付款项及受托代办保险业务；买卖政府债券、金融债券；代理发行、代理兑付、承销政府债券；提供保管箱业务；从事同行业拆借；经银行业务监督委员会批准开办的其他业务.**(依法须经批准的项目，经相关部门批准后方可开展经营活动)",宁夏,吴忠,"宁夏回族自治区青铜峡市小坝商城"
宁夏昊帅粮油有限责任公司,916402217749353364,2006-03-29,N/A,王学平,"2,600(万)","水稻加工；水稻、小麦、大米、面粉、食用植物油销售，农副产品购销",宁夏,石嘴山,"平罗县通伏乡通伏村八队"
宁夏言喻商贸有限公司,91640100774935862L,2006-03-29,N/A,张平,"1,500(万)","建材、电工电料、五金工具、日用百货、化工产品",宁夏,银川,"宁夏银川市兴庆区丽景南街昆仑建材市场9-71号"
青铜峡市农村信用合作联社邵刚信用社,91640381MA75W5T15J,2006-03-29,N/A,黄明波,"N/A","办理存款、贷款、票据贴现、国内结算业务；办理个人储蓄业务；代理其他银行的金融业务；代理收付款项及受托代办保险业务；买卖政府债券、金融债券；代理发行、代理兑付、承销政府债券；提供保管箱业务；从事同行业拆借；经银行业务监督委员会批准开办的其他业务.**(依法须经批准的项目，经相关部门批准后方可开展经营活动)",宁夏,吴忠,"宁夏回族自治区青铜峡市邵刚镇"
青铜峡市农村信用合作联社建民信用社,91640381MA75W6EK8H,2006-03-29,N/A,丁良英,"N/A","办理存款、贷款、票据贴现、国内结算业务；办理个人储蓄业务；代理其他银行的金融业务；代理收付款项及受托代办保险业务；买卖政府债券、金融债券；代理发行、代理兑付、承销政府债券；提供保管箱业务；从事同行业拆借；经银行业务监督委员会批准开办的其他业务.**(依法须经批准的项目，经相关部门批准后方可开展经营活动)",宁夏,吴忠,"青铜峡市古峡东街187号"
青铜峡市农村信用合作联社城关信用社,91640381MA75W6BY3C,2006-03-29,N/A,巴志刚,"N/A","办理存款、贷款、票据贴现、国内结算业务；办理个人储蓄业务；代理其他银行的金融业务；代理收付款项及受托代办保险业务；买卖政府债券、金融债券；代理发行、代理兑付、承销政府债券；提供保管箱业务；从事同行业拆借；经银行业务监督委员会批准开办的其他业务.**(依法须经批准的项目，经相关部门批准后方可开展经营活动)",宁夏,吴忠,"青铜峡市裕民北街21号"
固原宝佳利淀粉有限公司,91640402788228907N,2006-03-30,N/A,张文斌,"600(万)","淀粉收购及销售。",宁夏,固原,"宁夏回族自治区固原市原州区沙窝村"
宁夏西香记食品有限公司,916401227749357667,2006-03-30,N/A,孙希元,"1,000(万)","调味料（半固态、固态、液态）、速冻食品【速冻米面食品",宁夏,银川,"贺兰县常信乡四十里店（原四十里店中学）"
平罗县海程冶金炉料有限公司,91640221774935600F,2006-03-30,N/A,高勇,"1,812(万)","增炭剂、煅煤的加工、销售；冶金炉料、煤炭制品、硅锰合金产品销售",宁夏,石嘴山,"宁夏回族自治区平罗县崇岗镇工业区"
吴忠市利通盛世物业有限公司,916403007749370242,2006-03-30,N/A,吴文忠,"50(万)","物业管理及相关服务",宁夏,吴忠,"吴忠市迎宾大街（利通盛世花园）"
宁夏金乘来贸易有限公司,91640100774936355P,2006-03-30,N/A,哈志红,"100(万)","窗饰用品、地毯、家具、酒店用品、消毒用品、清洁用品、机械配件、建材、计算机软硬件、不锈钢制品、铝合金制品、化工原料及产品（不含易制毒及危险化学品）、厨房用品、酒店用品、环保设备、水泵及配件、制冷设备销售",宁夏,银川,"银川胜利南街胜利小区4号楼17号营业房"
银川金皇建筑材料销售有限公司,91640100774935977T,2006-03-30,N/A,王安宏,"50(万)","建材销售",宁夏,银川,"银川市西夏区丽子园南街16号（宁夏商业物流中心展一厅18号）"
银川经济技术开发区金日兴物资有限公司,91641100774935758W,2006-03-30,N/A,仇立洪,"400(万)","钢材、建筑材料、保温防水材料、橡胶制品、石棉制品、五金工具、机电产品、化工产品",宁夏,银川,"银川市西夏区黄河西路60号燕宝钢材市场C-61号"
吴忠市天正电力设备有限公司,916403007882037505,2006-03-30,N/A,林庆义,"50(万)","电力设备安装及辅助电力线路维修；外墙装饰；建筑电器、金属材料及防爆电器、电力器材、高低压开关柜、高低压元器件、灯具、五金工具、电线电缆的销售",宁夏,吴忠,"宁夏回族自治区吴忠市西环路"
平罗县洪伟农林牧开发有限公司,91640221774935811Y,2006-03-30,N/A,徐洪伟,"200(万)","农林牧生态开发、旅游，畜禽养殖繁育销售，房屋修缮，砂石销售，民用蜂窝煤加工、销售",宁夏,石嘴山,"平罗县崇岗镇110国道11公里处"
银川科峻医疗设备有限公司,91640100774935803H,2006-03-30,N/A,何会玲,"100(万)","一、二、三类医疗器械（凭许可证经营）、医疗设备的技术咨询、技术推广、技术服务；化学试剂",宁夏,银川,"银川市兴庆区胜利商业街桥兴苑2-5号营业房"
银川嘉腾建筑装饰材料有限公司销售一部,91640100774942130M,2006-03-30,N/A,彭涛,"N/A","油漆涂料、建筑装饰材料、日用百货、五金交电、办公用品销售；室内装饰；保洁服务",宁夏,银川,"银川市清和南街259号"
银川嘉腾建筑装饰材料有限公司销售二部,91640100774942157D,2006-03-30,N/A,彭涛,"N/A","油漆涂料、建筑装饰材料、日用百货、五金交电、办公用品销售；室内装饰；保洁服务",宁夏,银川,"银川市清和南街235号"
青铜峡市农村信用合作联社广武信用社,91640381MA75W5T07P,2006-03-31,N/A,杨生武,"N/A","办理存款、贷款、票据贴现、国内结算业务；办理个人储蓄业务；代理其他银行的金融业务；代理收付款项及受托代办保险业务；买卖政府债券、金融债券；代理发行、代理兑付、承销政府债券；提供保管箱业务；从事同行业拆借；经银行业务监督委员会批准开办的其他业务.**(依法须经批准的项目，经相关部门批准后方可开展经营活动)",宁夏,吴忠,"青铜峡市广武卫生院对面"
青铜峡市农村信用合作联社小坝信用社,91640381MA75W6CB18,2006-03-31,N/A,王秀萍,"N/A","办理存款、贷款、票据贴现、国内结算业务；办理个人储蓄业务；代理其他银行的金融业务；代理收付款项及受托代办保险业务；买卖政府债券、金融债券；代理发行、代理兑付、承销政府债券；提供保管箱业务；从事同行业拆借；经银行业务监督委员会批准开办的其他业务.**(依法须经批准的项目，经相关部门批准后方可开展经营活动)",宁夏,吴忠,"宁夏回族自治区青铜峡市汉延东街"
青铜峡市农村信用合作联社城郊信用社,91640381MA75W5U2XK,2006-03-31,N/A,郑丹,"N/A","办理存款、贷款、票据贴现、国内结算业务；办理个人储蓄业务；代理其他银行的金融业务；代理收付款项及受托代办保险业务；买卖政府债券、金融债券；代理发行、代理兑付、承销政府债券；提供保管箱业务；从事同行业拆借；经银行业务监督委员会批准开办的其他业务.**(依法须经批准的项目，经相关部门批准后方可开展经营活动)",宁夏,吴忠,"宁夏回族自治区青铜峡市小坝镇金三角"
青铜峡市农村信用合作联社立新信用社,91640381MA75W6EW6L,2006-03-31,N/A,刘丰年,"N/A","办理存款、贷款、票据贴现、国内结算业务；办理个人储蓄业务；代理其他银行的金融业务；代理收付款项及受托代办保险业务；买卖政府债券、金融债券；代理发行、代理兑付、承销政府债券；提供保管箱业务；从事同行业拆借；经银行业务监督委员会批准开办的其他业务.**(依法须经批准的项目，经相关部门批准后方可开展经营活动)",宁夏,吴忠,"青铜峡市大坝电厂家属区"
固原北海花卉苗木有限责任公司,91640400774936507K,2006-03-31,N/A,刘强,"1,210(万)","可承揽工程造价在500万元以下园林绿化工程，包括：综合公园、社区公园、专类公园、带状公园等各类公园，生产绿地、防护绿地、附属绿地等各类绿地；可承担园林绿化工程中的整地、栽植及小品、花坛、园路、水系、喷泉、假山、雕塑、广场铺装、驳岸、单跨10米以下的园林景观人行桥梁、码头以及园林设施、设备安装项目等；可承揽各种规模以及类型的园林绿化养护管理工程；可从事园林绿化苗木、花卉、草坪的培育、生产和经营。",宁夏,固原,"宁夏回族自治区固原市原州区固胡路"
银川国涛商贸有限公司,91640100774936195G,2006-03-31,N/A,楚良月,"50(万)","金属材料及制品、建筑装饰材料、机电产品、化工产品（不含易制毒危险品）、电线电缆、五金交电、橡塑制品、水暖配件、机械设备、百货日杂、卫生洁具、办公设备及用品销售",宁夏,银川,"银川市西夏区燕宝钢材市场B-63号"
固原公路工程质量检测中心(有限公司),91640404774935782A,2006-03-31,N/A,魏广必,"60(万)","公路工程试验检测、公路工程技术人员继续教育培训。(依法须经批准的项目，经相关部门批准后方可开展经营活动)",宁夏,固原,"固原扶贫发展试验区警民路"
中宁县新福星枸杞红枣购销有限公司,9164052177493590XR,2006-03-31,N/A,刘天敬,"600(万)","枸杞、红枣收购、初加工、销售(依法须经批准的项目，经相关部门批准后方可开展经营活动)",宁夏,中卫,"宁夏回族自治区中宁县新堡镇刘营七队"
银川创先德机械制造有限公司,91640122774940290Y,2006-03-31,N/A,徐萍,"500(万)","非标准机械设备、不锈钢制品、电动折叠门、车库门、电动手动推拉门、电动手动平开门、矿用井下自动风门、电动开窗机的制造及销售；建筑材料、防火门、防火卷帘门及消防产品的销售。",宁夏,银川,"银川德胜园区新月路16号"
青铜峡市农村信用合作联社峡口信用社,91640381MA75W5T23D,2006-03-31,N/A,郑新岚,"N/A","办理存款、贷款、票据贴现、国内结算业务；办理个人储蓄业务；代理其他银行的金融业务；代理收付款项及受托代办保险业务；买卖政府债券、金融债券；代理发行、代理兑付、承销政府债券；提供保管箱业务；从事同行业拆借；经银行业务监督委员会批准开办的其他业务.**(依法须经批准的项目，经相关部门批准后方可开展经营活动)",宁夏,吴忠,"宁夏回族自治区青铜峡市峡口镇任桥村"
宁夏光耀建筑工程有限公司光耀美居光华店,91640100774936881T,2006-03-31,N/A,马少勇,"N/A","家具、办公用品、家居装饰品销售：房屋及场地租赁",宁夏,银川,"银川市民族南街与宝庆路交叉口"
青铜峡市农村信用合作联社瞿靖信用社,91640381MA75W80B0F,2006-03-31,N/A,李志梅,"N/A","办理存款、贷款、票据贴现、国内结算业务；办理个人储蓄业务；代理其他银行的金融业务；代理收付款项及受托代办保险业务；买卖政府债券、金融债券；代理发行、代理兑付、承销政府债券；提供保管箱业务；从事同行业拆借；经银行业务监督委员会批准开办的其他业务.**(依法须经批准的项目，经相关部门批准后方可开展经营活动)",宁夏,吴忠,"青铜峡市瞿靖镇政府南侧"
青铜峡市农村信用合作联社铝厂信用社,91640381MA75W6D32Q,2006-03-31,N/A,赵乐,"N/A","办理农村集体经济组织,乡镇企业,个体工商户和农户存款业务,办理转帐结算和现金结算业务,办理居民储蓄存款,经信用社授权办理农村集体经济组织,乡镇企业个体工商户和农户贷款业务,经中国银行业务监督管理委员会批准的其他业务.(依法须经批准的项目，经相关部门批准后方可开展经营活动)",宁夏,吴忠,"宁夏回族自治区宁夏青铜峡市铝厂三村"
中卫市科源农贸有限公司刘营农资连锁店,91640500MA75XX0P97,2006-03-31,N/A,史建祥,"N/A","化肥、种子（不再分装的包装种子）、农药",宁夏,中卫,"中卫市常乐镇刘营村一队"
青铜峡市农村信用合作联社广场信用社,91640381MA75W6C600,2006-03-31,N/A,吴平,"N/A","办理存款、贷款、票据贴现、国内结算业务；办理个人储蓄业务；代理其他银行的金融业务；代理收付款项及受托代办保险业务；买卖政府债券、金融债券；代理发行、代理兑付、承销政府债券；提供保管箱业务；从事同行业拆借；经银行业务监督委员会批准开办的其他业务.**(依法须经批准的项目，经相关部门批准后方可开展经营活动)",宁夏,吴忠,"青铜峡市宾馆新楼一楼"
青铜峡市农村信用合作联社青镇信用社,91640381MA75W5QR9C,2006-03-31,N/A,滕建春,"N/A","办理存款、贷款、票据贴现、国内结算业务；办理个人储蓄业务；代理其他银行的金融业务；代理收付款项及受托代办保险业务；买卖政府债券、金融债券；代理发行、代理兑付、承销政府债券；提供保管箱业务；从事同行业拆借；经银行业务监督委员会批准开办的其他业务.**(依法须经批准的项目，经相关部门批准后方可开展经营活动)",宁夏,吴忠,"宁夏青铜峡市青镇新城滩"
宁夏吴忠市国海粮油有限公司,91640300788207663N,2006-04-03,N/A,丁国海,"500(万)","食用植物油(半精炼、全精炼)的加工销售；农副产品的收购及销售(不含粮食)(依法须经批准的项目，经相关部门批准后方可开展经营活动)",宁夏,吴忠,"宁夏回族自治区吴忠市马莲渠乡东侧"
中国银行股份有限公司银川市西夏广场分理处,916401007749415681,2006-04-03,N/A,王雪冰,"N/A","经营中国银行业监督管理委员会依照有关法律、行政法规和其他规定批准的业务，经营范围以批准文件所列的为准。",宁夏,银川,"宁夏银川市西夏区北京西路与贺兰山沿山路交汇处空军部队营区"
宁夏苏宁蒙电讯科贸有限公司,91640100774936857A,2006-04-03,N/A,蒋巧平,"100(万)","通信有线器材、光电设备、通风设备、电器开关灯具、五金交电、机电产品、化工产品（不含易制毒及化学危险品）、阀门水泵、消防器材、环保设备、保温材料、机械设备、电力设备、供暖设备销售",宁夏,银川,"银川市新华东街雅安公寓2号楼2单元902室"
海原县中裕运输有限责任公司,91640522774936013W,2006-04-03,N/A,马正荣,"40(万)","普通货物运输，代办机动车入户、审验、过户，驾驶证审换",宁夏,中卫,"宁夏回族自治区海原县东城路"
宁夏塞上阳光太阳能有限公司,91640381774936523E,2006-04-03,N/A,保烨,"7,668(万)","太阳能供暖、制冷发电、风力发电、沼气等节能产品的开发和应用；太阳能热水器、平板太阳能集热器、太阳能空气集热器、太阳能空调、太阳能开水器、太阳能集热工程设备、太阳能光热应用产品、太阳能产品、太阳能热利用产品、不锈钢容器、果蔬烘干房、空气源热泵果蔬烘干房、果蔬烘干机、空气源热泵果蔬烘干机、谷物烘干储藏塔、谷物烘干机、空气源热泵谷物烘干机、连续式谷物烘干机、热泵烘干机、除湿系统设备、果蔬清洗设备、自动化传输设备、智能化控制设备、地源热泵、水源热泵、空气源热泵、低温空气源热泵、空气能热水器（机）、热泵热水设备、节能热水器、制冷空调设备、空调器、热换器、制冷制热设备、中央空调机组、空气能采暖系统、空气能干燥系统、采暖末端设备（散热器、地暖管、风机盘管）、制冷设备、冷库制冷设备、制冷冷冻设备、制冷材料、保鲜冷库、空调及多联机、中央空调、实验室设备的研发、生产制造、销售、安装调试及售后维修服务；太阳能、热泵供热系统工程（凭资质证经营）、果蔬（谷物）烘干系统、太阳能与空气能结合的复合能源供应系统、制冷工程、冷库的设计、安装及技术服务；节能环保设备的研发和应用；不锈钢板材、铝合金型材、钢材的销售＊＊＊(依法须经批准的项目，经相关部门批准后方可开展经营活动)",宁夏,吴忠,"宁夏青铜峡市嘉宝工业园区"
宁夏塞尚丽人导游礼仪服务有限公司,91640100774936291R,2006-04-03,N/A,徐辉,"10(万)","导游业务咨询、会议、庆典、公关礼仪服务；礼品设计与包装；土特产销售。",宁夏,银川,"银川市兴庆区民族北街东侧宝丰银座第1幢1136号"
宁夏猛犸农业有限公司,91640100774937147Q,2006-04-03,N/A,陈原,"3,008(万)","法律法规明确或国务院决定须经审批的项目，经相关部门批准后方可开展经营活动；无须审批的，企业自主选择经营项目开展经营活动。",宁夏,银川,"银川市金凤区正源北街西侧，银川金凤万达广场5号楼1420室"
石嘴山市森泰物资有限公司,916402057749366468,2006-04-03,N/A,王志中,"30(万)","轴承、阀门、化工原料（不含危险化学品）、机械设备、电子产品、劳保用品、日用百货、橡塑制品、建材、金属材料、润滑油销售",宁夏,石嘴山,"惠农区吉运“88”城市花园4-1号"
中国工商银行股份有限公司银川振兴支行,91640100554199592J,2006-04-04,N/A,孔斌,"N/A","经营中国工商银行业监督管理委员会依照有关法律、行政法规和其他规定批准的业务，经营范围以批准文件所列的为准",宁夏,银川,"银川市兴庆区北京东路721号"
