裕诚隆泰(宁夏)实业有限公司,91641100788221502X,2006-09-07,N/A,李艳凤,"5,000(万)","设计、制作、发布国内各类广告业务；国内版图书、消防器材、建筑材料、五金交电、劳保用品批发兼零售；石油机械设备销售、租赁与维修；机械设备配件销售。",宁夏,银川,"银川市金凤区创新园20号楼J7号房"
石嘴山市鼎力支护设备有限公司,91640200788221625P,2006-09-07,N/A,N/A,"900(万)","矿山支护设备及机械加工",宁夏,石嘴山,"宁夏回族自治区大武口工业园区"
石嘴山市强峰矿山配件有限公司,916402027882217801,2006-09-11,N/A,王玉霞,"10(万)","矿山机械设备及配件加工销售、机电产品的销售",宁夏,石嘴山,"大武口区经济开发区110国道3号井"
吴忠市恒鑫源物资贸易有限公司,91640300788222265H,2006-09-11,N/A,魏自成,"500(万)","建筑材料、五金百货、文化用品、日用百货、化工产品（不含危险品）橡胶产品、汽车（不含小轿车）、矿山产品的销售；混凝土拌料的生产与销售(仅限分公司经营)",宁夏,吴忠,"吴忠市友谊路（瑞特纸业东侧）"
宁夏森润牧业开发有限公司,916401817882220542,2006-09-11,N/A,王占森,"500(万)","家禽、畜牧养殖及销售；草原围栏工程建设；畜牧产品销售；畜牧新技术开发、推广；煤炭的销售及运输；货物装卸；清洁服务；物业管理。",宁夏,银川,"灵武市白土岗乡211国道以北"
宁夏凯洁工贸有限公司,91640100788222046W,2006-09-11,N/A,杨云霞,"100(万)","法律法规明确或国务院决定须经审批的项目，经相关部门批准后方可开展经营活动；无须审批的，企业自主选择经营项目开展经营活动。",宁夏,银川,"银川市兴庆区清和北街银河家园8号楼"
宁夏有车一族汽车服务有限公司,91640300788221764K,2006-09-11,N/A,刘波,"100(万)","汽车租赁；汽车的销售；二手车经销；车辆入户、过户、车辆检验的中介服务",宁夏,吴忠,"吴忠市明珠路金茂园(市政府后侧)"
银川力盈力科贸有限公司,916401037882247549,2006-09-11,N/A,N/A,"5(万)","计算机软硬件、机械设备、建筑材料、办公自动化设备、通信设备、五金交电、金属材料、办公家具、文具用品、电器、工艺品、化肥、农药（低毒低残留）、种子（不再分包的原包装种子）、种苗、农膜的销售。",宁夏,银川,"银川市丽景北街西北农资城17#-10号"
宁夏义立农牧开发有限公司,91640121788221959G,2006-09-12,N/A,徐金城,"200(万)","獭兔、水貂、家禽养殖；皮毛、畜禽产品开发；农业综合开发；饲料销售",宁夏,银川,"宁夏永宁县望远经济开发区"
宁夏罗森贸易有限公司,91640000788222361B,2006-09-12,N/A,徐靓,"800(万)","氢氧化钠、氢氧化钠溶液批发（无储存）；批发、零售建筑装饰材料、五金工具、机电设备、水暖配件、钢材、化工产品、兰炭、铁合金产品、电煅煤、氯化钙、焦炭、煤炭、无烟煤、聚氯乙烯；商品进出口业务。",宁夏,银川,"银川市兴庆区文化西街106号银川国际贸易中心B段九层C2号办公用房"
宁夏正源活性炭有限公司,91641100788222505E,2006-09-12,N/A,何永伟,"500(万)","活性炭、矿产品的销售。",宁夏,银川,"银川市金凤区新昌东路民生城市主场12#楼1308室"
吴忠市三郎果蔬配送中心(有限公司),91640300788222724N,2006-09-12,N/A,马正才,"800(万)","预包装食品兼散装食品、乳制品（含婴幼儿配方乳粉）的批发兼零售；日用百货、洗涤用品、烟、水果蔬菜、干鲜果、生牛羊肉的销售；花卉苗木、农作物（不含农作物种子）种植及销售；农业生态观光；农业技术开发、技术服务、技术转让；园林绿化工程（凭资质证经营）；园林技术服务；物流服务；仓储服务（不含危险化学品、易制毒品及易燃易爆物品的存储）(依法须经批准的项目，经相关部门批准后方可开展经营活动)",宁夏,吴忠,"吴忠市东郊批发市场内2号大棚"
宁夏博众文化产业有限公司,91640100788223583B,2006-09-13,N/A,骆浙宁,"100(万)","会议会展策划、服务；文化产业咨询；企业形象策划；市场营销策划；信息咨询服务；工艺美术品的销售；设计、制作、代理、发布国内各类广告；经营演出及经纪业务",宁夏,银川,"银川市兴庆区新华东街金泰大厦B座10楼东C"
山东省济宁市恒兴金属结构有限公司宁夏分公司,91640104788223508C,2006-09-13,N/A,郑夫涛,"N/A","钢结构、网架、金属容器（不含压力容器）的设计、加工、安装及附件加工；铝合金门窗的安装；钢材销售",宁夏,银川,"银川市丽景南街昆仑建材市场7-04号"
石嘴山市益友商贸有限公司,9164020578822325X5,2006-09-13,N/A,王润兰,"30(万)","焦炭销售；装卸、搬运服务；劳务分包",宁夏,石嘴山,"惠农区河滨工业园区（三鑫碳素制品厂院内）"
吴忠市隆德盛汽车贸易有限公司,9164030078822237XJ,2006-09-13,N/A,马小更,"100(万)","汽车（不含小轿车）、农用车、农用机械、摩托车、汽车配件的销售；代理机动车辆保险、货物运输保险",宁夏,吴忠,"吴忠市北门华瑞宾馆楼下"
宁夏中投担保有限公司,91641100788222273E,2006-09-13,N/A,周昕,"3,000(万)","依法为自治区内各类中小企业及个人提供贷款担保、履约担保、汽车消费贷款担保；票据承兑担保，诉讼保全担保",宁夏,银川,"银川市金凤区新昌西路紫荆花商务中心C座1201、1202号办公用房"
中宁县晶东红枣产业科技服务有限公司,916405217882242608,2006-09-14,N/A,李金栋,"3(万)","红枣种植、初加工、销售、农副产品销售、红枣种植技术引进、开发及咨询服务；化肥、农药、种子（以种子代销证为准）销售；园艺工具零售",宁夏,中卫,"中宁县恩和红梧山科技局科技基地"
宁夏冠明通信技术有限公司西夏移动通讯广场,916401057882225728,2006-09-14,N/A,王淑云,"N/A","通讯器材、计算机设备及耗材、家用电器、五金工具、水暖配件销售，通讯设备维修服务；代办移动通信业务（凭授权文件经营）(依法须经批准的项目，经相关部门批准后方可开展经营活动)",宁夏,银川,"银川市怀远东路（原宁夏邮电技工学校家属院）"
银川长城昊轮轮胎有限公司,91640122788222839E,2006-09-14,N/A,周学平,"150(万)","轻卡车轮胎、农用车轮胎、摩托车轮胎、力车轮胎、橡胶制品的生产、销售（生产仅限分公司经营）；化工产品（不含易制毒及危险化学品）的销售。",宁夏,银川,"银川德胜工业园区新胜东路16号"
中卫市容大燃气销售有限公司液化气配送服务中心,91640500MA75WHQ868,2006-09-14,N/A,黄治聪,"N/A","燃气灶具及其配件销售、维修。",宁夏,中卫,"中卫市沙坡头区香山西街"
宁夏共享人力资源有限公司,916401007882223963,2006-09-14,N/A,张明,"2,000(万)","人力资源开发、人事代理、劳务代理、劳务派遣、劳务承包、劳务服务；装卸、搬运；园林绿化工程；园林绿化服务、养护；清洁服务；道路保洁、道路清扫；环卫保洁、生活垃圾清扫；物业管理及服务；电梯保养及维护；保洁服务；餐饮管理服务；道路普通货物运输；油气田井场管护服务、油区巡护、井场区域设备及管线的管护巡护、机械设备的安装维护；农作物种植。",宁夏,银川,"宁夏银川市西夏区北京西路1135号澳海澜庭2号楼"
固原市九龙城市建设集团有限公司,91640404788222775X,2006-09-15,N/A,夏强,"184,385.0100(万元)","城市集中供热；供热管网建设、市政基础设施建设、城市道路建设；房地产开发；园林绿化；物业管理；本市范围内保障住房租赁、管理；投融资；铝钢加工、制作、销售；建筑材料、室内门、防盗门销售",宁夏,固原,"宁夏回族自治区固原经济开发区六盘路"
固原瑞博科工贸有限责任公司,91640402788222695D,2006-09-15,N/A,吕智宽,"111(万)","计算机、软件及辅助设备、耗材销售；电子产品、通讯器材、机电产品、仪器仪表、五金交电、建筑装饰材料、文化办公用品销售；综合布线、系统集成；设计、制作、发布、代理国内各类广告；打字复印、名片制作、其他印刷品印刷；摄像、视频制作、光盘刻录、会务服务；楼体亮化。",宁夏,固原,"宁夏固原市原州区政府街11号"
固原天意商贸有限责任公司,916404007882253274,2006-09-15,N/A,黄亚鸿,"1,180(万)","电脑、复印一体机及外部设备、耗材、软件、数码产品、照相器材、系统集成、网络设备、专用设备、家电、音响设备、乐器及演出设备、仪器、仪表、电讯器材、建筑装饰材料、办公家具及用品、文体用品、服装鞋帽、农副产品、劳保用品、消防设备、防护设备、教学设备、幼教设备、实验室设备、电子触摸及白板、机电机械、制冷设备、救灾物资、警用设备",宁夏,固原,"固原市原州区中山北街畜牧局楼下"
宁夏诚翔商贸有限公司售后服务中心,916401037882247624,2006-09-15,N/A,马双龙,"N/A","家用电器销售及售后维修服务；电工电料、办公自动化设备、洗涤化妆用品、装饰材料、通讯设备、劳保用品、服装、鞋帽批发零售。(依法须经批准的项目，经相关部门批准后方可开展经营活动)",宁夏,银川,"银川市兴庆区解放西街232号"
中卫市志忠劳务建筑有限公司,91640500788220913R,2006-09-15,N/A,吴红存,"30(万)","劳务分包（以企业资质",宁夏,中卫,"中卫市城区世纪花园商业二号楼"
银川林子装饰工程有限公司,91640100788222652K,2006-09-15,N/A,林保森,"500(万)","室内装饰设计、施工；室内外效果图绘制。",宁夏,银川,"银川市兴庆区民族南街新世纪花园三组团2号楼13号营业房"
宁夏琪琳不锈钢制品有限公司,9164010078822309XG,2006-09-15,N/A,孙建敏,"200(万)","批发、零售不锈钢材料、建筑装饰材料、钢材、化工产品",宁夏,银川,"宁夏银川经济技术开发区金凤工业园"
宁夏固原六盘山建设工程监理有限公司,91640402715022641M,2006-09-15,N/A,胡祥学,"500(万)","房屋建筑工程监理甲级；市政公用工程监理甲级；房屋建筑工程（估算投资1亿元以下）代建；水利水电工程监理丙级；公路工程监理丙级；工程造价咨询乙级（可以从事工程造价5000万元人民币以下的各类建设项目的工程造价咨询业务）；工程招标代理机构暂定级",宁夏,固原,"固原市原州区文化街34号"
宁夏温情假日旅行社(有限公司),916402007882241642,2006-09-15,N/A,马春霞,"100(万)","国内旅游业务；入境旅游业务",宁夏,石嘴山,"大武口区110国道（凯欣大酒店旁边）"
银川融硕物资有限公司,91640121564107292W,2006-09-15,N/A,N/A,"300(万)","建筑材料、五金交电、化工产品",宁夏,银川,"宁夏望远现代金属物流园7-55号"
银川金佰利工贸有限公司,91640122788223065Y,2006-09-15,N/A,张微,"100(万)","五金、建材、机电产品（不含小轿车）、化工产品",宁夏,银川,"银川德胜园区西部建材城15-41号"
固原经济开发区宁通汽车运输有限公司,916404047882228124,2006-09-18,N/A,王建宁,"30(万)","普通货物运输、汽车租赁、汽车",宁夏,固原,"固原市经济开发区九龙路"
银川杰欣工贸有限公司,91640100788223495W,2006-09-18,N/A,李庚麟,"500(万)","法律法规明确或国务院决定须经审批的项目，经相关部门批准后方可开展经营活动；无须审批的，企业自主选择经营项目开展经营活动。",宁夏,银川,"银川市兴庆区长城东路368南-2"
宁夏清水之源环保科技有限公司,91640100788223225A,2006-09-18,N/A,王静波,"100(万)","水处理设备及产品、化工原料(不含易制毒及危险化学品)、食品、农副产品、日用百货、皮革制品、建筑装饰材料、五金交电、金属材料、机械设备、汽车配件、办公用品、文体用品、棉麻日杂、玻璃器皿、饲料、劳保用品、工艺美术品的销售。",宁夏,银川,"宁夏银川市金凤区宝湖中路55号宝湖湾62号楼706室"
银川铭骏棉麻日杂有限公司,9164010022776112X1,2006-09-18,N/A,孙济民,"30.2800(万)","棉麻日杂、陶瓷制品、厨房设备、家具、农用机械、五金交电、塑料制品的销售；房屋租赁",宁夏,银川,"银川市兴庆区文化东街43号"
宁夏顺达通信有限公司新华东街营业厅,9164010378823520X4,2006-09-19,N/A,陈贻滔,"N/A","通讯器材及终端设备、电子产品、办公用品、日用百货、服装销售；电子产品的维修、技术服务、咨询（涉及许可证的凭证经营）",宁夏,银川,"银川市兴庆区新华东街228号"
银川苏峪口滑雪场有限公司,91640100788223815B,2006-09-19,N/A,李占芳,"1,000(万)","滑雪场；滑雪训练；体育用品的销售及租赁",宁夏,银川,"宁夏回族自治区宁夏苏峪口森林公园"
石嘴山市旭源废旧金属回收有限公司,91640205788224498T,2006-09-21,N/A,魏丰均,"50(万)","机械加工、钢材、再生物资回收与批发；金属材料、有色金属（不含贵重金属）、焦炭、化工产品（不含危险化学品）、五金交电、机械设备、硅铁、铅、锌、硅锰合金的销售",宁夏,石嘴山,"石嘴山市惠农区尾闸镇西河桥村"
银川彦昌工贸有限公司,916401007882237785,2006-09-21,N/A,刘涛,"50(万)","保温材料、日用百货、化工产品",宁夏,银川,"银川市金凤区陶然水岸22幢2单元102号"
中国电信股份有限公司石嘴山惠农区花园路营业厅,91640200MA75WNJU8L,2006-09-21,N/A,荀卓,"N/A","基础电信业务：在全国范围内经营800MHzCDMA第二代数字蜂窝移动通信业务和CDMA2000第三代数字蜂窝移动通信业务。在本省范围内经营固定网本地电话业务(含本地无线环路业务）、固定网国际国内长途电话业务、IP电话业务（限于phone-to-phong）、卫星国际专线业务、因特网数据传送业务、国际数据通信业务、公众电报和用户电报业务、26GHz无线接入业务、国内通信设施服务业务。增值业务：在本省范围内经营第二类基础电信业务中的国内甚小口径终端地球站（VSAT）通信业务、固定网国内数据传送业务、无线数据传送业务、用户驻地网业务、网络托管业务；第一类增值电信业务中的在线数据处理与交易处理业务、国内因特网虚拟专用网业务、因特网数据中心业务；第二类增值电信业务中的存储转发类业务、X.400电子邮件业务、呼叫中心业务、因特网接入服务业务和信息服务业务",宁夏,石嘴山,"惠农区花园路(矿安俱乐部南)"
中建华会计师事务所有限责任公司宁夏分所,91640103788224084L,2006-09-21,N/A,王和义,"N/A","审查企业会计报表、出具审计报告；验证企业资本，出具验资报告；办理企业合并、分立、清算事宜中的审计业务，出具有关的报告；承办会计咨询、会计服务、工程造价咨询业务；资产评估。",宁夏,银川,"宁夏银川市民族北街中房朝阳大厦1015号"
中国电信股份有限公司石嘴山惠农区河滨营业厅,91640200MA75WNKA00,2006-09-21,N/A,荀卓,"N/A","基础电信业务：在全国范围内经营800MHzCDMA第二代数字蜂窝移动通信业务和CDMA2000第三代数字蜂窝移动通信业务。在本省范围内经营固定网本地电话业务(含本地无线环路业务）、固定网国际国内长途电话业务、IP电话业务（限于phone-to-phong）、卫星国际专线业务、因特网数据传送业务、国际数据通信业务、公众电报和用户电报业务、26GHz无线接入业务、国内通信设施服务业务。增值业务：在本省范围内经营第二类基础电信业务中的国内甚小口径终端地球站（VSAT）通信业务、固定网国内数据传送业务、无线数据传送业务、用户驻地网业务、网络托管业务；第一类增值电信业务中的在线数据处理与交易处理业务、国内因特网虚拟专用网业务、因特网数据中心业务；第二类增值电信业务中的存储转发类业务、X.400电子邮件业务、呼叫中心业务、因特网接入服务业务和信息服务业务",宁夏,石嘴山,"惠农区河滨街中央大道东"
银川益商广告策划有限公司,916401007882234797,2006-09-21,N/A,宋建林,"50(万)","企业形象策划；设计、制作、发布、代理国内各类广告业务。",宁夏,银川,"银川市兴庆区凤凰南街121号"
宁夏庆华煤化集团有限公司,91640300788223698U,2006-09-21,N/A,孙永智,"52,900(万元)","焦炭的加工、生产、销售；煤炭批发经营；粗苯、煤焦油、硫磺、甲醇、液氧的生产及销售(以上各项凭有效资质证经营)；钢材、水泥、PVC管及管件、砖、混凝土、建筑材料、劳保用品、电力、电气材料、仪器、仪表、标准件、消防用品、管阀件、橡胶、塑料及制品、五金材料、金属材料的销售；煤炭开采****（依法须经批准的项目，经相关部门批准后方可开展经营活动）",宁夏,吴忠,"吴忠市太阳山移民开发区宁夏庆华太阳山煤化工循环经济工业园"
中国电信股份有限公司石嘴山惠农区北街营业厅,91640200MA75WNKRX9,2006-09-21,N/A,荀卓,"N/A","基础电信业务：在全国范围内经营800MHz CDMA 第二代数字蜂窝移动通信业务和CDMA2000第三代数字蜂窝移动通信业务。在本省范围内经营固定网本地电话业务(含本地无线环路业务）、固定网国际国内长途电话业务、IP电话业务（限于phone-to-phong）、卫星国际专线业务、因特网数据传送业务、国际数据通信业务、公众电报和用户电报业务、26GHz无线接入业务、国内通信设施服务业务。增值业务：在本省范围内经营第二类基础电信业务中的国内甚小口径终端地球站（VSAT）通信业务、固定网国内数据传送业务、无线数据传送业务、用户驻地网业务、网络托管业务；第一类增值电信业务中的在线数据处理与交易处理业务、国内因特网虚拟专用网业务、因特网数据中心业务；第二类增值电信业务中的存储转发类业务、X.400电子邮件业务、呼叫中心业务、因特网接入服务业务和信息服务业务",宁夏,石嘴山,"宁夏回族自治区惠农区北大街80号"
吴忠市浩森机械制造厂,91640302788224666N,2006-09-21,个人独资企业,杨士俊,"N/A","机械产品制造、销售※(依法须经批准的项目，经相关部门批准后方可开展经营活动)",宁夏,吴忠,"吴忠市西环路红星仓储货运市场内"
银川万象商务会展有限公司,91640100788224009G,2006-09-21,N/A,聂显弟,"35(万)","会议、会展咨询、策划、服务；商务考察、培训学习的接待服务；汽车租赁；旅游纪念品、办公用品、计算机软件、通讯设备、计算机硬件系统集成的销售；计算机技术服务；旅游信息咨询；工商咨询服务；企业营销策划；装潢设计；打字复印（分公司经营）。",宁夏,银川,"银川市兴庆区绿地21商城D区7号楼107（复式）室"
宁夏佳士洁水处理有限公司,91640121788224199W,2006-09-21,N/A,卫彦昌,"1,800(万)","工业水处理剂、烟气脱硫增效剂开发、生产（限分支机构经营）、销售；有色金属销售；液氯、粗苯、甲醇、煤焦油、电石、盐酸、金属钠、氯酸钠、氯乙酸、过氧化氢、氢氧化钠、液氨、硫酸、氢氟酸、氯化钡、次氯酸钠溶液、二氯异氰尿酸、三氯异氰尿酸、氧化钙、水处理设备及配件的销售以及水处理设备组装、清洗、维修、营运总包业务",宁夏,银川,"宁夏银川市望远工业园区金源路北侧2号规划路西侧"
银川新华百货东桥电器有限公司青铜峡移动通信大世界,916403817882243083,2006-09-22,N/A,蔡兵,"N/A","通讯器材销售；移动代办业务；手机维修服务",宁夏,吴忠,"青铜峡市小坝镇古峡东街"
银川财军二手车交易市场有限公司,91640122788241079D,2006-09-22,N/A,N/A,"100(万)","二手车交易市场经营；润滑油、机电产品、汽车(不含小轿车)及配件的销售；车辆交易、车辆和驾驶证相关业务咨询代理服务；汽车美容。",宁夏,银川,"银川市正源北街北绕城口向北800米处"
宁夏天池浩旭工贸有限公司,91640100788224236M,2006-09-22,N/A,张文江,"200(万)","家用电器、厨房设备、锅炉、机电产品、日用百货、针纺织品、服装鞋帽、五金交电、建材、金属材料、办公用品的销售",宁夏,银川,"银川市凤凰北街领秀一居8-1营业房"
宁夏蓝森幕墙装饰有限公司(自然人独资),916401227882238900,2006-09-22,N/A,赵艳君,"505(万)","建筑装饰材料批发、零售。",宁夏,银川,"银川德胜园区德源街1号"
宁夏天神宝枸杞制品有限公司,91640381788223903E,2006-09-22,N/A,任华,"1,000(万)","枸杞全粉的加工及销售",宁夏,吴忠,"青铜峡市嘉宝工业园区"
同心县泰昌运输有限公司,916403247882236557,2006-09-22,N/A,周彦斌,"150(万)","汽车销售（不含小轿车）、汽车配件销售、危险货物运输、运输信息服务、大型停车场服务、土特产品购销",宁夏,吴忠,"宁夏吴忠市同心县杨家河湾村"
吴忠市煜智商贸有限公司,91640300788223743W,2006-09-22,N/A,杨波,"80(万)","日用百货、电子产品、服装服饰、针纺织品、机电产品、润滑油、农产品、办公设备、汽车配件、纸制品的销售；提供土石方清运服务；建筑材料的批发销售；设计、制作户外广告；拓展训练（不含危险项目）；房屋信息咨询服务(依法须经批准的项目，经相关部门批准后方可开展经营活动)",宁夏,吴忠,"吴忠市北湖花园A区7号（左营第二中心村）"
宁夏新安科技有限公司,916402217882237510,2006-09-22,N/A,王群孝,"5,349.7300(万)","多菌灵、敌草隆、草甘膦、甲基硫菌灵、噻嗪酮、异丙隆、烷基乙烯酮二聚体（AKD）、CR-39、甘氨酸、吡虫啉、噁草酮、氰胺基甲酸甲酯生产、销售；外贸出口业务（无进口商品分销业务）；盐酸销售；污水环保处理业务。",宁夏,石嘴山,"石嘴山市生态经济开发区"
青铜峡市燕顺废旧物资购销有限责任公司,91640381MA75Y44C46,2006-09-25,N/A,吴建芳,"5(万)","废旧物资、碳素制品、金属制品、化工（危险化学品除外）建材石料购销",宁夏,吴忠,"青铜峡市青镇化肥厂南则1500米处"
银川诗楠老好人服饰有限公司,916401007882258965,2006-09-25,N/A,蔡玉琴,"31(万)","服装服饰、鞋帽、皮革制品、办公用品、洗涤化妆品、针纺织品、玻璃制品的销售.",宁夏,银川,"银川市新华西街塔东3号楼F座"
宁夏四维金盾保安押运服务有限公司,91641100788224420R,2006-09-25,N/A,闫晓军,"1,000(万)","货币、有价证券、金银珠宝、文物、艺术品及其他贵重物资和爆炸、化学、危险物品的押运、守护、保管、随身护卫服务；金融、企事业单位、机关团体、居民住宅区、公共场所的安全守护；展览、展销、文体、商业等活动的安全保卫；安全防盗报警器材、闭路电视监控器材、防火器材、通讯器材的安装、维修、销售；安全技术防范工程设计、施工；社区报警运营保障与服务；安全咨询服务；劳务派遣；道路普通货物运输",宁夏,银川,"宁夏回族自治区银川高新区2号办公楼"
银川众力兴机械有限公司,91640122788223962Q,2006-09-25,N/A,王斌,"200(万)","工业用金属链条、工矿设备配件的生产、销售；机械加工、制造、销售。(依法须经批准的项目，经相关部门批准后方可开展经营活动)",宁夏,银川,"银川德胜园区德翔东路19号"
青铜峡市兴陇工贸有限公司,91640381788225183P,2006-09-25,N/A,生俊霄,"50(万)","木材加工收购 包装板 五金、建材 纸品批发零售",宁夏,吴忠,"青铜峡小坝镇银河东街(越秀湾9#商贸房3-18-2)"
固原华州育昕商贸有限公司,916404047882248778,2006-09-25,N/A,马啟,"500(万)","煤炭、建筑材料、电器机械及器材、办公设备、汽车及配件、化工产品（不含危险化学品）、五金交电、水暖配件、日用百货、针纺织品、矿产品",宁夏,固原,"固原市经济开发区振兴街"
吴忠市兴瑞民族装饰工程有限公司,916403007999156148,2006-09-26,N/A,王学义,"300(万)","装饰材料、瓷砖、木地板、壁纸、石材、五金水暖配件、整体橱柜的零售及批发",宁夏,吴忠,"吴忠市北门(永昌装饰材料市场东门口)"
固原经济开发区协祥汽车销售服务有限公司,916404027882256184,2006-09-26,N/A,买成智,"30(万)","汽车、汽车配件、五金建材、煤炭、日用百货批发、零售；普通货物运输。",宁夏,固原,"宁夏回族自治区固原市清水河工业园区"
中卫市黄湾阳光大酒店(有限责任公司),9164050078822499XF,2006-09-26,N/A,崔浩,"50(万)","住宿服务",宁夏,中卫,"中卫市沙坡头区鼓楼南街黄河宾馆南侧"
