乌鲁木齐新港特商贸有限公司,91650103787642073R,2006-05-17,N/A,邹金祥,"50(万)","销售：建材，水泥，机电设备，汽车配件，饲料，日用百货，服装鞋帽，计算机及设备，家用电器，通讯产品，体育器材，办公用品及设备，五交化产品，石油制品，皮棉，农畜产品；塑料制品加工。",新疆,乌鲁木齐,"新疆乌鲁木齐市沙依巴克区阿里路10号"
克拉玛依市金飞达商贸有限公司,91650204787640019B,2006-05-17,N/A,王金山,"10(万元人民币)","汽车修理与维护，道路普通货物运输，五金交电及化工产品、建材、汽车零配件、其他日用品、针织品、纺织品销售。",新疆,克拉玛依,"新疆克拉玛依市白碱滩区门户路129号"
乌鲁木齐金龙翔通讯器材有限公司,91650103787638429H,2006-05-18,N/A,史龙,"500(万)","销售：装饰装潢材料，金属及电器构件，园林护栏，橱具，路牌灯箱，铁，铜字的生产，加工，农畜产品。",新疆,乌鲁木齐,"新疆乌鲁木齐市沙依巴克区河滩北路41号7栋"
新疆泽强工程项目管理有限公司伊犁分公司,91654002787645098Y,2006-05-18,N/A,汤计发,"N/A","工程咨询服务；工程技术咨询。",新疆,伊犁哈萨克,"新疆伊犁州伊宁市解放路219号"
新疆宏丰农牧林有限公司新疆奎屯农资专业批发市场,91654003789866281A,2006-05-18,N/A,赵宏峰,"N/A","农资市场管理；农业技术培训、咨询服务。",新疆,伊犁哈萨克,"新疆伊犁州奎屯市南环西路24号"
乌鲁木齐旺盛隆服饰有限公司,916501047876433329,2006-05-18,N/A,李玉岱,"500(万元人民币)","服装、服饰、针纺织品的加工，销售；销售：服装鞋帽，体育器材，社会公共安全器材，文化办公用品，针纺织品，家用电器，五金交电，建筑材料，化工产品",新疆,乌鲁木齐,"新疆乌鲁木齐市新市区盛海路83号海盈城市花园3号楼1层8号商铺"
伊宁市天兴机电商贸有限公司,91654002787638605C,2006-05-18,N/A,吕建强,"50(万元人民币)","金杯品牌汽车",新疆,伊犁哈萨克,"新疆伊犁州伊宁市解放西路西郊市场院内"
托里县大地宝贝8号黄金矿业有限公司,91654224751682073H,2006-05-18,N/A,刘洋,"75(万)","黄金开采加工销售,探矿。",新疆,塔城,"新疆塔城地区托里县大地宝贝8号点"
巴州旭洲工贸有限公司,91652801787635682P,2006-05-18,N/A,李方志,"200(万)","凿井乙级，造林服务，机械设备租赁，房屋出租，境内劳务输出，工程机械维修；机井维修，加工销售：钢材、型材、水泥制品、铝合金门窗，批发零售：建材，土石方挖运，芦苇的加工与销售",新疆,巴音郭楞,"新疆巴州库尔勒市库尉公路西侧"
乌鲁木齐瀚思联创有限责任公司,916501037876401744,2006-05-18,N/A,甘德智,"10(万)","批发零售：造林苗、城镇绿化苗、经济林苗、花卉；网络技术服务，计算机、软件及辅助设备，广告经营，摄影及摄影器材，通讯产品，电子产品的销售。",新疆,乌鲁木齐,"新疆乌鲁木齐市沙依巴克区阿勒泰路83号18栋"
乌鲁木齐德盛鑫贸易有限公司,916501047876380589,2006-05-18,N/A,王琴,"1,000(万)","销售：化工产品及原料（危险化学品除外）、钢材，建筑装饰材料，五金交电，日用百货、针纺织品、汽车配件、农畜产品、塑料设备及配件、机械设备、矿产品、家用电器、建材、金属材料、石油制品",新疆,乌鲁木齐,"新疆乌鲁木齐市新市区喀什东路648号诚信祥钢材市场南区V-3号"
哈密振源矿业开发有限责任公司,91652200787634145U,2006-05-18,N/A,周异,"60(万)","水泥用石灰岩的开采",新疆,哈密,"新疆哈密地区哈密市天山乡榆树沟村"
新疆筑城建筑勘察设计咨询有限公司和田分公司,91653201789855320Q,2006-05-18,N/A,多里坤·阿里木,"N/A","工程勘察设计、工程技术咨询服务。销售：建筑材料、汽车配件，五金交电，百货，干鲜果品。",新疆,和田,"新疆和田地区和田市北京东路15号"
克拉玛依永元检测技术有限责任公司独山子分站,91650202787637899Y,2006-05-18,N/A,李晓东,"N/A","建材产品质量、公路、水利、油田管道无损；电气设备检测；检测设备安装、调试与销售。",新疆,克拉玛依,"新疆克拉玛依市独山子区金山路30号"
乌鲁木齐鑫汇鑫化工有限责任公司,91650100787634997N,2006-05-18,N/A,赵月娥,"5,000(万)","服务:服装制作；销售：机械设备，矿山机械，耐磨材料，五金交电及电子产品，化工产品及原料（危险化学品除外），玻璃制品，建材及装饰材料，针纺织品，日用品，农畜产品，汽车装潢，化肥，工业盐，玻璃钢制品，环保设备",新疆,乌鲁木齐,"新疆乌鲁木齐新市区北站二路东一巷226号B1-170"
乌鲁木齐路易通科技有限公司,91650103787634313B,2006-05-18,N/A,尔艳青,"50(万)","批发兼零售：预包装食品",新疆,乌鲁木齐,"新疆乌鲁木齐市沙依巴克区钱塘江路38号自治区三建物业公司四楼"
新疆康银生物医学科技有限公司,91650103787636538N,2006-05-18,N/A,黄丽翠,"3,000(万)","医学研究和试验发展；生物科学技术研究推广服务，疗养服务，专业技术咨询服务，美容服务；销售：家用美容产品，化妆品，保健电器具，洗涤用品。",新疆,乌鲁木齐,"新疆乌鲁木齐市沙依巴克区克拉玛依西路9号"
乌鲁木齐海天宇工贸有限公司,91650100787635009P,2006-05-18,N/A,李玉海,"50(万)","销售：金属材料，不锈钢配件，管道配件，阀门，机电产品，五金工具，仪器仪表，水暖配件，建材，塑料制品，劳保用品，农畜产品，化工产品，钢材，法兰。",新疆,乌鲁木齐,"新疆乌鲁木齐高新技术产业开发区（新市区）高新街南一巷51号2-502室"
博湖县民乐劳务派遣有限责任公司,916528297898518563,2006-05-18,N/A,尚纾华,"252(万)","打字复印",新疆,巴音郭楞,"新疆巴州博湖县博湖镇团结西路"
中国铁路乌鲁木齐局集团有限公司乌鲁木齐供电段,91650000787618006F,2006-05-18,N/A,李新彪,"N/A","为铁路运输生产提供保障服务，收取水、电使用费；铁路运输设备租赁服务；合资铁路、地方铁路、专用线、专用铁路的受托管理；场地出租；本系统的计算机服务、软件服务；计量检定；铁路技术及管理咨询服务；其他铁路运输辅助活动,汽车租赁；铁路、道路、隧道桥梁工程；架线和管道工程建筑；电气安装；再生资源回收、销售。",新疆,乌鲁木齐,"新疆乌鲁木齐市头屯河区站前街266号"
乌鲁木齐金虹达汽车租赁有限公司,916501037876384457,2006-05-18,N/A,罗庆强,"10(万)","汽车租赁，会议会展服务。",新疆,乌鲁木齐,"新疆乌鲁木齐市沙依巴克区平顶山东一路238号汇嘉园北区17-15车库"
新疆天润高新实业有限公司,916501007876348580,2006-05-18,N/A,龚晓锐,"1,000(万元人民币)","化工机械设备、环保设备、建筑材料的生产，设备维修，石油天然气的技术应用、开发、咨询，城市天然气管网投资，石油制品、化工产品、环保产品、水处理设备、节能产品、机电产品、仪器仪表、阀门、五金交电、棉麻制品、电子产品、仪器仪表、建材、医疗器械",新疆,乌鲁木齐,"新疆乌鲁木齐高新技术产业开发区（新市区）北京南路439号中核发展大厦16层1602室"
新疆景荣置业有限责任公司,91652300787636829H,2006-05-19,N/A,黄新兵,"800(万)","房地产开发经营；房地产中介服务；建筑工程机械与设备租赁。",新疆,昌吉,"新疆昌吉州昌吉市4区3丘10栋9层10907"
乌鲁木齐市蕾丝特布艺家纺有限公司,91650105787636546E,2006-05-19,N/A,魏庆凤,"1,000(万)","销售：布艺，纺织品，工艺品，建材，五金交电，装饰材料，酒店用品，床上用品，家具，文化用品，日用百货,房屋租赁。",新疆,乌鲁木齐,"新疆乌鲁木齐市水磨沟区西虹东路4号惠源商城4楼"
巴州鸣河漆业有限责任公司经销部,91652800789881430X,2006-05-19,N/A,党召,"N/A","批发零售：建筑材料、五金交电、其他化工产品、农用薄膜、农业机械，农业种植。。",新疆,巴音郭楞,"新疆巴州库尔勒市华凌市场板材区5-49号"
新华文轩出版传媒股份有限公司乌鲁木齐分公司,916501007876386646,2006-05-19,N/A,张帆,"N/A","销售：图书、报刊、期刊、电子出版物。",新疆,乌鲁木齐,"新疆乌鲁木齐市钱塘江路216号"
新疆烽火台电子科技有限公司,91650105787636474M,2006-05-19,N/A,曹骥飞,"100(万)","计算机软硬件及机电产品的开发与销售，计算机软件代理；设备租赁服务，销售：电子设备，农畜产品，建筑材料，汽车专用卫星定位系统，监控系统，防盗防爆器材。",新疆,乌鲁木齐,"新疆乌鲁木齐市水磨沟区南湖东路63号2栋2单元602室"
新疆泊沿商贸有限公司,916501007876361247,2006-05-19,N/A,朱江文,"200(万元人民币)","国际道路普通货物运输、道路普通货物运输、货物专用运输",新疆,乌鲁木齐,"新疆乌鲁木齐市新市区迎宾路881号新港世纪花园3号楼12号、13号商铺"
乌鲁木齐市欣冠捷科技有限公司,91650102787636941A,2006-05-19,N/A,徐磊,"30(万)","计算机及相关设备的销售及维护，计算机软硬件开发，计算机综合布线，计算机系统服务；销售：办公用品，办公耗材，文教设备，电气设备，通讯及通信设备，机电设备，电子产品，办公自动化设备，劳保用品",新疆,乌鲁木齐,"新疆乌鲁木齐市天山区中山路232号红旗路电脑城5B-09号"
库车塔北泥浆材料有限公司,91652923787636896Q,2006-05-19,N/A,王华胜,"1,200(万)","泥浆材料和油田助剂的生产销售，井下技术服务，道路普通货物运输，装卸搬运。",新疆,阿克苏,"新疆阿克苏地区库车县化工园区库车大方实业有限公司用地以东、规划道路以南"
新疆浩天源家具有限公司,91650100787636116C,2006-05-19,N/A,齐东升,"500(万)","许可经营项目：无。 一般经营项目：",新疆,乌鲁木齐,"新疆乌鲁木齐经济技术开发区青岛路104号"
中国电信股份有限公司巴音郭楞蒙古自治州分公司,91652800761141537J,2006-05-19,N/A,梁鹏,"N/A","基础电信业务：在本区域范围内经营800MHzCDMA第二代数字峰窝移动通信业务和CDMA2000第三代数字蜂窝移动通信业务。和LTE/第四代数安蜂窝移动通信业务（TD-LTE/LTEFDD），在本区域范围内经营固定网本地电话业务（含本地无线环路业务）、固定网国内长途电话业务、固定网国际长途电话业务，IP电话业务（限于phone-to-phone）、卫星国际专线业务，因特网数据传送业务、国际数据通信业务、公众电报和用户电报业务、26CHz无线接入业务、国内通信设施服务业务。在本区域范围内经营第二类基础电信业务中的国内甚小口径终端地球站（VSAT）通信业务、固定网国内数据传送业务、无线数据传送业务、用户驻地网业务、网络托管业务；第一类增值电信业务中的在线数据处理与交易处理业务、国内因特网虚拟专用网业务、因特网数据中心业务；第二类增值电信业务中的存储转发类业务、呼叫中心业务、因特网接入服务业务和信息服务业务,IPTV传输服务：服务内容为IPTV集成播控平台与电视用户端之间提供信号传输和相应技术保障，传输网络为利用固定通信网络（含互联网）架设IPTV信号专用传输网格，IPTV传输服务在限定的地域范围内开展；互联网地图服务（有效期至2019年12月31日）；利用信息网络经营音乐娱乐产品、游戏产品（含网络游戏虚拟货币发行）、艺术品、演出剧",新疆,巴音郭楞,"新疆巴州库尔勒市人民西路1号"
乌鲁木齐星之创广告装饰装潢有限公司,91650105787636589U,2006-05-19,N/A,刘勇,"100(万元人民币)","广告装饰装潢工程的设计与施工，室内工程装饰装修及设计与施工，会展服务，设计、制作、发布、代理国内各类广告，亮化工程的设计与施工，加工制作不锈钢、型材门；商务信息咨询服务；销售：广告设备，喷绘材料，广告制作材料，亚克力材料，型材，LED模组及模块，建材，文化用品，工艺品，办公用品。",新疆,乌鲁木齐,"新疆乌鲁木齐市水磨沟区西虹东路8号"
乌鲁木齐豪力神工贸有限公司,91650103787636431B,2006-05-19,N/A,任润桃,"50(万)","销售:工程机械及配件，汽车配件，农机设备，建筑材料，机电产品，五金交电，仪器仪表，农畜产品，石油制品，日用百货，机械维修，设备租赁。",新疆,乌鲁木齐,"新疆乌鲁木齐市沙依巴克区南昌路北2巷"
新疆亚中(郑州)日产汽车销售有限公司服务站,91650100789853691W,2006-05-19,N/A,刘建征,"N/A","汽车售后服务；汽车配件、旅游纪念品、百货销售。",新疆,乌鲁木齐,"新疆乌鲁木齐经济技术开发区乌昌路229号"
哈密市四方电子有限责任公司,91652201787635818F,2006-05-19,N/A,钟兴文,"50(万元人民币)","计算机及计算机软、硬件、打印机、复印机及周边设备、网络产品、安防器材的销售、安装与维修；办公设备、办公耗材、电子产品、数码产品、通讯器材、照相器材、家用电器、家具、仪表仪器、五金交电、机电产品、音响设备、建材、劳保用品、日用百货、服装的销售；计算机网络工程、技术服务；LED显示工程；",新疆,哈密,"新疆哈密地区哈密市天山北路52号"
乌鲁木齐市亿安达视频技术有限公司,91650100787636183A,2006-05-19,N/A,苗志国,"50(万)","楼宇自动化系统集成，商务信息咨询服务，计算机综合布线，批零兼营：计算机及配件、防盗系统设备、多媒体电子设备、消防器材、农畜产品（活畜及专项除外）、保温材料、水暖器材、仪器仪表、电子产品（不含地面卫星接收设施）、化工原料（危险品除外）、橡胶制品、劳保用品、办公用品、五金交电、针纺织品、通讯设备",新疆,乌鲁木齐,"新疆乌鲁木齐市天山区中山路141号三层DIR3-45号"
阿克苏市金旺商贸有限责任公司,9165290178763943XW,2006-05-19,N/A,王艳,"30(万)","预包装食品批发兼零售。洗涤用品、日用百货、五金交电的销售。",新疆,阿克苏,"新疆阿克苏地区阿克苏市乌喀中路鑫大商贸城D3"
新疆中宇机电设备有限公司,91650102787636132Y,2006-05-19,N/A,王青,"300(万元人民币)","销售：机电产品，化工产品（化学危险品除外），建材，家用电器，日用百货，针纺织品，通讯器材，汽车配件，农畜产品，装饰装潢材料，工程机械，油田钻井设备，玻璃制品，现代化办公用品，计算机软硬件及耗材，化玻制品，化学试剂（危险化学品除外）,教学设备,仪器仪表及技术服务",新疆,乌鲁木齐,"新疆乌鲁木齐市青年路26号月光小区9栋4单元104室"
新疆新亚特科技有限公司,9165010378763636XF,2006-05-19,N/A,简锡华,"100(万)","无销售:石油制品,化工产品及原料,塑料制品,建材,装饰材料,五金交电,橡胶制品,农畜产品,办公用品,环保产品,劳保用品；仪器仪表,电线电缆,家用电器,计算机及耗材,机械设备,机电产品,通讯产品,电子产品，高低压电器,矿产机械及配件,泵,阀门的销售、装配及调试。",新疆,乌鲁木齐,"新疆乌鲁木齐市沙依巴克区扬子江路52号1016室"
徐州矿务(集团)新疆天山矿业有限责任公司俄霍布拉克煤矿,91650100789872825M,2006-05-19,N/A,张雷,"N/A","煤炭生产。",新疆,乌鲁木齐,"新疆阿克苏地区库车县阿格乡卡拉库尔村"
喀什博瑞树莓科技开发有限责任公司,91653101787641724G,2006-05-19,N/A,张幸运,"3(万元人民币)","酒类；批发兼零售；预包装食品；",新疆,喀什,"新疆喀什地区喀什市色满乡二村"
阿勒泰市南方旅行社有限责任公司,91654301787636888U,2006-05-19,N/A,宋惠云,"30(万元人民币)","入境旅游业务、国内旅游业务；会议、会展服务业务。",新疆,阿勒泰,"新疆阿勒泰地区阿勒泰市文化路2号区"
上海浦东发展银行股份有限公司乌鲁木齐分行,91650100787638744R,2006-05-19,N/A,吴晓峰,"N/A","经营中国银行业监督管理委员会依照有关法律、行政法规和其他规定批准的业务，经营范围以批准文件所列为准。",新疆,乌鲁木齐,"新疆乌鲁木齐市天山区新华南路379号商业写字楼1栋1楼"
阿图什市通达煤炭经销有限责任公司,91653001787637389X,2006-05-19,N/A,徐强,"50(万元人民币)","煤炭及制品销售。",新疆,克孜勒苏柯尔克孜,"新疆克州阿图什市帕米尔路314国道"
乌鲁木齐诚信达商贸有限公司,91650100787637530R,2006-05-19,N/A,苏鸿朝,"200(万元人民币)","许可经营项目：无。一般经营项目：货物与技术的进出口业务；销售、设计、安装、调试、维护家庭影院，舞台音响灯光系统，体育场馆音响灯光系统，视频点播系统，可视会议系统，会议同步翻译系统，会议传声工程系统,亮化工程；销售：装饰装潢材料，水处理设备，办公家具，电器、电工电料，工程机械，农畜产品，水暖配件，工业产品，矿业产品，纸制品，五金工具，石油制品，文化用品，电脑设备及耗材，办公用品，建材，钢材。",新疆,乌鲁木齐,"新疆乌鲁木齐市扬子江路4号"
新疆德美房地产开发有限公司,91652301787636677K,2006-05-20,N/A,肖勇,"600(万)","房地产开发经营销售；物业管理、建筑安装；建筑装饰；销售建材",新疆,昌吉,"新疆昌吉州昌吉市延安北路供电巷五区文艺路"
和布克赛尔县华丰有限责任公司察和特种子加工厂,916542267898945060,2006-05-20,有限责任公司,伊怀文,"N/A","许可经营项目：按照(农作物种子经营许可证)及(主要农作物种子生产许可证)核准的经营范围经营核准。一般经营项目：无。",新疆,塔城,"新疆塔城地区和布克赛尔县察和特开发区"
新疆旭升果蔬制品有限公司,916528267898523816,2006-05-22,N/A,胡德志,"500(万)","罐头",新疆,巴音郭楞,"新疆巴州焉耆县二十七团第四居民小区"
新疆凌通动力科技有限公司,91650100787641468C,2006-05-22,N/A,胡慧贤,"250(万)","一般经营项目：销售：机电设备及配件，工业自动化设备及配件，石油物资设备，石油制品，仪器仪表，电线电缆，计算机及配件，五金交电，装饰装璜材料，文化用品，金属材料，化工原料，化工产品，农畜产品；机电设备安装、维修、租赁。",新疆,乌鲁木齐,"新疆乌鲁木齐市沙依巴克区钱塘江路415号天宝大厦1号楼1单元1702室"
库尔勒拓友科技有限公司,91652801787641513Q,2006-05-22,N/A,刘南海,"1,300(万元人民币)","石油技术服务，石油和天然气开采的相关勘探活动，批发零售：五金交电、其他化工产品、其他机械设备及电子产品、计算机辅助设备、家用电器、石油钻采专用设备、防爆器材，通讯终端设备及维修。",新疆,巴音郭楞,"新疆巴州库尔勒市塔指东路康都世纪花园40号三单元202室"
乌苏市民企农牧实业有限公司,9165420278763740XE,2006-05-22,N/A,刘双江,"400(万)","许可经营项目：屠宰，肉制品加工，冷冻冷藏、储藏、保鲜、销售，道路普通货物运输。一般经营项目：水果，蔬菜收购，农副产品收购",新疆,塔城,"新疆塔城地区乌苏市北京东路北侧"
托克逊县鑫鑫矿业开发有限责任公司,91650422787636765U,2006-05-22,N/A,周卫明,"5,000(万)","重晶石,铜,铅锌,金,银矿产品的销售*。",新疆,吐鲁番,"新疆吐鲁番市托克逊县丝绸路(南疆路)"
新疆帕米尔石油化工有限公司,91650104787638090L,2006-05-22,N/A,吐拉江·依格木,"1,000(万)","防冻液生产及销售；销售：化工产品（危险化学品除外）、化学试剂(危险化学品除外)、润滑油、有色金属材料（专项除外）、橡胶制品、塑料制品、石油制品",新疆,乌鲁木齐,"新疆乌鲁木齐市米东区九沟南路东一巷359号"
新疆威克特利石油物资有限公司,91650103787642022H,2006-05-22,N/A,魏桂芳,"300(万)","销售：石油化工机械成套设备，钻探机械成套设备,采油机械成套设备,工矿机械成套设备,五交化产品、汽车配件、仪器仪表、电线电缆、通用标准配件、消防器材、劳保用品、日用百货、服装鞋帽。",新疆,乌鲁木齐,"新疆乌鲁木齐市沙依巴克区阿勒泰路83号皓翔金山大厦702室"
乌什县供销棉麻公司二厂,91652927929833781J,2006-05-22,N/A,李涛,"N/A","许可经营项目：（具体经营项目以有关部门文件或颁发的许可证、资质证书为准）：棉花收购加工（籽棉皮棉）。一般经营项目：",新疆,阿克苏,"新疆阿克苏地区乌什县阿合雅乡十一村"
新疆白尔纳商贸有限公司,91650102787638859W,2006-05-22,N/A,阿吾提·阿吉,"300(万)","批发兼零售:预包装食品兼散装食品；销售:化妆品,日用百货,服装鞋帽,针纺织品,家用电器,农畜产品,五金交电,纸制品,珠宝玉器,民族手工艺品,装饰材料,建材；货物与技术的进出口业务，商务信息咨询服务，物业管理服务。",新疆,乌鲁木齐,"新疆乌鲁木齐市天山区后泉街宁夏湾巷45号1号楼1单元302号"
莎车县恒通机动车代理有限公司,91653125787639333J,2006-05-22,N/A,李团结,"3(万)","（具体经营项目以有关部门批准文件或颁发的许可证、资质证书为准）：道路普通货物运、机动车辆保险（交强险除外）交强险。道路普通货物运、机动车辆保险",新疆,喀什,"新疆喀什地区莎车县车管所旁"
新疆金丰源种业股份有限公司种子加工厂,91652900787644618A,2006-05-22,股份有限公司,张银宝,"N/A","主要农作物种子生产。",新疆,阿克苏,"新疆阿克苏地区温宿县依希来木齐乡"
乌鲁木齐诚翔电子工程科技发展有限公司,91650102787636562Q,2006-05-22,N/A,解新雷,"300(万)","智能化弱电系统安装,计算机技术、视频检测技术的服务及相关产品的销售，强弱电系统暗管铺设工程，楼宇电子对讲防盗系统设备及安装；销售:电线电缆,消防器材及设备,电力产品,农畜产品,装饰材料，汽车电子类产品,塑料制品及辅料，化工产品，五金交电，工业用纸，石油制品，建筑材料，保温材料，办公用品，仪器仪表，机电产品，化学试剂，节能产品及技术服务。",新疆,乌鲁木齐,"新疆乌鲁木齐市青年路799号紫薇花园3栋4层1单元402"
伊犁正远锁业有限公司,91654023787639050L,2006-05-22,N/A,马正勋,"150(万)","集装箱锁、注塑的生产、加工、销售；电焊条混合粉的配置，各类商品及技术的进出口业务",新疆,伊犁哈萨克,"新疆伊犁州霍城县芦草沟镇广仁创业园区"
阿克苏市天惠商贸有限公司,916529017876426555,2006-05-22,N/A,张惠东,"30(万元人民币)","二类摩托车维护、小修。摩托车及配件销售；助力车、自行车及配件销售、维修；家用电器，家用音频产品、建筑材料、化工产品",新疆,阿克苏,"新疆阿克苏地区阿克苏市中原路绿洲小区1号楼"
新疆奥达科技开发有限责任公司,9165010478763804X9,2006-05-22,N/A,陈静,"50(万)","技术转让，技术服务，技术咨询，技术培训；商务信息咨询代理。",新疆,乌鲁木齐,"新疆乌鲁木齐市新市区北京南路40号"
阿克苏恒誉新型建材有限责任公司,91652901787637709E,2006-05-22,N/A,刘天真,"1,200(万)","防水材料加工、销售；防水、防腐保温工程施工，市政公用工程总承包。",新疆,阿克苏,"新疆阿克苏地区阿克苏市南工业园区阿塔公路7公里处"
新疆万盛堂医药零售连锁有限责任公司乌鲁木齐第五十五分店,916501007876477046,2006-05-22,N/A,丁云英,"N/A","零售（连锁）：中药饮片、中成药，化学药制剂、抗生素制剂、生化药品、生物制品",新疆,乌鲁木齐,"新疆乌鲁木齐市新市区西八家户路768号天山博雅文轩小区7栋1层8号"
库尔勒路宝汽车配件有限责任公司,91652801787639982M,2006-05-22,N/A,李兴恩,"3(万)","批发零售：汽车配件、润滑油、轮胎、五金交电(磨砂机、切割机、电焊机、电钻机、发电机、粉碎机、机床除外)、装潢材料、灯具，加工：滤清器。",新疆,巴音郭楞,"新疆巴州库尔勒市天山东路北侧22号小区"
乌什县供销棉麻公司,916529272298308031,2006-05-22,N/A,李涛,"1,500(万)","许可经营项目：（具体经营项目以有关部门文件或颁发的许可证、资质证书为准）：棉花收购加工、销售（籽棉皮棉）（仅限于其具备资质的分支机构）。一般经营项目：",新疆,阿克苏,"新疆阿克苏地区乌什县团结北路6号"
