新疆亿德建材科技发展有限公司,91650106789890396B,2006-07-26,N/A,田金海,"2,000(万元人民币)","建筑材料的研发；建筑构件的研发；建筑工程学培训及开展学术交流；新技术的引进、开发、咨询与服务；销售：建材、金属材料、有色金属、矿产品、机电产品、五金交电、计算机软、硬件及辅助设备、电线电缆、初级农产品、农用机械、化妆品、服装鞋帽、汽车配件；美容服务；货物与技术的进出口业务。",新疆,乌鲁木齐,"新疆乌鲁木齐市头屯河区北站西路619号（果之美东楼205室）"
新疆鑫国宇担保有限责任公司,91650100789893941P,2006-07-26,N/A,周丽,"500(万)","为中小企业、个人从业人员的提供担保。",新疆,乌鲁木齐,"新疆乌鲁木齐市沙依巴克区奇台路308号综合楼4楼"
新疆嘉视光电科技有限公司,91650105789890759Q,2006-07-27,N/A,朱立军,"100(万元人民币)","有线电视工程设计安装",新疆,乌鲁木齐,"新疆乌鲁木齐市水磨沟区克拉玛依东路南湖二期7栋7-202号"
昌吉润峰化工有限责任公司,91652300789889993R,2006-07-27,N/A,郑小疆,"3,100(万)","批发(无仓储)：1，4-二甲苯、溶剂油、轻质燃料油；氢氧化钠；石油气；硫磺；其他石油制品的生产、销售；与石油和天然气开采有关的服务活动；销售五金交电、电子产品、机械设备、汽车配件、建材、塑料制品、橡胶制品、服装鞋帽、百货,仓储服务。",新疆,昌吉,"新疆昌吉州昌吉高新技术产业开发区"
新疆新城建工程设计审查有限公司,916501057898930446,2006-07-27,N/A,王晖,"100(万)","工程设计审查、咨询服务。",新疆,乌鲁木齐,"新疆乌鲁木齐市水磨沟区新兴街20号1栋4层"
新疆贝思特工贸有限责任公司,916501037898926747,2006-07-27,N/A,刘明,"200(万元人民币)","销售：仪器仪表，阀门，机电产品，五金交电，钢材，化工产品，家用电器，音响设备，电子产品，水泵，阀门，机械设备，橡胶制品，家具，工艺美术品，通讯产品，玻璃制品，文化用品，办公用品，针纺织品，农畜产品，化妆品，电力设备，化工原料；自动化控制设备安装、调试、设计。",新疆,乌鲁木齐,"新疆乌鲁木齐市沙依巴克区平顶山东一路锦福苑15幢2单元602室"
北京大龙建设集团有限公司新疆分公司,91650100789893976A,2006-07-27,N/A,陈建明,"N/A","许可经营项目：无。一般经营项目：建筑施工；古建施工；市政工程施工；室内外装饰装潢；设备安装；建筑设计；销售钢材、木材、水泥、建筑材料；设备租赁；技术咨询（不含中介服务）；保洁服务。",新疆,乌鲁木齐,"乌鲁木齐经济技术开发区上海路西二巷5号"
新疆卫华起重设备有限公司,91650104789891030U,2006-07-27,N/A,王庆超,"1,000(万元人民币)","机械维修；销售：工程机械设备及配件、建材、电线电缆、五金交电、机械设备及配件,起重设备及配件，钢材。",新疆,乌鲁木齐,"新疆乌鲁木齐市新市区太原南路188号附339号"
伊犁恒盛新型建材制造有限责任公司,91654002789896034U,2006-07-27,N/A,曹秀河,"10(万元人民币)","各种建材用苯板，冷藏，保鲜库材料，彩钢板，C型板的生产及销售，防水建筑材料，隔热和隔音材料制造。",新疆,伊犁哈萨克,"新疆伊犁州伊宁市吉里格朗渔场"
伊犁博美广告装饰有限责任公司,91654002789893650X,2006-07-27,N/A,宋锦州,"508(万)","户内外广告设计制作与发布；代理国内各类广告营销策划及推广；各类展会策划,推广；广告装潢；产品外包装的设计；楼盘模型、沙盘、路灯、户外灯箱、铁艺钢架的设计与制作；不锈钢加工制作；LED电子屏制作安装；大型钢构制作安装；路标标示加工制作；楼体亮化设计施工；舞台灯光、大型庆典策划的设计、制作与安装；打字复印。",新疆,伊犁哈萨克,"新疆伊犁州伊宁市阿合买提江街4巷地委家属院5号楼10幢101室"
泽普县润泰进出口贸易有限责任公司,9165312478989061XJ,2006-07-27,N/A,孙志峰,"50(万元人民币)","许可经营项目：无。一般经营项目：边境小额贸易,自营和代理各类商品及技术的进出口,但国家限定经营或禁止进出口的商品和技术除外,土特产,畜产品,金属材料,化工产品,纺织品,工艺品,工程机械,农副产品,机电产品,仪器仪表,日用杂品,建筑材料,汽配,锅炉配件。",新疆,喀什,"新疆喀什地区泽普县津泽工业园区"
乌鲁木齐朴而思服饰有限公司,916501057898920843,2006-07-27,N/A,吴蓬勃,"50(万)","服饰加工、销售，销售：针纺织品，布艺，装饰材料，日用百货，服装鞋帽",新疆,乌鲁木齐,"新疆乌鲁木齐市水磨沟区温泉西路601号3层"
新疆城建材料有限责任公司,91650100792254489P,2006-07-27,N/A,周红革,"4,470(万)","生产、加工、销售：沥青混凝土、沥青、混凝土面砖、路沿石、空心砌块、承重砌块、水泥稳定土、二灰土；仓储服务",新疆,乌鲁木齐,"新疆乌鲁木齐市沙依巴克区过境公路1号"
新疆中博投资有限公司,9165010078989889X2,2006-07-27,N/A,张治豪,"1,100(万)","矿业投资，房地产投资，商业投资；油田投资；农业开发，种植业，商务代理；销售：矿产品，机械设备，建材钢材，木材，节能环保设备，日用百货，机电产品，电子产品，农畜土特产品，石油新技术及工艺研究及推广应用。",新疆,乌鲁木齐,"新疆乌鲁木齐市新市区杭州东街666号大得豪庭27栋103室"
乌鲁木齐百之兴贸易有限公司,916501027898920682,2006-07-27,N/A,胡涛,"50(万元人民币)","销售:日用百货,办公用品,服装鞋帽,农畜产品,建材,钢材,木材,棉短绒,机电产品,家用电器,针纺织品,五金交电,机械设备,汽车配件,环保设备,橡胶制品。",新疆,乌鲁木齐,"新疆乌鲁木齐市天山区碱泉街8号13栋"
泽普县泰润果业有限责任公司,91653124789890601T,2006-07-27,N/A,王锋,"500(万元人民币)","种植业,果蔬加工、保鲜、储存、销售；通过边境小额贸易方式向毗邻国家开展各类商品及技术的进出口业务，国家限制进出口的商品及技术除外。允许经营边贸项下废钢、废铜、废铝、废纸、废塑料等国家核定公司经营的五种废旧物资的进口。",新疆,喀什,"新疆喀什地区泽普县津泽工业园"
伊宁美志彩色印刷厂冰馨冷饮批发部,91654021MA77519E88,2006-07-27,个人独资企业,张美娟,"N/A","冷冻",新疆,伊犁哈萨克,"新疆伊犁州伊宁县吉里于孜大街经贸委楼下"
乌鲁木齐鑫润恒贸易有限公司,9165010078989272XR,2006-07-27,N/A,杨婷婷,"50(万)","销售：化工产品，机械设备，五金交电，电子产品，建材，钢材，计算机、软件及辅助设备，工艺美术品，文化体育用品及器材，纺织服装及日用品，农畜产品，货物与技术的进出口贸易及边境小额贸易，仪器仪表修理，软件开发，信息技术咨询服务，贸易代理。",新疆,乌鲁木齐,"新疆乌鲁木齐高新技术产业开发区（新市区）苏州路84号苏州花园二区10幢5单元601室"
霍尔果斯兰州大酒店有限责任公司,9165400478989280XK,2006-07-27,N/A,李永宁,"120(万)","宾馆、餐饮服务、足浴、歌舞娱乐服务、房屋租赁、预包装食品零售。",新疆,伊犁哈萨克,"新疆伊犁州霍尔果斯口岸亚欧南路7号"
新疆农资集团有限责任公司托克逊县第二十四农佳乐村级服务部,91650422792250568N,2006-07-27,N/A,杨生华,"N/A","农药",新疆,吐鲁番,"新疆吐鲁番市托克逊县博斯坦乡博斯坦村"
中国联合网络通信有限公司富蕴县分公司,916500007898972050,2006-07-28,N/A,N/A,"N/A","在全国范围内经营固定网本地电话业务（含本地无线环路业务）、公众电报和用户电报业务、国内通信设施服务业务、固定网国内长途电话业务、固定网国际长途电话业务、IP电话业务（限Phone-Phone的电话业务）、900/1800MHzGSM第二代数字蜂窝移动通信业务、WCDMA第三代数字蜂窝移动通信业务、LTE/第四代数字蜂窝移动通信业务（TD-LTE）、卫星国际专线业务、因特网数据传送业务、国际数据通信业务、26GHz无线接入业务；3.5GHz无线接入业务。在全国范围内经营国内甚小口径终端地球站（VSAT）通信业务，固定网国内数据传送业务、无线数据传送业务、用户驻地网业务、网络托管业务、在线数据处理与交易处理业务、国内因特网虚拟专用网业务、因特网数据中心业务、语音信箱业务、传真存储转发业务、X.400电子邮件业务、因特网接入服务业务和信息服务业务（含固定网电话信息服务业务、互联网信息服务业务和移动网信息服务业务）。经营与通信及信息业务相关的系统集成、设备生产销售、设计施工业务；技术开发、技术服务、技术咨询、技术培训；寻呼机、手机及其配件的销售、维修；电信卡的制作、销售；客户服务；房屋租赁；编辑、出版、发行电话号码簿。",新疆,阿勒泰,"新疆富蕴县四区迎宾路256幢"
中国联合网络通信有限公司托克逊县分公司,91650100789897221T,2006-07-28,N/A,N/A,"N/A","在全国范围内经营固定网本地电话业务（含本地无线环路业务）、公众电报和用户电报业务、国内通信设施服务业务、固定网国内长途电话业务、固定网国际长途电话业务、IP电话业务（限Phone-Phone的电话业务）、900/1800MHzGSM第二代数字蜂窝移动通信业务、WCDMA第三代数字蜂窝移动通信业务、LTE/第四代数字蜂窝移动通信业务（TD-LTE）、卫星国际专线业务、因特网数据传送业务、国际数据通信业务、26GHz无线接入业务；3.5GHz无线接入业务。在全国范围内经营国内甚小口径终端地球站（VSAT）通信业务，固定网国内数据传送业务、无线数据传送业务、用户驻地网业务、网络托管业务、在线数据处理与交易处理业务、国内因特网虚拟专用网业务、因特网数据中心业务、语音信箱业务、传真存储转发业务、X.400电子邮件业务、因特网接入服务业务和信息服务业务（含固定网电话信息服务业务、互联网信息服务业务和移动网信息服务业务）。经营与通信及信息业务相关的系统集成、设备生产销售、设计施工业务；技术开发、技术服务、技术咨询、技术培训；寻呼机、手机及其配件的销售、维修；电信卡的制作、销售；客户服务；房屋租赁；编辑、出版、发行电话号码簿。",新疆,乌鲁木齐,"新疆吐鲁番地区托克逊县始昌路西侧瑞峰综合楼"
中国联合网络通信有限公司于田县分公司,91650100789897109U,2006-07-28,N/A,N/A,"N/A","在全国范围内经营固定网本地电话业务（含本地无线环路业务）、公众电报和用户电报业务、国内通信设施服务业务、固定网国内长途电话业务、固定网国际长途电话业务、IP电话业务（限Phone-Phone的电话业务）、900/1800MHzGSM第二代数字蜂窝移动通信业务、WCDMA第三代数字蜂窝移动通信业务、LTE/第四代数字蜂窝移动通信业务（TD-LTE）、卫星国际专线业务、因特网数据传送业务、国际数据通信业务、26GHz无线接入业务；3.5GHz无线接入业务。在全国范围内经营国内甚小口径终端地球站（VSAT）通信业务，固定网国内数据传送业务、无线数据传送业务、用户驻地网业务、网络托管业务、在线数据处理与交易处理业务、国内因特网虚拟专用网业务、因特网数据中心业务、语音信箱业务、传真存储转发业务、X.400电子邮件业务、因特网接入服务业务和信息服务业务（含固定网电话信息服务业务、互联网信息服务业务和移动网信息服务业务）。经营与通信及信息业务相关的系统集成、设备生产销售、设计施工业务；技术开发、技术服务、技术咨询、技术培训；寻呼机、手机及其配件的销售、维修；电信卡的制作、销售；客户服务；房屋租赁；编辑、出版、发行电话号码簿。",新疆,和田,"新疆和田地区于田县玉城东路东山苑8栋13号"
乌鲁木齐君舰汽车服务有限责任公司,9165010479225098XY,2006-07-28,N/A,N/A,"10(万元人民币)","销售：汽车配件。服务：汽车过户,年审,新车落户,咨询服务,二手车交易,汽车租赁。",新疆,乌鲁木齐,"新疆乌鲁木齐市新市区鲤鱼山北路1号(赛博特汽车城E1-102"
中国联合网络通信有限公司北屯分公司,9165000078989715XR,2006-07-28,N/A,N/A,"N/A","在全国范围内经营固定网本地电话业务（含本地无线环路业务）、公众电报和用户电报业务、国内通信设施服务业务、固定网国内长途电话业务、固定网国际长途电话业务、IP电话业务（限Phone-Phone的电话业务）、900/1800MHzGSM第二代数字蜂窝移动通信业务、WCDMA第三代数字蜂窝移动通信业务、LTE/第四代数字蜂窝移动通信业务（TD-LTE）、卫星国际专线业务、因特网数据传送业务、国际数据通信业务、26GHz无线接入业务；3.5GHz无线接入业务。在全国范围内经营国内甚小口径终端地球站（VSAT）通信业务，固定网国内数据传送业务、无线数据传送业务、用户驻地网业务、网络托管业务、在线数据处理与交易处理业务、国内因特网虚拟专用网业务、因特网数据中心业务、语音信箱业务、传真存储转发业务、X.400电子邮件业务、因特网接入服务业务和信息服务业务（含固定网电话信息服务业务、互联网信息服务业务和移动网信息服务业务）。经营与通信及信息业务相关的系统集成、设备生产销售、设计施工业务；技术开发、技术服务、技术咨询、技术培训；寻呼机、手机及其配件的销售、维修；电信卡的制作、销售；客户服务；房屋租赁；编辑、出版、发行电话号码簿。",新疆,阿勒泰,"新疆阿勒泰地区北屯文化路以东"
中国联合网络通信有限公司布尔津县分公司,91650000789897168R,2006-07-28,N/A,N/A,"N/A","在全国范围内经营固定网本地电话业务（含本地无线环路业务）、公众电报和用户电报业务、国内通信设施服务业务、固定网国内长途电话业务、固定网国际长途电话业务、IP电话业务（限Phone-Phone的电话业务）、900/1800MHzGSM第二代数字蜂窝移动通信业务、WCDMA第三代数字蜂窝移动通信业务、LTE/第四代数字蜂窝移动通信业务（TD-LTE）、卫星国际专线业务、因特网数据传送业务、国际数据通信业务、26GHz无线接入业务；3.5GHz无线接入业务。在全国范围内经营国内甚小口径终端地球站（VSAT）通信业务，固定网国内数据传送业务、无线数据传送业务、用户驻地网业务、网络托管业务、在线数据处理与交易处理业务、国内因特网虚拟专用网业务、因特网数据中心业务、语音信箱业务、传真存储转发业务、X.400电子邮件业务、因特网接入服务业务和信息服务业务（含固定网电话信息服务业务、互联网信息服务业务和移动网信息服务业务）。经营与通信及信息业务相关的系统集成、设备生产销售、设计施工业务；技术开发、技术服务、技术咨询、技术培训；寻呼机、手机及其配件的销售、维修；电信卡的制作、销售；客户服务；房屋租赁；编辑、出版、发行电话号码簿。",新疆,阿勒泰,"新疆布尔津县文明北路525幢"
中国联合网络通信有限公司拜城县分公司,9165010078989723XJ,2006-07-28,N/A,N/A,"N/A","在全国范围内经营固定网本地电话业务（含本地无线环路业务）、公众电报和用户电报业务、国内通信设施服务业务、固定网国内长途电话业务、固定网国际长途电话业务、IP电话业务（限Phone-Phone的电话业务）、900/1800MHzGSM第二代数字蜂窝移动通信业务、WCDMA第三代数字蜂窝移动通信业务、LTE/第四代数字蜂窝移动通信业务（TD-LTE）、卫星国际专线业务、因特网数据传送业务、国际数据通信业务、26GHz无线接入业务；3.5GHz无线接入业务。在全国范围内经营国内甚小口径终端地球站（VSAT）通信业务，固定网国内数据传送业务、无线数据传送业务、用户驻地网业务、网络托管业务、在线数据处理与交易处理业务、国内因特网虚拟专用网业务、因特网数据中心业务、语音信箱业务、传真存储转发业务、X.400电子邮件业务、因特网接入服务业务和信息服务业务（含固定网电话信息服务业务、互联网信息服务业务和移动网信息服务业务）。经营与通信及信息业务相关的系统集成、设备生产销售、设计施工业务；技术开发、技术服务、技术咨询、技术培训；寻呼机、手机及其配件的销售、维修；电信卡的制作、销售；客户服务；房屋租赁；编辑、出版、发行电话号码簿。",新疆,乌鲁木齐,"新疆拜城县团结路瑞康美居小区13号楼2区拐角楼一层105号"
中国联合网络通信有限公司福海县分公司,91650000789897192A,2006-07-28,N/A,N/A,"N/A","在全国范围内经营固定网本地电话业务（含本地无线环路业务）、公众电报和用户电报业务、国内通信设施服务业务、固定网国内长途电话业务、固定网国际长途电话业务、IP电话业务（限Phone-Phone的电话业务）、900/1800MHzGSM第二代数字蜂窝移动通信业务、WCDMA第三代数字蜂窝移动通信业务、LTE/第四代数字蜂窝移动通信业务（TD-LTE）、卫星国际专线业务、因特网数据传送业务、国际数据通信业务、26GHz无线接入业务；3.5GHz无线接入业务。在全国范围内经营国内甚小口径终端地球站（VSAT）通信业务，固定网国内数据传送业务、无线数据传送业务、用户驻地网业务、网络托管业务、在线数据处理与交易处理业务、国内因特网虚拟专用网业务、因特网数据中心业务、语音信箱业务、传真存储转发业务、X.400电子邮件业务、因特网接入服务业务和信息服务业务（含固定网电话信息服务业务、互联网信息服务业务和移动网信息服务业务）。经营与通信及信息业务相关的系统集成、设备生产销售、设计施工业务；技术开发、技术服务、技术咨询、技术培训；寻呼机、手机及其配件的销售、维修；电信卡的制作、销售；客户服务；房屋租赁；编辑、出版、发行电话号码簿。",新疆,阿勒泰,"新疆福海县八区黄金海岸酒店一层、三层联通公司办公室"
中国联合网络通信有限公司墨玉县分公司,916501007898973879,2006-07-28,N/A,N/A,"N/A","在全国范围内经营固定网本地电话业务（含本地无线环路业务）、公众电报和用户电报业务、国内通信设施服务业务、固定网国内长途电话业务、固定网国际长途电话业务、IP电话业务（限Phone-Phone的电话业务）、900/1800MHzGSM第二代数字蜂窝移动通信业务、WCDMA第三代数字蜂窝移动通信业务、LTE/第四代数字蜂窝移动通信业务（TD-LTE）、卫星国际专线业务、因特网数据传送业务、国际数据通信业务、26GHz无线接入业务；3.5GHz无线接入业务。在全国范围内经营国内甚小口径终端地球站（VSAT）通信业务，固定网国内数据传送业务、无线数据传送业务、用户驻地网业务、网络托管业务、在线数据处理与交易处理业务、国内因特网虚拟专用网业务、因特网数据中心业务、语音信箱业务、传真存储转发业务、X.400电子邮件业务、因特网接入服务业务和信息服务业务（含固定网电话信息服务业务、互联网信息服务业务和移动网信息服务业务）。经营与通信及信息业务相关的系统集成、设备生产销售、设计施工业务；技术开发、技术服务、技术咨询、技术培训；寻呼机、手机及其配件的销售、维修；电信卡的制作、销售；客户服务；房屋租赁；编辑、出版、发行电话号码簿。",新疆,和田,"新疆和田地区墨玉县其尼巴格路"
中国电信股份有限公司巴州驿站路营业部,91652800MA7761PM01,2006-07-28,N/A,N/A,"N/A","基础电信业务：在本区域范围内经营800MHzCDMA第二代数字峰窝移动通信业务和CDMA2000第三代数字蜂窝移动通信业务。和LTE/第四代数安蜂窝移动通信业务（TD-LTE/LTEFDD），在本区域范围内经营固定网本地电话业务（含本地无线环路业务）、固定网国内长途电话业务、固定网国际长途电话业务，IP电话业务（限于phone-to-phone）、卫星国际专线业务，因特网数据传送业务、国际数据通信业务、公众电报和用户电报业务、26CHz无线接入业务、国内通信设施服务业务。在本区域范围内经营第二类基础电信业务中的国内甚小口径终端地球站（VSAT）通信业务、固定网国内数据传送业务、无线数据传送业务、用户驻地网业务、网络托管业务；第一类增值电信业务中的在线数据处理与交易处理业务、国内因特网虚拟专用网业务、因特网数据中心业务；第二类增值电信业务中的存储转发类业务、呼叫中心业务、因特网接入服务业务和信息服务业务,IPTV传输服务：服务内容为IPTV集成播控平台与电视用户端之间提供信号传输和相应技术保障，传输网络为利用固定通信网络（含互联网）架设IPTV信号专用传输网格，IPTV传输服务在限定的地域范围内开展；互联网地图服务（有效期至2019年12月31日）；利用信息网络经营音乐娱乐产品、游戏产品（含网络游戏虚拟货币发行）、艺术品、演出剧",新疆,巴音郭楞,"新疆巴州库尔勒市驿站路"
中国农业银行股份有限公司阿勒泰一八四团支行,91654226930870125G,2006-07-28,N/A,N/A,"N/A","贷款、储蓄，保险业务",新疆,塔城,"新疆塔城地区和布克赛尔县农十师一八四团长宁西街"
中国联合网络通信有限公司霍尔果斯口岸分公司,916540047898971760,2006-07-28,N/A,N/A,"N/A","在全国范围内经营固定网本地电话业务（含本地无线环路业务）、公众电报和用户电报业务、国内通信设施服务业务、固定网国内长途电话业务、固定网国际长途电话业务、IP电话业务（限Phone-Phone的电话业务）、900/1800MHzGSM第二代数字蜂窝移动通信业务、WCDMA第三代数字蜂窝移动通信业务、LTE/第四代数字蜂窝移动通信业务（TD-LTE）、卫星国际专线业务、因特网数据传送业务、国际数据通信业务、26GHz无线接入业务；3.5GHz无线接入业务。在全国范围内经营国内甚小口径终端地球站（VSAT）通信业务，固定网国内数据传送业务、无线数据传送业务、用户驻地网业务、网络托管业务、在线数据处理与交易处理业务、国内因特网虚拟专用网业务、因特网数据中心业务、语音信箱业务、传真存储转发业务、X.400电子邮件业务、因特网接入服务业务和信息服务业务（含固定网电话信息服务业务、互联网信息服务业务和移动网信息服务业务）。经营与通信及信息业务相关的系统集成、设备生产销售、设计施工业务；技术开发、技术服务、技术咨询、技术培训；寻呼机、手机及其配件的销售、维修；电信卡的制作、销售；客户服务；房屋租赁；编辑、出版、发行电话号码簿。",新疆,伊犁哈萨克,"新疆伊犁州霍尔果斯口岸亚欧路1幢"
乌鲁木齐伊利食品有限责任公司,916501007898939177,2006-07-29,N/A,徐亚明,"9,000(万)","奶牛饲养。牛奶购销。农副产品购销。冷饮、酸奶、速冻食品、液体奶生产销售。包装物料、原辅材料的生产及销售",新疆,乌鲁木齐,"新疆乌鲁木齐经济技术开发区洪湖路88号"
新疆华凯建设工程有限责任公司,916523017898975472,2006-07-30,N/A,朱训华,"4,000(万)","建筑安装业；建筑装饰业；建筑工程机械与设备租赁；建材、五金产品销售；房地产中介服务；市政道路工程服务；绿化管理；防水工程；土石方工程服务；电子与智能化工程专业承包贰级；安防系统监控服务。",新疆,昌吉,"新疆昌吉州昌吉市建国东路(新疆兵团豫剧团办公楼内)"
新疆鸿瑞能源科技有限公司,916501057898929657,2006-07-31,N/A,陈军,"30(万元人民币)","销售：照明器材及设备，节能设备，五金交电，日用百货，金属材料，电子产品，农畜产品，皮棉，家具，汽车及配件，建材，电线电缆，办公用品及设备，通讯产品（二手手机销售除外），机械设备，数码产品，服装鞋帽，矿产品，仪器仪表，塑料橡胶制品，文体用品，工艺礼品；设备租赁。家禽牲畜养殖",新疆,乌鲁木齐,"新疆乌鲁木齐市水磨沟区克拉玛依东路142号"
