伊宁市绒鑫商贸有限责任公司经销部,916540027922846453,2006-10-17,N/A,阳林,"N/A","针纺织品，服装鞋帽，文体体育用品，办公用品。",新疆,伊犁哈萨克,"新疆伊犁州伊宁市阿合买提江街7巷1号"
阿拉尔农垦农资有限责任公司十四团分公司,91659002792290148Q,2006-10-17,N/A,周永军,"N/A","农药",新疆,阿拉尔,"新疆阿拉尔十四团市场"
鄯善县鑫奥森矿业开发有限公司,91650421792284960A,2006-10-17,N/A,石国兵,"50(万)","矿产品加工销售。",新疆,吐鲁番,"新疆吐鲁番市鄯善县一区团结路南侧三号小区"
哈密中光电子工贸有限责任公司,916522007922840204,2006-10-17,N/A,李夏利,"50(万元人民币)","矿山机械设备及配件、工程机械设备及配件、电子产品及原器件。",新疆,哈密,"哈密市伊州区八一路新禧花园5栋5-1602"
轮台县金太阳农资有限公司,916528227922845574,2006-10-17,N/A,陈永明,"30(万)","农药",新疆,巴音郭楞,"新疆巴州轮台县迪那路"
库尔勒博琳商贸有限责任公司,91652801792285234H,2006-10-17,N/A,蒋长国,"30(万)","批发零售:针纺织品、其他日用品、五金交电(磨砂机、切割机、电焊机、电钻机、发电机、粉碎机、机床除外)、其他机械设备及电子产品、计算机、软件及辅助设备、建筑材料、家用电器、文具及体育用品、通讯设备",新疆,巴音郭楞,"新疆巴州库尔勒市兰干路文拉提村二组"
新疆天山水泥股份有限公司塔里木分公司,9165280079228432XX,2006-10-17,N/A,刘新明,"N/A","生产及批发零售：水泥及技术服务。",新疆,巴音郭楞,"新疆巴州库尔勒市天山西路"
乌鲁木齐市多斯德克伊克商贸有限公司,91650100792277357X,2006-10-17,N/A,日阿纳巴耶夫.塔尔嘎特.穆卡舍维奇,"50(万元人民币)","日用品、化工产品（危险化学品除外）、机电设备、农用机械、仪器、仪表、家具、服装、建材的进出口贸易和国内批发业务",新疆,乌鲁木齐,"新疆乌鲁木齐市沙依巴克区钱塘江路328号国贸大厦1A栋A-1806室"
克拉玛依市中天安科工贸有限公司,91650203792287811U,2006-10-17,N/A,尹月耀,"500(万)","机械设备及配件、五金交电、化工产品、建材、电子产品、纺织品、服装、日用品、文体用品及器材、劳动防护用品销售。",新疆,克拉玛依,"新疆克拉玛依市昆仑路14-17号"
阿拉尔农垦农资有限责任公司十六团分公司,91659002792290252W,2006-10-17,N/A,周永军,"N/A","农药零售；化肥、农用薄膜、微肥、复合肥、植物生长调节剂、农用机械、植保器械、农机具。",新疆,阿拉尔,"新疆阿拉尔市新开岭镇"
阿拉尔农垦农资有限责任公司十一团分公司,91659002792289921P,2006-10-17,N/A,周永军,"N/A","农药零售；化肥、农药、农用薄膜、微肥、复合肥、植物生长调节剂、农用机械、植保器械、农用机具。",新疆,阿拉尔,"新疆阿拉尔市花桥镇"
库尔勒海曼商贸有限公司,9165280179228475X6,2006-10-17,N/A,依力夏提·阿巴斯,"30(万元人民币)","批发零售：汽车配件、其他日用品、其他机械设备及电子产品、五金交电、其他化工产品、其他农畜产品、润滑油。",新疆,巴音郭楞,"新疆巴州库尔勒市天山辖区东山坡314国道西侧"
木垒县凯源煤炭有限责任公司,916500002293602230,2006-10-17,N/A,王建邦,"3,000(万元人民币)","煤炭的开采、销售(限自产)。",新疆,昌吉,"新疆昌吉州奇台县北塔山"
新疆红云祥农业科技开发有限公司,916501097922877747,2006-10-18,N/A,权建升,"2,000(万元人民币)","生产、销售：农业机械设备及配件、灌溉设备、有机肥、有机无机复混肥、复混肥料、生物有机肥、水溶肥料、有机物料腐熟剂；销售：农副产品、尿素、磷酸二铵、磷酸二氢钾、硫酸钾",新疆,乌鲁木齐,"新疆乌鲁木齐市米东区三道坝南路天生沟西寺巷5号"
克拉玛依市易申工贸有限公司,91650203792288021N,2006-10-18,N/A,鄢新霞,"500(万)","金属材料、五金交电、电子产品、化工产品、建材、劳动防护用品、石油制品销售；机械设备销售及维修；油田技术服务。",新疆,克拉玛依,"新疆克拉玛依市阿山路15号"
新源县瑞基矿业有限责任公司,91654025792291722R,2006-10-18,N/A,邢永明,"50(万)","铜矿石的精选、破碎、粉末及销售。",新疆,伊犁哈萨克,"新疆伊犁州新源县别斯托别乡"
哈密新庆矿业有限责任公司,91652200792294421M,2006-10-18,N/A,王东生,"1,000(万)","矿产品销售；矿业设备维修。",新疆,哈密,"新疆哈密地区哈密市广东路146号"
新疆新德国际运输有限责任公司乌鲁木齐国际运输汽车站,91650103333099379N,2006-10-18,N/A,阿依吐尔逊·依明,"N/A","国际客运站经营",新疆,乌鲁木齐,"新疆乌鲁木齐市乌鲁木齐市沙依巴克区黑龙江路370号"
西安康健消毒制品有限公司乌鲁木齐分公司,916501047957564172,2006-10-18,N/A,陈菊伟,"N/A","许可经营项目：液体消毒剂",新疆,乌鲁木齐,"乌鲁木齐市新市区余杭路安吉一巷3号"
新疆四友彩印包装有限公司乌鲁木齐市分公司,9165010579575397XH,2006-10-18,N/A,张兰,"N/A","生产，销售：激光图像制作，激光全息制品，包装装潢，美工设计，纸塑彩印商标；销售：农畜产品，现代办公设备及耗材，机电产品，矿产品，五金交电，建材,纸制品，塑料制品加工。",新疆,乌鲁木齐,"新疆乌鲁木齐市水磨沟区康辉四巷46号"
霍尔果斯亚通报关服务有限责任公司,916540047922854296,2006-10-18,N/A,马军,"150(万)","代理报关、报检业务。",新疆,伊犁哈萨克,"新疆伊犁州霍尔果斯口岸振兴路10号雅园小区10202号"
新疆农资(集团)有限责任公司巴楚县阿纳库勒乡农佳乐第十一连锁店,91653130792288312W,2006-10-18,N/A,叶华军,"N/A","农药（高毒、剧毒农药除外）零售、化肥(硝基复混肥除外）、农用地膜、五金交电、日用百货、农业机械、钢材、建筑材料、汽车配件、机电产品(专项审批除外)零售",新疆,喀什,"新疆喀什地区巴楚县团结西路"
克拉玛依市双利商贸有限责任公司,916502037922880051,2006-10-18,N/A,吴朝,"150(万元人民币)","机械设备、五金交电、电子产品、建材、金属材料、化工产品、日用品、服装、润滑油销售。",新疆,克拉玛依,"新疆克拉玛依市石油小区18-24号"
新疆巴州万方物资再生利用有限公司且末县回收站,91652825795757495M,2006-10-18,N/A,潘孝德,"N/A","废旧物资回收。",新疆,巴音郭楞,"新疆巴州且末县埃塔北路农贸市场下方"
喀什蓝天益达保洁服务有限公司,91653101795751835A,2006-10-18,N/A,秦福容,"50(万)","饮食服务；保洁服务，洗车服务；国内航空货运代理服务；仓储服务，家政服务；汽车服务、汽车租赁,绿化服务、供暖服务、花卉的种植与销售。。",新疆,喀什,"新疆喀什地区喀什市机场路473号"
乌鲁木齐源兴德商贸有限公司,91650102792285381L,2006-10-18,N/A,包明峰,"100(万元人民币)","销售：五金交电、化工产品、建筑材料、室内装修材料、针纺织品、服装、日用品、文化、体育用品及器材、家用电器、电子产品、摩托车配件、石油制品、橡胶制品、家具、花卉、农畜产品的销售，商务信息咨询，计算机软硬件开发及销售，计算机及配件耗材。",新疆,乌鲁木齐,"新疆乌鲁木齐市天山区红旗路113号"
深圳市天音美讯信息技术有限公司乌市分公司,916501027957561262,2006-10-18,N/A,李忠,"N/A","销售：日用百货。",新疆,乌鲁木齐,"乌鲁木齐市人民路1号南门国际城D4幢1505号"
巴州盛业石油技术服务有限公司,91652801792286560G,2006-10-18,N/A,卢永录,"500(万元人民币)","石油钻采设备及配件的加工、销售、维修、租赁、石油技术服务、批发零售：五金交电、其他化工产品、石油化工助剂、建筑材料、钢材、其他机械设备及电子产品、家用电器、计算机及耗材、文具及体育用品、其他日用品、针纺织品、服装、鞋帽、汽车配件，石油钻采专用设备的进出口业务。批发零售、加工：高碱微玻璃纤维棉",新疆,巴音郭楞,"新疆巴州库尔勒市新城北路唐明新村别墅1-2号"
新疆金色丝路国际贸易有限公司,91650100792289315R,2006-10-18,N/A,艾尼瓦尔·买买提,"8,000(万)","销售：五金交电，日用品，针纺织品，化妆品，机械配件，建材，玉石，汽车及摩托配件，金属材料及制品，服装鞋帽，文化办公用品，钢材，电子元件，音响设备，机电产品，照明电器，医疗器械（一类），农畜产品，皮棉，矿产品，房地产投资，房地产经纪，社会经济咨询，酒店管理，新能源开发及技术咨询，室内装修装饰设计、工程，货运代理服务；土地整治，市场管理，畜牧养殖，农业投资，风力发电投资、太阳能发电投资；货物与技术的进出口业务",新疆,乌鲁木齐,"新疆乌鲁木齐市天山区人民路322号34栋10层1单元1006室"
新疆亿能电子科技有限责任公司,91650102792285365Y,2006-10-18,N/A,苏青松,"50(万)","电子产品的销售、研究及开发，计算机软件开发及销售，发电机组维修、设备安装、零配件销售，环保工程施工，机电设备安装，环保设备研发及销售，楼宇智能化工程；销售：消防产品，建材，机电产品，电线电缆，五金交电，办公设备，计算机及配件、耗材，照明器材，灯光音响设备，网络及多媒体设备，服装鞋帽，日用百货，石油产品、化工产品，仪器仪表，农畜产品",新疆,乌鲁木齐,"新疆乌鲁木齐市天山区青年路月光小区21号楼7单元501号"
新疆世路源贸易有限公司,916501057922865875,2006-10-18,N/A,张红兵,"2,000(万元人民币)","销售：金属材料，建材，五金交电，机械设备，电子产品，农畜产品，矿产品，焦煤；钢结构构件加工。",新疆,乌鲁木齐,"新疆乌鲁木齐市水磨沟区安居北路59号底商高层住宅楼1栋17层1单元1704"
乌鲁木齐满江红药业零售连锁有限责任公司第二十一店,91650100795756599C,2006-10-18,N/A,苏华,"N/A","中成药、化学药制剂、抗生素制剂、生化药品、保健食品、医疗器械的零售；日用百货、五金、建筑材料、洗涤化妆用品、珠宝玉器的销售；预包装食品的零售；钟表维修。",新疆,乌鲁木齐,"新疆乌鲁木齐市沙依巴克区九家湾村一队1栋"
乌鲁木齐京疆友联市政设备有限公司,916501047922865449,2006-10-19,N/A,徐岩,"50(万)","销售：汽车",新疆,乌鲁木齐,"新疆乌鲁木齐市新市区北京北路18号1幢B单元16楼C室"
新疆星洲机电设备有限公司,91650103792285517R,2006-10-19,N/A,李济,"100(万)","销售：电站辅机，仪器仪表，环保设备，五金交电，机电产品，园林机械，灌溉设备，电子产品，劳保用品，机械设备，化工产品，建材，农畜产品，皮棉，阀门管件，电动工具，高低压柜，电线电缆，净水设备，水暖设备，电脑机配件，办公设备，文体用品，轴承，制冷设备，灯具；综合布线，仪器仪表的组装。",新疆,乌鲁木齐,"新疆乌鲁木齐市沙依巴克区河滩南路477号汇玺小区9号楼2单元603号"
库尔勒天宇顺发装饰材料有限责任公司,916528017922921276,2006-10-19,N/A,陈琴,"3(万)","批发零售：五金交电、其他机械设备及电子产品",新疆,巴音郭楞,"新疆巴州库尔勒市华凌市场主市场区8-41号"
西部绿洲国际实业集团有限公司,91650000792288363C,2006-10-19,N/A,刘林刚,"10,000(万)","餐饮服务、住宿；卷烟零售",新疆,乌鲁木齐,"新疆乌鲁木齐市沙依巴克区友好南路551号3栋"
新疆农资(集团)有限责任公司轮台县大道南乡第二农佳乐连锁店,91652822792294667J,2006-10-19,N/A,吴向东,"N/A","许可经营项目：（具体经营项目及期限以有关部门的批准文件或颁发的许可证、资质证书为准）：零售：农药（剧毒农药除外）。一般经营项目：",新疆,巴音郭楞,"轮台县迪那路皮毛社对面"
阿克苏昌通电子科技有限公司,91652900792287598A,2006-10-19,N/A,刘春杰,"100(万)","计算机及办公自动化设备、电脑耗材、电子监控、电子大屏、电教设备、通讯器材、电器、音乐器材、摄影器材、音箱、灯光照明设备、防盗监控设备、体育文化用品、办公用品、办公桌椅、劳保用品、服装及针织用品、日用百货、土产日杂、化工金属材料、装饰装潢材料、塑料制品、基建产品、建筑材料、农副产品销售；太阳能路灯及配件、道闸系统设计安装与施工；软件开发、视频会议、录播室、校园广播、电线电缆、网络及综合布线安装工程的维护与技术服务。",新疆,阿克苏,"新疆阿克苏地区阿克苏市团结东路香港街电脑城二楼44号"
新疆金杰工贸有限公司,916501007922858247,2006-10-19,N/A,王小胖,"60(万)","计算机软硬件开发销售，仓储服务（危险化学品、易燃易爆品除外）：销售：计算机耗材，通讯设备及产品，电子产品，化妆品，农畜产品，建筑材料，机械设备，金属材料，钢材，电线电缆，皮棉，石材，陶瓷制品，办公自动化产品，五金交电，化工产品（化学危险品除外），石油制品",新疆,乌鲁木齐,"新疆乌鲁木齐经济技术开发区厦门路8号"
乌鲁木齐市鑫盈信商贸有限公司,91650104792288654E,2006-10-19,N/A,徐劲松,"200(万元人民币)","道路普通货物运输，货物专用运输（罐式容器）；货运代理，货运咨询服务，商务信息咨询；销售：水泥，五金交电，建筑材料，电子产品，机械设备，化工产品",新疆,乌鲁木齐,"新疆乌鲁木齐市新市区北站路西郊停车场"
新疆天亿圣项目管理有限公司,916501097922854885,2006-10-19,N/A,邱红,"50(万元人民币)","工程项目管理，工程造价咨询，企业策划，企业管理。",新疆,乌鲁木齐,"新疆乌鲁木齐米泉市古牧地东路新华路北侧回归园4号小区"
新疆奇台县开仁托让格矿业有限责任公司,91652325792293007L,2006-10-19,N/A,王晓春,"300(万元人民币)","五金、交电、化工（危险化学品除外）、农副产品",新疆,昌吉,"新疆昌吉州奇台县东风北街"
巴州新汇通钢材有限公司,91652801792287184F,2006-10-19,N/A,肖青华,"50(万元人民币)","批发零售：钢材、建筑材料、有色金属材料、其他机械设备及电子产品（磨砂机、切割机、电焊机、电钻机、发电机、粉碎机、机床除外）、其他农畜产品、文具及体育用品、汽车配件、其他日用品",新疆,巴音郭楞,"新疆巴州库尔勒市华凌南疆综合批发市场钢材市场1栋13号"
新疆得恒聚科技有限公司,91650104792287002R,2006-10-19,N/A,曾轲,"100(万元人民币)","销售：盐酸，硫酸，三氯甲烷，丙酮，氨基磺酸，苯，苯酚，2-丙醇，次氯酸钠溶液[含有效氯＞5%]，碘化亚汞，1,1-二氯乙烷，1,2-二氯乙烷，1,1-二氯乙烯，二异丙胺，氟化钾，氟化钠，高氯酸镁，铬酸钾，高碘酸钾，过二硫酸铵，过硫酸钠，过氧化钠，甲醇，3-甲基-1-丁醇，1-甲基戊醇，酒石酸锑钾，硫化铵溶液，硫化钠，六亚甲基四胺，氯铂酸，氯化钡，氯酸钾，氯酸钠，1-萘胺，偏钒酸铵，氢氟酸，氢氧化钡，三氯化铁，三氯化钛，三氯乙烯，1,4-苯二酚，吡啶，1-丙醇，碘酸钾，2-丁醇，2-丁酮，1,2-二氯乙烯，1,4-二羟基-2-丁炔，二硫化碳，氟化铵，高碘酸，高氯酸，铬酸铅，汞，过二硫酸钾，过氧化氢，环己酮，环己烷，甲醛溶液，甲酸，甲酸甲酯，硫脲，硫氰酸汞，硫酸汞，二氯化汞，氯化钴，氯化铜，硼氢化钾，硼氢化钠，硼酸，氢氧化钾，氢氧化钠，氢氧化锂，2,4,6-三硝基苯酚，石油醚，水合肼[含肼≤64%]，计算机及办公自动化设备及耗材的销售、维修；专业技术咨询服务；销售：矿产品，冶金炉料，机电产品及设备，钢材，建材，汽车配件，工矿配件，五金交电，电子产品，金属材料，仪器仪表，办公用品，劳保用品，化工产品（危险化学品除外），玻璃仪器，教学用品，光学仪器，实验设备，通讯设备",新疆,乌鲁木齐,"新疆乌鲁木齐市新市区北站二路东一巷226号化工市场A6-048"
新疆山河雕塑艺术有限公司,916501047922892350,2006-10-19,N/A,王宣元,"250(万)","社会经济咨询，会议及展览服务，动漫及衍生产品设计服务，城市雕塑规划咨询服务，园林绿化，图文设计、制作，园林艺术品的设计、制作，数字动漫制作，游戏设计制作，标识标牌制作、安装，景观和绿地设施工程施工，雕塑、喷泉的设计、制作；销售：雕塑艺术品，旅游纪念品，礼品，办公用品，五金建材，照明设备，音响器材，工艺品，农畜产品。",新疆,乌鲁木齐,"新疆乌鲁木齐市新市区鲤鱼山路1911号"
新疆阿克苏嘉兴典当有限责任公司,916529007922855336,2006-10-19,N/A,郑恩彤,"1,000(万元人民币)","动产质押典当业务、财产权利质押典当业务；房地产",新疆,阿克苏,"新疆阿克苏地区阿克苏市英阿瓦提路2号"
若羌县成渝运输有限公司,916528247922853305,2006-10-19,N/A,李成渝,"20(万)","县内班车客运、县内出租客运；普通货物运输；零售汽车配件、建筑材料。",新疆,巴音郭楞,"新疆巴州若羌县6号小区11号楼1单元1202号"
新疆农资(集团)有限责任公司北屯配送中心,91659005792291546U,2006-10-19,N/A,董福红,"N/A","农药(剧毒除外）、化肥、农膜批发零售；代销不分装种子。",新疆,阿勒泰,"新疆阿勒泰地区阿勒泰市北屯西北路以北火电厂南侧"
新疆帕戈郎食品有限公司,91650100792287504J,2006-10-19,N/A,王琮,"1,200(万)","家禽的加工销售。家禽养殖。冷冻相关技术服务。销售：机械设备、农畜产品、食品；货物与技术的进出口业务。",新疆,乌鲁木齐,"新疆乌鲁木齐高新技术产业开发区（新市区）正扬路81号"
新疆鑫立森投资集团有限公司,91650100792288961D,2006-10-19,N/A,刘铭锦,"11,899(万元人民币)","房地产投资及开发经营；房地产经纪",新疆,乌鲁木齐,"新疆乌鲁木齐市水磨沟区南湖东路63号南珏大厦综合楼7楼"
新疆兄弟陆桥国际物流有限责任公司,91650100792288662F,2006-10-19,N/A,段希文,"200(万)","国际货运代理；货物及技术进出口业务。",新疆,乌鲁木齐,"新疆乌鲁木齐高新区（新市区）天津南路431号博雅居2栋2单元301室"
新疆风暴国际贸易进出口有限公司,91650105792286771W,2006-10-19,N/A,赵斌,"100(万)","货物与技术的进出口业务；销售：农畜产品，木材，钢材，金属材料，日用百货，服装鞋帽，建筑材料，装饰材料，针纺织品，机械设备，汽车配件，电子产品，家用电器，办公用品，家具，煤炭，非危险化学品的化工产品，净水产品，管道配件，阀门；汽车销售",新疆,乌鲁木齐,"新疆乌鲁木齐市水磨沟区华祥二巷55号"
新疆蚂蚁物业服务有限公司,916540027922872641,2006-10-19,N/A,李晓娜,"500(万)","物业服务，单位后勤管理服务，保洁服务，家政服务，护理服务，家政信息咨询服务，物流服务，代驾服务，会议服务，运输信息咨询服务，筑物清洁服务，停车服务，环卫保洁服务，道路清扫保洁服务；酒店管理，餐饮管理；劳务派遣；园林绿化养护及施工设计，园林绿化工程施工及设计；水电暖维修；监控设备安装与维护，设施设备维修及维护；室内外装饰工程设计与施工；搬运装卸；广告的制作、发布；市政公用工程施工及设计。",新疆,伊犁哈萨克,"新疆伊犁州伊宁市经济合作区北京路2568号47-1综合楼1318房"
乌鲁木齐陆安物流有限公司,916501067922870379,2006-10-19,N/A,李保锋,"50(万)","普通货物运输；装卸服务。",新疆,乌鲁木齐,"新疆乌鲁木齐市头屯河区北站西路617号1楼114室"
新疆通元国际货运代理有限公司,91650100792286755Y,2006-10-19,N/A,顾新军,"318(万元人民币)","揽货、仓储、包装、货物的监装、监卸；货物运输代理；快递咨询服务，国际货运代理；代理报检、报关服务。",新疆,乌鲁木齐,"新疆乌鲁木齐市沙依巴克区宝山路386号和枫雅居小区第1栋6层602号"
新疆农资(集团)有限责任公司轮台县农佳乐连锁超市,916528227922948002,2006-10-19,N/A,张刚,"N/A","许可经营项目：（具体经营项目及期限以有关部门的批准文件或颁发的许可证、资质证书为准）：零售：农药（剧毒农药除外）。一般经营项目：",新疆,巴音郭楞,"新疆巴州轮台县迪那路西苑社区楼下"
乌鲁木齐琥加迪电子科技有限公司,916501037922868273,2006-10-19,N/A,王虎,"50(万)","销售：电子产品，灯光音响设备；销售：家用电器，电线电缆，金属材料，通讯产品，日用百货，办公设备，仪器仪表，汽车配件，综合布线；楼宇智能化工程的设计、施工及维修，舞台灯光音响设计及技术服务。。",新疆,乌鲁木齐,"新疆乌鲁木齐市沙依巴克区扬子江路17号B3-8-10号"
新疆世纪名雕装饰工程有限公司,916501007922868000,2006-10-19,N/A,林生宏,"50(万)","室内装饰装修工程；室内装饰设计服务。",新疆,乌鲁木齐,"新疆乌鲁木齐高新技术产业开发区(新市区)长春南路西二巷83号津城茗苑小区5-2-702室"
新疆巨昆能源有限公司,91650102792288814Q,2006-10-19,N/A,杜勇,"50(万)","销售：矿产品，机电产品，五金交电，化工产品（危险化学品除外），建材，石油制品（成品油除外），日用百货，农畜产品，计算机及耗材，办公用品，汽车配件，电线电缆，塑料制品，橡胶制品；矿业开发技术服务",新疆,乌鲁木齐,"新疆乌鲁木齐市天山区建设路18号"
新疆新华冲乎尔水利水电开发有限公司,91654321792290922K,2006-10-19,N/A,刘瑞河,"3,000(万)","水力发电。水利水电资源开发及投资。",新疆,阿勒泰,"新疆阿勒泰地区布尔津县冲乎尔镇库须根村"
哈密德峰矿业开发有限公司,9165220078988501XW,2006-10-19,N/A,闫舒明,"3,000(万元人民币)","地质勘查服务；矿产地质调查；矿产品、化工产品、塑料制品、日用百货、五金交电建材、机电产品、数码产品、机械设备及配件销售；机械设备及配件、房屋租赁。",新疆,哈密,"新疆哈密地区哈密市广场北路38号"
额敏县汇丰商贸有限公司,916542217922852425,2006-10-19,N/A,潘兴斌,"50(万)","食品",新疆,塔城,"新疆塔城地区额敏县中心路"
新疆永安网络科技有限公司,916501037922866591,2006-10-19,N/A,朱全新,"50(万元人民币)","计算机网络综合布线，计算机系统服务；销售：计算机软硬件，网络产品及耗材，电子产品，办公用品，电源产品，通讯设备，日用百货，服装鞋帽，文体用品，农畜土特产品，针纺织品，工艺品，家用电器，化工产品。",新疆,乌鲁木齐,"新疆乌鲁木齐市沙依巴克区钱塘江路27号1号楼二单元603室"
新疆宝源轩商贸有限公司,916501037922887509,2006-10-19,N/A,傅志新,"100(万)","销售：机电设备，石油制品，电工电料，五金工具，电线电缆，仪器仪表，消防器材，水暖器材，建材，劳保用品，橡胶制品，阀门，保温防腐材料，灯具，办公用品及设备，化工产品，针纺织品，日用百货，农畜产品。",新疆,乌鲁木齐,"新疆乌鲁木齐市沙依巴克区克拉玛依西街1096号塞外江南5-2-501"
乌鲁木齐长景伟业工贸有限公司,91650100792288881R,2006-10-20,N/A,陈长森,"200(万)","许可经营项目：无。一般经营项目：（国家法律、法规规定有专项审批的项目除外；需取得专项审批待取得有关部门的批准文件或颁发的行政许可证书后方可经营，具体经营项目期限以有关部门的批准文件和颁发的行政许可证为准）：服务：塑料制品及原材料加工；销售：农畜产品，机械设备，化工原料",新疆,乌鲁木齐,"新疆乌鲁木齐经济技术开发区农十二师合作区青海湖路251号"
新疆丝雅丹化妆品有限公司,9165010279228977XX,2006-10-20,N/A,张显文,"100(万)","洗涤化妆品、日用品、办公用品、五交化产品、农畜产品、石油制品、工艺品、橡胶制品、塑料制品、针纺织品、服装鞋帽、电子产品、机电产品、通讯器材、卫生洁具、照相器材、建材、装饰材料、体育用品、计算机软件及耗材的销售；科技信息咨询服务。",新疆,乌鲁木齐,"新疆乌鲁木齐市天山区人民路151号君泰大厦18-B4室"
新疆天华矿业有限责任公司,916540287922890080,2006-10-20,N/A,肖胜祥,"20,000(万元人民币)","铁矿开采。矿业投资，矿业技术咨询服务，矿产品加工、销售。",新疆,伊犁哈萨克,"新疆伊犁州尼勒克县胡吉尔台乡阿克塔斯牧场"
