北流市家顺康商贸有限公司,91450981MA5NNP2DXR,2019-03-21,有限责任公司,陈永流,"10(万)","日用百货、预包装食品批发、零售。",广西,玉林,"北流市北流镇丛义村十三组林开群宅"
南宁希顿酒店管理有限责任公司,91450100MA5NNNRL9T,2019-03-21,有限责任公司,刘利敏,"1,000(万)","酒店管理;对酒店业的投资；酒店管理信息咨询、会议会展服务、商务信息咨询、企业形象策划；物业管理；房屋租赁；销售：酒店用品、日用百货、农副土特产品（仅限初级农产品）、食品（具体以审批部门批准的为准）、工艺品（除象牙及其制品）、五金交电；住宿服务（具体以审批部门批准的为准）；餐饮服务（具体以审批部门批准的为准）;网页设计",广西,南宁,"南宁市西乡塘区安阳路22号广西广播电视监测中心调度指挥综合楼10层"
广西一好置业有限公司,91450103MA5NNB5Q73,2019-03-21,有限责任公司,廖泽武,"2,000(万)","房地产开发经营，房地产销售代理服务，商务信息咨询，对旅游业、酒店业的投资，物业管理服务，园林绿化工程施工；销售：建筑材料",广西,南宁,"南宁市青秀区民族大道92-1号新城国际8层0807号房"
北海小郝装饰工程有限公司,91450502MA5NNNPC23,2019-03-21,有限责任公司,郝忠广,"50(万)","室内装饰装修工程，建筑装饰装修工程，建筑防水工程，水电安装。",广西,北海,"北海市上海路南39号园辉新都14幢12单元0601号"
南宁市飞腾软件科技有限公司,91450100MA5NNNQHX0,2019-03-21,有限责任公司,陆青或,"100(万)","计算机软件及网络技术开发、技术咨询、技术转让；计算机系统集成；设计、制作、代理、发布国内各类广告；企业管理信息咨询、企业营销策划；批发、零售：计算机软件、办公用品、电子产品",广西,南宁,"南宁市青秀区葛村路8号3栋3单元306号房"
博白县宏博汽车服务有限责任公司,91450923MA5NNN4D7R,2019-03-21,有限责任公司,刘胜生,"200(万)","汽车、汽车配件的销售，汽车贷款业务、车辆保险业务的代办服务，金融信息咨询服务。",广西,玉林,"博白县博白镇人民中路金世纪商贸城1单元1001号"
合浦县白沙镇万豪内衣厂,92450521MA5NNNUKX2,2019-03-21,个体工商户,石斌,"N/A","内衣加工。",广西,北海,"合浦县白沙镇兴隆十米一街1号、3号。"
北流市圣凡汽车运输有限公司,91450981MA5NNQT16M,2019-03-21,有限责任公司,郑家平,"300(万)","道路普通货物运输，汽车、汽车配件的销售，停车场、仓储、物流信息咨询服务。",广西,玉林,"北流市新荣镇新荣村郑屋组27号"
博白县东春农业科技有限公司,91450923MA5NNNWRXJ,2019-03-21,有限责任公司,高小蓉,"500万元人民币","农业科学技术的研发、推广,龟、鳖、鱼、虾的养殖、销售,果蔬、绿化苗木的种植、销售,有机肥、生物肥的销售,对农贸市场建设项目的投资。",广西,玉林,"博白县东平镇绿荣村古想队"
广西一码通信息科技有限公司,91450300MA5NNMM610,2019-03-21,有限责任公司,何明烈,"200(万)","计算机软硬件产品、网络设备、商品码技术产品的研发与销售，物联网技术服务，防伪追溯标签产品生产与销售，室内外装潢设计、施工，包装装潢及其他印刷，检验检测咨询服务，广告策划与企业管理咨询服务。",广西,桂林,"桂林经开区华为信息生态产业合作区创新大厦第3层322号"
大化县菲华木材加工厂,92451229MA5NNNF27Q,2019-03-21,个体工商户,蓝振球,"N/A","木片、单板、锯材，加工销售。",广西,河池,"大化瑶族自治县北景镇那色村九洞屯"
中大工程设计有限公司广西分公司,91450322MA5NNPEN8Q,2019-03-21,有限责任公司 私营企业,韦江涛,"N/A","受公司委托，承接总公司业务。",广西,桂林,"临桂区临桂镇金水路29号267幢2单元5层02号"
南宁市旺益茂装饰工程有限公司,91450100MA5NNNYQ4U,2019-03-21,有限责任公司,韦育葵,"10(万)","建筑装饰工程设计、施工；水电安装工程的施工及维修；网络综合布线（以上项目凭资质证经营）; 销售：门窗、装饰材料(除危险化学品及木材)、劳保用品、灯具、家具、五金交电、卫生洁具；道路货物运输",广西,南宁,"南宁市青秀区安湖路2号平湖家居32栋1单元101号房"
南宁海之清贸易有限公司,91450103MA5NNNCA3F,2019-03-21,有限责任公司,周海亮,"380(万)","销售:建筑装饰材料(除化学危险品)、日用百货、电气设备及配件、照明设备、电线电缆、五金交电、金属材料(除国家专控产品)、包装材料(除危险化学品)、珠宝首饰、服装鞋帽、箱包、针纺织品、洗涤用品(除危险化学品)、化妆品、橡胶制品、塑料制品(国家禁止经营的除外)、纸制品、床上用品、办公用品、电子产品、通讯设备(以上两项，除国家专控产品)、计算机软硬件。",广西,南宁,"南宁市青秀区中山路66号外滩新城二区金外滩大厦17层1703A号"
宁明丰洞贸易有限公司,91451422MA5NNKQD90,2019-03-21,有限责任公司,詹前堆,"10(万)","货物或技术进出口（国家禁止或涉及行政审批的货物和技术进出口除外）;日用百货、服装鞋帽、手袋、箱包、办公用品、五金交电、电子元件、化工产品",广西,崇左,"宁明县城中镇凤翼路113号1楼"
兴业县宏居装饰工程有限责任公司,91450924MA5NNPY23B,2019-03-21,有限责任公司,李家基,"500(万)","住宅装饰、装修服务；厨具卫具、厨房电器、家具、建筑陶瓷的批发、零售**",广西,玉林,"兴业县沙塘镇合成村牛皮塘东面"
南宁市武鸣区尚元体育有限责任公司,91450122MA5NNP940N,2019-03-21,有限责任公司,岑树华,"50(万)","体育器械销售；拓展活动。",广西,南宁,"南宁市武鸣区城厢镇濑琶村渡头桥三产安置点14号"
北海鑫垚商贸有限公司,91450500MA5NNXCX9H,2019-03-21,有限责任公司,王唯玮,"100(万)","食品、水产品、农副土特产、服装鞋帽、箱包、体育用品、电子产品、日用百货、日用品、化妆品、办公用品、工艺品、塑料制品、五金交电、仪器仪表、电子产品及配件、包装材料、金属材料的销售，电子商务信息咨询。",广西,北海,"北海市四川路36号万家兴大厦B1106B号"
兴安县嘉友能源投资有限公司,91450325MA5NNPBX0H,2019-03-21,有限责任公司,文志峰,"1,000(万)","对加油站、加气站、石油、天然气、新能源项目的投资；成品油零售（限分支机构经营）；润滑油、日用百货、化工产品",广西,桂林,"兴安县兴安镇灵湖大道45号"
南宁陆阳劳务服务有限公司,91450109MA5NNP3346,2019-03-21,有限责任公司,陆其忠,"50(万)","建筑劳务分包、室内外装修装饰工程、钢结构工程、公路工程、园林绿化工程、市政工程、消防设施工程",广西,南宁,"南宁市邕宁区蒲庙镇广信路5号中盟产业园A05栋三层"
南宁市精讨网络科技有限公司,91450126MA5NNPKR9T,2019-03-21,有限责任公司,梁德福,"50(万)","电子商务、计算机网络技术开发；图文设计制作；设计、制作、发布国内各类广告；企业形象策划、市场营销策划、文体活动策划、经济贸易信息、商务信息、文化交流信息咨询服务；会务会展服务；批发兼零售：网络设计、日用百货、农副产品、服装鞋帽、电子产品、家用电器、家具、化妆品、玩具、工艺品、办公用品、文体用品、床上用品***",广西,南宁,"广西宾阳县黎塘镇龙胜村委会独石村32号"
宁明钱林贸易有限公司,91451422MA5NNM1C7L,2019-03-21,有限责任公司,詹前堆,"10(万)","货物或技术进出口（国家禁止或涉及行政审批的货物和技术进出口除外）；日用百货、服装鞋帽、手袋、箱包、办公用品、五金交电、电子元件、化工产品",广西,崇左,"宁明县城中镇凤翼路113号1楼"
北海市海山置业投资有限公司,91450521MA5NNPEC8A,2019-03-21,有限责任公司,陈磊相,"5,000(万)","房地产开发、房地产中介服务、生态农业观光服务；酒店项目投资，园林绿化工程，林木种植，禽畜饲养、水产养殖，农副产品、饲料加工销售；建筑材料、五金交电销售。",广西,北海,"广西北海市合浦县廉州镇民生路3号明园新城A、B座2-3号商铺"
南宁市惠伦科技有限公司,91450107MA5NNMH513,2019-03-21,有限责任公司,李惠莲,"20(万)","计算机软硬件的技术开发、技术咨询、技术转让、技术推广服务;计算机系统集成;计算机网络综合布线;楼宇智能化系统设备、安防监控设备的销售、安装及维修维护;销售:计算机及其配件、电子产品、办公设备及其耗材、照明设备;人力资源信息咨询(凭许可证在有效期内经营,具体项目以审批部门批准的为准)、企业营销策划、会展服务。",广西,南宁,"南宁市西乡塘区衡阳西路1号广运·都市景苑3号楼1301号"
南宁市吃货乐园贸易有限公司,91450107MA5NNQ4333,2019-03-21,有限责任公司,杨槟霞,"50(万)","销售：食品（凭许可证在有效期内经营，具体项目以审批部门批准的为准）、农副土特产品（仅限初级农产品）、化妆品、电子产品（除国家专控产品）、工艺品",广西,南宁,"南宁市西乡塘区华西路38号大和平华西商业城1号楼五层5033号商铺"
兴业星辰电子商务服务有限责任公司,91450924MA5NNPXY95,2019-03-21,有限责任公司,覃先容,"1万元人民币","批发、零售(含通过互联网零售):服装、针织品、纺织品、日用百货、化妆品、护肤品、五金产品、文具用品、玩具、电子产品、母婴用品**",广西,玉林,"兴业县石南镇东三街12幢4号"
北海鹏源房地产代理有限公司,91450502MA5NNMPJ7H,2019-03-21,有限责任公司,梁艳波,"100万元人民币","房地产商品交易居间、代理、行纪,房地产营销策划,房地产商品信息咨询,物业服务、家政服务;建筑装修装饰工程,设计、制作、发布、代理国内各类广告,电脑图文设计制作,旅游信息咨询、商务信息咨询。",广西,北海,"北海市南珠大道90号海江南花园4幢1304号"
南宁市振荣医药科技有限公司,91450107MA5NNPQX6H,2019-03-21,有限责任公司,陆美荣,"20(万)","生物技术、生物工程药物的开发、技术咨询、技术转让、技术推广服务；人力资源信息咨询（涉及许可的，凭许可证在有效期内经营，具体项目以审批部门批准的为准）；商务信息咨询、企业营销策划、会展服务",广西,南宁,"南宁市西乡塘区鲁班路46-6号振业尚府5号楼四层405号房"
南宁文涵汇智房地产开发有限公司,91450107MA5NNP721M,2019-03-21,有限责任公司,俞建午,"200万元人民币","房地产开发(凭资质证经营);对房地产业的投资。",广西,南宁,"南宁市西乡塘区北际南路7号“春江花月”1号楼107号商铺"
南宁胜之蓝房地产代理有限公司,91450100MA5NNRR24E,2019-03-21,有限责任公司,刘忠诚,"20(万)","房地产交易、居间、代理、行纪；房屋租赁；对房地产业的投资；水电设施安装；室内装饰装修工程的施工及设计",广西,南宁,"南宁市青秀区柳园路西一里1-2号一和二楼商铺"
南宁良奇企业管理咨询有限公司,91450107MA5NNN62XF,2019-03-21,有限责任公司,宋格军,"60万元人民币","企业管理信息咨询、教育信息咨询、财务信息咨询、税务信息咨询、企业形象策划、企业营销策划、企业登记注册代理、商务信息咨询、舞台艺术造型策划、会展服务、文化艺术交流活动策划(以上项目除国家有专项规定外);设计、制作、代理、发布国内各类广告。",广西,南宁,"南宁市西乡塘区明秀西路111号正恒国际广场3号楼B单元1401号"
北海市永利广告有限公司,91450500MA5NP2EY69,2019-03-21,有限责任公司,张宝庆,"100(万)","设计、制作、代理、发布国内各类广告",广西,北海,"北海市西边铜鼓岭62号"
兴安特斯拉机械租赁有限责任公司,91450325MA5NNPL20Q,2019-03-21,有限责任公司,蔡林波,"10(万)","工程机械设备租赁、维修服务；工程机械零配件销售。",广西,桂林,"兴安县兴安镇秦皇路229号"
三江县侗力十足科技有限公司,91450226MA5NNTUB2Y,2019-03-22,有限责任公司,杨群胜,"200(万)","互联网信息服务，互联网生活平台，互联网科技创新平台，基础软件开发，应用软件开发，其他广告服务，酒、饮料及茶叶零售，粮油零售，会议、展览及相关服务，其他商务服务业。",广西,柳州,"三江县侗乡大道100号金桥花园14-1号门面"
八步区莲塘步德木材加工厂,92451102MA5NNRXD2G,2019-03-22,个体工商户,黄步德,"N/A","木材加工，家具、门窗、教学办公桌椅加工销售。",广西,贺州,"贺州市八步区莲塘镇新莲村新屋组1210号"
南宁宁方舞蹈教育咨询有限公司青秀分公司,91450103MA5NNM7X7U,2019-03-22,有限责任公司,彭玮,"N/A","教育信息咨询、文化信息咨询、体育信息咨询、企业管理信息咨询；健身服务（具体项目以审批部门批准的为准）；电子信息技术咨询；企业形象策划服务；市场调研服务；市场营销策划服务；会议服务、展览展示服务；公司礼仪服务、个人形象设计服务；文化艺术交流活动策划；文艺创作与表演（具体项目以审批部门批准的为准）；舞台灯光设备、音响设备的安装服务；摄影服务；演出服装道具出租服务；计算机系统集成，演出经纪（凭许可证经营，具体项目以审批部门批准的为准）；销售：工艺品（除国家专控产品）、文化体育用品、办公用品、计算机软硬件、安防产品（除国家专控产品）、数码产品、电子产品",广西,南宁,"南宁市青秀区朱槿路8号缅甸园区德利·凤岭世家办公楼401号"
北京和平天下国际旅行社有限公司桂林分公司景鸿宾馆门市部,91450322MA5NNRK03D,2019-03-22,有限责任公司,黄丽红,"N/A","受公司委托、承接公司业务。",广西,桂林,"临桂区临桂镇榕山路261号"
华联世纪工程咨询股份有限公司柳州分公司,91450200MA5NNRLY8G,2019-03-22,股份有限公司,罗宗乐,"N/A","工程造价咨询；工程招标代理；政府采购代理；工程监理。",广西,柳州,"柳州市古亭山春苑路西巷17-1号"
南宁亨佳庆信息科技有限公司,91450103MA5NNTAB58,2019-03-22,有限责任公司,李丹丹,"10(万)","信息科技的技术开发、网站设计与制作（涉及许可的，具体项目以审批部门批准的为准），图文设计与制作（不含出版物印刷，涉及许可的，具体项目以审批部门批准的为准），市场营销策划，企业形象策划，美术设计与制作，企业投资信息咨询",广西,南宁,"南宁市青秀区民族大道93号新兴大厦A栋13层1301号“商务秘书企业（南宁好先机商务秘书有限公司）托管”"
北海优卓环保科技有限公司,91450502MA5NNTMNXJ,2019-03-22,有限责任公司,张呈剑,"100(万)","聚脲涂料，绝缘材料，环保设备制造与安装。",广西,北海,"北海市贵州路东紫金阁7号"
南宁市壹玖捌捌物业服务有限公司,91450102MA5NNU4Y8U,2019-03-22,有限责任公司,李聪,"30(万)","物业管理服务(凭有效资质证经营)；餐饮服务(具体项目以审批部门批准的为准)；旅行社服务(具体项目以审批部门批准的为准)；物业信息咨询，停车场管理服务，清洁服务，摄像服务，婚庆服务，礼仪服务，会务服务，商务信息咨询(国家有专项规定的除外)，企业管理信息咨询，会议服务，房地产投资信息咨询，酒店管理信息咨询；销售：酒店设备、厨房设备、办公用品、日用百货、酒店用品、工艺品(象牙及其制品除外)、母婴用品；妇幼护理服务，生活美容服务(具体项目以审批部门批准的为准)。",广西,南宁,"南宁市兴宁区邕武路3-2号B一楼"
北海钜城房地产开发有限公司,91450500MA5NNT1M82,2019-03-22,有限责任公司,韩宏蓓,"1001万元人民币","房地产开发经营,自有房屋租赁,房地产营销策划,物业管理,停车场服务,餐饮服务、住宿服务。",广西,北海,"北海市银海区杭州路万达广场以东、银海区打击传销专业队以北100米处房屋1房1室A29(北海红树林小镇商务秘书有限公司托管)"
北海格律诗酒店管理有限公司,91450502MA5NNTPG11,2019-03-22,有限责任公司,林福,"10(万)","酒店管理，对酒店项目的投资，住宿服务，餐饮服务，房地产商品交易居间、代理、行纪，家务清洁服务，房屋租赁代理，商务信息咨询，室内外装修装饰设计、代订飞机票、车票、船票、酒店、景点门票。",广西,北海,"北海市茶亭路49号北部湾壹号雅苑海悦阁一单元1002号"
北海荥海欣机械租赁有限公司,91450500MA5NNTTB6F,2019-03-22,有限责任公司,庞春凤,"10(万)","建筑机械设备租赁，道路货物运输。",广西,北海,"广西北海市广东路156号恒宇海岸华府二区3幢第一层102室"
北流市嘉仕通商贸有限公司,91450981MA5NNTM872,2019-03-22,有限责任公司,党皓,"50(万)","水泥、煤、石膏、粉煤灰、煤渣、岩粉、矿粉、水泥熟料、绿色建筑材料批发零售。",广西,玉林,"北流市大岭路二里15号"
北海云沛网络科技有限公司,91450502MA5NNT2470,2019-03-22,有限责任公司,任志荣,"1,000(万)","计算机软件技术开发、技术应用、技术咨询、技术转让；市场营销策划，企业营销管理策划，广告设计制作、代理发布，会议及展览服务；五金交电，建筑装饰材料，日用百货销售。",广西,北海,"北海市北京路川南商厦小区BC幢公寓楼二层商业房南部"
华联世纪工程咨询股份有限公司北海分公司,91450500MA5NNTWL77,2019-03-22,股份有限公司,黄晓波,"N/A","受公司委托联系相关业务。",广西,北海,"北海市湖南路铜鼓里二巷46号"
南宁创远隆科技有限公司,91450100MA5NNRU071,2019-03-22,有限责任公司,苏金龙,"50(万)","计算机技术开发、技术咨询、技术服务；贸易代理服务；计算机系统集成；教育信息咨询；网络技术服务；通信系统技术服务；云计算服务；大数据服务；信息安全服务；计算机软件的设计与开发；建筑智能化工程；计算机软件的销售。",广西,南宁,"南宁市青秀区青山路5号3栋1单元402号房"
北海冠昌房地产代理有限公司银滩分公司,91450503MA5NNW6P2P,2019-03-22,有限责任公司 私营企业,林永东,"N/A","房地产商品交易居间、代理、行纪*",广西,北海,"北海市银海区银滩社会主义新农村回建四区10苑C1型9号一层"
南宁宝冠体育用品有限公司柳州一分店,91450200MA5NNP7H4E,2019-03-22,分公司,王强,"N/A","零售运动用品、服装",广西,柳州,"柳州市文昌路17号华润万象城L1层135号商铺"
南宁亚贝欧医药信息咨询有限公司,91450100MA5NNRXJ1C,2019-03-22,有限责任公司,张秀兰,"50(万)","医药信息咨询、企业管理信息咨询、财务信息咨询（除国家有专项规定外）、医药产品的技术研发、技术咨询、技术推广；生物科技技术开发、技术推广、技术服务；对医药业的投资；设计、制作、代理、发布国内各类广告；会议会展服务，展览展示服务；企业营销策划；代理记账服务",广西,南宁,"南宁市青秀区桃源路37号11栋独单元704号房"
南宁好嗨哟影视传媒有限公司,91450103MA5NNT4Y5R,2019-03-22,有限责任公司,杨天福,"10(万)","影视节目制作（具体项目以审批部门批准的为准），演出经纪服务",广西,南宁,"南宁市青秀区民族大道166号上东国际T2栋2001号"
南宁市佰辉科技有限公司,91450100MA5NNQQL0P,2019-03-22,有限责任公司,赵文辉,"100(万)","医疗科技、电子科技、计算机科技的技术开发、技术咨询；医疗设备技术咨询、租赁、维修保养；销售：医疗器械（凭许可证在有效期内经营，具体项目以审批部门批准的为准）、办公用品、实验室设备、仪器仪表、电梯、环保设备、建材（除危险化学品）、电子产品（除国家专控产品）、消毒用品（除危险化学品）、化工产品",广西,南宁,"南宁市星光大道223号荣宝华星光大厦1-1410号"
三江县毛哥生态种养有限公司,91450226MA5NNXW146,2019-03-22,有限责任公司,吴能利,"200(万)","牛、猪饲养，其他牲畜饲养，鸡、鸭饲养，其他家禽饲养，内陆养殖，蔬菜、茶叶、水稻、玉米、其他谷物种植，薯类种植，土特产品，花卉、其他园艺作物种植，林木育苗、绿化管理，城乡市容管理，民宿服务，小吃服务，建筑装饰和装修业。",广西,柳州,"三江县林溪乡林溪村亮寨地仁"
南宁市华墩企业管理咨询有限公司,91450103MA5NNTRX3R,2019-03-22,有限责任公司,刘林,"50(万)","企业管理信息咨询，财税信息咨询",广西,南宁,"南宁市青秀区园湖南路16号3栋2楼"
北海双沛商贸有限公司,91450502MA5NNT7M6T,2019-03-22,有限责任公司,任志荣,"1,000(万)","家具、家用电器、皮革制品、服装鞋帽、卫生洁具、装饰材料、陶瓷、石材、金属材料、不需许可的医疗器械、电子产品、机电设备、五金交电、日用百货、办公用品、洗涤用品、食品、酒类、果蔬、农副产品、化肥的销售；货物或技术进出口业务；建筑工程、园林绿化工程",广西,北海,"北海市广东路138号星海颐园2幢三单元1003号"
南宁伟宙教育咨询有限公司,91450100MA5NNTKH8F,2019-03-22,有限责任公司,杨诗姣,"50(万)","教育信息咨询服务；职业中介服务",广西,南宁,"南宁市西乡塘区滨河路3号同和华彩上湾尚智阁一层62号商铺“商务秘书企业（广西咕咕狗商务秘书有限公司南宁第一分公司）托管”"
临桂万佳建筑材料贸易有限公司,91450322MA5NNTJX2R,2019-03-22,有限责任公司,陶玉芳,"20(万)","室内外装饰工程设计、施工；建筑材料批发、零售；机械设备及配件租赁、销售；装饰材料、五金材料、化工原料及产品(除危险化学品)、机电设备、木材、板材、塑料制品、管道配件批发、零售；沙石、钢材、水泥销售；国家允许经营的进出口贸易；国内贸易代理。",广西,桂林,"临桂区临桂镇建设路27、29、31、33-1、33-2号１单元１层01号"
南宁市卓盾印章制作有限公司,91450100MA5NNRF44P,2019-03-22,有限责任公司,磨定国,"50(万)","公章及各种印章制作",广西,南宁,"南宁市青秀区东葛路82号永凯现代城1单元1303号房"
上林县澄泰乡华德皮具制造厂,92450125MA5NNRRD4X,2019-03-22,个体工商户,廖五九,"N/A","皮革制品制造及销售。",广西,南宁,"上林县澄泰乡圩底村圩底庄路口东边街"
南宁市吉浩营销策划有限公司,91450107MA5NNUCD7W,2019-03-22,有限责任公司,胡炳坤,"20(万)","企业营销策划、企业形象策划、商务信息咨询、企业管理信息咨询、市场调查、市场推广、会展服务（以上项目除国家有专项规定外）；计算机网络技术研发、技术服务；设计、制作、代理、发布国内各类广告；销售：服装、玩具、体育用品、床上用品、化妆品、办公用品、家用电器、健身器材、计算机软硬件、电子产品（除国家有专项规定外）、工艺品",广西,南宁,"南宁市西乡塘区大学路59号文华园5号楼5单元6层5-5-501号"
中蓝废旧物资循环利用科技有限公司,91450500MA5NNYMK9H,2019-03-22,N/A,王双亮,"5,000(万)","环保科技的技术开发、技术咨询;预包装食品、木材、煤炭、钢材、建材、纺织品、家具、五金交电、塑料制品、纸制品、电子产品、像胶制品、机械制品、饲料、化工产品（不含易燃易爆易污染易制毒危险化学品）、汽车配件、金属材料、矿产品、润滑油、日用百货、机械设备的销售;自营和代理一般商品及技术的进出口业务;商务信息咨询",广西,北海,"北海市工业园区北海大道东延线199号中国电子北部湾信息港08-1-B塔楼三层16室"
北海华辰建设工程有限公司,91450512MA5NNRG24C,2019-03-22,有限责任公司,欧敏,"200(万)","土木工程、土建工程、土石方工程、园林绿化工程、市政道路工程、室内外装饰设计与施工（以上项目凭资质证经营）；工程设备租赁服务；建筑材料",广西,北海,"广西北海市铁山港区林浆纸一体化项目搬迁回建小区B101号"
