南宁市点即达商贸有限责任公司,91450107MA5NMW1C93,2019-03-07,有限责任公司,韦掇,"10万元人民币","在互联网上及实体店销售:食品(凭许可证在有效期内经营,具体项目以审批部门批准的为准)、农副土特产品(仅限初级农产品)、服装、鞋帽、针纺织品、日用百货、化妆品、护肤品、工艺品、床上用品;商务信息咨询、企业管理咨询(以上两项除国家有专项规定外);食品、农副产品、床上用品生产(以上三项仅限分支机构)。",广西,南宁,"南宁市西乡塘区秀安路1-3号棕榈湾20号楼二单元2005号-1号房"
南宁市梦之星足球俱乐部有限公司,91450102MA5NMUKD25,2019-03-07,有限责任公司,张平,"50万元人民币","足球体育赛事活动策划,教育信息咨询,设计、制作、代理、发布国内各类广告,对体育文化业的投资,文化艺术交流活动策划,企业形象策划,会议会展服务,影视节目策划;销售:食品(具体项目以审批部门批准的为准)、农副土特产品(仅限初级农产品)、日用百货、五金交电、教学设备与器材、儿童玩具、服装、鞋、帽、体育用品及器材、办公...",广西,南宁,"南宁市兴宁区望州路302号岭南名居8号楼1单元302号"
兴安县召麒物流有限公司,91450325MA5NMU8T78,2019-03-07,有限责任公司,彭琳,"50万元人民币","普通货物道路运输;国内货物运输代理;货物运输信息咨询、仓储服务;家电、监控器材安装、维修服务;家电及配件、监控器材销售。",广西,桂林,"兴安县兴安镇秦皇E区22栋后1号"
东兴市鸿缘国际旅行社有限公司北仑大道第三经营部,91450681MA5NMU4X4X,2019-03-07,有限责任公司,陈强,"N/A","招徕旅游者、旅游信息咨询服务。",广西,防城港,"东兴市北仑大道84号"
北海华越水产养殖有限公司,91450502MA5NMT3U00,2019-03-07,有限责任公司,王华,"100(万)","水产养殖，水产品收购及销售。",广西,北海,"北海市广东路以东、铁路以北龙凤新居1幢3单元1001号房"
南宁亘享科技有限公司,91450103MA5NMTKJ97,2019-03-07,有限责任公司,林忠伟,"50(万)","网络科技、电子科技的技术开发、技术咨询、技术服务、技术转让；计算机系统集成；软件开发；网页设计、电脑平面设计（以上两项具体项目以审批部门批准的为准）；设计、制作、代理、发布国内各类广告；包装设计；室内外装修装饰设计；批发兼零售：计算机软硬件、电子产品",广西,南宁,"南宁市青秀区东葛路118号南宁青秀万达广场西2栋1306号"
北流市万裤都贸易有限公司,91450981MA5NMU391R,2019-03-07,有限责任公司,任冬萍,"200(万)","服装、鞋、帽、皮具制品、宠物用品、工艺品（象牙制品除外）、日常用品、针纺织品、化妆品、灯饰、办公用品、文化用品、床上用品、电子产品、有色金属及其制品、钢材、机电产品、汽车及配件、五金交电、家用电器的批发与零售及互联网销售；蔬菜、水果、食品、农副产品、粮油、水产品、肉、禽、农副土特产品、饲料的收购、零售、批发及配送服务；预包装食品、乳制品",广西,玉林,"北流镇城南二路精通住宅四区35号楼A号"
南宁市惠红保洁服务有限公司,91450105MA5NMU2U7X,2019-03-07,有限责任公司,杨芝红,"50(万)","清洁服务（除高空作业）、家政服务、物业管理（凭资质证经营）、病虫害防治服务（除国家有专项规定外）；生活垃圾清运（具体项目以审批部门批准为准，凭有效许可证经营）；河道疏通工程、园林绿化工程（以上两项凭资质证经营）；销售：日用百货、电子产品（除国家专控产品）、机械设备、五金交电、化工产品（除危险化学品）、保洁用品、花卉、商品苗木",广西,南宁,"南宁市江南区白沙大道38-8号A栋16层1615号房"
北海市北上通商贸有限公司,91450502MA5NMU5D7R,2019-03-07,有限责任公司,吴玉兰,"500(万)","家具、家用电器、皮革制品、服装鞋帽、卫生洁具、装饰材料、陶瓷、石材、金属材料、不需许可的医疗器械、电子产品、机电设备、五金交电、日用百货、办公用品、洗涤用品、食品、酒类、果蔬、农副产品、化肥的销售；货物或技术进出口业务；建筑工程、园林绿化工程。",广西,北海,"北海市长青路16号领秀一方2单元2620号"
中航恒天建筑劳务有限公司,91450521MA5NMT4G21,2019-03-07,有限责任公司,刘朋,"15,000(万)","公路工程，铁路工程，机场工程，隧道工程，港口工程，码头工程，市政工程，房屋建筑工程，水利工程，建筑工程劳务分包。",广西,北海,"广西北海市合浦县廉州镇廉州大道西路18号明园公寓十一幢2单元601"
北流市钜鹿农业旅游产业有限公司,91450981MA5NMTFNXT,2019-03-07,有限责任公司,莫彪,"1,000(万)","旅游观光景区开发、建设、经营，文化教育示范，旅游景区园林规划、畜牧业养殖销售及花草树木种植销售，景区内旅游客运及相关配套服务；农作物种植销售及科技开发推广应用服务，旅游住宿及餐饮服务；房地产开发经营。",广西,玉林,"北流市日用陶瓷工业园区"
南宁市汉墨教育咨询有限公司,91450107MA5NMT049N,2019-03-07,有限责任公司,谢志成,"50(万)","教育信息咨询、文化艺术信息咨询、文化艺术交流活动策划",广西,南宁,"南宁市西乡塘区高新大道55号南宁安吉万达广场12栋218号"
南宁卓然机械设备租赁有限责任公司,91450100MA5NMW5P04,2019-03-07,有限责任公司,温贤英,"1,000(万)","工程机械设备、机电设备（凭资质证经营）、仪器设备、建筑模具、小型机具材料及设备、通信设备（除国家专控产品）、汽车的租赁及维修；道路货物运输",广西,南宁,"南宁市科园大道31号财智时代公寓A-1916号"
南宁市武鸣通达速递有限公司太平代理点,91450122MA5NMRWQ7K,2019-03-07,有限责任公司,李景有,"N/A","快件收寄、投递",广西,南宁,"南宁市武鸣区太平镇文溪街42号"
北流市金森源农业有限公司,91450981MA5NMT8P1D,2019-03-07,有限责任公司,李开生,"100(万)","农牧行业的投资；禽畜、水产品养殖、销售；农副产品种植、农产品加工、销售；农用机械、农具、化肥的销售；农牧技术研发、支持；饲料批发、销售。",广西,玉林,"广西北流市清湾镇平旦村红星组4号"
北海科沃农业科技有限公司,91450502MA5NMW0B49,2019-03-07,有限责任公司,李永隆,"100(万)","生物技术开发、水产养殖技术咨询服务；农副土特产品、水产品、家电、五金交电、铝合金门窗、体育用品、建材、钢材、机电产品、化肥、种子、花卉苗木、渔具及渔船配件的批发与零售。海洋捕捞（不含滩涂捕捞），市政工程、园林林绿化工程、建筑工程、室内外装修工程、商务信息咨询、企业管理信息咨询；房地产商品交易居间、代理、行纪",广西,北海,"北海市南珠大道44号东尚领域1幢1115号"
南宁市康川健康管理有限公司,91450103MA5NMU48XW,2019-03-07,有限责任公司,杨雄剑,"10万元人民币","健康信息咨询,医疗设备销售及租赁,健身美容服务,减肥瘦身服务,养生服务与咨询。",广西,南宁,"南宁市青秀区桃源路59号40栋3单元1-6号房"
北海蜜悦荟母婴护理有限公司,91450500MA5NMTYH15,2019-03-07,有限责任公司,李娴,"100万元人民币","对母婴提供护理服务,家政服务,住宿服务,母婴用品、预包装食品、保健品的批发及零售。",广西,北海,"北海市南京路92号昕景华庭6幢三楼301号"
北海万桶酒店管理有限公司,91450500MA5NMU0174,2019-03-07,有限责任公司,龚圳军,"100(万)","酒店管理，餐饮管理，票务服务，物业管理，会议会展服务，市场营销策划服务，自有场地租赁，商务信息咨询服务，日用百货的销售。",广西,北海,"北海市冠岭路86号嘉和冠山海东区爱丁堡10幢1707号"
南宁市豆绿服饰有限公司,91450100MA5NMTKY1F,2019-03-07,有限责任公司,孙彩云,"50万元人民币","销售:服饰、服装及辅料、床上用品、针纺织品、窗帘、鞋帽、皮革制品、箱包、化妆品、工艺礼品、旅游用品、办公用品、卫生洁具、五金交电、建筑材料(除危险化学品)、珠宝首饰、日用百货、文具用品、体育用品、母婴用品、食品(凭许可证在有效期内经营,具体项目以审批部门批准的为准);网上贸易代理(除国家有专项规定外)。",广西,南宁,"南宁市大学东路162号东盟财经广场2号楼412号"
上思县百石牙自来水管理有限公司,91450621MA5NN2KX5C,2019-03-07,有限责任公司,杨金鑫,"20万元人民币","自来水供应;自来水管道设施施工、维护;管道配件销售。",广西,防城港,"防城港市上思县思阳镇环城东路14号旧公安局第八间门面"
南宁市腾迅机动车驾驶员培训有限公司,91450100MA5NMU463Y,2019-03-07,有限责任公司,邓武,"20(万)","机动车驾驶员培训服务（具体项目以审批部门批准的为准）；驾驶员信息咨询；汽车销售及租赁；机动车登记代理；保险兼业代理",广西,南宁,"南宁市江南区五一西路105号伟康市场内"
南宁市盈谦财务管理有限公司,91450107MA5NMUGHX4,2019-03-07,有限责任公司,程开明,"100(万)","代理记账、资产评估（以上项目凭许可证在有效期内经营，具体项目以审批部门批准的为准）；企业登记代理（除国家有专项规定外）；销售：汽车配件、家用电器、珠宝首饰、矿产品（除国家专控产品）、煤炭、五金交电、日用百货、服装鞋帽、纺织品、工艺品（象牙及其制品除外）、陶瓷制品、办公用品、办公耗材、劳保用品、玻璃制品、皮革制品、纸制品、农副产品（仅限初级农产品）、建筑装饰材料（除危险化学品）、钢材、机械设备及配件、金属材料、电子产品（以上两项除国家专控产品）、塑料制品",广西,南宁,"南宁市西乡塘区高新大道55号南宁安吉万达广场5栋907号"
南宁市奔捷汽车维修有限公司,91450100MA5NMRY66D,2019-03-07,有限责任公司,周秀美,"20(万)","汽车维修服务。",广西,南宁,"南宁市秀厢大道69号恒安新城一号楼一层27、28、29、30、31号房屋"
北流市成诚机制炭有限公司,91450981MA5NMTHJX2,2019-03-07,有限责任公司,李泽彬,"10万元人民币","机制炭生产、销售,农作物桔梗、木糠、木材废料回收。",广西,玉林,"北流市民安镇十字铺第八水泥厂厂区内"
南宁市莱强商贸有限公司,91450100MA5NMT0D25,2019-03-07,有限责任公司,吕志军,"10(万)","销售：封边条、五金交电、五金配件、纸箱、建筑装饰材料（除危险化学品外）、办公用品、家具",广西,南宁,"南宁市西乡塘区永宁村里坡11队13号"
中城投集团西南建筑工程有限公司南宁分公司,91450103MA5NMT487H,2019-03-07,有限责任公司,鲍国平,"N/A","接受总公司委托在总公司经营范围内联系业务",广西,南宁,"南宁市青秀区金湖路63号金源·现代城940号"
南宁市歪歪兔教育咨询有限公司,91450103MA5NN02PXM,2019-03-07,有限责任公司,朱桦,"100万元人民币","教育信息咨询,设计、制作、代理、发布国内各类广告;市场调查,软件开发,从事货物和技术的进出口业务(国家禁止或涉及行政审批的货物和技术进出口除外);组织文化艺术交流活动,展览展示服务;销售:日用百货、服饰、金属材料(除危险化学品)、玩具、计算机软硬件及辅助设备、电子产品(除国家专控产品);旅游信息咨询,软件设计,企业...",广西,南宁,"南宁市青秀区吉祥路5号城光俊景B125号商铺"
北海桦润建材有限公司,91450521MA5NMTWG03,2019-03-07,有限责任公司,黄兰英,"50(万)","建筑工程劳务分包，建筑材料、沙石的销售，河道采砂，装卸搬运服务。",广西,北海,"广西北海市合浦县廉州大道西侧第一排187号"
南宁市椿记餐饮有限公司,91450103MA5NMU5F39,2019-03-07,N/A,秦长春,"10(万)","餐饮服务，食品，卷烟、雪茄烟、罚没烟草制品零售",广西,南宁,"南宁市青秀区东葛路100号盈地大厦第一层A1003-A1004、第三层"
中地寅岗建设集团有限公司平南分公司,91450821MA5NMULC08,2019-03-07,有限责任公司,刘助安,"N/A","房屋建筑,市政公用、机电安装、水利水电、地基与基础、土石方、建筑装饰装修、城市及道路照明、电力、公路、通信、钢结构、化工石油、工程勘察专业类、地质灾害治理、电子与智能化、消防设施、防水防腐保温、公路交通工程、矿山、环保工程施工;变压器及高低压线路维护,房屋租赁、钢制作;机械设备的销售;...",广西,贵港,"平南县平南街道二环路瑞发办公写字楼509号"
东兰隘洞莫顺木材加工厂,92451224MA5NMU8A1T,2019-03-07,个体工商户,莫顺,"N/A","木材加工",广西,河池,"东兰隘洞苗圃开发区"
北海金穗养老服务有限公司,91450500MA5NN19R3F,2019-03-07,有限责任公司,魏淑,"1,000(万)","养老服务，房地产中介服务，餐饮服务，营养健康咨询，食品、日用百货的销售。",广西,北海,"北海市南京路8号恒立蓝海名都花园1幢1单元0901号"
北流市大中商贸有限公司,91450981MA5NMTL50U,2019-03-07,有限责任公司,顾风云,"100万元人民币","百货、五金、农产品、销售。",广西,玉林,"北流市园林路26号"
南宁市庭祥商贸有限公司,91450107MA5NMRP77Y,2019-03-07,有限责任公司,张作,"10(万)","销售：数码产品（除国家专控产品）、日用百货、服装鞋帽、工艺品（除象牙及其制品）、计算机设备及耗材、农副土特产品（仅限初级产品）、文体用品、家用电器、通信设备、照明设备、家居用品、五金交电、安防设备（除国家专控产品）、助力自行车及配件、珠宝玉器、金银制品（除国家专控产品）；电子产品（除国家专控产品）及零配件的维修与服务；物业服务；展示展览服务、文化艺术交流活动策划、企业形象策划、票务代理（以上项目除国家有专项规定外）；房屋租赁；计算机软件开发及技术转让、技术服务、技术咨询；网站开发；设计、制作、代理、发布国内各类广告；家用电器维修；自营和代理一般经营项目商品和技术的进出口业务，许可经营项目商品和技术的进出口业务须取得国家专项审批后方可经营",广西,南宁,"南宁市西乡塘区石埠路154号提取车间1楼5号"
东风标致雪铁龙融资租赁有限公司南宁分公司,91450100MA5NMW6U8N,2019-03-07,分公司,丁国祥,"N/A","汽车融资租赁服务;租赁汽车的残值处理及维修;租赁交易咨询和担保(除融资性担保);汽车租赁;汽车信息咨询;交通信息咨询服务及车辆租赁的配套服务;商务咨询;企业管理咨询。",广西,南宁,"南宁市江南区白沙大道31号2#楼4-8轴、5#楼4-7轴一楼"
北流市大中投资有限公司,91450981MA5NMTDY7K,2019-03-07,有限责任公司,顾风云,"200(万)","对商业、农业、房地产的投资，房地产开发、经营。",广西,玉林,"北流市塘岸镇长塘村禾仓九组"
南宁市家佳享家庭服务有限公司,91450103MA5NMP0N37,2019-03-07,有限责任公司,段继龙,"100万元人民币","家庭服务,保洁服务,清洁服务,会议服务,老年人养护服务(具体项目以审批部门批准的为准),环境监测,销售:日用百货。",广西,南宁,"南宁市青秀区民族大道170号莱茵湖畔C组团地下室B2011号"
南宁市亭鹏医药科技有限公司,91450107MA5NMU076P,2019-03-07,有限责任公司,杨金莹,"50(万)","医药、生物科技、计算机软硬件的技术开发、技术咨询、技术转让、技术推广服务；计算机系统集成；商务信息咨询、会展服务、市场营销策划、企业形象设计、公关活动策划、品牌策划、货物包装服务（以上项目除国家有专项规定外）；销售：日用百货、计算机软硬件、办公用品及耗材、安防监控设备、电子产品",广西,南宁,"南宁市西乡塘区明秀东路145号明秀小区18栋302号房"
三江县锦秀服装加工厂,91450226MA5NMUU93F,2019-03-07,个人独资企业,曹玉秀,"N/A","纺织服装、服饰活动；机织服装制造；服饰制造；皮革服装制造。",广西,柳州,"三江县古宜镇西尤村龙吉屯油榨冲7号之二"
北海涌源房地产营销策划有限公司,91450500MA5NNJNB0C,2019-03-08,N/A,罗仁朗,"10(万)","房地产中介服务，房地产营销策划，房地产信息咨询，自有房屋租赁，对房地产、旅游、酒店项目的投资，房地产开发、经营，建筑装修装饰工程，设计、制作、发布、代理国内各类广告",广西,北海,"北海市新世纪大道38号怡康春城3幢一单元1801号"
南宁启飞商贸有限责任公司,91450107MA5NMWKNXH,2019-03-08,有限责任公司,王昌足,"10(万)","销售：照明灯具、建筑装饰材料（除危险化学品）、家居装饰品、家用电器、日用百货、文具用品、文化用品、食品（凭许可证在有效期内经营，具体项目以审批部门批准的为准）、水果、蔬菜、家禽、蛋品、水产品、茶叶、服装鞋帽、化妆品、卫生用品（除药品及危险化学品）、厨房用品、卫浴产品、手机配件、农副土特产品（仅限初级农产品）、电子产品（除国家专控产品）、二类医疗器械；企业管理信息咨询、供应链管理服务（以上项目除国家有专项规定外）；道路货物运输",广西,南宁,"南宁市西乡塘区明秀西路118号百汇华庭2栋1单元1502室"
北海市房通房地产营销策划有限公司,91450500MA5NMW9F4K,2019-03-08,有限责任公司,聂小凤,"50(万)","房地产营销策划，房地产中介服务，房地产经纪服务，房地产居间代理服务，房地产商品信息咨询服务，室内外装饰设计，设计、制作、代理、发布国内各类广告。",广西,北海,"北海市广东路南路213号同和水岸香堤小区45幢207、208、209号商铺"
东兴市德晟贸易有限公司,91450681MA5NMWWN6C,2019-03-08,有限责任公司,刘德臣,"200(万)","网上销售：水果、农副产品（仅限初级农副产品）、食品；水果、农副产品",广西,防城港,"东兴市解放东路74号"
南宁二米半服饰有限公司,91450102MA5NMWJ80B,2019-03-08,有限责任公司,唐建军,"50(万)","服装设计、生产、加工及销售；企业管理信息咨询，企业形象策划，会议会展服务，婚庆礼仪服务，文化艺术交流活动策划，设计、制作、代理、发布国内各类广告；销售：计算机软硬件及辅助设备、日用百货、办公用品。",广西,南宁,"南宁市兴宁区东州路2号中海雍翠峰4号楼2单元2702号"
北流市嘉浴馨商贸有限公司,91450981MA5NMX0M76,2019-03-08,有限责任公司,肖素素,"100万元人民币","卫浴、五金交电、日用百货、汽配、建筑机械、瓷器、灯饰销售;建筑机械租赁服务,建筑机械维修、安装服务;自营或代理货物进出口业务。",广西,玉林,"北流市北流镇清湖路(原氮肥厂)北流市亿联商贸城有限公司B6幢112号"
南宁哈伽新材料科技有限公司,91450107MA5NMXBN51,2019-03-08,有限责任公司,王纯群,"630(万)","新材料、食品的技术开发、技术转让、技术咨询服务，研发、销售：食品、食品添加剂（以上两项凭许可证在有效期内经营，具体项目以审批部门批准的为准）、日用百货、包装材料、塑料制品（除一次性发泡塑料及超薄塑料袋）、玻璃制品、机电产品及配件、模具、工艺品（除象牙及其制品）、针纺织品、化工产品（除危险化品），包装服务，企业营销策划，货物或技术的进出口",广西,南宁,"南宁市西乡塘区明秀西路111号正恒国际广场8号楼1807号"
北流市金强宠物食品有限公司,91450981MA5NMX7P6W,2019-03-08,有限责任公司,杨平,"100(万)","宠物食品用品销售。",广西,玉林,"广西北流市桂塘路四区136号"
全州县灵峰建筑材料有限公司,91450324MA5NMX6F8L,2019-03-08,有限责任公司,宋灵敏,"300(万)","钢材、水泥等建筑材料销售；预拌混凝土销售；预拌沥青混凝土销售；建筑装饰材料、机械设备及配件、五金交电销售；建筑工程机械与设备租赁及工程服务；普通货物道路运输。",广西,桂林,"全州县全州镇桂黄北路锦绣家园第3幢第1层6号"
北海云泰沧合贸易有限公司,91450500MA5NMXKT1M,2019-03-08,有限责任公司,叶科,"50(万)","食品、酒类、农副产品、工艺品、针纺织品、酒店用品、卫生洁具、水产品、服装鞋帽、箱包、体育用品、日用百货、生活用品、化妆品、办公用品、塑料制品、五金交电、仪器仪表、电子产品及配件、包装材料、金属材料的销售。",广西,北海,"北海市北京路43号祥和大厦509号"
北海津铜千钰汽车租赁有限责任公司,91450503MA5NMXHU0K,2019-03-08,有限责任公司,翟梓园,"100(万)","汽车、电动车、自行车租赁服务，旅游信息咨询服务，酒店、机票、火车票、船票、汽车票、景点门票代订业务*",广西,北海,"北海市广东路以西、浙江路以南越亚银滩城天赐良园3幢1单元23层2302号"
北海静宿时光装饰装修有限公司,91450500MA5NMXAW2P,2019-03-08,有限责任公司,孙振钢,"10万元人民币","建筑装修装饰工程,建筑装饰设计,商务信息咨询,网络工程,建筑工程,土石方工程,园林绿化工程,水电安装,灯具、家具、木制品、电线电缆、五金交电、机电设备、金属材料、建筑材料、装饰材料的销售。",广西,北海,"北海市北海银滩恒利旅游度假中心前三区18型11号别墅"
北海鑫多多贸易有限公司,91450500MA5NMWEP8L,2019-03-08,有限责任公司,朱觉亮,"168(万)","医疗器械,监测仪器设备、实验室设备、教学仪器设备、环保设备、办公设备及耗材、机电设备、消防设备、化工产品、药品、汽车、康复训练设备、体育健身器材、建筑装修材料、钢材、电梯, 空调、酒店用品、劳保用品、食品的批发、零售,水产品、洗涤用品的加工、销售,医疗设备租赁和维修服务,信息技术咨询服务, 软件销售及维护,商务代理服务,市场调查,设计、制作、 代理发布国内各类广告。",广西,北海,"北海市四川路31号之10防疫站办公室一楼培训室"
兴安县友利废旧物资回收有限公司,91450325MA5NMW9M1D,2019-03-08,有限责任公司,邹玉群,"3(万)","废旧物资回收、销售；非金属废料加工处理、销售。",广西,桂林,"兴安县溶江镇革命街95号"
佛吉亚(柳州)排气控制技术有限公司,91450200MA5NMTY882,2019-03-08,N/A,韦明凤,"12,000(万元人民币)","汽车排气控制系统及其零部件的开发、制造、销售、售后服务和技术咨询；技术、货物进出口业务",广西,柳州,"柳州市鱼峰区车园横二路20号"
兴安县桂北红色文化教育培训中心有限公司,91450325MA5NMWBX4A,2019-03-08,有限责任公司,宿小艳,"10万元人民币","红军长征历史文化教育、党性教育;会务服务;土特产销售。",广西,桂林,"兴安县兴安镇志玲路142号"
北流市森盛炭业有限公司,91450981MA5NMW5N43,2019-03-08,有限责任公司,梁万光,"300万元人民币","木炭、环保炭加工、销售,生产性废旧物品及生活性废旧物品回收、销售(危险废物、医疗废物、报废汽车除外)。",广西,玉林,"北流市新荣镇长岗岭工业区"
上思县明江清流文化传媒有限公司,91450621MA5NMWTRXE,2019-03-08,有限责任公司,黄运良,"100(万)","文艺创作与表演；乐器、文体用品及器材销售；舞蹈艺术活动、音乐艺术活动策划。",广西,防城港,"广西上思县环城东路"
北海宇东轩餐饮有限公司,91450502MA5NMWC27D,2019-03-08,有限责任公司,吴森,"8.8万元人民币","餐饮服务;农产品批发零售;对餐饮业的投资;设计、制作、代理、发布国内各类广告(具体项目以审批部门批准为准)。",广西,北海,"北海市云南南路99号北海花园1号楼6号商铺"
北海兆飞水产有限公司,91450502MA5NMW4P4C,2019-03-08,有限责任公司,李明权,"50(万)","水产品、农副产品的收购、初加工、销售",广西,北海,"北海市地角下寮661号（地角鲜活海产批发市场内）"
