东兴市淘京进出口贸易有限公司,91450681MA5NLRCK5X,2019-01-31,有限责任公司,钟康美,"500(万)","货物或技术进出口（国家禁止或涉及行政审批的货物和技术进出口除外）；食品、水果、农副产品（仅限初级农副产品）、原生中草药、水产品（不含国家明令禁止经营项目）、日用百货、日用化工产品（除危险化学品外）、针纺织品、服装、鞋帽、工艺品（文物除外）、家具、电子产品（除国家禁止或限定产品外）、机电设备、矿产品（除国家专营专控产品外）、金属材料（除放射性金属、贵重金属外）、橡胶及其制品、五金交电、建筑材料(除危险品、木材外）、装饰材料、工程机械设备、汽车零配件、农用机械设备的销售；坚果加工及销售；国内普通货物运输代理服务；装卸服务；仓储服务",广西,防城港,"东兴市东兴镇解放路199-8号"
南丹县天城富林建设工程有限责任公司,91451221MA5NLNYY91,2019-01-31,有限责任公司,杨彩艳,"6,666(万)","矿山工程、矿山井巷工程、机电安装工程、市政公用工程、钢结构工程、房屋建筑工程、地基基础工程、市政工程、园林绿化工程、室内外装潢工程、路桥隧道工程、土石方工程、房屋拆除工程宗承包（凭资质证有效期限经营），物业管理、工程机械租赁、爆破技术咨询、矿山工程信息咨询服务，安全警示牌、化学试剂（除危险化学品外）、商品混凝土、建材（不含木材）销售，有色金属矿产品",广西,河池,"南丹县大厂镇巴里社社区巴里路江浙小区2号"
南宁市鑫帅建设监理有限责任公司第六分公司,91450103MA5NLECQ97,2019-01-31,有限责任公司,莫品源,"N/A","凭总公司资质联系业务。",广西,南宁,"南宁市青秀区凤翔路16号紫金苑小区伴云居A组团B3栋1203号"
全州湘江科技有限责任公司,91450324MA5NLRDE24,2019-01-31,有限责任公司,陈禹龙,"180(万)","电脑及配件销售、维修服务；计算机软件开发、销售；办公用品、日用百货、服装、鞋帽、五金交电、电线电缆、家居用品、工艺品、监控设备、音响设备、通讯设备、电子产品、家用电器销售；LED显示屏、广播系统、停车道闸系统、亮华照明系统的设计、制作、安装；国内各类广告设计、制作；园林绿化工程、建筑装饰工程。",广西,桂林,"全州县全州镇北门社区第五居民小组安置地"
南宁市腾阁投资有限公司,91450102MA5NLR5C5P,2019-01-31,有限责任公司,韦爱云,"50(万)","对建筑业、交通业、能源业、农业、环保业、科技业、畜牧业、互联网业、餐饮业、酒店业、旅游业、房地产业的投资；房屋建筑工程(凭有效资质证经营)，水利水电工程(凭有效资质证经营)，电力工程(凭有效资质证经营)，市政共用工程(凭有效资质证经营)，机电设备安装工程(凭有效资质证经营)，建筑劳务分包(凭有效资质证经营)，地基基础工程(凭有效资质证经营)，环保工程(凭有效资质证经营)，钢结构工程(凭有效资质证经营)，城市及道路照明工程(凭有效资质证经营)，建筑装修装饰工程(凭有效资质证经营)，消防设施工程(凭有效资质证经营)，建筑幕墙工程(凭有效资质证经营)，桥梁工程(凭有效资质证经营)，隧道工程(凭有效资质证经营)，公路工程(凭有效资质证经营)，公路路面工程(凭有效资质证经营)，公路路基工程(凭有效资质证经营)；设计、制作、代理、发布国内各类广告，企业登记代理服务，企业管理信息咨询服务。",广西,南宁,"南宁市兴宁区玉蟾路6号金源城金源悦峯16号楼1单元1305号"
广西东兴市壮美实业有限公司,91450681MA5NLR5QXM,2019-01-31,有限责任公司,朱荣荣,"5,000(万)","对互联网技术、化工业、农业技术项目、生物技术、畜牧业、林业、环保业、旅游业、酒店业的开发投资；贸易信息咨询；互联网信息技术咨询服务；计算机网络系统集成；APP开发；为网络商品交易提供第三方平台；企业管理及咨询；网站建设（不含互联网信息服务增值电信业务）、网站优化；计算机软硬件技术研发及技术转让；物流信息咨询服务；广告制作、发布服务；食品、水果、农副产品（仅限初级农副产品）、原生中草药、水产品（不含国家明令禁止经营项目）、日用百货、化工产品、针纺织品、服装、鞋帽、工艺品（文物除外）、家具、电子产品（除国家禁止或限定产品外）、机电设备、矿产品（除国家专营专控产品外）、金属材料（除放射性金属、贵重金属外）、橡胶及其制品、五金交电、建筑材料(除危险品、木材外）、装饰材料、工程机械设备、汽车零配件、农用机械设备的销售；国内普通货物运输代理服务；装卸服务；仓储服务（危险品除外）；货物或技术进出口",广西,防城港,"东兴市民族路(北园C片03-2#地块)锦绣华庭4栋3-901房号。"
广西万展投资有限公司,91450500MA5NLQT90W,2019-01-31,有限责任公司,解添,"200(万)","对房地产、旅游、酒店、餐饮项目的投资，房地产信息咨询、商务信息咨询、企业管理咨询,房地产营销策划、企业营销策划、企业形象策划，房地产中介服务，展览展示服务，市场营销策划及推广，设计、制作、发布、代理国内各类广告",广西,北海,"北海市北京路东侧、西南大道北侧交汇处海尚芭黎2729号二室"
平南县平山镇袁玉荣养殖场,92450821MA5NLRGB7W,2019-01-31,个体工商户,袁玉荣,"N/A","生猪、鸡养殖销售。",广西,贵港,"平南县平山镇瀚冲村红旗屯石头冲"
平南县亚乃汽车贸易有限公司,91450821MA5NLRD402,2019-01-31,有限责任公司,凌锋,"50(万)","汽车旧车、汽车配件销售；汽车修理与维护服务；汽车租赁；汽车信息咨询服务。",广西,贵港,"平南县大坡镇直道村如二队"
幸福高地健康科技有限公司,91450100MA5NLQYH80,2019-01-31,有限责任公司,陈玲,"5,000(万)","健康科技领域内的技术开发、技术咨询、技术服务；医疗的技术开发、技术推广；保健用品的研发及销售；营利性医疗服务（具体项目以审批部门批准的为准），保健按摩服务（具体项目以审批部门批准的为准）；老年人养护服务（具体项目以审批部门批准的为准）；健康管理信息咨询，美容信息咨询，医药信息咨询，商务信息咨询（除国家有专项规定外）；销售：医疗器械（涉及许可的，具体项目以审批部门批准的为准）、食品（具体项目以审批部门批准的为准）、保健用品、日用百货、农副土特产品、化妆品、保健用品、美容仪器设备、数码产品（除国家专控产品）、电子产品（除国家专控产品）、卫生用品、网络设备（除国家专控产品）；货物及技术进出口",广西,南宁,"南宁市青秀区民族大道182号金旺角国际大酒店主楼三楼340号"
北部湾集团实业发展股份有限公司,91450100MA5NLQW14P,2019-01-31,股份有限公司,刘尚清,"10,000(万)","对工业、农业、林业、矿业、交通业、能源业、高新技术产业、房地产业、建筑业、教育业、养老产业、餐饮业、酒店业、公墓的投资；农业技术研发、技术服务、技术咨询、技术转让；企业营销策划、文化交流活动策划；商品信息咨询；电子商务平台、供应链管理商务平台设计与开发；供应链管理；房地产交易代理；房地产营销策划；物业服务；房屋租赁；设计、制作、代理、发布国内各类广告；企业信用评估及咨询服务；会议会展服务；销售：矿产品（除国家专控产品）、农副土特产品、钢材、水泥、饲料、环保设备、农机设备、不再分包装的种子、化肥、海产品的销售；进出口贸易（国家禁止或涉及行政审批的货物和技术进出口除外）；房地产开发、建筑工程施工、施工劳务（以上项目凭资质证经营）；食品的加工与销售、畜牧养殖",广西,南宁,"南宁市青秀区东葛路163号绿地中央广场B3号楼五层506号"
南宁市五行养络健康管理有限公司,91450107MA5NLRDJ3D,2019-01-31,有限责任公司,李文佳,"50(万)","健康管理信息咨询，教育信息咨询；生活美容服务，保健按摩服务，室内休闲健身服务",广西,南宁,"南宁市西乡塘区龙胜街2栋2单元101号"
东兴市浩阳新能源有限公司,91450681MA5NLQFQ0D,2019-01-31,有限责任公司,蒋琼,"100(万)","新能源发电站的开发、建设、运营；新能源电力的生产和技术服务；机电设备销售；售电业务；房地产开发、农业观光旅游开发、旅游产品生产加工、餐饮管理服务、停车场经营服务；酒店管理服务、住宿服务。",广西,防城港,"东兴市兴东路390号"
南宁隽茂教育信息咨询有限公司,91450103MA5NLRE8XF,2019-01-31,有限责任公司,黄欢,"50(万)","教育信息咨询，企业管理信息咨询，经济信息咨询；自主研发产品及教育用品、儿童用品、文教用品、玩具的销售，服装，运动器材，图书，益智工具，办公用品，母婴用品的销售。",广西,南宁,"南宁市青秀区中山路66号"
南宁市新弘伟通讯设备有限公司大塘分公司,91450108MA5NLR1L3R,2019-01-31,有限责任公司,黄兰英,"N/A","批发零售：通讯设备、手机配件、家用电器、数码产品；房屋租赁；接受委托代办指定的中国移动通信业务。",广西,南宁,"南宁市良庆区大塘镇民族街130号"
南宁市众劲保洁服务有限责任公司,91450108MA5NLQNF1E,2019-01-31,有限责任公司,张建佳,"200(万)","保洁服务，物业管理、物业服务；从事生活垃圾经营性清扫、收集、运输、处理（具体项目以审批部门批准的为准）；害虫防治服务；再生资源回收（不含固体废物、危险废物、报废汽车等需经相关部门批准的项目）；园林绿化养护（凭资质证开展经营）；盆景、花卉租赁；室内外装饰装修工程、防水补漏工程（以上具体项目凭资质证经营）；销售：清洁用品、杀虫剂",广西,南宁,"南宁市良庆区大明路44号二楼"
兴业桂信水环境有限公司,91450924MA5NLP7Y23,2019-01-31,有限责任公司,孙舒祺,"5,059.9380(万)","水环境治理、供水水源净化、水污染治理、承接环保工程、生态治理工程，废气综合处理，废水综合处理，固体废弃物综合处理（以上项目凭资质登记经营），工程环保技术的技术开发、技术服务、技术转让及技术咨询；批发、零售：环保设备、气体处理设备、污水处理设备、固体废弃物处理设备、净水设备；货物或技术进出口（国家禁止或涉及行政审批的货物和技术进出口除外）**",广西,玉林,"兴业县玉贵路218号"
南宁市奕晨进出口贸易有限公司,91450100MA5NLR3E9X,2019-01-31,有限责任公司,蒙思瑾,"100(万)","销售及网上销售：日用百货、保健用品、食品（凭许可证在有效期内经营，具体项目以审批部门批准的为准）、母婴用品、办公用品、通迅器材（无线电发射及地面卫星接收系统除外）、文体用品、化妆品、护肤品、钟表、箱包、皮具、服装鞋帽、电子产品（除国家专控产品）、水产品、汽车及汽车零配件；品牌推广及企业管理服务；自营和代理一般经营项目商品和技术的进出口业务",广西,南宁,"南宁市杜鹃路8号南宁综合保税出口加工产业园D2栋厂房五层5-02号（南宁综合保税区）"
平南县平山镇兆壬养殖场,92450821MA5NLRGA92,2019-01-31,个体工商户,宾兆壬,"N/A","生猪、鸡养殖销售。",广西,贵港,"平南县平山镇瀚冲村新村屯老竹岭嘴"
南宁市青墨苑文化传播有限公司,91450102MA5NLR9N09,2019-01-31,有限责任公司,邓樱英,"50(万)","平面设计，设计、制作、代理、发布国内各类广告；动画、漫画设计，动漫文化活动策划，教育信息咨询，舞台美术设计策划，展览展示服务，婚庆服务，摄影摄像服务，产品外观设计服务，企业形象设计，图文设计制作，网页设计制作",广西,南宁,"南宁市兴宁区昆仑大道5号大嘉汇东城6号楼306号"
全州鼎鑫投资有限公司,91450324MA5NLRF27J,2019-01-31,有限责任公司,邓灵杰,"50(万)","对房地产的投资；室内外装修装饰；园林绿化工程；土石方工程服务；市政工程及道路硬化；水电安装；监控安装；建筑工程劳务分包；普通货运；装修装饰材料、建筑材料销售；水利建筑工程项目的投资；对文化建设项目的投资；对农业、种植业、畜牧业的项目投资；对旅游休闲观光服务的投资。",广西,桂林,"全州县全州镇桂黄北路玉龙新都花园27栋1号"
南宁市亿晟莱商贸有限公司,91450100MA5NLR0L7W,2019-01-31,有限责任公司,魏巍,"500(万)","批发、零售：汽车配件、机电产品、日用百货、润滑油、机械设备及配件、仪器仪表、五金机电、钢材、劳保用品、玻璃制品、橡胶制品、塑料制品、电力设备、消防器械、园艺产品。",广西,南宁,"南宁市滨河路28号中国-东盟企业总部基地三期综合楼南宁广告产业园大楼A座25层2509室"
北海平安国际旅行社有限公司北部湾东路第二营业部,91450502MA5NLQU2X2,2019-01-31,有限责任公司,王黎明,"N/A","受公司委托联系相关业务。",广西,北海,"北海市北部湾东路60号欧情海景园27幢2单元102号"
崇左市波斯顿建筑工程设备租赁有限公司,91451400MA5NLQQP2D,2019-01-31,有限责任公司,旷娟,"500(万)","建筑材料销售",广西,崇左,"广西崇左市工业新区濑湍镇全凤村加领屯东南面"
平南县平山镇陈婧乾养殖场,92450821MA5NLRFN9Q,2019-01-31,个体工商户,陈婧乾,"N/A","生猪、鸡养殖销售。",广西,贵港,"平南县平山镇登明村白二屯大平岭"
南宁市永源水泥制品有限公司,91450100MA5NLQU621,2019-01-31,有限责任公司,苏永归,"500(万)","生产（限分支机构经营）和销售：水泥制品；石材的加工（限分支机构经营）、销售；建筑装饰材料的销售（除危险化学品）；货物或技术进出口",广西,南宁,"南宁市南站大道65号"
合浦县常乐镇张丽木材加工厂,92450521MA5NLQXN0M,2019-01-31,个体工商户,张丽,"N/A","木材锯木加工",广西,北海,"合浦县常乐镇火星村委会大平坡209国道旁直行200米"
岑溪市星贝艺术培训学校有限公司,91450481MA5NLRAK2Y,2019-01-31,有限责任公司,谢婷,"5(万)","舞蹈、美术培训",广西,梧州,"岑溪市东宁路诚信小区旁（甘日兰屋）二楼"
兴业县葵阳镇彭青先养殖场,92450924MA5NLQJ11L,2019-01-31,个体工商户,彭青先,"N/A","养殖、销售：肉鸡*",广西,玉林,"兴业县葵阳镇泉江村等天琅岭"
三江县覃仁保茶叶加工厂,92450226MA5NLQXF5N,2019-01-31,个体工商户,覃仁保,"N/A","茶叶加工及销售。",广西,柳州,"三江县同乐乡岑甲村蓬叶屯"
容县鸿基投资有限公司,91450921MA5NLQP60T,2019-01-31,有限责任公司,卢凤强,"100万元人民币","对农业、林业、牧业、渔业、制造业、建筑业、房地产、市场、能源业、环保业、矿产业、旅游业、教育业、酒店业、文化娱乐业、餐饮业项目的投资;房地产、市场开发、经营;房屋、场地租赁服务;建筑装饰工程、园林景观工程、钢结构工程、水电安装工程设计、施工;汽车、服装、鞋帽、箱包、日用百货、食品、电气设备、建筑材料、...",广西,玉林,"容县容州镇侨乡大道100号"
北海市君有益贸易有限公司,91450500MA5NLRJKXT,2019-01-31,有限责任公司,赖小梅,"100(万)","日用百货、服装鞋帽、箱包、工艺品、床上用品、电子产品",广西,北海,"北海市北部湾东路66号海语城18幢2单元0202号"
合浦县博学幼儿园有限公司,91450521MA5NLR996K,2019-01-31,有限责任公司,朱庆林,"50万元人民币","全日制学前教育(按有效许可证经营至2022年01月29日)。",广西,北海,"广西北海市合浦县廉州镇廉东社区岭脚村二队小碑城许屋园"
三江县鑫凯建材物资贸易有限公司,91450226MA5NLR726R,2019-01-31,有限责任公司,吴仕昌,"100(万)","建材、金属及金属制品、涂料",广西,柳州,"三江县古宜镇侗乡大道苏城光明城18栋106号商铺"
南宁利车潮汽车服务有限公司,91450100MA5NLQYC7P,2019-01-31,有限责任公司,李军良,"150万元人民币","汽车修理与维护;电子产品(除国家专控产品)的批发及零售。",广西,南宁,"南宁市友谊路西二里19号中房碧翠园A组团6区商铺2号"
南宁市化蝶金融有限公司,91450100MA5NLRDH7K,2019-01-31,N/A,黄泽军,"500万元人民币","农业畜禽养殖场、屠宰场、食品加工厂、制糖企业的废弃物、污水的资源综合利用(除国家有限专项规定外,涉及许可证的需先办理许可证方可开展经营活动);农副土特产品(仅限初级农产品)、农用机械设备、饲料的销售;农作物种植、畜禽养殖(具体项目以审批部门批准为准);水果采摘服务,钓鱼服务;沼气技术服务;生物质燃料(除危险化学品...",广西,南宁,"南宁市青秀区金湖路22222号南宁市青秀区金湖路22222号南宁市青秀区金湖路22222号南宁市青秀区金湖路22222号南宁市青秀区金湖路22222号南宁市青秀区金湖路22222号南宁市青秀区金湖路22222号"
南宁恺泽恺贝口腔门诊部有限责任公司,91450103MA5NLR54X8,2019-01-31,有限责任公司,韦东,"30(万)","口腔科诊疗服务",广西,南宁,"南宁市青秀区枫林路17-1号11号商铺"
崇左市鸿鑫建材有限公司,91451400MA5NLQT07G,2019-01-31,有限责任公司,旷娟,"500(万)","销售建筑材料",广西,崇左,"广西崇左市工业新区濑湍镇全凤村加领屯东南面"
北海桂航足球俱乐部有限公司,91450500MA5NLRARXK,2019-01-31,有限责任公司,李永智,"100(万)","足球俱乐部的经营、管理，体育运动训练指导服务，体育赛事的组织，对体育项目的投资，体育信息咨询，体育用品的销售，体育赛事经纪服务，体育组织经纪服务，设计、制作、发布、代理国内各类广告",广西,北海,"北海市广场西里小区21号"
博白县英桥镇陈沛养殖场,92450923MA5NLQA9XP,2019-01-31,个体工商户,陈沛,"N/A","肉鸽养殖销售。",广西,玉林,"博白县英桥镇谢樟村根竹矿队"
南宁盛祥食品有限公司第一分公司,91450103MA5NLQPK5C,2019-01-31,有限责任公司,吴开振,"N/A","生产、加工及销售食品（具体项目以审批部门批准的为准），食品加工技术咨询及转让，餐饮管理咨询，展览展示服务，餐饮服务",广西,南宁,"南宁市青秀区民族大道136号南宁华润中心购物中心万象城第L6层690号商铺"
南宁东蒙灵洁商贸有限公司,91450102MA5NLRU30U,2019-02-01,有限责任公司,翟朋洁,"150(万)","销售：农副土特产品、工艺品（除象牙及其制品）、陶瓷制品、皮革制品、针纺织品、服装、床上用品、家具、卫生洁具、建筑材料（除危险化学品）、装潢材料（除危险化学品）、办公用品、计算机及配件、日用百货、通讯设备",广西,南宁,"南宁市兴宁区昆仑大道995号嘉和城塞纳北岸2栋2单元二十五层2503号房"
北流市金玉满堂房地产置业有限公司,91450981MA5NLT2X30,2019-02-01,有限责任公司,黄昭进,"50(万)","房地产信息咨询服务、房地产中介服务、房地产估价服务、物业管理服务、房地产营销策划、市场营销服务、企业形象策划、商务信息咨询、家政服务、室内装饰及设计、广告牌安装服务、国内演出经纪代理、房屋租赁与销售代理、代办贷款服务。",广西,玉林,"北流市月塘路34号"
东兴海之旅国际旅行社有限公司第九营业部,91450681MA5NLT3T7F,2019-02-01,有限责任公司,钟懋胜,"N/A","招徕旅游者、旅游信息咨询服务",广西,防城港,"东兴市新华路225号"
南宁云洛企业管理咨询有限公司,91450103MA5NLR873U,2019-02-01,有限责任公司,黄云鸿,"20(万)","企业管理信息咨询，商务信息咨询，财务管理信息咨询，活动策划信息咨询，物业信息咨询，劳务信息咨询、人力资源信息咨询（以上两项涉及许可的，具体项目以审批部门批准的为准），企业投资信息咨询（除金融、证券、期货业务），设计、制作、代理、发布国内各类广告，网页设计",广西,南宁,"南宁市青秀区朱槿路10号新加坡园区逸墅公馆B单元503号"
北海裕众房地产投资有限公司,91450503MA5NLRN87D,2019-02-01,有限责任公司,陈育英,"500万元人民币","对房地产项目的投资,房地产商品交易居间、代理、行纪,房屋托管,房地产营销策划,房地产商品信息咨询,商务信息咨询,旅游信息咨询,展览展示策划,会务策划,物业管理,室内外装饰工程,园林绿化工程,市政公用工程,家具、电子产品、建筑材料、装饰材料的销售,网络领域内的技术开发、技术咨询、技术应用,设计、制作、代理、发布国内...",广西,北海,"北海市广东路188号银滩圣美阳光家园1幢0101号"
北流市品香商贸有限公司,91450981MA5NLT2700,2019-02-01,有限责任公司,陈振新,"100(万)","水果，农产品销售及网上销售。",广西,玉林,"广西北流市新丰镇二中门口"
北海海之旅国际旅行社有限公司杭州路营业部,91450500MA5NLTDM37,2019-02-01,有限责任公司,李文江,"N/A","受公司委托联系相关业务。",广西,北海,"北海市银海区杭州路以北“杭州路便民市场”A3号商铺"
北海吉业广告有限公司,91450502MA5NLT510Q,2019-02-01,有限责任公司,姚业凤,"100(万)","设计、制作、代理、发布国内各类广告，展览展示策划，企业形象策划，公关活动策划，室内设计与装饰，铝合金门窗制作及销售；钢结构工程；计算机信息技术领域的技术开发、技术应用、技术咨询和电子产品销售。",广西,北海,"北海市南京路98号桐洋家园5幢0106号"
北海市星梦娱乐有限公司南宁青秀分公司,91450103MA5NLRGM74,2019-02-01,有限责任公司,吴有平,"N/A","室内儿童乐园，户外拓展运动组织策划，文化艺术交流活动组织、策划，会务策划，设计、制作、代理、发布国内各类广告，展览展示服务，企业管理咨询，健身服务，摄影服务，游乐设施，户外用品、体育用品、健身器材、玩具、服装、鞋帽、箱包、日用百货、电子产品、文具、工艺品（除象牙及其制品）、钟表、眼镜、鲜花、照相器材、食品",广西,南宁,"南宁市青秀区教育路22号百佳华三楼13150号"
北海岩门前建材有限公司,91450502MA5NLT3P4G,2019-02-01,有限责任公司,杨祝龙,"200(万)","建材销售，脚手架、机械设备的租赁，室内外装饰工程、建筑幕墙工程、钢结构工程、市政公用工程、园林绿化工程、金属门窗工程，建筑工程技术咨询。",广西,北海,"北海市海湾新城回建区一期B39号"
北流市飘香百里果业有限公司,91450981MA5NLRQB0R,2019-02-01,有限责任公司,陈玉燊,"50万元人民币","水果、农副产品销售及网上销售。(依法须经批准的项目,经相关部门批准方可开展经营活动)",广西,玉林,"广西北流市新丰镇永安村十组3-4号"
北流市声美电子科技有限公司,91450981MA5NLT2M3P,2019-02-01,有限责任公司,廖金艳,"100(万)","手机保护膜、钢化玻璃膜、手机配件、电子产品及配件、五金制品、绝缘材料、包装材料、机械设备、家用电器的生产、销售及互联网销售；LED电子屏幕设备、监控设备、防盗设备、仪器仪表、暖通设备、环保设备、停车场智能电子设备、路桥收费系统、楼宇知能化电子设备的销售、安装、维护、维修；交通设施设计和安装及相关技术咨询服务；广告策划、广告制作、庆典活动策划承办；自营或代理商品进出口业务。",广西,玉林,"北流市六靖镇六靖村里冲组（刘金振屋）"
三江县龙兴农业科技有限公司,91450226MA5NLRFK4J,2019-02-01,有限责任公司,龙永平,"3,000(万)","蔬菜、水果、食用菌及园艺作物种植；林木育种、育苗与销售；森林经营和管护及改培；木材和主材采运；花卉种植；中药材种植；茶叶、茶油种植、加工及销售；园林绿化工程施工；货物道路运输。",广西,柳州,"三江县古宜镇福桥西路9号江湾一品门面30栋9#"
北流市嘉盛房地产经纪有限公司,91450981MA5NLT3856,2019-02-01,有限责任公司,梁雪珍,"500(万)","房地产中介服务、房地产营销策划、房地产信息咨询服务、物业管理服务，房屋修缮服务，代办证件服务，代办按揭服务、房产估价服务，网站建设及网络推广，项目策划，广告设计与制作发布，家政服务，图文设计服务，室内装饰设计，营销策划，市场调查，展览展示，形象包装，礼仪庆典服务；五金交电批发及销售。",广西,玉林,"北流市北流镇富林塘客运中心北侧（吴林屋）"
