株洲知途网络科技有限公司,91430202MA4Q94LF4U,2019-02-02,有限责任公司,胡蛟,"50万元人民币","网络技术的研发;电子商务平台的开发建设;计算机网络平台的开发及建设;摄影服务;广告设计;广告发布服务、制作服务;文化艺术交流活动的组织;多媒体、动漫及衍生产品设计服务;影视策划;商务信息咨询;自媒体新闻发布服务;数字动漫制作。(依法须经批准的项目,经相关部门批准后方可开展经营活动)",湖南,株洲,"湖南省株洲市荷塘区戴家岭村芷塘组052号"
湖南湘江歌斐天使母基金管理有限公司,91430104MA4Q94N205,2019-02-02,有限责任公司,殷哲,"1000万元人民币","受托管理私募股权基金,从事投融资管理及相关咨询服务业务(不得从事吸收公众存款或变相吸收公众存款、发放贷款等金融业务)。(依法须经批准的项目,经相关部门批准后方可开展经营活动)",湖南,长沙,"湖南省长沙市岳麓区观沙岭街道滨江路53号楷林国际大厦A栋17楼(集群注册)"
娄底文正建材有限公司,91431300MA4Q94Q11F,2019-02-02,有限责任公司,李旅平,"600万元人民币","建筑用石灰石的开采加工和销售;钢材、水泥、混泥土的销售;装配置建筑用材的生产与销售。(依法须经批准的项目,经相关部门批准后方可开展经营活动)",湖南,娄底,"湖南省娄底市经济技术开发区第二工业园娄涟大道以北"
宁远腾俊电子商务有限公司,91431126MA4Q94EA94,2019-02-02,有限责任公司,蒋德交,"50(万元人民币)","互联网零售；电子商务服务；电子产品、家用电器、电脑及配件、通信设备、户外运动用品的网上销售。",湖南,永州,"湖南省永州市宁远县舜陵街道莲花社区宁郡华府3栋1单元25A03房"
冷水江市罗拉贸易有限公司,91431381MA4Q94Q622,2019-02-02,有限责任公司,罗阳,"300万元人民币","五金零售;氨水、盐酸、硫酸、氢氧化钠、氢氧化钾、磷酸、甲苯、丙酮、氢氟酸零售(无仓储)(有效期至2022年1月27日);五金交电、日用品、矿产品、农副产品、有色...对外贸易(国家法律法规规定应经审批方可经营或禁止进出口的货物除外);节能环保设备的销售、安装、出租。(依法须经批准的项目,经相关部门批准后方可开展经营活动)",湖南,娄底,"冷水江市金竹西路(原煤炭公司宿舍楼609室)"
湖南西米检测技术有限公司,91430100MA4Q94M32W,2019-02-02,有限责任公司,刘海粟,"200万元人民币","钢铁及有色金属检验检测服务;建筑材料检验服务;贵金属检测服务;化工产品检测服务;建筑消防设施检测服务;电气机械检测服务;电子产品检测;电气防火技术检测服务;公共设施安全监测服务;软件测试服务;无损检测;计量检定校准;仪器设备检验检测;仪器设备计量校准;材料科学研究、技术开发;新材料技术转让服务;计算机检测控制系统的...",湖南,长沙,"长沙高新开发区尖山路39号长沙中电软件园一期9栋7楼A7148室"
新邵县罗比餐饮有限公司,91430522MA4Q94L1X9,2019-02-02,有限责任公司,曾宪替,"200万元人民币","正餐服务。(依法须经批准的项目,经相关部门批准后方可开展经营活动)",湖南,邵阳,"湖南省邵阳市新邵县严塘镇严塘社区10组"
浏阳市聚力烟花原材料经营有限责任公司,91430181MA4Q94KL7W,2019-02-02,有限责任公司,周勇,"500(万元)","高氯酸钾、硝酸钾、硝酸钡、四氧化三铅、硫磺、铝粉、铝镁合金粉、钛粉、镁粉（不带储存设施经营）(危险化学品经营许可证有效期至2022年1月27日)，纸制品销售。",湖南,长沙,"浏阳市集里街道金沙北路163号"
沅江市金莫特电子有限公司,91430981MA4Q94HM6Q,2019-02-02,有限责任公司,肖敬风,"1,000(万元人民币)","电子产品、变压器、整流器和电感器制造。",湖南,益阳,"湖南省益阳市沅江市胭脂湖街道莲子塘村（原竹莲收费站附近）"
湖南阳通智能科技有限公司,91430111MA4Q94FK7Q,2019-02-02,有限责任公司,左华,"600万元人民币","智能化技术、积分管理软件、人脸识别系统、物联网技术研发;支撑软件、基础软件、应用软件、公交高新技术信息网络开发;增强现实制作;虚拟现实制作;信息系统集成服务;物联网技术服务;数字内容服务;通信基站技术咨询;智能电网技术咨询;物流信息服务;数据采集、挖掘服务;软件技术服务;人工智能应用;电子商务平台的开发建设;...",湖南,长沙,"长沙市雨花区中意一路798号冠铭商务中心6栋12层1208"
湖南澎润咨询管理有限公司,91430922MA4Q94M83A,2019-02-02,有限责任公司,苏澎,"1000万元人民币","社会经济咨询、商务信息咨询(不含金融、证券、期货信息);企业管理咨询;贸易咨询;计算机网络领域内技术开发、技术咨询、技术服务;电子商务;市场营销策划;文化艺术交流策划;会务展览服务。(依法须经批准的项目,经相关部门批准后方可开展经营活动)",湖南,益阳,"湖南省益阳市桃江县桃花江镇育英巷育英楼201室"
岳阳市德佑房产经纪服务有限责任公司,91430624MA4Q94MU3B,2019-02-02,有限责任公司,肖攀,"100万元人民币","房地产中介服务;房地产咨询服务。(依法须经批准的项目,经相关部门批准后方可开展经营活动)",湖南,岳阳,"湖南省岳阳市湘阴县文星镇东茅路北侧"
湖南正然建设工程有限公司,91430111MA4Q94HA8X,2019-02-02,有限责任公司,余有云,"1000万元人民币","房屋建筑工程、地质灾害治理工程、环保工程设施、电力工程、公路工程、水利水电工程、园林绿化工程、建筑防水、防腐保温工程、室外体育设施工程施工;工程造价专业咨询服务;节能环保产品销售;节能技术开发服务;生产混凝土预制件(限分支机构);建筑装饰材料生产(限分支机构);建筑钢结构、预制构件工程安装服务;广告制作服务、...",湖南,长沙,"长沙市雨花区万家丽南路二段688号中南总部基地1-B栋6010房(集群注册363号)"
张家界西线国际旅行社有限公司宏天绿城二门市部,91430800MA4Q94QP89,2019-02-02,有限责任公司,张玲,"N/A","招徕游客;提供旅游咨询服务。(依法须经批准的项目,经相关部门批准后方可开展经营活动)",湖南,张家界,"湖南省张家界市永定区南庄坪宏天绿城第11、12、13号门面"
湖南深究科技有限公司,91430103MA4Q94R50T,2019-02-02,有限责任公司,杨健,"500万元人民币","环保材料、机电产品、机电设备、建筑节能产品研发;支撑软件、应用软件、基础软件开发;节能技术转让服务、开发服务;管道、供水设备、空调设备维护;供水设备、电子产品、建材、空调设备、中央空调系统、节能环保产品销售;建筑节能改造、环保工程设施施工;机电设备、管道设施安装服务;中央空调系统保养、维修、清洗;...",湖南,长沙,"湖南省长沙市天心区书院南路189号华新花苑15栋301"
湖南洞庭兰盾服饰有限公司,91430921MA4Q94LL3J,2019-02-02,有限责任公司,邓双,"200万元人民币","服饰制造。(依法须经批准的项目,经相关部门批准后方可开展经营活动)",湖南,益阳,"湖南省益阳市南县经济开发区腾辉创业园16年标准化厂房14号栋三楼"
湖南正全路桥工程有限公司,91431300MA4Q94LM1D,2019-02-02,有限责任公司,蔡冬正,"2000万元人民币","道路桥梁工程、铁路工程、涵洞工程、建筑工程、水利水电工程、土石方工程、基础工程、隧道工程施工及劳务承包;建筑机械设备租赁。(依法须经批准的项目,经相关部门批准后方可开展经营活动)",湖南,娄底,"湖南省娄底市娄星区富康路与三元街交叉口西北角三元农贸大市场铺位221号"
新化县亿佳房地产经纪有限公司第十分店,91431322MA4Q94KJ0D,2019-02-02,有限责任公司,王莉,"N/A","在隶属企业经营范围内从事房地产信息咨询服务,房地产租赁代理服务、房地产买卖居间服务及相关产权证代办服务;房地产营销策划服务。(依法须经批准的项目,经相关部门批准后方可开展经营活动)",湖南,娄底,"湖南省娄底市新化县枫林街道华新社区立新桥下门面"
宁远县灼隆印刷有限责任公司,91431126MA4Q94E15E,2019-02-02,有限责任公司,黄莞城,"300(万元人民币)","包装装潢及其他印刷。",湖南,永州,"湖南省永州市宁远县东溪街道舜德社区十里铺工业园内"
湖南林浅苗木有限公司,91430626MA4Q94MR9Q,2019-02-02,有限责任公司,湛贺兵,"500万元人民币","花卉、苗木、草种、蔬菜、园艺作物、茶叶、香料作物的种植;种苗、塑木、苗木、木制品的销售;人造板、木制品、竹、藤、棕、草等制品的制造;林业产品、树、竹、草、花卉作物、木材的批发;木材加工;园艺作物、花卉的收购;苗木收购(不含野生保护类);林木育种;林木育苗。(依法须经批准的项目,经相关部门批准后方可开展经营活动)",湖南,岳阳,"湖南省岳阳市平江县大洲乡石煤矿姚洲村36号"
新化县桥头养牛专业合作社,93431322MA4Q94G69M,2019-02-02,N/A,刘烈开,"100万元人民币","组织采购、供应成员养牛、猪所需的生产资料,组织收购、销售成员生产的产品,为成员养殖引进新技术、新品种,开展技术交流和咨询服务。(依法须经批准的项目,经相关部门批准后方可开展经营活动)",湖南,娄底,"湖南省娄底市新化县琅塘镇桥头村12组"
汉寿县博宏商贸有限责任公司,91430722MA4Q94G34H,2019-02-02,有限责任公司,吴博凯,"10万元人民币","酒、饮料及茶叶批发;预包装食品(不含冷藏冷冻食品)、调味品销售;水产品养殖、收购、加工、销售;政策允许的农副产品收购、销售;仓储(不含危险品);普通货物道路运输。(依法须经批准的项目,经相关部门批准后方可开展经营活动)",湖南,常德,"湖南省常德市汉寿县辰阳街道大杨镇社区大杨西路159号"
岳阳县国正法律咨询服务有限公司,91430621MA4Q94HD2P,2019-02-02,有限责任公司,张三军,"50万元人民币","律师及相关法律服务;法律咨询服务;提供法律咨询、法律文书代写服务;代理非诉法律事务、合同审查;国内贸易代理服务;企业信息咨询。(依法须经批准的项目,经相关部门批准后方可开展经营活动)",湖南,岳阳,"岳阳县荣家湾镇荣新路3号(县公路管理所西边200米处506幢6楼779房)"
湖南千方建筑有限公司,91430224MA4Q94LR2U,2019-02-02,有限责任公司,谭聪林,"200(万元人民币)","市政公用工程、房屋建筑工程、建筑装饰装修工程、水利水电工程、公路工程、电力工程、土石方工程、环保工程、钢结构工程、城市及道路照明工程、地基基础工程、园林绿化及古建筑工程的设计与施工；施工劳务分包；广告代理、制作、发布、庆典礼仪、平面设计制作、工艺装潢；特种设备安装、改造、维修；建材、装饰及金属材料、办公家具、机电设备、水暖器材、林木及花草的销售。",湖南,株洲,"茶陵县城关镇腊园社区广南银苑D栋501号"
株洲莱芙文化娱乐管理有限公司,91430200MA4Q94PJ2W,2019-02-02,N/A,席仁清,"501万元人民币","歌舞厅娱乐活动;企业管理服务;餐饮服务;文化体育娱乐活动的组织与服务;广告设计、制作、发布与代理服务;饮料、副食、小礼品、日用百货、文体用品、工艺品、服饰批发与零售。(依法须经批准的项目,经相关部门批准后方可开展经营活动)",湖南,株洲,"湖南省株洲市芦淞区沿江中路8号大汉希尔顿国际401号"
宜章县德重堂种养专业合作社,93431022MA4Q94L36G,2019-02-02,N/A,谭永光,"70万元人民币","组织采购、供应成员中药材、蔬菜、水果、油茶、稻谷、林木种植及家禽、牲畜、内陆养殖所需的农业生产资料;组织收购、加工、包装、销售成员生产的同类产品;...开展与本社生产经营有关的技术培训、技术交流和信息咨询服务;乡村观光旅游;农家垂钓;住宿、餐饮服务。(依法须经批准的项目,经相关部门批准后方可开展经营活动)",湖南,郴州,"湖南省郴州市宜章县天塘镇龙塘村24组"
湖南昌凯科技有限责任公司,91430103MA4Q94QU9P,2019-02-02,有限责任公司,舒浩波,"200万元人民币","科技中介服务;科技信息咨询服务;科技项目代理服务;软件技术服务;信息技术咨询服务;物联网技术服务。(依法须经批准的项目,经相关部门批准后方可开展经营活动,未经批准不得从事P2P网贷、股权众筹、互联网保险、资管及跨界从事金融、第三方支付、虚拟货币交易、ICO、非法外汇等互联网金融业务)(依法须经批准的项目,经相关部门...",湖南,长沙,"湖南省长沙市天心区劳动西路348号贺龙体育场5043房(集群注册)"
湖南悠悠人生互联网信息服务有限公司,91430203MA4Q94F54K,2019-02-02,有限责任公司,游广一,"300万元人民币","互联网信息服务(不含互联网新闻信息服务);信息技术咨询;互联网信息技术咨询;移动互联网研发和维护;物联网技术研发;软件开发系统集成服务;人工智能应用;网络集成系统建设、维护、运营、租赁;物流信息服务。(依法须经批准的项目,经相关部门批准后方可开展经营活动)",湖南,株洲,"湖南省株洲市芦淞区建设南路9号2栋福星大厦商住楼(福星阳光金地)401号"
临武县汇智魔耳教育培训学校有限公司,91431025MA4Q94P23Q,2019-02-02,有限责任公司,胡运娟,"50(万元人民币)","文化教育。",湖南,郴州,"湖南省临武县舜峰镇解放南路100号"
湖南精美广告传媒有限公司,91430400MA4Q94QA5X,2019-02-02,有限责任公司,何纯科,"508万元人民币","广告设计、制作、代理、发布服务;标识牌、指示牌的销售;路牌、路标、广告牌的安装施工;室内装饰、设计;亮化工程的施工;文化活动的组织与策划;策划创意服务;展台设计、包装装潢的设计服务;商品信息咨询服务(不含金融、证券、期货以及民间资本投融资中介服务);市场营销策划服务;公司礼仪服务;会议、展览及相关服务;美术图案...",湖南,衡阳,"湖南省衡阳市蒸湘区立新路55号冠都现代城A1区1-12号平层1030室"
株洲百益工程技术服务有限公司,91430200MA4Q94NL6M,2019-02-02,有限责任公司,杨勇,"50万元人民币","工程机械检测技术服务;施工现场质量检测;建设工程检测;房屋建筑工程施工;房屋建筑工程监理;建筑行业建筑工程设计;机械设备、建筑器材、检测设备、汽车的租赁,建筑工程机械与设备经营租赁;专用设备的维护;工程咨询;建筑劳务分包;建筑工程施工总承包。(依法须经批准的项目,经相关部门批准后方可开展经营活动)",湖南,株洲,"株洲云龙示范区龙头铺街道兴隆山社区兴山组7号"
湖南超成水电工程有限公司,91430111MA4Q94KC3U,2019-02-02,有限责任公司,申超群,"318万元人民币","水利水电工程、城市及道路照明工程施工;水利水电工程施工总承包;电子与智能化工程专业承包;机电设备的维修及保养服务;水利设备、配电设备销售;机电设备安装服务;弱电工程总承包;从事10千伏以下电压等级电力设施的安装、维修或者试验活动。(依法须经批准的项目,经相关部门批准后方可开展经营活动)",湖南,长沙,"长沙市雨花区高桥街道友谊村新塘垅小区16栋3单元1楼东5-6号门面"
新化县亿佳房地产经纪有限公司第一分店,91431322MA4Q94MY6P,2019-02-02,有限责任公司,李薇,"N/A","在隶属企业经营范围内从事房地产信息咨询服务,房地产租赁代理服务、房地产买卖居间服务及相关产权证代办服务;房地产营销策划服务。(依法须经批准的项目,经相关部门批准后方可开展经营活动)",湖南,娄底,"湖南省娄底市新化县上渡街道科苑路28号门面"
江永阿玺电子商务有限公司,91431125MA4Q94RBX3,2019-02-02,有限责任公司,毛立玺,"150万元人民币","预包装食品、散装食品销售(含网络销售);农产品、水果、蔬菜种植销售(含网络销售);腊制品加工销售(含网络销售);旅游接待;餐饮服务。(依法须经批准的项目,经相关部门批准后方可开展经营活动)",湖南,永州,"湖南省永州市江永县潇浦镇永明东路农机局旁"
新化县亿佳房地产经纪有限公司第二分店,91431322MA4Q94NC2E,2019-02-02,有限责任公司,曾洁,"N/A","在隶属企业经营范围内从事房地产信息咨询服务,房地产租赁代理服务、房地产买卖居间服务及相关产权证代办服务;房地产营销策划服务。(依法须经批准的项目,经相关部门批准后方可开展经营活动)",湖南,娄底,"湖南省娄底市新化县枫林街道火车站社区建新路18号"
永州国皖实业发展有限公司,91431102MA4Q94RMX3,2019-02-02,有限责任公司,段日军,"5000万元人民币","其他未列明建筑业;市政道路工程建筑;园林绿化、节能的工程施工;电线、电缆制造;食品、酒、饮料及茶生产专用设备制造;安全、消防用金属制品制造;液压动力机械及元件、液力动力机械元件、气压动力机械及元件制造;气体压缩机械制造;电影机械制造;商业、饮食、服务专用设备制造;房地产开发经营;经济型连锁酒店;工程设计活动;...",湖南,永州,"湖南省永州市零陵区南津中路102号"
湖南红红食品有限公司,91430224MA4Q94HW8G,2019-02-02,有限责任公司,陈建平,"500万元人民币","肉制品及副产品加工、储存及销售;预包装食品、散装食品、农副产品销售(含网上销售)。(依法须经批准的项目,经相关部门批准后方可开展经营活动)",湖南,株洲,"茶陵县虎踞镇把集村江下"
湖南丽旺建筑劳务有限公司,91430124MA4Q94L60W,2019-02-02,有限责任公司,周利军,"1000万元人民币","建筑劳务分包;桥梁工程专业承包;钢结构工程专业承包;石油化工工程施工总承包;地基与基础工程专业承包;水利和内河港口工程建筑;铁路工程建筑;房屋建筑工程、电力工程、园林绿化工程、建筑防水、防腐保温工程、公路工程、城市地铁隧道工程施工;市政设施管理;水电安装;机电设备安装服务;室内装饰、设计;土石方工程服务;建筑物...",湖南,长沙,"湖南省宁乡市玉潭街道楚沩社区豪德市场A区十二街3栋106~108"
湖南火焱有害生物防治有限公司,91430121MA4Q94HX6T,2019-02-02,有限责任公司,邓华南,"200万元人民币","林业有害生物防治活动;农业病虫害防治活动;卫生消毒用品零售;防虫灭鼠服务;绿化管理;生物防治技术推广服务;中央空调系统的清洗;洁净净化工程设计与施工。(依法须经批准的项目,经相关部门批准后方可开展经营活动)",湖南,长沙,"湖南省长沙县星沙街道星沙大道198号蓝山郡三期A栋1103室"
常德市山水画商贸有限公司,91430700MA4Q94E66K,2019-02-02,有限责任公司,周杨,"200万元人民币","肉、禽、蛋、奶及水产品零售;酒、饮料及茶叶零售;小吃、茶馆的服务;餐饮服务;食品的销售;饮料及冷饮的服务。(依法须经批准的项目,经相关部门批准后方可开展经营活动)",湖南,常德,"常德柳叶湖旅游度假区七里桥街道戴家岗社区大河街D125号"
湖南霓裳服装商贸有限公司,91430922MA4Q94RH9W,2019-02-02,有限责任公司,龚言知,"200万元人民币","服装、童装、袜子、皮具、箱包、皮革制品、鞋帽批发兼零售。(依法须经批准的项目,经相关部门批准后方可开展经营活动)",湖南,益阳,"湖南省益阳市桃江县修山镇修山村茶亭坪村民组53号"
临澧县亿童月亮岛幼儿园有限公司,91430724MA4Q94Q463,2019-02-02,有限责任公司,杨武平,"1000万元人民币","学前教育。(民办学校办学许可证有效期限至2022年1月31日)。",湖南,常德,"湖南省常德市临澧县望城街道月亮岛社区月亮岛小区"
湖南奥启达文化传播有限公司,91430104MA4Q94N04F,2019-02-02,有限责任公司,夏瑶,"300万元人民币","文化活动的组织与策划;文化艺术咨询服务;文化创意;文化创意设计;文化产品研发;文化艺术交流活动的组织;文化艺术讲座活动的组织策划;预包装食品、进口酒类、国产酒类销售;广告制作服务、发布服务、国内外代理服务;文化艺术竞赛活动的组织策划;录音制作;广告设计;教育管理;教育咨询;电影发行;影视节目发行;营业性文艺表演;...",湖南,长沙,"湖南省长沙市岳麓区桔子洲街道潇湘中路271号天麓苑小区3栋901室"
新化县亿佳房地产经纪有限公司第十二分店,91431322MA4Q94H730,2019-02-02,有限责任公司,刘东,"N/A","在隶属企业经营范围内从事房地产信息咨询服务,房地产租赁代理服务、房地产买卖居间服务及相关产权证代办服务;房地产营销策划服务。(依法须经批准的项目,经相关部门批准后方可开展经营活动)",湖南,娄底,"湖南省娄底市新化县上渡街道学府南路金资湾21号门面"
常德颜姐人力资源有限公司,91430724MA4Q94LX1N,2019-02-02,有限责任公司,颜银香,"200万元人民币","人力资源外包服务;用人单位人力资源管理咨询服务;建筑劳务服务;企业经营管理人才服务。(依法须经批准的项目,经相关部门批准后方可开展经营活动)",湖南,常德,"湖南省常德市临澧县望城街道文塘社区居委会迎宾南路330号"
湖南有通新材料科技有限公司,91430100MA4Q94JW0F,2019-02-02,有限责任公司,肖超,"500万元人民币","新材料技术推广服务;汽车内饰用品、日用化学产品、环保新型复合材料、环保材料、功能性材料、新材料及相关技术生产;汽车用品、汽车内饰用品、环保新型复合材料、研磨材料、功能性材料、新材料及相关技术、环保材料销售;汽车零配件零售;环保材料、功能性材料研发;隔热和隔音材料制造;涂层材料加工;材料科学研究、技术开发;...",湖南,长沙,"长沙高新开发区东方红中路586号1号厂房101-西区1号车间"
岳阳和美文化传播有限公司,91430602MA4Q94P90Y,2019-02-02,有限责任公司,苏练金,"200万元人民币","电影和影视节目制作;著作权代理;知识产权代理;计算机技术开发、技术服务;软件技术服务;软件技术转让;策划创意服务;纺织、服装及日用品零售;文化艺术咨询服务;广告设计、发布、制作、国内外代理服务;文化用品、办公用品、工艺品、计算机外围设备、电子产品(不含无线电管制器材及地面卫星接收设施)的销售。(依法须经批准的...",湖南,岳阳,"湖南省岳阳市岳阳楼区站前路与南湖大道交汇处金冠商厦(原九天大厦)5楼501室"
湖南亦喜良枕家居用品有限责任公司,91430121MA4Q94QB3N,2019-02-02,有限责任公司,路发旺,"200万元人民币","家居用品、床上用品、服装、服装配饰、鞋、窗帘、布艺制品、日用品销售。(依法须经批准的项目,经相关部门批准后方可开展经营活动)",湖南,长沙,"湖南省长沙县星沙街道星沙大道198号蓝山郡一期A栋102号"
湖南特发服装有限公司,91430281MA4Q94MN6C,2019-02-02,有限责任公司,刘正佳,"500万元人民币","服装、西服、标志服,工作服、雨衣、雨具、棉衣棉裤、棉被、帐篷、帽子、领带、手套、窗帘、毛毯、口罩、鞋子、箱包、劳保用品、家纺用品、床上用品的设计、研发、制造及销售;服装配饰、消防器材、安保器材、交通安全设施、矿山设备、救灾设备、行政执法装备、道路养护装备、百货、办公用品、电子产品、日用品、环卫用品设施...",湖南,株洲,"醴陵市船湾镇增加滩村雷公塘组12号"
湖南苏茂广告传播有限公司,91430104MA4Q94EY54,2019-02-02,有限责任公司,钮依依,"200万元人民币","广告制作服务、发布服务;学术交流活动的组织;广告设计;文化活动的组织与策划;商业活动的策划。(依法须经批准的项目,经相关部门批准后方可开展经营活动)",湖南,长沙,"湖南省长沙市岳麓区天顶街道航天大院407栋201号"
湖南省萌童坊服饰有限公司,91430521MA4Q94GH9N,2019-02-02,有限责任公司,容俊杰,"200万元人民币","婴幼儿服饰、服装、箱包、皮具、针纺织品、鞋帽的制造销售及互联网销售;自营和代理各类商品的进出口,但国家限定公司经营或禁止进出口的商品除外。(依法须经批准的项目,经相关部门批准后方可开展经营活动)",湖南,邵阳,"湖南省邵阳市邵东县两市塘街道办事处绿汀大道巨龙工业园9栋"
宁乡市奇武建筑劳务有限公司,91430124MA4Q94P07D,2019-02-02,有限责任公司,唐宁,"10(万元)","建筑劳务分包；地坪工程设计、施工；土石方工程服务；建筑钢结构、预制构件工程安装服务；室内设计技术咨询服务；房屋建筑工程、景观和绿地设施工程的施工；建筑装饰工程、建筑行业建筑工程设计。",湖南,长沙,"宁乡市玉潭街道香山社区龙头湾购物中心404号"
