中国移动通信集团湖南有限公司湘潭分公司湖南科技大学南校区营业厅,91430300MA4QAB0D9A,2019-03-07,有限责任公司,王跃平,"N/A","移动通信、IP电话和互联网等网络的建设和投资；经营移动通信业务（包括语音、数据、多媒体等）以及基于移动通信业务的各类增值业务（包括从事为电子商务服务的手机支付业务）；IP电话及互联网接入服务；凭资质从事移动通信、IP电话和互联网等网络工程勘察、设计、安装、工程施工和维修；经营与移动通信、IP电话和互联网业务相关的系统集成、漫游结算清算、技术开发、技术服务、设备销售等；出售、出租移动电话终端设备、IP电话设备、互联网设备及其备件，并提供售后服务；广告设计、制作及户外广告、自有媒体广告的发布，代理电视、广播、报刊及印刷品、礼品广告。",湖南,湘潭,"湘潭经开区响水乡桃源路科技大学招待所"
临湘市羊楼司脚板鞋店,92430682MA4QABE28G,2019-03-07,个体工商户,段云,"-","鞋类、服装、纺织品及日用品零售（依法须经批准的项目，经相关部门批准后方可开展经营活动）",湖南,岳阳,"湖南省临湘市羊楼司镇尖山中路117号"
东安龙飞艺术教育学校有限公司,91431122MA4QA9EJ1M,2019-03-07,有限责任公司,陈冬海,"30(万元人民币)","其他未列明教育；中小学艺术类；舞蹈、中小学体育类；跆拳道。",湖南,永州,"湖南省永州市东安县舜皇城家具配套区B1B2栋2001C号"
临澧湘味乡愁电子商务有限公司,91430724MA4QA8XUX3,2019-03-07,有限责任公司,刘学才,"50(万元人民币)","预包装食品、散装食品、纺织及针织品、塑料制品、电气设备、灯具、工艺美术品、服装、鞋帽、玩具、文化、体育用品及器械材、珠宝首饰、农副产品销售及互联网销售；网络咨询服务；摄影服务；室内装饰设计服务；广告制作、发布、代理。",湖南,常德,"湖南省常德市临澧县安福街道安福路社区居委会九龙路翰林苑西侧112号门面"
上海航广广告有限公司湖南分公司,91430105MA4QAA4C34,2019-03-07,有限责任公司,胡俊杰,"-","广告设计；广告制作服务、发布服务、国内代理服务；企业形象策划服务；图文制作；电子技术研发；电子技术转让；电子技术服务；电子产品、计算机、软件、计算机辅助设备销售。",湖南,长沙,"长沙市开福区清水塘街道芙蓉中路一段319号绿地中心T3栋2102号房"
华容县好运竹木经营有限公司,91430623MA4QA9TR20,2019-03-07,有限责任公司,陈浩航,"300万元人民币","建材批发;竹、木收购、加工、销售;竹制品制造;林产品初级加工活动。(依法须经批准的项目,经相关部门批准后方可开展经营活动)",湖南,岳阳,"湖南省岳阳市华容县东山镇华容道村原包家仓六组"
双峰县石茂贸易有限公司,91431321MA4QAAJQ3U,2019-03-07,有限责任公司,陈国新,"200(万元人民币)","建材、防水涂料、五金交电销售；机械设备租赁。",湖南,娄底,"湖南省娄底市双峰县永丰镇城中路（汇丰步行街6、7、8栋）6层602房"
临湘市羊楼司镇尚爱竹木家居生活馆,92430682MA4QAB4AX1,2019-03-07,个体工商户,舒民,"-","竹木制品互联网上的销售（依法须经批准的项目，经相关部门批准后方可开展经营活动）",湖南,岳阳,"湖南省临湘市羊楼司镇中洲居委会中洲街95号"
冷水江市渣渡农贸市场管理有限公司,91431381MA4QAAA11D,2019-03-07,有限责任公司,李群鹏,"5万人民币","农贸市场管理服务；市场调查；农产品销售。",湖南,娄底,"冷水江市渣渡镇木瓜居委会（镇政府办公楼223室）"
冷水江市子风贸易有限公司,91431381MA4QABL9XC,2019-03-07,有限责任公司,吴萍,"20万人民币","橡胶制品销售。",湖南,娄底,"冷水江市环城东路（同兴汽车站6号楼6栋106室）"
临湘市羊楼司镇金福竹木加工厂,92430682MA4QABGJXD,2019-03-07,个体工商户,何金福,"N/A","竹木成品及半成品加工销售（依法须经批准的项目，经相关部门批准后方可开展经营活动）",湖南,岳阳,"湖南省临湘市羊楼司镇尖山村居民三组47号"
东安县荣腾工程项目管理有限公司,91431122MA4QAANB6J,2019-03-07,有限责任公司,蒋政治,"50万元人民币","其他房屋建筑业;建筑工程劳务分包;房屋建筑工程、土石方工程、市政工程、公路桥梁隧道工程、港口码头建筑工程设计、施工;室内外建筑装饰装潢设计、施工;公路标志标牌设计、施工;水电安装、机械设备安装;建筑机械设备、脚手架租赁。(依法须经批准的项目,经相关部门批准后方可开展经营活动)",湖南,永州,"湖南省永州市东安县川岩乡下界头村12组"
上海一嗨汽车租赁有限公司长沙七分公司,91430100MA4QA8JT28,2019-03-07,港、澳、台,熊延益,"N/A","汽车租赁。(依法须经批准的项目,经相关部门批准后方可开展经营活动)",湖南,长沙,"湖南省长沙市岳麓区梅溪湖游园路98号麓阳和景雅苑7幢1层07号"
九华建设工程有限责任公司龙山分公司,91433130MA4QA8N19E,2019-03-07,有限责任公司,彭官智,"N/A","市政工程、土木工程、公路工程、桥梁工程、建筑装饰工程、水利工程、园林工程、古建筑工程的施工及设备安装,工程项目管理、工程招标代理、工程造价咨询、施工图设计审查,环保工程、交通设施工程的施工,标志、标线、护栏、隔离栅、信号灯、电子监控、路灯等设施的安装、施工;安防监控系统的设计、安装、维护、施工;建筑钢...",湖南,湘西,"湖南省湘西土家族苗族自治州龙山县民安街道办事处朝阳路步步高小区八栋一单元"
冷水江市辉达农业发展有限公司,91431381MA4QAANJ13,2019-03-07,有限责任公司,余朝辉,"100万人民币","水稻、玉米、油茶、食用菌、森林植物（林木）、蔬菜、绿化用苗木、花卉种植、销售；果树的种植及所产果实的销售；中药材种植；水生动物、家禽、家畜的养殖、销售；农副产品晒制、烘干加工、销售；提供本公司种植园、养殖场观光服务及本公司水生动物养殖场垂钓服务；热食类食品、冷食类食品制售。",湖南,娄底,"冷水江市沙塘湾街道办事处群丰村9组015号"
冷水江市众希房地产经纪有限公司金竹西路分公司,91431381MA4QABK268,2019-03-07,有限责任公司,胡田玉,"-","房地产经纪及营销策划、房地产信息咨询服务、房产过户手续的代理。",湖南,娄底,"冷水江市金竹西路（商务局原办公楼院落大门口南侧商住楼1号门面）"
五一惠民健康管理有限公司怀化分公司,91431200MA4QA9RN74,2019-03-07,有限责任公司,梁仁乐,"-","经济贸易咨询；企业管理；健康管理（须经审批的诊疗活动除外）；健康咨询（须经审批的诊疗活动除外）；医院管理（不含诊疗活动）；居家养老服务（不含集中式养老）；市场调查；承办展览展示活动；设计、制作、代理、发布广告；销售（含网上销售）医疗器械（仅限1类）、日用品、化妆品、电子产品、文化用品、体育用品、环保...",湖南,怀化,"湖南省怀化市鹤城区瑞丰路幸福家园正对面"
临澧县海清薯业有限公司,91430724MA4QAAHWXE,2019-03-07,有限责任公司,胡自兵,"200万人民币","薯类、农作物、茎类植物种植、加工、销售。",湖南,常德,"湖南省常德市临澧县合口镇楠桥村九组"
冷水江市鹏汉运输有限公司,91431381MA4QA8QG0T,2019-03-07,有限责任公司,李汉,"68万人民币","道路普通货物运输；货运代理；仓储服务；货运配载信息服务；货物包装、装卸服务。",湖南,娄底,"冷水江市铎山镇洞头村8组218号"
中励项目管理有限公司,91430100MA4QA8JN37,2019-03-07,有限责任公司,陈刃,"5000万元人民币","工程管理服务;工程建设项目招标代理服务;政府采购咨询服务;政府采购代理;招、投标代理服务;工程技术咨询服务;工程监理服务;工程造价专业咨询服务。(依法须经批准的项目,经相关部门批准后方可开展经营活动)",湖南,长沙,"湖南省长沙市雨花区湘府东路二段517号红星大厦2012"
临湘市勇球建筑劳务有限公司,91430682MA4QA8M47L,2019-03-07,有限责任公司,李勇球,"500万元人民币","住宅房屋建筑;建筑劳务分包,土石方工程服务,公路工程建筑,铁路、道路、隧道和桥梁工程建筑,市政公用工程施工,建筑物拆除(不含爆破作业),建筑垃圾综合治理及其再生利用,渣土(含砂石)运输,砂石销售。(依法须经批准的项目,经相关部门批准后方可开展经营活动)",湖南,岳阳,"湖南省岳阳市临湘市忠防镇坵坪社区25号"
临湘市羊楼司镇天美家居生活馆,92430682MA4QAB3282,2019-03-07,个体工商户,贺美玲,"-","竹木制品互联网上的销售（依法须经批准的项目，经相关部门批准后方可开展经营活动）",湖南,岳阳,"湖南省临湘市羊楼司镇中洲居委会中洲街93号"
华南亿顺航空服务有限公司,91431100MA4QAAPX98,2019-03-07,有限责任公司,何凡,"5,000(万元人民币)","航空旅客运输；保险代理服务；航空客运票务代理；人力资源咨询服务（不含劳务派遣）；货运代理；通用航空服务；民航信息咨询服务；航空地面接待服务；国内外包机服务；旅游信息咨询；酒店订房服务；企业管理咨询；企业内部人员培训；航空产业的信息技术咨询；航空机场的管理与服务；机场租赁服务。",湖南,永州,"湖南省永州市冷水滩区零陵中路西侧紫金路南侧金水湾城市广场2701室"
冷水江市鸿仁食品有限公司,91431381MA4QAAM77L,2019-03-07,有限责任公司,易峰,"10万人民币","炒货食品及坚果制品制售；预包装食品、散装食品、日用品、服装的销售。",湖南,娄底,"冷水江市金电环路（四四零加油站旁商住楼101-103号门面）"
南县金锦印章有限公司,91430921MA4QAE4D2D,2019-03-08,有限责任公司,戴兆进,"10(万元人民币)","公章刻制；雕塑工艺品制造；打字，复印。",湖南,益阳,"湖南省益阳市南县南洲镇小荷堰社区九都山南路211号"
中铭工程设计咨询有限公司长沙分公司,91430104MA4QACG90U,2019-03-08,有限责任公司,周宏光,"N/A","在隶属企业经营范围内开展下列经营活动:工程咨询;项目调研咨询服务;建设项目社会稳定风险评估;环境评估;建设工程设计。(依法须经批准的项目,经相关部门批准后方可开展经营活动)",湖南,长沙,"湖南省长沙市岳麓区咸嘉湖街道谷丰南路9号高信向日葵园12栋710房"
上海大华工程造价咨询有限公司湖南分公司,91430111MA4QAC1T98,2019-03-08,有限责任公司,陈长春,"N/A","在隶属企业经营范围内承接业务。(依法须经批准的项目,经相关部门批准后方可开展经营活动)",湖南,长沙,"长沙市雨花区迎新路499号坤颐商务中心第1、2、3栋1535号房"
临武县九泽源电力有限公司,91431025MA4QADQ97T,2019-03-08,有限责任公司,张曦,"300万元人民币","风力发电、太阳能发电;电力销售:工程咨询服务;电力技术咨询;招、投标咨询服务。(依法须经批准的项目,经相关部门批准后方可开展经营工作)。",湖南,郴州,"湖南省郴州市临武县南强镇杉树村上板栗综合楼"
华容金砾建材有限公司,91430623MA4QACJP00,2019-03-08,有限责任公司,白祖兵,"200万元人民币","其他非金属矿物制品制造;建筑材料销售;机制砂的加工、销售。(依法须经批准的项目,经相关部门批准后方可开展经营活动)",湖南,岳阳,"湖南省岳阳市华容县操军镇湖城村东升片9组"
华容妮果贸易有限公司,91430623MA4QACAN77,2019-03-08,有限责任公司,李黎,"30万元人民币","化妆品及卫生用品、营养和保健品、护肤品、预包装食品、婴儿用品销售。(依法须经批准的项目,经相关部门批准后方可开展经营活动)",湖南,岳阳,"湖南省岳阳市华容县田家湖生态新区茶花园路003-1号"
华容县南征建材有限公司,91430623MA4QADHM62,2019-03-08,有限责任公司,张劲,"280万元人民币","其他非金属矿物制品制造;建筑材料销售;机制砂的加工、销售。(依法须经批准的项目,经相关部门批准后方可开展经营活动)",湖南,岳阳,"湖南省岳阳市华容县万庾镇万庾村苍台7组172号"
华容县富成建筑劳务有限公司,91430623MA4QAE318B,2019-03-08,有限责任公司,郝浩,"500万元人民币","其他未列明建筑业;建筑劳务分包;土石方工程服务;工程围栏装卸施工;工程排水施工服务;围栏、护栏设计与安装;市场升级改造建设;公路工程建筑;建筑工程后期装饰、装修和清理。(依法须经批准的项目,经相关部门批准后方可开展经营活动)",湖南,岳阳,"湖南省岳阳市华容县鲇鱼须镇原宋家嘴墟场88号"
南县达祥建筑装饰工程有限公司,91430921MA4QADJX9U,2019-03-08,有限责任公司,陈国华,"50万元人民币","住宅装饰和装修;建筑材料销售。(依法须经批准的项目,经相关部门批准后方可开展经营活动)",湖南,益阳,"湖南省益阳市南县南洲镇宝塔湖社区三王庙65号"
保靖维舟贸易有限公司,91433125MA4QACR90H,2019-03-08,有限责任公司,宋春玲,"3(万元人民币)","互联网零售。",湖南,湘西,"湖南省湘西土家族苗族自治州保靖县迁陵镇酉水园B栋403"
凤凰志扬吊装有限责任公司,91433123MA4QAD1JXN,2019-03-08,有限责任公司,张志,"100(万元人民币)","装卸搬运；建筑工程机械与设备出租。",湖南,湘西,"湖南省湘西土家族苗族自治州凤凰县沱江镇土桥路滕家湾2组"
东安县好未来培训教育有限公司,91431122MA4QADD862,2019-03-08,有限责任公司,唐小玲,"100万元人民币","中小学学科类:语文、数学、英语、化学(办学许可证有效期至2022年8月31日)。(依法须经批准的项目,经相关部门批准后方可开展经营活动)",湖南,永州,"湖南省永州市东安县白牙市镇建设大道105号(加州首府二楼)"
东安新天地农业开发有限公司,91431122MA4QADU926,2019-03-08,有限责任公司,陈钦,"100万人民币","蔬菜、瓜果及相关农产品种植及销售；水产品养殖及销售；农业休闲观光旅游，果蔬采摘。",湖南,永州,"湖南省永州市东安县芦洪市镇永电新村1号商业楼"
临湘市云湖自来水有限公司,91430682MA4QAFR3X1,2019-03-11,有限责任公司,卢胜良,"1000万元人民币","自来水生产和供应。(依法须经批准的项目,经相关部门批准后方可开展经营活动)",湖南,岳阳,"湖南省岳阳市临湘市云湖办事处板桥村自生组(原花园小学内整栋)"
中方县盛荣木业有限公司,91431221MA4QAGC29U,2019-03-11,有限责任公司,陈生荣,"100万元人民币","木材、木制品、竹制品、家具、建筑材料、装饰材料的加工和销售。(依法须经批准的项目,经相关部门批准后方可开展经营活动)",湖南,怀化,"湖南省怀化市中方县中方镇鸭咀岩村二组"
中方县华盛物资有限公司,91431221MA4QAEBD7W,2019-03-11,有限责任公司,潘系名,"200万元人民币","砂石的加工、销售及运输。(依法须经批准的项目,经相关部门批准后方可开展经营活动)",湖南,怀化,"湖南省怀化市中方县中方镇竹站村209国道边"
中方县陈家湾村木材加工厂,92431221MA4QAFYQ2Q,2019-03-11,个体工商户,向开军,"N/A","木材加工、取暖器批发兼零售。",湖南,怀化,"中方县中方镇陈家湾村一组"
中方县鸿辉物资有限公司,91431221MA4QAED974,2019-03-11,有限责任公司,黄光辉,"200万元人民币","砂石的加工、销售及销售。(依法须经批准的项目,经相关部门批准后方可开展经营活动)",湖南,怀化,"湖南省怀化市中方县桐木镇桐木村桐木组"
东安焕程电子科技有限公司,91431122MA4QAFFY7M,2019-03-11,有限责任公司,李中明,"500万元人民币","其他电子专用设备制造。(依法须经批准的项目,经相关部门批准后方可开展经营活动)",湖南,永州,"湖南省永州市东安县紫溪市镇五里牌村四组"
中海油湖南销售有限公司常宁嘉佳加油站,91430482MA4QAHCC34,2019-03-11,有限责任公司,姜宏伟,"N/A","成品油零售(危险化学品经营许可证有效期至2022年3月7日);日用百货、润滑油、五金交电、汽车配件、预包装食品、散装食品、乳制品(不含婴幼儿配方奶粉)、果品、蔬菜、调味品、计生用品、进口食品及用品的零售;酒类的零售;卷烟、雪茄烟的零售。((依法须经批准的项目,经相关部门批准后方可开展经营活动)",湖南,衡阳,"湖南省衡阳市常宁市宜阳办事处万寿村六组"
临湘市众思网络科技有限公司,91430682MA4QAEJU7N,2019-03-11,有限责任公司,付芹芹,"100万元人民币","其他未列明信息技术服务业;计算机应用电子设备、计算机、计算机软件、计算机辅助设备、监控设备、通信设备、光纤设备、手机辅料、计算机零配件、办公设备耗材、开关、插座、接线板、电线电缆、绝缘材料、多媒体系统、广播电视卫星设备、电子产品(不含无线电管制器材和卫星地面接收设施)、保安器材、门的销售,计算机外围设备...",湖南,岳阳,"湖南省岳阳市临湘市长安南太路70号"
中科油（益阳）清洁能源有限公司,91430900MA4QAFMJ9J,2019-03-11,有限责任公司,黄泽雄,"5000万人民币","车用清洁燃料的研发和技术推广（不含危险化学品）",湖南,益阳,"益阳市高新区益阳大道金源大厦B座803室"
上海纽盾科技股份有限公司湖南分公司,91430104MA4QAGQ87T,2019-03-11,股份有限公司,彭伟立,"N/A","在隶属企业经营范围内开展下列经营活动:计算机技术开发、技术服务;环保技术开发服务、咨询、交流服务、转让服务;建筑材料、电子产品销售;商务信息咨询。(依法须经批准的项目,经相关部门批准后方可开展经营活动)",湖南,长沙,"湖南省长沙市岳麓区观沙岭街道桔洲新苑小区1栋4楼(集群注册)"
七彩建设发展有限公司长沙分公司,91430104MA4QAG9T0J,2019-03-11,有限责任公司,虢传宇,"N/A","在隶属企业经营范围内承接业务。(依法须经批准的项目,经相关部门批准后方可开展经营活动)",湖南,长沙,"湖南省长沙市岳麓区咸嘉湖街道枫林二路218号办公楼第六楼整层"
临武县裕翔农业开发有限公司,91431025MA4QAEBE57,2019-03-11,有限责任公司,胡建军,"500万元人民币","蔬菜种植;水果种植;水产养殖;家禽饲养;农业技术开发服务,农业技术咨询、交流服务;农产品销售;农产品配送;农业园艺服务。(依法须经批准的项目,经相关部门批准后方可开展经营活动)",湖南,郴州,"湖南省临武县舜峰镇城南市场通道口处西面1号门面"
临武县东汇汽贸有限公司,91431025MA4QAEL12K,2019-03-11,有限责任公司,王亚斌,"100万元人民币","汽车新车零售;汽车旧车、汽车零配件的零售;汽车修理与维护。(依法须经批准的项目,经相关部门批准后方可开展经营活动)",湖南,郴州,"湖南省临武县武水镇武水大道龙凤嘉园小区一楼门面"
中方县百川园林绿化工程有限公司,91431221MA4QAHW45K,2019-03-11,有限责任公司,阳立军,"500万元人民币","园林绿化工程施工、设计及养护;园林景观的销售、施工及售后服务;亮化工程施工、设计、维护;建筑工程施工;仿古建筑的施工;花卉、苗木的培育、收购、租赁及销售;建筑材料、装饰材料、石材、金属材料、体育器材、凉亭、廊桥、假山、护栏、栈道、花箱、果皮箱、垃圾车、吊顶、休闲椅、阳光房、标识牌的销售、安装及售后服务;...",湖南,怀化,"湖南省怀化市中方县桃花源二期40栋04号门面"
娄底市六六九吊装有限公司,91431300MA4QAM7666,2019-03-12,有限责任公司,谢志珍,"508(万元人民币)","起重设备、机电设备的安装服务；机械设备、五金机电产品、起重设备及配件、叉车及配件、通用仪器仪表、汽车配件的销售；建筑工程机械与设备经营租赁；工程机械应急救援服务；货物装卸搬运服务。",湖南,娄底,"娄底市娄星区春园路鹏泰国际B804"
光大环保能源（宁远）有限公司,91431100MA4QALHK1B,2019-03-12,有限责任公司 港、澳、台,邱波,"14915.31万人民币","焚烧处理城市生活垃圾及销售所产生的电力、蒸汽、灰渣及附属品；垃圾渗滤液处理；研究开发垃圾处理技术及提供相关技术咨询和技术服务。（禁止的外商投资领域除外）",湖南,永州,"湖南省永州市宁远县舜陵镇仁山庙村"
古丈县鼎名广告传媒有限公司,91433126MA4QAJCY93,2019-03-12,N/A,向财,"20(万元人民币)","广告设计与制作、传媒、电子科技、广告装饰、装修。",湖南,湘西,"湖南省古丈县古阳镇竹溪湾太阳城102号"
双峰县聚旺商贸有限公司,91431321MA4QAL616H,2019-03-12,有限责任公司,刘满辉,"100万元人民币","预包装食品、散装食品、乳制品(含婴幼儿配方乳粉)、保健食品、日用百货销售;卷烟、雪茄烟零售;会议及商品展览服务。(依法须经批准的项目,经相关部门批准后方可开展经营活动)",湖南,娄底,"湖南省娄底市双峰县永丰镇工农北路239号"
嘉禾县德润商贸有限公司,91431024MA4QAM432Y,2019-03-12,有限责任公司,曾利军,"500(万元人民币)","煤炭批发及零售；矿渣、炉渣、水渣批发及零售。",湖南,郴州,"湖南省郴州市嘉禾县晋屏镇泉凤村8组5号一楼门面"
嘉禾亿农谷生态农业科技发展有限公司,91431024MA4QAJAD4U,2019-03-12,有限责任公司,曾利侠,"5,369(万元人民币)","稻谷种植与收购、粮食加工与销售、农副产品种植与销售、农业智能设备研发生产与销售、田园综合体设计与开发、技术咨询服务、园林绿化设计与种植养护、物业管理服务.（依法须经批准的项目，经相关部门批准后方可开展经营活动）",湖南,郴州,"湖南省郴州市嘉禾县晋屏镇原盘江乡政府大院"
古丈县星发建设有限公司,91433126MA4QAJJEXJ,2019-03-12,有限责任公司,黄明发,"1000万元人民币","公路工程建筑;混凝土浇灌、水泥路面硬化:建筑材料销售:民族工艺品制作及销售。(依法须经批准的项目,经相关部门批准后方可开展经营活动)",湖南,湘西,"湖南省湘西土家族苗族自治州古丈县古阳镇(老塘坊法院桥头)1栋14A01"
古丈县军龙工程建设有限公司,91433126MA4QAJ6TXT,2019-03-12,有限责任公司,罗军,"200万元人民币","农村公路路基路面、小桥涵、小型码头(渡口)工程;房屋修缮、装饰工程施工;混凝土浇灌、水泥路面硬化、土石方工程、保坎工程;;小型水利水电工程;市政公用工程施工、园林绿化工程、亮化工程;建筑材料销售。(依法须经批准的项目,经相关部门批准后方可开展经营活动)",湖南,湘西,"湖南省湘西自治州古丈县古阳镇且茶村"
北京鼎元智业科技有限公司长沙分公司,91430104MA4QAMH94Y,2019-03-12,N/A,蒋兰,"N/A","在隶属企业经营范围内开展下列经营活动：第二类增值电信业务中的信息服务业务（不含固定网电话信息服务和互联网信息服务）；贸易咨询服务；计算机零售；化妆品零售；日用品、通用机械设备销售；计算机技术转让；计算机技术开发、技术服务。",湖南,长沙,"湖南省长沙市岳麓区望岳街道金星北路一段15号景芳新寓北栋101号"
双峰力天物流有限公司,91431321MA4QAJK44R,2019-03-12,有限责任公司,贺忍,"20万元人民币","普通货物道路运输及物流服务;普通货物运输代理及打包服务;普通货物仓储、装卸、搬运服务;货运配载信息服务。(依法须经批准的项目,经相关部门批准后方可开展经营活动)",湖南,娄底,"湖南省娄底市双峰县永丰镇五里牌双兴街73号"
双牌县军洁环保科技有限公司,91431123MA4QAK904N,2019-03-12,有限责任公司,蒋明权,"300万元人民币","其他未列明专业技术服务业;城市生活垃圾收集、清运、处理利用;垃圾分选物制肥、塑料造粒。(依法须经批准的项目,经相关部门批准后方可开展经营活动)",湖南,永州,"湖南省永州市双牌县泷泊镇车站路(黄能家)"
华夏信达保险经纪(北京)有限公司湖南分公司,91430104MA4QAKF61Q,2019-03-12,N/A,韩阳飞,"N/A","在隶属企业经营范围内开展下列经营活动:经营保险经纪业务。(依法须经批准的项目,经相关部门批准后方可开展经营活动)",湖南,长沙,"湖南省长沙市岳麓区银盆岭街道银杉路31号绿地时代广场5栋501号"
中骏建设有限公司新邵分公司,91430522MA4QALNKXJ,2019-03-12,有限责任公司,米友军,"N/A","在隶属企业经营范围内从事经营活动。(依法须经批准的项目,经相关部门批准后方可开展经营活动)",湖南,邵阳,"湖南省邵阳市新邵县陈家坊镇陈家坊村(原供销社)"
