企业名称,统一社会信用代码,注册日期,企业类型,法人代表,注册资金,经营范围,所在省份,地区,注册地址
花垣县思成种植专业合作社,93433124MA4Q7DMK50,2019-01-01,N/A,李诗成,"17万元人民币","依法为成员提供西瓜、水果、蔬菜、茶叶、粮食、油茶、烟叶、政策允许的中药材种植所需的生产资料;组织收购、销售成员生产的产品;开展成员所需的贮藏(仅限普通货物)、加工服务;引进和推广相关新品种、新技术;开展相关技术培训、交流和咨询服务;农业观光旅游、农家乐。(依法须经批准的项目,经相关部门批准后方可开展经营活动)",湖南,湘西,"湖南省湘西土家族苗族自治州花垣县龙潭镇金溶村一组"
上海青桃服饰有限公司长沙分公司,91430102MA4Q7ENHXA,2019-01-02,N/A,廖哲,"N/A","在隶属企业经营范围内开展下列经营活动:电力照明设备批发;家用电器零售;文化创意;建筑装饰工程设计;服装、鞋、帽、箱包、体育用品、窗帘、布艺制品、纸制品、玩具、眼镜、空调设备的销售。(依法须经批准的项目,经相关部门批准后方可开展经营活动)",湖南,长沙,"湖南省长沙市芙蓉区定王台街道黄兴中路188号乐和城1-0001(L2017)号商铺"
常德市德山欣禾培训学校有限公司,91430700MA4Q7EKT9N,2019-01-02,N/A,胡少斌,"200万元人民币","艺术类培训(音乐、美术、舞蹈、播音主持、跆拳道、少儿模特)(有效期至2022年12月9日止)。(依法须经批准的项目,经相关部门批准后方可开展经营活动)",湖南,常德,"湖南省常德经济技术开发区德山大道785号(盛世佳园小区1栋二层)"
保靖县世纪恒鑫汽车销售服务有限责任公司,91433125MA4Q7F0827,2019-01-02,N/A,刘丁宇,"50万元人民币","汽车新车零售;汽车配件零售。(依法须经批准的项目,经相关部门批准后方可开展经营活动)",湖南,湘西,"湖南省湘西土家族苗族自治州保靖县清水坪镇清水坪加油站旁"
常德杰成商业管理有限公司,91430703MA4Q7DYT5W,2019-01-02,有限责任公司,朱从敏,"200万人民币","物业管理；商业运营管理：房地产咨询服务，商业活动的策划，房地产销售代理，物业服务管理，广告设计，制作，发布，市场经营管理，摊位出租，文化活动的组织与策划，企业管理服务。",湖南,常德,"湖南省常德市鼎城区郭家铺街道办事处孔家溶9组56号"
岳阳欣丰物流有限公司,91430600MA4Q7DU37R,2019-01-02,有限责任公司,李文娟,"200万人民币","道路货物运输。",湖南,岳阳,"岳阳市屈原管理区营田镇凤凰乡村"
常宁市鸿墒贸易有限责任公司,91430482MA4Q7E1783,2019-01-02,有限责任公司,朱先明,"500万人民币","化工原料及产品（不含危爆品）、有色金属产品及废渣废料加工销售;焦炭、柴煤、烟煤、石灰生产，销售;农副产品、日杂、百货销售;小型机械设备销售;物流运输，渣土挖运。",湖南,衡阳,"湖南省衡阳市常宁市水口山镇大桥居委会安源路24号"
娄底市娄星区大风车馨德幼儿园有限公司,91431302MA4Q7EHR3C,2019-01-02,N/A,严远新,"4800万元人民币","学前教育。(依法须经批准的项目,经相关部门批准后方可开展经营活动)",湖南,娄底,"湖南省娄底市娄星区吉星路与南贸东街交汇处东南角金泰家园旁"
岳阳金吉汽车销售服务有限公司,91430602MA4Q7FEL80,2019-01-02,N/A,万长青,"200万元人民币","汽车零配件、汽车新车的零售;新能源汽车、电动车、汽车零配件、汽车用品的销售。(依法须经批准的项目,经相关部门批准后方可开展经营活动)",湖南,岳阳,"湖南省岳阳市岳阳楼区花板桥路农科组140号(高山坡社区二网格)"
岳阳一德贸易有限公司,91430602MA4Q7DPN9R,2019-01-02,N/A,李智臣,"400(万元人民币)","五金建材批发，砂石、水泥、木制品的销售。",湖南,岳阳,"湖南省岳阳市岳阳楼区白杨坡路455号门面（李家冲社区三网格）"
岳阳圣亨电子商务有限公司,91430611MA4Q7DRL5P,2019-01-02,N/A,屈展辉,"100万元人民币","网上商务咨询;鱼饵、苗木与文化用品的销售;农业技术咨询、交流服务、转让服务;广告制作、广告设计、广告发布;农业园艺服务;农业项目开发;农业生产资料配送、销售;农副产品收购及销售;农产品配送;虾、鱼的养殖;鱼苗批发;会议、展览及相关服务;商业活动的策划;路牌、路标、广告牌的安装施工;电脑打字、录入、校对、打印服务;...",湖南,岳阳,"湖南省岳阳市君山区钱粮湖镇分路口(龙虾小镇101号)"
华容县聚农富龙虾养殖专业合作社,93430623MA4Q7FN03G,2019-01-02,N/A,章瑞香,"150万元人民币","组织收购、供应成员龙虾养殖所需的生产资料;销售成员的产品;引进新品种、新技术;开展成员所需的技术培训、技术交流和咨询服务。(依法须经批准的项目,经相关部门批准后方可开展经营活动)",湖南,岳阳,"湖南省岳阳市华容县治河渡镇学会村2组"
岳阳新德福装饰有限公司,91430621MA4Q7DUTX3,2019-01-02,有限责任公司,刘新军,"300万人民币","建筑装修装饰工程、土矿工程、建筑幕墙工程、公路水利水电工程、钢结构工程、地基与基础工程、防水防腐保温工程、园林绿化工程的施工；建筑劳务分包；建筑材料（不含危险化学品）、装饰材料销售；工程建设项目招标代理服务。",湖南,岳阳,"岳阳县荣家湾镇长丰路与荣新西路交叉口（亿丰时代广场12幢1332号）"
常德市鼎城区德艺轩培训学校有限公司,91430703MA4Q7DY91Y,2019-01-02,N/A,刘玢利,"30万元人民币","文化艺术培训。(依法须经批准的项目,经相关部门批准后方可开展经营活动)",湖南,常德,"湖南省常德市鼎城区斗姆湖街道机场社区常沅路40号"
安乡锦湘稻虾种养专业合作社,93430721MA4Q7EQN83,2019-01-02,N/A,江耀连,"400万元人民币","以成员为主要服务对象:从事稻谷种植、稻田养殖小龙虾及相关产品的加工、销售、运输、贮藏及其他相关服务;提供成员所需生产资料的购买、使用;开展与稻谷种植、稻田养殖小龙虾及加工、经营有关的技术、信息、设施建设运营服务。(依法须经批准的项目,经相关部门批准后方可开展经营活动)",湖南,常德,"湖南省常德市安乡县陈家嘴镇民阜村15002号"
娄底市林锐装饰工程有限公司,91431300MA4Q7E8U05,2019-01-02,有限责任公司,颜林,"1000万人民币","室内外装饰、市政、防水保温、园林绿化工程施工；外墙干挂石材、外墙玻璃幕墙、外墙涂料施工；建筑劳务承包；建材批发；钢架结构安装。",湖南,娄底,"湖南省娄底市娄星区白塘路佳宏小区七栋一单元202"
娄底市娄星区金鑫工程机械修理厂,92431302MA4Q7FC708,2019-01-02,个体工商户,胡奇明,"N/A","工程机械配件、润滑油零售及维修服务。",湖南,娄底,"湖南省娄底市娄星区黄泥塘办事处曹家村五组娄涟公路旁"
平江县梅仙镇飞午种养农民专业合作社,93430626MA4Q7F5681,2019-01-02,N/A,单飞午,"110万元人民币","餐饮经营,家禽类、水产、畜牧等养殖销售,水果、林木种植和销售(依法须经批准的项目,经相关部门批准后方可开展经营活动)",湖南,岳阳,"平江县梅仙镇小源村第八组308号"
娄底市润鑫商贸有限公司,91431302MA4Q7EU3XY,2019-01-02,N/A,郭润初,"218万元人民币","办公用品、预包装食品、粮油、家用电器、服装、鞋帽、金银珠宝饰品、针纺织品、文化体育用品、通讯器材、钢材、建筑材料、五金交电产品、不锈钢制品销售。(依法须经批准的项目,经相关部门批准后方可开展经营活动)",湖南,娄底,"湖南省娄底市娄星区金谷市场七栋三单元北06门面"
吉首市吉联再生资源有限公司综合回收三十七门市部,91433101MA4Q7E7F13,2019-01-02,有限责任公司,谭德平,"N/A","再生资源回收、销售。",湖南,湘西,"湖南省吉首市乾州办事处狮子社区二组46号"
岳阳金辉物流有限公司,91430602MA4Q7DX79C,2019-01-02,N/A,严丽,"100万元人民币","普通货物运输。(依法须经批准的项目,经相关部门批准后方可开展经营活动)",湖南,岳阳,"湖南省岳阳市岳阳楼区鹰山社区西区十三栋503室"
中建鼎正项目管理有限公司湘西分公司,91433101MA4Q7EE62L,2019-01-02,N/A,王勇,"N/A","负责与总公司业务联系及咨询服务。(依法须经批准的项目,经相关部门批准后方可开展经营活动)",湖南,湘西,"湖南省湘西经开区吉凤街道湾溪安置区1号"
平江县岑川镇包湾种养殖农民专业合作社,93430626MA4Q7FA19B,2019-01-02,N/A,秦山南,"N/A","谷物养殖，豆类、油料和薯类、棉、麻、蔬菜及园艺作物、水果、坚果、油料和饮料作物、中药材种植、休闲农业、观光农业、其它农业，造林和育林，木材和竹材采运，木产品采集，牲畜、家禽饲养，其它畜牧",湖南,岳阳,"湖南省岳阳市平江县岑川镇包湾村294号"
娄底中泰物流有限公司,91431302MA4Q7EAK18,2019-01-02,有限责任公司,谭正,"500万人民币","普通货物道路运输服务；物流信息咨询、货运代理、货物包装、搬运、装卸服务；汽车轮胎、汽车维修服务；汽车配件销售。",湖南,娄底,"湖南省娄底市娄星区黄泥塘街道办事处东来村石祠组"
常德市鼎城区天润建材有限责任公司,91430703MA4Q7F0900,2019-01-02,N/A,丁美丽,"100万元人民币","建材批发;建筑工程机械与设备经营租赁;其他机械与设备经营租赁;建筑装饰用石开采;粘土及其他土砂石销售。(依法须经批准的项目,经相关部门批准后方可开展经营活动)",湖南,常德,"湖南省常德市鼎城区镇德桥镇乔家岗村7组"
岳阳君山区欣农龙虾养殖专业合作社,93430611MA4Q7FE9XG,2019-01-02,N/A,杨萍,"200万元人民币","组织采购、供应成员龙虾养殖所需的生产资料;组织收购、加工、贮藏、销售成员所养殖的龙虾;为成员提供信息咨询和业务培训的服务。(依法须经批准的项目,经相关部门批准后方可开展经营活动)",湖南,岳阳,"湖南省岳阳市君山区钱粮湖镇牛奶湖村五组"
常德逸壕运输有限公司,91430724MA4Q7DQM79,2019-01-02,N/A,胡治军,"300(万元人民币)","货物运输代理；道路普通货物运输；货物配载；水泥原材料、矿产品销售。",湖南,常德,"湖南省常德市临澧县新安镇高兴社区五组"
娄底市楚南生态农业有限公司,91431300MA4Q7EFN8G,2019-01-02,有限责任公司,周楚南,"528万人民币","农产品种植、加工及销售;家禽养殖、家畜饲养、加工及销售;水产养殖及销售;苗木种植及销售;园林绿化工程施工及养护服务;餐饮服务;住宿服务。",湖南,娄底,"湖南省娄底市娄星区大科办事处大新居委会刘家组"
岳阳市八哥食品有限公司,91430600MA4Q7FKB4R,2019-01-02,N/A,谭飞明,"218(万元人民币)","芽菜及其制品的研发、销售及技术服务，政策允许的农产品、蔬菜、预包装食品的销售。",湖南,岳阳,"岳阳经济技术开发区金凤桥管理处金凤桥社区湘塘组"
会同县鸿运青蛙养殖专业合作社,93431225MA4Q7FAQ3R,2019-01-02,N/A,林中,"25万元人民币","青蛙养殖及销售;青蛙种苗培养及销售;引进新技术和新品种、开展技术培训、技术交流和咨询服务。(依法须经批准的项目,经相关部门批准后方可开展经营活动)。",湖南,怀化,"湖南省怀化市会同县沙溪乡宝联村五组(村部)"
吉首市吉联再生资源有限公司综合回收四十二门市部,91433101MA4Q7EAJ3D,2019-01-02,N/A,张明平,"N/A","再生资源回收、销售。(依法须经批准的项目,经相关部门批准后方可开展经营活动)",湖南,湘西,"湖南省吉首市乾州街道兔岩社区畜牧局门面"
常德市自由派对文化传播有限公司,91430702MA4Q7EDB7U,2019-01-02,N/A,丁野曾子,"50(万元人民币)","文化活动服务；文化会展服务；日用品、工艺品（不含文物、象牙及其制品）的销售。",湖南,常德,"湖南省常德市武陵区芷兰街道沙河社区武陵大道（新邦壹品小区6幢25楼2516号）"
常德市彦美装饰有限公司,91430702MA4Q7EE467,2019-01-02,N/A,杨亮,"5(万元人民币)","住宅装饰和装修；室内装饰设计服务。",湖南,常德,"湖南省常德市武陵区穿紫河街道朝阳路社区育才路（大中苑小区1栋1单元306室）"
岳阳市岳家家政有限公司,91430602MA4Q7FBL92,2019-01-02,N/A,张中奎,"300万元人民币","家庭服务,家政服务,建筑物清洁服务,住院陪护,母婴陪护,老年人、残疾人养护服务,母婴保健服务(不含医疗诊断),产后恢复服务,交通设备、设施的清洗及维护,市政道路清扫保洁、维护,物业清洁、维护,计算机、办公设备和专用设备维修,家用电器安装、调试、维修,电动工具、照相机、钟表、金属锅盆、陶瓷容器的维修服务。(依法须经...",湖南,岳阳,"湖南省岳阳市岳阳楼区青年路天伦城金三角银座B栋1937室(新城社区一网格)"
宜章县宗胜新能源汽车有限公司,91431022MA4Q7EFBXJ,2019-01-02,N/A,杨光宗,"200万元人民币","新能源汽车销售及售后服务;汽车销售;汽车装饰用品销售、新能源汽车配件、充电设备销售;汽车维修、救援服务;汽车美容服务、汽车租赁服务、新能源车充电桩、换电站建设及经营。(依法须经批准的项目,经相关部门批准后方可开展经营活动)",湖南,郴州,"湖南省郴州市宜章县玉溪镇文明南路99-8号长坪"
岳阳二元健康咨询服务有限公司,91430600MA4Q7DQP1T,2019-01-02,N/A,雷培发,"506(万元人民币)","医疗导诊咨询，药品、医疗器械的销售，健康管理，医院经营管理，健康医疗产业项目的管理、运营。",湖南,岳阳,"岳阳市岳阳楼区站前西路与得胜北路交汇处都市华庭1822房（万籁酒店旁）"
常德市狮子王智慧电气有限公司,91430703MA4Q7FN70T,2019-01-02,N/A,曲建厂,"100万元人民币","电气信号设备装置制造;防盗、防火报警器及类似装置制造及销售。(依法须经批准的项目,经相关部门批准后方可开展经营活动)",湖南,常德,"湖南省常德市鼎城区灌溪镇(湖南常德鼎城高新技术产业园樟窑路-常德科技创新创业孵化产业园第三层306层)"
岳阳正飞物流有限公司,91430600MA4Q7DTH5C,2019-01-02,有限责任公司,胡力强,"300万人民币","道路货物运输。",湖南,岳阳,"岳阳市屈原管理区凤凰乡"
中国邮政储蓄银行股份有限公司湘西经开区支行,91433101MA4Q7FC898,2019-01-02,股份有限公司 国有企业,贺乐,"N/A","凭本企业有效许可证经营经隶属企业授权，中国银行业监督管理委员会依照有关法律、行政法规和其他规定批准的业务。(依法须经批准的项目，经相关部门批准后方可开展经营活动）",湖南,湘西,"湖南省湘西经济开发区武陵山大道8号建发大厦一楼、七楼"
东安县家宝环境服务有限公司,91431122MA4Q7FB23E,2019-01-02,N/A,龙江涛,"30万元人民币","环境卫生管理:清洁服务、市政设施维护、园林绿化服务、江河保洁服务、渠道疏通、市政下水道清疏、市政下水道清淤服务、污水处理、道路清扫保洁、工业固体废弃物处置、除雪、有害生物防制、除四害。(依法须经批准的项目,经相关部门批准后方可开展经营活动)",湖南,永州,"湖南省永州市东安县白牙市镇小心田村东新路366号"
常德市鑫湘昕房地产经纪有限公司,91430703MA4Q7DYX89,2019-01-02,N/A,李湘琴,"10万元人民币","房地产中介服务;房地产租赁经营;策划创意服务。(依法须经批准的项目,经相关部门批准后方可开展经营活动)",湖南,常德,"湖南省常德市鼎城区玉霞街道迎宾社区花溪路632号"
冷水江市生日城大酒店有限公司,91431381MA4Q7F7J7D,2019-01-02,N/A,刘艳辉,"100(万元人民币)","热食类食品、冷食类食品制售；预包装食品、预包装饮料酒销售。",湖南,娄底,"冷水江市锑都中路（东苑大厦五楼）"
岳阳县鸿发再生资源有限公司,91430621MA4Q7EB39R,2019-01-02,有限责任公司,方检军,"50万人民币","废旧船舶拆解，废旧机械设备拆解、回收；废旧物资回收（不含报废汽车及危险废物）。",湖南,岳阳,"岳阳县荣家湾镇鹿角村鹿角片二组"
安仁县益居房地产信息咨询有限公司,91431028MA4Q7ETF15,2019-01-02,N/A,张起清,"20(万元人民币)","房地产中介服务；房地产经纪服务；房地产咨询服务；新建房屋、住宅、非住宅的买卖、租赁代理服务；二手房屋、住宅、非住宅的买卖、租赁代理服务",湖南,郴州,"湖南省郴州市安仁县永乐江镇五一南路"
宜信博诚保险销售服务（北京）股份有限公司郴州分公司,91431000MA4Q7F9D04,2019-01-02,股份有限公司,刘亚玲,"N/A","在湖南省区域内代理销售保险产品；代理收取保险费；代理相关保险业务的损失堪查和理赔；中国保监会批准的其他业务。",湖南,郴州,"湖南省郴州市北湖区大华天都2栋2208号"
安乡攀成稻虾种养专业合作社,93430721MA4Q7EQK3G,2019-01-02,N/A,芮庆祥,"400万元人民币","以成员为主要服务对象:从事稻谷种植、稻田养殖小龙虾及相关产品的加工、销售、运输、贮藏及其他相关服务;提供成员所需生产资料的购买、使用;开展与稻谷种植、稻田养殖小龙虾及加工、经营有关的技术、信息、设施建设运营服务。(依法须经批准的项目,经相关部门批准后方可开展经营活动)",湖南,常德,"湖南省常德市安乡县陈家嘴镇沙河口村03033号"
岳阳仁义物流有限公司,91430600MA4Q7DW649,2019-01-02,有限责任公司,李后明,"300万人民币","道路货物运输。",湖南,岳阳,"岳阳市屈原管理区凤凰乡"
临湘市森琴缘酒业有限公司,91430682MA4Q7DP783,2019-01-02,N/A,吴森林,"200万元人民币","白酒制造;国产酒类、预包装食品销售,互联网上零售。(依法须经批准的项目,经相关部门批准后方可开展经营活动)",湖南,岳阳,"湖南省岳阳市临湘市五里牌时代名都小区16栋东单元405室"
山西凯特通讯有限责任公司新化分公司,91431322MA4Q7E442Q,2019-01-02,N/A,刘治兵,"N/A","在隶属企业经营范围内从事通讯设备维修;通讯设备、家用电器、电子数码产品的销售、安装及维修;代办移动业务(办理综合业务)。(依法须经批准的项目,经相关部门批准后方可开展经营活动)",湖南,娄底,"湖南省娄底市新化县上梅街道东外社区迎宾路81号"
岳阳洪升机械设备租赁有限公司,91430600MA4Q7DX01F,2019-01-02,有限责任公司,杨崎,"300万人民币","建筑工程机械与设备经营租赁。",湖南,岳阳,"湖南省岳阳市屈原管理区凤凰乡"
冷水江市三尖镇大冲家禽养殖场,92431381MA4Q7EKX10,2019-01-02,个体工商户,刘秋山,"N/A","从事鸡、鸭、鱼塘养殖业。",湖南,娄底,"湖南省娄底市冷水江市三尖镇木山村"
常德南院国药控股药房有限公司,91430703MA4Q7EJD16,2019-01-02,有限责任公司,司若成,"100万人民币","西药、中药、医疗用品及器材、卫生用品、日用杂品、纺织及针织品、化妆品、食品的销售。",湖南,常德,"湖南省常德市鼎城区红云街道福广社区红云路（第四人民医院南院内）"
娄底市春梅文化传播有限公司,91431302MA4Q7EGQ98,2019-01-02,N/A,谢春红,"68万元人民币","传统文化活动组织、策划、推广服务;文化艺术咨询、健康咨询服务。(依法须经批准的项目,经相关部门批准后方可开展经营活动)",湖南,娄底,"湖南省娄底市娄星区蛇形山镇檀凤村水美组"
娄底市娄星区克立兹文化培训学校有限公司,91431302MA4Q7FE49F,2019-01-02,有限责任公司,刘春芳,"180万人民币","中小学文化培训。",湖南,娄底,"湖南省娄底市娄星区早元街南侧扶青路西侧盛世华庭二期1栋404(星星试验学校斜对面)"
岳阳市君山区青云建筑有限责任公司,91430611MA4Q7FLE5K,2019-01-02,N/A,王清云,"1,080(万元人民币)","房地产开发经营；建筑装饰工程；景观和绿地设施工程施工；机电设备安装工程专业承包；保安监控及防盗报警系统工程服务；土石方工程；钢结构工程；水电安装工程；建筑装饰材料、环保设备、金属材料、防水材料、机电设备、花卉盆景、水泵阀门、流体控制成套设备及配件的销售。",湖南,岳阳,"湖南省岳阳市君山区钱粮湖镇百花社区八组15号"
平江县萌婴贝贝母婴用品有限公司,91430626MA4Q7EW59L,2019-01-02,N/A,廖书丽,"50(万元人民币)","营养和保健品零售；预包装食品、散装食品、乳制品、服装、鞋帽、玩具、日用百货的零售；婴幼儿配方乳粉销售；连锁企业管理。",湖南,岳阳,"湖南省岳阳市平江县新城区长冲安置区临街27号铺面"
南县新颜建筑劳务有限公司,91430921MA4Q7FM15T,2019-01-02,N/A,徐航,"200万元人民币","其他未列明建筑业;承接建筑施工企业的劳务分包作业;普通道路货物运输;机械设备租赁;土木工程、水利工程、园林绿化工程、市政工程施工。(依法须经批准的项目,经相关部门批准后方可开展经营活动)",湖南,益阳,"湖南省益阳市南县南洲镇新张村6组(原新颜村)"
中吉颐天生态旅游发展有限公司,91430100MA4Q7DWEX5,2019-01-02,N/A,严彬彬,"5000万元人民币","生态农业旅游、文化旅游产业、旅游项目、亚健康干预技术的开发;土壤及生态修复项目的、旅游规划、农业项目规划设计;地方民俗文化的开发利用、展示、推广;健康医疗产业项目的管理、运营;生态保护及环境治理业务服务;自然生态系统保护管理;环境与生态监测;园艺作物种植;花卉作物批发;园艺作物、花卉的收购;文化活动的组织与...",湖南,长沙,"湖南省长沙市雨花区湘府东路二段168号山水熙园5栋1601"
娄底市娄星区英明网络科技有限公司,91431302MA4Q7EHM25,2019-01-02,N/A,尹明,"20万元人民币","网络通讯设备、导航设备技术开发、销售及服务;安防产品、建筑材料、汽车配件、汽车尾气清洁剂、汽车用品销售。(依法须经批准的项目,经相关部门批准后方可开展经营活动)",湖南,娄底,"湖南省娄底市娄星区娄涟公路黄泥塘街道新280小区1栋A84号"
常德鑫潮租赁服务有限公司,91430702MA4Q7E5C46,2019-01-02,N/A,何蕾,"500(万元人民币)","水上运输设备租赁服务，集装箱租赁服务；沿海杂货船货运服务，沿海散货船货运服务，沿海冷藏船货运服务，沿海集装箱船运输服务，沿海货物轮渡服务，配备驾驶员沿海船舶租赁服务，内河杂货船货运服务，内河散货船货运服务，内河冷藏船货运服务，内河集装箱船运输服务，配备驾驶员内河船舶租赁服务，内河船舶拖推运输服务。",湖南,常德,"湖南省常德市武陵区南坪街道望月社区皂果路（荷塘月色小区1-2号楼106、107室）"
临湘市乡情稻虾种养专业合作社,93430682MA4Q7E4U5K,2019-01-02,N/A,肖艳红,"1000万元人民币","组织成员从事稻谷、玉米、棉花的种植,淡水鱼、虾、蟹、鳖、龟养殖,组织收购、销售成员及同类生产经营者的产品,为成员提供相关配套的技术及信息咨询服务。(依法须经批准的项目,经相关部门批准后方可开展经营活动)",湖南,岳阳,"湖南省临湘市江南镇江南村八组40号"
岳阳中久物流有限公司,91430600MA4Q7DUG3T,2019-01-02,有限责任公司,李拥护,"200万人民币","道路货物运输。",湖南,岳阳,"岳阳市屈原管理区凤凰乡凤凰村"
吉首市联农立体农业专业合作社,93433101MA4Q7HF24U,2019-01-03,N/A,杨清茂,"150万元人民币","组织采购、供应成员所需的生产资料;组织收购、销售成员生产的产品;开展成员所需的运输、贮藏、加工、包装服务;引进新技术、新品种,开展技术培训、技术交流和咨询服务。(依法须经批准的项目,经相关部门批准后方可开展经营活动)",湖南,湘西,"湖南省吉首市矮寨镇阳孟村三组"
南县浩之宇农业发展有限公司,91430921MA4Q7J702N,2019-01-03,N/A,李洁清,"1000万元人民币","内陆养殖;水产品销售;食品加工、销售;农副产品收购、加工、销售;家禽、畜牧养殖、销售;农作物种植、销售;泡沫箱生产、销售; 农作物病虫害防治服务;仓储、物流服务; 水产品养殖技术推广服务。(依法须经批准的项目,经相关部门批准后方可开展经营活动)",湖南,益阳,"湖南省益阳市南县茅草街镇八百弓村(原集群村二组)"
双牌县鼎正建筑劳务分包有限公司,91431123MA4Q7JF38R,2019-01-03,N/A,唐华军,"10万元人民币","其他未列明建筑业;建筑劳务分包;建筑材料销售;代理办理图纸设计、工程预算及其报建手续;建筑工程机械、设备经营租赁;房屋建筑工程施工;水电安装服务。(依法须经批准的项目,经相关部门批准后方可开展经营活动)",湖南,永州,"湖南省永州市双牌县泷泊镇紫阳东路检察院旁"
