北京欧美思教育科技发展有限公司长沙分公司,91430111MA4QDCGW5A,2019-04-11,有限责任公司,于雏辅,"N/A","在隶属企业经营范围内开展下列经营活动:应用软件、基础软件开发;软件技术转让;广告制作服务;广告发布服务;教育咨询(不含培训、不含托管);会议服务;文化艺术交流活动的组织;影视策划;计算机软件、计算机辅助设备、文具用品、电子产品、通用仪器仪表、塑料制品、纸制品销售;企业管理服务;广告国内代理服务。...",湖南,长沙,"长沙市雨花区湘府中路18号德思勤城市广场B3至B6栋1127"
常德培森商贸有限公司,91430702MA4QDAXG7D,2019-04-11,有限责任公司,王飞,"220万元人民币","五金产品、服装、家具、灯具、建材(不含砂砾)、计算机、软件及辅助设备、日用家电、家用视听设备、汽车零配件、文具用品、钟表、眼镜、箱、包、化妆品、卫生用品、鞋帽、纺织品、针织品的销售。(依法须经批准的项目,经相关部门批准后方可开展经营活动)",湖南,常德,"湖南省常德市武陵区南坪街道白马社区七组"
常德市优诚设备租赁有限公司,91430703MA4QDCA05P,2019-04-11,有限责任公司,卢春喜,"180万元人民币","建筑工程机械与设备经营租赁。(依法须经批准的项目,经相关部门批准后方可开展经营活动)",湖南,常德,"湖南省常德市鼎城区镇德桥镇同心坝村六组"
安仁县健坤智淘汽车服务有限公司,91431028MA4QDDCM00,2019-04-11,有限责任公司,谭智林,"500万人民币","汽车相关证件代理服务；二手车信息咨询服务；汽车维修与维护；汽车租赁；汽车、汽车配件及用品的销售",湖南,郴州,"湖南省郴州市安仁县永乐江镇五一北路33号1-2号门面"
岳阳精诚档案管理服务有限公司,91430626MA4QD9N18M,2019-04-11,有限责任公司,童韬,"100万元人民币","其他文化艺术业;提供档案咨询、整理、保护、寄存、数字化;档案修复;档案管理服务;档案管理技术服务;档案鉴定;办公用品、计算机软件销售;电脑打字、录入、校对、打印服务;应用软件开发。(依法须经批准的项目,经相关部门批准后方可开展经营活动)",湖南,岳阳,"湖南省岳阳市平江县开发区井墈社区9号二楼(党校对面)"
北京镖行天下国际文化传媒有限公司浏阳镇头分公司,91430181MA4QDBUXX9,2019-04-11,有限责任公司,马强,"N/A","在隶属企业经营范围内承接业务。(依法须经批准的项目,经相关部门批准后方可开展经营活动)",湖南,长沙,"浏阳市镇头镇振兴街49号2楼"
张家界晨希运输有限公司,91430800MA4QDBY489,2019-04-11,有限责任公司,赵绪亮,"300万元人民币","普通货物道路运输服务;渣土清运服务;土石方工程、园林绿化工程施工服务;建筑工程机械与设备租赁服务;建筑劳务分包;室内外装饰设计及施工;建材销售。(依法须经批准的项目,经相关部门批准后方可开展经营活动)",湖南,张家界,"湖南省张家界市永定区沙堤街道办事处沙田村黄家坪组"
常德恒讯通信技术有限公司,91430722MA4QDC749P,2019-04-11,有限责任公司,杨丽,"500万元人民币","其他未列明信息技术服务业;通信工程、智能化工程、安防工程、防雷工程设计、施工及维护;机电设备安装;计算机系统集成、综合布线;通信器材、通信电子产品销售。(依法须经批准的项目,经相关部门批准后方可开展经营活动)",湖南,常德,"湖南省常德市汉寿县龙阳街道花木兰社区龙阳中路75号二楼"
宁乡市城投物业管理有限责任公司,91430124MA4QD9YH90,2019-04-11,有限责任公司,钟双奇,"500万元人民币","物业管理;物业清洁、维护;市政道路清扫保洁、维护;绿化养护;建筑物外墙清洗、翻新服务;建筑物内清洁服务;建筑物管道疏通服务;单位后勤管理服务;商务文印服务;车队管理服务;公司礼仪服务;会议服务;展览服务;安全系统监控服务;汽车清洗服务;日用品寄卖服务;...(依法须经批准的项目,经相关部门批准后方可开展经营活动)",湖南,长沙,"湖南省宁乡市白马桥街道凤形社区一环南路229号"
常德金燕金属制品有限公司,91430703MA4QDCA72M,2019-04-11,有限责任公司,宁海燕,"500万元人民币","金属门窗制造;金属结构制造、建筑、家具用金属配件制造、销售及安装服务;工程围栏装卸施工;塑料制品、五金产品的销售。(依法须经批准的项目,经相关部门批准后方可开展经营活动)",湖南,常德,"湖南省常德市鼎城区石板滩镇石板滩居委会狮子口组"
岳阳泉球五金建材有限公司,91430600MA4QDD2M7W,2019-04-11,有限责任公司,许方球,"50万人民币","五金产品、建材、电子产品（不含无线电管制器材及卫星地面接收设施）、智能家居的销售，网上贸易代理，自营和代理各类商品及技术的进出口（国家限制经营或禁止进出口的商品和技术除外），室内外装饰、设计，水电安装，消防设施工程设计与施工。",湖南,岳阳,"岳阳经济技术开发区白石岭南路128号（滨水新境界第18栋609室）"
岳阳金威文旅小镇建设投资有限公司,91430621MA4QDA1C00,2019-04-11,有限责任公司,郝一夫,"10000万元人民币","以自有资金对文化旅游项目投资【限以自有合法资金(资产)对外投资,不得从事股权投资、债权投资、短期财务性投资及面对特定对象开展受托资产管理等金融业务,不得从事吸收存款、集资收款、受托贷款、发放贷款等国家金融监管及财政信用业务】;景区旅游资源开发;房地产开发;市政工程、园林绿化工程、室内外装修工程施工;...",湖南,岳阳,"岳阳县荣家湾镇金垅村立新组"
临湘市百特文化艺术培训学校有限公司,91430682MA4QDDBR5N,2019-04-11,有限责任公司,石银华,"10万人民币","课外文化、书法（中华人民共和国民办学校办学许可证有效期至2021年12月12日止），教具、文具、玩具的嵌入式软件服务，网上视频服务，乐器、文化用品、图书、报刊、清扫、清洗日用品销售。",湖南,岳阳,"湖南省临湘市长盛西路（河西南路）长安购物公园3号商铺261室"
常德久缘文化传播有限公司,91430725MA4QDA0M65,2019-04-11,有限责任公司,李蓉蓉,"30万元人民币","文化活动服务,社会经济咨询服务,健康咨询服务,其他未列明商务服务,其他专业咨询与调查服务,专业设计服务。(依法须经批准的项目,经相关部门批准后方可开展经营活动)",湖南,常德,"湖南省常德市桃源县漳江街道渔父祠社区浔阳路丹桂嘉苑小区1号"
岳阳双合劳务服务有限公司,91430600MA4QDD6889,2019-04-11,有限责任公司,魏星荣,"200万人民币","劳动力外包服务，建筑材料销售。",湖南,岳阳,"岳阳市南湖新区求索西路恒大名都项目剧场首层109号门面"
娄底市美世美家装饰设计工程有限公司,91431302MA4QDCH34Q,2019-04-11,有限责任公司,彭勇,"100万人民币","室内外设计装潢工程、建筑装饰工程、建筑安装工程、绿化景观工程、钢结构工程、楼宇智能化工程、基础土石方工程、照明工程承包；建筑装饰材料销售。（依法须经批准的项目，经相关部门批准方可开展经营活）",湖南,娄底,"湖南省娄底市娄星区吉星路西侧、同仁街北侧树鑫城市花园小区第4栋109室"
岳阳县嘉乐食品有限公司,91430621MA4QDC8TXE,2019-04-11,有限责任公司,徐朝平,"50万元人民币","农副产品初加工、销售(依法须经批准的项目,经相关部门批准后方可开展经营活动)",湖南,岳阳,"岳阳县筻口镇柒市村柒市片十组"
岳阳市华音文化传媒有限公司,91430602MA4QD9YXX8,2019-04-11,有限责任公司,夏时,"100万元人民币","网络音乐服务,文化艺术咨询服务,文化活动的组织与策划,乐器销售,乐器维修、调试,教育咨询服务(不含培训),企业营销策划,群众参与的文艺类演出、比赛等公益性文化活动的策划,会议及展览服务,广告设计,灯光设备租赁,音频和视频设备租赁,录音制作,音像制作。(依法须经批准的项目,经相关部门批准后方可开展经营活动)",湖南,岳阳,"湖南省岳阳市岳阳楼区建湘路天伦国际6栋4021室(新城社区七网格)"
常德市穗丰房产中介有限公司,91430702MA4QDB5E54,2019-04-11,有限责任公司,高阿兰,"50万元人民币","房地产经纪服务,房地产咨询服务。(依法须经批准的项目,经相关部门批准后方可开展经营活动)",湖南,常德,"湖南省常德市武陵区白马湖街道芙蓉社区三岔路(穗丰新园2栋106号)"
常德市和盈福电子商务有限公司,91430702MA4QDB8N8N,2019-04-11,有限责任公司,何清萍,"300万元人民币","化妆品、卫生用品、纺织品、服装、鞋、帽、电子产品、灯具、日用杂品、箱、包、通讯设备的销售。(依法须经批准的项目,经相关部门批准后方可开展经营活动)",湖南,常德,"湖南省常德市武陵区南坪街道白马社区五组"
常德市顺联物流有限公司,91430721MA4QDCNG9T,2019-04-11,有限责任公司,夏维念,"80万人民币","普通货物道路运输；冷藏车道路运输；货物运输代理。",湖南,常德,"湖南省常德市安乡县深柳镇下码头社区十七组（原安尤乡下码头村十七组）"
常德市德正源人力资源服务有限公司,91430725MA4QDCUP72,2019-04-11,有限责任公司,谢飞,"200万人民币","人力资源管理咨询、企业管理咨询、职业中介服务。",湖南,常德,"湖南省常德市桃源县浔阳街道二里岗社区荷花路阳光世纪小区105号"
常德一碗饭商贸有限公司,91430702MA4QDB5R13,2019-04-11,有限责任公司,姜友波,"220万元人民币","计算机、软件及辅助设备、五金产品、服装、家具、灯具、建材(不含砂砾)、日用家电、家用视听设备、汽车零配件、文具用品、钟表、眼镜、箱、包、化妆品、卫生用品、鞋帽、纺织品、针织品的销售。(依法须经批准的项目,经相关部门批准后方可开展经营活动)",湖南,常德,"湖南省常德市武陵区南坪街道白马社区七组"
常德金庭捌零养老服务有限公司,91430726MA4QDA76X3,2019-04-11,有限责任公司,孙园,"50万元人民币","老年人、残疾人养护服务;养老产业咨询、管理;养老公寓开发、管理;养生保健服务;家政服务;物业管理;健康智能化产品销售。(依法须经批准的项目,经相关部门批准后方可开展经营活动)",湖南,常德,"湖南省常德市石门县楚江街道老西门社区澧阳中路金山大厦16楼05号"
娄底市清建商贸有限公司,91431382MA4QDCUL4Y,2019-04-11,有限责任公司,陈迪清,"100万人民币","服饰、服装、床上用品、母婴用品、珠宝饰品、玩具、鞋、帽、箱包、家用电器、纺织品、日用品、家居用品、文化用品、化妆品、体育用品、家具、工艺品(象牙及其制品除外)、建筑材料(不含危险化学品)、通用机械设备、电子产品、保健用品销售及网上销售。",湖南,娄底,"湖南省娄底市涟源市安平镇水口山村下家湾组"
岳阳国通保安服务有限公司怀化分公司,91431200MA4QDBAY07,2019-04-11,有限责任公司,薛琬月,"N/A","安全防范工程,保安监控及防盗报警系统工程服务,监控系统工程安装服务,信息系统集成服务,弱电工程总承包,综合布线,计算机技术开发、技术咨询、技术服务,软件技术转让,文化艺术活动的组织与策划,人力资源外包服务(不含劳务派遣),安全技术防范产品、消防设备及器材、电子产品(不含无线电管制器材及卫星地面接收设施)的零售。...",湖南,怀化,"湖南省怀化市鹤城区顺天北路与府前路交汇处(智慧大厦605号)"
常德稳进网络科技有限公司,91430722MA4QDC5E8K,2019-04-11,有限责任公司,朱猛,"50万元人民币","应用软件开发;信息技术的推广;计算机软件开发;建材(不含砂砾)、日用品、五金产品、办公用品的批发。(依法须经批准的项目,经相关部门批准后方可开展经营活动)",湖南,常德,"湖南省常德市汉寿县龙阳街道城北社区沧浪东路1栋2单元401号(汉寿县邮政局对面)"
岳阳泰奕诺财务咨询服务有限公司,91430602MA4QDBG277,2019-04-11,有限责任公司,董定红,"50万元人民币","会计咨询,资产评估服务,企业管理服务,代理记账服务。(依法须经批准的项目,经相关部门批准后方可开展经营活动)",湖南,岳阳,"湖南省岳阳市岳阳楼区东茅岭社区兆丰商厦404室(东茅岭社区7网格)"
光大财问企业管理(北京)有限公司邵阳分公司,91430502MA4QDBET59,2019-04-11,N/A,刘希,"N/A","在总公司经营范围内承揽业务:企业管理;网络技术开发、技术服务;企业管理咨询、商务信息咨询、教育信息咨询、经济信息咨询(中介除外);财务咨询(不得开展审计、验资、查帐、评估、会计咨询、代理记账等需经专项审批的业务,不得出具相应的审计报告、验资报告、查帐报告、评估报告等文字材料);企业形象策划;...",湖南,邵阳,"湖南省邵阳市双清区紫薇社区十一组附17号"
宜章县福源达贸易有限公司,91431022MA4QDCK090,2019-04-11,有限责任公司,黄连发,"100万人民币","建材批发；建材零售；钢材、煤炭及制品、矿产品销售。",湖南,郴州,"湖南省郴州市宜章县梅田镇车头村4组"
东安澔特贸易有限公司,91431122MA4QDBUE4A,2019-04-11,有限责任公司,文美林,"20万元人民币","其他家庭用品批发;纺织、服装及家庭用品批发;办公用品销售;日用百货、家用电器及电子产品零售。(依法须经批准的项目,经相关部门批准后方可开展经营活动)",湖南,永州,"湖南省永州市东安县白牙市镇碧园春城B区B区9栋406"
常德盛顺建筑工程有限公司,91430703MA4QDAT86F,2019-04-11,有限责任公司,易德权,"16800万元人民币","住宅房屋建筑;水利水电施工工程;土石方工程施工;其他房屋建筑业;地下综合管廊工程建筑;管道和设备安装;公共建筑装饰和装修;住宅装饰和装修;市政道路工程建筑;市政设施管理;电气安装;管道工程建筑;铁路工程建筑;其他道路、隧道和桥梁工程建筑;园林绿化工程施工;...(依法须经批准的项目,经相关部门批准后方可开展经营活动)",湖南,常德,"湖南省常德市鼎城区玉霞街道常沅社区善卷路2502号(南城天街1号楼1302-1308号)"
娄底市军迪贸易有限公司,91431382MA4QDCU10Y,2019-04-11,有限责任公司,吴建军,"100万人民币","服饰、服装、床上用品、母婴用品、珠宝饰品、玩具、鞋、帽、箱包、家用电器、纺织品、日用品、家居用品、文化用品、化妆品、体育用品、家具、工艺品(象牙及其制品除外)、建筑材料(不含危险化学品)、通用机械设备、电子产品、保健用品销售及网上销售。",湖南,娄底,"湖南省娄底市涟源市安平镇水口山村正屋组"
张家界建国工程机械租赁有限公司,91430800MA4QDD987H,2019-04-11,有限责任公司,樊永搏,"500万人民币","工程机械租赁服务；房屋建筑工程施工服务；土石方工程服务；钢结构、预制建筑物（活动板房）安装及销售；普通货物道路运输服务；渣土运输服务；五金产品、建材销售。",湖南,张家界,"湖南省张家界市永定区大桥办事处且住岗居委会新家园8栋305B室"
常德市如丰鼎贸易有限公司,91430702MA4QDB7Q6W,2019-04-11,有限责任公司,桂华树,"300万元人民币","谷物、豆、薯类、粮油、调味品、化妆品、卫生用品、纺织品、工艺品(不含文物、象牙及其制品)、日用杂品、日用家电、电子产品、文具用品的销售。(依法须经批准的项目,经相关部门批准后方可开展经营活动)",湖南,常德,"湖南省常德市武陵区南坪街道白马社区五组"
常德众淮汽车销售有限公司,91430702MA4QDB8C8C,2019-04-11,有限责任公司,谈磊,"300万元人民币","汽车及零配件批发;商务代理代办服务。(依法须经批准的项目,经相关部门批准后方可开展经营活动)",湖南,常德,"湖南省常德市武陵区南坪街道白马社区龙港路(德商·汇景城9幢2403号)"
张家界均亚牛奶有限公司,91430800MA4QDCT49W,2019-04-11,有限责任公司,骆晓燕,"200万元人民币","牛奶零售及批发、预包装食品零售与批发。(依法须经批准的项目,经相关部门批准后方可开展经营活动)",湖南,张家界,"湖南省张家界市经济开发区C区众创空间3楼B3区"
中盛弘宇建设科技有限公司长沙分公司,91430111MA4QDA380X,2019-04-11,有限责任公司,李博坛,"N/A","在隶属企业经营范围内承接业务。(依法须经批准的项目,经相关部门批准后方可开展经营活动)",湖南,长沙,"长沙市雨花区湘府中路129号高升家园A15栋401"
常德蓝月商贸有限公司,91430702MA4QDAXW8W,2019-04-11,有限责任公司,王飞,"220万元人民币","五金产品、服装、家具、灯具、建材(不含砂砾)、计算机、软件及辅助设备、日用家电、家用视听设备、汽车零配件、文具用品、钟表、眼镜、箱、包、化妆品、卫生用品、鞋帽、纺织品、针织品的销售。(依法须经批准的项目,经相关部门批准后方可开展经营活动)",湖南,常德,"湖南省常德市武陵区南坪街道白马社区七组"
常德市生达安装工程有限公司,91430703MA4QDD2U24,2019-04-11,有限责任公司,鄢生明,"80万人民币","电气安装；水电安装，管道和设备安装，其他建筑安装，住宅装饰和装修，运行维护服务，工程管理服务，工程监理服务，物业管理。",湖南,常德,"湖南省常德市鼎城区玉霞街道永安路裕华明珠小区2号楼2001号"
常德市龙兴建设投资开发有限公司,91430700MA4QDBXE39,2019-04-11,有限责任公司,肖连会,"2000万元人民币","房地产开发经营;城市、农村基础设施的建设与管理;棚户区改造;房地产租赁经营;建筑工程机械与设备经营租赁;住宅及其他房屋建筑;普通货物道路运输;酒店管理;物业管理;信息技术咨询服务。(依法须经批准的项目,经相关部门批准后方可开展经营活动)",湖南,常德,"湖南省常德经济技术开发区樟木桥街道龙潭庵社区(社区大楼6楼)"
岳阳市光耀餐饮服务管理有限公司,91430611MA4QDAA699,2019-04-11,有限责任公司,吴光耀,"300万元人民币","餐饮服务;餐饮管理;农产品销售;预包装食品销售;厨房设备及厨房用品销售。(依法须经批准的项目,经相关部门批准后方可开展经营活动)",湖南,岳阳,"湖南省岳阳市君山区广兴洲镇团湖村村民委员会(原北洲村三组)"
岳阳市特品建筑材料有限公司,91430626MA4QDC0445,2019-04-11,有限责任公司,杨侠,"200万元人民币","建筑材料、通用机械设备、民用净水设备、金属材料、煤炭及制品、智能产品销售;建筑工程施工总承包;工程装饰;建筑工程后期装饰、装修和清理;室内维修;建筑劳务分包;市政公用工程施工总承包;电线、电缆、五金建材、化工产品、日用百货批发;园林绿化工程施工。(依法须经批准的项目,经相关部门批准后方可开展经营活动)",湖南,岳阳,"湖南省岳阳市平江县城关镇家居建材物流园A2栋"
娄底宝淇广告文化传媒有限公司,91431302MA4QDCME61,2019-04-11,有限责任公司,曾政,"100万人民币","广告设计、制作、代理及发布；路牌、灯箱、导识标识系统的设计、制作及安装；庆典礼仪服务；展览展示服务；摄影服务；企业形象、舞台造型、文化艺术交流活动策划服务(不含经营性演出)；企业管理咨询服务；网站建设及设计服务。",湖南,娄底,"湖南省娄底市娄星区春园步行街银街0011幢11—151室"
张家界吉湘疗养院有限公司,91430800MA4QDD0W60,2019-04-11,有限责任公司,赵显峰,"200万人民币","疗养院；职工疗养服务；会议服务；旅客票务代理；汽车租赁；营养健康咨询服务。",湖南,张家界,"张家界市永定区子午路631号东玉楼大酒店内五楼办公区左三号"
宁乡水投建材有限公司,91430124MA4QDC1D4D,2019-04-11,有限责任公司,喻巍,"30000万元人民币","建材、砂石、河卵石销售;建筑用石、碎石加工。(依法须经批准的项目,经相关部门批准后方可开展经营活动)",湖南,长沙,"湖南省宁乡市玉潭街道新山社区八一西路90号"
中航油湖南空港石油有限公司,91430121MA4QDBYM5T,2019-04-11,有限责任公司,王迎春,"1000万元人民币","润滑油、五金产品、预包装食品、烟草制品、化工产品、汽车零配件、日杂零售;办公用品、燃料油(闪点大于60摄氏度,不含成品油、甲醇及危险化学品)、汽车用品、汽车内饰用品、工业重油(不含危险化学品、监控品、易燃易爆品)销售;汽车美容;汽车清洗服务;信息技术咨询服务;油罐、油库、油车的清洗;仓储代理服务;...",湖南,长沙,"湖南省长沙县星沙街道长永高速辅道与星沙大道交叉口西北角香槟花苑1栋103号"
常德德茂防水保温工程有限公司,91430700MA4QDB0Y7H,2019-04-11,有限责任公司,康建明,"600万元人民币","其他房屋建筑业;住宅房屋建筑;园林绿化、环保、体育场地设施工程施工;公共建筑装饰和装修;防水保温工程施工;建筑劳务分包;建材(不含砂砾及危险化学品)销售。(依法须经批准的项目,经相关部门批准后方可开展经营活动)",湖南,常德,"湖南省常德市武陵区南坪街道竹根潭社区东星家具城S19栋5楼101室"
平江县龙峰建材有限公司,91430626MA4QDA428P,2019-04-11,有限责任公司,武龙峰,"100万元人民币","建筑材料、通用机械设备、民用净水设备、金属材料、煤炭及制品、智能产品销售;建筑工程施工总承包;工程装饰;建筑工程后期装饰、装修和清理;室内维修;建筑劳务分包;市政公用工程施工总承包;电线、电缆、五金建材、化工产品(不含危险化学品和易制毒化学品)、日用百货批发;园林绿化工程施工。(依法须经批准的项目,经相关部门...",湖南,岳阳,"湖南省岳阳市平江县城关镇家居建材物流园A2栋"
娄底市华梓贸易有限公司,91431382MA4QDC845M,2019-04-11,有限责任公司,邓丁,"100万人民币","服饰、服装、床上用品、母婴用品、珠宝饰品、玩具、鞋、帽、箱包、家用电器、纺织品、日用品、家居用品、文化用品、化妆品、体育用品、家具、工艺品(象牙及其制品除外)、建筑材料(不含危险化学品)、通用机械设备、电子产品、保健用品销售及网上销售。",湖南,娄底,"湖南省娄底市涟源市安平镇水口山村花屋组"
常德驭道天下汽车租赁有限公司,91430700MA4QDD821X,2019-04-11,有限责任公司,靳梦欣,"10000万人民币","汽车租赁；汽车新车、汽车旧车的销售；互联网生活服务平台；装卸搬运；信息技术咨询服务；网络约车客运服务。",湖南,常德,"湖南省常德经济技术开发区桃林路661号（双创大厦302室）"
娄底江斌气体供应有限公司,91431302MA4QD9NC85,2019-04-11,有限责任公司,江斌,"5万元人民币","氧气、丙烷、乙炔、氮气、二氧化碳、氩气销售。(依法须经批准的项目,经相关部门批准后方可开展经营活动)",湖南,娄底,"湖南省娄底市娄星区湘阳街棉纺厂后院101室"
岳阳市君山区自立电子商务有限责任公司,91430611MA4QDAP13B,2019-04-11,有限责任公司,朱思洪,"100万元人民币","果蔬批发;初级食用农产品销售;农产品初加工服务;网上销售服装、鞋帽、电子产品、农产品、日用百货、针纺织品、塑料制品。(依法须经批准的项目,经相关部门批准后方可开展经营活动)",湖南,岳阳,"湖南省岳阳市君山区富岗路君山工业园标准化厂房二期1栋(集群注册)"
常宁市常青玉龙山建筑材料有限公司,91430482MA4QDDEQ6F,2019-04-11,有限责任公司,姚玉荣,"300万人民币","煤矸石、页岩砖生产、销售；建筑材料销售；装饰材料销售；废渣、废料销售；道路普通货物运输。",湖南,衡阳,"湖南省衡阳市常宁市水口山街道办事处常青中路富源大厦"
岳阳山和水文化旅游发展有限公司,91430602MA4QDAN298,2019-04-11,有限责任公司,陈国斌,"1200万元人民币","旅游资源开发,旅游景区规划设计、开发、管理,航运旅游、文化旅游、商务旅行、工业旅游、农业观光旅游,国内旅游和入境旅游招徕、组织、接待业务,游乐园,国内旅游经营服务,建筑物拆除(不含爆破作业),房屋建筑工程施工,景观和绿地设施工程施工,风景园林工程设计服务,公园、景区内游船出租活动,文化活动的组织与策划,企业形象...",湖南,岳阳,"湖南省岳阳市岳阳楼区青年中路缤纷年华C栋1115室(花板桥社区一网格)"
