宁夏普善机电煤矿设备有限公司,916401005748854504,2011-09-16,N/A,张小英,"200(万)","矿山机械设备及配件、机电产品、电动工具、五金配件、电线电缆、仪器仪表、劳保用品、办公用品、钢材、建筑材料、装饰材料、橡胶制品、日用百货、办公自动化设备、汽车配件、润滑油的销售。",宁夏,银川,"银川市兴庆区世纪小区云开苑17号楼1单元301室"
宁夏安盾商贸有限公司,916401005748855142,2011-09-16,N/A,陈式远,"101(万)","建筑材料、日用百货、服装鞋帽、管道闸门、五金交电、机电产品、水暖配件、照明设备、厨房设备、卫生洁具的销售；防盗门窗、家用电器的销售及安装；电梯的销售。(依法须经批准的项目，经相关部门批准后方可开展经营活动)",宁夏,银川,"银川市兴庆区银横路北侧隆鑫综合市场24号4、5、12、13号营业房"
百家好(上海)时装有限公司银川满德比万达店,91640000574889769R,2011-09-16,N/A,朱学敦,"N/A","从事各类服装、服饰、鞋帽、袜子、手套、箱包、皮革制品、纺织品、服装面料、服装相关配件的零售",宁夏,银川,"银川市金凤区正源北街22号银川金凤万达广场室内步行街一层1058号商铺"
银川广益达节能科技有限公司,91641100574886816W,2011-09-16,N/A,何宝,"50(万)","环保设备的研发、安装及销售；电子产品、工艺美术品的销售；技术咨询、技术服务、技术转让；电子商务",宁夏,银川,"银川市金凤区商贸广场2号楼北楼102号营业房"
宁夏佳力源科贸有限公司,91640100574885522W,2011-09-16,N/A,李佳媛,"101(万)","报纸、图书零售；净水设备、五金交电、建筑材料、化工产品",宁夏,银川,"银川市兴庆区新华西街162号五楼"
宁夏华昆机电设备有限公司,916402005748863068,2011-09-16,N/A,房泽清,"100(万)","电梯及配件、高低压电气设备及配件、机电设备及配件、钢材、铝材、电子产品、五金交电、建筑材料、装饰材料、仪器仪表、办公设备、服装鞋帽、环保设备、消防器材的销售；建筑工程机械租赁；电梯安装、维修保养；超重设备安装、机械设备安装、建筑工程、园林绿化工程、室内装饰工程、消防工程；空调制冷设备销售及安装（在许可证有效期限内开展经营活动）",宁夏,石嘴山,"石嘴山市大武口区黄河西街新月家园16幢1号"
隆德县兴民农机服务有限公司,916404235748858567,2011-09-19,N/A,杨荣,"20(万)","农业机械化整地、播种、收获；农机具销售；蚕豆、土豆购销；农技培训。",宁夏,固原,"宁夏固原市隆德观庄乡大庄村"
丝芙兰(北京)化妆品销售有限公司银川正源北街分公司,91640000574889646Q,2011-09-19,N/A,何中怡,"N/A","香水、化妆品、个人护理用品和其它相关产品、工艺品的零售。",宁夏,银川,"银川市金凤区正源北街22号万达广场一层1028、1029、1030号店铺"
永宁县鑫飞凡贸易有限公司,91640121574886082B,2011-09-19,N/A,杨立明,"100(万)","建材、白灰、五金、劳保用品、标准件、钢材、煤炭销售；道路普通货物运输",宁夏,银川,"宁夏永宁县杨和镇宁和家园42-1号营业房"
宁夏鸿邺房地产开发有限公司,916405002283455310,2011-09-19,N/A,陈江,"2,550(万)","房地产开发经营（以企业资质",宁夏,中卫,"中卫市沙坡头区鼓楼西街"
隆德县景林苗木专业合作社,93640423596243192L,2011-09-19,N/A,马明明,"N/A","造林苗木、城镇绿化苗木生产经营。***",宁夏,固原,"宁夏固原市隆德县奠安乡景林村"
银川鑫庆发商贸有限公司,91640100574886277P,2011-09-19,N/A,马月英,"666(万)","五金交电、建筑材料、环卫设施、公路试验仪器的销售；建筑机械设备的租赁。",宁夏,银川,"银川市兴庆区大新镇上前城6队"
宁夏双闽汽车贸易有限责任公司,91640121574885995H,2011-09-19,N/A,吁蕴华,"500(万)","汽车（不含小轿车）及配件销售",宁夏,银川,"宁夏永宁县望远工业园区永清路北侧"
宁夏浩正实业有限公司,916401005748859361,2011-09-19,N/A,王继玲,"3,000(万)","预包装食品兼散装食品、食用农产品、酒店用品、工艺用品、厨房设备、酒店用品、家具、粮油蔬菜、电讯器材、家用电器、装饰材料的批发兼零售；物流仓储及配送；食品加工及销售；餐饮管理；餐饮服务；酒店管理；企业信息咨询",宁夏,银川,"宁夏银川市兴庆区康平路悦海新天地购物广场15号办公楼2009室"
海原县万兴农业机械化服务有限公司,91640522574886058X,2011-09-19,N/A,王明义,"46(万)","农田耕作、灌溉；农村土地整理服务；为种植农作物，促进其生长或防治病虫害的活动；农作物收割服务",宁夏,中卫,"海原县曹洼乡脱烈行政村"
永宁县蓝春苗木花卉专业合作社,93640121574889718X,2011-09-19,N/A,荀学清,"N/A","组织收购、销售成员种植的苗木、花卉、蔬菜，为成员提供相关的技术、信息服务**(依法须经批准的项目，经相关部门批准后方可开展经营活动)",宁夏,银川,"永宁县李俊镇东方村三组"
宁夏顺翔公路工程有限公司,91640303574886381H,2011-09-19,N/A,谢绍会,"800(万)","沥青拌和、混泥土拌和、稳定土拌和，工程机械租赁、销售，公路工程施工",宁夏,吴忠,"吴忠市红寺堡区黄河路西侧"
固原塞上天润饮品有限公司,91640402L33608963M,2011-09-19,N/A,乔永明,"10(万)","饮料",宁夏,固原,"固原市原州区清清河镇高红村"
银川力克消杀服务有限公司,91640106574886015N,2011-09-19,N/A,马少林,"10(万)","有害生物预防、控制、杀灭服务（法律法规固定，须许可或审批的，凭许可证或审批文件经营）",宁夏,银川,"银川市金凤区上海西路银新苑26号-2-101室"
隆德县丰碑中药材专业合作社,93640423574886154A,2011-09-19,N/A,王国强,"N/A","中药材种植；中药材新品种引进，新技术推广、培训、技术交流和咨询服务；从事农村中药材经纪活动。***",宁夏,固原,"宁夏固原市隆德县凤岭乡冯碑村一组"
宁夏翔宇劳务有限公司,91640100574885960H,2011-09-19,N/A,寇德申,"101(万)","建筑劳务分包；职业介绍服务。",宁夏,银川,"银川市西夏区华荣园14-3号营业房"
中卫市睿智会计服务有限公司,91640500574886314J,2011-09-19,N/A,王希晓,"3(万)","代理记账业务（凭许可证经营）；会计、税务、财务服务",宁夏,中卫,"中卫市沙坡头区文萃南路西侧世纪花园会所12号楼"
宁夏合力万兴汽车制造有限公司,91640300574886517W,2011-09-19,N/A,谭春林,"5,000(万)","专用汽车制造、改装、生产及销售；汽车零部件、环保、环卫设备及垃圾箱的制造、生产与销售；工程机械设备销售；电动环卫车的生产及销售；钢结构、非标准件的制作、安装及销售；技术服务、内部职工技术培训（以上经营范围不含国家禁止经营项目；需经审批及许可的，凭审批手续和许可证经营）",宁夏,吴忠,"吴忠市利通区装备制造产业园区"
宁夏精诚建材工业有限公司,916401005748862500,2011-09-20,N/A,刘成柏,"300(万)","防火卷帘门的生产、安装、销售；建筑材料的生产销售；金属材料（不含危险物质）、装饰材料、化工原料",宁夏,银川,"银川经开区金凤工业园A区18号"
宁夏景中宏园林绿化有限公司,916404255748868835,2011-09-20,N/A,赵杰,"1,000(万)","生态苗木、绿化苗木、经济林苗木、花卉、城市园林绿化(以企业资质等级许可业务范围为准)，景观灯具销售",宁夏,银川,"银川市西夏区朔北路怡祥新村东商17(27-11)号"
宁夏鑫荣小额贷款有限公司,91640381574886322D,2011-09-20,N/A,田文荣,"3,300(万)","依法为青铜峡市辖区内农户、个体工商户、小企业发放小额贷款",宁夏,吴忠,"青铜峡市小坝镇古峡西街16号"
宁夏盐池县通汇农牧科技开发有限公司,9164032357488647XU,2011-09-20,N/A,王淑梅,"100(万)","农业种植；滩羊养殖、屠宰、牛羊肉销售、牛羊杂碎、畜产品、建材、五金、日用百货、劳保用品、工程机械设备、润滑油销售；油气技术服务",宁夏,吴忠,"盐池县花马池西街(龙辰苑小区)"
宁夏信华无忧财税咨询有限公司,916401035748861467,2011-09-20,N/A,强薇,"200(万)","财务咨询服务、会议服务、代理记账业务。",宁夏,银川,"银川市兴庆区清和北街30号东升大厦七楼704室"
宁夏艾维嘉商贸有限公司,91640103574886293Q,2011-09-20,N/A,韩斌,"100(万)","预包装食品兼散装食品、计算机及软件辅助设备、电脑耗材、电器、通讯软件及设备、化工产品",宁夏,银川,"银川市兴庆区东方国际公寓B座1206室"
宁夏广润人力资源有限公司,9164010057488612X1,2011-09-20,N/A,何一帆,"101(万)","人才中介；人力资源咨询服务；企业管理咨询服务；人力资源管理咨询服务；人力资源资源供求信息收集发布；职业介绍和职业指导；人才培训、测评；劳务派遣。",宁夏,银川,"银川市兴庆区南薰东路中房富力城C座923号"
中卫市盛轩物流有限公司,91640500574886496N,2011-09-20,N/A,洪解放,"500(万)","道路普通货物运输",宁夏,中卫,"中卫市沙坡头区应理南街瑞丰家园45号楼"
平罗县鑫泰隆煤业有限公司,91640221574886074M,2011-09-20,N/A,颜成森,"518(万)","炭素制品、耐火材料、焦炭、润滑油、矿石、装饰材料、橡胶制品、建筑材料、五金标准件、兰炭、矿山设备销售；机械加工、销售；煤炭加工、洗选、销售。",宁夏,石嘴山,"平罗县崇岗工业园区(煤炭批发市场)"
宁夏石油化工建设有限公司中宁分公司,91640521574887421L,2011-09-20,N/A,罗安玉,"N/A","承担公司委托的建筑施工项目；非标准件加工。",宁夏,中卫,"宁夏回族自治区中宁县石空镇"
宁夏青铜峡市仁和工贸有限公司,91640381574886656X,2011-09-20,N/A,李淑琴,"300(万)","速凝剂、助磨剂、编织袋、塑料制品、水泥、混凝土及其制品、石灰石粉、砖、瓦、砂、石料、钢材、苗木、化工产品（不含危险化学品）、劳保、机电产品、五金、百货销售；干粉砂浆、混凝土及其制品生产加工销售；货物装卸",宁夏,吴忠,"青铜峡市峡口镇草台子二队"
宁夏普达医药有限公司,91640122574886226B,2011-09-20,N/A,刘冬鸣,"142.8600(万)","I类医疗器械（不含国家审批项目）的销售；医疗技术研发及咨询；物流信息配载服务；会议展览展示；Ⅱ类医疗器械：医用X射线附属设备及部件、医用化验和基础设备器具、消毒和灭菌设备及器具、病房护理设备及器具的销售；Ⅱ、Ⅲ类医疗器械：注射穿刺器械、医用电子仪器设备、医用光学器具仪器及内窥镜设备、医用超声仪器及有关设备、医用激光仪器设备、医用高频仪器设备、物理治疗及康复设备、医用磁共振设备、医用X射线设备、临床检验分析仪器、体外循环及血液处理设备、手术室、急救室、诊疗室设备及器具、医用冷疗、低温冷藏设备及器具、医用卫生材料及辅料、医用缝合材料及粘合剂、医用高分子材料及制品、软件的销售；中成药、中药饮片、化学药制剂、抗生素、生化药品（以上范围不含冷藏、冷冻药品）的销售。（经营范围兼营）农副产品收购",宁夏,银川,"银川德胜工业园区沁园路12号"
银川市西夏区鑫荣种养殖农民专业合作社,93640105574887085G,2011-09-20,N/A,金丹,"N/A","谷物、水果、蔬菜、花卉种植；家畜、家禽养殖。**(依法须经批准的项目，经相关部门批准后方可开展经营活动)",宁夏,银川,"银川市西夏区农牧场十三队"
宁夏兄弟欣源商贸有限公司,91640100574886218L,2011-09-20,N/A,张亚军,"210(万)","法律法规明确或国务院决定须经审批的项目，经相关部门批准后方可开展经营活动；无须审批的，企业自主选择经营项目开展经营活动。",宁夏,银川,"银川市金凤区良田镇和顺新村自建房"
宁夏百杰通贸易有限公司,91641100574886955K,2011-09-20,N/A,郭丽华,"100(万)","I类、II类医疗器械",宁夏,银川,"银川市金凤区宁安大街490号银川IBI育成中心1号楼5层513室"
银川市宁东东诚商贸有限公司,91641200574886541L,2011-09-20,N/A,王冬燕,"50(万)","针纺织品、劳保用品、办公用品、五金、建材、机械设备、家用电器、日用百货、化工产品",宁夏,银川,"宁东镇紫荆花广场金花超市西侧"
吴忠市利通区学花种植专业合作社,93640302574890495C,2011-09-20,N/A,马小军,"N/A","玉米的种植及销售****",宁夏,吴忠,"宁夏回族自治区吴忠市利通区南环路"
宁夏科进投资置业有限公司,916411005748872377,2011-09-20,N/A,马海华,"7,500(万)","资产管理（依法需取得许可和备案的项目除外，不含证券投资、基金管理）；投资咨询服务",宁夏,银川,"银川金凤区瑞银财富中心C座25层"
银川正德文化传媒有限公司,916401225748861708,2011-09-20,N/A,吕艳荣,"10(万)","企业形象及营销策划；会议会展、婚庆、礼仪的策划及承办服务；动漫设计；计算机平面设计、效果图设计；网页的设计及制作；摄影摄像服务；设计、制作、发布国内各类广告业务；舞台灯光影响设备的租赁；餐饮业管理服务；家政服务；保洁服务",宁夏,银川,"贺兰县永胜花园B区1号楼4号营业房"
宁夏弘益生物医药有限公司,916401005748863731,2011-09-20,N/A,马正奎,"101(万)","Ⅱ、Ⅲ类:医用卫生材料及敷料、医用缝合材料及粘合剂、医用高分子材料及制品（一次性输液器除外）、注射穿刺器械（一次性注射器除外）、医用电子仪器设备、物理治疗及康复设备、医用Ｘ射线设备、手术室、急救室、诊疗室设备及器具、体外诊断试剂；Ⅱ类：基础外科手术器械、中医器械、普通诊察器械、医用化验和基础设备器具、病房护理设备及器具、消毒和灭菌设备及器具、仪器仪表、玻璃仪器、化学试剂",宁夏,银川,"宁夏银川市兴庆区兴水路1号绿地21城D区20号楼401（复式）室"
中卫市隆城酒店有限公司,91640500574886576A,2011-09-20,N/A,唐政,"600(万)","餐饮服务：大型餐馆",宁夏,中卫,"中卫市沙坡头区鼓楼东街五环广场西侧"
宁夏红枸杞产业有限公司,91640521574886568W,2011-09-20,N/A,王黎明,"10,000(万)","枸杞系列产品、葡萄酒及果酒、配制酒、其他蒸馏酒及纯净水、果汁系列饮料生产、销售；预包装食品（不含冷藏冷冻食品）销售；农副产品（不含粮食）种植、收购、初加工、销售；工艺品销售",宁夏,中卫,"宁夏回族自治区中宁县新堡镇"
宁夏绿墅房地产开发有限公司,91640400574886410N,2011-09-20,N/A,毛蓬,"1,200(万)","房地产开发经",宁夏,固原,"宁夏固原市原州区城区东关路428-3号"
宁夏隆翔宾馆(有限公司)宁东分公司,916412005748890649,2011-09-21,N/A,张恒,"N/A","住宿；日用百货、饮料、食品销售。",宁夏,银川,"宁东中央大道东龙商业中心15号楼"
银川平顺安建设工程技术咨询服务有限公司,91640103585350988P,2011-09-21,N/A,王学华,"3(万)","建设工程技术咨询服务；仪器仪表、文化用品销售。",宁夏,银川,"银川市兴庆区民族北街隆湖小区15-3-102号"
青铜峡市润和林果种植专业合作社,93640381574887165G,2011-09-21,N/A,方亮,"N/A","林果、苗木繁育、种植、销售及相关技术咨询服务***",宁夏,吴忠,"青铜峡市树新林场沿山分场"
宁夏和金重工有限公司,91641100574886840D,2011-09-21,N/A,赵巍,"500(万)","石油化工设备、电力设备、冶金设备、环保设备的加工制造；机械设备、管道配件、标准件、化工产品",宁夏,银川,"银川经济技术开发区经三东路129号"
宁夏新源同德医疗设备有限公司,916401005748887156,2011-09-21,N/A,张志艳,"118(万)","法律法规明确或国务院决定须经审批的项目，经相关部门批准后方可开展经营活动；无须审批的，企业自主选择经营项目开展经营活动。(依法须经批准的项目，经相关部门批准后方可开展经营活动)",宁夏,银川,"宁夏银川市兴庆区银河家园三区9号楼C单元701室"
固原华商天然气有限公司,91640400574886824T,2011-09-21,N/A,王建国,"100(万)","气瓶充装；天然气销售、批发、储存，光伏发电建设及运营。",宁夏,固原,"固原市原州区长城路西侧"
银川天之艺图文设计有限公司,91641100574889494X,2011-09-21,N/A,王巍,"5(万)","广告设计及制作、图文设计（（国家法律、法规规定须经批准的经营项目凭批准的文件或资质证经营）",宁夏,银川,"银川市金凤区新昌西路紫荆花商务中心D座607室"
宁夏利拓农业开发有限公司,9164000057488671XW,2011-09-21,N/A,曾富洪,"100(万元人民币)","蔬菜、水果种植及销售",宁夏,银川,"永宁县望洪镇望洪村六队109线西侧"
宁夏厚正商贸有限公司,91640200574888926T,2011-09-21,N/A,王卫军,"100(万)","烟花（C、D)、爆竹（B、C）的零售；五金交电、电子元件、水处理设备、环保设备、计算机软件及耗材、办公用品、文具用品、通讯器材、照明电器、工艺品、婚庆礼仪用品、工程机械设备及配件的销售",宁夏,石嘴山,"石嘴山市大武口区潮湖下庄原育英中学库房"
宁夏谦润商贸有限公司,916403005748867367,2011-09-21,N/A,杨建其,"100(万)","广告材料、装饰材料、办公用品、文体用品、办公家具、五金工具、钢材、不锈钢制品、机电设备（不含小轿车）、电线电缆、环保设备、水处理设备、电子产品、电讯器材、音响设备、舞台设备、LED照明及设备、管道阀门、玻璃制品、五金轴承、标准件、工程机械设备及配件、花卉苗木、日用百货、工艺礼品、服装鞋帽、针纺织品、劳保用品、工业用盐（按照《盐业管理条例》规定经营、不得用于食用盐销售）、消毒清洁用品的销售；非标件加工；广告牌加工、制作及销售",宁夏,吴忠,"吴忠市文卫路明珠苑A段商网"
固原中信投资有限公司,91640403574888563L,2011-09-21,N/A,谢桂霞,"500(万)","向房地产、矿产、商业、工业、农业、养殖业、机械、道路工程以及新建在建项目、营运车辆及非营运车辆提供投资(依法需取得许可和备案的项目除外；不得吸收公众存款、不得非法集资）；工程机械租赁",宁夏,固原,"宁夏回族自治区固原市原州区文化西街"
富迪健康科技有限公司宁夏分公司,91640000585355439W,2011-09-21,N/A,陈怀啸,"N/A","销售隶属企业生产的服装、化妆品、健身器材、保健日用品、洗涤剂、家用厨具、家用饮水机，销售隶属企业自产产品。",宁夏,银川,"银川市新昌路紫荆花商务中心A座9层901室"
银川市宁东中宝劳务输出有限公司,91641200574886832P,2011-09-21,N/A,刘志,"500(万)","劳务输出，劳务派遣，委托招聘，劳动事务处理，职业介绍，停车管理，劳务咨询服务，劳务承包，劳务分包，租赁，运输服务，建筑工程承包及分包，室内外装饰装修，水电暖安装，市政工程，园林绿化，排水工程，道路工程,防水、防腐及桩基工程，起重设备安装、拆卸；房屋及设备租赁；土方工程；建筑门窗制作、安装；林木苗种子培育，苗圃、花卉种植；建筑材料销售。",宁夏,银川,"宁夏回族自治区宁东古窑子"
彭阳县守贵建材有限责任公司,91640425574886963Q,2011-09-21,N/A,马守贵,"50(万)","百货、建筑建材、五金(不含卫星地面接收设施)、文化体育用品、竹胶板、竹杆、水泥制品销售；钢架焊接安装服务",宁夏,固原,"彭阳县城阳乡城阳村"
固原市原州区小季家具加工厂,92640402MA761EBC76,2011-09-21,个体工商户,季建强,"N/A","家具加工及销售。(依法须经批准的项目，经相关部门批准后方可开展经营活动)",宁夏,固原,"二中梁99号"
银川津雍商贸有限公司第一分公司,9164010657488882XX,2011-09-21,N/A,刘萍,"N/A","服装鞋帽、日用百货、装饰材料、通讯器材销售（法律法规规定需经审批的，凭审批批准文件经营）",宁夏,银川,"银川市金凤区正源北街22号万达广场室内步行街二层2029号商铺"
彭阳县林峰苗木营销专业合作社,9364042557489973X2,2011-09-21,N/A,郭有录,"N/A","绿化、生态、经济林苗木、花卉生产经营、园林绿化，小秋杂粮种植，园林机械销售***",宁夏,固原,"彭阳县城阳乡陈沟村"
永宁县众帮农机作业服务有限公司,91640121574886701P,2011-09-21,N/A,吴红利,"30(万)","农机耕作服务、农机咨询服务；农作物种植；二级农业机械综合维修（农业机械、农机具维修、保养）；农机配件销售、农业技术信息服务",宁夏,银川,"宁夏永宁县良种繁殖场"
银川宝顺捷物流有限公司,91640100574887130F,2011-09-21,N/A,刘慧,"101(万)","货运信息咨询；建筑材料、装饰材料的销售；道路普通货物运输。",宁夏,银川,"宁夏银川市兴庆区众一物流园信息大厅3-19号"
海原县裕民马铃薯专业合作社,93640522574890823Y,2011-09-21,N/A,田维荣,"N/A","以本社从事马铃薯生产经营的农民为主要服务对象：组织采购、供应成员所需的农业生产资料；新产品、新技术引进、试验、示范及推广，病虫害统防统治；开展技术培训和交流；为成员提供产品的销售、储藏、加工、运输以及与农业生产经营有关的技术、信息等服务**(依法须经批准的项目，经相关部门批准后方可开展经营活动)",宁夏,中卫,"海原县海城镇武塬行政村"
宁夏恒通佳宜建筑工程有限公司,9164020057488655X0,2011-09-21,N/A,郑文孝,"1,500(万)","土石方工程三级；建材、环保设备、金属材料（不含危险化学品）、机电设备的销售",宁夏,石嘴山,"大武口区永乐南路225号"
银川华利通衡器销售有限公司,91640122MA75XXBR5J,2011-09-22,N/A,刘洪涛,"10(万)","计量器具、建材、五金的销售。",宁夏,银川,"贺兰县宝庆国际花园综合办公楼23号营业房"
宁夏华麟装饰设计有限公司,91641100574887253W,2011-09-22,N/A,柳荣,"100(万)","建筑装饰装修工程设计；建筑幕墙工程设计。",宁夏,银川,"银川市金凤区聚和公寓3号商住楼16号营业房一楼"
宁夏吴忠市鑫睿机械设备租赁有限公司,916403005748871069,2011-09-22,N/A,马帅,"100(万)","机械设备租赁；机械设备、钢材、五金交电、机电产品（不含小轿车）、水泥的销售",宁夏,吴忠,"吴忠市利通区中央大道三区B座五号楼"
宁夏北方温和房地产开发集团有限公司青铜峡第二分公司,91640381574893792D,2011-09-22,N/A,杨彦聪,"N/A","房地产开发经营业务联系；房屋租赁",宁夏,吴忠,"青铜峡市规划路两侧、唐条路东侧"
宁夏平罗县易丰冷储保鲜有限公司,91640221574887173F,2011-09-22,N/A,张振斌,"100(万)","水果、蔬菜保鲜、冷储、销售。",宁夏,石嘴山,"平罗县城关镇前丰村（城关镇辖区前锋小学）"
宁夏亿佳信科贸有限公司,916401005748872883,2011-09-22,N/A,程华,"1,000(万)","教学设备、舞台灯光设备、音响设备、电子产品、办公设备及用品、体育器械、通讯器材、家用电器、教学玩具、视频会议设备的销售；计算机系统集成及综合布线。",宁夏,银川,"银川市兴庆区清和北街西侧宁景花园2幢13号"
中卫市兴炭金沙商贸有限公司,91640500574887392U,2011-09-22,N/A,张建国,"50(万)","建材、五金、水暖配件、办公用品、日用百货的销售。",宁夏,中卫,"中卫市沙坡头区滨河镇炭场子村部内"
宁夏鑫鸿翔广告传媒有限公司,91640100574887296X,2011-09-22,N/A,张永昌,"101(万)","设计、制作、发布国内各类广告业务；图文设计、制作；会议会展服务、礼仪庆典服务；企业形象策划；企业营销策划；商务咨询；企业管理咨询；办公用品、体育器械的销售。",宁夏,银川,"银川市兴庆区玉皇阁北街75号楼7号营业房一层"
平罗县广源工贸有限公司,91640221574887114C,2011-09-22,N/A,赵俊,"500(万)","煤炭加工、洗选、销售；有机腐植酸销售；型煤粘合剂加工、销售；炭素制品、焦炭、钢材、建材、水泥制品、塑料制品、复合肥销售；滑石粉加工、销售。",宁夏,石嘴山,"宁夏回族自治区平罗县崇岗工业园区"
宁夏万菲达工贸有限公司,916401005748872028,2011-09-22,N/A,韩飞,"101(万)","化工产品",宁夏,银川,"银川市兴庆区利民南街250号"
固原步瑞得企业管理咨询服务有限公司,916404045748872299,2011-09-22,N/A,马鹏,"10(万)","市场战略及营销推广、企业发展规划、投资可行性研究、融资、节能咨询服务。",宁夏,固原,"固原市经济开发区同康街"
宁夏煤炭质量检测有限公司,91640000574889793A,2011-09-22,N/A,郑国敏,"500(万)","煤炭检测、焦炭检测、炭素检测、活性炭检测、水质检测、岩石矿物检测、垃圾检测",宁夏,银川,"银川兴庆区文化西街16号"
