宁夏鑫虎建筑装饰工程有限公司,91640300574858735B,2011-06-15,N/A,马金福,"200(万)","广告设计；户内外广告工程；建筑装饰材料、五金机电、化工产品（不含危险品及易制毒品）、厨房设备、玻璃制品、通信设备、电气热水器、饰品、工艺品的批发及零售",宁夏,吴忠,"吴忠市胜利西街国际家居建材城"
银川杰伟嘉服装商贸有限公司,9164010457485964XP,2011-06-15,N/A,常延飞,"50(万)","服装销售",宁夏,银川,"银川市兴庆区星光花园14号综合楼正立面十六层15号房"
灵武市德晟工贸有限公司,91640181574858495G,2011-06-15,N/A,齐海涛,"500(万)","门窗、钢结构、机械零部件制作、加工、销售；建筑附属工程施工；中空玻璃、建筑材料",宁夏,银川,"宁夏回族自治区灵武市农场场部"
宁夏东宇手抓餐饮有限公司,916401005748583132,2011-06-15,N/A,王进福,"2,000(万)","中餐类制售、含凉菜、含生食海产品、不含裱花蛋糕。",宁夏,银川,"银川市兴庆区利民南街238号"
宁夏中卫市山汉西甜瓜流通专业合作社,93640500574860202L,2011-06-15,N/A,陈学明,"N/A","组织成员及农户开展水果、坚果（西甜瓜、西瓜、枸杞、红枣）的种植、收购、销售；",宁夏,中卫,"中卫市沙坡头区香山乡瓜果市场"
吴忠市丽华林果种植专业合作社,93640302585355324W,2011-06-15,N/A,王云,"N/A","依法为成员提供林果种植所需生产资料的购买，收购和销售成员生产的果品，为成员提供林果种植方面的技术指导、信息咨询服务***",宁夏,吴忠,"吴忠市利通区扁担沟镇五里坡村"
吴忠市利通区泽鹏机床加工厂,92640302MA7718Q84L,2011-06-15,个体工商户,尹少刚,"N/A","机床加工、钢板剪切、电气焊。(依法须经批准的项目，经相关部门批准后方可开展经营活动)",宁夏,吴忠,"吴忠市利通区郭家桥乡山水沟村三队"
宁夏盛世创业电子有限公司,91640100574857978J,2011-06-15,N/A,井小东,"501(万)","计算机系统集成及综合布线；广告宣传；印刷品制作；建筑设计；装饰设计；机电安装；计算机及辅助设备、数码产品、办公用品、LED显示屏、安防产品、劳保用品、润滑油、化工产品",宁夏,银川,"银川兴庆区中山南街12号"
吴忠市泽源肉牛养殖专业合作社,93640302064759833B,2011-06-15,N/A,马少波,"N/A","依法为成员提供肉牛养殖所需生产资料，收购和销售成员养殖的肉牛，为成员提供与肉牛养殖有关的技术指导和信息咨询服务，饲草加工***",宁夏,吴忠,"宁夏回族自治区吴忠市孙家滩开发区"
宁夏天韵音响设备有限公司,916402005748581455,2011-06-15,N/A,张建发,"500(万)","音响、灯光、舞台设备、计算机软硬件、数码电子视屏、酒店用品（不含许可经营项目）、办公用品、装饰材料、建筑材料、电线电缆、机电产品、灯具、电子产品、LED电子屏、数码产品、办公耗材、五金、监控设备、铁艺护栏、工艺礼品、家用电器、体育器材、通讯设备、警用装备器材的销售；厨房设备的销售和维修；演出策划服务；音响设备租赁、安装调试服务；家政服务；物业服务；室内外装饰装修工程；软件开发；LED显示屏、液晶拼接屏幕触控一体机销售及维修(依法须经批准的项目，经相关部门批准后方可开展经营活动)",宁夏,石嘴山,"宁夏石嘴山大武口区文明北路284-7"
泾源县新月生态园有限公司,916404245748584446,2011-06-15,N/A,陈文明,"100(万)","餐饮、住宿；会议培训服务；场地租赁；停车；苗木种植与销售；生态旅游。",宁夏,固原,"宁夏泾源县香水镇新月村"
中国石化销售有限公司宁夏石油分公司固原长城路加油站,916404005748595512,2011-06-15,N/A,李广珠,"N/A","汽油、柴油、润滑油的零售；日用百货的销售，汽车清洗服务；烟草制品、劳保用品、文化用品销售；预包装食品兼散装食品、乳制品",宁夏,固原,"宁夏固原市经济开发区长城路277号"
灵武市华伟果蔬营销专业合作社,9364018157486801XD,2011-06-15,N/A,唐自华,"N/A","牲畜、家禽的养殖；农作物、林木的种植；组织采购供应成员养殖、种植所需的生产资料；组织收购、销售成员养殖和种植的产品；引进新技术、新品质；开展技术培训、技术交流和咨询服务；农副产品、粮油、调味品的批发及零售；果品、蔬菜的储藏、包装服务；发布果品营销信息。(依法须经批准的项目，经相关部门批准后方可开展经营活动)",宁夏,银川,"灵武市东塔镇果园村八队"
中国石化销售有限公司宁夏银川石油分公司源丰加油站,9164010357489017XX,2011-06-15,N/A,张世铎,"N/A","汽油、柴油、润滑油、日用百货、劳保用品、文化用品、食品、烟草的零售。",宁夏,银川,"银川市兴庆区掌政镇横城村S203道南侧"
宁夏中国国际旅行社(有限公司)新一中营业部,916401045748599223,2011-06-15,N/A,陈一雪,"N/A","从事招待旅游者、提供旅游咨询服务",宁夏,银川,"银川市兴庆区凤凰花园B区11号商住楼14号"
宁夏博众钢幕工程有限公司,916401005748585407,2011-06-15,N/A,李元,"500(万)","建筑安装工程施工。",宁夏,银川,"银川兴庆区民族南街光耀美居五层营业房A535号"
重庆群洲实业(集团)有限公司宁夏分公司,91640104574860114H,2011-06-15,N/A,王维,"N/A","一般经营项目：房屋建筑工程施工总承包壹级，市政公用工程施工总承包壹级，公路工程施工总承包贰级，水利水电工程施工总承包贰级，土石方工程专业承包壹级，建筑装修装饰工程专业承包壹级，地基与基础工程专业承包叁级，钢结构工程专业承包壹级、环保工程专业承包叁级（以上范围以资质证核定的范围为准）",宁夏,银川,"银川市兴庆区民族南街771号光耀美居五层C区553"
宁夏博宇投资有限公司,91640000574858284H,2011-06-15,N/A,哈金贵,"8,000(万)","向煤炭开采和洗选业、黑色金属冶炼及压延加工业、房地产业、物流运输业、建筑业、电石铁合金业、酒店餐饮业、商贸业的投资。",宁夏,石嘴山,"宁夏回族自治区宁夏石嘴山工业园区"
宁夏万齐源果业有限公司,91640500574858137R,2011-06-15,N/A,郭艳,"962(万)","水果、坚果的种植、销售；农产品配送、仓储、冷藏。",宁夏,中卫,"中卫市沙坡头区迎水镇杨渠村林场"
宁夏燕军工贸有限公司,916401005748586638,2011-06-16,N/A,李静军,"101(万)","建筑材料、日用百货、机械设备、机电设备、电子产品、床上用品、化妆品、玩具、工艺品、水暖配件、电线电缆、劳保用品、沙石料的销售；工程信息咨询服务。",宁夏,银川,"银川市兴庆区银佐路满春村春晨苑1号商住楼05号营业房"
银川正青禾财务咨询有限公司,916401035748590095,2011-06-16,N/A,董丽娟,"10(万)","代理记账、财务咨询、工商代理。",宁夏,银川,"银川市兴庆区北京东路清和园4号210室"
宁夏泰瑞力克机械精工制造有限公司,91641100574859105F,2011-06-16,N/A,丁红兵,"500(万)","机械设备(不含特种设备)的制造与维修；机械零部件及模具的加工；结构件制作；五金交电销售.（法律法规规定须经审批的,凭审批批准文件经营)",宁夏,银川,"银川经济技术开发区中小企业创业园16号厂房东面"
宁夏泰利龙轮胎橡胶有限公司,91640121574859455N,2011-06-16,N/A,刘兴太,"1,000(万)","轮胎销售、货运信息服务、货运代理、仓储理货、搬运装卸",宁夏,银川,"宁夏永宁县望远工业园区"
宁夏宏大铝业有限公司,91640100574858655D,2011-06-16,N/A,林正华,"200(万)","门窗、铝型材、塑钢型材、涂料、电线电缆、建筑材料的销售（法律法规规定须经审批的经营项目，评审批文件或许可证经营）",宁夏,银川,"银川兴庆区长城东路336号营业房"
陕西华夏建筑设计有限公司银川分公司,916411005748591995,2011-06-16,N/A,马海军,"N/A","建筑工程的设计、勘察、监理、工程概预算；室内装饰及工程项目规划的设计（国家法律、行政法规和国务院决定规定必须报经批准或许可的，凭批准文件或有效许可证经营）",宁夏,银川,"银川市金凤区满城北街17A-1号营业房"
宁夏江宏达劳务有限公司,91640100574858700E,2011-06-16,N/A,张江宏,"101(万)","劳务分包；劳务中介服务；劳务派遣。",宁夏,银川,"银川市金凤区银新南路紫园小区3-1-1"
宁夏利阁容商贸有限公司,91640500574858858N,2011-06-16,N/A,刘峰,"100(万)","预包装食品、乳制品（不含婴幼儿配方乳粉）零售（有效期至2017年5月31日）；矿产品（专项审批项目除外）、建材及化工产品（危险化学品除外）、机械设备",宁夏,中卫,"中卫市沙坡头区鼓楼东街（长途汽车站对面）"
银川广煜龙电子科技有限公司,916401065748593912,2011-06-16,N/A,张伟,"30(万)","计算机、软件及辅肋设备、安防产品（不含禁止及许可类项目）、机械设备、五金交电、电子产品（不含品牌汽车和卫星地面接收设施）、建材（不含木材）、汽车装饰用品、办公用品销售；计算机系统集成；软件开发",宁夏,银川,"银川市金凤区紫馨苑36号楼4号营业房"
宁夏现代通信有限公司馨和分公司,916401065748602535,2011-06-16,N/A,蔡兵,"N/A","电话机、传真机、BP机等通信终端设备、电子产品、五金交电、办公自动化设备、家用电器批发、零售、维修；代办移动通信业务(依法须经批准的项目，经相关部门批准后方可开展经营活动)",宁夏,银川,"银川市金凤区正源北街东侧馨和苑2-7号营业房"
石嘴山市新宇兰山电碳有限公司,91640200574859076W,2011-06-16,N/A,陈进斌,"500(万)","多晶硅、单晶硅零部件的加工、销售；石墨及炭素制品加工及销售；五金、建材、水暖部件、机电设备零配件的销售",宁夏,石嘴山,"石嘴山市大武口区工业园区、110国道东、欣盛路北"
宁夏海德斯曼电液控制技术有限公司,91640100574858890D,2011-06-16,N/A,王学工,"500(万)","电液控制设备及售后服务；液压阀门、液压软管、机械零部件销售；电气自动化设备、电力设备及配件、高低压电器、机械设备、劳保用品、五金交电、建筑材料、装饰材料、塑料制品、服装鞋帽、办公用品及耗材、煤炭、焦炭、钢材、电子产品、铁矿石、氧化球团、消防材料、阀门、水泵、轴承、汽车（不含乘用车）、通讯设备的销售；安全监测设备、家用电器、机械设备的维修；计算机软件技术服务 。",宁夏,银川,"银川市兴庆区清和南街东方国际公寓15层15号"
宁夏万里食品包装机械有限公司,91640100574858583L,2011-06-16,N/A,陈玉华,"101(万)","食品机械、包装机械、厨房设备、制冷设备、机电产品、五金交电、电动工具的销售（法律法规规定须经审批的经营项目，评审批文件或许可证经营）",宁夏,银川,"银川市兴庆区中山南街201号"
银川市盛世天下商贸有限公司,9164010057485892XM,2011-06-16,N/A,丁来霞,"110(万)","日用百货、预包装食品、服装鞋帽、家用电器、电子产品、计算机及耗材的销售；预订酒店代理；策划及承办各类会议服务；投资管理咨询。",宁夏,银川,"银川市兴庆区新华西街新宁园5单元401室"
永宁县欣龙保洁有限公司,91640121574862742J,2011-06-16,N/A,姚欣龙,"10(万)","保洁服务、餐饮服务、家政服务（需经审批未获得审批项目的不得经营）",宁夏,银川,"永宁县城宁和北街农村信用联社楼下"
宁夏昊亿贸易有限公司,916411005748588669,2011-06-16,N/A,孙昊,"100(万)","五金交电、建筑材料、钢材、机电设备、仪器仪表、日用百货、塑料制品、包装材料、劳保用品、工矿设备及产品、化工产品（不含易制毒及危险化学品)、阀门、管件、管材、水暖配件、金属材料",宁夏,银川,"银川市金凤区民生城市花园居园12号楼1204号房"
宁夏塞上四季阳光餐饮有限公司,91640100574858620T,2011-06-16,N/A,马占良,"400(万)","中餐类制售、快餐、火锅、不含凉菜、不含裱花蛋糕、不含生食海；酒店咨询管理。",宁夏,银川,"银川市金凤区长城花园南区28号楼12号营业房"
中能新源宁夏同心风力发电有限公司,91640324574858874T,2011-06-16,N/A,高松林,"100(万)","新能源投资开发以及新能源电站运营",宁夏,吴忠,"宁夏吴忠市同心县招待所北楼"
银川麟飞广告有限公司,91640103574860034F,2011-06-16,N/A,颜颖,"100(万)","设计、制作、发布国内各类广告；会议会务服务、承办展览、展示活动。(国家法律、法规规定应经审批的，未获审批前不得生产经营)",宁夏,银川,"银川市兴庆区唐槐新村117号楼1-102"
银川坊上人炭火菜馆有限公司,91640103574859228F,2011-06-16,N/A,张学梅,"100(万)","中餐",宁夏,银川,"银川市兴庆区玉皇阁北街37号"
北京京能新能源有限公司宁夏分公司,91641100574860093K,2011-06-16,N/A,胡永,"N/A","风电项目技术咨询、技术服务。",宁夏,银川,"银川市黄河东路南侧庆祥街东侧柏桂苑1号楼公寓1501室"
宁夏创特机械制造有限公司,91640200574861184B,2011-06-16,N/A,梁小军,"100(万)","金属材料的加工、销售；非标设备的制造、销售(依法须经批准的项目，经相关部门批准后方可开展经营活动)",宁夏,石嘴山,"石嘴山市惠农区110国道西聚宝新村4排1栋1号"
宁夏鹏德康商贸有限公司,91640100574858698T,2011-06-16,N/A,李珺,"200(万)","体育器材、运动场地、场馆设施的销售及安装；文化体育用品、服装鞋帽、针纺织品、文化办公用品、家用电器、五金交电、日用百货、乐器、装饰材料、劳保用品、塑胶材料、地板、金属材料、电线电缆、家具的销售；会议会展体育赛事的策划及服务。",宁夏,银川,"银川市兴庆区宁夏体育馆南一层西侧"
宁夏晟昊伟业商贸有限公司,9164010057485868XT,2011-06-16,N/A,王勇,"101(万)","机电产品、机械设备、电气设备、五金交电、电线电缆、电器元件、电子产品、计算机及耗材、建筑材料、保温材料、防腐材料、日用百货、劳保用品、办公用品、化工产品",宁夏,银川,"银川市兴庆区塞上骄子15#楼9层908号房"
宁夏瑞鹏商贸有限公司,916401005748586120,2011-06-16,N/A,蔡建斌,"200(万)","化工产品及原料（不含易制毒及危险化学品）、日用百货、建筑材料、家用电器、金属制品、五金交电、水暖配件、仪器仪表、节能设备、机电产品、橡胶制品、塑料制品、装饰材料、家具、办公用品的销售（法律法规规定须经审批的经营项目，评审批文件或许可证经营）",宁夏,银川,"银川市兴庆区上海东路777号综合办公楼503室"
宁夏弘胜汽车销售服务有限公司,91640000574861037F,2011-06-16,N/A,卢俊陶,"2,000(万)","东风日产品牌汽车销售；二手车经销；汽车配件批发、零售；汽车装潢；汽车保洁；汽车售后服务；汽车租赁，信息咨询。",宁夏,银川,"银川经开区金凤工业园宝湖路金凤工业集中区服务中心大楼201室"
银川市金凤区青华獭兔养殖农民专业合作社,93640106574862806K,2011-06-16,N/A,吴碧华,"N/A","獭兔养殖、屠宰及销售；种兔培育及销售；獭兔回收；畜禽的养殖及销售，相关养殖技术的咨询服务***(依法须经批准的项目，经相关部门批准后方可开展经营活动)",宁夏,银川,"银川市金凤区丰登镇新联村八社84号"
宁夏为民物流有限公司,91640521574859025H,2011-06-16,N/A,吕荣亮,"1,000(万)","普通货物道路运输、配送、仓储、搬运装卸；运输货物打包服务；物流信息发布",宁夏,中卫,"中宁县宁新物流园区为民建材港1号营业房"
宁夏美雅居装饰工程有限公司,916401215748592447,2011-06-16,N/A,田福军,"500(万)","可承担单位工程造价500万元以下的室内装饰装修工程的施工（包括车、船、飞机及室内水、暖、电改造，音、视频安装），室内相关用品的成套供应，陈设布置；设计、制作、发布国内各类广告业务；企业形象策划；展览展示的策划及承办",宁夏,银川,"永宁县望远镇立业春城1区3#9号"
北京窝窝团信息技术有限公司银川分公司,91640104574859615A,2011-06-16,N/A,周华,"N/A","技术开发。",宁夏,银川,"宁夏银川市兴庆区富力城2号楼2单元1101室"
宁夏翰业商贸有限公司,91641100574859041H,2011-06-16,N/A,林晓巧,"100(万)","通讯设备、五金交电、建筑材料、日用百货、文化用品、珠宝首饰、钟表、眼镜、照相器材、服装、箱包、家用电器、医疗器械",宁夏,银川,"银川市金凤区易大紫荆花商务中心E座公寓2108号"
宁夏鑫农丰水土环境治理有限公司,91640100574860106W,2011-06-16,N/A,赵大鹏,"1,000(万)","中低产田改造、暗管排水、农业节水灌溉、排灌、农业机耕及相关技术咨询、培训、服务；塑料管材生产、加工、销售；建筑材料销售；机械设备租赁。(依法须经批准的项目，经相关部门批准后方可开展经营活动)",宁夏,银川,"宁夏银川市金凤区亲水大街东侧银川万达中心3号公寓818室"
宁夏宏建房地产开发有限公司一分公司,916401065748702162,2011-06-16,N/A,周永利,"N/A","房地产开发（凭公司有效资质经营）；房屋租赁；建材（不含木材)；水暖配件、五金交电、电器产品销售(依法须经批准的项目，经相关部门批准后方可开展经营活动)",宁夏,银川,"银川市金凤区庆祥街100号"
银川嘉实得物流有限公司,916401035748598939,2011-06-16,N/A,刘凯双,"101(万)","道路普通货物运输、装卸服务、仓储服务、信息配载。",宁夏,银川,"银川市兴庆区丽景南街五号众一货运市场门口小二楼8号"
西安华通新能源股份有限公司泾源县分公司,91640424574859754F,2011-06-17,N/A,杨峰,"N/A","新能源的节能、环保等技术的研究、开发、推广、利用、民用及工业用天然气项目投资；天然气加气站的投资；天然气输气管道防腐材料开发及防腐处理；燃气具研制、销售；天然气管道及设备的施工、安装；以下限分支机构经营：民用及工业用天然气项目经营、天然气加气站的经营。",宁夏,固原,"泾源县北环路西段L-CNG合建站"
贺兰县金贵镇银河村瓜菜产销专业合作社,93640122574864588L,2011-06-17,N/A,马振锋,"N/A","蔬菜、瓜果的种植及销售。***",宁夏,银川,"宁夏回族自治区贺兰县金贵镇银河村"
青铜峡市商城桂芳豆腐加工厂,92640381MA762RK23C,2011-06-17,个体工商户,盛桂芳,"N/A","豆制品（非发酵性豆制品）加工零售(依法须经批准的项目，经相关部门批准后方可开展经营活动)",宁夏,吴忠,"青铜峡市小坝镇曹湾村一队"
中宁县全兴枸杞有限责任公司,91640521574859877A,2011-06-17,N/A,王全兴,"100(万)","枸杞种植、收购、初加工、销售；农副产品（不含粮食）收购、初加工、销售(依法须经批准的项目，经相关部门批准后方可开展经营活动)",宁夏,中卫,"宁夏回族自治区中宁县枸杞商城"
银川陕宁海商贸有限公司,916401035748591139,2011-06-17,N/A,白文慧,"10(万)","水泥制品、木材、建筑材料的销售。(依法须经批准的项目，经相关部门批准后方可开展经营活动)",宁夏,银川,"银川市兴庆区丽景街满春物资综合交易市场265号"
宁夏嘉盛泽商贸有限公司,91640100574859535W,2011-06-17,N/A,安云艳,"508(万)","办公用品、体育器械及用品、健身器材、教学设备及仪器、实验室设备及用品、服装服饰、美术教具、日用百货、家具、玩具、乐器、音响设备、电子产品、计算机软硬件及辅助设备、I类医疗器械、II类医疗器械的销售；技术推广服务；运动场地施工及维护。",宁夏,银川,"银川市兴庆区湖滨西街98号楼"
顺丰速运(宁夏)有限公司兴庆分公司,91640103574864545W,2011-06-17,N/A,糜祖荣,"N/A","国际货运代理、办理国际、国内快递（邮政企业专营业务除外）。",宁夏,银川,"银川市兴庆区清河北街庆丰苑26号楼3号营业房"
宁夏金成林生态农林科技有限公司,91640425574859332Y,2011-06-17,N/A,邵建海,"1,000(万)","城市园林绿化、景观工程的规划、设计、施工；市政公用、水利水电、房屋建筑、公路工程、园林古建筑、城市及道路照明、电力、机电设备安装、环保工程、建筑装饰装修工程承包；园林绿地养护、管理及技术咨询；机械设备维修、推广服务；苗木、花卉生产销售；茶叶的生产销售；电子商务（(以上项目涉及国家法律、行政法规规定及国务院决定有前置许可的，凭有效许可经营)",宁夏,固原,"彭阳县古城镇古城村"
广东拓奇电力技术发展有限公司西北分公司,91641100574859578N,2011-06-17,N/A,曾繁强,"N/A","承装（修、试）电力设施；煤炭批发（以上项目具体按公司有效许可经营）；电厂的机械、电气检修与维护；中小型电力工程技术服务及咨询服务；非标部件及配件的加工；电力工程技术的研究及开发、销售；电器机械及器材销售；货物进出口，技术进出口；（国家法律、法规规定应经审批的，未获审批前不得生产经营）",宁夏,银川,"银川经济技术开发区金波南街165号"
宁夏银川宏远翔科贸有限公司泾源苗木分公司,91640424574866612H,2011-06-17,N/A,庙玲,"N/A","苗木种植与销售；通讯器材、机电产品、化工原料",宁夏,固原,"泾源县金水苑小区10-1-202"
宁夏中宁县金桥商贸有限公司,91640521574859666T,2011-06-17,N/A,李兴智,"100(万)","枸杞、红枣、中药材（政策许可范围内）收购、销售，农副产品（不含粮食）收购、初加工、销售，五金、日用百货、建筑材料、化工产品",宁夏,中卫,"中宁县舟塔乡黄桥村三队"
宁夏天锦元商贸有限公司,916401005748592952,2011-06-17,N/A,马会民,"101(万)","预包装食品兼散装食品、乳制品",宁夏,银川,"银川市兴庆区宁夏日用百货副食批发市场9号楼B28号"
宁夏凯达丰商贸有限公司,916403005748590687,2011-06-17,N/A,陈文斌,"300(万)","钢材、电线电缆、五金机电、电脑耗材、劳保用品、办公用品、电工电料、化工产品（不含危险化学品及易制毒品）、兰碳、石灰、机械设备、建筑材料、工艺品的销售；劳务分包（凭资质证经营）",宁夏,吴忠,"吴忠市利通区友谊西路银平招待所"
宁夏建银劳务有限公司,916401005748592877,2011-06-17,N/A,赵银,"101(万)","劳务分包；劳务派遣；劳务中介服务；劳务信息咨询。",宁夏,银川,"银川市金凤区尚景世家7号楼4单元601室"
同心县菊香刺绣专业合作社,93640324585360166B,2011-06-17,N/A,马自香,"N/A","刺绣产品加工、销售、新技术引进、社员培训***(依法须经批准的项目，经相关部门批准后方可开展经营活动)",宁夏,吴忠,"同心县石狮镇城一村南环路交警大队对面"
银川月德园林绿化工程有限公司,91640100574859201C,2011-06-17,N/A,任鹏飞,"500(万)","园林绿化、景观工程、园林绿化养护；苗木、花卉、草坪的种植、配送及销售；草种的销售。",宁夏,银川,"银川市金凤区康居A4区-9号"
宁夏德元环宇贸易有限公司,91640100574859324D,2011-06-17,N/A,温学霞,"101(万)","酒、预包装食品兼散装食品、日用百货、通讯产品、计算机及辅助设备、计算机软件、电子产品、五金交电、机械设备、装饰材料、塑料制品、水暖配件、化工材料",宁夏,银川,"银川市兴庆区凤凰花园A座2号商住楼95号营业房"
宁夏声腾智能系统有限公司,91640100574859316J,2011-06-17,N/A,汪辉,"101(万)","舞台音响灯光设备、智能音视频会议系统；计算机综合布线；安防产品的销售。",宁夏,银川,"银川市兴庆区凤鸣家苑33号楼10号营业房"
固原银雪混凝土有限责任公司,916404005748593755,2011-06-17,N/A,赵雄,"1,200(万)","预拌商品混凝土三级，建材销售。",宁夏,固原,"固原市原州区清水河工业园区"
宁夏红福康商贸有限公司,916405215748595199,2011-06-17,N/A,金钟鸣,"100(万)","农副产品（不含粮食）收购、初加工、销售；预包装食品、散装食品批发兼零售；烟草制品（凭许可证经营）、文化办公用品、日用百货、中药材（国家政策许可范围内）、五金交电、建筑材料、工程机械设备及配件销售",宁夏,中卫,"中宁县平安西街瀛海花园9#19#"
西吉县云峰丰农冷凉蔬菜开发有限公司,9164042257486078XR,2011-06-17,N/A,祁云峰,"150(万)","蔬菜种植、销售、冷凉、储存",宁夏,固原,"西吉县吉强镇袁河村一组"
