银川宏景益机电设备有限公司,91641100564133669F,2011-03-30,N/A,董小燕,"300(万)","中央空调、通风设备、电子产品、仪器仪表、通讯设备、电器设备及器材、电线电缆、电梯、太阳能设备、楼宇自控产品、水处理设备、五金交电、建材、制冷设备、机电设备的销售、安装、维修及保养；公路工程服务；铁路工程服务；市政道路工程服务；土石方工程服务；桩基工程服务；劳务服务",宁夏,银川,"金凤区易大紫荆花商务中心D座2117号公寓"
银川步一商贸有限公司,91640103564133634U,2011-03-30,N/A,陈秀珍,"20(万)","日用百货、家用电器、五金、机电、化工产品（不含易制毒及危险化学品）、服装鞋帽、劳保用品、办公家具、体育器械、矿山机械、电线电缆、仪器仪表、建筑材料、装饰材料、厨房设备、数码产品、电子产品、洗涤化妆品、电力物资、计算机软、硬件及耗材、办公用品、文化用品的销售；汽车信息咨询服务。",宁夏,银川,"银川市兴庆区民族北街50号"
宁夏大多石油装备再制造有限公司,916411005641341195,2011-03-30,N/A,杨永利,"2,000(万)","石油装备再制造研发、生产、销售及技术服务；化工原料及产品",宁夏,银川,"银川市经济技术开发区发祥东路85号"
宁夏众阳工贸有限公司,916401005641332474,2011-03-30,N/A,林棋星,"500(万)","法律法规明确或国务院决定须经审批的项目，经相关部门批准后方可开展经营活动；无需审批的，企业自主选择经营项目开展经营活动。",宁夏,银川,"银川市兴庆区清河南街7号2号楼103室"
吴忠市伊禾农机作业服务有限公司,91640300564134557P,2011-03-30,N/A,谭振龙,"100(万)","农机作业服务，农业技术推广服务，农机配件的销售；农业机械设备及配套农机具研发、制造、销售、维修；初级农产品加工、批发及零售。",宁夏,吴忠,"吴忠市利通区金积镇塔湾村"
吴忠市惠民商贸有限公司,91640300564135584Q,2011-03-30,N/A,强云,"100(万)","建筑机械、机械设备、五金机电、农副产品（不含稻谷、玉米及国家专项审批的产品）、畜产品的销售",宁夏,吴忠,"吴忠市利通区杨马湖乡新渠村宏大塑料化工公司厂区5号"
银川银泰祥商贸有限公司,916401035641341862,2011-03-30,N/A,郭文龙,"50(万)","汽车用品、汽车（不含品牌小轿车）、汽车音响、汽车配件、汽车装饰材料、服装鞋帽、日用百货、办公用品、文体用品、电子产品、家用电器、通讯器材、五金交电、水暖配件、机电产品、建筑材料、劳保用品、电线电缆的销售。",宁夏,银川,"银川市兴庆区清和北街1039号义通汽车城A区11号商业楼4号营业房"
宁夏玥玲珑餐饮管理有限公司,916411005641337306,2011-03-30,N/A,赵虎子,"101(万)","中餐制售。",宁夏,银川,"银川市金凤区宁安大街108号"
宁夏和众瑞达机电设备有限公司,916401065641334072,2011-03-30,N/A,王红梅,"100(万)","机电设备、五金交电、仪器仪表、水泵、阀门、空气压缩机、制氮机、制氧机、储气罐、净化设备的销售、维修及技术服务",宁夏,银川,"银川市金凤区长城花园27号楼5单元511号"
宁夏仕家毛纺织有限公司,91640300564134303T,2011-03-30,N/A,徐小军,"100(万)","羊毛羊绒、驼毛驼绒、兔毛兔绒的分梳及销售",宁夏,吴忠,"吴忠市金积工业园区毛纺织产业园"
宁夏宝塔油气销售有限公司隆德加油站,91640423735955107D,2011-03-30,N/A,孙国庆,"N/A","汽油、柴油零售。",宁夏,固原,"宁夏固原市隆德县城关镇七里村"
宁夏嘉熙仕生物科技有限公司,9164052156413395X3,2011-03-30,N/A,赵刚,"500(万)","枸杞系列产品、水果制品、茶叶及其制品、粮食加工品、炒货食品、坚果制品生产、销售；葡萄酒、果酒、配制酒、其他蒸馏酒及纯净水、果汁系列饮料、特殊食品（保健食品）、医疗器械（限一类）、预包装食品兼散装食品（不含冷藏冷冻食品）销售；农副产品收购、加工、销售；企业管理咨询；企业策划；经济贸易咨询；技术开发、技术推广、技术转让、技术咨询、技术服务；教育咨询；组织文化艺术交流活动",宁夏,中卫,"宁夏回族自治区中卫市中宁县新堡镇刘庙村十队"
宁夏宁东春旺工贸有限公司,91641200564133888Y,2011-03-30,N/A,杨学国,"200(万)","机械设备租赁；砂石料、建材、五金、劳保用品、办公用品、煤矸石、焦炭、沥青、润滑油销售；承揽工程、土方填挖、房屋修缮：废机油的回收；厂区内绿化；花草、苗木、木材、钢材、道牙花砖的批发销售；劳务派遣、彩钢结构、成品油、道路沥青、道路重油、自然毛砂、片石、水洗砂、碎石的销售。",宁夏,银川,"宁夏宁东镇回民巷村"
宁夏广贞信息科技有限公司,91640404564133896H,2011-03-30,N/A,张光明,"2,000(万)","企业管理咨询；市场营销策划；提供经营决策、商务信息咨询、经济信息咨询、市场管理、市场调研人才交流咨询及技术咨询技术服务；企业形象策划；劳务服务（不含劳务派遣）、翻译服务；文化艺术交流策划；展览展示会务咨询、电子商务服务；游戏产品销售（法律法规禁止的除外）；计算机网络软件的设计、开发、销售及售后服务；办公用品、电子产品销售；财务咨询、审计服务咨询、会计记帐业务咨询、税务服务咨询、资产评估服务咨询、企业重组及收购兼并业务的咨询；企业登记代理服务、代理记帐服务",宁夏,固原,"宁夏固原经济开发区西兰银物流园"
西吉县兴隆虎豹商贸有限责任公司,91640422554155290T,2011-03-30,N/A,马银良,"300(万)","钢材、砂石料、水泥及水泥制品、化肥、农副产品的销售；普通货物公路运输；机械设备租赁；提供劳务、技术、信息方面咨询服务",宁夏,固原,"宁夏回族自治区西吉县兴隆镇兴隆街道"
吴忠市牧源饲料加工有限公司,91640300564144341G,2011-03-30,N/A,丁永国,"10(万)","浓缩饲料、精料补充料的加工及销售",宁夏,吴忠,"吴忠市利通区马莲渠乡廖桥村四队"
银川泰能车用天然气配件销售有限公司,916401055641336851,2011-03-30,N/A,雷洪,"5(万)","汽车用天然气配件销售；压力容器安装",宁夏,银川,"银川市西夏区怀远东路425-1号"
同心县土峰村正云肉牛养殖专业合作社,9364032456413512XU,2011-03-30,N/A,虎正云,"N/A","肉牛养殖、销售***",宁夏,吴忠,"宁夏吴忠市同心县预旺镇土峰村"
银川巴格斯三生葡萄酒庄(有限公司),9164012156413379X7,2011-03-30,N/A,王彦辉,"50(万)","葡萄种植、销售",宁夏,银川,"宁夏永宁县胜利乡金沙村"
青铜峡市长青工贸有限公司,916403815641332126,2011-03-30,N/A,张敬,"200(万)","三类机动车维修（供油系统维护及油品更换）；汽车(不含小轿车)、汽车配件批发零售及售后服务；房屋租赁、停车服务；代收水电费、暖气费、物业费；五金建材、机械设备、机电产品、电线电缆、水泥、砂石、建材、钢材、化工产品（不含危险化学品）、润滑油、橡胶制品、劳保用品、办公用品、日用百货的批发、零售",宁夏,吴忠,"青铜峡市北环西路179号"
兰州豪斯设计装饰有限责任公司银川分公司,91641100564134338F,2011-03-30,N/A,廉旭,"N/A","室内外装饰、建筑幕墙施工、机电设备安装、消防、监控、综合布线系统；楼宇智能化管理系统；工艺品制作；装饰材料的批发、零售。",宁夏,银川,"银川市金凤区紫荆花商务中心E座1305号公寓"
宁夏太空人太阳能工程安装有限公司,91640100564133335J,2011-03-30,N/A,吴治宁,"101(万)","太阳能热水器、太阳能集热器、太阳能集热板、太阳能路灯、太阳能电池板、太阳能发电设备及配件、太阳能蒸汽锅炉、水暖建材、电工电料、仪器仪表、五金交电、装饰材料、日用百货、劳保用品、办公用品的销售；太阳能集热水系统、太阳能采暖系统、太阳能发电设备、太阳能产品的安装、设计及销售。",宁夏,银川,"银川市兴庆区永安巷永兴家园1号楼5号房"
宁夏百益中程能源服务有限公司,916401035641336779,2011-03-30,N/A,苗润森,"300(万)","风电机主机维修；陆地拉线；测风塔；塔筒外壁防腐补漆；塔筒清洗除油、翻新；叶片检测、修补、维护；风场定检、巡查、托管服务；光伏电站运维服务；组件清洗服务；光伏设备日常巡查；电力设备技术开发、技术咨询、技术转让、技术服务；电力设备、化工产品、机械设备、仪器仪表、五金交电的销售；劳务分包。",宁夏,银川,"银川市兴庆区上海东路民族村19号楼4单元102室"
宁夏华伟达物资有限公司,91640100564133597A,2011-03-30,N/A,杨勇,"102(万)","建材五金、水暖配件、机电设备、劳保用品、日用百货、棉麻日杂、装饰材料、水性涂料、工矿产品（除国家专控）、标准件、钢板网、丝网、铁艺的销售；机电设备的安装；技术咨询服务",宁夏,银川,"银川市兴庆区丽景南街昆仑综合物资市场6号"
宁夏信诺英皇酒店用品有限公司,91640100564133511F,2011-03-30,N/A,邢军,"101(万)","日用百货、针纺织品、办公用品、卫生洁具、工艺品的销售；酒店管理咨询。",宁夏,银川,"银川市兴庆区民族南街光耀美居五层营业房"
宁夏安信达建筑劳务有限公司,9164110056413360X7,2011-03-30,N/A,于学忠,"100(万)","劳务分包（凭资质证经营）；建筑材料、金属材料、机电产品、五金交电、电线电缆、灯具、消防器材、劳保用品、日用百货、化工产品",宁夏,银川,"银川市西夏区三号路以南，金波南街以东"
宁夏铭方工程项目管理有限公司,916411005641333942,2011-03-30,N/A,赵玉宁,"200(万)","工程咨询；工程造价咨询；工程招标代理及咨询服务；企业管理咨询；工程信息技术、轨道交通、人防工程、医院建设咨询服务；节能评估；地产评估；室内装潢、设计；低碳节能、清洁生产咨询服务；工程项目管理及代建、工程建设监理、工程勘察、设计服务；决算审计服务；建设工程试验检测服务；工程设备安装；工程技术开发；计算机软硬件开发、销售；计算机系统集成；新能源设备、电气设备、环保设备、水处理设备、安防设备的技术服务及产品销售；工程总承包。",宁夏,银川,"银川市高新技术开发区中苑大厦五楼501室"
宁夏富海阳光信息科技有限公司,91641100564133829N,2011-03-30,N/A,王耀玮,"300(万)","计算机系统集成及综合布线；计算机软硬件及耗材的开发销售；信息咨询服务；安防产品、电器机械及器材、仪器仪表、电子产品、五金交电、建材、塑料制品、办公用品、电线电缆、装饰材料、电力设备的销售。",宁夏,银川,"金凤区正源北街48号营业房"
平罗县东陵农业科技有限公司,916402215641332717,2011-03-30,N/A,孟庆林,"120(万)","农业技术研发与推广；农作物种植；畜牧产品养殖；水稻、小麦育种；农牧产品销售。",宁夏,石嘴山,"平罗县灵沙乡东灵村西羊场"
同心县农林农业机械作业有限公司,91640324564133538A,2011-03-30,N/A,强林,"110(万)","农业机械作业、耕地、坪地、播种、施肥、覆膜、收割、脱粒、技术培训推广，农机及配件销售、农机修理",宁夏,吴忠,"宁夏吴忠市同心县韦州镇"
银川元帧广告有限公司,91640103564133992W,2011-03-30,N/A,宋建忠,"10(万)","国内各类广告的代理、制作、发布；平面设计、喷绘制作、动漫设计",宁夏,银川,"银川市兴庆区景墨家园18号楼3单元602室"
宁夏骏兴顺物流有限公司,91640300564133933Q,2011-03-30,N/A,马文君,"2,000(万)","道路普通货物运输，仓储服务、货物联运、货物配送、货物中转、代运代办、信息配载；绒毛分梳；绒毛购销；绒毛织品的加工及销售",宁夏,吴忠,"吴忠市利通区毛纺织产业园"
宁夏和润达纸业有限公司,916401035641339099,2011-03-30,N/A,刘金钊,"500(万)","纸及纸制品的分切、包装及销售；办公用品、文化用品、计算机及耗材、教学设备、电子产品、日用百货、五金交电、安防产品、印刷设备的销售；设计、制作、代理、发布国内各类广告。",宁夏,银川,"银川市兴庆区中山南街12号"
宁夏长晟油气技术服务有限公司,916403235641336938,2011-03-30,N/A,李晓飞,"1,980(万)","油气田技术服务，钻前标准化井场平整；油井设备、工程机械设备、五金建材销售；工业保洁服务；抽油机安装；危险货物运输（3类）；普通道路货物运输；石油钻井、井下作业（修井）",宁夏,吴忠,"盐池县花马池镇煦衍南路100号"
同心县预旺镇沙土坡村如国肉牛养殖专业合作社,93640324564135154H,2011-03-30,N/A,杨如国,"N/A","肉牛养殖、销售***(依法须经批准的项目，经相关部门批准后方可开展经营活动)",宁夏,吴忠,"宁夏回族自治区同心县预旺镇沙土坡村"
银川恒泰世纪化工有限公司,916401035641337492,2011-03-30,N/A,李鸿江,"50(万)","化工原料、化工产品及化学试剂共五大类54种",宁夏,银川,"银川市兴庆区北京东路八一小区高台三队1-11号"
宁夏元佳福商贸有限公司,916401005641334824,2011-03-30,N/A,张小平,"101(万)","婴儿用品、日用百货生资日杂、不锈钢制品、玻璃制品、木制品、家居饰品、工艺礼品、办公用品的销售。",宁夏,银川,"宁夏银川市兴庆区新世纪花园桃花源4-2-301室"
宁夏宁东金源工贸有限公司,91641200564133837N,2011-03-30,N/A,王学玲,"1,000(万)","保洁服务；垃圾清运；废水、废渣外运；水稳拌合料、砂石料销售；土石方工程；道路养护；货物运输；劳务分包；机械设备租赁。",宁夏,银川,"中心区新民小区2号楼1单元401室"
银川杰士通商贸有限公司,91640106564144106W,2011-03-30,N/A,殷丽芳,"30(万)","汽车配件、摩托车配件、电瓶、五金交电、化工产品（不含易制毒及危险化学品）、润滑油销售",宁夏,银川,"银川市金凤区双悦小区双悦新村20号楼7号营业房"
宁夏天鼎长秋商贸有限公司,91640100564133220C,2011-03-30,N/A,李相军,"101(万)","混凝土外加剂、路政设施材料、建筑材料销售。",宁夏,银川,"银川市兴庆区上海东路777号至799号"
青铜峡市德诚门窗制作有限公司,91640381564133853F,2011-03-30,N/A,贾学武,"200(万)","塑钢门窗、铝合金门窗、金属门窗制作安装及销售；五金销售；玻璃安装销售",宁夏,吴忠,"青铜峡市嘉宝工业园区纬二路北侧"
银川广瑞源农业科技有限公司,916401065641339410,2011-03-30,N/A,刘贞,"10(万)","农业科技开发；林果培育；农药器械、低毒无残留农药、化肥、复合肥、不再分包的农作物种子、农膜、园林机械批发兼零售",宁夏,银川,"银川经开区金凤工业园外来务工人员公寓楼9-108室"
永宁县誉方圆粮食种植专业合作社,936401215641438677,2011-03-30,N/A,宋智勇,"N/A","组织销售成员种植水稻、小麦、玉米、大豆、蔬菜以及冷藏、储藏及与农业生产经营有关的信息技术服务***",宁夏,银川,"宁夏回族自治区永宁县望洪镇北渠村"
宁夏国豪建筑有限公司,91640521564134899T,2011-03-30,N/A,龚剑豪,"1,480(万)","房屋工程建筑施工、水利工程建筑、园林绿化工程施工、管道运输工程施工；水、暖、电安装；市政设施维护",宁夏,中卫,"宁夏回族自治区中宁县新堡镇"
宁夏中卫市博富商贸有限公司,91640500564133917D,2011-03-31,N/A,闫春海,"500(万)","煤炭及制品，矿产品（专项审批项目除外）、其他化工产品",宁夏,中卫,"中卫市沙坡头区永康镇永康村"
银川奋飞橡塑物资有限公司,91640104564134522L,2011-03-31,N/A,吴昌区,"50(万)","橡胶制品、塑料制品、机电产品、化工产品、五金交电、建筑材料、装饰材料、钢材、金属材料、棉麻日杂、机械设备、劳保用品、汽车配件、文化用品、办公用品、家用电器、仪器仪表、电线电缆、电子产品、通讯产品、照明器材、消防用品、安防产品、工艺品、酒店用品、纸制品、体育用品、电力设备及器材的销售",宁夏,银川,"银川市兴庆区丽景南街宁夏机电批发市场7号楼12A营业房"
宁夏玩美汽车美容装潢有限公司,916401005641344502,2011-03-31,N/A,徐宏亮,"101(万)","汽车美容；汽车装饰装潢；汽车装饰用品、汽车配件、化工产品",宁夏,银川,"银川市金凤区馨和苑小区32号楼2号商业房"
银川市西夏区个体经营贺兰石工艺品加工厂,92640105MA761UNQ18,2011-03-31,个体工商户,王智新,"N/A","法律法规明确或国务院决定须经审批的项目，经相关部门批准后方可开展经营活动；无须审批的、企业自主选择经营项目开展经营活动。(依法须经批准的项目，经相关部门批准后方可开展经营活动)",宁夏,银川,"甜菜研究所家属院"
西安宅急送快运有限公司东门分公司,9164010357487820XN,2011-03-31,N/A,陈显宝,"N/A","货运信息配载、仓储；国内快递",宁夏,银川,"银川市兴庆区中山北街五宝苑1号楼6号营业房"
宁夏宏学建筑劳务分包有限公司,91640100564134311B,2011-03-31,N/A,何喜军,"101(万)","劳务分包；建筑装饰材料、水暖配件、卫生洁具、厨房设备、五金交电、劳保用品、电线电缆、化工产品",宁夏,银川,"银川市西夏区北京西路怡林园29号楼6号营业房"
宁夏浩华房地产综合开发有限公司彭阳分公司,91640425564135912E,2011-03-31,N/A,魏翠萍,"N/A","房地产开发与经营叁级(按资质证核定的范围)",宁夏,固原,"彭阳县南苑小区1#4-202"
银川兰宇农资有限公司,9164010356413459X1,2011-03-31,N/A,何浩英,"10(万)","农药、种子（不再分包的原包装种子）、化肥的销售。",宁夏,银川,"银川市兴庆区五渡桥村二队"
宁夏黄河坛文化产业发展有限责任公司青铜峡分公司,91640381564140375D,2011-03-31,N/A,夏桃萍,"N/A","餐饮；文化艺术交流策划；市场营销策划；销售各类文化产品、工艺产品；旅游宣传；旅游商品的开发与销售；会议场所出租及会议组织策划；农副产品销售；住宿；水上旅游客运、水上货物运输（凭资质证经营）；农林产品种植、生产、加工、销售（凭资质证经营）；林业苗木生产、销售；农业机耕、排灌、病虫害防治；优良品种引进、示范推广；农业高新技术的应用、培训、咨询；工程机械、农业机械租赁；物业管理、土地租赁；旅游设施租赁（含游船、交通运输车辆、娱乐设备）",宁夏,吴忠,"青铜峡市青铜峡镇广武村一组79号金沙湾旅游区"
银川怡丰顺停车设备自动化科技有限公司,91640106564135090D,2011-03-31,N/A,王君利,"50(万)","停车场车位规划、设计；监控系统、门禁系统、电子围栏报警系统、电子巡更系统、智能一卡通系统销售；停车设备的销售、安装、维护、维修（国家法律、法规规定须许可经营的，凭许可证经营）",宁夏,银川,"银川市金凤区紫园小区13号楼3单元101室"
宁夏华辉活性炭股份有限公司惠农分公司,91640200564135576Q,2011-03-31,N/A,李国栋,"N/A","煤基活性炭的开发、生产、销售",宁夏,石嘴山,"宁夏回族自治区石嘴山工业园区"
银川吉祥飞通航空服务有限公司,9164010656413408XY,2011-03-31,N/A,赵春晖,"50(万)","国内航线（除港、澳、台以外）的航空客运机票代理销售（国家法律、法规规定须经审批的，凭审批件方可经营）",宁夏,银川,"银川市金凤区尚景世家3号住宅楼1单元901室"
盐池县城西滩种养殖专业合作社,93640323564145459B,2011-03-31,N/A,朱彦海,"N/A","1、组织成员进行设施蔬菜、瓜果种植及销售；肉牛、滩羊养殖及销售；柠条加工、饲料颗粒制作，玉米、青贮、甘草种植、加工及销售；2、供应成员所需生产资料；3、组织开展相关技术交流和技术推广，提供运输及储藏信息服务农业信息咨询；农业科技、农业技术领域内的技术开发、技术服务、技术咨询、技术转让；电子商务；农产品冷链物流运输；农作物、蔬菜的种植、加工及销售；农用机械、农具、农药、化肥、种子、种苗销售；瓜果蔬菜的育苗及销售；黄花、玫瑰、油牡丹种植、加工及销售；餐饮服务（凭许可证经营）***",宁夏,吴忠,"盐池县花马池镇惠泽村"
银川易卓创新网络技术有限公司,91640105564134573B,2011-03-31,N/A,刘国峰,"50(万)","软件开发、综合布线、计算机、电子产品、机械设备、五金交电、化工产品（不含易制毒及危险化学品）、日用百货、塑料制品、工矿设备及配件、办公用品、劳保用品、建筑装饰材料的销售；数据处理服务、信息技术咨询服务、信息系统集成服务及技术开发；航空模型及其配件销售；数字动漫设计。",宁夏,银川,"银川市西夏区和佳居小区3号公寓20楼05室"
宁夏明菲二手车交易市场经营有限公司,91640122564134071C,2011-03-31,N/A,张斌,"100(万)","二手车交易市场经营；二手车交易过户",宁夏,银川,"贺兰县金贵镇雄英村6社40号"
宁夏依尔帅洗涤消毒有限公司,91640122564135568L,2011-03-31,N/A,李国红,"500(万)","布草的租赁、洗涤及消毒服务；保洁服务；布草、宾馆一次性耗品、消毒液、厨房用具的销售；洗涤设备及零配件的销售、安装调试及售后服务；洗涤用品的销售。",宁夏,银川,"银川德胜工业园区沁园路3号"
宁夏固德新型安全设施有限公司,91640100564134434C,2011-03-31,N/A,刘建军,"101(万)","五金机电产品、建筑材料、化工原料",宁夏,银川,"银川市兴庆区宝湖东路康桥水郡15-2号楼13号营业房"
宁夏金锐领航贸易有限公司,916401005641345658,2011-03-31,N/A,王磊,"101(万)","计算机及辅助设备、电子产品、数码产品、工艺品、服装鞋帽、日用百货、办公用品及自动化设备、家用电器、五金交电、针纺织品、劳保用品、机电设备、教学仪器、照明设备、交通器材、电线电缆、标示牌、电子设备、舞台灯光音响、制冷设备、通讯产品、阀门轴承、消防器材、电力设备、安防监控系统设备",宁夏,银川,"银川市兴庆区民族南街名人国际大厦1419号"
固原贤明民族服饰有限公司,91640403564133925E,2011-03-31,N/A,郑贤伦,"820(万)","服装、校服、民族服饰用品、床上用品、窗帘、学生卧具、宾馆用品、工作服、白大褂、病号服加工与销售；电脑绣花。",宁夏,固原,"宁夏回族自治区固原市银平公路东侧长城梁圆德慈善园"
银川快洁美车汽车服务有限公司,916401045641346883,2011-03-31,N/A,孙宁,"100(万)","汽车清洗、美容；代办车辆入户、过户、年审、驾驶证审验；代驾；车辆中介、家政保洁服务；全自动电脑洗车机生产与销售；清洗设备、机电设备及零部件销售。",宁夏,银川,"宁夏银川市兴庆区凤凰南街与长城路交叉路口加油站"
玉田县新鑫节水安装有限公司银川分公司,916401045641346028,2011-03-31,N/A,程志祥,"N/A","塑料管材、塑料制品、水暖器材销售及安装；水泵、水表、压力灌、恒压供水设备销售；节水灌溉工程施工",宁夏,银川,"银川市兴庆区新世纪花园四组团8号楼18号营业房"
银川庞大兴驰汽车销售服务有限公司,9164012256413416XP,2011-03-31,N/A,王永生,"1,000(万)","汽车、汽车配件、汽车装潢材料、五金工具、箱包、皮具、日用品、家用电器、皮毛制品、针纺织品的销售；二手车经销；汽车信息咨询服务；二类机动车维修",宁夏,银川,"银川德胜工业园区109国道东侧"
宁夏新捷能源有限公司中卫分公司,916405005748993935,2011-03-31,N/A,李少兵,"N/A","液化天然气充装、汽车加气（凭许可证经营）；日用杂货、润滑油、汽车装饰物品、汽车零配件销售；预包装食品兼散装食品、特殊食品零售（凭许可证经营）；烟草零售",宁夏,中卫,"中卫市沙坡头区迎水桥镇牛滩村五队农房西侧、卫青公路南侧、中央大道北侧"
银川亦龙数码科技工程有限公司,916401035641345819,2011-03-31,N/A,赵鲲,"100(万)","建筑材料、装饰材料、电教设施、楼宇监控设备、保温材料、地板、电梯及配件，电力设备、电力器材及配件、计算机及耗材、减压设备、节能设备及配件的销售；楼宇综合布线、室内装饰设计；计算机软件开发；网页制作；网站建设；计算机系统集成。(依法须经批准的项目，经相关部门批准后方可开展经营活动)",宁夏,银川,"银川市兴庆区文化西街106号银川国际贸易中心B段八层C2号办公用房"
