泰安锻压机床厂,91370900166401402E,1990-09-11,N/A,段元华,"368(万元人民币)","锻压设备制造、工程车辆制造修理、机床维修、技术开发、服务、培训及承包、涂料、综合技术服务、塑料机械制造(依法须经批准的项目，经相关部门批准后方可开展经营活动)。",山东,泰安,"泰安市泰山区徐家楼乡徐家楼村"
青岛电子检测仪器厂,913702131636618825,1990-09-12,集体所有制,于志强,"201万人民币","制造：金属探检器、燃烧器、钢结构件，配电开关控制设备，电气设备、电子元器件、工业自动控制系统装置（以上范围不含特种设备）；电工器材维修，铆焊，交通标志加工销售，交通标杆及护栏工程设计施工，交通设施、信号灯、电子监控设计安装（不含特种设备），船用信号设备制造；加工：船用配件、...电子产品、电器安装及维修；...",山东,青岛,"青岛市李沧区九水东路320-3号"
济宁交运联运有限公司,91370800165922740M,1990-09-12,N/A,胡家强,"500万人民币","普通货运",山东,济宁,"山东省济宁市任城区建设北路141号"
烟台交运集团有限责任公司莱阳汽车站,91370682869784200K,1990-09-12,N/A,张伟,"N/A","客运站经营",山东,烟台,"莱阳市五龙北路1号"
山东包装进出口青岛盈远实业公司招待所,913702038636009926,1990-09-12,N/A,刘同文,"10万元","招待所",山东,青岛,"青岛市市北区市场一路49号"
微山县张楼建筑公司,913708267207184240,1990-09-13,N/A,卞丙夏,"50万人民币","建筑工程劳务分包。(依法须经批准的项目，经相关部门批准后方可开展经营活动)",山东,济宁,"山东省微山县张楼乡"
山东省聊城市人民医院劳动服务公司,913715001678502937,1990-09-13,N/A,董建军,"84.5万人民币","计算机打印纸销售。以下限分支机构经营：预包装食品、散装食品、日用百货的销售；自动售货机服务。餐饮服务。",山东,聊城,"聊城市东昌西路67号"
青岛聚源物业管理有限公司,913702031637212322,1990-09-13,N/A,孙志广,"50万元","物业管理",山东,青岛,"青岛市市北区临淄路2号2号楼0107室"
枣庄市市中区商业物资购销公司,913704021645254529,1990-09-14,N/A,王锦东,"70万人民币","百货、五金交电、化工产品（不含化学危险品）、木材、钢材、水泥设备、机械配件、标准件、钢丝绳、电线电缆、轴承、板材、劳保用品、文体用品、针纺织品、土产杂品、矿用电器、润滑油、水泥、建筑材料批发零售（以上不含危险化学品）；消防器材销售及维修；矿山设备及配件销售、安装、维修（不含特种设备）；预包装食品零售",山东,枣庄,"枣庄市市中区青檀北路113号"
禹城市第四油棉加工厂,91371482MA3CU9DD0C,1990-09-14,集体所有制,翟东升,"696万人民币","棉短绒加工(依法须经批准的项目，经相关部门批准后方可开展经营活动)。",山东,德州,"禹城市辛店镇南首"
山东仙河药业有限公司,91370503164841850P,1990-09-15,N/A,李保国,"1,380.2902(万元人民币)","片剂、颗粒剂、硬胶囊剂、煎膏剂、丸剂",山东,东营,"河口区仙河镇"
临沂市供销石油公司第三加油站,913713126644497674,1990-09-15,集体分支机构(非法人),叶刚,"N/A","零售：汽油、柴油、润滑油",山东,临沂,"河东区汤头镇驻地"
山东一顺建设有限公司,91370828720718678R,1990-09-15,N/A,李建顺,"10009万人民币","房屋建筑工程、市政工程、钢结构工程、水利工程、道路及桥梁工程施工；室内外装饰装修；常压锅炉、水暖管道及电线路安装；园林绿化；建筑材料销售。",山东,济宁,"金乡县城文化路北段西侧金桂园小区8号楼1702室"
山东省禹城市宏达建筑安装工程有限公司,9137148216757222XA,1990-09-17,N/A,司建国,"2097.9万人民币","房屋建筑工程：三级企业：可承担单项建安合同额不超过企业注册资本金5倍的下列房屋建筑工程的施工：（1）14层及以下、单跨跨度24米及以下的房屋建筑工程；（2）高度70米及以下的构筑物；",山东,德州,"山东省德州市禹城市行政街29号"
烟台亚新利电器有限公司,913706006134221184,1990-09-17,N/A,闫军,"500(万元人民币)","开发、研制、生产、销售电力调度自动化、通讯设备、仪器、仪表；电力用电管理系列；工业控制自动化及电力相关产品；汽车零部件；机电一体化产品；手机配套产品；楼宇智能化系列产品。(依法须经批准的项目，经相关部门批准后方可开展经营活动)",山东,烟台,"烟台经济技术开发区长江路79号"
山东中和新华印刷有限公司,91370102163145976K,1990-09-17,N/A,王化争,"1620.9万元","出版物、包装装潢印刷品、其他印刷品印刷",山东,济南,"济南市历下区历山路146号"
山东济宁皮革有限责任公司,91370800165932789D,1990-09-17,N/A,张合友,"696.7900(万元人民币)","猪、牛、羊原皮的收购、储存；皮革原料、皮革及皮革制品、皮革化工辅料",山东,济宁,"济宁市中区车站西路47号"
福安药业集团烟台只楚药业有限公司,91370600165111227Y,1990-09-17,N/A,唐茂锋,"24016.01万元","小容量注射剂（含激素类），片剂，胶囊剂（均含头孢菌素类），颗粒剂，原料药（麦白霉素、乙酰螺旋霉素、水飞蓟宾葡甲胺、硫酸庆大霉素），粉针剂，冻干粉针剂，并销售公司上述所列自产产品（有效期限以许可证为准）；医药中间体（不含危险品）、化工中间体",山东,烟台,"山东省烟台市芝罘区烟福路1号"
青州市庙子供销社副食门市部,91370781MA3CUQK997,1990-09-17,集体分支机构(非法人),冯春华,"22万人民币","零售预包装食品兼散装食品,乳制品(不含婴幼儿配方乳粉）(有效期限以许可证为准)。农副产品",山东,潍坊,"青州市庙子镇庙子村"
招远市玲珑供销合作社果品站,91370685MA3D1NB37W,1990-09-18,集体分支机构(非法人),孙国田,"5万人民币","农药零售(有效期限以许可证为准)；干鲜果品收购、化肥、农用薄膜、不再分装的包装种子植物保护机械零售(依法须经批准的项目，经相关部门批准后方可开展经营活动)。",山东,烟台,"招远市玲珑镇沟上"
曲阜市建筑设计有限公司,91370881267132993L,1990-09-18,N/A,孔红珊,"320万人民币","工业与民用建筑设计；古建筑设计；建筑装饰装潢设计；风景园林设计及技术咨询；地基勘察及新技术、新材料推广应用。(依法须经批准的项目，经相关部门批准后方可开展经营活动)。",山东,济宁,"曲阜市大同路南首建设大厦六楼"
滕州市鲍沟供销合作社新兴丰谷加盟店,91370481MA3D0F3R5H,1990-09-19,集体分支机构(非法人),胡安旗,"1万人民币","零售：日用百货、针织鞋帽、棉布、五金交电、土产杂品；代销化肥、农药（属危险化学品的除外）、农膜、农副产品",山东,枣庄,"滕州市鲍沟镇驻地"
青州市庙子供销合作社中心社,91370781169353098Q,1990-09-19,集体所有制,朱长征,"75.5万人民币","化肥（不含硝酸铵）、农膜、煤炭、润滑油、日用百货、日用杂品、农机具、针纺织品、服装鞋帽、文体用品、家用电器、五金交电、水暖管件、液化气灶、陶瓷制品、建筑材料、钢材、干鲜果品销售；产地中药购销；废旧物资收购；水暖安装；农药（不含化学危险品）、柴油、汽油、预包装食品兼散装食品、乳制品、卷烟销售（仅限有...",山东,潍坊,"青州市庙子镇庙子村"
滕州市食品塑料包装厂,91370481169903344H,1990-09-19,集体所有制,刘思水,"30万人民币","生产加工食品塑料包装",山东,枣庄,"滕州市北辛街道办事处新华街路北"
山东普泰建筑有限公司,913708281662423418,1990-09-19,N/A,陈群,"6,600(万元人民币)","房屋建筑工程、市政公用工程、钢结构工程、地基基础工程、起重设备安装工程、消防设施工程、防水防腐保温工程、道路及桥梁工程、装饰装修工程、环保工程、水电暖安装工程、园林绿化工程施工。",山东,济宁,"金乡县司马镇政府驻地"
中国农业银行股份有限公司济南东门支行,913701008631856373,1990-09-19,N/A,李延民,"0万元","许可该机构经营中国银行业监督管理委员会依照有关法律、行政法规和其他规定批准的业务，经营范围以批准文件所列的为准。",山东,济南,"济南市历下区东关大街43号"
莱芜市钢城区颜庄供销合作社,913712031695334359,1990-09-21,集体所有制,王庆文,"104.6万人民币","日用百货、化肥、农副产品（粮食除外）、废旧物资购销；成品油的购销",山东,济南,"莱芜市钢城区颜庄村"
禹城市电影发行放映公司,913714821675724222,1990-09-21,N/A,王爱苹,"73.4万人民币","电影发行、放映。(依法须经批准的项目，经相关部门批准后方可开展经营活动)",山东,德州,"山东省德州市禹城市行政街231号"
滨州市沾化区下河供销社生资批发商场,91371624MA3CCCT65A,1990-09-22,集体分支机构(非法人),王清岭,"N/A","化肥、农药",山东,滨州,"山东省滨州市沾化区下河乡政府驻地"
微山县对外贸易皮蛋加工厂,91370826166165219X,1990-09-24,国有企业,唐凤群,"11万人民币","生产、销售：畜禽水产品罐头、再制蛋类、荷叶茶；收购：农副产品",山东,济宁,"微山县夏镇国富街1号（微山经济开发区内）"
莘县金盾保安服务有限公司,9137152268065076X9,1990-09-24,N/A,史景来,"100(万元人民币)","门卫、巡逻、守护、随身护卫、安全检查、安全防范、安全风险评估、区域秩序维护。(有效期限以许可证为准)。物业管理、保安器材的零售。",山东,聊城,"莘县宏图街路南"
莱州市公共汽车公司,913706834937022372,1990-09-24,N/A,武炳军,"84(万元人民币)","城市公交客运。",山东,烟台,"山东省烟台市莱州市城港路街道北苑路3456号"
济南大隆建设工程有限公司,91370112163401271P,1990-09-24,N/A,张令泉,"2,000(万)","造林苗、城镇绿化苗、经济林苗、花卉的种植、批发、零售；房屋建筑工程、装饰装修工程、钢结构工程、园林工程、管道工程、路桥工程、防腐保温工程、园林古建筑工程、市政公用工程（凭资质证经营）；机械设备（不含特种设备）、电器设备安装；门窗安装；机械设备",山东,济南,"济南市历城区王舍人镇殷陈村"
微山县留庄建筑公司,91370826166162923E,1990-09-24,N/A,李玉友,"516.6万人民币","销售：工程内部电器、管道、预制构件；太阳能发电。",山东,济宁,"山东省微山县留庄镇"
淄博张店王舍建筑安装公司,913703031642415800,1990-09-25,N/A,孙猛,"2000万人民币","建筑安装工程、室内外装饰装修工程、工业与民用建筑工程、钢结构工程、地基基础工程、防水保温工程、园林绿化工程施工。(依法须经批准的项目，经相关部门批准后方可开展经营活动)",山东,淄博,"张店区王舍汽配城6-102"
诸城市春和商贸有限公司商业大厦,913707828697309906,1990-09-25,N/A,张夕生,"50万人民币","零售烟。销售日用百货、五金、日用杂品、针纺织品、服装鞋帽、家用电器；出租房屋、柜台。(有效期限以许可证为准；依法须经批准的项目，经相关部门批准后方可开展经营活动)。",山东,潍坊,"山东省潍坊市诸城市和平街99号"
潍坊市坊子区联运公司,91370704165603096A,1990-09-25,N/A,任成忠,"59.6000(万元人民币)","普通货运；危险货物运输（2类1项、2类2项、2类3项、3类、4类3项）；货物专用运输（集装箱、罐式）；货运站（场）经营。",山东,潍坊,"坊子工矿街19号"
诸城市春和商贸有限公司,913707821697116090,1990-09-25,N/A,张夕生,"50万人民币","零售烟。销售日用百货、五金、日用杂品、针纺织品、服装鞋帽、家用电器；出租房屋、柜台。(有效期限以许可证为准；依法须经批准的项目，经相关部门批准后方可开展经营活动)。",山东,潍坊,"山东省潍坊市诸城市和平街178号"
金乡县兴隆第二建筑工程有限公司,913708281662424131,1990-09-25,N/A,张本文,"2,078(万元人民币)","房屋建筑工程、市政公用工程、机电安装工程、地基基础工程、装饰装修工程、钢结构工程、起重设备安装工程、消防设施工程、防水防腐保温工程、外墙保温工程、铝合金门窗及塑料门窗安装工程、体育场地设施工程、环保工程施工。",山东,济宁,"金乡县兴隆乡驻地"
金乡县东关建筑公司,913708287609520638,1990-09-26,N/A,刘勇,"2026万人民币","房屋建筑工程承揽；水泥予制件制造。(依法须经批准的项目，经相关部门批准后方可开展经营活动)。",山东,济宁,"金乡县金乡镇东关村"
山东新合机械工程有限公司,913701026140707167,1990-09-26,N/A,许俐丽,"100(万)","对轻纺设备工程的安装、改造提供维修与咨询服务，加工配套专件和组件；进出口资格证书批准范围内的进出口业务、劳动保护用品、百货、日用杂货、五金交电、化工产品（不含化学危险品）、文化办公用品、建材、钢材、工艺美术品、汽车配件、纺织原料",山东,济南,"济南市文化东路145号"
中国农业银行股份有限公司龙口北大街分理处,91370681F495503010,1990-09-27,N/A,刁增勇,"N/A","经营中国银行业监督管理委员会依照法律、行政法规和其他规定批准的业务,经营范围以批准文件所列的为准。(依法须经批准的项目,经相关部门批准后方可开展经营活动)。",山东,烟台,"龙口市东莱街道北大街215-217"
兰陵县城区供销社楼西生产店,91371324MA3CYF3J4J,1990-09-27,集体分支机构(非法人),王守兰,"N/A","化肥、中小农具、五金、民用建材零售。(依法须经批准的项目，经相关部门批准后方可开展经营活动)。",山东,临沂,"兰陵县县城会宝路"
德州市德源橡塑制品厂,91371402MA3CUDWL8J,1990-09-27,集体所有制,李洪昌,"50万人民币","ＰＶＣ阻燃管、橡胶排泥管制造及维修、塑料制品制造。(依法须经批准的项目，经相关部门批准后方可开展经营活动)。",山东,德州,"德州市德城区湖滨南路"
山东省寿光市农业生产资料公司第十八经营部,91370783MA3CUQ6D2Q,1990-09-27,N/A,刘宗云,"N/A","零售:化肥、农药(不含危险化学品)、农膜、中小农具、农机配件、小五金、化工产品(不含危险化学品)、土产品、小百货(依法须经批准的项目,经相关部门批准后方可开展经营活动)。",山东,潍坊,"寿光市孙家集街道周家庄村"
兰陵县城区供销社多种经营综合部,91371324MA3CYF675B,1990-09-27,集体分支机构(非法人),张保兴,"N/A","化肥、民用建材、机电产品、日用杂品零售。(依法须经批准的项目，经相关部门批准后方可开展经营活动)。",山东,临沂,"兰陵县县城会宝路"
宁阳县城南供销合作社大孟批发部,91370921MA3CY44X5E,1990-09-28,集体分支机构(非法人),沈登军,"N/A","零售预包装食品兼散装食品，乳制品",山东,泰安,"泗店镇大孟村"
阳谷县供销合作社闫楼中心社关庄中心店,91371521MA3CXEL56U,1990-09-28,集体分支机构(非法人),陶兴可,"N/A","农药",山东,聊城,"阳谷县闫楼镇关庄村"
宁阳县城南供销合作社泗店第五综合商店,91370921MA3CY4560W,1990-09-28,集体分支机构(非法人),金永胜,"1.4万人民币","日用百货、针纺织品、农膜、化肥零售。(需许可经营的，凭许可证件经营)(依法须经批准的项目，经相关部门批准后方可开展经营活动)。",山东,泰安,"泗店镇泗店村"
中国建设银行股份有限公司济南历下支行,9137010086315198X9,1990-09-28,N/A,高立江,"0万元","经营中国银行业监督管理委员会依照有关法律、行政法规和其他规定批准的业务，经营范围以批准文件所列的为准。",山东,济南,"济南市历下区文化西路51号"
中国工商银行股份有限公司济南市中支行,91370100863185370G,1990-09-28,N/A,杨小宁,"0万元","经营中国银行业监督管理委员会依照有关法律、行政法规和其他规定批准的业务，经营范围以批准文件所列的为准。",山东,济南,"济南市市中区经十路21586号"
青州市庙子供销社百货门市部,91370781MA3CUQHN4R,1990-09-29,集体分支机构(非法人),刘玉军,"7万人民币","零售预包装食品兼散装食品,乳制品(不含婴幼儿配方乳粉)(有效期限以许可证为准）。在本店内零售卷烟.雪茄烟(有效期限以许可证为准)。针纺织品、日用百货、文教用品、鞋帽.日用杂品.建筑五金.陶瓷制品零售(依法须经批准的项目，经相关部门批准后方可开展经营活动)。",山东,潍坊,"青州市庙子镇庙子村"
青州市庙子供销社建材门市部,91370781MA3CUQL1XJ,1990-09-29,集体分支机构(非法人),张景友,"2.2万人民币","建筑材料零售(依法须经批准的项目，经相关部门批准后方可开展经营活动)。",山东,潍坊,"青州市庙子镇庙子村"
青州市北关建安有限公司,91370781169351260R,1990-09-29,N/A,马萍,"2000万人民币","房屋建筑工程施工",山东,潍坊,"青州市西环路营子村东南"
山东省济宁市林工商公司,913708001659231610,1990-09-29,N/A,周革新,"68.5万人民币","林产化工产品",山东,济宁,"济宁市红星中路19号"
中国工商银行股份有限公司广饶支行商业街储蓄所,91370523785025012J,1990-09-30,N/A,任同飞,"10万人民币","金融许可证范围内中国银行监督管理委员会依照有关法律法规和其他规定批发的业务；经营范围以批准文件所列的为准。(依法须经批准的项目，经相关部门批准后方可开展经营活动)",山东,东营,"广饶县府南路6号"
中国银行股份有限公司龙口支行,913706814936511936,1990-10-01,N/A,刘军,"N/A","经营中国银行监督管理委员会依照有关法律、行政法规和其他规定批准的业务，经营范围以批准文件所列的为准。(有效期限以许可证为准)。(依法须经批准的项目，经相关部门批准后方可开展经营活动)。",山东,烟台,"龙口市东莱街道办事处花木兰街388号"
青州市供销社实业公司,9137078116935172XU,1990-10-02,集体所有制,李常村,"340万人民币","国内商业购销，饮食服务，农副产品加工，废旧物资收购",山东,潍坊,"青州市云门山北路１５６号"
山东省化肥工业总公司,913701021630440919,1990-10-02,N/A,范秀凯,"120(万)","销售：化肥、化工产品（不含危险品）、钢材、水泥、仪表、普通机械；技术服务；复混肥生产用原料的供应",山东,济南,"济南市历下区历山路80号"
青岛市经济开发公司,9137021172556759XW,1990-10-03,N/A,杨德顺,"5000万元","制定实施开发区基础设施、生产设施的建设，洽谈和签订合资、合作项目，接受国内外投资者委托；经营其他无需行政审批即可经营的一般经营项目。",山东,青岛,"山东省青岛市黄岛区长江路369号"
山东省宁津县动力配件厂,91371422167772512Y,1990-10-03,N/A,刘文彬,"4.2万人民币","汽车配件、农机配件、尼龙件制造销售(依法须经批准的项目，经相关部门批准后方可开展经营活动)。",山东,德州,"宁津县杜集镇来庄"
中国农业银行股份有限公司龙口新嘉支行,91370681869440774H,1990-10-04,N/A,贾铭韬,"N/A","经营中国银行业监督管理委员会依照法律、行政法规和其他规定批准的业务,经营范围以批准文件所列的为准。(依法须经批准的项目，经相关部门批准后方可开展经营活动)。",山东,烟台,"龙口市新嘉镇邮电局东"
鄄城县农业生产资料公司,91371726169230434W,1990-10-06,N/A,吴正涛,"5万人民币","农药",山东,菏泽,"鄄二路188号"
山东省盐业集团有限公司,91370000163044251E,1990-10-06,N/A,孙树声,"21,608.7000(万元人民币)","盐及盐化工产品",山东,济南,"山东省济南市历下区文化东路59号"
烟台市莱山区振华农具配件厂,91370613MA3D1N9U5T,1990-10-06,集体所有制,苏胥德,"5万人民币","农用金属工具制造(依法须经批准的项目，经相关部门批准后方可开展经营活动)。",山东,烟台,"莱山区初家镇宋家庄村"
青州市同利机械厂,91370781169353151L,1990-10-06,集体所有制,冯可忠,"546.9万人民币","建筑机械及配件、农机具生产、销售，生铁铸造",山东,潍坊,"青州市庙子镇上庄村"
山东万达电缆有限公司,91370521164883743R,1990-10-07,有限责任公司,巴文广,"30000万人民币","变压器、箱式变电站，电子、电器材料，节能电子、电力设备，高低压计量设备、直线抽油机、采油设备及配件、抽油杆、油管、电机电泵轴，压缩机、风机、电机、石油化工设备、钻采工具及成套设备的生产、销售和相关技术开发，机械加工；电气工程安装；黄金饰品销售；售电；电力工程、机电工程、石油化工建设工程施工、防水防腐...",山东,东营,"东营市永莘路68号"
微山县夏镇建筑公司,91370826166163301B,1990-10-08,N/A,李正平,"600万人民币","房屋建筑工程三级企业",山东,济宁,"山东省微山县夏镇城后路58号"
青州市吉利粮油有限公司,91370781169353645C,1990-10-08,N/A,李维章,"20万人民币","批发兼零售预包装食品(有效期限以许可证为准)。粮油收购、储存、销售,饲料原料、农副产品",山东,潍坊,"青州市东高镇东高村"
青岛天马建材有限公司,91370203163921699R,1990-10-08,N/A,高隆明,"105万元","一般经营项目:批发、零售：建筑装饰材料、五金交电、机械设备。",山东,青岛,"青岛市市北区保张路2号甲"
济宁蓝天锅炉压力容器安装有限公司,91370800165923233Q,1990-10-08,N/A,刘建新,"5,000(万元人民币)","锅炉的安装、改造、维修；电器仪表的安装；锅炉辅机的生产销售。(依法须经批准的项目，经相关部门批准后方可开展经营活动)",山东,济宁,"山东省济宁市任城区港宁路中段路东济宁运河热力有限公司院内"
青岛优源铸造有限公司,91370281614371391T,1990-10-09,N/A,阎立方,"860(万美元)","生产工艺铸铁产品、铸铝产品和铸铜产品和食品机械加工、制造。",山东,青岛,"青岛胶州市李哥庄镇驻地"
青州市东坝供销合作社,91370781MA3CUQJQ18,1990-10-09,集体所有制,王其新,"81.3万人民币","酒糖茶、糕点、罐头、食品、乳制品及非酒精饮料、调味品、化肥（不含硝酸铵）、农药、农膜、定型包装种子、针纺织品、文教用品、日用百货、建筑五金、日用杂品、建筑材料销售",山东,潍坊,"青州市东坝镇东坝村"
青岛宏峰印刷有限公司宏峰电脑工作室,91370200X14201866M,1990-10-10,N/A,张桂英,"0万元","打印、复印；批发零售：文教用品、办公自动化设备。",山东,青岛,"青岛市市南区山西路21号"
中国农业银行股份有限公司济南文苑支行,91370100724811482Y,1990-10-10,N/A,李晓梅,"0万元","经营中国银行业监督管理委员会依照有关法律、行政法规和其他规定批准的业务，经营范围以批准文件所列的为准。(依法须经批准的项目，经相关部门批准后方可开展经营活动)",山东,济南,"济南市历下区文化东路88-1号"
菏泽市定陶区糖业烟酒公司,91371727740201668E,1990-10-10,N/A,崔承军,"53万人民币","烟；常温预包装食品、散装食品；酒水零售",山东,菏泽,"菏泽市定陶区青年路D段084号"
鲁英( 济宁 )塑料制品有限公司,913708006135901706,1990-10-10,N/A,王长青,"535(万美元)","PVC压延薄膜.PVC复合薄膜.PVC夹网薄膜生产销售",山东,济宁,"济宁市车站东路38号"
山东新星集团有限公司,91370302164201028Q,1990-10-10,有限责任公司,魏心东,"12000万人民币","批发兼零售预包装食品兼散装食品、乳制品（含婴幼儿配方乳粉）；比亚迪汽车销售；煤炭、保健食品、农副产品（不含种子）、五金交电、化工产品（不含危险及易制毒化学品）、洗涤化妆用品、金银珠宝、文体用品、针纺用品、日用百货、钢材、服装鞋帽、太阳能热水器、建材、消防器材、仓储货物堆放架、安防监控设备、二类医疗...",山东,淄博,"淄川区淄城路341号"
微山县副食品加工厂,9137082616616059X1,1990-10-11,国有企业,张伟,"218万人民币","加工销售：酱油、醋(凭许可证经营，有效期至2013年2月24日止)(依法须经批准的项目，经相关部门批准后方可开展经营活动)。",山东,济宁,"山东省微山县夏镇奎文东路23号"
寿光市杨庄供销合作社土产门市部,91370783765756504P,1990-10-11,集体分支机构(非法人),丁月风,"N/A","零售：土产杂品、化肥、农药",山东,潍坊,"杨庄乡杨庄村"
