企业名称,统一社会信用代码,注册日期,企业类型,法人代表,注册资金,经营范围,所在省份,地区,注册地址
寿光市道口供销合作社张海水生资经营部,91370783MA3CAJMG0U,1990-01-01,集体分支机构(非法人),张海水,"N/A","零售：五金交电、百货、针纺织品、农药(不含危险化学品)、农膜、化肥(依法须经批准的项目，经相关部门批准后方可开展经营活动)*",山东,潍坊,"寿光市侯镇北仉村"
寿光市北洛供销合作社,91370783165683479K,1990-01-01,集体所有制,徐新闻,"162万人民币","零售：日用百货、五金交电、针纺织品、日用杂品、化肥、农药（不含危险化学品）、农膜、农副产品",山东,潍坊,"寿光市北洛镇北洛村"
山东省工艺品进出口集团企业公司,91370000163047866N,1990-01-01,N/A,吕跃进,"217.4万人民币","仓储（不含化学危险品）、物业管理；组织出口货源",山东,青岛,"青岛市城阳区流亭立交桥西侧"
中国农业银行股份有限公司胶州北京路分理处,91370281869675661D,1990-01-01,N/A,韩伟,"0万元","许可经营项目:经营中国银行业监督管理委员会依照有关法律、行政法规和其他规定批准的业务，经营范围以批准文件所列的为准",山东,青岛,"青岛市胶州市北京路2号胶州市行政东楼"
寿光市道口供销合作社北单门市部,91370783MA3CFBWA0H,1990-01-01,集体分支机构(非法人),单广,"3.5万人民币","零售：卷烟、雪茄烟（有效期限以许可证为准)；零售预包装食品，零售散装食品，乳制品（含婴幼儿配方乳粉）；零售：五金交电、百货、针纺织品、农药(不含危险化学品)、农膜、化肥(依法须经批准的项目，经相关部门批准后方可开展经营活动)*",山东,潍坊,"道口镇北单村"
中国农业银行股份有限公司龙口市支行,913706814936501740,1990-01-02,N/A,王宏,"118万人民币","经营中国银行业监督管理委员会依照法律、行政法规和其他规定批准的业务,经营范围以批准文件所列的为准。(有效期限以许可证为准)。(依法须经批准的项目，经相关部门批准后方可开展经营活动)。",山东,烟台,"龙口市黄城西环路中段龙口大酒店对面"
潍坊市寒亭区寒亭供销合作社大楼生产门市部,91370703MA3CUQA87X,1990-01-02,集体分支机构(非法人),姜其森,"N/A","化肥零售",山东,潍坊,"寒亭镇寒亭二村"
青岛市市北区辽源路社区服务公司,91370203163745074D,1990-01-03,N/A,崔鑫,"80(万)","组织本街道闲散居民生产、装卸、劳务服务；批发兼零售：汽车零部件、电工器材、建筑材料、装饰材料、日用百货；零售：劳动防护用品；复印、打字；市场开办；市场内经营管理和劳务服务；场地、房屋、摊位、设备租赁；【废品收购；住宿】",山东,青岛,"青岛市市北区通榆路36号丙"
中国工商银行股份有限公司济南趵突泉支行,91370100964709014M,1990-01-03,N/A,邱绪柱,"0万元","经营中国银行业监督管理委员会依照有关法律、行政法规和其他规定批准的业务，经营范围以批准文件所列的为准。(依法须经批准的项目，经相关部门批准后方可开展经营活动)",山东,济南,"济南市市中区济大路11号"
中国工商银行股份有限公司济南趵突泉支行旅游路储蓄所,913701008631695492,1990-01-03,N/A,邱绪柱,"N/A","经营中国银行业监督管理委员会依照有关法律、行政法规和其他规定批准的业务，经营范围以批准文件所列的为准。(依法须经批准的项目，经相关部门批准后方可开展经营活动)",山东,济南,"济南市市中区旅游路28666号国华东方美郡1区3号楼1-102室"
平邑县白彦供销合作社贾庄联合超市,91371326MA3C1APEXM,1990-01-04,集体经营单位(非法人),贾兆平,"1.2万人民币","农药、化肥、百货、日用杂品、针纺织品、文具零售；金银花、花椒、板栗、干鲜果品、花生米购销",山东,临沂,"山东省临沂市平邑县白彦镇同心村"
平邑县白彦供销合作社小黄坡村综合服务站,91371326MA3CU7LC85,1990-01-04,集体经营单位(非法人),谢洪青,"0.5万人民币","副食、农药、烟花爆竹(有效期限以许可证为准)。百货、针纺织品、五金、日用杂品、化肥、农地膜、杂粮零售。(依法须经批准的项目，经相关部门批准后方可开展经营活动)。",山东,临沂,"平邑县白彦镇小黄坡"
平邑县白彦供销合作社传振联合超市,91371326MA3BYQER93,1990-01-04,集体经营单位(非法人),隋纪荣,"3万人民币","农药、食品、烟花爆竹(有效期限以许可证为准)。百货、针纺织品、日用杂品、化肥、农地膜零售",山东,临沂,"平邑县白彦镇驻地"
平邑县白彦供销合作社芳彬联合超市,91371326MA3CDH8K5T,1990-01-04,集体经营单位(非法人),神芳彬,"2.2万人民币","食品、烟花爆竹(有效期限以许可证为准)。百货、针纺织品、五金、日用杂品、服装、鞋帽零售。(依法须经批准的项目，经相关部门批准后方可开展经营活动)。",山东,临沂,"山东省临沂市平邑县白彦镇枣梨村"
新泰市龙廷供销社,91370982169595759T,1990-01-04,集体所有制,单光文,"91万人民币","百货、五金、化肥、土产杂品（除烟花爆竹）、木材、文教用品零售；农副产品",山东,泰安,"山东省泰安市龙廷村"
平邑县白彦供销合作社龙桂联合超市,91371326MA3C1AN96K,1990-01-04,集体经营单位(非法人),龙西桂,"N/A","农药",山东,临沂,"山东省临沂市平邑县白彦镇同心村"
新汶矿业集团有限责任公司第二招待所,91370982796185978T,1990-01-04,N/A,梁翠云,"N/A","住宿",山东,泰安,"山东省泰安市新汶办事处"
新汶矿业集团孙村煤矿多种经营公司..,9137098216959588XH,1990-01-04,N/A,史秀清,"496万人民币","煤副产品、家用电器、汽车零部件、轮胎的批发、零售；矿用机电产品的制造、维修；电器维修；室内外装修；水泥预制品、工艺毯、绒绣、儿童玩具、服装、加工、销售；运输业务咨询 ；汽车装具；汽车轮胎修补；自有房屋租赁；以下项目只限分支经营：汽油、柴油、润滑油、润滑脂、汽车配件的零售。(依法须经批准的项目，经相关部门批准后方可开展经营活动)。",山东,泰安,"山东新泰新汶办事处"
平邑县白彦供销合作社姜家庄综合超市,91371326MA3C5DKR4H,1990-01-04,集体经营单位(非法人),吴文爱,"N/A","百货、针纺织品、五金、日用杂品、家具、化肥、农地膜、杂粮零售；地产中药材购销（依法须经批准的项目，经相关部门批准后方可开展经营活动）",山东,临沂,"山东省临沂市平邑县白彦镇姜家庄村"
中国银行股份有限公司泰安市政广场支行,91370900764832819C,1990-01-05,N/A,张敏,"N/A","经营中国银行业监督管理委员会依照有关法律、行政法规和其他规定批准的业务，经营范围以批准文件所列的为准。(依法须经批准的项目，经相关部门批准后方可开展经营活动)。",山东,泰安,"山东省泰安市东岳大街435-1号"
烟台天富化工实业有限责任公司,913706002656003006,1990-01-06,N/A,赵欧平,"100万人民币","计算机技术咨询、计算机软件开发；网上销售：花卉、生鲜水果蔬菜、装饰材料、日用百货、电子产品、办公用品、化妆品、清洁用品、洗化用品、家居用品、玩具、陶瓷制品、橡胶及塑料制品、工艺礼品；销售：除味系列产品、洗涤用品、化工产品及原料",山东,烟台,"烟台开发区五指山路17号"
山东建勘集团有限公司,91370000495573061M,1990-01-06,N/A,付宪章,"6,702.2100(万元人民币)","岩土工程勘察、岩土工程设计与咨询、地基基础工程施工、建筑工程质量检测；建筑工程设计，市政工程设计，工程鉴定与加固设计施工，城乡规划编制；工程测量、地形测绘、建筑基坑与轨道工程监测、不动产测量、地理信息系统工程建设；摄影测量与遥感；水文地质勘察、劳务类（工程凿井、钻探），市政公用工程施工，地质灾害勘查设计与评估，建筑工程、工程勘察施工图审查，特种专业（结构补强），污染修复工程设计、环保工程施工；建材、五金、交电、建筑装饰装潢材料、金属材料（除危险品）、木材、钢材、一般化工产品、机械设备、电子产品、纸制品、橡胶制品、塑料制品销售（依法须经批准的项目，经相关部门批准后方可开展经营活动）",山东,济南,"山东省济南市天桥区无影山西路686号"
莒南县演马供销合作社五金店,91371300MA3CBWNC5D,1990-01-07,集体分支机构(非法人),冯立峰,"10万人民币","家用电器、电工器材、五金杂品、油漆、颜料、农机配件、文体百货零售",山东,临沂,"临沂临港经济开发区壮岗镇东演马村"
山东华鲁建安集团有限公司,91371327168490488M,1990-01-07,N/A,刘志良,"6,567.3000(万)","房屋建筑工程施工总承包壹级，建筑装饰装修工程专业承包贰级，园林古建筑工程专业承包贰级，钢结构工程专业承包贰级，机电设备安装工程贰级，起重设备安装工程贰级",山东,临沂,"莒南县城华鲁街"
淄博康平机电安装工程有限公司,91370305265160464Q,1990-01-07,N/A,崔课贤,"1200万人民币","机电设备、线路、管道安装维修及配套土建工程；防腐保温工程；化工设备清洗；通讯信息网络工程施工；化工配件加工；门窗制作安装；批零化工产品及原料",山东,淄博,"淄博市临淄区辛三路19号"
莒南县壮岗供销合作社生产资料采购站二店,91371300MA3C4NKT20,1990-01-07,集体分支机构(非法人),冯守礼,"N/A","化肥、农地膜、中小农具零售。(依法须经批准的项目，经相关部门批准后方可开展经营活动)。",山东,临沂,"临沂临港经济开发区壮岗镇东演马村"
诸城市桃林供销合作社,91370782169713794X,1990-01-08,集体所有制,郭德玉,"56万人民币","批发、零售化肥，高效低毒、低残留农药，农膜，日用杂品，针织品，百货，五金交电，收购土产品。(依法须经批准的项目，经相关部门批准后方可开展经营活动)。",山东,潍坊,"山东省潍坊市诸城市桃林乡桃林村"
济南兴华汽车修理有限公司,913701021631474022,1990-01-08,N/A,李新祺,"52万元","二类汽车维修（小型车辆维修）",山东,济南,"济南市历下区和平路29号"
泰安市岱岳区满庄镇教育书店,91370900866531400H,1990-01-08,N/A,高传银,"2万人民币","图书报刊零售;日用百货、文体用品、五金交电、劳保用品、床上用品销售。(依法须经批准的项目，经相关部门批准后方可开展经营活动)",山东,泰安,"山东省泰安市满北村"
中国银行股份有限公司胶州广州北路支行,9137028186967540XJ,1990-01-08,N/A,贾红梅,"0万元","许可经营项目:经营中国银行业监督管理委员会依照有关法律、行政法规和其他规定批准的业务，经营范围以批准文件所列的为准",山东,青岛,"青岛市胶州市广州北路6号第7号网点"
山东水利工程机械总厂,913700001630414136,1990-01-09,国有企业,薛军,"1075万人民币","装载机、水利闸门启闭机、泥浆泵、裹砂混凝土搅拌机、金属结构及其构件制造、电焊、气焊、铆焊服务；机械零件加工；机械设备租赁。(依法须经批准的项目，经相关部门批准后方可开展经营活动)",山东,济南,"济南市历城区大桥路229号"
曹县韩集供销合作社,91371721MA3CWMM67T,1990-01-09,集体所有制,周长涛,"45万人民币","烟花爆竹、烟酒糖茶、五金交电、化肥、农膜、农药、不再分装的包装的包装种子、饲料、农机具、药械，鞋帽、布匹、日用杂品",山东,菏泽,"韩集镇韩集村北门外"
中国工商银行股份有限公司潍坊北宫支行,91370700740206813Q,1990-01-10,N/A,刘焕勇,"N/A","吸收公众存款,发放短期、中期和长期贷款,办理国内外结算,办理票据承兑与贴现,代理发行、代理兑付、承销政府债券,买卖政府债券、金融债券,从事银行卡业务,代理收付款项业务,经中国银行业监督管理委员会或其他享有行政许可权的机构核准或备案并经上级机构授权的业务。",山东,潍坊,"潍坊市潍城区向阳路208号"
中国建设银行股份有限公司华能德州发电厂支行,91371400706367322C,1990-01-10,N/A,张华,"N/A","经营中国银行业监督管理委员会依照有关法律、行政法规和其他规定批准的业务，经营范围以批准文件所列的为准。(依法须经批准的项目，经相关部门批准后方可开展经营活动)。",山东,德州,"德城区华兴路10号"
中国工商银行股份有限公司潍坊分行圣荣广场分理处,913707005690111184,1990-01-10,N/A,李欣,"0万人民币","经营中国银行业监督管理委员会依照有关法律、行政法规和其他规定批准的业务,经营范围以批准文件所列的为准。(凭金融许可证开展经营)(有效期限以许可证为准，有效期限以许可证为准）",山东,潍坊,"潍坊高新区北海路666号"
中国工商银行股份有限公司潍坊潍柴支行,91370700865423555F,1990-01-10,N/A,李冰,"0万人民币","办理人民币存款、贷款、结算业务；办理票据业务；代理发行、兑付债券；买卖政府债券；代理收付款项；办理外币储蓄业务；其总行在中国银行业监督管理委员会批准的业务范围内授权的业务，经银行业监督管理机构批准的其他业务。",山东,潍坊,"奎文区民生东街中段"
中国工商银行股份有限公司潍坊分行金宝分理处,913707005690112490,1990-01-10,N/A,丛子程,"N/A","经营中国银行业监督管理委员会依照有关法律、行政法规和其他规定批准的业务，经营范围以批准文件所列的为准",山东,潍坊,"潍坊市奎文区潍州路以东、金宝商业街以南潍州路1988号"
中国工商银行股份有限公司临朐支行东城分理处,91370724569003468R,1990-01-10,N/A,陈波,"N/A","办理人民币存款、贷款、结算业务；代理发行金融债券；代理发行、代理兑付、销售政府债券；代理收付款项；办理外币储蓄业务；其总行在中国银行监督管理委员会批准的业务范围内授权的业务，经银行业监督管理机构批准的其他业务(有效期限以许可证为准)；中国保监会批准的财产保险和人身保险（航意险及其替代产品除外）",山东,潍坊,"临朐县东城科技创业大厦大门西侧第1号房"
中国工商银行股份有限公司潍坊和平路支行,913707006832248706,1990-01-10,N/A,杨世栋,"0万人民币","办理人民币存款、贷款、结算业务；办理票据业务；代理发行、兑付债券；买卖政府债券；代理收付款项；办理外币储蓄业务；其总行在中国银行业监督管理委员会批准的业务范围内授权的业务；经银行业监督管理机构批准的其他业务",山东,潍坊,"潍城区和平路50号"
中国工商银行股份有限公司潍坊分行东风影院分理处,913707005754911035,1990-01-10,N/A,韩顺,"N/A","经营中国银行业监督管理委员会依照有关法律、行政法规和其他规定批准的业务，经营范围以批准文件所列的为准",山东,潍坊,"潍坊市潍城区东风西街1597号8号房一层"
中国工商银行股份有限公司临朐支行,9137072486575352XE,1990-01-10,N/A,陈波,"N/A","办理人民币存款、贷款、结算业务；代理发行金融债券；代理发行、代理兑付、销售政府债券；代理收付款项；办理外币储蓄业务；其总行在中国银行监督管理委员会批准的业务范围内授权的业务，经银行业监督管理机构批准的其他业务(有效期限以许可证为准)；中国保监会批准的财产保险和人身保险（航意险及其替代产品除外）",山东,潍坊,"县城民主路105号"
中国工商银行股份有限公司潍坊文化路支行,913707005690202177,1990-01-10,N/A,于春明,"N/A","吸收公众存款，发放短期、中期和长期贷款，办理国内外结算，办理票据承兑和贴现，代理发行、代理兑付、承销政府债券，买卖政府债券、金融债券，从事银行卡业务，代理收付款项，经中国银行业监督管理委员会或其他享有行政许可权的机构核准或备案并经上级授权的业务。",山东,潍坊,"潍坊市奎文区文化路469号"
山东临朐市政工程有限公司,91370724165720786C,1990-01-10,N/A,王英军,"12000万人民币","市政公用工程、城市及道路照明工程及园林绿化工程施工；市政设施养护管理；工程测量、不动产测绘；工程服务；水泥制品、筑路材料、预拌混凝土加工、销售；建筑用石材来料加工、销售；道路清扫、保洁；垃圾收集、清运。",山东,潍坊,"山东省潍坊市临朐县城石埠街67号"
德州市德城区抬头寺供销合作社路东门市部,91371402MA3CUDW73M,1990-01-10,集体分支机构(非法人),赵长武,"3.2万人民币","日用百货、日用杂品（不含易燃易爆物品）、土产杂品",山东,德州,"德州市德城区抬头寺乡大赵村北"
中国工商银行股份有限公司潍坊分行北宫西街分理处,913707005754911110,1990-01-10,N/A,刘刚,"N/A","经营中国银行业监督管理委员会依照有关法律、行政法规和其他规定批准的业务，经营范围以批准文件所列的为准（凭金融许可证开展经营，有效期至以许可证为准）",山东,潍坊,"潍坊市潍城区北宫街与永安路交叉口西北角(瑞泰大厦)"
中国工商银行股份有限公司潍坊东关支行,91370700865423539R,1990-01-10,N/A,刘美光,"0万人民币","经营中国银行业监督管理委员会依照有关法律、行政法规和其他规定批准的业务，经营范围以批准文件所列的为准（凭金融许可证开展经营，有效期限以许可证为准）",山东,潍坊,"山东省潍坊市潍坊市奎文区潍州路751号(甲)"
中国农业银行股份有限公司莱西南京路支行,91370285864031824D,1990-01-12,N/A,李树生,"0万元","许可该机构经营中国银行业监督管理委员会依照有关法律、行政法规和其他规定批准的业务，经营范围以批准文件所列的为准。",山东,青岛,"青岛莱西市水集街道办事处琴岛东路71-1号"
山东工艺品进出口集团发制品厂,91370000163046193H,1990-01-12,国有企业,丁兆云,"552.4万人民币","发制品、化纤发制品、服装、皮革制品制造、加工；本公司出口工艺品的生产、加工；玩具生产。(依法须经批准的项目，经相关部门批准后方可开展经营活动)",山东,青岛,"青岛市城阳区城阳镇"
临沂剧院有限公司,913713021682622582,1990-01-12,N/A,宋开富,"1,000(万元人民币)","影院管理。(有效期限以许可证为准)。广告制作发布。(依法须经批准的项目，经相关部门批准后方可开展经营活动)。",山东,临沂,"临沂市考棚街10号"
新泰市宫里镇淀粉厂,91370982MA3CY3X74N,1990-01-12,N/A,李义儒,"27.5万人民币元","机械设备及自有房屋租赁。(依法须经批准的项目,经相关部门批准后方可开展经营活动)。",山东,泰安,"山东省泰安市东柳村"
德州市陵城区农村信用合作联社边临镇信用社,91371421867373088A,1990-01-12,N/A,毕川,"N/A","（一）吸收公众存款；（二）发放短期、中期、长期贷款；（三）办理国内结算；（四）办理票据承兑与贴现；（五）代理发行、代理承兑、承销政府债券；（六）买卖政府债券、金融债券；（七）代理收付款项及代理保险业务；（八）提供保险箱服务；（九）办理经中国银行业监督管理机构批准的其他业务",山东,德州,"陵城区边临镇政府南邻"
德州市陵城区农村信用合作联社丁庄信用社,91371421867377951H,1990-01-12,N/A,朱毅,"N/A","（一）吸收公众存款；（二）发放短期、中期、长期贷款；（三）办理国内结算；（四）办理票据承兑与贴现；（五）代理发行、代理兑付、承销政府债券；（六）买卖政府债券、金融债券；（七）代理收付款项及代理保险业务；（八）提供保险箱业务；（九）办理经中国银行业监督管理机构批准的其他业务",山东,德州,"陵城区丁庄镇丁庄街"
五莲县中至供销合作社,91371121MA3CYEFL4U,1990-01-13,集体所有制,白友亮,"98万人民币","日用百货、针织品、五金交电、化肥、农膜的销售",山东,日照,"(山东省日照市)中至镇驻地"
中国银行股份有限公司海阳支行,913706878653017859,1990-01-13,N/A,戚卫旻,"N/A","许可该机构经营中国银行业监督管理委员会依照有关法律、行政法规和其他规定批准的业务，经营范围以批准文件所列的为准(有效期限以许可证为准)(依法须经批准的项目，经相关部门批准后方可开展经营活动)。",山东,烟台,"山东省烟台市海阳市海政路160号"
淄博市鲁源实业总公司鲁源大酒店,913703238686288552,1990-01-13,N/A,杨玉海,"23.5万人民币","大型餐馆；住宿；会务服务。",山东,淄博,"沂源县城振兴路西首"
莱州市店东塑料制品厂,91370683169863493C,1990-01-13,集体所有制,宿吉,"4.3万人民币","制造:塑料打包带。(依法须经批准的项目，经相关部门批准后方可开展经营活动)",山东,烟台,"平里店镇店东村"
济南市供销储运总公司,913701041631409645,1990-01-13,N/A,朱霆,"324万元","仓储，公路货运",山东,济南,"济南市经七路纬七路149号"
微山县顺发印刷有限公司,91370826267146607N,1990-01-15,N/A,胡景者,"50万人民币","其他印刷品印刷(有效期限以许可为准).",山东,济宁,"山东省济宁市微山县马坡镇老泗河桥南200米,济微路东(微山县职业中专门北500米"
平邑县流峪银花专业合作社谭家庄分社,91371326MA3CYG9424,1990-01-15,集体经营单位(非法人),陈现合,"0.15万人民币","化肥、百货、针纺织品、五金、日用杂品零售。(依法须经批准的项目，经相关部门批准后方可开展经营活动)。",山东,临沂,"平邑县流峪镇谭家庄"
中国银行股份有限公司青岛李沧支行,91370213964902789N,1990-01-15,N/A,王建旭,"0万元","许可经营项目:经营中国银行业监督管理委员会依照有关法律、行政法规和其他规定批准的业务，经营范围以批准文件所列的为准",山东,青岛,"青岛市李沧区京口路15号"
平邑县流峪银花专业合作社南申庄分社,91371326MA3CADHF4J,1990-01-15,集体经营单位(非法人),许士金,"N/A","烟酒、食品、烟花爆竹",山东,临沂,"平邑县流峪镇南申庄村"
平邑县流峪银花专业合作社批裴家沟村分社,91371326MA3CADA315,1990-01-15,集体经营单位(非法人),裴亚军,"0.13万人民币","烟酒、食品、烟花爆竹",山东,临沂,"平邑县流域镇裴家沟村"
淄博恩成经贸有限公司,91370305164323957P,1990-01-15,N/A,毕方亮,"100.38万人民币","喷花类［C级D级］、爆竹类［C级］、旋转类［C级D级］、升空类［C级］、吐珠类［C级］、玩具类［C级、D级］、组合烟花类［C级D级］（烟雾、摩擦产品除外）的储存、批发、销售(有效期限以许可证为准)；日用百货、民用建材、土产杂品、五交化、化纤棉布、百货鞋帽、针纺织品、家用电器、服装、文化用品、搪瓷制品、钟表、塑料、化工产品",山东,淄博,"临淄区齐园路56号"
平邑县流峪银花专业合作社老泉崖分社,91371326MA3CAD2X62,1990-01-15,集体经营单位(非法人),王胜,"0.14万人民币","烟酒、食品、农药、烟花爆竹（在许可证核准的经营范围内经营）百货、针纺织品、五金、日用杂品、饲料、杂粮",山东,临沂,"流峪老泉崖村"
栖霞市官道供销合作社农机具修配组,91370686MA3D1P7K69,1990-01-15,集体经营单位(非法人),胡乃友,"N/A","加工、修理：农机具、床头、铁门。(依法须经批准的项目，经相关部门批准后方可开展经营活动)。",山东,烟台,"栖霞市杨家洼村"
平邑县流峪银花专业社合社贵山子村分社,91371326MA3CYFDY08,1990-01-15,集体经营单位(非法人),刘启贵,"0.13万人民币","百货、针纺织品、五金、日用杂品、化肥零售。(依法须经批准的项目，经相关部门批准后方可开展经营活动)。",山东,临沂,"平邑县流峪贵山子村"
平邑县流峪银花专业合作社上固安分社,91371326MA3CAD2A8L,1990-01-15,集体经营单位(非法人),孟祥美,"N/A","烟酒、预包装兼散装食品、烟花爆竹、百货、针纺织品、五金、日用杂品、化肥、饲料零售。",山东,临沂,"流峪上固安村"
中国工商银行股份有限公司潍坊豪德广场支行,91370700740227235M,1990-01-16,N/A,宫金峰,"N/A","吸收公众存款，发放短期、中期和长期贷款，办理国内外结算，办理票据承兑和贴现，代理发行、代理兑付、承销政府债券，买卖政府债券、金融债券，从事银行卡业务，代理收付款项，经中国银行业监督管理委员会或其他享有行政许可权的机构核准或备案并经上级授权的业务",山东,潍坊,"潍坊市潍城区豪德贸易广场中区A-1-1南街32号"
