曲阜市工业供销总公司,913708811694727830,1990-06-05,N/A,武民,"88万人民币","金属材料．木材．化工产品．机械设备．机电设备．农机配件．建筑材料销售(依法须经批准的项目，经相关部门批准后方可开展经营活动)。",山东,济宁,"曲阜市大同路8号"
济南市供销社经贸实业总公司,9137010526431170X6,1990-06-06,集体所有制,李玉亭,"660万人民币","百货、针织品、五金、交电、日用品、中小农具批发、零售；房屋出租。(依法须经批准的项目，经相关部门批准后方可开展经营活动)",山东,济南,"济南市天桥区北园大街423号"
德州市陵城区农村信用合作联社凤凰分社,913714218673766680,1990-06-07,N/A,孙选彬,"500万人民币","（一）吸收公众存款；（二）发放短期、中期、长期贷款；（三）办理国内结算；（四）办理票据承兑与贴现；（五）代理发行、代理承兑、承销政府债券；（六）买卖政府债券、金融债券；（七）代理收付款项及代理保险业务；（八）提供保险箱服务；（九）办理经中国银行业监督管理机构批准的其他业务",山东,德州,"陵城区临齐街道凤凰店"
中国建设银行股份有限公司烟台福山支行,913706114935401433,1990-06-08,N/A,姜文胜,"N/A","金融许可证批准范围内的相关业务。(有效期限以许可证为准)。",山东,烟台,"烟台市福山区汇福街59号"
山东省茌平县自来水公司,91371523168092121D,1990-06-08,N/A,吕志远,"632万人民币","自来水供应、销售及相关安装、维修、服务；纯净水生产、销售（有效期限以许可证为准）；房屋租赁；光伏发电",山东,聊城,"山东省聊城市茌平县民生路以北迎宾大道以西"
山东省聊城市钻探机械配件厂,91371502167897358N,1990-06-08,集体所有制,陈光,"50万人民币","钻探机械配件、农机具、机加工、车下脚、维修；各种农机具制造 销售、维修。(依法须经批准的项目，经相关部门批准后方可开展经营活动)。",山东,聊城,"柳园南路65号"
山东省茌平县燃料公司,913715231680920922,1990-06-08,N/A,孙长军,"100万人民币","钢材建材、五金交电、百货、房屋租赁；汽油、柴油、机油及润滑油（仅限于下属加油站经营）、化工产品〈剧毒危险品除外〉＊",山东,聊城,"中心街219号"
中国农业银行股份有限公司聊城城东分理处,91371500740207349B,1990-06-08,N/A,沈庆广,"0万人民币","吸收公众存款；发放短期、中期、长期贷款；办理国内外结算；办理票据承兑与贴现；代理发行、代理兑付、承销政府债券。从事银行卡业务；代理收付款项及代理保险业务；代理资金清算；各类汇兑业务；外汇存款；外汇贷款；外汇汇款；发行、代理发行、买卖或代理买卖股票以外的外币有价证券；外汇票据承兑和贴现；自营、代客外汇买卖；外币兑换；企业、个人财务顾问服务；证券公司客户交易结算资金存管业务；证券投资基金托管业务；企业年金托管业务；产业投资基金托管业务；代理开放式基金业务；电话银行、网上银行、手机银行业务；经中国银行业监督管理机构等监管部门批准并经上级行授权的其他业务。(凭有效期内的金融许可证经营，有效期限以许可证为准)。",山东,聊城,"聊城市经济开发区高速路南88米钢管城内C-101、C-102.C-103商铺"
招远市人民商场有限公司,91370685165232555A,1990-06-09,有限责任公司,韦新利,"1000万人民币","预包装食品、散装食品、乳制品（含婴幼儿配方乳粉）、日用百货、针纺织品、五金交电、日用杂品、家具、橡胶制品、塑料制品、陶瓷制品、炊事用具、日用化学品、玩具、服装、家用电器、文体用品、干鲜蔬菜、水果、肉蛋制品、黄金珠宝首饰、钟表、图书报刊、音像制品及电子出版物、计算机通讯设备批发零售；...",山东,烟台,"山东省招远市东关街15号"
威海文笔峰建筑工程有限公司,91371002166733319P,1990-06-09,N/A,戚本华,"2,536(万元人民币)","建筑安装",山东,威海,"威海市戚家夼路"
肥城市建筑材料工业公司,9137098316663955XA,1990-06-10,N/A,秦胜恩,"41.8万人民币","建筑材料、机电产品、五金、化工",山东,泰安,"山东省泰安市肥城市长山街北首"
中国农业银行股份有限公司青州口埠分理处,913707818693518860,1990-06-11,N/A,黄晓慰,"0.5万人民币","经营中国银行业监督管理委员会依照有关法律、行政法规和其他规定批准的业务，经营范围以批准文件所列的为准。(依法须经批准的项目，经相关部门批准后方可开展经营活动)。",山东,潍坊,"青州市何官镇孙板村"
济南市鲁钟机械厂,913701041631454070,1990-06-11,集体所有制,李培勇,"22.8万人民币","加工、自销：变偏心型蝶阀、中压板；机械加工；木器加工；电气焊加工。(依法须经批准的项目，经相关部门批准后方可开展经营活动)",山东,济南,"济南市经七纬十二路444号"
中国农业银行股份有限公司青州谭坊分理处,91370781739284152H,1990-06-11,N/A,刘友田,"0.5万人民币","经营中国银行业监督管理委员会依照有关法律、行政法规和其他规定批准的业务，经营范围以批准文件所列的为准(依法须经批准的项目，经相关部门批准后方可开展经营活动)。",山东,潍坊,"青州市谭坊镇谭坊村(青年路)"
中国农业银行股份有限公司青州北城分理处,91370781556739345A,1990-06-11,N/A,崔钢,"3万人民币","经营中国银行业监督管理委员会依照有关法律、行政法规和其他规定批准的业务，经营范围以批准文件所列的为准(依法须经批准的项目，经相关部门批准后方可开展经营活动)。",山东,潍坊,"青州市区北城村委东侧"
中国农业银行股份有限公司青州东高分理处,91370781740218152J,1990-06-11,N/A,曲伟,"0.5万人民币","经营中国银行业监督管理委员会依照有关法律、行政法规和其他规定批准的业务，经营范围以批准文件所列的为准。(依法须经批准的项目，经相关部门批准后方可开展经营活动)。",山东,潍坊,"青州市益都街道办事处东高村吕东路以北"
中国农业银行股份有限公司青州东夏分理处,91370781740218179A,1990-06-11,N/A,刘建国,"60万人民币","经营中国银行业监督管理委员会依照有关法律、行政法规和其他规定批准的业务，经营范围以批准文件所列的为准(依法须经批准的项目，经相关部门批准后方可开展经营活动)。",山东,潍坊,"青州市东夏镇刘胡同村"
中国农业银行股份有限公司青州王母宫支行,9137078173928411X1,1990-06-11,N/A,季延安,"23.7万人民币","经营中国银行业监督管理委员会依照有关法律、行政法规和其他规定批准的业务，经营范围以批准文件所列的为准(依法须经批准的项目，经相关部门批准后方可开展经营活动)。",山东,潍坊,"青州市309国道王桑路口西200米路南"
中国农业银行股份有限公司青州高柳分理处,91370781740218160D,1990-06-11,N/A,张伟铭,"5万人民币","经营中国银行业监督管理委员会依照有关法律、行政法规和其他规定批准的业务，经营范围以批准文件所列的为准(依法须经批准的项目，经相关部门批准后方可开展经营活动)。",山东,潍坊,"青州市高柳镇孙家村"
中国农业银行股份有限公司青州益都支行,913707817392841019,1990-06-11,N/A,赵立梅,"20万人民币","经营中国银行业监督管理委员会依照有关法律、行政法规和其他规定批准的业务，经营范围以批准文件所列的为准(依法须经批准的项目，经相关部门批准后方可开展经营活动)。",山东,潍坊,"青州市尧王山路与石坊路交叉路口东南角"
中国建设银行股份有限公司邹城支行东城分理处,91370883739261903R,1990-06-11,N/A,许广丽,"N/A","在《中华人民共和国金融许可证》许可范围内开展经营活动。(依法须经批准的项目，经相关部门批准后方可开展经营活动)。",山东,济宁,"山东省济宁市邹城市泉山路与王兰路交汇十字路口西北角"
中国农业银行股份有限公司青州范公亭支行,91370781739284072X,1990-06-11,N/A,黄维志,"0.5万人民币","经营中国银行业监督管理委员会依照有关法律、行政法规和其他规定批准的业务，经营范围以批准文件所列的为准(依法须经批准的项目，经相关部门批准后方可开展经营活动)。",山东,潍坊,"青州市青都街2号楼房"
德州市陵城区农村信用合作联社刘泮分社,913714218673769406,1990-06-12,N/A,李耀宗,"500万人民币","（一）吸收公众存款；（二）发放短期、中期、长期贷款；（三）办理国内结算；（四）办理票据承兑与贴现；（五）代理发行、代理承兑、承销政府债券；（六）买卖政府债券、金融债券；（七）代理收付款项及代理保险业务；（八）提供保险箱服务；（九）办理经中国银行业监督管理机构批准的其他业务",山东,德州,"陵城区临齐街道后刘泮村十字街"
滨州市滨城区旧镇供销合作社,91371600166931788B,1990-06-13,集体所有制,张杰臣,"79万人民币","卷烟、雪茄烟、农药（危险化学品、易制毒化学品、杀鼠剂除外）、副食品",山东,滨州,"滨州高新区青田办事处驻地"
济南齐鲁园林古建筑工程公司,91370103163154442N,1990-06-14,N/A,史国兴,"250(万)","古建筑工程专业承包",山东,济南,"济南市市中区经三路118号"
济南塑料工业公司,91370102163154434D,1990-06-14,N/A,刘雷,"591.5万元","批发、零售：高压聚乙烯、低压聚乙烯、聚氯乙烯、塑料助剂，塑料制品，塑料建材，塑料模具，塑料机械设备，花卉；房屋租赁；提供仓储服务（危险品仓储除外）；物业管理",山东,济南,"济南市历下区趵突泉前街50号"
新泰市新汶剧院,91370982MA3CY4AH26,1990-06-14,N/A,张淑营,"20万人民币","自有房屋租赁。(依法须经批准的项目，经相关部门批准后方可开展经营活动)。",山东,泰安,"山东省泰安市新汶大街"
肥城盐业公司,91370983166604891D,1990-06-15,N/A,刘洪伟,"218万人民币","食盐批发，批发兼零售预包装食品，百货、日用杂品、家用电器、五金交电、建材、钢材批发、零售，房屋、场地租赁。(依法须经批准的项目，经相关部门批准后方可开展经营活动）。",山东,泰安,"山东省泰安市肥城市工业一路北金牛山大街西"
山东槐建建设工程有限公司,91370104163325280W,1990-06-15,N/A,赵鹏,"10,620(万)","建筑工程、室内外装饰装修工程、基础工程、市政工程、园林绿化工程、消防工程、钢结构工程、土石方工程、建筑幕墙工程、建筑物拆除工程（不含爆破）、管道工程、水利水电工程、古建筑工程、建筑智能化工程、体育场地设施工程",山东,济南,"济南市槐荫区济兖路261号"
阳谷县供销合作社阿城中心社颜营双代店,91371521MA3CXELT25,1990-06-15,集体分支机构(非法人),王培昌,"0.2万人民币","卷烟、雪茄烟零售；零售预包装食品，零售散装食品，乳制品（含婴幼儿配方乳粉）",山东,聊城,"阳谷县阿城镇颜营村"
潍城区望留供销合作社庄头门市部,91370702MA3BYQPE2L,1990-06-17,集体经营单位(非法人),刘恩普,"N/A","零售：卷烟、雪茄烟。(有效期限以许可证为准)。销售：农药",山东,潍坊,"潍城区望留镇庄头村"
新泰市粮油贸易公司,91370982169596807C,1990-06-19,N/A,徐可伟,"50万人民币","农副产品",山东,泰安,"山东省泰安市府前街"
淄博市张店区蔬菜副食品公司,91370303MA3D1RAP1N,1990-06-20,N/A,张新义,"242(万元人民币)","批发预包装食品（不含乳制品）；销售土产品",山东,淄博,"张店区金晶大道96号2号楼2218室"
枣庄市伯桃酒业有限公司,91370402164448346H,1990-06-20,N/A,王超,"46万人民币","白酒制造、销售(有效期限以许可证为准)。(依法须经批准的项目，经相关部门批准后方可开展经营活动)。",山东,枣庄,"市中区西王庄乡田屯南"
寿光市五台供销合作社,9137078316568472XL,1990-06-20,集体所有制,韩振业,"125万人民币","批发、零售：烟、酒、糖、茶、副食、日用百货、针纺织品、建筑材料、家用电器、服装鞋帽、五金、自行车、土产杂品、农机配件、化肥、农药(不含化学危险品)、农膜、农副产品(不含粮食)；废旧物资收购；饮食服务；加工、销售：家具、木材；种子零售(依法须经批准的项目，经相关部门批准后方可开展经营活动)*",山东,潍坊,"侯镇草碾村东"
莱州市文峰高碳石墨制品厂,91370683169865237M,1990-06-21,集体所有制,李广春,"96万人民币","加工：高碳石墨，碳素石墨，电碳电极，石材。(依法须经批准的项目，经相关部门批准后方可开展经营活动)。",山东,烟台,"莱州市南十里李家"
蓬莱京鲁渔业有限公司,91370684165189999R,1990-06-22,N/A,王轰,"10,000(万元人民币)","远洋捕捞；生产销售：速冻食品、饮料、蔬菜制品、水果制品、罐头；普通货运；海水养殖；加工销售：养殖器材、渔需物资；批发零售：五金交电；海水育苗；货物进出口、技术进出口；货物仓储服务",山东,烟台,"山东省烟台市蓬莱市刘家沟镇北大街16号"
中国青岛国际经济技术合作(集团)有限公司,91370200163581866H,1990-06-23,N/A,盖方民,"1,000(万)","向境外派遣各类劳务人员（含海员）；提供法律、法规和政策咨询；提供互联网人才供求信息；办理人才求职登记和人才推荐；组织人才招聘（凭人力资源服务许可证经营）；财务顾问（不得开展审计、验货、查账、评估、会计咨询、代理记账等须经专项审批的业务，不得出具相应的审计报告，验货报告，查账报告，评估报告等文字资料）。承担我国对外经济援助项目；劳务合作和海外项目下的技术进出口业务；经营商品进出口业务（按核准商品目录），对内对外经贸咨询服务；代理外企驻青代表机构中国员工的中介服务等；国内商贸（国家专营商品除外）；国内劳务派遣；劳动事务代理",山东,青岛,"青岛市市南区香港中路6号"
曲阜市时庄镇房地产综合开发公司,913708817424238385,1990-06-23,N/A,王洪丁,"140万人民币","村镇房地产综合开发",山东,济宁,"曲阜市时庄"
青岛天鹅旅游汽车公司,91370202163582666A,1990-06-23,N/A,唐荣民,"117(万)","出租客运",山东,青岛,"青岛市市南区延安三路117号甲"
山东省博兴县工艺美术公司,91371625MA3CXXMDXC,1990-06-26,N/A,泥玉珂,"401万人民币","柳制品、蜡杆制品、抽纱工艺品、童装、制造、加工、销售、服务(依法须经批准的项目，经相关部门批准后方可开展经营活动)。",山东,滨州,"博城五路173号"
济南固锝电子器件有限公司,91370100613201171Y,1990-06-27,N/A,董志强,"300(万美元)","设计、制造电子产品；销售本公司生产的产品。",山东,济南,"济南市高新开发区孙村片区科远路1659号"
临商银行股份有限公司高新区支行,913713007648397033,1990-06-27,N/A,王传栋,"0万人民币","经营中国银行业监督管理委员会依照有关法律、行政法规和其他规定批准的业务，经营范围以批准文件所列的为准。",山东,临沂,"临沂市高新技术产业开发区科技大道与双月园路交汇处西100米路北"
阳谷县起重运输公司,91371521168011432G,1990-06-28,N/A,王建华,"59.2000(万元人民币)","普通货运、货物专用运输、大型货物运输、汽车维修、汽车配件销售",山东,聊城,"阳谷县阳谷镇大众街７号"
山东黄河工程集团有限公司第二工程处,91370105863044551C,1990-06-29,N/A,李士光,"N/A","水利水电工程、房屋建筑、公路、市政公用、铁路、港口与航道等工程建设项目的勘察设计、承包、施工；房地产开发；工程项目可行性研究、水文、地质勘探、测量 、规划设计，工程咨询业务；机械设备租赁。",山东,济南,"济南市天桥区济洛路79号"
山东莱阳农村商业银行股份有限公司旌阳路分理处,91370682MA3C5LK999,1990-06-29,N/A,王敏,"0万人民币","吸收公众存款；发放短期、中期和长期贷款；办理国内结算；办理票据承兑与贴现；代理发行、代理兑付、承销政府债券；买卖政府债券、金融债券；从事同业拆借；从事银行卡",山东,烟台,"莱阳市旌阳路影院对面"
山东莱阳农村商业银行股份有限公司旌旗路分理处,91370682MA3C5LLG2G,1990-06-29,N/A,张玉华,"0万人民币","吸收公众存款；发放短期、中期和长期贷款；办理国内结算；办理票据承兑与贴现；代理发行、代理兑付、承销政府债券；买卖政府债券、金融债券；从事同业拆借；从事银行卡",山东,烟台,"莱阳市旌旗路梨香园东"
中国农业银行股份有限公司莱阳东郊分理处,91370682735755834T,1990-06-29,N/A,迟永河,"0万人民币","经营中国银行业监督管理委员会依照有关法律、行政法规和其它规定批准的业务，经营范围以批准文件所列的为准。(有效期限以许可证为准)(依法须经批准的项目，经相关部门批准后方可开展经营活动)。",山东,烟台,"莱阳市旌旗路174号"
山东铝业公司水泥纸袋厂,91370303164102716C,1990-06-29,N/A,常传水,"48(万元人民币)","涂复袋、集装袋、纸塑复合袋的生产、加工、销售，塑料原料（不含危险、监控及易制毒化学品）销售，货物进出口*(依法须经批准的项目，经相关部门批准后方可开展经营活动)",山东,淄博,"山东省淄博市张店"
山东莱阳农村商业银行股份有限公司富水分理处,91370682MA3C5LL44A,1990-06-29,N/A,闫晓芳,"0万人民币","吸收公众存款；发放短期、中期和长期贷款；办理国内结算；办理票据承兑与贴现；代理发行、代理兑付、承销政府债券；买卖政府债券、金融债券；从事同业拆借；从事银行卡",山东,烟台,"莱阳市旌旗西路54号"
招远市石材总公司,913706851652326866,1990-06-29,N/A,徐永璞,"1098万人民币","花岗石开采（有效期限以许可证为准)；石材加工",山东,烟台,"山东省招远市宋家镇宋家村"
中国农业银行股份有限公司莱阳西郊分理处,913706827357558260,1990-06-29,N/A,焦建华,"0万人民币","经营中国银行业监督管理委员会依照有关法律、法规和其他规定批准的业务，经营范围以批准文件所列的为准。(有效期限以许可证为准)(依法须经批准的项目，经相关部门批准后方可开展经营活动)。",山东,烟台,"莱阳市昌山路64号"
山东莱阳农村商业银行股份有限公司五龙北路支行,913706823126697822,1990-06-29,N/A,邵华堂,"0万人民币","吸收公众存款；发放短期、中期和长期贷款；办理国内结算；办理票据承兑与贴现；代理发行、代理兑付、承销政府债券；买卖政府债券、金融债券；从事同业拆借；从事银行卡",山东,烟台,"莱阳市五龙北路98号"
济南长途汽车运输有限责任公司,91370100163140526N,1990-06-30,N/A,潘锡民,"3,310.5000(万)","普通货运；大型货物运输（一类）；货运站（场）经营；县内班车客运；县际班车客运；市际班车客运；省际班车客运；县内包车客运；县际包车客运；市际包车客运；省际包车客运；客运站经营；公交客运（以上有效期以许可证为准）；一类机动车维修（大中型客车维修，大中型货车维修）、二类机动车维修（大中型货车维修）；在本店内零售卷烟、雪茄烟，冷冻冷藏和常温保存食品、饮料的销售、图书、报刊、住宿、炒菜加工、销售；主食、候车室，厂企班车",山东,济南,"济南市天桥区堤口路75号"
鱼台县王庙供销社加油站,91370827L00110480E,1990-07-01,集体分支机构(非法人),李金华,"N/A","汽油、柴油零售(持许可证经营,有效期限以许可证为准)；润滑油零售(国家禁止和限制经营的项目不得经营，依法须经批准的项目，经相关部门批准后方可开展经营活动)。",山东,济宁,"鱼台县王庙镇王庙村南20米枣曹公路101公里处东路北"
中国建设银行股份有限公司莱阳支行五龙北路分理处,91370682735787406W,1990-07-02,N/A,唐伟,"N/A","金融许可证批准范围内的相关业务。(依法须经批准的项目，经相关部门批准后方可开展经营活动)。",山东,烟台,"山东省莱阳市五龙北路胶木厂门前左侧"
烟台黄金物资有限责任公司,91370602165003349X,1990-07-02,N/A,彭昊,"87.69万人民币","钢材、木材、建筑材料、装饰材料、机电产品（不含小轿车）、化工产品（不含危险化学品）、纺织品、机械设备及配件、日用百货、纸张（不含新闻纸）、办公文化用品、工艺品、日用杂品（不含鞭炮）的批发、零售、仓储",山东,烟台,"芝罘区幸福南路1号"
中国银行股份有限公司莱阳五龙南路支行,913706827961889680,1990-07-02,N/A,韩富仲,"N/A","经营中国银行业监督管理委员会依照有关法律、行政法规和其他规定批准的业务，经营范围以批准文件所列为准",山东,烟台,"山东省莱阳市五龙南路023号"
潍坊新建压缩机厂,91370702165520311X,1990-07-02,集体所有制,庞书华,"56万人民币","组装、销售：压缩机及配件。(依法须经批准的项目，经相关部门批准后方可开展经营活动)。",山东,潍坊,"潍城区北宫西街西首"
青岛市刘家铁路联用货场有限公司,913702131638251971,1990-07-03,N/A,刘青军,"560万元","装卸、仓储服务",山东,青岛,"青岛市李沧区瑞金路5号"
济南浪潮微电计算机咨询服务有限公司,91370100163154565C,1990-07-03,N/A,卢文杰,"40,500(万)","电子计算机软、硬件技术开发、成果转让、技术咨询服务；计算机及配件、文化办公用机械、仪器仪表、非专控通信设备、文教用品、五金、交电、电工器材的销售。(依法须经批准的项目，经相关部门批准后方可开展经营活动)",山东,济南,"济南市高新区孙村镇科航路2877号研发楼一楼"
山东省三0一处,913709821695968157,1990-07-05,N/A,王斌,"1231.8万人民币","金属材料、建筑材料、化工产品、机电产品、木材、木制品、机械配件、五金交电、土产杂品销售；自有厂房租赁；机械设备租赁。(依法须经批准的项目，经相关部门批准后方可开展经营活动)",山东,泰安,"山东省泰安市东都镇"
龙口耀天绝缘材料有限公司,91370681613414011R,1990-07-05,N/A,史荣禄,"29(万美元)","生产经营硅树脂自熄管 硅橡胶套管及其它玻璃纤维管和有关电工绝缘材料及纸制品包装(依法须经批准的项目，经相关部门批准后方可开展经营活动，有效期限以许可证为准)。",山东,烟台,"山东省龙口市羊岚镇西吴村"
莱阳市西留供销社中院分销店,91370682MA3D1ME76C,1990-07-05,集体分支机构(非法人),董言国,"1.5万人民币","零售预包装食品、散装食品",山东,烟台,"山东省莱阳市西留中院村"
青岛平度市新华书店有限责任公司祝沟书店,913702837137804304,1990-07-05,N/A,彭波,"0万元","图书报刊零售",山东,青岛,"青岛平度市旧店镇两目街86号"
青岛金迈科自动化设备有限公司,91370200163582121D,1990-07-06,N/A,战惠丽,"200万元","机械设计、机械设备制造、机械加工、模具设计制造、塑料制品及冲压件加工；五金交电、化工产品",山东,青岛,"青岛市四方区瑞昌路45号"
济宁市住宅建筑公司,91370800165922791X,1990-07-06,N/A,崔龙胜,"30万人民币","建筑工程、装饰装修工程（凭资质证书开展经营活动）；建材",山东,济宁,"济宁市武胜桥南街10号"
烟台经济技术开发区金光经济发展总公司,91370600165095810J,1990-07-11,N/A,曲德强,"1000万人民币","刺绣、机绣、服装加工；批发、零售：五金交电、建筑材料、农机配件、木材、日用百货、化工产品",山东,烟台,"烟台开发区曲家台子"
中国银行股份有限公司济南历下支行,91370100863232755T,1990-07-12,N/A,柳璐,"0万元","经营中国银行业监督管理委员会依照有关法律、行政法规和其他规定批准的业务，经营范围以批准文件所列的为准。(依法须经审批的项目，经相关部门批准后方可展开经营活动)",山东,济南,"济南市历下区山大路201号"
菏泽市公共汽车公司,91371700168894327E,1990-07-13,N/A,崔宏生,"40万人民币","公交客运；润滑油销售；机动车维修及配件销售；广告设计和制作路牌、灯箱、霓虹灯、车体、站亭、票据广告；车辆租赁；出境旅游、入境旅游、国内旅游；充电服务；出租客运。",山东,菏泽,"菏泽市牡丹路399号"
