山东弘润水利建筑工程有限公司,91371500706362337X,1990-03-30,N/A,刘勇,"180万人民币","承担中型水利水电工程及辅助生产设施的建筑、安装和基础工程施工。承担工程量15万立方米以下土石方工程施工。承担8层以下、18米跨度以下的建筑物，高度30米以下的构筑物的建筑施工(依法须经批准的项目，经相关部门批准后方可开展经营活动)。",山东,聊城,"聊城市新南环二干渠桥西路南"
中国石化销售有限公司山东临沂莒南第一加油站,91371327MA3CYEUB84,1990-03-31,N/A,李朝晖,"N/A","汽油、柴油(有效期以许可证为准)、润滑油零售;零售预包装食品兼散装食品,乳制品(不含婴幼儿配方乳粉);在本店内零售卷烟、雪茄烟(有效期以许可证为准)。化肥、石油添加剂(燃油宝)、家用电器、日用百货、化妆品、电子通讯产品、文具体育用品、工艺品、花卉、轮胎、汽车装具、建筑建材(危险化学品除外)、五金工具、纺织品、农...",山东,临沂,"莒南县嵋山路中段"
莒南县坊前供销合作社永光建材经营部,91371327MA3C8Y317P,1990-03-31,集体分支机构(非法人),赵兰玉,"3万人民币","建筑材料、五金交电、油漆、日用杂品、塑料制品零售；干鲜果品、花生米、瓜干、板栗收购。(依法须经批准的项目，经相关部门批准后方可开展经营活动)。",山东,临沂,"莒南县坊前镇坊前"
新泰市果品公司,91370982MA3CY419XE,1990-03-31,N/A,陈西波,"228.6000(万元人民币)","干鲜果菜,日用杂品,工业品,建筑材料,五金交电,百货针织。(依法须经批准的项目，经相关部门批准后方可开展经营活动)。",山东,泰安,"山东省泰安市青云路"
莱阳市高格庄供销合作社胡城分销店,91370682MA3D1MERX6,1990-04-01,集体分支机构(非法人),盖文学,"2.7万人民币","农药（不含剧毒、监控化学品、易制毒化学品）的零售(有效期限以许可证为准)；预包装食品、乳制品",山东,烟台,"莱阳市高格庄镇胡城村"
曹县青岗集供销社,91371721MA3CWMW01R,1990-04-02,集体所有制,苗润生,"73万人民币","烟花爆竹、农药、化肥、农膜、烟酒糖茶、日用百货、土杂、文具、针棉纺织品、五金、农具",山东,菏泽,"曹县青岗集"
寿光市纪台供销合作社,91370783165684084M,1990-04-02,集体所有制,杨文吉,"282万人民币","批发：化肥、农药（不含危险化学品）、农膜；零售：百货、针纺织品、烟、酒、副食（仅限分支机构）、五金交电、农机配件、日用杂品、柴油、汽油、润滑油；收购：农副产品(不含粮食)、废旧物资",山东,潍坊,"纪台镇纪台村"
潍坊市寒亭区南孙供销合作社党家营零售店,91370703MA3CUQ8D5H,1990-04-02,集体分支机构(非法人),李晓辉,"5万人民币","农药",山东,潍坊,"寒亭区南孙乡党家营村"
中国工商银行股份有限公司滨州渤海十二路支行,91371600866937339D,1990-04-02,N/A,范海珍,"0万人民币","许可该机构经营中国银行业监督管理委员会依照有关法律、行政法规和其他规定批准的业务，经营范围以批准文件所列的为准(有效期限以许可证为准)",山东,滨州,"市西办事处渤海十二路586号北沿街楼"
寿光市泰成建筑安装有限公司,91370783165684076T,1990-04-02,N/A,孙振坤,"2000万人民币","承揽：建筑贰级企业范围内的工程(依法须经批准的项目，经相关部门批准后方可开展经营活动)***",山东,潍坊,"寿光市侯镇草碾村"
山东水泥厂有限公司,91370100163156202A,1990-04-03,N/A,张圣军,"18,200(万)","水泥用石灰岩露天开采、销售；普通货运",山东,济南,"济南市市中区党家镇党东村东"
莒南县板泉供销合作社综合批发部,91371327MA3C83J73K,1990-04-03,集体分支机构(非法人),王献礼,"N/A","预包装食品（不含冷藏冷冻食品）销售，散装食品",山东,临沂,"莒南县板泉镇"
济南美利洗染业有限责任公司,91370103163153351P,1990-04-04,N/A,庞道元,"30(万)","服装干洗、水洗；皮衣上光服务；住宿",山东,济南,"济南市市中区经二路196号"
陵县丁庄供销合作社,91371421MA3CUAJN37,1990-04-04,集体所有制,崔天虎,"156万人民币","纺织品，针织品，百货，五金交电、化工(不含化学危险品)，日用杂货，中小农具，化肥，农膜",山东,德州,"陵县丁庄丁庄街"
山东省莘县观城供销社,91371522MA3CXE4G81,1990-04-04,集体所有制,翟成功,"58万人民币","农药零售。",山东,聊城,"莘县观城镇驻地"
中国建设银行股份有限公司泰安泰山支行,913709008664888605,1990-04-04,N/A,尤万杰,"N/A","金融许可证批准范围内的相关业务。(依法须经批准的项目，经相关部门批准后方可开展经营活动)。",山东,泰安,"泰安市奈河东路6号"
济南天齐特种平带有限公司,91370100613200996N,1990-04-04,N/A,王兰喜,"5,684(万)","高速传动带、高强度传动带、轻型输送带、锭带、胶辊、胶圈、软胶带、搓皮板、辊包皮的生产、销售；进出口业务；技术咨询；房屋租赁。(依法须经批准的项目，经相关部门批准后方可开展经营活动)。",山东,济南,"济南市槐荫区济齐路92号"
兰陵县永祥建筑工程有限公司,913713241684531429,1990-04-05,N/A,李开华,"600万人民币","按资质证书核定的范围经营。(依法须经批准的项目，经相关部门批准后方可开展经营活动)。",山东,临沂,"兰陵县芦柞镇芦柞"
山东泰山地质勘查公司第一工程处,9137048186992180XP,1990-04-05,N/A,段启国,"972万人民币","受公司委托从事资质许可证批准范围内的地质勘查监理及灾害防治工程、水文、环境地质调查、评价，岩矿鉴定与测试，地形测量，各类地基基础工程及民用工程施工。",山东,枣庄,"滕州市平行路268号"
栖霞市天桥商厦,91370686MA3CP5353G,1990-04-05,集体经营单位(非法人),徐成权,"N/A","批发、零售：五金交电、百货、针纺织品、机电产品、杂品、建筑材料(不含油漆)、出租柜台。(依法须经批准的项目，经相关部门批准后方可开展经营活动)。",山东,烟台,"跃进路449号"
烟台开发区八角海水养殖场,91370600MA3D1MHAXY,1990-04-05,集体所有制,王学正,"66万人民币","养殖销售：海带，扇贝。(依法须经批准的项目，经相关部门批准后方可开展经营活动)。",山东,烟台,"烟台开发区八角口"
乳山市大洋硅胶厂,91371083706252365X,1990-04-05,N/A,李琳琳,"118(万元人民币)","硅胶、兰胶、干燥剂加工、销售、机绣服装加工、销售＊(依法须经批准的项目，经相关部门批准后方可开展经营活动)。",山东,威海,"山东省威海市乳山市乳山口镇祝家庄"
禹城市李屯供销合作社综合门市部,91371482MA3CU94FX5,1990-04-05,集体分支机构(非法人),李茂刚,"7万人民币","百货、针纺织品、五金交电、日用杂品零售＊(依法须经批准的项目，经相关部门批准后方可开展经营活动)。",山东,德州,"禹城市李屯乡李屯街"
茌平县博平供销合作社,91371523723280392Y,1990-04-06,集体所有制,李云泉,"69万人民币","百货、针纺织品、五金交电、农副产品〈棉花除外〉、化肥、农膜、图书、文体用品销售；农药、副食、烟酒糖茶、饮食服务仅限分支机构经营。(依法须经批准的项目，经相关部门批准后方可开展经营活动)",山东,聊城,"山东省茌平县博平"
青岛琴岛国际旅行社有限公司,91370212163643377P,1990-04-06,N/A,朱震,"500万元","出境旅游业务，国内旅游业务，入境旅游业务（依据旅游主管部门核发的《旅行社许可证》开展经营活动），汽车租赁，旅游信息咨询，经济信息咨询，票务代理，会务服务，翻译服务，展览展示服务，礼仪庆典服务，舞台设计、布置，商务信息咨询，批发：工艺品，食品销售",山东,青岛,"山东省青岛市崂山区海尔路87号金地公寓2号楼501"
中国农业银行股份有限公司博兴县支行,91371625867156091T,1990-04-06,N/A,高兵,"0万人民币","吸收公众存款；发放短期、中期、和长期贷款；办理国内外结算；办理票据承兑与贴现；发放金融债券；代理发行、代理兑付、承销政府债券；代理发行、代理兑付、承销政府债券、金融债券；从事银行卡业务；代理收付款项及代理保险业务；人民币理财业务；第三方存管业务；电子银行业务；开放式基金代理业务；个人外汇理财业务；银期转帐；外币储蓄、外汇存款、外汇汇款、外币兑换、个人外汇结构性存款、结汇、售汇、居民个人购汇；经国务院银行业监督管理机构批准的其它业务。(有效期限以许可证为准)。(依法须经批准的项目，经相关部门批准后方可开展经营活动)。",山东,滨州,"博兴县城胜利二路299号"
荣成市东山福利综合加工厂,9137108216686014XD,1990-04-06,集体所有制,孔玉英,"22万人民币","纸制品.针织品.农业机械配件制造销售(依法须经批准的项目，经相关部门批准后方可开展经营活动)。",山东,威海,"荣成市东山街道办事处东山村"
博兴县陈户镇水利建筑安装工程公司,91371625167152727H,1990-04-07,N/A,牟向明,"608万人民币","水利水电工程及辅助生产设施的建筑、安装和基础工程施工。包括",山东,滨州,"博兴县陈户镇水利站"
青岛市南区量具有限公司,913702021636632987,1990-04-07,N/A,曹钢,"8.6万元","制造:衡器、量具。",山东,青岛,"山东省青岛市市南区闽江路84号"
青岛蒙力橡塑填料有限公司,91370203614201376G,1990-04-07,N/A,杨纪平,"84(万)","批发、零售：工程塑料，塑料及橡胶制品，钢材，化工产品( 不含危险品 )，建筑材料。",山东,青岛,"青岛市四方区瑞昌路118号"
莒南县石莲子供销社家电车辆商场,91371327MA3CYG9XX0,1990-04-07,集体分支机构(非法人),张晓荣,"5万人民币","家用电器、五金交电、太阳能及配件、电动车、自行车零售、家电维修。(依法须经批准的项目，经相关部门批准后方可开展经营活动)。",山东,临沂,"石莲子镇驻地"
中国工商银行股份有限公司东营仙河支行,91370503864843128K,1990-04-08,N/A,李华章,"N/A","金融许可证范围内中国银行监督管理委员会依照有关法律、行政法规和其他规定批准的业务，经营范围以批准文件所列的为准。(有效期限以许可证为准)。(依法须经批准的项目，经相关部门批准后方可开展经营活动)。",山东,东营,"河口区仙河镇中华路商业街东首"
中国工商银行股份有限公司莱阳旌阳路支行,91370682552248055E,1990-04-08,N/A,初淑清,"0万人民币","经营中国银行业监督管理委员会依照有关法律、行政法规和其他规定批准的业务，经营范围以批准文件所列的为准(依法须经批准的项目，经相关部门批准后方可开展经营活动)。",山东,烟台,"山东省莱阳市旌阳路31号"
中国工商银行股份有限公司广饶支行开发区分理处,913705238648431523,1990-04-08,N/A,岳玉峰,"0万人民币","金融许可证范围内中国银行监督管理委员会依照有关法律、行政法规和其他规定批准的业务，经营范围以批准文件所列的为准。(依法须经批准的项目，经相关部门批准后方可开展经营活动)。",山东,东营,"广饶县广凯路55号"
中国电子进出口山东有限公司青岛办事处,91370203863600781N,1990-04-08,N/A,田浡,"5万元","房地产管理及出租；外贸咨询服务；机械设备；汽车",山东,青岛,"青岛市市北区延安一路82号2栋南单元29户"
中国工商银行股份有限公司东营孤岛支行,91370503864843371E,1990-04-08,N/A,马德玲,"0万人民币","金融许可证范围内中国银行监督管理委员会依照有关法律、行政法规和其他规定批准的业务，经营范围以批准文件所列的为准。(依法须经批准的项目，经相关部门批准后方可开展经营活动)。",山东,东营,"河口区孤岛镇"
济南锐凯车辆修理有限责任公司,91370102163142230F,1990-04-09,N/A,原杰,"50万元","自行车车辆修理；电工专用机械修理；房屋租赁。",山东,济南,"济南市历下区东圩子门外商住楼底层7号"
宁阳县葛石供销合作社东街综合部,91370921MA3C8ND96P,1990-04-09,集体分支机构(非法人),孙思勇,"0.9万人民币","零售预包装食品兼散装食品，乳制品（不含婴幼儿配方乳粉）",山东,泰安,"宁阳县葛石镇"
宁阳县葛石供销合作社宁庄综合商店,91370921MA3C8NEP3J,1990-04-09,集体分支机构(非法人),郁传凤,"N/A","零售预包装食品兼散装食品，乳制品（不含婴幼儿配方乳粉）",山东,泰安,"宁阳县葛石镇宁庄村"
荣成市焊接设备厂,9137108216685783XY,1990-04-09,集体所有制,杨永良,"31万人民币","制造销售电焊机及配件(依法须经批准的项目，经相关部门批准后方可开展经营活动)。",山东,威海,"荣成市寻山街道办事处小桥村"
青州市泡沫塑料厂,91370781169350778Q,1990-04-09,集体所有制,聂胜利,"5万人民币","聚氨脂泡沫塑料.注塑吹塑制品销售(依法须经批准的项目，经相关部门批准后方可开展经营活动)。",山东,潍坊,"青州南路东一街东首路南"
宁阳县葛石供销合作社石屯综合商店,91370921MA3C8NEF14,1990-04-09,集体分支机构(非法人),黄庆田,"N/A","零售预包装食品、散装食品，乳制品（不含婴幼儿配方乳粉）",山东,泰安,"宁阳县葛石镇石屯村"
宁阳县葛石供销合作社柳沟超市,91370921MA3C8NEW0E,1990-04-09,集体分支机构(非法人),孙思勇,"N/A","零售预包装食品、散装食品，乳制品（不含婴幼儿配方乳粉）（凭许可证经营）；在本店内零售卷烟、雪茄烟",山东,泰安,"宁阳县葛石镇柳沟村"
宁阳县葛石供销合作社沙卜超市,91370921MA3C8NDX20,1990-04-09,集体分支机构(非法人),刘洪群,"N/A","零售预包装食品、散装食品，乳制品（不含婴幼儿配方乳粉）",山东,泰安,"宁阳县葛石镇沙卜村"
荣成市夏庄供销合作社,91371082166856677C,1990-04-09,集体所有制,吕华昭,"41万人民币","批发零售日用百货、五金交电、钢材、纺织品；房屋出租。以下限分支机构经营：零售化肥、农药、农机具、农用地膜、种子。(依法须经批准的项目，经相关部门批准后方可开展经营活动)。",山东,威海,"夏庄镇大夏庄村"
宁阳县葛石供销合作社杏山超市,91370921MA3C8NDP79,1990-04-09,集体分支机构(非法人),宁方田,"2.1万人民币","零售预包装食品、散装食品，乳制品（不含婴幼儿配方乳粉）",山东,泰安,"宁阳县葛石镇杏山村"
宁阳县葛石供销合作社夏庄综合商店,91370921MA3C5UJA5Y,1990-04-09,集体分支机构(非法人),张桂菊,"N/A","零售预包装食品、散装食品，乳制品（不含婴幼儿配方乳粉）",山东,泰安,"宁阳县葛石镇夏庄村"
宁阳县葛石供销合作社,91370921166563858R,1990-04-09,集体所有制,王西柱,"100.6万人民币","日用百货、纺织品、服装鞋帽、洗化用品、建筑材料、钢材、中小农具及配件、文具用品、土产杂品、五金交电、家用电器、电话机手机及配件、化肥、农膜、饲料、农副产品、儿童玩具销售；废旧物资（生产性废旧金属、危险废物、报废拆解汽车除外）、干鲜果品购销；（以下限分支经营）干鲜果品、糕点加工销售，烟零售，散装食品及...",山东,泰安,"宁阳县葛石镇葛石村"
博兴县自来水公司,91371625MA3CXXNL1J,1990-04-10,N/A,张克元,"125万人民币","供水管道安装、维修(依法须经批准的项目，经相关部门批准后方可开展经营活动)。",山东,滨州,"博城六路152号"
济南市历城区供销合作社棉油加工厂,91370105163409900T,1990-04-10,集体所有制,刘士安,"358万人民币","棉花的销售；开办市场。(依法须经批准的项目，经相关部门批准后方可开展经营活动)",山东,济南,"天桥区桑梓店镇"
淄博市临淄区边河供销社,91370305MA3D1UY915,1990-04-10,N/A,孙万蕾,"56.5万","百货、鞋帽、针织、棉布、五金交电、土产杂品、农副产品、化肥、农膜、农机产品、不再分装的农作物包装种子批发、零售,废旧物资(不含报废汽车、危险废物、境外可利用废物)收购。(依法须经批准的项目,经相关部门批准后方可开展经营活动)",山东,淄博,"边河乡金阳村南"
嘉祥县饮食服务公司,91370829166281287F,1990-04-10,N/A,李文军*,"8.8万人民币","住宿、饮食服务；理发、沐浴、摄影；烟（零售）酒糖茶、水产品、干鲜果品销售（以上项目均由其分支机构经营）",山东,济宁,"县城兖兰中路110号*"
嘉祥县饮食服务公司嘉祥宾馆,91370829MA3C6M655G,1990-04-10,N/A,焦绪申,"47.85万人民币","住宿；中型餐馆（含凉菜）；零售卷烟、雪茄烟",山东,济宁,"嘉祥县城兖兰中街108号"
宁阳县城关供销合作社青川门市部,91370921MA3CBM3TXP,1990-04-10,集体分支机构(非法人),孟现营,"1万人民币","日用百货、日用杂品、中小农具、化肥、农膜零售。",山东,泰安,"宁阳县宁阳镇红庙村"
寿光市北洛供销合作社综合经营部,91370783MA3CT95D45,1990-04-10,集体分支机构(非法人),王清会,"N/A","代销：化肥、农药、农膜；零售：五金交电、日用杂品、民用建材、日用百货(依法须经批准的项目，经相关部门批准后方可开展经营活动)。",山东,潍坊,"寿光市田柳镇张僧村"
烟台市隆腾机床附件厂,913706121653420338,1990-04-11,集体所有制,刘钰,"20万人民币","砂钢片转子、定子、５号电池拉伸、电机帽拉伸制造，组装酒敏断接器，平垫、罗丝、罗帽加工，油泵制造(依法须经批准的项目，经相关部门批准后方可开展经营活动)。",山东,烟台,"牟平区宁海街道办事处隋家疃村"
济南市历城区仲宫供销合作社,91370112163400770R,1990-04-11,集体所有制,王士柱,"150万人民币","有毒品（农药）的零售（无备货库）（不包括剧毒品、成品油、易制爆、第一类易制毒和第二类监控化学品）（有效期限以许可证为准）；预包装食品、散装食品、乳制品（不含婴幼儿配方乳粉）的批发、零售，住宿服务，烟零售，汽油、柴油零售（以上仅限分支机构凭许可证经营）；儿童玩具、文具用品、体育用品、家用电器、针织品、...",山东,济南,"历城区仲宫镇仲北村"
山东银河酒业(集团)彩印纸箱厂,91371121706194556H,1990-04-11,N/A,来廷龙,"37(万元人民币)","包装纸箱、纸箱商标印刷；瓶盖的生产及销售。",山东,滨州,"县城解放路101号"
宁阳县东庄供销合作社,913709211665642607,1990-04-11,集体所有制,陈良伟,"62.8万人民币","日用百货、针织品、服装鞋帽、文体用品、家用电器、日用陶瓷、家具、日用杂品、农机配件、中小农具销售，土特产品、干鲜果品、废旧物资(有色金属除外)购销(依法须经批准的项目，经相关部门批准后方可开展经营活动)。",山东,泰安,"宁阳县东庄乡驻地"
莘县位庄供销合作社,91371522168052437L,1990-04-12,集体所有制,付贵臣,"52.6万人民币","百货．五金．交电．化工．针织布匹．服装．化肥．农膜．废旧收购．畜产品．民用建材。批发．零售．加工＊(依法须经批准的项目，经相关部门批准后方可开展经营活动)。",山东,聊城,"莘县位庄乡驻地"
德州市德城区赵虎供销合作社,91371402MA3CUBD18B,1990-04-12,集体所有制,于逢玺,"91万人民币","纺织品、日用百货（不含易燃易爆物品）、五金交电、化工产品（不含危险品）、日用杂品",山东,德州,"德州市德城区赵虎街驻地"
德州市德城区赵虎供销合作社生资门市部,91371402MA3CUB170L,1990-04-12,集体分支机构(非法人),李俊杰,"12万人民币","日用杂品（不含易燃易爆物品）、五金化工产品",山东,德州,"德州市德城区赵虎村内"
青岛市杨家群工贸总公司金属物资公司,91370203163746165C,1990-04-13,N/A,王昌迂,"55万元","零售、批发：金属材料",山东,青岛,"青岛市市北区杨家群村."
临沂新新影剧院有限公司,91371300168262397U,1990-04-14,N/A,马学勤,"999.96万人民币","酒店管理，广告设计、制作、发布。(依法须经批准的项目，经相关部门批准后方可开展经营活动)。",山东,临沂,"临沂市兰山区解放路273号"
荣成市王连供销合作社,91371082166855965Y,1990-04-16,集体所有制,陈兆刚,"51.9万人民币","批发、零售五金、交电、纺织品、日用杂品、日用百货；废旧物资回收；房屋出租；以下限分支机构经营：零售农药、化肥、农膜。(依法须经批准的项目，经相关部门批准后方可开展经营活动)",山东,威海,"荣成市王连街道办事处王家庄村"
中国农业银行股份有限公司胶州福州路分理处,9137028186967604X7,1990-04-16,N/A,王志东,"0万元","许可经营项目:经营中国银行业监督管理委员会依照有关法律、行政法规和其他规定批准的业务，经营范围以批准文件所列的为准",山东,青岛,"青岛市胶州市福州南路3号"
寿光市古城供销合作社生资站,91370783MA3CLU5R2Y,1990-04-16,集体分支机构(非法人),李金之,"N/A","零售：化肥、农药、农膜（不含危险化学品）(依法须经批准的项目，经相关部门批准后方可开展经营活动)*",山东,潍坊,"寿光市古城街道前王村"
中国农业银行股份有限公司胶州常州路分理处,91370281869676015R,1990-04-16,N/A,李述国,"N/A","经营中国银行业监督管理委员会依照有关法律、行政法规和其他规定批准的业务，经营范围以批准文件所列的为准",山东,青岛,"青岛市胶州市常州路68号"
中国农业银行股份有限公司胶州铺集支行,91370281869676007Y,1990-04-16,N/A,刘明江,"N/A","经营中国银行业监督管理委员会依照有关法律、行政法规和其他规定批准的业务，经营范围以批准文件所列的为准",山东,青岛,"青岛市胶州市铺集镇驻地"
临沂市政集团有限公司,913713004951721375,1990-04-16,N/A,庞玉坤,"60000万人民币","承担各类市政公用工程的施工、公路工程施工、水利工程施工、体育场馆设施施工、园林工程、房屋建筑工程施工，承包国外工程项目；预制构件加工及质量检测业务",山东,临沂,"山东省临沂市兰山区蒙山北路63号辰坤国际"
泰安市岱庙旅游服务公司,91370901166478776A,1990-04-16,N/A,付民,"50万人民币","旅游纪念品制作；摄影服务；园林工程；工艺美术品、苗木花卉、照像器材零售；旅游服务。",山东,泰安,"山东省泰安市岱庙内"
烟台市勘测设计研究院有限公司,91370602493502358D,1990-04-18,N/A,李悦,"1,500(万元人民币)","工程勘察综合类甲级",山东,烟台,"芝罘区二马路155号"
胶南市横河机械厂,91370211864004965J,1990-04-18,集体经营单位(非法人),李西胜,"N/A","通用零部件加工、销售。",山东,青岛,"青岛市胶南市藏南镇驻地"
山东省博兴县棉麻公司,91371625MA3CXXNK3P,1990-04-18,N/A,耿庆国,"95(万元人民币)","皮棉、棉绒、油饼、棉纱、棉布(依法须经批准的项目，经相关部门批准后方可开展经营活动)。",山东,滨州,"博城六路33号"
诸城市粮油储运公司,913707827059952476,1990-04-19,N/A,张彦华,"87.5万人民币","粮食收购；销售预包装食品、散装食品；粮食储存、粮食调拨。(依法须经批准的项目，经相关部门批准后方可开展经营活动。)",山东,潍坊,"山东省潍坊市诸城市密州街办前黄疃村"
淄博市临淄乾成经贸有限公司,91370305745690202R,1990-04-20,N/A,孙子杰,"30万人民币","石化产品(不含危险化学品、易制毒化品、监控化学品)、橡胶、润滑油、塑料制品、建筑材料、金属材料、油库加油站设备、消防器材零售。(依法须经批准的项目，经相关部门批准后方可开展经营活动)",山东,淄博,"临淄区永流路52号"
临沂市装饰艺术公司,91371300168291825T,1990-04-21,N/A,刘怀洋,"53.6000(万元人民币)","室内外工程装饰；零售：装饰材料。(依法须经批准的项目，经相关部门批准后方可开展经营活动)。",山东,临沂,"解放路中段63号"
中国工商银行股份有限公司莱芜花园支行,91371200675527329T,1990-04-22,N/A,许世刚,"N/A","许可该机构经营中国银行业监督管理委员会依照有关法律、行政法规和其他规定批准的业务，经营范围以批准文件所列的为准。(有效期限以许可证为准)。(依法须经批准的项目，经相关部门批准后方可开展经营活动)。",山东,济南,"莱芜市花园北路"
中国银行股份有限公司青岛山东路支行,91370203713764369Y,1990-04-23,N/A,赵芃,"0万元","经营中国银行业监督管理委员会依照有关法律、行政法规和其他规定批准的业务，经营范围以批准文件所列的为准",山东,青岛,"青岛市市北区山东路10号壬-6"
