城厢区华亭供销合作社图书文具门市部,91350302757389556Q,1990-05-22,集体分支机构(非法人),杨建明,"N/A","文化用品、本册、笔、油墨书写用纸、文娱用品（陈磁带外）、体育用品、书籍、课本图片、杂志＊以上经营范围凡涉及国家专项专营规定的从其规定＊",福建,莆田,"莆田市城厢区华亭镇华亭街"
武夷山市五夫工业供销公司,913507821572615240,1990-05-22,N/A,王庆如,"35.4000(万元人民币)","木制品家具、兼营活性炭",福建,南平,"武夷山市五夫镇大布山"
城厢区华亭供销合作社濑溪农具门市部,91350302MA346FE33F,1990-05-22,集体分支机构(非法人),刘国兵,"N/A","铁制小农具、木竹制农具、化工原料（不含有毒、有害化学物品）、农药",福建,莆田,"莆田市城厢区华亭镇濑溪村"
城厢区华亭供销合作社庄稼医院,91350302689377261A,1990-05-22,集体分支机构(非法人),林源地,"N/A","化学肥料、化学农药（不含杀鼠剂、不含化学危险品）＊以上经营范围凡涉及国家专项专营规定的从其规定＊",福建,莆田,"莆田市城厢区华亭镇华亭街"
莆田市城厢区华亭供销合作社镇府路第一综合门市部,91350302MA346FCH5Q,1990-05-22,集体分支机构(非法人),林叔祺,"N/A","日用百货、日用化学品",福建,莆田,"莆田市城厢区华亭镇华亭街"
福清多福工业厂房开发有限公司,913501816113048474,1990-05-22,N/A,郑冰生,"250(万港币)","投资开发工业厂房及物业管理。",福建,福州,"福清市宏路融侨工业区内"
城厢区华亭供销合作社京果第一门市部,91350302MA346FWN1C,1990-05-22,集体分支机构(非法人),陈志萍,"N/A","干鲜果品、卷烟、雪茄烟、预包装食品兼散装食品、乳制品零售",福建,莆田,"莆田市城厢区华亭镇华亭街"
莆田市城厢区华亭供销合作社亭前东路第三综合门市部,91350302MA346FGX1F,1990-05-22,集体分支机构(非法人),游少雄,"N/A","纺织品、棉花、日用百货、五金交电销售。",福建,莆田,"莆田市城厢区华亭镇华亭街"
莆田市城厢区华亭供销合作社亭前东路第一综合门市部,91350302MA346FDY0C,1990-05-22,集体分支机构(非法人),杨秀丽,"N/A","建筑五金、五金工具、交电、日用百货销售。",福建,莆田,"莆田市城厢区华亭镇华亭街"
城厢区华亭供销合作社郊尾综合门市部,91350302MA346FD29B,1990-05-22,集体分支机构(非法人),蔡国荣,"N/A","零售预包装食品兼散装食品、乳制品",福建,莆田,"莆田市城厢区华亭镇郊尾村"
城厢区华亭供销合作社山牌综合门市部,91350302MA346FE17R,1990-05-22,集体分支机构(非法人),杨莉君,"N/A","卷烟、雪茄烟、预包装食品、散装食品、乳制品",福建,莆田,"莆田市城厢区华亭镇山牌村"
莆田市城厢区华亭供销合作社亭前东路第二综合门市部,91350302MA346HLU4U,1990-05-22,集体分支机构(非法人),杨荣松,"N/A","日用百货、棉布、针织品、服装、鞋帽、日用化学品",福建,莆田,"莆田市城厢区华亭镇华亭街"
城厢区华亭供销合作社综合二店门市部,91350302MA346FF133,1990-05-22,集体分支机构(非法人),王光白,"N/A","交电五金工具、建筑五金零售*以上经营范围凡涉及国家专项专营规定的从其规定＊",福建,莆田,"城厢区华亭镇华亭街"
城厢区华亭供销合作社濑柳综合门市部,91350302MA346FD376,1990-05-22,集体分支机构(非法人),杨金椅,"N/A","卷烟、雪茄烟、预包装食品、散装食品、乳制品",福建,莆田,"莆田市城厢区濑柳村"
厦门美商医药有限公司,913502001551413772,1990-05-23,N/A,姚亮,"18,248(万元人民币)","生产酊剂（外用）、喷雾剂、涂剂、洗剂、搽剂、糖浆剂、口服液；发用类、护肤类及香水类化妆品。“远红外”保健用品，保健鞋系列的生产加工；委托生产加工湿巾；批发发用类化妆品。其它基础化学原料制造（不含危险化学品和监控化学品及非药品类易制毒化学品）；营养食品制造；保健食品制造；其它未列明食品制造；单位后勤管理服务；教育咨询（不含教育培训及出国留学中介、咨询等须经许可审批的项目）；其他未列明专业技术服务业",福建,厦门,"厦门市海沧区山边洪路2号"
福建省平潭县白青船务有限公司,913501281549400625,1990-05-23,N/A,陈云祥,"50(万)","国内沿海及长江中下游普通货物运输",福建,福州,"平潭县白青乡岱峰村"
莆田大发泡棉有限公司,91350300611250084Q,1990-05-23,N/A,张志和,"280(万元人民币)","一般经营项目:生产泡棉及泡棉、塑胶、布类的贴合加工；数控机床制造、销售。",福建,莆田,"福建省荔城区黄石镇"
三明市三元区国营龙泉林业采育场木材综合加工厂,91350403155701776U,1990-05-23,集体所有制,林纪雄,"3.5万人民币","加工锯材、包装箱、木片（依法须经批准的项目，经相关部门批准后方可开展经营活动）",福建,三明,"三元区莘口延永路164号（生产场所：三元区莘口镇龙泉村顺坑）"
南平市城区供销合作社,913507021570246414,1990-05-24,集体所有制,游之平,"41.28万人民币","百货，纺织,针织品,五金,交电,化工产品",福建,南平,"南平市横排路106号(新门牌)"
南平市城区供销合作社生产资料门市部,91350702MA2XQU223B,1990-05-24,集体分支机构(非法人),廖典寿,"N/A","农业生产资料，农业机械及配件。(依法须经批准的项目，经相关部门批准后方可开展经营活动)",福建,南平,"南平市横排路129号"
厦门国本空调冷冻工业有限公司,91350200612006171L,1990-05-24,N/A,褚明贤,"319(万美元)","生产各种空调、冷冻主机、送风机、空调箱及其零配件和半成品。产品可有６０％内销。",福建,厦门,"厦门市同安区新西桥一号"
晋江市金井福盛服装厂,91350582754974100H,1990-05-24,个人独资企业,王连程,"N/A","服装加工。(依法须经批准的项目，经相关部门批准后方可开展经营活动)",福建,泉州,"金井丙洲村"
晋江安东机械有限公司,91350582156271640J,1990-05-24,有限责任公司,柯子江,"3288万人民币","机械配件、工程机械部件制造。(依法须经批准的项目，经相关部门批准后方可开展经营活动)",福建,泉州,"安海前埔工业区"
福建省晋江市安海镇房地产开发公司,91350582156277698U,1990-05-24,N/A,陈基鑫,"3,275.6000(万元人民币)","房地产综合开发。(依法须经批准的项目，经相关部门批准后方可开展经营活动)",福建,泉州,"安海成功东路镇政府大厦"
同谛(厦门)工程设计有限公司,91350212155327286P,1990-05-24,N/A,蔡振扬,"59(万元人民币)","建设工程勘察设计；专业化设计服务；园林景观和绿化工程设计；工程管理服务。",福建,厦门,"厦门市同安区大同街道舒安里23号四楼"
沙县电力公司,91350427MA2XW8NW5B,1990-05-24,N/A,陈章漂,"1,690(万元人民币)","仅供清理债权债务使用。(依法须经批准的项目，经相关部门批准后方可开展经营活动)",福建,三明,"沙县新城中路147号"
福建省晋江安海汽车配件厂,913505821562716087,1990-05-24,普通合伙,肖奕垣,"N/A","汽车配件制造、农机配件、纸品机械、塑料机械制造。",福建,泉州,"晋江市安海镇西安工业区"
晋江市前程铸造工业有限公司,9135058215627194XD,1990-05-24,有限责任公司,陈美兰,"500万人民币","制造：机械配件",福建,泉州,"晋江市安海西畲"
晋江市特质铸业机械有限公司,913505821562719150,1990-05-24,有限责任公司,陈孙艺,"120万人民币","机械配件制造。(依法须经批准的项目，经相关部门批准后方可开展经营活动)",福建,泉州,"安海西畲村"
福建省晋江市安海富鹰鞋塑有限公司,91350582156271878R,1990-05-24,N/A,许合省,"98(万元人民币)","鞋制造。(依法须经批准的项目，经相关部门批准后方可开展经营活动)",福建,泉州,"安海可慕村"
大东亚（福建）体育用品有限公司,91350582156268492D,1990-05-24,有限责任公司,林耿煌,"2008万人民币","体育用品制造；生产：鞋、鞋材（不含化学危险品）、服装、针织、内衣、电脑绣花、帽子、护具、袜子、篮球、包装袋、纸箱；货物或技术的进出口业务",福建,泉州,"福建省泉州市晋江市陈埭镇洋埭村龙泉路132号"
晋江市迪依服饰织造有限公司,913505821562729939,1990-05-24,N/A,洪金记,"228(万元人民币)","服装制造。(依法须经批准的项目，经相关部门批准后方可开展经营活动)",福建,泉州,"龙湖烧灰村"
晋江市英仑服装拉链有限公司,91350582156272205E,1990-05-24,N/A,留开友,"328(万元人民币)","服装、拉链制造。(依法须经批准的项目，经相关部门批准后方可开展经营活动)",福建,泉州,"晋江龙湖仑上"
厦门市同安区供销商社,91350212155301203B,1990-05-24,国有企业,张永杰,"200万人民币","批发、零售：农业生产资料",福建,厦门,"厦门市同安区城西路107号（原科技楼）5楼"
晋江市华益机械配件有限公司,91350582156270867E,1990-05-24,有限责任公司,庄建设,"120万人民币","汽车配件，机械配件制造。(依法须经批准的项目，经相关部门批准后方可开展经营活动)",福建,泉州,"晋江市青阳青华工业区"
晋江市安海天红机械有限公司,913505821562717986,1990-05-24,N/A,尤祖镒,"675(万)","石材加工机械制造。(依法须经批准的项目，经相关部门批准后方可开展经营活动)",福建,泉州,"晋江安海奄前"
晋江市永达钢铁工艺有限公司,91350582156272600M,1990-05-24,N/A,张永忠,"400(万)","扁铁、圆钢加工。(依法须经批准的项目，经相关部门批准后方可开展经营活动)",福建,泉州,"晋江市东石洪塘"
福建省长泰县食品公司城关食品站,91350625156781528U,1990-05-24,N/A,郑全财,"7.3000(万元人民币)","生猪屠宰、猪肉零售",福建,漳州,"长泰县武安镇金里村郭林前"
晋江市世纪花园酒店有限公司,91350582156273582M,1990-05-24,有限责任公司,张旭,"4300万人民币","酒店商务服务、物业管理；销售：针织品、纺织品及原料、服装、鞋帽、玩具、床上用品、体育用品、日用品百货、工艺品、电子产品、五金产品、机械设备、建筑材料、化工产品（不含危险化学品）；零售：预包装食品、卷烟、雪茄烟；对房地产业的投资；企业管理咨询服务；企业并购；软件开发、黄金饰品、白银、珠宝首饰加工；...",福建,泉州,"晋江市青阳普照"
晋江市强中强服装有限公司,91350582156272125T,1990-05-24,有限责任公司,洪文强,"1000万人民币","服装制造；销售：五金、服装辅料、拉链、商标标头、注塑皮头。(依法须经批准的项目，经相关部门批准后方可开展经营活动)",福建,泉州,"晋江龙湖杭边"
晋江市高特刚五金配件有限公司,91350582156272619J,1990-05-24,有限责任公司,张明辉,"200万人民币","五金配件制造。(依法须经批准的项目，经相关部门批准后方可开展经营活动)",福建,泉州,"晋江东石洪塘"
晋江市财星自动化设备研究所,91350582156271894F,1990-05-24,个人独资企业,陈科也,"N/A","自动化设备研发；机械配件制造。",福建,泉州,"晋江市安海镇西畲村兴畲里32号"
晋江市安海雅特五金有限公司,913505821562715449,1990-05-24,有限责任公司,高超庭,"118万人民币","制造：五金产品、机械配件（以上均不含铸锻件、电镀）、塑料玩具、塑料包装箱及容器、日用塑料制品",福建,泉州,"福建省泉州市晋江市安海镇安平聚贤路91号"
福建省晋江市安海佳坂长兴塑料厂,91350582156271763K,1990-05-24,个人独资企业,尤炼铁,"N/A","PVC造粒、拉条、拉管制造。(依法须经批准的项目，经相关部门批准后方可开展经营活动)",福建,泉州,"福建省泉州市晋江市安海镇佳坂新兴路4号"
厦门市同安果园供销合作社,9135021215530122XX,1990-05-25,国有企业,彭友谊,"80万人民币","1、批发、零售：化肥、农药（不含危险化学品和监控化学品及杀鼠剂）、农膜、日用百货、纺织品、五金交电、化工产品（不含危险化学品和监控化学品）；2、经营新鲜果蔬、原粮、鲜冻畜禽产品、水产品；3、零售：石油制品",福建,厦门,"厦门市同安区五显镇五显村"
厦门市同安新民供销合作社,913502121553011665,1990-05-25,国有企业,杨金铁,"163万人民币","化肥批发；农用薄膜批发；文具用品批发；其他文化用品批发；农业机械批发；其他机械设备及电子产品批发；五金产品批发；其他化工产品批发（不含危险化学品和监控化学品）；纺织品、针织品及原料批发；石油制品批发（不含成品油、危险化学品和监控化学品）；牲畜批发；饲料批发；文具用品零售；其他文化用品零售；...",福建,厦门,"厦门市同安区祥平街道凤岗里767号"
福建省南靖县农业生产资料公司,91350627156860648C,1990-05-25,N/A,马伟,"144.6000(万元人民币)","中低毒农药（不含杀鼠剂）零售",福建,漳州,"山城镇安美路52-53号"
南平市饲料工业公司,91350700157024588B,1990-05-26,N/A,廖挺平,"254.3500(万)","仅供清理本企业债权债务使用。",福建,南平,"南平市解放路６０号"
福建鑫焱集团建设发展有限公司,91350304155500093R,1990-05-26,N/A,陈玉炎,"5,323(万元人民币)","房屋建筑工程施工总承包二级、建筑防水工程专业承包三级；土石方工程专业承包三级；水泥预制品、建筑材料零售；房地产开发（依法须经批准的项目，经相关部门批准后方可开展经营活动）",福建,莆田,"莆田市荔城区镇海街道胜利北街816号"
莆田市秀屿区埭头供销合作社通讯门市部,91350305MA346P04XN,1990-05-26,集体分支机构(非法人),汤立涵,"N/A","手机及配件零售、手机维修。(依法须经批准的项目，经相关部门批准后方可开展经营活动)",福建,莆田,"莆田市秀屿区埭头镇埭头街"
南靖县农业生产资料公司浮山调拨组,91350627MA2XR1B35K,1990-05-26,N/A,马伟,"N/A","中低毒农药（不含杀鼠剂）零售",福建,漳州,"山城镇浮山"
福建郭坑铁路工务设备有限公司,91350603156627926T,1990-05-26,N/A,刘腾福,"2,367.7000(万元人民币)","铁路专用器材制造；机械加工；防护隔离栅栏的生产、安装；五金配件、金属材料、水泥、铁路钢轨配件、机床设备、机械铸造配件的销售；自营和代理商品及技术的进出口业务",福建,漳州,"漳州市龙文区郭坑火车站边"
莆田市秀屿区埭头供销合作社石塔综合门市部,91350305MA346P0E1A,1990-05-26,集体分支机构(非法人),韩国富,"N/A","零售预包装食品兼散装食品，零售乳制品（含婴幼儿配方乳粉），卷烟、雪茄烟零售，日用百货、针织品、农具、农肥、农药（中、低毒）",福建,莆田,"莆田市秀屿区埭头镇石塔村"
厦门市思明区鑫达综合加工厂,91350203155103354H,1990-05-26,集体所有制,吴晓华,"40万人民币","塑料制品、工艺美术品",福建,厦门,"厦门市思明区黄厝村~"
南平市城区供销合作社日杂门市部,91350702MA2XQU4185,1990-05-26,集体分支机构(非法人),李亨寿,"N/A","日用杂货。(依法须经批准的项目，经相关部门批准后方可开展经营活动)",福建,南平,"南平市横排路104号"
莆田市秀屿区埭头供销合作社,91350305155503438X,1990-05-26,集体所有制,林美清,"229.18万人民币","日用化学品(不含危险化学品)、散装食品、预包装食品、卷烟、雪茄烟、化学肥料、化学农药、烟花爆竹零售、小吃（早点、点心）",福建,莆田,"莆田市秀屿区埭头镇埭头街"
漳平火车站劳动服务公司,91350881158060660X,1990-05-27,N/A,苏志国,"51(万元人民币)","代办货物中转、铁路货物运输代理、业务协作服务、运输监护服务、劳务服务；货物仓储（危险货物除外）、货物装卸搬运作业；机械设备维修、维护、保养；机械设备出租；电子衡器称重、货物包装；房屋出租；住宿；茶座（依法须经批准的项目，经相关部门批准后方可开展经营活动）",福建,龙岩,"漳平火车站"
厦门轮渡有限公司,91350200154986554K,1990-05-28,N/A,黄育斌,"10,000(万元人民币)","客运轮渡运输；港口旅客运输服务；码头及其他港口设施服务；旅游管理服务；图书、报刊零售；音像制品零售；电子出版物零售；国内沿海旅客运输；港口设施、设备和港口机械的租赁业务；船舶港口服务；从事国内船舶代理业务；船舶管理业务；烟草制品零售；百货零售；其他综合零售；酒、饮料及茶叶零售；超级市场零售；预包装食品零售；散装食品零售；代理收取保险费；乳制品（含婴幼儿配方奶粉）零售；糕点、面包零售；旅客票务代理；工艺美术品及收藏品零售（不含文物）；其他文化用品零售；其他未列明专业设备修理（不含需经许可审批的项目）；互联网销售；装卸搬运；其他仓储业（不含需经许可审批的项目）；物业管理；自有房地产经营活动；停车场管理；其他未列明的机械与设备租赁",福建,厦门,"厦门市思明区大中路85号嘉年华大厦1205、1206室"
福建鼎盛建材有限公司,91350500156102062E,1990-05-28,N/A,吴丽娜,"800(万元人民币)","普通陶瓷制品生产、销售；建筑用石材加工；销售：建筑材料、普通机械；纸、木包装箱的生产及销售。",福建,泉州,"晋江市磁灶镇洋尾村"
将乐县光明体育用品厂,91350428155984438W,1990-05-29,集体所有制,杨道华,"4.5万人民币","体育用品加工、销售。",福建,三明,"光明乡光明村"
永春县达埔供销合作社达山购销站,91350525MA346JFG79,1990-05-30,集体分支机构(非法人),康建能,"N/A","农药零售（剧毒除外）",福建,泉州,"达埔镇达山村"
中国银行股份有限公司武夷山度假区支行,913507828572607684,1990-05-30,N/A,许谟惠,"N/A","经营中国银行业监督管理委员会依照有关法律、行政法规和其他规定批准的业务，经营范围以批准文件所列的为准；代理中国保监会批准和允许销售的人身保险和财产保险。",福建,南平,"武夷山市国家旅游度假区大王峰北路2号"
永春县达埔供销合作社五交门市,91350525MA346KF84Y,1990-05-30,集体分支机构(非法人),林淑汝,"N/A","五金、交电、文化用品。(依法须经批准的项目，经相关部门批准后方可开展经营活动)",福建,泉州,"达埔东街157号"
中国银行股份有限公司武夷山支行,91350782857260725N,1990-05-30,N/A,张纪华,"N/A","经营中国银行业监督管理委员会依照有关法律、行政法规和其他规定批准的业务，经营范围以批准文件所列的为准；代理中国保监会批准和允许销售的人身保险和财产保险。",福建,南平,"武夷山市五九中路16-1号"
永春县达埔供销合作社百货商店,91350525MA346J852N,1990-05-30,集体分支机构(非法人),叶建辉,"N/A","百货、针织品、纺织品。(依法须经批准的项目，经相关部门批准后方可开展经营活动)",福建,泉州,"达埔东街157号"
福建长荣建业有限公司,913500001546604150,1990-05-30,N/A,林秋英,"5,180(万元人民币)","建筑工程、市政公用工程、公路工程、水利水电工程施工总承包；建筑装修装饰工程、古建筑工程、钢结构工程、地基与基础工程、土石方工程、消防设施工程、建筑幕墙工程、城市及道路照明工程、环保工程、建筑机电安装工程、电子与智能化工程、公路养护工程专业承包；园林绿化工程施工；施工劳务。",福建,福州,"福建省福州市闽侯县祥谦镇凤港村老人活动中心"
永春县达埔供销合作社肥料门市,91350525MA346HF94H,1990-05-30,集体分支机构(非法人),陈金坚,"N/A","化学肥料。(依法须经批准的项目，经相关部门批准后方可开展经营活动)",福建,泉州,"达埔东街157号"
永春县达埔供销合作社批发部,91350525MA346JPK3D,1990-05-30,集体分支机构(非法人),叶鸿艺,"N/A","经营预包装食品（有效期至2015年6月13日），卷烟、雪茄烟店堂零售",福建,泉州,"达埔东街157号"
永春县达埔供销合作社,91350525156401214J,1990-05-30,集体所有制,郭少卿,"138万人民币","管理下属机构经营下列项目：百货、食品、针纺织品、五金、交电、化学农药、肥料、农副产品、烟、日用陶瓷器。(依法须经批准的项目，经相关部门批准后方可开展经营活动)",福建,泉州,"永春达埔东街157号"
永春县达埔供销合作社针织品门市,91350525MA346GK42M,1990-05-30,集体分支机构(非法人),李瑞定,"N/A","针织品、服装零售。(依法须经批准的项目，经相关部门批准后方可开展经营活动)",福建,泉州,"达埔东街157号"
福建省霞浦县瀚强航运有限公司,91350921157542238T,1990-05-30,N/A,许强,"100(万元人民币)","国内沿海及长江中下游普通货船运输；五金、电子产品、金属制品、制冷设备及配件、建筑材料、装潢材料、陶瓷制品、洁具、电动工具、家用电器、机电设备、通迅器材代购代销及网上经营；计算机网络技术开发、转让、咨询及服务；设计、制作、代理、发布国内各类广告。",福建,宁德,"福建省宁德市霞浦县溪南镇圹塍头村16号"
永春县达埔供销合作社生资门市,91350525MA346KEH19,1990-05-30,集体分支机构(非法人),张育生,"N/A","农药零售（剧毒除外）",福建,泉州,"达埔东街157号"
厦门尚宏理容椅业有限公司,913502006120062000,1990-05-30,N/A,潘复春,"100(万美元)","生产和销售理容、美容业设备及有关配件。",福建,厦门,"厦门市湖里区高殿村(殿前小学对面)"
厦门工程机械结构件厂,91350200155013180N,1990-05-31,集体所有制,王斌彬,"267万人民币","工程机械及配件、非标准设备制造、销售。",福建,厦门,"厦门市思明区湖滨南路334号26楼03单元"
天安登云(福建)房地产开发有限公司,91350100611304871A,1990-05-31,N/A,王澍陶,"5,250(万美元)","在福州市晋安区登云水库附近桂规划红线范围内建设、经营高尔夫球场及配套别墅、普通商住楼等。",福建,福州,"福州市晋安区登云路388号"
厦门市塑料包装厂,913502001550132797,1990-06-01,集体所有制,柯明旭,"73万人民币","聚乙烯、聚丙烯薄膜制造。",福建,厦门,"厦门市思明区湖滨南路334号26楼03单元"
福州国丰工艺品有限公司,913501006113227387,1990-06-01,N/A,吴金泉,"10,000(万元人民币)","生产、加工毛笔、砚台、印泥、包装盒；石制、木制、陶瓷类工艺品（不含脱胎漆器、寿山石雕及其他国家限制品种）及书画纸",福建,福州,"福州市晋安区新店镇后山村318号"
莆田市旺佳金属包装有限公司,91350322155544459W,1990-06-01,有限责任公司,王荣坤,"100万人民币","瓶盖生产。(依法须经批准的项目，经相关部门批准后方可开展经营活动)",福建,莆田,"仙游县鲤城东大路251号"
漳州市郭坑供销社,91350603738027381C,1990-06-01,集体所有制,冯承伟,"71.3万人民币","1、批发零售百货、针纺织品、五金、交电、化工（危险化学品及易制毒化学品除外）、日用杂品（烟花爆竹除外）、农药机械、农具；2、另设分支机构经营化肥、农药",福建,漳州,"漳州市龙文区郭坑镇人民路85号"
光泽县财贸委员会劳动服务公司,91350723157302701W,1990-06-01,N/A,王和彩,"5(万元人民币)","农副土特产、日用百货、水产品、纸制品、饲料购销。(依法须经批准的项目，经相关部门批准后方可开展经营活动)",福建,南平,"光泽县商业城三楼"
厦门凯联服饰有限公司,91350200612006403L,1990-06-02,N/A,陈嘉惠,"50(万美元)","针织或钩针编织服装制造；其他化工产品批发",福建,厦门,"厦门市集美北部新区"
亨国(厦门)精机工业有限公司,91350200612006227P,1990-06-02,N/A,张应钦,"730(万美元)","汽车制动器总成、驱动桥总成、摩托车盘式制动器总成及配件的生产、制造；汽车、摩托车模具、夹（治）具、刀具、量具设计、制造；关门器、天（地）铰链、玻璃门夹及关门器配件、天（地）铰链配件生产、制造；发电机、发电机组件，自行车刹车、自行车刹车组件，门锁及门锁组件设计、制造；非金属、金属制品模具、夹",福建,厦门,"厦门市湖里区台湾工业园"
福建省武夷山市二轻工业供销公司,91350782157261727L,1990-06-02,N/A,施飞旺,"50.3000(万元人民币)","五金交电、百货针纺织品、服装、皮革及制品、金属材料、竹木制品。(依法须经批准的项目，经相关部门批准后方可开展经营活动)",福建,南平,"武夷山市崇安街77号"
泉州市先锋产业公司,91350503MA2XW9EB9C,1990-06-02,N/A,林志谦,"100(万)","仅供清理本企业债权债务使用。",福建,泉州,"泉州市东湖路（高甲剧团内先锋楼７０１、７０２室）"
