中国农业银行股份有限公司福州新店支行,91350100854426144T,1990-10-01,N/A,林岑,"N/A","办理人民币存款、结算；代理收付款项；中国保监会批准和允许销售的人身保险和财产保险；办理人民币贷款、票据",福建,福州,"福州市晋安区新店镇秀峰路153号翡翠园1号楼01店面、2号楼09-11店面"
中化明达(福建)地质勘测有限公司,91350100154426776N,1990-10-01,N/A,江学中,"1,500(万元人民币)","工程勘察综合类甲级；地基基础检测；岩土检测；工程测量；土工试验",福建,福州,"福州市晋安区火车站西凤路68号"
中国农业银行股份有限公司福州五里亭支行,913501008544261878,1990-10-01,N/A,程协铸,"N/A","办理人民币存款、贷款、结算；办理票据承兑与贴现业务；代理收付款项；代理保险业务等中间业务；办理外汇存款、贷款、汇款、外币兑换业务；国际结算；通过上级行代理个人实盘外汇买卖；经中国银行业监督管理机构批准的其他业务。",福建,福州,"福州市晋安区浦墘路16号君临东城3号楼12-15店面"
福建省平潭县水产供销公司,91350128154941436C,1990-10-02,N/A,陈毓苏,"67(万元人民币)","水产品；渔需品。",福建,福州,"平潭县城关东大街122号"
福建省食品工业公司厦门公司,913502001549880582,1990-10-02,N/A,林丽,"170(万元人民币)","代理省公司在厦门的业务。",福建,厦门,"厦门市思明区槟榔西里18号303室"
南靖县金山供销合作社,913506271568620615,1990-10-03,集体所有制,吴鹏,"301万人民币","农药（危险化学品除外）、化肥、农具械、五金交电、化工（危险品除外）、百货、针纺织品、图书杂志、日用杂品、其他副食品和食品、煤油、柴油、润滑油、建材、汽车配件、拖拉机配件、摩托车配件、废旧物资回收、农副产品购销...（以上经营范围仅供下属分支机构经营）（依法须经批准的项目，经相关部门批准后方可开展经营活动）",福建,漳州,"金山镇东建村"
闽侯县竹岐供销社汶洲购销处,91350121MA348HQCX6,1990-10-04,集体分支机构(非法人),陈祖荻,"N/A","化肥、农膜、农业器具、日用品、五金、棉百、服装、化工产品",福建,福州,"闽侯县竹岐乡汶洲街"
罗源县电影发行放映公司,91350123154741311P,1990-10-04,N/A,林文朝,"72(万元人民币)","电影发行，、放映、录像播放；零售预包装食品兼散装食品（依法须经批准的项目，经相关部门批准后方可开展经营活动）",福建,福州,"罗源县城关长桥路21号"
闽侯县竹岐供销社半岭购销处,91350121MA348HNU89,1990-10-04,集体分支机构(非法人),许乾府,"N/A","化肥、农具、农膜。(依法须经批准的项目，经相关部门批准后方可开展经营活动)",福建,福州,"闽侯县竹岐乡半岭街"
福建省连江县城关西南街机械修配厂,913501221547013019,1990-10-04,集体所有制,林启榕,"3.2万人民币","铁门花格，零件加工。(以上经营范围涉及许可经营项目的,应在取得有关部门的许可后方可经营)",福建,福州,"凤城镇816西路67号"
莆田市涵江区秋芦供销合作社庄稼医院,91350303MA346AB9XF,1990-10-04,集体分支机构(非法人),张金城,"N/A","化学农药、化学肥料零售.",福建,莆田,"莆田市涵江区秋芦镇崇圣半南村"
厦门市湖里华龙实业公司,91350206155227568L,1990-10-04,N/A,吴荣集,"500(万元人民币)","制造加工：纸及纸制品、包装材料及制品。",福建,厦门,"厦门市湖里区湖里街14号二号楼二层0208室"
闽侯县竹岐供销社火炬购销处,91350121MA348HPH48,1990-10-04,集体分支机构(非法人),余清玉,"N/A","化肥、农具、农膜。(依法须经批准的项目，经相关部门批准后方可开展经营活动)",福建,福州,"闽侯县竹岐乡火炬街"
闽侯县竹岐供销社高洲购销处,91350121MA348HQK53,1990-10-04,集体分支机构(非法人),林振胸,"N/A","化肥、农具、农膜。(依法须经批准的项目，经相关部门批准后方可开展经营活动)",福建,福州,"闽侯县竹岐乡高洲村"
福建省福鼎市糖业烟酒公司,913509821575011377,1990-10-05,N/A,纪孟良,"143.4000(万元人民币)","仅供清理债权债务。(依法须经批准的项目，经相关部门批准后方可开展经营活动)",福建,宁德,"福鼎市太姥商住区B幢306号"
福建省汽车运输有限公司永泰分公司修理厂,91350125X1126305XJ,1990-10-05,N/A,王勇,"N/A","乘用车维修、客车维修、货车维修（二类汽车维修）（依法须经批准的项目，经相关部门批准后方可开展经营活动）",福建,福州,"永泰县樟城镇龙峰园346号"
永春县锦斗供销合作社五金门市,91350525MA346PD426,1990-10-05,集体分支机构(非法人),郑瑞锦,"N/A","五金、交电、化工。",福建,泉州,"锦斗镇锦斗街"
永春县锦斗供销合作社肥料门市,91350525MA346PGJ4U,1990-10-05,集体分支机构(非法人),吴海星,"N/A","零售化学肥料。",福建,泉州,"锦斗镇锦斗街"
惠安县华惠体育用品有限公司,913505211562340145,1990-10-05,有限责任公司,陈宗成,"180万人民币","制造、加工：鞋类、服装及配件、鞋帽。(依法须经批准的项目，经相关部门批准后方可开展经营活动)",福建,泉州,"泉州惠安螺阳镇后田村"
永春县锦斗供销合作社综合门市,91350525MA346PF963,1990-10-05,集体分支机构(非法人),潘曙光,"N/A","零售百货、针纺织品。",福建,泉州,"锦斗镇锦斗街"
福建省泉运实业集团有限公司蓬壶汽车站,91350525856392136Y,1990-10-05,N/A,王朝炳,"N/A","客运站经营。",福建,泉州,"永春县蓬壶镇"
永春县锦斗供销合作社百货门市,91350525MA346PE14Y,1990-10-05,集体分支机构(非法人),王清泉,"N/A","百货、针织品。",福建,泉州,"锦斗镇锦斗街"
晋江市腾辉鞋服有限公司,91350582156460273E,1990-10-05,N/A,许有田,"80(万元人民币)","鞋制造。(依法须经批准的项目，经相关部门批准后方可开展经营活动)",福建,泉州,"晋江永和英墩"
永春县锦斗供销合作社,913505251564014252,1990-10-05,集体所有制,颜建育,"47.5万人民币","百货、五金、交电、化工、针纺织品、肥料、农膜、日用杂品零售，管理下属机构经营下列项目：食品、饮料、烟花爆竹。(依法须经批准的项目，经相关部门批准后方可开展经营活动)",福建,泉州,"锦斗镇锦斗街"
中国农业银行股份有限公司泉州分行,91350500856105408N,1990-10-05,N/A,王城英,"N/A","办理人民币存款、贷款；结算业务；办理票据贴现；代理发行金融债券；代理发行、代理兑付、销售政府债券；代理收付款项及代理中国保监会批准和允许销售的人身保险和财产保险",福建,泉州,"泉州市丰泽区泉秀路中段农行大厦内"
福建省泉运实业集团有限公司一都汽车站,913505258563921284,1990-10-05,N/A,曾志忠,"N/A","客运站经营。",福建,泉州,"永春县一都镇"
永春县锦斗供销合作社生资门市,91350525MA346PDK3Q,1990-10-05,集体分支机构(非法人),洪振山,"N/A","零售农药械、农膜。",福建,泉州,"锦斗镇锦斗街"
永春县锦斗供销合作社食杂门市,91350525MA346PC70D,1990-10-05,集体分支机构(非法人),王柳萌,"N/A","零售预包装食品、烟花爆竹。",福建,泉州,"锦斗镇锦斗街"
南靖县奎洋供销合作社,91350627156862168G,1990-10-05,集体所有制,吴国龙,"87.9万人民币","其他食品、五金、交电、化工(危险品除外)、纺织品、百货、日用杂品、农业生产资料销售。",福建,漳州,"奎洋镇永溪"
东山县铜陵镇第九渔业公司机械修配厂,9135062685682391X3,1990-10-05,集体分支机构(非法人),翁海,"N/A","船用柴油机维修",福建,漳州,"东山县铜陵镇桥雅街268号"
中国工商银行股份有限公司福州北尚支行,913501008543903213,1990-10-06,N/A,江东,"N/A","人民币存款、贷款、结算，办理人民币票据贴现，外汇存款、外币兑换，经银监会批准的其他业务。",福建,福州,"福州市晋安区南平东路98号稻田创业小镇A9号金城楼9107店面"
中国工商银行股份有限公司福州福大支行,91350100738027488J,1990-10-06,N/A,林忠永,"N/A","办理人民币存款、贷款、结算，办理人民币票据贴现，外汇存款、外币兑换，经银监会批准的其他业务。(依法须经批准的项目，经相关部门批准后方可开展经营活动)",福建,福州,"福州市乌山西路20号(凤湖新城四区沿街商业店面一层)"
中国工商银行股份有限公司福州东大支行,91350100854390188K,1990-10-06,N/A,程娟,"N/A","许可经营项目：办理人民币存款、结算，代理收付款项、代理保险业务及代理基金业务；办理人民币贷款、票据",福建,福州,"福州市鼓楼区五一北路88号"
中国工商银行股份有限公司福州华林支行,913501008543902762,1990-10-06,N/A,李岩斌,"N/A","许可经营项目：办理人民币存款、结算，代理收付款项、代理保险业务及代理基金业务；办理人民币贷款、票据",福建,福州,"福州市鼓楼区华林路138号国发广场商住楼一层4-8号店面"
中国工商银行股份有限公司福州火车站支行,9135010085439017XK,1990-10-06,N/A,方燮琼,"N/A","办理人民币存款、结算，代理收付款项、代理保险业务及代理基金业务；办理人民币贷款、票据",福建,福州,"福州市晋安区茶园街道华林路303号(铂金大厦)一层、二层部分店"
中国工商银行股份有限公司福州台江支行,91350100854390364G,1990-10-06,N/A,林坚英,"N/A","办理人民币存款、结算；代理收付款项；办理人民币贷款、票据",福建,福州,"福州市台江区817南路中亭街利生苑A区2号楼137号"
中国工商银行股份有限公司福州五一支行,913501008543905750,1990-10-06,N/A,张琳,"N/A","办理人民币存款、结算；代理收付款项、代理保险业务及代理基金业务；办理人民币贷款、票据",福建,福州,"福州市五一南路67号"
中国工商银行股份有限公司福州八一七支行,91350100854390356M,1990-10-06,N/A,陈澍农,"N/A","办理人民币存款、结算，代理收付款项、代理保险业务及代理基金业务；办理人民币贷款、票据",福建,福州,"福州市鼓楼区梅峰支路108号"
中国工商银行股份有限公司福州连江路支行,91350100854390225R,1990-10-06,N/A,郭燊东,"N/A","办理人民币存款、贷款、结算，办理人民币票据贴现，外汇存款、外币兑换，经银监会批准的其他业务。",福建,福州,"福州市晋安区王庄街道连江北路558号东嘉花园1号楼06、07号店面"
中国工商银行股份有限公司福州金融街支行,91350100854390401N,1990-10-06,N/A,邹似伟,"N/A","办理人民币存款、结算；代理收付款项；办理人民币贷款、票据",福建,福州,"福州市台江区金融街万达广场49-51号商铺"
中国工商银行股份有限公司福州象园路支行,913501008543903993,1990-10-06,N/A,李社,"N/A","办理人民币存款、结算，代理收付款项、代理保险业务及代理基金业务；办理人民币贷款、票据",福建,福州,"福州市台江区象园路72-1号"
中国工商银行股份有限公司福州商场支行,91350100854390487H,1990-10-06,N/A,陈琳,"N/A","办理人民币存款、结算；代理收付款项；办理人民币贷款、票据",福建,福州,"福州市台江区安平小区2号楼2号店面"
中国工商银行股份有限公司福州五里亭支行,9135010085439025X7,1990-10-06,N/A,郭祥锋,"N/A","办理人民币存款、结算；代理其支行在中国人民银行批准的业务范围内授权的人民币贷款、票据贴现及其他业务；办理外币储蓄、外汇存款和外币兑换业务；经中国银行业监督管理委员会批准的其他业务。",福建,福州,"福州市晋安区象园街道连江路双坂双龙花园1#楼A、B座连接体1层A1店面"
中国工商银行股份有限公司福州海润滨江支行,91350100854390479N,1990-10-06,N/A,李丹,"N/A","办理人民币存款、结算；代理收付款项、代理保险业务及代理基金业务；办理人民币贷款、票据",福建,福州,"福州市台江区鳌峰街道江滨中大道378号海润滨江花园17号楼19-20号店面"
中国工商银行股份有限公司福州温泉公园支行,91350100854390348T,1990-10-06,N/A,陈剑,"N/A","办理人民币存款、结算；办理其上级行在批准业务范围内授权的人民币贷款、票据贴现及其他业务；办理外币储蓄、外汇存款和外币兑换业务，经中国银行业监督管理委员会批准的其他业务。",福建,福州,"福州市鼓楼区树汤路17号温泉小区2号楼1号店面"
中国工商银行股份有限公司福州下杭支行,913501008543904369,1990-10-06,N/A,宋雅丽,"N/A","许可经营项目：办理人民币存款、结算；代理收付款项；办理人民币贷款、票据",福建,福州,"福州市台江区苍霞新城嘉惠园6-10号"
中国工商银行股份有限公司福州塔头支行,9135010085439033XT,1990-10-06,N/A,唐芳,"N/A","人民币存款、贷款、结算，办理人民币票据贴现，外汇储蓄、外币兑换，经银监会批准的其他业务。",福建,福州,"福州市晋安区塔头路8号"
中国工商银行股份有限公司福州台江商务区支行,91350100854390524P,1990-10-06,N/A,刘师捷,"N/A","许可经营项目：办理人民币存款、结算；代理收付款项；办理人民币贷款、票据",福建,福州,"福州市台江区江滨西大道省广电北侧“万科金域中央”2#101商铺"
中国工商银行股份有限公司福州大学城支行,91350121854390313M,1990-10-06,N/A,郑振银,"N/A","许可该机构经营中国银行业监督管理委员会依照有关法律、行政法规和其他规定批准的业务，经营范围以批准文件所列的为准",福建,福州,"闽侯县上街镇福州大学城内福大生活区2号楼东侧"
中国工商银行股份有限公司福州洋下支行,91350100854390161U,1990-10-06,N/A,张林,"N/A","人民币存款、贷款、结算，办理人民币票据贴现，外汇储蓄、外币兑换，经银监会批准的其他业务。",福建,福州,"福州市鼓楼区六一北路金福公寓4座11-12号店面"
中国工商银行股份有限公司福州心家泊支行,9135010085439041XE,1990-10-06,N/A,高颖,"N/A","办理人民币存款、结算，代理收付款项、代理保险业务及代理基金业务；办理人民币贷款、票据",福建,福州,"福州市台江区江滨西大道189号心家泊1号附属楼03-06号店"
中国工商银行股份有限公司福州元一支行,913501008543905082,1990-10-06,N/A,商瑞英,"N/A","办理人民币存款、结算；办理人民币贷款、票据",福建,福州,"福州市台江区新港街道群众东路99号元一小区1#综合楼一层"
中国工商银行股份有限公司福州小桥支行,91350100854390372B,1990-10-06,N/A,林清,"N/A","办理人民币存款、结算；代理收付款项、代理中国保监会批准和允许销售的人身保险和财产保险；办理人民币贷款、票据",福建,福州,"福州市台江区下杭路50号金马花园C楼底层"
中国工商银行股份有限公司福州金泉支行,91350100854390241F,1990-10-06,N/A,陈城,"N/A","人民币存款、贷款、结算，办理人民币票据贴现，外汇储蓄、外币兑换，经银监会批准的其他业务。",福建,福州,"福州市温泉路3号"
福建晋江市沙透机械配件有限公司,913505821564617947,1990-10-07,有限责任公司,王朝权,"350万人民币","汽车配件制造；货物或技术的进出口业务",福建,泉州,"新塘街道办事处沙塘"
福州市饲料工业公司劳动服务公司,913501031543821280,1990-10-08,N/A,庄永洪,"35(万元人民币)","经营范围:仅供清理本企业债权债务使用。",福建,福州,"福州市台江区中选路5号"
莆田市城厢区华榕艺术有限公司,91350302155505206C,1990-10-08,N/A,陈金柱,"100(万元人民币)","工艺油画绘制",福建,莆田,"莆田市城厢区凤凰山街道壶山东路266号"
福建省永春新华印刷有限公司,91350525156392549G,1990-10-08,N/A,李爱花,"150(万元人民币)","包装装潢印刷品印刷。",福建,泉州,"永春县桃城镇财政路23-25号"
泉州益品制香有限公司,91350521156230187E,1990-10-08,N/A,曾阳平,"200(万元人民币)","制造加工香制品、灯饰工艺、木雕工艺品。(依法须经批准的项目，经相关部门批准后方可开展经营活动)",福建,泉州,"螺阳镇廖厝前工业区"
莆田市涵江区白沙供销合作社,91350303155505177F,1990-10-08,集体所有制,戴清勇,"100万人民币","日用百货、塑料制品、玩具、服装鞋帽、钟表、眼镜、文教用品、针纺织品、五金工具、建筑五金、电工器材、其他食品、家具电器、液化灶具、农机交通用品、化工用品(不含危险品)、棉制品、粮油食品、化学农药（不含杀鼠剂）、化学肥料、手喷务器及零件、照相、中餐烹饪供应、图书课本、烟花、爆竹、卷烟零售；...",福建,莆田,"莆田市涵江区白沙镇白沙街7号"
平潭县水产供销公司加工厂,9135012815494184XB,1990-10-09,N/A,林在和,"15.9000(万元人民币)","水产品。(依法须经批准的项目，经相关部门批准后方可开展经营活动)",福建,福州,"平潭县城关夏致街11号"
福州市经济技术开发区万福机械厂,91350105154582066A,1990-10-09,集体所有制,王秀明,"65万人民币","仅供清理本企业债权债务使用。",福建,福州,"福州市马尾君竹路12号"
惠安县崇武海峰加油站有限公司,91350521156230240A,1990-10-09,N/A,陈建平,"800(万元人民币)","柴油零售；润滑油零售。",福建,泉州,"惠安县崇武镇港口码头堆场北侧"
莆田市忠湄轮渡有限责任公司,91350305155342662C,1990-10-09,N/A,潘春森,"8,649(万元人民币)","客渡（文甲-湄洲岛）、车渡运输（文甲-湄洲岛）、（兼营）高速客船运输（文甲-湄洲岛）（有效期至2019年05月07日）（依法须经批准的项目，经相关部门批准后方可开展经营活动）",福建,莆田,"莆田市湄洲镇宫下村"
莆田市涵江区庄边建筑工程公司,91350303155505265X,1990-10-09,N/A,黄新佑,"50.3000(万元人民币)","道路、水沟卫生清障服务",福建,莆田,"莆田市涵江区庄边镇溪西村"
厦门市粮油供应公司,91350200154988066W,1990-10-09,N/A,林祖授,"888(万元人民币)","批发零售饲料、日用百货、五金交电、日用杂品、建筑材料。",福建,厦门,"厦门市思明区豆仔尾路186号"
闽清县塔庄供销合作社省璜生资门市部,91350124MA349DAW66,1990-10-10,集体分支机构(非法人),黄自锦,"N/A","零售农具、化肥、农膜农药（不含剧毒农药、老鼠药，经营场所限存农药0.3吨以下）（依法须经批准的项目，经相关部门批准后方可开展经营活动）",福建,福州,"省璜镇省璜街"
莆田市荔城区北高供销社车头商场,91350304561663365B,1990-10-10,集体分支机构(非法人),张金通,"N/A","零售针织品、布、服装、鞋帽",福建,莆田,"荔城区北高镇北高街"
福建省晋江市新塘沙塘达利鞋帽服装厂,91350582156461719E,1990-10-10,个人独资企业,王文革,"N/A","针织品，服装制造。(依法须经批准的项目，经相关部门批准后方可开展经营活动)",福建,泉州,"新塘街道办事处沙塘"
晋江市罗山供销合作社沙塘综合商店,91350582683089568G,1990-10-10,集体分支机构(非法人),陈重海,"N/A","批发、零售：日用品百货、针织品、纺织品、五金产品、农具；零售：预包装食品、卷烟、雪茄烟。",福建,泉州,"晋江市新塘沙塘"
福建省平潭县水产养殖公司,91350128154942324N,1990-10-10,N/A,林安宁,"108(万元人民币)","海水及淡水动植物养殖(含苗种)，水产品购销",福建,福州,"平潭县城关北大街新村路"
罗源县起步供销合作社果药门市部,91350123MA2XW5W53G,1990-10-10,集体分支机构(非法人),黄致刚,"N/A","化学农药(不含杀鼠剂)。(以上经营范围涉及许可经营项目的，应在取得有关部门的许可后方可经营)",福建,福州,"罗源县起步乡起步街"
莆田市荔城区北高供销社农具门市部,91350304MA346BB76U,1990-10-10,集体分支机构(非法人),李世良,"N/A","农药",福建,莆田,"荔城区北高镇北高街"
莆田市荔城区北高供销社埕头分销处,91350304MA346AY7XP,1990-10-10,集体分支机构(非法人),陈仙景,"N/A","针纺织品、日用百货、日用杂品、五金交电零售。",福建,莆田,"荔城区北高镇埕头村"
泉州旭阳鞋业有限公司,91350521156230320X,1990-10-10,有限责任公司,江灿阳,"250万人民币","加工、制造：皮鞋、服装、包袋。",福建,泉州,"泉州台商投资区张坂镇仑前村"
厦门华达石化工程有限公司鼓浪屿供应站,91350200X1217864X1,1990-10-10,N/A,祁家宣,"N/A","从事本公司经营范围内石油气的供应以及石化燃气器具的销售和维修。",福建,厦门,"厦门市鼓浪屿内厝澳"
莆田市荔城区北高供销社,913503041555055057,1990-10-10,集体所有制,肖庆鸿,"230万人民币","零售预包装食品、零售散装食品；化肥、农药（中、低毒）",福建,莆田,"莆田市荔城区北高镇北高街"
罗源县起步供销合作社五金门市部,91350123MA2XW5UF22,1990-10-10,集体分支机构(非法人),柯绍彬,"N/A","油漆，涂料，电工器材，日用杂品,照明电器。(以上经营范围涉及许可经营项目的,应在取得有关部门的许可后方可经营)",福建,福州,"罗源县起步乡起步村"
龙岩闽广广告有限公司,91350800157822176Q,1990-10-10,N/A,李春辉,"50(万元人民币)","国内广告设计、制作、代理及发布；展览展示服务；摄影服务；园林古建筑工程、建筑装饰装修工程、城市及道路照明工程的设计及施工；广告材料及装璜装饰材料",福建,龙岩,"龙岩市新罗区东城松涛北环中路10号(天宇大厦一层北厅)"
福建省南平造纸营林总公司古田分公司,913509228576201022,1990-10-10,N/A,陈芳茂,"N/A","造纸专用林。(依法须经批准的项目，经相关部门批准后方可开展经营活动)",福建,宁德,"古田县林业局(城东)"
晋江市永和供销合作社杏山双代店,91350582MA347H1K09,1990-10-10,集体分支机构(非法人),王诗湖,"N/A","零售：卷烟、雪茄烟、预包装食品；零售：粮油、日用杂品、农具、日用百货、化肥、农药",福建,泉州,"福建省泉州市晋江市永和镇玉溪村西区3号"
永春县电影发行放映公司,913505254894567585,1990-10-10,N/A,孙梓灿,"58.9000(万元人民币)","电影发行放映。",福建,泉州,"永春县八二三中路18号（房产证：五里街镇儒林村）"
莆田市荔城区北高供销社埕头化肥门市部,91350304MA346AXU10,1990-10-10,集体分支机构(非法人),陈文栋,"N/A","化学肥料、农药",福建,莆田,"荔城区北高镇埕头村"
福建省永春县肉类联合加工厂,913505251563843890,1990-10-10,国有企业,郑明忠,"35.2万人民币","厂房出租。(依法须经批准的项目，经相关部门批准后方可开展经营活动)",福建,泉州,"８２３东路商业大厦二楼"
莆田市秀屿区忠门供销合作社,913503051555053539,1990-10-10,集体所有制,郑仁发,"210.5万人民币","散装食品、预包装食品、卷烟、雪茄烟、农药（中、低毒）、图书（分支机构经营）；日用杂品、针织品、鞋帽、五金交电、文化用品、体育用品、服装、化工（不含危险化学品）、化学肥料、家具、建筑材料、农用机械、中小农具、农用薄膜、农副产品、塑料制品（分支机构经营）(依法须经批准的项目，经相关部门批准后方可开展经营...",福建,莆田,"莆田市秀屿区月塘乡双告山村"
莆田市荔城区北高供销社北高超市,91350304MA346AX304,1990-10-10,集体分支机构(非法人),翁国雄,"N/A","散装食品、预包装食品零售；日用百货、日用杂品、针纺织品、五金交电零售。",福建,莆田,"莆田市荔城区北高镇北高村910号"
莆田市涵江区大洋供销合作社,91350303155505388Y,1990-10-11,集体所有制,戴清勇,"101.5万人民币","其他食品、副食品、针纺织品、日用百货、日用化妆品、塑料制品、文化用品、服装鞋帽、日用陶瓷、五金交电、（除国家实行的专营专卖物资之外）油漆、涂料（不含化学危险品）水泥、农具、化学肥料、化学农药杀鼠剂、塑料薄膜、粮食及制品、食用植物油零售、批发（由下属机构经营）",福建,莆田,"莆田市涵江区大洋乡大洋村渡口"
莆田市秀屿区忠门供销合作社忠门综合门市部,91350305MA346G5557,1990-10-11,集体分支机构(非法人),戴金兰,"N/A","日用杂品、日用陶瓷器、日用百货、日用化学品",福建,莆田,"莆田市秀屿区忠门镇忠门街"
晋江市博茂石雕制品有限公司,91350582156298413F,1990-10-11,N/A,林荣茂,"300(万)","石雕，石板材销售。(依法须经批准的项目，经相关部门批准后方可开展经营活动)",福建,泉州,"晋江市永和镇马坪村"
