永泰县葛岭供销合作社生资门市部,91350125MA347E4R9G,1990-08-15,集体分支机构(非法人),侯广木,"N/A","化学农药，化学肥料。(依法须经批准的项目，经相关部门批准后方可开展经营活动)",福建,福州,"永泰县葛岭镇葛岭街"
建瓯市小桥供销合作社下抱购销站,91350783MA348FWY26,1990-08-15,集体分支机构(非法人),李世雄,"N/A","农药（不含危险化学品）、化肥、百货、针纺织品、日用杂货、五金交电零售；农产品购销；农用塑料薄膜、农机械具及配件零售；非生产性废旧金属、非金属再生资源的回收、销售",福建,南平,"建瓯市小桥镇下抱村"
建瓯市小桥供销合作社洽历购销站,91350783MA348FYN5J,1990-08-15,集体分支机构(非法人),谢可全,"N/A","农药",福建,南平,"建瓯市小桥镇洽历村"
永泰县葛岭供销合作社台口生资门市部,91350125MA347E5Y2M,1990-08-15,集体分支机构(非法人),林新亮,"N/A","化学农药，化学肥料。(依法须经批准的项目，经相关部门批准后方可开展经营活动)",福建,福州,"永泰县葛岭镇台口街"
永泰县长庆供销合作社,913501251548214183,1990-08-15,集体所有制,林聿环,"57.85万人民币","百货，针纺织品，五金交电，纸及制品，文教用品零售；化学肥料、化学农药",福建,福州,"永泰县长庆乡长庆街"
永泰县长庆供销合作社歧峰购销处,91350125MA348DKP7X,1990-08-15,集体分支机构(非法人),魏乃基,"N/A","百货，布，针织品，建筑五金，自行车，家用电器，文教用品，体育用品，日用杂品，水产品。化学肥料，水泥，农副产品购销，竹木制品，废旧物资收购。(依法须经批准的项目，经相关部门批准后方可开展经营活动)",福建,福州,"长庆歧峰村"
永泰县城关供销合作社芭蕉购销处,91350125MA346NJX2G,1990-08-15,集体分支机构(非法人),余能强,"N/A","酒，茶，乳制品，非酒精饮料，糕点，糖果，罐头食品，烟花爆竹C、D级产品零售百货，针纺织品，鞋帽，钟表，五金，纸及制品，文教用品，日用杂品，卷烟、调味品、水产品、其它副食品、化学农药、化学肥料、农副产品购销，农用薄膜。",福建,福州,"永泰县富泉乡芭蕉村"
晋江源兴织造工艺有限公司,91350582611531310Q,1990-08-15,N/A,吴我伟,"600(万元人民币)","生产织造梭织布、针织布及其制品( 产品出口不涉及许可证配额管理品种)。",福建,泉州,"福建省晋江市安海镇灵水村"
永泰县嵩口供销合作社嵩阳酒店,91350125MA346B0U4Y,1990-08-15,集体分支机构(非法人),赵峰,"N/A","住宿服务。",福建,福州,"永泰县嵩口镇道南222号"
永泰县嵩口供销合作社,913501251548217096,1990-08-15,集体所有制,陈秀效,"103万人民币","针纺织品、服装鞋帽、玩具、钟表眼镜、五金交电、建材、纸及制品、农药、烟花爆竹、化学肥料批发、零售，废旧农资收购、农副产品购销。预包装食品、散装食品、乳制品批发零售",福建,福州,"永泰县嵩口镇道南227号"
永泰县长庆供销合作社五交化门市部,91350125MA348DPN24,1990-08-15,集体分支机构(非法人),魏爱珠,"N/A","自行车，家用电器，建筑五金，五金工具。(依法须经批准的项目，经相关部门批准后方可开展经营活动)",福建,福州,"永泰县长庆乡"
中国农业银行股份有限公司永泰梧桐支行,913501258548247831,1990-08-15,N/A,池海萍,"N/A","办理人民币存款、结算；代理收付款项及代理保险业务；办理其上级行在中国银行业监督管理委员会批准的业务范围内授权的人民币贷款，票据贴现及其他业务；办理外汇存款、外汇汇款；外币兑换业务；经中国银行业监督管理委员会等监管部门批准的其他业务。(依法须经批准的项目，经相关部门批准后方可开展经营活动)",福建,福州,"永泰县梧桐镇梧桐街"
永泰县清凉供销合作社白云生资门市部,91350125MA348MR1X7,1990-08-15,集体分支机构(非法人),黄智,"N/A","化学农药.化学肥料.农用金属工具（依法须经批准的项目，经相关部门批准后方可开展经营活动）",福建,福州,"永泰县白云乡白云街"
永泰县梧桐供销合作社,913501251548218808,1990-08-15,集体所有制,黄敏,"59万人民币","日用百货、日用化学品、布、丝织品、其它纺织品、针织品、服装、鞋帽、玩具、钟表眼镜、建筑五金、五金工具、自行车、家用电器、纸、纸制品、文教用品、文娱用品、体育用品。化学农药、烟花爆竹零售、化学肥料、水泥、石灰、废旧物资收购，农副产品购销、农业薄膜零售。",福建,福州,"永泰县梧桐镇"
建瓯市小桥供销合作社百丈购销站,91350783MA348FY58A,1990-08-15,集体分支机构(非法人),陈立功,"N/A","百货、针纺织品、五金交电零售；农产品购销；农药",福建,南平,"建瓯市小桥镇百丈村"
永泰县大洋供销合作社霞拔生资收购门市部,91350125MA2XRY7R6H,1990-08-15,集体分支机构(非法人),林宣莲,"N/A","化学农药，化学肥料，家用薄膜，日用杂品,农业机械；农副产品购销,废旧物资收购。",福建,福州,"永泰县霞拔乡"
永泰县城关供销合作社塔山购销处,91350125MA346TANXC,1990-08-15,集体分支机构(非法人),鄢庆锄,"N/A","百货，针纺织品，服装鞋帽，玩具，建筑五金，五金工具，纸及制品，文教用品；化学农药、化学肥料、农副产品购销、农用薄膜。",福建,福州,"永泰县樟城塔山路"
福建省平和县农资公司玉溪门市部,91350628MA349TH29X,1990-08-15,N/A,卢朝生,"N/A","零售中低毒农药",福建,漳州,"小溪镇玉溪村"
永泰县梧桐供销合作社生资门市部,91350125MA34AC9Q32,1990-08-15,集体分支机构(非法人),郑达强,"N/A","化学肥料，化学农药，日用杂品，农、林机械，农用薄膜。(依法须经批准的项目，经相关部门批准后方可开展经营活动)",福建,福州,"永泰县梧桐镇梧桐街"
福建省烟草公司福州市公司,913501001543813529,1990-08-15,N/A,黄学良,"3,164.1000(万元人民币)","卷烟、雪茄烟全国购进本地（市）批发；卷烟、雪茄烟本省（自治区、直辖市）购进本地（市）批发；烟丝本省（自治区、直辖市）购进本地（市）批发；烟叶本地（市）购进全国销售；烟叶全国购进定向销售；进口卷烟、雪茄烟、购进本省",福建,福州,"福州市晋安区茶园街道六一北路17号"
永泰县城关供销合作社岭路生资门市部,91350125MA346TD35F,1990-08-15,集体分支机构(非法人),程成泉,"N/A","化学农药、农用薄膜；化学肥料、农业机械。(依法须经批准的项目，经相关部门批准后方可开展经营活动)",福建,福州,"永泰县岭路乡岭路街"
晋江精密纺织有限公司,9135058261153567XN,1990-08-15,N/A,吴晓猛,"1,000(万港币)","生产化纤布( 产品出口不涉及许可证配额管理品种)。",福建,泉州,"晋江市安海坑边加工小区"
永泰县城关供销合作社生产资料商店,91350125MA346DFY82,1990-08-15,集体分支机构(非法人),檀丽容,"N/A","化学农药、农用薄膜化学肥料、日用杂品、植物保护和管理机械、种子零售批发（依法须经批准的项目，经相关部门批准后方可开展经营活动）",福建,福州,"永泰县樟城镇南门新村132号"
永泰县大洋供销合作社盘谷生资门市部,91350125MA2XRYDB3U,1990-08-15,集体分支机构(非法人),方连贞,"N/A","日用百货，日用化学品，建筑五金，文教用品；化学肥料，农业机械，化学农药。",福建,福州,"永泰县盘谷乡"
建瓯市小桥供销合作社生产资料经理部,91350783MA348FYG8M,1990-08-15,集体分支机构(非法人),郑礼光,"N/A","农业生产资料（不含种子）",福建,南平,"建瓯市小桥镇小桥村"
中国工商银行股份有限公司尤溪支行,913504268559089893,1990-08-16,N/A,严克樟,"N/A","许可该机构经营中国银行业监督管理委员会依照有关法律、行政法规和其他规定批准的业务，经营范围以批准文件所列的为准；代理保险业务。",福建,三明,"尤溪县城关解放路16号"
永泰县城关供销合作社富泉综合门市部,91350125MA346P1C1J,1990-08-16,集体分支机构(非法人),黄文彬,"N/A","日用百货，日用化学品，针纺织品，服装鞋帽，建筑五金，家用电器，文教用品，日用杂品、化学肥料、化学农药、农用薄膜、干鲜果品、卷烟、酒、蜜饯果脯、调味品、粮食制品、其它副食品零售。",福建,福州,"永泰县富泉乡富泉街"
中国建设银行股份有限公司闽清城关支行,91350124854787177D,1990-08-16,N/A,张伯连,"N/A","许可该机构经营中国银行业监督管理委员会依照有关法律、行政法规和其他规定批准的业务，经营范围以批准文件所列的为准。(以上经营范围涉及许可经营项目的，应在取得有关部门的许可后方可经营)",福建,福州,"梅城镇解放大街168号"
闽清县白中供销合作社后佳购销处,91350124MA349CN47D,1990-08-16,集体分支机构(非法人),黄积财,"N/A","百货、针纺织品、农膜、化肥、农具零售，农产品收购零售农药（不含剧毒农药、老鼠药，经营场所限存危险化学物品0.5吨以下）（依法须经批准的项目，经相关部门批准后方可开展经营活动）",福建,福州,"后佳乡后佳街"
厦门市高殿经济发展公司搬运分公司,913502061552255976,1990-08-16,N/A,曾文良,"120(万元人民币)","火车北站货物的装卸、搬运服务。",福建,厦门,"厦门火车北站"
厦门南洋模特儿衣架有限公司,913502006120069132,1990-08-17,N/A,骆妙琼,"160.7650(万元人民币)","模具制造；雕塑工艺品制造（象牙及其制品除外）；玻璃纤维增强塑料制品制造；泡沫塑料制造；软木制品及其他木制品制造；初级形态塑料及合成树脂制造（不含危险化学品和监控化学品及非药品类易制毒化学品）；其他塑料制品制造；其他未列明专业技术服务业（不含需经许可审批的事项）；其他日用杂品制造；经营各类商品和技术的进出口",福建,厦门,"厦门市集美区灌口镇深青工业区香树路60号（厂房）之302"
宏发集团( 中国)有限公司,913500006115291149,1990-08-17,N/A,林移来,"13080万元人民币","生产方便食品(方便面)、挂面(普通挂面),代购代销成员企业原辅材料和产品,粮油食品批发(不含进口分销),并协调成员企业的经营活动(粮油食品批发经营年限不得超过30年)。(依法须经批准的项目,经相关部门批准后方可开展经营活动)",福建,南安,"南安市水头镇大盈工业区"
永春县蓬壶供销合作社苏坑肥料门市,91350525MA345K0D47,1990-08-17,集体分支机构(非法人),张光年,"N/A","化学肥料、石灰零售。(依法须经批准的项目，经相关部门批准后方可开展经营活动)",福建,泉州,"永春县苏坑嵩山"
厦门市海沧供销社石塘门市部,91350205855263885H,1990-08-17,集体分支机构(非法人),谢忠芬,"N/A","肉、禽、蛋零售；水产品零售；酒、饮料及茶叶零售；烟草制品零售；预包装食品零售；散装食品零售；纺织品及针织品零售；服装零售；鞋帽零售；其他日用品零售；日用家电设备零售。",福建,厦门,"厦门市海沧镇石塘村"
福建莆田侨发鞋业有限公司,91350300611252258U,1990-08-18,N/A,刘祖华,"2,268(万元人民币)","生产时装鞋",福建,莆田,"莆田市八二一北街503号"
南靖县靖城供销合作社,91350627156861528U,1990-08-18,集体所有制,简永雄,"310万人民币","百货、五金交电、日用杂品、土畜产品、农药(不含剧毒农药及杀鼠剂)、化肥、其他食品和其他副食品；废旧物资回收、石油制品。",福建,漳州,"福建省漳州市南靖县靖城镇兰陵路12号"
武夷山市上梅供销合作社,913507821572629062,1990-08-18,集体所有制,周兴发,"56.3万人民币","百货、针纺织品、五金交电、农业生产资料、日用杂货品、副食品、农副土特产口购销",福建,南平,"武夷山市上梅下屯街"
中国工商银行股份有限公司福州东街口支行,91350100854430418H,1990-08-18,N/A,章少丽,"N/A","办理人民币存款、结算，代理收付款项、代理保险业务及代理基金业务；办理人民币贷款、票据",福建,福州,"福州市鼓楼区东街43号"
福建省平潭县糖酒副食品公司,91350128154940433U,1990-08-19,N/A,谢康生,"66(万元人民币)","批发兼零售预包装食品（依法须经批准的项目，经相关部门批准后方可开展经营活动）",福建,福州,"平潭县城关东大街6号"
将乐县白莲供销合作社,91350428155984059B,1990-08-19,集体所有制,饶素兰,"45万人民币","农产品、农业生产资料(危险化学品除外)、百货、五金、交电、化工产品、建筑材料、针纺织品、日用杂品",福建,三明,"白莲镇白莲乡"
晋江市龙湖供销合作社中山街傢俬门市部,913505827395217523,1990-08-20,集体分支机构(非法人),郑开辉,"N/A","傢俬零售。(依法须经批准的项目，经相关部门批准后方可开展经营活动)",福建,泉州,"福建省泉州市晋江市龙湖镇中山街"
晋江市东石供销合作社五交化门市部,913505827917994447,1990-08-20,集体分支机构(非法人),蔡文为,"N/A","五金工具、家用电器零售。(依法须经批准的项目，经相关部门批准后方可开展经营活动)",福建,泉州,"东石龙江东路"
闽侯县城关供销社棉百门市部,91350121854660571H,1990-08-20,集体分支机构(非法人),程文钗,"N/A","棉布、纺织品、百货、服装。(依法须经批准的项目，经相关部门批准后方可开展经营活动)",福建,福州,"闽侯县甘蔗镇双池村"
晋江市东石供销合作社综合商场,91350582MA347DEB9R,1990-08-20,集体分支机构(非法人),颜黎明,"N/A","百货、针织品零售。(依法须经批准的项目，经相关部门批准后方可开展经营活动)",福建,泉州,"晋江市东石龙江东路"
晋江市东石供销合作社肥料农药专营门市部,9135058279179837XT,1990-08-20,集体分支机构(非法人),许祖(水石),"N/A","肥料、农药、农膜零售。(依法须经批准的项目，经相关部门批准后方可开展经营活动)",福建,泉州,"晋江市东石玉和西路"
晋江市金井供销合作社新楼大小百货门市部,91350582MA34881678,1990-08-20,集体分支机构(非法人),蒋福群,"N/A","百货零售。(依法须经批准的项目，经相关部门批准后方可开展经营活动)",福建,泉州,"金井中兴路"
宁德市蕉城区赤溪供销社第一百货门市部,91350902MA2XWGNM5G,1990-08-20,集体分支机构(非法人),汤树良,"N/A","针纺织品、日用百货、建筑五金、电风扇、电饭煲、电工器材零售。(以上经营范围涉及许可经营项目的,应在取得有关部门的许可后方可经营)",福建,宁德,"宁德市蕉城区赤溪乡赤溪街"
厦门铁路开发有限公司,9135020015498775XK,1990-08-20,N/A,薛敏,"100(万元人民币)","糕点、糖果及糖批发；酒、饮料及茶叶批发；其他预包装食品批发；其他散装食品批发；乳制品（不含婴幼儿配方奶粉）批发；其他综合零售；糕点、面包零售；酒、饮料及茶叶零售；图书、报刊零售；预包装食品零售；乳制品（不含婴幼儿配方奶粉）零售；其他铁路运输辅助活动；烟草制品零售(限合法设立的分支机构经营)；果品零售；纺织品及针织品零售；文具用品批发；其他文化用品批发；贸易代理；其他未列明批发业（不含需经许可审批的经营项目）；文具用品零售；箱、包零售；其他日用品零售；工艺美术品及收藏品零售（不含文物）；其他文化用品零售；其他仓储业",福建,厦门,"厦门市思明区厦禾路878号铁道大厦21楼D单元"
晋江市东石供销合作社小百门市部,913505827917995085,1990-08-20,集体分支机构(非法人),蔡珠碧,"N/A","小百货鞋帽零售。(依法须经批准的项目，经相关部门批准后方可开展经营活动)",福建,泉州,"东石龙江东路"
中国农业银行股份有限公司永泰塔山支行,91350125854825751Y,1990-08-20,N/A,林宜茗,"N/A","办理人民币存款、结算；代理收付款项及代理保险业务；办理其上级行在中国银行业监督管理委员会批准的业务范围内授权的人民币贷款，票据贴现及其他业务；办理外汇存款、外汇汇款；外币兑换业务；经中国银行业监督管理委员会等监管部门批准的其他业务。(依法须经批准的项目，经相关部门批准后方可开展经营活动)",福建,福州,"永泰县樟城镇龙翔大厦3-5号"
晋江市东石供销合作社湾道棉布针织门市部,91350582791798396M,1990-08-20,集体分支机构(非法人),周建尤,"N/A","棉布、针织品、鞋帽零售。(依法须经批准的项目，经相关部门批准后方可开展经营活动)",福建,泉州,"晋江市东石龙江石东路"
顺昌县洋口供销合作社,913507211571029104,1990-08-20,集体所有制,汤权平,"99万人民币","针纺织品、百货、农副产品、农药化肥(分支机构使用)、农用薄膜、农技机械、笋炭、香菇、木耳。建筑五金，交电，日杂。(依法须经批准的项目，经相关部门批准后方可开展经营活动)",福建,南平,"顺昌县洋口镇中山路74号"
晋江市金井供销社合作社新楼棉布针织门市部,91350582MA3488001R,1990-08-20,集体分支机构(非法人),黄禄宜,"N/A","棉布、针织品、服装、鞋帽零售；日用百货零售。(依法须经批准的项目，经相关部门批准后方可开展经营活动)",福建,泉州,"金井中兴路"
晋江市东石供销合作社布百门市部,91350582MA347D5X1G,1990-08-20,集体分支机构(非法人),蔡崇山,"N/A","棉布、小百货、针织品零售。(依法须经批准的项目，经相关部门批准后方可开展经营活动)",福建,泉州,"东石龙江东路057-061号"
晋江市东石供销合作社湾道百货门市部,91350582791798409B,1990-08-20,集体分支机构(非法人),黄呈伟,"N/A","小百货、五金工具零售，文化用品零售。(依法须经批准的项目，经相关部门批准后方可开展经营活动)",福建,泉州,"晋江市东石湾道"
晋江市龙湖供销合作社衙口百货商店,91350582739521832N,1990-08-20,集体分支机构(非法人),李金兴,"N/A","零售：针织品、棉布、五金工具、教育用品、；卷烟、雪茄烟",福建,泉州,"晋江龙湖衙口"
晋江市东石供销合作社湾道农具果杂门市部,91350582MA347DH835,1990-08-20,集体分支机构(非法人),蔡尤和,"N/A","农具、日用杂品零售。(依法须经批准的项目，经相关部门批准后方可开展经营活动)",福建,泉州,"晋江市东石湾道"
福州三富制衣有限公司,9135010061130517XG,1990-08-20,N/A,欧朝瑞,"593(万元人民币)","生产各种服装",福建,福州,"福州连江路南段红星村标准厂房C栋"
晋江市东石供销合作社果杂综合门市部,91350582MA347DGF4R,1990-08-20,N/A,施恩惠,"N/A","日用杂品、小百货、小五金、文具零售。(依法须经批准的项目，经相关部门批准后方可开展经营活动)",福建,泉州,"晋江市东石第一居委会"
福建杨振华851生物科技股份有限公司,91350000611445156K,1990-08-21,N/A,刘德建,"4,200(万元人民币)","发酵制品、瓶",福建,福州,"福建省福州市马尾区罗星中路15号"
福建省武夷山市果品食杂水产公司,91350782157262893C,1990-08-21,N/A,杨义斌,"45(万元人民币)","仅供清理本企业债权债务使用。(依法须经批准的项目，经相关部门批准后方可开展经营活动)",福建,南平,"武夷山市温岭街55号"
福建省宁德盐业有限责任公司蕉城分公司,913509028574669932,1990-08-21,N/A,李强,"N/A","主营盐批发、零售；批发兼零售预包装食品；水产品、日用品批发零售（依法须经批准的项目，经相关部门批准后方可开展经营活动）",福建,宁德,"福建省宁德市蕉城区城南镇福洋村福洋路39号"
福建省南靖县经济技术协作开发公司,91350627489849658R,1990-08-21,N/A,林荣开,"61(万元人民币)","钢材、水泥及制品、水暖器材、化工产品、化工原料、电工工具、仪表仪器具、计量衡器具。(依法须经批准的项目，经相关部门批准后方可开展经营活动)",福建,漳州,"山城安美路13-14号"
万益皮革(厦门)有限公司,91350200612006999W,1990-08-21,N/A,邱攸枫,"600(万美元)","从事以皮革，人造皮革及纺织布料为主要原料的各类箱、包、带、夹以及鞋类的生产、加工。",福建,厦门,"厦门市同安区五显镇西洋村"
南靖县靖城供销合作社德育肥药门市,91350627079776230P,1990-08-21,集体分支机构(非法人),沈德育,"N/A","中低毒农药",福建,漳州,"南靖县靖城镇沧溪村"
福建省惠安县港峰服装有限公司,9135052115622879XP,1990-08-22,有限责任公司,蔡荣奎,"268万人民币","加工、制造：服装、针织、鞋件。(依法须经批准的项目，经相关部门批准后方可开展经营活动)",福建,泉州,"泉州惠安螺阳镇上坂村"
南靖县山城供销社割山生产资料门市,913506278568622737,1990-08-22,集体分支机构(非法人),陈瑞程,"N/A","化肥、农用薄膜、中低毒农药",福建,漳州,"山城镇割山村"
南靖县山城供销合作社,91350627156861536N,1990-08-22,集体所有制,吴跃真,"115万人民币","副食品、其他食品、纺织品、百货、日用杂品、五金交电、化工(危险品除外)、塑料制品、农业生产资料零售；店面出租（以上经营范围仅供分支机构经营）（依法须经批准的项目，经相关部门批准后方可开展经营活动）",福建,漳州,"山城镇解放路69号"
云霄县劳动服务公司水果加工厂,9135062285666439XG,1990-08-23,集体分支机构(非法人),黄震智,"N/A","水果罐头",福建,漳州,"云霄县胜利路55号"
晋江市深沪供销合作社狮峰综合商店,913505826943597622,1990-08-23,集体分支机构(非法人),陈秋影,"N/A","针纺织品、百货、五金、家用电器零售。(依法须经批准的项目，经相关部门批准后方可开展经营活动)",福建,泉州,"晋江深沪狮峰"
晋江市安海供销合作社内坑分社批发部,91350582MA2XWBCYXE,1990-08-23,集体分支机构(非法人),林建康,"N/A","日用杂品、针织品、日用百货批发；化肥、农药、农膜零售。",福建,泉州,"福建省晋江市内坑镇内坑街"
晋江市金井供销合作社肥料建燃门市部,91350582MA34882JXE,1990-08-23,集体分支机构(非法人),王金盾,"N/A","化肥、农膜、农药；建筑材料(必经是国家政策允许)零售。(依法须经批准的项目，经相关部门批准后方可开展经营活动)",福建,泉州,"金井瀛光街尾"
晋江市泰华制衣实业有限公司,913505006115202751,1990-08-23,N/A,洪维灿,"500(万元人民币)","生产各式服装及针纺织品( 不含配额许可证管理品种)。",福建,泉州,"福建省晋江市东石镇石菌村"
晋江市深沪供销合作社百货五交门市部,91350582MA34692815,1990-08-23,集体分支机构(非法人),杨晓泳,"N/A","针纺织品、百货、五金、家用电器零售。(依法须经批准的项目，经相关部门批准后方可开展经营活动)",福建,泉州,"晋江市深沪镇南春"
晋江市金井供销合作社百货门市部,91350582MA3487W88F,1990-08-23,集体分支机构(非法人),陈泽昌,"N/A","日用百货零售。针织品、服装、鞋帽零售。(依法须经批准的项目，经相关部门批准后方可开展经营活动)",福建,泉州,"晋江市金井镇旧街"
晋江市金井供销合作社日杂门市部,91350582MA34881J38,1990-08-23,集体分支机构(非法人),徐金善,"N/A","日用杂品、塑料制品零售。(依法须经批准的项目，经相关部门批准后方可开展经营活动)",福建,泉州,"福建省晋江市金井旧街"
光泽县食品公司冷冻厂,91350723MA2XPYU43N,1990-08-23,N/A,许传富,"N/A","冷冻肉、禽、渔海产品。",福建,南平,"光泽县坪山东路65号"
晋江市金井供销合作社围头购销站,91350582MA2XWBCX1N,1990-08-23,集体分支机构(非法人),洪少华,"N/A","化肥零售、卷烟、雪茄烟",福建,泉州,"晋江金井围头"
晋江市宝信鞋业有限责任公司,91350582156285436D,1990-08-23,有限责任公司,张文星,"180万人民币","制造：鞋、鞋材（鞋底、鞋衬）、模具（不含电镀）；货物或技术的进出口业务",福建,泉州,"福建省泉州市晋江市西滨镇海滨社区海滨街244号"
永春县岵山供销合作社食杂门市,91350525MA346MA61M,1990-08-24,集体分支机构(非法人),柯宝珍,"N/A","零售预包装食品兼散装食品，零售乳制品",福建,泉州,"永春县岵山镇茂霞村和塘中路66号"
漳州市郭坑供销社农业技术咨询部,91350603741669115R,1990-08-24,集体分支机构(非法人),洪加生,"N/A","中低毒农药（不含杀鼠剂）、化肥",福建,漳州,"漳州市龙文区郭坑镇人民南路16-18号"
南平市粮油供应公司,913507001570265915,1990-08-24,N/A,黄少平,"532(万元人民币)","饲料批发、零售；分支机构经营：零售预包装食品、乳制品",福建,南平,"南平市中山路529号"
