保山众杰汽车销售服务有限公司腾冲分公司,91530522MA6K9HK339,2010-10-12,N/A,N/A,"N/A","汽车销售。",云南,保山,"云南省保山市腾冲市腾越镇热海社区腾八中路边"
昆明城珍科技有限公司,91530102563151056K,2010-10-12,N/A,N/A,"100(万元人民币)","计算机软硬件的开发、研究及技术咨询；计算机系统集成及综合布线；计算机网络技术咨询；国内贸易、物资供销（依法须经批准的项目，经相关部门批准后方可开展经营活动）",云南,昆明,"云南省昆明市五华区西站向阳新村52-乙101号"
云南之佳便利店有限公司蒙自红河学院分店,915325225631566667,2010-10-12,N/A,N/A,"N/A","预包装食品兼散装食品、乳制品（含婴幼儿配方乳粉）；保健食品；酒水、饮料、消毒剂、消毒器械、卫生用品、医疗器械（涉及前置审批的凭许可证经营）；鲜花、日用百货、家用电器、五金工具、电线、文化用品、办公用品、劳保用品、化妆品、食盐、通讯产品配件、农副产品的销售；卷烟、图书、杂志的零售；充值卡、续费卡的销售（依法须经批准的项目，经相关部门批准后方可开展经营活动）",云南,红河,"云南省红河州蒙自市红河学院生活服务中心柠檬时代1栋1-102号"
云南海美格科技有限公司,915301005631517939,2010-10-12,N/A,N/A,"100(万元人民币)","计算机软硬件的开发及应用；计算机系统集成及综合布线；企业管理；经济信息咨询；计算机及配件、仪器仪表、通讯器材、家用电器、制冷设备、办公用品、工艺美术品、建筑材料、装饰材料的销售；农业技术的研究及推广；土石方工程、园林绿化工程的设计与施工（依法须经批准的项目，经相关部门批准后方可开展经营活动）",云南,昆明,"云南省昆明市高新区洪发小区13幢1单元602室"
云南华康管业有限公司,9153260056315234XP,2010-10-12,N/A,N/A,"510(万元人民币)","PE管材生产；PPR管材管件、PVC管材管件、PE管材管件、金属管材管件、节水灌溉设备、五金交电、塑料原料、塑料制品、橡胶制品的销售。（依法须经批准的项目，经相关部门批准后方可开展经营活动）",云南,文山,"云南省文山壮族苗族自治州文山市蚂蟥塘村(中央储备粮文山直属库对面)"
云南辰刚科技有限公司,91530111563151363D,2010-10-12,N/A,N/A,"1,100(万元人民币)","计算机软硬件开发应用及技术服务；计算机系统集成及综合布线；国内贸易、物资供销；钢结构工程施工、土石方工程施工、建筑装修装饰工程施工、通信工程施工、市政公用工程施工、园林绿化工程施工（按资质证核定的范围和时限开展经营活动）（依法须经批准的项目，经相关部门批准后方可开展经营活动）",云南,昆明,"昆明市关上中心区41号地块关上北路109号龙远大厦五层8号"
昆明伟瀚科技有限公司,91530102563151400J,2010-10-12,N/A,N/A,"100(万元人民币)","计算机软硬件的开发及应用；计算机系统集成及综合布线；企业管理咨询；经济信息咨询；国内贸易、物资供销；医疗器械的租赁（依法须经批准的项目，经相关部门批准后方可开展经营活动）",云南,昆明,"云南省昆明市五华区黑林铺街道办事处海源社区春城慧谷小区一期（A2地块）8幢17层1707号"
罗平县远东电脑有限责任公司,915303245631521981,2010-10-12,N/A,N/A,"20(万)","电脑、电脑配件、耗材、办公设备、打印机销售，技术开发、监控防盗产品、工程安装、网络系统开发、维护，废旧家电、电器回收。",云南,曲靖,"罗平县九龙大道防疫站斜对面"
砚山县大华威尔房地产开发有限公司,9153262207763049XF,2010-10-12,N/A,N/A,"2,350(万元人民币)","房地产开发、经营；房地产开发项目的总承包；房地产买卖、出租；房地产投资；商品房销售；房屋维修、装修、装饰及物业管理；建筑建材、装璜材料的销售（依法须经批准的项目，经相关部门批准后方可开展经营活动)。",云南,文山,"云南省文山壮族苗族自治州砚山县江那镇通广路三星坝(东方永胜硅锰厂内)"
中国石油天然气股份有限公司云南曲靖销售分公司石英加油站,91530302563152040H,2010-10-12,N/A,N/A,"N/A","汽油、柴油、卷烟、预包装食品、汽车零配件、日用百货、农用物资（含化肥零售）的销售，汽车美容；房屋和机械设备的租赁；石油化工、化工产品（不含危险品）、文体用品、家用电器、电子产品、计生用品销售；彩票代理销售。（依法须经批准的项目，经相关部门批准后方可开展经营活动）",云南,曲靖,"云南省曲靖市麒麟区三宝镇温泉隽旗村"
富源县华清魔芋种植专业合作社,93530325577280721L,2010-10-12,N/A,N/A,"N/A","魔芋种植、初加工、销售；引进魔芋新品种、新技术；对成员开展魔芋技术培训指导和咨询服务；组织采购、供应成员所需的生产资料；组织开展魔芋产业及相关魔芋产品的收购、销售；农村经纪人业务（依法须经批准的项目，经相关部门批准后方可开展经营活动）",云南,曲靖,"云南省曲靖市富源县墨红镇三台村委会石岩塘村"
云南玉溪诚雪汽车销售服务有限公司,91530402563151654Y,2010-10-12,N/A,N/A,"800(万元人民币)","东风雪铁龙品牌汽车销售；一类汽车维修（小型车辆维修）；二手车交易；汽车租赁服务；汽车配件、汽车装饰用品的批发、零售；汽车装饰服务；代理人身意外险、家财险、企业财产险、机动车辆险；市场调研；市场营销策划；会展服务；商务信息、企业管理咨询服务。（依法须经批准的项目，经相关部门批准后方可开展经营活动）",云南,玉溪,"云南省玉溪市红塔区太极路中段(亚太国际汽车城)"
昆明妈姆食品有限公司,915301005631520597,2010-10-12,N/A,N/A,"60(万元人民币)","鸡精调味料（鸡精）、味精[味精（99%谷氨酸钠）（分装）]、调味料（固态调味料、半固态调味料）的生产及销售；代用茶、干果的分装及销售；预包装食品的批发兼零售；保健食品的销售；国内贸易（危险化学品及国家限定违禁管制品除外）（不得在经开区内从事本区产业政策中限制类、禁止类行业） （依法须经批准的项目，经相关部门批准后方可开展经营活动）",云南,昆明,"云南省昆明经开区阿拉乡高桥村126号"
腾冲清澜湾农业开发有限公司,91530522563158071C,2010-10-12,N/A,N/A,"50(万元人民币)","家禽养殖；住宿、餐饮服务；其他旅游景点开发建设管理；石灰石开采、加工、销售；沙子销售；铁、锰黑色金属收购、销售；铅、锌、铜、锡有色金属收购、销售；水电站筹建。（依法须经批准的项目，经相关部门批准后方可开展经营活动）",云南,保山,"云南省保山市腾冲市固东镇小甸第四组一号"
曲靖市亿农家园农资有限责任公司,91530302563153297Y,2010-10-12,N/A,N/A,"30(万元人民币)","农药、化肥、农膜、普通农业机械销售及维修服务；农业病虫害防护，农业技术服务，企业营销策划。（依法须经批准的项目，经相关部门批准后方可开展经营活动）",云南,曲靖,"云南省曲靖市春雷路下东关新村十栋132号"
云南吉盛祥茶业有限公司羊浦分公司,91530100MA6K6QD37E,2010-10-12,N/A,N/A,"N/A","茶叶（绿茶、红茶、黑茶、紧压茶）分装（依法须经批准的项目，经相关部门批准后方可开展经营活动）",云南,昆明,"昆明国家经济技术开发区羊浦村548号"
景洪瑞源商贸有限责任公司,91532800563165116R,2010-10-12,N/A,N/A,"10(万元人民币)","文化、体育、办公用品及设备销售，服装、床上用品、家具、日用百货、机电设备、家用电器、建筑材料、五金、交电、橡胶制品、汽车配件、农副产品、化工产品及原料（不含危险品）销售；种植；进出口贸易，技术进出口。（依法须经批准的项目，经相关部门批准后方可开展经营活动）",云南,西双版纳,"云南省西双版纳傣族自治州旅游度假区曼弄枫幼儿园"
云南普益物业管理有限责任公司建水分公司,91532524563155727H,2010-10-12,N/A,N/A,"N/A","住宅小区、组团楼宇的物业管理业务（依法须经批准的项目，经相关部门批准后方可开展经营活动）",云南,红河,"云南省红河州建水县临安镇育英路思源小区"
云南振华建筑建材有限责任公司,91530381709794602F,2010-10-12,N/A,N/A,"5186万元人民币","房屋建筑工程施工;路线管道、设备安装;房屋装饰装修;道路施工;土石方工程、市政工程、水利工程施工;建筑材料销售",云南,曲靖,"云南省曲靖市宣威市西宁街道翠西苑17-13号"
昆明味盟餐饮管理有限公司,91530112563152761K,2010-10-12,N/A,N/A,"10(万元人民币)","餐饮企业管理；餐饮服务（此项仅限分公司经营）。（依法须经批准的项目，经相关部门批准后方可开展经营活动）",云南,昆明,"昆明市西山区广福小区（一区）东区1幢1-802号"
曲靖市麒麟区春辉水泥制品厂,92530302MA6KH2DR8J,2010-10-12,个体,N/A,"N/A","水泥制品加工、生产销售。（以上经营范围涉及许可经营项目的，应在取得有关部门的许可后方可经营）",云南,曲靖,"麒麟区三宝街道三宝社区七队"
姚安县科旺葡萄种植专业合作社,93532325MA6MWT0NXE,2010-10-12,N/A,N/A,"10万人民币","一般经营项目:组织成员开展葡萄种植;对成员产品进行收购、销售;引进葡萄种植新技术、新品种;开展与葡萄种植有关的技术培训、技术交流和信息咨询服务。",云南,楚雄,"云南省楚雄彝族自治州姚安县栋川镇德丰路55号"
云龙县云山凤养殖专业合作社,935329295631513717,2010-10-12,N/A,N/A,"N/A","家禽、野鸡、中蜂养殖销售；农作物、核桃、中药材种植销售；组织收购、销售成员生产的农产品；开展成员所需的运输、贮存服务；开展技术培训、技术交流和咨询服务。（依法须经批准的项目，经相关部门批准后方可开展经营活动）",云南,大理,"云南省大理白族自治州云龙县团结乡团结村苗家寨村民小组"
昆明川贤快递有限公司世博园分公司,915301035631709358,2010-10-12,N/A,N/A,"N/A","快递服务（信件及信件性质的物品除外）（依法须经批准的项目，经相关部门批准后方可开展经营活动）",云南,昆明,"云南省昆明市盘龙区金菊路76号附16号"
昆明宗信科技有限公司,91530100563151187J,2010-10-12,N/A,N/A,"200(万元人民币)","计算机软硬件的开发、应用及技术咨询；计算机系统集成及综合布线；图文设计；仪器仪表、电子产品、普通机械及配件、计算机及配件、五金交电、办公设备、文化用品、装饰材料、钢材、办公用品、办公家具销售；工业控制系统、安全防护及监控设备设计、安装、调试；机电设备工程设计与施工；国内贸易、物资供销（危险化学品、涉氨制冷业及国家限定违禁管制品除外）（不得在经开区内从事本区产业政策中限制类、禁止类行业）（依法须经批准的项目，经相关部门批准后方可开展经营活动）",云南,昆明,"昆明经开区出口加工区丹槿园小区南侧一期3栋16号"
丽江市宁蒗女儿国汽车租赁有限公司,91530724563151742Q,2010-10-12,N/A,N/A,"30(万元人民币)","汽车租赁服务",云南,丽江,"宁蒗县大兴镇"
昆明华信建筑劳务有限公司,91530111563151881M,2010-10-12,N/A,N/A,"50(万元人民币)","建筑劳务分包；劳务派遣",云南,昆明,"昆明市官渡区关雨路延长线东聚五金机电精品市场C区5号商铺"
富源县金晔农民专业合作社,935303255823547210,2010-10-12,N/A,N/A,"N/A","魔芋种植、初加工、销售；引进魔芋新品种、新技术；对成员开展魔芋技术培训指导和咨询服务；组织采购、供应成员所需的生产资料；组织开展魔芋产业及相关魔芋产品的收购、销售；中药材种植、初加工、销售；苗圃培育、林下种植；鸡、鸭、鱼、牛、羊饲养销售；农村经纪人业务（依法须经批准的项目，经相关部门批准后方可开展经营活动）",云南,曲靖,"云南省曲靖市富源县墨红镇清水村委会百草地林场"
云南广渡贸易有限公司,91530111563151929X,2010-10-12,N/A,N/A,"100(万元人民币)","国内贸易、物资供销（依法须经批准的项目，经相关部门批准后方可开展经营活动）",云南,昆明,"云南省昆明市官渡区昆明螺蛳湾国际商贸城二期5幢1210号"
曲靖市麒麟区得金煤业有限公司,915303025631546791,2010-10-12,N/A,N/A,"500(万元人民币)","煤炭零售经营；机电产品、矿山机械设备、电子设备、金属制品、钢材、型材、五金交电、日用百货、矿产品、生铁、农用机械、化肥、农用物资、汽车及汽车配件销售。（依法须经批准的项目，经相关部门批准后方可开展经营活动）",云南,曲靖,"云南省曲靖市南宁西路金穗花园14幢4楼2号"
重庆华地工程勘察设计院云南分公司,91530100563157466R,2010-10-12,N/A,N/A,"N/A","工程勘察、工程设计、地质灾害治理工程施工、工程咨询根据资质证核定的范围和时限开展经营活动（依法须经批准的项目，经相关部门批准后方可开展经营活动）",云南,昆明,"昆明市经开区顺通大道第三城映象欣城C区C4幢8层808号"
玉龙县宏升种养殖专业合作社,93530721563156949C,2010-10-12,N/A,N/A,"N/A","农作物、经济作物、林果的种植、加工、销售；家禽、家畜的养殖、销售。（依法须经批准的项目，经相关部门批准后方可开展经营活动）",云南,丽江,"玉龙县宝山乡果乐村黄土坡二组52号"
云南中雄国畅电子工程有限公司,91530103563152032T,2010-10-12,N/A,N/A,"100(万元人民币)","计算机软硬件的开发及应用，网络工程的开发、计算机系统集成；信息技术咨询服务；安全防范工程、弱电工程、建筑智能化工程的设计及施工；灯光亮化工程、音乐喷泉工程；消防器材、电子产品、文具用品、日用百货、节能产品的销售（依法须经批准的项目，经相关部门批准后方可开展经营活动）",云南,昆明,"云南省昆明市盘龙区北京路金星立交桥时尚家园A幢3205室"
丘北县八道哨赛白玉双飞粉加工厂,92532626MA6KEPWUXC,2010-10-12,个体工商户,N/A,"N/A","双飞粉、腻子粉加工销售。（依法须经批准的项目，经相关部门批准后方可开展经营活动）",云南,文山,"丘北县八道哨乡响水村"
楚雄申通快递有限公司大姚县分公司,915323265631794624,2010-10-12,N/A,N/A,"N/A","国内快递服务（邮政企业专营业务除外）（依法须经批准的项目，经相关部门批准后方可开展经营活动）。",云南,楚雄,"云南省楚雄彝族自治州大姚县金碧镇金碧路(春溪巷20号)"
大理新储物流园有限公司,9153290056315285XL,2010-10-12,N/A,N/A,"10,000(万元人民币)","物资中转运输、仓储保管、配送；搬运装卸；货运代理；流通加工；物流方案设计与策划；提供有关物流的技术服务和信息服务；道路货物运输（冷藏保鲜设备）；包装服务；钢材、化肥、粮油、酒、预包装食品、汽车配件、建材、石油沥青的批发、零售；道路普通货物运输；劳务派遣。（依法须经批准的项目，经相关部门批准后方可开展经营活动）",云南,大理,"大理白族自治州大理市凤仪镇兴凤路7号"
昆明卓厚科技有限公司,91530103563151339A,2010-10-12,N/A,N/A,"50(万元人民币)","水泵及配件、电机、阀门、控制柜、轴承、电气机械及器材、五金交电、矿山机械设备、普通机械及配件、装饰材料、矿产品、电子产品、仪器仪表、电线电缆的销售；水泵、电机安装及修理（依法须经批准的项目，经相关部门批准后方可开展经营活动）",云南,昆明,"云南省昆明市盘龙区金辰街道办事处羊肠小村46栋1号附1号"
宣威市革香河林业开发有限责任公司,91530381563151443P,2010-10-12,N/A,N/A,"10(万)","苗木培育、经济林木栽培。",云南,曲靖,"云南省曲靖市宣威市田坝镇红岩村委会"
昆明滇龙建筑劳务有限公司,91530111563151507Y,2010-10-12,N/A,N/A,"500(万元人民币)","建筑劳务分包；劳务派遣；社会经济信息咨询（依法须经批准的项目，经相关部门批准后方可开展经营活动）",云南,昆明,"昆明市官渡区银海花园北区八幢一单元三层B号房"
安宁鼎达经贸有限公司,91530181563151785Q,2010-10-12,N/A,N/A,"120(万)","五金、建材的销售；物业修缮、租赁服务。",云南,昆明,"安宁市太平镇桥头社区居委会"
大姚齐和牧业开发有限公司,91532326563152382E,2010-10-12,N/A,N/A,"300(万元人民币)","肉牛综合养殖；正餐服务；畜禽屠宰加工销售；肉类加工、冷藏、储运、批发、零售。（依法须经批准的项目，经相关部门批准后方可开展经营活动）",云南,楚雄,"云南省楚雄彝族自治州大姚县金碧镇金龙路（南塔路与金龙路交汇处）和伟才私宅六楼601室"
昆明宁尚商贸有限公司,915301025631515661,2010-10-12,N/A,N/A,"300(万元人民币)","国内贸易、物资供销（依法须经批准的项目，经相关部门批准后方可开展经营活动）",云南,昆明,"云南省昆明市五华区一二一大街116号云南大学劳动服务公司东一院后院15号房（二楼）"
昆明优狐广告有限公司,915301035631538799,2010-10-12,N/A,N/A,"3(万元人民币)","广告设计、广告策划、公关策划、影视策划及新媒体策划；代理国内各类广告；电子商务；国内贸易，物资供销（依法须经批准的项目，经相关部门批准后方可开展经营活动）",云南,昆明,"云南省昆明市盘龙区穿金路完家山金林碧水住宅小区G19栋6-7层601室"
宣威市瑞峰恒运输有限公司,91530381563152235Q,2010-10-12,N/A,N/A,"408(万元人民币)","普通货物运输。",云南,曲靖,"云南省曲靖市宣威市环城东路"
云南云上四季酒店管理有限公司景星店,91530102563157175K,2010-10-12,N/A,N/A,"N/A","住宿；日用百货的销售（依法须经批准的项目，经相关部门批准后方可开展经营活动）",云南,昆明,"云南省昆明市五华区市府东街15-16号2-7楼"
云南恒弘会计师事务所有限公司,91530103563153916F,2010-10-12,N/A,N/A,"100(万元人民币)","审查企业会计报表、出具审计报告；验证企业资本、出具验资报告；办理企业合并、分立、清算事宜中的审计业务、出具有关报告；基本建设年度财务决算审计；代理计帐；会计咨询、税务咨询、管理咨询、会计培训（依法须经批准的项目，经相关部门批准后方可开展经营活动）",云南,昆明,"云南省昆明市盘龙区金星小区金星广场A幢写字楼1-22轴二层附1号"
昆明攀腾轻钢活动房销售有限公司,9153010056315189XF,2010-10-12,N/A,N/A,"100(万元人民币)","轻钢活动房的安装及销售；金属材料、装饰材料、建筑材料、五金交电、普通机械的销售（依法须经批准的项目，经相关部门批准后方可开展经营活动）",云南,昆明,"云南省昆明经济技术开发区信息产业基地春漫大道80号云南海归创业园2幢2楼02296号"
丘北县新龙电脑有限公司,91532626563154417A,2010-10-12,N/A,N/A,"10(万元人民币)","计算机系统集成、应用及技术咨询服务；计算机软硬件及配件、图文设计制作、网页设计、多媒体设备、会议系统、网络设备及综合布线、安全技术防范工程、舞台灯光音响工程、电子产品、文具用品、办公设备、办公耗材销售、租赁及维修（依法须经批准的项目，经相关部门批准后方可开展经营活动）",云南,文山,"丘北县锦屏镇重阳街"
云南曲靖交通集团有限公司罗平东盛汽车修理厂,91530324563160753Q,2010-10-12,N/A,N/A,"N/A","汽车维护、汽车小修、专项修理、汽车装饰；汽车配件、润滑油零售。",云南,曲靖,"罗平县罗雄镇云贵路156号"
永德县农资有限责任公司城北化肥门市部,91530923MA6MYXFX9H,2010-10-12,N/A,N/A,"N/A","化肥、农药、农膜、农具（零售）。（依法须经批准的项目，经相关部门批准后方可开展经营活动）",云南,临沧,"云南省临沧市永德县德党镇德党街"
曲靖容大纸业有限公司,91530300563152892D,2010-10-12,N/A,N/A,"1,500(万元人民币)","麻纺织品、木包装箱、纸制品、贴花纸、纸箱包装的生产销售；非生产性废旧物资收购销售。（依法须经批准的项目，经相关部门批准后方可开展经营活动）",云南,曲靖,"云南省曲靖市麒麟区建宁街道麻黄社区竹鹰村"
曲靖市立禾商贸有限公司,91530302563154898B,2010-10-12,N/A,N/A,"200(万元人民币)","家电、五金、百货、纺织品、厨房用具、监控产品、化工产品（不含危险化学品）销售。",云南,曲靖,"云南省曲靖市麒麟区交通路189号16-9商铺"
北京中寰工程项目管理有限公司云南分公司,91530100563152905Q,2010-10-13,N/A,N/A,"N/A","接受委托从事工程项目管理；工程咨询；工程监理；招标代理；工程设计、技术开发、技术转让；经济信息咨询；；建筑材料、装饰材料、机械设备、电子产品、仪器仪表、五金交电的销售；施工总承包（依法须经批准的项目，经相关部门批准后方可开展经营活动）",云南,昆明,"云南省昆明市五华区新闻路337号报业尚都商务楼1幢11层1106室"
昆明南燕商贸有限公司,9153010356315357X6,2010-10-13,N/A,N/A,"300(万元人民币)","国内贸易、物资供销；计算机及配件、办公设备的维修；计算机系统集成及综合布线（依法须经批准的项目，经相关部门批准后方可开展经营活动）",云南,昆明,"云南省昆明市盘龙区东华新迎社区景星花园一期3幢1单元3层301号"
昆明璞沛商贸有限公司,915301125631560844,2010-10-13,N/A,N/A,"3(万元人民币)","预包装食品的销售（按《食品流通许可证》核定的范围及时限开展经营活动）；国内贸易、物资供销。（依法须经批准的项目，经相关部门批准后方可开展经营活动）",云南,昆明,"云南省昆明市西山区秋苑二期2组团26幢第一层13-14号"
云南乾龙桥国际物流有限公司,91530100563152550P,2010-10-13,N/A,N/A,"500(万元人民币)","物流方案的设计与策划；货运代理；货运配载；货运信息；货物及技术进出口（依法须经批准的项目，经相关部门批准后方可开展经营活动）",云南,昆明,"云南省昆明经开区云大西路新广丰食品物流中心A区2幢第10层A2-1010号"
开远市欢乐佳园装饰工程有限公司蒙自分公司,915325225662109474,2010-10-13,N/A,N/A,"N/A","室内装饰工程、园林绿化工程设计与施工；建筑材料、装饰材料销售（依法须经批准的项目，经相关部门批准后方可开展经营活动）",云南,红河,"蒙自市天马路与文萃路交叉口(豪风电子商务楼四层南侧)"
普洱顺通快递有限公司孟连分公司,91530827563159605J,2010-10-13,N/A,N/A,"N/A","物品寄递服务（邮政专递除外）。（依法须经批准的项目，经相关部门批准后方可开展经营活动）",云南,普洱,"云南省普洱市孟连县盛世嘉园3幢107-108号"
师宗县利源商贸有限公司,915303235631531901,2010-10-13,N/A,N/A,"50(万元人民币)","百货批发、零售，建筑建材、矿山物资、矿山机电设备、非金属矿产品销售（不含前置许可经营项目）（依法须经批准的项目，经相关部门批准后方可开展经营活动）",云南,曲靖,"师宗县漾月街道丹凤东路253-26号"
云南师宗农资有限责任公司高良第三农药门市部,91530323MA6KTPFR9Y,2010-10-13,N/A,N/A,"N/A","农药代销及经纪业务（依法须经批准的项目，经相关部门批准后方可开展经营活动）",云南,曲靖,"云南省曲靖市师宗县高良乡设里街"
云南丰泰经贸有限公司第十八经营部,91530000563156965N,2010-10-13,N/A,N/A,"N/A","卷烟，雪茄烟、办公用品，文化用品，日用百货；预包装食品的零售。（依法须经批准的项目，经相关部门批准后方可开展经营活动）",云南,昆明,"云南省昆明市滇池路大坝社区郑家河居民小组金岸春天3幢1层商铺6号"
云南师宗农资有限责任公司五龙农药第三门市部,91530323MA6L2HQQ2Q,2010-10-13,N/A,N/A,"N/A","农药代销及经纪业务（依法须经批准的项目，经相关部门批准后方可开展经营活动）",云南,曲靖,"云南省曲靖市师宗县五龙乡狗街村"
