云南朗悦科技有限公司,91530100557774900D,2010-07-09,N/A,N/A,"200(万元人民币)","节能环保设备的改造设计、技术开发、技术服务；环保工程设计与施工；节能设备、工业自动化控制系统、环保设备的研发、维修；再生资源技术的研究及开发；经济信息咨询；国内贸易、物资供销（依法须经批准的项目，经相关部门批准后方可开展经营活动）",云南,昆明,"云南省昆明经开区E16号地块佳逸盛景花园一期Ⅰ区57幢"
广南县坝美兴丰供销有限公司石山农药门市部,91532627MA6K70YW2A,2010-07-13,N/A,N/A,"N/A","农药（不含危险化学品）、化肥、农膜、农用器械零售（依法须经批准的项目，经相关部门批准后方可开展经营活动）",云南,文山,"广南县坝美镇石山农场"
保山双友尾矿回收有限公司,9153050055777939X7,2010-07-13,N/A,N/A,"1,000(万元人民币)","金属矿渣回收利用（筹建）；金属矿收购、销售。",云南,保山,"云南省保山市隆阳区蒲缥镇塘子沟村(水长工业园区)"
安宁腾阳经贸有限责任公司,91530181557782775C,2010-07-13,N/A,N/A,"3(万元人民币)","预包装食品、冷冻（藏）食品、水产品、蔬菜、服装、鞋、日用百货的销售（依法须经批准的项目，经相关部门批准后方可开展经营活动）",云南,昆明,"安宁市湖滨小区1幢1单元402室"
云南道义建筑工程有限公司,915301255577773270,2010-07-13,N/A,N/A,"2,000(万元人民币)","房屋工程建筑；园林绿化工程施工；桥涵道路工程施工；土石方工程施工；房屋装饰装修；钢门窗制作；五金建材销售（依法须经批准的项目，经相关部门批准后方可开展经营活动）",云南,昆明,"昆明市宜良县匡远镇花园街东路7号附6号"
保山九思食品有限公司,91530502557787445K,2010-07-13,N/A,N/A,"3(万元人民币)","预包装、散装食品，化妆品、保健品的批发与零售；中药材的种植、收购、初加工与销售。（依法须经批准的项目，经相关部门批准后方可开展经营活动）",云南,保山,"云南省保山市隆阳区兰城街道隆阳路（南三环以北）"
广南县坝美兴丰供销有限公司底圩农药第三门市部,91532627MA6K70CG1L,2010-07-13,N/A,N/A,"N/A","农药（不含危险化学品）、化肥、农膜、农用器械零售（依法须经批准的项目，经相关部门批准后方可开展经营活动）",云南,文山,"广南县底圩乡底圩街上"
云南翠洲装饰设计工程有限公司,915301005577785734,2010-07-13,N/A,N/A,"100(万元人民币)","室内装饰工程的设计与施工；建筑材料、五金交电、普通机械及配件、电子产品、通信设备、日用百货的销售（依法须经批准的项目，经相关部门批准后方可开展经营活动）",云南,昆明,"云南省昆明市高新区康宏小区29幢3单元601号"
华坪县浩瀚煤业有限责任公司,91530723557777650G,2010-07-13,N/A,N/A,"1,000(万元人民币)","煤炭开采、销售；煤炭洗选、销售；煤炭购销；电器设备、五金交电、日用百货、劳保用品、矿山机械、汽车配件、建筑材料销售。（依法须经批准的项目，经相关部门批准后方可开展经营活动）",云南,丽江,"云南省丽江市华坪县中心镇柳溪社区一组"
大理李四海百货有限公司,91532901557780227Q,2010-07-13,N/A,N/A,"1,230(万元人民币)","服装服饰、鞋帽、棉纺织品、皮革制品、家具护理用品、劳保防护用品、办公用品、工艺品、床上用品、五金交电、日用百货（含磷洗涤用品除外）、针纺织品、家用电器的批发零售。（依法须经批准的项目，经相关部门批准后方可开展经营活动）",云南,大理,"云南省大理白族自治州大理市下关苍山路17号"
昆明同大汽车销售有限公司,915301005577789360,2010-07-13,N/A,N/A,"300(万元人民币)","货车、普通机械及配件、建筑材料、五金交电的销售（依法须经批准的项目，经相关部门批准后方可开展经营活动）",云南,昆明,"云南省昆明经开区阿拉街道办事处普照汽车市场9号"
云南鑫盛园餐饮有限公司,91530121557779824P,2010-07-13,N/A,N/A,"100(万元人民币)","餐饮管理；会议服务。（依法须经批准的项目，经相关部门批准后方可开展经营活动）",云南,昆明,"云南省昆明市呈贡区兴呈路斗南路口"
昆明昊坤混凝土制造有限公司,915301125577789447,2010-07-13,N/A,N/A,"1,000(万元人民币)","混凝土的生产及销售；建筑材料、装饰材料、普通机械的销售；货运代理、货运信息。（依法须经批准的项目，经相关部门批准后方可开展经营活动）",云南,昆明,"云南省昆明市西山区春雨路1356号原昆明水泥厂老矿山足球场"
云南赛诺联行房地产经纪有限公司,915301035577781270,2010-07-13,N/A,N/A,"100(万元人民币)","房地产经纪、营销策划及信息咨询（依法须经批准的项目，经相关部门批准后方可开展经营活动）",云南,昆明,"云南省昆明市盘龙区穿金路764号云南映象小区40幢1单元2层202号"
昆明丰牧动物食品科技研发有限公司,915301025577842878,2010-07-13,N/A,N/A,"10(万元人民币)","按照《资质认定计量认证证书》批准的产品类别开展经营活动；饲料、饲料添加剂、添加剂混合饲料、畜产品的技术研发及销售；农业科技研究及技术咨询；仪器仪表、实验室仪器设备、玻璃制品、塑料制品（一次性购物塑料袋除外）的销售（依法须经批准的项目，经相关部门批准后方可开展经营活动）",云南,昆明,"云南省昆明市盘龙区北京路898号颐高数码中心(二期)综合楼B座14楼A室"
巍山县巍宝山生态果园植保专业合作社,93532927054667847H,2010-07-13,N/A,N/A,"N/A","组织提供成员所需的农业生产资料；开展相关的技术培训、技术交流和信息咨询服务；植保机务联防，农林产品的种植和销售，林下生猪养殖及销售。（依法须经批准的项目，经相关部门批准后方可开展经营活动）",云南,大理,"巍山县南诏镇巍宝山境区停车场旁"
昆明悠游旅行社有限公司,915301115577862235,2010-07-13,N/A,N/A,"50(万元人民币)","国内旅游业务、入境旅游业务（依法须经批准的项目，经相关部门批准后方可开展经营活动）",云南,昆明,"云南省昆明市官渡区春城路银海领域小区3幢2单元102室"
云南谐泰电子科技有限公司,91530103557778557R,2010-07-13,N/A,N/A,"500(万元人民币)","电子产品技术研究及开发；电子产品、电梯、照明器材、建筑材料、装饰材料、金属材料的销售；安全技术防范工程的设计与施工（依法须经批准的项目，经相关部门批准后方可开展经营活动）",云南,昆明,"云南省昆明市盘龙区大树营市政小区C组团10-2号405室"
北京亿邦联合广告有限公司陆良县分公司,915303225577998178,2010-07-13,N/A,N/A,"N/A","设计、制作、代理、发布国内及外商来华广告。（依法须经批准的项目，经相关部门批准后方可开展经营活动）",云南,曲靖,"云南省陆良县千佛商业城1-5号"
云南万昌装饰设计工程有限公司,9153011255777816X9,2010-07-13,N/A,N/A,"100(万元人民币)","室内外装修装饰工程（按《资质证》核定的范围和时限开展经营活动）；企业形象设计、计算机图文设计；广告的设计、制作、代理及发布；工艺美术品、装饰材料、建筑材料、金属材料、五金交电、塑料制品（除一次性塑料购物袋）、灯具、窗帘、家具、办公用品、日用百货的销售。",云南,昆明,"云南省昆明市西山区前兴路大商汇商贸中心89幢第6层607号"
广南县坝美兴丰供销有限公司底圩农药四门市,91532627MA6K710D3T,2010-07-13,N/A,N/A,"N/A","农药（不含危险化学品）、化肥、农膜、农用器械零售（依法须经批准的项目，经相关部门批准后方可开展经营活动）",云南,文山,"广南县底圩乡底圩街上"
昆明丹木办公家具有限公司,915301005577784690,2010-07-13,N/A,N/A,"100(万元人民币)","家具、日用百货、电子产品的销售；经济信息咨询（依法须经批准的项目，经相关部门批准后方可开展经营活动）",云南,昆明,"云南省昆明经开区经开路3号时代创富中心D幢6层6-5室"
昆明度假区云合纸制品印刷厂,92530100MA6L4U7L7K,2010-07-13,个体工商户,N/A,"N/A","纸袋、档案盒的印刷",云南,昆明,"昆明市度假区金家社区小赵家村9号"
昆明午辰经贸有限公司,915301035577781008,2010-07-13,N/A,N/A,"100(万元人民币)","国内贸易、物资供销（依法须经批准的项目，经相关部门批准后方可开展经营活动）",云南,昆明,"云南省昆明市盘龙区环城北路250号小城故事B座1-919号"
昆明亿皇缘经贸有限公司,915301025577810864,2010-07-13,N/A,N/A,"100(万元人民币)","国内贸易、物资供销；经济信息咨询；旅游信息咨询；商务信息咨询；房地产经纪业务；代订客房、门票、机票、火车票及订餐服务；汽车租赁；工商事务代理；代理记账；企业管理；网页设计；承办会议及商品展览展示活动（依法须经批准的项目，经相关部门批准后方可开展经营活动）",云南,昆明,"云南省昆明市五华区新闻路337号报业尚都商务楼1幢3层314室"
北京中公教育科技股份有限公司曲靖分公司,91530302557779779G,2010-07-13,N/A,N/A,"N/A","教育信息咨询。",云南,曲靖,"云南省曲靖市麒麟南路中天嘉园F栋1楼"
广南县坝美兴丰供销有限公司普盆农药第二门市,91532627MA6K70CJ66,2010-07-13,N/A,N/A,"N/A","农药（不含危险化学品）、化肥、农膜、农用器械零售（依法须经批准的项目，经相关部门批准后方可开展经营活动）",云南,文山,"广南县底圩乡普盆街上"
德宏中机汽车销售服务有限公司,915331005577790822,2010-07-13,N/A,N/A,"1,000(万元人民币)","汽车、机电产品及备品配件、塑料制品、化工产品（不含化学危险品）销售；汽车装饰美容；代理机动车辆险、企业财产险、人身意外险；汽车维修；汽车信息咨询服务。（依法须经批准的项目，经相关部门批准后方可开展经营活动）",云南,德宏,"云南省德宏州芒市机场大道东侧后谷庄园旁"
峨山县大龙潭乡绿丰植保专业合作社,935304265631611071,2010-07-13,N/A,N/A,"N/A","农作物病虫害专业化统防统治；组织采购成员所需的化肥、农药、农膜、农用器械；引进新品种、新技术；开展与成员生产经营有关的技术培训、技术交流及信息咨询服务。（依法须经批准的项目，经相关部门批准后方可开展经营活动）",云南,玉溪,"峨山县大龙潭乡大龙潭街"
云南孔孔文化传播有限公司,91530100557778178W,2010-07-13,N/A,N/A,"100(万元人民币)","设计、制作、代理发布国内各类广告；组织文化艺术交流活动（演出除外）；承办会议及商品展览展示活动；企业营销策划；计算机软硬件的开发、应用及技术服务；音乐创作商品包装装璜设计；文化用品、工艺美术品、广告材料、灯具的销售；音乐制作；教育信息咨询；摄影服务（依法须经批准的项目，经相关部门批准后方可开展经营活动）",云南,昆明,"昆明市滇池路听涛雅苑小区域紫薇苑11单元305号"
云南美铭装饰工程有限公司,91530103557778661X,2010-07-13,N/A,N/A,"100(万元人民币)","室内装饰工程的设计及施工根据资质证核定的范围和时限开展经营活动（依法须经批准的项目，经相关部门批准后方可开展经营活动）",云南,昆明,"昆明市盘龙区金江小区D29幢6-7号商铺"
云南鑫磊地坪材料科技有限公司,91530100557777810E,2010-07-13,N/A,N/A,"1,000(万元人民币)","建筑材料、装饰材料、五金交电、普通机械、电线电缆、水暖器材的销售；计算机系统集成及综合布线；室内外装饰工程、市政公用工程、路面路基工程、园林绿化工程的设计与施工",云南,昆明,"云南省昆明经开区信息产业基地13#2号云南海归创业园4栋6楼670-3号"
昆明普石文化传播有限公司,91530103557778047C,2010-07-13,N/A,N/A,"50(万元人民币)","组织文化艺术交流活动（演出除外）、承办会议及商品展览展示活动，设计、制作、发布、代理国内各类广告，网页设计、鲜花礼仪庆典服务、企业营销策划、企业管理咨询；工艺美术品、办公用品、体育用品、日用百货的销售（依法须经批准的项目，经相关部门批准后方可开展经营活动）",云南,昆明,"云南省昆明市盘龙区白塔路北延线86街公寓U2第3幢806号"
昆明天宝兴盛资产管理有限公司金色维也纳分公司,91530100557784682J,2010-07-13,N/A,N/A,"N/A","对承接楼盘提供物业管理、物业咨询、物业顾问、物业管理策划、清洁保洁服务、绿化服务、房屋修缮及管理、房屋租售代理、水电气费用代收等各项服务（依法须经批准的项目，经相关部门批准后方可开展经营活动）",云南,昆明,"云南省昆明市五华区银河大道151号金色维也纳花园B幢104号"
云南固越建材有限公司,91530100557778354R,2010-07-13,N/A,N/A,"108(万)","建筑材料、装饰材料、防水材料、卫生洁具、五金交电、水暖器材的销售",云南,昆明,"云南省昆明经开区信息产业基地云南海归创业园4栋676-10号"
昆明农盛食品有限公司,91530102557778549G,2010-07-13,N/A,N/A,"50(万元人民币)","按《全国工业产品生产许可证》核准的经营范围和时限开展经营活动（依法须经批准的项目，经相关部门批准后方可开展经营活动）",云南,昆明,"云南省昆明市五华区沙朗白族乡桃园大村（普桃公路）"
云南锦鹏装饰工程有限公司,915301005577777738,2010-07-13,N/A,N/A,"500(万元人民币)","室内外装饰工程、金属门窗工程、建筑幕墙工程、园林绿化工程（依法须经批准的项目，经相关部门批准后方可开展经营活动）",云南,昆明,"云南省昆明市经济技术开发区信息产业基地春漫大道80号云南海归创业园2幢4楼04383号"
云南胜捷消防设备有限公司,9153011155777859XL,2010-07-13,N/A,N/A,"100(万元人民币)","消防设备及器材、普通机械及配件、五金交电的销售（依法须经批准的项目，经相关部门批准后方可开展经营活动）",云南,昆明,"云南省昆明市官渡区昌宏路华丰国际商贸城D5幢24号"
云南优耐特电子科技有限公司,91530100557778493G,2010-07-13,N/A,N/A,"100(万元人民币)","计算机软硬件的开发及应用；计算机系统集成及综合布线；电器机械及器材、仪器仪表、电子产品、计算机及配件、矿产品、日用百货、建筑材料、五金交电的销售（依法须经批准的项目，经相关部门批准后方可开展经营活动）",云南,昆明,"云南省昆明经开区信息产业基地春漫大道80号云南海归创业园2栋13楼13294号"
云南昆洁物业管理有限公司,915301115577783382,2010-07-13,N/A,N/A,"100(万元人民币)","物业管理；家政服务；保洁服务；组织文艺化艺术交流活动（演出除外）；承办会议及商品展览展示活动；社会经济信息咨询（依法须经批准的项目，经相关部门批准后方可开展经营活动）",云南,昆明,"昆明市官渡区昆铁怡园小区二期907幢5单元7楼701号"
广南县坝美兴丰供销有限公司普盆第一农药门市部,91532627MA6K70D66F,2010-07-13,N/A,N/A,"N/A","农药（不含危险化学品）、化肥、农膜、农用器械零售（依法须经批准的项目，经相关部门批准后方可开展经营活动）",云南,文山,"广南县底圩乡普盆街上"
昆明全一快递服务有限公司迪庆分公司,91533400091306960G,2010-07-13,N/A,N/A,"N/A","货物快递服务（信件和其他具有信件性质的物品除外）；国内贸易、物资供销",云南,迪庆,"香格里拉城阳塘路北侧桐馨苑小区3栋"
昆明灿邦医疗器械有限公司,91530112557778397K,2010-07-13,N/A,N/A,"2,300(万元人民币)","医疗器械的销售(按《医疗器械经营企业许可证》核定的范围及时限开展经营活动）（依法须经批准的项目，经相关部门批准后方可开展经营活动）",云南,昆明,"云南省昆明市西山区兴苑路光华花园二期13号商铺"
巍山县三台山果园植保专业合作社,935329275688333202,2010-07-13,N/A,N/A,"N/A","组织提供成员所需的农业生产资料；开展相关的技术培训、技术交流和信息咨询服务；植保机务联防，农产品的种植、销售。",云南,大理,"巍山县永建镇小围埂村委会三台山"
宣威市泵阀经贸有限公司,915303815577798164,2010-07-13,N/A,N/A,"100(万)","机电产品、五金交电、建筑材料购销。",云南,曲靖,"云南省曲靖市宣威市龙堡西路140号"
昆明普悦咨询有限公司,91530100557760664A,2010-07-13,N/A,N/A,"5(万美元)","提供翻译、贸易、计算机、国际经济、环保、人力资源、投资、商务信息及语言的咨询服务。（依法须经批准的项目，经相关部门批准后方可开展经营活动）",云南,昆明,"云南省昆明市五华区龙泉路岗头村荷塘月色8幢4单元2层201号B室"
云南南方机电设备有限公司普洱分公司,915308025577950318,2010-07-13,N/A,N/A,"N/A","普通机械配件、机电产品、五金、交电、仪器仪表销售。（依法须经批准的项目，经相关部门批准后方可开展经营活动）",云南,普洱,"普洱市思茅区龙生路14号1幢1-3层"
云南五湖建设工程有限公司,915301225577796489,2010-07-14,N/A,N/A,"2,000(万元人民币)","园林绿化工程设计与施工；公路工程、水利工程、桥梁工程、市政公用工程施工总承包。（依法须经批准的项目，经相关部门批准后方可开展经营活动）",云南,昆明,"云南省昆明市晋宁区二街镇栗庙村委会栗庙村156号"
云南东骏药业有限公司东骏大药房外滩路连锁店,91532621557784973M,2010-07-14,N/A,N/A,"N/A","药品（按《药品经营许可证》核准的业务范围开展经营活动）、医疗器械（按《医疗器械经营许可证》核准的业务范围开展经营活动）、眼镜、食品、消毒产品、消毒剂器械、卫生用品、百货、日用化妆品、洗涤用品、纺织品、服装饰品、玩具销售；验配眼镜（依法须经批准的项目，经相关部门批准后方可开展经营活动）。",云南,文山,"云南省文山壮族苗族自治州文山市开化街道永通社区外滩路10号"
云南住友科技有限责任公司,91530112557782505U,2010-07-14,N/A,N/A,"100(万元人民币)","塑料、高分子材料、橡胶材料的研发、推广及销售（按西山区安监局核定的42个不属于危化品品种经营）；化肥、农药、矿产品的销售；农业技术咨询服务；仓储理货；货物及技术进出口业务；压缩气体和液化气体，易燃液体，易燃固体、自燃物品和遇湿易燃物品，腐蚀品、化肥、农药、矿产品、计算机及配件的销售；计算机软硬件的开发、应用及技术服务；通信终端设备维修技术服务（依法须经批准的项目，经相关部门批准后方可开展经营活动）",云南,昆明,"云南省昆明市西山区世纪半岛小区V期一组团2幢3单元303号"
云南仁品生物科技有限公司,91530000557781836A,2010-07-14,N/A,N/A,"1,000(万元人民币)","生物技术研发，食品、保健品及植物提取物的研究，生产工艺技术研究开发，生产装置研发、设计、制造、销售；全套生产线及公用配套系统的设计、制造、安装、调试（工厂项目咨询、方案设计、项目受理），工程项目管理及咨询，专利技术开发转让，技术成果产业化；机械设备及相关技术的进出口业务；机电设备销售。（依法须经批准的项目，经相关部门批准后方可开展经营活动）",云南,昆明,"云南省昆明市世博生态社区临山邻里1幢1层商铺5-3室"
中国铁通集团有限公司红河分公司绿春经营部,915325315662367412,2010-07-14,N/A,N/A,"N/A","国内长途电话；本地电话；传真、电报业务；公共数据传送业务；网络资源出租业务；互联网接入服务（ISP）：互联网信息服务（ICP）等经国家电信主管部门批准的电信业务，电子产品及通信设备；办公机械批发零售；电子计算机技术服务及通信相关的经营业务；无线寻呼业务）（依法须经批准的项目，经相关部门批准后方可开展经营活动）",云南,红河,"云南移动通信有限责任公司绿春分公司(县城中段街心花园一号商住楼)"
云南鸿翔一心堂药业(集团)股份有限公司昆明日新小区连锁店,91530000557784252K,2010-07-15,N/A,N/A,"N/A","中成药、抗生素、化学药制剂、生化药品、生物制品（除疫苗）、生物制品（除血液药品）；I、II、III类医疗器械（凭许可证经营）；消毒剂、消毒器械、一次性使用医疗用品和卫生用品；预包装食品、乳制品（含婴幼儿配方乳粉）的零售；通讯产品配件、充值卡、续费卡；日用百货、化妆品的零售。保健食品；受委托代收费；眼镜的销售；验配眼镜；",云南,昆明,"云南省昆明市日新小区商网6号"
勐海县广进农资有限责任公司,91532822557790302W,2010-07-15,N/A,N/A,"30(万元人民币)","杀虫剂、杀菌剂、除草剂、植物生长调节剂；化肥、农膜、农业机械及零配件销售；委托销售不再分装的包装种子。（依法须经批准的项目，经相关部门批准后方可开展经营活动）",云南,西双版纳,"勐海县宏福集贸市场南棚1-3号"
云南中天电缆有限公司,915340015577808767,2010-07-15,N/A,N/A,"100(万元人民币)","电缆的加工；电线电缆、五金交电、普通机械设备、建筑材料、装饰材料的销售。（依法须经批准的项目，经相关部门批准后方可开展经营活动）",云南,昆明,"昆明市大板桥街道办事处长水社区长坡村老320国道旁141号"
保山惠泽文化传媒有限公司,915305025577838828,2010-07-15,N/A,N/A,"500(万元人民币)","设计、制作（不含金属类广告牌）、发布、代理国内各类广告业务；钢结构工程施工；计算机、软件及辅助设备，电子产品，办公用品的批发和零售；企业形象策划，商标代理，智能化安装工程，会议及展览，公司礼仪，信息技术咨询的服务；软件开发；网上贸易代理。（依法须经批准的项目，经相关部门批准后方可开展经营活动）",云南,保山,"云南省保山市隆阳区永昌街道正阳北路保山义乌国际商贸城一期主体市场3层A区A5-5108号"
云南兵伟贸易有限公司,915301005577810274,2010-07-15,N/A,N/A,"100(万元人民币)","国内贸易、物资供销；企业形象设计及营销策划（依法须经批准的项目，经相关部门批准后方可开展经营活动）",云南,昆明,"云南省昆明经开区信息产业基地海归创业园4栋6楼677-13号"
昆明一动体育用品销售有限公司小西门分公司,9153010055778341XC,2010-07-15,N/A,N/A,"N/A","服装鞋帽、体育用品、体育器材、体育器械及配件、日用皮革制品、针纺织品的销售（依法须经批准的项目，经相关部门批准后方可开展经营活动）",云南,昆明,"云南省昆明市高新区昆明正大紫都城1区1层74号附020号"
云南德心融资担保有限公司,91530102557782425Q,2010-07-15,N/A,N/A,"10,000(万元人民币)","融资担保业务（依法须经批准的项目，经相关部门批准后方可开展经营活动）",云南,昆明,"云南省昆明市五华区祥云街59号国资银佳大厦B座9楼"
云南金牛望月餐饮管理有限公司,91530102557782361T,2010-07-15,N/A,N/A,"200(万元人民币)","餐饮企业管理（不得开展餐饮经营活动）；以下限分支机构经营：餐饮服务；卷烟、雪茄烟的销售（依法须经批准的项目，经相关部门批准后方可开展经营活动）",云南,昆明,"云南省昆明市五华区祥云街45-48号副楼二楼1号"
云南鸿翔一心堂药业(集团)股份有限公司昆明永丰村连锁店,91530000557784260E,2010-07-15,N/A,N/A,"N/A","中成药、中药饮片、化学药制剂、抗生素、生化药品、生物制品（除疫苗）、生物制品（除血液药品）；I、II、III类医疗器械（凭许可证经营）；消毒剂、消毒器械、一次性使用医疗用品和卫生用品；预包装食品、乳制品（含婴幼儿配方乳粉）的零售；通讯产品配件、充值卡、续费卡；日用百货、化妆品的零售。保健食品；受委托代收费；眼镜的销售；验配眼镜；",云南,昆明,"云南省昆明市官渡区永丰村14号"
昆明丹腾门业有限公司,91530100557781043R,2010-07-15,N/A,N/A,"50(万元人民币)","门窗、家具、建筑材料、装饰材料、办公用品的销售（依法须经批准的项目，经相关部门批准后方可开展经营活动）",云南,昆明,"云南省昆明经济技术开发区航天城37幢5单元3层302号"
