云南城宏商贸有限公司,915326275551265398,2010-04-27,N/A,N/A,"1,000(万元人民币)","卫生洁具、装修装饰材料、取暖材料、建筑材料销售；园林绿化、建筑设备租赁；经济林果种植；免烧砖生产(筹建)；建筑石料用灰岩露天开采。",云南,文山,"广南县莲城镇北坛社区福迎福旁苗里小区"
云南元投融资担保有限公司,915301025527427663,2010-04-27,N/A,N/A,"20,500(万元人民币)","按照《融资性担保机构经营许可证》核准的范围及时限开展经营活动（依法须经批准的项目，经相关部门批准后方可开展经营活动）",云南,昆明,"云南省昆明市五华区威远街正义大厦(现华夏大厦)东塔楼16-B"
云南景绣云天贸易有限公司工会委员会,8153012632307037XE,2010-04-27,N/A,N/A,"N/A","住宿服务；餐饮加工销售。",云南,昆明,"石林彝族自治县鹿阜街道办学地山108号"
云南焕祺商贸有限公司,91530103552744585K,2010-04-27,N/A,N/A,"500(万)","国内贸易，物资供销",云南,昆明,"云南省昆明市盘龙区金洲湾会所201号"
云南亿凡茶业有限公司,915301125527477516,2010-04-27,N/A,N/A,"303(万元人民币)","预包装食品、茶具、工艺美术品（象牙及其制品除外）、农副产品的销售；组织文化艺术交流活动（演出除外）；承办会议及商品展览展示活动（依法须经批准的项目，经相关部门批准后方可开展经营活动）",云南,昆明,"云南省昆明市盘龙区北辰财富中心商住楼B幢1单元2211号"
云南鸿翔一心堂药业(集团)股份有限公司保山城南盛市连锁店,91530502568818139R,2010-04-27,N/A,N/A,"N/A","药品（根据《药品经营许可证》核定的经营范围和时限开展经营活动）、Ⅰ、Ⅱ、Ⅲ类医疗器械（凭许可证经营）、食品销售（凭许可证经营）、消毒产品、日用百货、化妆品的零售；眼镜的验配、销售；受委托代收费；国内贸易、物资供销。（依法须经批准的项目，经相关部门批准后方可开展经营活动）",云南,保山,"云南省保山市隆阳区兰城街道城南盛市东27-28号"
云南宏峰汽车销售服务有限公司,915301295527437345,2010-04-27,N/A,N/A,"1,000(万元人民币)","汽车零配件销售；汽车美容装饰；一类汽车维修；汽车销售（依法须经批准的项目，经相关部门批准后方可开展经营活动）",云南,昆明,"云南省昆明市寻甸县仁德镇钟灵路58号"
双柏县鑫鑫工贸有限责任公司硝塘铁矿,91532322MA6MEX8B5A,2010-04-27,N/A,N/A,"N/A","铁矿开采销售,生物资源开发、加工。(依法须经批准的项目,经相关部门批准后方可开展经营活动)",云南,楚雄,"云南省楚雄彝族自治州双柏县妥甸镇马龙办事处"
云南满美商贸有限公司,915301005527427073,2010-04-27,N/A,N/A,"1,000(万元人民币)","国内贸易；物资供销（依法须经批准的项目，经相关部门批准后方可开展经营活动）",云南,昆明,"昆明经开区信息产业基地13#2号云南海归创业园4栋6楼626-14号"
云南佳通物流有限公司,915301005527431368,2010-04-27,N/A,N/A,"100(万元人民币)","物流方案的设计及策划；物流管理；普通货运、货运代理、货运配载、搬运装卸；经济信息咨询（不得涉及互联网金融及其关联衍生业务、个人征信业务）；仓储服务（危险化学品、涉氨制冷行业及国家限定违禁管制品除外）（不得在经开区内从事本区产业政策中限制类、禁止类行业）（依法须经批准的项目，经相关部门批准后方可开展经营活动）",云南,昆明,"云南省昆明经开区洛羊镇南昆编组站内"
云南德思搏装饰工程有限公司,91530103552743144E,2010-04-27,N/A,N/A,"100(万元人民币)","室内装饰工程的设计与施工；建筑材料、装饰材料、五金交电、办公用品、日用百货、电子产品、电线电缆、水暖器材的销售（依法须经批准的项目，经相关部门批准后方可开展经营活动）",云南,昆明,"云南省昆明市盘龙区北京路与联盟路交叉口卓越俊园11幢21-22层2116室"
安宁干洲机动车检测有限公司,91530181552743494K,2010-04-27,N/A,N/A,"200(万元人民币)","机动车安全性能检测；机动车环保(尾气)检测；汽车综合性能检测；汽车高新技术及环保产品的推广应用；汽车检测设备、润滑油、日用百货、五金交电、橡胶制品的销售；自有产权房屋租赁；仓储（依法须经批准的项目，经相关部门批准后方可开展经营活动）",云南,昆明,"云南省昆明市安宁市草铺街道平地哨村"
云南祥兴建筑安装有限责任公司,91532901697999204Y,2010-04-27,N/A,N/A,"2,600(万元人民币)","房屋建筑工程施工承包、园林古建筑工程专业承包、室内外装饰施工、市政公用工程施工总承包、土石方工程专业承包、建筑装饰装修工程专业承包、水电安装工程承包、钢结构工程承包、消防、防雷安装工程施工承包；堤防工程、水利水电工程、公路工程、拆迁工程、路灯安装工程、管道设备安装工程、环境艺术工程、起重设备安装工程、建筑幕墙工程施工承包；园林花卉、石材、工艺石材销售、建材经营。（依法须经批准的项目，经相关部门批准后方可开展经营活动）",云南,大理,"云南省大理州大理市大理镇南国城A-07-2号"
大理俊杰人力资源有限公司,915329005551140795,2010-04-27,N/A,N/A,"50(万元人民币)","职业介绍；劳务派遣；劳务信息咨询。（依法须经批准的项目，经相关部门批准后方可开展经营活动）",云南,大理,"云南省大理白族自治州大理市大理经济开发区苍山东路282号"
临沧泰恒林业有限公司,915309025527445421,2010-04-27,N/A,N/A,"550(万元人民币)","造林、林木的抚育与管理；城市园林绿化工程施工；城市市政工程施工、房屋工程建筑、建筑装饰、土石方工程施工、建筑工程用水泥砼预制品加工销售。（依法须经批准的项目，经相关部门批准后方可开展经营活动）",云南,临沧,"云南省临沧市临翔区海关小区10栋-1号"
云南菌粹源食用菌有限公司,91530111552743654E,2010-04-27,N/A,N/A,"100(万元人民币)","农副产品的销售（依法须经批准的项目，经相关部门批准后方可开展经营活动）",云南,昆明,"昆明市官渡区关上街道办事处福发路8号云南木水花花卉野生菌综合批发市场2栋6号铺面"
弥勒翔胜混凝土有限公司,91532526552748455F,2010-04-27,N/A,N/A,"1,000(万元人民币)","混凝土、预制构件、管桩、水泥制品生产及销售（依法须经批准的项目，经相关部门批准后方可开展经营活动）",云南,红河,"云南省红河哈尼族彝族自治州弥勒市弥阳镇牛背村委会牛背村新花冲"
云南鸿翔一心堂药业(集团)股份有限公司漾濞苍山西路连锁店,91532922555118985M,2010-04-27,N/A,N/A,"N/A","药品（根据《药品经营许可证》核定的经营范围和时限开展经营活动）、I、II、III类医疗器械（凭许可证经营）、食品销售（凭许可证经营）、消毒产品、农副产品、日用百货、化妆品的销售；眼镜的验配、销售；其他服务；受委托代收费；国内贸易、物资供销。（依法须经批准的项目，经相关部门批准后方可开展经营活动）",云南,大理,"漾濞县上街镇苍山西路(农贸市场入囗处"
安宁林源朗乡置业开发有限责任公司,91530181552746409F,2010-04-27,N/A,N/A,"1,000(万元人民币)","房地产开发、经营、咨询服务；矿产品销售。（依法须经批准的项目，经相关部门批准后方可开展经营活动）",云南,昆明,"安宁市百花东路(林源公司内)"
云南品尊商贸有限公司,9153011255274274XP,2010-04-27,N/A,N/A,"210(万元人民币)","国内贸易、物资供销",云南,昆明,"云南省昆明市西山区西苑开发区凯苑19幢3单元101号"
云南艾维贸易有限公司第六经营部,915301025662195384,2010-04-27,N/A,N/A,"N/A","针纺织品、日用百货、工艺美术品、服装鞋帽、皮革皮具、钟表眼镜、五金交电、电子产品、金属材料、装饰材料、建筑材料、汽车配件、电器机械及器材、普通机械及配件、计算机及配件（依法须经批准的项目，经相关部门批准后方可开展经营活动）",云南,昆明,"云南省昆明市五华区顺城街王府井购物中心E区一层E1-05、E1-04"
云南健之佳连锁健康药房有限公司文山休闲广场分店,91532621555109755Q,2010-04-27,N/A,N/A,"N/A","药品、医疗器械（按《药品经营许可证》、《医疗器械经营许可证》核准的范围）、保健食品、日用百货、化妆品、卫生用品、眼镜销售；预包装食品兼散装食品、乳制品(含婴幼儿配方乳粉)零售（依法须经批准的项目，经相关部门批准后方可开展经营活动）。",云南,文山,"云南省文山壮族苗族自治州文山市开化街道振华社区文华大厦商业城一楼A01-甲B2号商铺"
云南春和盛典当有限公司,91530103552747671H,2010-04-27,N/A,N/A,"1,000(万元人民币)","动产质押典当业务、财产权利质押典当业务、房地产（外省、自治区、直辖市的房地产或者未取得商品房预售许可证的在建工程除外）抵押典当业务；限额内绝当物品的变卖，鉴定评估及咨询服务（依法须经批准的项目，经相关部门批准后方可开展经营活动）",云南,昆明,"云南省昆明市盘龙区北市区春怡雅苑翠羽苑2号"
云南全景国际旅行社有限责任公司,91530111555100013K,2010-04-27,N/A,N/A,"100(万元人民币)","国内旅游业务、入境旅游业务（依法须经批准的项目，经相关部门批准后方可开展经营活动）",云南,昆明,"云南省昆明市官渡区北京路96号云南锦华国际酒店6楼606号"
南华县查姆农特产品加工专业合作社,935323240832595436,2010-04-27,N/A,N/A,"N/A","㈠野生食用菌、灵芝、核桃、辣椒、白芸豆、萝卜、洋芋、魔芋等农特产品种植、收购、初加工、销售；㈡组织采购、供应成员所需的生产资料；㈢引进农特产品种植新技术、新品种，开展技术培训、技术交流和咨询服务等（依法须经批准的项目，经相关部门批准后方可开展经营活动）",云南,楚雄,"云南省楚雄彝族自治州南华县龙川镇老高坝工业园区"
云南仁人达人力资源开发有限公司,91530112552742934L,2010-04-27,N/A,N/A,"200(万元人民币)","人才派遣、人才推荐、人才培训、人才信息发布、人才咨询、人才测评、举办人才洽谈会、职业指导、进行人才猎头服务；劳务派遣；人力资源信息咨询；企业营销策划、企业形象设计；企业管理咨询；家政服务；园林景观工程；汽车租赁；汽车代驾服务；职业技能鉴定；建筑劳务分包；工程机械设备租赁（依法须经批准的项目，经相关部门批准后方可开展经营活动）",云南,昆明,"云南省昆明市西山区刘家营西区活动室一楼办公用房"
云南辰巢装饰工程有限公司,91530102552742790K,2010-04-27,N/A,N/A,"200(万元人民币)","室内外装饰工程的设计及施工；建筑材料、装饰材料、五金交电、电线电缆、日用百货的销售（依法须经批准的项目，经相关部门批准后方可开展经营活动）",云南,昆明,"云南省昆明市五华区东风西路182号云南省核工业商务楼323室"
云南辰宇置地有限公司,91530103552744745T,2010-04-28,N/A,N/A,"1,000(万元人民币)","土地整理及咨询；房地产开发及经营（依法须经批准的项目，经相关部门批准后方可开展经营活动）",云南,昆明,"云南省昆明市盘龙区金星小区健身娱乐中心4楼"
云南迈邦贸易有限公司,915301025527448768,2010-04-28,N/A,N/A,"200(万元人民币)","国内贸易、物资供销（依法须经批准的项目，经相关部门批准后方可开展经营活动）",云南,昆明,"云南省昆明市五华区人民西路380号熙城大厦1409室"
云南树德文化传播有限公司,91530102552744307P,2010-04-28,N/A,N/A,"100(万元人民币)","组织文化艺术交流活动（演出除外）；承办会议及商品展览展示活动；礼仪庆典服务；计算机图文设计；国内各类广告的设计、代理、制作及发布；企业形象设计；企业营销策划；经济信息咨询；教育信息咨询（依法须经批准的项目，经相关部门批准后方可开展经营活动）",云南,昆明,"云南省昆明市五华区西昌路692号长城证券大厦614室"
个旧市海云矿业有限公司,91532501552747321U,2010-04-28,N/A,N/A,"200(万)","有色金属及矿产品销售；工矿配件、机械设备销售；矿产技术服务",云南,红河,"云南省红河州个旧市云锡新村广元大厦40幢夹层商铺9号"
云南均衡矿业有限公司,91530100552744606Q,2010-04-28,N/A,N/A,"500(万元人民币)","矿产品、矿山机械设备、计算机配件、普通机械、装饰材料、建筑材料、塑料制品、五金交电、办公用品、日用百货的销售（依法须经批准的项目，经相关部门批准后方可开展经营活动）",云南,昆明,"云南省昆明经开区洛羊物流片区西南广物流中心内二幢二楼三号"
昆明路路行汽车租赁有限公司,9153011155510548X6,2010-04-28,N/A,N/A,"3(万元人民币)","汽车租赁服务（依法须经批准的项目，经相关部门批准后方可开展经营活动）",云南,昆明,"昆明市官渡区日新办事处日新村C幢405号"
嵩明洁城环卫服务有限责任公司,91530127555101649Q,2010-04-28,N/A,N/A,"30(万)","街道清扫、保洁；垃圾收集、清运、处理及再生资源回收分拣",云南,昆明,"嵩明县嵩阳镇盟台路86号"
昆明宏富农生物科技有限公司,91530103552744884H,2010-04-28,N/A,N/A,"50(万元人民币)","生物科技的开发；饲料、宠物用品的销售（依法须经批准的项目，经相关部门批准后方可开展经营活动）",云南,昆明,"云南省昆明市盘龙区金殿麦冲村125号"
昆明檞瀚商贸有限公司,91530100552744753A,2010-04-28,N/A,N/A,"50(万元人民币)","国内贸易、物资供销（依法须经批准的项目，经相关部门批准后方可开展经营活动）",云南,昆明,"云南省昆明经开区信息产业基地13#2号云南海归创业园4栋6楼615-19号"
云南金利科技发展有限公司十七门市,915301025551025029,2010-04-28,N/A,N/A,"N/A","计算机及计算机软件、硬件、电子产品、通信器材、金属材料、矿产品、橡胶制品、五金交电、日用百货、文具用品、办公设备的销售；计算机网络工程；计算机的维修及技术咨询（依法须经批准的项目，经相关部门批准后方可开展经营活动）",云南,昆明,"云南省昆明市五华区圆通北路32号"
宣威市博雅文化传播有限公司,915303815527459594,2010-04-28,N/A,N/A,"100(万)","广告设计、包装设计、工艺美术品、办公用品、纸张批发零售；其他印刷品印刷、内部资料性出版物印刷；承办会议及商品展览展示活动，设计、制作、代理发布各类广告，企业形象策划、企业管理咨询、市场营销策划、商务信息咨询，动漫、图文设计，城市景观亮化工程的设计与施工。",云南,曲靖,"宣威市西宁路北段114号"
嵩明鑫丰汽车贸易有限公司,91530127555101921Y,2010-04-28,N/A,N/A,"10(万元人民币)","上汽通用五菱面包车、小货车代销；汽车售后技术咨询服务；三类汽车维修；宝骏品牌汽车销售",云南,昆明,"嵩明县嵩阳镇彩云路"
云南众地经贸有限公司,91530100552744278F,2010-04-28,N/A,N/A,"200(万元人民币)","国内贸易、物资供销；企业形象设计；商务信息、经济信息、企业管理信息咨询（依法须经批准的项目，经相关部门批准后方可开展经营活动）",云南,昆明,"云南省昆明经济技术开发区信息产业基地春漫大道80号云南海归创业园2幢4楼04401号"
云南畅亮商贸有限公司,915301115527448176,2010-04-28,N/A,N/A,"1,000(万元人民币)","国内贸易、物资供销；票务代理；旅游服务、旅游咨询；承办会议及商品展览展示活动；汽车租赁（依法须经批准的项目，经相关部门批准后方可开展经营活动）",云南,昆明,"云南省昆明市官渡区广福路与金源大道交汇处春城时光花园1座22层2204室"
云南上业混凝土有限公司,915301125527452972,2010-04-28,N/A,N/A,"1,000(万元人民币)","商品混凝土加工及销售；建筑材料、装饰材料的销售。（依法须经批准的项目，经相关部门批准后方可开展经营活动）",云南,昆明,"云南省昆明市西山区马街街道办事处普坪社区大箐路李永山"
昆明海岛娱乐有限公司,91530100552745502X,2010-04-28,N/A,N/A,"50(万元人民币)","KTV（依法须经批准的项目，经相关部门批准后方可开展经营活动）",云南,昆明,"昆明经开区云大西路新广丰食品批发市场C区3栋"
云南清和物业管理有限公司,9153010055274514XY,2010-04-28,N/A,N/A,"100(万元人民币)","物业管理",云南,昆明,"昆明经开区云大西路39号创业大厦7楼712号"
昆明恒磊商贸有限公司,915301005527458449,2010-04-28,N/A,N/A,"500(万元人民币)","国内贸易、物资供销（依法须经批准的项目，经相关部门批准后方可开展经营活动）",云南,昆明,"云南省昆明经开区信息产业基地4-2#至4-5#地块鹏龙坤佳物流有限公司内B区1031号"
昆明捷佳广告有限公司,915301115527451908,2010-04-28,N/A,N/A,"50(万)","设计、制作、代理、发布国内各类广告",云南,昆明,"昆明市官渡区矣六乡星汇园D6幢1层H-94号"
昆明沪锦酒店有限公司,9153011155274709XT,2010-04-28,N/A,N/A,"50(万元人民币)","酒店管理；住宿；企业营销策划；社会经济信息咨询（依法须经批准的项目，经相关部门批准后方可开展经营活动）",云南,昆明,"云南省昆明市官渡区关上街道办事处关上北路95号一楼"
云南顺景建筑工程有限公司,915325225527453345,2010-04-28,N/A,N/A,"1,000(万元人民币)","装饰、装修工程；房屋拆出工程施工；建筑施工总承包；水利水电施工总承包；市政公用工程施工总承包；公路施工总承包；公路养护总承包；钢结构施工总承包；土石方工程；建筑工程机械的租赁；城市园林绿化；土地治理；水土保持；施工劳务；地基基础工程（依法须经批准的项目，经相关部门批准后方可开展经营活动）",云南,红河,"云南省红河州蒙自市护国路金色碧海小区51幢负1-4层51-1号二楼202室"
个旧世纪广场实业有限公司,91532501552746775W,2010-04-28,N/A,N/A,"600(万元人民币)","有色金属、黑色金属及贵金属、化工产品（国家专项控制商品除外）、非金属、矿产品、建筑材料、矿山机械配件、汽车配件销售；环境保护工程服务；劳务服务；物资仓储；花卉种植、销售、租赁；家畜、家禽养殖；饲料销售（依法须经批准的项目，经相关部门批准后方可开展经营活动）",云南,红河,"云南省红河州个旧市大屯镇新坝"
云南闽龙矿业有限公司,9153010355274477X8,2010-04-28,N/A,N/A,"1,000(万元人民币)","矿产品、矿山机械设备的销售；矿山机械设备的租赁；矿权、矿产品信息咨询；矿山勘探技术服务；代理矿权年检及延续技术服务；（依法须经批准的项目，经相关部门批准后方可开展经营活动）",云南,昆明,"云南省昆明市盘龙区锦悦四季花园7幢27层2703号"
昆明温商文化传播有限公司,915301005527470815,2010-04-28,N/A,N/A,"500(万元人民币)","组织文化艺术交流活动（演出除外）；承办会议及商品展览展示活动、礼仪庆典；设计、制作、代理、发布国内各类广告；工商事务代理；计算机网络技术服务；计算机网页设计；包装装潢设计；商标代理；客房代订及票务代理；网上销售：日用百货、服装鞋帽、电子产品、工艺美术品、农副产品、珠宝玉石、体育用品（依法须经批准的项目，经相关部门批准后方可开展经营活动）",云南,昆明,"云南省昆明市高新区M2-8-4地块A号楼第十六层1681号"
大姚荣星农副产品销售有限公司,91532326552746839P,2010-04-28,N/A,N/A,"200(万元人民币)","农副产品的收购、销售；花粉、白芸豆的收购、销售；速生林基地建设；经济林果种植；林下资源开发；生猪养殖、山羊饲养繁殖(限分公司经营)；农业技术开发、咨询、培训和推广服务。（依法须经批准的项目，经相关部门批准后方可开展经营活动）",云南,楚雄,"云南省楚雄彝族自治州大姚县金碧镇北城外大丫口"
云南博昌农产品开发有限公司,91530181552745449C,2010-04-28,N/A,N/A,"380(万元人民币)","农产品研究、种植、收购、包装、销售；货物进出口；干鲜蔬菜、水果、花卉、农副产品、日用百货销售。",云南,昆明,"安宁市八街镇竹园村村口安八公路边"
云南圣发商贸有限公司,91530100552744323G,2010-04-28,N/A,N/A,"500(万元人民币)","国内贸易、物资供销（依法须经批准的项目，经相关部门批准后方可开展经营活动）",云南,昆明,"昆明经开区经开路3号科技创新园A15-16室"
云南七彩环境咨询有限公司,91530300697999159P,2010-04-28,N/A,N/A,"300(万元人民币)","清洁生产咨询服务；环境影响评价咨询。（依法须经批准的项目，经相关部门批准后方可开展经营活动）",云南,曲靖,"云南省曲靖开发区锦华山水缘小区翠连4幢第1-2层翠连4号"
云南网度商贸有限公司,915301115527453852,2010-04-28,N/A,N/A,"100(万)","国内贸易、物资供销；社会经济信息咨询；货物及技术进出口业务（国家限制项目除外）；CDMA移动通信业务代理；商务信息咨询；企业营销策划；计算机软硬件的开发、应用及技术咨询；计算机系统集成及综合布线；承办会议及商品展览展示活动；国内各类广告的设计、制作、代理及发布；工程勘察设计；通信工程施工总承包、电信工程专业承包（按资质证核定的范围和时限开展经营活动）（依法须经批准的项目，经相关部门批准后方可开展经营活动）",云南,昆明,"云南省昆明市官渡区日新小区1幢2单元201号"
云南秀川水利水电勘察设计有限公司,91530102552746863C,2010-04-28,N/A,N/A,"800(万元人民币)","水利水电技术开发及咨询；水利水电工程的设计；普通机械及配件、电器机械及器材的销售；水利水电工程施工总承包；地基与基础专业工程承包；机电设备安装（特种设备除外）；编制项目建议书、编制项目可行性研究报告；计算机、汽车、普通机械设备的租赁（依法须经批准的项目，经相关部门批准后方可开展经营活动）",云南,昆明,"云南省昆明市五华区青年路376号"
怒江三江传统火腿农民专业合作社,93533321555103046E,2010-04-28,N/A,N/A,"N/A","火腿腌制。（依法须经批准的项目，经相关部门批准后方可开展经营活动）",云南,怒江,"云南省怒江傈僳族自治州泸水市六库镇新村怒江瑞兴农牧开发有限公司院内"
昆明琳艺科技有限公司,915301025527447612,2010-04-28,N/A,N/A,"20(万元人民币)","计算机软硬件的开发及应用；计算机系统集成及综合布线；电子产品、普通机械及配件；办公设备的销售（依法须经批准的项目，经相关部门批准后方可开展经营活动）",云南,昆明,"云南省昆明市五华区龙泉路上马村泰旸欣城235号商铺"
开远市盈叶化工有限公司,91532502552747487Q,2010-04-28,N/A,N/A,"5,000(万元人民币)","复混肥料（含有机—无机复混肥料）的生产、销售；有机肥、配方肥料、掺混肥料的生产、加工、销售；氮、磷、钾肥的批发及零售，水溶肥的生产、销售（依法须经批准的项目，经相关部门批准后方可开展经营活动）",云南,红河,"云南省红河州开远市南郊棉花冲"
昆明纳隆商贸有限公司,91530111552747049P,2010-04-28,N/A,N/A,"100(万元人民币)","国内贸易、物资供销；企业营销策划；商务信息咨询",云南,昆明,"昆明市塘双路2号自由港11楼C01号"
建水县盛农蔬菜专业合作社,93532524552746011N,2010-04-28,N/A,N/A,"N/A","为成员购买所需的农业生产资料；组织收购、销售种苗、蔬菜；开展农业生产经营的技术、信息咨询服务（依法须经批准的项目，经相关部门批准后方可开展经营活动）",云南,红河,"建水县面甸镇闫把寺小寨村白塘子"
云南华仑天玺贸易有限公司,91530102552745510M,2010-04-28,N/A,N/A,"100(万元人民币)","国内贸易、物资供销；货物及技术进出口业务（国家限定或禁止公司经营的货物及技术除外）（依法须经批准的项目，经相关部门批准后方可开展经营活动）",云南,昆明,"云南省昆明市五华区江东华龙人家B座2单元102号"
