企业名称,统一社会信用代码,注册日期,企业类型,法人代表,注册资金,经营范围,所在省份,地区,注册地址
昆明冉冉物业管理有限公司,91530102697992344J,2010-01-06,N/A,N/A,"300(万元人民币)","物业管理；经济信息咨询；企业管理信息咨询；企业营销策划；餐饮企业管理；家政服务；清洁服务；垃圾清运（依法须经批准的项目，经相关部门批准后方可开展经营活动）",云南,昆明,"云南省昆明市五华区一二一大街428号成都军区工程科研设计院内"
玉溪市通达绿化工程有限公司,91530402697992010H,2010-01-06,N/A,N/A,"300(万元人民币)","荒山植树造林；园林绿化工程设计、施工及养护；苗木、花卉的种植与销售。（依法须经批准的项目，经相关部门批准后方可开展经营活动）",云南,玉溪,"云南省玉溪市红塔区冯井5组51幢7号"
昭通市昭阳区翔飞食品专业合作社,93530602096527797L,2010-01-06,N/A,N/A,"N/A","农副产品生产、加工、销售、贮藏;化肥、农药、农作物种子销售",云南,昭通,"昭通市昭阳区旧圃镇大村村委会下四甲村162号"
弥渡县中心中药材农民专业合作社,935329250642692792,2010-01-06,N/A,N/A,"N/A","为成员采购、供应中药材种植所需的生产资料、开展成员种植有关的技术培训、交流及信息咨询服务。（依法须经批准的项目，经相关部门批准后方可开展经营活动）",云南,大理,"云南省大理白族自治州弥渡县密祉镇中心村委会"
云南盛客经贸有限公司,91530100697992766L,2010-01-06,N/A,N/A,"100(万元人民币)","国内贸易、物资供销（依法须经批准的项目，经相关部门批准后方可开展经营活动）",云南,昆明,"云南省昆明经开区经开路3号科技创新园A15-5室"
大理州源泉建筑工程有限责任公司,91532923550102829J,2010-01-06,N/A,N/A,"1,000(万元人民币)","房屋建筑工程、水利水电工程、市政公用工程施工总承包；土石方工程、建筑装修装饰工程专业承包；机械设备租赁；金属材料、建筑材料、装饰材料、普通机械及配件、电器机械及器材、日用百货的销售，公路工程施工总承包、钢结构工程专业承包。（依法须经批准的项目，经相关部门批准后方可开展经营活动）",云南,大理,"云南省大理白族自治州祥云县祥城镇清红路西侧、吉祥路北侧"
云南中汇矿业有限公司,915300006979931527,2010-01-06,N/A,N/A,"1,000(万)","矿产品、矿山机械、五金交电、建筑材料、装饰材料、普通机械及配件的销售；矿产地质勘查的技术咨询；进出口贸易。",云南,昆明,"云南省昆明市白塔路387-395号11层1108号"
昆明斐林电缆有限公司,91530100697992176K,2010-01-06,N/A,N/A,"100(万元人民币)","电线电缆、建筑材料、装饰材料、五金交电、橡胶制品的销售（依法须经批准的项目，经相关部门批准后方可开展经营活动）",云南,昆明,"云南省昆明经开区云大西路39号科技孵化区B幢3楼358-1号"
楚雄璟辉建业有限公司,91532300697992045T,2010-01-06,N/A,N/A,"1,109(万元人民币)","房屋建筑工程施工、公路工程施工、市政工程施工、室内外装饰工程施工、水电安装。（依法须经批准的项目，经相关部门批准后方可开展经营活动）",云南,楚雄,"云南省楚雄彝族自治州楚雄市鹿城镇青龙河东路117号福龙苑2-123号商铺"
云南金涌源投资有限公司,91530000697992811G,2010-01-06,N/A,N/A,"1,000(万元人民币)","项目投资对所投资的项目进行管理；计算机软硬件的开发及销售服务；经济信息咨询服务；室内装饰工程的设计与施工；矿产品的开采技术咨询及销售；电器机械及器材、普通机械、电信电缆、金属材料、橡胶制品、五金交电、照明电器配件的销售；生物技术的研究及开发；农业科技开发研究；酒类的经营；建筑材料的销售；土特产品、农产品、预包装食品、茶叶的开发及销售、文化体育用品、工艺美术品的销售、园林绿化工程设计、施工及养护、园林绿化苗木、花卉的开发及销售。（依法须经批准的项目，经相关部门批准后方可开展经营活动）",云南,昆明,"云南省昆明市滇池度假区迎海路8号金都商集8幢1-5号"
弥渡县山川黑山羊养殖农民专业合作社,93532925MA6MXJUN9N,2010-01-06,N/A,N/A,"N/A","为成员采购、供应黑山羊养殖所需的生产资料；开展成员黑山羊养殖有关的技术培训、交流及信息咨询服务。（依法须经批准的项目，经相关部门批准后方可开展经营活动）",云南,大理,"弥渡县弥城镇朱坊村61号"
昆明市成通建筑有限公司,91530111697992934L,2010-01-06,N/A,N/A,"2,000(万元人民币)","房屋建筑工程施工、市政工用工程施工、公路工程施工总承包；土石方工程、建筑装修装饰、建筑防水工程、园林古建筑工程、钢结构工程、金属门窗工程、城市及道路照明工程专业承包（按资质证核定的范围和时限开展经营活动）；建筑劳务分包。（依法须经批准的项目，经相关部门批准后方可开展经营活动）",云南,昆明,"云南省昆明市官渡区宏仁片区昆明螺蛳湾国际商贸城二期4幢11层1107号"
楚雄天溢商贸有限公司,91532301697996142J,2010-01-06,N/A,N/A,"10(万元人民币)","预包装食品、乳制品（含婴幼儿配方乳粉）、其他日用品、服装、珠宝首饰、塑料家居用品、家用电器、体育用品、文化用品的批发、零售；服装加工、零售。（依法须经批准的项目，经相关部门批准后方可开展经营活动）",云南,楚雄,"云南省楚雄彝族自治州楚雄市鹿城镇灵秀路鹿鸣阁小区"
昆明万科房地产开发有限公司,91530102550104920B,2010-01-06,N/A,N/A,"2,000(万元人民币)","房地产开发及经营；建筑装修装饰工程的设计及施工；物业管理；企业管理信息咨询；项目投资及对所投资的项目进行管理（依法须经批准的项目，经相关部门批准后方可开展经营活动）",云南,昆明,"云南省昆明市五华区滇缅大道340号"
弥渡县金果香酥梨产销农民专业合作社,935329250546943000,2010-01-06,N/A,N/A,"N/A","为成员采购、供应香酥梨种植所需的生产资料；销售成员种植的产品；开展成员种植有关的技术培训、交流及信息咨询服务。",云南,大理,"云南省大理白族自治州弥渡县弥城镇弥渡县弥城镇朱坊村82号"
弥渡县田野奶牛养殖农民专业合作社,93532925MA6KY2QL43,2010-01-06,N/A,N/A,"N/A","为成员采购供应奶牛养殖所需的生产资料；开展成员奶牛养殖有关的技术培训、交流及咨询服务。",云南,大理,"云南省大理白族自治州弥渡县寅街镇河东村委会河东村"
云南亚飞科技有限公司,915301116979920028,2010-01-06,N/A,N/A,"500(万元人民币)","计算机软硬件开发及应用；系统集成及综合布线；安防产品、计算机及配件、普通机械及配件、五金交电、通信器材、电子产品、仪器仪表、日用百货、文化用品、办公用品、工艺美术品、建筑材料、装饰材料、矿产品、农副产品（粮食除外）、交通设施的销售；货物进出口、技术进出口业务（国家限制项目除外）；第二类增值电信业务中的信息服务业务（含通信短信息服务业务，不含电话信息服务和因特网信息服务业务）、呼叫中心业务。（依法须经批准的项目，经相关部门批准后方可开展经营活动）",云南,昆明,"云南省昆明市官渡区环城南路108号东来大厦10楼D座"
云南欧尼斯特医疗器械有限公司,91530103697992555G,2010-01-06,N/A,N/A,"100(万元人民币)","医疗器械的销售（根据滇531534号《医疗器械经营许可证》核定的范围和时限开展经营活动）；普通机械及配件、五金交电、日用百货的销售（依法须经批准的项目，经相关部门批准后方可开展经营活动）",云南,昆明,"云南省昆明市盘龙区人民东路19号有色大厦一幢13楼1303号"
砚山畜镡养殖场,91532622697994980C,2010-01-06,个人独资企业,N/A,"N/A","畜禽养殖及销售；果树种植及销售（依法须经批准的项目，经相关部门批准后方可开展经营活动）。",云南,文山,"云南省文山壮族苗族自治州砚山县稼依镇老虎冲"
昭通市昭阳区新网缘网络服务有限公司,91530602697994462C,2010-01-06,N/A,N/A,"3(万元人民币)","网吧活动；预包装食品、乳制品（不含婴幼儿配方乳粉）的零售",云南,昭通,"昭通市昭阳区昭阳大道174号内"
安宁绿标商贸有限公司,915301816979923958,2010-01-06,N/A,N/A,"10(万元人民币)","批发和零售业；谷物、豆及薯类、果品、蔬菜、肉、禽、蛋、奶及水产品、盐及调味品、米、面制品及食用油、酒、饮料及茶叶、农副产品、散装食品的销售；国内贸易、物资供销。（依法须经批准的项目，经相关部门批准后方可开展经营活动）",云南,昆明,"安宁市江东天然居商铺C-附2号"
祥云县文兴养殖农民专业合作社,935329235551302206,2010-01-06,N/A,N/A,"N/A","畜禽养殖及其产品销售。（依法须经批准的项目，经相关部门批准后方可开展经营活动）",云南,大理,"云南省大理白族自治州祥云县刘厂镇松梅村委会二组"
维西嘉祥生态农业科技有限公司,91533423550124171P,2010-01-06,N/A,N/A,"2,700(万元人民币)","水果苗木培育及果树栽培、蔬菜籽种培育及蔬菜种植、畜禽良种繁育及养殖、农产品初深加工、食品加工、农产品贸易、农资销售；水果、预包装食品、散装食品（含冷藏冷冻食品）的销售；旅游服务、餐饮服务、公共食堂服务、农业技术培训、农业基础设施工程施工。（依法须经批准的项目，经相关部门批准后方可开展经营活动）",云南,迪庆,"云南省维西县永春乡兰永村花乐坝"
云南博延文化传媒有限公司,91530102697992758N,2010-01-06,N/A,N/A,"100(万元人民币)","组织文化艺术交流活动（演出除外）；承办会议及商品展览展示活动；国内各类广告的设计、代理、制作及发布；经济信息咨询；企业营销策划及形象设计；影视策划；文具用品、办公用品、广告材料、电子产品、计算机及配件、金属材料、建筑材料、装饰材料、普通机械及配件、日用百货的销售（依法须经批准的项目，经相关部门批准后方可开展经营活动）",云南,昆明,"云南省昆明市五华区学府路755号馨悦尚居8幢CD区201号"
中国人寿保险股份有限公司元江县支公司因远营销服务部,91530428550100735Q,2010-01-06,N/A,N/A,"N/A","对营销员开展培训及日常管理；收取营销员代收的保险费、投保单等单证；分发保险公司签发的保险单、保险收据等相关单证；接受客户的咨询和投诉；经保险公司核保，营销服务部可以打印保单；经保险公司授权，可以从事部分险种的查勘理赔工作。（依法须经批准的项目，经相关部门批准后方可开展经营活动）",云南,玉溪,"元江县因远镇节夏路20号"
曲靖市兴鑫商贸有限公司,915303025501002416,2010-01-06,N/A,N/A,"30(万元人民币)","化工产品、化工原料、化学试剂（不含危险品）销售，机电设备、五金电器、装潢材料、油漆涂料、铁矿石、磷矿石、化玻仪器销售，化工技术咨询服务，非标准件制作。（依法须经批准的项目，经相关部门批准后方可开展经营活动）",云南,曲靖,"曲靖市麒麟北路"
弥渡县丰收马铃薯产销农民专业合作社,93532925086389757Q,2010-01-06,N/A,N/A,"N/A","为成员采购供应马铃薯种植所需的生产资料；销售成员生产的产品；开展成员马铃薯种植和经营有关的技术培训、交流及咨询服务。",云南,大理,"云南省大理白族自治州弥渡县寅街镇寅街村委会寅街村5号"
云南三鑫集团有限公司采砂厂,915326005501113038,2010-01-06,N/A,N/A,"N/A","石灰岩开采、建筑用砂生产、销售。（依法须经批准的项目，经相关部门批准后方可开展经营活动）",云南,文山,"云南省文山州文山市高末村委会马厂村"
普洱市思茅区南岛河咖啡专业合作社,935308025600935162,2010-01-06,N/A,N/A,"N/A","咖啡、茶叶种植；组织采购、供应成员所需的生产资料；组织收购、销售社员生产的产品；开展成员所需的运输、储藏、加工、包装服务；引进新技术、新品种，开展技术培训、技术交流和咨询服务（以上经营范围中涉及国家法律、行政法规规定的专项审批，按审批的项目和时限开展经营活动）",云南,普洱,"普洱市思茅区南屏镇南岛河村茶树林社"
麻栗坡县龙峰船舶运输有限公司,91532624697994171X,2010-01-06,N/A,N/A,"66(万元人民币)","水上客、货运输（依法须经批准的项目，经相关部门批准后方可开展经营活动）",云南,文山,"云南省文山壮族苗族自治州麻栗坡县天保镇城子上村委会城子上村"
开远阳光房地产开发经营有限公司,9153250269799442XF,2010-01-06,N/A,N/A,"2,920(万元人民币)","房地产开发及经营、房地产咨询服务。（依法须经批准的项目，经相关部门批准后方可开展经营活动）",云南,红河,"云南省红河州开远市河滨南路42号至72号"
弥渡县中和肉牛养殖农民专业合作社,935329250642745457,2010-01-06,N/A,N/A,"N/A","为成员采购、供应肉牛养殖所需的生产资料；开展成员肉牛养殖有关的技术培训、交流及信息咨询服务。（依法须经批准的项目，经相关部门批准后方可开展经营活动）",云南,大理,"云南省大理白族自治州弥渡县密祉镇永和村委会"
楚雄立天房地产开发有限公司,91532300550109887U,2010-01-06,N/A,N/A,"100(万元人民币)","一般经营项目：房地产开发经营；市政工程、街道绿化工程施工。",云南,楚雄,"楚雄开发区太阳历大道94号322室"
云南瑞能建筑工程有限公司,915301116979923796,2010-01-06,N/A,N/A,"2,000(万元人民币)","房屋建筑工程、水利水电工程、市政公用工程总承包；公路路基工程、公路路面工程、送变电工程、建筑装修装饰工程专业承包；电力工程施工总承包；建筑劳务分包（按资质证核定的范围和时限开展经营活动）",云南,昆明,"云南省昆明市西山区团结街道办事处雨花居委会大墨雨村343号"
富源融信小额贷款有限公司,91530325697996433M,2010-01-06,N/A,N/A,"6,000(万元人民币)","小额贷款业务；小企业发展管理及财务咨询服务（依法须经批准的项目，经相关部门批准后方可开展经营活动）",云南,曲靖,"云南省曲靖市富源县中安街道金牛小区"
云南旷格商贸有限公司,915301036979928891,2010-01-06,N/A,N/A,"500(万元人民币)","国内贸易、物资供销；计算机软硬件的开发及应用；组织文化艺术交流活动（演出除外）；礼仪庆典服务；企业形象设计及营销策划；经济信息咨询、商务信息咨询（1、未经有关部门批准，不得以公开方式募集资金；2、不得公开开展证券类产品和金融衍生品交易活动；3、不得发放贷款；4、不得对所投资企业以外的其他企业提供担保；5、不得向投资者承诺投资本金不受损失或者承诺最低收益）、企业管理咨询；承办会议及商品展览展示活动；园林绿化工程、室内外装饰装修工程的设计与施工；保洁服务；垃圾清运；劳务派遣；建筑劳务分包；餐饮管理；停车服务（依法须经批准的项目，经相关部门批准后方可开展经营活动）",云南,昆明,"云南省昆明市盘龙区新迎枫蓝国际1幢A座205号"
普洱至胜房地产开发有限公司江城分公司,91530826550106977H,2010-01-06,N/A,N/A,"N/A","城市房地产开发、房地产开发项目的总承包、房地产买卖、出租（依法须经批准的项目，经相关部门批准后方可开展经营活动）",云南,普洱,"云南省普洱市江城哈尼族彝族自治县勐烈镇三国贸易城中国区1幢6-103号"
云南徐起工程机械设备有限公司,915301006979922567,2010-01-06,N/A,N/A,"500(万元人民币)","工程机械、农用机械及配件的销售、租赁及维修技术服务；农副产品、矿产品的销售；货物装卸搬运（危险化学品、涉氨制冷业及国家限定违禁管制品除外）（不得在经开区内从事本区产业政策中限制类、禁止类行业）（依法须经批准的项目，经相关部门批准后方可开展经营活动）",云南,昆明,"云南省昆明经开区信息产业基地春漫大道80号云南海归创业园2幢2楼02117号"
建水县奥城百货有限公司,915325245501001889,2010-01-06,N/A,N/A,"100(万元人民币)","日用百货、五金交电、针纺织品、珠宝玉器、儿童玩具、日用化学品、服装鞋帽、家用电器购销；房屋租赁服务；房屋信息咨询服务（依法须经批准的项目，经相关部门批准后方可开展经营活动）",云南,红河,"云南省红河州建水县临安镇建水大道与清远路交汇处裕顺奥城１号楼"
富源县龙源选煤有限公司,91530325697994219C,2010-01-06,N/A,N/A,"2,000(万元人民币)","原煤洗选、加工、销售；普通货运（依法须经批准的项目，经相关部门批准后方可开展经营活动）",云南,曲靖,"云南省曲靖市富源县竹园镇糯木村委会大下村"
昆明实远诚机械设备有限公司,91530112697992387F,2010-01-06,N/A,N/A,"300(万元人民币)","普通机械设备及配件、建筑材料、装饰材料、五金交电的销售、普通机械设备及配件的上门维修（依法须经批准的项目，经相关部门批准后方可开展经营活动）",云南,昆明,"云南省昆明市西山区广福路香槟小镇1幢1号商铺"
云南烟叶复烤有限责任公司工会委员会,815301025577953490,2010-01-06,N/A,N/A,"N/A","烟叶复烤加工、包装材料、麻制品、复烤工业副产品等。（依法须经批准的项目，经相关部门批准后方可开展经营活动）",云南,昆明,"昆明市圆通街51号"
昆明佳亿房地产开发有限责任公司,915301036979928036,2010-01-06,N/A,N/A,"10,000(万元人民币)","房地产开发经营（依法须经批准的项目，经相关部门批准后方可开展经营活动）",云南,昆明,"云南省昆明市盘龙区凤凰村116号塑料厂办公楼3楼"
曲靖市云鹰机械制造有限公司,915303026979957726,2010-01-06,N/A,N/A,"58(万元人民币)","机械加工、冷作加工、农机加工；工矿配件、机械设备制作及销售。",云南,曲靖,"云南省曲靖市麒麟区白石江街道长河社区五组柳家凯盛建城内"
曲靖市鸿辰人才交流服务有限公司,91530302550112816T,2010-01-06,N/A,N/A,"200(万元人民币)","人才信息收集、整理、储存、发布和咨询；人才推荐、招聘、培训、测评；人事代理、社会保险代理。（依法须经批准的项目，经相关部门批准后方可开展经营活动）",云南,曲靖,"云南省曲靖市麒麟区小坡上村"
景洪鑫辉商贸有限公司,91532801550147146M,2010-01-06,N/A,N/A,"240(万元人民币)","家用电器、批发、零售；家电维修、安装服务。（依法须经批准的项目，经相关部门批准后方可开展经营活动）",云南,西双版纳,"云南省西双版纳州景洪市勐罕镇金橄榄财富中心3幢C01号"
昆明泛在物联网工程技术有限公司,91530100697963439R,2010-01-06,N/A,N/A,"100(万元人民币)","物联网技术、无线传感器、网络技术及相关计算机软硬件、网络设备的研究开发、物联网、无线传感网技术的咨询、服务；计算机软、硬件的安装维护及销售。",云南,昆明,"昆明市金实小区宏实园11幢1单元501号"
弥渡县正东土鸡养殖农民专业合作社,93532925MA6MXJTP92,2010-01-06,N/A,N/A,"N/A","为成员采购、供应养殖土鸡的生产资料、开展成员有关的养殖技术培训、交流及信息咨询服务。（依法须经批准的项目，经相关部门批准后方可开展经营活动）",云南,大理,"弥渡县弥城镇新庄村57号"
弥渡县连峰红雪梨产销农民专业合作社,9353292506426892XB,2010-01-06,N/A,N/A,"N/A","为成员采购供应红雪梨种植所需的生产资料；销售成员生产的产品；开展成员种植和经营有关的技术培训、交流及咨询服务。（依法须经批准的项目，经相关部门批准后方可开展经营活动）",云南,大理,"云南省大理白族自治州弥渡县密祉镇莲峰村委会"
玉溪康宁医疗器械有限公司,915304006979939617,2010-01-06,N/A,N/A,"160(万元人民币)","二类6864医疗卫生材料及敷料、6826物理治疗及康复设备、6840临床检验分析仪器、6823医用超声仪器及有关设备、6857消毒和灭菌设备及器具。三类6866医用高分子材料及制品、6864医用缝合材料及粘合剂、6821医用电子仪器设备、6822医用光学器具、仪器及内窥镜设备、6824医用激光仪器、6825医用高频仪器设备、6831医用X射线设备、6854手术室、急救室、诊疗器具及设备、6815注射穿刺器械的销售；医疗器械租赁、汽车租赁、商业设施租赁。（依法须经批准的项目，经相关部门批准后方可开展经营活动）",云南,玉溪,"云南省玉溪市高新区文化路133-7号裕达华府一期1-2层5号"
云南中云建筑工程有限公司,91530000697992862Q,2010-01-06,N/A,N/A,"5,000(万元人民币)","工业与民用建筑工程、公路工程、水利水电工程、市政公用工程、园林绿化工程、园林景观工程、建筑装饰装修工程、机电设备安装工程、安防工程、土石方工程、钢结构工程、水电安装工程、公路城市照明工程；建筑材料、装饰材料、环保设备、金属材料、防水材料、机械设备、电器成套设备的销售。",云南,昆明,"云南省昆明市新亚洲体育城星都国际总部基地30幢101号"
玉溪永豪商贸有限公司,915304026979931956,2010-01-06,N/A,N/A,"20(万元人民币)","针纺织品、化妆品、洗涤、清洁用品及其他日用品的销售。（依法须经批准的项目，经相关部门批准后方可开展经营活动）",云南,玉溪,"云南省玉溪市红塔区星明巷1号2幢1单元501室"
云南汇百景园林绿化有限公司,915300006979940161,2010-01-06,N/A,N/A,"2,000(万)","城市园林绿化工程的设计与施工；生物工程技术咨询；道路桥梁工程设备、汽车配件、建筑材料、电子产品、五金交电、仪器仪表、家用电器、橡胶制品、普通机械及设备、苗木的销售；绿色生物防护技术服务。",云南,昆明,"云南省昆明市滇池路福海乡214号2幢3层018号"
昆明成冠亚科技有限公司,91530102697994446W,2010-01-06,N/A,N/A,"50(万元人民币)","计算机软件的开发、应用及销售；办公用品的销售；按《中华人民共和国医疗器械经营企业许可证》核准的经营范围的时限开展经营活动（依法须经批准的项目，经相关部门批准后方可开展经营活动）",云南,昆明,"云南省昆明市五华区人民中路都市名园A座(A幢)1602号"
云南广电房地产开发有限公司,9153010069799274XR,2010-01-06,N/A,N/A,"1,000(万元人民币)","房地产开发、经营；房屋租赁；建筑材料销售；物业管理（依法须经批准的项目，经相关部门批准后方可开展经营活动）",云南,昆明,"云南省昆明市高新技术开发区二环西路西苑立交桥旁软件大厦14楼"
昭通市昭阳区恐龙网络服务有限公司,91530602697994374X,2010-01-06,N/A,N/A,"3(万元人民币)","网吧活动；预包装食品、乳制品（不含婴幼儿配方乳粉）的零售",云南,昭通,"云南省昭阳区枫园路36-37号"
楚雄市运通货运物流有限公司,91532300697994526N,2010-01-06,N/A,N/A,"600(万元人民币)","普通货运；大型设备运输；货运代理；集装箱多式联运；货运信息服务；货物装卸、仓储；金属材料及制品、建材、矿产品、农产品、办公用品、计算机及配件、汽车零配件、日用品、机电产品、装饰材料、化工产品批发、零售；化肥零售；国内贸易、货物及技术进出口。（依法须经批准的项目，经相关部门批准后方可开展经营活动）",云南,楚雄,"楚雄开发区程家坝(楚雄汽车城)"
中国人寿保险股份有限公司元江县支公司东峨营销服务部,915304285501007861,2010-01-06,N/A,N/A,"N/A","对营销员开展培训及日常管理；收取营销员代收的保险费、投保单等单证；分发保险公司签发的保险单、保险收据等相关单证；接受客户的咨询和投诉；经保险公司核保，营销服务部可以打印保单；经保险公司授权，可以从事部分险种的查勘理赔工作。（依法须经批准的项目，经相关部门批准后方可开展经营活动）",云南,玉溪,"元江县东峨镇红光街49号"
