河南隆祥药业有限公司,91410700172924867R,1982-09-11,N/A,N/A,"2,050(万元)","中成药、中药材、中药饮片、化学药制剂、抗生素、生化药品、生物制品（除疫苗）、麻醉药品（限新乡市）、精神药品（第一类）（限新乡市）、医疗用毒性药品、第二类精神药品（制剂）、罂粟壳、蛋白同化制剂、肽类激素药品批发；医疗器械、化妆品、日化用品、消毒杀菌用品、百货、纺织品销售；康复服务；预包装食品兼散装食品、保健品批发兼零售；山药粉、木耳粉加工；山药粉、木耳粉、三七粉、西洋参粉、红豆薏苡仁粉保健粉销售；",河南,新乡,"新乡市卫滨区解放大道119号"
河南省丰源工业设备安装有限公司,91411400576308649K,1982-09-15,N/A,张传勇,"2,245(万元)","锅炉、起重机械、压力管道安装、改造、维修，压力容器设计、制造，电气、暖通、汽轮机、热工仪表、行车、机电设备安装、维修，油罐制造、安装（以上项目凭证经营）；氧气销售及气瓶充装",河南,商丘,"商丘市胜利西路231号"
陕县原店镇供销社鑫秦购销站,91411222MA404DRA5M,1982-09-16,集体事业单位营业,周玉峰,"N/A","糖烟酒、食品、副食品、饮料。",河南,三门峡,"三门峡市西站"
尉氏县朱曲供销合作社工商联营批发部,91410223MA40570HXP,1982-10-01,集体分支机构(非法人),李红花,"N/A","百货、针织品、日杂、服装。",河南,开封,"尉氏县朱曲镇"
宜阳县赵保供销合作社,91410327171630859B,1982-10-17,集体所有制,张利民,"65万人民币","百货、杂品、针纺织品、烟酒、副食品、五金交电、化肥。",河南,洛阳,"洛阳市宜阳县赵保乡东赵村"
尉氏县朱曲供销合作社化肥门市部,91410223MA40570P5K,1982-10-30,集体分支机构(非法人),何付林,"N/A","化肥",河南,开封,"尉氏县朱曲镇西街"
夏邑县车站供销社营业楼,91411426MA403YUJXT,1982-11-30,集体分支机构(非法人),杨广运,"N/A","针纺织品、服装鞋帽、文化体育用品、日用百货＊",河南,商丘,"夏邑县车站镇"
商丘市睢阳区冯桥供销合作社,91411403175134596N,1982-12-10,集体所有制,余昉财,"25.3万人民币","农药（不含杀鼠剂）、化肥、农膜、化工产品（不含易燃易爆物品）、针纺织品、百货、五金交电、日用杂品零售*",河南,商丘,"商丘市睢阳区冯桥供销社路北"
河南高中压阀门有限公司,9141018217035344X3,1982-12-17,N/A,付万年,"6,000.0889(万元)","阀门制造、销售、维修；销售水暖配件、风机",河南,郑州,"荥阳市高山镇竹川"
