中国石化销售有限公司新疆巴州石油分公司库尔勒团结南路八号加油站,916528007789734527,2005-09-08,N/A,查云,"N/A","零售：汽油、柴油、预包装食品、卷烟批发零售：日用杂货、润滑油、石蜡、其他化工产品、其他日用品、家用电器、通讯器材、其他农畜产品、棉纺织品、化肥、农业机械、化妆品、五金交电、服装、鞋帽、计算机、软件及辅助设备、文具体育用品、工艺品、厨房、卫生间用具、洗涤用品、首饰、建材、照相器材、鲜花、电子产品，航空票务代理服务，汽车清洗服务，房屋租赁，场地租赁，广告发布及代理服务，代办移动通信业务",新疆,巴音郭楞,"新疆巴州库尔勒市团结南路"
乌鲁木齐冠林商贸有限公司,91650104778973671E,2005-09-08,N/A,杨应新,"50(万元人民币)","销售：机电产品、五金交电、工程机械设备、橡胶制品、钢材、塑料制品、电子产品、电线电缆、建材、石油制品、汽车及配件工艺美术品、办公用品、文化用品、体育器材、玻璃制品、皮棉、家用电器、厨具、家具、花卉、计算机及配件、耗材、办公自动化设备、农畜产品、日用百货。",新疆,乌鲁木齐,"新疆乌鲁木齐市新市区阿勒泰路1695号"
乌苏市明新棉业有限责任公司,916542027789723459,2005-09-08,N/A,潘建川,"2,010(万元人民币)","籽棉加工，籽棉收购，销售，农作物的种植及销售，化肥、地膜的销售。",新疆,塔城,"新疆塔城地区乌苏市石桥乡杨树村"
乌鲁木齐晋江华强防火涂料有限公司,91650106778973700N,2005-09-08,N/A,王清波,"5,000(万)","防火隔热涂料、消防产品的生产及销售；销售：涂料；消防设施工程专业承包。",新疆,乌鲁木齐,"新疆乌鲁木齐市沙依巴克区种牛场二阶台东2-6号"
乌鲁木齐市沈泉泵业有限公司,91650104778975386C,2005-09-08,N/A,刘庆阳,"30(万)","零售：机电产品，建筑材料，机械设备，五金交电，电线电缆，汽车配件，建材，钢材，园林机械，排灌设备，水泵的零售、维修。",新疆,乌鲁木齐,"新疆乌鲁木齐市新市区阿勒泰路53号"
乌鲁木齐中新雅商贸有限公司,91650100778974500U,2005-09-08,N/A,盛志诚,"50(万)","销售：电力电缆及附件，机电产品，电子产品，五金交电，石油制品（成品油除外），化工产品（危险化学品除外），劳保用品，日用百货，通信器材",新疆,乌鲁木齐,"新疆乌鲁木齐市新市区新医路463号惠源大厦513室"
乌鲁木齐市君捷石化有限公司,916501007789727247,2005-09-08,N/A,牛江杰,"501(万)","电器设备、仪器仪表、石油制品、化工产品、橡胶制品、塑料制品、劳保用品、建筑材料、五金交电、农畜产品的销售；石油设备、水处理设备的制作及加工、咨询服务；泵及相关产品维修；水处理设备维修",新疆,乌鲁木齐,"新疆乌鲁木齐市高新区(新市区)苏州东街568号金邦(公寓)大厦1栋5层505"
乌鲁木齐红利商贸有限公司,91650105778972716L,2005-09-08,N/A,孙亮民,"30(万)","计算机技术咨询服务。",新疆,乌鲁木齐,"新疆乌鲁木齐市水磨沟区新民东街57号3栋1单元606室"
新疆图木舒克新赛油脂有限公司,91659003778976506J,2005-09-09,N/A,赵建江,"3,700(万)","植物油生产、加工（精炼）、销售",新疆,图木舒克,"新疆图木舒克市工业区"
乌鲁木齐市荣庆贸易有限公司,91650105778975976U,2005-09-09,N/A,赵勤,"50(万)","销售：五金交电，金属材料，日用百货，轻工产品，纺织品，机电产品，农畜产品。",新疆,乌鲁木齐,"新疆乌鲁木齐市水磨沟区昆仑路127号2栋5单元402室"
新疆天章房地产开发有限公司,9165010077897501XH,2005-09-09,N/A,蔡春雨,"2,000(万)","房地产开发、销售，房地产经纪，建筑机械设备租赁、销售；销售：建材，装饰装潢材料，五金交电，机电产品，消防器材，防水材料，橡胶制品，农畜产品，房屋租赁。",新疆,乌鲁木齐,"新疆乌鲁木齐经济技术开发区广州路5号"
乌鲁木齐轶杰进出口贸易有限公司,9165010377897798XM,2005-09-09,N/A,哈俊虎,"50(万)","服务：货物与技术的进出口业务，机械设备及租赁：销售：服装鞋帽，纺织品，电脑软件及耗材，化工产品（化学危险品除外），通讯器材，机电设备，电线电缆，建筑材料，装饰装璜材料，五金交电，塑料制品，照明设备，汽车",新疆,乌鲁木齐,"新疆乌鲁木齐市沙依巴克区九家湾五队"
伊犁鑫达再生资源有限责任公司昭苏县第六回收站,91654026MA7769B46W,2005-09-09,N/A,路传荣,"N/A","废旧资源回收及加工",新疆,伊犁哈萨克,"新疆伊犁州昭苏县洪纳海西街(11-25号)"
新疆雨润建筑园林安装工程有限公司,91659003781774016A,2005-09-09,N/A,尹才兵,"12,700(万)","城市园林绿化贰级，建筑工程施工总承包贰级，公路工程施工总承包叁级，水利水电工程施工总承包叁级，石油化工工程施工总承包叁级，市政公用工程施工总承包贰级，钢结构工程专业承包叁级，建筑装修装饰工程专业承包叁级，建筑机电安装工程专业承包叁级，古建筑工程专业承包叁级；景观工程设计施工，喷滴灌设计安装，仿古建筑，水电暖安装；园林机械设备，喷滴灌材料，苗圃苗木，二三类机电产品销售及租赁；植物生长剂及植物调节剂销售；建筑材料，预制构件，钢模租赁；自动化电动门，太阳能热水器，塑料门窗，钢化玻璃，铝合金门窗，供排水管材加工、制作。",新疆,图木舒克,"新疆图木舒克市19号小区6号楼"
陕西光大建设工程有限公司巴州分公司,91652801778981225R,2005-09-09,N/A,刘蓓蕾,"N/A","房屋建筑工程、化工石油设备管道安装工程、防腐保温工程、建筑防水工程、电信工程、公路路基工程。",新疆,巴音郭楞,"新疆巴州库尔勒市萨依巴格辖区人民东路1幢15层1单元1508号"
哈密市富民矿业开发有限责任公司,91652200778991749Y,2005-09-09,N/A,俞仁山,"20(万)","石灰石、砂石、片石、农产品",新疆,哈密,"新疆哈密地区哈密市七角井镇开发区"
阿拉尔市塔里木驾校有限公司,916590027817538807,2005-09-09,N/A,冯毅,"10(万)","汽车、机动车驾驶员培训",新疆,阿拉尔,"新疆阿拉尔市虹桥路2号"
哈密市向阳物业管理有限责任公司,91652201778975984T,2005-09-09,N/A,尹玉新,"50(万)","场地租赁、家政服务。",新疆,哈密,"新疆哈密地区哈密市向阳路53号(地下室)"
库车银花棉业有限责任公司,9165292377895290XT,2005-09-09,N/A,孙伟挺,"500(万)","籽棉收购加工和销售；棉副产品收购加工销售；棉机配件、包装材料销售；种植业、养殖业。",新疆,阿克苏,"新疆阿克苏地区库车县乌尊镇色根苏盖提村"
乌苏市九方电子有限责任公司,91654202731804563J,2005-09-10,N/A,刘洁,"500(万)","销售：文化用品、计算机、软硬件及耗材、办公设备及用品、通讯器材、数码产品、仪器仪表、监控器材、电线电缆、机房设备、防盗报警监控系统、电子元器件、消防器材、机械设备，农副产品；办公自动化系统、网络维护、报警系统、监控系统的设计安装、维修；设备租赁。销售、安装：安检设备、净水设备、家用电器、音响广播系统、系统集成项目；楼宇对讲系统、门禁道闸系统",新疆,塔城,"新疆塔城地区乌苏市新区办事处文德路1号院翰林苑小区5栋1-1室"
富蕴县乔夏哈拉金铜矿业有限责任公司,916543222309622059,2005-09-10,N/A,陈杨,"4,855.5600(万)","铁矿、铜矿、金矿开采。铜精粉、铁精粉、球团加工、销售,金属及金属矿批发,钢材、废旧物资销售。",新疆,阿勒泰,"新疆阿勒泰地区富蕴县富兴路"
新疆华澳能源化工股份有限公司精细化工厂,91652324MA7755AT89,2005-09-11,N/A,胡小平,"N/A","油田轻烃系列产品开发、生产*。",新疆,昌吉,"新疆昌吉州玛纳斯县北沙漠"
库尔勒神雕广告有限公司,91652801778975220F,2005-09-12,N/A,李迎江,"10(万)","广告的制作、发布及代理；打字复印。**。",新疆,巴音郭楞,"新疆巴州库尔勒市石化大道梨香小区1幢一楼"
新疆和顺工程咨询有限公司,91650102781753688A,2005-09-12,N/A,陈文萍,"500(万)","工程管理服务。",新疆,乌鲁木齐,"新疆乌鲁木齐市天山区人民路446号南门国际城D3栋5层1号"
巴州东泰农资有限责任公司焉耆经销部,91652826778979125D,2005-09-12,N/A,刘彬,"N/A","零售：农药",新疆,巴音郭楞,"新疆巴州焉耆县光明路农资市场"
巴州国棉徽商农业科技有限公司,91652801778976880Y,2005-09-12,N/A,管怀友,"100(万元人民币)","农业技术推广，农业技术服务，批发零售：各类农作物常规种子，零售：化肥，批发零售：农膜、皮棉、棉短绒、棉籽、棉粕、塑料制品、滴灌设备。",新疆,巴音郭楞,"新疆巴州库尔勒市团结辖区兰干路奇乐花园3幢102室"
新疆文正汽车销售服务有限公司,91650100778979571A,2005-09-12,N/A,张全,"200(万)","销售：汽车",新疆,乌鲁木齐,"新疆乌鲁木齐市北站东路2号华南机械设备交易市场内29号"
乌苏市汇康棉业有限责任公司,916542027789774378,2005-09-12,N/A,程生旺,"500(万)","许可经营项目：籽棉加工。一般经营项目：籽棉收购，棉短绒的加工，籽棉、皮棉，棉短绒及副产品，棉花机械设备及配件、塑钢带、铁丝，包布，棉花打包套的销售；滴灌带的回收加工。。",新疆,塔城,"乌苏市古尔图镇"
新疆天富电力(集团)有限责任公司南山煤矿水沟分矿,91650000686478171L,2005-09-12,N/A,王宏刚,"N/A","矿山机电设备租赁。",新疆,石河子,"新疆石河子市南山石场镇"
石河子天富饭店管理有限责任公司,9165900177899523X7,2005-09-12,N/A,陈新德,"7,230.0600(万)","工艺美术品、日用百货的销售；打字、复印、染洗服务；房屋租赁；会议及展览服务；停车场服务。",新疆,石河子,"新疆石河子市北二路３小区２８号"
新疆三海保鲜园有限责任公司,91650000778977568B,2005-09-12,N/A,刘三海,"3,000(万)","炒货食品及坚果制品（烘炒类、其他类）、水果制品",新疆,乌鲁木齐,"新疆乌鲁木齐市头屯河区工业园"
库车县供销社塔里木基层社,916529237223486748,2005-09-12,集体所有制,胡明,"62.6万人民币","住宿；针纺织品、日用百货、五金工具、日用杂品(烟花爆竹除外)、地膜、化肥、包装种子销售。",新疆,阿克苏,"新疆阿克苏地区库车县塔里木乡"
新疆兴华夏彩印有限公司,91650100778975685G,2005-09-12,N/A,胡超,"1,000(万)","许可经营项目：（具体经营项目和期限以有关部门的批准文件或颁发的行政许可证书为准）：自治区区域内的出版物、包装装潢印刷品、其他印刷品。一般经营项目：",新疆,乌鲁木齐,"新疆乌鲁木齐市西环北路1289号"
乌鲁木齐牧利农牧业设备有限公司,91650103778976135H,2005-09-12,N/A,祖新疆,"30(万元人民币)","销售：机械设备，五金交电，化工产品",新疆,乌鲁木齐,"新疆乌鲁木齐市沙依巴克区长江路155号"
阿勒泰地区金英财务咨询有限公司,91654301778976856D,2005-09-12,N/A,努尼沙·阿布德海俄木,"10(万元人民币)","代理记帐业务；社会经济咨询。",新疆,阿勒泰,"新疆阿勒泰地区阿勒泰市金山路三号区2栋"
乌鲁木齐圣银汽车服务有限公司,916501027789773493,2005-09-12,N/A,黄江华,"10(万元人民币)","服务：代办车辆审验、过户、年检、补办牌证的业务,商务信息咨询、税务代理。",新疆,乌鲁木齐,"新疆乌鲁木齐市天山区幸福中路21号"
乌鲁木齐百慕达文化传播有限公司,91650102778975079N,2005-09-12,N/A,周剑琴,"50(万)","国内各类广告的设计、制作、发布、代理，庆典服务，企业营销策划，会展服务，舞台音响器材安装调试",新疆,乌鲁木齐,"新疆乌鲁木齐市天山区团结路256号"
新疆中远海运国际货运有限公司霍尔果斯分公司,91654004778993306H,2005-09-12,N/A,赵秉俊,"N/A","承办海运进出口货物的国际运输代理业务，包括：揽货、订舱、中转、集装箱拼装拆箱、结算运杂费、报关、报验、保险、相关的短途运输服务及咨询业务。",新疆,伊犁哈萨克,"新疆伊犁州霍尔果斯口岸亚欧南路9号农业银行四楼"
新疆阿米娜生物科技有限公司,9165010077897595XQ,2005-09-12,N/A,阿米娜·阿布里米提,"100(万元人民币)","饮料",新疆,乌鲁木齐,"新疆乌鲁木齐市水磨沟区南湖东路77号"
乌鲁木齐昊翔盛业贸易有限公司,91650102778976178G,2005-09-12,N/A,刘刚,"50(万)","专业技术咨询，房屋租赁，房地产经纪，商务信息咨询。。",新疆,乌鲁木齐,"新疆乌鲁木齐市天山区新华北路8号"
新疆博达人才开发有限公司博乐分公司,91652701778982455A,2005-09-12,N/A,马静,"N/A","人才中介服务、劳务外包；人才资源开发、信息咨询，企业管理咨询、项目引进、家政服务、装卸服务、房地产租赁，国内劳务派遣。",新疆,博尔塔拉,"新疆博州博乐市北京南路468号(州人事局一楼)"
乌鲁木齐市天运通商贸有限公司,916501037789779633,2005-09-12,N/A,刘岐龙,"100(万)","航空货运代理销售：汽车配件，润滑油，五金交电，建材，装饰材料，农畜产品，土特产品，化工产品，机电产品，百货，针纺织品，机械设备及配件，办公家具，办公用品，厨房设备及用品，家用电器；家政服务，货运信息咨询，装卸服务，快递服务，设计、制作、发布、代理国内各类广告。",新疆,乌鲁木齐,"新疆乌鲁木齐市沙依巴克区和田街2号1栋2单元501室"
乌鲁木齐广轮汽车用品服务有限公司,91650104778979539Q,2005-09-13,N/A,徐菊荣,"80(万)","销售：汽车配件，轮胎，钢圈，电瓶，日用百货，办公用品，汽车用品。工业投资，农业投资，矿业投资，房地产投资，社会经济咨询，商务信息咨询。",新疆,乌鲁木齐,"新疆乌鲁木齐市新市区青海路南纬巷16号楼706室"
天安财产保险股份有限公司石河子中心支公司,91659001778991407E,2005-09-13,N/A,李和平,"N/A","企业财产损失保险、家庭财产损失保险、机动车辆保险、建筑工程保险、安装工程保险、短期健康保险、意外伤害保险、法定责任保险、一般责任保险、保证保险，上级公司在中国保监会批准范围内授权的其他财产保险业务。",新疆,石河子,"新疆石河子市40小区城区北四路292-C号"
乌鲁木齐奥特威工贸有限公司,916501037789757147,2005-09-13,N/A,马桂兰,"500(万)","批发（无仓储）：氢气、甲烷、氧[压缩的或液化的]、氮[压缩的或液化的]、氩[压缩的或液化的]二氧化碳[压缩的或液化的]、氯、氨、丙酮、乙醚、二硫化碳、石脑油、溶剂油[闭杯闪点≦60℃]、苯、粗苯、甲醇、乙醇、乙酸乙酯、煤焦油、正丁醇、萘、乌洛托品、硫化钠、连二亚硫酸钠、亚硝酸钠、氯酸钠、次氯酸钙、漂白粉、三氧化铬[无水]、重铬酸铵、重铬酸钠、重铬酸钾、三氯甲烷、苯胺、硫脲、硫酸、盐酸、氢氟酸、氯化亚砜、电池液[酸性的]、甲酸、三氯化铁、醋酸、磷酸、氢氧化钾、水合肼[含肼≦64%]、次氯酸钾溶液[含有效氯>5%]、次氯酸钠溶液[含有效氯>5%]、甲醛溶液、苯酚钠、汞、硫磺、高锰酸钾、高氯酸[浓度50%～72%]、过氧化氢、硝酸。销售：化工产品，塑料制品，机电产品，仪器仪表，水泵，阀门，防腐保温材料，汽车配件，润滑油，玻璃制品，橡胶制品，办公用品，农畜产品，土特产品，锅炉配件，水暖器材，劳保用品，电线电缆，钢材，金属材料，电子产品，化肥",新疆,乌鲁木齐,"新疆乌鲁木齐市新市区北站二路东一巷226号乌鲁木齐化工市场B3-372-1"
尼勒克县银龙湾旅游开发有限公司,91654028778977007R,2005-09-13,N/A,张明,"50(万)","洗浴、餐饮、住宿、旅游、娱乐服务；酒零售，旅游纪念品、日用百货零售。",新疆,伊犁哈萨克,"新疆伊犁州尼勒克县巴尔盖提"
新疆弋万国际贸易有限公司,91650102778975722K,2005-09-13,N/A,王平,"100(万)","销售：通信设备，计算机软硬件及耗材，电子产品，办公用品，五金交电，机电产品，化工产品，石油制品，润滑油，金属制品，日用百货，针纺织品，服装鞋帽，棉麻织品，装饰材料，建材，钢材，水暖器材，陶瓷制品，家用电器，农畜产品，机械设备，家俱，矿产品。",新疆,乌鲁木齐,"新疆乌鲁木齐市天山区光明路26号"
乌鲁木齐鑫盛天源电力自动化工程有限公司,9165010577897747X5,2005-09-13,N/A,张国良,"80(万)","电力设备的安装，电力工程施工，土木工程施工，室内外装饰装修工程施工，房屋建筑工程施工。",新疆,乌鲁木齐,"新疆乌鲁木齐市水磨沟区新兴街39号"
中国石化销售有限公司新疆喀什石油分公司阿克陶县第一号加油站,91653022778990893X,2005-09-13,N/A,王敬荣,"N/A","汽油、柴油零售；定型",新疆,克孜勒苏柯尔克孜,"新疆克州阿克陶县老城街(水电局旁)"
库尔勒博顺商贸有限责任公司,916528017789769362,2005-09-13,N/A,贺辉,"100(万)","零售：五金交电、其他化工产品、其他机械设备及电子产品、建材、针纺织品、文具及体育用品、其他日用品、家具、厨房卫生间用具、洗涤用品、计算机软件及辅助设备、家用电器、石油钻采专用设备及配件、通讯终端设备。。",新疆,巴音郭楞,"新疆巴州库尔勒市华凌市场贸易城四楼A区17、18号"
东莞徐记食品有限公司新疆分公司,91650100778980521U,2005-09-13,N/A,苌凤怀,"N/A","销售，配送本公司生产的产品；从事本公司产品同类商品销售；道路普通货物运输。",新疆,乌鲁木齐,"新疆乌鲁木齐市沙依巴克区扬子江路42号红十月东二区8号楼1单元1101室"
奎屯锦陆早种业科技发展有限公司,91654003778981276E,2005-09-13,N/A,李明,"2,000(万)","主要农作物常规大田用种和非主要农作物种子的批发、零售、代销；种子的生产，销售；皮棉，短绒，农业机械及设备，塑料制品，机电产品，成套电器设备的批发、零售；农业开发；农业技术研究、开发及推广咨询服务；房屋租赁；汽车租赁。",新疆,伊犁哈萨克,"新疆伊犁州奎屯市伊犁路63号"
伊犁鸿途交通运输有限责任公司,91654002778981161R,2005-09-14,N/A,范亚民,"1,000(万)","县内班车客运、道路普通货物运输、国际道路普通货物运输；机动车辆保险(交强险除外)、货物运输保险、意外伤害保险；货物配载、代办货物托运、装卸、过磅、保管、中转服务；货物信息咨询服务、停车服务、仓储服务(危险化学品及易燃易爆物品除外)；代定火车票、飞机票、汽车客运票服务；房屋租赁、场地租赁；煤炭、蔬菜、瓜果、建筑材料、汽车、环卫车辆、环保设备、除雪设备、消防车、消防设备、五金交电、机电产品（发电设备除外）、橡胶制品、照明设备及配件、太阳能设备、机械设备的销售；安防设备的安装及销售；道路救援服务，货物与技术的进出口业务，开展边境小额贸易；零售：汽车轮胎、汽车配件及用品，汽车美容及维修",新疆,伊犁哈萨克,"新疆伊犁州伊宁市公园街4巷7号"
新疆通汇建设集团有限公司第八工程分公司,91650109778976872T,2005-09-14,N/A,赵勇嘉,"N/A","房屋建筑，市政工程，水利水电，园林古建，装饰装修，公路工程；制造、安装、维修简易施工升降机。",新疆,乌鲁木齐,"新疆乌鲁木齐市米泉市稻香南路107号"
巴楚县新荣商贸有限公司新荣物流中心,9165313078175690XG,2005-09-14,N/A,顾莉萍,"N/A","货运站（场）经营，仓储(危险化学品除外)、配载，信息服务，理货服务,房屋租赁",新疆,喀什,"新疆喀什地区巴楚县迎宾北路东侧"
乌鲁木齐巨大物资有限公司,9165010377897771X3,2005-09-14,N/A,易彦均,"50(万)","销售：机电产品，金属材料，五金交电，建材，汽车配件，办公用品，日用百货，劳保用品，农畜产品，工矿配件。",新疆,乌鲁木齐,"新疆乌鲁木齐市沙依巴克区哈密路412号"
乌鲁木齐洁运油罐服务有限公司,91650106778979838K,2005-09-14,N/A,毛保新,"350(万)","各类油罐清洗，装卸、搬运",新疆,乌鲁木齐,"新疆乌鲁木齐市头屯河区火车西站劳动服务公司二楼"
新疆机场(集团)有限责任公司阿勒泰机场,916543007817993367,2005-09-14,N/A,郝宏云,"N/A","无航空地面服务和保障；仓储服务；国内机票销售代理、国内航空货运代理；飞机航线机务勤务保障；停车场服务；土地、场地、房屋及柜台的租赁；广告业；旅游纪念品、纺织品、服装鞋帽、日用百货的销售。",新疆,阿勒泰,"新疆阿勒泰地区阿勒泰市阿苇滩镇库布东村"
新疆海茵尔投资担保有限公司和田地区分公司,91653201778988005C,2005-09-14,N/A,顾宏武,"N/A","房地产项目的投资；诉讼保全担保，工程履约担保，农业综合开发，房屋租赁。",新疆,和田,"新疆和田地区和田市迎宾路22号"
克拉玛依市时代科力分析检测有限公司,916502007789886462,2005-09-14,N/A,赵波,"120(万元人民币)","质检技术服务；环境与生态监测。",新疆,克拉玛依,"新疆克拉玛依市友谊路138号"
新疆蓝钻农林科技有限公司,91650109778981620P,2005-09-14,N/A,王建民,"100(万)","水果制品、炒货食品及坚果制品、含茶制品及代用茶的分装、加工、生产、销售；批发兼零售：预包装食品。农业科学研究与试验发展；科技交流与推广服务。农用生产资料、农业机械、五金交电、日用百货、建材、农副产品、化工产品的销售。货物与技术的进出口业务；农畜产品、棉花、农副土特产品的收购、加工、销售；林果种植。",新疆,乌鲁木齐,"新疆乌鲁木齐市米东区芦草沟乡芦草沟村二队"
新疆东海渔村大酒店有限公司,91650100778977496P,2005-09-14,N/A,陈阿圣,"150(万元人民币)","会议接待，商务代理，房屋租赁。",新疆,乌鲁木齐,"新疆乌鲁木齐市水磨沟区南湖北路933号"
新疆特精纺织有限公司,91659001778978149T,2005-09-14,N/A,汤闽华,"3,000(万)","棉纱、网套、纸管的生产销售；皮棉、打包布的购销；农副产品、籽棉收购；棉纺织品的销售；纺织机械设备的进出口贸易。",新疆,石河子,"新疆石河子市一二二团东野棉纺厂内"
新疆三友机电产品有限公司,91650103778980994E,2005-09-14,N/A,黄桂秋,"50(万元人民币)","货物与技术的进出口业务；销售：机电产品，五金交电，化工产品",新疆,乌鲁木齐,"新疆乌鲁木齐市沙依巴克区南昌路398号"
阜康市根成建材有限责任公司,9165230277897763X4,2005-09-14,N/A,杨根成,"100(万)","建筑用砂开采销售；荒山绿化；停车场经营；水泥预制构件生产销售；机械设备租赁；农业灌溉用水销售;建筑用轻型条板、陶粒砖生产销售；房屋租赁；房产经纪服务",新疆,昌吉,"新疆昌吉州阜康产业园阜东二区（甘河子镇北侧甘河子镇东干渠西侧）"
库尔勒新伟豪商贸有限责任公司,91652801778978245N,2005-09-14,N/A,叶继杰,"100(万元人民币)","批发零售：家具、五金交电、建材、其他日用品、其他化工产品、针纺织品、文具及体育用品、家用电器，加工：家具",新疆,巴音郭楞,"新疆巴州库尔勒市北山路华凌市场贸易城四楼Ａ区２１－２６号"
乌鲁木齐市人和兴业商贸有限公司,91650102778982631X,2005-09-14,N/A,杨异,"200(万元人民币)","销售：化工产品及原料，针纺织品，皮棉，棉纱，服装鞋帽，皮革制品，摄影器材，音响设备及器材，文化用品，办公用品，玩具，洗涤化妆品，工艺美术品，首饰，通讯器材及设备",新疆,乌鲁木齐,"新疆乌鲁木齐市天山区新华南路379号键龙金融中心大厦21层12号"
特克斯县巨康有机肥业有限责任公司,91654027778976653Y,2005-09-14,N/A,陈林峰,"68(万)","有机复合肥、生物有机复合肥、花肥、腐殖酸胺的销售。",新疆,伊犁哈萨克,"新疆伊犁州特克斯县齐勒乌泽克乡"
五家渠鸿翔驾校有限公司,91659004778979037G,2005-09-14,N/A,陈昱心,"50(万)","普通机动车驾驶员培训三级。 。",新疆,五家渠,"新疆五家渠市军垦南路683号"
新疆正祥财务管理咨询有限公司呼图壁分公司,91652323781753477B,2005-09-14,N/A,王佳,"N/A","财务管理咨询；企业管理及经济信息咨询服务。",新疆,昌吉,"新疆昌吉州呼图壁县东风路82号(六街10区1院"
石河子市永鑫建筑劳务有限公司,916590017789836425,2005-09-14,N/A,顾晶晶,"200(万)","建筑劳务",新疆,石河子,"新疆石河子市北泉镇北泉路366-9号(国家农业科技园区)"
