中国石化销售有限公司新疆巴州石油分公司库尔勒英下乡农机加油站,91652800738390877H,2005-03-28,N/A,查云,"N/A","零售：汽油、柴油、预包装食品、卷烟，批发零售：日用杂货、润滑油、石蜡、其他化工产品、其他日用品、家用电器、通讯器材、其他农畜产品、棉纺织品、化肥、农业机械、化妆品、五金交电、服装、鞋帽、计算机、软件及辅助设备、文具体育用品、工艺品、厨房、卫生间用具、洗涤用品、首饰、建材、照相器材、鲜花、电子产品，航空票务代理服务，汽车清洗服务，房屋租赁，场地租赁，广告发布及代理服务，代办移动通信业务",新疆,巴音郭楞,"新疆巴州库尔勒市英下乡"
克拉玛依市万安机动车综合性能检测服务有限公司,91650200770394165E,2005-03-28,N/A,徐建国,"385(万)","汽车检测。",新疆,克拉玛依,"新疆克拉玛依市阿山路5号"
乌鲁木齐吉通达物流有限公司,91650103770395715Q,2005-03-28,N/A,郑大利,"30(万元人民币)","三级零担货运；信息咨询服务，机械设备及租赁；销售：汽车配件，农畜产品。",新疆,乌鲁木齐,"新疆乌鲁木齐市沙依巴克区棉花街南三巷10号"
克拉玛依兆源科技有限公司,91650200770393007H,2005-03-28,N/A,岳才东,"200(万元人民币)","与石油和天然气开采有关的服务活动；专用化学试剂和助剂、化学用品制造；建材、文化用品、劳动防护用品、电子产品、其他机械设备、其他化工产品销售；汽车租赁；技术推广、其他科技服务。",新疆,克拉玛依,"新疆克拉玛依市南苑小区43栋甲44-15-4号"
博尔塔拉蒙古自治州同创广告有限责任公司,916527017734802101,2005-03-28,N/A,王维全,"50(万)","广告的制作、发布及代理。",新疆,博尔塔拉,"新疆博州博乐市商业步行街9-201"
乌鲁木齐简洁装璜设计有限公司,91650103770399492K,2005-03-28,N/A,段宗年,"200(万)","装璜设计；室内装饰装修，水电暖安装，照明电器线路安装。",新疆,乌鲁木齐,"新疆乌鲁木齐市沙依巴克区友好南路417号天章大厦2310室"
克拉玛依市广丞房地产经纪有限公司,91650200770393752Y,2005-03-28,N/A,马恩强,"50(万)","企业财产保险、家庭财产保险、意外伤害保险代理；房地产经纪；房地产咨询服务；数码摄影；广告的制作、发布及代理；室内装饰装修；电脑设计。",新疆,克拉玛依,"新疆克拉玛依市友谊路169号友谊大厦712-713室"
乌鲁木齐华民劳务派遣有限公司,91650103770397075M,2005-03-29,N/A,李继中,"200(万)","服务：劳务派遣，清洁服务。",新疆,乌鲁木齐,"新疆乌鲁木齐市沙依巴克区牛奶一巷21号2单元202室"
伊宁市航讯信息咨询服务有限公司,916540027703949070,2005-03-29,N/A,岳玲,"10(万)","票务信息咨询服务；代购、代订、代销汽车、火车、飞机票。",新疆,伊犁哈萨克,"新疆伊犁州伊宁市飞机场路3号"
乌鲁木齐市世纪领航技术开发有限公司,916501027703984579,2005-03-29,N/A,党青锋,"200(万)","计算机软硬件开发及咨询；销售：计算机软硬件及耗材、汽车设备、公路检测设备、机械设备、摩托车配件、五金交电,化工产品，建材，机电产品，金属材料，矿产品，服装鞋帽，皮具，针纺织品，日用百货，办公用品，农畜产品，文体用品。",新疆,乌鲁木齐,"新疆乌鲁木齐市天山区中山路南巷51号2-22"
乌鲁木齐有为测绘服务有限公司,91650103770397606K,2005-03-29,N/A,王梓淇,"50(万元人民币)","工程测量、地籍测绘。一般经营项目：测绘仪器销售及租赁；商务信息咨询；销售：通讯产品，实验仪器，化工产品，建筑材料，文体用品，机电产品，电子产品，计算机软硬件及耗材，机械设备。",新疆,乌鲁木齐,"新疆乌鲁木齐市沙依巴克区扬子江路213号红十月西二区13-2-401室"
伊犁乐峰路桥建筑有限公司,91654000770397366R,2005-03-29,N/A,赵庆芬,"4,300(万元人民币)","建筑施工(见资质证书)、道路普通货物运输、机械设备租赁。",新疆,伊犁哈萨克,"新疆伊犁州伊宁市南环路858号城南壹号"
伽师县新科农牧开发有限责任公司,91653129770392688Q,2005-03-29,N/A,苏鹏,"110(万元人民币)","许可经营项目：无.。一般经营项目：农业种植，畜牧养殖，林木的培育和种植物，日用百货。",新疆,喀什,"伽师县哈里胡其农场"
乌鲁木齐白杨树文化传播有限公司,916501037703989082,2005-03-29,N/A,杨晓林,"10(万元人民币)","服务：文化交流，文化咨询，商务信息咨询，技术服务，会议策划，图片征集，文化创意策划。",新疆,乌鲁木齐,"新疆乌鲁木齐市沙依巴克区九家湾"
成都新路电脑有限责任公司乌鲁木齐分公司,916501036606489616,2005-03-29,N/A,李明,"N/A","计算机及通讯软、硬件产品生产和销售、以及售后服务。",新疆,乌鲁木齐,"新疆乌鲁木齐市沙依巴克区公园北街1号"
新疆合众时代商贸有限公司,91650100770398852K,2005-03-29,N/A,韩辉,"100(万)","销售：机械设备，节能环保设备，电气系统设备，服装鞋帽，家具，五金交电，计算机及配件，金属材料，通讯设备，建筑材料，矿产品，仪器仪表，电线电缆，日用品，农畜产品；节能环保产品的技术开发；电子产品的销售及售后服务；园林绿化工程",新疆,乌鲁木齐,"新疆乌鲁木齐市天山区青年路17号阳光花苑B栋607室"
巴州万方汽车运输有限公司和静分公司,916528277703936802,2005-03-29,N/A,蔡斌,"N/A","公路客运服务，道路货物运输，客运出租，汽车租赁，货运信息服务。",新疆,巴音郭楞,"新疆巴州和静县和静镇天鹅湖路"
新疆西夏旅行社有限公司,9165280177039654X2,2005-03-30,N/A,李君,"100(万)","国内旅游业务，入境旅游业务；批发零售：其他日用品，运输代理服务，汽车租赁，民航票务代理，会议服务。",新疆,巴音郭楞,"新疆巴州库尔勒市人民东路巴州宾馆大门门面房"
哈密成正矿业有限责任公司,916522007703965900,2005-03-30,N/A,王燕华,"200(万)","许可经营项目：无。一般经营项目：（国家法律、行政法规有专项审批的项目除外）：矿产品的加工；矿石、碎石、砂石料、化工产品、五金交电",新疆,哈密,"新疆哈密地区哈密市八一路西侧新禧花园7-1706（A2）"
克拉玛依市中太机械制造有限公司,91650200770395176R,2005-03-30,N/A,魏巍,"500(万元人民币)","道路普通货物运输；装卸搬运；1、2类压力容器、油田用加热炉、油田用热煤炉、油田用换热器安装、改造、维修；油田注气锅炉维修；机械零部件加工；机械设备维修及销售；油田技术咨询服务；五金产品、电子产品、化工产品销售；金属包装容器、金属结构件制作。",新疆,克拉玛依,"新疆克拉玛依市天池南小区42-5号"
新疆蓝特通信技术有限公司,9165900477039574XY,2005-03-30,N/A,陈沛然,"3,200(万)","通信业务网、电信支撑网、电信基础网的方案策划设计、设备配置与选型、软件开发，工程实施、工程后期的运行保障及相关服务；铁塔维修，通信网络方案策划、设计；电子产品、通信产品的销售、维护；计算机软硬件的开发、销售、维护；农畜产品销售；商务信息咨询。",新疆,五家渠,"新疆五家渠市北京路1309号(新疆总部基地一期29号楼3单元)"
喀什亨达矿业有限公司,916531017703958382,2005-03-30,N/A,范美荣,"50(万元人民币)","矿产品的收购、粗加工及销售。",新疆,喀什,"新疆喀什地区喀什经济开发区深喀大道总部经济区远方财富中心18座04-03号"
和田地区安康医药零售连锁有限责任公司十一分店,916532007734828735,2005-03-30,N/A,周燕,"N/A","零售：中成药、化学药制剂、抗生素、生化药品、生物制品（处方药、非处方药）、三类医疗器械、保健品、预包装食品，柜台出租",新疆,和田,"新疆和田地区和田市北京西路"
冠新软件股份有限公司,91650100781756053E,2005-03-30,N/A,洪继群,"6,495(万)","信息工程系统集成；计算机软硬件开发、销售，网络综合布线；销售：医疗器械一类二类，电子产品，通讯产品，针纺织品，家用电器，农畜产品，皮棉，计算机耗材，办公用品，服装鞋帽，文体用品，汽车配件，五金交电，水暖建材；计算机维修，计算机软件安装、维护、技术服务，计算机及网络的信息咨询服务，网络技术维护及技术咨询服务；计算机及辅助设备租赁。",新疆,乌鲁木齐,"新疆乌鲁木齐经济技术开发区大绿谷喀纳斯湖路455号新疆软件园大中型企业区E1栋8层"
和田地区安康医药零售连锁有限责任公司十分店,91653200773482865A,2005-03-30,N/A,安世锋,"N/A","零售：中成药、化学药制剂、抗生素、生化药品、生物制品（处方药、非处方药）、三类医疗器械、保健品、预包装食品，柜台出租",新疆,和田,"新疆和田地区和田市迎宾路20号"
和田地区安康医药零售连锁有限责任公司十五分店,91653200773482910B,2005-03-30,N/A,安世锋,"N/A","零售：中成药、化学药制剂、抗生素、生化药品、生物制品（处方药、非处方药）、三类医疗器械、保健品、预包装食品，柜台出租",新疆,和田,"新疆和田地区和田市乌鲁木齐北路200号"
伊犁鑫维商贸有限责任公司汽车维修分公司,91654002751652894N,2005-03-30,N/A,刘镇华,"N/A","货车维修（二类）、乘用车维修",新疆,伊犁哈萨克,"新疆伊犁州伊宁市福田街2号3-54-25中嘉·佰汇汽配城B1号楼101号"
哈密经纬测绘有限责任公司,916522007734571767,2005-03-30,N/A,何卫东,"70(万元人民币)","测绘及其相关服务",新疆,哈密,"新疆哈密地区哈密市广场北路38号"
乌鲁木齐金鑫豪森商贸有限公司,91650105770399556E,2005-03-30,N/A,南新茹,"50(万)","销售:钢材,建材,水暖配件,装饰装潢材料,机电产品,电脑耗材,办公用品,机械产品,汽车配件,五金工具,润滑油,电瓶,橡胶制品,化工产品,五金交电,日用百货,皮棉,棉短绒,农蓄产品,不锈钢材料加工。",新疆,乌鲁木齐,"新疆乌鲁木齐市水磨沟区西虹东路681号3-1-404室"
乌鲁木齐鑫银河贸易有限公司,916501047703984651,2005-03-30,N/A,张军,"200(万)","销售：通讯产品（二手手机销售除外），电力器材，五金交电，电缆，机电产品，仪器仪表，石油制品，化工原料",新疆,乌鲁木齐,"新疆乌鲁木齐市新市区柳州路156号"
和田地区安康医药零售连锁有限责任公司九分店,91653200773482857F,2005-03-30,N/A,安世锋,"N/A","零售：中成药、化学药制剂、抗生素、生化药品、生物制品（处方药、非处方药）、三类医疗器械、保健品、预包装食品，柜台出租",新疆,和田,"新疆和田地区和田市阿恰勒西路"
太原王孝雄建筑设计院(有限公司)伊犁分公司,91654002773462792X,2005-03-30,N/A,张新柱,"N/A","建筑工程及相应的工程咨询和装饰设计,建筑科技推广应用",新疆,伊犁哈萨克,"新疆伊犁州伊宁市解放路243号金融大厦七层"
伊犁金算盘代理咨询有限责任公司,91654002773452156C,2005-03-30,N/A,张锦钟,"10(万)","企业代理咨询；财务管理咨询；企业验资、审计、评估咨询服务；代办工商、税务登记咨询服务；代理商标注册、变更、延展、转让；商标设计的业务。",新疆,伊犁哈萨克,"新疆伊犁州伊宁市迎宾路与红旗交叉口(G区)16号楼二单元501室"
和田地区安康医药零售连锁有限责任公司十四分店,91653200773482902G,2005-03-30,N/A,安世锋,"N/A","零售：中成药、化学药制剂、抗生素、生化药品、生物制品（处方药、非处方药）、三类医疗器械、保健品、预包装食品，柜台出租",新疆,和田,"新疆和田地区和田市古江南路(塔西那宾馆楼下)"
中国石油天然气股份有限公司塔里木油田分公司巴楚县销售部,91653100773450134H,2005-03-30,N/A,刘纲,"N/A","化肥、地膜的销售。",新疆,喀什,"新疆喀什地区巴楚县巴尔楚克小镇四栋一单元1602室"
博尔塔拉蒙古自治州美途运输有限公司,9165270177039662XG,2005-03-30,N/A,赵龙海,"68(万元人民币)","普通货物运输；汽车配件、副油销售；汽车美容、机动车代理服务；货物与技术的进出口业务。",新疆,博尔塔拉,"新疆博州博乐市团结路(州养路工程队)"
新疆源新宏矿业技术服务有限公司,91650103770396515L,2005-03-30,N/A,李培成,"100(万)","矿产资源开发技术咨询服务、石油技术开发、商业信息咨询；销售：矿产品、有色金属、黑色金属、建筑材料、五金交电、机电产品、水暖器材、农副产品、汽车配件、日用百货、矿山开采设备。",新疆,乌鲁木齐,"新疆乌鲁木齐市长胜妖魔沟居民区"
哈密市明辉经贸有限责任公司,91652201770394878P,2005-03-30,N/A,张学辉,"260(万元人民币)","汽车配件、砂石料销售；货运信息服务；工程机械设备租赁；土石方工程挖运；房屋拆迁；土建工程；水利工程",新疆,哈密,"新疆哈密地区哈密市青年北路6号14号楼5单元201室"
新疆有色金属工业集团天池矿业有限责任公司阜康大平滩煤矿,916501007703956862,2005-03-30,N/A,黄益群,"N/A","煤炭开采、销售；煤炭技术咨询服务。",新疆,乌鲁木齐,"新疆昌吉州阜康市三工乡大平滩"
新疆深华视电子科技有限公司,91650100770397761L,2005-03-30,N/A,洪金春,"318(万元人民币)","电子产品的销售、安装、调试，通讯设备的销售、维修；销售：办公自动化设备，影像设备，照像器材，农畜产品。",新疆,乌鲁木齐,"新疆乌鲁木齐市沙依巴克区钱塘江路17号"
克拉玛依市卓越商贸有限公司,916502007703952648,2005-03-30,N/A,朱春环,"600(万元人民币)","道路货物运输；矿产品、建材及化工产品、机械设备（含发电机）、电子产品、五金产品、文化、体育用品、劳动防护用品、纺织、服装及家庭用品",新疆,克拉玛依,"新疆克拉玛依市克拉玛依区胜利路26-16-211号"
和田地区安康医药零售连锁有限责任公司一分店,91653200773484131H,2005-03-30,N/A,周燕,"N/A","零售：中药饮片、中成药、化学药制剂、抗生素、生化药品、生物制品（处方药、非处方药）、三类医疗器械、保健品、预包装食品，柜台出租",新疆,和田,"新疆和田地区和田市北京东路2号"
新疆戈壁绿洲废旧物资回收有限公司,91650109770398801D,2005-03-30,N/A,汪洋,"20(万)","再生物资回收与批发；废旧物资回收人员",新疆,乌鲁木齐,"新疆乌鲁木齐市米东区古牧地西路十八号"
和田地区安康医药零售连锁有限责任公司二分店,91653200773482785N,2005-03-30,N/A,安世锋,"N/A","零售：中成药、化学药制剂、抗生素、生化药品、生物制品（处方药、非处方药）、三类医疗器械、保健品、预包装食品、日用百货、化妆品，柜台出租",新疆,和田,"新疆和田地区和田市阿恰勒东路1号"
和田地区安康医药零售连锁有限责任公司六分店,91653200773482822W,2005-03-30,N/A,安世锋,"N/A","零售：中成药、化学药制剂、抗生素、生化药品、生物制品（处方药、非处方药）、三类医疗器械、保健品、预包装食品，柜台出租",新疆,和田,"新疆和田地区和田市迎宾路8号"
伽师县布拉克液化气供应有限责任公司,91653129761116366D,2005-03-30,N/A,木塔力甫·斯拉木,"50(万元人民币)","许可经营项目：无.。一般经营项目：液化气的储配、充装及灌装液化气的销售***。",新疆,喀什,"新疆喀什地区伽师县江巴孜乡十村"
昌吉市华顺运输有限责任公司,91652301770395678Q,2005-03-30,N/A,杨前,"10(万元人民币)","道路普通货物运输、货物专用运输（罐式容器）（在许可证有效期内经营）；提供代办机动车注册登记、转移登记、变更登记、抵押登记、申领机动车检验合格标志、补领机动车号牌登记证、行驶证服务；汽车租赁",新疆,昌吉,"新疆昌吉州昌吉市乌伊西路21号"
新疆国美电器有限公司库尔勒分公司,916528017703959936,2005-03-30,N/A,秦小砾,"N/A","普通货物运输，代售手机号源及不记名卡销售，批发零售：家用电器、其他日用品、针纺织品、五金交电、金属材料、其他机械设备及电子产品、其他化工产品、计算机、软件及辅助设备、建筑材料、通讯终端设备，专业音响的设计，安装调试，信息咨询，柜台租赁，场地租赁，仓储服务，家用电器、计算机维修，销售：预包装食品兼散装食品、粮油、消毒产品、化妆品、护肤用品、服装鞋帽；计算机软件研发及推广服务。***。",新疆,巴音郭楞,"新疆巴州库尔勒市金色时代广场一楼"
库尔勒黑土地农资有限责任公司米兰分公司,91652824773459569C,2005-03-30,N/A,胡卫军,"N/A","销售：农药",新疆,巴音郭楞,"新疆巴州若羌米兰镇长安路"
和田地区安康医药零售连锁有限责任公司五分店,916532007734828142,2005-03-30,N/A,安世锋,"N/A","零售：中成药、化学药制剂、抗生素、生化药品、生物制品",新疆,和田,"新疆和田地区和田市乌鲁木齐北路(英买里巷)5号2栋"
乌鲁木齐德顺恒商贸有限公司,91650103776096222Q,2005-03-30,N/A,李宗文,"330(万)","服务：房屋场地租赁。",新疆,乌鲁木齐,"新疆乌鲁木齐沙依巴克区马料地街平川路"
和田地区安康医药零售连锁有限责任公司四分店,916532007734828067,2005-03-30,N/A,周燕,"N/A","零售：中成药、化学药制剂、抗生素、生化药品、生物制品（处方药、非处方药）、三类医疗器械、保健品、预包装食品，柜台出租",新疆,和田,"新疆和田地区和田市文化路"
和田地区安康医药零售连锁有限责任公司十二分店,916532007734828810,2005-03-30,N/A,周燕,"N/A","零售：中成药、化学药制剂、抗生素、生化药品、生物制品（处方药、非处方药）、三类医疗器械、保健品、预包装食品、日用百货、化妆品，柜台租赁",新疆,和田,"新疆和田地区和田市台北路2号"
新疆农资(集团)有限责任公司墨玉县奎牙乡农佳乐直营店,91653222773456835Q,2005-03-31,N/A,乃比江·阿卜杜热西提,"N/A","销售：主要农作物种子（不再分装的包装种子）、化肥、农膜、茶叶",新疆,和田,"新疆和田地区墨玉县奎牙乡萨牙提村"
乌鲁木齐市三花制冷设备有限公司,916501007734501427,2005-03-31,N/A,胡莲芬,"300(万元人民币)","销售:制冷设备及配件,五金工具,电动工具,保鲜剂；制冷空调设备维修。",新疆,乌鲁木齐,"新疆乌鲁木齐市沙依巴克区长江路31号"
新疆广电网络股份有限公司塔城分公司,91654200757666429F,2005-03-31,N/A,李继,"N/A","有线电视工程网络传输的设计、安装及经营管理、信息网络传播视听业务广播电视节目传送业务、广播电视和网络设备及配件",新疆,塔城,"新疆塔城地区塔城市新华路19号"
喀什高地矿业有限责任公司,91653101770398289X,2005-03-31,N/A,韩冰,"30(万元人民币)","矿产品的收购、筛选及销售。",新疆,喀什,"新疆喀什地区喀什经济开发区深喀大道总部经济区川渝大厦7012室"
新疆农资(集团)有限责任公司墨玉县阿克萨拉依乡农佳乐直营店,91653222787630355K,2005-03-31,N/A,乃比江·阿卜杜热西提,"N/A","销售：主要农作物种子（不再分装的包装种子）、化肥、农膜、茶叶",新疆,和田,"新疆和田地区墨玉县阿克萨拉依乡尔巴格村"
哈密博宇矿业有限责任公司,91652200770399396W,2005-03-31,N/A,武兴平,"1,000(万元人民币)","矿产品的销售。",新疆,哈密,"新疆哈密地区哈密市广场北路38号"
乌鲁木齐市骏王工贸有限公司,91650105773466013W,2005-03-31,N/A,朱国华,"300(万)","机械设备租赁，房屋出租。",新疆,乌鲁木齐,"新疆乌鲁木齐市水磨沟区七道湾振业街南五巷10号"
哈密路通驾驶员培训有限责任公司,9165220076377301XT,2005-03-31,N/A,殷向东,"300(万)","餐饮服务；住宿；机动车驾驶员培训；场地租赁。",新疆,哈密,"新疆哈密地区哈密市火石泉"
鄯善县国经建筑劳务有限责任公司,916504217734759803,2005-03-31,N/A,周孝良,"125(万)","热力供应，[住宿，餐饮，烟酒，浴池（仅限分支机构经营）]、游泳馆。建筑劳务总承包，房屋拆迁；百货，公厕",新疆,吐鲁番,"新疆吐鲁番市鄯善县地税局游泳馆(新城青年路122号)"
新疆量子通信技术有限公司,9165010077039769XQ,2005-03-31,N/A,孙莉,"100(万)","通信技术服务；商务信息咨询，企业策划，计算机软件开发；销售：现代化办公设备，通讯设备、器材（二手手机除外），汽车配件，日用品，五金交电，化工产品，建材，文体用品，机电产品，电子产品，针纺织品，服装鞋帽，金属材料，橡胶制品，塑料制品，机械设备，电脑及软件，农畜产品，皮棉，劳保用品，化妆品，综合网络布线及其配套设备的设计施工",新疆,乌鲁木齐,"新疆乌鲁木齐市沙依巴克区文化宫路59号吉祥苑小区1栋B座805室"
乌鲁木齐市石人生态农业开发有限责任公司砖厂,91650109770396857N,2005-03-31,N/A,程岩魁,"N/A","生产、销售：多孔砖",新疆,乌鲁木齐,"新疆乌鲁木齐市东山区碱沟煤矿北山坡"
中国新疆伊犁州华侨旅行社有限责任公司,916540027734521647,2005-03-31,N/A,马军,"30(万元人民币)","国内旅游业务(具体以资质证书为准。",新疆,伊犁哈萨克,"新疆伊犁州伊宁市飞机场路26号昊丰伊景大厦1单元902号"
巴州联超商贸有限责任公司,91652801770396224H,2005-03-31,N/A,柴建,"30(万元人民币)","批发零售：计算机、软件及辅助设备、文具及体育用品、电子产品、通信设备(二手手机除外)、其他日用品、建材、其他机械设备、五金交电（磨砂机、切割机、电焊机、电钻机、发电机、粉碎机、机床除外）、家用电器、针纺织品、服装鞋帽、安防设备，软件开发、计算机维修、数据处理和存储服务、集成电路设计、信息系统集成服务、信息技术咨询服务、安全技术防范工程设计、施工、广告设计、发布制作及代理",新疆,巴音郭楞,"新疆巴州库尔勒市人民东路通力大厦2楼A区24号"
新疆天方云顶科技发展有限公司,9165010077039881X3,2005-03-31,N/A,石酩中,"510(万元人民币)","许可经营项目：无。一般经营项目：计算机软硬件开发，应用软件服务，网络维护，商务信息咨询，社会经济咨询，家政服务，仪器仪表的销售、维护；销售：电信器材，通讯设备，计算机耗材，机电产品，石油制品，化工产品，农畜产品，建材，装饰材料，针纺织品，服装鞋帽，办公用品，金属材料，日用百货。",新疆,乌鲁木齐,"新疆乌鲁木齐经济技术开发区校园路107号北大科技楼二楼231房间"
新疆挚龙工程技术有限公司,91650105770399484M,2005-03-31,N/A,张阳春,"1,600(万元人民币)","非开挖管道工程项目施工及技术咨询、技术服务。",新疆,乌鲁木齐,"新疆乌鲁木齐市水磨沟区温泉西路567号"
库尔勒诚久商贸有限责任公司,916528017703998047,2005-03-31,N/A,宋立,"30(万)","批发：五金交电、其他机械设备、建筑材料、农业机械、有色金属材料、汽车配件、家用电器、其他日用品、文具用品、计算机软件及辅助设备、建筑工程机械。＊＊＊。",新疆,巴音郭楞,"新疆巴州库尔勒市萨依巴格辖区青年路建宇综合楼二单元1003室"
新疆农资(集团)有限责任公司墨玉县扎瓦乡农佳乐直营店,91653222773456616E,2005-03-31,N/A,乃比江·阿卜杜热西提,"N/A","销售：主要农作物种子（不再分装的包装种子）、化肥、农膜、茶叶",新疆,和田,"新疆和田地区墨玉县扎瓦乡库台玛村326号"
新疆农资(集团)有限责任公司墨玉县农佳乐连锁店喀拉喀什镇第三直营店,916532227734566917,2005-03-31,N/A,乃比江·阿卜杜热西提,"N/A","销售：化肥、地膜。",新疆,和田,"新疆和田地区墨玉县喀拉喀什镇十四大队三小队"
昌吉市聚兴商贸运输有限责任公司,91652301770395862G,2005-03-31,N/A,熊新红,"10(万元人民币)","道路普通货物运输，货物专用运输（集装箱），大型物件运输",新疆,昌吉,"新疆昌吉州昌吉市西外环路全优农资市场二号楼三楼3-12号(126区1丘2栋)"
乌鲁木齐海诺尔装饰设计工程有限公司,91650102773454493A,2005-03-31,N/A,姜粉珍,"500(万)","在乌鲁木齐辖区承接住宅室内装修工程。",新疆,乌鲁木齐,"新疆乌鲁木齐市天山区人民路139号附18号"
新疆农资(集团)有限责任公司墨玉县萨依巴格乡农佳乐直营店,916532227734568861,2005-03-31,N/A,乃比江·阿卜杜热西提,"N/A","销售：主要农作物种子",新疆,和田,"新疆和田地区墨玉县萨依巴格乡卡如克萨依巴格村"
