昌吉市云飞商贸运输有限责任公司,91652301776063340K,2005-06-17,N/A,任道芳,"500(万)","道路普通货物运输；货物信息咨询服务；汽车保养服务；工程机械租赁；提供代办机动车注册登记、转移登记、变更登记、抵押登记、申领机动车检验合格标志、补领机动车号牌登记证、行驶证服务；装卸搬运。",新疆,昌吉,"新疆昌吉州昌吉市长宁南路联谊家园门面房(54区3丘97栋1层3商业-3)"
喀什新陆国际旅行社有限责任公司,916531017383643458,2005-06-17,N/A,郭拥军,"180(万)","入境旅游业务；国内旅游业务；货物和技术的进出口业务；会议接待；汽车租赁；销售：建材、水泥、矿产品、日用百货、装饰装修材料、农畜产品、体育用品、工艺美术品的销售",新疆,喀什,"新疆喀什地区喀什市帕依纳甫路20号"
和田昆仑畜产品开发实业有限责任公司,91653201776068627K,2005-06-17,N/A,艾比不拉·马合木地,"335(万元人民币)","牛、羊、家禽的定点屠宰。畜禽产品加工，动物及动物产品调运、销售，冷藏冷冻,饲料加工、销售，房屋租赁，水产品养殖。",新疆,和田,"新疆和田地区和田市伊力其乡托甫卡村"
新疆山花毯业商贸有限公司,91650100776059894K,2005-06-17,N/A,孙新学,"100(万)","销售：地毯，家具，五金交电，建筑材料，家用电器，布艺，日用品，服装鞋帽，金属材料，机械设备，水暖配件，机电产品，陶瓷，汽车配件，劳保用品，电子产品，玩具，轮胎，计算机耗材。",新疆,乌鲁木齐,"新疆乌鲁木齐市水磨沟区西虹东路266号昊坤大厦7层704室"
乌鲁木齐共同佳业科技有限公司,91650105778950904T,2005-06-17,N/A,王玲,"50(万)","销售：水处理设备，环保产品，热交换设备，建材，日用百货，五金交电，钢材，服装鞋帽，农畜产品，文体用品，机械设备，工艺品，化妆品，办公用品，计算机及耗材，橡胶制品，机械设备，塑料制品，针纺织品，装饰材料，通讯器材",新疆,乌鲁木齐,"新疆乌鲁木齐市水磨沟区新民路荣合小区17号楼3单元301室"
新疆南电鸿杰电力设备有限公司,91650103776064108X,2005-06-18,N/A,孙建宝,"100(万元人民币)","销售：阀门，减温、减压装置，空压机配件，锅炉配件，消防器材，仪器仪表，五金交电，化工产品（化学危险品除外），建材，机电产品，电子产品，机械设备，润滑油；电线电缆，劳保用品，茶具，金属材料，钢材，石棉，橡胶制品，水暖器材；货物与技术的进出口业务，电气的安装，专业技术咨询",新疆,乌鲁木齐,"新疆乌鲁木齐市沙依巴克区扬子江路213号红十月小区西区74号楼6单元401室"
新疆海旭工贸有限公司,91650100776068862T,2005-06-20,N/A,徐潇,"100(万)","销售：保健食品。销售：医疗器械，电子产品，建筑材料，农畜产品，土特产品，石油开采设备及配件，化工产品，五金交电，针纺织品，工艺品，陶瓷制品，防水、防腐、防火材料；电器控制装置的安装、调试、维修",新疆,乌鲁木齐,"新疆乌鲁木齐市水磨沟区温泉西路25号11号商铺"
新疆发尔缘建设工程有限公司,916501007760605457,2005-06-20,N/A,黄朝容,"3,000(万)","市政工程施工、设计、咨询，土石方工程施工、设计、咨询，装饰装修工程施工、设计、咨询，公路工程施工、设计、咨询，水利工程施工、设计、咨询，建筑工程施工、设计、咨询，园林绿化施工、设计、咨询，养护管理，荒山绿化，荒地种植，防沙治理，农牧业开发，林业开发，节水灌溉，农畜产品加工",新疆,乌鲁木齐,"新疆乌鲁木齐市水磨沟区会展北路南一巷60号"
新疆德顺成工贸有限公司,916501047760723788,2005-06-20,N/A,张作臣,"50(万)","销售：仪器仪表，建筑装饰材料，建筑设备，机电设备，五金交电，化工产品",新疆,乌鲁木齐,"新疆乌鲁木齐市新市区北京北路18号华联大厦1栋A座15F室"
乌鲁木齐宁钢商贸有限公司,91650100776063711Q,2005-06-20,N/A,刘忆,"100(万)","销售：五金交电，建材，钢材，塑钢制品，玻璃制品，计算机软硬件及耗材，农畜产品，服装，百货，办公用品。",新疆,乌鲁木齐,"新疆乌鲁木齐市水磨沟区南湖北路204号"
乌鲁木齐太合医疗器械有限公司,91650103776065645C,2005-06-20,N/A,杨建伟,"1,000(万)","销售：医疗器械,办公用品，仪器仪表，农畜产品，橡胶制品，化工产品（危险化学品除外），电子产品,计算机、软件及辅助设备；养殖，种植，其他技术推广服务，机械设备租赁",新疆,乌鲁木齐,"新疆乌鲁木齐市沙依巴克区阿勒泰路8号"
乌鲁木齐德昌物业服务有限责任公司,91650102776066672Y,2005-06-20,N/A,周光德,"300(万)","物业管理，房屋租赁，设备租赁，汽车租赁，清洗服务，家政服务,非占道停车服务；销售：钢材。",新疆,乌鲁木齐,"新疆乌鲁木齐市天山区解放北路1号"
喀什新德房地产开发有限公司,916531007760660826,2005-06-20,N/A,杨德芬,"1,000(万元人民币)","房地产开发与经营。房屋租赁；销售：建材、水泥、装饰装璜材料、服装、日用百货。",新疆,喀什,"新疆喀什地区喀什经济开发区深喀大道总部经济区川渝大厦5层"
哈密市玉龙工贸有限责任公司,91652201776065290C,2005-06-20,N/A,胡建刚,"50(万)","果品的销售；石材、矿产品的加工销售；五金",新疆,哈密,"新疆哈密地区哈密市益寿路(药厂旁)"
乌鲁木齐吉之鸟房地产服务有限公司,91650103776064343X,2005-06-20,N/A,张斌富,"100(万)","房地产经纪,企业形象设计、策划，家政服务，房屋租赁，汽车租赁，专业技术服务，婚介服务，旅游咨询服务；销售：计算机设备、软硬件及耗材，家用电器，通讯产品，电子产品，办公设备，家具，照相器材，洗涤用品，仪器仪表，五金交电，陶瓷制品，建材，钢材，化工产品，水暖器材，石英石，矿产品；沙盘及模型制作销售，工艺品及玉器加工销售，户外用品，酒店管理，装饰装修设计咨询，商务信息咨询，矿业咨询服务，矿产资源咨询服务。",新疆,乌鲁木齐,"新疆乌鲁木齐市沙依巴克区克拉玛依宾馆416号"
布尔津县融和民俗风情园旅游开发有限公司,91654321778976100W,2005-06-20,N/A,赵素菲,"2,500(万)","住宿旅游项目开发与产品的销售;农业投资开发;房地产投资和开发与经营，",新疆,阿勒泰,"新疆阿勒泰地区布尔津县河滨路"
新疆盛世华夏文化传媒有限公司,91650104776065055R,2005-06-20,N/A,刘学军,"100(万)","设计、制作、发布、代理国内各类广告，社会经济咨询，图文设计、制作，营销策划，会展服务，礼仪服务，房产经纪，计算机软硬件开发；销售：水暖建材，办公用品，文体用品，五金交电，机电产品，农畜产品，日用品。",新疆,乌鲁木齐,"新疆乌鲁木齐市新市区北京南路28号"
新疆朗天科技发展有限公司,916501097760646775,2005-06-20,N/A,叶仙君,"50(万)","销售：石油制品、化工产品、电力设备、建筑材料、消防器材；服务：汽车尾气检测、汽车安全性能检测。",新疆,乌鲁木齐,"新疆乌鲁木齐市米东区龙河南路426号"
乌鲁木齐龙海置业有限公司,91650100776064511L,2005-06-20,N/A,姚军,"2,000(万)","许可经营项目：无。一般经营项目：（国家法律、法规有专项审批的项目除外；需取得专项审批待取得有关部门的批准文件或颁发的行政许可证书后方可经营，具体经营项目期限以有关部门的批准文件和颁发的行政许可在证为准）：房地产开发、销售，装饰装璜，仓储服务，房屋租赁；通信产品，电子产品，五金交电，建材，钢材，机电产品，装饰装璜材料，化工产品，原料",新疆,乌鲁木齐,"新疆乌鲁木齐经济技术开发区广州路8号"
哈密市众联铸钢有限责任公司,9165220077606436X3,2005-06-20,N/A,王效良,"1,000(万)","铸钢的生产、加工、销售；矿产品、五金、建材销售；废品回收。",新疆,哈密,"新疆哈密地区哈密市红星三场312国道3589公里处北侧(原黄田监狱砂石场内)"
新疆撒哈拉商贸有限公司,91650102776065901E,2005-06-20,N/A,努买买提·吐尔逊,"30(万)","零售：预包装食品；乳制品",新疆,乌鲁木齐,"新疆乌鲁木齐市天山区明华街西七巷25号"
昌吉市天山金提农业有限责任公司,91652301776067050G,2005-06-21,N/A,袁海英,"200(万元人民币)","瓜果蔬菜的种植、销售；农副产品（专项除外）、钢材、建材、水泥销售；货物的进出口业务；房屋租赁",新疆,昌吉,"新疆昌吉州昌吉市健康西路55号(36区5丘4栋)"
乌鲁木齐新俊源物资有限公司,916501007760684321,2005-06-21,N/A,陈俊芳,"100(万)","金属材料、机电产品、化工产品、农畜产品、装饰材料、计算机软硬件产品及辅助设备、文体用品、办公用品、服装鞋帽、针纺织品、汽车配件、五金交电、家用电器、日用百货的销售。机械设备及房屋租赁。废旧金属回收。仓储业务。中介服务及信息咨询。",新疆,乌鲁木齐,"新疆乌鲁木齐高新技术产业开发区（新市区）长春南路333号盈科棕榈园18栋1-13号"
鄯善县同泰矿业有限公司,91650421776063762X,2005-06-21,N/A,于斌,"50(万)","鄯善县谢克先布拉克铁矿普查，矿产资源勘查；矿山筹建。",新疆,吐鲁番,"新疆吐鲁番市鄯善县新城路481号"
中国电信股份有限公司玛纳斯凉州户镇营业厅,91652324MA7761N67G,2005-06-21,N/A,王旭东,"N/A","基础电信业务：在本区域范围内经营800MHzCDMA第二代数字蜂窝移动通信业务、CDMA2000第三代数字蜂窝移动通信业务和LTE/第四代数字蜂窝移动通信业务（TD-LTE/LTEFDD)；在本区域范围内经营固定网本地电话业务（含本地无线环路业务）、固定网国内长途电话业务、固定网国际长途电话业务、IP电话业务（限Phone-Phone的电话业务）、卫星国际专线业务、因特网数据传送业务、国际数据通信业务、公众电报和用户电报业务、26GHz无线接入业务、国内通信设施服务业务；增值电信业务：在本区域范围内经营第二类基础电信业务中的国内甚小口径终端地球站通信业务、固定网国内数据传送业务、用户驻地网业务、网络托管业务（比照增值电信业务管理）、第一类增值电信业务中的互联网数据中心业务、国内互联网虚拟专用网业务、互联网接入服务业务；第二类增值电信业务中的在线数据处理与交易处理业务、存储转发类业务、国内呼叫中心业务和信息服务业务以及无线数据传送业务；IPTV传输服务：服务内容为IPTV集成播控平台与电视用户端之间提供信号传输和相应技术保障，传输网络为利用固定通信网络（含互联网）架设IPTV信号专用传输网络，IPTV传输服务在限定的地域范围内开展；互联网地图服务（有效期至2019年12月31日）；利用信息网络经营音乐娱乐产品，游戏产品（含网络游戏虚拟货币发行），艺术品、演出剧",新疆,昌吉,"新疆昌吉州玛纳斯县凉州户镇"
库尔勒国润农资有限公司,91652801776065012X,2005-06-21,N/A,陈菊,"50(万)","零售：农药（剧毒农药除外）；批发零售：农用薄膜、农药器械、滴灌设备，零售：化肥。",新疆,巴音郭楞,"新疆巴州库尔勒市乐悟北路88号顺和农产品综合市场20号楼1层18号"
阿瓦提县刀郎部落有限责任公司,91652928776064722Q,2005-06-21,N/A,王小平,"2,180(万元人民币)","餐饮旅馆服务，卷烟，预包装食品,旅游娱乐项目的开发、建设、服务；旅游文化、演出、会务、拓展训练；日用百货的销售、旅游服装、工艺品、纪念品的制作与销售；养殖,水果种植与销售；房屋租赁，项目承包，设备承包。",新疆,阿克苏,"新疆阿克苏地区阿瓦提县玉满闸口"
新疆安科安全科学技术咨询中心有限责任公司,916501027760729842,2005-06-21,N/A,张杰,"100(万元人民币)","管理体系咨询，科技信息服务。",新疆,乌鲁木齐,"新疆乌鲁木齐市天山区光明路121号建设广场11层"
喀什阿米娜食品有限公司,91653101776066066Y,2005-06-21,N/A,艾买提江·那买提,"500(万)","方便面、饮料【瓶（桶）装饮用水类",新疆,喀什,"新疆喀什地区喀什中亚南亚工业园区中亚3路1号"
昌吉市银宇棉花有限公司,91652301776066250L,2005-06-21,N/A,李英浩,"50(万)","批发零售皮棉、铁丝、包装布、棉花机械配件、针织产品、棉纱、棉短绒",新疆,昌吉,"新疆昌吉州昌吉市建设路22号"
昌吉市七彩印刷厂,92652301MA77JAMP1A,2005-06-21,个体工商户,陶春生,"N/A","印刷文件、资料、图表、票证、名片#。",新疆,昌吉,"新疆昌吉州昌吉市北京北路301号"
中国电信股份有限公司玛纳斯北五岔镇营业厅,91652324MA7761PQ3C,2005-06-21,N/A,王旭东,"N/A","基础电信业务：在本区域范围内经营800MHzCDMA第二代数字蜂窝移动通信业务、CDMA2000第三代数字蜂窝移动通信业务和LTE/第四代数字蜂窝移动通信业务（TD-LTE/LTEFDD)；在本区域范围内经营固定网本地电话业务（含本地无线环路业务）、固定网国内长途电话业务、固定网国际长途电话业务、IP电话业务（限Phone-Phone的电话业务）、卫星国际专线业务、因特网数据传送业务、国际数据通信业务、公众电报和用户电报业务、26GHz无线接入业务、国内通信设施服务业务；增值电信业务：在本区域范围内经营第二类基础电信业务中的国内甚小口径终端地球站通信业务、固定网国内数据传送业务、用户驻地网业务、网络托管业务（比照增值电信业务管理）、第一类增值电信业务中的互联网数据中心业务、国内互联网虚拟专用网业务、互联网接入服务业务；第二类增值电信业务中的在线数据处理与交易处理业务、存储转发类业务、国内呼叫中心业务和信息服务业务以及无线数据传送业务；IPTV传输服务：服务内容为IPTV集成播控平台与电视用户端之间提供信号传输和相应技术保障，传输网络为利用固定通信网络（含互联网）架设IPTV信号专用传输网络，IPTV传输服务在限定的地域范围内开展；互联网地图服务（有效期至2019年12月31日）；利用信息网络经营音乐娱乐产品，游戏产品（含网络游戏虚拟货币发行），艺术品、演出剧",新疆,昌吉,"新疆昌吉州玛纳斯县北五岔镇"
哈密市良种棉加工厂,91652200776072714G,2005-06-21,国有企业,杨春生,"50万人民币","籽棉收购、加工。",新疆,哈密,"新疆哈密地区哈密市农副产品加工园区"
伊犁伊远工程材料检测服务有限责任公司,9165400277607973XX,2005-06-21,N/A,张辉,"100(万)","开展标准计量部门许可范围内的建筑材料检测业务。",新疆,伊犁哈萨克,"新疆伊犁州伊宁市阿合买提江街36号"
哈密市金宏鑫矿业有限责任公司,916522017760792624,2005-06-21,N/A,刘宝,"1,100(万元人民币)","铜、金矿的开采；矿产品的收购、加工、销售；日用百货、农副产品、办公用品、五金、建材的销售；农畜产品的收购销售；设备租赁；矿建工程。",新疆,哈密,"新疆哈密市伊州区天山北路52号701室(哈建大厦)"
巴州亿和物资有限责任公司,91652801776063279N,2005-06-21,N/A,王芳芳,"30(万)","零售：烟、预包装食品，乳制品（不含婴幼儿配方乳粉）",新疆,巴音郭楞,"新疆巴州库尔勒市塔指东路铁克其乡安居工程一楼"
新疆新姿源生物制药有限责任公司,916540257760660584,2005-06-22,N/A,陶亮,"3,367.6900(万元人民币)","结合雌激素原料药",新疆,伊犁哈萨克,"新疆伊犁州新源县218国道252公里处"
乌鲁木齐市天勤汇金工贸有限公司,91650103776066963G,2005-06-22,N/A,杨桂玲,"100(万元人民币)","机械设备，五金交电及电子产品，建材及化工产品，农畜产品，文化用品，日用百货，服装鞋帽，针纺织品，办公用品，洗涤用品，劳保用品，数码产品，家具，体育器材，水暖配件的销售；计算机技术、水处理设备及配件维修，铁件加工的服务。",新疆,乌鲁木齐,"新疆乌鲁木齐市沙依巴克区公园南街72号"
乌鲁木齐龙扬会展服务有限公司,91650100776066613Y,2005-06-22,N/A,王冬梅,"10(万)","会展服务。礼仪庆典服务。汽车及房屋的租赁。商务信息咨询。",新疆,乌鲁木齐,"新疆乌鲁木齐高新技术产业开发区（新市区）北京南路370号银通大厦1302室"
和田地区亚中机动车检测有限公司,916532017760699292,2005-06-22,N/A,吾布力卡生木·买买提奴日,"100(万)","机动车安全性能检测，机动车综合性能检测，摩托车安全性能检测。",新疆,和田,"新疆和田地区和田市艾依提卡路22号"
新疆西域春乳业有限责任公司,916523237760661622,2005-06-22,N/A,赵斌,"10,000(万)","乳制品[乳粉（全脂乳粉），液体乳（灭菌乳、调制乳、发酵乳、巴氏杀菌乳），其他乳制品（奶片）]，饮料",新疆,昌吉,"新疆昌吉州呼图壁县东郊种牛场"
新疆天河庭州广告有限责任公司额敏分公司,9165422177608626XH,2005-06-22,N/A,袁翠萍,"N/A","企业形象策划、各类会务活动策划、展示设计、制作、代理发布国内各类广告",新疆,塔城,"新疆塔城地区额敏县红花路武装部门头"
克拉玛依市天缘商贸有限公司,91650203776072909W,2005-06-22,N/A,王新坤,"30(万)","五金交电、化工产品、电子产品、文化体育用品、日用品、建材、汽车配件销售；制冷设备维修；网络工程；计算机系统服务。",新疆,克拉玛依,"新疆克拉玛依市鸿雁路新村11-4号"
新疆八音和投资有限公司八音和速八酒店,9165010377606727XH,2005-06-22,N/A,杨迎新,"N/A","客房；餐饮；零售：预包装食品，卷烟；会议服务，非占道停车服务。",新疆,乌鲁木齐,"新疆乌鲁木齐市沙依巴克区公园北街140号"
新疆银通棉业有限公司库尔勒轧花厂,916528017760824108,2005-06-22,N/A,张炜,"N/A","籽棉加工，籽棉收购，批发零售：皮棉、打包布。",新疆,巴音郭楞,"新疆巴州库尔勒市阿瓦提乡"
巴州塔海石油钻采设备有限责任公司,916528017760650043,2005-06-22,N/A,罗海堂,"100(万)","制造、维修、批发零售：石油钻采设备及配件，公路工程建筑，其他工程准备活动，机械设备租赁，批发零售：金属材料、文具及体育用品、计算机、软件及辅助设备、其他化工产品、其他日用品、其他农畜产品、五金交电、润滑油、电子办公设备、机械设备及配件。(管控要素除外)。",新疆,巴音郭楞,"新疆巴州库尔勒市铁门关路东一巷金馨花园6幢2-301室"
伊犁诚远建材检测试验有限责任公司,91654002776066226U,2005-06-22,N/A,何智华,"80(万)","建设工程材料的检测和试验(具体以资质证书为准)。房屋出租。",新疆,伊犁哈萨克,"新疆伊犁州伊宁市解放路四巷74号利达商务楼"
奎屯恒基商品混凝土有限公司,91654003776066576G,2005-06-22,N/A,丁武忠,"1,205(万元人民币)","混凝土、水泥制品的生产、销售。",新疆,伊犁哈萨克,"新疆伊犁州奎屯市石化工业园区东晓苑-迎宾大道18-1幢"
奎屯中恒工程检验实验有限责任公司,91654003776066445L,2005-06-22,N/A,王建勇,"210(万)","公路工程项目的检验、试验。",新疆,伊犁哈萨克,"新疆伊犁州奎屯市呼图壁街13号"
巴州新星石油技术服务有限责任公司,91652822776069670A,2005-06-23,N/A,樊建华,"130(万元人民币)","石油工程技术服务；为石油和天然气开采提供的其他服务活动；行业应用软件服务；煤层气钻采技术投资及开发，相关设备技术服务；运输代理服务；零售：计算机零配件及消耗材料、其他电子产品、五金交电、文具用品、家具***。",新疆,巴音郭楞,"新疆巴州轮台县都护府大街"
乌鲁木齐爱通科技发展有限公司,91650102776068395P,2005-06-23,N/A,张宏伟,"60(万)","计算机配件及耗材，办公用品，机电设备，工业自动化控制设备，工艺品，仪器仪表，化工产品，农畜产品，五金交电，汽车配件，建筑材料，日用百货，有色金属，橡胶制品；代销“天山通”SIM卡，计算机服务，矿业技术咨询，矿山设备销售；批发兼零售：通讯产品",新疆,乌鲁木齐,"新疆乌鲁木齐市天山区中山路189号"
额敏县新建农机服务有限责任公司,91654221776067253P,2005-06-23,N/A,陈新建,"10(万)","农机修理、加工、农机、拖拉机配件销售、售后服务、暖气设备销售",新疆,塔城,"新疆塔城地区额敏县郊区乡依萨塔木村"
伊犁智汇机动车鉴定评估有限公司,91654002776068221T,2005-06-23,N/A,杨晋新,"10(万)","为旧机动车提供鉴定评估服务，为旧机动车交易双方提供指导、信息咨询服务。",新疆,伊犁哈萨克,"新疆伊犁州伊宁市解放路1巷105号美景华庭1号楼3单元502室"
新疆博昊机械设备有限公司,91650109776072431C,2005-06-23,N/A,朱明忠,"100(万)","机械设备的维修；销售：化工产品",新疆,乌鲁木齐,"新疆乌鲁木齐市米东区米东南路西四巷254号"
乌鲁木齐丰源达汽车修理有限公司,91650103776074381K,2005-06-23,N/A,黄德宇,"50(万)","道路普通货物运输，货车维修（二类)，乘用车维修（二类）；汽车技术信息咨询服务，信息系统集成服务，汽车清洗，汽车装潢；销售：汽车配件，农畜产品，汽车用品，润滑油，电子产品",新疆,乌鲁木齐,"新疆乌鲁木齐市沙依巴克区九家湾水库街156号"
吐鲁番地区宏运劳务派遣有限责任公司,91650402776080044K,2005-06-23,N/A,马芳智,"10(万)","疆内劳务派遣业务；建筑劳务分包，建筑安装工程，建筑设备租赁，工程机械租赁，房屋拆迁。",新疆,吐鲁番,"新疆吐鲁番市高昌区文化路西域商街3层1号"
克拉玛依市盛势工贸有限公司酒店,91650205776069937H,2005-06-23,N/A,王建华,"N/A","餐饮服务。",新疆,克拉玛依,"新疆克拉玛依市乌尔禾区百口泉"
克拉玛依市盛势工贸有限公司纯净水厂,91650205776069945C,2005-06-23,N/A,王建华,"N/A","纯净水生产及销售。",新疆,克拉玛依,"新疆克拉玛依市乌尔禾区百口泉"
新疆天宇建设工程有限责任公司兴宇分公司,916531017760681764,2005-06-23,N/A,李玉波,"N/A","许可经营项目：许可经营项目（具体经营项目以有关心部门批准文件或颁发的许可证、资质证书为准）：房屋建筑工程施工，市政公用工程施工，水利水电工程施工，机电设备安装工程，管道工程承包，送变电工程承包，特种专业工程",新疆,喀什,"新疆喀什地区喀什市东湖安居小区甲28栋2单元204室"
乌鲁木齐君晨第易网络技术服务有限公司,91650100776067376L,2005-06-23,N/A,马燕燕,"100(万)","许可经营项目：无。一般经营项目：",新疆,乌鲁木齐,"新疆乌鲁木齐经济技术开发区校园路107号北大科技楼二楼213房间"
克拉玛依市盛势工贸有限公司公寓,916502057760699537,2005-06-23,N/A,王建华,"N/A","住宿",新疆,克拉玛依,"新疆克拉玛依市乌尔禾区百口泉"
福海县农牧土特产日杂有限责任公司,91654323776069427W,2005-06-24,N/A,何刚,"50(万)","烟花爆竹、烟酒糖荼、土产日杂;棉麻、五金交电、服装百货、房屋出租、种植饲养动物、鞋帽、文化用品。",新疆,阿勒泰,"新疆阿勒泰地区福海县福海镇济海西路016号"
哈密鑫宝矿业开发有限公司,91652201776067704A,2005-06-24,N/A,武念龙,"200(万)","矿产资源勘查；矿产品、化工产品、五金、交电、建材的销售；矿产品加工。",新疆,哈密,"新疆哈密地区哈密市天山北路军民巷别墅12号"
乌鲁木齐西尔沃工贸有限公司,91650104776076870Q,2005-06-24,N/A,王玉洁,"60(万)","销售：轴承，密封件，机械设备、五金交电及电子产品、液压气动元件、化工产品",新疆,乌鲁木齐,"新疆乌鲁木齐市新市区太原南路188号亚中机电市场326号"
新疆安科公路监理有限公司,91650100776070604D,2005-06-24,N/A,李刚,"500(万)","公路工程监理、咨询。",新疆,乌鲁木齐,"新疆乌鲁木齐市新市区西八家户路6号"
乌鲁木齐高新生态农业开发有限公司,91650100787646541E,2005-06-24,N/A,马英杰,"100(万)","农业开发研究经营。农业产品的种植养殖及加工销售。对农业领域的投资。",新疆,乌鲁木齐,"新疆乌鲁木齐高新技术产业开发区（新市区）四平路2288号创新广场2号楼26层2615室"
阿克苏地区农鑫源农资有限责任公司农哈哈分公司,91652901778955967N,2005-06-24,N/A,承大平,"N/A","农药。化肥、植保机械、植物生长调节剂、农用薄膜、包装种子的销售。",新疆,阿克苏,"新疆阿克苏地区阿克苏市交通路25号农哈哈大世界14-3号"
