江油川西北利通实业总公司,91510781214315825U,1992-09-08,N/A,梁振宇,"600(万元人民币)","批发[仅限票据交易]：煤油、石脑油、汽油[－18℃≤闪点＜23℃]、柴油、甲醇。销售：燃料油，广告设计、制作、代理，石油石化工程设备检修，监控设备销售、安装、维修，机电设备安装工程，建筑装饰装修工程，化工石油设备管道安装工程，建筑防水工程，防腐保温工程，建筑智能化工程，石油化工储罐及其它储运设施清洗，安防工程，市场调查，企业管理服务",四川,绵阳,"江油市太白大道石油大厦12楼"
四川三业房屋开发公司,915100002018210833,1992-09-09,N/A,陈颖科,"830(万元人民币)","房地产开发、经营，房屋装饰、装修。",四川,成都,"成都市青羊区温哥华广场8楼E,F室"
四川省公路物资公司,915100002018211989,1992-09-09,N/A,罗野,"2,000(万元人民币)","商品批发与零售、租赁业、进出口业、金属制品、机械和设备修理业。",四川,成都,"成都市武侯祠横街省公路局内"
四川凌海房地产开发有限公司,9151000020182118X9,1992-09-09,N/A,刘蓉,"2,000(万元人民币)","房地产开发；商品批发与零售。",四川,成都,"成都市武侯区洗面桥街30号-1幢26层2号"
四川泸州三江林业集团公司,915105222049105916,1992-09-09,N/A,鄢晓玲,"360(万元人民币)","木材供销，竹木制品加工、销售，家俱制造。。",四川,泸州,"合江县合江镇通惠路36号"
成都市青白江区生产资料公司,91510113621884531R,1992-09-10,N/A,罗典利,"50(万元人民币)","农业生产资料(不含种子)、建筑材料、机电产品(不含汽车)、化工原料(不含危险品)、钢材、生铁、矿石(不含稀贵品种)。橡胶制品、塑料制品、农膜、汽车配件、五金交电、日用杂货、日用百货、废旧物资回收",四川,成都,"成都市青白江区大弯北路"
四川省输变电工程公司,91511621209753994P,1992-09-10,N/A,周益文,"8,089(万元人民币)","电力工程施工总承包壹级；房屋建筑工程施工总承包二级；电力工程、通讯工程勘查、设计、咨询服务；自造、自销水泥预制构件，零售建筑材料、五金，空调安装与维修。输变电工程专业承包叁级；施工劳务；电力专业技术服务；电力安全维护服务；电力设备维修检测服务；电力设施承装、承修、承试；电力机具设备租赁；房屋出售、租赁。(依法须经批准的项目，经相关部门批准后方可开展经营活动)",四川,广安,"四川省广安市岳池县九龙镇九龙大街305号"
成都市温江区自来水公司经营部,91510115709244520W,1992-09-10,N/A,周晓,"10(万元人民币)","水暖器材、供水设备及材料；针织品、鞋、五金交电、摩托车及零配件；供水设施工程的安装维修。",四川,成都,"成都市温江区柳城镇迎晖路217号"
达州市通川区粮油二公司,91511702210255247L,1992-09-10,N/A,陈华,"101(万元人民币)","粮食收购，粮油及其制品销售。",四川,达州,"达州市通川区荷叶街362号"
成都神农集团公司,915101142025973781,1992-09-10,N/A,马留文,"1,008(万元人民币)","保健用品、电子产品、眼镜、金属制品、非金属波纹管、膨胀节、环保产品；从事环保工程服务。以上项目不含法律、法规和国务院决定需要前置审批或许可的项目。",四川,成都,"成都市新都区清流镇"
成都金康房屋开发有限公司,91510100621708677P,1992-09-10,N/A,彭建祥,"2,654.3894(万元人民币)","房屋建设和销售。",四川,成都,"成都市武侯区簇桥乡铁佛村九组"
四川省新维广告营销策划公司,91510000201862459F,1992-09-11,N/A,蒋四维,"109(万元人民币)","设计、制作、发布、代理国内外各类广告业务。",四川,成都,"成都市武侯区晋吉南路278号35-4-1A"
彭州市通济经济区供销合作社综合服务部,91510182MA62LWEE57,1992-09-11,集体分支机构(非法人),刘昌华,"N/A","批发、零售：农机具、农药器具及配件、化肥、农膜、不再分装的袋装种子、日用杂品；零售：农药",四川,成都,"成都市彭州市通济镇"
四川玖阳建筑设计有限责任公司,915101002047195005,1992-09-11,N/A,蒲继,"300(万元人民币)","房屋建筑工程、风景园林工程设计（凭资质证书经营）；室内装饰工程设计、施工（凭资质证书经营）；工程技术咨询服务（凭资质证书经营）；建材（不含危险化学品）、装饰材料",四川,成都,"成都高新区肖家河中街44号"
四川省地方电力开发公司,91510000201821235F,1992-09-11,N/A,唐惊涛,"500(万元人民币)","地方中、小型水电、火电站及２２０千伏及其以下输变电工程的开发。",四川,成都,"成都市外西罗家碾"
眉山大宋文化旅游发展公司,91511400207307480M,1992-09-11,N/A,陈仲文,"80(万元人民币)","工艺美术品、图书、广播电视器材销售；电影放映；广播电视安装维修；广告设计、制作、代理、发布。",四川,眉山,"东坡区纱彀行南段86号"
武胜县粮贸建筑公司,91511622765071994H,1992-09-11,N/A,符云辉,"2,000(万元人民币)","房屋建筑工程施工总承包；公路工程、土石方工程、水利水电工程、市政公用工程、建筑装饰装修工程、水电设备安装、城市及道路照明工程、环保工程、管道工程、保温防腐工程、河湖整治工程、堤防工程、公路路基工程、公路交通工程、送变电工程、城市园林绿化工程、消防设施工程、爆破与拆除工程、公路路面工程、钢结构工程、地基基础工程、特种工程、古建筑工程、起重设备安装工程；建筑劳务分包；劳务派遣；投资经营及管理",四川,广安,"沿口镇弘武大道"
成都铁山实业集团有限公司,91510100214394869R,1992-09-11,N/A,曹德州,"1,000(万元人民币)","科技新产品项目及成果推广、转让、开发；铁路机车车辆（不含小轿车）销售及租赁；电器机械、电子产品、铁道信号及控制产品，日用百货、金属材料（不含稀贵金属），电子计算机硬件、办公用品、办公设备",四川,成都,"成都市金牛区金牛大道营门口246号"
江油生通建设总公司,91510781214315905F,1992-09-11,N/A,荣吉祥,"600(万元人民币)","房屋建筑工程施工总承包叁级。预制构件制造、涂料加工、销售。【依法须经批准的项目，经相关部门批准后方可开展经营活动】",四川,绵阳,"江油市双江路1号"
大邑县市政工程公司,9151012920266637XX,1992-09-11,N/A,何强,"2,000(万元人民币)","市政工程设施、架桥、筑路、房屋建筑。",四川,成都,"成都市大邑县晋原镇围城南路西段9号"
四川电力建设有限责任公司,915100002018211396,1992-09-12,N/A,肖勇,"17,350(万元人民币)","(以下范围不含前置许可项目，后置许可项目凭许可证或审批文件经营)输变电工程；电力工程；电力供应；机电工程；建筑工程；建筑机电安装工程；电子与智能化工程；消防设施工程；防水防腐保温工程；市政公用工程；水利水电工程；隧道工程；通信工程；钢结构工程；地基基础工程；城市及道路照明工程；机械设备租赁；工程管理服务；施工劳务作业；建材批发；机械设备、五金产品及电子产品批发；自有房地产经营活动。",四川,成都,"成都市高新区新光路66号"
四川华西生辉建筑有限公司,91510106201821323R,1992-09-12,N/A,蒲虹菠,"2,160(万元人民币)","房屋建筑工程施工总承包（二级）；机电设备安装工程专业承包（二级）；钢结构工程专业承包（二级）；城市及道路照明工程专业承包（二级）；建筑装修装饰工程专业承包（二级）；市政公用工程施工总承包（二级）；管道工程专业承包",四川,成都,"成都市解放路二段95号"
中国银行股份有限公司广安政府大道支行,91511602771698152M,1992-09-12,N/A,李艳霖,"N/A","吸收存款；发放贷款；办理结算；代理发行兑付政府债券、金融债券；代理支付款项及代理保险业务；按规定办理票据贴现。外币存款、外币兑换、外汇汇款。",四川,广安,"四川省广安市广安区人民路96号-42"
成都市青白江区农资公司城厢茶花社区三农服务站,91510113684573845G,1992-09-14,N/A,何育松,"N/A","销售：农业机械、农具、农业生产资料、化学农药（不含危险品）、种子",四川,成都,"成都市青白江区城厢镇(唐巴公路旁)"
成都市燃气建安工程开发服务公司,91510100201942926P,1992-09-14,N/A,钟培建,"30(万元人民币)","燃气工程、电力工程、给排水工程、市政工程、道桥工程、消防工程、装饰工程、环保工程、绿化工程开发",四川,成都,"成都市抚琴西区营通路"
成都旅游贸易公司,915101006331466083,1992-09-14,N/A,滕刚,"80(万元人民币)","工艺美术品〔不含金银制品〕。家用电器、五金工具、百货、服装、针纺织品、照像器材、计划外钢材、通讯设备",四川,成都,"成都市锦江区武城大街181号"
成都城投地产有限公司,91510100201918889M,1992-09-14,N/A,夏荣科,"10,500(万元人民币)","房地产开发,土地拆迁整理，市政基础设施投资及建设，物业管理；销售：建辅建材",四川,成都,"成都市锦里西路121号"
四川高速公路物资公司,91510000201821892E,1992-09-14,N/A,员林,"300(万元人民币)","一般经营项目",四川,成都,"成都市武侯区二环路西一段90号"
成都富源燃气股份有限公司,91510100629519934N,1992-09-14,N/A,孟庆华,"2,000(万元人民币)","燃气工程施工，市政公用工程施工、石油、化工管道安装，燃气设备销售、燃气管道防腐、燃气开发投资",四川,成都,"成都市成华区双建路1号"
成都美登高食品有限公司,9151010062170510XJ,1992-09-14,N/A,王俊,"1,155(万元人民币)","研究和开发：冰激凌、乳酸饮料、冷冻食品、速冻食品；销售：建辅建材、办公用品、电线电缆、五金交电；房屋租赁。",四川,成都,"成都市高新区科园三路4号"
四川省中大置业有限责任公司,91510000201821243A,1992-09-15,N/A,王光明,"2,680(万元人民币)","房地产开发（三级）；商品批发与零售业",四川,成都,"成都市锦江区东大街紫东楼段11号1-1-2101号"
成都市和平电器厂,91510100MA62M7YEXK,1992-09-15,集体所有制,裴锡君,"20万人民币","主营：可控电器设备、硅整流设备；兼营：加工配电箱、柜廉电器配件。",四川,成都,"成都市高新区桂溪乡和平村10组"
成都市相君酒业有限公司,915101832024120385,1992-09-15,N/A,李显维,"48(万元人民币)","生产销售白酒、曲酒；组织酿酒所需原辅材料。",四川,成都,"成都市邛崃市固驿镇汽车站"
四川大雅糟坊酒业有限公司,915114247822923349,1992-09-15,N/A,余立平,"999(万元人民币)","白酒、饮料[瓶(桶)装饮用水类(其他饮)]制造；经营本企业自产产品及技术的出口业务和本企业所需原辅材料及技术的进口业务",四川,眉山,"丹棱县丹棱镇外南街456号"
四川文艺音像出版社有限公司,9151000005414646X0,1992-09-15,N/A,刘传,"500(万元人民币)","",四川,成都,"成都市青羊区东城根南街21号附1号综合楼(栋)第二层"
四川省商业外贸有限公司,915100002018212515,1992-09-15,N/A,梅岷,"500(万元人民币)","批发、零售五金，机械设备，建筑材料（不含危险化学品），金属材料（不含稀贵金属），交电，通信设备（不含无线发射设备）及器材，针纺织品，矿产品（不含国家限制品种），农副产品（不含棉花、蚕茧、烟叶、粮油），日用百货，仪表仪器，汽车配件，工艺美术品",四川,成都,"成都市新华大道文武路42号7楼H单元"
四川省川粮贸易开发公司,91510000201821278W,1992-09-15,N/A,邢国涛,"1,800(万元人民币)","商品批发与零售；商务信息咨询；（以上项目不含前置许可项目，后置许可项目凭许可证或审批文件经营）（以下经营项目及期限以许可证为准，且仅限分支机构经营）茶座；中餐制售；粮食及其制品销售；食用油脂",四川,成都,"成都市上东大街67号"
成都历新纤维科技有限公司,915101002143991683,1992-09-15,N/A,胡刚,"69.4000(万元人民币)","合成纤维、合成材料、功能高分子材料、纺织专用设备的研发、生产（工业行业另设分支机构经营或另选经营场地经营）、销售及技术转让、技术咨询和技术服务",四川,成都,"成都市高新区高朋大道26号1幢1楼1-3号"
成都市兴业集建投资有限公司,91510106202084740Y,1992-09-16,N/A,潘小波,"1,300(万元人民币)","项目投资（不得从事非法集资、吸收公众资金等金融活动）；劳务派遣",四川,成都,"成都金牛高新技术产业园区兴盛西路2号6栋10层2号"
南充中天房地产有限责任公司,915113006213200311,1992-09-16,N/A,滕凡,"2,000(万元人民币)","房地产开发经营；销售：民用建材，五金，交电，化工，百货，日用杂品，针纺织品，皮革及制品，钢材，木材，水泥",四川,南充,"南充市顺庆区丝绸路55号"
成都市华通食用华工公司,91510108MA61W7MQ5P,1992-09-16,N/A,杨小军,"50(万元人民币)","食品、添加剂、食品生产原铺材料。食品、添加剂、食品生产原铺材料。",四川,成都,"成都市成华区人民南路四段二环路立交桥侧"
成都市高新区灯塔锋加工厂,91510100MA62M8AR6D,1992-09-16,集体所有制,周奎友,"10.6万人民币","锌、锌合金。",四川,成都,"成都市石羊场灯塔村8组"
四川誉川建设工程有限公司,915108117089770367,1992-09-16,N/A,陈高祥,"609(万元人民币)","旅游开发",四川,广元,"广元市昭化区昭化场镇"
成都蜀源房地产开发有限公司,9151010020194311XP,1992-09-17,N/A,刘成学,"1,100(万元人民币)","房地产综合开发，建筑安装及技术咨询，物业管理",四川,成都,"成都市锦江区东升街89号"
成都市通用工程技术有限责任公司,91510107202169656J,1992-09-18,N/A,庞玉学,"10,000(万元人民币)","新工艺、新设备研究开发、技术转让、技术服务；工程咨询、工程设计、化工石化医药建设工程总承包、工程项目管理；机械设备及电子产品、金属材料及制品（不含稀贵金属）、化工原料及制品及节能环保化工材料",四川,成都,"成都市武侯区洗面桥街29号"
四川建设发展股份有限公司,91510600205108154H,1992-09-18,N/A,江秉金,"10,000(万元人民币)","房屋建筑工程施工总承包壹级，市政公用工程施工总承包壹级，建筑装修装饰工程专业承包贰级，消防设施工程专业承包壹级，公路工程施工总承包贰级，起重设备安装工程专业承包贰级，钢结构工程专业承包壹级，机电安装工程施工总承包贰级，地基与基础工程专业承包贰级；建筑装饰工程设计专项丙级(凭有效许可证开展经营活动），桥梁施工，建筑设计，室内外装饰装修，水电安装，空调销售及安装，塔机、机械式停车设备生产及销售，机械设备、建筑设备租赁，水处理工程设计、施工，水电处理工程设计、施工，环境水处理工程设计、施工，餐饮服务（凭有效许可证开展经营活动），住宿（凭有效许可证开展经营活动），预拌商品混凝土生产销售，木制家俱生产（仅限分支机构经营）、销售，五金工具、五金交电、建筑五金、建筑材料、钢材、木材（凭有效许可证开展经营活动）、化工产品（不含危险货物及易制毒化学品）、矿产品、装饰材料、电器机械及器材、工具、灯具销售，普通机械及零配件加工销售，进出口贸易，光纤、电缆、电表销售，批发兼零售：日用百货、家电，房地产开发经营",四川,德阳,"四川省德阳市华山北路6号"
成都市牛氏商贸有限责任公司,91510114MA61WC9N1Y,1992-09-19,N/A,牛元峻,"100(万元人民币)","销售服装。",四川,成都,"成都市新都区大丰皇花社区"
成都泰来装饰工程有限公司,91510100621709055L,1992-09-19,N/A,李开碧,"1,200(万元人民币)","承接各类装饰、装修工程、智能化工程、幕墙工程的设计和施工，以及相关配套工程的设计和施工；提供相关技术咨询服务。",四川,成都,"四川省成都市青羊区亲仁里4号"
盐源县平川铜业有限责任公司,91513423720859761E,1992-09-19,N/A,刘富康,"225(万元人民币)","铜矿开采、洗选、电解铜生产（依法须经批准的项目，经相关部门批准后方可开展经营活动）",四川,凉山,"盐源县平川镇"
成都市金堂沁鑫机械制造厂,91510121202326957F,1992-09-21,集体所有制,冯久金,"50万人民币","有色金属",四川,成都,"成都市金堂清江镇云丰村"
自贡市华泰贸易公司,915103022039974106,1992-09-21,N/A,段秀珍,"76(万)","日用杂品、建材、家具制品、竹木藤棕草荆制品、废旧物资回收、黑色金属、农产品、黑色金属回收、五金交电、机电产品、日用百货、针纺织品。塑料、橡胶制品、皮毛制品、纸制品、工艺美术品、家电维修、电子器材、服装、鞋帽、皮制品、汽车配件。",四川,自贡,"自贡市自流井区骑坳井12号"
成都西南交大通联科技产业有限公司,9151010020194338XA,1992-09-21,N/A,顾潼,"50(万元人民币)","电子产品",四川,成都,"成都市高新区天目路77号"
自贡长征置业总公司,915103006207251766,1992-09-21,N/A,李兴明,"1,500(万)","预防保健科、内科、外科、中医科。",四川,自贡,"贡井区建设路"
成都中发企业总公司,91510112202247503A,1992-09-22,N/A,林丰祥,"5,000(万元人民币)","销售：建筑材料、卫生材料、机械设备、汽车租赁服务(依法须经批准的项目，经相关部门批准后方可开展经营活动；未取得相关行政许可",四川,成都,"四川省成都市龙泉驿区龙泉镇滨河街12号"
四川建设工程监理公司,91510000201821577T,1992-09-22,N/A,李阳,"303.2000(万元人民币)","工程监理服务、工程技术咨询服务、工程建设项目招标代理服务、勘察阶段项目管理服务、设计阶段项目管理服务、施工阶段项目管理服务、竣工阶段项目管理服务、工程项目综合服务;工程勘察设计、规划管理;质检技术服务;物业管理;会议及展览服务;停车场服务。",四川,成都,"四川省成都市"
成都同科兴机电设备有限公司,91510112202236695G,1992-09-22,N/A,叶银忠,"10(万元人民币)","制造、销售：高低压成套配电装置及元件；模具、塑料制品的生产、加工及销售[依法须经批准的项目，经相关部门批准后方可开展经营活动；未取得相关行政许可",四川,成都,"四川省成都经济技术开发区西干道东泰工业园"
成都丰菱汽车配件有限公司,91510107202178763G,1992-09-22,N/A,吴青荣,"50(万元人民币)","销售：汽车零部件、水暖器材、建筑材料、五金工具、机电产品；国内商务信息咨询；企业管理咨询。(依法须经批准的项目，经相关部门批准后方可开展经营活动）。",四川,成都,"成都市武侯区新南路75号2栋3号"
四川东方电气集团公司水电工程公司,915100002018216141,1992-09-22,N/A,黄宇权,"462(万元人民币)","一般经营项目",四川,成都,"成都市永陵路18号"
成都中铁二局宏源房地产综合开发有限公司,91510100201943611D,1992-09-23,N/A,冯斌,"15,800(万元人民币)","旧城改造高新区和龙泉驿工业区商品房开发经营，建筑装饰，零售、批发建筑材料、钢材。",四川,成都,"成都市二环路西三段213号"
成都华威机电实业公司,915101142026001518,1992-09-23,N/A,叶育明,"46(万元人民币)","锻压、机械加工；批发零售机械电子设备、计划外钢材、建筑材料、五金交电。",四川,成都,"成都市新都区斑竹园镇廖家湾"
成都物资经济发展公司,9151010020199235XN,1992-09-23,N/A,庄雪萍,"200(万元人民币)","仅供清理本企业债权债务使用。",四川,成都,"成都市青羊区上陞街18号5楼"
成都达江装饰材料有限公司,915101842026282260,1992-09-23,N/A,吴绍良,"1,121(万元人民币)","生产中密度纤维板、保丽板.塑料贴面板等人造板材和装饰材料，销售本公司产品。",四川,成都,"崇州市三江镇顺金村一组"
四川西南房屋综合开发有限公司,9151010020195437X8,1992-09-23,N/A,张宽,"1,300(万元人民币)","房地产开发经营，销售：建筑材料、装饰材料",四川,成都,"成都市金牛区马鞍南路110号"
德阳鹿鹤股份合作总公司,91510600205170986L,1992-09-24,N/A,曾艳,"1,338(万元人民币)","五金工具、建筑五金、日用杂品、百货、钢材、建筑材料销售。",四川,德阳,"四川省德阳市区汉江路西段"
四川省西昌市西溪(集团)股份公司彩印厂,91513401MA62H6FN20,1992-09-24,N/A,张英伟,"N/A","色装装潢印刷、其他杂件印刷；纸塑软包装袋印刷、销售*（依法须经批准的项目，经相关部门批准后方可开展经营活动）",四川,凉山,"西昌市西溪乡"
四川省西昌市西溪(集团)股份公司水电站,91513401MA62H72D0X,1992-09-24,N/A,李孝伟,"N/A","水力发电、供电*（依法须经批准的项目，经相关部门批准后方可开展经营活动）",四川,凉山,"西昌市西溪乡上乡村"
四川农业大学建筑工程公司,12510000450718925E,1992-09-24,N/A,卢怀志,"501.9000(万元人民币)","三级土木工程建筑安装（依法须经批准的项目，经相关部门批准后方可开展经营活动）",四川,雅安,"雅安市雨城区新康路4６号"
成都成华恒达新技术公司,91510108MA61WA377U,1992-09-24,N/A,郑宇,"56.4500(万元人民币)","计算机软硬件，现代办公设备,兼营:塞化工产品",四川,成都,"成都市成华区建设路56号新东方2栋"
四川省盐业总公司长宁支公司,915115249091550558,1992-09-24,N/A,王颖,"N/A","盐加工、批发、零售；销售：预包装食品（调味品、饮料、糖及巧克力、粮食及其制品、食用油脂、茶叶、酒类）、包装材料及制品、针纺织品、煤炭、水泥、五金交电、百货、日用杂品、建筑材料、洗涤用品、化妆品、服装、化工原料及产品",四川,宜宾,"长宁县长宁镇金融街109号"
中国建设银行股份有限公司乐山经济开发区支行,915111007716848421,1992-09-25,N/A,钟鸣,"N/A","办理人民币存款、贷款、结算业务；办理外币储蓄业务：办理外币兑换业务：代理收付款项及代理保险业务；办理其上级行在中国银行业监督管理委员会批准的业务范围内授权的业务；经中国银行业监督管理委员会批准的其他业务。。",四川,乐山,"乐山市市中区嘉州大道123号"
合江县地产开发公司,91510522204914680L,1992-09-25,N/A,税显庭,"1,200(万元人民币)","荒山、荒地、滩涂的整理改造；园区投资、开发。。",四川,泸州,"合江镇人民路38号"
四川犍为农村商业银行股份有限公司,91511100709032261C,1992-09-26,N/A,黄小鹏,"30,000(万元人民币)","吸收公众存款；发放短期、中期和长期贷款；办理国内结算；办理票据承兑与贴现；代理发行、代理兑付、承销政府债券；买卖政府债券、金融债券；从事同业拆借；从事银行卡",四川,乐山,"四川省犍为县玉津镇凤凰路北段331号"
成都华圣企业总公司,9151010862951894XH,1992-09-26,N/A,王华龙,"1,400(万元人民币)","机械电子技术服务。",四川,成都,"成都市成华区圣灯人民塘社区4组（社）"
四川华森饲料有限公司,91511402621131070X,1992-09-28,N/A,鲜斌,"1,880(万元人民币)","生产销售饲料及饲料添加剂。批发零售饲料原料",四川,眉山,"眉山市东坡区三苏大道西段"
理塘县仓央民族贸易有限责任公司,91513334212750006N,1992-09-28,N/A,格乃绕吉,"416(万元人民币)","茶叶、盐,民用爆破器材零售。日用百货、针织品、五金家电。废旧物品回收，再生资源回收，报废汽车回收。",四川,甘孜,"理塘县幸福路"
四川向阳房产房屋开发公司,91510107202157903Y,1992-09-28,N/A,干贵昌,"5,000(万元人民币)","房屋综合开发。建筑辅料，建筑装饰、安装。",四川,成都,"成都市武侯区人民南路四段（二环路南二段23#）"
成都亿发房屋开发有限公司,915101006217020640,1992-09-28,N/A,杨刚,"1,650(万元人民币)","从事成都市的旧城改造、开发区建设、牧马山的开发及其它房屋建设、开发、研制新型建筑材料，销售本公司产品",四川,成都,"四川省成都市彭州市天彭镇朝阳北路9号1栋"
成都兴蓉沱源自来水有限责任公司,9151012145080652XU,1992-09-28,N/A,韩霄,"7,399.7899(万元人民币)","自来水生产与销售，供水设备安装与管理维护、供水管道安装与维护、市政公用工程、技术咨询、建筑工程、管网查漏、水表检测与修校、供水材料批发",四川,成都,"四川省成都市金堂县赵镇北滨路上段269号"
