四川省民族房屋综合开发有限公司,915100002018160819,1992-06-11,N/A,马庆芳,"800(万元人民币)","从事房地产开发经营（凭建设主管部门资质证书经营）；销售建筑材料（不含危险化学品）、金属材料（不含稀贵金属）、矿产品、针纺织品、五金、交电、百货、通讯器材",四川,成都,"成都市金牛区营门口路民光大厦六楼"
中国石油天然气股份有限公司四川达州销售分公司润滑油门市,91511700MA6CK8N223,1992-06-11,N/A,唐飞,"N/A","润滑油、油桶、油库专用设备销售;香烟、预包装食品、日用百货零售;广告业务。(依法须经批准的项目,经相关部门批准后方可开展经营活动)",四川,达州,"达州市通川区朝阳中路485号"
四川省犍为县粮油购销总公司,915111232073529194,1992-06-11,N/A,牟冠华,"2,038.9000(万元人民币)","收购、储存、调拔：粮食；生产销售：大米及其他食品 ；销售：粮油机械、储运器材。",四川,乐山,"犍为县玉津镇凤凰路26号"
资阳市临江机械厂,91512002MA6CKJUB00,1992-06-11,集体所有制,李祖明,"15万人民币","机械零部件、配件。",四川,资阳,"资阳市雁江区松涛镇周祠社区18组186号"
成都成华区新达物资商贸公司油料经营部,91510108MA61WB7LXB,1992-06-11,N/A,吕源江,"N/A","柴油,润滑油,化工产品。",四川,成都,"成都市成华区金牛区天回乡士门村"
四川省富顺县童寺供销合作社,91510322204303783T,1992-06-12,集体所有制,李长海,"120.7万人民币","销售：百货、针纺织品、五金交电（除监视器）、化工产品",四川,自贡,"富顺县童寺街村"
中国银行股份有限公司崇州支行,91510184902623098D,1992-06-15,N/A,焦均,"N/A","经营中国银行业监督管理委员会依照有关法律、行政法规和其他规定批准的业务。",四川,成都,"成都市崇州市崇阳镇西街48号"
四川省化学工业总公司,915100002018066687,1992-06-15,N/A,龚长明,"1,100(万元人民币)","商品批发与零售",四川,成都,"成都市锦江区人民南路二段27号"
威远县经济技术开发建设公司,915110242067080208,1992-06-15,N/A,李静威,"828.8000(万元人民币)","房地产开发及商品房销售；土地整理等建设项目进行投资及经营管理（依法须经批准的项目，经相关部门批准后方可开展经营活动）",四川,内江,"威远县严陵镇南大街1号"
北京中生生物工程技术公司成都开发部,91510108MA61WCAN8L,1992-06-15,N/A,周洁,"20(万元人民币)","销售开发车公司生产诊断试剂及原疗仪田",四川,成都,"成都市北京中生生物工程技术公司成都开发部"
成都康特电子高新科技有限责任公司,91510107202173305M,1992-06-16,N/A,龙永庆,"10,000(万元人民币)","电子电器、通讯产品、仪器仪表、化工产品",四川,成都,"成都市武侯区武科东三路9号(武侯新城管委会内)"
成都市龙泉湖房地产开发公司,91510112202241355Y,1992-06-16,N/A,李世英,"120(万元人民币)","房地产开发、公寓、别墅、道路桥梁。水电器材、旅游品[依法须经批准的项目，经相关部门批准后方可开展经营活动；未取得相关行政许可",四川,成都,"四川省成都市龙泉驿区茶店乡"
绵阳高新区通达联运有限公司,9151070020540683X3,1992-06-16,N/A,冯素芬,"100(万元人民币)","代购飞机、轮船、汽车、火车客票，代办货物运输,房屋租赁。",四川,绵阳,"绵阳高新区绵兴东路78号"
四川天龙产业发展有限公司,91511100207056925K,1992-06-16,N/A,黄世华,"800(万元人民币)","销售建筑材料，五金、交电、化工",四川,乐山,"乐山市市中区嘉定南路176号"
四川省鸿兴工程建设有限责任公司,91511000206408271B,1992-06-16,N/A,陈超,"2,150(万元人民币)","市政公用工程施工总承包二级（不含桥、气）；公路路面工程专业承包二级；公路路基工程专业承包二级；普通机械修理；批发、零售：建筑材料、装饰材料；洗车服务",四川,内江,"内江市中区大洲路59号2单元2号"
四川唯怡饮料食品有限公司,915106006208901555,1992-06-16,N/A,邹宗凤,"280(万美元)","生产各类食品、饮料、葡萄酒、果露酒、米酒、黄酒、料酒",四川,德阳,"四川省什邡市蓝剑大道2.5公里处"
成都成华微电子技术配套公司维修部,91510108902199469N,1992-06-17,N/A,黄宁松,"N/A","办公机械、家用电器维修。",四川,成都,"成都市成华区新鸿路106号"
中国水利水电建设工程咨询成都有限公司,9151000020181617XL,1992-06-17,N/A,章建跃,"110.2000(万元人民币)","一般经营项目",四川,成都,"成都市青羊区浣花北路一号"
四川省内江物资回收利用总公司收购一店,915110027939707942,1992-06-18,N/A,罗淑坤,"N/A","再生物资回收、销售",四川,内江,"内江市中区东坝街39号"
大邑县国有资产投资经营公司,915101294508540541,1992-06-18,N/A,毛智红,"1,000(万元人民币)","按国家法律、法规的规定从事国有资产的投资经营业务。",四川,成都,"成都市大邑县晋原镇大北街67号"
成都红光净化设备有限公司,91510122202366975Q,1992-06-18,N/A,李廷西,"133(万元人民币)","制造、销售、安装空气净化设备，通风空调配件，空调器及其配套安装产品，消防产品。",四川,成都,"成都市双流区九江街道沿河路37号"
四川彭山大东方实业有限公司,9151142273488065X8,1992-06-18,N/A,余云富,"1,260(万元人民币)","许可经营项目：出租汽车客运、三级房地产开发经营",四川,眉山,"眉山市彭山区凤鸣镇凤鸣中路216号"
德阳红雨股份合作总公司,91510600205170513D,1992-06-18,N/A,李基贵,"1,250(万元人民币)","建筑材料、农用机械、电器、电气机械及器材、农畜产品批发零售。",四川,德阳,"四川省德阳市区长江西路129号"
中铁十七局集团达州驾校,91511700210254738Y,1992-06-18,N/A,陈向凯,"55(万元人民币)","机动车驾驶员培训（在前置许可有效期内经营）；建筑材料、装饰材料",四川,达州,"达州市通川区西圣寺路129号"
四川省内江物资回收利用总公司收购五店,91511000793970751P,1992-06-18,N/A,陈金四,"N/A","再生物资回收、销售",四川,内江,"内江市市中区交通乡临江村四组"
中国银行股份有限公司广元人民路支行,91510802905828080T,1992-06-18,N/A,杨置平,"N/A","人民币业务：吸收存款、发放贷款，办理结算；代理兑付政府债券、金融债券；代理收付款项及代理保险业务，按规定办理票据贴现。外汇业务：外汇存、贷款，外汇汇款；外币兑换、结、售汇，通过上级行办理代客外汇买卖，代理国外信用卡付款。个人外汇理财业务；以及在银行业监督管理委员会、外汇管理局许可范围内开办的业务。",四川,广元,"四川省广元市利州区人民路南段20号"
成都市成华区上雅贸易有限公司,91510108MA61W82Q0K,1992-06-19,N/A,文生林,"48(万元人民币)","矿产品、冶金炉料、钢材、煤炭、黑色有色金属、化工产品、建筑建辅材料、五金交电、农业生产资料、日用百货、汽车、农机配件、烟、酒、糖、日杂、副食。",四川,成都,"成都市成华西街3号"
简阳市南方建筑工程有限公司,91512081206881333F,1992-06-19,N/A,谢燕,"5,508(万元人民币)","房屋建筑工程、市政公用工程、水利水电工程、公路工程施工总承包、地基与基础工程、钢结构工程、模板脚手架、特种工程、起重设备安装工程、建筑装修装饰工程、土石方工程、园林古建筑工程、消防设施工程、防腐保温工程、金属门窗安装工程专业承包。零售：水电设备器材。",四川,成都,"简城镇公园后街20号"
四川现代建设咨询监理有限公司,91510000201816428F,1992-06-20,N/A,曾伟,"300(万元人民币)","工程监理；工程咨询；招投标代理，工程造价咨询；工程项目管理。",四川,成都,"成都市武侯区武科东二路11号2幢1-3楼2-5号"
武都引水工程梓潼实业开发公司,915107252056537428,1992-06-20,N/A,羊依国,"600(万)","建筑工程施工总承包叁级；水利水电工程施工总承包叁级；建筑装修装饰工程专业承包贰级；销售建筑材料、五金、交电。",四川,绵阳,"四川省梓潼县文昌镇翠云路272号"
四川省土地开发有限责任公司,915100002018163807,1992-06-20,N/A,聂红梅,"3,116.0800(万元人民币)","土地开发",四川,成都,"成都市青羊区百卉路13号3楼"
成都华民企业管理有限公司,91510107202154593U,1992-06-21,N/A,谢文华,"260(万元人民币)","企业管理咨询、物业管理。",四川,成都,"成都市武侯区一环路南一段51号"
成都市温江区量子科技有限公司,915101152024574558,1992-06-22,N/A,曹阳,"876(万元人民币)","批发、零售、通信电缆、动力电缆、化工产品（除危险品）、建筑材料",四川,成都,"成都市温江区永盛镇劳模村7组"
成都鹃艳食品有限公司,91510124202496630T,1992-06-22,N/A,晏成福,"50(万元人民币)","生产、销售：调味品",四川,成都,"成都市郫县花园镇七里香村"
自贡市大安商业贸易公司五门市,91510304MA6CJ2LL33,1992-06-23,N/A,胡维华,"N/A","日用杂品、陶瓷制品、建筑材料、涂料、日用百货。(以上范围不含法律、法规和国务院决定需要前置审批或许可的项目)。(依法须经批准的项目,经相关部门批准后方可开展经营活动)",四川,自贡,"自贡市大安区大安街扇子坝"
四川三联饲料有限公司,91511421207258332R,1992-06-23,N/A,余汇江,"871(万元人民币)","饲料、浓缩饲料、农副产品（不含棉花、蚕茧、烟叶）、化学肥料、针纺织品、百货、五金交电、化工产品（不含危险品）、建筑材料（不含木材）、钢材、水泥、体育用品、汽车配件、装饰材料销售（以上项目不含前置许可或审批项目，涉及后置许可或审批的凭许可证经营）（依法须经批准的项目，经相关部门批准后方可开展经营活动）",四川,眉山,"仁寿县文林镇书院路二段383号"
成都市华兴建筑工程公司,91510122202366158J,1992-06-23,N/A,丁正全,"5,000(万元人民币)","房屋建筑、公路工程建筑",四川,成都,"成都市双流区东升街道清泰路二段35号1楼"
中国建设银行股份有限公司绵阳兴达广场支行,91510703772996979H,1992-06-24,N/A,廖相容,"N/A","吸收存款、发放贷款、办理结算，代理发行兑付政府债券、金融债券，代理支付款项及代理保险业务，按规定办理票据贴现，办理政策性房改业务，外币存款及外币兑换业务；按规定经中国银行业监督管理委员会批准或有权上级行授权开办的其他业务。(依法须经批准的项目，经相关部门批准后方可开展经营活动)",四川,绵阳,"绵阳市公园路1号"
四川省烟草公司南充市公司,9151130020945007XM,1992-06-24,N/A,钟智,"2,234.7000(万元人民币)","调拨，批发，零售：卷烟，雪茄烟，烟叶。",四川,南充,"南充市丝绸路286号"
成都市成华区蓉城贸易公司,91510108MA61W82X8H,1992-06-25,N/A,邓维元,"53(万元人民币)","针纺织品、百货同经营范围。",四川,成都,"成都市成华区荷花池东二街青龙饭店"
雅安市宏达建筑工程公司,915118027118459074,1992-06-25,N/A,张雅平,"2,000(万元人民币)","房屋建筑工程施工总承包二级、钢结构工程专业承包叁级。",四川,雅安,"雅安市临江路66号"
四川省内江国泰建设工程公司,91511000206408351Y,1992-06-26,N/A,罗公才,"2,085(万元人民币)","房地产开发及商品房销售、代建房及其他工程建设（依法须经批准的项目，经相关部门批准后方可开展经营活动）",四川,内江,"内江市市中区交通路298号附501号"
西南民航成都飞龙实业总公司,91510100201915135N,1992-06-27,N/A,张仰泽,"150(万元人民币)","航空器材及相关的配套物资代购、代销、旅游纪念品、电器维修、航空专用设备设计、安装、专业人员培训。批发、零售家用电器〔不含进口摄录放相机〕、日用百货、服装、摩托车、汽车零部件。",四川,成都,"成都市锦江区北新街31号"
都江堰市胥家兴达塑料厂,91510181202765669L,1992-06-27,集体所有制,熊继伦,"9.8万人民币","制造、销售：塑料及零配件。(依法须经批准的项目，经相关部门批准后方可开展经营活动)。",四川,成都,"四川省成都市都江堰市胥家乡场镇"
四川省洪雅华丽彩印有限公司,91511423621146854Y,1992-06-28,有限责任公司,祝永钢,"1000万人民币","包装装潢印刷；塑料袋、塑料制品、药品内包材、金属包装制品、塑料包装制品、铝箔包装制品、纸容器、纸板容器制造、销售。",四川,眉山,"洪雅县机械化工产业区胜科路二段5号"
成都市新都区盛意液压附件有限公司,9151011420258565XT,1992-06-29,N/A,李盛银,"27(万元人民币)","自产自销液压附件、液压件、液压万能仪表；液压虎钳、液压系统设备的设计、制造。以上项目不含法律、法规和国务院决定需要前置审批或许可的项目。",四川,成都,"成都市新都区石板滩镇土城村"
泸州粮油企业集团公司,915105002047144780,1992-06-29,N/A,王永吉,"2,080(万元人民币)","销售：粮油机械、饲料。",四川,泸州,"泸州市江阳区江阳中路5号"
中国建设银行股份有限公司绵阳游仙支行,91510700772997023J,1992-06-29,N/A,崔岚,"N/A","吸收存款、发放贷款、办理结算，代理发行兑付政府债券、金融债券，代理支付款项及代理保险业务，按规定办理票据贴现，外币储蓄和外币兑换业务",四川,绵阳,"四川省绵阳市游仙区东津路13号交通局公路管理处综合楼一楼17-18号"
成都泰立广播电视研究所有限公司,91510100621603445C,1992-06-29,N/A,刘致远,"100(万元人民币)","广播电视中心机房设备、网络设备、计算机软、硬件的开发、研制、销售；批发零售广播电视器材、电子产品（国家有专项规定的除外）、通讯器材",四川,成都,"成都高新区兴蓉北街1号"
成都大光大药物开发有限公司,915101007092456114,1992-06-29,N/A,徐海涛,"110(万元人民币)","药物,保健食品的研究及技术开发、技术咨询；信息技术的研发。",四川,成都,"成都高新区高朋大路17号"
中国工商银行股份有限公司绵阳荷花支行,91510703782256763K,1992-06-29,N/A,王育刚,"N/A","许可该机构经营中国银行业监督管理委员会依照有关法律、行政法规和其他规定批准的业务，经营范围以批准文件所列的为准。意外伤害保险、人寿保险、健康保险。(依法须经批准的项目，经相关部门批准后方可开展经营活动)",四川,绵阳,"绵阳市临园路西段82号"
四川西南建筑工程咨询有限公司,91510000201810085A,1992-06-30,N/A,黄祖毅,"300(万元人民币)","工程咨询；工程设计；专业技术服务；施工图设计文件审查。",四川,成都,"成都市金牛区星辉西路８号"
成都铁路机电配件厂,91510124202497334D,1992-06-30,股份合作制,曹德州,"2600万人民币","铁路机车配件、铁路专用设备及器材、配件的研发、制造、销售及相关技术服务；铁路设备修理及维护；货物及技术进出口；橡胶制品；机电设备安装",四川,成都,"成都市郫县安德镇"
成都热电厂检修公司,91510112202237591M,1992-06-30,N/A,熊先国,"64(万元人民币)","电站设备检修；机电设备和管道安装、修理；机械配件加工；金属结构件制作及安装；电厂粉煤灰活理销售[依法须经批准的项目,经相关部门批准后方可开展经营活动；未取得相关行政许可",四川,成都,"四川省成都市龙泉驿区十陵镇青龙村二组"
江油市意中实业公司,9151078121431446XC,1992-06-30,N/A,曾鑫,"50(万元人民币)","金属材料、工业电器及配件、建筑材料、粉煤灰销售；化工产品",四川,绵阳,"江油市中坝镇北大街142号"
四川省邛崃市邛州酒业有限公司,91510183709286413C,1992-06-30,N/A,李富玉,"100(万元人民币)","生产、销售：白酒(凭相关许可证在有效期及许可范围内从事经营）。",四川,成都,"成都市邛崃市孔明乡太阳村十七组"
成都倍特建设开发有限公司,91510100201956068K,1992-07-01,N/A,栾汉忠,"28,590(万元人民币)","房地产开发、商品房经营、兴建高新区内公共设施、为区内企业生产和生活提供配套服务，建筑装饰、装修（凭资质经营）；停车场的管理",四川,成都,"成都高新区九兴大道8号"
四川苍龙公路桥梁工程有限公司,91510821205951432T,1992-07-01,N/A,宋海涛,"5,000(万元人民币)","公路工程施工总承包二级；市政公用工程施工总承包二级；水利水电工程施工总承包二级；公路路基工程专业承包二级；公路路面工程专业承包二级；桥梁工程专业承包二级；公路交通安全工程施工承包",四川,广元,"旺苍县东河镇新桥村2社"
四川省江油市长城石化配件厂,91510781MA624FH35K,1992-07-01,集体所有制,胥君,"50万人民币","仅供清理本企业债权债务使用。",四川,绵阳,"江油市太平路观音桥"
四川省江油市科迪特殊钢制品厂,91510781214314574M,1992-07-02,联营企业,李顺安,"80万人民币","汽阀钢棒材及冷拔丝加工、销售，特殊钢材生产工艺的研究及深加工后产品的销售。",四川,绵阳,"江油市武都镇江武路"
四川德阳融发公司,91510600205171532K,1992-07-02,N/A,郭艳,"50(万元人民币)","化工原料（不含有毒、易燃原料），计划外金属材料",四川,德阳,"四川省德阳市区涪江西路"
成都市武侯区凉井机械铸造厂,91510107202158412P,1992-07-03,集体所有制,杨大明,"3万人民币","机械铸造加工；钢窗,铝合金卷门窗,线路附件加工",四川,成都,"成都市武侯区凉水井村9组"
成都市金牛国鑫粮油购销有限责任公司,915101002019562606,1992-07-03,N/A,何艳,"180(万元人民币)","粮油及其制品贸易、仓储服务、粮油加工；房屋租赁；物业管理；提供场地服务。",四川,成都,"成都市茶店子西口内配路(跃进村二、三组)"
四川金鹏圣汇置业有限公司,91510000768628997H,1992-07-03,N/A,张辉,"1,000(万元人民币)","房地产开发；物业管理；商务信息咨询；商品批发与零售。",四川,成都,"成都市青羊区太升北路64号1幢10楼14号"
宜宾天原集团股份有限公司压力容器检测站,91511500MA62A6MD70,1992-07-03,N/A,李建权,"N/A","特种设备检验。(依法须经批准的项目，经相关部门批准后方可开展经营活动)",四川,宜宾,"宜宾市下江北"
成都五化塑料有限公司,91510100201907776N,1992-07-03,N/A,白红,"1,903(万元人民币)","批发、零售：五金交电及电子产品、化工产品（不含危险品）、塑料制品、机械设备、纺织品、服装、鞋帽、皮革、箱包、化妆品、工艺品（不含文物）、日用百货、眼镜（不含隐形眼镜）、钟表、文化体育用品及器材、矿产品",四川,成都,"成都市青羊区通惠门街33号"
太极集团四川太极制药有限公司,91510122621609724F,1992-07-04,N/A,胡元发,"217(万元人民币)","生产、销售片剂（含青霉素类）、颗粒剂、胶囊剂、原料药（盐酸格拉司琼、盐酸托烷司琼、紫杉醇、精氨酸乙酰水杨酸）、小容量注射剂（含抗肿瘤药、激素类）、大容量注射剂",四川,成都,"四川省成都市双流区西南航空港经济开发区"
成都市锦江区食品公司商贸部,91510104709281356J,1992-07-04,N/A,曹华,"N/A","针纺织品、服装、日用百货、家用电器；建辅建材、文化用品。",四川,成都,"成都市锦江区署袜中街44-46号"
成都市大同实业公司,91510106202105935L,1992-07-06,N/A,邓先敏,"302.2000(万元人民币)","销售：净化剂系列产品、电子变频器、汽车配件、日用百货、文化用品、五金交电、建筑材料。",四川,成都,"成都市金牛区华严路49号"
平武县林业开发公司,91510727205752126Q,1992-07-06,N/A,李甫金,"36.3000(万元人民币)","森林管护；森林资源、野生动植物资源、湿地资源、荒漠化土地调查监测评价；森林分类区划界定；占用征收林地可行性报告编制；森林资源规划设计调查；实施方案编制；林业专项核查；林业作业设计调查；营造林设计；林业数表编制；木材检验；育苗。兼营：林副业产品购销。",四川,绵阳,"平武县龙安镇冀安西路48号"
四川省冶金贸易开发公司,91510000201804216N,1992-07-07,N/A,李强国,"505(万元人民币)","金属材料（不含稀贵金属），化工原料",四川,成都,"成都市陕西街100号"
中国机械工业供销西南公司,91510000201816401P,1992-07-08,N/A,陈矢,"2,027(万元人民币)","商品批发与零售",四川,成都,"成都市锦江区一环路东四段14号"
成都市医药总公司,91510108201904962J,1992-07-08,N/A,易显奇,"600(万元人民币)","销售：消毒用品、消毒剂、I类医疗器械、化妆品、劳保用品、玻璃仪器；医学新产品开发、技术咨询、技术服务；第二类精神药品、生化药品、中药材、中成药、中药饮片、生物制品（不含预防性生物制品）、化学原料药、抗生素原料药、化学药制剂、抗生素制剂、蛋白同化制剂、肽类激素、医疗器械II类、III类（以上项目凭许可证并按许可时效和范围经营）、化学试剂（不含危险化学品）批发；批发兼零售：预包装食品兼散装食品",四川,成都,"成都市成华区成华大道新鸿路187号"
四川省坤瑞电力工程有限公司,91510000202205573J,1992-07-08,N/A,朱宏伟,"2,600(万元人民币)","(以下范围不含前置许可项目，后置许可项目凭许可证或审批文件经营)输变电工程、建筑工程、钢结构工程、特种工程、建筑装修装饰工程、防水防腐保温工程、市政公用工程、园林绿化工程、城市及道路照明工程、工程管理服务、电气设备修理；商品批发与零售。",四川,成都,"成都市武侯区广福桥30号"
沐川县沐溪河流域综合开发有限公司,915111292076520065,1992-07-09,N/A,杨胜利,"31.1000(万元人民币)","自来水生产和供应，水力发电。自来水管道及设备安装、维修；水利水电器材、五金交电、家用电器、建材、化工（不含危化品）、日杂",四川,乐山,"沐川县沐溪镇交通街693号"
成都市恒通办公用品有限公司,915101082020416363,1992-07-09,N/A,张登明,"50(万元人民币)","销售：文具用品、五金交电、建筑材料、水暖部件、日用百货、复印机及配件；计算机维修",四川,成都,"成都市成华区新鸿路118-120号"
威远县永生塑料厂,91511024X210604598,1992-07-09,个人独资企业,滕晓燕,"N/A","自产自销：日用塑料杂品",四川,内江,"内江市威远县严陵镇长益村九组51号"
成都市川电三联电器配套厂,915101242025007590,1992-07-10,集体所有制,唐东俊,"30万人民币","绝缘制品。",四川,成都,"成都市郫县唐昌镇西北公路"
中国银行股份有限公司自贡大安支行,915103007348555770,1992-07-10,N/A,徐丽,"N/A","许可该机构经营中国银行业监督管理委员会依照有关法律、行政法规和其他规定批准的业务，经营范围以批准文件所列的为准。",四川,自贡,"自贡市大安区大安街望竹湾社区居委会3组远达仁和半岛售楼部"
中国农业银行股份有限公司理县新区分理处,91513200692291063D,1992-07-10,N/A,伍宇斌,"N/A","吸收存款、发放贷款、办理结算、储蓄业务；中国人民银行和国家外汇管理局批准的经营金融业务；按规定经中国银行业监督管理委员会批准或有权上级行授权开办的其他业务。",四川,阿坝,"理县杂谷脑镇"
四川汇元经贸产业有限责任公司,915107816209187366,1992-07-10,N/A,胡洪贵,"3,300(万元人民币)","中餐制售（凉菜、裱花蛋糕）；住宿、茶水；卡拉OK（包间）；卷烟雪茄烟零售【以上限分支机构经营】；预包装食品批发、零售；金属材料、冶金炉料、建材、五金交电、针纺织品、百货、汽车",四川,绵阳,"江油市中坝镇花园路北段335号汇元国际商业广场二期1栋3楼22号"
乐山市乐湘涂料有限公司,915111002070621378,1992-07-10,N/A,胡太学,"50(万元人民币)","涂料、墙地砖生产、销售；建筑装饰施工；家具加工；日用百货，针纺织品，塑料制品，土畜产品；五金、交电、化工（不含化学危险品）；烟、酒零售；商品展销服务",四川,乐山,"乐山市市中区车子乡惠安村"
四川南方高新技术产业公司,91510000201817148P,1992-07-11,N/A,邓起孝,"100(万元人民币)","一般经营项目",四川,成都,"成都市锦江区秀水街1号(自编号95号)"
西昌丰源实业有限公司,91513401MA62H52H8C,1992-07-12,N/A,焦新庆,"1,008(万元人民币)","住宿、餐饮及茶水服务",四川,凉山,"西昌市文汇路中段"
成都晨光房地产开发有限责任公司,915101242025051895,1992-07-13,N/A,兰康云,"800(万元人民币)","房地产开发，建筑材料销售",四川,成都,"成都市郫县郫筒镇南街二段"
