四川省新兴房地产开发公司,915100002018320731,1992-10-27,N/A,赵辅成,"732(万元人民币)","房地产经营。",四川,成都,"成都市解放路一段95号"
中铁八局集团第四工程有限公司,91510100201962433J,1992-10-27,N/A,廖华政,"20,000(万元人民币)","房屋建筑工程、市政公用工程、铁路工程、公路工程、消防设施工程、钢结构工程、建筑装修装饰工程、建筑幕墙工程、机电设备安装工程、环保工程施工；设备安装；工程技术检测服务；环境保护监测；技术咨询服务；工程机械、机械设备销售及维修；物资机械设备租赁；铁路专用设备器材及配件租赁；仓储；机械加工；室内装饰；电脑动画设计；包装装潢设计；销售：铁路专用设备、器材及配件、日用百货、汽车配件、塑料制品、橡胶制品；打字、复印（限分支机构经营）；住宿、中餐制售（不含凉菜）、预包装食品销售、茶座（限分支机构经营）；零售卷烟、雪茄烟（限分支机构经营）；预制构件销售、组装与装配工程施工；苗木、花卉种植及销售；自营和代理各类商品和技术的进出口",四川,成都,"四川省成都市西北桥东街4号"
汉源县西沟石材加工总厂,91511823711845739F,1992-10-27,个人独资企业,陈军,"N/A","花岗石购销。",四川,雅安,"汉源县富泉乡大农村五组"
四川省冶金综合服务公司,915100002018230894,1992-10-27,N/A,王野,"500(万元人民币)","一般经营项目",四川,成都,"成都市青羊区人民中路一段一号"
攀枝花攀西蓝星化学清洗有限公司,9151040020435795XG,1992-10-28,N/A,吉伟,"1,300(万元人民币)","各类工业设备、民用设施及交通工具的系统清洗除垢，工业设备、管道的防腐；化学清洗技术咨询；果树、苗木、花卉种植、荒山育苗；机械、电器设备修理；冶金辅助材料加工；金属结构件制造；办公设备维修；销售：百货、针纺织品、五金、交电、化工（不含危险品）、日用杂品",四川,攀枝花,"攀枝花市东区马坎巷"
夹江县兴中机械厂,91511126621142159M,1992-10-28,个人独资企业,王运树,"N/A","瓷砖机械设备制造、修理，通用零部件制造、销售，机制砖瓦制造、销售；销售瓷砖机器设备、配件、五金交电化工产品、小型机电产品、建筑材料。",四川,乐山,"夹江县漹城镇迎恩路10号"
成都市东方防腐工程有限公司,915101122020010798,1992-10-29,N/A,赖玉,"500(万元人民币)","金属及非金属防腐及保温工程（依法须经批准的项目，经相关部门批准后方可开展经营活动；未取得相关行政许可",四川,成都,"四川省成都市龙泉驿区龙泉镇青年路173号"
成都高新电缆有限责任公司,915101832024131887,1992-10-29,N/A,何成基,"811(万元人民币)","生产销售：电缆、电线；销售：日用五金、通讯器材，电缆材料及配件。",四川,成都,"成都市邛崃市平乐镇闫巷子"
成都市保兴贸易有限公司,91510100201950176Q,1992-10-29,N/A,冷松,"800(万元人民币)","销售：钢材、有色金属材料、金属制品、建筑材料、普通机械、电器机械及器材、五金工具、汽车零部件、文化办公机械、计算机及配件、日用百货、服装、针纺织品、家用电器；房地产开发。",四川,成都,"成都市青羊区槐树街30号"
成都发达塑业有限公司,91510122202374182C,1992-10-30,N/A,杨树青,"180(万元人民币)","销售电线、电子原器件、漆包线、超微细活性碳酸钙、化工原料",四川,成都,"成都市双流区东升街道接待寺社区9组"
广汉市金雁贸易公司成都海飞音响音乐中心,91510108MA61WDBC74,1992-10-31,N/A,陈永宁,"30(万元人民币)","工艺美术品(不含金,银首饰)信息开发,技术咨询及技术服务。",四川,成都,"成都市人民南路20号"
大邑县水电建筑安装工程公司,915101292026670493,1992-10-31,N/A,刘文彬,"615(万元人民币)","中型水利水电建筑工程施工、涵洞、隧道、公路、桥梁、河道疏浚工程施工。",四川,成都,"成都市大邑县晋原镇围城路东段192#"
四川省城镇建设综合开发有限责任公司,91510000201823118F,1992-10-31,N/A,陈朝钦,"2,000(万元人民币)","房地产开发经营；建筑装修装饰工程；房地产中介服务。",四川,成都,"成都市青羊区太升南路222号成都赛格广场4层5008-5016、5025-5017"
四川亿丰粮油有限公司,9151000071184316X0,1992-10-31,N/A,石世建,"2,000(万元人民币)","仓储业；商品批发与零售；（以上项目不含前置许可项目，后置许可项目凭许可证或审批文件经营）（以下项目经营期限以许可证为准）粮食收购；经营预包装食品",四川,成都,"成都市武侯区科华中路9号1-1幢10楼18号"
峨眉山市峨眉车务段劳动服务公司,91511181207464216U,1992-10-31,N/A,杨箭,"70(万元人民币)","机械及人力装卸、代办铁路运输服务、地中衡、物资仓储、机械维修代理服务、室内外装饰、劳务派遣、矿产品销售。",四川,乐山,"峨眉山市桂花桥镇"
成都市武侯区桂溪房地产开发公司,9151010720215514XP,1992-10-31,N/A,樊增明,"2,170(万元人民币)","房地产开发,项目投资，装饰工程,建辅材料。",四川,成都,"成都市武侯区外东高攀村"
渠县粮油贸易公司,915117252107565272,1992-11-02,N/A,陈世华,"32(万)","粮食代购、代销。",四川,达州,"渠县渠江镇胜利街56号"
四川省金竺建筑有限责任公司,91510922206357443L,1992-11-02,N/A,何军,"2,100(万元人民币)","房屋建筑工程、市政公用工程、水利水电工程、公路工程、园林绿化工程、建筑装饰装修工程、地基基础工程、土石方工程、环保工程、体育场地设施工程、建筑防水工程、防腐保湿工程、玻璃门窗工程、玻璃幕墙工程、堤防工程、河湖整治工程、水工大坝工程、公路路面工程、公路路基工程、城市道路照明工程、钢结构工程",四川,成都,"四川省成都市天府新区煎茶街道文化路12号"
乐山市兴业投资公司,91511100206956198P,1992-11-03,N/A,梁建奇,"4,504.4000(万元人民币)","投资与资产管理、资产经营；土地整理。",四川,乐山,"乐山市市中区柏杨中路528号6楼"
四川开大教育旅行社有限公司,91510000201823249B,1992-11-03,N/A,闵红,"150(万元人民币)","许可经营项目：入境旅游业务、国内旅游业务",四川,成都,"成都市金牛区一环路西三段三号"
四川省农业生产资料总公司化肥公司,91510000201823230E,1992-11-03,N/A,刘廷礼,"1,000(万元人民币)","化学肥料。",四川,成都,"成都市太升北路12号"
乐山市宝通贸易有限公司,915111002070578646,1992-11-03,N/A,许光荣,"36(万元人民币)","销售五金、交电、建材、其他机械设备及电子产品、金属材料、金属矿及非金属矿",四川,乐山,"乐山市市中区柏杨东路39号1幢1楼1号"
四川农资集团塑料化工有限公司,91510000201823329Y,1992-11-03,N/A,施宏,"580(万元人民币)","",四川,成都,"成都市青羊区太升北路12号7楼"
西昌昆班建筑工程有限公司,915134017091153586,1992-11-04,N/A,凌昆,"23,000(万元人民币)","房屋建筑工程施工总承包贰级：公路工程施工总承包贰级；市政公用工程施工总承包叁级；园林古建筑工程专业承包叁级；；爆破与拆除工程专业承包叁级；地基与基础工程；公路路基工程；公路路面工程；建筑装修装饰工程；土石方工程",四川,凉山,"西昌市商业街二段(州交通局)4幢1单元11层1号"
四川省机械科技开发有限责任公司,91510105201823601J,1992-11-04,N/A,蒋运烈,"50(万元人民币)","生产机电产品；销售：机械电子设备、五金交电、金属材料（不含稀贵金属）、化工材料、化工产品",四川,成都,"成都市人民中路一段5号招待所5楼"
成都市武侯区南辉工商实业公司,9151010720215485X9,1992-11-04,N/A,李长春,"200(万元人民币)","机械制造,木材加工,建筑安装，建辅材料，五金交电,机电产品,日用百货,工艺品(不含金银),农用机械，成都市武侯区火车南站蔬菜批发市场物业管理。",四川,成都,"成都市武侯区火车南站8号"
成都亚明电子有限公司,91510108629524717R,1992-11-04,N/A,李治刿,"500(万元人民币)","生产",四川,成都,"成都市成华区建设北路三段2号1栋1单元22层5号"
宜宾市房屋建筑安装工程公司,91511502G55688523A,1992-11-05,N/A,左林,"607(万元人民币)","工业与民用建筑工程施工",四川,宜宾,"北城珠玉街19号4楼"
四川叙永农村商业银行股份有限公司,9151050020500307XF,1992-11-05,N/A,徐军,"20,030(万元人民币)","吸收公众存款；发放短期、中期和长期贷款；办理国内结算；办理票据承兑与贴现；代理发行、代理兑付、承销政府债券；买卖政府债券、金融债券；从事同业拆借；从事银行卡业务",四川,泸州,"叙永县叙永镇环城中路55号"
雅安市旅游汽车公司,91511800210904470R,1992-11-05,N/A,何俊,"49(万元人民币)","摩托车配件、劳保用品、针纺织品.（依法须经批准的项目，经相关部门批准后方可开展经营活动）",四川,雅安,"雅安市北二路140号"
成都长城电器厂,915101052020672382,1992-11-05,集体所有制,骆盛国,"60万人民币","输配电器；电子产品。",四川,成都,"成都市青羊区苏坡乡龙咀村四组"
四川丝绸泰发实业公司,915100006216039982,1992-11-06,N/A,王青元,"800(万元人民币)","商品批发与零售；物业管理；停车服务。",四川,成都,"成都市高新区永丰路14号4栋202室"
四川化工机械厂康达实业开发公司,915101136218811383,1992-11-06,集体所有制,丁世奇,"50.05万人民币","铸锻件及通用零部件；为本厂组织供应生产所需的原燃材料及设备；化工机械维修；批发零售：五金交电、日用百货、现代办公用品、化工原料、（不含危险品）、建筑材料、钢材、农副产品",四川,成都,"成都市青白江区大弯镇果市巷"
渠县粮油储运基建工业公司,91511725210756578A,1992-11-06,N/A,杨杰,"50(万元人民币)","粮油及其制品、粮油包装物资的组织供应、粮油质量测定。为本县粮食系统的修建提供咨询服务。",四川,达州,"渠县渠江镇胜利街56号"
四川国龙集团金属制品有限公司,91510113202280426T,1992-11-06,N/A,赵中彬,"12,000(万元人民币)","制造、销售：镀锌钢丝、镀锌钢绞丝、钢丝绳、弹簧钢丝、轮胎钢丝、焊丝、预应力钢丝、钢芯、裸铝绞线、布电线、电力电缆、控制电缆、金属制品；批发零售：建筑材料、金属材料（不含稀贵金属）、金属网围栏；普通货运；经营企业自产产品及技术的出口业务；经营本企业生产所需的原辅材料、仪器仪表、机械设备、零配件及技术的进口业务",四川,成都,"中国(四川)自由贸易试验区成都市青白江区祥福镇高平南路981、988、999号"
四川都江堰市伟达有限公司,91510181621871829L,1992-11-07,N/A,彭伟,"100(万元人民币)","引进资金、技术项目；销售国家政策许可的化工产品（不含危险化学品）、五金交电、矿产品",四川,成都,"四川省成都市都江堰市观景路宝瓶花园内"
四川省永兴管理服务公司,91510000201823628W,1992-11-07,N/A,王建国,"450(万元人民币)","物业管理、商务服务业、房屋租赁。",四川,成都,"成都市锦江区永兴巷15号"
四川华欣实业公司,9151000020182353X9,1992-11-07,N/A,周亚利,"128(万元人民币)","生产针纺织品，纺织机械及配件，纺织原料",四川,成都,"成都市青羊区十二桥路二号"
成都蜀鹏房地产开发有限公司,91510182202544014G,1992-11-07,N/A,宁钦海,"800(万元人民币)","房屋销售[依法须经批准的项目，经有关部门批准后方可开展经营活动]。",四川,成都,"成都市彭州市天彭镇金彭西路335号"
四川省三业发展总公司,915100002018240497,1992-11-07,N/A,陈颖科,"400(万元人民币)","化工原料、化工产品（不含危险品），交电，照像器材，五金工具，仪器、仪表、计算机、文化办公机械，金属材料（不含稀贵金属），普通机械，电器机械及器材，通讯器材，电子元器件，摩托车及配件，建筑材料（不含危险化学品），针纺织品，日用百货，酒",四川,成都,"成都市青羊区温哥华广场8楼E,F室"
乐山市五通桥昌源水业有限责任公司,91511112207157144B,1992-11-09,N/A,卢健,"1,610(万元人民币)","自来水、桶装纯净水、矿化水生产、销售；给排水管表安装维修；供水设备、材料销售；园林绿化",四川,乐山,"乐山市五通桥区竹根镇劳动街"
广汉市博美印务有限责任公司,91510681214281960P,1992-11-09,N/A,曾航,"160(万元人民币)","销售：印刷材料；包装装潢、其它印刷品印刷",四川,德阳,"四川省广汉市小汉镇凤翔村三社"
成都瑞发置业有限责任公司,91510106202098472U,1992-11-09,N/A,秦怀林,"3,000(万元人民币)","房地产开发、经营",四川,成都,"成都市金牛区黄忠街8号"
成都郫县华光机械厂,91510124MA62LU41X4,1992-11-10,集体所有制,张东,"110万人民币","汽车减震器及零配件。",四川,成都,"郫县唐昌镇建丰村六组"
四川红驰农机销售有限公司,91510824MA6252YL0W,1992-11-10,N/A,胡勇,"37,317.0336(万元人民币)","百货零售；书刊零售；中华鳖零售；零售：预包装食品兼散装食品，乳制品",四川,广元,"苍溪县歧坪镇歧坪场"
四川省华夏房屋开发公司,915100002018236795,1992-11-10,N/A,范晓晋,"806(万元人民币)","房地产开发经营",四川,成都,"成都市成华区一环路东一段192号"
成都王府井百货有限公司,91510100201930562J,1992-11-10,N/A,胡勇,"37,317.0336(万元人民币)","百货零售；书刊零售；中华鳖零售；零售：预包装食品兼散装食品，乳制品",四川,成都,"成都市锦江区总府路15号"
成都铁路房地产开发公司,91510100201950889T,1992-11-10,N/A,刘强,"6,432(万元人民币)","房地产开发、经营；成都荷花池市场第七交易区经营管理；房地产经纪与代理、土地开发、土地整理；项目管理，劳务分包。批发零售建筑材料、计划外钢材、房地产租赁技术咨询、房屋装饰装修。",四川,成都,"成都市金牛区西一路"
成都前进建筑装饰工程公司,91510124720355424J,1992-11-11,N/A,张宇,"50(万元人民币)","房屋装饰、维修及装饰材料加工。",四川,成都,"成都市郫县郫筒镇西街三段"
攀枝花市蓝天经济贸易公司,91510400204358143Q,1992-11-11,N/A,付正兴,"35(万元人民币)","销售：百货、针纺织品、日用杂品",四川,攀枝花,"江南二路一村55号"
成都蜀星总公司,9151012472035048X2,1992-11-11,N/A,刘昌贵,"1,100(万元人民币)","投资开发、花木种植。",四川,成都,"成都市郫县郫筒镇成灌西路315号"
四川宏大建筑工程有限公司,91510000201971778J,1992-11-11,N/A,杨德成,"10,380(万元人民币)","一般经营项目",四川,成都,"成都市金牛区兴科中路36号1栋11楼1号、3号、4号、5号"
成都华益教育实业开发总公司,915101072021613127,1992-11-12,N/A,薛运良,"1,000(万元人民币)","教育信息咨询、组织本公司所属实体的项目开发,产品研制成果转让、自有房屋租赁。",四川,成都,"成都市武侯区洗面桥下街20号"
成都华樱出国预备人员培训中心有限责任公司,91510100621709119J,1992-11-12,N/A,胡宗跃,"100(万元人民币)","培训赴日研修生，出国人员，外经贸人员及三资企业工作人员，提供出国咨询服务",四川,成都,"四川省成都市青羊区西大街84号"
四川省威远县中福贸易公司,91511024206708936Y,1992-11-12,N/A,李建明,"50(万元人民币)","批发零售：日用杂品、五金、交电、民用建筑材料；停车。",四川,内江,"威远县黄荆沟镇老明槽"
成都明泰房屋开发有限公司,91510100621701758U,1992-11-12,N/A,尤巧,"2,700(万元人民币)","位于成都市火车北站处商贸大厦的房屋销售和出租。",四川,成都,"成都市金牛区人民北路二段298号"
成都市成华区狮子劳动运输服务公司,91510108202209902L,1992-11-12,N/A,钟培廷,"53.2000(万元人民币)","劳务派遣（不含职业介绍与咨询、推荐和劳务输出及其他法律法规决定需前置审批项目）；建筑工程机械设备租赁；人力装卸服务",四川,成都,"成都市成华区八里庄77号"
成都长源工程咨询有限公司,91510100621700739M,1992-11-13,N/A,曹亮,"2,200(万元人民币)","从事工程项目设计、工程承包代理及工程咨询服务，开发、研制、销售装饰材料，承接装饰、装修工程，对外工程晒图、监理，工程招标代理。工程项目管理；工程造价咨询。",四川,成都,"成都市青羊区石马巷5号"
四川省农业生产资料总公司自贡公司,915103006207272353,1992-11-13,N/A,何晓波,"55(万元人民币)","销售：化肥、农膜、农机具。五金、交电、化工产品",四川,自贡,"自贡市汇东新区汇东路东段19号(英祥大厦)"
攀枝花市宏福机械电器制造有限责任公司,915104022044529225,1992-11-13,有限责任公司,任福禄,"50万人民币","机械制造；铆焊件、锻造件精加工；配电盘、箱、柜制造、安装。销售：建筑材料、机械设备。",四川,攀枝花,"攀枝花市大和北路三村323号附12号"
四川宜宾树高建筑有限公司,91511521MA62A3NN7N,1992-11-13,N/A,梁佩强,"5,001(万元人民币)","房屋建筑工程施工总承包二级、公路工程、建筑装修装饰工程、防腐保温工程、市政工程",四川,宜宾,"四川省宜宾市叙州区柏溪镇滨江路金沙首座1幢5层5号"
简阳市铁埝建材有限公司,91510185206867013E,1992-11-14,N/A,陈伟,"30(万)","生产、销售：页岩砖；销售：建材。",四川,成都,"四川省简阳市铁埝村一社"
四川省巴中运输(集团)有限公司南江城南客运站,91511922910577984M,1992-11-16,N/A,韩友波,"N/A","汽车站经营。百货、汽车配件零售。",四川,巴中,"四川省巴中市南江县南江镇米仓山大道南磷路298号"
成都市万宝房地产开发公司,91510108MA61WCPF87,1992-11-16,N/A,沈国建,"2,098(万元人民币)","房地产开发、经营。",四川,成都,"成都市马鞍南路38号万宝大厦11楼"
成都宝光数码产品市场经营管理有限责任公司,91510100621701520L,1992-11-16,N/A,王登荣,"2,000(万元人民币)","宝光数码产品科技专业市场经营及管理；从事本市人民南路四段1号“庄士中心”的销售、出租、转让及管理。",四川,成都,"成都市武侯区人民南路四段一号"
四川石油管理局川中石油天然气勘探开发公司,91510903906163092L,1992-11-16,N/A,青春,"N/A","组织供应所属企业生产的生产资料",四川,遂宁,"遂宁市城区凯旋下路162号"
成都市成华区电力器材供应公司,91510108629512812R,1992-11-16,N/A,陈木清,"64.8000(万元人民币)","电工器材、输变电设备；五金工具、家用电器、建筑材料、金属材料",四川,成都,"成都市成华区槐树店路40号民苑1栋1层68号"
四川省巴中运输(集团)有限公司汽车第一六零队,91511922731599977F,1992-11-16,N/A,韩友波,"N/A","城市公交客运；县内班车客运（四类），县内班车客运（农村客运），县内包车客运，市际班车客运（一类），市际包车客运，省际班车客运",四川,巴中,"四川省巴中市南江县南江镇米仓山大道南磷段298号"
四川瑞通实业发展有限公司,91510000621606080T,1992-11-17,N/A,雷静松,"350(万美元)","从事工业用房、商业用房和居民住宅的开发、建设、出租、装饰工程施工、销售",四川,成都,"四川省成都市高新区永丰路22号1幢5楼5号"
四川省南充市鑫达房地产开发有限公司,9151130078914537XL,1992-11-17,N/A,殷邦权,"1,000(万元人民币)","房地产开发与经营。",四川,南充,"南充市顺庆区白土坝路16号1幢2层1号"
川西南石油物资供销公司,915103116207295993,1992-11-17,N/A,吴志平,"500(万元人民币)","批发(仅限票据交易)：汽油、柴油；销售：润滑油；成品油及物资代理咨询；销售：化工产品（不含危化品）、建筑五金、交电、石油钻采配件、竹、藤、木制品、汽车配件、钢材（含废旧钢材）、纯碱、水泥、化肥、燃料油",四川,自贡,"自贡市自流井区东兴寺街东兴河岸家园5栋1单元1-16号"
四川蜀华工贸公司电子仪器厂,91510108MA61W7707M,1992-11-18,集体所有制,梁希鑫,"4.69万人民币","电子仪器。",四川,成都,"成都市东安北石街38#"
四川新安置业有限公司,91510107202152950N,1992-11-18,N/A,蒲伟,"1,000(万元人民币)","房地产开发；城市雕塑、壁画、园林的设计",四川,成都,"成都市武侯区永丰乡核桃村三组"
成都三泰屋业有限公司,91510100621709514R,1992-11-18,N/A,黎明,"3,200(万元人民币)","开发、经营住宅及非住宅。",四川,成都,"四川省成都市武侯区桐梓林中路1号"
成都丽港纸制品有限公司,915101006217014326,1992-11-18,N/A,周勤,"200(万元人民币)","开发、生产、销售瓦楞纸箱包装、无钉纸箱包装。",四川,成都,"成都市金牛区金牛乡罗家村"
中国石油天然气股份有限公司四川达州销售分公司麻柳加油站,915117217274554870,1992-11-18,N/A,唐飞,"N/A","零售：汽油、柴油",四川,达州,"达州市达川区麻柳镇万宝寨村二组"
成都市华蓉机电设备公司,91510100201944809P,1992-11-18,N/A,杨子进,"58(万元人民币)","机械设备。计划外金属材料",四川,成都,"成都市金牛区金府路502号A区13幢9号"
四川百事佳国际房地产开发有限公司,9151010062170502XY,1992-11-18,N/A,熊小峰,"5,000(万元人民币)","成都市境内的旧城改造、开发区建设，以及牧马山的房屋开发、经营",四川,成都,"四川省成都市武侯区临江东路36号1栋3层"
成都市南塔酒业有限公司,91510183202413794X,1992-11-18,N/A,朱阳春,"50(万元人民币)","生产销售白酒。生产销售白酒。",四川,成都,"成都市邛崃市宝林镇百胜村"
四川省子昂建设工程有限公司,915100002020821478,1992-11-18,N/A,谢信,"3,054(万元人民币)","",四川,成都,"成都市金牛区金府路593号7幢1层2号"
内江东兴变压器配件厂,91511000206400368U,1992-11-19,集体所有制,钟开琼,"5.21万人民币","金具铁附件，金属表面处理及热处理；变压器及汽车电机修理。",四川,内江,"四川省内江市东兴区新江路176号"
四川怡和置业有限公司,91510100621605352W,1992-11-19,N/A,粟世金,"10,000(万元人民币)","房地产经营；销售建筑材料、装饰材料（不含危险化学品）；项目投资",四川,成都,"成都市高新区一环路南三段80号信都大厦综合楼5楼"
峨眉山市灯具厂,91511181MA6CKQEU3H,1992-11-19,集体所有制,汪志华,"9万人民币","交通用灯具制造（依法须经批准的项目，经相关部门批准后方可开展经营活动）",四川,乐山,"峨眉山市绥山镇铁后街8号"
成都川大华西保健品有限公司,915101136218834320,1992-11-19,N/A,范辰华,"556.8300(万元人民币)","生产、销售：食品、消毒剂、日用品；销售：农副产品（不含限制类）；农产品初加工服务（含沙棘、蘑菇、苦瓜、芦笋）（不含限制类）；食品及保健品技术服务；商品进出口业务",四川,成都,"成都市青白江区工业集中发展区敬业路799号"
四川华灏置业有限公司,915101072065585284,1992-11-19,N/A,张玲洁,"2,008(万元人民币)","房地产开发经营；物业管理；酒店管理",四川,成都,"成都市武侯区科华北路62号12层6号"
成都市青白江区洪安石油制品有限责任公司,91510113621887708D,1992-11-19,N/A,包磊,"500(万元人民币)","销售石油制品",四川,成都,"成都市青白江区福洪镇进步村11组"
四川省农业生产资料总公司广元公司,91510800MA62569N9P,1992-11-19,N/A,蒲小波,"223(万元人民币)","化肥、农药、农膜。",四川,广元,"利州西路二段二号"
四川省南充公路物资公司,9151130020945541XA,1992-11-19,N/A,王克,"148(万元人民币)","道路沥青、乳化沥青、重油、筑养路机械及配件、建材。",四川,南充,"南充市顺庆区北干道553号"
自贡市大安机电设备公司,91510304620711516U,1992-11-20,N/A,左明均,"27(万)","零售、批发、代购、代销：电器机械及器材、阀门、轴承、五金工具、交电、金属材料、化工产品",四川,自贡,"大安区大安街"
泸州市大地房地产开发有限公司,915105002047197974,1992-11-21,N/A,杨佳庆,"500(万元人民币)","房地产开发",四川,泸州,"泸州市江阳区中平远路63号"
合江县金堂山竹木加工厂,91510522MA6CJ18Q9T,1992-11-21,个人独资企业,向阳,"N/A","竹木成品、半成品加工销售；木材、苗、木种植；家禽、水产养殖；百货、日用杂品",四川,泸州,"合江县先滩镇金堂山"
成都市金堂供销合作总公司,91510121202325372Q,1992-11-21,集体所有制,周传志,"500万人民币","零售五金交电、建筑材料、建筑辅料、农业生产资料、市场管理。",四川,成都,"成都市金堂县赵镇文化街334号"
