天津市南仓站联营储运公司,91120113103958596G,1992-06-12,N/A,陈宝钟,"876(万元人民币)","商品储存",天津,北辰,"北辰区铁东路"
天津津德建筑装饰设计工程有限公司天津办事处,91120000MA0669675D,1992-06-12,N/A,李谨,"N/A","负责总公司经营范围内的咨询、联络",天津,N/A,"N/A"
天津京工建筑工程有限公司,9112011610431811XU,1992-06-12,N/A,张连全,"5,208(万元人民币)","市政公用工程施工；土木工程建筑；工程技术咨询；金属材料、机械、电器设备、木材、建筑材料、五金、交电、百货、汽车配件批发兼零售；线路、管道、设备安装；园林绿化；室内外装饰；机械设备租赁；智能化建筑物软件设计及电子元器件安装、销售；承装（修试）电力设施",天津,滨海,"天津开发区第三大街21号B15"
天津市津南铜材加工厂,91120112103880557U,1992-06-13,集体所有制,任云中,"60万人民币","有色金属压延加工(铜材改制)；阀门的加工、制造。",天津,津南,"津南区小站镇东花园村　"
天津华能集团公司,911202251030655794,1992-06-13,N/A,于建国,"1,500(万元)","节能设备的制造；商业、物资供销；汽车（不含小轿车）；设备租赁；技术开发、转让；经济信息咨询服务",天津,蓟州,"蓟县城内文昌街六号"
天津市新星建材工业公司海鲜大酒店,91120224700509975W,1992-06-15,N/A,霍军,"N/A","主食、热菜加工经营；住宿。",天津,宝坻,"宝坻区津围路13号"
天津富丽娜餐厅有限公司,911201016006004050,1992-06-15,N/A,张信芳,"60(万美元)","西餐厅、面包西饼、欧陆美食、饮品",天津,和平,"天津市和平区南京路75号"
津川国际客货航运(天津)有限公司,911201016005034457,1992-06-15,N/A,杨万军,"40(万美元)","天津至仁川之间“天仁”号轮的客货运输及其代理业务（限分支经营）；船舶物流，物流分拨配送，集装箱维修、清洗、装卸、搬运（不涉及国营贸易管理商品，以上经营范围涉及行业许可的凭许可证件，在有效期限内经营，国家有专项专营规定的按规定办理）",天津,和平,"天津市和平区常德道56号"
中国石化销售华北有限公司,911200001030623869,1992-06-15,N/A,于金广,"30,964.8000(万元人民币)","石油化工产品销售（危险化学品及易制毒品除外）；石油产品添加剂生产、销售（危险化学品除外）；计算机软件开发；自有房屋租赁",天津,西青,"天津市华苑产业区榕苑路11号"
天津市汇通贸易有限公司,91120116104318136N,1992-06-16,N/A,杨凤麟,"90(万元人民币)","五金、交电、百货、金属材料、机械、电器设备（含汽车配件）、化工轻工材料",天津,滨海,"天津开发区第五大街1号C306室"
天津市建达科技发展有限公司,91120103103329837F,1992-06-16,N/A,闻宝联,"200(万元人民币)","（建设工程新技术、新工艺、新产品、新材料、混凝土结构应用技术、桥梁维修技术）技术开发、技术转让、技术咨询、技术服务；（机电设备、仪器仪表、计算机软硬件）技术开发、技术转让、技术服务；翻译服务；工程效果图制作；机电设备（汽车修理除外）、仪器仪表、计算机软硬件维修；管道检测；非开挖修复、更换；混凝土结构维护；混凝土结构防水、防腐工程；钢结构防腐工程；桥梁维修、加固工程；室内外装修装饰；工程监测设备租赁；（建筑防腐材料、加固材料、补强材料、装饰材料、建筑防水材料）制造、加工；佣金代理；机电设备（小轿车除外）、仪器仪表、计算机软硬件、建筑材料、沥青、橡胶制品、塑料制品、化工产品及原料",天津,河西,"河西区平山道39号"
天津天宇控股集团有限公司,91120000103067021N,1992-06-16,N/A,李文明,"7,000(万元人民币)","对制造业、房地产业、商贸业进行投资；建筑安装；有色金属压延加工；电线电缆制造；各类商品及物资供销；经营本企业或本企业成员企业自产产品及相关技术的出口业务；经营本企业或本企业成员企业生产、科研所需的原辅材料、机械设备、仪器仪表、零配件等商品及相关技术的进口业务；承办中外合资经营、合作生产及开展“三来一补”业务",天津,静海,"天津市静海城东天宇科技园内"
天津市静海县吉春汽车配件厂,91120223104156712Y,1992-06-16,集体所有制,陈庆华,"4万人民币","汽车配件制造。",天津,静海,"蔡公庄乡惠丰前村"
中国人民财产保险股份有限公司天津港保税区支公司,91120116803109034E,1992-06-16,N/A,季红英,"N/A","财产损失保险、责任保险、信用保险、意外伤害保险、短期健康保险、保证保险等人民币或外币保险业务；与上述业务相关的再保险业务；各类财产保险、意外伤害保险、短期健康保险及其再保险的服务与咨询业务；代理保险机构办理有关业务；国家法律法规规定的或国家保险监管机构批准的其他业务（依法须经批准的项目，经相关部门批准后方可开展经营活动）",天津,滨海,"天津空港经济区西三道158号金融中心5号楼1001"
天津津裕电业股份有限公司,91120105600558286P,1992-06-17,N/A,林明宗,"3,338(万元人民币)","电子控制系统及电路连接装置的研发、生产、销售、进出口及技术转让；自有设备及厂房租赁；普通货运。",天津,河北,"天津市河北区南口路12号"
天津统一企业食品有限公司,91120116600558278T,1992-06-17,N/A,吴谅丰,"9,800(万元人民币)","委托生产、委托加工、销售面粉、麸皮；调配碱粉的零售。",天津,滨海,"天津经济技术开发区"
天津华能集团安装工程公司,91120225104288926W,1992-06-18,N/A,刘林海,"300(万元人民币)","水暖管道、设备安装、维修、设计；劳务派遣服务",天津,蓟州,"蓟县经济开发区京哈道北"
天津渤化海晶建设发展有限公司,911201161043181794,1992-06-18,N/A,王勇,"30,000(万元人民币)","建筑安装、房地产开发及经营、仓储、普通货运、机械土方、挖泥船施工；装饰及设计；木材木制品、金属门窗、幕墙加工制作、安装、销售；设备租赁；建筑材料、五金交电、钢材、日用杂品、电器产品批发兼零售；拆除房屋及附属物；房屋租赁；仪器仪表、机电产品检测服务；机电安装维修；工程测量：线路管道测量、控制测量、地形测量、市政工程测量、水利工程测量、建筑工程测量、线路工程测量、变形观测、形变测量、竣工测量；房产测绘：房产平面控制测量、房产图测绘；地籍测绘：平面控制测量、宗地测量；建筑外窗的安装；建筑外窗加工",天津,滨海,"天津开发区恂园西里28号"
天津威乐斯机电有限公司,91120116600558323U,1992-06-18,N/A,张春江,"1,210(万元人民币)","高低压电气成套设备制造、安装、调试；高低压电器元件制造、修理；成套设备及工业自动化控制系统设备的技术开发、转让；高低压电器成套设备相关配件、仪器仪表、电线电缆销售；潜没电泵、电控设备制造、销售；五金工具及相关元件、配件的修理、租赁及相关技术的咨询服务；道路货物运输",天津,津南,"天津市津南区八里台镇建设五支路2号"
天津市塘沽房地产开发公司,91120116103630320M,1992-06-18,N/A,李钧,"3,000(万元人民币)","房地产开发及商品房销售；建筑安装工程。国家有专营专项规定的按专营专项规定办理。",天津,滨海,"天津市滨海新区塘沽大连道7号"
天津市大港鸿达供销公司,911201161037094420,1992-06-18,N/A,潘淑珍,"688.6600(万元人民币)","生铁、钢材、有色金属、日用百货、五金、交电、化工（危险化学品及易制毒品除外）、土产品、民用建材、机械设备、电子产品、汽车配件、木材、生物柴油、阀门、矿粉零售兼批发，工业生产用三类3项高闪点液体、三类2项中闪点液体（自有储存）、三类1项低闪点液体（无存储、租赁仓储行为）（剧毒、监控、一类易制毒化学品除外）批发，城市燃气经营（取得许可证后经营）；再生物资回收；汽车普通货运，危险货物运输",天津,滨海,"中国石化大港油库北侧"
天津华纳国际投资开发有限公司,91120116600503509W,1992-06-18,N/A,陈建鑫,"2,080(万美元)","在天津开发区内从事房地产开发、销售、自有房屋出租及相关设施的经营管理；室内外装饰工程；在经济技术开发区内建设和经营写字楼、多功能会馆、经济展示信息中心、艺术馆、酒店及其他配套的商务、通讯、交通、购物中心、健身房和娱乐服务设施。",天津,滨海,"天津经济技术开发区南海路１号"
中国外运天津集团塘沽公司,91120116103630339J,1992-06-18,N/A,郑滨,"1,506.7000(万元人民币)","报验；仓储（不含化学危险品、煤炭及有污染性货物）；劳务服务；自有房屋租赁；海上、航空、陆路国际货物运输代理；物业管理；餐饮服务",天津,滨海,"天津市滨海新区塘沽新港路86号"
天津市滨海新区塘沽金建房地产开发有限公司,91120116103630312T,1992-06-18,N/A,于德,"3,000(万元人民币)","商品房销售、土木工程建筑。",天津,滨海,"天津市滨海新区塘沽上海道3-180号"
天津市津南区咸水沽供销合作社北洋收购站,9112011279250402X8,1992-06-19,集体分支机构(非法人),王东,"N/A","废旧物资收购。",天津,津南,"天津市津南区辛庄镇白塘口村小学对面"
天津市津水工程新技术开发公司,911201031033299766,1992-06-19,N/A,史庆生,"120(万元人民币)","节水型农林灌溉设备及配套器材、低压成套设备及配套器材、金属制品、玻璃钢制品、塑料制品技术开发、生产、加工；模具设计及制造；节水型农林灌溉技术、水环境治理技术、网络信息化集成及软件技术开发、技术转让、技术咨询、技术服务；花卉、农产品种植；园林绿化、景观工程、节水型灌溉工程设计、施工、监理；农林灌溉设备及配套器材、建筑材料、水环境治理设备、化工产品批发兼零售；货物与技术进出口；物业服务、保洁、企业后勤管理服务；汽车租赁。",天津,河西,"河西区友谊路60号"
天津市武清区供销商业总公司,9112022210407029XH,1992-06-20,N/A,孙福元,"200(万元人民币)","预包装食品批发兼零售，国产卷烟零售，水果、蔬菜、淡水鱼、虾、蟹，日用百货、纺织品、服装鞋帽、箱包、五金产品、化工原料（危险化学品、易制毒化学品除外），钢材、建材、家具、化肥、农膜销售，家具加工，货物及技术进出口",天津,N/A,"杨村招商场丙楼4号"
天津赛信印刷有限公司,9112010610357092XE,1992-06-20,N/A,吴春久,"50(万元人民币)","其他印刷品印刷：纸制品加工、复膜、焖盒；写真、喷绘、亚克力、水晶字、灯箱制作；展览展示服务。",天津,红桥,"红桥区西青道70号"
天津开发区天地化工贸易有限公司,91120103104318283D,1992-06-22,N/A,王殿明,"30(万元人民币)","五金、交电、化工商品",天津,河西,"河西区宾馆南道19号内"
天津利得摄影材料化工有限公司办事处,91120000MA0669907D,1992-06-22,N/A,强钢,"N/A","负责本公司经营范围内的咨询、联络",天津,N/A,"N/A"
天津伟光电子有限公司,911201166005035680,1992-06-22,N/A,谢伟光,"22(万美元)","生产、销售小型民用电子、电器产品，设计、生产、加工、销售工模具、冷冲件、注塑件（不含国家限制、禁止类项目）＊＊＊",天津,滨海,"天津经济技术开发区"
天津京铁津通实业公司,911201051035042016,1992-06-23,N/A,赵英才,"500(万元人民币)","机械设备、电子产品、橡胶制品、仪器仪表、钢材、金属制品、建筑材料、五金、交电、化工产品（危险化学品、易制毒品除外）、百货、日用杂品、针纺织品、办公用品、劳保用品、家具、机车车辆配件、汽车配件、通讯器材、玻璃制品零售兼批发；铁路运输设备、机械设备、电子产品、家用电器、计算机修理；机加工、玻璃制品加工；铁路运输技术、计算机技术咨询、服务；铁路运输设备租赁、线路管道安装、普通货运、仓储服务",天津,河北,"天津市河北区十字街78号"
天津市津蔬工商实业公司,911201021032325336,1992-06-23,N/A,赵树贵,"96.4000(万元人民币)","服务：劳务服务、自有房屋租赁。",天津,河东,"河东区程林庄路103号增6号"
天津正通恒业商贸有限公司,91120221104008613L,1992-06-23,N/A,李原子,"869.7200(万元人民币)","皮棉、棉籽销售；纺织品、日用杂品、文具用品、预包装食品兼散装食品批发兼零售；虾收购、冷藏；水果、蔬菜保鲜、销售；自有房屋、设备租赁。",天津,宁河,"天津市宁河区贸易开发区同兴道27号"
中国建设银行股份有限公司天津浙江路分理处,911201166794478442,1992-06-23,N/A,吴刚,"N/A","吸收公众存款；发放短期、中期和长期贷款；办理国内结算；办理住房公积金及单位、个人城市住房基金的归集、结算等业务；办理票据承兑与贴现；代理发行金融债券；代理发行、代理兑付、承销政府债券；代理买卖政府债券、金融债券；从事银行卡业务；代理收付款项及代理保险业务。经总行授权的其他业务；经中国银行业监督管理委员会等监督管理机构批准的其他业务。",天津,滨海,"天津市滨海新区塘沽上海道2312-2314号一层底商"
天津市宏鹏塑料制品公司,911201161037094938,1992-06-23,N/A,高旄贤,"100(万元人民币)","塑料编织；喷涂、黑白铁加工；纸制品、铁木家具、低压电器、五金制品制造；劳务服务",天津,滨海,"天津市滨海新区大港小王庄镇政府"
天津市蓟州区经济开发区总公司,911202251042770395,1992-06-23,N/A,权红涛,"6,000(万元人民币)","建筑材料、机械设备、电器设备(不含汽车）。五金、交电、化工",天津,蓟州,"天津市蓟州区经济开发区天阳路1号201室"
天津海河制冷有限公司,911201026006004139,1992-06-24,N/A,王秀琛,"273(万美元)","电冰箱家用电器的生产销售；机械加工；从事现自有厂房和办公用房的租赁业务；向“扎努西电气机械天津压缩机有限公司”提供保障和服务（国家有专营专项规定的按规定执行）",天津,河东,"天津市河东区八纬路103号"
天津科地基础工程有限公司,91120102103232672W,1992-06-25,N/A,唐敏,"3,500(万元人民币)","地基与基础工程施工；矿产地质勘探；软地质基础处理；桩基检测；水文地质、工程地质、钻探、钻井；隧道工程施工、普通货运、桩基设备租赁。",天津,河东,"河东区大直沽八号路4号"
中国诚通金属材料贸易有限公司,9112000011766197XL,1992-06-26,N/A,刘鸿启,"10,000(万元人民币)","金属材料、金属制品、矿产品（钨锡锑矿产品及冶炼产品除外）、五金、炉料、金属结构及构件、锻铸件、建筑材料、机电产品、焦炭、有色金属（钨锡锑矿产品及冶炼产品除外）批发、零售；仓储",天津,和平,"天津市和平区小白楼街承德道与张自忠路交口西北侧港湾中心1603室"
天津市武经建筑工程有限公司,911202221040704929,1992-06-27,N/A,高学青,"600(万元人民币)","土木工程建筑，水、电采暖设备安装，室内外装饰，建筑设备租赁。",天津,武清,"武清区杨村泉州北路18号"
天津市民政实业公司,91120103239006623G,1992-06-29,N/A,王晓津,"100(万元人民币)","五金、交电、化工产品（危险化学品及易制毒品除外）、民用建材、塑料制品、木制品、文具、办公用机械、体育用品、日用百货、汽车配件、纺织品、服装、鞋帽、预包装食品、散装食品、粮食批发兼零售；卷烟零售；建筑装饰施工；从事广告业务；家政服务",天津,河西,"河西区佟楼信济里65号(金刚石工具厂内"
天津天盛集装箱服务有限公司,91120116600558446W,1992-06-29,N/A,李学其,"231.4872(万元人民币)","集装箱的修理、翻新、清洗及与其相关联的储存和运输业务，货物进出口、代理进出口及技术进出口；房屋租赁。",天津,滨海,"天津经济技术开发区微山路3号"
天津仁发实业发展有限责任公司,911201161043185158,1992-06-30,N/A,黄成,"500(万元人民币)","设备租赁；建筑材料、金属材料、机电产品（不含小轿车）、汽车配件、五金、交电、化工",天津,滨海,"天津开发区第一大街47号209室"
天津市滨海新区塘沽房地产开发总公司,911201161036609414,1992-06-30,N/A,李开顺,"6,000(万元人民币)","房地产开发、商品房销售、拆迁安置、房地产技术咨询服务；五金、交电、建筑材料零售兼批发；碱渣制土及应用。",天津,滨海,"天津市滨海新区中心商务区新港四号路136号"
天津润舟置业发展有限公司,9112011610431846X2,1992-06-30,N/A,夏利晓,"3,000(万元人民币)","房地产开发及商品房销售。国家有专项、专管规定的，按规定执行；涉及上述审批的，以审批有效期为准。",天津,滨海,"天津开发区翠园公寓四号楼"
天津市大港经济技术贸易公司,91120116103709573U,1992-06-30,N/A,孙宝付,"50(万元人民币)","钢材、机械设备、电子产品、汽车配件、木材、橡胶、建筑材料、塑料制品、五金、交电、涤纶丝、聚丙烯、聚乙烯、纺织制品、棉纱、皮棉批发兼零售，工业生产用二类1项易燃气体、二类2项不燃气体、三类1项低闪点液体、三类2项中闪点液体、三类3项高闪点液体、四类1项易燃固体、四类2项自燃物品、四类3项遇湿易燃物品、五类2项有机过氧化物、六类1项毒害品、八类1项酸性腐蚀品、八类2项碱性腐蚀品（剧毒、监控、一类易制毒化学品除外）批发（无存储、租赁仓储及物流行为）；土方工程施工（依法须经批准的项目，经相关部门批准后方可开展经营活动）",天津,滨海,"天津市滨海新区大港世纪大道62--2"
天津市东丽储运服务公司,91120110103729101G,1992-06-30,N/A,邢恩军,"1,200(万元人民币)","普通货运；仓储（化学危险品及易制毒品除外）；广告业务；批发和零售业（法律、行政法规和国务院决定禁止经营的项目不得经营；一般经营项目可以自主经营；许可经营项目凭批准文件、证件经营）；劳务服务",天津,东丽,"天津市东丽区无缝钢管公司一号路"
天津市远东房地产开发公司,9112011010372911X8,1992-06-30,N/A,汪润丰,"1,000(万元人民币)","房地产开发及商品房销售；挖土方；企业自有房屋出租。",天津,东丽,"天津市东丽区张贵庄街津塘公路永平巷10号楼前院平房"
天津滨海新区亚星房屋租赁有限公司,9112011610431838XE,1992-07-01,N/A,马军,"200(万元人民币)","房屋租赁；商务信息咨询；物业服务。",天津,滨海,"天津开发区洞庭路74号"
天津市南仓农工商联合公司,911201131039596442,1992-07-02,N/A,梁永义,"2,650(万元人民币)","电器开关柜、木制品、铸件、小型机械设备制造；塑料制品、建筑材料、水暖器材、家用电器、木材、化工原料(危险化学品、易制毒品除外)批发兼零售；仓储（危险化学品除外）；厂房租赁；劳务服务",天津,北辰,"北辰区京津公路南仓村"
交通银行股份有限公司天津广开支行,91120104789368653R,1992-07-03,N/A,孙建忠,"N/A","办理人民币存款、贷款、结算业务；办理票据贴现；代理发行金融债券；代理发行、兑付、销售政府债券；代理收付款项；外汇汇款、外汇存款、外汇贷款、国际结算、外币兑换业务；结售汇业务；办理其总、分行授权的业务；办理经银监会批准的其他业务。",天津,南开,"南开区广开四马路212号"
天津市建中新技术开发公司,911201031033303607,1992-07-03,N/A,赵炳涛,"100(万元人民币)","建筑工程技术咨询服务；建筑工程技术开发；建筑材料新产品研制；建筑工程材料试验检测；钢结构加工、安装；机加工、钢材加工；五金交电、建筑材料批发兼零售；物业管理、建筑物清洁；保洁服务；园艺工程；电机电器维修；水暖修配；餐饮管理咨询。",天津,河西,"河西区解放南路郁江道61号"
天津美嘉达灯饰有限公司,91120222600503752J,1992-07-03,N/A,李希娜,"10(万美元)","生产并销售照明器具及配套照明箱和提供售后服务。",天津,武清,"天津市武清区徐官屯街沙古堆村"
天津泰达商贸有限公司,911201161043185233,1992-07-03,N/A,温健,"3,000(万元人民币)","金属材料、建筑材料、机械、电器设备、汽车配件、化工轻工材料、五金、交电、针纺织品、百货、装饰材料批发兼零售；技术咨询、信息咨询。",天津,滨海,"天津开发区第一大街2号"
天津中海水利水电工程有限公司,911201031033305476,1992-07-03,N/A,黄鹏,"2,186(万元人民币)","水利水电工程施工；五金交电、钢材、机电产品、汽车",天津,河西,"河西区紫金山路73号增1号"
天津市滨海新区汉沽津营塑料制品厂,911201161036732834,1992-07-04,国有企业,张连生,"6万人民币","塑料粒料加工；塑料板管棒材制造；塑料编织袋；苛性钠分装*",天津,滨海,"天津市滨海新区汉沽营城东街"
天津市东丽区建筑安装工程有限公司,911201101037294869,1992-07-04,N/A,翟增武,"3,000(万元人民币)","房屋建筑工程、市政工程、公路工程、城市及道路照明工程、管道工程、土石方工程、地基基础工程、建筑装饰装修工程、钢结构工程、桥梁建筑工程、机电设备安装工程、外墙保温工程、园林绿化工程、园林古建筑工程、绿化养护工程、堤防工程；建筑劳务服务",天津,东丽,"天津市东丽区津塘公路十号桥北无瑕花园内(东大房地产开发有限公司物业楼101室)"
天津市重信房地产开发公司,91120000103062589X,1992-07-06,N/A,靳强,"1,000(万元人民币)","房地产开发及商品房销售、自有房屋租赁。",天津,和平,"天津市和平区南京路305号经济联合大厦101-15室"
天津市南开区民政福利企业公司,91120104103428448N,1992-07-06,N/A,孟繁荣,"106.9000(万元人民币)","五金、交电、化工",天津,南开,"南开区烈士路120号"
天津市东丽湖旅游开发总公司,91120110103729507R,1992-07-06,N/A,李莉,"45,088(万元人民币)","许可经营范围：无 一般经营范围：旅游开发；土地整理；基础设施施工及相关项目的投资建设；城市规划、策划、设计、咨询服务和预决算。以自有资金对农业、制造业、热力生产和供应业、建筑业、批发和零售业、交通运输仓储业、住宿和餐饮业、信息输出、软件和信息技术服务业、金融业、房地产业、租赁和商务服务业、科学研究和技术服务业、水利、环境和公共设施管理业、卫生和社会工作、文化、体育和娱乐业进行投资。以下项目限招商引资：文化娱乐服务；住宿；餐饮服务；池浴、蒸气浴；修养医疗；设备场地租赁；市内出租；汽车客运。(以上经营范围涉及许可的凭许可证件，在有效期限内经营，国家有专营规定的按规定办理)",天津,东丽,"天津市东丽区东丽湖"
天津市远东电扶梯公司,911201031033306782,1992-07-06,N/A,赵捷,"400(万元人民币)","电扶梯制造；化工、电子器具技术开发；电梯配件制造、电器机械修理。",天津,河西,"河西区小海地泗水道"
天津市北方精细化工实业公司,91120111103824125U,1992-07-07,N/A,周恩禄,"2,300(万元人民币)","有机化工原料染料及染料中间体、橡胶助剂销售",天津,西青,"西青区李七庄街邓店村北"
天津市南开区房屋修缮工程公司,91120104401232224R,1992-07-07,N/A,王晖,"35(万元人民币)","房屋修建；拆迁工程施工。",天津,南开,"南开区断桥路52号"
天津金鼎管道有限公司,91120116600503824G,1992-07-08,N/A,高德良,"11,041.5378(万元人民币)","生产、销售管道系列配件、金属结构件及相关的技术服务。",天津,滨海,"天津市滨海新区大港经济开发区昌和街485号"
天津市河北区建设开发公司,9112010510350501XR,1992-07-08,N/A,孙守亮,"8,000(万元人民币)","房地产开发及商品房销售、房屋拆迁、自有房屋租赁服务。经营范围中国家有专营专项规定的按专营专项规定办理",天津,河北,"河北区翔纬路169号"
天津稳泰化工兴业有限公司,91120116600503883K,1992-07-08,N/A,王瑞智,"300(万美元)","生产、销售工业、车辆用电解液、防冻液、刹车液等化工产品，及相关的橡塑制品",天津,滨海,"天津经济技术开发区第八大街36号"
天津港建房地产开发有限公司,91120110600558710H,1992-07-08,N/A,梁延禧,"200(万美元)","房地产开发、销售及相关建筑工程的承包、设计及装饰工程的施工和租赁自建房屋",天津,东丽,"天津市东丽区经济开发区香港花园香江环路2号"
