天津市亨丽装饰工程有限公司,911201101037553508,1992-10-21,N/A,朱希泉,"68(万元人民币)","室内外装饰及土木建筑工程、水电安装工程、筑路工程施工。",天津,东丽,"东丽开发区二纬路12号"
天津市环荣电梯部件有限公司,91120113103965980M,1992-10-22,有限责任公司,胡淑娟,"80万人民币","电梯用控制开关、电梯零部件制造；电器控制设备修理。",天津,北辰,"北辰区小淀镇刘安庄村"
天津市蓟县城关房地产开发公司,911202251042799901,1992-10-22,N/A,杨奎生,"6,500(万元人民币)","房地产开发；商品房销售、中介服务；养老服务。",天津,蓟州,"蓟县迎宾路24号"
天津罗伦特物业有限公司天津办事处,91120000MA05W3549D,1992-10-22,N/A,霍秀兰,"N/A","负责本公司经营范围内的咨询与联络",天津,N/A,"N/A"
天津市予应力钢丝一厂金弓实业公司,91120102103238521A,1992-10-23,N/A,邹尔发,"304(万元人民币)","金属材料、木材、机电产品、建筑材料；商业；机械、制冷设备仪器仪表修理；金属丝绳及其制品制造；技术开发、咨询、中介服务；劳务服务；设备租赁。",天津,河东,"河东区富民路21号"
天津白金天实业有限公司,91120116600506910E,1992-10-23,N/A,陆苍,"161.9800(万美元)","国际贸易；代办保税仓储服务；装饰装修；投资咨询；煤炭批发经营；焦炭、建材等批发、零售（依法须经批准的项目，经相关部门批准后方可开展经营活动）",天津,保税区,"天津港保税区海滨八路88号513室"
天津市房信房产经营有限公司,91120101103166433K,1992-10-23,N/A,路长江,"5,000(万元人民币)","房地产开发、房地产经营、物业管理、自管产住房置换、托管、商品房销售代理；房产交易、咨询、基建、修缮工程预算、结算及咨询服务、房地产中介服务；置换公产住房；建筑材料批发兼零售；供热服务",天津,和平,"天津市和平区五大道街云南路52号(现46号)"
天津市天医技术开发公司,911201011031614998,1992-10-23,N/A,董彪,"35(万元人民币)","生物医学仪器、仪表、电子专业、卫生材料的技术咨询、经济技术服务、与主营项目相关的中试产品销售；办公用品、验光制镜配镜、信息咨询",天津,和平,"天津市和平区气象台路22号"
天津津津食品加工有限公司,911202256005620580,1992-10-23,N/A,张永强,"102(万美元)","生产淀粉及淀粉制品。",天津,蓟州,"天津市蓟县经济开发小区"
天津市亨华保洁服务有限公司,91120110103755553W,1992-10-26,N/A,杜明奎,"50(万元人民币)","保洁服务；房屋修缮、水暖安装、维修；防腐工程；机加工；铆焊；金属材料（贵重稀有金属除外）、化工原料（易燃易爆易制毒化学危险品除外）、五金交电、橡胶及其制品、建筑材料、装饰材料、木材、针纺织品、服装鞋帽、土产杂品批发兼零售；劳动服务",天津,东丽,"东丽区津塘公路十号桥南"
中国天辰工程有限公司,91120113103063864L,1992-10-26,N/A,袁学民,"50,000(万元人民币)","境内外工程设计、技术开发、技术咨询及其相关的设备材料采购、工程总承包、监理、环评和工程勘查；有关工程所需的设备、材料的进出口（国家禁止的除外）；对外派遣与上述工程相关的生产及服务行业的劳务人员；货物及技术进出口",天津,北辰,"北辰区京津路1号"
天津市中富染整公司,911202227491256656,1992-10-26,N/A,李津浩,"50(万元人民币)","纺织品印染、染整加工、销售。",天津,武清,"武清区大碱厂镇南辛庄村"
天津机电汽车销售中心有限公司,91120102103238599A,1992-10-26,N/A,孙广顺,"1,000(万元人民币)","汽车、旧机动车、拖拉机、摩托车及配件、机电设备、金属材料、化工轻工材料",天津,河东,"河东区津塘路一号桥119号"
陵川国际贸易(天津)有限公司,91120116600507059J,1992-10-27,N/A,钱晔,"15(万美元)","国际贸易及相关的简单加工；电子元器件、电工器材、仪器仪表、电讯器材、工艺品、预包装食品批发、零售；咨询服务（不含中介）（依法须经批准的项目，经相关部门批准后方可开展经营活动）",天津,保税区,"天津自贸试验区（天津港保税区）海滨六路78号B-417号"
天津莱皮诺瓦医护用品有限公司,911201056005070835,1992-10-27,N/A,张静珠,"11(万美元)","生产、销售一类医疗器械、放疗防护用品（依法须经批准的项目，经相关部门批准后方可开展经营活动）",天津,河北,"天津市河北区金钟河东街34号碧泽园3号楼2门201"
天津未名生物医药有限公司,91120116600600595N,1992-10-27,N/A,丁学国,"22,823.4105(万元人民币)","研究、开发、生产和销售基因工程生物制品及其中间体、生化制品及其中间体、其他药品及其中间体；提供医药服务、与产品相关的售后服务、技术咨询、技术服务和技术培训、以及技术许可与转让；货物、技术进出口；第二类医疗器械经营（凭许可证开展经营活动）；消毒产品生产、销售",天津,滨海,"天津经济技术开发区黄海路203号"
天津凤飞化学建材有限公司,911201106005071630,1992-10-27,N/A,李梅华,"10(万美元)","生产、销售塑钢门窗",天津,东丽,"天津市东丽区经济开发小区"
天津泰达阿尔卑斯物流有限公司,91120116600562170Q,1992-10-27,N/A,杨卫红,"624(万美元)","承办海运、空运进出口货物的国际运输代理业务，包括揽货、订舱、仓储、中转、集装箱拼装拆箱、结算运杂费、报关、报验、相关的短途运输服务及咨询业务；集装箱配套、维修（信件和其他具有信件性质的物品除外）；道路货运业务",天津,滨海,"天津经济技术开发区"
天津市华艺印章公司,91120102103238759H,1992-10-28,N/A,李川,"30(万元人民币)","刻字、打字、印字、复印（限分支）、印章材料加工制作；描晒图；牌匾制作；日用金属制品修理加工；机加工；工艺品、百货、五金交电化工",天津,河东,"天津市河东区六纬路60号"
天津大邱庄万全发展股份有限公司,911200001030640312,1992-10-28,N/A,张玉银,"9,989.1000(万元人民币)","冶金、机械、电子、轻工、纺织品的生产、加工、制造；各类商品、物资的批发、零售；经济信息咨询服务业（以上经营范围涉及行业许可的凭许可证件，在有效期内经营，国家有专项专营规定的按规定办理）",天津,静海,"天津市静海县大邱庄镇万全街"
天津天正房地产招商有限公司,91120116600562285Y,1992-10-28,N/A,赵致强,"3,600(万美元)","房地产开发、经营、招商、国内外经济技术合作、国际贸易、储运、商业经营及与以上业务相关的其它服务（依法须经批准的项目，经相关部门批准后方可开展经营活动）",天津,保税区,"天津港保税区"
天津市京铁物资经销公司,911201021032388988,1992-10-29,N/A,仝砚平,"150(万元人民币)","木材、金属材料、机电产品、建筑材料、装饰装修材料、人造木皮、锯材、带据机、带据条、竹材、建筑五金、水暖器材、耐火材料、机械配件、汽车配件、办公用品、拖拉机配件、涂料、五金工具、交电、土产杂品、润滑油脂、焦碳、生铁和铁精粉的批发兼零售、代购代销；木箱、家具制造；竹木制品、木材加工；物资储存；劳务服务；自有房屋出租；普通货运。",天津,河东,"河东区六纬路十五经路4号"
天津中德工程设计有限公司,911201011031533683,1992-10-29,N/A,王宝成,"1,800(万元人民币)","石油及化工产品储运设计、建筑设计、市政公用燃气设计、工程总承包",天津,和平,"天津市和平区解放路94号"
天津市广视房地产开发公司,911201031031617390,1992-10-29,N/A,甄垣津,"3,000(万元人民币)","房地产开发；建筑材料、装饰材料、电气设备、污水处理设备及器材零售兼批发；地热开采；供热设备工程、地热技术服务、技术开发；供热设备安装、调试、维修；供热服务；室内外装饰装修；管道及设备安装；污水处理工程；停车场服务。",天津,河西,"河西区友谊北路天达里14门101-106"
天津市汉沽孔雀五金有限公司,91120116103674737Y,1992-10-29,N/A,邵如田,"50(万元人民币)","五金制品加工制造；铝合金加工；塑料制品加工制造；摩托车配件加工、销售；模具制造；机械加工。",天津,滨海,"天津市滨海新区汉沽茶淀镇桥沽村"
天津保力安房地产开发有限公司,91120116600562349W,1992-10-29,N/A,左红琴,"200(万美元)","国内外房地产开发、销售。",天津,滨海,"天津经济技术开发区"
天津市红健医药科技开发服务公司,911201061035744884,1992-10-29,N/A,吕超,"50(万元人民币)","医药、卫生保健及保健食品、用品专业（新技术、新产品技术开发、培训）；销售本单位研制的中试产品；日用电器修理、安装；医疗器材、百货、针织品、纺织品、五金、交电、化工",天津,红桥,"红桥区勤俭道65号"
天津市静海县静海镇工业总公司,91120223104164173F,1992-10-29,N/A,刘宝成,"100(万元人民币)","服装、塑料零件、手工具、手板葫芦制造；机加工。(国家有专营专项规定的按专营专项规定办理)",天津,静海,"静海县静海镇胜利南路43号"
天津市西青区汇源贸易公司,91120111103830322Q,1992-10-29,N/A,李成达,"50(万元人民币)","建筑材料、钢材、木材、五金、交电、化工",天津,西青,"西青区南河镇付村"
天津市东丽区中山实业公司,91120110103755756H,1992-10-30,N/A,张玉龙,"30(万元人民币)","五金交电、装饰材料、机械车辆配件、土产杂品、建筑材料、钢材。",天津,东丽,"广瑞路月牙河旁"
天津佳创置业发展有限公司,91120116600562437B,1992-10-30,N/A,龚金源,"236.7000(万美元)","降解树脂吸塑、吹塑、注塑粒料及相关产品的生产、销售，商品房销售、物业管理、停车管理服务、自有房屋租赁；工程技术咨询服务。",天津,滨海,"天津开发区黄海路137号"
天津中天国际投资合作公司,91120116103104531X,1992-10-30,N/A,郭毅强,"1,000(万元人民币)","境内外投资、合作；化工商品（危险化学品及易制毒品除外）、金属材料、机电产品",天津,滨海,"天津开发区招待所内"
天津金田实业有限公司,91120223104164296G,1992-10-30,N/A,陈大禧,"500(万元人民币)","化工轻工材料、机械设备、汽车配件、建筑材料、金属材料。五金、交电、百货、针织品、纺织品、土产品、工艺美术品。国家有专项经营规定的按规定执行",天津,静海,"静海经济开发区"
天津开发区三发中拓模塑科技有限公司,91120116103104558M,1992-10-30,N/A,李克明,"1,000(万元人民币)","塑料零件、电器零件制造；金属材料、建筑材料、化工轻工",天津,滨海,"天津开发区第五大街15号"
天津外贸实业公司,9112010110306391X6,1992-10-30,N/A,张化军,"1,088(万元人民币)","机械设备、轻纺、土畜产品、五金、电器、建筑材料、装饰装修材料、日用杂品、钢材；上述业务相关的咨询服务",天津,和平,"天津市和平区云南路12号清华园B座4门12B01、12B02室"
天津市隆昌科技开发公司,91120103103336703C,1992-10-31,N/A,刘金祥,"25(万元人民币)","机械、电子产品、建筑材料技术开发；建筑材料、电缆、机械设备、电机零售兼批发；绝缘制品制造；电机水泵修理。",天津,河西,"河西区隆昌路11号"
天津港保税区滨海工贸有限公司,911201161031071939,1992-10-31,N/A,王泽军,"1,000(万元人民币)","煤炭、焦碳的经营；餐具、厨具、 五金交电、矿产品、轻工产品、劳保用品、钢材、木材、石材、建材、纸制品、有色金属的销售；新产品的开发,；国际贸易、代办保税仓储服务；自有房屋租赁；以上相关的咨询服务（依法须经批准的项目，经相关部门批准后方可开展经营活动）",天津,保税区,"天津港保税区海滨七路3号"
天津港保税区天马国际贸易公司,91120118103107169M,1992-10-31,N/A,只帅,"500(万元人民币)","国际贸易及相关的简单加工；代办仓储；咨询服务（不含中介）；煤炭、焦炭、铝钒土、钢材、木材、五金交电、铁矿粉、化工产品（不含危险品及易制毒品）、工矿、铁合金及建筑材料的销售；集装箱中转；国内货运代理；搬倒装卸服务；自有房屋租赁；机械设备租赁；区内保税汽车经营；道路货运经营（依法须经批准的项目，经相关部门批准后方可开展经营活动）",天津,保税区,"天津港保税区海滨十路129号A4131室"
天津市汉沽运输公司驾校,9112011610367469XK,1992-11-02,N/A,张伟,"20(万元人民币)","机动车驾驶员培训。",天津,滨海,"天津市滨海新区汉沽街新开北路56号"
天津市利达钢管集团有限公司,91120000792507116R,1992-11-02,N/A,韩振友,"35000万人民币","钢压延加工;铝塑复合管材、钢材管材管件制造、加工、销售;矿产品批发;进出口业务(法律、行政法规另有规定的除外)。(国家有专项专营规定的按规定执行涉及行业许可的凭许可证或批准文件经营)",天津,西青,"西青区大寺镇王村金龙道南侧"
天津市协合家具有限公司,9112011610346529X7,1992-11-03,N/A,曹士云,"1,050(万元人民币)","计算机及外围设备、文教用品、纸制品、仪器仪表、日用百货批发零售；以下限分支机构经营：五金、交电、服装、鞋帽、装饰材料零售兼批发；办公家具制造、机加工。",天津,西青,"华苑产业区物华道2号C座252室"
天津市金环道桥绿化综合服务公司,91120111103830568T,1992-11-03,N/A,李毅,"320(万元人民币)","园林绿化服务；公路绿化工程施工；公路桥梁工程施工；绿化及道桥维修机具租赁；绿化及道桥维修养护。",天津,西青,"天津市西青区中北镇侯台外环西路85号"
天津勤美达工业有限公司,91120116600507358G,1992-11-03,N/A,何明宪,"3,000(万美元)","设计、开发、生产、销售汽车、摩托车用铸锻毛坯件和其他建筑、阀门、五金制品、运动器材、厨房器具、机械零件、电机零件的铸锻毛坯件及提供相关咨询服务",天津,滨海,"天津滨海高新区塘沽海洋科技园塘汉路0-10号"
天津市金孚利贸易公司,91120104103436042N,1992-11-03,N/A,何椿佐,"50.4000(万元人民币)","五金、交电（移动电话、无线寻呼机除外）、化工",天津,南开,"南开区南运河道860、1000号生产楼一楼厂房"
天津美通木业有限公司,911201166005075690,1992-11-04,N/A,魏兆强,"21(万美元)","生产、销售建筑装饰用木制品及相关服务,生产、销售实木门、家具及相关服务＊＊＊（依法须经批准的项目，经相关部门批准后方可开展经营活动）",天津,滨海,"天津经济技术开发区"
天津渤海集团财务有限责任公司,9112010110316194XD,1992-11-04,N/A,肖京喜,"100,000(万元人民币)","对成员单位办理财务和融资顾问、信用鉴证及相关的咨询、代理业务；协助成员单位实现交易款项的收付；经批准的保险代理业务；对成员单位提供担保；办理成员单位之间的委托贷款及委托投资；对成员单位办理票据承兑与贴现；办理成员单位之间的内部转帐结算及相应的结算、清算方案设计；吸收成员单位的存款；对成员单位办理贷款及融资租赁；从事同业拆借；承销成员单位的企业债券；有价证券投资（股票二级市场投资除外）；自有房屋出租（限南京路129号B座13层01-08）。",天津,和平,"天津市和平区大理道30号"
波利特(天津)国际工贸有限公司,91120116600507534D,1992-11-04,N/A,单志礼,"20(万美元)","以船舶备件物料、医疗器械、五金交电为主的国际贸易及相关的简单加工；代办保税货物仓储服务业务；相关技术、信息咨询服务；室内外装修；船舶维修服务（依法须经批准的项目，经相关部门批准后方可开展经营活动）",天津,保税区,"天津港保税区华夏工贸城202－办5号"
天津开发区华顺船务工程有限公司,911201166008342874,1992-11-04,N/A,史华,"128(万元人民币)","建筑材料、五金、交电、化工商品（危险化学品及易制毒品除外）零售兼批发；机电设备维修；船舶供退物料服务；钢结构工程；船舶修理",天津,滨海,"天津经济技术开发区第二大街泰达MSD-G1座808单元"
天津市海河水利物资供应公司,9112010210323941XH,1992-11-04,N/A,董洪春,"100(万元人民币)","金属材料、木材、机电产品、塑料及制品、橡胶；五金、化工",天津,河东,"河东区龙潭路15号"
天津市东达房地产开发有限公司,91120000777307052H,1992-11-04,N/A,牛世清,"3,600(万元人民币)","房地产开发及商品房销售；房屋拆迁安置；房屋置换；自有房屋租赁（以上经营范围涉及行业许可的凭许可证件，在有效期内经营，国家有专项专营规定的按规定办理）",天津,河东,"河东区荣兴温泉公寓2号楼部分"
天津市武清区美华装饰公司,911202221040764482,1992-11-04,N/A,赵桐,"15(万元人民币)","室内外装饰、土木工程建筑；室内外装修、民用建材、建筑五金、电工器材、水暖器材、铜材、铝材；机加工。",天津,N/A,"杨村招商场乙楼19号"
天津市启达电力能源开发公司,91120103103336818J,1992-11-04,N/A,孙迎召,"30(万元人民币)","电力能源技术开发、技术服务；配电设备现场维修；限分支经营：机械电器批发、百货、五金交电化工",天津,河西,"河西区宾水道欧亚花园1-1104"
天津市南华经贸发展公司,91120112103884339H,1992-11-05,N/A,王瑞生,"300(万元人民币)","百货、五金、建筑材料(水泥限零售)、钢材零售、商业信息咨询。",天津,津南,"天津市津南区咸水沽镇体育场路"
天津市瑞达线缆有限公司,91120113103966908D,1992-11-06,N/A,叶晓义,"10,000(万元人民币)","电线电缆制造；电焊机、切割机、开关控制柜制造（以下经营范围限分支经营）电线、电缆、五金、日用杂品",天津,北辰,"天津经济技术开发区中区纺八路283号"
天津市华美纺织经营公司,9112011110343643X4,1992-11-06,N/A,邵景堃,"30.2000(万元人民币)","纺织品制造、纺织配件制造；纺织机械修理；劳务服务（为本厂）；纺织品",天津,西青,"西青区中北镇邢庄子村南(前进织布厂院内"
天津市国泰房地产开发公司,9112010110316207XL,1992-11-06,N/A,杨煦堂,"5,000(万元人民币)","房地产开发、销售商品房、房屋租赁",天津,和平,"天津市和平区岳阳道37号"
天津市汉沽茶淀加油站有限公司,9112011610367477X7,1992-11-07,N/A,吴士龙,"20(万元人民币)","润滑油零售。",天津,滨海,"天津市滨海新区汉沽津汉公路104号"
天津市中山建筑材料实业公司,911201021032395085,1992-11-07,N/A,曹金利,"210(万元人民币)","建筑材料、装饰装修材料（还包括石材及石材制品）、五金交电化工",天津,河东,"河东区津塘路59号"
天津市东丽区腾飞静电喷涂厂,91120110600748012D,1992-11-07,个人独资企业,陈春艳,"N/A","静电喷涂、机械加工；金属结构加工；起重设备安装、检修。",天津,东丽,"天津市东丽区华明镇南坨村"
天津市凯联实业公司,91120112103895492N,1992-11-07,N/A,赵春亭,"340(万元人民币)","机械设备、电器设备、建筑材料(水泥限零售),零售:钢材木材。五金、化工、日用杂品;以下限所属企业经营:潜水泵、电动机、铁粉、铸件、手套、蓄电池制造。",天津,津南,"津南区南洋乡二道桥村"
天津伟荣机电有限公司,91120116600507630N,1992-11-09,N/A,胡春晖,"122(万美元)","生产、销售工装模具、金属、塑料制品及相关的机电产品，并提供机电工程设计、加工、安装和技术咨询服务。",天津,滨海,"天津经济技术开发区"
天津市河西区珠江注塑加工厂,91120103103337183R,1992-11-09,集体所有制,姜凤强,"3万人民币","塑料零件制造、加工；日用塑料杂品制造、加工。",天津,河西,"河西区珠江道84号"
天津市液力机械厂工程机动车配件经营部,91120105103515402K,1992-11-10,集体所有制,袁金宏,"10万人民币","通用设备、汽车配件、摩托车配件、交电、五金零售兼批发；通用设备修理。经营范围中国家有专营专项规定的按专营专项规定办理*",天津,河北,"河北区南口路14号"
天津物产煤业器材有限公司,911201031033370368,1992-11-10,N/A,张军,"1,200(万元人民币)","煤炭机械设备、建筑材料、五金、化工",天津,河西,"河西区浦口道22号"
天津市工程地基基础公司,91120103103337052X,1992-11-10,N/A,王津源,"800(万元人民币)","土木工程建筑",天津,河西,"河西区黑牛城道7号"
天津市荣光强立工贸公司,91120103103337263D,1992-11-11,N/A,姜宝珠,"80(万元人民币)","机加工；针棉织品、化工添加剂、磨具加工；仪器仪表、工艺品制造；纸制品、塑料膜、模具制造、加工；塑料制品制造；包装制品加工；物资储存",天津,河西,"河西区福建路7号"
天津杰麦多乐器有限公司,911202226005077292,1992-11-11,N/A,李界寿,"2,536.3950(万美元)","生产并销售乐器、乐器支架及塑料制品配件、管乐器、打击乐器、弦乐器、簧乐器、音响喇叭、音箱、扩音器及其压铸件、鼓皮、鼓框、盒子、电子产品、五金零件、金属零部件、车辆装饰品、不锈钢产品和金属表面的抛光及电镀加工，模制具加工。",天津,武清,"天津市武清开发区福源道27号"
天津市英博生化试剂有限公司,91120103103337124N,1992-11-11,N/A,谭来群,"50(万元人民币)","生化试剂制造",天津,河西,"河西区珠江道枫林路5号"
天津长芦房地产开发有限公司,911201031031050321,1992-11-11,N/A,苏庆国,"10,000(万元人民币)","房地产开发及商品房销售；房屋租赁。",天津,河西,"河西区厦门路富邦花园1号楼会所"
天津市宁河县外贸工艺品公司,91120221MA06F1664W,1992-11-11,N/A,刘立春,"60(万元人民币)","只限企业办理职工社会保险、清理债权债务使用，不能作为经营凭证。",天津,N/A,"天津市芦台镇芦汉路20号"
天津市罗德盛达自行车有限公司,91120113103828708Y,1992-11-12,N/A,崔云沛,"200(万元人民币)","自行车、电动自行车制造、销售；钢木家具制造；从事国家法律、法规允许经营的进出口业务；自有房屋租赁。",天津,北辰,"天津市北辰区青光镇青光村北（安光路南）"
天津市盘山暖气片工业公司,91120225104281169A,1992-11-12,N/A,刘亚辉,"60(万元人民币)","暖气片制造、水暖炉具制造、水暖设备安装、机加工；水暖器材、钢材批发、零售；普通货运",天津,蓟州,"蓟县开发区八一路11号"
天津市西青区物资总公司,9112011110382853XT,1992-11-12,N/A,刘畅,"1,000(万元人民币)","金属材料、建筑材料、化工轻材料（危险品及易制毒品除外）、木材、机电产品、汽车(不含小轿车）、废旧钢材、副食品、纺织品、日用杂品、五金、交电、棉、麻、土畜产品、农业生产资料",天津,西青,"西青区杨柳青润杨道99号"
天津美龙净化设备有限公司,91120102600507796U,1992-11-12,N/A,张书敏,"36(万美元)","生产、销售空气、纯水、中水净化设备及相关配套产品，净化工程设计、安装、调式、检测服务（国家有专项专营规定的按规定执行）",天津,河东,"天津市河东区真理道甲1号"
天津市西青区商业局房地产开发公司,91120111103828679N,1992-11-13,N/A,杨延青,"3,000(万元人民币)","房产开发；平房改造；房地产投资信息咨询服务",天津,西青,"西青区西青道405号"
天津市美雅包装印刷有限公司,91120103103337415R,1992-11-14,N/A,李殿新,"50(万元人民币)","包装装潢印刷品印刷、其他印刷品印刷；纸制品、不干胶、纸箱加工；烫金、覆膜加工。",天津,河西,"河西区爱国道前程里35号对面平房"
天津市东建物资公司,91120102103239719L,1992-11-14,N/A,汤洪福,"70(万元人民币)","金属材料、化工轻工材料",天津,河东,"河东区红星路176号"
