天津市西青经济开发总公司,91120111103826315L,1992-08-21,N/A,李东维,"300,000(万元人民币)","管道设备租赁；自有房屋租赁、房屋信息咨询",天津,西青,"西青经济开发区内"
中冶天工集团天津有限公司,9112000010375258X6,1992-08-21,N/A,周青,"81,000(万元)","冶炼工程施工、房屋建筑工程施工；市政公用工程施工、公路工程施工；铁路工程施工；设备安装、钢结构制作、安装；炉窑工程施工、地基与基础工程施工；起重设备安装工程施工；高压电器测试安装；土木工程建筑（装饰工程）；建筑工程科研设计、咨询（不含中介）；设备及建筑工具租赁；汽车货运（危险品运输除外）；建筑材料、机械设备及配件、防腐涂料、木材、金属材料批发兼零售；机械设备检修及工具修理；绿化工程；劳务服务；承包与其实力、规模、业绩相适应的国外工程项目；对外派遣实施上述境外工程所需的劳务人员；起重设备检修；电力工程施工；焦炭、矿石、矿石粉、钢材的销售；货物进出口（法律、行政法规另有规定的除外）；承装（修、试）电力设施业务；矿山工程施工；压力管道、锅炉安装",天津,东丽,"天津市东丽区无瑕街津塘公路十号桥"
中国工商银行股份有限公司天津港东新城支行,91120116777339839K,1992-08-21,N/A,窦晓梅,"N/A","办理人民币存款、贷款、结算业务；办理票据贴现；代理发行金融债券；代理发行、代理兑付、销售政府债券；买卖政府债券；代理：家庭财产保险、与贷款标的物相关的财产保险、人寿保险、意外伤害保险、健康保险；代理收付款项；外币储蓄；外币兑换；外汇存款；外汇贷款；外汇汇款；国际结算；通过上级行办理代客外汇买卖业务；个人实盘外汇买卖；代理国外信用卡付款；代收及对付外币旅行支票；外币票据的承兑和贴现；办理经中国银行监督管理委员会批准和总行授权经营的其他业务。",天津,滨海,"天津市滨海新区港东新城海景七路以西,旭日路以北福瑞商业楼1号楼292号"
中国工商银行股份有限公司天津采油支行,911201167773403113,1992-08-21,N/A,陈秋梅,"N/A","办理人民币存款、贷款、结算业务；办理票据贴现；代理发行金融债券；代理发行、代理兑付、销售政府债券；买卖政府债券；代理：家庭财产保险、与贷款标的物相关的财产保险、人寿保险、意外伤害保险、健康保险；代理收付款项；代理外币储蓄、外币兑换业务、外汇存款、外汇汇款、个人实盘外汇买卖、国际结算、通过上级行办理代客外汇买卖业务；结汇售汇",天津,N/A,"天津油田三号院采油生活区"
天津开发区金牛实业经销有限公司,9112011610310219XM,1992-08-21,N/A,张学成,"60(万元人民币)","化工轻工材料、建筑用钢网、汽车配件；百货、土产品、日用杂品、交电、化工商品",天津,滨海,"天津开发区欣园新村32号"
中国工商银行股份有限公司天津兴华路支行,91120116777339978A,1992-08-21,N/A,苑哲,"N/A","办理人民币存款、贷款、结算业务；办理票据贴现；代理发行金融债券；代理发行、代理兑付、销售政府债券；买卖政府债券；代理收付款项；代理保险业务；外币储蓄；外币兑换；外汇存款、外汇贷款、外汇汇款；国际结算；通过上级行办理代客外汇买卖业务；个人实盘外汇买卖；代理国外信用卡付款；代收及兑付外币旅行支票；外币票据的承兑和贴现；其总行在中国银行业监督管理委员会批准的业务范围内授权的业务；经中国银行业监督管理委员会批准的其他业务。",天津,滨海,"天津市滨海新区大港胜利街兴华路"
中国工商银行股份有限公司天津迎新支行,911201167773403038,1992-08-21,N/A,齐秀芬,"N/A","办理人民币存款、贷款、结算业务；办理票据贴现；代理发行金融债券；代理发行、代理兑付、销售政府债券；买卖政府债券；代理收付款项；代理保险业务；外币储蓄；外币兑换；外汇存款；外汇贷款；外汇汇款；国际结算；通过上级行办理代客外汇买卖业务；个人实盘外汇买卖；代理国外信用卡付款；代收及兑付外币旅行支票；其总行在中国银行业监督管理委员会批准的业务范围内授权的业务；经中国银行业监督管理委员会批准的其他业务。",天津,滨海,"天津市滨海新区大港迎新街"
中国工商银行股份有限公司天津迎宾支行,911201167303662076,1992-08-21,N/A,刘振林,"N/A","办理人民币存款、贷款、结算业务；办理票据贴现、代理发行、代理兑付、销售政府债券；买卖政府债券；代理收付款项；外汇存款、外汇汇款、外币兑换、国际结算、通过上级行办理代客外汇买卖（含个人实盘外汇买卖）；外币储蓄；结汇售汇",天津,滨海,"天津市滨海新区大港迎宾街79号"
天津春锦建筑装饰有限责任公司,911201011031319195,1992-08-22,N/A,陈云,"502(万元人民币)","建筑装饰施工；建筑材料、装饰材料、五金交电零售兼批发；室内外建筑装饰工程设计。",天津,和平,"天津市和平区新兴街卫津路149号云琅新居C座"
中国工商银行股份有限公司天津赛达支行,91120111777339919Y,1992-08-22,N/A,宋悦,"N/A","办理人民币存款、贷款、结算业务；办理票据贴现；代理发行金融债券；代理发行、代理兑付、销售政府债券；买卖政府债券；代理收付款项；代理保险业务；外币储蓄；外币兑换；外汇存款；外汇贷款；外汇汇款；国际结算；对公、对私结售汇业务；通过上级行办理代客外汇买卖业务；个人实盘外汇买卖；代理国外信用卡付款；代收及兑付外币旅行支票；外币票据的承兑和贴现；其总行在中国银行业监督管理委员会批准的业务范围内授权的业务；经中国银行业监督管理委员会批准的其他业务。",天津,西青,"天津市西青经济开发区新兴产业园E1座2层201、202单元"
中国工商银行股份有限公司天津五经路支行,91120116777340338T,1992-08-22,N/A,李红琳,"N/A","办理人民币存款、贷款、结算业务；办理票据贴现；代理发行金融债券；代理发行、代理兑付、销售政府债券；买卖政府债券；代理：家庭财产保险、与贷款标的物相关的财产保险、人寿保险、意外伤害保险、健康保险；代理收付款项、外汇存款、外币储蓄、外汇汇款、外币兑换；国际结算、结汇售汇（含对私）通过上级行办理代客外汇买卖",天津,滨海,"天津市滨海新区大港迎宾街晨晖里高层B座"
中国建设银行股份有限公司天津红桥支行,911201068035475447,1992-08-22,N/A,梁钧,"N/A","吸收公众存款；发放短期、中期和长期贷款；办理贸易融资；办理国内外结算；办理保险业务；办理住房公积金及单位、个人城市住房基金的归集、结算等业务；办理票据承兑与贴现；代理发行金融债券；代理发行、代理兑付、承销政府债券；代理买卖政府债券、金融债券；代客外汇买卖；从事外币兑换；结汇、售汇；从事银行卡业务；提供信用证服务及担保；代理收付款项及代理保险业务；提供保管箱服务；从事资信调查、咨询、见证业务。经总行授权的其他业务；经中国银行业监督管理委员会等监督管理机构批准的其他业务。",天津,红桥,"红桥区勤俭道86、193号"
中国工商银行股份有限公司天津石化路支行,911201167303662669,1992-08-22,N/A,李庆江,"N/A","办理人民币存款、贷款、结算业务；办理票据贴现；代理发行、代理兑付、销售政府债券；买卖政府债券；代理发行金融债券；代理收付款项、外汇存款、外币储蓄、外汇汇款、外币兑换；国际结算、结汇售汇（含对私）通过上级行办理代客外汇买卖",天津,滨海,"天津市滨海新区大港石化路"
中国工商银行股份有限公司天津金钟支行,911201107773398200,1992-08-22,N/A,孔丽丽,"N/A","办理人民币存款、贷款、结算业务；代理票据贴现；代理发行金融债劵；代理发行、代理兑付、销售政府债劵；买卖政府债劵；代理收付款项；外币储蓄；外币兑换；外汇存款、外汇贷款；外汇汇款；国际结算；通过上级行办理代客外汇买卖；个人实盘外汇买卖；对公结售汇业务；对私结售汇业务；代理国外信用卡付款；代收及兑付外币旅行支票；外币票据的承兑和贴现。其总行在中国银行业监督管理委员会批准的业务内授权的业务；经中国银行业监督管理委员会批准的其他业务；代理保险业务",天津,东丽,"天津市东丽区金钟街道大毕庄村金钟新城增1号商业1号、2号"
天津经济技术开发区讯捷公司,91120116103102157D,1992-08-22,N/A,徐立东,"50(万元人民币)","建筑材料、装饰材料、电工器材、机电产品、化工材料",天津,滨海,"天津开发区第一大街翠园别墅9号"
天津市滨海新区滨海建筑工程有限公司,91120116103673830P,1992-08-24,N/A,徐玉海,"4,126(万元人民币)","土木工程建筑、室内外装饰装潢、房屋维修、房屋拆迁、管道安装、机电设备安装、土石方工程、园林绿化工程、防水保温工程施工；房屋工程建筑；建筑安装工程；工程管理服务、建筑物清洁服务、物业管理服务；普通货运；钢结构施工。",天津,滨海,"天津市滨海新区汉沽街新开北路136号小二楼两层"
天津京铁房地产开发公司,91120105103507090N,1992-08-24,N/A,王振军,"5,812(万元人民币)","房地产开发及商品房销售、建筑工程施工；房屋租赁、劳务服务；预包装食品、建筑材料、五金批发兼零售。",天津,河北,"天津市河北区富强道301号2号楼"
天津市阳光包装材料厂,911201101037526276,1992-08-24,集体所有制,王芝平,"400万人民币","金属包装物品及容器制造；药品包装用铝箔生产；五金制品加工、铝箔纸、卡纸加工、纸类分切加工；普通货运；包装装潢印刷品印刷、其他印刷品印刷；代收水电费。",天津,东丽,"天津市东丽区卫国道128号"
天津北辰经济技术开发区总公司,911201131039626913,1992-08-25,N/A,刘春海,"9,500(万元人民币)","利用外资兴办合资、合作企业；开发区的基础设施建设、完美管理、区内综合生活服务；组织进出口贸易、物资供应；商业综合批发、咨询服务；土地出让服务、厂房出租及转让。",天津,北辰,"天津市北辰区永进道88号"
天津市北辰区辰青运输服务公司,91120113103962720E,1992-08-25,N/A,宋福祥,"25(万元人民币)","普通货运；装饰搬运、劳务；建筑材料销售；劳务服务",天津,北辰,"北辰区青光镇政府东"
天津市供销建设综合开发公司,911201011031319788,1992-08-25,N/A,刘迎,"1,500(万元人民币)","房地产开发及商品房销售。",天津,和平,"天津市和平区重庆道25号"
天津市蓟县城关镇农工商总公司,911202257005879494,1992-08-25,N/A,南春林,"360(万元人民币)","百货、五金交电、化工",天津,N/A,"商贸街西口"
天津亿达金属制品有限公司,91120103600505184J,1992-08-25,N/A,廖旷生（LIV KONG SANG）,"100(万美元)","设计、制作并生产、销售金属制品及与金属制品相关的装饰业务；生产、销售汽车配件、木器加工（依法须经批准的项目，经相关部门批准后方可开展经营活动）",天津,河西,"天津市河西区解放南路452号"
天津市亨通工贸公司,911201161037107930,1992-08-26,N/A,窦广生,"310(万元人民币)","金属制品制造",天津,滨海,"天津市滨海新区大港阳春里22号楼101底商"
新时代证券股份有限公司天津营口道证券营业部,911201168030605092,1992-08-26,N/A,姜宏轶,"N/A","证券经纪；证券投资咨询；与证券交易、证券投资活动有关的财务顾问；证券承销与保荐；证券资产管理；融资融券；证券投资基金代销；代销金融产品。",天津,滨海,"天津市滨海新区塘沽营口道931号大泛华国际商务中心四层"
天津市商业建设发展有限公司,91120102103160023Y,1992-08-26,N/A,梅志昇,"2,898.4780(万元人民币)","商业建筑工程施工；投资管理；批发和零售业；劳务服务、会议服务、房屋租赁、制冷设备安装、家电维修；食品销售；酒店管理、商务信息咨询、商品房销售代理、物业服务、汽车销售、货物及技术进出口；国际货运代理；煤炭经营、洗衣服务",天津,河东,"天津市河东区六经路11号"
天津市华通纺织品公司,91120101103160031B,1992-08-26,N/A,陈士珍,"50(万元人民币)","纺织品、纺织原材料、建筑材料、五金交电、服装、化工（易毒化学品除外）、装饰材料、日用百货、提供信息",天津,和平,"和平区赤峰道33号"
天津市华南商贸公司,91120104103431217A,1992-08-26,N/A,阎春维,"50(万元人民币)","五金、交电、机电产品（汽车除外）、建筑材料、锅炉配件、保温材料、工艺美术品、字画、家用电器、日用杂品、百货、塑料制品、汽车摩托车配件、纺织品、文化用品、计算机及辅助设备、体育用品、办公设备；复印、影印、打印；非机动车交易；废旧黑色金属回收；制冷设备安装修理；自行车零件、服装加工；信息服务",天津,南开,"南开区一纬路怀仁里8号楼9门底商"
天津市鸿飞实业公司,911201061035724155,1992-08-26,N/A,张美玲,"30(万元人民币)","皮箱、皮包制造；服装、皮革衣、皮票夹、皮手套、日用小革皮件制造；针纺织品、五金、交电、化工(不含危险品)、塑料制品、文教用品、建筑材料、木材；机加工；电机修理。",天津,红桥,"红桥区本溪路本溪零号楼旁"
天津市东丽区房地产开发总公司,91120110103752774P,1992-08-27,N/A,黄志起,"4,163(万元人民币)","房地产开发及商品房销售；工业厂房出租、办公楼及公寓出租。",天津,东丽,"天津市东丽开发区一经路39号"
天津市新星生物工程技术有限公司,9112011371829348XY,1992-08-27,N/A,刘东田,"10(万元人民币)","生物工程技术、实验室试剂技术、化学试剂技术开发、转让、咨询、服务。",天津,北辰,"天津市北辰区西堤头镇霍庄大桥南兽药厂院内"
山西省溢源钢铁有限公司天津办事处,91120000MA05W0276G,1992-08-27,N/A,范先仁,"N/A","本公司业务范围内的业务联络",天津,滨海,"天津市塘沽区广州道江西路一号"
天津市塘沽金辉物资购销公司,91120116103632852R,1992-08-28,N/A,王南,"130(万元人民币)","建材、汽车、摩托车配件、木制品、化工产品(不含危险品及易制毒品)、装饰材料、日用百货、干鲜果品零售；商品信息咨询服务。",天津,滨海,"天津市滨海新区塘沽花园里48号"
天津市工石石化产品经营公司,911201021030632318,1992-08-28,N/A,丁文胜,"50(万元人民币)","油品原料回收；经济信息咨询服务。",天津,河东,"河东区津塘路79号"
天津市华宇贸易公司,911201111038265932,1992-08-28,N/A,孙胜英,"550(万元人民币)","金属材料、建筑材料、五金、交电、化工产品（不含危险品及易制毒化学品）批发兼零售；兽药（生物制品除外）、饲料药物添加剂经营；地磅秤重服务；货物进出口（国家法律、法规有规定的除外）；危险化学品无存储经营",天津,西青,"天津市西青区大寺镇梨双路69号-1-203室"
天津市家庭服务公司,91120102075919820H,1992-08-28,N/A,付宝钧,"215(万元人民币)","为家庭及企业提供劳务服务；待业人员培训；居民服务；电器安装；经济信息咨询服务；保洁服务",天津,河东,"河东区十经路九号"
天津市北辰区宏达运输公司,91120113103963037L,1992-08-29,N/A,高玉银,"30(万元人民币)","普通货运；装卸搬运货物",天津,北辰,"北辰区大张庄镇南王平村"
天津市东方工业公司,91120110103752942R,1992-08-29,N/A,杜晓东,"300(万元人民币)","电动机制造；五金、交电、化工",天津,东丽,"天津市东丽区金桥街"
天津市振飞房地产开发公司,91120105103507349E,1992-08-29,N/A,魏星,"500(万元人民币)","房地产开发及商品房销售、室内外装饰服务；建筑材料、民用建材、五金、电工器材、化工",天津,河北,"河北区中山路121号"
天津市宏发装饰净化公司,91120224789358666G,1992-08-29,N/A,庞金宝,"32(万元人民币)","室内外装饰；机房净化工程；空调修理；自有房屋租赁。",天津,宝坻,"宝坻区城东津围路31号"
天津华昌房地产开发经营有限公司,91120101600560001Q,1992-08-29,N/A,李昶,"357(万美元)","房地产的开发、建设、销售、租赁、房地产销售咨询和服务及旧房调剂服务有关房地产工程的咨询服务、物业管理、投资咨询、科技与技术交流",天津,和平,"天津市和平区五大道街南京路129号世贸广场A座2405号"
阳春春华锦纶纺织有限公司天津办事处,91120000MA0669974B,1992-08-31,N/A,阎梅,"N/A","负责本公司经营范围内的咨询、联络",天津,N/A,"天津市"
天津开发区中建机械设备有限公司,911201161031024053,1992-08-31,N/A,曹希良,"600(万元人民币)","机械、电器设备含汽车、建筑材料、钢材、化工轻工材料",天津,滨海,"天津开发区欣园路4号"
天津市西青区大稍口供销合作社曹庄子废品收购站,91120111MA05W2298A,1992-08-31,集体分支机构(非法人),段国庆,"N/A","废旧物资收购。",天津,西青,"西青区中北镇津杨公路水利站旁"
霸州胜庆电脑绣花制品有限公司天津办事处,91120000MA06699826,1992-08-31,N/A,杨志俭,"N/A","本公司经营范围内的咨询、联络",天津,和平,"天津市和平区南京路94号"
天津奥特赛恩斯仪器有限公司,911201166005053017,1992-09-01,N/A,续竞生,"10(万美元)","科学仪器和设备的生产、销售及相关的技术服务。",天津,滨海,"天津经济技术开发区"
天津育新塑料包装有限公司,911201166005052566,1992-09-01,N/A,张百清,"1,200(万美元)","生产、销售塑料板材及其制品、食品包装容器、塑料餐饮用具、保鲜膜、热封膜、工业包装用缓冲材料、新型环保包装材料；纸包装产品的批发；包装装潢印刷品印刷；普通货运",天津,滨海,"天津经济技术开发区欣泰街3号"
天津华远实业发展有限公司,911201166005600956,1992-09-01,N/A,田景明,"1,500(万美元)","房地产开发、销售，物业管理，服装、服饰的生产、加工、销售，纸制品、塑料制品的加工、销售以及技术咨询服务；自有房屋租赁（塘沽解放路296号、塘沽区东海云天会所）；房屋中介服务；劳务服务",天津,滨海,"天津经济技术开发区"
天津开发区津冷制冷工程有限公司,91120116103102456B,1992-09-01,N/A,史铁华,"88(万元人民币)","制冷设备的制造、销售及安装；机械设备、五金、交电、化工商品",天津,滨海,"天津开发区翠亨村D座39门201室"
天津大进制衣有限公司,911201126005601082,1992-09-01,N/A,刘少英,"33(万美元)","生产、加工、销售服装及服饰和面辅料的批发、零售、进出口",天津,津南,"天津市津南区葛沽镇东埂村"
天津石油集团津塘公路加油站,911201101037530721,1992-09-01,N/A,柴寿山,"180(万元人民币)","运输工具用乙醇汽油、柴油【闭杯闪点≤60℃】有储存经营；润滑油零售；食品、汽车配件、文化办公用品、汽车",天津,东丽,"天津市东丽区无瑕街十号桥路北"
天津市顺达机电设备安装有限公司,911201056006938085,1992-09-01,N/A,王杰,"350(万元人民币)","机电设备、金属结构、电气设备、水暖设备安装、维修、调试、制造、加工；装饰装修工程设计、施工；机电设备技术开发、咨询、转让、服务；机械设备、金属材料、五金、交电、装饰装修材料、电子产品批发兼零售。",天津,河北,"天津市河北区南口西路4号"
天津经济技术开发区机电设备有限公司,9112011610310243XG,1992-09-01,N/A,冯琨,"150,000(万元人民币)","机电产品、金属材料、化工轻工材料、木材、建筑材料、五金交电、化工产品（危险化学品及易制毒品除外）、汽车装具及配件、机械配件、矿产品、润滑油脂、金属制品、纺织品批发兼零售、代购、代销；煤炭批发经营；焦碳批发、零售；小轿车销售；汽车养护；设备租赁；技术服务；信息咨询；工程机械修理；进出口业务；市场经营管理",天津,滨海,"天津开发区第十大街49号303室"
天津市静海县建兴土方工程公司,9112022376126334XH,1992-09-02,N/A,王乃标,"583(万元人民币)","土方工程；建筑机械设备租赁。",天津,静海,"静海镇静文路18号"
天津市武清区梅厂供销合作社,91120222104074194B,1992-09-02,集体所有制,赵连权,"114万人民币","纺织品、百货、五金交电、日用杂品、化肥、农膜、建材批发兼零售；废旧物资收购。",天津,武清,"梅厂镇"
天津市信息资料印刷公司,91120103103333051X,1992-09-02,N/A,张治平,"50(万元人民币)","其他印刷品印刷；纸制品制造、加工。 ",天津,河西,"河西区平江道24号"
天津市橡胶技术开发服务公司,91120104103431743D,1992-09-02,N/A,郭洪达,"45(万元人民币)","技术开发、服务、转让、中介（生物医学工程、非金属材料的技术及产品）；橡胶制品、塑料制品、高分子聚合物、化工（危险品、易制毒品除外）、五金工具、电工器材、家用电器、家用电子产品、汽车配件；房屋出租；主食、热菜加工经营",天津,南开,"天津市南开区鞍山西道322号（科技园）"
天津市利华实业公司,91120110103753136Y,1992-09-03,N/A,张洪良,"120(万元人民币)","编织机制造；塑料制品、绝缘制品、体育用品、编织绳制造、五金、交电、建筑材料、黑色金属、日用百货、木材、汽车配件、炉料批发兼零售；机械零部件加工。",天津,东丽,"东丽区么六桥乡向阳村"
天津六建中达房地产开发有限公司,91120223103160146J,1992-09-03,N/A,王芸,"3,000(万元人民币)","房地产开发及商品房销售；信息咨询",天津,静海,"静海县开发区春曦道西侧"
天津市东丽区金属制品加工厂,911201101037531284,1992-09-03,集体所有制,孔德滨,"50万人民币","金属部件加工、木型加工；铸造。",天津,东丽,"天津市东丽区金桥街郭家台村"
亿财投资(天津)有限公司,91120116600505344L,1992-09-04,N/A,顾积平,"100(万美元)","高科技项目开发，仓储，保税汽车区内经营，自有房屋租赁（依法须经批准的项目，经相关部门批准后方可开展经营活动）",天津,保税区,"天津港保税区海滨六路98号"
天津万科兴业发展有限公司,91120113600560220F,1992-09-04,N/A,丁长峰,"6,000(万元人民币)","国内外房地产开发、管理、销售、售后服务；配套市政设施、公共设施、居民康乐设施；商品房销售代理",天津,北辰,"天津市北辰区新宜白道"
天津永兴源国际科贸有限公司,911201166005053797,1992-09-04,N/A,孟宪芬,"20(万美元)","国际贸易、高科技工程开发及高科技产品的开发、销售和相关的咨询服务；计算机及外围产品的批发兼零售(上述涉及配额许可证管理专项规定管理的商品按国家有关规定办理)",天津,保税区,"天津港保税区海滨八路11号A-307室"
天津市帽子王实业有限公司,911201036006759090,1992-09-04,N/A,王德强,"300(万元人民币)","帽子、皮革制品、服装制造加工、批发、零售；工艺美术品、百货批发兼零售、雕朔、金属竹藤、棕草、柚纱刺绣、陶瓷、玻璃民间工艺品制造加工；进口本企业生产所需的原辅材料、机械设备、零配件及技术；以下限分支机构经营：眼镜制造。",天津,河西,"河西区小海地三水道华江里11号楼"
天津市工发客运出租汽车公司,91120102103063311U,1992-09-05,N/A,孙忠如,"50(万元人民币)","市内客运出租业务；汽车配件批发兼零售。",天津,河东,"河东区津塘路79号"
天津市天航汽车运输公司,91120110103753283G,1992-09-05,N/A,朱锡友,"30(万元人民币)","汽车客运；房屋租赁；机动车存车服务；小型客车整车修理、总成修理、整车维护、小修、维修救援、专项修理。",天津,东丽,"天津市东丽区张贵庄机场"
天津吉利大厦有限公司,91120101600560263G,1992-09-05,N/A,毛铁,"1,200(万美元)","物业管理、房屋租赁及相关配套的工程维修和咨询服务；餐饮、美容、美发；店内商品、酒零售；室内外装修；广告展览的设计、制作、发布；停车场管理服务。",天津,和平,"天津市和平区南京路吉利大厦"
