中国邮政集团公司天水市太京邮电所,91620500MA71J4GX7M,1998-07-28,N/A,康明明,"2()","邮政基础（基本）业务，邮政增值业务，邮政附属业务，国家邮政局批准开办的其他邮政业务，报刊，邮政物流配送业务，城乡物流配送、分销、邮购，液肥、化肥配送、分销、邮购，饲料、饲料添加剂（均不含国家许可管理的品种）、酒的零售，国内航线除香港、澳门、台湾地区航线外的航空空运销售代理业务，日用百货",甘肃,天水,"甘肃省天水市秦州区太京乡"
中国邮政集团公司天水市李子园邮电所,91620500MA71QYRH6K,1998-07-28,N/A,燕祥,"2()","邮政基础（基本）业务，邮政增值业务，邮政附属业务，国家邮政局批准开办的其他邮政业务，报刊，邮政物流配送业务，城乡物流配送、分销、邮购，液肥、化肥配送、分销、邮购，饲料、饲料添加剂（均不含国家许可管理的品种）、酒的零售，国内航线除香港、澳门、台湾地区航线外的航空空运销售代理业务，日用百货",甘肃,天水,"甘肃省天水市秦州区李子乡"
中国邮政集团公司天水市中梁邮政所,91620500MA740F1B04,1998-07-28,N/A,燕治军,"2()","邮政基础（基本）业务，邮政增值业务，邮政附属业务，国家邮政局批准开办的其他邮政业务，报刊，邮政物流配送业务，城乡物流配送、分销邮购、液肥、化肥配送、分销、邮购、饲料、饲料添加剂（均不含国家许可管理的品种）、酒的零售，国内航线除香港、澳门、台湾地区航线外的航空空运销售代理业务，预包装食品、乳制品（不含婴幼儿配方奶粉），日用百货",甘肃,天水,"甘肃省天水市秦州区中梁乡"
中国邮政集团公司天水市汪川邮电所,91620500MA73RPNB4G,1998-07-28,N/A,王小红,"N/A","邮政基础（基本）业务，邮政增值业务，邮政附属业务，国家邮政局批准开办的其他邮政业务，报刊，邮政物流配送业务，城乡物流配送、分销、邮购，液肥、化肥配送、分销、邮购，饲料、饲料添加剂（均不含国家许可管理的品种）、酒的零售，国内航线除香港、澳门、台湾地区航线外的航空空运销售代理业务，日用百货",甘肃,天水,"甘肃省天水市秦州区汪川乡"
兰州市西固区金晨百合加工厂,91620104710336107A,1998-07-29,个人独资企业,瞿义业,"N/A","百合干、鲜百合、农副产品(不含原粮油）。",甘肃,兰州,"兰州市西固区马家山88号"
中国联合网络通信集团有限公司甘肃省分公司,91620000710206345T,1998-08-06,N/A,刘炳坤,"N/A","许可经营项目固定通信业务、蜂窝移动通信业务、第一类卫星通信业务、第一类数据通信业务、网络接入业务（具体业务种类、覆盖范围以许可证为准，有效期至2019年1月6日）；国内甚小口径终端地球站（VSAT）通信业务、固定网国内数据传送业务、无线数据传送业务、用户驻地网业务和网络托管业务、增值电信业务中的在线数据处理与交易处理业务、国内因特网虚拟专用网业务、因特网数据中心业务、语音信箱业务、传真存储转发业务、X.400电子邮件业务、呼叫中心业务、因特网接入服务业务和信息服务业务（含固定网电话信息服务业务、互联网信息服务业务和移动网信息服务业务，有效期至2019年3月27日）；利用信息网络经营音乐娱乐产品、游戏产品（含网络游戏虚拟货币发行）、演出剧（节）目、动漫产品",甘肃,兰州,"甘肃省兰州市高新技术产业开发区道用一号厂房"
天水二一三低压电器厂,916205027103425239,1998-08-06,集体所有制,王亚军,"50万人民币","高低压电器开关柜及配电箱、高低压电器元件、电线、电缆桥架、二类机电的批发零售（依法须经批准的项目，经相关部门批准后方可开展经营活动）*",甘肃,天水,"秦州区赤峪路35号"
甘肃弘业建设工程集团有限公司,91620000670836149K,1998-08-12,N/A,王静鸿,"5,000(万元人民币)","房屋建筑工程、建筑装修装饰工程、土石方工程、地基与基础工程、市政公用工程、消防设施工程、钢结构工程的施工、水利水电工程施工",甘肃,兰州,"甘肃省兰州市城关区庆阳路91号27层"
国营红峰机械厂驻金昌销售处,916203007102279554,1998-08-24,国有企业,沈永军,"30.1万人民币","阀门系列、低压电皿系列、文件柜系列、橡胶、双氧水产品、锅炉配件。",甘肃,金昌,"金昌市金川区7区22栋"
玉门市百利通水泥制品有限责任公司,916209817103569097,1998-08-26,有限责任公司,崔岩,"300万人民币","预应力楼板、水泥排水管、水泥制品的生产及销售，钢材，木材，水泥，建筑安装材料的销售（依法须经批准的项目，经相关部门批准后方可开展经营活动）*",甘肃,酒泉,"甘肃省酒泉市玉门市玉门镇"
中国邮政集团公司嘉峪关分公司邮政广告中心,91620200720279249R,1998-08-27,N/A,姚志刚,"60()","设计、制作、发布、代理国内外各类商业信函广告及DM中国邮政广告。",甘肃,嘉峪关,"嘉峪关市雄关广场西侧"
中国邮政集团公司兰州市嘉峪关南路邮政所,91620102MA73NBBAXQ,1998-08-27,N/A,姚志刚,"60()","设计、制作、发布、代理国内外各类商业信函广告及DM中国邮政广告。",甘肃,兰州,"甘肃省兰州市城关区嘉峪关南路254号"
庆城县农村信用合作联社阜城信用社,91621021926090740Y,1998-08-31,N/A,杨光虹,"10()","经营中国银行业监督管理委员会批准的业务，经营范围以批准文件所列的为准。",甘肃,庆阳,"甘肃省庆阳市庆城县城街道油建大厦一楼"
天水市麦积区花牛镇安平矿山机械厂,92620503MA71FYR580,1998-09-04,N/A,麻安平,"N/A","矿山机械配件加工和修理（依法须经批准的项目，经相关部门批准后方可开展经营活动）*",甘肃,天水,"麦积区花牛镇高湾村"
金塔县鼎新镇供销社万生综合门市部,92620921MA72K7NW8Q,1998-09-15,个体工商户,焦万生,"N/A","预包装食品兼散装食品、乳制品",甘肃,酒泉,"金塔县鼎新镇政府所在地"
中盐甘肃省盐业(集团)有限责任公司,91620000710207743J,1998-09-18,N/A,何中信,"N/A","食盐的加工及分装、盐糖酒副食品、食用碱、苏打的分装加工、批发零售。盐化产品",甘肃,兰州,"甘肃省兰州市城关区郑家台56号之1号"
古浪县裴家营供销社百货第一经营部,91620622MA71FUPDX1,1998-09-29,集体分支机构(非法人),王玉堂,"N/A","日用百货、针纺织品、预包装食品、散装食品、乳制品（不含婴幼儿配方乳粉）（凭许可证有效期经营）*",甘肃,武威,"甘肃省武威市古浪县城新街"
嘉峪关市河口养殖场,91620200789621858P,1998-09-29,N/A,崔国忠,"8()","鸡、猪、兔、淡水鱼。",甘肃,嘉峪关,"甘肃省嘉峪关市文殊双泉开发区"
古浪县裴家营供销社兴隆综合经营部,91620622MA74APQ79N,1998-09-29,集体分支机构(非法人),白兴花,"N/A","百货、针纺织品、日杂、文化用品、化肥；农作物常规种子、农药零售（凭许可证有效期经营）*",甘肃,武威,"甘肃省武威市古浪县裴家营镇裴家营街"
兰州市城关区宏发塑料制品厂,91620100710359341J,1998-10-06,个人独资企业,石瑞红,"N/A","塑料制品、模具加工；机械配件、五金机电、农副日杂的零售（以上项目国家禁止及须取得专项许可的项目除外）*",甘肃,兰州,"兰州市城关区南面滩私营园区2号"
定西交通运输(集团)有限责任公司客运分公司,91621100MA71U8X22E,1998-10-06,N/A,刘全仲,"N/A","许可经营项目省际班车客运、市际班车客运、县际班车客运、县内班车客运、省际包车客运、市际包车客运",甘肃,定西,"定西市安定区交通路280号"
甘肃新华书店集团武威新华书店有限责任公司南关门市部,91620602MA73QL3T85,1998-10-07,N/A,雷爱莲,"N/A","图书、报刊、电子出版物（有效期至2014年2月28日止）零售***",甘肃,武威,"武威市凉州区南关中路14号"
酒钢职工消费合作社,916202005562513904,1998-10-12,N/A,嘉晖,"20(万元人民币)","日用百货、服装、鞋帽、卷烟、雪茄烟、预包装食品、乳制品（不含婴幼儿配方乳粉）、食盐（不含批发）、调味品、农副产品、化工产品、五金交电、装璜材料、文化用品、体育用品、洗涤用品、化妆品的批发零售***（依法须经批准的项目，经相关部门批准后方可开展经营活动）",甘肃,嘉峪关,"甘肃省嘉峪关市五一中路十二号"
中盐甘肃省盐业(集团)有限责任公司兰州盐业分公司,91620102710371199P,1998-10-13,N/A,马龙,"N/A","食盐的加工及分装、盐糖酒副食品、食用碱、苏打的分装加工、批发零售。盐化产品",甘肃,兰州,"甘肃省兰州市城关区东岗西路455号"
天水长城电工器材厂,91620500224890217X,1998-10-15,国有企业,刘强,"518.95万人民币","高低压电器元件、开关设备及成套装置.电工合金材料及产品、异型材料*",甘肃,天水,"天水秦州区南廓路41号"
中盐甘肃省盐业(集团)有限责任公司安定区配送中心,91621100710271542G,1998-10-19,N/A,孟海龙,"N/A","食盐、糖、酒副食品、食用碱、苏打的批发兼零售、普通货运、盐化产品（不含危险品）的销售；化肥零售、日用百货、洗涤用品的批发兼零售，物流配送，仓储设施、营业场所的出租",甘肃,定西,"定西市安定区交通路409号"
中盐甘肃省盐业(集团)有限责任公司天水盐业分公司,916205037103439487,1998-10-21,N/A,王忠贵,"N/A","食盐的加工及分装，盐、糖酒副食品的加工分装、批发零售。盐化产品",甘肃,天水,"天水市麦积区渭河南路"
中盐甘肃省盐业(集团)有限责任公司河西盐业分公司,916203002247405937,1998-10-26,N/A,杨育斌,"N/A","食盐批发（在专项审批期限内）、零售；盐化产品（不含危险品）销售；预包装食品、散装食品（不含婴幼儿配方奶粉）零售（凭有效许可经营）；食用碱、苏打、洗涤用品、日用百货、化肥批发、零售；物流配送、运输（凭有效许可经营）（在专项审批期限内）及仓储设施、营业场所和铁路专用线经营性资产出租；鲜干农副产品销售，建筑材料生产经营；花卉苗木、瓜果蔬菜的种植、销售（不含种子）；酒类商品的批发零售、糖、茶叶的经营销售；粮油",甘肃,金昌,"甘肃省金昌市金川区延安路91号盐政商厦"
兰州亨达塑料编织厂,91620102710360019T,1998-10-28,集体所有制,陈光辉,"313万人民币","塑料编织袋、停车服务；塑料绳、水泥袋(依法须经批准的项目，经相关部门批准后方可开展经营活动)。",甘肃,兰州,"甘肃省兰州市城关区盐场路413号"
中国邮政集团公司甘肃省康乐县分公司,9162292232541851XF,1998-10-29,N/A,马岩,"315()","邮邮政基础（基本）业务，邮政增值业务，邮政附属业务，代理邮政储蓄业务，国家邮政局批准开办的其他邮政业务，国内（除港澳台）版图书、报刊、电子出版物。邮政物流配送业务；城乡物流配送、分销、邮购；液肥、化肥配送、分销、邮购；饲料、饲料添加剂；酒的零售；保险兼业代理；国内航线除香港、澳门、台湾地区航线外的航空空运销售代理业务；农药化肥（详见危险化学品经营许可证）；媒体广告代理；小型农机具、农产品（不含粮食和食品）的批发零售。预包装食品、乳制品（不含婴幼儿配方奶粉）批发兼零售；日用百货、家用电器、文体用品、家具的批发兼零售。",甘肃,临夏,"甘肃省临夏州康乐县新治街23号"
中盐甘肃省盐业(集团)有限责任公司陇东盐业分公司,91620800710291877B,1998-11-02,N/A,王君明,"N/A","食盐的加工及分装、盐糖副食品的加工及分装、批发零售；盐化产品",甘肃,平凉,"甘肃省平凉市崆峒区过店街28号"
酒泉地区现代农业(控股集团)有限责任公司,91620900710248502L,1998-11-09,N/A,景方元,"N/A","农业生产服务；农业科学研究；土地资源的开发、利用；农林业种植；农副产品的收购、加工、销售。※",甘肃,酒泉,"甘肃省酒泉市肃州区盘旋东路10号"
甘肃荣华实业(集团)股份有限公司,916200007102656365,1998-11-12,N/A,刘永,"66,560(万元人民币)","谷氨酸、生物发酵肥、淀粉及其副产品、饲料、包装材料、塑料制品的生产、批发零售；建筑材料、农副产品（不含粮食批发）的批发零售；农业种植、养殖；本企业及成员企业自产产品及相关技术的出口；本企业生产、科研所需的原辅材料、机械设备、仪器仪表、零部件及相关技术的进口、本企业的进料加工和“三来一补”",甘肃,武威,"甘肃省武威市东关街荣华路1号"
中盐甘肃省盐业集团华池县盐业有限责任公司,91621023710306063Y,1998-11-19,N/A,闫靖林,"50(万元人民币)","盐、酒、糖、副食品的分装、批发零售；食用碱、苏打、洗涤用品、日用百货，化肥的批发零售；运输及仓储设施；营业场所等经营性资产出租；建筑材料生产经营；物流配送；盐化产品（不含危险品）、花卉苗木，瓜果蔬菜的销售***",甘肃,庆阳,"甘肃省庆阳市华池县城南街26号"
康乐县辛兴综合加工厂,916229226860826958,1998-11-19,个人独资企业,辛文荣,"N/A","洋芋粉条加工、零售*",甘肃,临夏,"康乐县陈家磨"
兰州宏建建业集团有限公司,91620100224461439J,1998-11-19,N/A,田炫宏,"30,000(万元人民币)","预应力混凝土输水管，钢筋砼排水管，预应力电杆，GRC轻质墙板，水泥制品设备，建筑金属门窗的组合安装，预拌商品混凝土的研发、生产、销售及技术服务，酒店经营，自有房屋及场地租赁，道路普通货物运输（凭许可证经营），房地产开发、商品房销售",甘肃,兰州,"兰州市七里河区河湾堡西街25号"
甘肃亚盛盐化工业集团有限责任公司,916200007102096690,1998-11-23,N/A,董野,"12,000(万元人民币)","农业技术开发、新技术、新产品的开发、加工、农副产品（不含粮食批发）、化工产品及原料",甘肃,兰州,"兰州市城关区秦安路105号"
兰州东风家饰制品厂,91620102710361468T,1998-11-25,集体所有制,谢安,"192万人民币","办公设备、家具、装饰材料、铝合金制品、各类门窗的生产、销售；房屋租赁；企业管理咨询",甘肃,兰州,"甘肃省兰州市城关区皋兰路67号"
中国邮政集团公司甘肃省清水县分公司,91620521710242135P,1998-12-04,N/A,杨永军,"40()","邮政基础业务、邮政增值业务、邮政附属业务、邮政储蓄业务、邮政局批准开办的其他业务。国家允许开办的服务项目及代办邮政各项业务等、城乡物流配送、分销邮购；农业生产资料",甘肃,天水,"清水县北环路21号"
景泰县漫水滩乡供销合作社四个山门市部,91620423MA74E5H790,1998-12-07,股份制企业(非法人),王元中,"N/A","化肥、农用地膜销售、再生物资回收。",甘肃,白银,"甘肃省白银市景泰县红水镇泰安村"
景泰县漫水滩乡供销合作社生产资料门市部,91620423MA71MHQY0Q,1998-12-07,股份制企业(非法人),黄育延,"N/A","化肥、农用地膜、农机配件、五金交电、再生物资回收(不含报废汽车、危险废物)、钢材的销售。",甘肃,白银,"甘肃省白银市景泰县漫水滩乡漫水滩村"
甘肃省武山县黎明农副土特产品加工厂,91620524710245395A,1998-12-10,个人独资企业,包小平,"N/A","蚕豆、芸豆、杂豆、山野菜、蔬菜、果品、瓜籽、薯类食品、淀粉及淀粉制品的加工、贮存的批发和零售*",甘肃,天水,"甘肃省天水市武山县火车站511仓库"
天水存正九和医疗设备有限责任公司,91620502MA728RKE0B,1998-12-14,有限责任公司,沈存正,"200万人民币","第二类物理治疗及康复设备——电疗仪器。",甘肃,天水,"甘肃省天水市秦州区岷山路46号开天大厦三楼"
甘肃飞翔建设集团有限公司,91620902225111545T,1998-12-14,N/A,魏强,"10,800(万元人民币)","可承担单项建安合同额不超过企业注册资本金５倍的下列房屋建筑工程的施工可承担２８层以下、单跨跨度３６米及以下的房屋建筑工程、高度１２０米以下的构筑物的建筑施工、建筑面积１２万平方米及以下的住宅小区或建筑群体；可承担单项合同额不超过企业注册资本金５倍的８００千牛？米及以下塔吊等起重设备、６０吨以下起重机和龙门吊的安装与拆卸；水泥预制构件、亚硫酸铵、新型墙体材料制造、销售、建筑材料、装璜材料销售；可承担单项合同额不超过企业注册资本金5倍的下列市政公用工程的施工1、城市道路工程（不含快速路），单跨跨度20米以内桥梁工程，公共广场工程；2、2万吨/日及以下给水厂，1万吨/日及以下河水处理工程，1m3/秒及以下给水、污水泵站，5m3/秒及以下潜水泵站，直径1.5米以内污水管道；3、总贮存容积500m3及以下液化气贮罐场（站），供气规模5万m3/日燃气工程，2公斤/平方厘米及以下中压、低压燃气管道、调压站，供热面积50万㎡及以下热力工程，直径0.2米以内热力管道；4、生活垃圾转运站；可承包单项合同额不超过企业注册资本金5倍且跨度24米及以下，总重量600吨及以下，单体建筑面积6000㎡及以下的钢结构工程",甘肃,酒泉,"甘肃省酒泉市肃州区肃州路46号"
清水县惠于民种养殖农民专业合作社,93620521MA735MNY42,1998-12-15,N/A,郁香,"85(万元人民币)","农业科技开发及应用；农副产品（不含粮油）、国家允许经营的中药材的销售***",甘肃,天水,"甘肃省天水市清水县红堡镇古道村委会"
庆阳鑫康泰种养殖农民专业合作社,93621002MA7285XB9Q,1998-12-15,N/A,郁香,"85(万元人民币)","农业科技开发及应用；农副产品（不含粮油）、国家允许经营的中药材的销售***",甘肃,庆阳,"甘肃省庆阳市西峰区显胜乡铁路村铁路队27号"
会宁县新塬养军种养殖农民专业合作社,93620422MA73942G6M,1998-12-15,N/A,郁香,"85(万元人民币)","农业科技开发及应用；农副产品（不含粮油）、国家允许经营的中药材的销售***",甘肃,白银,"甘肃省白银市会宁县新塬镇新塬村中队"
两当县进平种养殖农民专业合作社,93621228MA72G3GM9Q,1998-12-15,N/A,郁香,"85(万元人民币)","农业科技开发及应用；农副产品（不含粮油）、国家允许经营的中药材的销售***",甘肃,陇南,"甘肃省陇南市两当县金洞乡新潮村磨坝组054号"
靖远振川种养殖农民专业合作社,93620421MA72XTB43U,1998-12-15,N/A,郁香,"85(万元人民币)","农业科技开发及应用；农副产品（不含粮油）、国家允许经营的中药材的销售***",甘肃,白银,"甘肃省白银市靖远县刘川镇南川村二社111号"
甘肃省平凉市静宁县众友种养殖农民专业合作社,93620826MA72WN041F,1998-12-15,N/A,郁香,"85(万元人民币)","农业科技开发及应用；农副产品（不含粮油）、国家允许经营的中药材的销售***",甘肃,平凉,"甘肃省平凉市静宁县威戎镇王咀村"
宁县平子兴盛德种养殖农民专业合作社,93621026MA727M720B,1998-12-15,N/A,郁香,"85(万元人民币)","农业科技开发及应用；农副产品（不含粮油）、国家允许经营的中药材的销售***",甘肃,庆阳,"甘肃省庆阳市宁 县平子镇仙灵村二组157号"
清水县金硕田园种养殖农民专业合作社,93620521MA73MLWH25,1998-12-15,N/A,郁香,"85(万元人民币)","农业科技开发及应用；农副产品（不含粮油）、国家允许经营的中药材的销售***",甘肃,天水,"甘肃省天水市清水县土门乡丰胜村上丰胜19号"
宁县和庙源种养殖农民专业合作社,93621026MA733CJ53Q,1998-12-15,N/A,郁香,"85(万元人民币)","农业科技开发及应用；农副产品（不含粮油）、国家允许经营的中药材的销售***",甘肃,庆阳,"甘肃省庆阳市宁县和盛镇庙花村村部院内"
合水县肖咀明豪种养殖农民专业合作社,93621024MA725R6X02,1998-12-15,N/A,郁香,"85(万元人民币)","农业科技开发及应用；农副产品（不含粮油）、国家允许经营的中药材的销售***",甘肃,庆阳,"甘肃省庆阳市合水县甘肃省合水县肖咀乡老庄行政村湾子自然村"
张家川回族自治县永恒种养殖农民专业合作社,93620525MA73KBUW4A,1998-12-15,N/A,郁香,"85(万元人民币)","农业科技开发及应用；农副产品（不含粮油）、国家允许经营的中药材的销售***",甘肃,天水,"甘肃省天水市张家川回族自治县马鹿镇陡崖村一组99号"
临洮县兴鹏种养殖农民专业合作社,93621124MA72DU8A71,1998-12-15,N/A,郁香,"85(万元人民币)","农业科技开发及应用；农副产品（不含粮油）、国家允许经营的中药材的销售***",甘肃,定西,"甘肃省定西市临洮县窑店镇四十铺村田家庄社1号"
靖远治海种养殖农民专业合作社,93620421MA72BJT67A,1998-12-15,N/A,郁香,"85(万元人民币)","农业科技开发及应用；农副产品（不含粮油）、国家允许经营的中药材的销售***",甘肃,白银,"甘肃省白银市靖远县靖安乡新合村旧庄社"
成县小川联农种养殖农民专业合作社,93621221MA72YG617A,1998-12-15,N/A,郁香,"85(万元人民币)","农业科技开发及应用；农副产品（不含粮油）、国家允许经营的中药材的销售***",甘肃,陇南,"甘肃省陇南市成 县小川镇草坝村"
临洮县启军种养殖农民专业合作社,93621124MA73A83WXD,1998-12-15,N/A,郁香,"85(万元人民币)","农业科技开发及应用；农副产品（不含粮油）、国家允许经营的中药材的销售***",甘肃,定西,"甘肃省定西市临洮县辛店镇白杨村阳山社"
华池县众建共发种养殖农民专业合作社,93621023MA724NR24J,1998-12-15,N/A,郁香,"85(万元人民币)","农业科技开发及应用；农副产品（不含粮油）、国家允许经营的中药材的销售***",甘肃,庆阳,"甘肃省庆阳市华池县紫坊畔乡庙沟村庙沟组"
庆阳杨小鱼种养殖农民专业合作社,93621002MA72B4Q16Q,1998-12-15,N/A,郁香,"85(万元人民币)","农业科技开发及应用；农副产品（不含粮油）、国家允许经营的中药材的销售***",甘肃,庆阳,"甘肃省庆阳市西峰区彭原乡杨坳村西坳村6号"
清水县新世惠种养殖农民专业合作社,93620521MA733CYH7T,1998-12-15,N/A,郁香,"85(万元人民币)","农业科技开发及应用；农副产品（不含粮油）、国家允许经营的中药材的销售***",甘肃,天水,"甘肃省天水市清水县土门镇高庙村友联刘家崖"
兰州瑞达酒店(集团)股份有限公司建兰路超市,916201007103672880,1998-12-15,N/A,高勇,"N/A","日用百货、针纺用品、文化用品、五金交电",甘肃,兰州,"兰州市七里河区建兰路126号"
中国联合网络通信集团有限公司定西市分公司,91621100710271497F,1998-12-17,N/A,张胜利,"N/A","经营与通信及信息业务相关的系统集成、技术开发、技术服务、设备生产、销售、设计施工业务；招标代理；自有房屋出租；电子通信器材的销售；承办展览；专业人员培训；物业管理；技术交流和信息咨询；广告业务；编制、发行电话号码薄。固定通信业务、蜂窝移动通信业务、第一类卫星通信业务、第一类数据通信业务、网络接入业务（凭许可证有效期经营）；国内甚小口径终端地球站（VSAT）通信业务、固定网国内数据传送业务、无线数据传送业务、用户驻地网业务和网络托管业务、增值电信业务中的在线数据处理与交易处理业务、国内因特网虚拟专用网业务、因特网数据中心业务、语音信箱业务、传真存储转发业务、X.400电子邮件业务、呼叫中心业务、因特网接入服务业务和信息服务业务（含固定网电话信息服务业务、互联网信息服务业务和移动网信息服务业务，凭许可证有效期经营）；利用信息网络经营音乐娱乐产品、游戏产品（含网络游戏虚拟货币发行）、演出剧",甘肃,定西,"甘肃省定西市安定区民主路18号"
