中国联合网络通信集团有限公司庆阳市分公司,91621000571635739F,1998-12-18,N/A,杨伟平,"N/A","许可经营项目固定通信业务、蜂窝移动通信业务、第一类卫星通信业务、第一类数据通信业务、网络接入业务（具体业务种类、覆盖范围以许可证为准，有效期至2019年1月6日）；国内甚小口径终端地球站（VSAT）通信业务、固定网国内数据传送业务、无线数据传送业务、用户驻地网业务和网络托管业务、增值电信业务中的在线数据处理与交易处理业务、国内因特网虚拟专用网业务、因特网数据中心业务、语音信箱业务、传真存储转发业务、X.400电子邮件业务、呼叫中心业务、因特网接入服务业务和信息服务业务（含固定网电话信息服务业务、互联网信息服务业务和移动网信息服务业务，有效期至2019年3月27日）；利用信息网络经营音乐娱乐产品、游戏产品（含网络游戏虚拟货币发行）、演出剧（节）目、动漫产品",甘肃,庆阳,"甘肃省庆阳市西峰区世纪大道中段东侧"
甘肃建新实业集团有限公司,91621227710290209J,1998-12-18,N/A,吴城,"55,000(万元人民币)","自营和代理各类商品和技术的进出口（国家限定公司经营或禁止进出口商品和技术除外）；机械设备、化工产品（不含化学危险品）、机电产品、农副产品、建筑材料、五金交电、仪器仪表、橡胶及塑料制品、矿产品销售（依法须经批准的项目，经相关部门批准后方可开展经营活动）***",甘肃,陇南,"甘肃省陇南市徽县城关滨河路"
中盐甘肃省盐业集团宕昌县盐业有限责任公司,91621223710283228M,1998-12-20,N/A,马林忠,"N/A","食盐；盐产品的加工、分装、批发、零售；盐化产品（不含危险品）研发、批发、零售；预包装食品、散装食品批发零售；洗涤用品、日用百货、化肥的批发、零售(以上经营项目涉及前置许可的凭前置许可经营）",甘肃,陇南,"甘肃省陇南市宕昌县城关镇大桥湾"
中国联合网络通信集团有限公司临夏州分公司,91622900719085295T,1998-12-22,N/A,韩国平,"N/A","固定通信业务、蜂窝移动通信业务、第一类卫星通信业务、第一类数据通信业务、网络接入业务（具体业务种类、覆盖范围以许可证为准，有效期至2019年1月6日）；国内甚小口径终端地球站（VSAT）通信业务、固定网国内数据传送业务、无线数据传送业务、用户驻地网业务和网络托管业务、增值电信业务中的在线数据处理与交易处理业务、国内因特网虚拟专用网业务、因特网数据中心业务、语音信箱业务、传真存储转发业务、X.400电子邮件业务、呼叫中心业务、因特网接入服务业务和信息服务业务（含固定网电话信息服务业务、互联网信息服务业务和移动网信息服务业务，有效期至2019年3月27日）；利用信息网络经营音乐娱乐产品、游戏产品（含网络游戏虚拟货币发行）、演出剧（节）目、动漫产品（有效期至2016-08-11）",甘肃,临夏,"临夏市民主东路8-1号"
中国联合网络通信集团有限公司陇南市分公司,916212007396394434,1998-12-22,N/A,尚晞宏,"N/A","许可经营项目固定通信业务、蜂窝移动通信业务、第一类卫星通信业务、第一类数据通信业务、网络接入业务（具体业务种类、覆盖范围以许可证为准，有效期至2019年1月6日）；国内甚小口径终端地球站（VSAT）通信业务、固定网国内数据传送业务、无线数据传送业务、用户驻地网业务和网络托管业务、增值电信业务中的在线数据处理与交易处理业务、国内因特网虚拟专用网业务、因特网数据中心业务、语音信箱业务、传真存储转发业务、X.400电子邮件业务、呼叫中心业务、因特网接入服务业务和信息服务业务（含固定网电话信息服务业务、互联网信息服务业务和移动网信息服务业务，（有效期至2019年3月27日）；利用信息网络经营音乐娱乐产品、游戏产品（含网络游戏虚拟货币发行）、演出剧（节）目、动漫产品",甘肃,陇南,"甘肃省陇南市武都区东江11号路"
临洮县维乾粉条机械加工厂,91621124MA71DJXP8B,1998-12-25,个人独资企业,杨维乾,"N/A","粉条机械制造、销售、修理。",甘肃,定西,"临洮县洮阳镇北五里铺村148号"
兰州兰新通信设备集团有限公司,91620000296583240J,1998-12-25,N/A,王文戈,"3,525(万元人民币)","非经营性资产管理、离退休职工管理、房屋出租、已售产品维修。",甘肃,兰州,"兰州市城关区九州中路295号"
永昌县供销合作社,91620321MA74E64F44,1998-12-28,集体所有制,李兴盛,"87.9万人民币","农副产品（不含小麦、玉米）、农业机械及配件、五金交电（不含进口摄录象机）、化工（除危毒品）、建筑材料、日用百货、文体用品、服装鞋帽、针绵织品*",甘肃,金昌,"永昌县城东街"
甘肃省敦煌种业集团股份有限公司,916200007102487488,1998-12-28,N/A,马宗海,"52,780.2080(万元人民币)","粮食、瓜类、蔬菜、花卉、油料、牧草、棉花等农作物种子的引进、选育、繁殖、加工、储藏、销售；棉花的收购、加工（仅限分公司经营）、储藏、销售，其它农产品的收购、加工，农科产品的开发和推广，农业技术的引进、示范、推广、应用和咨询服务；果树、桑树、进出口，房地产开发（凭资质证经营）、商品房销售",甘肃,酒泉,"甘肃省酒泉市肃州区肃州路28号"
甘肃省敦煌种业集团股份有限公司敦煌市种子公司,91620982720270519K,1998-12-30,N/A,祁彦龙,"N/A","各类农作物种子的销售；种棉的收购、加工、销售。",甘肃,酒泉,"甘肃省酒泉市敦煌市新建路"
甘肃省敦煌种业集团股份有限公司金塔县棉花公司,9162090071909452XN,1998-12-30,N/A,李象春,"N/A","棉花、棉籽油、棉絮的生产、收购、加工、销售；棉花种子的引进、储藏、销售化肥、地膜等农业生产资料的销售",甘肃,酒泉,"甘肃省酒泉市金塔县西城路10号"
甘肃省敦煌种业集团股份有限公司敦煌市棉花公司,91620982720270527E,1998-12-30,N/A,张慧泉,"N/A","棉花的收购、销售。※",甘肃,酒泉,"甘肃省酒泉市敦煌市环城南路1号"
