长岛县钦岛粮油公司,91370634165385295G,1981-07-25,N/A,N/A,"52.7万人民币","粮食、食用油、熟面食品、水产品、烟酒糖茶批发、零售(有效期限以许可证为准)；五金交电零售,房屋租赁。(依法须经批准的项目，经相关部门批准后方可开展经营活动)。",山东,烟台,"长岛县大钦岛乡北村"
青岛广告公司,91370203163569293Y,1981-07-25,N/A,N/A,"50万元","设计、制做、发布国内外广告业务及相关代理经纪服务；字画装裱、摄影冲扩、工艺美术品销售。",山东,青岛,"青岛市市北区辽宁路263号8楼809室"
青岛三星面粉股份合作公司,913702131639060939,1981-07-25,N/A,N/A,"90万元","一般经营项目:房屋租赁。",山东,青岛,"青岛市李沧区夏庄路46号"
青岛前卫船舶机械修理厂,913702001635767769,1981-07-27,国有企业,N/A,"205.6万人民币","一般经营项目:船舶制造及设计，船舶机械修理；船舶设备及配件销售；钢结构工程；货物进出口。",山东,青岛,"青岛市市南区四川路15号"
青岛自行车公司,913702001635767844,1981-08-01,N/A,N/A,"1,439(万)","自行车及自行车零部件制造；零售、批发：本公司所属企业生产的自行车及其零部件；房屋租赁；开办市场。",山东,青岛,"山东省青岛市市北区曹县路27号"
烟台开发区古现供销合作社,91370600165145769R,1981-08-10,集体所有制,N/A,"250万人民币","购销、批发、零售：百货、针棉纺织品、杂品、五金交电、化工产品、文体用品、烟酒糖茶、副食品、瓜果；零售：润滑油、成品油（仅限分支机构）、地膜、农机具、化肥；废旧物资收购(不含旧自行车收购、拼装和置换)；修理家电、农具、自行车；住宿、餐饮",山东,烟台,"烟台开发区古现"
蓬莱市湾子口水产联合加工厂,9137068486518737XL,1981-08-10,集体经营单位(非法人),N/A,"37万人民币","水产品加工",山东,烟台,"蓬莱市新港街道湾子口村"
青岛孚德鞋业有限公司门市部,9137020286356352XY,1981-08-10,N/A,N/A,"N/A","一般经营项目:批发零售：皮鞋。",山东,青岛,"青岛市市南区中山路156号"
青岛市对外供应总公司,913702001635796945,1981-08-11,N/A,N/A,"1634万元","一般经营项目:批发零售供应：国际船舶及远洋国轮船用物资及生活用品；日用电子器具和家用电器修理业务。",山东,青岛,"青岛市市北区新疆路12号"
青岛第六棉纺织厂综合服务加工厂,91370213163570980J,1981-08-12,集体所有制,N/A,"60万人民币","纺纱、织布；包套加工、白铁加工，塑料制品，包装物品、服装加工；电器原件组装。(以上范围需经许可经营的,须凭许可证经营)",山东,青岛,"青岛市李沧区太原路39号"
青岛三盛楼饭店有限责任公司三盛楼羊肉馆,913702138635699998,1981-08-13,N/A,N/A,"0万元","小吃店（不含凉菜；不含裱花蛋糕；不含生食海产品）",山东,青岛,"山东省青岛市李沧区四流中路273-25号"
青岛纺联集团六棉有限公司,91370200163570868Q,1981-08-13,N/A,N/A,"6,108(万)","纺纱、织布制造；进出口业务",山东,青岛,"青岛市李沧区四流中路46号"
青岛曙光美发美容公司长青理发店,913702038637022780,1981-08-14,N/A,N/A,"N/A","理发店",山东,青岛,"青岛市市北区无棣二路37号"
青岛市五金工业公司,91370202163565532B,1981-08-19,N/A,N/A,"98万元","一般经营项目:金属制品制造；销售：手工工具、建筑五金、轻工机械、炉具、五金、钢材、木材、建筑装饰材料、机械及配件、机电产品",山东,青岛,"青岛市市南区莘县路106号"
青岛隆腾达工贸有限公司钟表眼镜分公司,91370203863782749A,1981-08-19,N/A,N/A,"0万元","销售：钟表眼镜及零配件，办公用品，日用杂品；零售：服装、布匹、鞋帽、电子产品、家用电器。",山东,青岛,"青岛市四方区平安路4号"
山东省长岛海洋渔业公司,91370634165385893C,1981-08-20,N/A,N/A,"720(万元人民币)","出口活鲜水产品、贝类、藻类；进口生产所需原材料、机械设备零配件；渔需物资、针纺织品零售。(依法须经批准的项目，经相关部门批准后方可开展经营活动)",山东,烟台,"长岛县海滨路"
青岛国风集团药材有限责任公司,91370200163560571B,1981-08-28,N/A,N/A,"1,260(万)","房屋租赁；销售：日用百货；销售：保健滋补品及食品（限分支经营）；中药材栽培、种植、技术研究与咨询",山东,青岛,"青岛市市南区天津路52号"
青岛金粮食业市北有限责任公司台东八路粮油食品店,91370203863574376Y,1981-09-02,N/A,N/A,"0万元","依据食品药品监管部门核发的《食品经营许可证》开展经营活动。",山东,青岛,"青岛市市北区大名路74号"
蓬莱市第二建筑工程公司,91370684165206808N,1981-09-02,N/A,N/A,"610万人民币","土木工程建筑；水暖安装；装饰装修；木材加工；予制件加工(依法须经批准的项目，经相关部门批准后方可开展经营活动)。",山东,烟台,"登州镇三里沟村西"
青岛金粮食业市南有限责任公司东山路粮油食品店,91370203863575133D,1981-09-02,N/A,N/A,"0万元","零售预包装食品",山东,青岛,"青岛市市北区桑梓路17号"
青岛市化工轻工总公司,91370200163574703A,1981-09-04,N/A,N/A,"889.26万元","一般经营项目:批发零售：化工轻工产品（不含危险品）、金属材料（不含贵重金属）、机电设备、建筑装饰材料、木材、汽车（不含小轿车）、百货、五金交电；仓储服务",山东,青岛,"青岛市市南区中山路33号"
青岛建材实业总公司,91370203163573321K,1981-09-04,N/A,N/A,"50(万)","加工生产新型建筑材料；批发零售、代购代销：建筑材料、非金属矿产品、钢材、木材、装饰材料、五金、机械、机电产品、橡胶及制品、化工产品（不包括危险品）、电石泥、纺织品、百货；仓储；房屋租赁；货物与技术的进出口业务",山东,青岛,"青岛市市北区松江路1号"
山东省纺织供销青岛公司,91370200163582463Q,1981-09-07,N/A,N/A,"407万元","批发、零售、“四代”：纺织原料、染料、设备、器材、助剂，塑料、橡胶、金属材料、建筑材料、机电产品，针纺织品，百货，化工原料及产品",山东,青岛,"青岛市崂山区香港东路126号亚麦花园6-2-101室"
青岛百维家居科技有限公司,91370203163565567C,1981-09-08,有限责任公司,N/A,"50万人民币","家居用品技术开发、技术咨询、技术服务；【生产、销售：家居用品、家具、木制品、五金配件、工艺品、货架、展台、橱具；维修：家具】（不得在此住所从事生产、维修业务）；依据食品药品监督管理部门核发的《食品经营许可证》开展经营活动；依据烟草管理部门核发的《烟草专卖零售许可证》开展经营活动；...",山东,青岛,"山东省青岛市市北区长沙路49-18"
兴隆庄煤矿驻黑山留守处劳动服务公司,913703041642825261,1981-09-09,N/A,N/A,"39(万元人民币)","机械配件加工 ,陶瓷烤花 ,热合器粘合 ,橡胶制品制造 ,销售 （以上经营范围需审批或许可经营的凭审批手续或许可证经营）*(依法须经批准的项目，经相关部门批准后方可开展经营活动)",山东,淄博,"八陡黑山前68号"
青岛金粮食业四方有限责任公司杭州路店,913702038635852351,1981-09-10,N/A,N/A,"0万元","零售：建筑装饰材料，日用百货。",山东,青岛,"青岛市四方区杭州路187号"
青岛金粮食业四方有限责任公司鞍山二路粮油食品店,9137020386358550X9,1981-09-10,N/A,N/A,"0万元","零售散装食品；零售散装食品（现场制售）",山东,青岛,"青岛市四方区抚顺路19号"
烟台市通用锻压有限公司,91370602165100149F,1981-09-10,N/A,N/A,"10万人民币","钢压延加工、铸造。(依法须经批准的项目，经相关部门批准后方可开展经营活动)。",山东,烟台,"山东省烟台市幸福中路240号"
青岛市花木有限责任公司,91370200163581997D,1981-09-11,N/A,N/A,"2000万元","为城市园林绿化建设提供服务；城市花木需求信息收集、整理、研究、发布；花木良种选育与新技术推广；花木种苗病虫害防治；花木种子采集加工；花木珍贵品种保护；花卉、苗木繁、养殖、批发零售、咨询服务；园林绿地建设管理与维护；园林绿化工程设计；花鸟鱼虫供应；花卉租摆业务；贰级城市园林绿化；园林机械机具供应。",山东,青岛,"青岛市市北区龙潭路8号"
青岛市商业冷藏公司,9137020216356832X8,1981-09-12,N/A,N/A,"490万元","房屋租赁；代销及维修制冷设备及配件；制冷设备安装。",山东,青岛,"青岛市市南区红岛路31号"
青岛金粮食业市北有限责任公司镇江路粮油食品店,91370203863574464D,1981-09-15,N/A,N/A,"0万元","零售：预包装食品、散装食品；零售：散装食品（现场制售）",山东,青岛,"青岛市市北区镇江路53号"
青岛万兴商贸有限公司四方路百货店,91370202863586369Y,1981-09-16,N/A,N/A,"0万元","一般经营项目:批发：服装鞋帽。 ",山东,青岛,"青岛市市南区广州路1号"
青岛轻工业供销有限公司,913702031635746232,1981-09-17,N/A,N/A,"65万元","销售：五金、电器、电缆、建材、化工产品",山东,青岛,"青岛市市北区周村路62号23户甲"
青岛金瑞商业机械有限公司,9137020016356293X3,1981-09-18,N/A,N/A,"400万元","商业机械，制冷设备制造；机械加工；模具设计、制造、加工；生产：修正液、圆珠笔、荧光笔、钢珠笔；自有资金对外投资；自有房屋租赁；客房（限分支机构经营）",山东,青岛,"青岛市经济技术开发区香江一路21号"
青岛二轻工业供销有限公司,913702001635629483,1981-09-19,N/A,N/A,"150万元","批发零售：金属材料（不含贵重金属）、化工原料",山东,青岛,"青岛市市南区香港西路63号10层1户"
青岛市市南天华实业公司,9137020216366221XQ,1981-09-19,N/A,N/A,"0.5万元","一般经营项目:销售：日用百货、日用杂品、化工产品",山东,青岛,"青岛市市南区河南路40号丁"
山东师范大学劳动服务公司,91370102163040664L,1981-09-28,N/A,N/A,"30(万)","住宿（凭许可证经营）；餐饮服务",山东,济南,"济南市历下区山东师大院内"
烟台华瑞纺织品有限公司,91370612165354317R,1981-10-03,N/A,N/A,"55(万元人民币)","纺织品、日用百货、日用化学品、文化体育用品、鞋帽、服装、五金交电、文娱用品、塑料制品、化工产品（不含化学危险品）、土产杂品",山东,烟台,"牟平区工商大街84号"
青岛湛山蔬菜副食品商场有限公司,91370202163566316H,1981-10-04,N/A,N/A,"45万元","零售：预包装食品、乳制品（含婴幼儿配方乳粉）；零售：散装食品（现场制售）；卷烟零售、雪茄烟零售",山东,青岛,"青岛市市南区新湛路60号"
青岛市化学石油供销有限责任公司,9137020016358352X2,1981-10-04,N/A,N/A,"100(万)","批发(禁止储存):中、低闪点易燃液体。易燃固体。酸性腐蚀品、有毒品（以上不含剧毒化学品、成品油、农药、第一类易制毒化学品和禁止、限制、监控化学品）。一般经营项目：销售：沥清,金属材料（不含贵重金属），机电设备，五金交电，建筑装饰材料，纺织品；进出口业务",山东,青岛,"青岛市市南区东海西路35号太平洋中心3号楼4层"
淄博宇凡油品销售有限公司,913703041642899710,1981-10-07,N/A,N/A,"116.536万人民币","柴油、汽油零售(有效期限以许可证为准)；润滑油零售（依法须经批准的项目，经相关部门批准后方可开展经营活动）*",山东,淄博,"博山区颜北路143号"
青岛金粮食业市南有限责任公司大港路粮油食品店,91370203863600976G,1981-10-15,N/A,N/A,"0万元","依据食品药品监管部门核发的《食品经营许可证》开展经营活动。",山东,青岛,"青岛市市北区大港纬二路10号"
青岛金粮食业市南有限责任公司武昌路粮油食品店,913702028635742882,1981-10-19,N/A,N/A,"N/A","批发：预包装食品",山东,青岛,"青岛市市南区武昌路3号"
青岛金麦园经贸有限公司北京路便民店,9137020272403103XK,1981-10-19,N/A,N/A,"N/A","一般经营项目:批发：日用杂品、日用百货、五金交电。",山东,青岛,"青岛市市南区河北路22号"
青岛金粮食业市南有限责任公司浮山所粮油食品店,91370202863573680Q,1981-10-19,N/A,N/A,"N/A","小吃店（中餐类制售：仅限经营汤面、炒面；不含凉菜、不含裱花糕点、不含生食海产品、不含冷热饮品制售）；批发预包装食品",山东,青岛,"青岛市市南区闽江路131号甲"
青岛金麦园经贸有限公司湖北路粮油食品店,913702028635998724,1981-10-19,N/A,N/A,"0万元","餐饮服务；零售：散装食品",山东,青岛,"青岛市市南区安徽路18号"
安丘市临浯供销合作社,91370784165644509Q,1981-11-02,集体所有制,N/A,"71.6万人民币","零售、批发：化肥、农膜、日用杂品、五金交电、针纺织品、百货、文化文娱用品、民用建材、农机配件。(依法须经批准的项目，经相关部门批准后方可开展经营活动)",山东,潍坊,"山东省潍坊市安丘市景芝镇临浯"
安丘市景芝供销合作社,91370784165643784M,1981-11-10,集体所有制,N/A,"238万人民币","批发　零售：纺织品、百货、日用杂品、五金交电、文件用品、农副产品",山东,潍坊,"安丘市景芝镇驻地"
济南历山结婚用品商店有限公司,91370102163243883R,1981-11-12,N/A,N/A,"53.1800(万)","销售：家具；礼仪庆典服务；房屋出租。",山东,济南,"历山路67号"
安丘市宋官疃供销合作社,91370784MA3CUQDC9K,1981-11-12,集体所有制,N/A,"64.7万人民币","批发　零售:针纺织品、日用百货、日用化学品、玩具、服装鞋帽、钟表、眼镜、文教用品、陶瓷制品、五金交电",山东,潍坊,"安丘市景芝镇宋官疃村"
烟台市牟金矿业有限公司,91370612165353779M,1981-11-14,N/A,N/A,"5500万人民币","金矿石采选，矿山安全事故应急救援、预防性安全检查，房屋租赁，以自有资金对外投资",山东,烟台,"牟平区水道镇东山"
泰安市天东宾馆,91370900494192451H,1981-11-18,N/A,N/A,"226.6000(万元人民币)","照相器材、家用电器、百货、工艺美术品（不含金银饰品）、五金、建筑材料、装饰材料销售；摄影服务；厨师培训（以上项目需许可经营的，须凭许可证经营）；住宿",山东,泰安,"泰安市红门路16号"
泰安市御座宾馆,91370900494192806J,1981-11-18,N/A,N/A,"570.9万人民币","餐饮服务",山东,泰安,"山东省泰安市岱庙东"
淄博鲁鹰炊事机械总厂,913703061643621710,1981-11-20,股份合作制,N/A,"152万人民币","炊事机械、电热管制造销售；五金加工＊(依法须经批准的项目，经相关部门批准后方可开展经营活动)",山东,淄博,"周村区南营镇西坞村"
青岛春汇源商贸有限公司,91370211163866001Q,1981-11-20,N/A,N/A,"51万元","建筑材料、日用百货、五金交电、针纺织品、粮油的批发及零售。经营其它无需行政审批即可经营的一般经营项目。",山东,青岛,"山东省青岛市黄岛区长江东路435号"
淄博风机厂有限公司,91370306164361988W,1981-11-20,N/A,N/A,"7800万人民币","风机（含消防排烟风机）生产、销售；风机设计、机械设备、型材制造、管道安装；矿用机电设备安装及维修；进出口企业资格证书批准范围内的进出口业务",山东,淄博,"淄博市周村区南郊镇吴家村"
交运集团有限公司青岛黄岛分公司,913702118638604366,1981-11-24,N/A,N/A,"101万元","许可经营项目:县内班车客运；县际班车客运；市际班车客运；省际班车客运；县际包车客运；市际包车客运；省际包车客运",山东,青岛,"青岛经济技术开发区长江西路6号"
淄博王村水电安装有限公司,91370306164360774W,1981-12-04,N/A,N/A,"30万人民币","水电工程安装(凭法定的许可经营证件经营)；五金产品、电工器材、民用建材、化工产品（不含易制毒、危险化学品）的批发零售***(依法须经批准的项目，经相关部门批准后方可开展经营活动)",山东,淄博,"周村区王村镇西门"
中建筑港集团有限公司,913702001630428898,1981-12-06,N/A,N/A,"52000万元","港口与航道工程施工；市政公用工程施工；公路工程施工；水利水电工程施工；房屋建筑工程施工；钢结构工程；加工销售预拌商品混凝土；混凝土预制构件；建筑业技术咨询服务；货物及技术进出口。承包与其实力、规模、业绩相适应的国外工程项目；对外派遣实施上述境外工程所需的劳务人员。资质证书范围内的装饰装修；船舶机械租赁。",山东,青岛,"山东省青岛市市北区嘉定路68号"
泰安市山东农业大学劳动服务公司,9137090016647883XL,1981-12-07,N/A,N/A,"30.2万人民币","房屋租赁；眼镜修理；教学用实验仪器、家用电器、自行车、百货、建筑材料销售；计算机技术培训；室内装修；建筑门窗加工、安装。",山东,泰安,"山东省泰安市文化路"
青岛经济技术开发区水产供销有限公司,913702111638614384,1981-12-14,N/A,N/A,"78万元","一般经营项目:鲜活水产品销售；以自有房屋对外租赁。",山东,青岛,"青岛市黄岛区长兴岛街62号"
青岛元惠堂餐饮有限公司,91370202163564396B,1981-12-14,N/A,N/A,"3万元","中型餐馆（不含凉菜、不含裱花蛋糕、不含生食海产品）",山东,青岛,"青岛市市南区江宁路44号"
青岛海龙源经贸有限公司商场,913702127537722248,1981-12-25,有限责任公司,N/A,"N/A","零售：预包装食品、散装食品（依据食品药品监督管理部门核发的《食品流通许可证》开展经营活动），零售：烟花爆竹C、D类（依据安监部门核发的《烟花爆竹经营许可证》开展经营活动），食盐零售，零售：卷烟、雪茄烟（依据烟草主管部门核发的《烟草零售许可证》开展经营活动），销售：日用百货、针纺织品、服装鞋帽、日用杂品...",山东,青岛,"青岛市崂山区王哥庄镇王哥庄市场"
胶州市夼集供销合作社,91370281169652311J,1981-12-30,集体所有制,N/A,"62万人民币","一般经营项目:批发、零售：百货、纺织品、针织品、五金、交电、化工产品（不含化学危险品等国家限制或禁止经营的产品）、农机机械配件、零售：化肥，批发、零售：预包装食品、散装食品",山东,青岛,"青岛市胶州市夼集乡夼集村."
中国石油天然气第七建设有限公司,91370212706493329L,1981-12-31,N/A,N/A,"44,234(万)","化工、石油、石油化工引进装置及各类型化工、石油、石油化工工程施工，铁路建设，城市道路、桥梁、液化气储罐、水气管道工程施工，钢结构及网架制造安装，工业与民用建筑，起重机械安装维修，消防设施施工，承包境外石油化工工程和境内国际招标工程中，经营进出口业务（详见目录），无损检测，管道工程，房地产开发（未获得资质不得经营），撬装设备设计与制造（限分支机构制造），机电产品（不含九座及九座以下乘用车）、建筑材料、金属材料、化工产品（不含危险化学品）、轻工产品、工程机械、家用电器、日用百货的销售，仓储服务、货物装卸（不含危险化学品），机械设备租赁，特种设备安装、设计制造（依据质量监督管理部门核发的《特种设备安装改造维修许可证》开展经营活动），承装（修、试）电力设施（依据电力部门核发的《承装（承修、承试）电力设施》许可证经营），非学历职业技能培训",山东,青岛,"青岛市崂山区苗岭路36号"
