烟台龙益机械有限公司,91370611165013619L,1981-03-30,有限责任公司,N/A,"180万人民币","皮革机械、通用机床的生产、销售；五金产品的销售；货物进出口业务。(依法须经批准的项目，经相关部门批准后方可开展经营活动)",山东,烟台,"福山高新区信息产业城龙益路9号"
烟台万华氯碱有限责任公司,91370600165011277H,1981-03-30,N/A,N/A,"4,400(万元人民币)","氢氧化钠、氢氧化钠溶液[含量≥30%]、盐酸、次氯酸钠溶液[含有效氯＞5%]、丙酮、硫酸、1，2-二甲苯、1，3-二甲苯、1，4-二甲苯、甲苯、甲醇、乙醇[无水]、甲醛溶液、甲酸、甲烷、硼酸、三氯化铁、氧[压缩的或液化的]、乙炔、乙酸[含量＞80%]、N，N-二甲基甲酰胺的销售",山东,烟台,"山东省烟台市芝罘区化工路51号"
烟台嘉亿刺绣有限责任公司,9137060216500603XF,1981-03-30,N/A,N/A,"112万人民币","抽纱工艺品、刺绣工艺品、家庭装饰品、床上用品、工艺品的生产销售，经营本企业自产产品的出口业务和本企业所需的机械设备、零配件、原辅材料的进口业务，国家限制经营或禁止进出口的商品及技术除外(依法须经批准的项目，经相关部门批准后方可开展经营活动)。",山东,烟台,"芝罘区南沟街47号"
烟台正毓粮油食品有限公司,913706021650042453,1981-03-30,N/A,N/A,"30万人民币","预包装食品零售(有效期限以许可证为准)。日用百货的零售；西医内科",山东,烟台,"芝罘区黄山东街付18号"
烟台进发建筑机械有限责任公司,9137060216501112XP,1981-03-30,N/A,N/A,"50万人民币","建筑机械制造、维修、安装。(有效期限以许可证为准)。(依法须经批准的项目，经相关部门批准后方可开展经营活动)。",山东,烟台,"芝罘区大海阳路83号"
烟台市江翰置业有限公司,91370602165102494L,1981-03-30,有限责任公司,N/A,"1300万人民币","房地产开发经营；日用百货、服装、建材、办公用品的批发、零售；自有场地和房屋租赁。",山东,烟台,"芝罘区北大街145号"
烟台沸昌钟表眼镜有限责任公司,91370602165101707E,1981-03-30,N/A,N/A,"50(万元人民币)","二氟甲烷、1,1-二氟乙烷、1-氯-1,1-二氟乙烷、三氟甲烷、四氟甲烷、一氯二氟甲烷、一氯三氟甲烷不带有储存设施的经营；金属制品、模具、机械加工；仪表配件制造；零售预包装食品、散装食品；刻字；验光配镜；验光设备、钟表眼镜及配件、隐形眼镜及护理产品、空调设备、家用电器、电子产品、制冷设备的批发、零售、安装、维修；打字、复印；普通货运；服装鞋帽、箱包批发、零售（以上限分支机构经营）；日用百货、日用杂品、五金交电、化工产品",山东,烟台,"桃花街022号"
烟台市烟中宾馆有限公司,91370600493502884K,1981-03-30,N/A,N/A,"116.6000(万元人民币)","住宿服务；会务服务；餐饮服务；水果、蔬菜的销售；肉制品、水产品、烘焙食品、速冻食品、罐头食品的加工与销售；自有房屋租赁。(依法须经批准的项目，经相关部门批准后方可开展经营活动)。",山东,烟台,"芝罘区德润街12号"
烟台北海宾馆有限公司,91370600165005248N,1981-03-30,N/A,N/A,"751万人民币","酒店管理、打字、复印、会务服务、自有房屋租赁。",山东,烟台,"芝罘区南通路68号"
烟台市芝罘区电影发行放映公司,91370602165101109J,1981-03-30,N/A,N/A,"276(万元人民币)","电影发行，放映；房屋出租。(依法须经批准的项目，经相关部门批准后方可开展经营活动)。",山东,烟台,"北大西街40号"
中国机电设备烟台公司,91370600165010426D,1981-03-30,N/A,N/A,"674(万元人民币)","机电设备、普通机械、仪器仪表、金属材料、化工原料及产品",山东,烟台,"芝罘区只楚路31-14号"
烟台市铸造机械厂,91370602165105337P,1981-03-30,个人独资企业,N/A,"N/A","铸造机械；机械设备配件制造、加工(依法须经批准的项目，经相关部门批准后方可开展经营活动）。",山东,烟台,"大海阳西路20号"
烟台华科食品有限公司,9137060216500945XX,1981-03-30,N/A,N/A,"550万人民币","水产品的加工、批发、零售；冷藏仓储；普通机械、家具、金属材料、化工产品(不含危险品)的批发与零售；商品及技术的进出口(国家禁止的除外，需许可的须许可证经营)；本企业生产、科研所需的原辅材料、机械设备、仪器仪表及零配件的进出口。(依法须经批准的项目，经相关部门批准后方可开展经营活动)。",山东,烟台,"芝罘区环海路29号"
烟台钢铁企业集团公司,913706002656457013,1981-03-30,N/A,N/A,"9,158(万元人民币)","钢铁冶炼、建筑材料、机械设备的销售，货物、技术的进出口，废旧金属回收，农副产品种植，自有房屋、自有场地及设施租赁，物业管理及服务。",山东,烟台,"三站市场(芝罘区前进路9号)"
烟台高压开关设备有限公司,91370602165110574H,1981-03-30,有限责任公司,N/A,"100万人民币","高压开关柜、低压开关板制造。(依法须经批准的项目，经相关部门批准后方可开展经营活动)。",山东,烟台,"烟台市芝罘区芝罘屯路76号"
烟台艾格瑞精密机械有限公司,9137061316500355X6,1981-03-30,N/A,N/A,"1,219.7000(万元人民币)","卡盘、过滤设备、机床附件及部件、经营本企业自产机电产品、成套设备及相关技术的出口业务，经营本企业生产、科研所需的原辅材料、机械设备、仪器仪表、备品备件、零配件及技术的进口业务(依法须经批准的项目，经相关部门批准后方可开展经营活动)。",山东,烟台,"莱山区绿斯达路9号"
烟台市锅炉水暖安装有限公司,91370602165101336P,1981-03-30,N/A,N/A,"303(万元人民币)","锅炉安装",山东,烟台,"芝罘区幸福中路314号"
烟台光明染织有限责任公司,91370602165024000K,1981-03-30,N/A,N/A,"79.6000(万元人民币)","色织布、丝光、染色线、服装、工业及民用线的生产；(有效期限以许可证为准)。色织布、丝光、染色线、服装、工业及民用线的销售。仓储服务",山东,烟台,"芝罘区只楚路13号"
山东省烟台市果品总公司,913706001650114881,1981-03-30,N/A,N/A,"3000万人民币","批发兼零售预包装食品，普通货运(有效期限以许可证为准)。五金交电、普通机电产品、果品、蔬菜及农副产品的初加工、储藏、销售，饲料、化肥、钢材、纸浆、农副产品",山东,烟台,"烟台市芝罘区幸福南路11号"
烟台华艺绒绣有限责任公司,913706001650037523,1981-03-30,N/A,N/A,"500(万元人民币)","绒绣品、抽纱工艺品制造；经营本企业自产产品及技术的出口业务；经营本企业生产、科研所需的原辅材料、仪器仪表、机械设备、零配件及技术的进口业务",山东,烟台,"山东省烟台市芝罘区文化五巷7号A204"
烟台瑞峰糖酒茶副食品有限公司,91370600165005096A,1981-03-30,N/A,N/A,"876.5万人民币","批发兼零售预包装食品，批发兼零售散装食品，乳制品",山东,烟台,"芝罘区西南河路190号"
烟台市粮油储运公司,91370600165004157P,1981-03-30,N/A,N/A,"3,187.2000(万元人民币)","粮油",山东,烟台,"三站市场（芝罘区建设路16号）"
烟台市恒盛轴承有限公司,91370600165006160H,1981-03-30,N/A,N/A,"500万人民币","滚动轴承销售、自有房屋租赁。(依法须经批准的项目，经相关部门批准后方可开展经营活动)。",山东,烟台,"山东省烟台市芝罘区青年路49号"
烟台市清泉宾馆有限公司,91370613165107818H,1981-03-31,N/A,N/A,"200万人民币","中餐类制售，住宿，卷烟、雪茄烟零售，会务服务，非学历职业技能培训。",山东,烟台,"莱山区黄海办事处清泉寨村"
烟台凯联化工有限公司,91370602165011023H,1981-03-31,N/A,N/A,"690万人民币","许可证范围内的进出口业务、农用化肥（国家法律法规规定需要办理生产许可证的须凭许可证生产）、双氧水、二氧化硫脲、化工产品（不含危险品）、硬化油、硬脂酸、工业防腐剂、化工助剂",山东,烟台,"山东省烟台市芝罘区珠玑北路219号"
淄博市南定蔬菜副食品公司,91370303164272432R,1981-04-10,N/A,N/A,"86万人民币","房屋租赁。(依法须经批准的项目，经相关部门批准后方可开展经营活动)",山东,淄博,"南定西山路10号"
淄博市博山区饮食服务公司,913703041642805980,1981-04-14,N/A,N/A,"435万人民币","中型餐馆（中餐类制售；不含凉菜；不含裱花蛋糕；不含生食海产品；不含冷热饮品制售）；浴池（仅限分支机构经营）*（依法须经批准的项目，经相关部门批准后方可开展经营活动）",山东,淄博,"山东省淄博市博山区税务街62号"
威海市凯达建筑有限公司,913710811668154453,1981-04-18,N/A,N/A,"5000万人民币","土木工程建筑；水电暖安装；土石方工程施工；道路铺设；承揽小型地质灾害治理工程的施工业务；建筑幕墙工程施工；铝合金门窗加工、销售；建筑劳务分包；建筑工程技术服务；苗木种植、销售；园林绿化工程施工；建筑机械设备租赁。",山东,威海,"山东省威海市文登区界石镇楚岘村288号"
海阳市华祥机械厂,91370687MA3D1MMU5X,1981-05-20,集体所有制,N/A,"91万人民币","木工机械制造；农机具维修(依法须经批准的项目，经相关部门批准后方可开展经营活动)。",山东,烟台,"行村镇政府驻地"
海阳市埠落养殖机械厂,9137068716530044xP,1981-05-20,集体所有制,N/A,"88万人民币","饵料粉碎机、水泵、铸件制造及本企业产品的进出口业务；农机维修(依法须经批准的项目，经相关部门批准后方可开展经营活动)。",山东,烟台,"留格庄镇埠落村"
青岛碧海康乐有限公司,91370203163564628R,1981-05-23,N/A,N/A,"10万元","依据卫生部门核发的《卫生许可证》开展经营活动。",山东,青岛,"青岛市市北区甘肃路59号"
招远市宋家供销合作社土产杂品门市部,91370685MA3D1N360W,1981-06-01,集体分支机构(非法人),N/A,"2.6万人民币","日用杂品、棉麻、畜禽产品、家具、建筑装饰材料、日用百货、炉具零售(依法须经批准的项目，经相关部门批准后方可开展经营活动)。",山东,烟台,"招远市张星镇宋家"
山东省招远市蚕庄供销合作社,913706851652252834,1981-06-01,集体所有制,N/A,"337.6万人民币","预包装食品兼散装食品、乳制品（含婴幼儿配方乳粉）、卷烟、农药、汽油、柴油、烟花爆竹、粮油、日用百货、日用杂品、针纺织品、服装鞋帽、五金交电化工、文化体育用品、建筑装饰材料、土产杂品、家具、矿山配件、通讯器材及配件、太阳能及配件、不再分装的包装种子、纸袋、水产品、化肥、润滑油、农膜、农机具零售；...",山东,烟台,"招远市蚕庄镇蚕庄"
招远七六一有限责任公司,91370685165228599E,1981-06-01,N/A,N/A,"700万人民币","2-奈酚、山梨醇酐硬脂酸单脂、化工产品",山东,烟台,"山东省招远市夏甸镇留仙庄村"
招远市宋家供销合作社油肥组,91370685MA3D1N3522,1981-06-01,N/A,N/A,"N/A","粮油及制品、百货、日用杂品、五金交电、土产杂品、建筑材料、涂料、钢材、木材、工具、润滑油、化学肥料销售；农药（不含危险化学品）销售；农用薄膜、饲料、炉具零售（依法须经批准的项目，经相关部门批准后方可开展经营活动））",山东,烟台,"山东省烟台市招远市张星镇宋家"
招远市宋家供销合作社徐家供销店,91370685MA3D1N0H1A,1981-06-01,N/A,N/A,"N/A","卷烟零售；农药零售",山东,烟台,"招远市张星镇徐家村"
招远市南院供销合作社油肥组,91370685MA3D1NEQ4A,1981-06-01,集体分支机构(非法人),N/A,"N/A","农药",山东,烟台,"山东省招远市阜山镇南院庄"
招远市宋家供销合作社,91370685165231165D,1981-06-01,集体所有制,N/A,"244.34万人民币","预包装食品兼散装食品、乳制品（含婴幼儿配方乳粉）；烟酒糖茶、百货、日用杂品、服装鞋帽、针棉纺织品、毛衣、棉麻、文体用品、钟表眼镜、家具批发、零售；图书、炉具零售；颜料、畜禽产品、五金交电、农药(不含危险化学品）、化学肥料、农用薄膜、钢材、木竹、工具、建筑装饰材料、食用油批发零售;涂料、润滑油、手机、...",山东,烟台,"招远市张星镇宋家"
山东省招远市电器一厂,913706851652232105,1981-06-01,集体所有制,N/A,"88万人民币","电子绝缘材料-高溴环氧树脂制造(有效期限以许可证为准)。变压器、配电盘、镇流器、照明电器配件制造，硅胶加工(依法须经批准的项目，经相关部门批准后方可开展经营活动)。",山东,烟台,"山东省招远市金岭镇寨里村"
山东省招远市农业机械公司,91370685165221303L,1981-06-01,N/A,N/A,"519万人民币","农业机械及配件、农用载货车、汽车修理、汽车零部件批发零售(依法须经批准的项目，经相关部门批准后方可开展经营活动)。",山东,烟台,"招远市罗峰路67号"
招远市夏甸供销合作社,913706856601766188,1981-06-01,集体所有制,N/A,"363万人民币","针织品、纺织品、百货、日用杂品、五金交电、农用金属工具、木材、化肥农用薄膜零售。(依法须经批准的项目，经相关部门批准后方可开展经营活动)。",山东,烟台,"招远市夏甸镇夏甸东河北"
山东省招远市电器厂,91370685165229954Q,1981-06-01,集体所有制,N/A,"57万人民币","电焊机、电流互感器、变压器、交直流接触器、镇流器、磁力启动器、高压熔断器、低压电器、一般元件制造、电器维修；加工各种打包带及建筑用小五金、加工各种铁桶、纸桶及其它包装桶。(依法须经批准的项目，经相关部门批准后方可开展经营活动)。",山东,烟台,"招远市梦芝办事处西宋村"
博山第四建筑安装工程公司,91370304164280854G,1981-06-04,N/A,N/A,"556.9万人民币","工业与民用建筑安装*(依法须经批准的项目，经相关部门批准后方可开展经营活动)",山东,淄博,"博山区中心路东首"
青岛市乡镇企业工贸总公司,913702021635800895,1981-06-05,N/A,N/A,"50.4万元","一般经营项目:批发零售：百货，针纺织品，五金交电；柜台租赁。",山东,青岛,"青岛市市南区中山路35号"
莱阳市西留供销社邢格庄分销店,91370682MA3D1MBT72,1981-06-10,集体分支机构(非法人),N/A,"4万人民币","零售预包装食品、散装食品",山东,烟台,"山东省莱阳市邢格庄驻地"
莱阳市沐浴店供销合作社生产资料门市部,91370682MA3D1MEB9R,1981-06-10,集体分支机构(非法人),N/A,"N/A","农药",山东,烟台,"山东省莱阳市沐浴店镇驻地"
山东远方食品公司,91370682MA3D1MBMX1,1981-06-10,N/A,N/A,"1792.5万元人民币","加工制造糖果、糕点、饮料、葡萄酒。(依法须经批准的项目,经相关部门批准后方可开展经营活动)。",山东,烟台,"莱阳市旌旗东路121号"
莱阳市万第供销合作社生资门市部,91370682MA3D1MB341,1981-06-10,集体分支机构(非法人),N/A,"N/A","化肥、地膜、农机具及配件、民用建材的零售。(依法须经批准的项目，经相关部门批准后方可开展经营活动)。",山东,烟台,"山东省莱阳市万第镇驻地"
莱阳市照旺庄供销合作社生产资料门市部,91370682MA3D1MCKXL,1981-06-10,集体分支机构(非法人),N/A,"4.2万人民币","零售化肥、农膜、五金交电、农具、日用杂品，农副产品购销。(依法须经批准的项目，经相关部门批准后方可开展经营活动)。",山东,烟台,"山东省莱阳市前照旺庄村驻地"
济南同科医药物流有限公司,91370100169770668J,1981-06-10,N/A,N/A,"2000万元","中药材、中药饮片、中成药、化学原料药、化学药制剂、抗生素、生化药品、生物制品（除疫苗）、蛋白同化制剂、肽类激素、精神药品（限二类）、医疗用毒性药品、罂粟壳，预包装食品、乳制品（含婴幼儿配方乳粉）、包装材料的批发；医疗器械、保健食品、非专控农副产品、化妆品、日用品、健身器材、消杀用品、电子产品、计生用品、矿产品、化工产品及原料、化学试剂（以上两项不含危险、监控及易制毒化学品）、食品添加剂的销售；普通道路货物运输；物流服务；仓储服务",山东,济南,"济南市高新区舜风路322号生产厂2号楼二单元"
莱阳市机电器材厂,91370682MA3D1MEL07,1981-06-10,集体所有制,N/A,"66万人民币","制造电机、水泵、变压器、农机具铸造、电器配件。(依法须经批准的项目，经相关部门批准后方可开展经营活动)。",山东,烟台,"山东省莱阳市中荆乡驻地"
莱阳市西留供销社李格庄分销店,91370682MA3D1MD616,1981-06-10,集体分支机构(非法人),N/A,"4万人民币","零售预包装食品、散装食品",山东,烟台,"山东省莱阳市西留乡李格庄"
莱阳市众力汽车配件有限公司,91370682705844932P,1981-06-10,N/A,N/A,"10(万元人民币)","标准件、平垫、柴油机零部件的制造销售。(依法须经批准的项目，经相关部门批准后方可开展经营活动)",山东,烟台,"莱阳市河洛镇马崖口村"
莱阳市宏泰建筑公司,91370682756386230T,1981-06-10,N/A,N/A,"619(万元人民币)","房屋建筑工程",山东,烟台,"山东省莱阳市冯格庄办事处驻地"
莱阳莱动通力机械厂,91370682169771548L,1981-06-12,国有企业,N/A,"107万人民币","制造农业机械、动力机械、运输机械、工程机械、建筑化工机械、汽车及内燃机配件、各种发电设备；设备租赁、场地租赁、房屋租赁。(依法须经批准的项目，经相关部门批准后方可开展经营活动)。",山东,烟台,"山东省莱阳市五龙南路226号"
蓬莱市南王供销合作社生产资料门市部,91370684MA3D1NCB9J,1981-06-20,集体分支机构(非法人),N/A,"N/A","零售：农药（不含剧毒、易制毒、易制爆、监控化学品）(有效期限以许可证为准)；零售：农药机械、农业机械、中小农具、肥料、塑料制品（依法须经批准的项目，经相关部门批准后方可开展经营活动）",山东,烟台,"南王镇南王村"
烟台开发区芦洋包装制品厂,913706001651838024,1981-06-20,集体所有制,N/A,"197.6万人民币","加工、包装纸箱",山东,烟台,"烟台开发区大季家芦洋"
文登市晒字供销合作社,913710811668117356,1981-06-20,集体所有制,N/A,"56.6万人民币","纺织针织品、百货、日用杂品、五金、交电、农药（不含危险化学品）、化肥、土畜产品、钢材、建筑材料(不含油漆)、家具的购销；废旧物资",山东,威海,"文登市界石镇晒字村东"
烟台市潮水供销合作社生产资料门市部,913706847973055994,1981-06-20,集体分支机构(非法人),N/A,"N/A","零售：农业机械、农药机械、中小型农具、化肥、地膜、民用建筑材料、五金交电。(依法须经批准的项目，经相关部门批准后方可开展经营活动)。",山东,烟台,"山东省烟台市经济技术开发区潮水驻地"
蓬莱市于家庄供销合作社,91370684165188320D,1981-06-20,集体所有制,N/A,"70.8万人民币","销售：日用百货、杂品、针棉纺织品、小型农机具、生产资料、五金交电、化肥；批发农药",山东,烟台,"蓬莱市小门家镇于家庄村"
烟台市潮水供销合作社淳于生产资料门市部,91370684MA3C9RC968,1981-06-20,集体分支机构(非法人),N/A,"N/A","零售：农药",山东,烟台,"山东省烟台市经济技术开发区潮水淳于村"
蓬莱市刘家沟供销合作社,9137068416518811XT,1981-06-20,集体所有制,N/A,"44万人民币","零售：日用百货、针棉纺织品、五金交电、土产杂品、服装鞋帽、文化体育用品、农业机械、农药机械、中小农具、地膜，化肥、农药",山东,烟台,"刘家沟镇刘家沟村"
烟台开发区大季家供销合作社,91370600723850682M,1981-06-20,集体所有制,N/A,"111万人民币","批发零售：日用百货，文化体育用品，针棉织品，五金交电、小型农机具，化肥，农药",山东,烟台,"烟台开发区大季家"
蓬莱市北沟供销合作社,9137068416518344XT,1981-06-20,集体所有制,N/A,"128万人民币","零售：日用百货、烟；废旧物资回收；葡萄种植、销售(依法须经批准的项目，经相关部门批准后方可开展经营活动)。",山东,烟台,"蓬莱市北沟镇驻地"
山东长江汇泉集团有限公司,91371081746593746Y,1981-06-20,N/A,N/A,"1,200(万元人民币)","批发兼零售预包装食品,批发兼零售散装食品；普通货运（有效期限以许可证为准）；物流服务；普通货物仓储；日用百货、日用杂品（烟花爆竹除外）、服装、针纺织品、化妆品、洗涤用品、灶具及厨房用品、五金、交电、家用电器、钟表眼镜、首饰制品、工艺品、文具及体育用品、花卉、通讯设备",山东,威海,"山东省威海市文登区环山办米山路114号"
烟台市潮水供销合作社招待所,91370684MA3C9R5M83,1981-06-20,集体分支机构(非法人),N/A,"N/A","住宿服务(有效期限以许可证为准)；照像(依法须经批准的项目，经相关部门批准后方可开展经营活动)。",山东,烟台,"山东省烟台市经济技术开发区潮水驻地"
烟台市潮水供销合作社,9137068416518598XR,1981-06-20,集体所有制,N/A,"112万人民币","批发、零售：日用百货、烟、化肥、农膜、建筑材料、鞋帽、服装、文化体育用品、针纺织品、五金交电。(依法须经批准的项目，经相关部门批准后方可开展经营活动)。",山东,烟台,"山东省烟台市经济技术开发区潮水驻地"
蓬莱市南王供销合作社,91370684165184004R,1981-06-20,集体所有制,N/A,"53.2万人民币","零售、批发：日用百货、针棉织品、文化用品、五金交电、棉麻、畜产品、土杂品、果品；零售：汽油、柴油、润滑油、地膜、化肥、农药",山东,烟台,"蓬莱市南王镇南王村"
烟台市解宋营供销合作社,913706841651867040,1981-06-20,集体所有制,N/A,"57万人民币","批发零售：日用百货、针棉织品、五金交电、文化体育用品、生产资料，收购废纸、废塑料、废玻璃、酒瓶、废旧金属(不含报废车辆回收、拆解)(依法须经批准的项目，经相关部门批准后方可开展经营活动)。",山东,烟台,"山东省烟台市经济技术开发区潮水解宋营村"
青岛金粮食业市南有限责任公司,91370202163568063T,1981-06-26,N/A,N/A,"30万元","批发：预包装食品（食品流通许可证 有效期限以许可证为准）。批发：日用杂品、百货。[加工经营：热菜、水饺、炉包、米饭、面条、快餐；小吃店：包子；住宿；经营：散装食品",山东,青岛,"青岛市市南区洪泽湖路11号"
长岛船业总公司,91370634165387418B,1981-07-01,N/A,N/A,"1593万人民币","建造船舶总长55米以下钢质海洋运输船舶、修理空船排水量2000吨以下钢质海洋运输船舶；建造船长45米及以下钢质渔业船舶、建造船长20米及以下木质渔业船舶；设计船长不超过30米钢质渔业船舶；维修、销售上述产品。(依法须经批准的项目，经相关部门批准后方可开展经营活动)",山东,烟台,"山东省烟台市长岛县海滨路17号"
烟台市牟平区姜格庄供销合作社,913706121653513943,1981-07-02,集体所有制,N/A,"100万人民币","农药零售(仅限下属分支机构经营)(有效期限以许可证为准)，日用百货、针纺织品、五金交电、日用杂品（不含烟花爆竹）、工艺美术品、建筑材料、文教用品、日用化学用品",山东,烟台,"牟平区姜格庄镇政府驻地"
济宁高新区柳行供销合作社,91370800706348746H,1981-07-02,集体所有制,N/A,"66万人民币","化肥、微肥、包装种子、日用百货、土产杂品、五金交电、建材、电器、农机配件、服装鞋帽、化妆品、针织品的销售；农副产品收购；非生产性废旧物资回收；",山东,济宁,"济宁高新区柳行镇驻地"
泰安拖拉机厂,91370900738158402A,1981-07-08,国有企业,N/A,"1661.6万人民币","拖拉机制造；拖拉机、普通机械及摩托车配件销售；拖拉机及摩托车修理。",山东,泰安,"泰安高新技术产业开发区"
莱阳市电器厂,91370682169770262U,1981-07-11,国有企业,N/A,"70万人民币","加工制造开关板、电表箱，电机维修，房屋租赁。(依法须经批准的项目，经相关部门批准后方可开展经营活动)。",山东,烟台,"旌旗路127号"
青岛天合医药集团股份有限公司,913702001639174468,1981-07-23,N/A,N/A,"2136万元","经营：保健食品；批发：中成药、中药饮片、化学药制剂、化学原料药、抗生素、生化药品、生物制品（除疫苗）、麻醉药品、精神药品、蛋白同化制剂、肽类激素、罂粟壳、医疗用毒性药品、药品类易制毒化学品、植物提取物销售",山东,青岛,"青岛市李沧区浮山路32号"
