湖南昀泽建设工程有限公司,91431000187820032U,1981-11-06,N/A,陈翔峰,"8,000(万元人民币)","房屋工程建筑，道路工程建筑，水利工程建筑，工矿工程建筑，市政公用工程、土石方工程、基础工程、安防工程、通信工程、建筑装饰工程、园林景观工程、古建筑工程、钢结构工程、环保工程的设计、施工，机电设备安装，水电安装。",湖南,郴州,"湖南省郴州市苏仙区曹家坪路烈士公园办公楼三楼"
炎陵县石洲供销合作社,91430225MA4LEQUR2Y,1981-11-06,集体所有制,N/A,"4万人民币","食品,百货，五金，交电，日用杂品,建筑材料批零；清水笋加工。农药，化肥，农膜零售。",湖南,株洲,"炎陵县石洲乡石坝村"
国网湖南省电力有限公司株洲县供电分公司,91430221722579405W,1981-11-10,N/A,刘云从,"N/A","电力供应、销售；电力调度通信；输电、配电、变电工程、设备安装、维修、试验、维护；电力规划、设计；电力技术开发、研究；自动化控制及电力设备、器材生产、加工、修理、销售；承接电力业务扩充工程，相关调整试验及化验业务；仪器仪表修校；提供电力技术咨询服务。",湖南,株洲,"株洲县渌口镇漉浦路"
新晃侗族自治县饮食服务公司,91431227189281300L,1981-11-11,N/A,王连方,"50.9000(万元人民币)","饮食（仅限分支机构经营）、住宿（仅限分支机构经营）、门面出租服务（卫生许可证有效期至2017年4月25日、食品流通许可证有效期至2017年4月29日）",湖南,怀化,"新晃镇解放路25号"
湖南省广播电视器材公司,914300001837641098,1981-11-12,N/A,宋芝茂,"467(万元人民币)","广播电视设备及器件、家用电器、百货、五金、交电、文化用品、建筑材料",湖南,长沙,"长沙市芙蓉区韶山北路228号办公楼201房"
湖南省冷水滩运输公司,91431103188441173U,1981-11-12,N/A,N/A,"232.8000(万元人民币)","搬运装卸服务，(以上经营项目涉及前置许可的凭有效许可证经营)码头出租，门面出租。",湖南,永州,"永州市冷水滩区红星巷6号"
益阳市众旺公共交通有限责任公司,914309001871253637,1981-11-16,N/A,谭瑞香,"3,600(万元人民币)","公共客运交通经营、旅游出租；站场经营；房屋租赁；设计、制作、代理、发布各类广告；二类机动车维修",湖南,益阳,"益阳市金山北路26号"
醴陵市电影公司,91430281MA4LEN3NXU,1981-11-22,N/A,周永辉,"92.8000(万元人民币)","房屋出租。",湖南,株洲,"醴陵市瓷城大道47-51号文化商业广场公寓楼902室"
湖南省洪江市煤炭工业公司,91431281189080648C,1981-11-23,N/A,杨再生,"302.9000(万元人民币)","煤炭购销，煤灶、液化气灶具零售 。",湖南,怀化,"洪江市安江河西"
洪江市安江食品公司,91431281189082467E,1981-11-23,N/A,陈纯刚,"437.9200(万元人民币)","房屋租赁。",湖南,怀化,"洪江市安江镇丁字路"
洪江市安江航运公司,91431281189082264R,1981-11-24,N/A,刘生汉,"121(万元人民币)","水陆运输、采沙、淘金。造船、船舶修理。",湖南,怀化,"洪江市安江镇"
洪江市二装卸运输公司,914312810516963516,1981-11-24,N/A,何冰馨,"61.6000(万元人民币)","搬运、装卸、港口货物装卸、砂石销售。玻璃纤维、玻璃钢防腐施工、玻璃钢冷却塔、玻璃钢产品。",湖南,怀化,"洪江市安江镇油菜园64号"
洪江市第一装卸运输公司,914312811890812101,1981-11-24,N/A,谢志坚,"36.1000(万元人民币)","装卸、搬运。",湖南,怀化,"洪江市黔城镇北正街"
益阳中天房地产开发有限公司,914309001870910956,1981-11-26,N/A,田跃龙,"1,000(万)","房地产开发、经营；农业机械及配件、建材、百货的销售、仓储管理、房屋租赁、农机产品市场的开发。",湖南,益阳,"益阳赫山区桃花仑东路164号(中天国际花园"
祁阳县药材公司,914311211888435515,1981-11-27,N/A,漆国华,"110(万元人民币)","处方药和非处方药、中药饮片、中成药、化学药制剂、抗生素制剂、生化药品、生物制品、保健药品日化用品、I类医疗器械（限分支机构经营）",湖南,永州,"祁阳县浯溪镇东长街71号"
吉首市第三建筑安装公司,914331011895209737,1981-11-29,N/A,向安仁,"1,013.4000(万元人民币)","房屋建筑工程施工总承包叁级，市政公用工程施工总承包叁级建材生产五金电器材料、百货。 五金电器材料、百货。",湖南,湘西,"吉首市团结西路16号"
长沙市岳麓区坞泥矽砂加工厂,91430104184164105H,1981-12-01,集体所有制,路冬明,"3.5万人民币","加工矽砂。",湖南,长沙,"长沙市岳麓区坪塘镇蓝天村"
湖南牛力建材有限公司,91430000184164471E,1981-12-01,N/A,欧阳小艾,"6,000(万元人民币)","国家法律、法规允许的混凝土、预拌砂浆、机械设备的加工、制作及劳务加工服务；凭本企业资质从事房地产开发经营及物业管理服务。",湖南,长沙,"长沙市岳麓区洋湖街道湘江中路49号办公楼1、3楼"
长沙金马彩印包装有限公司,91430100184168173M,1981-12-01,有限责任公司,彭律,"262万人民币","包装装潢印刷品和其他印刷品印刷。",湖南,长沙,"长沙高新开发区雷锋街道廖家坪村"
长沙市岳麓区湘程机械厂,914301041841684995,1981-12-01,集体所有制,史定明,"50万人民币","路桥工程勘探机械、纺织机械配件的制造销售；农业机械修理。",湖南,长沙,"长沙市岳麓区雨敞坪镇高田村"
长沙市岳麓区桐溪锅炉配件厂,91430104722510731C,1981-12-01,集体所有制,谢再钧,"5.7万人民币","锅炉配件。铸件。",湖南,长沙,"长沙市岳麓区坪塘镇狮峰山村"
长沙坪塘天然香料有限公司,9143010418416464XC,1981-12-01,N/A,邹南其,"500(万元人民币)","香料、香精、食品添加剂的制造；香精及香料、食品添加剂的销售；生物制品研发。",湖南,长沙,"湖南省长沙市岳麓区岳麓科技产业园继善高科技产业基地B栋1楼"
长沙市岳麓区太平锅炉配件有限公司,914301041841638746,1981-12-01,N/A,包利君,"31(万)","锅炉配件、人造金刚石、铜、铝、铁铸件的制造销售。",湖南,长沙,"长沙市岳麓区坪塘街道长塘村"
长沙市望城区阳塘麻石有限公司,91430122184165394C,1981-12-01,N/A,朱星,"60(万元人民币)","建筑装饰用石开采；建筑用石加工。",湖南,长沙,"长沙市望城区桥驿镇洪家村朱家冲组71号"
望城县棕麻制品厂,91430122184166020Y,1981-12-01,集体所有制,周瑞延,"26.7万人民币","棕、麻、塑料制品、尼伦绳，钢丝绳的加工。",湖南,长沙,"望城县靖港镇保安街"
湖南省望城航运总公司丁字轮船公司,91430122184166178J,1981-12-01,N/A,李建文,"146.4000(万元人民币)","水上旅客运输；水上货物运输；矿产品、建材及化工产品批发",湖南,长沙,"长沙市望城区丁字湾街道丁字湾社区40号"
湘西土家族苗族自治州棉麻土产公司,914331001894804145,1981-12-04,N/A,向军,"50(万元人民币)","棉麻、针纺织品、皮张皮毛、竹木类、非食用植物油、政策允许的农副产品；系统内棉纱、蚕茧。 日杂、百货、五金、交电、化工产品",湖南,湘西,"吉首市武陵东路61号(州林业局斜对面"
宜章县关溪供销合作社,91431022188081243E,1981-12-04,集体所有制,廖志洲,"10.4万人民币","百货、针纺织品、五金、交电、化工、日用杂品。",湖南,郴州,"宜章县关溪乡"
宜章县梅田供销合作社,914310221880812519,1981-12-04,集体所有制,李红杏,"143.6万人民币","百货、针纺织品、服装、鞋类、文体用品，食品（由分支机构经营），五金、交电、化工、日用杂品、农业生产资料",湖南,郴州,"宜章县梅田镇梅商街2号"
宜章县里田供销合作社,91431022188080574E,1981-12-04,集体所有制,罗新华,"55万人民币","百货、纺织品、五金、交电、化工、日用杂品批发、零售；农药（不含化学危险物品）、化肥、不再分装的农作物种子零售；其他食品",湖南,郴州,"湖南省郴州市宜章县里田镇里田街"
湖南省轻工盐业集团有限公司醴陵支公司,914302817072610873,1981-12-04,N/A,文建波,"N/A","所隶属企业国有资产经营管理；日化产品、造纸原料及纸制品、陶瓷制品、化工原料（不含易燃易爆易制有毒物品）、建筑材料(不含硅酮胶)、金属材料销售；自有房屋租赁；提供经济信息咨询",湖南,株洲,"市泉湖路96号"
宜章县栗源供销合作社,91431022188081948M,1981-12-04,集体所有制,廖冬生,"47万人民币","农药、化肥、不再分装的小包装袋种子、农膜、中小农机具零售，废旧物资、农副产品收购。",湖南,郴州,"宜章县栗源镇明星桥"
宜章县浆水供销合作社,91431022188082035F,1981-12-04,集体所有制,李向阳,"49万人民币","化肥。",湖南,郴州,"宜章县浆水乡水口村"
宜章县食杂果品公司,91431022188080144L,1981-12-07,N/A,肖茜辉,"202(万元人民币)","新鲜水果， 日用百货、日用杂品。",湖南,郴州,"宜章县城关镇文明南路17号"
宜章县电影发行放映公司,91431022188080398H,1981-12-07,N/A,陈振云,"228(万元人民币)","电影片发行、放映；预包装食品、乳制品",湖南,郴州,"湖南省郴州市宜章县玉溪镇文明北路1号"
宜章县城关供销合作社,91431022188081956G,1981-12-07,集体所有制,N/A,"19.9万人民币","日用百货、五金、交电。(依法须经批准的项目，经相关部门批准后方可开展经营活动)",湖南,郴州,"宜章县玉溪镇文明南路16号"
宜章县杨梅山供销合作社,91431022188081702K,1981-12-07,集体所有制,胡斌,"10.8万人民币","日用百货、五金、交电、日用杂品零售、批发，农业生产资料零售",湖南,郴州,"宜章县杨梅山镇高枧街"
宜章县煤炭工业总公司,91431022188080136R,1981-12-07,N/A,欧阳进森,"1,551(万)","煤炭购销煤炭仓储、矿山物资设备、民用建材、室内外装修材料、圆钢销售",湖南,郴州,"宜章县南京洞"
宜章县东风供销合作社,91431022188081710E,1981-12-07,集体所有制,梁平光,"11万人民币","百货、针纺织品、五金、交电、日用杂货零售，停车服务。",湖南,郴州,"宜章县东风乡贺家圩"
宜章县岩泉供销合作社,914310221880818682,1981-12-07,集体所有制,姚友顺,"27.6万人民币","百货、纺织品、五金、交电、化工、化肥、农膜、农具。",湖南,郴州,"宜章县岩泉镇"
宜章县棉麻土产公司,91431022188080443J,1981-12-07,N/A,李兴华,"21(万元人民币)","棉花、麻类、土特产品调拨、转运、批发、零售。 百货、日用杂品、五金、交电零售。",湖南,郴州,"宜章县玉溪镇文明南路南京洞"
宜章县沙坪供销合作社,91431022188081817R,1981-12-07,集体所有制,邓异敏,"15万人民币","日用百货、日用杂品、五金交电批发兼零售，农药",湖南,郴州,"宜章县沙坪乡沙坪村（村委会旁）"
宜章县太平里供销合作社,91431022188082158G,1981-12-07,集体所有制,邓异敏,"27万人民币","日用百货、五金、交电、化工、日用杂品、建筑材料。农药",湖南,郴州,"宜章县五岭乡桃子湾"
宜章县白石渡供销合作社,914310221880819726,1981-12-07,集体所有制,杨寿堂,"22.5万人民币","百货、针纺织品、五金、交电。",湖南,郴州,"宜章县白石渡解放路18号"
宜章县麻田供销合作社,91431022188081227Q,1981-12-07,集体所有制,吴国栋,"22万人民币","百货、日用杂品、农业生产资料",湖南,郴州,"宜章县麻田镇"
宜章县生产资料公司,914310221880801872,1981-12-07,N/A,刘继勇,"284(万元人民币)","农业生产资料",湖南,郴州,"宜章县玉溪镇民主西路22号"
宜章县城南供销合作社,914310221880815694,1981-12-07,集体所有制,杨章勇,"120万人民币","日用百货、五金、交电、日用杂品、农业生产资料",湖南,郴州,"湖南省郴州市宜章县玉溪镇宜兴路8号"
湖南省农业生产资料总公司,91430000183762859N,1981-12-10,N/A,陈安才,"3,358(万元人民币)","销售化肥及其他农业生产资料、饲料、日用百货、针纺织品、汽车配件、五金交电及农林牧渔业生产所需的原辅材料、建筑材料、农副产品；自营和代理各类商品及技术的进出口业务；提供经济信息咨询服务；自有场地和自有房屋租赁。",湖南,长沙,"长沙市芙蓉区韶山北路186号"
长沙市利盛食品有限公司,914301001840081960,1981-12-10,N/A,陈静,"52(万元人民币)","农产品、日用百货、五金产品、建材、装饰材料的销售；日用杂品零售；房屋租赁；场地租赁；清洁服务。",湖南,长沙,"长沙市岳麓区望月湖月宫街213号"
长沙市食品公司砚瓦池贸易商行,914301051840502719,1981-12-10,N/A,陈新茶,"66(万元人民币)","农产品。",湖南,长沙,"东风路92号"
长沙市滨晟日用品贸易有限责任公司,91430103184008188G,1981-12-10,N/A,唐浪余,"30(万元人民币)","日用百货、纸张、文化用品的销售。",湖南,长沙,"长沙市天心区福胜街10号201房"
长沙市电子中专教学仪器设备厂,91430105183846163T,1981-12-10,集体所有制,佘金龙,"4.1万人民币","电子教学仪器设备的加工、修理。机械冷作加工。",湖南,长沙,"长沙市开福区蔡锷北路６１５号"
长沙市蓉中贸易有限公司,9143010018397152XB,1981-12-10,N/A,周文忠,"58(万元人民币)","五金交电、金属材料、日用百货的销售。(涉及行政许可的凭许可证经营)",湖南,长沙,"长沙市天心区芙蓉中路８７６号"
新晃侗族自治县自来水公司,91431227189281079N,1981-12-11,N/A,杨荣昌,"256(万元人民币)","自来水采掘供应。 水暖设施安装修理",湖南,怀化,"新晃县人民路40号"
长沙市清泰食品有限公司,914301001840503942,1981-12-11,N/A,易志,"28.8000(万元人民币)","预包装食品零售",湖南,长沙,"湖南省长沙市开福区寿星街5栋1楼3号门面"
长沙市佳鑫食品有限公司,91430100183928396U,1981-12-11,N/A,欧利明,"50(万元人民币)","肉食水产、卤腊味、食杂酱食、禽蛋、酒的销售",湖南,长沙,"长沙市芙蓉区复兴街146号综合楼101房"
长沙市涵元百货有限公司,9143010518404682XG,1981-12-11,N/A,罗建华,"30(万元人民币)","服装、百货的销售。",湖南,长沙,"长沙市开福区蔡锷北路14号"
湖南省乡镇企业供销总公司,914300001837610390,1981-12-11,N/A,陈兰勋,"1,000(万元人民币)","销售金属材料、 日用百货、针纺织品、矿产品、农副产品、化工原料",湖南,长沙,"长沙市芙蓉区远大路290号太平洋酒店五楼"
长沙涵可实业有限责任公司,9143010018384888XB,1981-12-11,N/A,王德钦,"108(万元人民币)","房屋租赁；清洁服务；五金产品批发；日用百货、文化用品的销售。",湖南,长沙,"长沙市岳麓区桃子湖３号"
长沙市长岛饭店有限责任公司,91430100183850920Y,1981-12-14,N/A,N/A,"300(万元人民币)","菜品的研究、开发、推广服务、技术服务；机电维修服务。",湖南,长沙,"长沙市芙蓉区五一大道136号"
长沙长油油脂发展有限公司,914301001838527316,1981-12-14,N/A,万慧,"51(万元人民币)","预包装食品的批发兼零售。",湖南,长沙,"长沙市天心区湘江中路二段137号"
衡阳市建筑材料供销公司,914304001850180035,1981-12-18,N/A,李珺,"56(万元人民币)","建筑材料。 计外金属材料、五金交电、家具、防腐材料，政策允许的化工原料、装饰材料。",湖南,衡阳,"衡阳市雁峰区中山南路55号"
长沙市工矿综合商业公司大椿桥商场,91430103183970092N,1981-12-19,N/A,陈永强,"19.6000(万元人民币)","百货、五金交电、针织品、日用杂货、副食品、食品、酒。",湖南,长沙,"长沙市天心区书院路228号"
湖南柿竹园有色金属有限责任公司,9143100018796225XW,1981-12-19,N/A,何斌全,"46,170.4473(万元人民币)","有色金属矿采选、冶炼、加工、销售及相关产品生产、销售；本企业自产的铅锭、锌锭、钼精矿、铋锭、钼铁、钨铁、氧化钼、萤石、铜、锡对外出口；本企业生产、科研所需的原辅材料、机械设备、仪器仪表、零配件进口、技术开发、技术咨询服务；工业及民用建筑工程、矿山井巷工程施工、安装；普通货物、危险货物运输",湖南,郴州,"郴州市苏仙区白露塘镇东河东路(郴州钻石钨制品有限公司南边)"
湖南金衡建设工程有限公司,91430422185320982Y,1981-12-22,N/A,欧阳金,"2,000(万元人民币)","房屋建筑工程施工总承包贰级:可承担单项建安合同额不超过企业注册资本金5倍的下列房层建筑工程的施工：（1）28层及以下、单跨跨度36米及以下的房屋建筑工程 ；（2）高度120米及以下的构筑物 ；",湖南,衡阳,"衡南县向阳镇向阳街208号"
湖南省机械设备进出口公司,914300001837642217,1981-12-25,N/A,李志国,"4,000(万元人民币)","销售汽车；自营和代理商品及技术的进出口业务；承包与出口成套设备相关的境外工程和境内国际招标工程",湖南,长沙,"长沙市天心区白沙路207号天机大厦"
长沙县干杉建新塑料制品厂,914301211841213753,1981-12-26,集体所有制,文向阳,"7.4万人民币","生产销售遮阳网、防虫网、编织袋、涂膜；提供配套印字服务",湖南,长沙,"长沙县干杉乡建新村"
长沙市金属材料有限责任公司,914301111838540243,1981-12-28,N/A,邓国祥,"500(万元人民币)","黑色、有色金属材料、机电产品、五金工具、家用电器、化轻材料、汽车及摩托车配件的销售。",湖南,长沙,"长沙市雨花区车站南路471号（长沙市金属材料有限责任公司）"
长沙达润金属材料有限责任公司,91430100183855262M,1981-12-28,N/A,袁丽娟,"210(万)","金属材料、汽车",湖南,长沙,"长沙市芙蓉区复兴街183号"
衡南江口湖南省粮食储备库有限公司,914304227700953683,1981-12-28,N/A,廖中林,"360.5000(万元人民币)","大米、食油、面粉加工销售，原粮购销、储存，饲料经营、百货、化肥。",湖南,衡阳,"衡南县江口镇丁字街"
长沙凯力化轻有限公司,9143010018385338XJ,1981-12-28,N/A,文新,"3,707.0787(万元人民币)","化工产品、轻工产品、水性涂料、化学试剂、纸张、橡胶轮胎、金属材料、建材、机电产品的销售。",湖南,长沙,"长沙市天心区西湖路45号"
湖南省湘西自治州木材公司,914331001894804220,1981-12-29,N/A,田儒洪,"117(万)","木材、 木制品、半成品、林化、林副、林特产品、日用百货、服装鞋帽、政策允许的民用建材、五金交电、化工",湖南,湘西,"吉首市武陵东路44号"
长沙市七件事食品有限责任公司,91430100883966043C,1981-12-29,N/A,喻和平,"30(万元人民币)","预包装食品、散装食品、乳制品（含婴幼儿配方乳粉）的零售（凭许可证、审批文件经营）；卷烟、雪茄烟的零售",湖南,长沙,"长沙市雨花区树木岭路228号"
长沙市机电设备有限责任公司,91430100183854139B,1981-12-29,N/A,周石山,"388(万元人民币)","机电产品、汽车",湖南,长沙,"长沙市芙蓉区芙蓉中路二段12号"
长沙市电子器材三厂,91430105184003985D,1981-12-29,集体所有制,郭立敏,"32万人民币","充电机、逆变电源、喊话机、报警器、电冰箱、保温器的生产。",湖南,长沙,"长沙市开福区德雅路65号"
湘潭市公共汽车公司维修分公司,91430300884700941T,1981-12-30,N/A,N/A,"N/A","二类机动车维修（大中型客车维修、小型车维修）",湖南,湘潭,"湘潭市岳塘区建设中路6号"
长沙市如意塑料包装厂,914301051838516677,1981-12-30,集体所有制,马国强,"7.5万人民币","塑料包装加工。",湖南,长沙,"长沙市开福区五一新村居民点8栋东头"
湘西土家族苗族自治州轻纺物资设备供销公司,91433100189480107C,1981-12-31,N/A,吴卫红,"93(万元人民币)","轻纺机械设备、原辅材料及产品、州内轻纺系统直属直供的金属材料及轻化产品。 政策允许的矿产品。",湖南,湘西,"吉首市光明西路16号"
长沙市黄春和实业有限公司,914301001839722824,1981-12-31,N/A,陈杨夫,"60(万元人民币)","住宿；中餐服务；小吃服务；餐饮配送服务；甜品制售；中央厨房；食品制售",湖南,长沙,"长沙市天心区城南西路274号"
长沙市粮油食品进出口有限公司,914301001838570652,1981-12-31,N/A,梁红虎,"286(万元人民币)","自营和代理各类商品及技术的进出口，但国家限定公司经营或禁止进出口的商品和技术除外；土特产、日用百货、包装材料、建材、汽车零配件、农副产品、矿产品、照相器材、化工产品的销售；牲畜、纺织品、针织品及原料的批发；纺织品及针织品的零售。",湖南,长沙,"长沙市芙蓉区朝阳路150号"
