抚顺市蔬菜公司北厚菜库,91210400119411026W,1981-06-10,N/A,N/A,"41(万元人民币)","蔬菜、水果储藏、批发、零售，水产品批发、零售，库房、场地出租，对外检斤。",辽宁,抚顺,"望花区工农街"
开原市业民供销合作社,91211282MA0UR1Q69G,1981-06-10,集体所有制,N/A,"80万人民币","针纺织品、百货、文具、五金交电、农业生产资料、农副产品、建筑材料销售；露天市场服务（不允许现场加工食品）",辽宁,铁岭,"辽宁省铁岭市开原市业民镇业民村"
抚顺市顺城区前甸供销社,912104001194725663,1981-06-13,集体所有制,N/A,"50万人民币","综合性百货(国家法律、法规禁止经营的除外，需前置许可项目按许可的项目及期限经营）、预包装食品批发兼零售；卷烟，雪茄烟零售；农副土特产品、民用建材（零售）；建筑五金、家用电器、日用杂品、化肥、农膜、农药",辽宁,抚顺,"顺城区靠山村"
抚顺市顺城区河北供销社,91210400119472486F,1981-06-13,集体所有制,N/A,"22.1万人民币","农副产品、民用建材、农膜、化肥、车马用具、小农工具销售。",辽宁,抚顺,"顺城区河北方晓村"
康平县小城子供销合作社,91210123123063044B,1981-06-16,集体所有制,N/A,"18.5万人民币","酒糖茶、百货、农业生产资料（不含种子、化肥、农药）、五金、交电批发零售；中成药、中药饮片；化学药制剂；抗生素、生化药品零售生猪、农副土畜产品、废旧物资收购；建筑材料、钢材、木材、蔬菜、日用杂品，烟、副食品、保健食品、预包装食品零售；代销原包装种子、常规种子（凭具有种子经营许可证的种子经营单位出具的...",辽宁,沈阳,"康平县小城子镇小城子村"
锦州电力建筑安装工程总公司,91210700738780402D,1981-06-22,N/A,N/A,"800.6000(万元人民币)","房屋建筑工程施工总承包叁级、防腐保温工程专业承包叁级、金属门窗工程专业承包叁级、机电设备安装工程专业承包叁级。",辽宁,锦州,"太和区兴隆南里72号"
沈阳塑料管业有限公司,9121010011786382X5,1981-06-25,有限责任公司 国有企业,N/A,"368.6万人民币","塑料管材、管件、管道附件，塑料节水灌溉设备，塑料制品制造加工；塑料原材料经营；节水灌溉设备工程规划、设计，设备安装",辽宁,沈阳,"沈阳市大东区小什字街140号"
盖州市万福供销合作社生产资料商店,91210881MA0TWYAW6Q,1981-06-27,集体分支机构(非法人),N/A,"N/A","农业生产资料（不含鼠药）农业配件，树种，农作物种子",辽宁,营口,"万福镇万福街"
开原市八宝屯供销合作社,91211282MA0UTJ0F7X,1981-06-27,集体所有制,N/A,"41万人民币","农业生产资料、日杂（不含易燃易爆危险品）、图书、五金、百货、农副产品、饲料零售",辽宁,铁岭,"辽宁省铁岭市开原市八宝镇八宝村"
宽甸优耐塑料电镀有限公司,91210624120468695R,1981-06-29,有限责任公司,N/A,"48万人民币","非金属电镀",辽宁,丹东,"永甸村"
抚顺红透山铜矿清原服务公司,9121042311961451XL,1981-06-29,N/A,N/A,"111.4000(万元人民币)","人力装卸服务＊＊＊",辽宁,抚顺,"清原镇矿山街"
葫芦岛市新华书店有限责任公司,91211400123716391T,1981-07-01,N/A,N/A,"133(万元人民币)","图书销售；像带、音带、视盘、房屋租赁；柜台出租、仓储服务、装卸搬运",辽宁,葫芦岛,"辽宁省葫芦岛市连山区中央大街7号"
彰武县新华书店有限公司,91210922121912823B,1981-07-01,N/A,N/A,"17(万元人民币)","国内版图书、期刊、报纸批发兼零售；国内劳务服务（劳务派遣除外）、企业管理服务、装卸搬运服务、仓储服务",辽宁,阜新,"辽宁省阜新市彰武县中华路25号"
大连白云商业有限公司风光商店,91210203674072457C,1981-07-01,N/A,N/A,"N/A","副食品、食品、百货、日用杂品的零售；切面加工",辽宁,大连,"辽宁省大连市西岗区风光街26号"
岫岩满族自治县客运总公司,91210322120363375K,1981-07-01,N/A,N/A,"376(万元人民币)","道路旅客运输；县内班车客运；县际班车客运；市际班车客运；省际班车客运；县内包车客运；县际包车客运；市际包车客运；省际包车客运。",辽宁,鞍山,"辽宁省鞍山市岫岩镇站前大街"
辽宁省土产进出口公司山菜加工厂,91210213118676575D,1981-07-01,国有企业,N/A,"834万人民币","盐渍菜、食用菌、脱水菜、罐头、水产品加工；房屋出租。",辽宁,大连,"辽宁省大连市金州区龙王村"
辽宁虎跃(丹东)客运有限公司二分公司,91210602820066064C,1981-07-04,N/A,N/A,"N/A","道路旅客运输。",辽宁,丹东,"丹东市元宝区八道东路1号"
丹东市振安区供销合作总社五龙背供销社,91210600120262216L,1981-07-06,集体所有制,N/A,"57.6万人民币","销售：纺织服装及日用品、钢材、建材、化工产品、机械设备、五金交电及电子产品、文化用品、农副土特产品、农膜、化肥、饲料、日杂；烟花爆竹零售；照片扩印服务；美术服务；[下设分支机构经营：零售毒害品（农药）、易燃液体、农作物种子、食品、饮料、烟；收购废有色、黑色金属、废三类物资、中药材；...",辽宁,丹东,"振安区五龙背镇"
丹东市城区供销合作社联合社蛤蟆塘供销社,91210600120264393P,1981-07-06,集体所有制,N/A,"50.2万人民币","销售：纺织、服装及日用品，家具，炊事用具，陶瓷制品，工艺品，初级农畜产品，五金交电，电器机械及器材，汽车配件，农机配件，钢材，建筑材料，化工产品，染料，化肥，农膜，录音带，固定电话机；房屋出租；零售：烟花爆竹，预包装食品、乳制品",辽宁,丹东,"元宝区金山镇山城村"
丹东市振安区供销合作总社楼房供销社,91210600120264174D,1981-07-06,集体所有制,N/A,"41.7万人民币","销售：日用百货，日用杂品，针纺织品，劳保用品，化肥，农膜；自有房屋、场地、柜台出租；零售烟花爆竹。",辽宁,丹东,"振安区楼房乡楼房村"
丹东市振安区供销合作总社同兴供销社,91210600120266225F,1981-07-07,集体所有制,N/A,"44.9万人民币","销售：纺织、服装及日用品，五金交电，初级农畜产品，钢材，建筑材料，电器机械，农机具，化工产品，涂料；钟表修理；房屋出租。",辽宁,丹东,"振安区同兴镇新兴村"
丹东市城区物资回收有限公司滨江收购站,91210603MA0QECX850,1981-07-07,N/A,N/A,"N/A","收购：废旧有色、黑色金属，废旧三类物资。",辽宁,丹东,"辽宁省丹东市振兴区胜利街1363号"
丹东市城区供销合作社联合社浪头供销社,91210600120269100X,1981-07-07,集体所有制,N/A,"173.5万人民币","销售：日用百货、服装鞋帽、针纺织品、日用杂品、五金交电、家具、电器机械及器材、钢材、化工产品（不含危险品）、文化用品、建筑材料（不含木材）、烟花爆竹",辽宁,丹东,"振兴区浪头镇浪头街"
丹东市振安区供销合作总社九连城供销社,91210600120263593U,1981-07-07,集体所有制,N/A,"55.7万人民币","销售：日用百货，日用杂品，针纺织品，五金交电，建筑材料，钢材，农用工具，初级农畜产品，化肥，农膜；自有房屋出租，柜台出租；零售烟花爆竹。",辽宁,丹东,"振安区九连城镇九连城街"
海城市西四供销合作社,91210381241539736N,1981-07-10,集体所有制,N/A,"77万人民币","花纱、百货、五金交电、化肥、农膜、生产资料(不含农药)、建筑材料农副产品、代购代销、废品收购（有色金属除外）",辽宁,鞍山,"海城市西四镇西四村"
海城市牛庄中心供销社,91210381241546311G,1981-07-10,集体所有制,N/A,"140万人民币","针织、百货、服装鞋帽、花纱、日用杂品（鞭炮、易燃易爆有毒品除外）、五金电料、化肥、农膜",辽宁,鞍山,"海城市牛庄镇商业大街路东"
大连第二电机厂电机维修配件厂,91210204118515878E,1981-07-10,集体所有制,N/A,"8万人民币","电机修理*零售机电产品、电机配件、机床配件、建筑材料、机械加工*",辽宁,大连,"辽宁省大连市沙河口区连山街１１号"
海城市王石中心供销社小女商店,91210381MA0QDQ213P,1981-07-10,集体分支机构(非法人),N/A,"N/A","建筑材料花百、五金、文具、农具、化肥、建筑材料、农药零售",辽宁,鞍山,"海城市什司县小女村"
海城市海州供销合作社,9121038124155096XT,1981-07-10,集体所有制,N/A,"240万人民币","零售：花纱、百货、五金交电、建材、彩电、家用电器、冰箱、摩托车、土产品收购、计划外钢材、化肥。",辽宁,鞍山,"海城市海州管理区新立街"
宽甸满族自治县牛毛坞供销合作社,91210624120476003H,1981-07-10,集体所有制,N/A,"37万人民币","百货，日杂，针纺织品，服装鞋帽，五金交电化工（不含危险品），农业生产资料（化肥不批发），房屋出租农副土特产品收购",辽宁,丹东,"牛毛坞村"
宽甸满族自治县青山沟供销合作社,912106241204760384,1981-07-10,集体所有制,N/A,"30万人民币","百货，日杂(不含烟花爆竹)，针纺织品，服装，鞋帽，五金交电化工(不含危险品)，化肥",辽宁,丹东,"青山沟镇青山沟村"
鞍山继电器厂,91210311119111445K,1981-07-14,股份合作制,N/A,"418万人民币","各种型号继电器电控设备,民用电器电控设备,民用电器电控设备,民用电器",辽宁,鞍山,"鞍山市千山区东旧堡街(区委西200米)"
彰武县日用杂品公司,91210922121910051C,1981-07-14,N/A,N/A,"30(万元人民币)","日用杂品，建筑材料，烟花类［B级（仅限喷花类）C级（组合烟花类成品单筒药量在25g以下）D级］、爆竹类［C级］经营（批发）（有效期至2015年1月6日）粮食油料购销",辽宁,阜新,"彰武县灯塔路"
大连革镇堡建筑工程公司,912102111185852359,1981-07-14,N/A,N/A,"602(万元人民币)","三级土木工程建筑；爆破与拆除工程专业承包三级",辽宁,大连,"辽宁省大连市甘井子区革镇堡镇中革镇堡村"
鞍山市铁西区饮食服务公司,91210300119013570T,1981-07-15,N/A,N/A,"112(万元人民币)","正餐服务、摄影扩印服务、理发服务、房屋租赁。",辽宁,鞍山,"鞍山市铁西六道街83-11号丘(地)号2-8"
沈阳市于洪区造化供销合作社,912101141181879827,1981-07-15,集体所有制,N/A,"40万人民币","日用工业品、副食品、农业生产资料、金属材料、炉料、二三类机电产品、农副产品、民用建材零售。",辽宁,沈阳,"于洪区造化乡造化村"
鞍山市千山区宁远供销合作社新堡商店,91210300701508018T,1981-07-15,集体分支机构(非法人),N/A,"N/A","百货、纺织品、农业生产资料、副食、五金交电,食品、烟酒、白糖、民用建材、农副土产。日用杂品、化肥、木材、油漆、涂料、农膜、粮油、饲料。日用杂品、化肥、木材、油漆、涂料、农膜、粮油、饲料。日用杂品、化肥、木材、油漆、涂料、农膜、粮油、饲料。",辽宁,鞍山,"鞍山市千山区宁远镇新堡村"
凤城市玉龙供销合作社采购栈,91210682MA0QFX4E2Y,1981-07-20,集体分支机构(非法人),N/A,"N/A","农副土特产品，中草药材",辽宁,丹东,"凤城市边门镇建设村"
鞍山市千山区宁远供销合作社北地号商店,91210303701507971J,1981-07-20,集体分支机构(非法人),N/A,"N/A","百货,纺织品,农业生产资料,副食,五金交电,食品,烟酒,白糖民用建材,农副土产,日用杂品,化肥,农膜、木材,粮油,饲料、农药（含杀鼠药）,照像.零售.民用建材,农副土产,日用杂品,化肥,农膜、木材,粮油,饲料、农药（含杀鼠药）,照像.零售.民用建材,农副土产,日用杂品,化肥,农膜、木材,粮油,饲料、农药（含杀鼠药）,照像....",辽宁,鞍山,"鞍山市千山区宁远镇北地号村"
鞍山市千山区旧堡供销合作社原委商店,912103118191110322,1981-07-20,集体分支机构(非法人),N/A,"N/A","生产资料、日杂、建材、百货、烟酒、糖茶、糕点、饮料、调味品、小食品、粮油零售。",辽宁,鞍山,"辽宁省鞍山市千山区旧堡路128号"
鞍山市千山区宁远供销合作社包董岳商店,912103007015079124,1981-07-20,集体分支机构(非法人),N/A,"N/A","百货、纺织品、农业生产资料、副食、五金交电、食品、烟酒、白糖民用建材、农副土产、日用杂品、化肥、农膜、粮油、饲料民用建材、农副土产、日用杂品、化肥、农膜、粮油、饲料民用建材、农副土产、日用杂品、化肥、农膜、粮油、饲料",辽宁,鞍山,"鞍山市千山区包董岳村"
鞍山市千山区宁远供销合作社南地号商店,9121030370150800X6,1981-07-20,集体分支机构(非法人),N/A,"N/A","百货、纺织品、农业生产资料、副食、五金交电、食品、烟酒、白糖、民用建材、农副土产、日用杂品、化肥、木材、农膜、粮油、饲料零售。",辽宁,鞍山,"鞍山市千山区南地号村"
鞍山市千山区汤岗子供销合作社地所屯商店,91210311794849718K,1981-07-20,集体分支机构(非法人),N/A,"N/A","百货、纺织品、农业生产资料、建筑小五金、预包装食品、乳制品、卷烟、雪茄烟、农副土特产、日杂、化肥、民用建材、农药",辽宁,鞍山,"鞍山市千山区东鞍山镇解家堡子村"
大连金州新区供销联社董家沟经销公司,91210213118686976Y,1981-07-20,集体所有制,N/A,"200.9万人民币","针纺织品、百货、日用杂品",辽宁,大连,"辽宁省大连经济技术开发区董家沟街道３６３号"
沈阳新光阀门制造厂,912101041178634160,1981-07-20,集体所有制,N/A,"428万人民币","阀门、机械零部件、滑管液位计、装卸软管、弹簧、鹤管、过滤器及阀门配套部件、橡塑制品、机械加工、制造；热处理；阀门检修。",辽宁,沈阳,"大东区凌云街２４号"
鞍山市旅游服务公司永乐绅澳浴城,9121030324146050X4,1981-07-21,N/A,N/A,"7.4000(万元人民币)","洗浴用品销售。",辽宁,鞍山,"铁西民生路208号"
凤城市边门供销合作社采购栈,91210682MA0QE74444,1981-07-21,集体分支机构(非法人),N/A,"N/A","废品、农副土特产品、林产品、中药材收购。",辽宁,丹东,"凤城市边门镇边门街"
大连市西岗区服务公司更新理发社,912102036740725888,1981-07-22,N/A,N/A,"N/A","理发。空白。",辽宁,大连,"辽宁省大连市西岗区更新街"
大连市西岗区服务公司北京浴池,91210203716913083P,1981-07-24,N/A,N/A,"N/A","浴池，住宿，理发",辽宁,大连,"辽宁省大连市西岗区长江路619号"
辽宁中医药大学附属医院劳动服务公司,9121010511791333XX,1981-07-27,N/A,N/A,"50(万元人民币)","提供劳务、礼仪、家政、洗涤、缝纫、会议、停车场管理服务，房屋维修，自有房屋租赁；二类医疗器械、保健用品、保健食品、制剂包装材料销售，预包装食品",辽宁,沈阳,"沈阳市皇姑区崇山东路72号"
鞍山鞍钢东山酒店管理有限公司东山宾馆分公司,91210300941264817X,1981-07-28,N/A,N/A,"N/A","宾馆",辽宁,鞍山,"鞍山市铁东区东风街108号"
绥中县荒地供销社,9121142112086417XR,1981-07-29,集体所有制,N/A,"23.5万人民币","日用消费品，农业生产资料",辽宁,葫芦岛,"绥中县荒地镇荒地村"
沈阳市新乐电子仪器厂,91210105117944830Y,1981-07-30,集体所有制,N/A,"47万人民币","保留主体资格，处理企业善后事宜。",辽宁,沈阳,"沈阳市皇姑区牡丹江街１１号"
盖州市陈屯供销合作社陈屯商店,91210881MA0UC11097,1981-07-31,集体分支机构(非法人),N/A,"N/A","农药",辽宁,营口,"盖州市陈屯镇陈屯村2号"
建平县建平供销合作社,91211322MA0QFRUJ2Q,1981-08-01,集体所有制,N/A,"124万人民币","自有资产经营管理。",辽宁,朝阳,"辽宁省朝阳市建平县建平镇本街"
彰武县苇子沟供销合作社,9121092212191102X7,1981-08-01,集体所有制,N/A,"13.5万人民币","服装百货，花纱，针织，鞋帽，五金，日杂，化肥零售；粮食油料购销（不含玉米、水稻、大米），毒害品（仅限农药和杀鼠剂）零售；农作物种子委托代销（以种子委托书为准）",辽宁,阜新,"彰武县苇子沟乡本街"
彰武县二道河子供销合作社,91210922121911070J,1981-08-01,集体所有制,N/A,"11.7万人民币","日用百货，服装鞋帽，日用杂品。五金工具，日用化学品，建材，化肥，粮食油料购销",辽宁,阜新,"彰武县二道河子乡本街"
彰武县阿尔乡供销合作社,91210922121912858X,1981-08-01,集体所有制,N/A,"25.8万人民币","日用百货，服装，鞋帽，日用杂品，家用电器，五金工具。建筑材料、木材、涂料、化肥、水暖器材零售建筑材料、木材、涂料、化肥、水暖器材零售",辽宁,阜新,"彰武县阿尔乡本街"
中国农业银行股份有限公司建平奎德素支行,912113228233624323,1981-08-01,N/A,N/A,"N/A","人民币存款、贷款、结算业务；票据贴现；本外币理财产品销售；代理发行金融债券；代理发行、兑付、销售政府债券；代理基金销售；代理收付款项及代理保险业务；外币储蓄、外币兑换及买卖、外汇汇款；贵金属买卖业务；经中国银行业监督管理委会批准的其他业务。",辽宁,朝阳,"辽宁省朝阳市建平县奎德素镇人民路014号"
彰武县章古台供销合作社,912109221219115057,1981-08-01,集体所有制,N/A,"18万人民币","百货、化肥、农膜日杂（不含烟花、爆竹），农机具，建筑材料，废旧物资回收（不含危险废物）",辽宁,阜新,"彰武县章古台镇本街"
建平县热水供销合作社,91211322MA0QC9CM7B,1981-08-01,集体所有制,N/A,"29万人民币","自有资产经营管理。",辽宁,朝阳,"辽宁省朝阳市建平县热水乡本街"
彰武县平安供销合作社,91210922121910289K,1981-08-01,集体所有制,N/A,"5万人民币","日用百货，服装鞋帽，针纺织品，五金交电。建筑材料，化肥，农作物种子代销",辽宁,阜新,"彰武县平安乡本街"
建平县三家供销合作社,91211322MA0P5YXXX7,1981-08-01,集体所有制,N/A,"77万人民币","自有资产经营管理。",辽宁,朝阳,"辽宁省朝阳市建平县三家乡本街"
建平县国营农场供销合作社,91211322MA0TP1MR3N,1981-08-01,集体所有制,N/A,"27万人民币","自有资产经营管理。",辽宁,朝阳,"辽宁省朝阳市建平县八家乡本街"
彰武县丰田供销合作社,91210922121910385W,1981-08-01,集体所有制,N/A,"8万人民币","日用百货，服装鞋帽，水产品，自行车建材，木材，饲料，化肥",辽宁,阜新,"彰武县丰田乡本街"
建平县杨树岭供销合作社,91211322MA0QFUUC34,1981-08-01,集体所有制,N/A,"16万人民币","自有资产经营管理。",辽宁,朝阳,"辽宁省朝阳市建平县杨树岭乡本街"
彰武县四堡子供销合作社,912109221219106092,1981-08-01,集体所有制,N/A,"32万人民币","日用百货、五金交电、文教用品、建筑材料销售",辽宁,阜新,"彰武县四堡子乡本街"
彰武县双庙供销合作社,91210922121910203Q,1981-08-01,集体所有制,N/A,"61万人民币","日用百货，针织鞋帽，五金交电，文化用品，日用杂品(不含烟花、爆竹），烟零售化肥，饲料。",辽宁,阜新,"彰武县双庙乡本街"
建平县哈拉道口供销合作社,91211322MA0QFYCYXP,1981-08-01,集体所有制,N/A,"370万人民币","自有资产经营管理。",辽宁,朝阳,"辽宁省朝阳市建平县哈拉道口本街"
彰武县哈尔套供销合作社,912109221219105454,1981-08-01,集体所有制,N/A,"41万人民币","日用百货，服装鞋帽，针纺织品，家用电器，五金工具，文教用品粮食油料收购（不含玉米，水稻，大米），化肥，农膜；房屋租赁",辽宁,阜新,"彰武县哈尔套镇本街"
建平县朱力科供销合作社,91211322MA0QFW9D36,1981-08-01,集体所有制,N/A,"197万人民币","自有资产经营管理。",辽宁,朝阳,"辽宁省朝阳市建平县朱力科镇本街"
建平县向阳供销合作社,91211322MA0QFR700E,1981-08-01,集体所有制,N/A,"50万人民币","自有资产经营管理。",辽宁,朝阳,"辽宁省朝阳市建平县向阳乡本街"
建平县青松岭供销合作社,91211322MA0QFXP799,1981-08-01,集体所有制,N/A,"73万人民币","自有资产经营管理。",辽宁,朝阳,"辽宁省朝阳市建平县青松岭乡铁营子村"
建平县白山供销合作社,91211322MA0QFW7N21,1981-08-01,集体所有制,N/A,"76万人民币","自有资产经营管理。",辽宁,朝阳,"辽宁省朝阳市建平县白山乡"
建平县万寿供销合作社,91211322MA0P5YGR2M,1981-08-01,集体所有制,N/A,"28万人民币","自有资产经营管理。",辽宁,朝阳,"辽宁省朝阳市建平县万寿镇本街"
建平县老官地供销合作社,91211322MA0QFUP38K,1981-08-01,集体所有制,N/A,"30万人民币","自有资产经营管理。",辽宁,朝阳,"辽宁省朝阳市建平县老官地镇本街"
建平县奎德素供销合作社,91211322MA0TP3R18J,1981-08-01,集体所有制,N/A,"70万人民币","自有资产经营管理。",辽宁,朝阳,"辽宁省朝阳市建平县奎德素乡本街"
建平县孤山子供销合作社,91211322MA0QFX0L4L,1981-08-01,集体所有制,N/A,"37万人民币","自有资产经营管理。",辽宁,朝阳,"辽宁省朝阳市建平县孤山子乡本街"
建平县惠州供销合作社,91211322MA0QFT7G7U,1981-08-01,集体所有制,N/A,"86万人民币","自有资产经营管理。",辽宁,朝阳,"辽宁省朝阳市建平县惠州乡本街"
彰武县后新秋供销合作社,91210922121911716N,1981-08-01,集体所有制,N/A,"31.8万人民币","日用百货、五金交电、毒害品（仅限农药和杀鼠剂）零售；农作物种子代销、化肥零售；建筑材料，粮食油料收购",辽宁,阜新,"彰武县后新秋镇本街"
建平县罗卜沟供销合作社,91211322MA0QFTMM1X,1981-08-01,集体所有制,N/A,"52万人民币","自有资产经营管理.",辽宁,朝阳,"辽宁省朝阳市建平县罗卜沟本街"
彰武县东六家子供销合作社,91210922121912970W,1981-08-01,集体所有制,N/A,"10万人民币","针纺织品，日用百货，文化用品，化肥零售；羊毛，粮食油料",辽宁,阜新,"彰武县东六家子镇本街"
建平县张家营子供销合作社,91211322MA0QFU0H30,1981-08-01,集体所有制,N/A,"35万人民币","自有资产经营管理。",辽宁,朝阳,"辽宁省朝阳市建平县张家营子乡本街"
建平县太平庄供销合作社,91211322MA0QFTH42Q,1981-08-01,集体所有制,N/A,"80万人民币","自有资产经营管理。",辽宁,朝阳,"辽宁省朝阳市建平县太平庄乡本街"
彰武县两家子供销合作社,91210922121910940B,1981-08-01,集体所有制,N/A,"13.6万人民币","日用百货，服装鞋帽，日杂，家用电器，五金，文教用品。建筑材料、化肥、土特产品、毒害品（仅限农药和杀鼠剂）零售",辽宁,阜新,"彰武县两家子乡本街"
建平县义成功供销合作社,91211322MA0TP1A65T,1981-08-01,集体所有制,N/A,"124万人民币","自有资产经营管理。",辽宁,朝阳,"辽宁省朝阳市建平县义成功乡本街"
建平县农业生产资料公司,912113221233601614,1981-08-01,N/A,N/A,"300(万元人民币)","自有资产经营管理。",辽宁,朝阳,"建平县叶柏寿镇万寿路中段"
彰武县前福兴地供销合作社,912109221219127197,1981-08-01,集体所有制,N/A,"13.8万人民币","日用百货，家用电器，服装鞋帽，针纺织品，农作物种子代销，毒害品（仅限农药和杀鼠剂）零售，化肥销售",辽宁,阜新,"彰武县福兴地乡本街"
建平县喀喇沁供销合作社,91211322123374221A,1981-08-01,集体所有制,N/A,"170万人民币","自有资产经营管理。",辽宁,朝阳,"辽宁省朝阳市建平县喀喇沁本街"
彰武县兴隆山供销合作社,9121092212191305XQ,1981-08-01,集体所有制,N/A,"28万人民币","化肥,农作物种子代销粮食油料收购（不含玉米、水稻、大米）",辽宁,阜新,"彰武县兴隆山乡本街"
彰武县兴隆堡供销合作社,91210922121911978E,1981-08-01,集体所有制,N/A,"21万人民币","日用百货，五金，家用电器，文教用品，自行车。建筑材料，涂料，木材，化肥，农膜，粮食油料收购",辽宁,阜新,"彰武县兴隆堡乡本街"
建平县马场供销合作社,91211322MA0QC5F56U,1981-08-01,集体所有制,N/A,"180万人民币","自有资产经营管理。",辽宁,朝阳,"建平县马厂乡本街"
彰武县四合城供销合作社,912109221219113450,1981-08-01,集体所有制,N/A,"14.4万人民币","日用百货，针纺织品，五金交电，化肥，农膜。此项空白。",辽宁,阜新,"彰武县四合城本街"
建平县富山供销合作社,91211322123367777C,1981-08-01,集体所有制,N/A,"89万人民币","自有资产经营管理。",辽宁,朝阳,"建平县富山镇本街"
建平县新华书店有限公司,912113227018239075,1981-08-01,N/A,N/A,"53(万元人民币)","国内版图书、报纸、期刊、音像制品、文化用品、电子产品、办公用品、日用百货、计算机设备教学设备、图书馆设备，体育用品，计算机耗材、计算机软硬件，纸制品，包装材料，服装鞋帽，工艺品",辽宁,朝阳,"辽宁省朝阳市建平县叶柏寿街道万寿路南广电大厦一、二、三楼"
