大连市普兰店区碧流河供销合作社牟屯商店,9121028279204617XP,1981-09-01,集体分支机构(非法人),N/A,"N/A","农业生产资料、农副土特产品、纺织品、百货、食品、副食品、五交化商品、日用杂品、建筑材料、废旧物资零售、代购、代销。",辽宁,大连,"辽宁省大连市普兰店区城子坦街道东老滩社区牟屯"
大连市普兰店区同益供销合作社西韭商店,91210282796912039U,1981-09-01,集体分支机构(非法人),N/A,"N/A","农药、化肥、农膜、种子、农机具及配件、农副土特产品、纺织品、百货、粮油、饲料、食品、副食品、五交化商品、日用杂品、图书、建筑材料零售。",辽宁,大连,"辽宁省大连市普兰店区同益乡西韭村"
大连市普兰店区四平供销合作社,91210282118729884U,1981-09-01,集体所有制,N/A,"71万人民币","农业生产资料、农副土特产品、纺织品、百货、食品、副食品、五交化商品、日用杂品、图书煤炭、中西药、建筑材料、废旧物资零售兼批发、代购、代销。",辽宁,大连,"辽宁省大连市普兰店区四平镇四平村"
大连市普兰店区星台供销合作社刘屯商店,91210282792048191H,1981-09-01,集体分支机构(非法人),N/A,"N/A","农药",辽宁,大连,"辽宁省大连市普兰店区星台镇元岭村"
中国石油天然气股份有限公司辽宁大连销售分公司双塔加油站,91210282796900628K,1981-09-01,N/A,N/A,"N/A","汽油、煤油、柴油、润滑油、五金交电、电气设备销售；百货、食品、副食品、饮料、烟、酒、化肥、计生用品、一般劳保用品、水果、蔬菜、预包装食品、乳制品（不含婴幼儿配方乳粉）、图书报刊、汽车配件零售；三类汽车",辽宁,大连,"辽宁省大连市普兰店区双塔镇双塔村"
大连市普兰店区碧流河供销合作社栾甸商店,91210282792046305H,1981-09-01,集体分支机构(非法人),N/A,"N/A","农药",辽宁,大连,"辽宁省大连市普兰店区城子坦街道金厂社区栾甸屯"
大连市普兰店区花儿山供销合作社花儿山商店,91210282792045935F,1981-09-01,集体分支机构(非法人),N/A,"N/A","农业生产资料、农副土特产品、纺织品、百货、食品、副食品、五交化商品、日用杂品、建筑材料、预包装食品、乳制品",辽宁,大连,"辽宁省大连市普兰店区铁西街道花儿山社区"
大连市普兰店区太平供销合作社唐房商店,912102827920446849,1981-09-01,集体分支机构(非法人),N/A,"N/A","农药、化肥、农膜、种子、农机具及配件、农副土特产品、纺织品、百货、粮油、饲料、食品、副食品、五交化商品、日用杂品、建筑材料零售、代购、代销。",辽宁,大连,"辽宁省大连市普兰店区太平街道办事处唐房社区"
大连市普兰店区夹河供销合作社王屯商店,91210282792046591R,1981-09-01,集体分支机构(非法人),N/A,"N/A","化肥、农药、农膜、农机具及配件、农副土特产品、纺织品、百货、饲料、种子。食品、副食品、五交化商品、日用杂品、建筑材料。",辽宁,大连,"辽宁省大连市普兰店区唐家房街道办事处冷家村王屯"
大连市普兰店区夹河供销合作社大于商店,91210282792046655P,1981-09-01,集体分支机构(非法人),N/A,"N/A","农业生产资料、农副土特产品、纺织品、百货食品、副食品、五交化商品、日用杂品、建筑材料、废旧物资零售。",辽宁,大连,"辽宁省大连市普兰店区唐家房街道办事处双岭社区"
大连市普兰店区泡子供销合作社朝阳商店,912102827920458396,1981-09-01,集体分支机构(非法人),N/A,"N/A","农药、化肥、农膜、种子、农机具及配件、农副土特产品、纺织品、百货、粮油、饲料、食品、副食品、五交化商品、日用杂品、建筑材料零售、代购、代销。",辽宁,大连,"辽宁省大连市普兰店区丰荣街道办事处朝阳村"
大连市普兰店区乐甲供销合作社庙岭商店,91210282792046057U,1981-09-01,集体分支机构(非法人),N/A,"N/A","农药、化肥、农膜、种子、农机具及配件、农副土特产品、纺织品、百货、粮油、饲料、烟花爆竹、食品、副食品、五交化商品、日用杂品、建筑材料、烟草制品零售。",辽宁,大连,"辽宁省大连市普兰店区乐甲满族乡庙岭村"
大连市普兰店区夹河供销合作社大张商店,912102827920466205,1981-09-01,集体分支机构(非法人),N/A,"N/A","农业生产资料、农副土特产品、纺织品、百货食品、副食品、五交化商品、日用杂品、建筑材料、废旧物资",辽宁,大连,"辽宁省大连市普兰店区唐家房街道办事处巴家村"
大连市普兰店区墨盘供销合作社王山头商店,91210282792046903D,1981-09-01,集体分支机构(非法人),N/A,"N/A","农药、化肥、农膜、种子、农机具及配件、农副土特产品、纺织品、百货、粮油、饲料、摩托车、食品、副食品、五交化商品、日用杂品、建筑材料、废旧物资零售、代购、代销；预包装食品、乳制品",辽宁,大连,"辽宁省大连市普兰店区墨盘乡王山头村"
大连市普兰店区杨树房供销合作社杨树房商店,912102827920478420,1981-09-01,集体分支机构(非法人),N/A,"N/A","农业生产资料、农副土特产品、纺织品、百货、家具、食品、副食品、五交化商品、日用杂品、建筑材料、废旧物资零售、代购、代销。",辽宁,大连,"辽宁省大连市普兰店区杨树房街道杨树房社区"
普兰店市大谭供销合作社油坊商店,91210282792047279N,1981-09-01,集体分支机构(非法人),N/A,"N/A","农药、化肥、农膜、种子、农机具及配件、农副土特产品、纺织品、百货、粮油、饲料、食品、副食品、五交化商品、日用杂品、建筑材料零售、代购、代销。",辽宁,大连,"辽宁省普兰店市大谭镇油坊村"
大连市普兰店区皮口供销合作社后赵商店,91210282792047623M,1981-09-01,集体分支机构(非法人),N/A,"N/A","农药、化肥、农膜、农机具及配件、农副土特产品、纺织品、百货、饲料、粮油、种子、食品、副食品、五交化商品、日用杂品、建筑材料、废旧物资零售。",辽宁,大连,"辽宁省大连市普兰店区皮口街道大尹村"
大连市普兰店区星台供销合作社张屯商店,9121028279204801XA,1981-09-01,集体分支机构(非法人),N/A,"N/A","农药、农膜、化肥、种子、农机具及配件、农副土特产品、纺织品、百货、粮油、饲料、食品、副食品、五交化商品、日用杂品、建筑材料零售。",辽宁,大连,"辽宁省大连市普兰店区星台镇张屯村"
大连市普兰店区安波地区供销合作社,9121028211872969XY,1981-09-01,集体所有制,N/A,"237万人民币","农业生产资料、农副土特产品、纺织品、百货、食品、副食品、五交化商品、日用杂品、图书、建筑材料、废旧物资零售兼批发、代购、代销；预包装食品、烟草制品、家用电器、文化用品、烟花爆竹、不再分装的包装种子、农药",辽宁,大连,"辽宁省大连市普兰店区安波镇安波社区"
大连市普兰店区泡子供销合作社马沟商店,91210282792045871H,1981-09-01,集体分支机构(非法人),N/A,"N/A","农药、化肥、农膜、种子、农机具及配件、农副土特产品、纺织品、百货、粮油、饲料、食品、副食品、五交化商品、日用杂品、建筑材料零售、代购、代销；预包装食品、乳制品",辽宁,大连,"辽宁省大连市普兰店区丰荣街道办事处马沟村"
大连市普兰店区农业生产资料公司皮口供应站,91210282118726034K,1981-09-01,N/A,N/A,"14(万元人民币)","农业生产资料",辽宁,大连,"辽宁省大连市普兰店区皮口街道建设社区"
大连市普兰店区双塔供销合作社卢店商店,912102827920477114,1981-09-01,集体分支机构(非法人),N/A,"N/A","农业生产资料、农副土特产品、纺织品、百货、食品、副食品、五交化商品、日用杂品、建筑材料、废旧物资零售、代购、代销。",辽宁,大连,"辽宁省大连市普兰店区双塔镇双塔村"
大连市普兰店区四平供销合作社四平商店,91210282792047148T,1981-09-01,集体分支机构(非法人),N/A,"N/A","农药、化肥、农膜、种子、农机具及配件、农副土特产品、纺织品、百货、粮油、饲料、食品、副食品、五交化商品、日用杂品、建筑材料零售兼批发。",辽宁,大连,"辽宁省大连市普兰店区四平镇四平村"
大连市普兰店区夹河供销合作社老虎峪商店,91210282792046495G,1981-09-01,集体分支机构(非法人),N/A,"N/A","农业生产资料、农副土特产品、纺织品、百货食品、副食品、五交化商品、日用杂品、建筑材料、废旧物资零售。",辽宁,大连,"辽宁省大连市普兰店区唐家房街道办事处老虎峪村"
大连市普兰店区安波地区供销合作社得胜商店,91210282792045708A,1981-09-01,集体分支机构(非法人),N/A,"N/A","农药、化肥、农膜、种子、农机具及配件、农副土特产品、纺织品、百货、粮油、饲料、烟花爆竹、食品、副食品、五交化商品、日用杂品、建筑材料、烟草制品零售。",辽宁,大连,"辽宁省大连市普兰店区安波镇得胜村"
大连市普兰店区双塔供销合作社栗寺商店,91210282792047463E,1981-09-01,集体分支机构(非法人),N/A,"N/A","农业生产资料、农副土特产品、纺织品、百货、食品、副食品、五交化商品、日用杂品、建筑材料、废旧物资零售、代购、代销。",辽宁,大连,"辽宁省大连市普兰店区双塔镇栗寺村"
朝阳市新华书店有限责任公司,91211300464903021M,1981-09-03,N/A,N/A,"225(万元人民币)","国内版图书、报纸、期刊批发兼零售；音像制品零售；贝美嘉儿童乐园；电影放映，7D影院游戏厅；电子产品、文化用品、计算机及其配件、工艺美术品；房屋、柜台租赁；互联网信息服务。",辽宁,朝阳,"朝阳市双塔区朝阳大街三段5号"
朝阳燕都国际酒店有限责任公司,91211302464900066G,1981-09-03,N/A,N/A,"1,000(万元人民币)","住宿、洗浴、KTV歌厅、美容美发、茶馆服务；中餐类制售；卷烟、雪茄烟零售；航空客运机票代售；日用百货、服装、工艺美术品零售；鲜花礼仪服务；房屋租赁",辽宁,朝阳,"朝阳市双塔区新华路二段77号"
丹东市森亚劳动防护用品有限公司,912106031200825145,1981-09-07,N/A,N/A,"50(万元人民币)","批发、零售：劳动保护用品、针纺织品、服装鞋帽、日用百货、日用化学品、文化体育用品、家用电器、电工器材、建筑五金、水暖器材、日用杂品",辽宁,丹东,"振兴区五经街４号"
瓦房店市元台供销合作社田家商店,912102817920464877,1981-09-10,集体分支机构(非法人),N/A,"N/A","农药",辽宁,大连,"辽宁省普兰店市元台镇田家村"
大连市普兰店区安波地区供销合作社商场,91210282796900142N,1981-09-10,集体分支机构(非法人),N/A,"N/A","种子、饲料、粮油、百货、纺织品、五交化商品、日用杂品、预包装食品、水果、烟草制品、文化用品、图书、服装、鞋帽、化妆品、家用电器、电子产品零售。",辽宁,大连,"辽宁省大连市普兰店区安波镇安波社区"
大连市普兰店区安波地区供销合作社宫家商店,912102827969056992,1981-09-10,集体分支机构(非法人),N/A,"N/A","农业生产资料、农副土特产品、纺织品、百货、食品、副食品、五交化商品、日用杂品、建筑材料、废旧物资、烟花爆竹、烟草制品、不再分装的包装种子零售。",辽宁,大连,"辽宁省大连市普兰店区安波镇宫家村"
大连市普兰店区安波地区供销合作社鸡冠商店,91210282792045687R,1981-09-10,集体分支机构(非法人),N/A,"N/A","农业生产资料、农副土特产品、纺织品、百货、食品、副食品、五交化商品、日用杂品、建筑材料、废旧物资零售、代购、代销；不再分装的包装种子、烟草制品、烟花爆竹零售。",辽宁,大连,"辽宁省大连市普兰店区安波镇鸡冠村"
大连船舶明珠酒店有限公司,91210202118421943W,1981-09-10,N/A,N/A,"100(万元人民币)","住宿、中、西餐；写字间出租、打字、复印、传真、保洁服务、会议接待服务；室内外装饰装修（凭资质证经营）；物业管理（凭资质证经营）；预包装食品、服装鞋帽、日用百货、工艺美术品销售（依法须经批准的项目，经相关部门批准方可开展经营活动）",辽宁,大连,"辽宁省大连市中山区竹青街１６号"
大连盛程建筑工程有限公司,912102132413068013,1981-09-10,N/A,N/A,"2,006(万元人民币)","二级土木工程建筑，钢结构安装,室内装饰",辽宁,大连,"辽宁省大连经济技术开发区董家沟"
锦州顺邦生产资料服务有限公司,91210700120556177A,1981-09-11,N/A,N/A,"66(万元人民币)","建筑材料、汽车（除小轿车）、汽车零部件、电器机械及器材、化工原料及产品",辽宁,锦州,"上海路三段４５号"
锦州顺信化工轻工有限公司,91210700120527640X,1981-09-11,N/A,N/A,"512(万元人民币)","化工原料及产品（除危险品）、五金、低压电器及元件、建筑材料、机电产品（除汽车）、金属材料",辽宁,锦州,"辽宁省锦州市凌河区解放路四段1号"
第三冶金建设公司冷饮厂,91210300241445369A,1981-09-17,N/A,N/A,"17(万元人民币)","冰果、雪糕、冰淇淋、果酱、酱菜、饮料、汽车货运、劳务。",辽宁,鞍山,"鞍山市立山区友好街"
锦州市太和区食品公司,912107111208173144,1981-09-25,N/A,N/A,"48(万元人民币)","鲜冻畜产品。蛋，禽蛋，禽",辽宁,锦州,"太和区凌西里１４７号"
大连葵英塑料厂,912102021184287900,1981-10-01,股份合作制,N/A,"43.1万人民币","塑料制品橡胶制品、钣金、机械铆焊加工、机电设备（不含小轿车）、粉末冶金、摩擦片",辽宁,大连,"辽宁省大连市中山区福庆巷５号"
宽甸满族自治县红石砬子供销合作社,91210624120476089C,1981-10-01,集体所有制,N/A,"65万人民币","百货、日杂(不含烟花爆竹)、针纺织品、服装、鞋帽、五金交电、化肥、干鲜果品、水产品零售；农产品收购。",辽宁,丹东,"红石镇红石砬子村"
大连长虹酒店有限公司,91210211241287268J,1981-10-01,N/A,N/A,"40(万元人民币)","住宿、中餐、卡拉OK；烟、酒、饮料零售；客房出租",辽宁,大连,"辽宁省大连市甘井子区华北路甘段27号"
大连交通运输集团汽车修配厂,9121021124304741X2,1981-10-01,N/A,N/A,"82(万元人民币)","一级机动车辆修配机械加工、汽车配件销售",辽宁,大连,"辽宁省大连市甘井子区东纬路24号"
大连华盛实业总公司,91210204422411379L,1981-10-01,N/A,N/A,"32.6000(万元人民币)","为下属企业产供销服务空白",辽宁,大连,"辽宁省大连市沙河口区春一街2号"
大连风顺商贸有限公司,912102131186860795,1981-10-06,有限责任公司,N/A,"80万人民币","化肥、农药、农膜、日用百货、机油、针纺织品、五金交电、化工商品、日用杂品、汽车配件、建筑材料、金属材料、土畜产品、蔬菜、水果销售，零售预包装食品，废旧物资收购；房屋出租。(依法需批准的经营项目，须相关部门批准后，方可进行经营活动)*",辽宁,大连,"辽宁省大连经济技术开发区51号小区"
大连亿联商贸有限公司,91210213118686394Q,1981-10-06,有限责任公司,N/A,"220万人民币","化肥、农药",辽宁,大连,"辽宁省大连市金州区华家屯镇华家村"
大连石河商贸有限公司收购站,91210246777274617E,1981-10-06,有限责任公司,N/A,"N/A","收购生产性、废旧金属(含有色)、民用生活废旧物资收购；建筑材料销售。",辽宁,大连,"辽宁省大连普湾新区石河街道石河村"
大连盛德利商贸有限公司马家分公司,912102131186872230,1981-10-06,有限责任公司,N/A,"N/A","农业生产资料销售；废旧物资销售；房屋租赁",辽宁,大连,"辽宁省大连市金州区站前街道马家村２３８号"
瓦房店市得利寺供销合作社,912102817021188471,1981-10-06,集体所有制,N/A,"107万人民币","百货、针纺织品、日用杂品*农业生产资料、五金交电商品(含彩电零售)、建筑材料、木材(只限零售)、煤炭、代销农作物种子*",辽宁,大连,"辽宁省瓦房店市得利寺镇得利寺村"
大连普湾新区复州湾供销合作社,912102461236251315,1981-10-07,集体所有制,N/A,"139万人民币","农业生产资料（不含专项审批及危险化学品）零售；代销农作物种子；烟草、酒类、食品的零售（限分支机构经营）；日用百货、日用杂品、办公用品、建筑材料",辽宁,大连,"辽宁省大连普湾新区复州湾镇"
瓦房店市许屯供销合作社,912102817021126050,1981-10-07,集体所有制,N/A,"161万人民币","针纺织品、日用百货*五金交电商品、日用杂品、农业生产资料、书刊、玻璃、油漆*",辽宁,大连,"辽宁省瓦房店市许屯镇许屯街"
中国工商银行股份有限公司大连星海公园支行,912102047288604687,1981-10-10,N/A,N/A,"N/A","办理人民币存款、贷款、结算业务；办理票据贴现；代理发行、兑付、销售政府债券；买卖政府债券；代理保险业务；外汇存款；外汇汇款；外汇兑换；国际结算；通过上级行办理代客外汇买卖业务；经中国银行业监督管理委员会批准的其他业务",辽宁,大连,"辽宁省大连市沙河口区中山路537号"
大连皮口燃料有限公司,9121028211871130X3,1981-10-10,N/A,N/A,"50(万元人民币)","煤炭、焦炭、化工产品",辽宁,大连,"辽宁省大连市普兰店区皮口街道建设街"
宽甸满族自治县土产物资回收公司,912106241204721680,1981-10-11,N/A,N/A,"62(万元人民币)","农副土特产品，林副产品，草编织品，条材建筑材料，五金交电，日用百货，文化娱乐用品，化工产品",辽宁,丹东,"新开路南段"
凤城市中昊农副产品加工厂,91210682564631908L,1981-10-12,N/A,N/A,"150(万元人民币)","农副土特产品收购。",辽宁,丹东,"凤城市红旗镇永兴村七组"
建昌县养马甸子供销社,91211422MA0XYYAA04,1981-10-14,N/A,N/A,"58万","百货(不含入口食品)、日杂、化肥、农膜零售;市场服务、物业管理、摊床租赁(露天经营、法律法规允许的范围内经营)。(依法须经批准的项目,经相关部门批准后方可开展经营活动。)",辽宁,葫芦岛,"建昌县养马甸子本街"
建昌县医药有限责任公司要路沟大药房,91211422MA0QCQ3061,1981-10-15,N/A,N/A,"N/A","中成药、化学制剂、抗生素零售、生化药品（药品经营许可证有效期限至2020年09月06日止）；保健食品（保健食品经营企业卫生许可证有效期限至2018年12月24日）.",辽宁,葫芦岛,"建昌县要路沟本乡要路沟新楼3号"
大连普湾新区炮台供销合作社柏岚商店,91210246MA0UL8G88D,1981-10-15,集体分支机构(非法人),N/A,"N/A","食品、副食品(不含食盐)、针纺织品、服装、鞋帽、五金商品、电工器材、油漆",辽宁,大连,"辽宁省大连普湾新区炮台镇柏岚村"
大连普湾新区炮台供销合作社收购站,91210246MA0UL8GF5B,1981-10-15,集体分支机构(非法人),N/A,"N/A","废品收购(不含生产性废旧金属)；农副土特产品收购。",辽宁,大连,"辽宁省大连普湾新区炮台镇三家子"
大连普湾新区炮台供销合作社松木岛商店,91210246MA0UM5H81F,1981-10-15,集体分支机构(非法人),N/A,"N/A","食品、副食品(不含食盐)、日用百货、针纺织品、服装鞋帽、五金交电商品、油漆、日用杂品、小农具；卷烟、雪茄烟的批发兼零售。",辽宁,大连,"辽宁省大连普湾新区炮台镇松木岛村"
大连普湾新区复州湾供销合作社东风商店,91210246674078322Q,1981-10-15,集体分支机构(非法人),N/A,"N/A","百货、针纺织品、食品、副食品(不含食盐)、农作物种子；卷烟、雪茄烟的零售（凭许可证经营）*建筑五金、油漆、日用杂品、中小农具、化肥、农药（不含危险化学品）、农膜*",辽宁,大连,"辽宁省大连普湾新区复州湾镇东风村"
大连铁路分局瓦房店站服务公司,91210281123610941D,1981-10-15,N/A,N/A,"33.9000(万元人民币)","包装、代运；为下属企业产、供、销服务；货物保管装卸；房屋农租；柜台出租；卷烟、雪茄烟的零售（凭许可证经营）；为下属企业产、供、销服务；货物保管装卸；房屋农租；柜台出租；卷烟、雪茄烟的零售（凭许可证经营；依法须经批准的项目，经相关部门批准后方可开展经营活动）",辽宁,大连,"辽宁省瓦房店市火车站"
大连普湾新区邓屯供销合作社旱泡商店,91210246MA0UM5HF9F,1981-10-15,集体分支机构(非法人),N/A,"N/A","百货、针纺织品、食品、副食品(不含食盐)；卷烟、雪茄烟的零售（凭烟草许可证经营）；日用杂品、建筑五金、电工器材、中小农具、化肥、农药",辽宁,大连,"辽宁省大连普湾新区炮台镇旱泡村"
大连普湾新区炮台供销合作社大冯商店,91210246MA0UM5HJ1R,1981-10-15,集体分支机构(非法人),N/A,"N/A","食品、副食品(不含食盐)、日用百货、针纺织品、服装鞋帽、五金商品、电工器材、日用杂品、油漆",辽宁,大连,"辽宁省大连普湾新区炮台镇大冯村"
大连普湾新区炮台供销合作社申炉商店,91210246MA0UL8GD9M,1981-10-15,集体分支机构(非法人),N/A,"N/A","食品、副食品(不含食盐)、针纺织品、日用百货*服装、鞋帽、五金商品、电工器材、日用杂品、油漆、小农具；卷烟、雪茄烟的零售*",辽宁,大连,"辽宁省大连普湾新区炮台镇申炉村"
大连普湾新区炮台供销合作社桥东商店,91210246MA0UL8GA43,1981-10-15,集体分支机构(非法人),N/A,"N/A","食品、副食品(不含食盐)、日用百货、针纺织品、服装鞋帽、五金商品、电工器材、油漆",辽宁,大连,"辽宁省大连普湾新区炮台镇桥东村"
建昌县医药有限责任公司建昌大药房,912114227654083318,1981-10-15,N/A,N/A,"N/A","中成药、中药饮片、化学药制剂、抗生素、生化药品、生物制品",辽宁,葫芦岛,"建昌县建昌镇红旗街二段30号楼门市2号"
大连普湾新区炮台供销合作社陈屯商店,91210246MA0UKX2X6D,1981-10-15,集体分支机构(非法人),N/A,"N/A","百货、针纺织品、食品、副食品、图书、中西成药、日用杂品、农业生产资料、农副土特产品、五金商品、日用电器、民用建材批发兼零售；卷烟、雪茄烟、烟花爆竹零售。",辽宁,大连,"辽宁省大连普湾新区炮台镇陈屯村"
大连普湾新区邓屯供销合作社高家商店,91210246MA0UM5H73L,1981-10-15,集体分支机构(非法人),N/A,"N/A","百货、针纺织品、食品、副食品(不含食盐)、卷烟、雪茄烟的零售（凭烟草许可证经营）、日用杂品、建筑五金、电工器材、中小农具、化肥、农药",辽宁,大连,"辽宁省大连普湾新区炮台镇高家村"
北票宾馆有限公司,91211381465050075H,1981-10-19,N/A,N/A,"358.9000(万元人民币)","住宿、饮食服务；农副产品收购。",辽宁,朝阳,"北票市南山街东段２１号"
新宾满族自治县农业生产资料公司,91210422119564196L,1981-10-24,N/A,N/A,"174(万元人民币)","毒害品（仅限农药）零售；化学肥料、农膜、中小农具、农药施肥机械及用具、农机具配件、日用杂品销售；房屋租赁",辽宁,抚顺,"新宾满族自治县新宾镇和平街"
凤城市赛马供销合作社百货门市部,91210682MA0QEHR480,1981-10-26,集体分支机构(非法人),N/A,"N/A","日用化学品、服装鞋帽、针纺织品、建筑五金、文化用品、日用杂品零售。",辽宁,丹东,"凤城市赛马镇赛马街"
盘锦市兴隆台区东盛商贸有限公司,91211100122560727D,1981-10-27,N/A,N/A,"21(万元人民币)","百货、针织、五金交电、化工产品",辽宁,盘锦,"盘锦市兴隆台区友谊街"
盘锦市兴隆台区欢采商贸有限公司,9121110012256359X3,1981-10-28,N/A,N/A,"66(万元人民币)","针纺织品、服装、鞋帽、文化体育用品、日用百货、电脑耗材、五金交电、化工产品（除易燃易爆化学危险品）、家用电器、电工电料、电动工具、水暖配件、消防器具、二类以下机电产品、民用建材、日用杂品",辽宁,盘锦,"盘锦市兴隆台区欢喜街"
沈阳市黄河皮鞋厂,91210105117938107Y,1981-10-29,集体所有制,N/A,"61万人民币","皮鞋，装饰材料，服装加工，木器制作加工、建筑材料、五金交电、水暖器材、铝合金制品加工皮革制品，家具，木制品，纸盒",辽宁,沈阳,"沈阳市皇姑区嘉陵江街六十五号"
中国石油天然气股份有限公司辽宁大连销售分公司东獐加油站,912102247288662295,1981-10-30,N/A,N/A,"N/A","经销本公司生产的石油、成品油、石油化工产品；定型包装食品、饮料、烟、渔需用具、日用百货零售",辽宁,大连,"辽宁省长海县獐子岛镇东獐村"
大连长海水产集团公司制品二厂,91210224MA0URN661W,1981-10-30,国有企业,N/A,"157万人民币","水产品*制冰、公路货运、海上货运、煤炭销售*",辽宁,大连,"辽宁省长海县獐子岛镇东獐村"
