企业名称,统一社会信用代码,注册日期,企业类型,法人代表,注册资金,经营范围,所在省份,地区,注册地址
宽甸满族自治县虎山供销合作社,912106241204760977,1981-01-01,集体所有制,N/A,"80万人民币","百货，日杂，针纺织品，服装鞋帽，五金交电化工，农业生产资料农副土特产品(国家法律法规禁止或限制产品除外)",辽宁,丹东,"虎山镇红石村"
中国石油天然气股份有限公司辽宁大连销售分公司长岭加油站,912102446799934904,1981-01-01,N/A,N/A,"N/A","经销成品油、石油化工产品、加油机零配件及维修。预包装食品、日用百货、汽车零配件销售；卷烟、雪茄烟的零售",辽宁,大连,"辽宁省大连长兴岛经济区长岭村"
建昌县供销社联营公司,91211422123510860C,1981-01-01,国有企业,N/A,"62万人民币","百货、针纺织品、文化用品、日杂、服装、机电产品",辽宁,葫芦岛,"建昌县建昌镇朝阳路二段２１号"
建平县北二十家子供销合作社,91211322MA0QFXTP12,1981-01-01,集体所有制,N/A,"69万人民币","自有资产经营管理。",辽宁,朝阳,"辽宁省朝阳市建平县北二十家子镇本街"
瓦房店市杨家供销合作社,91210281702110693L,1981-01-01,集体所有制,N/A,"99万人民币","百货、针纺织品、种子代销*日用杂品（不含烟花爆竹）、农副产品、农业生产资料、民用建材*",辽宁,大连,"辽宁省瓦房店市杨家乡杨家村"
沈阳市苏家屯区副食品加工厂,91210111118016374Y,1981-01-01,N/A,N/A,"345(万元人民币)","许可经营项目：无 一般经营项目：处理内部事务。",辽宁,沈阳,"沈阳市苏家屯区枫杨路123巷14号"
大连东北交通物资有限公司,9121020224236275X3,1981-01-01,N/A,N/A,"200(万元人民币)","金属材料、煤炭、木材、机电产品、汽车（不含小轿车）、化工原料经销；经济信息咨询及技术服务＊＊＊",辽宁,大连,"辽宁省大连市中山区七七街64号A区11号108室"
中车大连机车车辆有限公司,91210200241283929E,1981-01-01,N/A,N/A,"418,000(万元人民币)","机车车辆、城市轨道车辆及配件研发、设计、制造、修理、销售及相关技术咨询服务，柴油机制造、销售，起重机械设备安装、维修、铸造、锻造、热处理、机械铆焊加工、气体制造，本企业“三来一补”及自营进出口业务（限定商品之内）；承包境外铁道及相关行业工程和境内国际招标工程及其相关业务；钢结构工程施工、安装（凭资质证经营）；普通货运，危险货物运输（2类），危险货物运输（3类），普通货运",辽宁,大连,"辽宁省大连市沙河口区中长街51号"
丹东水丰湖航运有限公司,91210624120468396U,1981-01-01,N/A,N/A,"10(万元人民币)","水路旅客运输，水路货物运输，港口装卸，旅游咨询服务",辽宁,丹东,"长甸镇碑碣村三组"
瓦房店市东岗供销合作社,91210281702110749P,1981-01-01,集体所有制,N/A,"117万人民币","销售百货、针纺织品、日用杂品（不含烟花爆竹）、农副土特产品、农业生产资料（不含危险化学品）、建筑材料；烟草零售（凭许可证经营）*",辽宁,大连,"辽宁省瓦房店市红沿河镇红沿河村"
宽甸满族自治县杨木川供销社,912106241204664976,1981-01-01,集体所有制,N/A,"58万人民币","百货，日杂，服装鞋帽，针纺织品，五金交电化工（不含剧毒，易燃易爆危险品）农业生产资料，房屋租赁农副土特产品收购农副土特产品收购",辽宁,丹东,"杨木川乡杨木川村"
兴城市天宠建筑安装工程公司,91211481123790620E,1981-01-01,N/A,N/A,"1,041(万元人民币)","土木建筑安装、装饰、装修；土石方工程；建筑机械安拆；房屋拆除工程；市政公用工程施工；建筑材料销售。",辽宁,葫芦岛,"羊安乡址"
建昌县八家子劳动服务公司,91211400725500061Y,1981-01-01,集体所有制,N/A,"52万人民币","白灰、铁球、服装。空白。空白。",辽宁,葫芦岛,"建昌县八家子镇"
抚顺华丰建筑安装工程公司,91210400119300908J,1981-01-07,N/A,N/A,"719.2000(万元人民币)","房屋建筑、设备安装",辽宁,抚顺,"抚顺市东洲区平山街４号"
抚顺市第二建筑工程公司,91210400119300481Q,1981-01-07,N/A,N/A,"3,283(万元人民币)","砌筑、木工、钢筋、焊接、模板、抹灰、油漆、水暖电安装、混凝土、脚手架作业分包；房屋租赁。",辽宁,抚顺,"抚顺市顺城区新华街２２号"
抚顺电力建筑安装工程公司,91210400119302196N,1981-01-07,N/A,N/A,"2,073.9000(万元人民币)","蒸汽热供应、电力工程、管道工程施工、设备、厂房拆除、室内外装饰、装修。机械配件",辽宁,抚顺,"抚顺市新抚区解放路一号"
沈阳市兴顺橡胶制品厂,91210106117981690H,1981-01-09,集体所有制,N/A,"49万人民币","深水泵胶衬套、各种密封圈、水泵部件制造，加工。",辽宁,沈阳,"铁西区大业路20号7门"
沈阳铁路通信信号公司抚顺分公司,91210400119302487R,1981-01-09,N/A,N/A,"10.3000(万元人民币)","铁路通信信号工程、铁路线路大中工程维修，铁路钢轨无损探伤检测。",辽宁,抚顺,"抚顺城火车站东侧"
兴城市东辛庄供销合作社,912114811237699950,1981-01-14,集体所有制,N/A,"58万人民币","化肥、农膜、农用工具、日用杂货（不含烟花爆竹）、五金、自行车零售；农药零售",辽宁,葫芦岛,"东辛庄镇"
兴城市农业生产资料总公司,91211481730829013M,1981-01-14,N/A,N/A,"520(万元人民币)","农药（仅限）零售",辽宁,葫芦岛,"兴城市宁远街道铁西街18号楼E室"
兴城市汽车客运总公司,9121148112376166XC,1981-01-16,N/A,N/A,"1,600(万元人民币)","道路旅客运输：县内班车客运；县际班车客运；市际班车客运；省际班车客运；县内包车客运；县际包车客运；市际包车客运；省际包车客运；车用燃气充装。",辽宁,葫芦岛,"站前路388号"
凤城市鑫大物业管理公司,91210682463761201F,1981-01-17,集体所有制,N/A,"60万人民币","建筑材料，计划外钢材批发零售；供销联社系统内物业管理，系统内房地产管理；房屋维修，金属焊接。",辽宁,丹东,"凤城市凤凰大街４９号"
新民市第一运输公司,91210181118211209Y,1981-01-17,N/A,N/A,"225(万元人民币)","普通货物运输、汽车修理",辽宁,沈阳,"新民市新柳街铁北社区"
沈阳铁路通信信号公司工程队,91210105117910155L,1981-01-20,N/A,N/A,"310(万元人民币)","通信信号工程、电力工程、土建工程施工，建筑劳务外包，铁路设备维修。",辽宁,沈阳,"沈阳市皇姑区阿里山路九号"
抚顺市第一粮油工业储运有限公司,91210400119316563M,1981-01-20,N/A,N/A,"626(万元人民币)","原粮收购、储存、销售；场地、库房出租、装卸服务。",辽宁,抚顺,"辽宁省抚顺市新抚区粮栈街"
庄河市木器厂有限公司,91210283118811183G,1981-01-20,N/A,N/A,"2,000(万元人民币)","对外合资合作。",辽宁,大连,"辽宁省庄河市昌盛街道市场村"
辽宁省工业安装工程公司,912101021177623591,1981-01-20,N/A,N/A,"5,764(万元人民币)","工业安装（一级）；建筑",辽宁,沈阳,"和平区宁波路39号"
盖州市万福供销合作社联营综合商店,91210881MA0TWYED60,1981-01-23,集体分支机构(非法人),N/A,"N/A","农业生产资料,定点经营杀鼠剂（经营期限至2005年12月31日）、代销蔬菜种子、主要农作物种子（经营期限至2006年10月15日）百货，针纺织品，日用杂品，烟酒食品，五金交电",辽宁,营口,"万福镇万福街"
沈阳市第一建筑工程有限公司,9121010211767851XN,1981-01-24,N/A,N/A,"3,314.3000(万元人民币)","土木工程建筑（一级）",辽宁,沈阳,"沈阳市和平区文化路57号"
抚顺市顺城区高湾供销合作社,91210400119472523M,1981-01-25,集体所有制,N/A,"32.2万人民币","综合性百货农用生产资料、农副土特产品、民用建材、图书",辽宁,抚顺,"高湾农场高阳村"
抚顺矿务局火工设备制造厂,91210403119362623C,1981-01-28,集体所有制,N/A,"9.8万人民币","火工机械设备、火工电器、仪表、仪器工具、模器配件、气动隔膜泵制造，火工设备维修，厂内劳务承包。",辽宁,抚顺,"抚顺市东洲区平山街"
锦州市化纤机械配件厂,912107001205391079,1981-02-20,集体所有制,N/A,"38.6万人民币","化纤机械配件减速机，水电焊，机加工。",辽宁,锦州,"古塔区乐安里７０号"
锦州市燃气总公司,91210700120535560K,1981-02-20,N/A,N/A,"6,900(万元人民币)","燃气生产和供应。燃气表检定；燃气设施改装；燃气具检测；燃气供暖。燃气表检定；燃气设施改装；燃气具检测；燃气供暖。",辽宁,锦州,"凌河区解放东路旭东花苑１号"
锦州水务(集团)有限公司,91210700120536969D,1981-02-20,N/A,N/A,"50,000(万元人民币)","城市供水的管理、运营和服务；水利基础设施开发建设；供水、水利水电的勘察设计、咨询服务；给水管线施工改造、大修和维修；水表检定；水利水电科研、工程监理、运营、管理；污水处理的管理、运营和服务；中水开发利用；水利工程建设；水资源开发利用；水力发电；水库建设、经营、管理；水产养殖；旅游管理服务。",辽宁,锦州,"凌河区上海路四段16号"
锦州长兴铁路电务配件厂,9121070012052364XT,1981-02-20,集体所有制,N/A,"100万人民币","铁路信号设备、铁路线路器材及配件加工。绝缘材料、标准件加工。",辽宁,锦州,"凌河区延安路五段４号"
岫岩满族自治县五金机械二厂,91210322120370161W,1981-02-24,集体所有制,N/A,"65万人民币","平口钳、桌虎钳、台虎钳生产、加工。",辽宁,鞍山,"辽宁省鞍山市岫岩满族自治县新甸镇大山村（农村信用社对过）"
鞍山格瑞环境工程有限公司,912103041190107594,1981-02-26,N/A,N/A,"2,000(万元人民币)","环境工程设计与施工；工业污水处理、生活污水处理工程设计、施工、安装及运营；危固物垃圾无害化处理、医疗垃圾处理、生活垃圾处理及发电、环保、冶金、矿山、机电设备设计、制作、安装、调试；机械加工、铆焊加工、环保成套设备、水处理成套设备、冶金设备、自动化成套控制系统、耐火材料设备、工矿设备、化工设备、磁分离系列产品、机电设备、钢材、二类以下机电产品、耐火材料、冶金炉料、化工产品",辽宁,鞍山,"鞍山市立山区强工路455号"
中国工商银行股份有限公司鞍山九街口支行,91210300941313180C,1981-03-01,N/A,N/A,"N/A","经营范围以中国银行业监督管理委员会依照有关法律、行政法规和其他规定批准的文件中所列经营范围为准。",辽宁,鞍山,"鞍山市铁西区南九道街470号"
丹东市振兴物资回收有限公司电灯房收购站,91210603MA0UPNQJ4G,1981-03-01,N/A,N/A,"N/A","回收、销售:废旧物资。(依法须经批准的项目,经相关部门批准后方可开展经营活动。)",辽宁,丹东,"辽宁省丹东市振兴区人民路48号(金笔厂院内)"
沈阳市铁西金属制品厂,912101061179818268,1981-03-06,个人独资企业,N/A,"N/A","铁皮卷柜、金属结构件加工。",辽宁,沈阳,"沈阳市铁西区重工北街31号"
沈阳市六0一工业工程服务公司招待所,9121010511794091XF,1981-03-09,N/A,N/A,"14.2600(万元人民币)","住宿、房产租赁。日用小百货零售。",辽宁,沈阳,"沈阳市皇姑区塔湾街40号"
盖州市杨运供销合作社联营商店,91210881MA0UG3FG6B,1981-03-13,集体分支机构(非法人),N/A,"N/A","食品，饮料，烟草付食品，日用百货，日用杂品，针纺织品",辽宁,营口,"盖州市杨运镇六道河村10号"
新宾满族自治县电影公司,91210422463461292W,1981-03-14,N/A,N/A,"26.2000(万元人民币)","影片租赁，电影器材销售",辽宁,抚顺,"新宾满族自治县新宾镇胜利街"
中央储备粮葫芦岛直属库有限公司,91211481123767244H,1981-03-16,N/A,N/A,"2,412(万元人民币)","中央储备粮、油的收购",辽宁,葫芦岛,"辽宁省葫芦岛市兴城市古城街道兴建街22-3号"
抚顺市土产日杂公司抚顺城土产日杂商店,9121040011931113X8,1981-03-17,N/A,N/A,"13(万元人民币)","日用杂品、麻、搪瓷制品、塑料制品、日用玻璃制品、建筑五金、五金工具、胶合板、民用建材、钢材批发零售，电焊条、标准件、橡胶制品（除轮胎）、土产品、日用百货、日用电器",辽宁,抚顺,"抚顺市顺城区南关街"
辽阳市太子河区沙岭供销社,91211011122322155B,1981-03-17,集体所有制,N/A,"39万人民币","零售：农药",辽宁,辽阳,"辽阳市太子河区沙岭镇本街"
锦州市纺织品联营公司,91210700120535667Y,1981-03-18,N/A,N/A,"50(万元人民币)","针纺织品，服装鞋帽。日用百货",辽宁,锦州,"古塔区解放路三段３３号"
辽阳县隆昌供销合作社,91211021122320344K,1981-03-19,集体所有制,N/A,"27万人民币","针纺品，五金，文具，花纱，建材，服装，鞋帽，农药（只限分支机构经营），化肥零售；中草药收购（不含法律、法规禁止及许可经营项目）。小农工具，农副产品",辽宁,辽阳,"隆昌镇本街"
开原市玻璃钢制品厂,91211282122918784M,1981-03-25,集体所有制,N/A,"39万人民币","玻璃钢制品",辽宁,铁岭,"开原市长征街１０３号"
喀左县果品食杂公司,912113241235000801,1981-03-25,N/A,N/A,"49(万元人民币)","农产品、农副产品收购",辽宁,朝阳,"喀左县大城子镇民族街"
锦州华光电力电子(集团)公司(第一名称)国营七七七总厂(第二名称),91210700120556441M,1981-03-28,N/A,N/A,"3,493(万元人民币)","电真空器件，经营本企业及所属企业自产产品及相关技术的出口业务；经营本企业及所属企业生产科研所需的原辅材料、机械设备、仪器仪表、及相关技术进口业务",辽宁,锦州,"古塔区重庆路二段2号"
盖州市恒兴搪瓷设备有限公司,91210881121465920G,1981-03-28,N/A,N/A,"585.2000(万元人民币)","搪瓷反应罐、搪瓷储罐、搪瓷容器、搪瓷机械配件、不锈钢容器、碳钢容器、换热器制造、销售。",辽宁,营口,"盖州市梁屯镇梁屯村25号"
辽宁工业大学实业总公司印刷厂,91210700820548741W,1981-03-28,N/A,N/A,"N/A","其他印刷品印刷。打字、复印.",辽宁,锦州,"古塔区士英街169号"
鞍山市千山区旧堡供销合作社,91210311119111031F,1981-03-30,集体所有制,N/A,"200万人民币","百货、纺织品、五金交电、副食、农业生产资料、食品、烟酒、白糖、民用建材、日杂、涂料、粮油、钢材、木材、煤炭销售；农副产品收购。",辽宁,鞍山,"鞍山市千山区东鞍山镇旧堡街"
新民市农业机械局供销公司,91210181118211487C,1981-04-04,N/A,N/A,"50(万元人民币)","一般项目：供应本系统原材料，　钢材（不含四种钢材），　销售本系统企业产品房屋出租",辽宁,沈阳,"新民市城区东城街东升社区"
锦州顺达食品有限公司,912107001205256967,1981-04-06,N/A,N/A,"190(万元人民币)","食品销售。",辽宁,锦州,"凌河区铁南街民和里２６号"
大连市广播电视器材公司旅顺营业部,91210212818622789K,1981-04-06,N/A,N/A,"15(万元人民币)","五金交电化工商品、通讯器材(以上均不含专项审批).涂料、百货、仪器、仪表、建筑材料、金属材料、水暖配件,空白录像带、空白录音带;电器修理.",辽宁,大连,"辽宁省大连市旅顺口区菜市街"
沈阳航天机械工业总公司,91210105117919053R,1981-04-07,N/A,N/A,"500(万元人民币)","金属结构件，机械零部件、非标准设备、环保设备制造，电气元件、铆焊加工销售所属企业产品",辽宁,沈阳,"皇姑区牡丹江街11号"
锦州市保护电器设备厂,91210700120576848H,1981-04-17,集体所有制,N/A,"8万人民币","低压电器及元件制造机械，铆焊加工，仪器仪表",辽宁,锦州,"太和区雨露街１９号"
沈阳矿山机器厂机电设备分厂,91210104117860549C,1981-04-18,集体所有制,N/A,"155万人民币","矿山设备，矿山机械配件，硫化机，低压电器开关柜，机械加工，充退磁机制造，修理。",辽宁,沈阳,"大东区观泉路铸玻巷10号"
沈阳秋林友谊食品有限公司,91210102117788532F,1981-04-18,N/A,N/A,"100(万元人民币)","食品加工；预包装食品销售。",辽宁,沈阳,"沈阳市和平区中山路90号"
鞍钢矿山附企运修工业公司,91210300241434520N,1981-04-24,N/A,N/A,"830(万元人民币)","铸件（毛坯）；工矿备件加工、修理；运输机电设备修理；紧固件、铆钉、非标铁路车辆制造；电力机车修理；研磨设备；电器设备安装、维修；机电设备加工、修理；自动化及监控系统安装、调试及维修；铆焊结构；铁电路维修、管道维修；土建；安全技术防范设施设计施工（以上项目凭资质证经营）；电气元器件、电线、电缆、化工产品",辽宁,鞍山,"鞍山市千山区泉东一街8号"
大连铁道综合服务公司,912102021184182935,1981-05-01,N/A,N/A,"84.5200(万元人民币)","百货、五金化工商品、饲料、副食品、代办物资储运手续、提供劳务、房屋租售代理",辽宁,大连,"辽宁省大连市中山区新安街８号"
抚顺县上马供销合作社,91210421MA0QFBNX9J,1981-05-03,集体所有制,N/A,"25.7万人民币","日用百货、服装、鞋帽、针纺织品、日用杂品、文化体育用品、五金杂品、中小农具、化学肥料、农用薄膜、民用建材零售；毒害品（仅限农药）零售；种子销售",辽宁,抚顺,"上马乡西古村"
抚顺县营盘供销合作社,91210403119515159R,1981-05-03,集体所有制,N/A,"25.5万人民币","日用百货、文化体育用品、服装、鞋帽、针纺织品、建筑五金、日用杂品、中小农具、家用电器、五金杂品、化肥、农膜销售，房屋租赁。",辽宁,抚顺,"章党乡营盘村"
抚顺县安家供销合作社,91210421119515247A,1981-05-03,集体所有制,N/A,"25.5万人民币","日用百货、服装鞋帽、针纺织品、日用杂品、文化体育用品、中小农具、化学肥料、农用薄膜、种子销售。",辽宁,抚顺,"抚顺县安家乡邹家村"
抚顺县海浪供销合作社,912104211195152555,1981-05-03,集体所有制,N/A,"35.8万人民币","日用百货、服装、鞋帽、针纺织品、文化体育用品零售。房屋出租。",辽宁,抚顺,"抚顺县海浪乡下海浪村"
抚顺县后安供销合作社,91210421119515220J,1981-05-03,集体所有制,N/A,"45.8万人民币","日用百货、服装、鞋帽、针纺织品、日用杂品、文化体育用品、建筑五金、家用电器、中小农具、化肥、农用薄膜、汽车配件、农机配件销售；房屋租赁。",辽宁,抚顺,"后安镇后安村"
抚顺县救兵乡供销合作社,912104211195151917,1981-05-03,集体所有制,N/A,"62.1万人民币","日用百货、服装、鞋帽、针纺织品、日用杂品、文化体育用品、建筑五金、家用电器、中小农具、化肥、农用薄膜零售。",辽宁,抚顺,"救兵乡救兵村"
抚顺县峡河供销合作社,912104211195152630,1981-05-03,集体所有制,N/A,"13.1万人民币","日用百货、服装、鞋帽、针纺织品、日用杂品、文化用品、五金杂品、中小农具、化学肥料、农用薄膜议价粮油、种子议价粮油、种子",辽宁,抚顺,"抚顺县峡河乡峡河村"
抚顺县拉古供销合作社,912104001195151161,1981-05-03,集体所有制,N/A,"19.3万人民币","日用百货、日用杂品、文化体育用品零售。服装鞋帽、针纺织品、建筑五金、家用电器、中小农具、化学肥料、毒害品",辽宁,抚顺,"拉古乡拉古村"
抚顺县章党供销合作社,91210403119515175F,1981-05-03,集体所有制,N/A,"20.2万人民币","日用百货、服装鞋帽、针纺织品、日杂用品、文化体育用品、建筑五金、家用电器、劳保用品销售，中小农具、化学肥料、农用薄膜、房屋租赁。",辽宁,抚顺,"抚顺市露天区章党街"
抚顺县兰山供销合作社,91210403119515140W,1981-05-03,集体所有制,N/A,"12.5万人民币","卷烟、雪茄烟、预包装食品、日用百货、日用杂品、服装、鞋帽、针纺织品、文化体育用品建筑五金、中小农具、民用建材、颜料、家用电气、化学肥料、农用薄膜、农作物种子零售，危险化学品",辽宁,抚顺,"抚顺县兰山乡金家村"
抚顺县哈达供销合作社,91210403119515167L,1981-05-03,集体所有制,N/A,"40万人民币","日用杂品、日用百货、文化体育用品服装、鞋帽、针织品、建筑五金、农机配件、家用电器、中小农具、化肥、农药（危险化学品经营许可证有效期至2014年4月19日）、农用薄膜、汽车配件、耐火材料、饲料、种子（凭种子代销证经营）销售；房屋租赁；民用废品、废旧金属回收；农副产品收购",辽宁,抚顺,"哈达乡下哈达村"
铁岭市银州区农资土产公司,912112021227605266,1981-05-03,N/A,N/A,"30(万元人民币)","农业生产资料（不含种子、农药）建筑材料、日用杂品（不含鞭炮）",辽宁,铁岭,"铁岭市银州区铁西街二十委十八组"
抚顺县石文供销合作社,91210421119515239F,1981-05-03,集体所有制,N/A,"39万人民币","化学肥料。房屋租赁。",辽宁,抚顺,"抚顺县石文镇石文村"
沈阳机车车辆劳动服务公司,91210114117925082M,1981-05-06,N/A,N/A,"162(万元人民币)","铁路机车车辆及城市轨道交通的设备、配件和设施的制造、保洁、保养、涂装及修理，金属洗刷液制造，铁路器材、电气化接触网零部件、建筑用紧固件产品、非标设备及配件、工具工装、计量仪器、实验设备生产和销售、非标准钢构件的设计、制作、安装及服务。",辽宁,沈阳,"沈阳市于洪区沙岭街道沙和路J区2号"
大连联合路副食品公司联合路商场,9121020424303589XN,1981-05-07,N/A,N/A,"30(万元人民币)","副食品食品、百货、日用杂品、五金、电工器材、针纺织品、家电维修、干洗汽熨",辽宁,大连,"辽宁省大连市沙河口区联合路145号"
新民市建材杂品公司,91210181118211516P,1981-05-13,N/A,N/A,"54(万元人民币)","处理本企业内部事务",辽宁,沈阳,"新民市城区西城街大高社区"
抚顺市顺城区李石供销合作社,91210400119472531G,1981-05-14,集体所有制,N/A,"37.6万人民币","日用百货销售*农业生产资料、农用土特产品、民用建材销售（国家法律、行政法规规定禁止经营及须前置许可经营项目除外）",辽宁,抚顺,"顺城区李石镇"
沈阳矿务局前屯矿劳动服务公司,9121011311812536XB,1981-05-14,N/A,N/A,"27.8000(万元人民币)","许可经营项目：无 一般经营项目：此执照仅供本企业处理债权、债务、交纳本企业职工养老保险备用。",辽宁,沈阳,"沈阳市沈北新区前屯矿二区"
沈阳市第二住宅建筑公司,91210100117844856Q,1981-05-15,N/A,N/A,"2,096(万元人民币)","许可项目：无；一般项目：室内外装饰装修。",辽宁,沈阳,"沈阳市沈河区南通天街20甲号"
沈阳市东文机械厂,91210104117863037E,1981-05-16,个人独资企业,N/A,"N/A","非标准设备，机床配件设计、制造、加工；模具加工",辽宁,沈阳,"沈阳市大东区文官街４１－４号"
瓦房店市赵屯供销合作社,91210281716927573N,1981-05-20,集体所有制,N/A,"80万人民币","销售针纺织品、日用杂品（不含烟花爆竹）*销售五金交电商品(不含彩电)、化肥、复合肥料、复混肥料、有机肥、农药、农膜、玻璃、农机具*",辽宁,大连,"辽宁省瓦房店市赵屯乡赵屯村"
瓦房店市泡崖供销合作社,91210281123623144N,1981-05-23,集体所有制,N/A,"81万人民币","百货、针纺织品、农作物种子、市场管理、市场服务、市场设施、设备租赁*日用杂品、五金商品、日用电器、交通器材、农业生产资料、农副土特产品(粮油只限零售)、民用建材*",辽宁,大连,"辽宁省瓦房店市泡崖乡泡崖村"
抚顺市兴达实业公司,91210400701802030M,1981-06-08,N/A,N/A,"50(万元人民币)","预包装食品、乳制品（不含婴幼儿配方乳粉）零售，日用杂品、建筑五金、五金工具、交电、建筑材料、普通机械、针织品、纺织品、日用百货、服装、鞋帽、文化用品销售；复印、彩扩、技术咨询服务；通讯器材",辽宁,抚顺,"顺城区临江路东段"
抚顺市粮食集团有限公司,912104001194660003,1981-06-08,N/A,N/A,"5,328(万元人民币)","粮油储存、经营，原粮收购，粮食制品、食品加工、销售，饮料生产、销售；房屋、场地、粮油加工设备出租；货物",辽宁,抚顺,"顺城区前甸镇"
抚顺市物资回收公司中市商店,91210400119315421E,1981-06-08,N/A,N/A,"20(万元人民币)","五金工具、电工器材、水暖器材、建筑材料、日用杂品、日用百货、金属材料（除金、银）、劳保用品（除特种劳保用品）",辽宁,抚顺,"新抚区西十路１７号"
沈阳市康平宾馆(有限公司),91210123410691959L,1981-06-10,N/A,N/A,"576(万元人民币)","住宿；餐饮；房屋出租；广告设计、制作、发布；锅炉供暖",辽宁,沈阳,"康平县康平镇建设街"
