宽甸满族自治县步达远供销合作社,91210624120467385G,1981-08-02,集体所有制,N/A,"134万人民币","零售、批发、收购：百货，日杂、，针纺织品，服装鞋帽，化肥，五金交电化工，民用建材。农副土特产品及废品收购；烟花爆竹零售。",辽宁,丹东,"步达远村"
盖州市沙岗供销合作社惠屯商店,91210881MA0UNU6U5C,1981-08-03,N/A,N/A,"N/A","化肥、农药",辽宁,营口,"盖州市沙岗镇惠屯村"
沈阳市苏家屯区永乐供销合作社,9121011111802784XL,1981-08-05,国有企业,N/A,"140万人民币","日用工业品、农业生产资料",辽宁,沈阳,"苏家屯区永乐乡大韩台村"
锦州锅炉安装工程总公司,91210711120814199T,1981-08-06,N/A,N/A,"141(万元人民币)","锅炉安装；水暖管道安装及维修。",辽宁,锦州,"锦州市太和区东太平里263号"
抚顺矿区金材公司结构厂,91210400119414171X,1981-08-07,N/A,N/A,"17(万元人民币)","金属结构件制造。矿山机械修理。",辽宁,抚顺,"望花区建设街"
建平县小塘供销合作社,91211322MA0QFU8X50,1981-08-08,集体所有制,N/A,"43万人民币","自有资产经营管理。",辽宁,朝阳,"辽宁省朝阳市建平县小塘乡本街"
鞍山市大陆贸易公司,912103031190135113,1981-08-08,N/A,N/A,"100(万元人民币)","民用五金、电工器材、化工产品（不含危险化学品）、日用百货、家用电器、日用杂品",辽宁,鞍山,"铁西区九道街新综合楼"
建平县沙海供销合作社,91211322MA0TP2MY33,1981-08-08,集体所有制,N/A,"92万人民币","自有资产经营管理。",辽宁,朝阳,"辽宁省朝阳市建平县沙海镇本街"
建平县榆树林子供销合作社,912113221233733923,1981-08-08,集体所有制,N/A,"69万人民币","自有资产经营管理。",辽宁,朝阳,"建平县榆树林子乡本街"
建平县白家洼供销合作社,91211322MA0QFRJG86,1981-08-08,集体所有制,N/A,"80万人民币","自有资产经营管理；毒害品（仅限农药）零售.",辽宁,朝阳,"辽宁省朝阳市建平县沙海镇白家洼村"
阜新市糖酒公司批零商店,912109001215201765,1981-08-10,N/A,N/A,"3(万元人民币)","房屋出租。此处空白。",辽宁,阜新,"阜新市海州区解放大街9号"
建平县青峰山供销合作社,91211322MA0QFXLP0W,1981-08-10,集体所有制,N/A,"22万人民币","自有资产经营管理。",辽宁,朝阳,"辽宁省朝阳市建平县青峰山乡"
阜新市金属回收公司,91210900121512483L,1981-08-10,N/A,N/A,"106.4000(万元人民币)","废旧金属收购。金属材料、化工产品",辽宁,阜新,"阜新市海州区振兴路40号"
建平县深井供销合作社,91211322MA0QFY54X5,1981-08-10,集体所有制,N/A,"55万人民币","自有资产经营管理。",辽宁,朝阳,"辽宁省朝阳市建平县深井乡本街"
阜新市盐业有限责任公司,91210900121519730R,1981-08-10,N/A,N/A,"50(万元人民币)","食盐、其他盐产品批发；食盐分装；饲料添加剂、化工产品销售。",辽宁,阜新,"阜新市海州区平中街50号"
阜新市聚源再生资源利用有限公司,912109001215223583,1981-08-10,N/A,N/A,"200(万元人民币)","废旧物资回收",辽宁,阜新,"阜新市海州区东市路6号"
彰武县教育建筑工程公司,91210922121913359U,1981-08-11,N/A,N/A,"601.5000(万元人民币)","房屋建筑工程施工总承包叁级：可承担单项建安合同额不超过企业注册资本金5倍的下列房屋建筑工程的施工：1)14层及以下、单跨跨度24米及以下的房屋建筑工程；2)高度70米及以下的构筑物；2)建筑面积6万平方米及以下的住宅小区或建筑群体可承担总承包工程范围内塔吊的拆装",辽宁,阜新,"彰武县人民大街53-2-6门"
宽甸满族自治县八河川供销合作社,91210624120469890W,1981-08-12,集体所有制,N/A,"50万人民币","日杂，百货，针纺织品，服装鞋帽，五金交电化工，农业生产资料，干鲜果，房屋租赁农副土特产品及废品收购.",辽宁,丹东,"八河川街"
营口恒锐锅炉制造有限公司,91210882121424678M,1981-08-12,N/A,N/A,"800(万元人民币)","B级锅炉制造。",辽宁,营口,"大石桥市石佛镇石佛村"
中外运辽宁汽车运输有限公司,91210000242389477T,1981-08-14,N/A,N/A,"1,311(万元人民币)","集装箱运输管理咨询服务；房屋、场地出租，汽车租赁。",辽宁,大连,"辽宁省大连保税区大窑湾港区创业一路16号"
丹东市宽甸石油有限公司,91210624120479335H,1981-08-17,N/A,N/A,"3,000(万元人民币)","汽油、柴油、煤油、润滑油、润滑脂及石油化工产品批发零售;烟酒、百货、日杂、干鲜果、沥青、服装、针织品、手工艺品、农副产品、化肥、体育用品、家用电器、办公设备、办公用品、装饰材料、建筑材料、汽车配件零售；资产租赁。零售：预包装食品、乳制品",辽宁,丹东,"宽甸镇铁南路西１８６号"
丹东市宽甸石油有限公司灌水加油站,91210624120475553U,1981-08-18,N/A,N/A,"N/A","零售：成品油、润滑油、日用百货、沥青、服装、针织品、工艺品、化肥、体育用品、电子产品、家用电器、办公设备、办公用品、装饰材料、建筑材料（不含木材）、汽车配件、农产品;预包装食品、乳制品",辽宁,丹东,"灌水镇车古轮泡村"
宽甸满族自治县种子公司,91210624MA0QE52N1K,1981-08-18,N/A,N/A,"150(万元人民币)","农作物、油料作物、蔬菜种子",辽宁,丹东,"宽甸镇铁长路46号"
朝阳市龙城区联合供销合作社,9121130312331566X4,1981-08-18,集体所有制,N/A,"42.5万人民币","化肥、农膜、农作物包装种子零售；房屋租赁。",辽宁,朝阳,"朝阳市龙城区联合乡"
辽阳县黄泥洼供销合作社农资门市部,91211021MA0TQJAHX5,1981-08-18,集体分支机构(非法人),N/A,"N/A","化学农药",辽宁,辽阳,"黄泥洼黄金屯"
丹东市宽甸石油有限公司长甸加油站,9121062412046773XC,1981-08-18,N/A,N/A,"N/A","零售：成品油、润滑油、日用百货、沥青、服装、针织品、工艺品、化肥、体育用品、电子产品、家用电器、办公设备、办公用品、装饰材料、建筑材料（不含木材）、汽车配件、农产品、预包装食品、乳制品",辽宁,丹东,"长甸镇铁长路４号"
宽甸满族自治县新华书店有限公司,91210624463792032Q,1981-08-18,N/A,N/A,"31(万元人民币)","批发、零售：图书、图片、教材、音像制品，文化用品；房屋出租。",辽宁,丹东,"辽宁省丹东市宽甸满族自治县宽甸镇新兴东街(茂源新城A区东1裙房160-260号)"
朝阳市龙城区大平房供销合作社,91211303123311706F,1981-08-18,集体所有制,N/A,"66万人民币","日用百货、五金、交电、化工产品（不含易制毒、监控、化学危险品）、日杂、针织品、化肥、不再分装的农作物包装种子、农膜、文娱体育用品销售；房屋租赁",辽宁,朝阳,"朝阳市龙城区大平房镇"
宽甸满族自治县太平哨供销合作社,91210624120476070F,1981-08-22,集体所有制,N/A,"93万人民币","百货，针纺织品，服装鞋帽，五金交电化工，民用建材，农业生产资料（化肥不批发）",辽宁,丹东,"太平哨街"
喀左县平房子供销社,91211324MA0TPK258L,1981-08-26,集体所有制,N/A,"129万人民币","百货，日用杂品，五金工具，建筑五金，自行车，家用电器，针纺织品，房屋出租。农副产品购销",辽宁,朝阳,"喀左县平房子供销社"
喀左县兴隆庄供销社,912113241235012198,1981-08-26,集体所有制,N/A,"25万人民币","百货、日用杂品、建材、花卉、蔬菜、针纺织品、化肥、地膜批零，代购代销；本单位房屋出租。",辽宁,朝阳,"喀左县兴隆庄乡兴隆庄村"
宽甸满族自治县灌水供销合作社,91210624120470162Y,1981-08-29,集体所有制,N/A,"135万人民币","百货、日杂（不含烟花爆竹）、针纺织品、服装鞋帽、五金交电化工",辽宁,丹东,"灌水街"
宽甸满族自治县青椅山供销合作社,91210624120475043E,1981-08-29,集体所有制,N/A,"50万人民币","百货，针纺织品，五金交电化工，服装鞋帽，日杂（不含烟花爆竹），干鲜果，农业生产资料",辽宁,丹东,"青椅山村"
宽甸满族自治县古楼子供销社,91210624120461602L,1981-08-29,集体所有制,N/A,"50万人民币","日用杂品，化肥，农膜，农机具，针纺织品，服装鞋帽，日用百货，五金交电化工，生产性废旧金属，三类废旧物资收购文化用品，农副土特产品，房屋租赁。",辽宁,丹东,"古楼子乡"
营口市新华书店有限责任公司,91210800464101854R,1981-08-31,N/A,N/A,"858(万元人民币)","国内版音像制品批发；国内版图书、报纸、期刊批发兼零售；经销：文化娱乐用品、儿童玩具、电子产品、办公用品、日用百货、体育用品、工艺美术品、乐器、计算机设备、教学设备、图书馆设备；劳务服务（除劳务派遣业务）、企业管理服务、装卸搬运服务",辽宁,营口,"站前区渤海大街民主里２２号"
营口市老边区路南供销总公司白庙子商店,91210811MA0UQ5U942,1981-08-31,N/A,N/A,"N/A","预包装食品；零售（食品流通许可证有效期至2013-07-27）、日用品、烟酒；五金交电。化工原料",辽宁,营口,"老边区路南镇白庙子村"
营口市糖酒公司三楼副食商店,91210800MA0URPXXXB,1981-08-31,N/A,N/A,"4万人民币","付食品,烟酒糖茶,糕点,罐头日用化学制品,日用杂品(依法须经批准的项目,经相关部门批准后方可开展经营活动。)",辽宁,营口,"站前区三楼街"
大连市普兰店区农业生产资料公司城子坦供应站,9121028211871595X7,1981-09-01,N/A,N/A,"23.4000(万元人民币)","农业生产资料",辽宁,大连,"辽宁省大连市普兰店区城子坦街道春满社区城复路90号"
大连市普兰店区碧流河供销合作社,912102821187297455,1981-09-01,集体所有制,N/A,"49.8万人民币","农业生产资料、农副土特产品、纺织品、百货、食品、副食品、五交化商品、日用杂品、图书、建筑材料、废旧物资零售兼批发、代购、代销。",辽宁,大连,"辽宁省大连市普兰店区城子坦街道大卢社区"
大连市普兰店区花儿山供销合作社圈龙山商店,91210282792045994J,1981-09-01,集体分支机构(非法人),N/A,"N/A","农业生产资料、农副土特产品、纺织品、百货、食品、副食品、五交化商品、日用杂品、建筑材料、废旧物资零售、代购、代销。",辽宁,大连,"辽宁省大连市普兰店区铁西街道圈龙山社区"
大连市普兰店区城子坦供销合作社下吴商店,912102820715700518,1981-09-01,集体分支机构(非法人),N/A,"N/A","农药、化肥、农膜、种子、农机具及配件、农副土特产品、纺织品、百货、粮油、饲料、预包装食品、五交化商品、日用杂品、建筑材料零售、代购、代销。",辽宁,大连,"辽宁省大连市普兰店区城子坦街道下吴村"
大连市普兰店区花儿山供销合作社二道商店,91210282792046081C,1981-09-01,集体分支机构(非法人),N/A,"N/A","农药、化肥、农膜、种子、农机具及配件、农副土特产品、纺织品、百货、粮油、饲料、食品、副食品、五交化商品、日用杂品、建筑材料、预包装食品、乳制品",辽宁,大连,"辽宁省大连市普兰店区铁西街道办事处二道岭社区"
大连市普兰店区皮口供销合作社赞子河商店,91210282792047615T,1981-09-01,集体分支机构(非法人),N/A,"N/A","农药、化肥、农膜、种子、农机具及配件、农副土特产品、纺织品、百货、粮油、饲料、食品、副食品、五交化商品、日用杂品、建筑材料零售、代购、代销。",辽宁,大连,"辽宁省大连市普兰店区皮口街道赞子河社区"
大连市普兰店区泡子供销合作社拉树商店,91210282792045767D,1981-09-01,集体分支机构(非法人),N/A,"N/A","化肥、农药",辽宁,大连,"辽宁省大连市普兰店区丰荣街道办事处拉树村"
大连市普兰店区夹河供销合作社,912102821187298686,1981-09-01,集体所有制,N/A,"116.8万人民币","农业生产资料、农副土特产品、纺织品、百货、食品、副食品、中西药",辽宁,大连,"辽宁省大连市普兰店区唐家房街道办事处双泉寺社区"
大连市普兰店区皮口供销合作社于屯商店,91210282792047674X,1981-09-01,集体分支机构(非法人),N/A,"N/A","农药、化肥、农膜、农机具及配件、农副土特产品、纺织品、百货、饲料、粮油、种子、食品、副食品、五交化商品、日用杂品、建筑材料、废旧物资零售。",辽宁,大连,"辽宁省大连市普兰店区皮口街道崔家窑村"
普兰店市大谭供销合作社桥头商店,91210282792047105D,1981-09-01,集体分支机构(非法人),N/A,"N/A","农药、化肥、农膜、种子、农机具及配件、农副土特产品、百货、粮油、饲料、食品、副食品、五交化商品、日用杂品、建筑材料、废旧物资零售、代购、代销。",辽宁,大连,"辽宁省普兰店市大谭镇桥头村"
大连市普兰店区皮口供销合作社崔家窑商店,912102827920476070,1981-09-01,集体分支机构(非法人),N/A,"N/A","农药、化肥、农膜、农机具及配件、农副土特产品、纺织品、百货、饲料、粮油、种子、食品、副食品、五交化商品、日用杂品、烟花爆竹、建筑材料、煤炭销售；废旧物资回收。",辽宁,大连,"辽宁省大连市普兰店区皮口街道崔家窑村"
大连市普兰店区双塔供销合作社永宁商店,912102827920474201,1981-09-01,集体分支机构(非法人),N/A,"N/A","农业生产资料、农副土特产品、纺织品、百货、五交化商品、日用杂品、建筑材料、废旧物资、不再分装的包装种子零售兼批发；烟草制品零售。",辽宁,大连,"辽宁省大连市普兰店区双塔镇永宁村"
大连市普兰店区皮口供销合作社邵家商店,912102827920477039,1981-09-01,集体分支机构(非法人),N/A,"N/A","农药、化肥、农膜、种子、农机具及配件、农副土特产品、纺织品、百货、粮油、饲料、食品、副食品、五交化商品、日用杂品、建筑材料零售；蔬菜、水果、煤炭批发兼零售。",辽宁,大连,"辽宁省大连市普兰店区皮口街道邵家村"
大连市普兰店区大谭供销合作社范店商店,91210282MA0YBA443A,1981-09-01,集体分支机构(非法人),N/A,"N/A","农药、化肥、农膜、种子、农机具及配件、农副土特产品、纺织品、百货、粮油、饲料、食品、副食品、五交化商品、日用杂品、建筑材料零售、代购、氏销。",辽宁,大连,"辽宁省大连市普兰店区大谭街道夏沟村"
大连市普兰店区农业生产资料公司城子坦供应站门市,91210282MA0QEK597A,1981-09-01,N/A,N/A,"N/A","农业生产资料、百货、日用杂品、纺织品、五金、食品、副食品零售。",辽宁,大连,"辽宁省大连市普兰店区城子坦街道春满社区城复路48号"
大连市普兰店区双塔供销合作社王屯商店,91210282792047455K,1981-09-01,集体分支机构(非法人),N/A,"N/A","农业生产资料、农副土特产品、纺织品、百货、五交化商品、日用杂品、建筑材料、废旧物资零售兼批发、代购、代销。",辽宁,大连,"辽宁省大连市普兰店区双塔镇王屯村"
大连市普兰店区星台供销合作社矫屯商店,91210282792048175U,1981-09-01,集体分支机构(非法人),N/A,"N/A","农药、化肥、农膜、种子、农机具及配件、农副土特产品、纺织品、百货、粮油、饲料、食品、副食品、五交化商品、日用杂品、建筑材料零售、代购、代销。",辽宁,大连,"辽宁省大连市普兰店区星台镇塔南村矫屯"
大连市普兰店区莲山供销合作社于店商店,912102827969001854,1981-09-01,集体分支机构(非法人),N/A,"11.4万人民币","农药、化肥、农膜、种子、农机具及配件、农副土特产品、纺织品、百货、饲料。食品、副食品、五交化商品、日用杂品、建筑材料零售、代购、代销。",辽宁,大连,"辽宁省大连市普兰店区莲山街道于店社区"
大连市普兰店区乐甲供销合作社对峰商店,91210282792046006K,1981-09-01,集体分支机构(非法人),N/A,"N/A","农业生产资料、农副土特产品、纺织品、百货、不再分装的包装种子、烟花爆竹、食品、副食品、五交化商品、日用杂品、建筑材料、废旧物资、烟草制品、农药",辽宁,大连,"辽宁省大连市普兰店区乐甲满族乡对峰村"
大连市普兰店区安波地区供销合作社郑屯商店,91210282796905656L,1981-09-01,集体分支机构(非法人),N/A,"N/A","农业生产资料、农副土特产品、纺织品、百货、烟、酒、烟花爆竹、食品、副食品、五交化商品、日用杂品、建筑材料、废旧物资、不再分装的包装种子零售。",辽宁,大连,"辽宁省大连市普兰店区安波镇郑屯村"
大连市普兰店区乐甲供销合作社乐甲商店,91210282792045986P,1981-09-01,集体分支机构(非法人),N/A,"N/A","农业生产资料、农副土特产品、纺织品、百货、食品、副食品、五交化商品、日用杂品、图书、中西药、建筑材料、废旧物资零售、代购、代销；家用电器、文化用品、烟草制品、烟花爆竹、不再分装的包装种子、农药",辽宁,大连,"辽宁省大连市普兰店区乐甲满族乡乐甲村"
大连市普兰店区太平供销合作社矿洞商店,91210282792046292U,1981-09-01,集体分支机构(非法人),N/A,"N/A","农药、化肥、农膜、种子、农机具及配件、农副土特产品、纺织品、百货、粮油、饲料、食品、副食品、五交化商品、日用杂品、建筑材料零售、代购、代销；预包装食品、烟花爆竹零售。",辽宁,大连,"辽宁省大连市普兰店区太平街道矿洞社区"
中国石油天然气股份有限公司辽宁大连销售分公司俭汤加油站,912102827969007162,1981-09-01,N/A,N/A,"N/A","汽油、柴油、润滑油、五金交电、电气设备销售；百货、食品、副食品、饮料、烟、酒、化肥、计生用品、一般劳保用品、水果、蔬菜、预包装食品、乳制品（不含婴幼儿配方乳粉）、图书报刊、汽车配件零售；三类汽车",辽宁,大连,"辽宁省大连市普兰店区安波镇俭汤社区"
大连市普兰店区大刘供销合作社盖屯商店,91210282792046356R,1981-09-01,集体分支机构(非法人),N/A,"N/A","农药、化肥、农膜、种子、农机具及配件、农副土特产品、纺织品、百货、粮油、饲料、食品、副食品、五交化商品、日用杂品、建筑材料零售。",辽宁,大连,"辽宁省大连市普兰店区大刘家街道办事处小山村"
大连市普兰店区泡子供销合作社鞍子山商店,91210282588089498T,1981-09-01,集体分支机构(非法人),N/A,"N/A","化肥、农药",辽宁,大连,"辽宁省大连市普兰店区丰荣街道办事处鞍子山社区"
大连市普兰店区碧流河供销合作社于屯商店,91210282792046102W,1981-09-01,集体分支机构(非法人),N/A,"N/A","农业生产资料、农副土特产品、纺织品、百货、食品、副食品、五交化商品、日用杂品、建筑材料、废旧物资零售、代购、代销。",辽宁,大连,"辽宁省大连市普兰店区城子坦街道碧流河社区于屯"
大连市普兰店区皮口供销合作社三官商店,91210282792047578L,1981-09-01,集体分支机构(非法人),N/A,"N/A","农药、化肥、农膜、种子、农机具及配件、农副土特产品、纺织品、百货、粮油、饲料、食品、副食品、五交化商品、日用杂品、建筑材料零售、代购、代销；煤炭销售。",辽宁,大连,"辽宁省大连市普兰店区皮口街道郑窑村"
大连市普兰店区泡子供销合作社南台商店,912102827920458209,1981-09-01,集体分支机构(非法人),N/A,"N/A","农药、化肥、农膜、种子、农机具及配件、农副土特产品、纺织品、百货、粮油、饲料、食品、副食品、五交化商品、日用杂品、建筑材料零售、代购、代销；预包装食品、乳制品",辽宁,大连,"辽宁省大连市普兰店区丰荣街道办事处南台村"
大连市普兰店区泡子供销合作社北台商店,91210282792045791X,1981-09-01,集体分支机构(非法人),N/A,"N/A","农药（不含危险化学品）、化肥、农膜、农机具及配件、农副土特产品、纺织品、百货、粮油、种子、生熟肉制品、食品、副食品、五交化商品、日用杂品、建筑材料、废旧物资零售、代购、代销；预包装食品、乳制品",辽宁,大连,"辽宁省大连市普兰店区丰荣街道办事处北台村"
大连市普兰店区安波地区供销合作社转山商店,91210282792045759J,1981-09-01,集体分支机构(非法人),N/A,"N/A","农业生产资料、农副土特产品、纺织品、百货、烟花爆竹、烟酒、食品、副食品、五交化商品、日用杂品、建筑材料、废旧物资、烟花爆竹、不再分装的包装种子零售。",辽宁,大连,"辽宁省大连市普兰店区安波镇转山村"
大连市普兰店区安波地区供销合作社前房商店,91210282665834122E,1981-09-01,集体分支机构(非法人),N/A,"N/A","农业生产资料、农副土特产品、纺织品、百货食品、副食品、五交化商品、日用杂品、建筑材料、废旧物资、烟花爆竹、烟草制品、不再分装的包装种子零售。",辽宁,大连,"辽宁省大连市普兰店区安波镇太阳村"
大连市普兰店区城子坦供销合作社生产资料商店,91210282311484532D,1981-09-01,集体分支机构(非法人),N/A,"N/A","农业生产资料、日用杂品、建筑材料零售、代购、代销。",辽宁,大连,"辽宁省大连市普兰店区城子坦街道中心街"
大连市普兰店区碧流河供销合作社庞屯商店,9121028279204633XY,1981-09-01,集体分支机构(非法人),N/A,"N/A","农药、化肥、农膜、种子、农机具及配件、农副土特产品、纺织品、百货、饲料、食品、副食品、五交化商品、日用杂品、建筑材料零售、代购、代销。",辽宁,大连,"辽宁省大连市普兰店区城子坦街道碧流河社区庞屯"
大连市普兰店区安波地区供销合作社生产资料门市,91210282MA0QFGKY1Y,1981-09-01,集体分支机构(非法人),N/A,"N/A","农药、化肥、农膜、种子、农机具及配件、饲料、五交化商品、日用杂品零售。",辽宁,大连,"辽宁省大连市普兰店区安波镇安波社区"
大连市普兰店区碧流河供销合作社大卢商店,91210282792046348Y,1981-09-01,集体分支机构(非法人),N/A,"N/A","农药、化肥、农膜、种子、农机具及配件、农副土特产品、纺织品、百货、饲料、食品、副食品、五交化商品、日用杂品、建筑材料零售、代购、代销。",辽宁,大连,"辽宁省大连市普兰店区城子坦街道大卢社区小卢屯"
大连市普兰店区碧流河供销合作社三三商店,912102827920462841,1981-09-01,集体分支机构(非法人),N/A,"N/A","农药、化肥、农膜、种子、农机具及配件、农副土特产品、纺织品、百货、饲料、食品、副食品、五交化商品、日用杂品、建筑材料零售、代购、代销；烟花爆竹零售。",辽宁,大连,"辽宁省大连市普兰店区城子坦街道金厂社区"
大连市普兰店区安波地区供销合作社金店商店,91210282792045628N,1981-09-01,集体分支机构(非法人),N/A,"N/A","农业生产资料、农副土特产品、纺织品、百货、食品、副食品、五交化商品、日用杂品、建筑材料、废旧物资零售、代购、代销；烟花爆竹、不再分装的包装种子、农药",辽宁,大连,"辽宁省大连市普兰店区安波镇金店村"
大连市普兰店区皮口供销合作社八家商店,91210282792047631G,1981-09-01,集体分支机构(非法人),N/A,"N/A","农药、化肥、农膜、农机具及配件、农副土特产品、纺织品、百货、粮油、饲料、种子、食品、副食品、五交化商品、日用杂品、建筑材料、煤炭销售；废旧物资回收。",辽宁,大连,"辽宁省大连市普兰店区皮口街道八家村"
大连市普兰店区双塔供销合作社楼子商店,91210282792047690K,1981-09-01,集体分支机构(非法人),N/A,"N/A","农业生产资料、农副土特产品、纺织品、百货、种子",辽宁,大连,"辽宁省大连市普兰店区双塔镇娄子村"
大连市普兰店区皮口供销合作社夹心子商店,9121028279204764X8,1981-09-01,集体分支机构(非法人),N/A,"N/A","农药、化肥、农膜、农机具及配件、农副土特产品、纺织品、百货、饲料、粮油、种子、食品、副食品、五交化商品、日用杂品、建筑材料、煤炭销售；废旧物资回收。",辽宁,大连,"辽宁省大连市普兰店区皮口街道夹心社区"
大连市普兰店区同益供销合作社同益商店,91210282796900097M,1981-09-01,集体分支机构(非法人),N/A,"N/A","农药、化肥、农膜、不再分装的包装种子、农机具及配件、农副土特产品、纺织品、百货、粮油、饲料、五交化商品、日用杂品、图书、建筑材料、预包装食品、乳制品",辽宁,大连,"辽宁省大连市普兰店区同益乡同益村"
