昆明美格特经贸有限公司,91530112750672420R,2003-07-02,N/A,周亚新,"100(万元人民币)","计算机软硬件的开发、应用及销售；仪器仪表、电子产品、普通机械设备及配件、建筑材料、装饰材料、日用百货、医疗器械的销售（依法须经批准的项目，经相关部门批准后方可开展经营活动）",云南,昆明,"云南省昆明市西山区前卫西路月光宝盒住宅小区8幢B座20-21层2001室"
昆明万国车轮贸易有限公司第一分公司,91530100750673685M,2003-07-02,N/A,张正纪,"N/A","汽车轮胎、汽车配件、汽车护理用品、汽车保修设备、五金工具的销售；汽车维修（叁类）（依法须经批准的项目，经相关部门批准后方可开展经营活动）",云南,昆明,"昆明市春晖小区英茂花园7栋16、17、18号商铺"
云南大鲸科技有限公司,91532900750659998Y,2003-07-02,N/A,高珩,"3,976(万元人民币)","生产和销售自产的畜禽、水产等所需系列高科技饲料、生物饲料、预混合饲料、饲料原料及售后服务。",云南,大理,"云南省大理白族自治州祥云县财富工业园区祥姚公路10公里处"
云南龙溪房地产开发有限公司,9153000075067280XN,2003-07-02,N/A,顾仁兴,"500(万元人民币)","房地产开发、经营；建筑材料、装饰材料、金属材料、机电产品、电子产品、普通机械、化工原料及产品、工矿产品、橡胶及制品、农副产品的批发、零售、代购代销",云南,昆明,"云南省昆明市金牛小区综合楼301-302室及附1、附2号"
云南万春蜂业有限公司,91532325757174256Y,2003-07-02,N/A,许会芬,"100(万元人民币)","加工销售蜂王浆、蜂花粉、蜂蜜（固体、液体）、硬蜜含片、蜂产品制品、蜜蜂养殖。",云南,楚雄,"云南省楚雄彝族自治州姚安县栋川镇东正街58号"
云南井邑城乡规划设计有限公司,91530100750674872X,2003-07-02,N/A,张海宏,"100(万元人民币)","城乡规划设计；建筑设计；市政公用设施设计；旅游景区、景点规划设计；企业形象策划；商务信息咨询；承办会议、展示、展览活动（依法须经批准的项目，经相关部门批准后方可开展经营活动）",云南,昆明,"云南省昆明市五华区小康大道589号德润春城花园17号楼2312-2315号"
昆明恒立通经贸有限公司,91530100750671444L,2003-07-02,N/A,赵新明,"2,000(万元人民币)","金属材料、建筑材料、装饰材料、普通机械、橡胶制品、电子产品、文化办公用品的销售（依法须经批准的项目，经相关部门批准后方可开展经营活动）",云南,昆明,"云南省昆明经开区园丁新村C1幢07号商铺"
昆明金泰缘商贸有限责任公司,915301007506731833,2003-07-02,N/A,杨琼英,"1,000(万)","国内商业贸易、物资供销业；仓储服务",云南,昆明,"昆明市官渡区矣六乡广卫村"
昆明萌茂矿业开发有限责任公司,91530100750672332Y,2003-07-02,N/A,宋德军,"600(万元人民币)","铁矿采选；矿产品、建筑材料、金属材料购销",云南,昆明,"东川区舍块乡沙坝"
云南健田实业有限公司,91530121750673423B,2003-07-02,N/A,李水保,"1,000(万元人民币)","电机电器及相关产品、普通机械配件、发电设备及配件、工艺品的生产销售；普通机械、电机及器材、金属材料、汽车配件、电子计算机及配件、建筑材料、装饰材料、五金交电、百货、装饰材料、化工原料及产品、通信设备、通信器材、工艺品的批发、零售、代购代销；自营和代理各类商品和技术的进出口，但国家限定公司经营或禁止进出口的商品和技术除外。",云南,昆明,"云南省昆明市呈贡区置信广场C座2409号"
丽江市古城区翥春房屋拆迁有限公司,91530702750692499U,2003-07-02,N/A,和翥春,"50(万元人民币)","房屋拆迁。",云南,丽江,"云南省丽江市古城区纳西大酒店院内"
昆明振创标准件有限公司,915301007506771768,2003-07-02,N/A,戴继业,"50(万元人民币)","标准件、非标准件、轮胎的销售（依法须经批准的项目，经相关部门批准后方可开展经营活动）",云南,昆明,"昆明市官渡区永中路华洋五金机电城D区8号"
曲靖市麒麟区恒安有限责任公司汽车修理厂,91530302MA6K7FRW9G,2003-07-02,N/A,赵华富,"N/A","汽车维护，汽车接送，汽车及汽车配件销售。",云南,曲靖,"云南省曲靖市麒麟区曲靖昱安建工集团有限公司旁宗地号SB-132"
华宁县华盘公路建设开发有限责任公司,91530424738068052R,2003-07-02,N/A,赵刚,"500(万元人民币)","组织公路建设、桥涵承包；建筑材料、化工原料零售",云南,玉溪,"华宁县宁州镇宁兴街"
昆明网速风科技信息有限公司,91530100750671428Y,2003-07-02,N/A,饶林萍,"150(万元人民币)","计算机网络系统集成；计算机软硬件的开发、应用；计算机网络工程及技术服务、综合布线、计算机及耗材、现代办公设备、电子产品、普通机械及配件、建筑材料、装饰材料、日用百货的销售（依法须经批准的项目，经相关部门批准后方可开展经营活动）",云南,昆明,"昆明市一二一大街71号1栋5层506-507号"
云南玉溪市欣鑫食品有限公司,915304027506739840,2003-07-02,N/A,许建军,"100(万元人民币)","焙烤食品、糕点、糖果、调味品、馅料、辅料、其它食品的制造、销售；服装、鞋帽、针纺织品、日用品的批发、零售。",云南,玉溪,"云南省玉溪市红塔区北城镇王棋路口"
中国联合网络通信集团有限公司剑川县分公司,91532931770497754F,2003-07-02,N/A,曹勇,"N/A","固定通信业务、蜂窝移动通信业务、第一类卫星通信业务、第一类数据通信业务、网络接入业务、国内甚小口径终端地球站",云南,大理,"云南省剑川县金华镇鼎新路"
昆明同心创业工贸有限公司,915301007506729813,2003-07-03,N/A,段辉鹏,"100(万)","食用菌、脱水蔬菜生加工；农副土特产品的收购；国内贸易、物资供销；经营本企业自产产品的出口业务和本企业所需的机械设备、零配件、原辅材料及进口业务（不另附进出口商品目录）、但国家限定公司经营或禁止进出口的商品及技术除外",云南,昆明,"昆明市关上中苜蓿村2008号"
昆明圣世民经贸有限公司,915301007506748050,2003-07-03,N/A,徐红林,"100(万元人民币)","计算机、日用百货、厨房设备、电子产品、金属材料（稀贵金属除外）、装饰材料、建筑材料、塑料制品、农副产品、工艺美术品（黄金饰品除外）、矿产品、汽车配件、摩托车配件、橡胶制品、文化办公用品、电器机械及器材的销售（依法须经批准的项目，经相关部门批准后方可开展经营活动）",云南,昆明,"昆明市白龙寺云山合作住宅小区16幢3单元302号"
昆明中房现代房地产开发有限公司,91530103750673802T,2003-07-03,N/A,赵峰,"2,018(万元人民币)","房地产开发及经营；金属材料（不含稀贵金属）、建筑材料的销售（依法须经批准的项目，经相关部门批准后方可开展经营活动）",云南,昆明,"云南省昆明市盘龙区长青路94号现代广场22楼"
大理机械标准件有限公司,91532901218661565Q,2003-07-03,N/A,王民,"211(万元人民币)","机械设备、农业机械、工矿配件、标准件、钢结构件、电力金属配件、电缆桥架的制造销售。",云南,大理,"云南省大理州大理市银桥镇头铺"
丽江京丽缘商贸有限公司玉雪浓情大酒店,915307000950302525,2003-07-03,N/A,文燕,"N/A","住宿；餐饮。",云南,丽江,"云南省丽江市古城区东界河南段"
云南彩云宏通路桥有限公司,91532923750672391E,2003-07-03,N/A,钱体泽,"8,000(万元人民币)","公路工程施工总承包、市政公用工程施工总承包、土石方工程专业承包、公路路面工程专业承包、公路路基工程专业承包、水利水电工程施工总承包。",云南,大理,"云南省大理白族自治州祥云县祥城镇祥宁公路东侧"
昆明予象科技有限公司,915301007506771843,2003-07-03,N/A,张军,"100(万元人民币)","计算机信息系统及自动控制技术的开发、应用；高低压电器原件及成套设备、工业自动化系统设备、机械设备的销售及售后服务；国内贸易、物资供销（依法须经批准的项目，经相关部门批准后方可开展经营活动）",云南,昆明,"昆明市环城南路老民航路交叉口东来大厦13层13D号"
云南玉溪市华茂房地产有限公司,91530402750673837E,2003-07-03,N/A,王靖,"1,000(万元人民币)","房地产开发，销售；室内装饰；水电安装服务；建筑材料销售。",云南,玉溪,"云南省玉溪市红塔区环山北路景华苑小区B幢401号"
昆明广建建筑设备租赁有限公司,91530100750680914E,2003-07-03,N/A,崔长江,"100(万元人民币)","建筑钢模板、钢管及扣件、机械设备的租赁服务（依法须经批准的项目，经相关部门批准后方可开展经营活动）",云南,昆明,"昆明市董家湾路337号东方上城B栋3单元801室"
中国联合网络通信集团有限公司澜沧分公司上允营业厅,91530828MA6L4XYH42,2003-07-03,N/A,万春兰,"N/A","固定通信业务、蜂窝移动通信业务、第一类卫星通信业务、第一类数据通信业务、网络接入业务、国内通信设置服务业务;国内甚小口径终端地球站(VSAT)通信业务、固定网国内数据传送业务、用户驻地网业务和网络托管业务、因特网数据中心业务、语音信箱业务、呼叫中心业务、因特网接入服务业务和信息服务业务;全国性互联网上网服务...",云南,普洱,"云南省普洱市澜沧拉祜族自治县上允镇上允街"
云南省南盘江林业局曲靖木材加工厂,91530302917221649F,2003-07-03,国有企业,李庆,"N/A","胶合板制造，木材成品及关成品零售，木材贮运。兼营范围：(以上范围中涉及专项审批，按审批项目和时限经营)*",云南,曲靖,"云南省麒麟区城关镇王家山"
丽江叶氏车业有限责任公司,91530700750683234D,2003-07-03,N/A,叶彬,"800(万元人民币)","汽车销售（不含品牌汽车）及维修；汽车配件销售；汽车装璜。",云南,丽江,"丽江市古城区丽大路"
文山金源商贸有限公司,91532600750678224C,2003-07-03,N/A,杜光伟,"21,500(万元人民币)","农副产品销售；三七种植及销售；物流服务；房地产开发经营；自有房屋和场所租赁服务。",云南,文山,"云南省文山壮族苗族自治州文山市开化南路永通桥头"
勐腊县建筑工程公司第六施工队,915328237506794381,2003-07-03,N/A,陈克科,"N/A","房屋建筑工程施工总承包叁级，房屋装修与维修，设备安装。兼营范围：",云南,西双版纳,"云南省西双版纳州勐腊县城北路(建材综合市场内)"
保山市花城宾馆有限公司,91530500757199701L,2003-07-03,N/A,王云,"420(万元人民币)","酒店、茶室经营；烟、酒、百货、预包装食品的销售。",云南,保山,"云南省保山市隆阳区永昌镇兰苑巷1号"
中国联合网络通信集团有限公司澜沧分公司,9153082877856056XL,2003-07-03,N/A,杨永华,"N/A","固定通信业务、蜂窝移动通信业务、第一类卫星通信业务、第一类数据通信业务、网络接入业务、国内甚小口径终端地球站（VSAT）通信业务、固定网国内数据传送业务、无线数据传送业务、用户驻地网业务和网络托管业务、因特网数据中心业务、语音信箱业务、传真存储转发业务、X.400电子邮件业务、呼叫中心业务、因特网接入服务业务和信息服务业务；其他工业和信息化部批准经营的基础电信业务和增值电信业务。经营与通信及信息业务相关的系统集成、技术开发与服务、设备生产与销售、设计施工业务；招标代理；自有房屋出租；电子通信器材的销售；专业人员培训；物业管理；技术交流和信息咨询；广告业务。",云南,普洱,"云南省普洱市澜沧拉祜族自治县勐朗镇勐朗大街五交化出租屋"
安宁农业生产资料有限责任公司八街镇销售点,91530181MA6K78K70D,2003-07-04,N/A,廖路心,"N/A","化肥、农膜、农机具、饲料的销售。",云南,昆明,"云南省八街镇东湖小区"
开远市金泰饲料有限公司,915325027506867260,2003-07-04,N/A,包维全,"50(万元人民币)","浓缩饲料、配合饲料生产、加工、销售",云南,红河,"开远市西湖坝9号"
云南农生饲料有限公司,91530422750678849Q,2003-07-04,N/A,何祖训,"1,000(万元人民币)","配合饲料、浓缩饲料、混合饲料、饲料添加济的生产及销售；饲料原料的销售；畜禽养殖；水产品养殖；农产品收购。",云南,玉溪,"云南省玉溪市澄江县龙街街道办事处提古社区提古村"
云南华强工贸有限公司,91530100750683285N,2003-07-04,N/A,陈荣华,"100(万元人民币)","水电站开发、建设、管理及咨询；房屋管理及咨询；普通机械及电器产品、金属材料（除稀贵金属）、建筑材料、装饰材料、五金交电、矿产品、日用百货的批发零售、代购代销（依法须经批准的项目，经相关部门批准后方可开展经营活动）",云南,昆明,"云南省昆明市高新区二环西路398号"
云南鸿翔一心堂药业(集团)股份有限公司嵩明东街连锁店,91530127750684480X,2003-07-04,N/A,尹世升,"N/A","药品（根据《药品经营许可证》核定的经营范围和时限开展经营活动）、I、II、III、类医疗器械（凭许可证经营）、食品（凭许可证经营）、保健食品、消毒产品、农副产品、日用百货、化妆品的销售；眼镜的验配、销售；其他服务；受委托代收费；国内贸易、物资供销。",云南,昆明,"嵩明县嵩阳镇东街"
呈贡东龙金属制版加工厂,91530121L02667637Y,2003-07-04,个人独资企业,杨卫民,"N/A","模具加工销售．",云南,昆明,"呈贡县斗南镇斗南村路口"
中国联合网络通信集团有限公司镇沅分公司,915308257755439910,2003-07-04,N/A,张传勇,"N/A","固定通信业务、蜂窝移动通信业务、第一类卫星通信业务、第一类数据通信业务、网络接入业务、国内甚小口径终端地球站",云南,普洱,"云南省普洱市镇沅县金山路"
安宁天兴水处理剂有限公司,915301817506742827,2003-07-04,N/A,夏建伟,"1,000(万元人民币)","工业循环水处理剂、水质净化剂、环境污染防治设备、玻璃钢制品的生产销售（依法须经批准的项目，经相关部门批准后方可开展经营活动）",云南,昆明,"安宁市昆钢平顶山（动力厂第四总降压站旁）"
云南大理泛亚汽车城有限责任公司,915329007506750740,2003-07-04,N/A,张文,"5,000(万元人民币)","汽车及零部件、机电产品、橡胶制品、日用百货（含磷洗涤用品除外）的批发、零售；房屋、场地租赁；汽车信息服务；停车服务；房地产开发、经营。",云南,大理,"云南省大理白族自治州大理市大理经济开发区苍山东路539号"
云南大丰建筑勘察设计有限公司,915303027506751383,2003-07-04,N/A,何会祥,"200(万)","乙级建筑工程及相应的工程咨询及装饰设计。",云南,曲靖,"云南省曲靖市环城东路"
中国石化销售有限公司云南西双版纳石油分公司勐海曼列加油站,915328227928737496,2003-07-04,N/A,孙林,"N/A","石油制品（汽油、柴油、煤油、润滑油、沥清、石腊）零售，洗车服务。日用百货便利店、预包装食品、冷冻（藏）食品的经营；卷烟零售。",云南,西双版纳,"云南省西双版纳州勐海县勐遮乡"
大理万里信息有限责任公司,9153290176043555X4,2003-07-06,N/A,周绮文,"10(万元人民币)","租房、售房、信息咨询；商务信息咨询、家庭文化教育信息咨询。",云南,大理,"云南省大理州大理市下关泰兴市场内商铺茶叶一条街5号"
祥云县金鹏麻业有限公司,91532923750680041H,2003-07-07,N/A,朱国荣,"218(万元人民币)","亚麻种植、销售。",云南,大理,"云南省大理白族自治州祥云县禾甸镇大棚村达连海"
昆明市紫扬汽车服务有限公司,91530100750674944N,2003-07-07,N/A,杨正旺,"30(万元人民币)","二类汽车维修；汽车配件、摩托车配件的零售（依法须经批准的项目，经相关部门批准后方可开展经营活动）",云南,昆明,"云南省昆明市官渡区六甲乡盘龙村第三村民小组"
镇康南华南伞糖业有限公司工会委员会,81530924091302636G,2003-07-07,N/A,字海舟,"50(万)","糖料种植和收购、复合肥、白糖生产加工、销售、(承租)、农用五金、经营各类商品及技术的边境贸易进出口业务(国家限定公司经营和国家禁止进出口的商品及技术除外)；经营边贸进料加工和“三来一补”业务；经营边境地区对外经济技术合作和易货贸易等业务",云南,临沧,"云南省镇康县南伞镇南伞糖厂"
红河州华信房地产开发有限公司.,915325007506895801,2003-07-07,N/A,熊学亮,"816(万元人民币)","房地产开发；房地产经营；建筑材料、工艺美术品（除金银首饰、象牙制品）销售；绿化；观赏鸟养殖；户外广告代理、设计、制作、发布业务、儿童乐园;物业管理；房屋租赁、场地使用（依法须经批准的项目，经相关部门批准后方可开展经营活动）",云南,红河,"云南省红河州开远市南正街159号"
中国联合网络通信集团有限公司景东分公司,91530823775549728H,2003-07-07,N/A,张传勇,"N/A","固定通信业务、蜂窝移动通信业务、第一类卫星通信业务、第一类数据通信业务、网络接入业务、国内甚小口径终端地球站（VSAT）通信业务、固定网国内数据传送业务、无线数据传送业务、用户驻地网业务和网络托管业务、因特网数据中心业务、语音信箱业务、传真存储转发业务、X.400电子邮件业务、呼叫中心业务、因特网接入服务业务和信息服务业务；其他工业和信息化部批准经营的基础电信业务和增值电信业务。经营与通信及信息业务相关的系统集成、技术开发与服务、设备生产与销售、设计施工业务；招标代理；自有房屋出租；电子通信器材的销售；专业人员培训；物业管理；技术交流和信息咨询；广告业务。",云南,普洱,"云南省普洱市景东县景川路194号"
云南科技出版社有限责任公司图书市场经营部,91530000763872448W,2003-07-07,N/A,木健全,"N/A","国内版书刊批发、零售。",云南,昆明,"云南省昆明市新闻路图书批发市场348号"
云南龙山化肥有限公司,91530181216821633Q,2003-07-07,N/A,杨焱,"300(万元人民币)","三元复合肥、普通过磷酸钙、磷矿粉生产销售；化肥相关原料购销；农副产品购销；国内贸易、物资供销；液氨、乙酸乙酯、乙酸、硝酸铜、硝酸铁、硝酸铅、氨水、正磷酸购销；仓储服务",云南,昆明,"安宁市草铺镇下麒麟村"
昆明捷成杰彩印包装有限公司,915301007506744349,2003-07-07,N/A,杨应娟,"1,150(万元人民币)","出版物、包装装潢印刷品的印刷；电力设备、普通机械及配件、建筑材料、装饰材料、塑料制品、橡胶制品、文体用品、纸制品、办公用品、仪器仪表、日用百货、工艺美术品的销售（依法须经批准的项目，经相关部门批准后方可开展经营活动）",云南,昆明,"昆明市春城路329号"
昆明新云动力广告有限公司,91530100750676819U,2003-07-07,N/A,孙海浩,"50(万元人民币)","设计、制作、代理、发布国内各类广告；文化办公用品、建筑材料、包装材料、汽车配件、日用百货、金属材料的销售（依法须经批准的项目，经相关部门批准后方可开展经营活动）",云南,昆明,"昆明市五华区武成路旧改片区35号望湖雅筑1幢1单元201号"
中国联合网络通信集团有限公司孟连分公司,915308277755429561,2003-07-07,N/A,吴佳倚,"N/A","固定通信业务、蜂窝移动通信业务、第一类卫星通信业务、第一类数据通信业务、网络接入业务、国内甚小口径终端地球站",云南,普洱,"云南省普洱市孟连县大街11号1幢1单元602室(百富广场)"
云南昆影文化影视有限公司,9153000075069331X2,2003-07-07,N/A,邱红,"500(万元人民币)","设计、制作国内各类广告；代理提供电影、电视各类演职人员的中介服务及各类演职专业人才的培训；电影、电视文学剧本的组稿、收集、推广服务；电影、电视的化妆、服装、道具、布置景、美术、灯光照明、摄影配套器材及其它相关设备的租赁及制作服务；文化艺术的咨询服务。",云南,昆明,"云南省昆明市西园路麻园3号"
昆明宏普科技有限公司,91530100750676800Y,2003-07-07,N/A,杨承晖,"100(万元人民币)","计算机软硬件开发；信息网络安全技术检测及技术服务；国内贸易、物资供销（依法须经批准的项目，经相关部门批准后方可开展经营活动）",云南,昆明,"昆明市关上中路63号汇溪大厦A座616室"
昆明坝塘发电有限责任公司,91530113750680105X,2003-07-07,N/A,钟东,"2,400(万元人民币)","水力发电销售；水利水电开发；农副产品加工销售（依法须经批准的项目，经相关部门批准后方可开展经营活动）",云南,昆明,"东川区新村路124号"
昆明轻舞飞扬网络有限公司,915301027506769820,2003-07-07,N/A,李志坤,"60(万元人民币)","互联网上网服务；计算机软件的开发；硬件维护；网页设计（依法须经批准的项目，经相关部门批准后方可开展经营活动）",云南,昆明,"云南省昆明市五华区西翥街道办事处大村社区居委会西村第四居民小组54号"
昆明市农业生产资料有限公司平远镇分公司,91532622770450673N,2003-07-07,N/A,马跃金,"N/A","化肥、农药器械零售。",云南,文山,"云南省文山壮族苗族自治州砚山县平远镇商贸街-"
云南金呈房地产开发经营有限公司,915301007506779501,2003-07-07,N/A,文旭,"10,000(万元人民币)","房地产开发经营；信息咨询服务（凭许可证开展经营活动）；接受客户代理房地产买卖及租赁业务；建筑材料经营（依法须经批准的项目，经相关部门批准后方可开展经营活动）",云南,昆明,"云南省昆明经开区出口加工区监管大楼304室"
昆明康顺达科技有限公司,91530100750677205K,2003-07-07,N/A,陈琪,"50(万元人民币)","工业自动化程序的技术开发及应用，计算机软、硬件的开发及应用，计算机系统集成及综合布线；电子设备、普通机械设备、建筑材料、仪器仪表、五金交电、光学仪器的销售；医用电子仪器设备，医用光学器具、仪器及内窥镜设备，医用超声仪器及有关设备，手术室、急救室、诊疗室设备及器具，临床检验分析仪器及诊断试剂ⅡⅢ类医疗器械的零售（依法须经批准的项目，经相关部门批准后方可开展经营活动）",云南,昆明,"昆明市环城西路328号太阳城5楼26、27号"
中国联合网络通信集团有限公司勐腊县分公司,915328236979980333,2003-07-08,N/A,李杰,"N/A","固定通信业务、蜂窝移动通信业务、第一类卫星通信业务、第一类数据通信业务、网络接入业务、国内通信设置服务业务；国内甚小口径终端地球站（VSAT）通信业务、固定网国内数据传送业务、用户驻地网业务和网络托管业务、因特网数据中心业务、语音信箱业务、X400电子邮件业务、呼叫中心业务、因特网接入服务业务和信息服务业务；电子通信器材的销售；承办展览；专业人员培训；物业管理；技术交流和信息咨询；广告业务。",云南,西双版纳,"云南省西双版纳傣族自治州勐腊县迎宾路昆曼新天地1-301号"
昭通市世贵汽车有限责任公司,9153060075067571XN,2003-07-08,N/A,李志华,"50(万元人民币)","汽车销售(不含小轿车)，汽车修理，汽车配件，汽车停放，汽车美容。",云南,昭通,"云南省昭通市昭阳区珠泉路中段"
昆明靓彩涂料工程有限公司,9153010075067790XM,2003-07-08,N/A,宋晓涓,"50(万)","室内装饰工程设计与施工；建筑材料、装饰材料的销售",云南,昆明,"昆明市西华小区东区2幢2单元5层501号"
昆明展靖商贸有限公司,91530111750677459E,2003-07-08,N/A,阮进义,"2,000(万元人民币)","国内贸易、物资供销",云南,昆明,"云南省昆明市官渡区东聚建材城东16幢16-12号"
昭通市花琪食品实业有限责任公司,91530600750677352Y,2003-07-08,N/A,杨国锋,"300(万元人民币)","糕点生产、销售。",云南,昭通,"云南省昭通市昭阳区北顺城街5幢13号"
云南青珍工贸有限公司,9153011175067651XN,2003-07-08,N/A,杨静,"500(万元人民币)","野生菌、果、蔬及农副产品的收购、生产、加工、销售；花卉的收购、销售；经营本企业自产产品及技术的出口业务和本企业所需的机械设备、零配件、原辅材料及技术的进口业务，但国家限定公司经营或禁止进出口的商品和技术除外（依法须经批准的项目，经相关部门批准后方可开展经营活动）",云南,昆明,"昆明官渡区六甲乡盘龙办事处"
