云南一星工程造价咨询有限公司,91530381753584629F,2003-09-23,N/A,沈立清,"150(万元人民币)","编制建设工程概算、预算、结算、标底；招标、投标、报价；工程造价纠纷鉴定；编报、审查建设项目竣工结算；建设项目可行性研究及经济评价；其它工程造价咨询业务；资产评估；各类工程的勘察、设计、施工、监理以及与工程建设有关的重要设备（进口机电除外）、材料采购招标的代理（以上经营范围按资质证经营）",云南,曲靖,"云南省曲靖市宣威市西宁街道龙堡路西段333号"
云南一卡通旅游有限公司,91530100753564767Y,2003-09-23,N/A,朱志杰,"300(万元人民币)","承办昆明地区旅行社接待的旅游团体费用网络结算管理（依法须经批准的项目，经相关部门批准后方可开展经营活动）",云南,昆明,"昆明市正义路99、101、103号7楼"
昆明天日选矿机械有限公司,915301007535645057,2003-09-23,N/A,莫天云,"50(万元人民币)","矿山机械设备的制造、销售及零配件加工、铸造；废钢收购；橡胶制品、五金制品、建筑材料、装饰材料、汽车配件、摩托车配件的销售；货物进出口、技术进出口业务（国家限制项目除外）（依法须经批准的项目，经相关部门批准后方可开展经营活动）",云南,昆明,"昆明市西郊大普吉昆禄公路口"
武定县恒雄矿业经贸有限公司,9153232975356488XY,2003-09-23,N/A,杨开荣,"1,000(万元人民币)","许可经营项目：矿产品加工、销售。一般经营项目：井巷矿产品开采施工、土石方爆破工程施工。",云南,楚雄,"云南省楚雄州武定县狮山镇狮山路南段（武定鸿霈投资有限公司2号楼3楼）"
昆明华裕中林林业有限公司,91530100753569170C,2003-09-23,N/A,胡建增,"50(万元人民币)","花卉的销售；以下经营范围限分公司经营：树苗、花卉的培植与销售；荒山育林（依法须经批准的项目，经相关部门批准后方可开展经营活动）",云南,昆明,"云南省昆明市高新区西二环路576号"
蒙自市城郊供销社红寨生产资料门市,91532522574695155K,2003-09-23,N/A,李水莲,"N/A","农药、化肥、农膜、农机具。兼营范围：",云南,红河,"蒙自市红寨镇政府对面"
剑川县林兴木材有限公司马登贮木场,91532931MA6KUQBT8F,2003-09-23,N/A,高国锦,"N/A","木材、木制产品生产、加工、销售经营范围中涉及前置审批的按许可证经营",云南,大理,"剑川县马登镇"
峨山彝族自治县农村信用合作联社亚尼分社,915304267951649138,2003-09-23,N/A,陈永兵,"N/A","吸收公众存款；发放短期、中期和长期贷款；办理国内结算；办理票据承兑与贴现；代理发行、代理兑付、承销政府债券；买卖政府债券、金融债券；从事同业拆借；代理收付款项及代理保险业务；提供保管箱服务；经银行业监督管理机构批准的其他业务。",云南,玉溪,"峨山县塔甸镇亚尼街"
中国石化销售有限公司云南迪庆石油分公司环西路加油站,91533400MA6K839L7M,2003-09-23,N/A,杜伟,"N/A","汽油、柴油、灯用煤油、燃料油零售、石油设备、器材零售，日用百货便利店经营；卷烟零售（依法须经批准的项目，经相关部门批准后方可开展经营活动）",云南,迪庆,"云南省迪庆藏族自治州香格里拉市金沙路52号"
呈贡长河塑料制品厂,91530121753568565P,2003-09-23,个人独资企业,杨蓉,"N/A","保留营业执照，不得开展经营活动。",云南,昆明,"云南省昆明市呈贡区乌龙街道三岔口"
云南省楚雄金瑞实业有限公司,91532300753567175G,2003-09-24,N/A,武龙祥,"200(万元人民币)","纺织品、服装、鞋帽、日用百货、五金建材、自行车及配件、家俱销售，经营场所、摊位及相关设施的租赁、经营管理和服务，金属构件、农副产品的加工及销售。",云南,楚雄,"云南省楚雄彝族自治州楚雄市鹿城西路88号"
昆明和平盛市商贸有限公司,915301007535662798,2003-09-24,N/A,王可凡,"300(万元人民币)","国内贸易、物资供销；汽车销售；汽车租赁;代办汽车过户手续（依法须经批准的项目，经相关部门批准后方可开展经营活动）",云南,昆明,"昆明市二环北路下河埂村云锡小区5幢22-27号"
红河州大地锦德房地产开发有限公司石屏分公司,915325257535674072,2003-09-24,N/A,郭树生,"N/A","房地产开发与经营（国家有专项规定的除外）。",云南,红河,"石屏县湖滨路大地公司项目部"
腾冲翡翠商贸有限责任公司,91530522760425335L,2003-09-24,N/A,赵元兴,"1,500(万元人民币)","建筑材料、五金机电、汽车零配件销售；日用百货零售；住宿服务。",云南,保山,"云南省保山市腾冲市腾越镇满邑下村"
云南金塔实业有限公司,915304217535701045,2003-09-24,N/A,赵龙日,"580(万元人民币)","魔芋、农副产品加工销售；魔芋精粉、农副产品、花卉和农产品及瓜果蔬菜的种子种苗组培和出口销售。",云南,玉溪,"云南省玉溪市江川区江城镇江抚路"
昆明钢铁集团有限责任公司汽车运输分公司,91530181753574930K,2003-09-24,N/A,王礼全,"N/A","普通货运、危险货物运输（3类），危险货物运输（1类），危险货物运输（2类）；一类汽车维修（大中型货车维修，小型车辆维修，危险货物运输车辆维修）及技术咨询服务；道路旅客运输；货运站服务；停车、洗车及汽车美容服务；国产汽车及工程机械销售；汽车配件及机电产品经营、钢材销售。国内贸易，物资供销；预包装食品兼散装食品的零售；粮油的销售；保险兼业代理业务",云南,昆明,"安宁市连然镇太极山小菜园"
富源县旺达经销有限公司,91530325217312208E,2003-09-24,N/A,邓继华,"500(万元人民币)","煤炭及制品批发零售；煤炭资源投资开发（依法须经批准的项目，经相关部门批准后方可开展经营活动）",云南,曲靖,"云南省曲靖市富源县胜境街道多乐社区秧鸡脚塘子"
云南九洲医院有限公司,915300007535658236,2003-09-24,N/A,李德林,"3,000(万元人民币)","按医疗机构执业许可证核定的范围经营（经营范围中涉及专项审批的项目按经营许可证经营）、保健食品销售。",云南,昆明,"云南省昆明市白云路235号"
云南中驰风尚房地产有限公司,915300007535669738,2003-09-24,N/A,周涛,"1,000(万元人民币)","房地产开发经营，经营信息咨询服务，建筑材料，农副产品，金属材料，装饰材料的批发、零售、代购代销",云南,昆明,"云南省昆明市穿金路349号"
新华人寿保险股份有限公司玉溪中心支公司,915304007535701550,2003-09-24,N/A,向阳,"N/A","个人意外伤害保险；个人定期死亡保险；个人两全寿险；个人终身寿险；个人年金保险；个人短期健康保险；个人长期健康保险；团体意外伤害保险；团体定期寿险；团体终身保险；团体年金保险；团体年金保险；团体短期健康保险；团体长期健康保险；经中国保监会批准的其他人身保险业务；代理仅限大地财产保险股份有限公司险种。",云南,玉溪,"玉溪市红塔区抚仙路17号(世纪华庭正对面)"
中国人寿保险股份有限公司兰坪县营销服务部,91533325795178928Y,2003-09-24,N/A,和丽萍,"N/A","对营销员开展培训及日常管理；收取营销员代收的保险费、投保单等单证；分发保险公司签发的保险单、保险收据等单证；接受客户的咨询和投诉；经保险公司核保，营销服务部可以打印保单；经保险公司授权，营销服务部可以从事部分险种的查勘理赔。",云南,怒江,"云南省怒江傈僳族自治州兰坪白族普米族自治县金江路三江大道旁16号附1号"
云南百江燃气有限公司福达路门店,915300007414658411,2003-09-24,N/A,李长永,"N/A","经营液化石油气，销售本公司自产的液化石油气相关配套产品、其它石油能源化工产品；燃气燃烧器具的安装、维修；二甲醚供应；燃气类设备、计量器具及用具、仪器仪表及配件、供热设备及配件的安装、维修和批发、零售；厨房设备、用具及配件、净水设备、酒店设备的批发和零售；百货、日化及日用品、食品及饮料、五金、家用电器等的批发和零售；广告代理、保险代理等。",云南,昆明,"云南省昆明市盘龙区宋旗营新村57号"
昆明天河滨健康服务有限公司,915301007535656634,2003-09-24,N/A,段咏梅,"10(万)","足疗技术咨询",云南,昆明,"昆明市东寺街花椒巷5号小花椒巷2号"
云南德宏交通运输(集团)有限责任公司芒市红房子娱乐中心,91533100MA6K5EJX2B,2003-09-24,N/A,张晓东,"N/A","KTV包房、洗头、按摩服务。",云南,德宏,"云南省德宏州芒市勐焕路62号"
昆明鑫泽科技开发有限公司,9153010075356533XG,2003-09-24,N/A,张洪茂,"300(万元人民币)","计算机软硬件的开发及应用；计算机系统集成；计算机技术及网络技术的开发、咨询及服务；工业自动化控制系统的设计；电器机械及器材、普通机械及配件、电子产品、通信器材、计算机及配件、日用百货、办公用品、五金交电、矿产品、建筑材料的销售；机械设备租赁；经济信息咨询（依法须经批准的项目，经相关部门批准后方可开展经营活动）",云南,昆明,"昆明市盘龙区龙泉路918号办公楼2-1至2-5"
禄劝昱华建材煤业有限责任公司,91530128L026661839,2003-09-24,N/A,陈朝海,"2,000(万元人民币)","机电、金属材料、建筑材料、百货、烟煤、无烟煤、石膏、水渣购销。",云南,昆明,"云南省禄劝秀屏路英子龙"
昆明智源广禾商贸有限公司,91530100753566367N,2003-09-24,N/A,徐群,"30(万元人民币)","建筑材料、装饰材料、五金交电、日用百货、普通机械、办公用品、电子产品、金属材料、橡胶制品、纸及纸制品、计算机及配件的零售",云南,昆明,"昆明市豆腐营永兴路2-11幢504号"
怒江恒源商贸有限责任公司,91533321709865626Q,2003-09-24,N/A,李维经,"37.3000(万元人民币)","粮油、预包装食品销售；房屋租赁、市场管理服务。",云南,怒江,"泸水县六库镇人民路195号恒源商贸城内"
福贡县马吉供销合作社,91533323919342882H,2003-09-24,N/A,余荣华,"N/A","百货、五金交电、生活日常用品、针纺织品、农业生产资料、副食品、中药材、植物油类，烟花爆竹。",云南,怒江,"福贡县马吉乡"
云南省马龙县金泰实业有限责任公司,91530321757171215F,2003-09-24,N/A,李云华,"122.5000(万)","机制钢锄销售。",云南,曲靖,"云南省曲靖市马龙县工业经济(规划)园区"
丽江市古城区金安园林有限公司,9153070275359101XK,2003-09-24,N/A,和学圣,"50(万元人民币)","花卉、林果、苗木育种；园林绿化；牲畜饲养；农特产品、建筑材料、百货销售；土石方工程、装修工程。",云南,丽江,"云南省丽江市古城区香格里大道1144-6号"
昭通鑫马商贸有限责任公司,91530600753568725B,2003-09-24,N/A,马松,"50(万元人民币)","建筑建材，地衡过磅，五金交电，农副土特产（不含烟叶，棉花，粮油限零售）。",云南,昭通,"云南省昭通市昭阳区环东路324号"
昆明三腾广告有限公司,915301007535658909,2003-09-24,N/A,柳林,"50(万元人民币)","设计、制作、代理、发布国内各类广告（依法须经批准的项目，经相关部门批准后方可开展经营活动）",云南,昆明,"昆明市小坝麻线营"
玉溪市江川区农村信用合作联社海浒分社,91530421574689652F,2003-09-25,N/A,金四顺,"N/A","吸收公众存款；发放短期、中期和长期贷款；办理国内结算；办理票据承兑与贴现；代理发行、代理兑付、承销政府债券；买卖政府债券、金融债券；从事同业拆借；代理收付款项及代理保险业务；提供保险箱服务；经银行业监督管理机构批准的其他业务；经中国保监会核准的财产险、人身险保险代理业务。",云南,玉溪,"云南省玉溪市江川区大街街道海浒村"
西双版纳源诚贸易有限公司,915328007535680987,2003-09-25,N/A,撒慈明,"50(万)","日用百货、五金交电、化工产品、橡胶制品、塑料制品、矿产品、机械设备、农机具、农副产品销售；货物进出口；技术进出口。",云南,西双版纳,"云南省西双版纳州景洪市世纪新城HB-301室"
昆明晓东万鑫汽车配件有限公司,91530111753566527U,2003-09-25,N/A,王斌,"2,180(万元人民币)","汽车配件的加工、销售；物业管理；仓储理货；房屋租赁。",云南,昆明,"昆明市官渡区小板桥镇土桥村委会"
昆明迪美生健身运动有限公司,915301007535661567,2003-09-25,N/A,刘金龙,"30(万元人民币)","健美操、体育舞蹈、器械健身服务；体育用品、文化用品、办公用品、百货的销售",云南,昆明,"昆明市柏联广场A座7层会所701-703号"
元谋兴盛绿色食品有限责任公司,91532328753568717C,2003-09-25,N/A,张永祥,"10(万元人民币)","农药零售；菜豆、三叶瓜、大蒜的种植推广以及配套服务所需的化肥、农膜、种子（限售小包装种子）的零售。",云南,楚雄,"云南省楚雄彝族自治州元谋县老城乡老城街"
中国邮政集团公司云南省永平县杉阳支局,91532928577285880T,2003-09-25,N/A,席吉新,"N/A","邮政基础业务、邮政增值业务、邮政附属业务以及国家邮政局批准开办的其他邮政业务、邮政金融业务；经中国保监会核准的财产险、人身险。代办电信业务；社会各类代办业务；代办开放经营的电信、信息业务以及国家允许开办的其他服务项目。与邮政业务相关的设计、施工等服务项目；出版物的连锁经营、批发业务；农用物资（农药、化肥、液肥、饲料及饲料添加剂）的连锁经营及分销配送服务；经中国保监会核准的财产险、人身险。代售火车客票。",云南,大理,"云南省大理白族自治州永平县杉阳镇杉阳街-"
昆明吉瑞祥物业服务有限公司,915301007535666312,2003-09-25,N/A,李青,"300(万元人民币)","接受委托进行物业管理（依法须经批准的项目，经相关部门批准后方可开展经营活动）",云南,昆明,"云南省昆明市五华区威远街166号龙园金龙阁1901号"
昆明霖海微生物工程有限公司,915301007535660929,2003-09-25,N/A,张在海,"10(万元人民币)","微生物冶金工程技术研究与开发、技术服务与咨询（依法须经批准的项目，经相关部门批准后方可开展经营活动）",云南,昆明,"云南省昆明市高新区北区M2-8-1地块傲云峰小区7幢1单元15层1504号"
昆明开胜建筑工程有限公司,91530122753567933C,2003-09-25,N/A,栾宏元,"720(万元人民币)","房屋、公路及其他土木工程的建筑、承包、施工服务；房屋装修装饰工程承包、施工服务；门窗制造、五金建材销售。",云南,昆明,"云南省昆明市晋宁区昆阳街道办事处昆阳街11号"
保山市正兴建材有限责任公司,91530500753566885K,2003-09-25,N/A,王自刚,"210.2000(万元人民币)","水泥生产及销售。",云南,保山,"云南省保山市隆阳区西邑乡羊邑街"
呈贡民生经贸有限公司誉盛分公司,91530121MA6K32GN8D,2003-09-25,N/A,李艳坤,"N/A","车辆存放、过磅服务（依法须经批准的项目，经相关部门批准后方可开展经营活动）",云南,昆明,"云南省昆明市呈贡区停车场内(粮食市场内"
昆明永源鑫物资经贸有限公司,91530100753567466G,2003-09-25,N/A,王勇,"400(万元人民币)","国内贸易、物资供销；金属材料、稀贵金属、有色金属、废旧物资、废旧书报、废塑料、旧设备、废玻璃、旧电器、旧器材的收购、销售：劳务派遣；搬运装卸（依法须经批准的项目，经相关部门批准后方可开展经营活动）",云南,昆明,"昆明市五华区普吉路363号"
曲靖市恒原物资经贸有限责任公司,91530302753566025J,2003-09-25,N/A,莫崇坤,"200(万)","汽车及汽车配件、摩托车配件、农业机械、机械设备、电子设备、金属材料、建筑装饰材料",云南,曲靖,"云南省曲靖市小坡"
中国邮政集团公司云南省永平县曲硐支局,91532928577285944Q,2003-09-25,N/A,吴续王,"N/A","邮政基础业务、邮政增值业务、邮政附属业务以及国家邮政局批准开办的其他邮政业务、邮政金融业务。代办电信业务；社会各类代办业务；代办开放经营的电信、信息业务以及国家允许开办的其他邮政项目，与邮政业务相关的设计、施工等服务项目；出版物连锁经营、批发业务；农用物资（农药、化肥、液肥、饲料及饲料添加剂）的连锁经营及分销配送服务；代理经中国保监会核准的财产险、人身险。",云南,大理,"云南省大理白族自治州永平县博南镇曲硐村"
昆明奥斯通管道材料有限公司,915301007535696051,2003-09-25,N/A,黄柠柠,"2,500(万元人民币)","供、排水管道、建筑材料、金属材料、五金交电、电器机械及器材、计算机及配件、日用百货的销售；以下范围限分公司经营：新型墙体材料、供排水管道的生产（依法须经批准的项目，经相关部门批准后方可开展经营活动）",云南,昆明,"昆明市官渡区六甲乡六甲下村"
玉溪市江川区农村信用合作联社大营分社,91530421574691947W,2003-09-25,N/A,金四顺,"N/A","吸收公众存款；发放短期、中期和长期贷款；办理国内结算；办理票据承兑与贴现；代理发行、代理兑付、承销政府债券；买卖政府债券、金融债券；从事同业拆借；代理收付款项及代理保险业务；提供保险箱服务；经银行业监督管理机构批准的其他业务；经保监会核准的财产险、人身险保险代理业务。",云南,玉溪,"云南省玉溪市江川区大街街道大营黄家庄"
昆明福林曜升房地产开发有限公司,91530100753554809W,2003-09-25,N/A,杨莎,"305(万美元)","按照城市总体规划，在昆明市官渡区双龙乡进行房地产开发、销售及提供配套服务和管理（依法须经批准的项目，经相关部门批准后方可开展经营活动）",云南,昆明,"云南省昆明市五华区宝善街福林广场五楼"
大理杭泰新建材有限公司,91532901218672168A,2003-09-25,N/A,杨绍全,"193.2000(万元人民币)","新型墙体材料、新型防水材料和其他建筑材料的制造、施工及售后服务。",云南,大理,"云南省大理州大理市下关北郊下沿线阳南河中段"
昆明妍娜医疗器械有限公司,915301007535667468,2003-09-25,N/A,万有华,"100(万元人民币)","医疗器械的零售；五金交电、玻璃仪器、塑料制品、农副土特产品、电线电缆、电子产品、计算机及配件、卫生洁具、办公用品、针纺织品的销售（依法须经批准的项目，经相关部门批准后方可开展经营活动）",云南,昆明,"昆明市春城路123号兴杰现代城A座503A"
中国人寿保险股份有限公司砚山县支公司平远镇营销服务部,915326225971118614,2003-09-25,N/A,杨文燕,"N/A","人寿保险、健康保险、意外伤害保险及各类人身保险业务；各类人身保险服务，咨询和代理业务，国家保险监督管理部门批准的其他业务",云南,文山,"云南省文山壮族苗族自治州砚山县平远镇新平路"
昆明昌泽翔商贸有限公司,91530100753568477U,2003-09-25,N/A,彭雁超,"100(万)","国内贸易、物资供销",云南,昆明,"昆明市人民西路427号海天大厦12楼A座01号附2号"
昆明富新春彩色印务有限公司,9153010075356744XM,2003-09-25,N/A,金颖捷,"1,000(万元人民币)","出版物印刷；包装装璜印刷品印刷；图文设计、制作、制版；摄影服务；国内贸易、物资供销（依法须经批准的项目，经相关部门批准后方可开展经营活动）",云南,昆明,"云南省昆明经开区创新科技孵化器产业基地2-2-2号地块"
玉溪市江川区农村信用合作联社大庄分社,91530421574688369X,2003-09-25,N/A,金四顺,"N/A","吸收公众存款；发放短期、中期和长期贷款；办理国内结算；办理票据承兑与贴现；代理发行、代理兑付、承销政府债券；买卖政府债券、金融债券；从事同业拆借；代理收付款项及代理保险业务；提供保险箱服务；经银行业监督管理机构批准的其他业务；经保监会核准的财产险、人身险保险代理业务。",云南,玉溪,"云南省玉溪市江川区大街街道星象路"
云南素美生物技术发展有限公司,91530100753566244M,2003-09-25,N/A,陈林松,"200(万元人民币)","从事芦荟制品及生物资源产品的开发、研究及技术咨询；保健食品、化妆品、预包装食品及散装食品的销售。",云南,昆明,"云南省昆明高新区科发路139号云南省大学科技园、云南留学人员创业园A2栋207、208"
玉溪市锦星机械厂,915304007535726799,2003-09-25,个人独资企业,柴连全,"N/A","机械设备安装制作，机电产品、机械铸件、建材销售。",云南,玉溪,"云南省玉溪市高新区民心街37号"
保山市隆新食品有限责任公司,91530502218931641H,2003-09-25,N/A,杨锡汪,"200(万元人民币)","肉、禽、蛋及水产品，农产品，百货，纺织品、日用品，五金交电，建材销售；市场交易服务与场内房屋、货台出租管理，农产品市场管理服务；屠宰（分支机构经营）。",云南,保山,"云南省保山市隆阳区兰城街道下水河13号"
中国邮政集团公司云南省永平县龙门支局,915329285772859876,2003-09-25,N/A,姚树贤,"N/A","邮政基础业务、邮政增值业务、邮政附属业务以及国家邮政局批准开办的其它邮政业务、邮政金融业务。代办电信业务；社会各类代办业务；代办开放经营的电信、信息业务以及国家允许开办的其它服务项目与邮政业务相关的设计、施工等服务项目；出版物连锁经营、批发业务；农用物资（化肥、农药、液肥、饲料及饲料添加剂的连锁经营及分销配送服务，经中国保监会批准的财产险、人身险。",云南,大理,"云南省大理白族自治州永平县龙门乡羊街-"
福贡县石月亮乡供销社,91533323919342890C,2003-09-25,普通合伙,韩宝瑛,"N/A","百货文化、五金交电、针纺织品、农业生产资料、副食品、中药材、植物油类、烟花爆竹。",云南,怒江,"福贡县石月亮乡"
西双版纳雅丽商贸有限公司,915328007571846573,2003-09-25,N/A,陈福珍,"50(万元人民币)","针纺织品、家具、灯具、日用杂品、计算机销售、日用百货批发零售，烟、预包装食品",云南,西双版纳,"云南省西双版纳州景洪市勐泐大道59号"
中国邮政集团公司云南省永平县北斗邮政所,91532928577285899P,2003-09-26,N/A,马字军,"N/A","邮政基础业务、邮政增值业务、邮政附属业务以及国家邮政局批准开办的其他邮政业务、邮政金融业务。代办电信业务；社会各类代办业务；代办开放经营的电信、信息业务以及国家允许开办的其他服务项目，与邮政业务相关的设计、施工等服务项目；出版物连锁经营、批发业务；农用物资（农药、化肥、液肥、饲料及饲料添加剂）连锁经营及分销配送服务；代理经中国保监会核准的财产险、人身险。",云南,大理,"云南省大理白族自治州永平县北斗乡北斗村"
华坪大华煤炭有限责任公司,915307232192601222,2003-09-26,N/A,毛凯,"600(万元人民币)","煤炭开采、洗选加工、销售；矿山机械设备及零配件、汽车（不含小轿车）及零配件、钢材、建筑材料、五金、家用电器、百货、食品、饮料零售；住宿、饮食、慢摇吧、KTV服务；瓶装洒、糖、茶零售；集贸市场摊位租赁；房地产开发、销售；水泥、民用建筑材料购销。",云南,丽江,"云南省丽江市华坪县石龙坝乡基佐村"
云南东方糖酒有限公司,91530100753567589H,2003-09-26,N/A,范钦宇,"3,000(万元人民币)","预包装食品、散装食品、乳制品（含婴幼儿配方乳粉）、食用酒精的销售；仓储服务；代办货物运输业务（依法须经批准的项目，经相关部门批准后方可开展经营活动）",云南,昆明,"云南省昆明市高新技术开发区鑫园小区别墅58A、B幢22-23号"
中国邮政集团公司云南省永平县水泄支局,9153292857728604XA,2003-09-26,N/A,李红梅,"N/A","邮政基础业务、邮政增值业务、邮政附属业务以及国家邮政局批准开办的其他邮政业务、邮政金融业务。代办电信业务，社会各类代办业务；代办开放经营的电信、信息业务以及国家允许开办的其它服务项目；与邮政业务相关的设计、施工等服务项目；出版物的连锁经营、批发业务；农用物资（化肥、农药、液肥、饲料及饲料添加剂）的连锁经营及分销配送服务；代理经中国保监会核准的财产险、人身险。",云南,大理,"云南省大理白族自治州永平县水泄乡牛街河"
