中国联合网络通信集团有限公司峨山县分公司,91530426709821009A,2003-04-10,N/A,普琼珍,"N/A","固定通信业务、蜂窝移动通信业务、第一类卫星通信业务、第一类数据通信业务、网络接入业务；国内甚小口径终端地球站（VSAT）通信业务、固定网国内数据传送业务、无线数据传送业务、用户驻地网业务和网络托管业务、因特网数据中心业务、语音信箱业务、传真存储转发业务、呼叫中心业务、因特网接入服务业务和信息服务业务；其他工业和信息化部批准经营的基础电信业务和增值电信业务。全国性互联网上网服务营业场所连锁经营；利用互联网经营游戏产品、艺术品、演出剧（节）目、动画等其他文化产品、从事互联网文化产品展览、比赛等活动；经营与通信及信息业务相关的系统集成、技术开发与服务；电子通信器材的销售；承办展览；专业人员培训；物业管理；技术交流和信息咨询；广告业务。",云南,玉溪,"峨山县双江街道办事处嶍峨路(彝都大厦对面)"
云南省久泰药业有限公司嘎洒怀德仁连锁大药房,91532801748287304E,2003-04-10,N/A,余仕朋,"N/A","中成药、化学药制剂、抗生素；生化药品、中药饮片、生物制品、医疗器械、消毒产品、百货、化妆品、预包装食品、保健食品销售。",云南,西双版纳,"云南省西双版纳州景洪市嘎洒镇"
昆明市海丰益华光学配件厂,91530112748278678K,2003-04-10,N/A,昌树华,"N/A","金属、塑料零件来料加工（依法须经批准的项目，经相关部门批准后方可开展经营活动）",云南,昆明,"云南省昆明市西山区海口镇宽地坝81号"
云南鸿翔一心堂药业(集团)股份有限公司昆明王大桥连锁店,91530000750667306F,2003-04-10,N/A,尹世升,"N/A","抗生素、中药饮片、生物制品（不含血液制品、不含疫苗）、中成药、生化药品、化学药制剂；I、II、III类医疗器械（凭许可证经营）；消毒剂、消毒器械、一次性使用医疗用品和卫生用品；保健食品、预包装食品、乳制品",云南,昆明,"云南省昆明市东郊王大桥B幢4号"
大理顺泽药业有限责任公司第四药房,91532927MA6K5WJQ4J,2003-04-10,N/A,谢跃昆,"N/A","中成药、化学药制剂、生化药品、抗生素、生物制品（不含疫苗、不含血液制品）、Ⅲ类：一次性使用无菌注射器(针)；Ⅱ类：普通诊察器械、医用卫生材料及敷料、化妆品、预包装食品、保健食品、百货、眼镜零售。",云南,大理,"云南省大理白族自治州巍山彝族回族自治县南诏镇四方街"
弥渡县志钢木材加工厂,92532925MA6MJW5C9M,2003-04-11,个体,杨志钢,"N/A","锯材加工、木制品批发",云南,大理,"弥渡县新街镇客运站"
玉溪市利亨电气有限公司安装分公司,9153040274827137X1,2003-04-11,N/A,常波,"N/A","电气工程设计，安装，调试及安全防范工程。",云南,玉溪,"云南省玉溪市红塔区东风中路108-1号"
文山州华宇房地产开发有限责任公司,91532600748274909R,2003-04-11,N/A,王海燕,"5,160(万元人民币)","房地产开发、销售；房屋装修、装饰；建材批发与零售。",云南,文山,"云南省文山壮族苗族自治州文山市秀峰路99号"
玉溪市玉隆石膏制品有限责任公司,91530402748271353E,2003-04-11,N/A,钱双保,"90(万元人民币)","石膏制品制造，销售，石膏粉加工，销售。",云南,玉溪,"云南省红塔区高仓镇梁王坝"
曲靖市麒麟区枫业装饰有限责任公司,91530302748269456A,2003-04-11,N/A,熊炎明,"50(万元人民币)","室内装饰装璜设计施工丁级，五金建材、装饰材料、电器、卫生洁具、灯具零售；活动板房制作与安装。",云南,曲靖,"曲靖市环城东路珠街路口闽南建材城内临1-4号"
永胜县伯城服务有限公司,91530722709862118R,2003-04-11,N/A,史伯城,"59.2000(万元人民币)","住宿、饮食服务；舞厅、停车场；废旧物品收购；五金交电、汽车配件、日用百货、副食品、服装、卷烟零售；建材的生产和零售；太阳能器材的零售。",云南,丽江,"云南省丽江市永胜县永北镇东大街延长线"
易门致远机电工贸有限责任公司,91530425748269931L,2003-04-11,N/A,李志坚,"110(万元人民币)","机械设备、工矿备件、高锰钢铸件、磨球制造、销售，矿石销售。",云南,玉溪,"云南省玉溪市易门县绿汁镇"
易门龙翔社区服务有限责任公司,9153042574826898X9,2003-04-11,N/A,李玉琼,"30(万元人民币)","花卉种植、畜禽养殖销售。",云南,玉溪,"云南省玉溪市易门县绿汁镇"
玉溪市松杰塑胶制品有限责任公司,915304022176709619,2003-04-11,N/A,赵云松,"120(万元人民币)","橡胶型纸胶带，压敏胶，双面胶带，布基压敏胶带，炳烯免水胶带，聚乙烯保护膜胶带的生产、销售；家具，纸制品，化工原料（不含危险化学品），建筑材料，五金，水暖器材，普通机械，农机配件销售；包装装潢印刷（不含出版物）。",云南,玉溪,"云南省玉溪市红塔区凤凰路141号"
元谋县江边供销合作社腊甸综合农药化肥经营部,91532328750656068N,2003-04-11,股份制企业(非法人),蔡欣芹,"N/A","农药零售；化肥、农膜、日用杂品、建筑五金、农械、饲料零售。",云南,楚雄,"云南省楚雄彝族自治州元谋县江边乡腊甸村"
云南康瑞德医药有限公司,91532300713475452L,2003-04-11,N/A,倪玉琼,"155(万元人民币)","中药材、中药饮片、中成药、生化药品、化学药制剂、抗生素、生物制品（不含血液制品、不含疫苗）、蛋白同化制剂及肽类激素、保健食品、预包装食品、乳制品（不含婴幼儿配方乳粉）、Ⅰ类、Ⅱ类、Ⅲ类医疗器械、玻璃仪器、化妆品、百货的批发和零售；农副产品的收购及销售。",云南,楚雄,"云南省楚雄州楚雄市西郊河前（楚雄林源林产品工业有限责任公司内）"
河口易通商贸有限公司,91532532748268322F,2003-04-11,N/A,汪国发,"60(万元人民币)","纺织品、服装及日用品、文化、体育用品及器材、机械设备、五金交电及电子产品、建材、玻璃、橡胶及制品、饲料、水果、蔬菜、肉制品、粮食、预包装食品、矿产品、化肥、化工产品及化工原料（不含危险化学品）的销售；货物进出口、技术进出口（依法须经批准的项目，经相关部门批准后方可开展经营活动）",云南,红河,"云南省红河州河口县北山大道中段(易通商住楼"
曲靖市麒麟区供销社建筑建材装璜有限公司美居家装分公司,91530300787393265G,2003-04-11,有限责任公司,孙宗涛,"N/A","家庭室内装饰施工。(以上范围中涉及专项审批，按审批项目和时限经营)*",云南,曲靖,"云南省曲靖市玄坛西路"
玉溪晨兴矿冶科技开发有限公司,915304007482701744,2003-04-11,N/A,孙宏生,"430(万元人民币)","矿业工艺技术与产品研究，岩矿及环保样品化验，矿业技术咨询和技术服务。",云南,玉溪,"云南省玉溪市高新区南祥路16号"
昆明绩驰环保科技有限公司,915301007482720222,2003-04-14,N/A,李楠,"500(万元人民币)","环保节能产品、污水、给水、垃圾、废气、废渣处理及相关配套设施的开发、设计、技术咨询及服务；环保设备配件、机电产品、五金交电、建筑材料、矿产品、煤炭、劳动保护用品、电气设备、金属材料制品、橡胶制品、塑料制品的销售；环保工程、园林绿化工程的设计与施工；工程机械设备租赁（依法须经批准的项目，经相关部门批准后方可开展经营活动）",云南,昆明,"昆明市金康园1幢1单元404号"
云南百江燃气有限公司岗头村门店,91530000748271062R,2003-04-14,N/A,李长永,"N/A","经营液化石油气，销售本公司自产的液化石油气相关配套产品、其它石油能源化工产品；燃气燃烧器具的安装、维修；二甲醚供应；燃气类设备、计量器具及用具、仪器仪表及配件、供热设备及配件的安装、维修和批发、零售；厨房设备、用具及配件、净水设备、酒店设备的批发和零售；百货、日化及日用品、食品及饮料、五金、家用电器等的批发和零售；广告代理、保险代理等。",云南,昆明,"云南省昆明市五华区烟草二号路远洋风景小区1号铺面"
昆明银发地产咨询服务有限公司,91530100748272460N,2003-04-14,N/A,李秋霖,"30(万元人民币)","土地政策咨询、代办理土地证；工程测量、地藉测绘、房产测绘（依法须经批准的项目，经相关部门批准后方可开展经营活动）",云南,昆明,"云南省昆明市西山区云投景苑2栋1单元0302号"
红河金源生物科技有限公司,915325007194492392,2003-04-14,N/A,林庆贤,"3,000(万元人民币)","生物产品研究、开发",云南,红河,"云南省红河州蒙自经济技术开发区生物资源加工区(蒙自市海滨路南段西侧)"
昆明新阳光管理咨询有限公司,91530100748269720E,2003-04-14,N/A,张智,"56(万元人民币)","质量、环境、安全、卫生产品认证的咨询；企业管理、财务管理、公共关系、礼仪的咨询策划；清洁生产审核咨询（依法须经批准的项目，经相关部门批准后方可开展经营活动）",云南,昆明,"云南省昆明市官渡区佴家湾454号1幢6单元702号"
安宁厚德物业管理有限公司,91530181748272671G,2003-04-14,N/A,王瑜,"50(万元人民币)","物业管理、家政服务。",云南,昆明,"安宁市太平镇西山别墅莱濛区56幢"
昌宁德康生物科技有限公司,915305247482797266,2003-04-14,N/A,郑俊祥,"800(万元人民币)","植物提取精制、香精、香料、植物生物技术中间体生产销售、货物进出口；植物栽培；硫酸烟碱、烟碱提取、生产销售。",云南,保山,"昌宁县田园镇草场坝28号"
昆明裕宏食品有限公司,91534001748269691X,2003-04-14,N/A,胡春平,"420(万元人民币)","蜜饯、糖果制品（糖果）的加工及销售。",云南,昆明,"昆明市官渡区大板桥工业园"
丽江泰鑫酒店有限公司,91530702748272743T,2003-04-14,N/A,邓建国,"50(万元人民币)","住宿、餐饮、文化娱乐、装饰装璜；房屋租赁服务；建材销售。",云南,丽江,"云南省丽江市古城区雪山中路"
云南华之味食品有限公司,91530000748264516B,2003-04-14,N/A,秦贵忠,"400(万元人民币)","生产、加工及销售自产的畜禽产品、水产品及其副产品的熟食制品、工业用白冰；仓储、冷冻冷藏服务。",云南,昆明,"云南省昆明市官渡区前卫镇双凤社区"
景东彝族自治县发科农机有限公司,915308237452727640,2003-04-14,N/A,谢亚舜,"10(万元人民币)","农机、农业科学技术开发利用，信息咨询服务，汽车、机电产品、家用电器、农副产品、建筑材料、轮胎、润滑油零售。",云南,普洱,"云南省普洱市景东县锦屏镇大草地"
昆明迅雷水泥制品工贸有限公司,915301007482732362,2003-04-14,N/A,陈志伟,"50(万)","水泥制品的生产及销售；建筑材料、装饰材料、仪器仪表的销售；钢筋机械连接技术的推广及应用",云南,昆明,"云南省昆明市东郊大石坝有色十四冶机化公司内"
昭通市滇东北机动车商贸有限公司,915306027482710385,2003-04-14,N/A,马彭驰,"510(万元人民币)","东风悦达起亚品牌汽车销售、二手车交易；房屋租赁、场地租赁；商务咨询服务；会议会展服务；汽车零配件销售；汽车销售的商务代理。",云南,昭通,"昭阳区团结路（交警支队对面）"
云南昭通昭阳农村商业银行股份有限公司洒渔支行苏家院分理处,91530602916990729D,2003-04-14,N/A,段鸿先,"N/A","（与公司经营范围一致",云南,昭通,"云南省昭通市昭阳区苏家院镇"
昆明丰新凯洋通讯设备有限公司,91530100748268744M,2003-04-14,N/A,姜涛,"200(万)","通讯设备、通信器材、数字蜂窝移动电话机的销售（不含移动电话机维修）；办公设备、日用百货、五金交电的销售；计算机软硬件的开发及销售；经济信息咨询",云南,昆明,"昆明市东风东路48号金泰大厦9楼905-B号"
元江县因远万红酒厂青石制品销售门市,91530428763877206J,2003-04-14,个人独资企业,关万红,"N/A","青石制品加工、销售。",云南,玉溪,"元江县因远镇北泽村"
云南昭通昭阳农村商业银行股份有限公司北闸支行盘河分理处,91530602216991755U,2003-04-14,N/A,魏清江,"N/A","与公司经营范围一致（凭许可证件开展经营）。",云南,昭通,"云南省昭通市昭阳区盘河镇"
昆明隆润科技有限公司,91530100748271679P,2003-04-14,N/A,王剑,"50(万元人民币)","计算机软、硬件、电器机械成套设备的研究、开发及应用；计算机系统集成；计算机、电器成套设备、仪器仪表、环保设备、电器元件、电线电缆、电子产品、汽车配件、橡胶制品、办公用品、五金交电、金属材料（稀贵金属除外）、装饰材料、建筑材料的销售（依法须经批准的项目，经相关部门批准后方可开展经营活动）",云南,昆明,"昆明市东风东路延长线237号（昆明春源实业公司综合楼5楼）"
丽江信德拍卖有限公司,915307007482737624,2003-04-14,N/A,戚继超,"100(万元人民币)","依照法律、法规可以处分的物品或财产权利(不含文物)（依法须经批准的项目，经相关部门批准后方可开展经营活动）",云南,丽江,"丽江市古城区康仲路215号"
马关棉花山发电有限责任公司,9153262570983167XX,2003-04-14,N/A,张艺漫,"9,000(万元人民币)","水力发电；电力设备及材料、矿山机械及配件、工程机械及配件、建筑材料、农副产品销售；家用电器、五金交电、日用百货销售。",云南,文山,"云南省文山州马关县马白镇海子边社区文马路末端"
昆明方圆商贸有限责任公司,91530181709757414P,2003-04-14,N/A,李方元,"300(万元人民币)","橡胶轮胎制品、汽车配件的购销、废旧轮胎维修服务；普通货运（依法须经批准的项目，经相关部门批准后方可开展经营活动）",云南,昆明,"安宁市昆畹公路36公里"
楚雄活塞销有限公司,915323002174300440,2003-04-14,N/A,钱吉荣,"230(万元人民币)","许可经营项目：二类汽车维修（限分公司经营）。一般经营项目：汽车活塞销、汽车配件、拖拉机配件制造；经营本企业自产产品及技术的出口业务和本企业所需的机械设备、零配件、原辅材料及技术的进口业务；房屋租赁、房产销售。",云南,楚雄,"楚雄开发区乡镇企业园"
中国邮政集团公司丽江市玉龙雪山邮政所,91530700MA6KUXM423,2003-04-14,N/A,王文智,"N/A","邮政基础业务,邮政增值业务(依法须经批准的项目,经相关部门批准后方可开展经营活动)",云南,丽江,"丽江市玉龙县雪山索道上部站"
保山市新华肥皂有限责任公司,91530502218930200C,2003-04-15,N/A,沈允聪,"326.3000(万元人民币)","肥皂、肥皂粉、洗衣粉、甘油、洗发精、护发香波、餐具洗涤剂、家用合成洗涤剂的制造与销售。",云南,保山,"云南省保山市隆阳区下村工业园区惠通路"
中国邮政集团公司玉溪市江川区江城支局,91530421MA6K6KUX48,2003-04-15,N/A,赵昆明,"N/A","邮政基础业务、邮政增值业务、邮政附属业务、包括邮政函件业务、具体含电子信涵、商业信函、广告信函、广告信息、包件类业务、具体含邮购、零担货运及其它商品、劳务的销售寄递及代理、速递类业务、具体含礼仪、鲜花;报刊发行,书报刊零售、音像制品零售及出租集邮以及国家邮政局批准开办的其它业务。与邮政业务相关的设计、施工等服务项目、代办电信各项业务,吸收个人人民币储蓄存款,经中国人民银行批准的其他业务;本省范围内从事出版物连锁经营、批发业务;在农村开展农药(不含危险化学品)、化肥、不再分装的包装种子等农资配送、日用消费品的配送服务;代售火车票。(依法须经批准的项目,经相关部门批准后方可开展经营活动)",云南,玉溪,"云南省玉溪市江川区江城镇南北大街"
云南鸿翔一心堂药业(集团)股份有限公司玉溪凤凰路连锁一店,91530402748283223U,2003-04-15,N/A,尹世升,"N/A","药品（根据《药品经营许可证》核定的经营范围和时限开展经营活动）、I、II、III类医疗器械（凭许可证经营）、食品（凭许可证经营）、消毒产品、农副产品、日用百货、化妆品的销售；眼镜的验配、销售；受委托代收费。",云南,玉溪,"云南省玉溪市红塔区凤凰路42号"
中国邮政集团公司玉溪市江川区九溪支局,91530421MA6K6KUN2T,2003-04-15,N/A,郑金华,"N/A","邮政基础业务、邮政增值业务、邮政附属业务、包括邮政函件业务、具体含电子信函、商业信函、广告信函、广告信息,包件类业务、具体含邮购、零担货运及其它商品、劳务的销售、寄递及代理、速递业务,具体含礼仪、鲜花、报刊发行、书报刊零售、音像制品零售及出租、集邮以及国家邮政局批准开办的其它邮政业务。与邮政业务相关的设计、施工等服务项目、代办电信各项业务;吸收个人人民币储蓄存款,经中国人民银行批准的其他业务;在农村开展农药(不含危险化学品)、化肥、不再分装的包装种子等农资配送、日用消费品的配送服务。(依法须经批准的项目,经相关部门批准后方可开展经营活动)",云南,玉溪,"云南省玉溪市江川区九溪镇大营街"
保山市新华肥皂有限责任公司销售门市部,91530502MA6K56LW5H,2003-04-15,N/A,张玲,"N/A","肥皂、肥皂粉、洗衣粉、甘油、洗发精、护发香波、餐具洗涤剂、家具合成洗涤剂、护肤品、批发、零售。",云南,保山,"云南省保山市隆阳区兰城街道环城东路南段"
中国人寿保险股份有限公司新平彝族傣族自治县支公司漠沙镇营销服务部,91530427693054334P,2003-04-15,N/A,李有辉,"N/A","对营销员开展培训及日常管理；收取营销员代收的保险单、投保单等单证；分收保险公司签发的保险单；保险收据等相关单证；接受客户的咨询和投诉；经保险公司核保，营销服务部可以打印保单。",云南,玉溪,"新平县漠沙镇青年路58号"
中国人寿保险股份有限公司新平彝族傣族自治县支公司戛洒镇营销服务部,91530427693054457Q,2003-04-15,N/A,冯建琼,"N/A","对营销员开展培训及日常管理；收取营销员代收的保险单、投保单等单证；分收保险公司签发的保险单；保险收据等相关单证；接受客户的咨询和投诉；经保险公司核保，营销服务部可以打印保单。",云南,玉溪,"云南省玉溪市新平彝族傣族自治县戛洒镇新西路"
保山市大河拍卖有限责任公司,91530500748279363H,2003-04-15,N/A,江洪,"500(万元人民币)","委托人委托的依照法律法规可以处分的物品或财产权利（不含文物)。",云南,保山,"云南省保山市隆阳区兰城路59号"
宾川县医药有限责任公司古底门市部,91532924MA6K40UU4B,2003-04-15,N/A,姚文琴,"N/A","中成药、化学药制剂、抗生素、生化药品、消毒制剂、保健食品、日用百货、一次性使用无菌医疗器械、医用卫生材料及敷料、医用高分子材料及制品（一、二、三类）零售。",云南,大理,"云南省大理州宾川县古底乡古底街"
中国人寿保险股份有限公司新平彝族傣族自治县支公司桂山镇营销服务部,915304276930542544,2003-04-15,N/A,杨正荣,"N/A","对营销员开展培训及日常管理；收取营销员代收的保险费、投保单等单证；分收保险公司签发的保险单、保险收据等相关单证；接受客户的咨询和投诉；经保险公司核保，营销服务部可以打印保单。",云南,玉溪,"新平县桂山镇文化路"
中国邮政集团公司玉溪市江川区明珠路支局,91530421MA6K6KW747,2003-04-15,N/A,曲东红,"N/A","邮政基础业务、邮政增值业务、邮政附属业务、包括邮政函件业务、具体含电子信函、商业信函、广告信函、广告信息,包件类业务、具体含邮购、零担货运及其它商品、劳务的销售、寄递及代理、速递业务,具体含礼仪、鲜花、报刊发行、书报刊零售、音像制品零售及出租、集邮以及国家邮政局批准开办的其它邮政业务。与邮政业务相关的设计、施工等服务项目、代办电信各项业务;吸收个人人民币储蓄存款,经中国人民银行批准的其他业务;本省范围内从事出版物连锁经营、批发业务;在农村开展农药(不含危险化学品)、化肥、不再分装的包装种子等农资配送、日用消费品的配送服务。(依法须经批准的项目,经相关部门批准后方可开展经营活动)",云南,玉溪,"云南省玉溪市江川区大街街道明珠路"
中国人寿保险股份有限公司新平彝族傣族自治县支公司扬武镇营销服务部,91530427693054406G,2003-04-15,N/A,李亚萍,"N/A","对营销员开展培训及日常管理；收取营销员代收的保险单、投保单等单证；分收保险公司签发的保险单；保险收据等相关单证；接受客户的咨询和投诉；经保险公司核保，营销服务部可以打印保单。",云南,玉溪,"云南省玉溪市新平彝族傣族自治县扬武镇文明路"
保山市利兴百货有限责任公司,91530500218923510F,2003-04-15,N/A,杨绍康,"58.8000(万元人民币)","日用百货，五金交电，橡胶制品，化工原料（危险品除外），文化用品，塑料制品，纺织品，服装鞋帽，钟表眼镜，办公设备，纸及纸制品，玩具，皮革，羽绒及制品，玻璃及制品，农副产品批发、零售。",云南,保山,"云南省保山市隆阳区兰城街道办事处保岫西路93号"
中国邮政集团公司玉溪市江川区分公司,915304217098129700,2003-04-15,N/A,史俊,"N/A","邮政基础业务、邮政增值业务、邮政附属业务、包括邮政函件业务、具体含电子信函、商业信函、广告信函、广告信息、包件类业务、具体含邮购、零担货运及其它商品、劳务的销售寄递及代理;速递类业务、具体含礼仪、鲜花;报刊发行;书报刊零售;集邮以及国家邮政局批准开办的其它邮政业务。组织商品文化交流推广活动,承办会议及...",云南,玉溪,"云南省玉溪市江川区大街街道抚仙路"
昆明金逸房地产经纪咨询有限公司,915301007482735275,2003-04-16,N/A,王汝松,"10(万元人民币)","房产经纪业务；经济信息咨询服务；市场调研；企业投资咨询；营销策划；企业管理咨询服务（依法须经批准的项目，经相关部门批准后方可开展经营活动）",云南,昆明,"昆明市北市区金色大道景江花园2幢3号附1号商铺"
中国联合网络通信集团有限公司会泽县分公司,91530326748275266K,2003-04-16,N/A,钱昌,"N/A","固定通信业务，蜂窝移动通信业务、第一类卫星通信业务、第一类数据通信业务、网络接入业务、国内通信设置服务业务，国内甚小口径终端地球站（VSAT）通信业务、固定网国内数据传送业务、用户驻地网业务和网络托管业务、英特网数据中心业务、语音信箱、呼叫中心业务、因特网接入服务业务和信息服务业务，全国性互联网上网服务营业场所连锁经营，利用互联网经营游戏产品、艺术品、演出剧（节）目、动画等其他文化产品，从事互联网文化产品展览、比赛等活动，电子通信器材的销售，承办展览，专业人员培训，技术交流和信息咨询，广告业务（依法须经批准的项目，经相关部门批准后方可开展经营活动）",云南,曲靖,"云南省曲靖市会泽县金钟镇钟屏路289号"
巧家县新光铅锌实业有限责任公司,915306227194640840,2003-04-16,N/A,刘迅,"1,500(万元人民币)","铅、锌、铜矿销售、五金交电、建材、汽车配件。",云南,昭通,"云南省昭通市巧家县茂租乡茂租村"
昆明宏昌祥经贸有限公司,91530100748272452U,2003-04-16,N/A,李宏,"50(万元人民币)","橡胶、塑料制品及原料、五金、电器机械、水暖配件、汽车配件、百货的销售（依法须经批准的项目，经相关部门批准后方可开展经营活动）",云南,昆明,"昆明市昌宏路东聚建材城西12幢20号"
