中国移动通信集团河南有限公司平顶山市叶县分公司任店镇营业部,91410400MA3XDX2H5A,2003-10-09,N/A,王巧丽,"N/A","经营基础电信业务和增值电信业务",河南,平顶山,"叶县任店镇步行街西路南5米"
商丘市源中方铝业有限公司,914114027721958054,2003-10-09,N/A,崔玉峰,"3,000(万)","铝板带的生产、销售；从事货物和技术进出口业务",河南,商丘,"商丘市陇海北路"
南阳市金狮物业管理有限公司,91411300764855244E,2003-10-09,N/A,李玉芬,"500(万元)","物业管理服务、布草洗涤服务、空调清洗服务、劳务派遣",河南,南阳,"南阳高新区三号工业园"
偃师市李村供销合作社位村综合门市部,91410300MA3XARGD9Q,2003-10-09,集体分支机构(非法人),陈丁亮,"N/A","针纺、橡胶、玻璃、皮革制品、百货、日杂、文体、劳保、陶瓷用品、炊具、化肥的销售。",河南,洛阳,"洛阳市伊滨区李村镇位村"
中国移动通信集团河南有限公司孟津麻屯营业厅,91410300MA3X4TDU16,2003-10-09,N/A,周建超,"N/A","在孟津麻屯经营移动电话通信业务,出售、出租移动电话终端设备及零配件,并提供售后服务。",河南,洛阳,"孟津县麻屯镇"
中国邮政集团公司新乡市第112报刊零售亭,91410700MA40542PX3,2003-10-09,N/A,孙勇,"N/A","邮政增值业务、邮政基础业务、邮政附属业务（凡涉及许可经营的项目凭许可证经营）",河南,焦作,"机电专科学校后门汽车站牌北侧"
太平人寿保险有限公司郑州中心支公司荥阳营销服务部,914101820978072216,2003-10-09,N/A,郑鑫,"N/A","对营销员开展培训及日常管理；收取营销员代收的保险费、投保单等单证；分发保险合同签发的保险单、保险收据等相关单证；接受客户咨询和投诉；经公司核保、营销服务部可以打印保单。",河南,郑州,"荥阳市工业路48号"
安阳市辰星物业管理有限责任公司,9141050075515194XN,2003-10-09,N/A,王磊,"50(万元)","物业管理服务",河南,安阳,"安阳市灯塔路18号"
偃师市李村供销合作社农民服务部,91410300MA3XARG53X,2003-10-09,集体分支机构(非法人),董玉山,"N/A","化肥、农药（不含剧毒）",河南,洛阳,"偃师市李村镇李东村"
中国移动通信集团河南有限公司平顶山市郏县分公司茨芭乡营业部,91410400MA3X5RTK1D,2003-10-09,N/A,徐慧,"N/A","·经营范围：经营基础电信业务和增值电信业务",河南,平顶山,"郏县农村信用合作联社茨芭信用社北办公楼"
开封市中房建筑工程有限公司,91410200755159503M,2003-10-09,N/A,刘建平,"4,000(万)","土木建筑工程施工、水电暖安装，室内外装饰装修，预制构件生产，房屋拆除，建筑材料、装饰材料销售，建筑机械、设备租赁。",河南,开封,"开封市禹王台区公园路南段18号"
新乡市真毅机械有限公司,914107117551512965,2003-10-09,N/A,刘予宏,"50(万元)","过滤器及汽车零部件生产；照明设备及配件、液压件、气动件销售",河南,新乡,"牧野区西王村北梦溪路以东"
中国移动通信集团河南有限公司平顶山市郏县分公司冢头镇营业部,91410400MA3X5T0Y7Y,2003-10-09,N/A,徐慧,"N/A","经营基础电信业务和增值电信业务",河南,平顶山,"郏县冢头镇政府南100米路东"
兰考县新世纪量贩有限公司油田一分店,91410225777963930Y,2003-10-09,N/A,孔连岁,"N/A","预包装食品兼散装食品、乳制品（含婴幼儿配方乳粉）、卷烟、雪茄烟、化妆品、针织、百货、五金、日用品、文具、水果零售",河南,开封,"兰考县城关乡油田基地北区"
南阳市丰盈物资有限责任公司,914113257355349276,2003-10-09,N/A,王建伟,"500(万元)","金属建材，二、三类机电经销",河南,南阳,"内乡县城关镇大成路1号"
郑州中天环保助剂有限公司,914101827551609187,2003-10-09,N/A,王俊梅,"500(万元)","生产、销售氯化石蜡",河南,郑州,"荥阳市高村乡荆砦村"
中国邮政集团公司新乡市第109报刊零售亭,91410700MA40B5PL9Y,2003-10-09,N/A,王修莉,"N/A","邮政增值业务、邮政基础业务、邮政附属业务（凡涉及许可经营的项目凭许可证经营）",河南,焦作,"北站区新运超市门前**"
中国邮政集团公司新乡市第108报刊零售亭,91410700MA40AGDF8M,2003-10-09,N/A,晁社玲,"N/A","邮政增值业务、邮政基础业务、邮政附属业务（凡涉及许可经营的项目凭许可证经营）",河南,焦作,"北站区市场十字东北角"
英资迈世通(鹤壁)药业有限公司,914106007538916455,2003-10-09,N/A,栗广宇,"1,178(万元)","片剂(含抗肿瘤药)、硬胶囊剂、颗粒剂。",河南,鹤壁,"鹤壁经济技术开发区海河路"
中国邮政集团公司新乡市第107报刊零售亭,91410700MA3X4HL71W,2003-10-09,N/A,龚雨薇,"N/A","·经营范围：邮政增值业务、邮政基础业务、邮政附属业务（凡涉及许可经营的项目凭许可证经营）",河南,焦作,"胜利路与人民路交叉口东北角"
信阳市医药(集团)有限责任公司第二分公司,914115007067510174,2003-10-09,N/A,吕信双,"N/A","第一类医疗器械销售。",河南,信阳,"信阳市浉河区东方红大道31号"
中国邮政集团公司新乡市南干道支局,91410700794251994D,2003-10-09,N/A,郝卫华,"N/A","·经营范围：邮政增值业务、邮政基础业务、邮政附属业务、邮政储蓄业务；航空运输代理服务；即开型体育、福利彩票；商务演出票务的销售代理服务；日用品的销售；预包装食品兼散装食品零售。",河南,焦作,"河南省新乡市金穗大道161号"
鹤壁市金驹油品有限公司加油站,91410602MA3XADC92X,2003-10-09,N/A,柴小冬,"N/A","销售：润滑油。",河南,鹤壁,"鹤壁市鹤山区鹤汤路东段"
中国移动通信集团河南有限公司鲁山鲁平大道营业厅,91410400MA3X8AYU5K,2003-10-09,N/A,梁俊辉,"N/A","·经营范围：经营基础电信业务和增值电信业务",河南,平顶山,"鲁山县鲁阳镇南环路东段"
中国邮政集团公司新乡市劳动北路支局,9141070079425196XP,2003-10-09,N/A,李法海,"N/A","·经营范围：邮政增值业务、邮政基础业务、邮政附属业务、邮政储蓄业务；航空运输代理服务；即开型体育、福利彩票；商务演出票务的销售代理服务；日用品的销售；预包装食品兼散装食品零售。",河南,焦作,"新乡市宏力大道528号安康新城28号楼2单元1层2101号营业房"
巩义市恒旺耐材有限公司,914101817551536110,2003-10-09,N/A,王振卿,"50(万元)","制造、销售散状料；经销耐火砖、冶金建材、五金交电、化工产品(不含易燃易爆危险品)、百货(涉及国家专项审批的,凭许可证经营)。",河南,郑州,"巩义市大峪沟镇钟岭村"
兰考县新世纪量贩有限公司油田购物中心,91410225777963957N,2003-10-09,N/A,孔连岁,"N/A","预包装食品兼散装食品、乳制品（含婴幼儿配方乳粉）、卷烟、雪茄烟、化妆品、针织、百货、五金、日用品、文具、水果零售",河南,开封,"兰考县城关乡油田基地东大门里侧"
洛阳新渝华焊业有限公司,91410307755156214D,2003-10-10,N/A,江华,"50(万元)","焊接材料品的生产、销售，机械加工。",河南,洛阳,"洛阳市洛龙区李楼镇潘寨村西"
中国移动通信集团河南有限公司西华西夏营业厅,91411600MA404QXU2W,2003-10-10,N/A,杜亚飞,"N/A","经营周口分公司经营范围。",河南,周口,"西华县西夏镇"
许昌市华蓉服务有限公司三羊烩面,91411000665971071D,2003-10-10,N/A,李红文,"N/A","餐饮。",河南,许昌,"许昌市南关大街737号"
郑州中耐进出口有限公司,91410105755155705D,2003-10-10,N/A,项力,"100(万)","销售：机电产品（汽车除外）、五金、矿产品、农副产品、化工产品",河南,郑州,"郑州市金水区经二路2号4号楼022号"
中国邮政集团公司河南省巩义市分公司电信业务部,91410181MA40616E2A,2003-10-10,N/A,刘剑峰,"N/A","邮政基础业务、邮政增值业务、邮政储蓄业务、邮政附属业务、农资、日用消费品的连锁配送;国内航线除香港、澳门、台湾地区航线外的航空客运销售代理业务;即开型体育、福利彩票及商务演出票务的销售代理。",河南,郑州,"巩义市新兴路55号"
新乡市青年旅行社有限公司,914107007551517712,2003-10-10,N/A,张月利,"30(万元)","国内游和入境游",河南,新乡,"新乡市健康路28号"
河南富隆织造有限公司,91410704755159060R,2003-10-10,N/A,祝建立,"200(万元)","墙地砖、陶瓷产品的销售、机械加工；服装、玩具、足球、地毯的加工；藤编加工；设备租赁。",河南,新乡,"新乡市凤泉区宝山西路"
偃师市庞村供销社农资配送中心,91410300MA3XA3G669,2003-10-10,集体分支机构(非法人),赵雪芳,"N/A","农业生产资料",河南,洛阳,"洛阳市伊滨区庞村镇东庞村"
中国移动通信集团河南有限公司太康常营营业厅,91411600MA404RBA19,2003-10-10,N/A,罗进军,"N/A","经营周口分公司经营范围。",河南,周口,"太康县常营镇"
林州市东泰工贸建材有限公司,91410581755154809Y,2003-10-10,N/A,申西生,"1,000(万元)","销售:钢材、建材、机械设备、机电设备、汽车零配件、有色金属、铁矿石、精铁矿、生铁、碳素、电料、化工产品(不含易燃易爆化学危险品)；百货",河南,安阳,"林州市长安路中段路西体育中心南家和书香苑1号楼017号"
开封市新力达文化用品有限公司,91410204758376802Y,2003-10-10,N/A,张金玲,"100(万元)","文体用品，体育器材、乐器、运动服、照相器材、办公机具、日用百货的销售。",河南,开封,"开封市南书店街58号"
新郑市兴和化工有限公司,91410184753898505R,2003-10-10,N/A,王俊安,"50(万)","造纸助剂、助溜剂、显白剂、胶粘剂生产销售（危险化学品除外）",河南,郑州,"新郑市郭店镇小李庄村"
中国移动通信集团河南有限公司扶沟练寺营业厅,91411600MA40AHLJ4J,2003-10-10,N/A,张克俊,"N/A","经营基础电信业务和增值电信业务",河南,周口,"扶沟县练寺镇政府东"
中国移动通信集团河南有限公司西华皮营营业厅,91411600MA404QXK0E,2003-10-10,N/A,杜亚飞,"N/A","经营周口分公司经营范围。",河南,周口,"西华县皮营乡北大街"
许昌星光食品有限公司,914110007583983078,2003-10-10,N/A,旋彩敏,"50(万元)","预包装食品批发兼零售；房屋租赁。",河南,许昌,"许昌经济技术开发区"
河南沃通建筑设备有限公司,914101827551618302,2003-10-10,N/A,张华,"6,000(万元)","建筑机械设备的销售、维修、租赁",河南,郑州,"荥阳市产业聚集区中原路西段"
河南庆丰市场服务有限公司,91410105755153208U,2003-10-10,N/A,庆功,"1,000(万元)","房屋租赁、仓储（易燃、易爆及危险化学品除外）；销售：初级农产品（仅限杂粮）、日用百货、钢材、家用电器、电子产品、服装、其他化工产品（不含危险化学品）、电子产品；企业管理咨询。",河南,郑州,"郑州市金水区河南万邦庆丰粮油大米市场15区1号"
郑州旭隆金属材料有限公司,914101047551503735,2003-10-10,N/A,李新平,"51(万元)","钢材、建材、铝型材、机电产品、化工产品",河南,郑州,"郑州市管城区城东路幸福港湾B区二号楼二单元266号"
中国移动通信集团河南有限公司西华五二营业厅,91411600MA404QW785,2003-10-10,N/A,杜亚飞,"N/A","经营周口分公司经营范围。",河南,周口,"西华县五二农场"
中国移动通信集团河南有限公司西华红花营业厅,91411600MA404QW6X5,2003-10-10,N/A,杜亚飞,"N/A","经营周口分公司经营范围。",河南,周口,"西华县红花镇"
中国移动通信集团河南有限公司太康高贤营业厅,91411600MA404RBE4N,2003-10-10,N/A,罗进军,"N/A","经营周口分公司经营范围。",河南,周口,"太康县高贤乡"
郑州方欣生物科技有限责任公司,9141012275515522X1,2003-10-10,N/A,杨建平,"2,000(万元)","生物化学试剂及分子生物学试剂，实验室研究使用试剂、仪器、仪表、耗材的销售（国家专控除外）。医疗器械的生产和销售（凭有效许可证核定的范围经营）；生物技术咨询与服务；从事进出口业务",河南,郑州,"郑州中牟商都大街北侧万三路东(方欣工业园)"
方城县独树农资专业合作社第二综合批发部,91411322MA4048W87U,2003-10-10,N/A,李新宇,"N/A","百货糖酒饮料日用杂品针纺织品预包装食品兼散装食品乳制品（含婴幼儿配方乳粉）*",河南,南阳,"方城县独树镇龙泉路"
河南越海实业有限公司,914101057538994957,2003-10-10,N/A,朱运龙,"3,000(万元)","从事货物和技术进出口业务",河南,郑州,"郑州市金水区经三路66号1号楼4层西区"
洛阳市上杰酒店管理有限公司,9141030775515557XT,2003-10-10,N/A,翟上杰,"50(万元)","中型餐馆，住宿",河南,洛阳,"洛龙区龙门镇省工疗院内"
中国移动通信集团河南有限公司扶沟大新营业厅,91411600MA404R7G55,2003-10-10,N/A,张克俊,"N/A","经营基础电信业务和增值电信业务",河南,周口,"扶沟县大新镇政府东"
洛阳市乐奇食品加工厂,914103297648543996,2003-10-10,个人独资企业,黄雯华,"20万人民币","饮料[瓶（桶）装饮用水类",河南,洛阳,"洛阳市伊川县彭婆镇南寨村"
中国移动通信集团河南有限公司扶沟尚村岗营业厅,91411600MA404R7F7A,2003-10-10,N/A,张克俊,"N/A","经营基础电信业务和增值电信业务(上述经营项目的具体内容以工信部核发的有效许可证为准)。从事通信和互联网等网络的设计、投资和建设;通信和互联网等设施的安装、工程施工和维修;经营与通信和信息业务相关的系统集成、漫游结算清算、技术开发、技术服务、广告业务、设备销售等;出售、出租通信终端设备、互联网设备及其零...",河南,周口,"扶沟县吕潭镇政府西"
河南福森药业有限公司,91411326753898564K,2003-10-10,N/A,曹长城,"7,593.7400(万元人民币)","生产：片剂、硬胶囊剂、颗粒剂、小容量注射剂、大容量注射剂、口服液、原料药（以上项目凭有效许可证并在其核定的范围和期限内开展经营）",河南,南阳,"淅川县金河开发区"
郑州三合装饰设计工程有限公司,91410105755152686D,2003-10-10,N/A,王耀武,"5,000(万元)","建筑幕墙工程；市政公用工程；机电安装工程；室内外装饰装修工程；园林绿化工程；销售：家具、建材。",河南,郑州,"郑州市金水区民航路19号红星花园1号楼13层1309室"
中国移动通信集团河南有限公司西华奉母营业厅,91411600MA404QYR4N,2003-10-10,N/A,杜亚飞,"N/A","经营周口分公司经营范围。",河南,周口,"西华县奉母镇"
中国移动通信集团河南有限公司太康朱口营业厅,91411600MA404RB85K,2003-10-10,N/A,窦光明,"N/A","经营周口分公司经营范围。",河南,周口,"太康县朱口镇"
三门峡市康泰安全评价咨询服务有限公司,91411202757132515G,2003-10-10,N/A,郭兰芳,"500(万元)","河南省范围内安全评价（乙级）；三门峡市范围内的河南省工贸行业企业安全生产标准化评审（三级）；职业卫生技术服务",河南,三门峡,"三门峡市黄河路北六街坊8号楼10层1号"
郑州四通印刷纸制品有限公司,9141018375515792XJ,2003-10-10,N/A,梁津津,"500(万元)","出版物、包装装潢印刷品和其他印刷品、纸制品印刷、销售；印刷设备、印刷材料销售；国内广告设计、制作、发布、代理。",河南,郑州,"新密市大隗镇王沟村"
南阳市油区法维四海汽车服务有限公司,914113007551561266,2003-10-10,N/A,忽顺玉,"50(万元)","出租汽车客运",河南,南阳,"南阳油田骊山路"
中国移动通信集团河南有限公司平顶山市宝丰分公司商酒务营业部,91410400MA3X89K759,2003-10-10,N/A,张光辉,"N/A","·经营范围：经营基础电信业务和增值电信业务",河南,平顶山,"宝丰县商酒务人民政府东隔壁"
河南省华源佰信药业有限公司佰信大药房光武路店,91411302MA3X8GCKXY,2003-10-10,N/A,梁亚哲,"N/A","零售：中成药、化学药制剂、抗生素、生化药品、生物制品（除疫苗）、日用品、保健食品、预包装食品、乳制品（含婴幼儿配方乳粉）、一类医疗器械",河南,南阳,"南阳市宛城区光武路21号(光辉厂大门向西50米)"
郑州马寨燃气销售有限公司,914101037551554228,2003-10-10,N/A,徐安园,"60(万元)","瓶装燃气的销售。",河南,郑州,"郑州市二七区马寨绕城公路东边"
中国移动通信集团河南有限公司太康王集营业厅,91411600MA4076UBXR,2003-10-10,N/A,窦光明,"N/A","经营周口分公司经营范围。",河南,周口,"太康县王集乡"
中国移动通信集团河南有限公司平顶山市宝丰分公司赵庄营业部,91410400MA3X89JG2K,2003-10-10,N/A,张光辉,"N/A","·经营范围：经营基础电信业务和增值电信业务",河南,平顶山,"宝丰县赵庄乡文化路262号"
中国移动通信集团河南有限公司淮阳临蔡营业厅,91411600MA404R9Y5Y,2003-10-11,N/A,常新忠,"N/A","经营周口分公司经营范围。",河南,周口,"淮阳县临蔡镇淮南路路西"
济源市华宇矿业电器有限公司,914190017551539967,2003-10-11,N/A,张富国,"2,058(万元)","矿用高低压防爆电器、高低压成套开关设备制造销售；防爆电器配件零售。",河南,济源,"市煤气公司路西(韩村段)"
中国移动通信集团河南有限公司商水胡吉营业厅,91411600MA404QU088,2003-10-11,N/A,张克俊,"N/A","经营周口分公司经营范围。",河南,周口,"商水县胡吉乡"
中国移动通信集团河南有限公司项城官会营业厅,91411600MA404RAA50,2003-10-11,N/A,吴景志,"N/A","经营周口分公司经营范围。",河南,周口,"项城市官会东大街"
中国移动通信集团河南有限公司商水练集营业厅,91411600MA404QU163,2003-10-11,N/A,张克俊,"N/A","经营周口分公司经营范围。",河南,周口,"商水县练集乡"
中国移动通信集团河南有限公司商水张庄营业厅,91411600MA404QU24X,2003-10-11,N/A,张克俊,"N/A","经营周口分公司经营范围。",河南,周口,"商水县张庄乡"
中国移动通信集团河南有限公司项城贾岭营业厅,91411600MA404RAC1M,2003-10-11,N/A,吴景志,"N/A","经营周口分公司经营范围。",河南,周口,"项城市贾岭镇106国道西"
中国移动通信集团河南有限公司商水邓城营业厅,91411600MA404QU32Q,2003-10-11,N/A,张克俊,"N/A","经营周口分公司经营范围。",河南,周口,"商水县邓城镇"
中国移动通信集团河南有限公司项城王明口营业厅,91411600MA404RADXD,2003-10-11,N/A,吴景志,"N/A","经营周口分公司经营范围。",河南,周口,"项城市王明口镇"
中国移动通信集团河南有限公司项城范集营业厅,91411600MA404RA70D,2003-10-11,N/A,吴景志,"N/A","经营周口分公司经营范围。",河南,周口,"项城市范集乡"
中国移动通信集团河南有限公司项城南顿营业厅,91411600MA404RA89A,2003-10-11,N/A,吴景志,"N/A","经营周口分公司经营范围。",河南,周口,"项城市南顿镇清风路"
中国移动通信集团河南有限公司商水巴村营业厅,91411600MA404QTX1T,2003-10-11,N/A,张克俊,"N/A","经营周口分公司经营范围。",河南,周口,"商水县巴村镇"
中国移动通信集团河南有限公司项城高寺营业厅,91411600MA404RA975,2003-10-11,N/A,吴景志,"N/A","经营周口分公司经营范围。",河南,周口,"项城市高寺镇"
中国电信集团有限公司范县分公司,9141092676945540X0,2003-10-12,N/A,李志涛,"N/A","电信业务以中国电信集团公司基础电信业务、增值电信业务经营许可证批准的范围和期限为限：一般经营项目：与通信相关及信息业务相关的系统集成；技术开发，技术咨询服务，设备的销售和设计施工、广告、以上项目涉及国家法律法规规定须经审批的未获得批准前不得经营",河南,濮阳,"濮阳市范县新区"
郑州新视点动画制作有限公司,914101007551552385,2003-10-12,N/A,朱永胜,"51(万元)","计算机软件制作、动画制作、企业形象策划、产品营销策划及咨询服务，摄影服务，企业管理咨询，会议会展服务，文化艺术交流策划，商务信息咨询。",河南,郑州,"郑州市金水区卫生路4号1号楼"
新野县上港消费合作社香桥综合服务站,91411329MA40AW6H30,2003-10-12,N/A,宋桂叶,"N/A","主营:化肥.农药(不含杀鼠刹及危险化学品).农膜.不再分装的包装种子*兼营:小百货.日用品.五金.农副产品收购(小麦.玉米.稻谷除外)*",河南,南阳,"新野县大桥路西段北侧"
郑州兰晶电子有限公司,91410105755163115M,2003-10-12,N/A,刘雪强,"600(万元)","计算机软件开发；安全技术防范工程设计、施工（凭有效资格证经营）；销售：计算机及辅助设备、办公机具、仪器仪表（不含医用）、电子元器件电子产品、其他机械设备",河南,郑州,"郑州市金水区东风路28号世博中心603号"
郑州曙光重型机器有限公司,91410106755154083Y,2003-10-12,N/A,张杨梅,"100(万元)","机械加工及销售；从事货物进出口业务。",河南,郑州,"郑州市上街区龙江路19号"
河南德宝酒店有限公司,91410102755174383M,2003-10-13,N/A,藏建德,"100(万元)","餐饮服务：韩餐类制售：含凉菜、不含裱花蛋糕、不含生食海产品",河南,郑州,"郑州市中原区建设路125号二楼圆厅"
洛阳恩忠工贸有限公司,91410300755150680E,2003-10-13,N/A,杜青,"50(万元)","机械零部件的制造。",河南,洛阳,"洛阳市高新开发区孙辛路路东"
中国移动通信集团河南有限公司平顶山市叶县分公司龚店乡营业部,91410400MA3X8B5833,2003-10-13,N/A,王巧丽,"N/A","经营基础电信业务和增值电信业务",河南,平顶山,"叶县龚店乡龚店街龚西街"
扶沟县恒力缸盖有限公司,91411621755162200Y,2003-10-13,N/A,毛照红,"80(万)","汽缸盖加工及各种机械类加工;从事货物和技术进出口业务。",河南,周口,"河南省扶沟县产业集聚区管委会六楼"
中国移动通信集团河南有限公司平顶山市郏县分公司安良镇营业部,91410400MA3X5RY855,2003-10-13,N/A,徐慧,"N/A","经营基础电信业务和增值电信业务",河南,平顶山,"郏县安良镇政府对面"
洛阳普瑞森精密轴承有限公司,914103237551563539,2003-10-13,N/A,杨进周,"500(万元)","轴承及其配件、精密机械、光机电一体化产品的生产、销售；计算机软件开发、销售；汽车配件、摩托车配件、金属材料、复合材料及制品的批发、零售；相关技术咨询服务(不含中介服务)；从事货物和技术进出口业务",河南,洛阳,"新安县洛新产业集聚区京津北路东大科技产业园"
沈丘县农村信用合作联社下溜分社,91411624MA404WP29C,2003-10-13,N/A,武新伟,"N/A","吸收公众存款;发放贷款;办理国内结算;办理票据贴现;代理其他银行的金融业务;代理发行、代理兑现、承销政府债券和政策性金融债券;买卖政府债券、金融债券;从事同业拆借;代理收付款项及代理保险业务;提供保管箱服务;经银行业监督管理机构批准的其他业务、租赁。",河南,周口,"河南省周口市沈丘县新安集下溜集"
社旗县闯新出租汽车有限公司,91411327755150701F,2003-10-13,N/A,冯新伟,"50(万元)","出租客运",河南,南阳,"赊店镇北京路中段"
新乡市新昌化工有限公司,91410721755158981E,2003-10-13,N/A,朱命云,"500(万)","化工产品（不含易燃、易爆、有毒危险品）批发、零售",河南,新乡,"新乡县合河乡西河村"
中国移动通信集团河南有限公司平顶山市郏县分公司堂街镇营业部,91410400MA3X8AWH61,2003-10-13,N/A,徐慧,"N/A","经营基础电信业务和增值电信业务",河南,平顶山,"郏县堂街镇堂西村"
河南华农饲料有限公司,91411481755167810Q,2003-10-13,N/A,孟庆峰,"100(万元)","许可经营项目：自用粮收购、饲料加工（上述按有效许可证核定的范围和期限经营）；一般经营项目：牧畜饲料的批发",河南,商丘,"永城市芒山路北端311国道东300米"
洛阳市鑫安金属材料有限公司,914103007551540405,2003-10-13,N/A,张光波,"800(万元)","金属材料(不含贵重金属)，建材，普通机械批零。",河南,洛阳,"西工区道南路41号"
洛阳润方特油有限公司,91410322755153355B,2003-10-13,N/A,秦锋,"500(万元)","溶剂油3.6万吨/年的生产及销售（凭有效的安全生产许可证按核定范围经营）；液体石蜡、润滑油的生产、销售；建材",河南,洛阳,"孟津县平乐镇上屯村"
中国移动通信集团河南有限公司平顶山市叶县分公司旧县乡营业部,91410400MA3X8B1C07,2003-10-13,N/A,王巧丽,"N/A","·经营范围：经营基础电信业务和增值电信业务",河南,平顶山,"叶县旧县常庄村许南路西"
南阳市宏达玻璃纤维制品有限公司,91411303757121007X,2003-10-13,N/A,田广林,"600(万元)","玻璃纤维制品生产、销售（法律法规规定应经审批方可经营的项目凭有效许可证或资质证核定的经营范围经营，未获审批前不可经营)",河南,南阳,"南阳市中州西路岗西村"
河南赛维环保科技有限公司,91410102755163238B,2003-10-13,N/A,卓兰平,"50(万元)","磨具技术开发、转让，磨具生产、销售。",河南,郑州,"郑州市须水镇张湾街工业区"
