河南农大园林绿化工程有限公司,91410105752297302T,2003-07-14,N/A,谢风超,"2,000(万)","市政公用工程；河务工程；园林绿化工程；室内外装饰工程设计与施工；园林景观设计与施工；花卉、苗木种植与销售；机械设备销售。",河南,郑州,"郑州市金水区文化路52号402号"
河南纽威机械制造有限公司,914108007522649068,2003-07-14,N/A,张俊明,"1,000(万元)","机械配件加工制造；经营本企业产品的进出口业务（以上范围中凡涉及专项许可等项目，凭许可证或有关批准文件经营）",河南,焦作,"焦作新区苏家作乡寨卜昌村西口"
河南芊春园绿化工程有限公司,91411602752259824R,2003-07-14,N/A,王崇山,"1,000(万元)","城市园林绿化工程贰级资质。",河南,周口,"周口市川汇区许湾乡林场"
河南四达境外就业有限公司,9141010075226894XC,2003-07-14,N/A,武可可,"600(万元)","向境外派遣各类劳务人员",河南,郑州,"郑州高新技术产业开发区梧桐街50号24号楼2层201号"
淅川县永丰房地产开发有限公司,9141132675386513XA,2003-07-15,N/A,王克明,"220(万元)","在资质证有效期内承担房地产开发项目",河南,南阳,"淅川县上集镇铁庙村"
南阳市职工旅行社有限公司,914113037425210165,2003-07-15,N/A,刘玉永,"30(万元)","国内旅游服务、会议服务、房产咨询（不含房地产经纪及中介）",河南,南阳,"七一路市委门口西60米"
灵宝市红旗水泥制品厂,91411282752262687A,2003-07-15,N/A,薛孝民,"100(万元)","·经营范围：排水管、道沿、道板、预制构件的制造、销售。",河南,三门峡,"灵宝市城关镇牛庄村"
开封市陆稿荐食品有限公司,914102047765230527,2003-07-15,N/A,安儒祥,"30(万元)","餐饮服务。",河南,开封,"开封市鼓楼区南书店街74号"
平顶山市艺林园绿化工程有限责任公司,914104117522706524,2003-07-15,N/A,李学良,"201.6000(万元)","园林绿化",河南,平顶山,"平顶山市湛河区南环路(光明小区1号楼西单元四楼西户)"
西峡县红星汽车配件有限公司,91411323176484686R,2003-07-15,N/A,李朝军,"843(万元)","汽车配件生产销售、耐火材料、废旧钢铁购销、经营本企业自产产品及技术的出口业务和本企业所需的机械设备、零配件、原辅材料及技术的进口业务、但国家限定公司经营或禁止进出口的商品及技术除外",河南,南阳,"县城东环路(311国道与水电路交叉口)"
沈丘县嘉鑫纺织有限公司,91411624X15248893Y,2003-07-15,N/A,张建伟,"200(万元)","生产、销售:纺织品、合成纤维毛毯、针织品、纺纱、工艺品、经营本企业自产产品及技术的出口业务和本企业所需的机械设备、零配件、原材料及技术的进口业务",河南,周口,"沈丘县商临路槐店镇王楼段"
西平县供销社柏城宾馆,914117211760706510,2003-07-15,集体所有制,赵尊典,"159万人民币","房屋租赁*",河南,驻马店,"西平县柏城大道中段路南"
濮阳市安建物资有限公司,91410900752262839M,2003-07-15,N/A,邢武生,"2,000(万元)","生产加工建材；销售：钢材、化工产品（不含危险品）、门窗、集装箱、彩钢瓦、复合板、预制构件、沥青、五金工具、装潢材料、塑料制品、电子产品、机电设备及配件、机械设备及配件、仪器仪表、电线电缆、日杂百货、警示带、警示板、警示牌。",河南,濮阳,"胜利路东段路南"
河南创新教育产业发展有限公司,91410104752267226X,2003-07-15,N/A,安小兵,"300(万元)","教育信息咨询；计算机软硬件开发；销售：仪器仪表",河南,郑州,"郑州市管城区紫荆山路69号5楼"
洛阳元盛工贸有限公司,91410307752267330P,2003-07-15,N/A,王光耀,"230(万)","环保设备的研发、设计、生产、销售、安装、调试、金属制品、齿轮、金属结构、金属锻件的加工；机械设备、金属及金属矿、五金交电及电子产品的销售。",河南,洛阳,"洛阳市洛龙区安乐镇郑村"
开封市中远预应力设备有限公司,914102057522647545,2003-07-15,N/A,付峰瑜,"1,000(万元)","预应力设备及其产品的生产、销售。",河南,开封,"开封市开尉路168号"
新乡市海洋过滤器有限公司,914107827474495789,2003-07-15,N/A,岳学海,"418(万元)","过滤器加工销售。",河南,新乡,"辉县市孟电大道前李固西"
河南华通电力工程有限公司,91410500752262257T,2003-07-15,N/A,张长顺,"5,000(万元)","电力工程、承装（修、试）电力设施，建筑机电安装工程、城市道路照明工程，输变电工程，太阳能光伏系统施工，电力设备、机械设备",河南,安阳,"安阳市铁西路394号"
新野县新奥利线业有限公司,91411329752260251W,2003-07-15,N/A,赵功亭,"1,000(万元)","捻线;棉纱.麻纱.丝纱购销※",河南,南阳,"县城西环路中段北关工业园区"
河南省佳禾国际旅行社有限公司,91410202752278902E,2003-07-15,N/A,袁泉,"100(万元)","国内游和入境游。",河南,开封,"开封市龙亭区宋都御街79号"
河南诚信工程管理有限公司,91410105752263874G,2003-07-15,N/A,苗永强,"2,001(万元)","建设工程监理；招标代理；工程项目管理；工程技术咨询服务；工程造价咨询。",河南,郑州,"郑州市金水区文化路9号10层1006号"
宝丰县永发洗煤有限公司,9141040478916348X8,2003-07-15,N/A,谭斌旗,"3,000(万元)","原煤、精煤、煤泥加工。",河南,平顶山,"宝丰县大营镇韩庄村207国道东侧"
中国商标专利事务所有限公司河南分公司,9141010575226755XP,2003-07-15,N/A,张博理,"N/A","接受客户委托代理商标业务、专利业务；企业登记代理；承办商标、企业标志、包装装潢设计及相关的咨询服务。",河南,郑州,"郑州市郑花路7号"
商丘市伟娥油脂有限公司,91411400752264471B,2003-07-16,N/A,乔传伟,"200(万元)","食用植物油",河南,商丘,"商丘市310农贸市场粮油区"
封丘县黄池城市公共交通服务有限公司,91410727752268894H,2003-07-16,N/A,王素娟,"200(万元)","城区内的客运服务；房屋租赁。",河南,新乡,"封丘县城北干道西段1152号"
河南中领置业有限公司,91410100752280906N,2003-07-16,N/A,康建中,"5,000(万元)","房地产开发与经营",河南,郑州,"郑州市金水区文化路与优胜北路交叉口芯互联大厦1512号"
新乡市思达纸业有限公司,914107211731876358,2003-07-16,N/A,刘世民,"2,000(万元)","无碳复写纸制造、造纸助剂批发、零售、（涉及许可经营的凭许可证经营）",河南,新乡,"新乡县七里营镇政府北"
巩义市嵩源耐火材料有限公司,914101817522752508,2003-07-16,N/A,于正团,"500(万元)","制造、销售定型、不定型耐火材料、新型镁碳砖；经销：钢材、机电设备。",河南,郑州,"巩义市杜甫街道办外沟村"
博爱县孝敬供销合作社农资批发部,91410822MA3X902D0N,2003-07-16,集体分支机构(非法人),李素芳,"N/A","主营：化肥、农药、农地膜*兼营：日杂、百货、农副产品（不含粮食）收购*",河南,焦作,"博爱县孝敬镇东王贺村"
河南中州金银珠宝首饰有限责任公司,91410105716704636D,2003-07-16,N/A,李全喜,"501(万元)","批发零售：金银、珠宝首饰、银焊材料、工艺品。",河南,郑州,"郑州市金水区经三路东丰产路北成功花园1号楼5层502号"
汝州市天地广告有限公司,91410482752280447R,2003-07-16,N/A,吴文伟,"1,000(万元)","国内广告策划设计、制作发布代理，展览活动，照明工程及标示标牌的施工",河南,平顶山,"汝州市东建材B3区8-10号"
商丘市陇海煤炭销售有限公司,91411400752265474U,2003-07-16,N/A,刘红峰,"500(万元)","煤炭的零售；建筑材料的销售。",河南,商丘,"商丘市建设办事处曹庄村委会耿屯北村民组"
河南三众工程造价咨询有限公司,91410105752266223U,2003-07-16,N/A,张庆华,"500(万元)","工程造价咨询、工程招标代理",河南,郑州,"郑州市金水区花园路144号13层09号-10号"
河南万丽康体育文化传播有限公司,91410105752286398P,2003-07-16,N/A,韩化,"100(万元)","销售：体育用品、健身器材、文体用品、卫浴用品；设计、制作、发布国内广告业务；健身服务；企业管理咨询；物业服务。",河南,郑州,"郑州市金水区农科路38号2号楼1404号"
安阳市盛世地产咨询有限责任公司,91410502752264965Q,2003-07-17,N/A,李旗起,"10(万元)","房地产咨询服务，电子商务。",河南,安阳,"安阳市文峰区文峰中路与朝阳路交叉口安阳国贸中心C-2办公楼12层"
河南省新起起重设备有限责任公司,91410728752266952W,2003-07-17,N/A,韩松林,"1,040(万元)","通用桥式起重机.电动单梁起重机.电动葫芦桥式起重机.电动葫芦门式起重机.钢丝绳电动葫芦.起重配件制造.安装.维修",河南,新乡,"长垣县位庄起重工业园区"
郑州欣光纺织有限公司,91410103752265095R,2003-07-17,N/A,冯涛,"51(万元)","销售：纺织品、印染品、服装、纺织原料、染化料、纺织印染设备及配件。",河南,郑州,"郑州市二七区建设东路26号20号楼"
河南中原工程检测有限公司,91410900752268376F,2003-07-17,N/A,张长征,"1,500(万元)","无损检测、金属材料及制品、石油机械产品、三抽设备、钻井用承压件、阀门、井口采油树、电气产品、建筑材料、主体结构、节能、室内环境、油水检测、防腐施工及检测项目、阀门维修、检测及相关技术咨询服务。",河南,濮阳,"濮阳市大庆中路339号"
商丘市武全基础工程有限公司,91411400752277037G,2003-07-17,N/A,宋友祥,"300(万元)","地基与基础工程施工。",河南,商丘,"商丘市凯旋中路534号（市建筑设计院内）"
洛阳东鹏置业有限公司,91410300752271305B,2003-07-17,N/A,李书生,"2,000(万元)","房地产开发与经营(凭有效资质证)，建材、机械设备、水暖器材的销售。",河南,洛阳,"洛阳市西工区汉宫路62号"
商丘市土肥源肥料有限公司,91411400752267779T,2003-07-17,N/A,闫文敬,"1,220(万元)","复混肥、掺混肥生产",河南,商丘,"商丘市梁园区胜利东路10号"
新乡市华兴滤业工程有限公司,914107217522689829,2003-07-17,N/A,丁大伟,"501.1700(万元)","滤芯、滤器、滤材、过滤设备及配件制造；振动筛、水处理设备、保温材料销售；从事货物与技术进出口业务（国家法律法规规定应经审批方可经营或禁止进出口的货物和技术除外）",河南,新乡,"新乡县大召营过滤工业园区中路2号"
洛阳宜华滚动体有限公司,91410307752288211R,2003-07-17,N/A,张顺利,"9,000(万)","轴承及配件、金属结构件的制造、销售；从事货物和技术的进出口业务",河南,洛阳,"洛阳市洛龙区李楼乡景华工业园"
濮阳市汇龙科技服务有限公司,91410900761689703J,2003-07-17,N/A,李凤秋,"300(万)","计算机网络技术咨询、服务；其他印刷品印刷；批零：计算机及耗材、数码产品及设备、纸张、节能节电设备、文化体育器材、办公机具、仪器仪表、电工电料、塑料制品、通讯器材、化学试剂（不含危险品）、玻璃器皿、五金机电、石油钻采设备及配件、管材、钻具、工具、杂品、水处理设备及水质检验设备；电子自动化工程；展板、标识标牌制作；石油工程技术服务；办公机具维修（法律法规规定需专项审批的，未获审批前不得经营）。",河南,濮阳,"濮阳市中原路与文化路交叉口东50米路北"
安阳市广大印刷物资有限责任公司,914105027522833574,2003-07-17,N/A,李庆花,"50(万元)","其他印刷品，国内广告设计、制作、发布。",河南,安阳,"安阳市文峰区文明大道中段(东关村内)"
安阳市晨鑫物资有限责任公司,91410505752264973Y,2003-07-17,N/A,张世家,"50(万元)","钢材、生铁、铁矿产品、轻烧白云石粉、锰铁、硅铁、化工产品",河南,安阳,"安阳市殷都区安钢大门口东侧路北"
安阳市殷商园林绿化工程有限责任公司,914105007765159097,2003-07-17,N/A,刘庆然,"1,000(万)","园林绿化工程服务",河南,安阳,"安阳市北关区东风路北段"
临颍县烟花爆竹有限公司,91411122752264789J,2003-07-17,N/A,王国友,"50(万元)","烟花爆竹、农产品批发；零售。",河南,漯河,"临颍县铁西土产公司院内"
焦作市恒信减速机制造有限公司,91410823752263022X,2003-07-17,N/A,薛信福,"100(万元)","减速机及其配件的制造、销售；化工配套设备、铸件、电线、塑料制品的加工、销售；轴承经销",河南,焦作,"武陟县乔庙乡冯丈村"
信阳市八方电器有限责任公司,91411502MA409YKR42,2003-07-17,N/A,周国旗,"201(万元)","家用电器、通讯器材、五金交电、体育器械、厨房设备、日用百货销售；办公机具、电脑及耗材销售；废旧物品回收。",河南,信阳,"信阳市浉河区上海商场一楼"
郑州欧普陶瓷有限公司,91410184752265490B,2003-07-17,N/A,周满仓,"1,000(万元)","卫生陶瓷、日用陶瓷、工艺美术陶瓷及其它陶瓷制品的生产销售。",河南,郑州,"新郑市新村镇工业区"
郑州德河鑫食品工贸有限公司,91410103752263225F,2003-07-17,N/A,王伟,"51(万元)","生产（分装）：其它：干货食品及销售。",河南,郑州,"郑州市二七区京广南路仁恒上元1号楼2单元1801号"
鹤壁市蓝波湾商贸有限公司,91410611752261772M,2003-07-17,N/A,李利霞,"200(万元)","零售：日用百货、洗化用品、日杂用品、办公文体用品、家用电器、建筑材料、地板砖、油漆、涂料、室内外装饰装修材料。",河南,鹤壁,"鹤壁市淇滨区黄河路南侧388号"
新乡市金升物资建材有限责任公司,91410700752262142Y,2003-07-17,N/A,王世全,"50(万元)","钢材、建筑材料、五金、交电、化工（不含易燃、易爆、有毒危险品）、百货、针纺织品批发、零售（以上范围中凡涉及专项许可的项目凭许可证和有关批准文件经营）",河南,新乡,"新乡市洪门镇钢材市场B区18号"
郑州市华盛耐火材料有限公司,91410183170573039G,2003-07-17,N/A,张志远,"1,000(万元)","耐火材料系列产品的生产销售",河南,郑州,"新密市平陌镇刘门"
中国石化销售有限公司河南驻马店遂平石油分公司第七加油站,91411728737407470H,2003-07-17,N/A,闫滨,"N/A","车用乙醇汽油/柴油/润滑油、散装食品、预包装食品、烟、食盐、汽车装饰用品、化肥/零售、房屋租赁",河南,驻马店,"遂查公路南侧"
商丘丰登肥业有限公司,91411422757108056Q,2003-07-17,N/A,靳家玉,"500(万元)","复混肥、掺混肥、土壤改良剂、硫酸钾、有机无机复混肥、水溶肥、缓释肥、花草专用肥生产销售；农膜、农作物种子、小件农机具销售",河南,商丘,"商丘睢县工农路191号"
洛阳实立冶矿轴承有限公司,914103057492470568,2003-07-17,N/A,王靖亚,"30(万元)","轴承、机电产品、金属材料",河南,洛阳,"涧西区建设路110号"
河南瑞祥工程造价咨询有限公司,914101037522843689,2003-07-17,N/A,肖巧,"500(万元)","工程造价咨询。",河南,郑州,"郑州市航海路197号索克大厦6层"
虞城县供销社第二农业生产资料公司金峰农资经营部,91411425MA40BQ8144,2003-07-17,集体分支机构(非法人),张金峰,"N/A","化肥、农药、土产",河南,商丘,"虞城县人民路北段"
商丘市金伯利钻石饰品有限公司,91411402716737876A,2003-07-17,N/A,李宏,"30(万元)","黄金饰品、铂金饰品、钻石饰品零售。",河南,商丘,"商丘市民主路北东方宾馆1号综合楼"
河南省筑邦置业有限公司,9141010075226640XD,2003-07-17,N/A,汤恒,"800(万元)","房地产开发与经营",河南,郑州,"郑州市金水区三全路风雅颂社区小雅商务A座三层"
兰考县云龙木业有限公司,91410225752263815H,2003-07-17,N/A,张云龙,"100(万元)","板材、桐木板、毛拼板、木制品、工艺品、家具及家具部件加工、销售。",河南,开封,"兰考县城关乡老韩陵村"
洛阳瑞洛轴承有限公司,91410305752267357J,2003-07-17,N/A,孔繁志,"50(万元)","轴承及轴承配件、矿山机械、农机配件、金属材料",河南,洛阳,"涧西区嵩山路北段九号院嵩苑小区1号楼一层"
新密市新昌物资有限公司,91410183752272084K,2003-07-17,N/A,屈留兑,"50(万元)","建筑材料、钢材、五金、机电设备、矿山设备配件、橡胶制品销售；钢模及附件租赁。",河南,郑州,"新密市新华路东段"
开封市新丰空分设备有限公司,91410203752282696X,2003-07-18,N/A,王天庆,"50(万元)","空分设备及制氧机配件的生产、销售。",河南,开封,"开封市开黄路2号"
河南天存种业科技有限公司,91410100752266928T,2003-07-18,N/A,李文纯,"4,785(万元)","农作物种子研制、开发、推广、繁育、加工、销售；技术咨询、转让；成果转让；食用菌开发；复合肥销售；农业技术的技术研究、开发及服务；房屋租赁经营。",河南,郑州,"郑州高新开发区冬青西街97号"
平顶山市牧野农业技术服务有限公司,91410411755162702B,2003-07-18,N/A,张彩红,"306(万元)","农业项目、土地开发整理项目技术咨询服务、园林建设技术服务",河南,平顶山,"湛南路西段(畜牧局家属楼)"
河南中原隆兴苗业有限公司,914110247522647975,2003-07-18,N/A,王怀根,"1,100(万元)","花卉、苗木购销，草坪、盆景种植销售，园林器械销售。",河南,许昌,"鄢陵县陈化店镇东311国道帝豪饮品西邻"
许昌朝华伟业软件有限公司,914110007522686911,2003-07-18,N/A,雪丽霞,"30(万元)","计算机、办公自动化设备、网络设备、电脑耗材、软件零售；软件开发、网络工程开发服务。",河南,许昌,"许昌市西大街2号"
襄城县库庄供销社田庄门市部,91411025MA409NB65T,2003-07-18,集体事业单位营业,唐伟杰,"N/A","化肥、农膜",河南,许昌,"库庄乡田庄村"
新密市东达耐火材料有限公司,91410183752269029P,2003-07-18,N/A,许晓东,"850(万元)","耐火材料的生产销售及其配套服务（法律、法规规定应经审批的，未获批准前不得经营）",河南,郑州,"新密市超化镇东店"
河南省路桥集团远大公路工程有限公司,91411400752266805M,2003-07-18,N/A,卢成锋,"6,000(万元)","公路工程、公路路基工程、公路路面工程、桥梁工程施工。",河南,商丘,"商丘市睢阳区珠江东路266号"
延津县东屯供销合作社吴安屯购销站,91410726MA4054E60H,2003-07-18,集体经营单位(非法人),吴玉芬,"N/A","烟、酒、副食、百货、针紡、五金交电、文化用品、日杂。",河南,新乡,"延津县东屯镇吴安屯村"
郑州市嵩阳煤机制造有限公司,91410185752267197W,2003-07-18,N/A,弋现生,"12,000(万元)","工矿设备制造、工矿物资营销、煤矿设备维修、矿用设备进出口",河南,郑州,"登封市产业集聚区玉京大道西段南侧"
平顶山市德科机械制造有限公司,91410425752270513N,2003-07-18,N/A,张华献,"3,006.9000(万元)","液压机械制造；煤机配件加工。批发零售：机械配件、机电产品、建材、五金杂品、化工产品",河南,平顶山,"郏县行政路与和平路交叉口东路南"
河南鑫洋实业有限责任公司,914106117522645948,2003-07-18,N/A,杨峰,"1,188(万元)","淀粉、玉米油、蛋白粉、玉米浆、饴糖、希酸乳浆技术研发；销售：五金交电、化工原料",河南,鹤壁,"鹤壁市淇滨区卫河路365号"
内乡县菊潭城建服务有限公司,914113257522882973,2003-07-18,N/A,别良红,"50(万元)","混凝土作业分包",河南,南阳,"(内乡县建设局院内东二楼)县城西大街122号"
河南省路桥集团正鸿路桥建设有限公司,91411400752267787M,2003-07-18,N/A,胡功林,"3,000(万元)","公路工程、公路路基工程、公路路面工程、桥梁工程施工；建材、装饰材料的销售。",河南,商丘,"商丘市睢阳区平原路1122号"
新乡市弘宇化工有限责任公司,91410711752266039Q,2003-07-18,N/A,周爱华,"50(万元)","碳酸钙、硫酸钡、化工产品（不含危险化学品）、土产、日杂销售",河南,新乡,"新乡市牧野区吕村178号"
鹤壁市协力物资有限公司,91410603752280842X,2003-07-18,N/A,缑书宗,"50(万元)","销售：金属材料",河南,鹤壁,"山城区朝霞街霞光小区1号楼西单元2楼东户"
固始县兴业工艺品有限责任公司,91411525752264199H,2003-07-18,N/A,汤存贵,"50(万元)","柳制品工艺品、木制品、草制品、竹木混合制品、铁柳制品、藤制品、家具的收购、生产、销售及进出口贸易。",河南,信阳,"固始县三河徐桥镇"
河南省周口包装机械厂,91411602175454506G,2003-07-18,国有企业,王风志,"436.7万人民币","包装机械产品。房屋租赁、进出口贸易",河南,周口,"周口市建设路中段165号"
周口吉祥龙食品有限公司,91411624758362208T,2003-07-18,N/A,高翠荣,"150(万)","生产销售:糖果、巧克力、糕点、饮料",河南,周口,"沈丘县行政新区尚德路南段路西"
桐柏信盛石灰制造有限公司,91411330757143820Q,2003-07-18,N/A,李慧,"50(万元)","石灰生产.销售（以上经营业务范围如涉及许可证制度的，在未取得许可证以前不得从事生产经营活动）",河南,南阳,"桐柏县黄岗镇银山"
河南金宇机电工程有限公司,914101057522671896,2003-07-18,N/A,张和鑫,"5,000(万元)","机电设备安装工程；机电设备及产品、电力设备产品、电子器材、安全及消防器材、建材的销售。",河南,郑州,"郑州市金水区金水路299号浦发国际金融中心9号楼6层606号"
河南天一汽车销售服务有限公司,914100007522645358,2003-07-18,N/A,刘广聚,"1,000(万元)","汽车销售；天津一汽系列品牌汽车销售；汽车装饰；汽车展示展览服务；电动汽车、工程车、家用电器、日用百货、办公设备、摩托车、蓄电池、机油、润滑油、五金电料、电线电缆、消防器材、保健食品的销售；电子商务；房地产信息咨询服务；房屋租赁。",河南,郑州,"郑州市金水区中州大道与三全路交叉口向北200米路西蓝天加气站南边部"
安阳市星火防护包装有限责任公司,91410502172398545N,2003-07-18,N/A,陈玉宝,"50(万元)","金属切削液、清洗剂、防锈油剂加工，机电产品防护包装材料、润滑油、润滑剂销售",河南,安阳,"安阳市文峰区曙光路中段"
郑州致达装饰工程有限公司,914101027522862836,2003-07-18,N/A,张志国,"600(万元)","室内装饰装修工程",河南,郑州,"郑州市中原区陇海西路38号院1号楼4单元14号"
郑州豫新商务咨询有限公司,914101007522719620,2003-07-18,N/A,李杰,"2,000(万元)","贸易咨询、商务咨询、技术咨询。",河南,郑州,"郑州高新区玉兰街55号A区一层102号"
襄城县库庄供销社农资门市部,91411025MA404YBRXU,2003-07-18,N/A,张振华,"N/A","化肥、农膜",河南,许昌,"襄城县库庄乡西库村"
河南顺德集团强世贸易有限公司,91410402752270556R,2003-07-18,N/A,左建文,"2,000(万元)","批发：工矿配件、建筑材料。",河南,平顶山,"平顶山市新华区建设路西段(神马大酒店六楼)"
三门峡大宗资源开发有限公司,91411221769459494Q,2003-07-18,N/A,上官宣民,"2,300(万)","重晶石开采销售；矿产品购销（经营范围中国家要求许可证的项目，凭证经营)",河南,三门峡,"渑池县南村乡仁村"
平顶山市元博实业有限公司,914104037522705643,2003-07-18,N/A,司春堂,"1,500(万元)","批发兼零售：预包装食品，乳制品（含婴幼儿配方乳粉）、日用百货、日化洗涤用品、劳保用品、办公用品、土产日杂、五金工具、工矿机械配件、机电设备、电料、水暖器材、建材、计算机及配件；园林绿化工程；水果种植",河南,平顶山,"平顶山市卫东区矿工路东段北14号院(五交化公司仓库)"
郑州新佳汽车销售有限公司,914101007522779504,2003-07-18,N/A,姚海涛,"3,000(万)","汽车销售；汽车信息咨询；商务信息咨询；工程机械、机电产品、汽车零配件、汽车装饰品、电器产品、通用产品",河南,郑州,"郑州市金水区金印现代城小区3号楼2单元1801号"
孟州市全盛皮业有限责任公司,91410883758367295B,2003-07-19,N/A,张全喜,"500(万元)","皮毛皮革鞣制；皮毛皮革制品、革皮裘皮服装加工销售；化工原料经销（危险化学品除外)；从事货物进出口业务（国家法律法规规定应经审批方可经营或禁止进出口的货物除外）",河南,焦作,"孟州市南庄镇桑坡村"
河南圆方家庭服务有限公司,91410105752277125B,2003-07-19,N/A,李圆方,"100(万元)","室内外清洗保洁、家政服务",河南,郑州,"郑州市金水区城北路17号"
河南吉利包装有限公司,91410883752271225Q,2003-07-19,N/A,李培涛,"500(万元)","包装装潢印刷品；外包装袋、农作物秸秆复合模压托盘加工销售；纸箱、原纸、塑料制品、塑料颗粒销售。",河南,焦作,"孟州市黄河大道西段小坡掌村"
开封恒亚建筑材料有限公司,914102117522725007,2003-07-20,N/A,丁振邦,"851(万元)","销售：建筑材料、装饰材料、钢材、水泥、五金化工、木材、石材；企业营销策划、企业管理咨询。",河南,开封,"开封市大梁路与西环路交叉口西北角A段润达大厦6层"
