河南正博园林绿化工程有限公司,91410105749208049E,2003-04-11,N/A,马丽梅,"2,000(万元)","园林绿化工程施工、园林绿化养护与管理（凭有效资质证经营）（以上范围，国家法律、行政法规及规章规定须审批的项目除外）",河南,郑州,"郑州市金水区文化路68号1208号"
中丰建设有限公司,9141010517005671XE,2003-04-11,N/A,赵锋,"10,068(万元)","防水防腐保温工程；石油化工工程；电力工程；建筑工程；水利水电工程；机电工程；通信工程；市政公用工程；建筑机电安装工程；输变电工程；钢结构工程；模板脚手架；建筑装修装饰工程；水利水电机电安装工程；海洋石油工程；环保工程；特种工程；消防设施工程；城市及道路照明工程；机场弱电系统工程；劳务施工；设备维修，防腐保温材料销售；从事货物与技术的进出口业务；工程施工技术服务；设备租赁；防腐保温材料及五金销售（以上范围，危险化学品除外）。",河南,郑州,"长垣县南蒲街道办事处纬四路与桂陵大道交叉口小微创业园1号楼1-7号房"
新乡市大森工贸有限公司,91410711749212988K,2003-04-11,N/A,薛绍杰,"50(万元)","机械设备、电器设备、电动工具、电力器材、金属材料、建筑材料、化工（不含危化品）、土产批发零售",河南,新乡,"牧野区北干道236号"
平顶山市昊通物资有限公司,9141040274920921X0,2003-04-11,N/A,赵赛丽,"300(万元)","零售:金属材料(国家限制商品除外),建材,五金,机电产品(不含汽车)",河南,平顶山,"新华区西环路与平安大道西段交汇处路南建西建材城院西排9号"
平顶山市东方工程机械有限公司,91410402749228410R,2003-04-11,N/A,靳文杰,"200(万元)","批发、零售：工程机械设备及配件、化工产品（不含危险化学品）、五金产品；阀门、工矿配件、机电设备",河南,平顶山,"平顶山市新华区平安大道与西环路交叉口向东500米路北"
平顶山市仁信物资有限公司,9141041174920462XL,2003-04-11,N/A,孙国春,"500(万元)","批发、零售：工矿配件、五金交电、水暖、建材、电力器材、土产日杂、通讯器材、劳保用品、钢材。",河南,平顶山,"湛河区南环路南铝制品厂对面"
修武县七贤供销合作社第二门市部,91410821MA403UWX6Y,2003-04-11,集体分支机构(非法人),靳小社,"N/A","百文.针纺.五交化.家电*",河南,焦作,"七贤镇方庄村"
武陟昌荣纺织机械有限责任公司,914108231737902824,2003-04-11,N/A,翟泽栋,"70(万元)","纺织、印染、喷灌设备、木材加工设备，造纸、农业机械的加工、销售；中小型儿童游乐设备的组装及销售。",河南,焦作,"木城镇寨河街1号"
渑池县汉隆矿产品储运有限公司,91411221749212742K,2003-04-12,N/A,姚晓靖,"900(万元)","货位租赁；矿产品储运、销售；车用乙醇汽油、煤油、柴油零售。（以上范围涉及前置审批的项目,仅限分支机构凭有效许可证核定的范围经营)；有色金属销售（涉及前置许可的项目凭证经营），矿山工程施工",河南,三门峡,"渑池县英豪镇"
邓州市白牛供销社第一百货部,91411381MA40BD5NXL,2003-04-12,集体分支机构(非法人),秦书征,"N/A","针织、百货（上述经营范围涉及国家法律、法规和国务院决定规定应经审批方可经营的项目，凭有效许可证核定的范围和期限经营，未获得审批前不得经营）",河南,南阳,"邓州市白牛乡白牛街"
卢氏县潘河供销合作社新兴综合门市,91411224MA404DKH81,2003-04-12,集体分支机构(非法人),刘保学,"N/A","糖烟酒、副食、冷饮、日杂、百文针纺零售。土特产品、中药材购销。",河南,三门峡,"潘河乡潘河街"
邓州市白牛供销社百文门市部,91411381MA40BD1E0U,2003-04-12,集体分支机构(非法人),魏平会,"N/A","文具、百货销售*",河南,南阳,"邓州市白牛街"
邓州市老廷实业有限公司构林加油站,914113817066847150,2003-04-12,N/A,马宛,"N/A","车用乙醇汽油、柴油（闭杯闪点≤60℃）零售",河南,南阳,"邓州市构林邓襄路58号"
河南天道实业有限公司,914101857492068952,2003-04-12,N/A,王彦荣,"300(万元)","林木、蔬果、花木花卉种植；生态农业开发、旅游及相关产品开发、园林园艺、民族民俗文化研究及学术交流、电子商务及信息咨询。",河南,郑州,"登封市颍阳镇颍阳大道东段"
中国邮政集团公司开封市祥符区土山岗乡支局,91410212794270829T,2003-04-13,N/A,丰四海,"N/A","主营：邮政局基础业务、邮政增值业务、邮政储蓄业务（仅限分支机构凭证经营）、邮政附属业务；航空运输销售代理（需经审批方可经营的除外）；即开型体育、福利彩票、商务演出票务的销售代理；批发兼零售：预包装食品；肥料、受委托不再分装的种子、文体用品及器材、机械设备、五金交电、电子产品及耗材、日用百货的连锁配送服务及销售；汽车（不含小轿车）销售及售后服务，汽车配件销售。（以上项目涉及国家法律法规、国务院决定规定应经审批方可经营的，未获审批前不得经营，法律、法规禁止经营的不得经营）兼营：房屋租赁；通讯器材、通讯设备（不含无线）的销售、维修及附属材料销售；计算机网络设备及配套设备的销售；设计、制作、发布、代理国内广告业务。",河南,开封,"开封市祥符区土山岗乡政府西"
南阳市久乐天然日用品有限公司,91411300753864428C,2003-04-13,N/A,杨春海,"100(万)","化妆品、久乐牌胖大海含片、金银花含片、钙铁锌硒矿物质片、多维果蔬浓缩高钙片、高钙+D3片、多维钙片、蜂胶片、螺旋藻片、大豆异黄酮胶囊、决明子袋泡茶、罗布麻袋泡茶、葡萄籽软胶囊、天然芦荟软胶囊、果蔬粉、果蔬饮料、木瓜露酒销售",河南,南阳,"南阳市长江路东交312国道南久乐科技园道"
上蔡县兴蔡种业有限责任公司蔡沟分公司,91411722MA3X8P792T,2003-04-13,N/A,朱军臣,"N/A","受委托经营农作物种子、农药",河南,驻马店,"上蔡县蔡沟乡西头"
上蔡县兴蔡种业有限责任公司洙湖分公司,91411722MA3X8Q2G0N,2003-04-13,N/A,岳长云,"N/A","受委托经营农物种子、化肥零售。",河南,驻马店,"上蔡县洙湖集"
河南省宏声琴行有限公司,91410105749228314C,2003-04-13,N/A,胡泽桦,"1,001(万元)","批发兼零售：乐器、服装鞋帽、道具、灯光音响设备、体育器材、办公用品、建筑材料、电子产品、五金交电；其他机械设备租赁及维修；文化艺术交流策划、企业营销策划、企业管理咨询；销售：音乐美术教具、教学仪器及设备、消防器材、文具用品、塑料制品。",河南,郑州,"郑州市金水区文化路117号"
上蔡县兴蔡种业有限公司第二经营部,91411722MA3X8P6Y0L,2003-04-13,N/A,赵中华,"N/A","受委托经营农作物种子、化肥、农业机械零售。",河南,驻马店,"上蔡县市场路中段"
平顶山市安泰矿山机械制造有限责任公司,914104037492092444,2003-04-14,N/A,孔祥杰,"160(万元)","加工销售：矿用机械、支护用品。批发零售：工矿配件、五金工具、建材、日用百货、化工原料",河南,平顶山,"平顶山市卫东区平安大道东段(平安大道与申楼路交叉口路南)"
渑池金华新材料有限公司,914112217066660823,2003-04-14,N/A,刘志明,"1,000(万)","新型不定形耐火材料制品、耐磨材料制造与销售；本企业产品的进出口业务；矿产品购销",河南,三门峡,"渑池县产业聚集区天坛铝工业园区"
商丘市睢阳区临河店供销合作社批零部,91411403MA403XDN17,2003-04-14,集体分支机构(非法人),施善锋,"N/A","糖烟酒、副食品",河南,商丘,"商丘市睢阳区临河店集北街路西"
洛阳市星艺广告有限公司,91410300749208508M,2003-04-14,N/A,刘建彬,"50(万元)","设计、制作、代理、发布国内广告业务;标牌、灯箱、展柜、展板的制作及销售。",河南,洛阳,"洛阳市老城区春都路90号院外东5号(东道口对面)"
漯河市妇女旅行社有限责任公司,91411100749219784X,2003-04-14,N/A,钱学立,"30(万元)","国内游和入境游。",河南,漯河,"漯河市郾城区泰山路海河小区12楼一楼营业门面房"
商丘市睢阳区临河店供销合作社综合三部,91411403MA403XDQ6Q,2003-04-14,集体分支机构(非法人),侯春霞,"N/A","化肥、农膜、农药",河南,商丘,"商丘市睢阳区临河店集北街路西"
郑州恒丰磨料磨具有限公司,91410102749212259U,2003-04-14,N/A,李秀君,"800(万元)","销售：磨料磨具、五金、机电产品、建筑材料、水暖器材、土产品、日杂用品",河南,郑州,"郑州市中原区秦岭路166号院2a号楼1-2层A-02号"
洛阳凯瑞物业管理有限公司,9141030074921721X7,2003-04-14,N/A,王新立,"300(万元)","物业管理（凭有效资质证经营），家政服务；建材、家具、花卉、生活日用品的销售；君临广场、国宝花园、凯瑞凤凰名苑地下车库停车管理服务",河南,洛阳,"洛阳市西工区中州中路429号君临华府2号楼1层"
洛阳金白乐食品有限公司,91410322749205163U,2003-04-14,N/A,赵耀荣,"50(万元)","许可经营项目：饮料（固体饮料类）生产及销售",河南,洛阳,"孟津县常袋镇常袋村鹏兴路3号"
林州市城关供销合作社青林双代点,91410581MA40W1FJ2G,2003-04-14,集体分支机构(非法人),常永伏,"N/A","百货 日杂（不含烟花爆竹）副食 烟酒 预包装食品兼散装食品 乳制品（含婴幼儿配方奶粉）五金 化肥 农药 橡胶制品 塑料制品 文化用品",河南,安阳,"城郊乡青林村"
河南利华实业发展有限公司新乡分公司,9141070074920497XC,2003-04-14,N/A,刘长武,"N/A","房地产开发与经营",河南,新乡,"市开发区27号街坊丽水华庭24-25号楼1号营业房二楼"
兰考县泰奥发超市有限公司,91410225749222625A,2003-04-14,N/A,宋汉伟,"2,000(万)","卷烟、雪茄烟、预包装食品兼散装食品、乳制品",河南,开封,"兰考县城区黄河路中段西侧(黄河路与人民路交叉口路西)"
滑县留固供销社批发门市部,91410526MA404PW406,2003-04-14,集体分支机构(非法人),宋成社,"N/A","零售：烟酒、定型包装食品销售（按有效卫生许可证经营）、针纺织品*",河南,安阳,"滑县留固镇东街"
河南合美劳务派遣有限公司,91410105749213067X,2003-04-14,N/A,周立成,"1,000(万元)","劳务派遣（凭有效许可证在核定的范围内于2019年09月23日）。",河南,郑州,"郑州市金水区文化路126号院1号楼A座901室"
罗山县恒昌实业有限公司,91411521788082100R,2003-04-14,N/A,邓恒波,"1,000(万元)","二类机动车维修，汽车配件、工程机械销售，电子商务，物流服务。",河南,信阳,"罗山县产业集聚区"
洛阳欣业数码信息工程有限公司,914103007492067727,2003-04-14,N/A,张红瑜,"500(万元)","电子计算机及相关软硬件、信息工程、系统集成、网络工程的开发、设计、研究、安装；电子元器件、电子仪器、电力产品、电力设备、办公用品、建筑材料的零售；电子设备配套开发、调试、维修；信息技术咨询服务",河南,洛阳,"中国(河南)自由贸易试验区洛阳片区高新开发区丰华路6号银昆科技园5号楼5206号"
河南省内乡县永丰工艺品有限公司,9141132574920403X4,2003-04-14,N/A,张灵云,"500(万元)","墓碑、骨灰盒、工艺品石材、建筑用石材加工销售；石墨成品、冶金材料、建筑材料、装饰材料销售",河南,南阳,"河南省内乡县城滨河路与南环路交叉口"
沁阳市第一造纸机械有限公司,91410882173830133Y,2003-04-14,N/A,张公文,"100.5000(万元)","经营本企业自产的机电产品、成套设备、备件及相关技术出口业务、但国家限定的禁止出口的商品技术除外，经营本企业生产所需的机械设备、原铺材料、仪器仪表及零配件的进口业务，经营进料加工和“三来一补”业务",河南,焦作,"沁阳市葛村工业园"
河南笑脸食品有限公司,91410726749210018J,2003-04-14,N/A,孙伟,"3,380(万元)","速冻食品【速冻面米食品（生制品、熟制品）】，生产、销售。经营与本企业相关产品的进出口业务。",河南,新乡,"延津县产业集聚区食品路与北一路交叉口东北角"
河南弘都文化用品有限公司,91410300733859584P,2003-04-14,N/A,武杏霞,"510(万元)","包装装潢印刷品",河南,洛阳,"洛阳市洛龙区龙门镇龙门村广华北路上段"
河南力之星三轮摩托车制造有限公司,91410711749208110R,2003-04-14,N/A,李文玉,"6,000(万元)","三轮摩托车、农用正三轮摩托车、助力三轮车、电动三轮车、电动自行车设计、制造、销售、维修、售后服务及以上产品进出口贸易经营。",河南,新乡,"新乡市北环路西段"
郑州兴达铁路专用器材有限公司,91410100749208620A,2003-04-14,N/A,李贵军,"3,011(万元)","生产、销售：铁路连接线、道岔安装装置、SMC复合材料铸铁机构、箱盒及铁路电气系列产品。销售：铁路通讯信号器材、铁路工务器材、五金机电产品、机械电子设备、体育健身设备、电线电缆、电池、钢材、路材路料",河南,郑州,"郑州市二七区侯寨乡刘庄村"
洛阳云环汽车零部件制造有限公司,91410322L01269522G,2003-04-14,N/A,卫进功,"50(万)","汽车零部件制造及销售。",河南,洛阳,"孟津县城关镇建设南路"
郑州市普惠环保技术有限公司,91410108749209690C,2003-04-14,N/A,王光辉,"600(万元)","销售：仪器仪表、视频监控设备、环保设备及耗材、电子自动控制设备、计算机及软件和辅助设备、通讯器材、网络设备、机械设备及配件，环保设备及视频监控设备运营维护、技术开发、技术推广、技术转让、技术咨询、技术服务，非学历短期培训。",河南,郑州,"郑州市惠济区南阳路170号三江科技大厦八层811室"
林州市盛鑫汽配有限公司,91410581749216049E,2003-04-14,N/A,李长海,"300(万元)","汽车配件铸造加工销售",河南,安阳,"龙山区西街村南岸"
濮阳市远达建筑安装有限公司第十三工程处,91410922772179653H,2003-04-14,N/A,姚建强,"N/A","房屋建筑工程施工总承包、建筑装修、装饰工程专业承包、市政公用工程施工总承包。",河南,濮阳,"清丰县畜牧兽医服务中心院内"
林州市城关供销合作社蒿园双代点,91410581MA3X9NHX2G,2003-04-14,集体分支机构(非法人),尚会增,"N/A","百货 日杂（不含烟花爆竹）副食 烟酒 服装 鞋帽 针纺 预包装食品兼散装食品 乳制品（含婴幼儿配方奶粉）五金 化肥 农药 橡胶制品 塑料制品 文化用品 生鲜肉 蔬菜水果 农作物种子（不再分装的小包装种子）农业生产资料 建材 批发兼零售",河南,安阳,"城郊乡蒿元村"
新乡市京莺纸业有限公司,91410724749242845J,2003-04-14,N/A,刘锡杰,"500(万元)","原纸铸涂加工经营本企业自产产品及相关技术的进出口业务（国家限定公司经营或禁止进出口的商品及技术除外）(涉及许可经营的项目凭许可证经营)",河南,新乡,"获嘉县城西7公里处"
新郑市中博钢制品有限公司,914101847492038381,2003-04-14,N/A,柳建锋,"1,200(万元)","不锈钢、钢管、铜带、塑料、电缆材料生产加工销售。",河南,郑州,"新郑市梨河镇七里闫"
新密市隆华铸造材料有限公司,914101837492032054,2003-04-14,N/A,李三林,"50(万)","冒口覆盖剂生产销售；耐火材料销售。",河南,郑州,"新密市白寨镇老街"
灵宝函谷关旅游管理有限公司,914112827522626955,2003-04-14,N/A,张高成,"3,300(万元)","函谷关景区经营管理，景点开发及旅游服务。",河南,三门峡,"灵宝市函谷关古文化旅游区"
开封市建京建筑劳务有限公司,91410200749220179R,2003-04-14,N/A,史松国,"600(万元)","承接建筑工程劳务、市政工程劳务、房屋修缮",河南,开封,"开封市郑汴路81号楼"
正阳县新袁供销合作社春学农资部,91411724MA405A9W8F,2003-04-14,集体分支机构(非法人),周春学,"N/A","农药（不含剧毒农药和鼠药）、（不再分装）包装种子、化肥*",河南,驻马店,"正阳县袁寨乡袁寨街西"
周口市家乐福电器有限公司,914116007492322848,2003-04-14,N/A,常春霞,"100(万元)","销售家用电器、家用电器维修。",河南,周口,"周口市中州中段路西"
洛阳市东兴装饰设计工程有限公司,91410300749223409E,2003-04-14,N/A,赵曙光,"500(万元)","室内外装修装饰工程设计施工，建筑材料、装饰材料的批零。",河南,洛阳,"洛阳市西工区王城大道与九都路交汇处中迈·红东方广场A区商务楼704号房"
商丘市睢阳区闫集供销合作社雷庄生产一部,91411403MA403XAB44,2003-04-14,集体分支机构(非法人),晋宏峰,"N/A","化肥 农药",河南,商丘,"商丘市睢阳区闫集乡雷庄集路东"
舞钢市天健炉料有限公司,91410481749207628M,2003-04-14,N/A,张庆娟,"1,188(万元)","生产.销售:冶金炉料.耐火材料.有色金属.黑色金属.铁合金.铝制品；批发、零售：金属及金属矿、建材、电石；通讯及广播电视设备；废旧金属回收与销售",河南,平顶山,"朱兰建设路西段"
郑州市银隆广告文化传播有限公司,9141010374921932XD,2003-04-15,N/A,王佳祥,"80(万元)","设计、制作、发布、代理国内广告业务。",河南,郑州,"郑州市京广南路万山华庭5单元1楼3号"
郑州旺强公路工程技术有限公司,914101027492051205,2003-04-15,N/A,王松旺,"170(万元)","公路、桥梁工程技术咨询．（国家法律法规规定禁止的，不得经营；国家法律法规规定应经审批的，未获批准，不得经营）",河南,郑州,"郑州市中原区百花路19号5号楼“锦绣华庭”B座16层西北户"
周口中通汽车运输有限公司,91411600749206131R,2003-04-15,N/A,赵华营,"500(万元)","道路普通货物运输、货物专用运输",河南,周口,"周口市交通路与东环路交叉口"
商丘市蓝之火广告装璜有限公司,914114027694574641,2003-04-15,N/A,卢丽娜,"50(万元)","设计、制作、发布国内户外的广告业务，代理电视广告。",河南,商丘,"商丘市梁园归德南路37号"
泌阳县陈庄供销社范岗综合门市部,91411726MA409Y890R,2003-04-15,集体分支机构(非法人),寇付洋,"N/A","百货、纺织品、五金交电、化肥、农膜、农具*",河南,驻马店,"泌阳县陈庄乡范岗"
郑州市联晟厨房设备有限公司,91410100749213163Y,2003-04-15,N/A,叶春治,"1,000(万元)","厨具生产、销售；厨房设计；销售：厨房设备、酒店用品、五金交电、灯具、电子产品、日用百货、装饰材料、通讯器材、化工产品。",河南,郑州,"郑州经济技术开发区九龙工业园"
河南省华扬装潢设计工程有限公司,914101007507064169,2003-04-15,N/A,李华斌,"1,100(万元)","室内外装修、装饰设计施工",河南,郑州,"郑州市郑东新区商都路8号东4单元14层1401号"
河南省粤洋实业有限公司,91410104750749387C,2003-04-15,N/A,朱丹华,"300(万元)","销售：石材、石材制品及护理用品，建材、装饰材料，机电设备（不含汽车），照明设备，家电，通讯器材（除无线），玻璃制品，服装鞋帽，针纺织品的销售",河南,郑州,"郑州市管城区航海东路32号2号楼2单元16号"
扶沟县农牧场供销合作社,914116211755012532,2003-04-15,集体所有制,聂学军,"16万人民币","百货、交电、针织、农药、化肥、农膜、农副产品购销、",河南,周口,"扶沟县农牧场"
郑州金石磨料磨具有限公司,91410102749228170F,2003-04-15,N/A,王汉生,"51(万元)","陶瓷磨具生产、销售；销售：耐火材料",河南,郑州,"荥阳市崔庙镇郑庄村"
洛阳中孚机械设备有限公司,91410305749220734M,2003-04-15,N/A,蒋以波,"300(万元)","机械设备",河南,洛阳,"洛阳市涧西区工农乡王湾工业区2号"
开封市义兴塑材有限公司,9141020374921246XR,2003-04-15,N/A,刘伟杰,"100(万元)","塑钢门窗、铝合金门窗、玻璃、五金配件的销售、安装、维修。",河南,开封,"开封市禹王台区横船湾村"
周口市福利五一纸箱彩印包装厂,91411600175461773Y,2003-04-15,集体所有制,李树林,"5.6万人民币","纸箱加工、纸箱印刷。",河南,周口,"周口市五一路南段"
郑州市伯乐房地产营销策划有限公司,91410102749219178P,2003-04-15,N/A,刘玉民,"51(万元)","代理房地产营销策划、买卖、租赁、抵押及房地产有关手续，提供房地产信息咨询。",河南,郑州,"郑州市中原区伊河路50号院2号楼4单元2号"
郑州市新人和餐饮服务有限公司,91410105749211846P,2003-04-15,N/A,王慧军,"30(万元)","中餐类制售：含凉菜：不含裱花蛋糕：不含生食海产品；零售：卷烟、雪茄烟",河南,郑州,"郑州市金水区红专路东段123号一楼"
商丘市睢阳区临河店供销合作社家电百货综合部,91411403MA403XDP8X,2003-04-15,集体分支机构(非法人),张秋艳,"N/A","百货、化妆品、针纺织品、家用电器、五金交电、文化用品、日杂、玩具、化肥、农膜的零售。",河南,商丘,"商丘市睢阳区临河店集北街路西"
郑州精益金刚石工具有限公司,9141010074921625XR,2003-04-15,N/A,李道祥,"385(万元)","金刚石工具加工、销售；销售：磨料磨具、机械设备、机电设备",河南,郑州,"郑州高新区合欢西街112号"
固始县宏业液化气有限公司黎集供气三站,91411525MA3X736742,2003-04-15,N/A,董开会,"N/A","液化气、燃气具、钢瓶及零配件零售。",河南,信阳,"固始县黎集富民街"
延津县班枣供销合作社宋庄购销站,91410726MA3X5T3H7P,2003-04-15,集体分支机构(非法人),张同元,"N/A","农药",河南,新乡,"马庄乡宋庄村"
商丘科润畜牧生物工程有限责任公司,91411481776506746P,2003-04-15,N/A,翟素梅,"200(万元)","一般经营项目：牛的饲养、销售（按动物防疫条件合格证核定的范围和期限经营）",河南,商丘,"永城市刘河乡訾楼村"
固始县宏业液化气有限公司张老埠供气一站,91411525MA3X734A60,2003-04-15,N/A,何祖强,"N/A","液化气、钢瓶、燃气具及零配件零售。",河南,信阳,"固始县张老埠街道"
河南隆生园林古建筑工程有限公司,91410300749210691W,2003-04-15,N/A,曹春梅,"1,000(万元)","园林景观工程的设计、施工；园林绿地的养护；绿化苗木、花卉的种植、销售。",河南,洛阳,"洛阳市老城区马道街169号亚威金城1幢11单元11-401、402号"
固始县宏业液化气有限公司石佛店供气二站,91411525MA3X73412A,2003-04-15,N/A,崔善锋,"N/A","液化气、钢瓶、燃气具及零配件零售。",河南,信阳,"固始县石佛街道"
固始县宏业液化气有限公司张老埠供气二站,91411525MA3X738L1H,2003-04-15,N/A,孟凡中,"N/A","液化气、钢瓶、燃气具及零配件零售。",河南,信阳,"固始县张老埠街道"
河南鑫统煤矿配件有限公司,914101837492145533,2003-04-15,N/A,付永召,"300(万元)","煤矿机械配件、液压泵站配件、橡胶制品、矿山机械设备及配件、建材、耐火材料、润滑油的批发销售。(以上范围法律、法规规定应经审批后方可经营的项目除外)。",河南,郑州,"新密市嵩山大道西段"
河南亚信实业发展有限公司,91410100749212179B,2003-04-15,N/A,吴华杰,"7,000(万元)","建材、装饰材料及机电产品",河南,郑州,"郑州市郑东新区商务外环路12号19层6号"
固始县宏业液化气有限公司黎集供气二站,91411525MA3X6KHAXW,2003-04-15,N/A,王幼琴,"N/A","液化石油气、钢瓶、燃气具及配件。",河南,信阳,"固始县黎集街道"
郑州市价格事务所有限公司,914101027492285416,2003-04-15,N/A,鲁学敏,"20(万元)","价格评估及当事人委托的涉诉讼财物价格评估。",河南,郑州,"郑州市中原区中原西路27号"
延津县塔铺供销合作社五金门市部,91410726MA4054MK69,2003-04-15,集体分支机构(非法人),赵国凯,"N/A","五金、交电、化工",河南,新乡,"石婆固乡塔铺村"
延津县班枣供销合作社生活部,91410726MA4054L73X,2003-04-15,集体分支机构(非法人),冯好朋,"N/A","烟、副食、酒。",河南,新乡,"马庄乡班枣村"
河南新概念装饰工程有限公司,91410105749217121R,2003-04-15,N/A,李宁,"500(万元)","室内装饰、装修工程施工",河南,郑州,"郑州市金水区经三路66号院2号楼801号"
固始县宏业液化气有限公司柳树店供气一站,91411525MA3X738A17,2003-04-15,N/A,常国新,"N/A","液化气、钢瓶、燃气具及零配件零售。",河南,信阳,"固始县柳树街道"
延津县班枣供销合作社五金门市部,91410726MA4054L653,2003-04-15,集体分支机构(非法人),张孝民,"N/A","五金交电。",河南,新乡,"马庄乡班枣村"
滑县四间房供销社第二农药门市部,91410526MA404PUN3C,2003-04-15,集体分支机构(非法人),穗贤法,"N/A","零售：化肥、农药（不含杀鼠剂、剧毒、高毒农药）、农药械*",河南,安阳,"滑县四间房乡四间房集"
