杭州久福黄金珠宝有限公司,913301037517029195,2003-06-27,N/A,张利明,"3,000(万元人民币)","批发、零售：黄金、铂金、珠宝玉器、钻石、建筑材料、日用百货、工艺美术品、服装、皮革制品、针纺织品、装饰材料、眼镜（除角膜接触镜）、金属材料、橡胶原料、机械设备、机电设备、电子产品、通讯器材、第一类医疗器械、化妆品、燃料油、化工原料及产品（除化学危险品及易制毒化学品）、初级食用农产品（除食品、药品）、饲料、煤炭（除储存）、矿产品（除国家专控）；服务：商务信息咨询（除商品中介），图文设计，计算机软硬件的技术开发、技术咨询、技术服务及成果转让，配镜（除角膜接触镜）；货物进出口（法律、行政法规禁止除外，法律、行政法规限制的项目取得许可后方可以从事经营活动）；其它无需报经审批的一切合法项目。",浙江,杭州,"杭州市下城区杭州国际商务中心2332"
宁波格林斯粉末涂装有限公司,913302127503833708,2003-06-27,N/A,林斌,"406(万元人民币)","塑粉生产；静电喷塑加工；电器配件、五金件、塑料件的制造、加工",浙江,宁波,"宁波市鄞州云龙镇工业开发区"
慈溪市精诚印务有限公司,913302827503989198,2003-06-27,N/A,黄伟权,"150(万元人民币)","许可经营项目：包装装潢、其他印刷品印刷",浙江,宁波,"浙江省慈溪市龙山镇田央村"
永康市美杰商贸有限公司,913307847519126099,2003-06-27,N/A,楼美婵,"50(万元人民币)","商用车、摩托车、电动自行车、家用电器、五金工具销售",浙江,金华,"浙江省永康市九铃东路3290号"
桐乡市博飞特绣品有限公司,9133048375193420XG,2003-06-27,N/A,寿筱鹏,"500(万元人民币)","高仿真化纤装饰面料的刺绣加工；服饰面料的生产销售;普通道路货物运输。",浙江,嘉兴,"桐乡市乌镇镇工业园区内"
宁波市江东骏锋五金工具有限公司,91330204750373957K,2003-06-27,N/A,俞康法,"50(万元人民币)","园林工具、模具的制造、加工、批发、零售",浙江,宁波,"江东惊驾桥146-1号"
杭州市富阳区鹿山街道陆家村股份经济合作社,91330183751724165A,2003-06-27,N/A,陆飞峰,"50(万元人民币)","对本村集体资产经营管理。",浙江,杭州,"浙江省杭州市富阳区鹿山街道陆家村"
杭州福裕钢材有限公司,9133010975170296XY,2003-06-27,N/A,许伟江,"55(万元人民币)","一般经营项目：生产：轧钢；经销：五金配件，金属衣架，工艺品**",浙江,杭州,"萧山区浦阳镇安家山"
杭州惠和堂药店有限公司,91330110751703460D,2003-06-27,N/A,章红娟,"30(万元人民币)","一般经营项目：零售：处方药与非处方药：中药材、中成药、中药饮片、化学药制剂、抗生素制剂、生化药品。",浙江,杭州,"杭州余杭区乔司街道三角村维护路"
浙江千里马鞋业有限公司,913303247519222339,2003-06-27,N/A,王秀钗,"1,000(万元人民币)","一般经营项目：鞋、鞋材",浙江,温州,"永嘉县江北街道塘头工业区繁华东路58号"
永康市鑫源机械有限公司,91330784753004313J,2003-06-27,N/A,胡平法,"50(万元人民币)","机械设备、日用五金制品（不含计量器具）、不锈钢制品、厨房用具（不含木竹制品）、家用电器制造、加工、销售（依法须经批准的项目，经相关部门批准后方可开展经营活动）",浙江,金华,"浙江省金华市永康市古山镇前金村"
杭州鑫泽贸易有限公司,91330106751703815M,2003-06-27,N/A,王文英,"50(万元人民币)","批发、零售：汽车（除九座以下乘用车），工艺美术品，服装，鞋帽，纺织品，五金交电，家用电器，汽车配件，照相器材，家具，计算机及配件，日用百货，建筑材料，化工产品（除化学危险品及第一类易制毒化学品），普通机械，电子产品（除专控）；服务：室内装饰设计，汽车租赁，汽车事务代理（涉及许可证的凭证经营），商务咨询、经济信息咨询",浙江,杭州,"杭州市西湖区西溪街道马塍路锦绣文苑3幢5号"
永康市冬普五金制品有限公司,913307847519444839,2003-06-27,N/A,陈卫明,"50(万元人民币)","日用五金制品（不含计量器具），家用电器、健身器材、户外休闲用品制造、加工、销售；有色金属材料（不含危险化学品），不锈钢制品、铝制品、铁皮、钢材销售；货物及技术进出口业务",浙江,金华,"浙江省永康市象珠镇雅吕生产基地"
德清县博克斯纸箱有限公司,91330521751908773L,2003-06-27,N/A,沈立山,"50(万元人民币)","许可经营项目：无一般经营项目：纸箱加工",浙江,湖州,"德清县乾元镇卫星村"
桐乡市崇福宏球皮毛制品厂,91330483751905599W,2003-06-27,个人独资企业,沈永山,"N/A","裘皮制品的加工、裘皮服装的生产和销售；轻纺原料",浙江,嘉兴,"崇福镇上市村东坝头"
宁波舜塑薄膜有限公司,91330281747350885F,2003-06-27,N/A,吴贤弟,"1,500(万美元)","多功能薄膜的开发、生产，塑料原料的改性、造粒",浙江,宁波,"浙江省余姚市阳明科技工业园区"
乐清市金瑞五金机械配件有限公司,91330382751915658F,2003-06-27,N/A,施晓龙,"1,208(万元人民币)","五金加工、铁塔铁附件、电力金具、电线电缆、热镀锌螺丝、锻压件、防盗帽、标准件、电器加工、负荷绝缘子制造、销售。",浙江,温州,"乐清市北白象镇珠城西路158号"
浙江华宏一家科技有限公司,913302017503736072,2003-06-27,N/A,张跃军,"1,000(万元人民币)","根据甬市N安经（2017）0010危险化学品经营许可证经营",浙江,宁波,"宁波高新区创业大厦202室"
浙江协和薄钢科技有限公司,91330109749495711T,2003-06-28,N/A,邵益华,"1,700(万美元)","金属制品冷轧、镀锌、涂层精加工，钢结构制造",浙江,杭州,"浙江省杭州市萧山区红山农场"
杭州富阳区东洲街道张叶仁水泥制品厂,92330183MA2BKTUK3E,2003-06-29,个体工商户,张叶仁,"N/A","水泥侧石、水泥阴井盖板加工。",浙江,杭州,"杭州富阳区东洲街道张家村"
宁波市江北锐力金钢石制品厂,91330205750378344R,2003-06-29,个人独资企业,王志良,"N/A","一般经营项目：金钢石制品、通用零部件制造、加工。",浙江,宁波,"江北区环城北路东段334弄25号〈1-2>〈2-2〉"
浙江艾斯妮针织服饰有限公司,9133078375118359X5,2003-06-29,N/A,丁新旺,"1,721.6200(万元人民币)","服饰、服装及其他纺织品、针织品制造（不含印染）及销售；货物及技术进出口。",浙江,金华,"浙江省东阳市白云街道新潮路38号"
中国邮政集团公司浙江省余姚市临海邮政所,913302817562719350,2003-07-02,N/A,严雪丽,"N/A","一般经营项目：邮政基础业务，邮政增值业务，邮政附属业务",浙江,台州,"浙江省余姚市临山镇临海高泗公路"
余姚市万隆百草大药房有限公司,913302817503777047,2003-07-02,N/A,罗以科,"20(万元人民币)","药品经营：处方药与非处方药：（中成药，化学药制剂，抗生素制剂，生化药品，生物制品）；中药材；中药饮片；第一类医疗器械、第二类医疗器械、化妆品、百货的零售；食品经营：预包装食品、乳制品",浙江,宁波,"余姚市阳明西路234号"
中国邮政集团公司浙江省余姚市梁弄支局,913302817562715724,2003-07-02,N/A,戴波,"N/A","一般经营项目：邮政基础业务，邮政增值业务，邮政附属业务",浙江,宁波,"余姚市梁弄镇镇中路32号"
兴业银行股份有限公司台州分行,91331002751915412E,2003-07-02,N/A,李毅锋,"N/A","人民币存款、贷款、结算业务，人民币储蓄业务；外汇存款、外汇贷款、外汇汇款、外币兑换、国际结算、结汇、售汇业务；经中国人民银行批准的其他业务。",浙江,台州,"台州市椒江区金茂中心1层及23-29层"
中国邮政集团公司浙江省余姚市小曹娥邮政所,913302817562716955,2003-07-02,N/A,史金晶,"N/A","邮政基础业务，邮政增值业务，邮政附属业务",浙江,宁波,"余姚市小曹娥镇朗海南路65号"
乐清市天力电机有限公司,913303827519315944,2003-07-02,N/A,林品辉,"1,158(万元人民币)","电机、减速器、齿轮、泵、风机、调速控制器、刹车器、高低压电器及配件、塑料件、五金冲压件制造、加工、销售；货物进出口、技术进出口。（另设分支机构经营场：乐清市北白象镇温州大桥工业区）",浙江,温州,"乐清市北白象镇高东村"
中国邮政集团公司浙江省余姚市陆埠支局,91330281756271580Y,2003-07-02,N/A,郑幼莉,"N/A","一般经营项目：邮政基础业务，邮政增值业务，邮政附属业务",浙江,宁波,"余姚市陆埠镇车站路27号"
丽水市鼎盛装饰装潢有限公司,9133110275194597X1,2003-07-02,N/A,蓝炳申,"50(万元人民币)","建筑装饰装潢、设计。",浙江,丽水,"浙江丽水市中东路98号204室"
台州市黄岩泰来模钢有限公司,91331003751922102W,2003-07-02,N/A,蒋桂生,"1,000(万元人民币)","模具钢销售，模具、塑料制品制造、加工，机械配件、机械热处理加工。",浙江,台州,"台州市黄岩西城后洋村"
义乌市俱佳旅游用品有限公司,9133078275191433XT,2003-07-02,N/A,吴美忠,"200(万元人民币)","生产和销售：帐篷、休闲椅、户外野营用具、遮阳蓬、汽车遮阳伞、汽车遮阳罩、服装、鞋、帽、箱包、家具、小五金、文具（以上经营范围不含电镀、不含印制、不含染色）；批发：数码产品、电子产品（以上两项经营范围不含电子出版物）、家居日用品、汽车日用品；智能家居设备研发、生产和批发。",浙江,金华,"浙江省义乌市义亭镇姑塘特色工业小区"
中国邮政集团公司浙江省余姚市湖堤邮政所,91330281756271791E,2003-07-02,N/A,田亚君,"N/A","一般经营项目：邮政基础业务，邮政增值业务，邮政附属业务",浙江,宁波,"余姚市临山镇湖堤罗建1区31号"
仙居县兴合土特产有限公司新路茧站,913310247964979395,2003-07-02,N/A,陈力彪,"N/A","一般经营项目：农副产品购销、蚕茧收烘销售。",浙江,台州,"仙居县下各镇新路"
中国邮政集团公司浙江省余姚市临山支局,91330281756271783K,2003-07-02,N/A,包立勋,"N/A","一般经营项目：邮政基础业务，邮政增值业务，邮政附属业务",浙江,宁波,"余姚市临山镇车站北西路6号"
中国邮政集团公司浙江省余姚市大黄桥南路邮政所,913302817562708441,2003-07-02,N/A,史青,"N/A","一般经营项目：邮政基础业务，邮政增值业务，邮政附属业务",浙江,宁波,"余姚市大黄桥南路33-35号"
台州市荣鸽礼品有限公司,913310037519146714,2003-07-02,N/A,蒋文斌,"50(万元人民币)","一般经营项目：木制、铁制工艺品,玩具,塑料制品",浙江,台州,"台州市黄岩区沙埠镇繁三村"
伟成金属制品有限公司,91330226750370801C,2003-07-02,N/A,潘吉裕,"5,030(万元人民币)","机械工具、金属制品制造，道路货物运输",浙江,宁波,"浙江省宁海县科技园区"
北京实华开电子商务有限公司杭州办事处,91330100MA28WP3E48,2003-07-02,N/A,邵雯,"N/A","为总公司业务接待、联络",浙江,杭州,"杭州市中山北路中大广场3号十三层1307室"
中国邮政集团公司浙江省余姚市丈亭支局,91330281756271687A,2003-07-02,N/A,林斌,"N/A","一般经营项目：邮政基础业务，邮政增值业务，邮政附属业务",浙江,宁波,"余姚市丈亭镇新民中路105号"
中国邮政集团公司浙江省余姚市大隐邮政所,91330281756271679F,2003-07-02,N/A,郑亚凤,"N/A","一般经营项目：邮政基础业务，邮政增值业务，邮政附属业务",浙江,宁波,"浙江省余姚市大隐镇山王北路51号"
中国邮政集团公司浙江省余姚市鹿亭邮政所,913302817562717593,2003-07-02,N/A,戴波,"N/A","邮政基础业务，邮政增值业务，邮政附属业务（具体种类和范围按国务院通信主管部门的规定办理）#",浙江,宁波,"余姚市鹿亭乡上庄村"
中国邮政集团公司浙江省余姚市四明山邮政所,91330281756271265B,2003-07-02,N/A,戴波,"N/A","一般经营项目：邮政基础业务，邮政增值业务，邮政附属业务（具体种类和范围按国务院通信主管部门的规定办理）#",浙江,宁波,"余姚市四明山镇寺前村"
中国邮政集团公司浙江省余姚市城东邮政所,913302817562718712,2003-07-02,N/A,赵珍,"N/A","一般经营项目：邮政基础业务，邮政增值业务，邮政附属业务",浙江,宁波,"余姚市文山路478号"
中国邮政集团公司浙江省余姚市牟山邮政所,91330281756271257G,2003-07-02,N/A,邱玉意,"N/A","邮政基础业务，邮政增值业务，邮政附属业务",浙江,宁波,"余姚市牟山镇魏家村"
中国邮政集团公司浙江省余姚市梁辉邮政所,91330281756271775Q,2003-07-02,N/A,孙晶英,"N/A","邮政基础业务，邮政增值业务，邮政附属业务",浙江,宁波,"余姚市梨洲街道梁辉振兴路2号"
中国邮政集团公司浙江省余姚市朗霞支局,9133028175627188XR,2003-07-02,N/A,潘莉芳,"N/A","邮政基础业务，邮政增值业务，邮政附属业务",浙江,宁波,"余姚市朗霞街道创业路1号"
中国邮政集团公司浙江省余姚市新建北路邮政所,913302817562712811,2003-07-02,N/A,吴雪华,"N/A","一般经营项目：邮政基础业务，邮政增值业务，邮政储蓄业务，邮政附属业务",浙江,宁波,"余姚市新建北路284-1号"
中国邮政集团公司浙江省余姚市保庆路邮政所,91330281756273906E,2003-07-02,N/A,黄丹阳,"N/A","一般经营项目：邮政基础业务，邮政增值业务，邮政附属业务",浙江,宁波,"余姚市保庆路122-125号"
中国邮政集团公司浙江省余姚市低塘支局,91330281756271142A,2003-07-02,N/A,徐俊,"N/A","一般经营项目：邮政基础业务，邮政增值业务，邮政附属业务",浙江,宁波,"余姚市低塘街道镇南路"
上药康德乐(浙江)医药有限公司宁波分公司,913302057503776594,2003-07-02,N/A,王莲萍,"N/A","药品经营，食品经营，消杀剂、杀虫剂的批发、零售。",浙江,宁波,"江北区白沙路1号"
临安九强商贸有限公司,91330185751705650T,2003-07-02,N/A,程小明,"100(万元人民币)","销售：建筑材料(除砂石）、金属材料",浙江,杭州,"临安市锦城街道竹林大街"
中国邮政集团公司浙江省余姚市马渚支局,91330281756271708T,2003-07-02,N/A,黄文雷,"N/A","邮政基础业务，邮政增值业务，邮政附属业务",浙江,宁波,"余姚市马渚镇四季堰路1号"
仙居县兴合土特产有限公司埠头茧站,91331024796497744B,2003-07-02,N/A,陈力彪,"N/A","一般经营项目：农副产品购销、蚕茧收烘销售。",浙江,台州,"浙江省台州市仙居县埠头镇"
中国邮政集团公司浙江省余姚市方桥邮政所,91330281756273885X,2003-07-02,N/A,魏博,"N/A","一般经营项目：邮政基础业务，邮政增值业务，邮政附属业务（具体种类和范围按国务院通信主管部门的规定办理）#",浙江,宁波,"余姚市阳明街道老方桥东街"
临海市华宇锻压机械厂,9133108275192065X1,2003-07-02,个人独资企业,郭六华,"N/A","锻件、通用机械零配件加工。",浙江,台州,"临海市城南下浦钢铁市场"
仙居县兴合土特产有限公司大路茧站,913310247964977601,2003-07-02,N/A,陈力彪,"N/A","一般经营项目：农副产品购销、蚕茧收烘销售。",浙江,台州,"浙江省台州市仙居县福应街道大路"
乐清市硕丰机电配件厂,91330382751931615L,2003-07-02,个人独资企业,林力强,"N/A","一般经营项目：机电配件制造、加工、销售。",浙江,温州,"乐清市乐成镇悬浦村"
中国邮政集团公司浙江省余姚市斗门邮政所,91330281756271476T,2003-07-02,N/A,宋素文,"N/A","一般经营项目：邮政基础业务，邮政增值业务，邮政附属业务",浙江,宁波,"余姚市马渚镇斗门街"
中国邮政集团公司浙江省余姚市泗门支局,91330281756271732B,2003-07-02,N/A,郑佰宁,"N/A","许可经营项目：邮政基础业务，邮政增值业务，邮政附属业务",浙江,宁波,"余姚市泗门镇新建路15号"
中国邮政集团公司浙江省余姚市肖东邮政所,91330281756271118R,2003-07-02,N/A,孙晶英,"N/A","邮政基础业务，邮政增值业务，邮政附属业务",浙江,宁波,"余姚市兰江街道肖东长丰小区2幢1号"
临安市浙西光明石材有限公司,91330185321862226B,2003-07-02,N/A,徐小潮,"50(万元人民币)","加工、销售：花岗石",浙江,杭州,"临安市潜川镇城后村"
仙居县兴合土特产有限公司横溪茧站,9133102479649771XM,2003-07-02,N/A,陈力彪,"N/A","农副产品购销，蚕茧收烘销售。",浙江,台州,"浙江省台州市仙居县横溪镇"
仙居县兴合土特产有限公司蚕茧分公司,91331024796497867C,2003-07-02,N/A,陈力彪,"N/A","一般经营项目：农副产品购销、蚕茧收烘销售。",浙江,台州,"浙江省台州市仙居县福应街道解放街109号"
中国邮政集团公司浙江省余姚市三七市邮政所,91330281756273893Q,2003-07-02,N/A,熊晓浓,"N/A","邮政基础业务，邮政增值业务，邮政附属业务",浙江,宁波,"余姚市三七市镇安捷东路81号"
宁波永泰金属制品有限公司,91330226750372612K,2003-07-03,N/A,王荐檩,"105(万美元)","高档五金件、工艺品（除金银饰品）、文具、塑料制品制造、加工。",浙江,宁波,"浙江省宁波市宁海县城关梅林三军庄村"
宁波宁澳服饰有限公司鄞州分公司,91330212750382386L,2003-07-03,N/A,施光,"N/A","服装服饰、鞋帽箱包、床上用品、针织品、服装辅料的制造、加工。",浙江,宁波,"宁波市鄞州石碶街道石碶村"
宁波同人软件有限公司江北分公司,91330205MA2938R25X,2003-07-03,N/A,王贇,"N/A","计算机及网络软件的开发、咨询、销售及租赁;企业管理咨询;计算机网络工程设计、承接;计算机及配件的生产、组装、批发、零售。",浙江,宁波,"江北区人民路132号1302室"
杭州富阳南方红豆杉生物科技有限公司,91330183751706573T,2003-07-03,N/A,何晓东,"1,250(万元人民币)","生物工程技术、红豆杉天然植物提取物的技术研发；红豆杉苗木（除种苗）培育、开发、销售；花木种植；生态农业观光服务；有色金属、黑色金属销售；货物进出口",浙江,杭州,"杭州富阳区新桐乡程浦村程坟"
杭州天豪化工有限公司,913301107517077280,2003-07-03,N/A,毛才芬,"50(万元人民币)","制造、加工：和毛剂、织物柔软剂（除化学危险品）。批发、零售：化学原料及产品",浙江,杭州,"余杭区塘栖镇张家墩路150号"
德清县鼎强建材有限公司,91330521751917741U,2003-07-03,N/A,李彦兴,"108(万元人民币)","混凝土多孔砖生产。",浙江,湖州,"浙江省湖州市德清县下渚湖街道八字桥村新亭"
慈溪市富士橡胶化工有限公司匡堰分公司,9133028275038092XM,2003-07-03,N/A,高国明,"N/A","一般经营项目：腈纶纱、橡胶制品制造、加工，废旧橡胶回收。",浙江,宁波,"匡堰镇王家埭村"
云和县万兴税务师事务所有限公司,913311257519166851,2003-07-03,N/A,陈笑媚,"30(万元人民币)","税务代理。",浙江,丽水,"浙江省丽水市云和县浮云街道解放东路366号"
余姚市润通物资有限公司,91330281750376605D,2003-07-03,N/A,于建权,"50(万元人民币)","塑料原料、金属材料、建筑材料、五金交电、塑料颜料、助剂的批发、零售",浙江,宁波,"余姚市余姚中国塑料城国际商务中心3幢101室"
杭州五环办公设备技术有限公司,91330103751707023L,2003-07-03,N/A,费焕伦,"1,000(万元人民币)","生产:办公设备、包装机械；服务：办公设备、包装机械的技术开发、技术服务、技术转让；批发、零售：办公设备、包装机械；其他无需报经审批的一切合法项目。",浙江,杭州,"杭州市下城区石桥街道华丰村九组"
余姚市舜士塑料电器厂,91330281750382861D,2003-07-03,个人独资企业,谢仕京,"N/A","塑料制品、五金件、电器配件的制造、加工#",浙江,宁波,"浙江省余姚市泗门镇汝湖居委"
杭州宏力机电设备有限公司,913301037517064423,2003-07-03,N/A,赵倩,"50(万元人民币)","批发、零售：机床及配件、五金工具；服务：机床维修。其他无需报经审批的一切合法项目。***",浙江,杭州,"杭州市下城区沈家巷39号414室"
宁波新景城市环境服务有限公司,91330205750377675R,2003-07-03,N/A,忻瑞娣,"500(万元人民币)","国内劳务派遣。",浙江,宁波,"浙江省宁波市江北区天合财汇中心152号95幢4-14"
杭州富阳新海园林养殖有限公司,913301837517066026,2003-07-03,N/A,郑志军,"2,000(万元人民币)","城市园林绿化工程施工（贰级）。**淡水动物养殖；林业、农业技术开发；苗木、果树、茶树",浙江,杭州,"浙江省杭州市富阳区银湖街道龙溪北路499-1号"
台州亨达利名表城有限公司,91331004753035662G,2003-07-03,N/A,王良芬,"50(万元人民币)","钟表、眼镜批发、零售。",浙江,台州,"浙江省台州市路桥区路桥邮电路238号"
杭州余杭天地动迁有限公司,91330110751705685Q,2003-07-03,N/A,王万根,"30(万元人民币)","房屋及附属设施的拆迁、咨询服务。其他无需报经审批的一切合法项目**",浙江,杭州,"杭州余杭区临平街道汀洲路25-27号"
浙江三力机械股份有限公司,91330100751705765W,2003-07-03,N/A,陈胜飞,"2,000(万元人民币)","制造、加工：食品机械、离心机械、分离机械、差速器、机械配件；",浙江,杭州,"萧山区临浦工业园区苎萝东路9号"
杭州市蒋村乡包建村经济合作社,91330106X32183868E,2003-07-03,N/A,洪荣海,"100(万元人民币)","自有房产物业管理。",浙江,杭州,"杭州市西湖区蒋村乡洪家门"
杭州海贝服饰有限公司,91330103751709192W,2003-07-03,N/A,叶建,"100(万元人民币)","畜产品原料及产品、纺织品、服装、皮革原料及制品、机电产品、五金工具、工艺品、办公用品的批发、零售；经营进出口业务",浙江,杭州,"下城区庆春路楚庆巷3号"
平湖市中正塑板有限公司,91330482751919966D,2003-07-03,N/A,屈仿根,"300(万元人民币)","制造、加工、销售：塑板、卫浴设备；从事各类商品及技术的进出口业务。",浙江,嘉兴,"平湖市当湖街道虹霞路89号"
宁波市鄞州恒润合金材料有限公司,91330212750376541H,2003-07-03,N/A,葛建宏,"50(万元人民币)","合金材料的批发、零售",浙江,宁波,"宁波市鄞州区云龙镇王夹岙村"
桐乡市众友小五金加工厂,913304837519169099,2003-07-03,个人独资企业,夏梦雷,"N/A","小五金、不锈钢制品、塑胶制品的加工。",浙江,嘉兴,"桐乡市梧桐街道三新村六合小区34号"
宁波经济技术开发区定定物资有限公司,91330206750376250Q,2003-07-03,N/A,陈秀英,"50(万元人民币)","一般经营项目：金属材料、五金交电、电机、普通机械设备的批发、零售。",浙江,宁波,"浙江省宁波市北仑区戚家山街道开发区联合区域蔚斗新村103幢501室"
杭州德纳电气有限公司,91330106751709184D,2003-07-03,N/A,郑芳,"1,000(万元人民币)","批发、零售：电器元器件，输变电设备，通信设备",浙江,杭州,"西湖区翠苑四区12幢1号楼302室"
宁波凯元电器有限公司,91330225750376808Y,2003-07-03,N/A,方盛梅,"2,000(万元人民币)","一般经营项目：电器、机械配件制造、销售；电梯、起重机械制造、安装、维修；货运。",浙江,宁波,"象山县工业示范园区"
杭州迈成网络科技有限公司,913301097517063701,2003-07-03,N/A,李旭亮,"50(万元人民币)","网络工程服务；电子产品开发；经销：电子产品，计算机软、硬件、耗材，有线电视设备；其他无需报经审批的一切合法项目**",浙江,杭州,"萧山区瓜沥镇永福村(东灵北路汇德隆北"
杭州萧山姚江汽车小修城经营有限公司,913301097517079205,2003-07-03,N/A,吴少飞,"50(万元人民币)","萧山姚江汽车小修城的物业管理，市场服务**",浙江,杭州,"萧山区新塘街道姚江岸村通惠路旁"
宁波市镇海华集电器有限公司北仑分公司,91330206750377472K,2003-07-03,N/A,潘增荣,"N/A","一般经营项目：高低压开关设备、电器元件的制造、加工；金属材料、装璜材料、建筑材料、机电设备、五金、交电的批发、零售、。",浙江,宁波,"新矸镇凤洋二路653-655号"
杭州富阳华兴纺织服饰有限公司,913301837517084218,2003-07-03,N/A,吴功华,"60(万元人民币)","衬布、棉布、服装、化纤布、领带制造。棉纱、毛纱、化纤布销售。",浙江,杭州,"杭州富阳区胥口镇棠棣村"
宁波市江北华振文具有限公司,913302057503765760,2003-07-03,N/A,陈优珍,"50(万元人民币)","文具、通用零部件、塑料制品、服装的制造、加工和销售。",浙江,宁波,"江北区慈城观庄村湖塘下19号"
宁波中意置业有限公司,91330225750376955G,2003-07-03,N/A,吴开先,"2,000(万元人民币)","一般经营项目：房地产开发、建筑装饰、设计，五金、建筑材料、陶瓷、办公用品批发、零售",浙江,宁波,"浙江省象山县丹东街道天安路153号15楼"
