浙江广成装饰工程有限公司家装分公司,91330502749042608J,2003-04-23,N/A,张丽,"N/A","室内装潢施工。",浙江,湖州,"湖州市朝晖苑2幢406室"
宁海县奥翔电塑有限公司,91330226747384583P,2003-04-23,N/A,马幼红,"2,000(万元人民币)","橡塑制品、家用电器、文具、五金件、照明灯具、家用美容电器具制造、加工，自营和代理货物与技术的进出口，但国家限定经营或禁止进出口的货物与技术除外。",浙江,宁波,"宁海县西店镇樟树村"
杭州丰汇纺织有限公司,91330109749460666E,2003-04-23,N/A,汪伏英,"50(万元人民币)","化纤布织造，针织品、机械配件制造，加工；销售：轻纺产品，化纤原料，化工产品及原料（除化学危险品及易制毒化学品），五金交电，摩托车及配件，建材，钢材**",浙江,杭州,"萧山区瓜沥镇长巷村"
平湖市诚信拆迁事务有限公司,91330482749041699E,2003-04-23,N/A,包志鸿,"50(万)","无拆迁事务中介服务",浙江,嘉兴,"平湖市当湖街道城北路3号小区(原平湖血库旧址)"
海宁市倍宁土工织物有限责任公司,913304817490439852,2003-04-23,N/A,张建学,"150(万元人民币)","土工织物、塑料编织袋、特种纱、色纺纱、纱线制造、加工；化工原料（不含化学危险品、易制毒化学品和化学试剂等）、建筑材料批发、零售",浙江,嘉兴,"海宁市长安镇辛万路99号"
宁波市江东飞时达广告策划有限公司,913302047473849970,2003-04-23,N/A,劳剑刚,"50(万元人民币)","广告服务；企业形象策划、展览展示服务、室内外装饰、影视策划、三维动画设计、摄影摄像服务。",浙江,宁波,"江东区姚隘路332号(3-4)"
德清县林业发展有限公司,9133052174904569X3,2003-04-23,N/A,仲建平,"100(万元人民币)","城镇绿化苗、造林苗、花卉生产、批发、零售。林业工程勘察设计及施工、园林绿化工程设计及施工，林业技术开发、咨询服务。",浙江,湖州,"武康镇永安街25-1号"
杭州汇泽食品有限公司,9133010374945424XB,2003-04-23,N/A,付玉丰,"100(万元人民币)","批发、零售：预包装食品",浙江,杭州,"杭州市下城区体育场路257号顶层"
杭州吉永科技有限公司,91330106748876061Q,2003-04-23,N/A,彭艳萍,"500(万元人民币)","服务：电子产品、电子元器件的技术开发；批发、零售：电子产品",浙江,杭州,"浙江省杭州市西湖区西斗门路20号第五层5407室"
浙江椒光房地产开发有限公司,91331000749043790M,2003-04-23,N/A,朱莉莉,"2,000(万)","房地产开发经营。",浙江,台州,"浙江省台州经济开发区纬二路1号"
桐乡市怡嘉纺织品有限公司,91330483749041162P,2003-04-23,N/A,沈惠明,"50(万元人民币)","纺织品、纺织原料",浙江,嘉兴,"浙江省嘉兴市桐乡市梧桐街道复兴北路1330－1332号"
浙江义乌振江皮具有限公司,91330782749029710R,2003-04-23,N/A,吴因平,"533.5000(万美元)","皮带、箱包生产销售。",浙江,金华,"浙江省义乌市经济开发区戚继光路655号"
杭州临安全龙货物运输有限公司,91330185MA28M87K82,2003-04-23,N/A,方燚杰,"50万人民币元","服务:货运站(场)经营(货运配载);道路货物运输。(具体经营范围以有效许可证件为准)(依法须经批准的项目,经相关部门批准后方可开展经营活动)",浙江,杭州,"浙江省杭州市临安区锦城街道天目路163号"
浙江蔓哈顿服饰有限公司杭州第一分公司,91330103749459008Y,2003-04-23,N/A,顾祥,"N/A","许可经营项目：无一般经营项目：批发、零售：服装、服饰、百货、纺织面料、建筑材料、装饰材料、化工原料",浙江,杭州,"杭州市下城区中山北路631号1903室"
嵊泗丰华国际大酒店有限公司,913309227490457537,2003-04-23,N/A,苏景娇,"2,000(万元人民币)","住宿、KTV、公共浴室（含桑拿）服务；餐饮服务、食品销售；卷烟、雪茄烟零售；非危险性体育项目、会务服务、商场经营（宾馆内）；",浙江,舟山,"嵊泗县菜园镇云龙路89号"
浙江顶立添翼汽车部件股份有限公司,91331082749044988Q,2003-04-23,N/A,王福慧,"3,550(万元人民币)","汽车零部件及配件、铝合金、模具制造。",浙江,台州,"临海市涌泉工业区玉岘"
杭州维皇生物科技有限公司,913301027494554530,2003-04-23,N/A,龚显月,"300(万元人民币)","服务：生物制品的技术开发、技术咨询及成果转让；批发、零售：预包装食品。",浙江,杭州,"上城区中河中路281号1604室"
永嘉县埭下五金饰品有限公司,913303246617147644,2003-04-23,N/A,李月进,"60(万元人民币)","五金制品加工；电镀材料（不含危险化学品、易制毒化学品）销售",浙江,温州,"永嘉县瓯北镇埭下村"
浙江鹤王伞业有限公司,91330604749046182T,2003-04-23,N/A,张铁锋,"518(万元人民币)","伞、伞件、雨具、旅游休闲用品、帐篷制造、加工、销售；纸转印花；塑料制品加工、销售；户外广告用品销售；进出口贸易业务（依法须经批准的项目，经相关部门批准后方可开展经营活动）",浙江,绍兴,"绍兴市上虞崧厦镇伞业工业区"
嘉兴市鑫乐成套电气有限公司,913304027377825530,2003-04-23,N/A,瞿月丹,"N/A","成套电气柜、配电箱、电线桥架、机电产品（不含汽车）的销售。",浙江,嘉兴,"浙江省嘉兴市南湖区大桥镇步焦路395号"
嘉兴市银都物业管理有限公司,913304827498089179,2003-04-23,N/A,杨引观,"50(万)","无物业管理、园林绿化、水电和空调设备安装",浙江,嘉兴,"平湖市当湖镇朝阳路口商住楼南幢四层办公室"
永嘉县温庆拉链辅料有限公司,91330324749047257K,2003-04-23,N/A,夏作玉,"50(万)","拉链、拉头、服装辅料生产、销售。",浙江,温州,"永嘉县桥头镇林福东路1弄7号"
建德市望江印务有限公司,91330182084586765Y,2003-04-23,N/A,付建腾,"50(万元人民币)","其他印刷品印刷（不含出版物、包装装潢印刷品印刷）（上述经营范围中涉及前置审批项目的，在批准的有效期内方可经营）",浙江,杭州,"建德市新安江街道白沙路239号"
杭州宾利建筑工程有限公司,913301057494556560,2003-04-23,N/A,宋兵莉,"600(万元人民币)","室内外装饰设计及服务；房屋建筑工程、工业自动化系统工程、舞台工程、音响工程、楼宇智能工程、保温工程、市政工程、园林绿化工程、道路桥梁工程的施工（凭资质证书经营）；机械设备的安装",浙江,杭州,"拱墅区董家弄60号601室"
宁波新时代建筑设备安装有限公司,91330203747385367K,2003-04-23,N/A,孙连康,"300(万元人民币)","建筑装饰，水、电、暖通、消防、自动化、制冷设备安装及市政、园林绿化。",浙江,宁波,"海曙区解放北路124号(1-8)(1-9)室(集中办公区)"
仙居县春秋旅行社有限公司,91331024749803374P,2003-04-23,N/A,周飞华,"30(万元人民币)","国内旅游业务、入境旅游业务。",浙江,台州,"仙居县福应街道环北东路314-316号"
宁波市江北鑫来货运有限公司,91330205747385180H,2003-04-23,N/A,金其来,"30(万元人民币)","道路货物运输，国内货运代理、货物仓储、装卸。",浙江,宁波,"江北区庄桥街道费市村"
浙江龙游利达汽车有限公司,913308257490409281,2003-04-23,N/A,李和林,"500(万)","二手车、专用作业车、工程机械、汽车配件、润滑油销售，汽车租赁。",浙江,衢州,"浙江省龙游县龙洲街道衢龙路145号"
杭州富阳红苹果家居布艺有限公司,91330183749454629X,2003-04-23,N/A,唐林军,"100(万元人民币)","批发、零售：窗帘、装饰材料",浙江,杭州,"杭州富阳区富春街道金苑路136、138号"
上海佳福泵业有限公司温岭分公司,91331081769612604J,2003-04-23,N/A,杨平标,"N/A","水泵、电机生产、销售",浙江,台州,"温岭市大溪镇念母洋村"
杭州四季青面料市场有限公司,91330104X091524733,2003-04-23,N/A,蒋根发,"500(万元人民币)","服务：市场经营管理，停车服务（凭有效许可证经营）。",浙江,杭州,"浙江省杭州市江干区秋涛北路22-28号"
浙江永力电池有限公司,91330400745828451C,2003-04-23,N/A,徐一进,"230(万美元)","生产销售碱性干电池、干电池、电池配件及电池机械。",浙江,嘉兴,"嘉兴市南湖经济园区（浙江永高电池股份有限公司内）"
余姚市盛大印刷机械厂,913302817473841105,2003-04-23,个人独资企业,杜盛敏,"N/A","印刷机械设备，五金件，塑料制品，橡胶制品的制造、加工#",浙江,宁波,"余姚市姚西工业园区"
兰溪市裕宏纺织有限公司,913307817498045026,2003-04-23,N/A,杨玲弟,"300(万元人民币)","化纤纱、线、织布、针织服装的生产、销售；纺织品批发。(凡涉及前置审批或专项许可证的凭相关有效证件经营)",浙江,金华,"浙江省兰溪市游埠镇工业园区"
杭州地龙水泥制品有限公司,91330109MA280LMR6K,2003-04-23,N/A,殷传友,"100(万元人民币)","加工：水泥涵管、地砖**",浙江,杭州,"萧山区瓜沥镇山北村"
常山县民兴轴承有限公司,913308227490400044,2003-04-23,N/A,徐玉英,"50(万元人民币)","一般经营项目：轴承制造、加工、销售。",浙江,衢州,"常山县紫港街道狮东村"
宁波三凌网络科技有限公司,91330282747385121Y,2003-04-23,N/A,沈惠民,"550(万元人民币)","一般经营项目：计算机网络机柜、计算机网络技术开发研究；光缆、光纤、电缆、电线、计算机网络设备及外部设备、塑料制品、电子元件、五金工具制造、加工；自营和代理货物和技术的进出口，但国家限定经营或禁止进出口的货物和技术除外。",浙江,宁波,"慈溪市慈东工业区日显路333号"
浙江万邦塑业有限公司,91330326749043491G,2003-04-23,N/A,温正特,"1,600(万元人民币)","包装装潢、其他印刷品印刷",浙江,温州,"平阳县萧江镇立后村、凤头村"
杭州夏雨化工有限公司,91330185749455701W,2003-04-23,N/A,夏群,"300(万元人民币)","加工、销售：重质碳酸钙、HDPE再生料。销售：滑石粉、高岭土、塑料制品、化工原料（除危险化学品及易制毒化学品）；货物进出口",浙江,杭州,"浙江省杭州市临安区玲珑街道桥岭村"
宁波市鄞州茂通机械配件厂,91330212747384479A,2003-04-23,个人独资企业,张小良,"N/A","机械配件、电器配件、塑胶制品的制造、加工。",浙江,宁波,"宁波市鄞州区姜山镇上张村"
宁波市江北安杰金属丝工艺制品厂,913302051442236769,2003-04-23,个人独资企业,陈安国,"N/A","铁丝制品、五金、塑料配件制造、加工。",浙江,宁波,"江北区慈城镇洪陈村"
余姚市利千铝丝加工厂,92330281MA2ENLQB1T,2003-04-23,个体工商户,诸利千,"N/A","铝丝的加工。",浙江,宁波,"余姚市梨洲街道黄箭山村跳头"
宁波市北仑第一煤气有限公司柴桥芦南供应点,91330206790084973M,2003-04-23,N/A,王锡明,"N/A","液化气零售。",浙江,宁波,"柴桥环镇南路养鱼场旁"
宁波高立电子科技有限公司,91330226747397341F,2003-04-23,N/A,高艺中,"300(万元人民币)","安防电子产品及其他电子产品、节能灯具研发、制造、加工，五金件、小家电、橡塑件制造、加工；自营和代理货物及技术的进出口，但国家限定经营或禁止进出口的货物及技术除外。",浙江,宁波,"宁海县西店镇铁场西路85号"
浙江普康化工有限公司,91330824749040637F,2003-04-23,N/A,LI JIAYAO,"405(万元人民币)","N，N-二异丙基乙胺生产、销售（安全生产许可证有效期至2018年1月3日）。无机化工、有机化工、精细化工、医药中间体生产、销售",浙江,衢州,"浙江省浙江省开化县华埠镇三里亭"
杭州雷赛医疗设备有限公司,913301067494557362,2003-04-23,N/A,徐巍,"50(万元人民币)","批发、零售：医疗器械（具体范围详见《医疗器械经营企业许可证》内容）；批发：体外诊断试剂",浙江,杭州,"浙江省杭州市西湖区古翠路8号1幢610室"
杭州艺高印刷有限公司,913301107517070741,2003-04-23,N/A,高毅才,"500(万元人民币)","包装装潢印刷品和其他印刷品经营；生产：PVC卡、智能卡；智能读写器设计、开发；计算机系统集成，电子元器件销售。",浙江,杭州,"杭州余杭区良渚街道通运街427号7幢、8幢"
嘉兴市允宏钢构有限公司,91330411MA29H01838,2003-04-23,N/A,屠建华,"1000万元人民币","彩钢板及其配套金属构件、塑料制品的制造、加工;金属材料、建筑材料、塑料制品、化工原料(不含危险化学品和易制毒化学品)的销售;钢结构工程、农业温室大棚的施工。(以上经营范围涉及资质证书的凭有效资质证书经营)",浙江,嘉兴,"嘉兴市秀洲区新城街道义庄路736号"
台州市希尔家庭用品有限公司,913310037498085382,2003-04-23,N/A,洪薇,"1,268(万元人民币)","塑料制品、密胺制品、塑料薄膜袋、布艺制造、加工，家居用品、玻璃器皿、不锈钢制品及陶瓷制品销售，技术进出口与货物进出口。",浙江,台州,"台州市黄岩区澄江街道风光路86号"
义乌市杜邦医药用品有限公司,91330782751156647H,2003-04-23,N/A,楼升永,"50(万元人民币)","一般经营项目：创口贴制造销售",浙江,金华,"浙江省义乌市苏溪镇金三角小区"
慈溪市范市灵湖天井电子配件厂,92330282MA2AF4GD0N,2003-04-23,个体工商户,方孟,"N/A","电子配件加工。",浙江,宁波,"浙江省慈溪市龙山镇方家河头村"
东阳市杭强包装有限公司,91330783749046473G,2003-04-23,N/A,蒋宝妹,"150(万元人民币)","许可经营项目：包装装潢、其他印刷品印刷",浙江,金华,"浙江省东阳市横店后岭山粮站"
永嘉浩杰电子有限公司,91330324749045120N,2003-04-23,N/A,徐象晓,"50(万元人民币)","电子元器件、开关、插座、低压电器及配件、劳保用品、五金工具、仪表配件、灯具、逆变器、稳压器、调压器、充电器、应急灯生产、销售；货物进出口、技术进出口（法律、法规禁止的不得经营，应经审批未获审批前不得经营）",浙江,温州,"永嘉县乌牛镇皮服城"
浙江金华奥丰建设工程有限公司,91330702749829590F,2003-04-23,N/A,吴骏峰,"2,000(万元人民币)","一般经营项目：市政工程、园林绿化工程、水利水电工程、土木建筑工程及土石方工程、地基与基础工程、建筑装饰装修工程、钢结构工程、体育场地设施工程、城市及道路照明工程、环保工程、建筑物拆除工程、建筑幕墙工程、消防设施工程施工，预制构件（非预应力）生产与销售，广告设计、制作、代理、发布",浙江,金华,"浙江省金华市婺城区双龙北街602号"
江山市大昌汽车销售有限公司,913308817490420269,2003-04-23,N/A,罗时军,"500(万)","保险兼业代理：机动车辆保险、意外伤害保险；销售：汽车及配件；服务：汽车信息咨询、汽车租赁。",浙江,衢州,"江山市虎山街道虎山路185号"
杭州新科化工有限公司,91330106749456683F,2003-04-23,N/A,赵岩,"50(万元人民币)","批发、零售：纺织印染助剂，化工原料及产品",浙江,杭州,"杭州市西湖区三墩镇振华路196号裕华大厦B-1301室"
海宁市新联五金机械有限公司第一分公司,91330481749830997G,2003-04-23,N/A,朱锦平,"N/A","装璜五金、建筑五金、汽车配件制造、加工",浙江,嘉兴,"盐官镇联农村7组"
台州市黄岩艾丽司贸易有限公司,913310037498104944,2003-04-23,N/A,周江虹,"100(万)","工艺品（不含金）、皮革、塑料原料、化工原料",浙江,台州,"台州市黄岩九峰路187号（邮电大楼二楼）"
桐庐森原矿业有限公司,9133012274945520XY,2003-04-23,N/A,范来荣,"50(万元人民币)","销售：方解石、矿粉。",浙江,杭州,"桐庐县瑶琳镇毕浦村糁源"
杭州新乐仕颜料有限公司,91330108749454952Q,2003-04-23,N/A,周立潮,"500(万元人民币)","一般经营项目：批发、零售：颜料、染料、精细化工（除化学危险品及易制毒化学品）、五金、包装材料；其他无需报经审批的一切合法项目；货物进出口",浙江,杭州,"杭州市滨江区滨盛路1509号天恒大厦1304室"
海宁市硖石海洲机械厂,91330481749044259T,2003-04-23,个人独资企业,徐金明,"N/A","机械（不含医疗器械）、拉链带、制造、加工",浙江,嘉兴,"海宁市硖石街道联和村横墙里34号"
浙江诺尔园林工程有限公司,91330101749044646U,2003-04-23,N/A,宋胜年,"1,000(万元人民币)","生产：普通造林苗、绿化苗及花卉（三角枫、香樟、桂花、银杏、香泡、榉树、木瓜、山楂、杨梅）（凭资质证经营）。园林绿化工程设计、施工、养护；室内装饰服务（以上涉及资质证书的凭资质证书经营）；园林器械、园林绿化工程造景材料，苗木",浙江,杭州,"杭州经济技术开发区文津路1号-2"
杭州白浪助剂有限公司,91330109749455074K,2003-04-23,N/A,王水成,"1,060(万元人民币)","不带储存经营　其他危险化学品：环氧乙烷、1，2-环氧丙烷[抑制了的]； 制造、加工：非离子表面活性剂，聚醚多元醇；批发：化工原料及产品（除化学危险品及易制毒化学品），建筑材料；普通货物运输**（依法须经批准的项目，经相关部门批准后方可开展经营活动）",浙江,杭州,"浙江省杭州市萧山区萧山经济技术开发区鸿达路291号"
杭州轻触科技有限公司,91330106749459403H,2003-04-23,N/A,方永强,"1,000(万元人民币)","服务：计算机软件、计算机系统集成的技术开发、技术咨询、技术服务，成年人非证书劳动职业技能培训、成年人非文化教育培训（涉及前置审批的项目除外），设计、制作、代理、发布国内广告（除网络广告发布），公关活动策划，市场营销策划；批发、零售：计算机及配件，通信设备",浙江,杭州,"杭州市西湖区西溪街道文三路90号(71幢)杭州东部软件园科技大厦A1301-A1304室"
新昌县沙溪明达机械配件厂,92330624MA29BCPR1T,2003-04-23,个体工商户,唐明达,"N/A","制造、加工：缝纫机配件（以上经营范围涉及许可的凭许可经营）",浙江,绍兴,"新昌县沙溪镇上蔡岙村"
浙江晨业船舶制造有限公司,913309217498242048,2003-04-23,N/A,郑荣跃,"16,000(万元人民币)","船舶修造（凭资质经营），机械加工，钢结构制造，机械设备、五金交电销售，起重机械特种设备制造、安装、维修（凭有效许可证件经营），货物及技术进出口贸易（除国家限定项目外）",浙江,舟山,"岱山县岱西镇仇江门"
台州市新华洋汽摩有限公司,913310027490466763,2003-04-23,N/A,王于建,"218(万)","摩托车、汽车",浙江,台州,"台州市椒江区东环大道85－105号"
永康市兴合农资有限公司唐先农资部,91330784MA29N81R3H,2003-04-23,N/A,施巧霞,"N/A","不含危险品农药批发、零售;化肥、农膜、农业机械、小农具、不再分装的包装种子零售",浙江,金华,"浙江省金华市永康市唐先镇唐先一村北街78号"
海宁白金龙皮革有限责任公司,913304811467611952,2003-04-23,N/A,徐燕祥,"500(万元人民币)","皮革服装、裘皮服装、服装的批发。",浙江,嘉兴,"浙江省嘉兴市海宁市浙江海宁经编产业园区经都三路8号浙商大厦502室"
台州申港泵业有限公司温岭分公司,91331081753962933T,2003-04-23,N/A,叶正聪,"N/A","一般经营项目：电机、水泵、风机、电器配件、机械配件制造、加工、销售。",浙江,台州,"温岭市大溪镇上坦头村"
兰溪市塔山制鞋厂,913307817570608066,2003-04-24,个人独资企业,范仲春,"N/A","鞋、五金配件、一般劳保防护用品加工、生产、销售",浙江,金华,"兰溪市香溪镇西仓村"
义乌市守信塑胶制品厂,92330782MA2AA4KTX2,2003-04-24,个体工商户,吴厚香,"N/A","加工、销售：塑胶制品（不含印制）",浙江,金华,"义乌市廿三里街道郑山头村"
义乌市贝贝玩具有限公司,913307827498160283,2003-04-24,N/A,程天官,"200(万元人民币)","毛绒玩具、布制玩具（以上经营范围不含染色、印制）、工艺品",浙江,金华,"浙江省义乌市上溪工业区三期聚贤路48号"
嘉兴市国鸿汽车配件销售有限公司,913304017490454467,2003-04-24,N/A,陆雪华,"500(万元人民币)","汽车",浙江,嘉兴,"嘉兴市二环北路3977号东侧"
中国人寿保险股份有限公司安吉县支公司梅溪镇营销服务部,91330523MA29KNNM79,2003-04-24,N/A,黄敏,"N/A","对营销员开展培训及日常管理;收取营销员代收的保险费、投保单等单证;分发保险公司签发的保险单、保险收据等相关单证;接受客户的咨询、投诉。",浙江,湖州,"安吉县梅溪镇翔舞"
台州华联超市有限公司三门健跳店,91331022749819341H,2003-04-24,N/A,王威振,"N/A","食品经营；烟草专卖零售；纺织品、服装、日用品、文具用品、体育用品、五金、家用电器、电子产品批发、零售。",浙江,台州,"三门县健跳镇琴江路(供销社大楼)"
宁波东钱湖旅游度假区万金塑料电器有限公司,91330201747385703T,2003-04-24,N/A,俞明飞,"50(万元人民币)","塑料制品、胶木制品、五金件、汽车配件、电动工具、模具的制造、加工。",浙江,宁波,"浙江省宁波东钱湖旅游度假区(工业园区)上杨路"
仙居县广信食品有限公司白塔分公司,91331024MA28GL3M1K,2003-04-24,N/A,陈旭央,"N/A","生猪、畜禽购销，屠宰。",浙江,台州,"仙居县白塔镇下街村"
台州市黎豪影视广告传播有限公司,91331021749801213Y,2003-04-24,N/A,陈黎波,"300(万元人民币)","一般经营项目：设计、制作国内户外广告兼自有媒介广告发布，摄影、摄像服务。",浙江,台州,"浙江省玉环市玉城街道三合潭花苑1幢102室"
宁波市鄞州中河甬杰塑料制品厂,91330212L02867890N,2003-04-24,个人独资企业,李衍锋,"N/A","塑料制品、五金制品、模具的制造、加工",浙江,宁波,"宁波市鄞州区中河街道里段工业区"
台州市椒江明翔塑料厂,91331002749835333A,2003-04-24,普通合伙,梁玲君,"N/A","非食用塑料制品制造、加工。",浙江,台州,"台州市椒江区江城东路27号"
仙居县广信食品有限公司横溪分公司,91331024MA28GL3K5X,2003-04-24,N/A,郭建林,"N/A","生猪畜禽购销、屠宰。",浙江,台州,"仙居县横溪镇上街村"
中国建设银行股份有限公司平阳北港支行,91330326661738344L,2003-04-24,N/A,余晓峰,"N/A","办理人民币存款、贷款、结算业务；代理发行、代理兑付国库券、代理收付款项；外币储蓄存款、外币兑换业务；经中国银行业监督管理机构批准的其他业务。",浙江,温州,"平阳县水头镇江山西路34号"
宁波四明大药房有限责任公司三市连锁店,91330203747391396E,2003-04-24,N/A,王建华,"N/A","药品、食品、医药化工原料、化学试剂、第一类医疗器械、玻璃仪器、消杀剂、针纺织品、五金交电、日用品、文具用品、化妆品、医用卫生材料、第二类医疗器械的零售；自有柜台出租。",浙江,宁波,"海曙区县学街145号"
中国电信股份有限公司衢州分公司,91330800749800712G,2003-04-24,N/A,刘健,"N/A","在总公司的经营范围内开展业务",浙江,衢州,"衢州市衢江北路1号"
宁波万达信息系统有限公司,91330203747396154W,2003-04-24,N/A,史一兵,"200(万元人民币)","计算机软硬件及网络系统集成技术的开发、技术转让、技术咨询、技术服务；计算机软硬件、电子产品",浙江,宁波,"海曙区东渡路55号"
宁波市鄞州塘溪龙华汽车配件厂,91330212747385527U,2003-04-24,个人独资企业,陆启华,"N/A","汽车配件、五金件、塑料件、冲件的制造、加工。",浙江,宁波,"宁波市鄞州区塘溪镇上城村"
台州震华动力有限公司,913310217498065248,2003-04-24,N/A,陈伟峰,"508(万元人民币)","一般经营项目：内燃机配件、汽车配件制造，技术进出口、货物进出口",浙江,台州,"浙江省台州市玉环市玉城街道后湾村"
余姚市精诚吸塑包装有限公司,913302817473859221,2003-04-24,N/A,胡吉伍,"50(万元人民币)","吸塑片材，吸塑包装，塑料制品，五金件的制造、加工#",浙江,宁波,"余姚市凤山街道蜀山村"
台州永发机械制造有限公司,91331081749049703B,2003-04-24,N/A,蔡益波,"120(万元人民币)","高速精密间隙分割器、机械配件制造，销售。",浙江,台州,"浙江省台州市温岭市东部新区金塘北路52-13号"
嘉兴市荣伟织造有限公司,91330411749045454H,2003-04-24,N/A,蒋阿留,"50(万元人民币)","纺织品生产；化学纤维销售",浙江,嘉兴,"秀洲区王江泾镇田乐纺织园"
中国建设银行股份有限公司平阳水头支行,913303266617380884,2003-04-24,N/A,蔡炳通,"N/A","办理人民币存款、贷款、结算业务和经人民银行批准的其他业务",浙江,温州,"浙江省温州市平阳县水头镇泾川东路171、173、175号和同盛华景园第6、7幢204室"
宁波奉化大桥市场房产经纪有限公司,91330283739498644F,2003-04-24,N/A,吕婉娟,"5(万元人民币)","一般经营项目：一般经营项目：房地产中介、婚姻介绍服务。",浙江,宁波,"浙江省宁波市奉化区春晖路51号"
