义乌市天安汽车驾驶员培训有限公司,91330782753996666G,2003-09-19,N/A,骆光田,"200(万元人民币)","许可经营项目：机动车驾驶员培训。",浙江,金华,"浙江省义乌市佛堂镇朝阳东路101号(自主申报)"
杭州海之洋汽配有限公司,9133010575440487XR,2003-09-19,N/A,王艳宇,"50(万元人民币)","汽车及摩托车配件、汽车装潢用品、电子通信产品及配件、仪器仪表、五金工具及配件、工程机械及配件、叉车及配件、机电设备及配件、汽车保养维修设备、润滑油的销售",浙江,杭州,"拱墅区花园岗街111号（浙江金通汽配城21号楼18-19号）"
开化河星鞋业有限公司,91330824795596281U,2003-09-19,N/A,童长鑫,"200(万元人民币)","胶鞋制造、销售；经营货物进出口业务。",浙江,衢州,"浙江省衢州市开化县华埠镇工业园区"
杭州捷成建筑材料有限公司,91330105754405936B,2003-09-19,N/A,方伟敏,"50(万元人民币)","金属材料、五金、建筑材料、水暖配件、电工器材的批发、零售。",浙江,杭州,"拱墅区科园路207号"
温州市千意鞋业有限公司,913303007549008148,2003-09-19,N/A,程贤聪,"50(万元人民币)","鞋、服装、针织品制造、销售；服饰、皮具、袜子、箱包、玩具销售。",浙江,温州,"浙江省温州市鹿城区星际路29号103室"
东阳市伊士曼彩印包装厂,913307837549193205,2003-09-19,个人独资企业,包荣威,"N/A","包装装璜、其它印刷品印刷",浙江,金华,"东阳市南马镇大仁村"
杭州金马离合器有限公司,91330106143233426K,2003-09-19,N/A,袁彪,"600(万元人民币)","制造、加工：汽车离合器，五金（上述经营范围中涉及前置审批项目的，在批准的有效期内方可经营）。 货物进出口",浙江,杭州,"杭州市双浦镇小江村六号浦东114号9幢"
绍兴市今明数码科技服务有限公司,9133060275490126XC,2003-09-19,N/A,陈泉林,"100(万元人民币)","批发、零售：计算机及配件、电脑耗材、办公用品；机电设备、电气设备、配电柜、仪器仪表、景观灯具的销售、安装、调试、维修；LED电子屏销售、安装、调试、租赁、维修；计算机软件开发、网页制作（除经营性互联网信息服务）、系统集成、计算机技术服务及维修；计算机网络及智能化工程、监控防盗报警工程、自动化控制工程、照明工程的设计、施工。",浙江,绍兴,"绍兴市越城区香桥小区1幢3号"
中国电信股份有限公司台州路桥横街营业厅,913310045717302261,2003-09-19,N/A,戴仙福,"N/A","受所隶属公司委托，在公司经营范围内开展经营活动。",浙江,台州,"台州市路桥区横街镇横街居"
中国电信股份有限公司温州信河营业厅,9133030076131846XM,2003-09-19,N/A,张鸥,"N/A","在总公司经营范围内开展业务。",浙江,温州,"温州市信河街305号"
余姚市威龙塑料化工有限公司,91330281753270734P,2003-09-19,N/A,何爱珍,"50(万元人民币)","塑料原料，化工原料（除化学危险品），电线，电缆，插头，塑料制品，家用电器的批发、零售#",浙江,宁波,"余姚市余姚中塑商务楼10-05"
杭州恒达水泥制品厂,91330109754403412U,2003-09-19,私营合伙企业,N/A,"N/A","一般经营项目：生产：钢筋混凝土制品及混凝土管子*",浙江,杭州,"萧山区所前镇三泉王村"
湖州旭春纸箱有限公司,91330503754913535F,2003-09-19,N/A,吴小虎,"150(万元人民币)","包装装潢、其他印刷品印刷；纸箱制造。",浙江,湖州,"湖州市和孚镇荻港"
杭州天元土木工程造价咨询有限公司,913301067544028234,2003-09-19,N/A,郭峥,"100(万元人民币)","服务：建设工程造价咨询（甲级）。服务：建设工程技术咨询、建设工程招投标业务代理、建设工程项目报建业务代理、建设工程项目管理",浙江,杭州,"杭州市西湖区文三路369号文三数码大厦1331室"
遂昌县潘接坑口水电开发有限公司,91331123753993094L,2003-09-19,N/A,巫灵生,"200(万元人民币)","水力发电；发电机组、电气设备维护、保养。",浙江,丽水,"浙江遂昌县柘岱口乡尹家村"
宁波嘉能进出口有限公司,91330282753270304C,2003-09-19,N/A,杨俊亮,"1,650(万元人民币)","自营和代理货物和技术的进出口，但国家限定经营或禁止进出口的货物和技术除外；工艺美术品、针纺织品、服装、五金配件、普通机械、化工原料、电子产品、玩具、家用电器、建筑材料、金属材料批发、零售。",浙江,宁波,"慈溪市浒山街道时代华都4号楼802室"
宁波三林经贸有限公司,91330201753270646D,2003-09-19,N/A,张建林,"1,000(万元人民币)","金属材料、建筑材料、化工原料、五金交电的批发、零售；围塘工程咨询服务。",浙江,宁波,"宁波高新区广贤路1009号9-13室"
遂昌县万佳商贸有限公司,91331123753994644Q,2003-09-19,N/A,王杏凤,"500万人民币元","百货、化妆品、五金、日杂(不含烟花爆竹)、针织品、服装、玩具、保健食品、一般劳保用品、体育用品、办公用品、食用农产品(鲜活肉类、禽蛋类、鲜活水产品、水果、蔬菜)、鲜花、纸品、饰品、化工产品(危险化学品及易制毒化学品除外)、钟表、眼镜、黄金、银饰销售,家电、自行车、电动车、通讯器材维修、销售;以下限分支机构...",浙江,丽水,"浙江省丽水市遂昌县妙高街道北街216号"
杭州百朋贸易有限公司,9133010475174537XA,2003-09-19,N/A,诸利舫,"50(万元人民币)","一般经营项目：批发、零售：厨房用品、五金交电、装饰材料、办公用品、针织品、服装、鞋帽、卫生陶瓷、橡胶制品、电子计算机，家用电器，初级食用农产品（除食品）服务：网络技术服务、计算机软硬件技术开发，教育信息咨询（除留学中介及咨询），成年人非学历文化教育培训",浙江,杭州,"杭州市江干区富春路701号万象城第L5层第509号"
海盐凯特纺织品有限公司,913304247549059140,2003-09-19,N/A,张燕,"50(万元人民币)","机织棉布、涤布、海绵复合布、海绵制品制造、加工（以上经营范围不含需前置审批项目）",浙江,嘉兴,"百步工业区南C区"
舟山市嘉诚房产置业代理有限公司,913309037539985060,2003-09-19,N/A,丁建国,"100(万元人民币)","第二类增值电信业务中的信息服务业务（限互联网信息服务业务）",浙江,舟山,"舟山市普陀区沈家门街道菜市路121弄30号"
杭州力强索具有限公司,913301097544030415,2003-09-19,N/A,王雪源,"500(万元人民币)","生产：力拉带索具、五金配件；自产产品的出口业务和自用产品的进口业务（国家禁止公司经营和限制公司经营的商品及技术除外)；货物及技术进出口；投资咨询（除证券、期货、基金）；经销：金属材料、有色金属、化工产品及原料（除化学危险品及易制毒化学品），棉花、棉纺产品，国家政策允许上市的食用农产品，其他无需审批的一切合法项目的进出品业务",浙江,杭州,"萧山区闻堰镇闻兴村"
杭州龙光服饰有限公司,91330104754403367J,2003-09-19,N/A,林茂,"50(万元人民币)","批发零售：服装，小百货；服装进出口",浙江,杭州,"杭州市江干区艮山西路75号3091-3093号营业房"
杭州中德水利管理有限公司,91330103754404079H,2003-09-19,N/A,林倩,"200(万元人民币)","服务：环保工程投资管理咨询，水务处理的技术开发、技术咨询。其他无需报经审批的一切合法项目。***",浙江,杭州,"下城区思敬里21-1号"
苍南县万博礼品有限公司,91330327754923709A,2003-09-19,N/A,杨加旺,"50(万元人民币)","许可经营项目：台挂历装订(不含出版物、包装装潢印刷品印刷，在印刷许可证有效期内经营）；一般经营项目：文具、皮具、工艺礼品生产、加工、销售。",浙江,温州,"苍南县金乡环城东路168号"
杭州琳达汽配有限公司,91330109754402583L,2003-09-19,N/A,陈火才,"300(万元人民币)","制造、加工、销售：手工工具，五金工具，汽车配件，机械配件；经销：包装材料（粘胶带），化工产品及原料（除化学危险品及易制毒化学品），电器设备**",浙江,杭州,"萧山区义桥镇蛟山村"
慈溪市坎墩安达电器厂,91330282753284706x,2003-09-19,个人独资企业,励顺良,"N/A","五金配件、塑料制品加工、制造。",浙江,宁波,"慈溪市坎墩街道工业区"
遂昌县插坑水电开发有限公司,91331123753994169X,2003-09-19,N/A,徐志斌,"480(万元人民币)","许可经营项目：无一般经营项目：水力发电",浙江,丽水,"浙江省遂昌县龙洋乡西滩村插坑自然村"
浙江捷瑞疏浚工程有限公司,91330203754931223Q,2003-09-19,N/A,梅小云,"3,000(万元人民币)","港口航道疏浚，陆域吹填，环保清淤，深水挖泥，水下清障。",浙江,宁波,"海曙区民丰街69弄10,12号4-2"
温州金鼎汽摩部件有限公司,91330301753992462W,2003-09-19,N/A,邱振松,"300(万元人民币)","一般经营项目：制造、销售：汽车配件、摩托车配件、中低压电器开关、紧固件、塑料制品、五金配件、胶木制品。",浙江,温州,"温州市龙湾区海城中星工业区"
杭州英泰会计师事务所有限公司,91330103754404087C,2003-09-19,N/A,金庆辉,"60(万元人民币)","服务：审查企业会计报表，验证企业资本，办理企业合并、分立、清算事宜中的审计业务，基本建设年度决算审计，代理记账，会计咨询，税务咨询，税务事务代理，投资咨询",浙江,杭州,"杭州市江干区同方国际大厦5楼505室"
温州市瓯海潘桥伟意达皮鞋厂,92330304MA2C8CXF0H,2003-09-19,个体工商户,蔡国和,"N/A","皮鞋制造、加工",浙江,温州,"温州市瓯海潘桥潘桥高桐路1338号"
湖州市南浔安达加油站有限公司,9133050375490492XY,2003-09-19,N/A,徐海荣,"100(万元人民币)","许可经营项目：汽油零售（凭有效危险化学品经营许可证经营）。一般经营项目：柴油（除危险化学品）零售；燃料油（除成品油及危险化学品）、润滑油、日用品、文具用品、汽车零配件、医疗器械",浙江,湖州,"湖州市南浔镇方丈港村(318国道旁)"
温州市龙湾永中加芬仪表加工厂,92330303MA29771P7E,2003-09-19,个体工商户,黄加芬,"N/A","一般经营项目：五金配件加工",浙江,温州,"浙江省温州市龙湾区永中街道朱垟村"
台州市椒江海宇塑料厂,91331002753999402L,2003-09-19,个人独资企业,尚海鸥,"N/A","非食用塑料制品制造、加工。",浙江,台州,"台州市椒江区葭芷街道马庄村545号"
杭州智冠计算机服务有限公司,91330108751745548B,2003-09-19,N/A,孙家明,"10(万元人民币)","互联网上网服务；销售：预包装食品（含冷藏冷冻食品）",浙江,杭州,"杭州市滨江区西兴街道固陵路64-1号7楼"
宁波市江北锴锋五金模具商行,913302057532728360,2003-09-19,个人独资企业,裘定军,"N/A","五金产品、仪器仪表、机械设备及配件、橡塑制品、电气设备、磨料、日用品、清洁用品、文具用品、润滑油、建材、家具、计算机、软件及辅助设备、一般劳保用品、化工产品（除危险化学品和易制毒化学品）的批发、零售。",浙江,宁波,"浙江省宁波市江北区洪塘中路298号1-10"
杭州骏伟电子有限公司,91330105749498605C,2003-09-19,N/A,冯新勇,"200(万元人民币)","电子产品、仪器仪表、机械设备、计算机及配件、办公用品、通信设备、办公自动化设备及消耗材料的销售；计算机软硬件的技术开发、技术咨询、技术服务、成果转让；计算机信息网络工程；含下属分支机构经营范围。",浙江,杭州,"拱墅区丰潭路388号1幢705室"
温岭市金佳流水线设备制造厂,91331081754946994P,2003-09-19,个人独资企业,潘素花,"N/A","流水线设备制造、销售。",浙江,台州,"温岭市松门镇迎宾大道"
宁波联洋船务有限公司,91330204744969455T,2003-09-19,N/A,王战友,"1,550(万元人民币)","港口货物运输的无船承运（凭有效许可证经营）；海上、航空、陆路国际货物运输代理；民用航空销售代理；企业管理咨询；物流信息咨询；普通货物仓储，代理报关、报检；自营和代理货物和技术的进出口，但国家限定经营或禁止进出口的货物或技术除外。",浙江,宁波,"浙江省宁波市鄞州区福明路828号恒富大厦16楼"
临安锦大正兴环境技术有限公司,913301857544059442,2003-09-19,N/A,吴健平,"50(万元人民币)","生产、销售：土壤改良材料、园艺介质基质、有机肥料",浙江,杭州,"临安市板桥镇静堂弄1号"
杭州方维科技服务有限公司,91330105754403738P,2003-09-19,N/A,陈金爱,"10(万元人民币)","电子产品、机械设备、纺织品的技术开发、技术咨询；经济信息咨询（除证券、期货、商品中介）；企业管理咨询；成年人的非文化教育培训，成年人的非证书劳动职业技能培训",浙江,杭州,"拱墅区湖墅南路368号(浙租大厦)401室"
中国电信股份有限公司台州路桥蓬街营业厅,913310045717301623,2003-09-19,N/A,蔡晨曦,"N/A","受所隶属公司委托，在公司经营范围内开展经营活动。",浙江,台州,"台州市路桥区蓬街镇振蓬东路74号"
杭州龙翔科技有限公司,913301067544041756,2003-09-19,N/A,熊润祥,"101(万元人民币)","服务：承接弱电工程（涉及资质证凭证经营），工业自动化控制系统、安防监控系统、LED显示系统、门禁考勤系统的设计、安装及维护，计算机软硬件开发及技术服务；批发、零售：工业自动化控制设备，仪器仪表，通信设备",浙江,杭州,"杭州市西湖区文三路235号"
绍兴市诚合化工有限公司,91330600753995620L,2003-09-19,N/A,贺宏宾,"300(万元人民币)","生产、加工：助剂（除化学危险品、易制毒化学品、食品添加剂）；批发、零售：纺织原料及产品（除皮棉、蚕茧）、服装、电气设备、纸制品、化工原料及产品",浙江,绍兴,"绍兴市越城区斗门镇马海路44号"
杭州锦山装饰工程有限公司,91330110754406357W,2003-09-19,N/A,朱金山,"1,100(万元人民币)","建筑装饰施工；室内外装修设计；销售：建筑材料、五金交电、金属材料、化工原料（除化学危险品及易制毒化学品）、日用百货、五金工具、纺织品、工艺品、家具；国内广告设计、制作、代理、发布",浙江,杭州,"杭州余杭区南苑街道临东路170号"
杭州华天化工有限公司,91330105754403877E,2003-09-19,N/A,吴景,"100(万元人民币)","化工产品",浙江,杭州,"拱墅区富强路23号(原婴儿港21-1号)1幢408室"
杭州经纬建筑工程有限公司,91330106751744932A,2003-09-19,N/A,陈秀亮,"100(万元人民币)","服务：工业与民用建筑施工，室内外装饰设计、施工",浙江,杭州,"西湖区保俶路40号"
长兴县浙北建材市场有限公司,913305227539954791,2003-09-19,N/A,周永郎,"50(万元人民币)","一般经营项目：长兴县浙北建材市场内自有房屋租赁，物业管理。",浙江,湖州,"浙江省长兴县雉城镇环城南路西侧"
余姚市城区黑鲸电泳金属制品厂,92330281MA291C656L,2003-09-19,个体工商户,胡旭冲,"N/A","一般经营项目：五金件的加工，塑料制品、金属制品的电泳漆加工，汽车配件的制造。",浙江,宁波,"余姚市阳明街道潘巷村（下畈山脚）"
杭州中汇玻璃有限公司,913301097544025407,2003-09-19,N/A,汤光华,"1,880(万元人民币)","玻璃深加工及安装（钢化玻璃、中空玻璃、夹胶玻璃、家具玻璃）；经销：建材、五金机械及配件、、化工产品（除化学危险品及易制毒化学品）**",浙江,杭州,"萧山区红山农场一分场"
中国铁通集团有限公司衢州分公司龙游经营部,91330825754911775U,2003-09-19,N/A,黄尔东,"N/A","以总公司名义从事经国家电信主管部门批准的基础电信业务和增值电信业务。",浙江,衢州,"浙江省衢州市龙游县洲街道火车站人民广场58号"
杭州银鼎工程机械有限公司,91330109754403383G,2003-09-19,N/A,王乃炳,"50(万元人民币)","经销：工程机械整机及零配件，汽车零部件及汽车清洗美容用品，五金工具**",浙江,杭州,"萧山区杭州原野汽配五金市场2幢10号"
杭州华晨道路清洁有限公司,913301107544064536,2003-09-19,N/A,陈云飞,"100(万元人民币)","一般经营项目：道路清洁；绿化养护；家政服务；物业管理。",浙江,杭州,"杭州余杭区星桥街道贾家村"
绍兴汇业汽车销售服务有限公司,9133062175399357XW,2003-09-19,N/A,吴慧文,"500(万元人民币)","机动车维修：一类机动车维修（大中型货车维修、小型车辆维修）（道路运输经营许可证有效期至2016年11月29日止）；代理险种：机动车辆保险、意外伤害保险",浙江,绍兴,"绍兴市柯桥区钱清镇江墅村1幢"
浙江格林贝思设计咨询有限公司,91330105754402516W,2003-09-19,N/A,谭强,"500(万元人民币)","建筑景观设计、咨询（凭资质证书经营）；园林绿化、室内外装潢设计；建筑材料的批发、零售。",浙江,杭州,"浙江省杭州市拱墅区大塘巷2幢一层101室"
杭州叶洲泵业有限公司,91330109754402532C,2003-09-19,N/A,夏国春,"1,080(万元人民币)","一般经营项目：制造、加工、销售：水泵，机械配件**",浙江,杭州,"萧山区党湾镇先锋村"
宁波康尔丽电器有限公司,91330226753267113N,2003-09-19,N/A,尤剑松,"10(万美元)","电动牙刷、小家用电器、塑料制品制造、加工。",浙江,宁波,"浙江省宁海县强蛟镇团结路"
中国电信股份有限公司台州路桥新桥营业厅,91331004MA28GDNR8P,2003-09-19,N/A,王通尧,"N/A","受所隶属公司委托，在公司经营范围内开展经营活动。",浙江,台州,"台州市路桥区新桥镇新桥村文中街"
海宁市谛龙线业有限公司,9133048175399402X5,2003-09-19,N/A,计正文,"280(万元人民币)","氨纶包覆丝、服装、皮革制品、箱包、鞋帽、珠宝首饰（不含文物、古玩）批发及网上经营；氨纶包覆丝、经编织物、加弹丝、纺线制造、加工；从事各类商品及技术的进出口业务",浙江,嘉兴,"海宁市海昌街道光耀村李家桥10号"
杭州富顺弹簧有限公司,91330110754403703C,2003-09-19,N/A,司亚玲,"50(万元人民币)","许可经营项目：弹簧的制造、加工。一般经营项目：汽车配件的销售。",浙江,杭州,"余杭区良渚街道安溪村照山"
德清县明丽丝织有限公司,913305217539934491,2003-09-19,N/A,姚鑫良,"50(万元人民币)","真丝织品织造，围巾销售。",浙江,湖州,"德清县钟管镇钟管村"
宁波瑞巨机械制造有限公司,91330206753270179M,2003-09-19,N/A,柯根定,"380(万元人民币)","一般经营项目：紧固件、轴承、金属拉丝、机械设备及配件、模具、五金、塑料制品的制造、加工、销售。",浙江,宁波,"浙江省宁波市开发区小港富山南路36号"
临安金盛精密铸造有限公司,91330185754434630K,2003-09-19,N/A,宣四祥,"50(万元人民币)","加工、销售：不锈钢精铸制品",浙江,杭州,"临安市板桥镇三口村"
杭州龙虹水泵有限公司,91330104754403295R,2003-09-19,N/A,郑泽锋,"100(万元人民币)","批发零售：水泵，机电设备及配件",浙江,杭州,"杭州市江干区笕桥镇横塘村"
开化新利办公设备有限公司,91330824753996252H,2003-09-19,N/A,林振,"30(万元人民币)","计算机及软件、办公设备、文化用品、通讯器材零售（凡涉及许可证制度的，凭证经营）",浙江,衢州,"浙江省衢州市开化县城关镇环城路8号"
慈溪彩虹电子有限公司,9133028275327169XB,2003-09-19,N/A,李琴,"100(万元人民币)","电子元器件、家用电器、通讯器材、电线、电缆、仪器配件、仪表配件、五金配件、塑料制品批发、零售；自营和代理货物和技术的进出口，但国家限定经营或禁止进出口的货物和技术除外。",浙江,宁波,"慈溪市古塘街道明州路355号"
宁波明煌电子有限公司,913302047421613648,2003-09-19,N/A,王鸿雁,"150(万元人民币)","电子元器件、电器配件、塑料制品、五金、模具、灯具的制造、加工；铝制品、针纺织品、文化用品、玻璃制品的批发、零售。经营本企业自产产品及技术的出口业务和本企业所需的机械设备、零配件、原辅材料及技术的进口业务，但国家限定公司经营或禁止进出口的商品和技术除外。",浙江,宁波,"江东区科技创业中心四楼"
中国电信股份有限公司台州路桥下梁营业厅,91331004MA28GDNW9X,2003-09-19,N/A,戴仙福,"N/A","受所隶属公司委托，在公司经营范围内开展经营活动。",浙江,台州,"台州市路桥区金清镇高田村邮电路"
杭州全盛装饰安装工程有限公司,91330105749498648R,2003-09-19,N/A,李士和,"100(万元人民币)","室内外装饰工程、水电安装工程的承包",浙江,杭州,"拱墅区半山路101号"
温州市金顺印务有限公司,91330304755944579Q,2003-09-19,N/A,陈世珍,"150(万元人民币)","许可经营项目：包装装璜、印刷品印刷",浙江,温州,"瓯海任桥工业区13幢后"
宁海县黄坛海力塑料模具厂,92330226MA2EMMTWX9,2003-09-19,个体工商户,胡垚军,"N/A","一般经营项目：塑料件、模具加工。",浙江,宁波,"宁海县黄坛杨家村"
余姚市康嘉电器塑料厂,91330281753270670R,2003-09-19,N/A,陈周红,"N/A","家用电力器具，塑料制品，五金件的制造，加工#",浙江,宁波,"余姚市三七市镇二六市村官桥"
温州市瓯海潘桥立明眼镜厂,92330304MA2C99Y1XL,2003-09-19,个体工商户,林发明,"N/A","制造、加工、销售眼镜",浙江,温州,"温州市瓯海区潘桥街道奔驰路3号（2幢3楼西首）"
宁波市汇源机械设备进出口有限公司,91330204144067896Y,2003-09-19,N/A,王惠娟,"938.6000(万元人民币)","自营和代理各类商品和技术的进出口，但国家限定公司经营或禁止进出口的商品和技术除外。机械、电子产品包装储运及保税仓储；本公司场地和房屋租赁；会展、会务服务；金属材料、机电设备（除汽车）、五金、化工原料及产品（除危险化学品）、针纺织品、百货的批发、零售。",浙江,宁波,"浙江省宁波市鄞州区百丈路１６８号（会展中心Ａ楼）"
宁波普莱特电子有限公司,91330283753269282G,2003-09-19,N/A,李士峰,"400(万元人民币)","非金属制品模具的设计、制造，塑胶制品制造、加工，自营和代理各类商品和技术的进出口业务，但国家限定公司经营或禁止进出口的商品和技术除外。",浙江,宁波,"浙江省宁波市奉化区经济开发区汇源路126号"
浙江良丰阀门有限公司,91330301754901606P,2003-09-19,N/A,季克寅,"500(万元人民币)","制造、加工、销售：中、低压阀门、管道配件；货物进出口、技术进出口。",浙江,温州,"温州经济技术开发区沙城街道七一村罗东南街东首"
中国电信股份有限公司台州路桥营业厅,91331004MA28GDNU27,2003-09-19,N/A,潘海鹏,"N/A","受所隶属公司委托，在公司经营范围内开展经营活动。",浙江,台州,"台州市路桥区路桥良二村"
浙江华威智能科技有限公司,91330104754406031H,2003-09-19,N/A,姜林华,"1,680(万元人民币)","食品经营（凭有效许可证经营）；服务：网络技术、计算机软硬件、智能产品、数码产品、电子产品、通讯设备、机器人、无人机、照明电器、家用电器、工业自动化设备、机械设备的技术开发、技术咨询、技术服务、成果转让，经济信息咨询（除商品中介），企业管理咨询，文化交流活动策划，企业形象策划，市场营销策划，机器人产品的上门维修及租赁服务；批发、零售：卫生敷料，消毒用品，五金交电，计算机及电脑设备及配件，电子产品",浙江,杭州,"浙江省杭州市江干区三新路中豪湘座2号楼333室"
杭州意龙纺织品有限公司,91330103754426438Y,2003-09-19,N/A,许生杰,"100(万元人民币)","批发、零售：针纺织品、服装；货物进出口",浙江,杭州,"杭州市江干区九环路31-1号2幢3层302"
杭州德邦电子机械有限公司,91330100751737337Y,2003-09-19,N/A,张崇德`,"300(万美元)","生产汽车电子防抱死制动装置、汽车电器控制盒总成及汽车、摩托车零部件；销售自产产品（除国家禁止和限制的除外）＊＊＊",浙江,杭州,"杭州市高新技术产业开发区(滨江)滨康路619号"
温岭市博大爆破工程有限公司,913310817570730413,2003-09-19,N/A,郑正岗,"1,018(万元人民币)","一般经营项目：爆破与拆除工程专业承包叁级；土石方工程承包叁级；采掘工程施工类（二级）；爆破设计：拆除爆破C、硐室爆破C、中深孔爆破B；边坡绿化；建筑用石料（凝灰岩）露天开采",浙江,台州,"浙江省温岭市太平街道三星商业街16号楼"
