西藏中茵集团有限公司,91540124MA6T1WQB2T,2003-08-21,N/A,高建荣,"10,000(万)","对房地产、宾馆、纺织、电子及通信设备的投资；销售纺织原料(不含棉花、蚕茧)、化工原料(不含危险品)、金属材料。【依法需经批准的项目，经相关部门批准后方可经营此项目。】",西藏,拉萨,"拉萨市曲水县中小企业孵化基地301-B001号"
西藏合林建筑设计有限公司,91540400741907953K,2003-08-22,N/A,苏龙福,"650(万)","农林行业（农业工程）乙级、公路行业（公路）专业丙级、市政行业（给水工程、排水工程、道路工程)专业乙级、建筑行业（建筑工程）乙级、风景园林工程设计专项乙级、可承担建筑装饰工程设计、建筑幕墙工程设计、轻型钢结构工程设计、建筑智能化系统设计、照明工程设计和消防设施工程设计；建设工程总承包；项目管理；工程设计的技术与管理服务；工程测量；房屋建筑（不含超限高层）、市政基础设施",西藏,林芝,"西藏林芝市巴宜区八一镇福州大道西段49号"
西藏光达贸易有限公司,91540000741907929E,2003-08-26,N/A,马光辉,"1,000(万)","润滑油、建材辅材、日用百货、汽车配件、轮胎批发及零售；汽车维修、汽车美容、洗车。【以上经营范围以登记机关核定为准】",西藏,拉萨,"拉萨市金珠西路以北、和平路以南北侧商铺1-2层20号"
拉萨绿宝园林艺术有限公司,91540100919662210K,2003-09-08,N/A,赵炜,"20(万)","绿化工程，高尔夫练习球场，出售苗木，花卉。【依法须经批准的项目，经相关部门批准后方可经营该项目】。",西藏,拉萨,"拉萨市城关区蔡公堂乡五组"
西藏华立税务师事务所有限公司,91540000741908075B,2003-09-08,N/A,陈志,"30(万)","税务代理、税务咨询、税务审查、税务顾问、代理建帐建制【依法须经批准的项目，经相关部门批准后方可开展经营活动】。",西藏,拉萨,"拉萨市江苏东路２２号（市审计局内）"
西藏云龙商贸有限公司,915400007419080243,2003-09-09,N/A,叶智林,"218(万)","住宿；销售日用百货、服装鞋帽、家用电器、针纺织品、工艺品、土特产品、五金交电、旅游纪念品、建材；中药材收购。[依法须经批准的项目，经相关部门批准后方可开展经营活动。]",西藏,拉萨,"拉萨市北京中路２１号（地矿厅商品房）"
西藏四友商贸有限公司,91540000741908163R,2003-09-11,N/A,聂维莉,"40(万)","预包装食品（酒精饮料）零售；销售日用百货、家用电器、建辅建材、五金交电、服装鞋帽、土畜产品、机电产品",西藏,拉萨,"拉萨市柳梧新区冈仁国际1期12号商铺"
拉萨三和商贸有限公司,91540100741908235P,2003-09-16,N/A,张兴旗,"60(万)","房屋租赁。【依法需经批准的项目，经相关部门批准后，方可经营此项目】",西藏,拉萨,"拉萨市宇拓路12号（国贸大厦后面）"
西藏置信工程设备安装有限公司,9154000074190826X0,2003-09-18,N/A,付丽萍,"360(万)","生物工程技术、网络技术、计算机及软件开发；环保节能产品、通信器材、电子元器件的销售；中央空调设计、安装及维修。[依法须经批准的项目，经相关部门批准后方可开展经营活动]",西藏,拉萨,"拉萨市慈松塘中路48号"
林芝市平吉房地产开发有限责任公司,91540400741908315T,2003-09-24,N/A,韩灏,"3,000(万)","房地产经营与开发、物业管理、房屋装潢设计。[依法须经批准的项目，经相关部门批准后方可开展经营活动]",西藏,林芝,"林芝市巴宜区八一镇广州大道南段201号5楼"
西藏林芝宇拓藏药有限责任公司,91540000741905579E,2003-09-24,N/A,边巴次仁,"300(万)","丸剂、散剂的生产。【依法须经批准的项目，经相关部门批准后方可开展经营活动】",西藏,拉萨,"西藏拉萨市柳梧新区察古大道规划路"
西藏新原制冷设备有限公司,91540091741908534A,2003-09-27,N/A,赵修武,"500(万)","一般经营项目：家用电器、冷暖设备销售、安装维修、电子网络设备、办公用品、建材生产销售。",西藏,拉萨,"拉萨市经济技术开发区维色路A区A2-8"
拉萨尼达自然生态开发有限公司,91540127741908657T,2003-10-10,N/A,刘文凤,"600(万)","野生斑头雁的驯养、繁殖、销售；家禽家畜的养殖、销售；农产品种植、销售；水产养殖、销售；水产苗种养殖、销售。农业技术推广及服务",西藏,拉萨,"拉萨市墨竹工卡县工卡路4号"
西藏圣地旅游汽车有限公司,91540000741908702J,2003-10-10,N/A,尼玛次仁,"1,000(万)","非定线旅游",西藏,拉萨,"拉萨市林廓东路６号"
西藏永安工程监理有限公司,91540000741908729A,2003-10-16,N/A,廖代中,"100(万)","房屋建筑工程监理；房屋代办交易手续、房地产信息咨询服务、工程技术咨询服务；百货、电器成套开关的销售；水利水电工程监理；公路工程监理；市政工程监理；地质灾害治理工程监理；钢结构工程监理；建筑装修装饰工程监理；环保工程监理；消防设施工程监理；园林绿化工程监理；体育场地设施工程监理。［依法须经批准的项目，经相关部门批准后方可开展经营活动。］",西藏,拉萨,"拉萨市巴尔库路靓点小区A2-3号"
西藏阿妈羌玛酒业有限公司,915400007419089725,2003-10-20,N/A,陈东,"70(万)","其他酒",西藏,拉萨,"拉萨市达孜县工业园区"
西藏永正商贸有限公司,915400007419088681,2003-10-22,N/A,肖永正,"500(万)","家用电器、机电产品",西藏,拉萨,"拉萨市宇拓路９号（乾和大厦商品房）"
西藏日喀则扎寺古建筑工程有限公司,91540200741914862K,2003-10-23,N/A,旺久,"1,200(万)","园林古建筑工程施工、房屋建筑施工承包、古建筑维修保护",西藏,日喀则,"日喀则市吉几朗卡路7号"
西藏科汇新能源科技有限公司,91540000741909019Q,2003-10-28,N/A,王光淑,"100(万元人民币)","太阳能、风能、微小水电技术的开发、设备安装、销售通讯器材",西藏,拉萨,"拉萨市扎基路６号"
西藏惠翔商贸有限公司,915400007419149342,2003-10-30,N/A,苟拉黑曼,"150(万)","销售日用百货、土畜产品、机电产品（不含小轿车）、针纺织品、建辅建材、工艺品销售；货运信息；中药材收购",西藏,拉萨,"拉萨市北京西路（区征稽局商品房）"
西藏北大仓商贸有限公司,91540000741909190T,2003-11-03,N/A,崔永冬,"216(万)","销售土特产品、日用百货、工艺品、五金建材、家具、通讯器材；家政服务；办公用品加工销售。【依法须经批准项目，经相关部门批准后方可开展经营活动】",西藏,拉萨,"拉萨市娘热路城北税务局商品房8-10号"
西藏山南康达实业发展有限公司,91542200741914678L,2003-11-05,N/A,米玛次仁,"8,000(万)","矿产品开采、加工;；矿产品销售;；投资咨询;；房屋出租。",西藏,山南,"山南市乃东区泽当镇民族路康达大厦"
林芝市宏基出租汽车有限责任公司,91540400741909414L,2003-11-10,N/A,曹文蓉,"20(万)","城市客运出租服务与管理。",西藏,林芝,"西藏林芝市巴宜区八一镇福建路3号"
西藏西农永生车辆维修有限公司,915400007419094065,2003-11-12,N/A,周巍,"300(万)","机动车维修；汽车美容；汽车配件销售、租赁；汽车销售【依法须经批准的项目，经相关部门批准后方可开展经营活动】。",西藏,拉萨,"拉萨市金珠西路１５１号"
西藏永丰建设工程有限公司,91540000741909369Y,2003-11-12,N/A,吴永昌,"8,000(万)","房屋建筑工程施工总承包、市政公用工程施工总承包、水利水电工程施工总承包、公路工程施工总承包、建筑装修装饰工程专业承包、消防设施工程专业承包、环保工程专业承包；预制构件的销售；房屋租赁。",西藏,拉萨,"拉萨市娘热路３４号"
西藏发达农资销售有限公司,915400007419094658,2003-11-12,N/A,宋中平,"10(万)","蔬菜种子批零；农用器具；花卉。【依法须经批准的项目，经相关部门批准后方可开展经营活动】",西藏,拉萨,"拉萨市东郊农科所商品房"
拉萨市城关区乡镇企业天平运务有限公司,91540100741909430T,2003-11-14,N/A,李振平,"68(万)","停车场；住宿；道路普通货物运输。【依法须经批准的项目、经相关部门批准后方可开展经营活动】",西藏,拉萨,"拉萨市罗布林卡南路"
林芝华庭房地产开发有限责任公司,915404007419089564,2003-11-17,N/A,孙涛,"1,500(万)","房地产开发建设经营。[依法须经批准的项目，经相关部门批准后方可开展经营活动]",西藏,林芝,"西藏林芝市巴宜区八一镇迎宾大道尚城御林湾1号楼"
西藏圣腾商贸有限公司,915400917419288853,2003-11-18,N/A,侯建,"600(万)","一般经营项目：日用百货、建筑材料、五金交电、针纺织品、服装鞋贸、土畜产品、家用电器销售。",西藏,拉萨,"拉萨经济技术开发区A区博达路圣腾广场1号"
西藏天极税务师事务所有限公司,915400007419095964,2003-11-18,N/A,于佰松,"30(万)","税务代理、纳税知识培训、税务筹划、代理记帐、涉税鉴证、税务咨询、会计咨询。[依法须经批准的项目，经相关部门批准后方可开展经营活动]",西藏,拉萨,"拉萨市金珠东路5-8号"
拉萨力诺光优高科技有限责任公司,915401007419097801,2003-11-20,N/A,高元坤,"100(万)","太阳能能材料，太阳能电池，组件与应用产品及其相关生产设备的设计，批发，零售，技术服务",西藏,拉萨,"西藏拉萨市夺底路9号"
日喀则市雅江环保有限公司,91540200741909748T,2003-11-24,N/A,陈岗,"3,000(万)","防沙治沙、牧草种子种植及销售、草原网围栏、暖棚圈、草原防火设备、安防设备、化学实验室教学设备、农药化肥、饲料、热力设备、燃油锅炉、壁挂锅炉、暖气锅炉的销售；LED显示屏、动漫制作、园林绿化、企业培训咨询。",西藏,日喀则,"日喀则市东郊姊妹山"
西藏中兴华会计师事务所有限公司,91540000741909676P,2003-11-27,N/A,王晓泉,"30(万)","会计报表审计、验证企业资本；企业清算、合并、分立审计；经济责任审计、基本建设审计；司法会计鉴定；会计咨询服务、会计制度设计；担任会计顾问；各项经济理财；项目可行研究；财务业务培训【依法须经批准的项目，经相关部门批准后方可开展经营活动】。",西藏,拉萨,"拉萨市江苏东路２２号（市审计局办公楼１楼）"
西藏宏信物业管理有限公司,915400007419098877,2003-12-04,N/A,冉建军,"300(万)","物业管理；物业顾问、物业策划；家政服务、室内装饰装修；五金交电销售；机电产品维修",西藏,拉萨,"拉萨市金珠西路138号"
西藏雪域矿业开发有限公司,91540000741909991B,2003-12-09,N/A,张勇,"5,000(万)","西藏山南措美县马扎拉岩金矿详查",西藏,拉萨,"拉萨市民族北路一号宏运家居装饰城五楼8532-8538号"
华新水泥(西藏)有限公司,91542200741911020Y,2003-12-22,N/A,柯友良,"5,000(万)","生产32.5R、42.5R、52.5R普通硅酸盐水泥，42.5中热硅酸盐水泥，32.5低热硅酸盐水泥以及市场需要其他水泥，销售公司产品，提供水泥技术服务，提供货物运输服务和运输代理服务、水泥批发、零售，水泥用石灰石矿山开采（依法需经批准的项目，经相关部门批准后方可开展经营活动）",西藏,山南,"西藏自治区山南市泽当镇格桑路55号"
西藏沛源汽车销售有限公司,91540000741910204A,2003-12-23,N/A,郭骏,"100(万)","东风品牌汽车的销售及服务",西藏,拉萨,"拉萨市和平路东嘎村一组"
西藏华信工程招标有限公司,91540000741910351U,2003-12-25,N/A,嘎尔玛,"300(万)","工程招标代理【依法须经批准的项目，经相关部门批准后方可开展经营活动】。",西藏,拉萨,"拉萨市当热路城关区市政公司院内"
中国人民财产保险股份有限公司林芝分公司,91540400783522728A,2003-12-31,N/A,刘娟,"N/A","财产损失保险、责任保险、信用保险、意外伤害保险和保证保险等人民币或外币保险业务；各类财产保险的再保险业务；国家委托经营的政策性保险业务；各类财产保险及其再保险的服务与咨询业务；代理其他保险公司办理有关业务；国家法律、法规允许的资金运用业务；国家保险监管部门批准的其他业务。[依法须经批准的项目，经相关部门批准后方可经营该项目]",西藏,林芝,"西藏林芝市巴宜区八一镇八一大街367号"
