防城港市防城区附城企业总公司,91450603201183990W,1988-08-06,N/A,陈铁翔,"62.1000(万元人民币)","干鲜果品，农副土特产品（除食品），日用杂品，百货，五金交电，化工（除危险品、剧毒品），机电产品（除小汽车）批发、零售；果树、林木种植，对虾养殖；矿石购销（除国家专控部分）；服装加工",广西,防城港,"防城区慈爱路77号"
广西轻工业对外经济技术合作公司,91450000198220147N,1988-08-09,N/A,石小坚,"193(万)","腐殖酸类有机肥。兼营：摩托车、机电设备、金属材料、日用轻工产品、五金交电、纺织品、服装鞋帽、工艺美术品、建筑材料、橡胶及制品，经济技术合作。",广西,南宁,"南宁市青秀区建政路４９号"
中国农业银行股份有限公司柳州盛丰支行,91450200715128171R,1988-08-09,N/A,罗晓晏,"N/A","许可该机构经营中国银行业监督管理委员会依照有关法律、行政法规和其他规定批准的业务，经营范围以批准文件所列的为准。",广西,柳州,"柳州市晨华路12号盛丰国际2栋1层1号、2号"
广西壮族自治区平南县食品公司环城分公司,914508212004912117,1988-08-13,N/A,林裕勇,"5.6900(万)","猪、牛、禽、蛋、羊及其肉制品购销、屠宰、批发零售。",广西,贵港,"平南县平南镇河面街"
北海市教育后勤服务中心,91450500739950485N,1988-08-16,集体所有制,李世活,"100万人民币","教学器材、服装、学生用品、五金交电、百货、日杂、建材的销售；自有房屋租赁；会议服务；礼仪庆典策划。",广西,北海,"北海市广场东里６号一楼"
防城港市木材公司,914506021993601920,1988-08-17,N/A,陈寒春,"50(万元人民币)","主营：铁、锰、钛、铅锌、木材、木制品、家具、木材半成品、胶合板、橡胶及制品、林化产品。兼营：钢材、建筑材料、化工原料",广西,防城港,"港口区站前小区西面520号"
中国银行股份有限公司北海市四川路支行,91450500765804641J,1988-08-17,N/A,胡松,"N/A","按《金融许可证》核定范围经营。",广西,北海,"北海市四川路48号"
中国建设银行股份有限公司北海解放路支行,914505005859715309,1988-08-20,N/A,郭健文,"N/A","按《金融机构营业许可证》核定范围经营。",广西,北海,"市解放路2号"
中国工商银行股份有限公司柳州市柳石路第二支行,9145020070875158XW,1988-08-22,N/A,熊威,"N/A","许可该机构经营中国银行业监督管理委员会依照有关法律、行政法规和其他规定批准的业务，经营范围以批准文件所列的为准。",广西,柳州,"柳州市柳石路80号"
中国工商银行股份有限公司柳州市跃进路支行,91450200708751301J,1988-08-26,N/A,许芳,"N/A","许可该机构经营中国银行业监督管理委员会依照有关法律、行政法规和其他规定批准的业务，经营范围以批准文件所列的为准。",广西,柳州,"柳州市跃进路108号"
中国建设银行股份有限公司玉林金都支行,91450900773858201M,1988-08-27,N/A,肖文婷,"N/A","经营中国银行业监督管理委员会依照有关法律、行政法规和其它规定批准的业务",广西,玉林,"玉林市金玉路377号万昌.东方巴黎商住小区18栋-19栋07、08号商铺"
广西梧州市宝石工艺品有限公司,91450400199120121A,1988-08-27,N/A,张华庆,"800(万)","金银饰品、宝玉石、百货、服装鞋帽、文化用品、工艺美术品、摩托车、电动自行车批发零售；信息咨询服务；房地产开发经营；自营和代理各类商品和技术的进出口，但国家限定公司经营或禁止进出口的商品和技术除外。",广西,梧州,"梧州市大中路101-8号"
中国建设银行股份有限公司柳州桂中大道支行,91450200898605996Y,1988-08-29,N/A,周炜,"N/A","经营中国银行业监督管理委员会依照有关法律、行政法规和其他规定批准的业务，经营范围以批准文件所列的为准。",广西,柳州,"柳州市桂中大道南端2号阳光壹佰城市广场7栋1层1号"
广西钦州市物资总公司,91450702201131541M,1988-09-10,N/A,满雄谦,"86.9000(万)","金属材料、化工产品（除危险化学品）、燃料、机电设备、汽车、火工产品、国货贸易、易货贸易",广西,钦州,"钦州市钦州湾大道"
柳州市第二纸制品厂,91450205MA5KNEXT57,1988-09-15,股份合作制,李柳琼,"206万人民币","该执照不得用于生产经营，仅作清理债权债务用",广西,柳州,"柳州市白沙路19号"
河池市宜州区同德乡供销合作社大安生资门市部,91451281900916057F,1988-09-17,集体分支机构(非法人),韦美琼,"N/A","农药",广西,河池,"河池市宜州区同德乡大安村"
河池市宜州区同德乡供销合作社生资门市部,91451281900916348J,1988-09-17,N/A,潘明亮,"N/A","农药",广西,河池,"河池市宜州区同德乡同德街"
河池市宜州区同德乡供销合作社,9145128120091259XP,1988-09-17,集体所有制,王洪新,"17万人民币","农药（除剧毒农药和禁售农药、限分支机构经营）；中成药、化学药制剂、抗生素制剂、生化药品零售（不含冷冻冷藏药品）（限分支机构经营）；预包装食品、保健食品、Ⅰ类医疗器械、Ⅱ类医疗器械（不含体外诊断试剂）、消毒用品、计生用品零售（限分支机构经营）；蚕茧收烘销售（限分支机构经营）；化肥、农机配件、五金交电、...",广西,河池,"河池市宜州区同德乡同德街"
合浦县沙岗供销合作社服务部,91450521MA5KWFE419,1988-09-18,集体分支机构(非法人),黄怡坚,"N/A","日用百货，副食品",广西,北海,"广西北海市合浦县沙岗圩"
中国工商银行股份有限公司柳州市华展华园支行,91450200708753024B,1988-09-26,N/A,黄文蓉,"N/A","许可该机构经营中国银行业监督管理委员会依照有关法律、法规和其他规定批准的业务，经营范围以批准文件所列的为准。",广西,柳州,"柳州市静兰路9号“华展华园”38栋1-1、2、3、1-11、12、13号"
中国工商银行股份有限公司柳州市三中路支行,91450200708754473B,1988-09-28,N/A,兰一萍,"N/A","许可该机构经营中国银行业监督管理委员会依照有关法律、行政法规和其他规定批准的业务，经营范围以批准文件所列的为准",广西,柳州,"柳州市三中路66号"
广西梧州港航物资有限公司海通商场,91450403899126516M,1988-10-08,N/A,彭榕华,"N/A","船用物资、金属材料（锑、锡、钨除外）、易燃液体（油漆）（此项目凭《危险化学品经营许可证》经营，经营期限至2017年4月22日）的批发",广西,梧州,"梧州市西江二路4号"
贵港市市政建筑工程有限公司,91450800779126415N,1988-10-10,N/A,陈勇旺,"5,000(万)","建筑工程施工总承包壹级、市政公用工程施工总承包贰级、防水防腐保温工程专业承包贰级、建筑装修装饰工程专业承包贰级；地基基础工程专业承包叁级；房地产开发经营；城市园林绿化；矿产品销售；花卉种植销售；建筑材料批发零售。",广西,贵港,"贵港市港北区石羊塘开发区222号"
中国农业银行股份有限公司临桂人民支行,9145032289909557XT,1988-10-15,N/A,蒋艳琼,"N/A","金融业务。",广西,桂林,"临桂区临桂镇人民路西侧108号"
中国农业银行股份有限公司临桂六塘支行,914503228990955538,1988-10-15,N/A,蒙姬花,"N/A","金融业务。",广西,桂林,"临桂区六塘镇"
中国农业银行股份有限公司临桂县支行,9145032289909565XE,1988-10-15,N/A,卿志远,"N/A","金融业务存、贷款，家庭财产保险、与贷款标的物相关的财产保险、意外伤害保险、人寿保险、健康保险。",广西,桂林,"桂林市上海路26号"
中国农业银行股份有限公司临桂西城支行,914503228990956176,1988-10-15,N/A,蒋艳琼,"N/A","金融业务。",广西,桂林,"临桂区临桂镇庙岭村委岭底村村边(321国道娃哈哈食品厂路口斜对面)房屋一楼"
中国农业银行股份有限公司临桂两江支行,91450322899095510T,1988-10-15,N/A,石承驱,"N/A","金融业务。",广西,桂林,"临桂区两江镇"
中国农业银行股份有限公司临桂义宁支行,91450322899095481F,1988-10-15,N/A,李堃华,"N/A","金融业务。",广西,桂林,"临桂区五通镇"
中国农业银行股份有限公司临桂榕山支行,914503228990956251,1988-10-15,N/A,白萍,"N/A","金融业务。",广西,桂林,"临桂区临桂镇榕山路16号"
南宁市通机明秀加油站有限公司,91450100198343964R,1988-10-17,N/A,石玉秀,"15.4000(万元人民币)","对加油站的投资；零售：润滑油。",广西,南宁,"南宁市邕隆公路南面0１２５０７５地块（北湖北路东面）"
中国建设银行股份有限公司玉林铁路支行,914509007738581992,1988-10-18,N/A,李葵,"N/A","经营中国银行业监督管理委员会依照有关法律、行政法规和其它规定批准的业务",广西,玉林,"玉林市苗园路393-6号"
中国农业银行股份有限公司柳州龙潭分理处,914502009731757398,1988-10-21,N/A,杨遇春,"N/A","许可该机构经营中国银行业监督管理委员会依照有关法律、行政法规和其他规定批准的业务，经营范围以批准文件所列的为准。",广西,柳州,"柳州市柳石路35号1-1-9、1-1-10号"
中国农业银行股份有限公司扶绥新宁分理处,91451421899652268M,1988-10-24,N/A,玉海新,"N/A","吸收公众存款；发放短期、中期和长期贷款；办理国内外结算；办理票据承兑与贴现；发放金融债券；从事同业拆借；买卖、代理买卖外汇；从事银行卡业务；提供信用证服务及担保；代理收付款项及代理保险业务；代理基金销售业务；提供保险箱服务；经营结汇、售汇业务以及经中国银行业监督管理委员会、中国人民银行及其他有权部门批准或有权上级行授权开办的其他业务。",广西,崇左,"扶绥县新宁镇松江街３号"
广西壮族自治区烟草公司防城港市公司,9145060019936031XR,1988-10-26,N/A,何奇枢,"579.3000(万)","卷烟、雪茄烟全国购进本地（市）批发（有效期至2019年3月7日）；罚没卷烟购进本地（市）批发；进口卷烟、雪茄烟本省（自治区、直辖市）购进本地（市）批发",广西,防城港,"港口区渔峰路４号"
广西华侨企业联合进出口公司,9145000019822384X8,1988-10-27,N/A,肖欢德,"528.9000(万元人民币)","（本执照仅供清理债权债务使用）",广西,南宁,"南宁市青秀区桃源路4号"
柳州市第二饮食公司,914502001985875636,1988-10-31,N/A,张忠远,"434.6000(万)","为下属企业产、供、销服务，饮食、住宿服务",广西,柳州,"柳州市罗池路30号"
中国农业银行股份有限公司南宁国贸支行,914500008982223975,1988-11-09,N/A,黄敢,"N/A","吸收公众存款；发放短期、中期和长期贷款；办理国内外结算；办理票据承兑与贴现；发行金融债券；代理发行、代理兑付、承销政府债券；买卖政府债券、金融债券；从事同业拆借；买卖、代理买卖外汇；结汇、售汇；从事银行卡及电子银行业务；提供信用证服务及担保；提供保管箱服务；代理收付款项；代理资金清算；代理黄金买卖；代理开放式基金业务；代理政策性银行、外国政府和国际金融机构贷款业务；贷款承诺；组织或参加银团贷款；外汇存款；外汇贷款；外汇汇款；外汇借款；发行、代理发行、买卖或代理买卖股票以外的外币有价证券；外汇票据承兑和贴现；自营、代客外汇买卖；外币兑换；外汇担保；各类汇兑业务；财务顾问服务；资信调查、咨询、见证业务；保险兼业代理业务；证券公司客户交易结算资金存管业务；证券投资基金托管业务；企业年金托管业务；产业投资基金托管业务；合格境外机构投资者境内证券投资托管业务；金融衍生产品交易业务；经中国银行业监督管理委员会、中国人民银行及其他有权部门批准或上级行授权开办的其他业务。",广西,南宁,"南宁市青秀区教育路4-2号"
荔浦县电影发行放映公司,91450331200189928M,1988-11-09,N/A,黎东明,"54(万元人民币)","电影发行、放映。",广西,桂林,"荔浦县中园路41号"
富川瑶族自治县五金公司,914511232003805624,1988-11-17,N/A,邓馥林,"109(万)","五金、交电、百货、纺织品、服装、鞋帽批发及零售。",广西,贺州,"富川富阳镇新建路30号"
湖南橡塑密封件厂有限公司柳州销售处,9145020089858737XU,1988-11-18,N/A,罗作辉,"N/A","本厂橡胶产品.",广西,柳州,"柳州市文笔路８５号１、２门面"
广西马山县片联供销合作社,91450124MA5KKHW62D,1988-11-19,集体所有制,钟桂生,"103万人民币","日用百货、五金交电零售。",广西,南宁,"马山县林圩镇片联街"
柳州市双马电器集团公司,914502001986072373,1988-12-05,N/A,冯柳林,"3,329(万)","家用电风扇，洗衣机，电熨斗，汽车配件，其他家用厨房器具，照明电器，健身器材，娱乐器材，空气净化器，抽油烟机，微型电动机，塑料制品（一次性塑料餐具除外），电动自行车生产销售",广西,柳州,"柳州市鸡喇路4号"
广西柳州百草堂药业有限公司中药饮片厂,91450200198596582M,1988-12-06,N/A,李云乾,"N/A","中药材饮片加工。",广西,柳州,"柳州市长风路6号"
广西桂林兴安火电厂有限公司,91450325619633012B,1988-12-08,N/A,黄克乐,"2,005.2000(万)","发电。",广西,桂林,"广西桂林兴安县兴安镇狮子岭"
中国建设银行股份有限公司北海湖南路支行,91450500585971522E,1988-12-08,N/A,柳霞,"N/A","按《金融机构营业许可证》核定范围经营。",广西,北海,"北海市北海大道“东旭华庭”7号、8号、9号商铺"
广西柳州绿达实业有限责任公司砖厂,91450200898589885D,1988-12-15,N/A,柴致敬,"N/A","红砖生产。",广西,柳州,"柳州市柳北区石埤坪镇"
北海兴隆苑房地产开发有限公司,91450500199308730Y,1988-12-16,N/A,林雄,"500(万元人民币)","房地产开发与经营",广西,北海,"广西北海市北部湾西路31号"
防城港市港口区水产物资公司,914506021993707966,1988-12-16,N/A,吴前呈,"62.6700(万)","钢材、建筑材料、橡胶及制品、机电产品",广西,防城港,"港口区企沙白牛"
柳城县太平茂源木材加工厂,91450222MA5KNGU71X,1988-12-19,个人独资企业,吴志云,"N/A","木制品",广西,柳州,"柳城县太平镇太平街"
广西壮族自治区旅游服务公司,91450000198223524P,1988-12-21,N/A,许一准,"612(万)","旅游宾馆饭店设备、五金、家用电器、摩托车、工艺美术品、日用百货、针纺织品、鞋帽、服装、中西乐器、文娱用品、建筑材料、钢材、环保设备、汽车配件、家具配件、办公用品、体育用品、电子产品、数码产品、计算机软硬件及耗材、机电产品、化工产品、仪器仪表、通讯设备、工程机械、装饰装修材料、钟表眼镜、珠宝首饰、礼品、皮具、农副土特产品；旅游信息咨询服务；翻译服务；商品信息咨询服务；会议会展服务；商务服务；对酒店、旅游项目开发、旅游地产的投资。",广西,南宁,"南宁市兴宁区新民路40号"
荔浦县杜莫供销合作社,914503312001928878,1988-12-23,集体所有制,李本智,"42万人民币","农产品土特产、化肥、农药",广西,桂林,"荔浦县杜莫镇杜莫街"
南宁皮革塑料实验厂,91450102MA5KJXLJ7Y,1988-12-24,集体所有制,黄东明,"132.6万人民币","塑料薄膜.",广西,南宁,"长岗岭"
广西壮族自治区农业生产资料总公司复合肥料厂,914501001984302836,1988-12-29,N/A,白志舟,"500(万)","销售：化肥；复合肥料、复混肥料、有机肥料、有机-无机复混肥料I、II型生产及销售；仓库出租，铁路专线服务，装卸服务。",广西,南宁,"南宁市五一西路58号"
