中国农业银行股份有限公司合肥金穗支行,913401008491506734,1994-05-26,N/A,周伟忠,"N/A","办理人民币存款、贷款、结算业务；办理票据贴现；代理发行金融债券；代理兑付、销售政府债券；经中国银行业监督管理委员会依照有关法律、行政法规和其他规定批准的业务。代理收付款项；",安徽,合肥,"安徽省合肥市宁国路179号"
合肥市建苑工程建设监理公司,91340100MA2MXWJ25M,1994-05-26,N/A,马玉桢,"100(万元)","工程建设监理，技术开发、技术服务。",安徽,合肥,"安徽省合肥市阜阳路89号4楼"
安徽中联兴宇信息科技有限公司,9134010014895875X1,1994-05-26,N/A,汪才兴,"300(万元)","计算机软件、硬件开发、销售、维修与维护；工业自动化控制；计算机系统集成；计算机网络工程施工；高新技术应用；医疗器械销售（不含二、三类）；通讯设备研制与销售；机电产品销售、安装、维护；计算机信息技术咨询与服务；自营和代理各类商品的进出口业务",安徽,合肥,"安徽省合肥市蜀山区金寨路71号美地阳光大厦十楼"
颍上县焦岗湖实业开发总公司,91341226777394889R,1994-05-26,N/A,李学宽,"600(万元)","淡水养殖、水生植物开发。",安徽,阜阳,"安徽省阜阳市颍上县鲁口乡鲁口村"
安徽晋煤金龙源化工有限公司肥西柿树乡街道第五化肥经销部,91340123MA2N1GML2D,1994-05-27,N/A,翟荣春,"N/A","县产化肥、磷肥零售。",安徽,合肥,"安徽省合肥市肥西县柿树街道"
安徽省辉达装饰有限责任公司,91340100610307907N,1994-05-27,N/A,王进国,"610(万)","室内外装饰及设计。",安徽,合肥,"合肥市庐阳区长丰路水岸云锦公寓1004室"
安徽晋煤金龙源化工有限公司肥西山南镇周大集化肥经销部,91340123MA2N1GMM08,1994-05-27,N/A,傅守华,"N/A","“万龙”牌碳酸氢铵、尿素、复合肥、磷肥等系列产品销售。",安徽,合肥,"安徽省合肥市肥西县山南镇洪桥路口"
安徽晋煤金龙源化工有限公司肥西高刘镇南街化肥经销部,91340111MA2N1GMD79,1994-05-27,N/A,陈文斌,"N/A","本厂化肥产品、磷肥零售。",安徽,合肥,"安徽省合肥市肥西县高刘镇南街"
安徽舒城农村商业银行股份有限公司城南支行,913415000584585758,1994-05-27,N/A,董文清,"N/A","许可该机构经营中国银行业监督管理委员会依照有关法律、行政法规和其他规定批准的业务。",安徽,六安,"安徽省六安市舒城县城关镇东门街13号"
安徽晋煤金龙源化工有限公司肥西花岗镇花新路化肥经销部,91340123MA2N1GMC9T,1994-05-27,N/A,解正满,"N/A","本县化肥厂产品、磷肥零售。",安徽,合肥,"安徽省合肥市肥西县花岗镇化新路"
安徽晋煤金龙源化工有限公司肥西刘河街道第一化肥经销部,91340123MA2N1GMF3B,1994-05-27,N/A,黄定兰,"N/A","本县化肥厂产品、磷肥零售。",安徽,合肥,"安徽省合肥市肥西县刘河乡街道"
安徽晋煤金龙源化工有限公司肥西柿树乡防虎第二化肥经销部,91340123MA2N1GMHXX,1994-05-27,N/A,孟珍,"N/A","本厂化肥产品、磷肥零售。",安徽,合肥,"安徽省合肥市肥西县柿树乡防虎街道"
安徽晋煤金龙源化工有限公司肥西高刘镇老坟头化肥经销部,91340100MA2N1A0042,1994-05-27,N/A,徐世琢,"N/A","本厂化肥产品、磷肥零售。",安徽,合肥,"安徽省合肥市经济技术开发区高刘镇高洪路与高广路交叉口"
安徽开顺广告装饰有限公司,91340400769007551P,1994-05-27,N/A,沈玉楼,"150(万元)","国内外各类广告的策划、设计、制作、发布、代理，会展及商贸文化庆典活动的策划、承办，企业CIS整合传播、营销策划及新品上市代理，装饰装潢工程设计、施工，民用新科技、新产品的开发、推广、销售及专业技能培训，办公自动化设备的销售及技术培训，工艺礼品的制售，家电、文化办公用品、日用百货的销售。",安徽,淮南,"安徽省淮南市陈洞南路6号"
安徽晋煤金龙源化工有限公司肥西刘河乡街道第三化肥经销部,91340123MA2N1GMG16,1994-05-27,N/A,黄定德,"N/A","本县化肥厂产品、磷肥零售。",安徽,合肥,"安徽省合肥市肥西县刘河乡街道"
安徽晋煤金龙源化工有限公司肥西山南镇沈店街道第一化肥经销部,91340123MA2N1GMJ6P,1994-05-27,N/A,周先桂,"N/A","本县化肥厂产品、磷肥零售。",安徽,合肥,"安徽省合肥市肥西县山南沈店"
安徽晋煤金龙源化工有限公司肥西山南镇沈店街道第二化肥经销部,91340123MA2N1GMK4J,1994-05-27,N/A,张凤传,"N/A","本县化肥厂产品、磷肥零售。",安徽,合肥,"安徽省合肥市肥西县山南沈店"
阜阳市阜水建筑工程有限责任公司,913412007448669317,1994-05-29,N/A,严川林,"620.5500(万元)","房屋建筑工程施工总承包（暂定）叁级",安徽,阜阳,"阜阳市颍州区阜王路安居工程1#综合楼703室"
安徽晋煤金龙源化工有限公司肥西孙集乡街道第五化肥经销部,91340123MA2N1GMN95,1994-05-30,N/A,张寿友,"N/A","本厂化肥产品、磷肥零售。",安徽,合肥,"安徽省合肥市孙集乡街道"
霍邱县姜家湖供销合作社,913415227050029979,1994-05-30,集体所有制,张正瑜,"10万人民币","化肥、农药、红麻、棉花。",安徽,六安,"安徽省六安市霍邱县临淮岗"
安徽晋煤金龙源化工有限公司肥西孙集乡吴山口第一化肥经销部,91340123MA2N1GMP5R,1994-05-30,N/A,李治春,"N/A","本厂化肥产品、磷肥零售。",安徽,合肥,"安徽省合肥市肥西县孙集乡吴山口"
安徽晋煤金龙源化工有限公司肥西严店乡苏小街道化肥经销部,91340123MA2N1GMQ3L,1994-05-30,N/A,李友保,"N/A","本县化肥厂产品、磷肥零售。",安徽,合肥,"安徽省合肥市肥西县严店乡苏小街道"
安徽晋煤金龙源化工有限公司肥西严店乡街道第二化肥经销部,91340123MA2N1GMR1F,1994-05-30,N/A,贺冬梅,"N/A","本县化肥厂产品、磷肥零售。",安徽,合肥,"安徽省合肥市肥西县严店街道"
砀山县城关供销社第四生资门市部,91341321MA2N7H2P37,1994-05-30,集体经营单位(非法人),周存玲,"N/A","农药（化学危险品除外）、化肥、农膜、药械的零售",安徽,宿州,"安徽省宿州市砀山县曹庄镇洪河村蒋王庄自然村"
定远县城关供销社中兴商场综合柜,91341125MA2N6Q9J8K,1994-05-30,集体经营单位(非法人),程正森,"N/A","日用杂品（不含烟花爆竹）、鞋类、眼镜、服装、百货、办公用品、床上用品、五金电器、家具销售（依法须批准的项目，经相关部门批准后方可开展经营活动）*",安徽,滁州,"安徽省滁州市定城曲阳路（定110）"
马鞍山市新建劳动服务公司,913405007050602650,1994-05-30,N/A,王立军,"70(万元)","承包土方工程，劳动服务。",安徽,马鞍山,"马鞍山市雨山乡安民村"
宿州市汽车工业销售公司,91341302152389246U,1994-05-31,N/A,陈杰,"80(万元)","汽车、摩托车、建筑材料、农机具及配件、日用百货、茶叶购销",安徽,宿州,"安徽省宿州市工人路62号"
合肥新都实业公司,913401001492343581,1994-06-01,N/A,邵世刚,"520(万元)","集体资产经营管理及租赁。",安徽,合肥,"安徽省合肥市阜阳北路"
中国农业银行股份有限公司合肥井岗支行,913401006941447291,1994-06-01,N/A,谷梅,"N/A","农业企业信贷、结算和个人储蓄业务，经中国银行业监督管理委员会依照有关法律、行政法规和其他规定批准的业务。",安徽,合肥,"安徽省合肥市长江西路1004号"
宣城市桑尼电光源有限责任公司,91341800153325172L,1994-06-01,N/A,左从永,"100(万元)","制造照明电器；经营本企业自产产品的出口业务和本企业所需的机械设备、零配件、原辅材料的进口业务，但国家限定公司经营或禁止进出口的商品及技术除外。",安徽,宣城,"安徽省宣城市宣州区夏渡乡宣港路3公里"
合肥市拓展实业公司,913401001490213441,1994-06-02,N/A,李纲,"300(万元)","汽配加工、汽车修理、建筑材料、水电安装、装饰材料、涂料、五金交电，烟酒、百货、土产、劳动服务、粮油加工、蔬菜、土建工程。",安徽,合肥,"合肥市高新区蜀麓社区服务中心二楼"
太湖县花凉亭电站综合服务公司,91340825774952806U,1994-06-02,N/A,孙同安,"10(万元)","日杂百货、针纺织品、五金交电、预包装食品兼散装食品；乳制品（含婴幼儿配方乳粉）零售（仅限下属营业单位）；卷烟（雪茄烟）零售（仅限花凉亭水电站商业经营部四部和花凉亭水电站商业经营部）；劳务服务",安徽,安庆,"安徽省安庆市太湖县花凉亭电站"
安徽新集煤电(集团)有限公司,91340400150460088C,1994-06-02,N/A,彭卫东,"48,433(万元)","煤炭、火力发电、洗选煤、国内商业及物资供销业",安徽,淮南,"安徽省淮南市龙湖南路鑫舜大厦"
巢湖和州机电泵业公司,91340523766865753T,1994-06-02,N/A,黄贤初,"30(万元)","离心泵、交流电动机制造销售。",安徽,马鞍山,"安徽省马鞍山市历阳镇环城北路65号"
马鞍山市城市设计研究院有限责任公司,913405001505237556,1994-06-02,N/A,娄一兵,"200(万元)","建筑工程及相应的工程咨询和装饰设计(乙级)；市政公用行业",安徽,马鞍山,"马鞍山市花山区湖东中路1155号"
合肥三维实业公司,913401001491502855,1994-06-02,N/A,盛大贵,"100(万元)","建筑材料、钢材、五金交电、百货销售。",安徽,合肥,"安徽省合肥市濉溪路34号"
合肥新大陆广告装饰工程公司,91340100149030216Y,1994-06-03,N/A,罗世荣,"50(万元)","设计、制作、发布国内路牌、灯箱广告业务，信息、策划、咨询、中介服务、代理国内电视、电台、报纸广告业务。",安徽,合肥,"安徽省合肥市金寨路476号"
中国银行股份有限公司芜湖弋江支行,91340200781087304N,1994-06-03,N/A,翟牛,"N/A","许可该机构经营中国银行业监督管理委员会依照有关法律、行政法规和其他规定批准的业务，经营范围以批准文件所列为准。",安徽,芜湖,"安徽省芜湖市泰鑫商务中心一楼"
中国银行股份有限公司芜湖龙山支行,91340200781087259M,1994-06-03,N/A,杨蓓,"N/A","许可该机构经营中国银行业监督管理委员会依照有关法律、行政法规和其他规定批准的业务，经营范围以批准文件所列为准。",安徽,芜湖,"安徽省芜湖市经济技术开发区向东路大桥新城10号楼"
黄山市黟县长途汽车运输公司,91341023704959025P,1994-06-03,N/A,璩宝林,"104.9000(万元)","企业留守",安徽,黄山,"安徽省黄山市黟县城中沿河西路72号"
安徽省合肥汽车客运有限公司西门换乘中心,91340100723307751X,1994-06-04,N/A,李政,"N/A","长途客运服务、停车场服务。",安徽,合肥,"安徽省合肥市长江西路449号"
怀宁县雷埠乡农业服务公司雷埠服务部,91340822MA2N6D3L0P,1994-06-04,N/A,郑中胜,"N/A","有毒品：二级有机磷固态农药、二级有机磷液态农药、二级有机硫固态农药、二级有机硫液态农药、二级有机氯液态农药零售",安徽,安庆,"安徽省安庆市雷埠乡雷埠村"
潜山县龙关塑料三厂,91340824153984741K,1994-06-06,集体所有制,余双节,"80万人民币","塑料编制袋 兼营：高低压塑料内袋",安徽,安庆,"安徽省安庆市龙关乡木岗村"
萧县供销合作社化肥经销公司,91341322152461148L,1994-06-06,集体所有制,何勇,"226万人民币","一般经营项目：化肥、杀虫剂（不含剧毒物品）、杀菌剂、除草剂、激素、农膜、农药械、中小农具、农副产品（国家政策允许的）、常规农作物种子*销售*",安徽,宿州,"萧县龙城镇交通路西段319-6号"
安徽省房地产综合开发集团公司濉溪县公司,91340621704931380U,1994-06-07,N/A,夏民,"800(万元)","城房、民房建筑、出售商品房",安徽,淮北,"安徽省淮北市濉溪县岱河路57号"
安徽省和县第二建筑安装劳务公司,91340523737313378K,1994-06-08,N/A,吴先水,"338(万元)","木工作业分包一级，砌筑作业分包一级，抹灰作业分包不分级，油漆作业分包不分级，钢筋作业分包一级，混凝土作业分包不分级，脚手架搭设作业分包一级，模板作业分包一级，焊接作业分包一级，水暖电安装作业分包不分级。",安徽,马鞍山,"安徽省马鞍山市和县历阳镇共义小康村共义路50号"
中国石化销售有限公司安徽马鞍山当涂黄山加油站,91340521769044563T,1994-06-08,N/A,王立康,"N/A","零售乙醇汽油、柴油、煤油、石油制品（不含成品油）、化工产品",安徽,马鞍山,"安徽省马鞍山市当涂县姑孰镇黄山村"
阜阳市安驰小汽车出租有限公司,91341200719936352E,1994-06-09,N/A,徐卫东,"1,000(万元)","出租客运、汽车租赁、网约车咨询服务、保险兼业代理服务。",安徽,阜阳,"安徽省阜阳市颍州区阜王北路银海花园2号楼"
安徽省怀远县再生资源有限公司,91340321150105385A,1994-06-10,N/A,韩波,"230.3000(万元)","报废汽车收购；煤炭销售；农药销售（限分支机构经营）；废旧物资收购；化学肥料零售；钢材销售；粮食、油料购销；洗浴服务",安徽,蚌埠,"怀远县古城乡政府一楼"
安徽安华建筑工程有限公司,91340100711034952P,1994-06-10,N/A,宣宜军,"2,000(万元)","建筑工程施工；市政公用工程施工；建筑装修装饰工程施工；钢结构工程施工；地基基础工程施工；模板脚手架工程施工；建筑机电安装工程施工；建筑幕墙工程施工；建筑劳务工程施工；膜结构技术开发、设计、安装；膜材料、遮阳产品销售。",安徽,合肥,"安徽省合肥市蜀山区长江西路304号鑫鹏大厦30层3008室、3005室、3010室"
宿州市墉桥区物资集团实业发展公司,91341300779090846K,1994-06-13,N/A,李亚,"88万人民币元","汽车(不含小轿车)、摩托车、金属材料(不含贵金属)、机电产品、五金交电、农副产品(国家政策许可的)、木材销售∮",安徽,宿州,"安徽省宿州市汴河路335号"
中国邮政集团公司安徽省寿县十字街支局,91341521MA2MR2MU9G,1994-06-14,N/A,杨云,"N/A","邮政基础业务，邮政增值、邮政附属业务，邮政储蓄业务，代理保险业务、代销基金业务、小额质押贷款业务；国家邮政局批准开办的其他业务，代办电信各项业务，开办放开经营的电信、信息业务和国家允许开办的其他服务项目；办公用品的零售业务；从事种子(不再分装的包装种子)、肥料、农药(非危险化学品类)、饲料和饲料添加剂的经营；国内书报刊的批发、零售。",安徽,淮南,"安徽省淮南市寿县寿春镇十字街"
中国邮政集团公司安徽省寿县正阳支局,91341521MA2MQHH07C,1994-06-14,N/A,马崇玉,"N/A","邮政基础业务，邮政增值、邮政附属业务，国家邮政局批准开办的其他业务，代办电信各项业务，开办放开经营的电信、信息业务和国家允许开办的其他服务项目，办公用品的零售业务，从事不再分装的包装种子、肥料、非危险化学品类农药、饲料和饲料添加剂的经营，国内书刊批发、零售，二类航空运输销售代理，汽车、火车票、彩票、文艺、体育票券代理销售。",安徽,淮南,"安徽省淮南市寿县正阳关镇正新路镇政府对面"
中国邮政集团公司安徽省寿县双桥支局,91340422MA2MT8XY91,1994-06-14,N/A,夏多多,"N/A","邮政基础业务，邮政增值、邮政附属业务，国家邮政局批准开办的其他业务，代办电信各项业务，开办放开经营的电信、信息业务和国家允许开办的其他服务项目，办公用品的零售业务，从事不再分装的包装种子、肥料、非危险化学品类农药、饲料和饲料添加剂的经营，国内书刊批发、零售，二类航空运输销售代理，汽车、火车票、彩票、文艺、体育票券代理销售。",安徽,淮南,"安徽省淮南市寿县双桥镇街道"
中国邮政集团公司安徽省寿县北街邮政所,91340422MA2MT8YU2X,1994-06-14,N/A,杨婷婷,"N/A","邮政基础业务，邮政增值、邮政附属业务，国家邮政局批准开办的其他业务，代办电信各项业务，开办放开经营的电信、信息业务和国家允许开办的其他服务项目，办公用品的零售业务，从事不再分装的包装种子、肥料、非危险化学品类农药、饲料和饲料添加剂的经营，国内书刊批发、零售，二类航空运输销售代理，汽车、火车票、彩票、文艺、体育票券代理销售。",安徽,淮南,"安徽省淮南市寿县寿春镇北街城中小学南侧"
中国邮政集团公司安徽省寿县小甸支局,91341521MA2MR2LK0N,1994-06-14,N/A,秦宜森,"N/A","邮政基础业务，邮政增值、邮政附属业务，国家邮政局批准开办的其他业务，代办电信各项业务，开办放开经营的电信、信息业务和国家允许开办的其他服务项目，办公用品的零售业务，从事不再分装的包装种子、肥料、非危险化学品类农药、饲料和饲料添加剂的经营，国内书刊批发、零售，二类航空运输销售代理，汽车、火车票、彩票、文艺、体育票券代理销售。",安徽,淮南,"安徽省淮南市寿县小甸镇小甸街道"
中国邮政集团公司安徽省寿县保义支局,91341521MA2MQHH232,1994-06-14,N/A,王金业,"N/A","邮政基础业务，邮政增值、邮政附属业务，国家邮政局批准开办的其他业务，代办电信各项业务，开办放开经营的电信、信息业务和国家允许开办的其他服务项目，办公用品的零售业务，从事不再分装的包装种子、肥料、非危险化学品类农药、饲料和饲料添加剂的经营，国内书刊批发、零售，二类航空运输销售代理，汽车、火车票、彩票、文艺、体育票券代理销售。",安徽,淮南,"安徽省淮南市寿县保义镇保义街道路沿区196号"
中国邮政集团公司安徽省寿县戈店邮政所,91341521MA2MR4C80C,1994-06-14,N/A,时娜,"N/A","邮政基础业务，邮政增值、邮政附属业务，国家邮政局批准开办的其他业务，代办电信各项业务，开办放开经营的电信、信息业务和国家允许开办的其他服务项目，办公用品的零售业务，从事不再分装的包装种子、肥料、非危险化学品类农药、饲料和饲料添加剂的经营，国内书刊批发、零售，二类航空运输销售代理，汽车、火车票、彩票、文艺、体育票券代理销售。",安徽,淮南,"安徽省淮南市寿县安丰塘乡戈店街道"
中国邮政集团公司安徽省寿县迎河支局,91341521MA2MR47J96,1994-06-14,N/A,马崇玉,"N/A","邮政基础业务，邮政增值、邮政附属业务，国家邮政局批准开办的其他业务，代办电信各项业务，开办放开经营的电信、信息业务和国家允许开办的其他服务项目，办公用品的零售业务，从事不再分装的包装种子、肥料、非危险化学品类农药、饲料和饲料添加剂的经营，国内书刊批发、零售，二类航空运输销售代理，汽车、火车票、彩票、文艺、体育票券代理销售。",安徽,淮南,"安徽省淮南市寿县迎河镇商贸城街与立新街交口向南20米东侧"
中国邮政集团公司安徽省寿县堰口支局,91341521MA2MR48Y85,1994-06-14,N/A,邓雷,"N/A","邮政基础业务，邮政增值、邮政附属业务，国家邮政局批准开办的其他业务，代办电信各项业务，开办放开经营的电信、信息业务和国家允许开办的其他服务项目，办公用品的零售业务，从事不再分装的包装种子、肥料、非危险化学品类农药、饲料和饲料添加剂的经营，国内书刊批发、零售，二类航空运输销售代理，汽车、火车票、彩票、文艺、体育票券代理销售。",安徽,淮南,"安徽省淮南市寿县堰口镇寿六路与东街交口向西100米北侧"
中国邮政集团公司安徽省寿县枸杞邮政所,91341521MA2MR4C56U,1994-06-14,N/A,马崇玉,"N/A","邮政基础业务，邮政增值、邮政附属业务，国家邮政局批准开办的其他业务，代办电信各项业务，开办放开经营的电信、信息业务和国家允许开办的其他服务项目，办公用品的零售业务，从事不再分装的包装种子、肥料、非危险化学品类农药、饲料和饲料添加剂的经营，国内书刊批发、零售，二类航空运输销售代理，汽车、火车票、彩票、文艺、体育票券代理销售。",安徽,淮南,"安徽省淮南市寿县正阳关镇枸杞街道"
中国邮政集团公司安徽省寿县瓦埠支局,91341521MA2MR4842P,1994-06-14,N/A,姚宇,"N/A","邮政基础业务，邮政增值、邮政附属业务，国家邮政局批准开办的其他业务，代办电信各项业务，开办放开经营的电信、信息业务和国家允许开办的其他服务项目，办公用品的零售业务，从事不再分装的包装种子、肥料、非危险化学品类农药、饲料和饲料添加剂的经营，国内书刊批发、零售，二类航空运输销售代理，汽车、火车票、彩票、文艺、体育票券代理销售。",安徽,淮南,"安徽省淮南市寿县瓦埠镇二里半向北200米西侧"
中国邮政集团公司安徽省寿县南关邮政所,91341521MA2MR4746E,1994-06-14,N/A,郑兆悦,"N/A","邮政基础业务，邮政增值、邮政附属业务，国家邮政局批准开办的其他业务，代办电信各项业务，开办放开经营的电信、信息业务和国家允许开办的其他服务项目，办公用品的零售业务，从事不再分装的包装种子、肥料、非危险化学品类农药、饲料和饲料添加剂的经营，国内书刊批发、零售，二类航空运输销售代理，汽车、火车票、彩票、文艺、体育票券代理销售。",安徽,淮南,"安徽省淮南市寿县寿春镇寿春路桥向东300米北侧"
芜湖德云医用材料有限公司,91340200744873808R,1994-06-15,N/A,孙民培,"85(万美元)","生产销售脱脂纱，脱脂棉，绷带。",安徽,芜湖,"安徽省芜湖市南陵县开发区经二路旁"
安庆市第一纸箱包装有限公司,91340800151309689C,1994-06-15,N/A,邓远忠,"164.1000(万元)","包装装璜印刷品、其他印刷品印刷.（依法须经批准的项目，经相关部门批准后方可开展经营活动）",安徽,安庆,"安徽省安庆市集贤北路136号"
中国银行股份有限公司怀宁高河支行,9134082270493969XA,1994-06-16,N/A,韩文龙,"N/A","许可该机构经营中国银行业监督管理委员会依照有关法律、行政法规和其他规定批准的业务，经营范围以批准文件所列的为准。代理工程保险、意外伤害保险、人寿保险、企业财产保险、健康保险、家庭财产保险、机动车辆保险、船舶保险。",安徽,安庆,"安徽省安庆市怀宁县高河镇高河大道332号"
淮南鸿烈文化经济开发总公司,91340400150242590T,1994-06-16,N/A,余林,"800(万元)","科技、经济、文化、教育信息服务；室内装饰、舞台灯光音响工程；家电、百货、钢材、装璜材料、五金、化工产品",安徽,淮南,"安徽省淮南市龙湖南路29号"
中国邮政集团公司安徽省寿县炎刘支局,91341521MA2MR2MG4M,1994-06-16,N/A,黄涛,"N/A","邮政基础业务，邮政增值、邮政附属业务，国家邮政局批准开办的其他业务，代办电信各项业务，开办放开经营的电信、信息业务和国家允许开办的其他服务项目，办公用品的零售业务，从事不再分装的包装种子、肥料、非危险化学品类农药、饲料和饲料添加剂的经营，国内书刊批发、零售，二类航空运输销售代理，汽车、火车票、彩票、文艺、体育票券代理销售。",安徽,淮南,"安徽省淮南市寿县炎刘镇炎寿路1号"
合肥绿都物业管理公司,91340100149144344Q,1994-06-17,N/A,叶琴,"63.7100(万元)","物业管理，停车服务，场地及自有房屋租赁；水、电、暖气、通风管道、机械设备安装、维修。",安徽,合肥,"安徽省合肥市淮河路(绿都商城内)"
合肥市岗集草制品工艺总厂,9134012178858758X8,1994-06-18,N/A,汪蔚林,"N/A","草制品及其半成品、蔺草收购；棉线、铝合金门窗销售。",安徽,合肥,"安徽省合肥市长丰县岗集镇"
宿州市食品总公司,91341300713923171L,1994-06-18,N/A,李大洲,"917(万元)","屠宰及肉类加工；棕刷、骨粉、骨粒、工业油的加工；水产品、副食品、其它副食品、五金交电、百货、针纺织品、钢材、木材、塑料制品批发、零售；水暖设备安装；制箱包装；制冷及维修(依法须经批准的项目，经相关部门批准后方可开展经营活动)。",安徽,宿州,"安徽省宿州市宿固路88号"
芜湖市润翔建筑安装有限责任公司,913402007329934239,1994-06-18,N/A,俞经仓,"2,000(万元)","房屋建筑工程施工总承包贰级；建筑装修装饰工程专业承包叁级",安徽,芜湖,"芜湖市镜湖区旗杆村村民委员会(原村委会办公楼三楼)"
安徽省阜阳市饮食服务有限公司茶水分公司,91341200851860463K,1994-06-18,N/A,刘福海,"N/A","日用杂品零售。",安徽,阜阳,"安徽省阜阳市颍州区解放北路张家胡同25号"
