安徽颍上农村商业银行股份有限公司小张庄支行,91341226327956717X,1994-04-01,N/A,吴培培,"N/A","吸收公共存款；发放短期、中期和长期贷款；办理国内结算；办理票据承兑和贴现；从事银行卡业务；代理发行、代理兑付、承销政府债券；买卖政府债券、金融债券；从事同业拆借；代理收付款项及代理保险业务；提供保管箱服务；办理经中国银行业监督管理机构批准的其他业务。",安徽,阜阳,"安徽省阜阳市颍上县谢桥镇郑庄村后郑庄17-1号"
安徽交运集团滁州汽运有限公司滁州汽车中心站,913411007448811626,1994-04-01,N/A,孙忠,"N/A","公路客运、货运、零担。",安徽,滁州,"安徽省滁州市天长路186号"
马鞍山中理外轮理货有限公司,91340500150516504G,1994-04-01,N/A,邬步云,"54.8000(万元)","港口理货经营。",安徽,马鞍山,"马鞍山市金家庄区长江路47号（江边客运码头）"
合肥市运输总公司第二运输公司,913401001490492595,1994-04-03,N/A,王禄,"33.6000(万元)","货物运输、搬运装卸，汽车配件、煤炭、五金交电销售。",安徽,合肥,"安徽省合肥市蚌埠路935号"
安徽省界首市食品公司,9134128215226251X3,1994-04-03,N/A,谢景春,"45(万元)","牛、猪、羊、禽、食品冷藏销售。",安徽,阜阳,"安徽省界首市东顺河62号"
休宁县齐云供销社城西商场,91341022MA2MUU6Q7T,1994-04-04,集体经营单位(非法人),丁霞云,"N/A","烟、酒、糖果、糕点、饮料、食品罐头、干鲜果品、针纺织品、百货、文化用品、家用电器、五金、化肥、农膜、建筑材料、农具、畜产品销售，茶叶、土特产品收购、销售。",安徽,黄山,"安徽省黄山市休宁县海阳镇"
安徽省百草堂医疗器械有限公司,913412217489030821,1994-04-04,N/A,褚成立,"126(万元)","医疗器械二类：6826物理治疗及康复设备、热敷散生产、销售",安徽,阜阳,"安徽省阜阳市临泉县城关镇光明南路2号"
马鞍山市森隆物流有限责任公司,913405001505025831,1994-04-04,N/A,王胜和,"1,000(万元)","仓储（不含危险品），装卸服务，批发零售：木竹、竹制品、建筑装璜材料、陶瓷制品、金属材料、机电产品、家用电器、化工产品",安徽,马鞍山,"安徽省马鞍山市花山区大站东20号"
马鞍山市石南矿石开发公司,91340500150715546Q,1994-04-04,N/A,程昌桂,"30(万元)","销售建材、五金、百货、针纺织品、洗涤化妆品。",安徽,马鞍山,"安徽省马鞍山市卜塘镇石马村"
安徽省安庆市兴隆化工有限责任公司,91340800151339810U,1994-04-04,N/A,吴少平,"220.2000(万元)","非毒品农药（未列入危险化学品名录的）销售；甲苯、盐酸、有毒品：2-甲(苯)酚、2甲4氯、福美双、三唑磷、异稻瘟净粉剂、易燃液体；乙醇批发、零售(无仓储)",安徽,安庆,"安徽省安庆市华中东路250号"
马鞍山市五环科技服务公司,91340500150518905Q,1994-04-04,N/A,池本军,"10(万元)","科技推广服务；电脑排版、激光印字；批发零售现代办公设备、印刷器材、百货、五金建材、仪器仪表、机械配件；打字；科技信息中介服务。",安徽,马鞍山,"安徽省马鞍山市经济技术开发区太白大道588号"
淮南市八公山医用塑料制品厂,913404051502411338,1994-04-05,集体所有制,宋先勤,"10.7万人民币","纸桶及桶盖制造。",安徽,淮南,"安徽省淮南市八公山区农民工创业园1号厂房一层东户"
中铁合肥建筑市政工程设计研究院有限公司,913401001490359572,1994-04-05,N/A,李彦军,"1,000(万元)","工业与民用建筑设计；市政公用行业设计；规划设计；铁路隧道工程设计；公路行业特大隧道设计；工程监理；工程造价咨询；工程勘察；工程测量；岩石工程及地质勘测。",安徽,合肥,"安徽省合肥市新站区濉溪东路设计大厦"
安徽新贵科技发展有限公司,9134010014910844XR,1994-04-06,N/A,周景俊,"100(万元)","计算机软件及网络工程开发；新型陶瓷材料、产品生产、加工；机械设备加工、生产；日用百货、文化用品、工艺品、五金交电、针纺织品、建材、橡胶制品、家用电器、服装、电子元件、汽车配件销售；珠宝首饰销售。",安徽,合肥,"安徽省合肥市和平路125号"
全椒县兴博机械配件厂（普通合伙）,91341124152815188U,1994-04-06,普通合伙,娄辉,"N/A","柴油机配件加工,农业机械维修。",安徽,滁州,"安徽省滁州市全椒县古河镇工业集中区"
中国邮政集团公司阜阳市正午支局,91341200MA2N73550L,1994-04-07,N/A,曹东晓,"N/A","邮政基础业务、增值业务、附属业务。",安徽,阜阳,"安徽省阜阳市颍东区正午乡"
阜南县食品公司王家坝食品站,91341225152180389X,1994-04-07,N/A,王广辉,"5(万元)","食用动物，肉类，禽蛋，猪，牛，羊定点屠宰。",安徽,阜阳,"安徽省阜阳市阜南县王家坝"
中国邮政集团公司阜阳市三十铺支局,91341200590159192R,1994-04-07,N/A,曹东晓,"N/A","邮政基础业务、增值业务、附属业务，邮政储蓄业务。",安徽,阜阳,"安徽省阜阳市颍州区三十里铺乡"
休宁县鹤城林场木材加工厂,91341022085232643A,1994-04-07,集体所有制,方建海,"10万人民币","木材、竹制成品半成品加工、销售。",安徽,黄山,"安徽省黄山市休宁县鹤城乡棣甸新村"
中国工商银行股份有限公司阜阳清河支行,913412007790615434,1994-04-07,N/A,杨红侠,"N/A","办理人民币存款，贷款，结算业务；代理发行金融债券；代理收付款项及保险业务；经中国银行业监督管理委员会批准的其他业务。",安徽,阜阳,"安徽省阜阳市颍州区颍州南路501号S2#"
中国邮政集团公司阜阳市姜堂支局,913412000723597680,1994-04-07,N/A,曹东晓,"N/A","邮政基础业务、增值业务附属业务，邮政储蓄业务。",安徽,阜阳,"安徽省阜阳市颍泉区姜堂乡"
中国邮政集团公司阜阳市乌江支局,913412005901592215,1994-04-07,N/A,曹东晓,"N/A","邮政基础业务、增值业务、附属业务，邮政储蓄业务。",安徽,阜阳,"安徽省阜阳市颍东区乌江乡"
中国邮政集团公司阜阳市宁老庄支局,91341200072359848K,1994-04-07,N/A,曹东晓,"N/A","邮政基础业务、增值业务、附属业务，邮政储蓄业务。",安徽,阜阳,"安徽省阜阳市颍泉区宁老庄镇"
安徽龙盘(集团)公司,91341322MA2N7ENY2M,1994-04-07,N/A,陈琦,"6,000(万元)","煤（本矿自产煤经销）及煤制品销售，矿山机械、五金交电、建筑材料、装潢材料、日用杂品、汽车配件及维修、浴池、农副产品（国家政策许可的）、纺织品、苗木购销∮",安徽,宿州,"肖县龙城镇交通路东段"
黄山市三江实业有限公司家用电器分公司,91341000MA2N6KM5XT,1994-04-07,N/A,程红霞,"N/A","厨房设备、家用电器、五金、建材、文化用品销售。",安徽,黄山,"安徽省黄山市屯溪新安北路68号"
中国邮政集团公司阜阳市闻集支局,913412005901591171,1994-04-07,N/A,曹东晓,"N/A","邮政基础业务、增值业务、附属业务，邮政储蓄业务。",安徽,阜阳,"安徽省阜阳市颍泉区闻集镇"
中国邮政集团公司阜阳市马寨支局,91341200590159125U,1994-04-07,N/A,胡宝书,"N/A","邮政基础业务、增值业务、附属业务，邮政储蓄业务。",安徽,阜阳,"安徽省阜阳市颍州区马寨乡"
中国邮政集团公司阜阳市老庙支局,91341200MA2N73534Y,1994-04-07,N/A,曹东晓,"N/A","邮政基础业务、增值业务、附属业务.",安徽,阜阳,"安徽省阜阳市颍东区老庙镇"
中国邮政集团公司阜阳市苏集支局,91341200590157963Q,1994-04-07,N/A,曹东晓,"N/A","邮政基础业务、增值业务、附属业务，邮政储蓄业务。",安徽,阜阳,"安徽省阜阳市颍泉区苏集乡"
中国邮政集团公司阜阳市九龙支局,91341200MA2N735189,1994-04-07,N/A,曹东晓,"N/A","邮政基础业务、增值业务、附属业务。",安徽,阜阳,"安徽省阜阳市颍州区九龙镇"
休宁县市政工程公司,9134102215170681X2,1994-04-07,N/A,吴松南,"50(万元)","市政工程，混泥土构件预制。",安徽,黄山,"安徽省黄山市休宁县海阳镇玉宁街56号"
中国建设银行股份有限公司砀山老城支行,9134132105019726X2,1994-04-08,N/A,陈云侠,"N/A","吸收公众存款；发放短期、中期和长期贷款；办理国内结算；办理票据贴现；发行金融债券；代理发行、代理兑付、承销政府债券；买卖政府债券；从事同业拆借；买卖、代理买卖外汇；提供信用证服务及担保；代理收付款项及代理保险业务；提供保险箱业务；经中国银行业监督管理委员会批准委托代理业务及其他业务。",安徽,宿州,"砀山县砀城镇人民西路时代广场一楼"
蚌埠宁电铁路电务工程公司绝缘器材分厂,913403008498697175,1994-04-08,集体经营单位(非法人),赵伟,"N/A","轨道连接线、变压器箱线、轨道绝缘垫片；电线",安徽,蚌埠,"安徽省蚌埠市火车站东站"
马鞍山市长江实业有限公司,91340500150514939B,1994-04-09,N/A,高家发,"810(万元)","销售矿石、劳动服务。五金、交电、化工",安徽,马鞍山,"安徽省马鞍山市雨山山南38栋10号"
萧县国世通用零部件厂,91341322152469027K,1994-04-09,集体所有制,孙玮,"13万人民币","一般经营项目：通用零部件加工、销售*",安徽,宿州,"萧县龙城镇交通路西段"
利辛县阚町供销合作社服装门市部,91341623MA2N8HG54B,1994-04-09,集体经营单位(非法人),潘峰,"N/A","百货（不含食品）、针纺织品零售＊",安徽,亳州,"安徽省亳州市利辛县阚町镇"
亳州市汽车客运集团蒙城神州客运有限公司,913416227049805965,1994-04-11,N/A,李建,"200(万元)","汽车旅客运输（凭许可证在有效期限内经营）；：汽车",安徽,亳州,"安徽省亳州市307线庄子像东50米客运中心院内"
安徽省庐江县汽车出租旅游公司,91340124713951631P,1994-04-11,N/A,金家保,"48(万元)","汽车出租客运。(依法须经批准的项目，经相关部门批准后方可开展经营活动）",安徽,合肥,"安徽省合肥市庐江县庐城镇军二西路49号"
中国邮政集团公司阜阳市西郊支局,91341200592673750Y,1994-04-11,N/A,李斌,"N/A","邮政基础业务、增值业务、附属业务，邮政储蓄业务。法律、法规、国务院决定规定应取得批准许可的，无有效批准许可，不得经营。",安徽,阜阳,"阜阳市颍州区颍西镇中南现代城栖霞苑4#楼112室"
凤台县州来服务有限责任公司,91340421150466201J,1994-04-11,N/A,张玉南,"66.8000(万元)","浴洗、理发。",安徽,淮南,"安徽省淮南市凤台县城北开发区"
黄山市黟县西递旅游服务公司,91341023704959279L,1994-04-11,N/A,胡傲立,"500(万元)","古民居游览服务，旅游工艺品零售。",安徽,黄山,"安徽省黄山市黟县西递镇西递村"
中国邮政集团公司阜阳市向阳路支局,91341200MA2N735C8L,1994-04-11,N/A,李斌,"N/A","邮政基础业务、增值业务、附属业务，邮政储蓄业务。",安徽,阜阳,"安徽省阜阳市颍东区向阳路"
文士科普(安徽)有限公司,91341100610568605N,1994-04-12,N/A,胡厚士,"50(万美元)","生产和销售自产的礼品、文具、玩具及其科普教具、科普文化用品；科普产品技术研发、推广活动及服务。",安徽,滁州,"安徽省滁州市环滁西路29号"
中国农业银行股份有限公司合肥新政务区支行,913401007749804013,1994-04-12,N/A,张梅,"N/A","在农业银行安徽省分行营业部授权范围内办理人民币存款、贷款、结算业务；办理票据承兑与贴现；代理发行金融债券；代理发行、兑付、销售政府债券；从事银行卡业务；代理收付款项及代理保险，代理基金业务；办理外汇存款、外汇贷款、外汇汇款、外币兑换；经中国银行业监督管理委员会依照法律、行政法规和其他规定批准的业务。",安徽,合肥,"安徽省合肥市怀宁路与汇林南路交叉口安德兴业大厦"
中国农业银行股份有限公司合肥城东支行,91340100694144745N,1994-04-12,N/A,刘玉明,"N/A","办理人民币存款、贷款、结算业务，办理票据贴现，代理发行金融债券，代理发行、代理兑付、销售政府债券，代理收付款项，经中国银行业监督管理委员会依照有关法律、行政法规和其他规定批准的业务。",安徽,合肥,"合肥市瑶海区临泉路与全椒路交口乐富公寓5幢商109、110"
中国农业银行股份有限公司黄山岩寺分理处,91341004704954566N,1994-04-12,N/A,赵斌,"N/A","经中国银行业监督管理委员会依照有关法律、行政法规和其他规定批准的业务。",安徽,黄山,"徽州区岩寺镇滨河南路38号"
中国农业银行股份有限公司合肥裕溪路分理处,91340100719953072P,1994-04-12,N/A,周澧军,"N/A","办理存款、贷款、结算、个人储蓄及票据承兑贴现业务；保证保险、机动车辆保险、家庭财产保险、健康保险、人寿保险、意外伤害保险、与贷款标的物相关的财产保险",安徽,合肥,"合肥市瑶海区合裕路939号红旗大厦B幢134、135、136、137号"
中国农业银行股份有限公司合肥东陈岗支行,913401007139664385,1994-04-12,N/A,胡金慧,"N/A","办理人民币存款、贷款、结算业务；办理票据贴现；代理发行金融债券；代理兑付、销售政府债券；代理收付款项；健康保险、人寿保险、意外伤害保险",安徽,合肥,"安徽省合肥市包河区桐城南路398号仕嘉名苑北楼"
中国农业银行股份有限公司合肥庐阳区支行,91340100849028248R,1994-04-12,N/A,陈智,"N/A","办理人民币存款、贷款、结算业务，办理票据贴现，代理发行金融债券，代理兑付、销售政府债券，代理收付款项，健康保险、人寿保险、意外伤害保险，经中国银行业监督管理委员会依照有关法律、行政法规和其他规定批准的业务。",安徽,合肥,"安徽省合肥市长江路312号"
中国农业银行股份有限公司合肥马鞍山路支行,913401007110274024,1994-04-12,N/A,殷智,"N/A","办理人民币存款、贷款、结算业务，办理票据贴现，代理发行金融债券，代理兑付、销售政府债券，代理收付款项，健康保险、人寿保险、意外伤害保险，经中国银行业监督管理委员会依照有关法律、行政法规和其他规定批准的业务。",安徽,合肥,"安徽省合肥市包河区马鞍山路与太湖路交口绿地赢海国际大厦A座商202、商302、商303号商业用房营业"
安庆市光泰建筑安装工程有限公司,91340800711019365Q,1994-04-12,N/A,朱学斌,"2,103.1000(万元)","房屋建筑工程施工总承包叁级：可承担单项建安合同额不超过企业注册资本金5倍的下列房屋建筑工程的施工；（1）14层及以下、单跨跨度24米及以下的房屋建筑工程；（2）高度70米及以下的构筑物",安徽,安庆,"安徽省安庆市蔡山路5号"
池州市电子信息产业有限责任公司,91341700153821950L,1994-04-12,N/A,房玉莲,"10(万元)","计算机系列产品、通讯设备、生产资料销售；打字、复印服务",安徽,池州,"安徽省池州市池阳路42号"
中国邮政集团公司阜阳市颍上路支局,91341200590160644X,1994-04-12,N/A,李斌,"N/A","邮政基础业务、增值业务、附属业务，邮政储蓄业务。",安徽,阜阳,"安徽省阜阳市颍泉区颍上路"
淮北百慧工贸有限责任公司万隆橡塑制品厂,913406007316719407,1994-04-12,有限责任公司,孟祥玲,"N/A","许可经营项目：无。一般经营项目：制造、销售橡胶制品、塑胶产品、管材型材。",安徽,淮北,"安徽省淮北市朔里矿"
当涂县鲲鹏贸易公司,913405215518121284,1994-04-13,N/A,李明华,"35(万元)","橡胶制品、化工、建材、钢材、不锈钢型材农副产品、百货、批发、零售。",安徽,马鞍山,"安徽省马鞍山市当涂县太白镇新桥街道"
合肥虹美印务有限公司,91340100149109020E,1994-04-13,N/A,石开明,"50(万元)","纸张印刷，工艺品印制加工。",安徽,合肥,"安徽省合肥市当涂路121号"
安徽省佛子岭水电站实业总公司,91341525705006613U,1994-04-14,N/A,杨勇,"842(万元)","水电设备安装检修、电器机械及器材供销；电力生产及水资源开发；旅游服务（涉及行政许可，凭许可证经营）；日杂、百货、烟、酒、副食品零售；饮食、住宿服务",安徽,六安,"安徽省六安市霍山县佛子岭镇"
中国邮政集团公司安徽省寿县窑口邮政所,91341521MA2MQHH58L,1994-04-14,N/A,邓雷,"N/A","邮政基础业务，邮政增值、邮政附属业务，国家邮政局批准开办的其他业务，代办电信各项业务，开办放开经营的电信、信息业务和国家允许开办的其他服务项目，办公用品的零售业务，从事不再分装的包装种子、肥料、非危险化学品类农药、饲料和饲料添加剂的经营，国内书刊批发、零售，二类航空运输销售代理，汽车、火车票、彩票、文艺、体育票券代理销售。",安徽,淮南,"安徽省淮南市寿县窑口镇窑口街道"
马鞍山中普科技有限公司,913405001505182279,1994-04-14,N/A,黄光亚,"200(万元)","批发零售计算机及相关设备，计算机软件开发销售，计算机网络工程，办公设备、电子、电气、机械设备销售，电子工程、电气工程及相关技术咨询、技术服务。",安徽,马鞍山,"安徽省马鞍山市花山区湖东路44号"
中国建设银行股份有限公司宿州芦岭支行,91341300050159490Q,1994-04-14,N/A,任彬,"N/A","许可该机构经营中国银行业监督管理委员会依照有关法律、行政法规和其他规定批准的业务，经营范围以批准文件所列的为准(依法须经批准的项目，经相关部门批准后方可开展经营活动)。",安徽,宿州,"安徽省宿州市芦岭镇"
蚌埠市华阳汽车工业总公司,9134030075486899XD,1994-04-14,N/A,于志强,"108(万元)","许可经营项目：华阳汽车制造、销售，车辆修理；一般经营项目：汽车配件、钢板弹簧、矿机配件的制造、销售。",安徽,蚌埠,"安徽省蚌埠市解放二路1号"
国网安徽省电力有限公司安庆供电公司,91340800851303632M,1994-04-14,N/A,韩学民,"N/A","电力建设、销售；电网服务、经营、电力设备租赁。",安徽,安庆,"安徽省安庆市人民路170号"
安庆中船柴油机有限公司,91340800151306277Q,1994-04-15,N/A,付向昭,"36,073.5749(万元)","柴油机、柴油发电机组、柴油机零配件制造与销售；本企业自产的柴油机及配件出口；本企业生产、科研所需的原辅材料、机械设备、仪器仪表及零配件进口；自产的分离机械及配件，其它自产的机电产品出口业务；钢结构产品制造及出口业务；淀粉分离机、浓缩分离机、胶乳分离机、卧螺沉降分离机及其它分离机、曲筛、消沫泵、过滤器、离心筛、淀粉磨、振动磨、煤矿机械及配件、电器控制柜的制造与销售；机电类设备制造、销售、安装、维修、改造；配件销售、设备代理。",安徽,安庆,"安徽省安庆市经济技术开发区3.9平方公里工业园纬二西路"
中国建设银行股份有限公司安庆中兴大道支行,913408007668514237,1994-04-15,N/A,方虎,"N/A","办理人民币存款、贷款、结算业务；办理票据贴现；代理发行金融债券；代理发行、兑付、销售政府债券；买卖政府债券；代理收付款项及代理保险业务；办理外汇存款、外币兑换业务；其总行在中国银监会批准的业务范围内授权的业务；经中国银监会批准的其他金融业务。",安徽,安庆,"安徽省安庆市开发区舒怡国际家居购物广场二期3幢一层"
合肥市洪店云母电热材料有限公司,91340100149347168N,1994-04-15,N/A,何跃文,"30(万元)","云母、电热圈加工。",安徽,合肥,"安徽省合肥市经济技术开发区高刘社区洪店街道22号"
合肥秉辰电子电器有限公司,91340122149305929H,1994-04-15,有限责任公司,田炳东,"88万人民币","机电设备制造、销售及售后服务；汽车配件、工程机械配件、特种器件外壳、冲压件、结构件、锻压件研发、设计、加工、销售。",安徽,合肥,"安徽省合肥市肥东县撮镇镇中岗村"
铜陵市铜港水运有限公司,91340700151232204T,1994-04-15,N/A,陈大明,"1,500(万元)","长江中下游及内河货物运输、货物服务，硫金砂代购代销。",安徽,铜陵,"安徽省铜陵市扫把沟"
砀山县通达实业公司,91341321779098135Y,1994-04-15,N/A,邱奎,"30(万元)","教学用品、家用电器、五金、照明器材、纺织品、文化用品的销售；花卉、苗木的种植、销售",安徽,宿州,"安徽省宿州市砀城人民东路85号"
东至县洋湖中心供销合作社,913417217389484986,1994-04-16,集体所有制,谢圣林,"77.6万人民币","工业品，零售、批发；农副产品(不含粮食、鲜茧)，收购、销售。",安徽,池州,"安徽省池州市东至县洋湖镇"
安徽欣意电缆有限公司,913400007050403522,1994-04-18,N/A,林泽民,"1,808(万美元)","生产经营自产的电缆、电线及其包装用木盘。",安徽,合肥,"安徽省合肥市张洼路98号"
芜湖市中辉实业有限公司,91340200610351772K,1994-04-18,N/A,梅秀红,"380(万)","建筑机械、机械配件、汽车零部件、橡塑制品、电子产品、五金工具生产销售；电子产品维修；金属表面处理；水处理设备、铆焊加工；自有房屋租赁；五金、建筑材料、涂料",安徽,芜湖,"安徽省芜湖市胜利西路杏园小区一号商办楼"
黄山市杏林实业公司,913410001514656655,1994-04-18,N/A,吴福江,"50(万元)","咨询服务；一类医疗器械零售，二类医疗器械零售（仅限经营无须许可证的品种）；五金电器、化工产品（不含危险品）、日用杂品、棉制品销售；预包装食品兼散装食品；乳制品（含婴幼儿配方乳粉）；卷烟零售（凭有效许可证经营）；",安徽,黄山,"安徽省黄山市屯溪区栗园路4号"
蚌埠市油脂公司,91340300149863760R,1994-04-19,N/A,胡滨,"50(万元)","一般经营项目：家用电器、水暖器材、粮油加工机械销售（批发、零售、加工）",安徽,蚌埠,"安徽省蚌埠市淮河路640号"
南陵县弋江竹木制品服务公司,91340223MA2MYW8F7P,1994-04-20,N/A,李腊生,"22.5000(万元)","竹木制品交易中介服务，物品存放，摊位租赁，干鲜、水果销售。",安徽,芜湖,"安徽省芜湖市南陵县弋江镇油榨滩"
萧县康得利油脂厂,91341322730021962U,1994-04-20,集体所有制,毛吉顺,"40万人民币","皮革、油脂、骨头、甘油、脂肪酸、棉纤维(国家政策许可的)。汽车、农机配件零售。加工、零售*",安徽,宿州,"萧县黄口镇北大桥"
安徽永星工贸有限公司,91341523610610375X,1994-04-20,N/A,吴婷婷,"880(万)","钢材、建材及化工产品",安徽,六安,"安徽省六安市舒城县桃溪镇合安路1086K"
中国建设银行股份有限公司蚌埠铁路支行,91340300X103548149,1994-04-22,N/A,李文慧,"N/A","主营铁路建设投资、拨款、存款、贷款、结算、汇兑及企业存款、贷款、结算、个人储蓄业务、代理保险业务，经人民银行批准的其它金融业务",安徽,蚌埠,"安徽省蚌埠市胜利东路1599号"
安徽省苏洋设计装饰工程有限公司,91340100149036343R,1994-04-22,N/A,张捷,"1,180(万元)","室内外装饰工程设计、施工",安徽,合肥,"合肥市包河区徽州大道773号恒生阳光城8幢办公1104"
合肥澳达环境艺术设计工程有限公司,913401007050112019,1994-04-22,N/A,魏浩,"6,790(万元)","室内外设计与施工、建筑幕墙工程设计与施工、展览展示设计及施工、电子与智能化工程、园林绿化、钢结构工程、安防工程、金属门窗工程、机电设备安装、水电安装、城市及道路照明工程、市政工程、环境艺术设计与施工、仿古园林、仿古建筑修缮及保护、房屋建筑工程、消防工程、环保工程、建筑劳务、建筑防水、实验室工程、建材销售",安徽,合肥,"安徽省合肥市政务区怀宁路288号置地广场D座1707室"
潜山县农机化实业公司,91340824153983319B,1994-04-22,N/A,程云汉,"40(万元)","汽油、润滑油、柴油、农机、机械配件、钢材销售。",安徽,安庆,"安徽省安庆市梅城镇舒州西路"
合肥江淮汽车制管有限公司,91340000149238084E,1994-04-23,N/A,陈志平,"5,000(万人民币元)","汽车管路生产和销售，以及管路和其他部件组装的生产和销售；其他相关汽车配件的生产和销售；仓储服务",安徽,合肥,"安徽省合肥市经济技术开发区始信路62号"
安徽省安庆市曙光化工股份有限公司,913408006104528647,1994-04-23,N/A,汪晓波,"60,000(万元)","生产和销售自产的氰化钠、氰化钾、氢气、合成气、甲醇、硫酸、硫酸铵、异丁基油及后续加工和相关产品；电力、热力（蒸汽）、工业用水、煤灰",安徽,安庆,"安徽省安庆市腈北路47号"
合肥五洋实业公司,913401001492390799,1994-04-24,N/A,唐守桂,"80(万元)","提供劳务、水电安装、房屋维修服务、场区道路施工。",安徽,合肥,"安徽省合肥市四河路（五里拐村）"
