合肥兴泰供应链管理有限公司,913401001491855411,1994-09-01,N/A,葛立新,"450(万元)","供应链管理及服务；供应链投资、股权投资",安徽,合肥,"合肥市蜀山区潜山路100号琥珀五环城和颂阁1幢20层部分"
淮南市联博物资有限责任公司,913404006103809527,1994-09-02,N/A,高玉斌,"500(万)","煤炭零售经营（有效期至2014年05月30日止），化工产品（不含危险品及监控化学品）、五金、汽车配件、木材、建材、钢材、土产日杂、农副产品",安徽,淮南,"安徽省淮南市泉山西路望峰岗镇尚岗村"
马鞍山市建筑材料工业公司经营部,913405001505031808,1994-09-05,N/A,任晓凤,"16(万元)","零售、代销、批发建筑材料，五金，百货，销售润滑油，家电修理。销售通讯器材。",安徽,马鞍山,"安徽省马鞍山市花山区湖北路23号"
安徽省园林建设集团有限公司,91340123149047640T,1994-09-06,N/A,黄国庆,"7,000(万元)","一般经营项目：市政公用行业",安徽,合肥,"安徽省合肥市肥西县上派镇金寨南路与站前路交口名邦西城国际1#412室"
安徽金诚广告装饰工程有限责任公司,91340100149041484A,1994-09-06,N/A,金蔓,"100(万元)","设计、制作、发布国内广告，室内外装饰，包装装璜设计，对分支机构印刷业务进行管理；现代办公用品、计算机软硬件代理，礼品、装饰材料、纸张销售，企业形象策划；会展服务；市场调研；赛事活动策划、公关活动策划；景观设计、室内设计。",安徽,合肥,"合肥市庐阳区寿春路356号徽商国际大厦908室"
砀山县供销社工业品综合公司官庄生资部,91341321MA2N7H3M51,1994-09-06,集体经营单位(非法人),徐福才,"N/A","化肥、农药、农膜；饼肥。",安徽,宿州,"安徽省宿州市砀山县官庄坝镇刘楼村"
中国建设银行股份有限公司淮南望峰岗支行,9134040070492237XC,1994-09-07,N/A,张黎黎,"N/A","吸收公众存款、发放短期、中期、长期贷款；办理国内外结算；办理票据承兑与贴现；代理发行、代理兑付、承销政府债券；买卖政府债券、金融债券；买卖、代理买卖外汇；从事银行卡业务；提供信用证服务及担保；代理收付款项及代理保险业务；个人黄金买卖业务；经中国银行业监督管理机构等监管部门批准的其他业务。",安徽,淮南,"安徽省淮南市谢家集区望峰岗南路"
合肥科技农村商业银行股份有限公司,91340100713926874L,1994-09-07,N/A,胡忠庆,"180,034(万元)","吸收公众存款；发放短期、中期和长期贷款；办理国内结算；办理票据承兑与贴现；代理发行、代理兑付、承销政府债劵；买卖政府债劵、金融债劵；从事同业拆借；代理收付款项及代理保险业务；提供保管箱服务；经中国银行业监督管理委员会批准的其他业务。",安徽,合肥,"安徽省合肥市蜀山区长江西路101号"
安庆市龙泽供销社圣埠收购门市部,91340800MA2N6C1A5E,1994-09-08,集体经营单位(非法人),汪正文,"N/A","废旧物资回收收购。",安徽,安庆,"安徽省安庆市十里铺乡圣埠村"
黄山绿谷有限公司,913410031515869697,1994-09-08,N/A,张玉明,"2,472.5000(万元)","黄山绿谷",安徽,黄山,"黄山市黄山区北大门绿谷商苑"
安徽三益经济发展有限责任公司,91340400610380311X,1994-09-08,N/A,殷向群,"100(万)","机电产品、通讯器材、家用电器、仪器仪表、五金交电、办公自动化设备、建材、化工产品",安徽,淮南,"安徽省淮南市人民南路38号"
安徽银通物业管理有限公司,913401006103095159,1994-09-08,N/A,周名奎,"2,180(万)","物业管理及咨询服务；房地产投资咨询；文印；道路清扫；垃圾清理；保洁服务；停车场管理；园林绿化与施工；会展服务；餐饮管理；家政服务；装饰装修；水电安装；五金、水暖器材、电工电料、金属材料、建材、装饰材料、劳保用品、家用电器、日用百货、普通机械、电子产品及配件销售及售后服务；电子航空票务、火车票务、旅游服务。",安徽,合肥,"安徽省合肥市长江中路130号"
蒙城县田桥供销合作社驼涧生资门市部,91341622MA2N8DCT4Y,1994-09-08,集体经营单位(非法人),代建芳,"N/A","毒害品",安徽,亳州,"安徽省亳州市蒙城县田桥镇驼涧村"
合肥永达装饰工程有限公司,91340100734943489J,1994-09-08,N/A,阮亮,"10,000(万元)","室内外装饰工程设计、施工；工业与民用建筑施工，市政道路施工，幕墙设计、施工，消防、监控、智能化、防水工程，园林绿化工程施工；电气设备、通风空调管道设备安装；金属门窗、钢结构设计、施工；机电设备安装；环保工程施工；城市道路照明工程施工。",安徽,合肥,"安徽省合肥市长江西路669号F5楼三层"
蒙城县田桥供销合作社马集生资第二门市部,91341622574409761U,1994-09-08,集体经营单位(非法人),蔺如强,"N/A","化肥、农药",安徽,亳州,"安徽省亳州市蒙城县马集镇蔺圩村"
淮南永发铁路综合服务公司,91340400150222645B,1994-09-10,N/A,周茂勇,"200(万元)","装卸、搬运、仓储（不含危险物品）、物流服务（不含道路运输服务），农副产品（不含粮食）、百货、办公用品、煤炭销售，卷烟零售，房屋租赁，代办运输，蓬布修理，小件寄存，保洁服务，生产资料及运输类经纪服务，铁路技术服务、技术咨询、技术培训、技术指导，住宿（限分支机构经营），预包装食品、冷藏食品零售",安徽,淮南,"安徽省淮南市舜耕中路143号"
黄山市徽州建美花木有限责任公司,91341004771124538R,1994-09-12,N/A,程育平,"10(万元)","园林绿化、花木盆景栽培、咨询服务；陶瓷制品、工艺美术品、土特产品、糖、烟、酒零售",安徽,黄山,"安徽省黄山市徽州区岩寺文峰路2号"
安徽省福利企业公司经理部,9134000084894624XP,1994-09-13,N/A,王开明,"N/A","文化用品、挂历、日用百货、服装鞋帽、工艺美术品、皮革制品零售。",安徽,合肥,"安徽省合肥市庐阳区庙东街54号"
马鞍山市马钢巨龙有限责任公司,91340500150518796R,1994-09-13,N/A,黄志宇,"7,609(万元)","销售铸铁管、回转支承、机械设备、制品模具、金属产品、五金、化工(不含国家专控)、建材、技术咨询、劳务，进出口业务",安徽,马鞍山,"安徽省马鞍山市慈湖化工路"
中国建设银行股份有限公司淮南惠利支行,913404007049224418,1994-09-13,N/A,黄玉胜,"N/A","吸收公众存款，发放短期、中期、长期贷款，办理国内外结算，办理票据承兑与贴现，代理发行、代理兑付、承销政府债券，买卖政府债券、金融债券，买卖、代理买卖外汇，办理结汇、售汇业务，从事银行卡业务，提供信用证服务及担保，代理收付款项及代理保险业务，个人黄金买卖业务，经中国银行业监督管理机构等监管部门批准的其他业务。",安徽,淮南,"淮南市田家庵区惠利花园城翰林华府48栋裙楼101、102"
中国建设银行股份有限公司淮南舜耕路支行,9134040085022668X6,1994-09-14,N/A,李巍,"N/A","吸收公众存款，发放短期、中期、长期贷款，办理国内外结算，办理票据承兑与贴现，代理发行、代理兑付、承销政府债券，买卖政府债券、金融债券，买卖、代理买卖外汇，办理结汇、售汇业务，从事银行卡业务，提供信用证服务及担保，代理收付款项及代理保险业务，个人黄金买卖业务，经中国银行业监督管理机构等监管部门批准的其他业务。",安徽,淮南,"安徽省淮南市田家庵区舜耕中路东方丽景主楼"
黄山市徽州光宏汽车修配有限公司,913410047233025989,1994-09-14,N/A,程观宏,"10(万元)","汽车修理；汽车配件、五金、交电零售。",安徽,黄山,"黄山市徽州区徽州东路96号"
安徽含山农村商业银行股份有限公司长岗支行,91340522853742129Q,1994-09-15,N/A,梅蓓蓓,"N/A","吸收公众存款；发放短期、中期和长期贷款；办理国内结算；办理票据承兑与贴现；代理发行、代理兑付、承销政府债券；买卖政府债券、金融债券；从事同业拆借；代理收付款项及代理保险业务；提供保险箱服务；从事借记卡业务；经中国银行业监督管理委员会批准的其他业务。",安徽,马鞍山,"含山县铜闸镇长岗老街"
安徽含山农村商业银行股份有限公司十字街支行,91340522853742233W,1994-09-15,N/A,王锋长,"N/A","吸收公众存款；发放短期、中期和长期贷款；办理国内结算；办理票据承兑与贴现；代理发行、代理兑付、承销政府债券；买卖政府债券、金融债券；从事同业拆借；代理收付款项及代理保险业务；提供保险箱服务；从事借记卡业务；经中国银行业监督管理委员会批准的其他业务。",安徽,马鞍山,"安徽省含山县环峰镇环峰西路县科技大楼"
安徽含山农村商业银行股份有限公司钜兴支行,91340522853742081G,1994-09-15,N/A,李加海,"N/A","吸收公众存款；发放短期、中期和长期贷款；办理国内结算；办理票据承兑与贴现；代理发行、代理兑付、承销政府债券；买卖政府债券、金融债券；从事同业拆借；代理收付款项及代理保险业务；提供保险箱服务；从事借记卡业务；经中国银行业监督管理委员会批准的其他业务。",安徽,马鞍山,"含山县清溪镇巨兴集"
中国银行股份有限公司蚌埠泗水桥支行,913403007668518537,1994-09-15,N/A,吴迎春,"N/A","办理人民币存款、贷款、结算业务；办理票据贴现；代理发行金融债券；代理发行、代理兑付、销售政府债券；买卖政府债券；代理收付款项及代理保险业务；办理外汇存款、外汇汇款、外币兑换业务；通过上级行办理代客外汇买卖业务；代理国外信用卡付款业务；经中国银行业监督管理委员会等监管部门批准的其他业务。",安徽,蚌埠,"安徽省蚌埠市解放一路与凤阳路交叉口东北角一楼"
安徽含山农村商业银行股份有限公司东山支行,91340522853744132J,1994-09-15,N/A,范明宏,"N/A","吸收公众存款；发放短期、中期和长期贷款；办理国内结算；办理票据承兑与贴现；代理发行、代理兑付、承销政府债券；买卖政府债券、金融债券；从事同业拆借；代理收付款项及代理保险业务；提供保险箱服务；从事借记卡业务；经中国银行业监督管理委员会批准的其他业务。",安徽,马鞍山,"含山县环峰南路159号"
马鞍山市兴国金属结构有限责任公司,91340500150515886Q,1994-09-15,N/A,吴传国,"76(万元)","金属结构制作、安装，机电检修，土建维修；生产玻璃纤维；废品回收(不含废旧金属)。",安徽,马鞍山,"安徽省马鞍山市红旗南路与采向路交叉口"
滁州市琅琊办事处劳动服务公司,91341100152663372X,1994-09-18,N/A,王晓敏,"15(万元)","[批零兼营]建筑材料、农副产品",安徽,滁州,"安徽省滁州市路9-11号"
安徽鸿泰交家电(集团)有限公司,91340500150515608B,1994-09-19,N/A,汪创奇,"2,689(万元)","批发零售:家电,五金,交电,钢材,机电设备及配件,文化办公用品,摩托车,日用百货,灯具,通讯器材（除专控项目）,化工产品",安徽,马鞍山,"安徽省马鞍山市花山区解放路1号(1-5层)"
合肥市直机关劳动服务公司旅游车队,913401001491443283,1994-09-19,N/A,郭燕玲,"26(万元)","旅游服务、接送汽车服务。",安徽,合肥,"安徽省合肥市淮河路336号（市委大院内平房）"
合肥市海光汽车配件厂（普通合伙）,913401026103072294,1994-09-19,普通合伙,张道桥,"N/A","汽车配件、农机配件、加工。",安徽,合肥,"安徽省合肥市东郊大兴集"
煤炭工业合肥设计研究院有限责任公司,913401001491402635,1994-09-20,N/A,闫红新,"40,138.0900(万元)","工程勘察、设计、监理、咨询、技术服务及项目总承包，岩土工程、环境评价、压力容器设计，压力管道设计；民用建筑勘察、设计，人防工程设计；与工程项目有关的材料、设备销售，信息服务，软件开发与销售，承揽机械加工业务，承担境外煤矿、建设工程的勘测、咨询、设计和监理项目及相关劳务人员输出和所需的设备、材料出口，房屋租赁，项目投资。",安徽,合肥,"安徽省合肥市阜阳北路355号"
安庆市慧宇制衣有限公司,91340800151458529J,1994-09-20,N/A,汪俊才,"500(万元)","色织布、纺织布、服装生产；针纺织品、服装、纺织原料、设备器材、日用百货、五金产品、鞋帽销售。",安徽,安庆,"安徽省安庆市德宽路215号"
淮南市红春音像有限责任公司,91340400MA2N5R9Y8B,1994-09-22,N/A,宋文学,"50(万元)","音像制品",安徽,淮南,"安徽省淮南市唐山南路8号"
中国银行股份有限公司合肥四牌楼支行,91340100705057410W,1994-09-23,N/A,童良虎,"N/A","办理人民币存款、贷款、结算业务；办理票据贴现；代理发行金融债券；代理兑付、销售政府债券；代理收付款项；办理外汇存款、外汇汇款、外币兑换；代客外汇买卖业务；代理健康保险、人寿保险、意外伤害保险",安徽,合肥,"安徽省合肥市庐阳区徽州大道110号百鸣大厦办公楼"
合肥天益广告公司,91340100149151528G,1994-09-23,N/A,吴刚,"200(万元)","设计、制作、发布国内各类广告业务，承接装饰工程及美术设计，信息咨询服务。",安徽,合肥,"安徽省合肥市宿州路167号"
庐江县路桥建筑工程公司,91340124153660691T,1994-09-23,N/A,梁满意,"1,573.4000(万元)","公路养护工程（按资质等级施工）、水泥构件",安徽,合肥,"安徽省合肥市庐江县庐北路26号"
合肥市丽都娱乐有限责任公司,9134010014914327XC,1994-09-23,N/A,王强华,"100(万元)","电子游戏",安徽,合肥,"安徽省合肥市金寨路2号金江影剧院"
淮南市泉山糖业烟酒有限公司批发部,91340400719900464N,1994-09-23,N/A,顾先芝,"N/A","糖果、烟",安徽,淮南,"安徽省淮南市洞山迎宾路"
中国建设银行股份有限公司巢湖半汤路支行,913401817711111205,1994-09-24,N/A,周莹莹,"N/A","吸收公众存款；发放短期、中期、长期贷款；办理国内外结算；办理票据承兑与贴现；发行金融债券；代理发行、代理兑付、承销政府债券；买卖政府债券、金融债券；从事银行卡业务；提供信用证服务及担保；代理收付款项及代理保险业务；个人黄金买卖业务；经中国银行业监督管理机构等监督部门批准的其他业务。",安徽,合肥,"巢湖市半汤路与凤凰山路交叉口中央领域1幢102铺"
合肥联合广告装饰有限责任公司,913401001491656202,1994-09-24,N/A,文玉龙,"500(万元)","室内外装饰工程、建筑幕墙工程、安全防范工程设计与施工；电子与智能化工程、防水防腐保温工程、城市及道路照明工程、园林绿化工程施工；路牌、灯箱、标牌设计制作；建筑材料、装饰材料销售。",安徽,合肥,"合肥市包河区马鞍山路119号又一居6幢201室"
中国工商银行股份有限公司铜陵北京东路支行,91340700777366802T,1994-09-24,N/A,夏燕,"N/A","许可该机构经营中国银行业监督管理委员会依照有关法律、行政法规和其他规定批准的业务，经营范围以批准文件所列的为准。",安徽,铜陵,"安徽省铜陵市北京西路325、327、329号"
安徽瑞丰水利建筑有限公司,91340300150143162N,1994-09-26,N/A,曹明,"5,050(万元)","水利水电工程、房屋建筑工程、市政公用工程、环保工程、建筑装饰工程、园林综合工程施工；雨水收集利用；城市泄洪防涝；污水处理工程施工及技术服务。",安徽,蚌埠,"安徽省蚌埠市华夏第一街B3号楼305号"
中国建设银行股份有限公司六安滨河支行,91341500704998147W,1994-09-26,N/A,陶硕,"N/A","吸收公众存款；发放短期、中期、长期贷款；办理结算；办理票据承兑与贴现；代理发行、代理兑付、承销政府债券；买卖政府债券；从事同业拆借；办理银行卡业务；代理收付款项及代理保险业务；办理外汇存款、贷款、汇款、外币兑换、国际结算、结汇售汇、通过上级行办理代客外汇买卖；经中国银行业监督管理机构等监管部门批准的其他业务；基金代理业务；实物黄金买卖业务。",安徽,六安,"安徽省六安市大别山路13号"
安徽省先苗建筑工程有限公司,913401001490490726,1994-09-26,N/A,伍宣苗,"1,000(万元)","房屋建筑工程施工；市政公用工程施工；水利水电工程施工；建筑装饰装修工程设计与施工；园林绿化工程；消防设施工程；建筑防水工程；防腐保温工程；体育场地设施工程；园林古建筑工程；钢结构工程；土石方工程；地基与基础工程；堤防工程；城市及道路照明工程；建筑智能化工程；建筑幕墙工程；环保工程；建筑劳务分包",安徽,合肥,"安徽省合肥市庐阳区环城南路28号"
安徽格鲁伯建设工程有限公司,91340100149034786F,1994-09-27,N/A,庄世界,"2,349(万元)","房屋建筑工程、市政公用工程；建筑装修装饰工程设计与施工、建筑幕墙工程、金属门窗工程、机电设备、安装工程、建筑防水工程、消防设施工程、钢结构工程、建筑智能化工程施工、酒店软装饰用品与办公家具、建筑装饰材料、电子产品销售。",安徽,合肥,"合肥市蜀山区潜山路蔚蓝商务港城市广场A座817室"
安徽省凤台县金属材料有限责任公司,91340421150460192X,1994-09-27,N/A,王伟,"174.1000(万元)","金属材料销售；废旧金属回收；机电产品购销。",安徽,淮南,"安徽省淮南市凤台县城关镇淮河路县物资局二楼"
安徽安新能源有限公司,91340000705040547U,1994-09-27,N/A,何国泰,"700(万人民币元)","机电机组验测及设备、发电机组装配、生产、销售与租赁；相关技术服务与设备提供安装，售后服务、维修业务以及所有有关的业务；生产销售家庭用具、工业清洗设备、系统，家用与工业清水净化设备、系统，各种联带材料与工业用化工产品",安徽,合肥,"安徽省合肥市金寨路92号高科技广场南二座二十单元"
淮南矿业(集团)有限责任公司地质勘探工程处,91340400850228837N,1994-09-28,N/A,赵俊峰,"N/A","矿产地质、水文地质勘查",安徽,淮南,"安徽省淮南市蔡新路谢三村路口"
霍邱县王截流供销合作社,91341522705003092X,1994-09-29,集体所有制,郭建,"44万人民币","农业生产资料、日用百货、针纺织品、中小农具零售；废旧物资收购。",安徽,六安,"安徽省六安市霍邱县王截流街道"
安徽霍山龙图商贸有限责任公司,913415256106156789,1994-09-29,N/A,汪全龙,"400(万)","许可经营项目：公共浴池服务、宾馆住宿、饮食（含烟、副食品零售）服务；汽车运输服务（在许可证有效期内经营）。一般经营项目：针纺织品、日用百货、化妆品、服装、鞋帽、农机配件、汽车配件、钢材的销售；木竹、农副产品（除粮棉）、废旧物品",安徽,六安,"安徽省六安市霍山县衡山镇迎驾大道西路7号"
安徽省肥西县医药公司青年药店,91340123588862911B,1994-09-29,N/A,江永安,"N/A","中成药、化学药制剂、抗生素、生化药品、中药饮片",安徽,合肥,"安徽省合肥市肥西县上派镇三河路(农机二厂)"
安徽省颍上县金马广告有限责任公司,913412261522230781,1994-09-29,N/A,金佩修,"100(万元)","设计、制作、发布、代理国内各类广告业务；建筑工程、装饰装潢工程设计、施工；建材",安徽,阜阳,"安徽省阜阳市颍上县慎城镇二新北路水利局楼下"
灵璧县灵城房地产开发有限责任公司,91341323704995405X,1994-09-29,N/A,赵士华,"203(万元)","房屋租赁、建筑材料、装璜材料",安徽,宿州,"安徽省宿州市灵城光明大街1号"
蚌埠市太平建材有限责任公司,91340300149890072T,1994-09-30,N/A,高贵恒,"30(万元)","建筑装饰材料、五金电器、化工产品及原料",安徽,蚌埠,"安徽省蚌埠市凤阳东路410号"
安徽科安新技术开发有限责任公司,913401001489699261,1994-09-30,N/A,张新明,"650(万元)","电子、计算机软件开发，网络工程；医用器具类、医用光电仪器类、医用射线类、医用检验类、医用装备类、医用材料类（凭许可证经营），监测、监测仪器仪表设备代理销售，金属材料、废旧金属材料销售；医用设备、器械维修，医用设备租赁，自营和代理各类商品和技术的进出口",安徽,合肥,"安徽省合肥市蜀山区长江西路248号旺城国际大厦1516-1520室"
交通银行股份有限公司淮南龙湖支行,913404007050650314,1994-10-05,N/A,许鸣,"N/A","办理人民币存款、贷款、结算业务；办理贴现；代理发行金融债券；代理发行、代理兑付国库券及企业债券；经中国银行业监督管理委员会批准的其它业务,代理保险业务。",安徽,淮南,"淮南市田家庵区龙湖南路海沃世贸商城一二层商铺"
舒城县宏通丝业有限公司,913415237050035196,1994-10-05,N/A,费建松,"100(万元)","缫丝生产，真丝绸、真丝、床上用品制造，农产品收购",安徽,六安,"安徽省六安市舒城县干汊河镇乌羊"
交通银行股份有限公司蚌埠南苑支行,91340300788568485W,1994-10-05,N/A,韩玉梅,"N/A","办理人民币存款、贷款、结算业务；办理票据贴现；代理发行金融债券；代理发行、代理兑付、销售政府债券；买卖政府债券；代理收付款项及代理保险业务；经营外币储蓄存款业务；经中国人民银行批准的其他业务。",安徽,蚌埠,"安徽省蚌埠市南湖路与兰凌路交叉口"
合肥兴达电器有限公司,91340100149038058P,1994-10-06,N/A,毕金凤,"30(万元)","五金、家用电器、金属材料、装饰材料、建筑材料、纺织原材料、农副产品",安徽,合肥,"安徽省合肥市新站区安徽大市场三期名牌家电广场南B幢11号"
中国银行股份有限公司蚌埠胜利路支行,91340300766851802Y,1994-10-08,N/A,蒋宝琛,"N/A","许可经营项目：办理人民币存款、贷款、结算业务；办理票据贴现；代理发行金融债券；代理发行、代理兑付、销售政府债券；买卖政府债券；代理收付款项及代理保险业务；办理外汇存款、外汇汇款、外币兑换业务；通过上级行办理代客外汇买卖业务；代理国外信用卡付款业务；经中国银行业监督管理委员会等监管部门批准的其他业务。",安徽,蚌埠,"安徽省蚌埠市胜利中路127号"
合肥绿都广告有限责任公司,913401001491442720,1994-10-08,N/A,叶琴,"65(万元)","设计、制作、发布招牌、灯箱、霓虹灯、条幅广告业务、营销策划、会展、装饰等。",安徽,合肥,"安徽省合肥市淮河路(绿都商城D区六楼)"
安徽省华强装饰有限责任公司,91340122777392576L,1994-10-08,N/A,冯远胜,"506(万元)","建筑装修装饰工程专业承包贰级。",安徽,合肥,"安徽省合肥市肥东县店埠镇沿河东路建管局恢复楼2幢502室"
蚌埠市建设物资有限公司,91340300610359379H,1994-10-10,N/A,刘军,"142.8600(万)","化工轻工材料及产品、富马酸、聚丙烯酰胺、尿素、氯化铵、聚氯乙烯（不含危险化学品及爆炸品）、塑料及其制品、橡胶及其制品、钢材、金属材料",安徽,蚌埠,"安徽省蚌埠市涂山东路1757号投资大厦9楼"
中国工商银行股份有限公司合肥宿州路支行,91340100711761113W,1994-10-10,N/A,吕军,"N/A","存贷款及结算业务，项目评估，信息咨询，代收代付服务，外汇存款、外汇贷款、外汇汇款、外币兑换业务；保证保险、机动车辆保险、家庭财产保险、建筑工程保险、健康保险、人寿保险、意外伤害保险、与贷款标的物相关的财产保险，经中国银行业监督管理委员会依照有关法律、行政法规和其他规定批准的业务。。",安徽,合肥,"安徽省合肥市宿州路6号"
安徽美宏电子有限责任公司,9134010014918483XG,1994-10-11,N/A,杨伟,"200(万元)","电视机、通风设备、计算机、数码摄像机、数码照像机、摄像头、电子产品的销售及研发；汽车、车载用品、汽车GPS定位系统销售、并提供以上企业的技术咨询及服务",安徽,合肥,"安徽省合肥市高新区磁性材料工程研究中心601室"
合肥筑远规划建筑设计有限公司,91340100149142920X,1994-10-12,N/A,王文波,"300(万元)","建筑工程设计；建筑事务咨询；室内外装饰；城市规划编制；装修工程设计；平面设计制作。",安徽,合肥,"安徽省合肥市庐阳区金寨路327号新鸿安大厦8楼9楼"
合肥市蜀山邓店粮油加工厂,91340100149046410T,1994-10-13,N/A,吴宏毕,"5(万元)","粮食加工；农副产品、果木加工、销售；果木、花卉种植销售，仓储服务。",安徽,合肥,"安徽省合肥市蜀山镇邓店村"
