南宁诚意包装有限公司,91450100759797350A,2004-09-22,N/A,N/A,"2,800(万元人民币)","生产和销售食品用塑料容器［包括聚酯（ＰＥＴ）无汽饮料瓶、聚对苯二甲酸乙二醇酯（ＰＥＴ）碳酸饮料瓶］（凭许可证在有效期内经营，具体项目以审批部门审批的为准）；生产销售饮料［瓶（桶）装饮用水类（饮用纯净水）］",广西,南宁,"南宁市科园西十路15号"
广西百色市百洲水电开发有限公司,91451000765831594F,2004-09-22,N/A,N/A,"50(万)","水电开发，水电、水利设备、设施购销。",广西,百色,"百色市右江区百兰乡乡府所在地"
广西杰瑞龙商贸有限责任公司,91450100765829486R,2004-09-22,N/A,N/A,"500(万元人民币)","销售：服装、纺织品、家用电器、化工产品（除危险化学品外）、环保设备、建筑材料（除危险化学品及木材）、有色金属、橡胶、塑料制品（除一次性发泡制品及超薄塑料品）、办公用品、机电产品（除九座以下乘用车）、农副土特产品（仅限初级农产品）、检测设备",广西,南宁,"南宁市大学东路168号"
广西鑫晟房地产开发有限公司,914507007658295822,2004-09-22,N/A,N/A,"800(万元人民币)","房地产开发、经营；房地产商品信息咨询；建筑材料、钢材",广西,钦州,"钦州市金华路32号孟择雅居8、10、12号楼8#-01号商铺"
广西春霞园酒店管理有限公司,91450122765827704R,2004-09-22,N/A,N/A,"1,000(万元人民币)","土地开发、房地产开发经营、绿化工程及交通安全工程施工（凭有效的资质证和安全生产许可证经营），物业管理（凭有效的资质证经营）。对文化体育、旅游业、酒店业、矿业、建筑业、制造业、运输业、市政工程、交通、园林绿化、房地产、商业的投资与管理；金属材料、建筑材料（除危险化学品和木材外）、装饰材料、机械设备、汽车配件、日用百货、办公设备、矿产品（国家专控的矿产品除外）的购销代理；旅店，餐饮服务（具体项目以审批部门批准的为准），ＫＴＶ，场地出租；卷烟、雪茄烟、罚没烟草（有效期至２０１６年４月３０日）；食品加工销售",广西,南宁,"南宁市武鸣区城春霞路30号"
广西筑臻商贸有限公司,9145010076582807X2,2004-09-22,N/A,N/A,"1,000(万元人民币)","销售",广西,南宁,"南宁市金湖路49号圣展独立公社A栋A0905号房"
合浦艺丰房地产开发有限公司,91450521765829232Y,2004-09-22,N/A,N/A,"100(万)","房地产开发、经营（凭有效资质证书经营）",广西,北海,"合浦金鸡路三巷４２号"
广西南宁友萃商贸有限责任公司宾阳印刷分公司,91450126765828635B,2004-09-23,N/A,N/A,"N/A","其它印刷品印刷",广西,南宁,"宾阳县黎塘土产公司内"
广西南宁拓步科技有限公司,91450103765829929L,2004-09-23,N/A,N/A,"100(万元人民币)","计算机系统集成设计及安装，计算机应用和信息网络工程，计算机网络综合布线，计算机软硬件销售、开发、技术服务及维护，安防系统工程；照明、舞台灯光控制网络系统工程及其设备安装、销售（以上项目涉及资质证的，凭资质证经营）；计算机配件、机房设备、计算机网络设备、办公设备及耗材、仪表仪器、五金交电（除助力自行车）、建筑装饰材料（除危险化学品及木材）、电线电缆、电力设备（除国家专控外）、工艺礼品（除金银饰品）的销售；会展服务；自营和代理一般经营项目商品和技术的进出口业务，许可经营项目商品和技术的进出口业务须取得国家专项审批后方可经营",广西,南宁,"南宁市民族大道135号水电大厦11楼"
全州柳铺水电有限公司,91450324765836942T,2004-09-23,N/A,N/A,"2,500(万元人民币)","电能生产和销售、水电项目的开发。",广西,桂林,"全州县全州镇三江路11号"
广西南宁川宁工贸有限责任公司,91450100765830057R,2004-09-23,N/A,N/A,"100(万元人民币)","销售：机电设备（国家有专项规定的除外）、电气动工具、仪器仪表、五金交电（除助力自行车）、量具刀具（除国家禁止及限制的项目外）、化工设备、日用百货、服装鞋帽、建筑及装饰材料（除危险化学品）、原生中草药、农业机械、农副土特产品（仅限初级农产品）、农业用具、食品（具体项目以审批部门批准的为准）、不再分包装的农作物种子、肥料、农膜、汽车，农林科技的技术开发、技术服务、技术咨询、技术转让；对工业产品技术的投资；工业产品技术研究、开发、推广；产品包装设计；林木、农作物种植技术推广、技术服务、技术咨询，农业种植",广西,南宁,"南宁市青秀区七星路125号新民大厦B座B1003号房"
广西南宁梦之岛物业服务有限公司,914501037689164116,2004-09-23,N/A,N/A,"50(万元人民币)","物业服务",广西,南宁,"南宁市青秀区金湖北路67号梦之岛广场9楼910房"
广西南宁市九龙商务服务有限责任公司,914501037658310846,2004-09-23,N/A,N/A,"10(万元人民币)","代写文书，企业财务咨询，财务电算化推广，企业财务策划，企业工商注册代理，企业管理策划，企业管理咨询，商品信息咨询，网页及网站设计",广西,南宁,"南宁市青秀区长湖路20号绿城国际1704号"
广西和美房地产开发有限责任公司百色分公司,914510007658348089,2004-09-23,N/A,N/A,"N/A","在主体企业的委托下开展房地产开发、经营与管理业务。",广西,百色,"百色市江滨路A63号1、2层"
南宁市玲莉餐饮有限公司长湖店,91450103MA5KJXDE5B,2004-09-23,N/A,N/A,"N/A","餐饮服务（具体项目以审批部门批准的为准），快餐配送服务",广西,南宁,"南宁市长湖路8号一楼4、5、6号商铺"
广西劲力石油化工安装工程有限公司,914507047658324313,2004-09-23,N/A,N/A,"500(万)","石油化工设备管道安装工程专业承包（暂定）叁级。钢结构制作及民用给排水安装工程",广西,钦州,"钦州市钦州港柳州北路１号"
南宁市一路行法律咨询服务有限公司,91450102765835990C,2004-09-23,N/A,N/A,"10(万)","商品信息咨询，房地产信息咨询，房地产交易居间、代理、行纪，交通信息咨询、商务信息咨询、法律政策信息咨询",广西,南宁,"南宁市兴宁区三塘镇降桥村13号"
南宁华图普森激光刀模有限公司,91450100765832300E,2004-09-23,N/A,N/A,"60(万)","激光刀模、制模版设计、制作、销售；销售：电脑，纸张，印刷材料（危险化学品除外），文化用品，塑料制品",广西,南宁,"南宁市西乡塘区高新二路1号广西大学科技园4号厂房东头"
南宁市成进科技咨询有限公司,91450102765837195W,2004-09-23,N/A,N/A,"10(万元人民币)","科技企业策划咨询，商品信息咨询（除国家有专项规定外），企业形象策划（不含广告），科技项目申报代理，市场调查（除国家有专项规定外），文案设计",广西,南宁,"邕武路22号2栋4单元5号"
南宁九思畜牧有限公司,91450103765831041Q,2004-09-24,N/A,N/A,"50(万)","公司经营范围：研发、生产与销售饲料原料、发酵饲料产品、饲料原料添加剂、混合型饲料添加剂、添加剂预混合饲料、浓缩饲料、全价饲料、微生物菌剂；生物技术研发，养殖技术咨询；销售：家禽、牲畜。",广西,南宁,"南宁市兴宁区五塘镇广西国有高峰林场六塘林产品贮存中心园区一号厂房"
南宁协和医院有限责任公司,91450100765837259X,2004-09-24,N/A,N/A,"550(万)","预防保健科、内科、外科、妇产科、儿科（门诊）、口腔科（门诊）、皮肤病专业、急诊医学科、麻醉科、医学影像科、医学检验科、中医科（二级科目详见医疗机构副本诊疗科目核准记录）。中药学研究，生物技术开发、技术咨询及技术转让；医疗器械的技术开发",广西,南宁,"南宁市江南区五一路156号"
广西北部湾银行股份有限公司南宁市武鸣支行,91450122765841856Y,2004-09-24,N/A,N/A,"N/A","吸收公众存款，办理国内结算，办理票据贴现，代理发行、代理兑付、承销政府债券，代理收付款项及代理保险业务，经中国人民银行批准的其他业务。",广西,南宁,"广西壮族自治区南宁市武鸣区兴武大道163号房地产开发公司大厦一楼"
南宁武鸣区泰明电气工程有限公司,91450122765836168T,2004-09-24,N/A,N/A,"228.9700(万)","电力器材、建材",广西,南宁,"南宁市武鸣区标营社区定罗路6-2号新城花园22幢2号"
南宁市武鸣瑞安工贸物业服务有限公司,9145012276583615XT,2004-09-24,N/A,N/A,"300(万元人民币)","小区物业管理（具体项目以审批部门批准的为准）。电器维修，输配电工程的设备、材料及配件的计划编制、选型、选厂，输配电设备、文化用品购销。设计、制作、代理、发布广告（印刷品广告除外），其他印刷品印刷",广西,南宁,"南宁市武鸣区城厢镇标营社区定罗路6-2号(新城花园5栋1单元1楼)"
南宁苑丰园林工程有限公司,91450100MA5KKJY44B,2004-09-24,N/A,N/A,"200(万)","城市园林工程建设与投资（房屋建筑施工除外）、园林绿化、庭院小区绿化、旅游景区开发投资、水电安装、园林工程维护、农业林业投资开发（凭资质证经营）。造林苗木、经济林苗木、城镇绿化苗木、花卉种植销售（有效期至２０１6年1０月28日），园林机械、旅游工艺品生产销售。珍稀植物、单性木兰种质资源的生物技术研发；单性木兰提取分离物（单性木兰植物精油、罗勒烯、月桂烯、金合欢烯等）的生产、销售",广西,南宁,"南宁华侨投资区定斜村后苑丰园林公司花卉基地管理房"
广西新昌置业有限公司,91450700765830305E,2004-09-24,N/A,N/A,"1,180(万元人民币)","建筑材料、金属材料、机电产品、化工产品（除危险品）、家用电器、五金交电、水暖器材、日用百货、海产品、橡胶及制品、农副产品的销售；商品信息、中介服务；农林机耕服务，林业种植；水泥及水泥熟料、水泥的配套拌料",广西,钦州,"钦州市恒商大酒店1001室"
南宁市云泽科贸有限公司,91450103765830962R,2004-09-24,N/A,N/A,"50(万元人民币)","销售",广西,南宁,"南宁市青秀区民族大道82号嘉和·南湖之都12层1224号房"
合浦宏鑫货物运输有限责任公司,91450521765839692K,2004-09-24,N/A,N/A,"99(万元人民币)","普通货运",广西,北海,"合浦县廉州大道北河街口处地块编号Ｃ３Ｄ－Ｉ－１"
广西南宁市友能商贸有限公司,914501027658309038,2004-09-24,N/A,N/A,"50(万)","农副土特产品（除粮油）；工艺礼品，电子产品，文化用品，办公用品，电脑耗材，建筑装饰材料（除危险化学品）；机械设备，电力设备，机电设备，日用百货，通讯产品",广西,南宁,"南宁市明秀东路88号荣和·山水绿城B1组团13号楼A座28-A号"
平果壮族嘹歌文化发展有限责任公司,91451023765835464X,2004-09-24,N/A,N/A,"20(万元人民币)","平果壮族嘹歌等民俗民间文化的宣传、广告、音像、包装、推介、展演等；国内版图书、报刊零售。",广西,百色,"平果县马头镇龙阳街152号"
广西万江环境工程有限公司,914501007658306203,2004-09-24,N/A,N/A,"505(万)","环保工程专业承包叁级，环保工程图纸的设计（以上经营项目凭资质证经营）；水处理设备及环保设备的生产和销售，机电设备、自动化控制设备、垃圾焚烧处理设备、建筑材料（除危险化学品及木材），水溶性涂料（除危险化学品），仪器仪表，日用百货，通讯控制设备",广西,南宁,"南宁市园艺路北湖76号"
百色市绿洲阳光餐饮有限责任公司,91451002765845363F,2004-09-25,N/A,N/A,"30(万)","中餐，西餐，快餐服务；酒、饮料、预包装食品销售。",广西,百色,"百色市中山二路8号"
南宁百农科技农资连锁经营有限公司双桥第二服务部,91450122794334458F,2004-09-26,N/A,N/A,"N/A","农业种植技术服务、转让，复配农药",广西,南宁,"武鸣县双桥镇中街1号"
北海鼎鑫物业服务有限公司,91450500799737918F,2004-09-27,N/A,N/A,"50(万元人民币)","物业管理服务（凭许可证经营），房地产信息咨询，房地产中介、代理",广西,北海,"北海市新建二巷58号新源文明苑2幢三单元401号"
广西南宁功喜源健康产业有限公司,914501037658309464,2004-09-27,N/A,N/A,"200(万)","养生保健知识咨询；农产品种植；对医药保健品、医疗器械、健身器械的技术开发、技术咨询、技术转让、技术服务；销售：原生中草药、运动服装、海产品；批发兼零售：食品",广西,南宁,"南宁市青秀区双拥路30号南湖名都广场B栋A单元1804号"
北海润森贸易有限责任公司,91450500765833602H,2004-09-27,N/A,N/A,"50(万元人民币)","水泥、建筑装饰材料、机械设备、原木、锯材、木门窗、人造板购销、日用百货、服装鞋帽、计算机及其外围设备、家用电器、针纺织品、办公用品及自动化设备、五金交电销售；经济信息咨询服务",广西,北海,"北海市四川南路贵州开发区贵都花园Ｂ３－４号"
柳州佳力商贸有限责任公司,91450203765833944Q,2004-09-27,N/A,N/A,"30(万)","电气机械及器材、通用设备及配件、金属切削机床、家用电器、日用品的零售；电机、变压器维修；房屋门面租赁服务。",广西,柳州,"柳州市柳石路141号11栋1层1-1号"
天翌(广西)通信发展有限公司,91450100759796497J,2004-09-27,N/A,N/A,"2,479.6728(万)","软件、系统集成的开发、生产和销售；电信业务代理（限于代收费服务）、承接外包服务（含信息技术外包服务、呼叫中心外包服务及业务流程外包服务）；纺织品、服装、日用百货、文体用品、家用电器、电子产品（除国家专控产品）、家具（除木制品）及装潢材料（除危险化学品及木材）的销售（凡涉及配额、许可证、专项管理的商品，按国家专项管理规定办理）；批发兼零售：乳制品（不含婴幼儿配方乳粉）、预包装食品兼散装食品",广西,南宁,"南宁市科园大道２５－１号科创大厦第８层８２０８号"
南宁瑞红百货有限公司,91450103765832247X,2004-09-27,N/A,N/A,"30(万)","批发兼零售：日用百货、化妆品、洗涤用品、美容产品、服装、工艺品、电脑及周边配件；商务信息咨询。",广西,南宁,"南宁市青秀区仙葫大道东135号枫丹丽舍香庭园2号楼1单元201号"
广西康全药业连锁有限公司南宁园春分店,91450103765840343G,2004-09-27,N/A,N/A,"N/A","零售：中药饮片、中成药、化学药制剂、抗生素、生化药品、生物制品（除疫苗和血液制品）（有效期至2019年10月16日）；日用百货、化妆品、办公用品、体育用品、五金交电、建筑装饰材料",广西,南宁,"青秀区长园路8号大地华城S1-01号商铺"
柳州市浩东物资有限公司,914502007791060001,2004-09-27,N/A,N/A,"5,000(万)","建筑材料、五金交电、日用百货、钢球、饲料、鱼苗、渔具、化肥、不再分装的包装种子的销售。",广西,柳州,"柳州市飞鹅二路96号"
湖南省第六工程有限公司广西分公司,91450103765839545B,2004-09-27,N/A,N/A,"N/A","凭总公司资质联系经营业务。",广西,南宁,"南宁市青秀区双拥路36-1号绿城画卷A座A1307室"
桂林凯宁七星大酒店有限公司,914503007658362808,2004-09-27,N/A,N/A,"1,100(万元人民币)","客房；餐饮服务；日用百货、工艺美术品的销售；卷烟、雪茄烟、包装酒类产品、定型包装食品、土特产、相机、胶卷、旅游服饰零售；旅游咨询服务。",广西,桂林,"桂林市漓江路17号"
南宁高合农化有限责任公司,914501007658305677,2004-09-27,N/A,N/A,"50(万)","农药（除危险化学品及禁售农药）；化肥研究开发；植物生产调节剂，农用器具，肥料，种子",广西,南宁,"南宁市西乡塘区科德西路7号嘉士·涌金广场0703号"
广西玉林市健正药业有限公司第一药房,91450900773878368N,2004-09-27,N/A,N/A,"N/A","中药饮片、中成药（注射剂除外）、化学药制剂（注射剂除外）、抗生素（注射剂除外）、生化药品（注射剂除外）、生物制品（疫苗、血液制品、注射剂除外）、第二类医疗器械（不含体外诊断试剂）、保健食品的零售（凭有效许可证经营）；预包装食品、乳制品（含婴幼儿配方乳粉）、酒类的批发兼零售；五金交电、家用电器、日用百货",广西,玉林,"玉林市名山开发区第60号"
北海市南海洋石英砂有限公司,91450500765839051W,2004-09-27,N/A,N/A,"3,100(万元人民币)","石英砂露天开采",广西,北海,"北海市铁山港区兴港镇石头埠居委会生盐田村东侧"
北海畅通商务代理服务有限责任公司,91450500765841549Y,2004-09-27,N/A,N/A,"10(万元人民币)","商务代理服务",广西,北海,"市长青路田园大酒店临街铺面第六号（长青市场内）"
南宁海擎科技有限公司,91450100765831391K,2004-09-27,N/A,N/A,"500(万元人民币)","计算机软硬件的技术开发、技术服务、技术转让；数字化图书加工处理；电脑配件、计算机软件、计算机耗材、办公设备；网络设备、五金交电、建筑材料（危险化学品除外）、机械电器设备、通信设备、电子设备、安防器材、机电产品（除小轿车）、文体用品、健身器材、体育器材、仪器仪表、教学设备、实验室设备、化工原料及产品",广西,南宁,"南宁市青秀区民族大道155号荣和山水美地东盟国际C座23-B号"
贵港市华港农牧发展有限公司,91450800765829806C,2004-09-27,N/A,N/A,"480(万元人民币)","对农业、林业、牧业、渔业的投资及技术服务推广；农副产品初加工；配合饲料、浓缩饲料生产、销售",广西,贵港,"贵港市港南区横岭乡开发区"
罗城仫佬族自治县森隆达木业有限公司,9145122576583244XT,2004-09-27,N/A,N/A,"50(万元人民币)","原木收购；锯材、拼接板、旋切单板、木片加工、销售",广西,河池,"罗城县外贸公司出租仓库"
广西南宁市大西南木材有限责任公司,91450107765831025W,2004-09-27,N/A,N/A,"50(万)","销售：木材（凭许可证在有效期内经营，具体项目以审批部门批准的为准）、家具、塑料制品（除一次性发泡塑料及超薄塑料袋）、五金交电、家用电器；场地租赁；废旧物资回收（除国家有专项规定外）；以下项目限分支机构经营：木材加工",广西,南宁,"南宁市西乡塘区邕隆公路边19公里处房屋"
北海吉祥家政服务有限公司,91450500765830292E,2004-09-27,N/A,N/A,"50(万元人民币)","家庭服务",广西,北海,"市广东路九号一楼"
广西梧州嘉华置业有限公司,91450400763085698C,2004-09-27,N/A,N/A,"2,000(万元人民币)","土地开发、房地产开发经营及其配套设施的建设，物业管理；生产建筑材料、室内外装饰材料；销售本公司产品",广西,梧州,"广西梧州市龙圩区龙圩镇广场三路2号"
阳朔县鑫富铁合金冶炼有限公司,91450321768925959C,2004-09-27,N/A,N/A,"100(万元人民币)","硅锰合金冶炼、销售。",广西,桂林,"阳朔县福利镇老梧村"
广西卫虹医药电子商务有限公司南宁营业部,914501037738527156,2004-09-27,N/A,N/A,"N/A","凭公司资质联系业务；医疗信息咨询服务，电子计算机软硬件的技术开发、技术咨询、技术服务、技术培训；电子计算机及配件，电子元器件的销售。",广西,南宁,"南宁市民族大道６３－１号欧景城市广场ＴＢ３０１"
柳州新鸿消防器材有限责任公司,9145020476583148XX,2004-09-27,N/A,N/A,"100(万)","消防器材零售批发及维修，五金产品、电子产品、金属材料（不含贵稀金属及钨、锡、锑），塑料制品（一次性塑料餐具除外）、报警设备、交通安全设施、阀门、防火阻燃材料、水暖器材、机械设备、电力设备、通讯设备、化工产品（危险化学品除外）、钢材、钢板、镀锌水管、PVC水管及配件、建筑材料、日用百货、办公用品的销售；生产加工消火栓箱、灭火器箱。",广西,柳州,"柳州机车车辆厂消防队院内"
桂林天立医药科技服务有限公司,9145030576583041X3,2004-09-28,N/A,N/A,"10(万元人民币)","医药技术开发、咨询服务。",广西,桂林,"桂林市漓江路18号"
南宁市杰达广告策划有限公司,91450102765833071U,2004-09-28,N/A,N/A,"300(万元人民币)","设计、制作、代理、发布国内广告，对建筑业、餐饮业、畜牧业、水产业、农业、林业、市场的投资，停车场服务；销售",广西,南宁,"南宁市望州路289-39号3楼1、2室"
中国移动通信集团广西有限公司桂平分公司社步营业厅,91450881310121502N,2004-09-28,N/A,N/A,"N/A","接受隶属公司委托联系、洽谈以下业务：基础电信业务、增值电信业务",广西,贵港,"广西桂平市社步镇粮所开发区"
中国移动通信集团广西有限公司桂平分公司中沙营业厅,91450881310121940B,2004-09-28,N/A,N/A,"N/A","接受隶属公司委托联系、洽谈以下业务：基础电信业务、增值电信业务",广西,贵港,"广西桂平市中沙镇中沙街"
广西赛标电控设备有限公司,914501007658330559,2004-09-28,N/A,N/A,"1,000(万元人民币)","电控设备加工、五金交电加工；销售",广西,南宁,"南宁市江南区旱塘路老虎岭"
融水县盛源工艺木制品厂,91450225765846657B,2004-09-28,个人独资企业,N/A,"N/A","家具制造、单板加工、销售。",广西,柳州,"融水２７０大院"
桂林市爵色娱乐有限责任公司,91450300763089891R,2004-09-28,N/A,N/A,"60(万)","酒吧",广西,桂林,"桂林市总工会展览中心一楼北面"
中国移动通信集团广西有限公司桂平分公司大湾营业厅,91450881310121406D,2004-09-28,N/A,N/A,"N/A","接受隶属公司委托联系、洽谈以下业务",广西,贵港,"广西桂平市大湾邮政所对面"
广西力图文化传播有限公司,91450100765830858A,2004-09-28,N/A,N/A,"500(万元人民币)","文化传播与交流、文化艺术交流与合作、网站策划",广西,南宁,"南宁市鲤湾路５号盛源大厦第六层"
南宁南电子木新能源技术有限公司,914501027658311801,2004-09-28,N/A,N/A,"50(万元人民币)","检测仪器、仪表、自动化控制系统、工业民用电子产品、计算机软硬件的技术开发、技术服务、技术咨询、技术转让、加工销售。电脑整机及配件，计算机网络系统集成，工业控制产品，交、直流电源设备，高、低压电气设备，蓄电池，办公设备及耗材，文化用品，建筑材料（除危险化学品），沥青，重油，润滑油，化工产品（除国家行业标准剧毒物品名表GA58-93和国家标准公布的危险货物品名表GB12268外），五金交电，机电设备，通信器材设备的销售及售后服务",广西,南宁,"南宁市民主路6-6号阳光新都C栋5层511号房"
桂林市中星广告装潢有限责任公司,9145030576583252X8,2004-09-28,N/A,N/A,"10(万)","国内各类广告设计、制作、发布、代理；室内外装潢、设计；平面设计、园林景观规划；LED显示屏；亮化工程。",广西,桂林,"桂林市七星区空明西路１３－１号留学人员创业园Ｂ５０３"
中国移动通信集团广西有限公司桂平分公司厚禄营业厅,91450881310122062P,2004-09-28,N/A,N/A,"N/A","接受隶属公司委托联系、洽谈以下业务：基础电信业务、增值电信业务",广西,贵港,"桂平市厚禄乡白马圩市场对面"
钦州市鑫港物流有限公司,91450702765831797Q,2004-09-28,N/A,N/A,"100(万元人民币)","货物运输、仓储",广西,钦州,"钦州市建业街15号"
广西容县电力有限公司,914509217658452401,2004-09-28,N/A,N/A,"4,402(万)","经营、管理容县供电营业区内的供电业务，趸购电力电量，城镇、农村电网建设、改造；水力发电投资开发经营；发供电设备、材料、配件零售；水利综合经营、水利发供电技术服务咨询、电能计量装置的校验、检定、安装、维修；电力设施承装类四级、承修类四级；提供劳务、房屋租赁、场地租赁服务。",广西,玉林,"容县容州镇城南街150号"
桂林市又好又多连锁超市有限公司施家园便利店,91450300765834314L,2004-09-28,N/A,N/A,"N/A","批零兼营日用百货、土特产品，农副产品、家用电器，零售预包装食品、乳制品",广西,桂林,"桂林市七星区施家园路37号10-14"
广西梧州柏迪体育发展有限责任公司柏迪球馆,91450403765844424K,2004-09-28,N/A,N/A,"N/A","体育活动，文具、体育用品的零售；预包装食品零售。",广西,梧州,"梧州市桂江二桥西岸"
