桂林三木建筑劳务承包有限责任公司,91450305763068847Q,2004-06-15,N/A,N/A,"50(万)","土木建筑工程及装饰工程的劳务承包、周转材料租赁、建筑机械租赁、房屋拆迁、园林绿化施工（以上项目需资质证的凭资质证经营）；钢结构制作、安装；铁件加工、销售",广西,桂林,"桂林市空明西路4号"
贵港市大圩供销合作社街口综合服务站,91450800MA5KL1QP1L,2004-06-15,集体分支机构(非法人),N/A,"N/A","化肥、复配农药、农膜、农具、农作物种子销售。",广西,贵港,"港北区大圩镇街口"
广西百色银海发电有限公司,914510217630711061,2004-06-15,N/A,N/A,"23,000(万元人民币)","火力发电及其余热利用，国家鼓励的资源综合利用；水蒸汽对外供应及电力副产品",广西,百色,"田阳县头塘镇二塘村"
防城港森发木业有限公司,91450603763069970M,2004-06-17,N/A,N/A,"50(万元人民币)","人造板、木片、单板、木材成品、半成品加工销售",广西,防城港,"防城区那良镇大河村"
全州县灿金铁合金有限责任公司,91450324763069276E,2004-06-17,N/A,N/A,"50(万元人民币)","生产销售：硅锰、锰铁、富锰碴、炭锰；电炉炉料、锰矿石、莹石、硅石购销；日用杂品（烟花爆竹除外）零售",广西,桂林,"全州县龙水镇坦口村委"
广西南宁跃胜蓄电池商贸有限公司一分公司,91450102765806735A,2004-06-17,N/A,N/A,"N/A","销售：蓄电池及配件、汽车配件、五金交电、日用百货。",广西,南宁,"南宁市明秀东路4-2号"
广西广播电视信息网络股份有限公司南宁分公司,91450103763071958G,2004-06-17,N/A,N/A,"N/A","广播电视网络的设计、建设、改造、经营、维护、管理、多功能开发及技术服务；广播电视节目和网络信息传输服务；广播电视设备、电子设备、信息设备、教学设备、机电设备的购销、租赁；服务器托管服务；计算机技术开发、技术咨询、信息咨询与系统维护；计算机软硬件及辅助设备的销售、安装、设计与施工；网络综合布线；办公设备、通讯器材、数码产品、家用电器的销售。",广西,南宁,"南宁市新城区葛村路25号广电中心"
广西鑫庆房地产开发有限公司,914505007630691379,2004-06-17,N/A,N/A,"1,000(万元人民币)","房地产开发经营",广西,北海,"北海市广东路以西、站前路以北南方明珠小区A1幢12号房"
广西广播电视信息网络股份有限公司灌阳分公司,91450327763070314R,2004-06-17,N/A,N/A,"N/A","广播电视网络的设计、建设、改造、经营、维护、管理、多功能开发与技术服务；广播电视节目和网络信息传输服务；广播电视设备、电子设备、信息设备的购销、租赁；设计、制作、发布、代理国内各类广告；服务器托管服务；计算机信息系统集成临时三级；计算机技术开发、技术咨询、信息咨询与系统维护；计算机软硬件及辅助设备的销售、安装、设计与施工；安防工程壹级；办公设备、家用电器、日用百货的销售。",广西,桂林,"灌阳镇胜利路5号"
南宁市尔松科技有限公司,914501007630705688,2004-06-17,N/A,N/A,"2,000(万元人民币)","计算机软硬件技术开发、技术服务、技术咨询；计算机软硬件及网络产品的销售及售后服务，计算机信息系统集成，综合布线，维修电子产品；安防智能化系统、监控系统设计、安装；批发兼零售：通讯设备及配件（除国家专控产品）、办公设备耗材、办公用品、办公桌椅（除木制）、建筑装饰材料（除危险化学品及木材）；销售：电子计算机配套设备及接口设备、日用百货、服装、劳保用品；警用设备（除国家专控产品）、机电设备（除九座以下乘用车），汽车配件，钢材，农机，I类医疗器械，五金交电；自营和代理一般经营项目商品和技术的进出口业务；许可经营项目商品和技术的进出口业务须取得国家专项审批后方可经营",广西,南宁,"南宁市兴宁区玉蟾路3号金源城·金源悦府38号楼2单元202号"
南宁市宇航科技开发有限公司,91450100763070437C,2004-06-17,N/A,N/A,"500(万)","计算机软硬件的技术开发、技术咨询、技术服务、技术转让；数据机房装修（凭资质证经营）；计算机系统集成，数据容灾备份，网络综合布线；销售：计算机软硬件及其辅助设备、安全防范、楼宇自控、智能小区系统产品及设备、智能自动化设备及耗材、消防设备、办公设备及耗材、电子产品（除国家专控产品外）、通讯产品",广西,南宁,"南宁市青秀区民族大道63-1号欧景城市广场T4-0401号"
广西桂平市食品有限责任公司凤岭综合养殖场,91450881MA5L26NGXE,2004-06-17,有限责任公司,N/A,"N/A","生猪的养殖、销售。",广西,贵港,"广西桂平市南木镇凤岭示范场"
柳州富斯特工业气体有限责任公司,91450200763071456P,2004-06-17,N/A,N/A,"1,050(万)","二氧化碳【压缩的】、二氧化碳【液化的】、氮【压缩的】、氮【液化的】、氩【压缩的】、氩【液化的】、氧【压缩的】、氧【液化的】、液化气、丙烷、乙炔【溶于介质的】、天然气【液化的】、干冰、液氨、甲醇、甲醛、硫酸的批发",广西,柳州,"柳州市北雀路69号柳北文化商业广场3栋14-13号"
钦州美东投资置业有限责任公司,914507007630699384,2004-06-17,N/A,N/A,"14,540(万元人民币)","旅游项目开发；销售旅游产品；商品信息咨询；电子竞技运动信息咨询、赛事策划。",广西,钦州,"钦州市犀牛脚镇麻兰岛"
靖西市禄峒供销合作社驻新靖镇经营部,91451025MA5KU1X19K,2004-06-17,集体分支机构(非法人),N/A,"N/A","化学肥料、农具农机、农膜、低毒农药",广西,百色,"靖西市新靖镇城西路检察院旁"
广西好运来物业服务有限公司,914501037630704100,2004-06-17,N/A,N/A,"200(万元人民币)","物业管理服务、园林绿化工程、室内外装饰装修工程设计与施工、房屋防水补漏工程（以上凭资质证经营）；搬家服务、汽车租赁、房屋及道路清洁服务",广西,南宁,"南宁市东葛路１８－１号嘉和自由空间Ａ座２９１０室"
广西广播电视信息网络股份有限公司宁明分公司,9145142276307178XM,2004-06-17,N/A,N/A,"N/A","接受公司委托经营。",广西,崇左,"宁明县广播电视局内"
广西广播电视信息网络股份有限公司上思分公司,9145062176308445XE,2004-06-17,N/A,N/A,"N/A","广播电视网络的设计、建设、运营、改造、经营、维护、管理、多功能开发及技术服务；广播电视节目和网络信息传输服务；广播电视设备及信息设备的购销",广西,防城港,"上思县思阳镇中华路"
南宁市红木棉运输有限责任公司,914501007630694790,2004-06-17,N/A,N/A,"1,000(万元人民币)","汽车配件的销售，对运输业的投资，出租汽车客运",广西,南宁,"南宁市兴宁区二塘村北面(十组)东面鸡村十组"
恒拓集团广西圣康制药有限公司,91450122763070883P,2004-06-17,N/A,N/A,"1,000(万)","硬胶囊剂、片剂、颗粒剂（含中药前处理和提取）生产销售",广西,南宁,"广西—东盟经济技术开发区武华大道158号"
靖西市食品公司壬庄食品站,91451025MA5KE64C0L,2004-06-17,N/A,N/A,"N/A","日用百货、针织品、日用化学品、日用杂品、五金工具、建筑五金、自行车及零件、家用电风扇、灯泡、灯管、民用灯具、线圈、化工产品",广西,百色,"靖西市壬庄乡壬庄街"
南宁图联脉络科技有限公司,914501037630703499,2004-06-17,N/A,N/A,"100(万元人民币)","计算机软硬件及网络系统集成的技术服务、技术转让、技术咨询、技术开发；计算机综合布线；销售：计算机硬件及零配件、办公设备及耗材、通讯产品及设备（国家专项规定的除外）、电子产品；劳务分包、测绘服务、工程测量",广西,南宁,"南宁市建政路４９－２３号北纬２８"
南宁市图成物资有限责任公司,914501007630703226,2004-06-17,N/A,N/A,"50(万)","销售：金属材料、建筑材料（除危险化学品及木材）、机电产品（除九座以下乘用车及助力自行车）、五金产品",广西,南宁,"南宁市虎邱城北钢材市场第Ｋ３６－２栋货场号铺面"
南宁普洛森经贸有限公司,91450100763071333H,2004-06-18,N/A,N/A,"50(万元人民币)","一般经营范围：日用百货、文化用品（除音像制品及书报刊）、建筑材料",广西,南宁,"南宁经济技术开发区长凯路16号"
大新县新钧发电有限责任公司,91451424763070613X,2004-06-18,N/A,N/A,"76(万元人民币)","水力发电",广西,崇左,"大新县恩城乡新圩村钧屯"
北海清意文化艺术交流发展有限责任公司,91450500763089373U,2004-06-18,N/A,N/A,"190(万元人民币)","文化艺术交流策划（涉及前置审批的凭许可证或批文经营）、经济信息咨询服务；房屋租赁",广西,北海,"市北京路商业街8号中环广场603号"
广西聚骄鸣校教育策划咨询有限公司,914501007630704457,2004-06-18,N/A,N/A,"500(万)","教育信息咨询；人才信息咨询，企业管理咨询；市场营销策划，公共关系策划，文化活动策划；市场信息咨询与调查（除国家有专项规定外）；户外拓展策划服务，职业中介服务（凭许可证在有效期内经营，具体项目以审批部门批准的为准），创意服务，展览展示服务；品牌设计；设计、制作、代理、发布国内各类广告；网上贸易代理（除国家有专项规定外）；出版物批发及零售（凭许可证在有效期内经营，具体项目以审批部门批准的为准）；销售：教学设备、办公设备、办公文化、体育用品、文体用品、电子产品（除国家专控产品）、乐器、玩具、游艺器材及娱乐用品、户外用品、旅游用品、运动器材、健身器材、字画",广西,南宁,"南宁市总部路3号中国-东盟科技企业孵化基地二期9号厂房三层305号房"
钦州市永立食品有限责任公司,91450700759773308G,2004-06-18,N/A,N/A,"50(万香港元)","干制水产品、冷冻水产品购销经营。",广西,钦州,"钦州市钦南区犀牛脚渔船修造厂"
十一冶建设集团有限责任公司第一建筑安装工程分公司,91450200763072985B,2004-06-18,N/A,N/A,"N/A","接受主体公司委托，为主体公司接洽业务。",广西,柳州,"柳州市柳太路二区"
中国移动通信集团广西有限公司来宾分公司交通营业厅,91451300682133440A,2004-06-18,N/A,N/A,"N/A","移动电话通信业务",广西,来宾,"来宾市柳来路149号"
柳州劲达客运有限责任公司,914502237630701116,2004-06-18,N/A,N/A,"50(万)","班车客运（县内、县际、市际、省际）、包车客运",广西,柳州,"鹿寨县鹿寨镇城南开发区"
广西天农农业发展有限公司,9145142576306976X1,2004-06-18,N/A,N/A,"500(万元人民币)","非剧毒化学品农药销售；化肥、农膜、农机器械、农副产品、饲料批发零售。",广西,崇左,"天等县天等镇天宝南路０５７号"
广西广播电视信息网络股份有限公司环江分公司,9145122676308023X4,2004-06-18,N/A,N/A,"N/A","广播电视网络的设计、建设、改造、经营、维护、管理、多功能开发及技术服务；广播电视节目和网络信息传输服务；广播电视设备、电子设备、信息设备的购销、租赁；服务器托管服务；计算机信息系统集成临时三级；计算机技术开发、技术咨询、信息咨询与系统维护；计算机软硬件及辅助设备的销售、安装、设计与施工；安防工程壹级；办公设备、家用电器的销售。",广西,河池,"环江县思恩镇桥东路235号"
广西玉林玉柴汽车维修有限公司北环汽配销售部,91450900763074956X,2004-06-18,N/A,N/A,"N/A","机电产品、五金交电、汽车零部件、摩托车零部件、农业机械及其配件的批发、零售。",广西,玉林,"玉林市一环北路玉柴机电汽车城内西侧"
南宁市中鹿出租汽车有限公司,91450100763071261Q,2004-06-18,N/A,N/A,"1,000(万元人民币)","出租汽车客运",广西,南宁,"南宁市西乡塘区北湖南路24号元亨园商住楼三楼302室"
广西东润房地产开发有限公司,91450100763070728F,2004-06-18,N/A,N/A,"2,000(万元人民币)","房地产开发经营",广西,南宁,"南宁市青秀区金浦路16号汇东国际F座28层"
钦州市鸿兴农贸市场开发有限公司,914507007630733632,2004-06-18,N/A,N/A,"1,000(万元人民币)","提供市场服务设施；市场摊位出租服务；市场信息咨询、车辆保管；木材、家具、建筑材料、装饰材料、钢材、五金交电、日用百货、家用电器、矿产品、农副产品、饲料的销售；水产品养殖和销售；花卉种植和销售。",广西,钦州,"钦州市新兴西路便民市场内"
兴安华江大正竹业制品厂,91450325763089138Q,2004-06-18,个人独资企业,N/A,"N/A","竹制品。",广西,桂林,"华江千祥包岭口"
广西居雅空间文化有限公司,91450100763072643T,2004-06-18,N/A,N/A,"1,800(万)","雕刻艺术创作服务（具体项目以审批部门批准为准）；文艺创作与表演（具体项目以审批部门批准为准）；城市及道路照明工程、钢结构工程、市政公用工程、水电安装工程、室内外装饰装修工程、园林景观工程、污水处理工程、环保工程的设计与施工，体育场地设施工程专业承包、建筑装饰装修工程专业承包（以上工程项目凭资质证经营）；建筑工程勘察（凭资质证经营）；花卉、苗木（具体项目以审批部门批准为准）种植；工艺品制作；设计、制作、代理、发布国内各类广告；企业形象策划、展会展览服务；清洁服务；销售：建筑材料（除危险化学品）、建筑管材及配件、装饰材料（除危险化学品）、机电产品、通讯产品（除国家专控产品）、工艺品、办公用品、五金交电、计算机软硬件、水暖设备、环保设备、电子科技产品、橡塑制品",广西,南宁,"南宁市中越路7号东盟财经中心金旺角·CASA国际公馆A座1619室"
桂林市金麦园食品有限责任公司美食城分店,91450304763071683U,2004-06-18,N/A,N/A,"N/A","零售预包装食品、乳制品",广西,桂林,"桂林市中山南路59号"
广西南宁强源物资有限公司,91450100763071253X,2004-06-18,N/A,N/A,"5,000(万)","销售：金属材料（除国家专控产品）、钢管、建筑材料（除危险化学品）、装饰材料（除危险化学品）、消防器材",广西,南宁,"南宁市西乡塘区秀安路15号南宁市虎邱城北钢材市场A15栋1-22号"
广西广播电视信息网络股份有限公司灵川分公司,914503237630758871,2004-06-18,N/A,N/A,"N/A","广播电视网络的设计、建设、改造、经营、维护、管理、多功能开发及技术服务；广播电视节目和网络信息传输服务；广播电视设备及信息设备的购销",广西,桂林,"灵川县定江镇八里六路68号"
钦州市中邦广告装饰设计工程有限公司,91450702763068935G,2004-06-18,N/A,N/A,"50(万)","设计、制作、代理国内各类广告；室内外装饰装修设计和施工",广西,钦州,"钦州市城中南开发区新华街飞扬羽毛球馆旁"
桂林凯丽制衣有限公司,914503007630707792,2004-06-18,N/A,N/A,"300(万)","服装、纺织品、床上用品生产、加工、销售；棉纱、布匹销售。",广西,桂林,"桂林市高新区6号小区"
桂林市羽丰建筑安装劳务有限公司,914503047630716751,2004-06-18,N/A,N/A,"30(万元人民币)","建筑给排水、电气、暖通空调、消防及机电设备安装的劳务承包。",广西,桂林,"桂林市环城南二路十二号16栋"
贵港市恒基房地产开发有限公司,914508007630701548,2004-06-18,N/A,N/A,"1,008(万)","房屋租赁；填挖土石方；钢材（摆卖应当进入钢材专业市场）、瓷砖、书画装裱、画廊、古典家具批发零售。※",广西,贵港,"贵港市新世纪广场西侧云河商业楼"
中国移动通信集团广西有限公司隆安分公司雁江镇营业厅,91450123068890644D,2004-06-18,N/A,N/A,"N/A","移动电话通信业务",广西,南宁,"隆安县雁江镇市场开发新街道(农贸市场大门左边"
广西景祥物业服务有限公司,91450300763070808D,2004-06-18,N/A,N/A,"300(万)","物业管理，外墙清洗，水电安装，园林绿化管理，家政服务。",广西,桂林,"桂林市七星区空明西路１２号黄金屋小区１６栋"
广西南宁市锐蓝广告传播有限公司,914501037630719153,2004-06-18,N/A,N/A,"50(万元人民币)","设计、制作、发布、代理国内各类广告，企业形象策划，商务活动策划，产品形象策划，文艺创作策划。",广西,南宁,"南宁市青秀区中泰路9号天健·国际公馆A座801、802、804号"
广西南宁市泰亨商贸有限责任公司,914501007630779469,2004-06-18,N/A,N/A,"800(万元人民币)","销售：日用百货，五金交电（除助力自行车），建筑材料（除危险化学品及木材），服装纺织，有色金属（除国家专控产品）；机械设备，仪器仪表，陶瓷制品，工艺品（除金饰品）；家用电器，体育用品，通讯设备（除国家专控商品）；水暖器材，音响设备，计算机软、硬件，办公设备，汽车、摩托车配件，化妆品，文化用品；农副产品",广西,南宁,"南宁市滨湖路１－３号金湖苑Ｂ座8单元５１６号"
梧州长业服务有限公司,91450403763078826K,2004-06-18,N/A,N/A,"2,000(万元人民币)","物业租赁；旅宿。",广西,梧州,"梧州市西江二路５号☆"
广西千珍制药有限公司,91450100729777279W,2004-06-18,N/A,N/A,"1,300(万元人民币)","医药制造",广西,南宁,"南宁市银海大道838号"
广西桂诚达建设投资有限公司,91450100763071798X,2004-06-18,N/A,N/A,"1,080(万元人民币)","对交通能源、电站、公路、桥梁、港口、码头、飞机场、矿山、高科技项目、旅游业的投资；房地产开发经营（取得资质证书后方可在其资质等级许可的范围内开展）；建筑材料、装饰材料、五金交电、化工产品",广西,南宁,"南宁市青秀区长湖路南段中天世纪花园A区2号楼2单元1806号房"
广西广播电视信息网络股份有限公司上林分公司,91450125763082745M,2004-06-18,N/A,N/A,"N/A","接受总公司委托经营：广播电视网络的设计、建设、改造、经营、维护、管理、多功能开发及技术服务；广播电视节目和网络信息传输服务；广播电视设备、电子设备、信息设备的购销、租赁；服务器托管服务；计算机信息系统集成临时三级；计算机技术开发、技术咨询、信息咨询与系统维护；计算机软硬件及辅助设备的销售、安装、设计与施工；办公设备、家用电器的销售。",广西,南宁,"上林县大丰镇新民路48号"
南宁市寰亚贸易有限公司,9145010376307135XF,2004-06-18,N/A,N/A,"300(万)","批发兼零售食品（具体项目以审批部门批准的为准），销售：原生中草药、农副土特产品、矿产品（除国家专控产品）、电子产品、日用百货、橡胶、五金交电、纺织品、办公用品、机电产品、外文翻译服务、进出口贸易",广西,南宁,"南宁市白沙大道35号南国花园商城C4栋C4-6号房"
北海市飞越广告有限公司,91450500763073822W,2004-06-18,N/A,N/A,"50(万元人民币)","设计、制作、发布、代理国内各类广告",广西,北海,"北海市北海大道与广东路交汇处恒昌商业广场二楼"
南宁强国科技有限公司,91450103MA5KK35B3G,2004-06-19,N/A,N/A,"300(万元人民币)","水文测验控制设备；电子信息技术产品及计算机软硬件的研究、开发、生产、销售及技术服务；水文缆道架设与安装",广西,南宁,"南宁市仙葫开发区蓉茉大道67-25号"
十一冶建设集团有限责任公司第四建筑安装工程分公司,91450200763072918D,2004-06-21,N/A,N/A,"N/A","接受主体公司委托，为主体公司接洽业务。",广西,柳州,"柳州市柳太路13号"
十一冶建设集团有限责任公司安装工程分公司,9145020076307290XD,2004-06-21,N/A,N/A,"N/A","接受主体公司委托，为主体公司接洽业务。",广西,柳州,"柳州市柳太路"
中国移动通信集团广西有限公司河池分公司新建路营业厅,91451200399114703E,2004-06-21,N/A,N/A,"N/A","基础电信业务、增值电信业务",广西,河池,"河池市新建路37号"
中国移动通信集团广西有限公司河池分公司河池镇营业厅,91451200399112871N,2004-06-21,N/A,N/A,"N/A","基础电信业务、增值电信业务",广西,河池,"河池市河池镇河池街"
南宁市兆德农业科技有限公司,9145010076307258XR,2004-06-21,N/A,N/A,"50(万)","农业种植技术开发、技术服务、技术咨询、技术转让，农业种植，生物有机肥研究开发与推广，农业新品种培育，原生中草药、制冷空调设备配件、冷却塔设备、玻璃钢系列产品、五金交电（除助力自行车）、水暖器材、日用百货、服装鞋帽、农副土特产品（除粮油）、建筑材料",广西,南宁,"南宁市大学东路174号广西农业科学院旧行政办公楼三楼302-304号房"
南宁市力冠商贸有限公司,914501007630726350,2004-06-21,N/A,N/A,"1,000(万)","销售：钢材，金属材料（除国家专控产品），建筑材料（除危险化学品及木材），五金交电（除助力自行车），日用百货，矿产品",广西,南宁,"南宁市安园东路北侧广西南大物流市场第2A3-3号"
中国移动通信集团广西有限公司河池分公司九龙营业厅,914512003991130496,2004-06-21,N/A,N/A,"N/A","基础电信业务、增值电信业务",广西,河池,"河池市南新东路(稽征门面)"
十一冶建设集团有限责任公司第三建筑安装工程分公司,91450200763072897W,2004-06-21,N/A,N/A,"N/A","接受主体公司委托，为主体公司接洽业务。",广西,柳州,"柳州市柳太路"
南宁市宝典信息咨询有限公司,914501037630727667,2004-06-21,N/A,N/A,"10(万元人民币)","企业管理咨询，商品信息咨询",广西,南宁,"南宁市长湖路中天世纪花园景天阁6单元8楼806号"
十一冶建设集团有限责任公司第二建筑安装工程分公司,914502007630728892,2004-06-21,N/A,N/A,"N/A","接受主体公司委托，为主体公司接洽业务。",广西,柳州,"柳州市柳太路二区"
南宁市安利达汽车运输有限公司,91450107763072555H,2004-06-21,N/A,N/A,"50(万)","道路货物运输",广西,南宁,"南宁市大学东路172号C区109号商铺"
中国移动通信集团广西有限公司河池分公司六圩营业厅,914512003991126607,2004-06-21,N/A,N/A,"N/A","基础电信业务、增值电信业务",广西,河池,"河池市六圩镇六圩街"
中国移动通信集团广西有限公司桂林分公司桂电动感地带营业厅,91450300662109582X,2004-06-21,N/A,N/A,"N/A","移动电话通信业务",广西,桂林,"桂林电子工业学院"
中国移动通信集团广西有限公司贵港分公司古樟营业厅,914508003101632948,2004-06-22,N/A,N/A,"N/A","接受隶属公司委托联系、洽谈以下业务：基础电信业务、增值电信业务",广西,贵港,"广西贵港市古樟乡政府大院右侧"
中国移动通信集团广西有限公司贵港分公司大圩营业厅,91450800310164713G,2004-06-22,N/A,N/A,"N/A","接受隶属公司委托联系、洽谈以下业务",广西,贵港,"广西贵港市大圩镇商业街90号"
北海市百通药业有限公司,91450500763074278R,2004-06-22,N/A,N/A,"1,153.8000(万)","中成药、中药饮片、化学原料药及其制剂、抗生素、生化药品、生物制品（除疫苗）、第二类精神药品、蛋白同化制剂、肽类激素药品（以上项目凭药品经营许可证经营，有效期至2019年5月12日），计算机软、硬件的技术开发、计算机及辅助设备、计算机软件（不含电子出版物）、不锈钢制品、Ｉ、Ⅱ类医疗器械、化妆品、健身器械、日用百货、五金交电、家用电器、教学用模型、教学用标本、教学用品、教学仪器、实验室用品及设备、消毒剂",广西,北海,"北海市银海区银滩镇北背岭村委会大院内"
中国移动通信集团广西有限公司贵港分公司中里营业厅,91450800310179456Q,2004-06-22,N/A,N/A,"N/A","接受隶属公司委托联系、洽谈以下业务：基础电信业务、增值电信业务",广西,贵港,"广西贵港市中里乡粮所"
广西南宁庞氏工贸有限公司,91450103763072600Q,2004-06-22,N/A,N/A,"50(万元人民币)","化妆用品，美发用品，保健用品",广西,南宁,"南宁市建政路49号区化肥工业公司一楼"
中国移动通信集团广西有限公司贵港分公司大岭营业厅,91450800310179325W,2004-06-22,N/A,N/A,"N/A","接受隶属公司委托联系、洽谈以下业务：基础电信业务、增值电信业务",广西,贵港,"广西贵港市大岭乡大岭圩"
中国移动通信集团广西有限公司贵港分公司根竹营业厅,91450800310164369H,2004-06-22,N/A,N/A,"N/A","接受隶属公司委托联系、洽谈以下业务：基础电信业务、增值电信业务",广西,贵港,"广西贵港市根竹乡水利站"
广西广播电视信息网络股份有限公司扶绥分公司,91451421763077356H,2004-06-22,N/A,N/A,"N/A","接受公司委托经营。",广西,崇左,"广西扶绥县新宁镇松江路216号"
