佳木斯市广源物业管理有限公司,91230800766028445B,2004-09-28,N/A,N/A,"50(万元人民币)","物业管理（在资质证书规定的范围内从事经营活动）摄影、运输中介服务、房屋中介服务、汽车配件销售，复印、打字****",黑龙江,佳木斯,"黑龙江省佳木斯市郊区友谊路18号"
鹤岗峻兴净水有限责任公司,91230400766041041G,2004-09-29,N/A,N/A,"900(万元)","生活饮用水",黑龙江,鹤岗,"黑龙江省鹤岗市兴安区峻德矿院外"
伊春鑫阳松果有限公司,91230700766037210Q,2004-09-29,N/A,N/A,"113(万元)","小规格板方材加工、销售；山野果、山野菜、干制食用菌经销及进出口。",黑龙江,伊春,"黑龙江省伊春市美溪区曙光社区美林路2号"
大唐黑龙江发电有限公司,91230000766027194U,2004-09-29,N/A,N/A,"292,318.0278(万元人民币)","组织电力（热力）生产和销售。电力设备设施检修、安装、调试、运行维护；新能源开发；工程和技术研究与试验；租赁业；企业管理服务；投资和资产管理；技术推广服务；电力物资供应；计算机系统开发。建材生产和销售；技能培训、教育辅助服务；工程和技术研究和试验发展；科技推广和应用服务；销售煤炭",黑龙江,哈尔滨,"黑龙江省哈尔滨市松北区怡园街18号"
哈尔滨荣昌电站设备有限公司,91230110763187010L,2004-09-29,N/A,N/A,"50(万元人民币)","加工制造压力容器配件，锅炉辅机，阀门配件，电站设备维修、改造，经销电站阀门及阀门配件；提供技术咨询。",黑龙江,哈尔滨,"哈尔滨市香坊区通乡街254号2栋"
哈尔滨龙强金属制造有限公司,91230108763186827M,2004-09-29,N/A,N/A,"50(万元人民币)","机械加工、汽车零部件加工，销售：有色金属（不含稀有金属）、钢材",黑龙江,哈尔滨,"哈尔滨市平房区平新镇三家村"
哈尔滨龙江客运综合服务有限公司,91230104763186886Y,2004-09-29,N/A,N/A,"157(万元人民币)","旅馆业特业（依法须经批准的项目，经相关部门批准后方可开展经营活动）；公共卫生许可（依法须经批准的项目，经相关部门批准后方可开展经营活动）；食品生产经营（依法须经批准的项目，经相关部门批准后方可开展经营活动）；销售：日用品（不含危险化学品）；机动车维修",黑龙江,哈尔滨,"哈尔滨市道外区桦树街1号"
哈尔滨中发供热管理有限公司,9123010376319072X8,2004-09-29,N/A,N/A,"100(万元人民币)","按资质从事小区供热、供暖。",黑龙江,哈尔滨,"哈尔滨市南岗区先锋路577号"
中国铁通集团有限公司大兴安岭分公司塔河营业厅,91232722099659592K,2004-09-29,N/A,N/A,"N/A","在全国范围内经营第二类基础电信业务中的固定网国内数据传送业务、用户驻地网务；第二类增值电信业务中的语音信箱业务、传真存储转发业务、X.400电子邮件业务、呼叫中心业务、因特网接入服务业务；在北京、上海、2直辖市以及沈阳、大连、唐山、济南、青岛、广州、海口、成都、昆明、西安10城市经营信息服务业务（仅限固定网电话信息服务）互联网信息服务不含新闻、出版、教育、医疗、保健、药品、医疗器械和电子公告服",黑龙江,大兴安岭,"黑龙江省大兴安岭地区塔河县塔河镇繁荣街(路)开发4门市9号商服楼"
大庆市阳光物业有限公司,912306047660481710,2004-09-29,N/A,N/A,"500(万)","物业管理，供热，房屋租赁服务。",黑龙江,大庆,"黑龙江省大庆市让胡路区西宾路2号"
哈尔滨市双环环境园林有限责任公司,91230199763186755N,2004-09-29,N/A,N/A,"200(万元人民币)","取得资质证后方可从事环境、景观、园林设计、施工；购销园林工具、工艺品（不含专项审批产品）；购销花卉苗木；花木养植、种植业；农副产品收购（不含粮油）",黑龙江,哈尔滨,"哈尔滨市南岗区闽江路２１９－２号"
哈尔滨深蓝办公设备有限公司,91230102763187328W,2004-09-29,N/A,N/A,"30(万元人民币)","购销：办公设备、计算机设备、文教用品、计算机软硬件及耗材，计算机软硬件的技术开发、技术咨询、技术服务、技术转让。",黑龙江,哈尔滨,"哈尔滨市道里区松滨里小区32栋1层32－8号"
双鸭山市巨强车箱制造有限公司,91230500766026466J,2004-09-29,N/A,N/A,"2,000(万元)","在《汽车维修业经营许可证》规定范围内从事汽车修理和零小修服务；在国家规定的技术参数内从事机动车车箱加工（需专项审批的除外）",黑龙江,双鸭山,"黑龙江省双鸭山市尖山区福利镇双福路"
哈尔滨阿继格瑞机电有限责任公司,91230112763187942X,2004-09-29,N/A,N/A,"123.7000(万元人民币)","工业电器、工业控制装置、大中型油烟净化装置、环保产品、日用电器、屏体箱柜、机械零件的设计、制造、销售。",黑龙江,哈尔滨,"哈尔滨市阿城区继电街继林路１号"
哈尔滨迅成电子通信网络工程有限公司,91230111769059757E,2004-09-29,N/A,N/A,"600(万元)","通信网络工程、有线电视工程、楼宇智能、综合布线工程、安防工程",黑龙江,哈尔滨,"哈尔滨利民开发区（南京路宏信广场１号楼１单元１０２室）"
安达市建安建筑工程有限公司,91231281766026650H,2004-09-29,N/A,N/A,"11,000(万)","房屋建筑工程施工、市政公用工程施工",黑龙江,绥化,"黑龙江省绥化市安达市太平庄镇政府西80米"
中国人寿保险股份有限公司七台河分公司桃山支公司第一营销服务部,91230900MA18XTXT2U,2004-09-29,N/A,N/A,"N/A","人寿保险（按中国保险监督管理委员会核发的保险营销服务许可证规定的范围从事经营活动），",黑龙江,七台河,"黑龙江省七台河市桃山区桃北街008幢"
绥芬河凯翔国际旅行社有限责任公司,91231081766030369F,2004-09-29,N/A,N/A,"150(万元)","入境旅游业务、国内旅游业务、边境旅游业务。",黑龙江,牡丹江,"黑龙江省牡丹江市绥芬河市新安街19号"
大庆仙浪软件科技开发有限公司,9123060776602759X4,2004-09-29,N/A,N/A,"506(万)","计算机应用软件的开发、销售；计算机系统服务；输配电及节能控制设备研制、销售；仪表、电气设备、办公用品的销售。",黑龙江,大庆,"黑龙江省大庆市高新区新科路12号科技创业园创新大厦112房间"
哈尔滨市呼兰区伟峰瓜子加工厂,92230111MA1AEFWN7L,2004-09-29,个体工商户,N/A,"N/A","瓜子加工*",黑龙江,哈尔滨,"新民街四委十二组"
中国大地财产保险股份有限公司大庆中心支公司,91230604766026693N,2004-09-29,N/A,N/A,"N/A","详见经营保险业务许可证书第：Ｐ１０２１３ＤＱＧ。",黑龙江,大庆,"黑龙江省大庆市让胡路区玉门街西侧,家园路北侧汇景花园商业写字楼一楼大厅及三楼310A、310B、311A、311B、312A、312B、313、314"
黑龙江省宝泉岭农垦金谷米业有限公司,91233001766039689G,2004-09-30,N/A,N/A,"1,000(万)","大米的生产、批发；粮食收购；粮食初加工服务；豆类的收购；豆粕的批发零售。",黑龙江,鹤岗,"黑龙江省鹤岗市萝北县宝泉岭局直二十二委61栋1号"
齐齐哈尔北兴钢渣再生利用有限公司,91230206766040444M,2004-09-30,N/A,N/A,"50(万元)","钢渣再生利用，废钢铁收购，粉煤灰、炉渣、矿渣批发零售。",黑龙江,齐齐哈尔,"黑龙江省齐齐哈尔市富拉尔基区齐景路砖厂"
中国大地财产保险股份有限公司佳木斯中心支公司,91230800766027055E,2004-09-30,N/A,N/A,"N/A","保险业务",黑龙江,佳木斯,"佳木斯市向阳区长安西路346号"
铁力市东鑫速冻食品有限责任公司,912307817660290262,2004-09-30,N/A,N/A,"200(万元)","速冻食品[速冻其他食品（速冻果蔬制品）]",黑龙江,伊春,"黑龙江省伊春市铁力市铁桃公路4.3公里处"
中国大地财产保险股份有限公司齐齐哈尔中心支公司,91230200766028904H,2004-09-30,N/A,N/A,"N/A","1、企业财产损失保险；2、家庭财产损失保险；3、建筑工程保险；4、安装工程保险；5、货物运输保险；6、机动车辆保险；7、船舶保险；8、飞机保险；9、航天保险；10、核电站保险；11、能源保险；12、法定责任保险；13、一般责任保险；14、保证保险；15、信用保险；16、种植业保险；17、养殖业保险；18、短期健康保险；19、意外伤害保险；20、上述保险业务的再保险业务。",黑龙江,齐齐哈尔,"黑龙江省齐齐哈尔市建华区齐齐哈尔市金融街项目00单元01层01号北侧"
黑龙江安联会计师事务所有限公司大庆分公司,91230607766037667A,2004-09-30,N/A,N/A,"N/A","按分所执业证书核定的经营范围从事经营活动",黑龙江,大庆,"黑龙江省大庆市高新区金鹰国际大厦A栋608室"
七台河康威生物科技有限公司,91230900766039072J,2004-09-30,N/A,N/A,"2,000(万元人民币)","***。农副产品深加工技术开发、农副产品深加工",黑龙江,七台河,"黑龙江省七台河市新兴区曙光村"
中国石化销售有限公司黑龙江哈尔滨石油分公司光远加油站,91230000766029093H,2004-10-08,N/A,N/A,"N/A","H14-食品经营|H20-化学危险品经营成品油零售（汽油、柴油）；预包装食品",黑龙江,哈尔滨,"黑龙江省哈尔滨市道外区东风镇联胜村"
哈尔滨特利来石油工具制造有限公司,91230184763188128H,2004-10-08,N/A,N/A,"1,000(万)","从事货物与技术的进出口业务。从事货物与技术的进出口业务。钻头、石油工具、非标准件工具制造及修理，钻井技术服务，网络安装，电子设备安装维护。石油钻井及水井井下作业",黑龙江,哈尔滨,"五常市牛家工业园区"
黑龙江泰华医药连锁销售有限公司振华药店,91231200777884327M,2004-10-08,N/A,N/A,"N/A","药品零售；医疗器械、保健食品、预包装食品兼散装食品、乳制品、保健品、化妆品经销；小家电、日用百货销售。",黑龙江,绥化,"黑龙江省绥化市北林区四方台镇内"
哈尔滨思金达金属材料有限公司,91230103763187985A,2004-10-08,N/A,N/A,"1,000(万元人民币)","购销金属材料。",黑龙江,哈尔滨,"哈尔滨市南岗区仓库街2号"
五常市山林吉权大米加工厂,92230184MA1ABLG4XN,2004-10-08,个体工商户,N/A,"N/A","水稻收购、加工销售。",黑龙江,哈尔滨,"五常市山河镇太平湖村"
杜尔伯特蒙古族自治县农业生产资料有限责任公司宝丰生产资料商店,912306243229210130,2004-10-08,N/A,N/A,"N/A","零售：农用生产资料（包括政策允许经营的重要生产资料）日用杂品、种子、农药",黑龙江,大庆,"黑龙江省大庆市杜尔伯特蒙古族自治县泰康镇三道街（地矿局楼下）"
上海旺瑞建筑材料有限公司,91310113767902122N,2004-10-08,N/A,N/A,"50(万元人民币)","建筑装潢材料、给排水材料、金属材料、五金、花卉批兼零、代购代销；室内装潢设计及服务；空调按装维修服务；绿化园林工程；花卉租赁；水、电安装",黑龙江,双鸭山,"宝山区沪太路8885号商务楼A420室"
牡丹江市堰塞湖米业有限公司,91231083766028373W,2004-10-08,N/A,N/A,"500(万)","谷物、豆及薯类批发，谷物种植、磨制、仓储。",黑龙江,牡丹江,"黑龙江省牡丹江市海林市横道镇七里地村"
虎林市森林米业有限责任公司,91230381766028189B,2004-10-08,N/A,N/A,"3,000(万元)","通过边境小额贸易方式向毗邻国家开展各类商品及技术的进出口业务，国家限制禁止进出口的商品及技术除外；大豆、水稻、玉米收购、加工、销售、储存、装卸及搬运。",黑龙江,鸡西,"黑龙江省鸡西市虎林市革命街道铁南委"
佳木斯市易学电脑有限公司,91230800766029827D,2004-10-08,N/A,N/A,"100(万元人民币)","电脑设计服务、软件开发服务、手机应用开发服务、数据库维护服务、网站建设服务、信息咨询服务、日用百货零售。广告制作、发布、代理、软硬件销售。",黑龙江,佳木斯,"黑龙江省佳木斯市向阳西区长安路西段"
中国铁通集团有限公司大兴安岭分公司十八站营业厅,91232722099990509M,2004-10-08,N/A,N/A,"N/A","经国家电信主管部门批准的基础电信业务和增值电信业务；无线寻呼业务。",黑龙江,大兴安岭,"黑龙江省大兴安岭地区塔河县十八站站前街"
黑龙江龙庆电站设备制造有限公司,912301107631901566,2004-10-09,N/A,N/A,"50(万元人民币)","经环保部门监测验收合格后，方可从事：冲压、通用零部件加工，电站锅炉备品备件加工（以上均不含特种设备及部件）。经销：金属材料",黑龙江,哈尔滨,"动力区团结路１２号"
哈尔滨宝丰医药连锁有限公司康安店,9123010076318993XJ,2004-10-09,N/A,N/A,"N/A","药品零售；食品生产经营；自营或代理货物和技术进出口",黑龙江,哈尔滨,"哈尔滨市道里区康安路121号"
佳木斯顺达纸塑包装有限公司,9123080076602986XM,2004-10-09,N/A,N/A,"50(万元人民币)","包装装潢印刷。塑料制品、包装箱生产、纸袋加工",黑龙江,佳木斯,"黑龙江省佳木斯市郊区莲江口良种场"
中国移动通信集团黑龙江有限公司昂昂溪区分公司,9123020576603591XA,2004-10-09,N/A,N/A,"N/A","在本辖区内经营国家许可的基础电信业务和增值电信业务；经营与通信及服务相关的系统集成、结算清算、技术开发、技术服务、设备销售，通信设备终端机配件出售、出租、维修；业务培训",黑龙江,齐齐哈尔,"黑龙江省齐齐哈尔市昂昂溪区兴盛路88号"
同江浦发商联投资有限公司,91230881663860706H,2004-10-09,N/A,N/A,"3,000(万元人民币)","投资与投资管理",黑龙江,佳木斯,"黑龙江省佳木斯市同江市通港路西端二粮库北坝西"
哈尔滨鑫海房屋拆除有限公司,91230102763187926Q,2004-10-09,N/A,N/A,"120(万元人民币)","拆除工程专业承包叁级。",黑龙江,哈尔滨,"哈尔滨市道里区安固街51号"
东宁华宇国际旅行社有限责任公司,91231024772605886Q,2004-10-09,N/A,N/A,"550(万元人民币)","入境旅游业务、国内旅游业务、边境旅游业务",黑龙江,牡丹江,"东宁市东宁镇建国路99号（华宇酒店一楼）"
克山县信誉建设工程质量检测有限责任公司,912302297660293765,2004-10-09,N/A,N/A,"80(万)","与建筑材料有关的质量检测、检验",黑龙江,齐齐哈尔,"黑龙江省齐齐哈尔市克山县克西路路北(克山镇9街)"
中国移动通信集团黑龙江有限公司梅里斯区分公司,91230208766035928M,2004-10-09,N/A,N/A,"N/A","在本市辖区内经营国家许可的基础电信业务和增值电信业务。经营与通信及服务相关的系统集成、结算清算、技术开发、技术服务、设备销售,通信设备终端及配件出售、出租、维修,业务培训(内部员工)、会议服务,设计、制作、发布、代理国内外广告业务、商务代理服务。",黑龙江,齐齐哈尔,"黑龙江省齐齐哈尔市梅里斯达斡尔族区华丰大街信合一号楼"
中国移动通信集团黑龙江有限公司泰来分公司,91230224766035936M,2004-10-09,N/A,N/A,"N/A","在本市辖区内经营国家许可的基础电信业务和增值电信业务；经营与通信及服务相关的系统集成、结算清算、技术开发、技术服务、设备销售，通信设备终端及配件出售、出租、维修，业务培训（内部员工）、会议服务，设计、制作、发布、代理国内外广告业务，商务代理服务***",黑龙江,齐齐哈尔,"黑龙江省齐齐哈尔市泰来县泰来镇东风街"
哈尔滨理工大学创新创意孵化器有限公司,91230103763187678H,2004-10-09,N/A,N/A,"150(万元人民币)","科技企业和科技项目孵化，高新技术产品及专利产品开发、推广、应用，电子计算机软硬件、办公自动化设备、仪器仪表、机电产品、能源技术及产品的开发、生产",黑龙江,哈尔滨,"哈尔滨市南岗区学府路52号"
中国移动通信集团黑龙江有限公司碾子山区分公司,91230207766035901F,2004-10-09,N/A,N/A,"N/A","在本区辖区内经营国家许可的基础电信业务和增值电信业务,经营与通信及服务相关的系统集成、结算清算、技术开发、技术服务、设备销售，通信设备终端及配件出售、出租、维修；业务培训",黑龙江,齐齐哈尔,"黑龙江省齐齐哈尔市碾子山区富强二委四组"
中国移动通信集团黑龙江有限公司依安分公司,91230223766035987F,2004-10-09,N/A,N/A,"N/A","在本县辖区内经营国家许可的基础电信业务和增值电信业务。经营与通信及服务相关的系统集成、结算清算、技术开发、技术服务、设备销售，通信设备终端及配件出售、出租、维修；业务培训",黑龙江,齐齐哈尔,"黑龙江省齐齐哈尔市依安县依安镇东南街"
黑龙江省美科尔生物工程有限公司,912330017660365418,2004-10-09,N/A,N/A,"360(万)","万寿菊、辣椒、啤酒花等天然植物的种植，收购及初加工。",黑龙江,鹤岗,"黑龙江省鹤岗市萝北县共青农场交通街三委工业区13栋1号"
萝北县鹤翔米业有限公司,91230421766035282M,2004-10-09,N/A,N/A,"82(万元)","水稻加工；粮食购销。",黑龙江,鹤岗,"黑龙江省鹤岗市萝北县团结镇苇场粮库院内"
中国检验认证集团黑龙江有限公司绥芬河分公司,9123108176602847X6,2004-10-09,N/A,N/A,"N/A","按国家质量监督检验检疫总局及国家认证认可监督管理委员会核准的范围开展业务。",黑龙江,牡丹江,"黑龙江省牡丹江市绥芬河市同福街129号"
中国移动通信集团黑龙江有限公司龙江分公司,912302217660359445,2004-10-09,N/A,N/A,"N/A","在本县辖区内经营国家许可的基础电信业务和增值电信业务。经营与通信及服务相关的系统集成、结算清算、技术开发、技术服务、设备销售，通信设备终端及配件出售、出租、维修；业务培训",黑龙江,齐齐哈尔,"黑龙江省齐齐哈尔市龙江县县府街龙江移动通信公司综合楼1-5层"
中国移动通信集团黑龙江有限公司富拉尔基区分公司,9123020676603663X1,2004-10-09,N/A,N/A,"N/A","在本市辖区内经营国家许可的基础电信业务和增值电信业务(基础电信业务许可证有效期至2019年1月6日)、(增值电信业务经营许可证有效期至2015年9月30日)。经营与通信及服务相关的系统集成、结算清算、技术开发、技术服务、设备销售，通信设备终端及配件出售、出租、维修；业务培训(内部员工)、会议服务；设计、制作、发布、代理国内外广告业务；商务代理服务。",黑龙江,齐齐哈尔,"黑龙江省齐齐哈尔市富拉尔基区红岸办事处群众街"
中国移动通信集团黑龙江有限公司富裕分公司,91230227766036621N,2004-10-09,N/A,N/A,"N/A","在本辖区内经营国家许可的基础电信业务和增值电信业务。经营与通信及信息服务相关的系统集成、结算清算、技术开发、技术服务、设备销售，通信设备终端及配件出售、出租、维修；业务培训",黑龙江,齐齐哈尔,"黑龙江省齐齐哈尔市富裕县富裕镇三街"
方正县高楞宇通铅笔板有限公司,9123012476318774XJ,2004-10-09,N/A,N/A,"50(万元人民币)","铅笔板、小规格板方材、铅笔加工销售。",黑龙江,哈尔滨,"方正林业局吉岭经营所"
中国移动通信集团黑龙江有限公司甘南分公司,91230225766035952R,2004-10-09,N/A,N/A,"N/A","在本辖区内经营GSM数字移动通信业务；IP电话业务；因特网接入服务业务;因特网骨干网数据传送业务;与其相关的技术开发、技术服务、设备销售和信息服务；出租出售移动电话终端设备并提供售后服务；业务培训、会议服务。商务代理服务。",黑龙江,齐齐哈尔,"黑龙江省齐齐哈尔市甘南县甘南镇立新街"
中国移动通信集团黑龙江有限公司克东分公司,912302307660358995,2004-10-09,N/A,N/A,"N/A","在本辖区内经营GSM数字移动通信业务；IP电话业务；因特网接入服务业务;因特网骨干网数据传送业务;与其相关的技术开发、技术服务、设备销售和信息服务；出租出售移动电话终端设备并提供售后服务；业务培训、会议服务。商务代理服务。",黑龙江,齐齐哈尔,"黑龙江省齐齐哈尔市克东县克东镇春和街"
黑龙江省成瑞机电设备有限公司,912301037631877660,2004-10-09,N/A,N/A,"1,000(万元人民币)","经销：机电设备、空气压缩设备、净化设备、冷冻设备、板式热交换器及换热机组、商用及民用中央空调、粮油、五金、纺织品、服装、鞋帽、轻工产品、体育用品、文化用品、工艺品、机械设备、建筑材料、装饰材料、化工产品（不含危险品）、家用电器、木材",黑龙江,哈尔滨,"哈尔滨市南岗区贵新街170号东北亚大厦923室"
中国移动通信集团黑龙江有限公司克山分公司,91230229766035960E,2004-10-09,N/A,N/A,"N/A","在本县辖区内经营国家许可的基础电信业务和增值电信业务（基础电信业务许可证有效期至2019年1月6日，增值电信业务许可证有效期至2015年9月30日）。经营与通信及服务相关的系统集成、结算清算、技术开发、技术服务、设备销售，通信设备终端及配件出售、出租、维修；业务培训",黑龙江,齐齐哈尔,"黑龙江省齐齐哈尔市克山县克山镇5街"
中国移动通信集团黑龙江有限公司讷河分公司,91230281749680108D,2004-10-09,N/A,N/A,"N/A","在本市辖区内经营国家许可的基础电信业务和增值电信业务；经营与通信及服务相关的系统集成、结算清算、技术开发、技术服务、设备销售，通信设备终端及配件出售、出租、维修，业务培训",黑龙江,齐齐哈尔,"黑龙江省齐齐哈尔市讷河市西南街"
哈尔滨太氏食品有限公司,91230199763187563D,2004-10-10,N/A,N/A,"1,603.6698(万元人民币)","食品生产经营。收购：初级农副产品",黑龙江,哈尔滨,"哈尔滨经开区哈平路集中区新疆东路２７号"
哈尔滨市松北区世纪海尔铝塑加工厂,92230109MA19M1AL5Q,2004-10-10,个体工商户,N/A,"N/A","金属门窗加工制作、胶条加工制作",黑龙江,哈尔滨,"哈尔滨市松北区松北镇集乐村"
佳木斯华为电力建筑工程有限公司分公司,912308006814280873,2004-10-10,N/A,N/A,"N/A","以佳木斯华为电力建筑工程有限公司名义承揽工程。",黑龙江,佳木斯,"黑龙江省佳木斯市前进区永和街中段"
绥化昊昌亚麻纺织有限公司,91231200766032356K,2004-10-10,N/A,N/A,"411(万元)","亚麻纺织、销售；本企业自产产品及所需原料的进出口业务；普通货物仓储（不含危险化学品）",黑龙江,绥化,"黑龙江省绥化市北林区中直路与哈伊公路交叉处东40米路南"
上海伟豪制衣有限公司哈尔滨分公司,9123010376318950X4,2004-10-10,N/A,N/A,"N/A","销售：服装。",黑龙江,哈尔滨,"哈尔滨市南岗区邮政街105号12层8号"
黑龙江邮政书店连锁经营有限责任公司黑河连锁一店,91231100MA18XBQW3B,2004-10-10,N/A,N/A,"N/A","报刊、图书、音像及其它出版物的销售，文化用品销售。无",黑龙江,黑河,"黑龙江省黑河市爱辉区文化街168号"
大庆联碳石化产品销售有限公司,91230607766033009B,2004-10-10,N/A,N/A,"100(万元)","石油化工技术研究；润滑油调合、分装；化工产品",黑龙江,大庆,"黑龙江省大庆市高新区兴化园区精细化工科技园"
中国移动通信集团黑龙江有限公司拜泉分公司,91230231766036672P,2004-10-10,N/A,N/A,"N/A","在辖区内经营国家许可的基础电信业务和增值电信业务（《基础电信业务许可证》有效期至2019年1月6日；《增值电信业务许可证》有效期至2015年9月30日），经营与通信及服务相关的系统集成、结算清算、技术开发、技术服务、设备销售，通信设备终端及配件销售、出租、维修；业务培训",黑龙江,齐齐哈尔,"拜泉县拜泉县拜泉镇东方红街2委7组"
黑龙江省绿盟环保文化传播有限公司,91230108763187969W,2004-10-10,N/A,N/A,"30(万元人民币)","环保公益活动策划、组织、实施、环保企业形象设计、广告代理、环保专利产品开发、环保新技术推广、绿色环保产品代购代销、环境评价咨询服务。零售：润滑油、环保设备、饲料。",黑龙江,哈尔滨,"哈尔滨市平房区月华路１２号综合楼"
黑龙江省华源医药股份有限公司,91231100772621755U,2004-10-10,N/A,N/A,"3,000(万元)","化学药制剂、中成药、抗生素、生化药品、生物制品、中药饮片、中药材、第二类精神药品制剂、麻醉药品、第一类精神药品制剂",黑龙江,黑河,"黑龙江省黑河市北安市西和平街71号"
绥化市伟丰粮油购销有限公司,91231200766032823K,2004-10-10,N/A,N/A,"50(万元人民币)","粮食收购。",黑龙江,绥化,"黑龙江省绥化市北林区利民镇"
哈尔滨边达广告有限公司,91230103763188187A,2004-10-10,N/A,N/A,"150(万元人民币)","设计、制作、发布、代理国内广告业务。",黑龙江,哈尔滨,"哈尔滨市南岗区十字街１４３－１９号"
