南汇县农业生产资料公司,91310115133911430W,1989-06-01,N/A,万春辉,"299(万元人民币)","农药，肥料，薄膜，药械，小农具，林副土产品，装潢材料，日用陶瓷，土产建材，木材＜含胶合板＞，附设综合经营部，金属材料。【依法须经批准的项目，经相关部门批准后方可开展经营活动】",上海,浦东,"浦东新区书院镇新府路9号"
上海奉贤钱桥供销合作社农药化肥门市部,91310120784773609L,1989-06-01,集体分支机构（非法人）,王士芳,"N/A","农药、农业机械、化肥、小农具、陶瓷薄膜、农膜、不再分装的包装种子零售。【依法须经批准的项目，经相关部门批准后方可开展经营活动】",上海,N/A,"奉贤区钱桥镇"
上海市宝山区海红实业公司,913101131334405446,1989-06-01,N/A,张良,"880(万元人民币)","组织筹措本公司所属企业的新项目；货物储存；小型市政工程；绿化工程；塑料纸箱生产加工；普通机电维修；金属材料、五金交电、装潢材料、电子元件、日用百货、化工产品、建筑材料销售；土方工程。【依法须经批准的项目，经相关部门批准后方可开展经营活动】",上海,宝山,"上海市宝山区罗泾镇海红村"
上海市宝山区房产经营公司,91310113133448466J,1989-06-01,N/A,陈燕,"2,000(万元人民币)","房产开发及商品房销售；房产业务咨询、房产物业管理；建材、装潢材料批发零售、代购代销。【依法须经批准的项目，经相关部门批准后方可开展经营活动】",上海,宝山,"上海市宝山区淞浦路492号3F－73"
上海市宝山区罗店工业公司,91310113133406338J,1989-06-01,N/A,王雁滨,"300(万元人民币)","组织筹措本公司所属企业的新项目。【依法须经批准的项目，经相关部门批准后方可开展经营活动】",上海,宝山,"上海市宝山区罗店镇罗溪路口"
上海宝山农业生产资料有限公司,913101131334597046,1989-06-01,N/A,戴峰,"300(万元人民币)","肥料、农药、塑料薄膜、农药机械、农具、油漆、建材、钢材、五金、装潢材料、百货、汽配、农机配件、塑料制品批兼零、代购代销；塑料粒子销售。【依法须经批准的项目，经相关部门批准后方可开展经营活动】",上海,宝山,"上海市宝山区罗店镇束里桥月罗路北侧"
上海市宝山区汽车运输总公司,9131011313341387X6,1989-06-01,N/A,丁卫平,"685(万元人民币)","普通货物运输、国际集装箱运输。【依法须经批准的项目，经相关部门批准后方可开展经营活动】",上海,宝山,"上海市宝山区蕰川路2000号9幢"
宝钢发展有限公司,913101131334389465,1989-06-01,N/A,蔡伟飞,"241,326.3966(万元人民币)","企业管理；商务信息咨询；物业管理；旅游咨询；房屋租赁；汽车租赁；食品、卷烟、日用百货、体育用品、盆景化肥、环保防腐专用设备、管道、管件、密封件配件、消防设备及器材、蓄电池、空调设备、量具刃具、五金交电、劳防用品、家具、化工产品（除危险化学品、监控化学品、烟花爆竹、民用爆炸物品、易制毒化学品）销售；房地产开发；房屋和土木、防腐工程施工、维修；市政公共设施管理、施工；管道带压堵漏；五金制造；公用动力设备（除专控）运行管理、维护；机、电、仪设备的设计、制作、安装、维修、销售；消防设施维护、保养、检测；住宿；健身服务；洗衣服务；餐饮服务（限分支）；会展会务服务；文化艺术交流活动；体育赛事、公关活动策划；建筑装潢工程；电梯、楼宇自动化控制、安防、网络监控系统维修（除特种设备）；空调设备、起重机械安装、维修；城市绿化管理；园林绿化工程设计、施工、养护；生态环境工程；花卉种植、销售；餐饮企业管理（不含食品生产经营）；宝钢内部的医疗服务管理、卫生管理；普通货运；劳务派遣；停车场",上海,宝山,"宝山区宝杨路889号"
上海宝山市政工程有限公司,913101131334032097,1989-06-01,N/A,孟拥军,"2,500(万元人民币)","市政建设工程施工（贰级）；水电安装、装潢；城市道路及公路养护维修；自有工程机械出租；施工设施制作及出租；非承重预制品加工（限分支机构经营）；玻璃制品加工",上海,宝山,"上海市宝山区长江西路2311号二层203-36室"
上海沪北实业公司,91310113133424181P,1989-06-01,N/A,戴建华,"102(万元人民币)","组织筹措本公司所属企业的新项目；金属材料、机电设备、五金交电、汽车配件、化工产品",上海,宝山,"上海市宝山区场北路815号"
上海市南汇县水产供销公司,91310115133939652R,1989-06-01,N/A,李慧,"66.6000(万元人民币)","食品销售管理",上海,浦东,"浦东新区惠南镇南门大街114－118号"
上海华力内燃机工程公司,913101101332176092,1989-06-01,N/A,汪飙,"30(万元人民币)","内燃机试验、设计、改造、机电仪器配套安装内燃机维修加工，室内装潢，内燃机、家用电器科技咨询，技术开发，技术转让，技术服务，专用汽车设计开发；食品流通。【依法须经批准的项目，经相关部门批准后方可开展经营活动】",上海,杨浦,"军工路2500号335室"
上海中集汽车检测修理有限公司,91310113133421941B,1989-06-01,N/A,毛弋,"113(万元人民币)","汽车检测修理；机动车拍照；汽配、装潢材料、船用配件、五金交电、橡塑制品、电线电缆零售批发代购代销；汽车、挂车销售。【依法须经批准的项目，经相关部门批准后方可开展经营活动】",上海,宝山,"上海市宝山区水产路1699号"
上海武灵轻工机器有限公司,91310110133213552Y,1989-06-01,N/A,龙辉,"80(万元人民币)","军工产品设计测绘，纺织机配件、冷镦机、缝纫机零件、茶包机、机电设备生产、维修与销售，贸易经纪与代理",上海,杨浦,"上海市杨浦区共青路357弄10号"
上海东达实业有限公司,91310110133240489K,1989-06-01,N/A,张爱荣,"30(万元人民币)","零件加工，非标设备设计制作，汽车配件、建筑材料、仪器仪表、五金百货销售，电脑设备维修，网络安装与维护，软件开发与维护，各类机电设备安装调试维修",上海,杨浦,"上海市杨浦区四平路1230号212室"
上海南汇自来水有限公司,91310115133911932F,1989-06-02,N/A,谈晓鞍,"150,885.5500(万元人民币)","自来水，排水设计，供应水管配件，供水设备修理，水厂设备，管道安装，水质检测服务。【依法须经批准的项目，经相关部门批准后方可开展经营活动】",上海,浦东,"浦东新区惠南镇沪南公路9800号402室"
上海市周浦商业公司,913101151339356279,1989-06-02,N/A,常国平,"100(万元人民币)","装潢，建材，机电，五金交电，家用电器，土产，化工，油漆，绳网，陶杂，劳防，钢材，木材，水泥，下设十六个附属单位。【依法须经批准的项目，经相关部门批准后方可开展经营活动】",上海,浦东,"浦东新区周浦镇年家浜路34号"
上海润鑫建筑装饰有限公司,913101151339207677,1989-06-02,N/A,朱林祥,"1,000(万元人民币)","建筑，装饰，水电安装，市政工程，绿化工程，砼构件加工，建筑五金，建筑安装。【依法须经批准的项目，经相关部门批准后方可开展经营活动】",上海,浦东,"浦东新区周浦镇建设路25号"
南汇县商业合作联合社,913101151339124418,1989-06-02,N/A,顾龙娟,"49.7000(万元人民币)","针织百货、日用杂品、五金交电、建筑装潢材料、零售。【依法须经批准的项目，经相关部门批准后方可开展经营活动】",上海,浦东,"浦东新区惠南镇文体路5号"
上海振博建设(集团)有限公司,91310115133955927R,1989-06-02,N/A,张伟,"5,210(万元人民币)","房屋建设工程施工，市政公用建设工程施工，土石方建设工程专业施工，建筑装修装饰建设工程专业施工，园林古建筑建设工程专业施工，钢结构建设工程专业施工，消防设施建设工程专业施工，机电设备安装建设工程专业施工，爆破与拆除建设工程专业施工，建筑智能化建设工程专业施工，港口与海岸建设工程专业施工，河湖整治建设工程专业施工，送变电建设工程专业施工，管道建设工程专业施工，特种专业建设工程专业施工，建筑装饰装修建设工程设计施工一体化，防静电网络地板的安装，物业管理。【依法须经批准的项目，经相关部门批准后方可开展经营活动】",上海,浦东,"浦东新区书院镇洼港村701号"
上海深港建筑装饰有限公司,913101151339672076,1989-06-02,N/A,盛妙仙,"1,050(万元人民币)","工业与民用建筑工程施工",上海,浦东,"浦东新区南汇新城镇秋萍路70号"
上海南汇建工建设(集团)有限公司,913101151339142797,1989-06-02,N/A,杨永平,"30,000(万元人民币)","建筑工程，市政建设，建筑装饰，设备安装，地基基础、土方、消防、环保、空调净化、钢结构网架、管道及防腐保温工程，给排水及电力安装；建筑材料及砼结构试验，非标设备制作安装，化工医药工业设备安装，自有房屋租赁。【依法须经批准的项目，经相关部门批准后方可开展经营活动】",上海,浦东,"浦东新区惠南镇沪南路9999号"
上海南汇建工集团坦直建筑有限公司,913101151339682347,1989-06-02,N/A,陆志刚,"1,660(万元人民币)","建筑施工，拆房，打桩，造桥，上下水设备安装，供暖设备安装，电气设备安装，室内外装饰，建筑机械及脚手架出租业务，建筑劳务分包，市政工程，水利水电建设工程施工，河道疏浚，滩涂围垦，市政设施养护，园林绿化养护，保洁服务。【依法须经批准的项目，经相关部门批准后方可开展经营活动】",上海,浦东,"浦东新区新场镇沪南公路7178号9幢106室"
南汇县建筑材料供应公司,913101151339122811,1989-06-02,N/A,季君,"38(万元人民币)","建筑材料，木材钢材，装璜材料，卫生陶瓷，玻璃胶合板，五金，电器百货，机电产品，普通机械。【依法须经批准的项目，经相关部门批准后方可开展经营活动】",上海,浦东,"浦东新区惠南镇向阳路16号"
上海南汇化工轻工有限公司,91310115133921284T,1989-06-02,N/A,瞿惠忠,"122(万元人民币)","化工原料（其中危险化学品凭许可证经营）；化轻产品，钢材，有色金属，机电设备，木材，建材，五金交电，汽车配件，摩托车及配件，玻璃，日用百货的批发，零售；充装永久气体（氧气）气瓶；无缝气瓶充装（氧气、氮气、氩气、二氧化碳。充装地点限红桥村10组内）；医用氧",上海,浦东,"浦东新区周浦镇康沈路1823号"
上海桑通汽车电器有限公司,913101181343348901,1989-06-03,有限责任公司,胡后祥,"500万人民币","生产加工汽车电机、摩托车电机、电子产品、五金制品。【依法须经批准的项目，经相关部门批准后方可开展经营活动】",上海,青浦,"青浦区华新镇纪鹤路2789号"
上海华新合金有限公司,91310118134306603W,1989-06-03,N/A,徐清,"2,000(万元人民币)","生产加工合金铸件、球墨铸块、模具、机械设备及配件、汽车零部件，经营本企业自产产品的出口业务和本企业所需要的机械、零配件、原辅材料的进口业务",上海,青浦,"青浦区华新镇嘉松中路1855号"
上海青浦华新包装有限公司,91310118134334452C,1989-06-03,N/A,徐洪泉,"552(万元人民币)","生产加工危险化学品包装物、容器（具体内容见许可证）、汽车五金配件、摩托车零部件、金属制品、电子电器产品及配件、五金机电设备及配件、机械设备、航空地面设备，航空地面设备的维修，从事货物及技术的进出口业务，自有房屋租赁，仓储服务",上海,青浦,"青浦区华新镇华腾路1189号"
上海奉贤邬桥供销合作社,913101201340120151,1989-06-03,集体所有制,沈继军,"228.8万人民币","综合性商业日用杂品、一般劳保用品、农业生产资料、润滑油、建筑材料、木材家具、钢材，废旧物资收购、烟",上海,N/A,"奉贤区庄行镇"
上海崇明市政工程有限公司,91310230134410005G,1989-06-03,N/A,黄诚,"10,800(万元人民币)","市政公用工程施工总承包（壹级），公路工程施工总承包（贰级），房屋建筑工程施工总承包（贰级），土石方工程专业承包（叁级），工业与民用建筑施工，公路交通工程交通安全设施工程，城市道路和公路养护维修，公共排水泵站运行（叁级），建筑材料、路基材料、混凝土制品的生产、销售，本核准经营范围内信息咨询服务，工程测量（地形、市政工程测量）丙级，水利水电工程（三级），机电安装工程",上海,崇明,"上海市崇明县城桥镇东门路328号"
上海沪江生化有限公司,91310120134021018T,1989-06-03,N/A,蔡忠,"3,000(万元人民币)","农药生产（详见许可证）",上海,奉贤,"奉贤区南桥镇新建东路355号"
上海青浦华新冶炼厂有限公司,91310118134334129X,1989-06-03,N/A,朱叶红,"10(万元人民币)","有色金属冶炼，销售五金电器，以下范围限分支经营：销售金属材料",上海,青浦,"青浦区华新镇"
上海泉新市政桥梁工程有限公司,913101187030838774,1989-06-03,N/A,周健,"50(万元人民币)","制造加工水泥制品、新型建筑材料、市政桥梁，水电安装，土建，市政工程，道路工程。【依法须经批准的项目，经相关部门批准后方可开展经营活动】",上海,青浦,"青浦区大盈镇金家桥"
上海加松混凝土构件有限公司,913101181343067776,1989-06-03,N/A,钱海明,"628(万元人民币)","生产加工混凝土构配件。【依法须经批准的项目，经相关部门批准后方可开展经营活动】",上海,青浦,"青浦区华新镇方黄公路5538号"
上海奉贤邬桥供销合作社废品收购站,91310120MA1HLRT82N,1989-06-03,集体分支机构（非法人）,沈继军,"N/A","废旧物资回收",上海,N/A,"上海市奉贤区庄行镇邬桥社区安东路168号"
中国工商银行股份有限公司上海市虹口支行,91310109133143371R,1989-06-04,N/A,王睿,"N/A","人民币存款，贷款，结算业务，人民币储蓄业务；外汇存款；外汇贷款；外汇汇款；外币兑换；外汇买卖",上海,虹口,"上海市虹口区东大名路578号1层"
上海青浦青华灯具五金厂,91310118134334444H,1989-06-04,集体所有制,陈忠,"200万人民币","生产加工五金冲件、金属制品、模具、汽车配件。【依法须经批准的项目，经相关部门批准后方可开展经营活动】",上海,青浦,"青浦区华新镇嘉松中路1698号"
上海冷气机厂有限公司,91310113133067954M,1989-06-04,N/A,李黎,"835.5700(万元人民币)","氟冷冻机空调、低温设备、军工船用产品；主营产品的设计、安装和调试；氟冷冻机、空调、低温设备、军工船用产品制造；制冷设备生产",上海,宝山,"上海市宝山区泰和路1405号"
上海青平药业有限公司,91310118134318292J,1989-06-04,N/A,倪鸿海,"2,138(万元人民币)","生产片剂、硬胶囊剂、原料药（地巴唑、碘番酸、氢氧化铝、盐酸多塞平、丙戊酸钠、鱼腥草素钠、盐酸普罗帕酮、乙胺嘧啶、肌醇烟酸酯、三硅酸镁）、药用辅料（微晶纤维素、硫酸钙），食品添加剂生产",上海,青浦,"青浦区白鹤镇赵江路397号"
上海长江口仓储有限公司,91310113133430928F,1989-06-04,N/A,徐栋良,"500(万元人民币)","货运代理；仓储服务",上海,宝山,"上海市宝山区牡丹江路1325号3A－8座"
上海活塞厂分厂有限公司,91310118134307104T,1989-06-05,N/A,邵斌,"300(万元人民币)","从事活塞科技专业领域内的技术研究、技术服务、技术咨询，机械设备租赁，仓储服务",上海,青浦,"青浦区华新镇嘉松中路1085号"
上海丰锐五金机械有限公司,9131011813433177XD,1989-06-05,有限责任公司,浦炳华,"50万人民币","销售五金交电、机械设备及配件、金属材料、针纺织品。【依法须经批准的项目，经相关部门批准后方可开展经营活动】",上海,青浦,"上海市青浦区沪青平公路9565号1幢1层A区1777室"
上海嘉城汽车服务有限公司,913101141336397806,1989-06-05,N/A,杜加林,"73(万元人民币)","出租汽车服务，省际包车客运，旅游咨询",上海,嘉定,"嘉定区嘉定镇清河路113号"
上海申宏量具工具有限公司,9131012063050342XF,1989-06-05,N/A,王建军,"129.7600(万元人民币)","量具、量仪、量具液压工具、刀具、金属冲件制造、加工，冷作钣金，自有房屋租赁。【依法须经批准的项目，经相关部门批准后方可开展经营活动】",上海,奉贤,"上海市奉贤区南桥镇沪杭支路16号"
上海城建预制构件有限公司,91310112133385020D,1989-06-05,N/A,龚叶锋,"12,408.0200(万元人民币)","混凝土预制构件、管道、箱涵、桥梁构件、装配式住宅构件、水泥制品、成型钢筋、商品混凝土、砂浆、保温材料、建筑材料、建筑五金的销售，钢结构加工、建筑装饰装修、建筑工程专业设计、施工，仓储",上海,闵行,"上海市闵行区澄江路5号"
上海青浦游艺机玩具厂有限公司,913101181343317968,1989-06-05,N/A,陈琦,"800(万元人民币)","游艺器材，玩具，金加工，附一分支，以下范围限分支机构经营：游艺设备租赁、经营。【依法须经批准的项目，经相关部门批准后方可开展经营活动】",上海,青浦,"青浦区金泽镇（商榻）商洋路258弄11号"
上海曙光特种轴承有限公司,91310105607610016K,1989-06-06,N/A,马志强,"52(万元人民币)","轴承、汽车配件、机械配件．通用设备修理；电工电讯器械，仪器仪表五金橡塑，纺织配件，建筑装璜材；附设分支机构自产自销、加工、批发、零。．代购代销。【依法须经批准的项目，经相关部门批准后方可开展经营活动】",上海,长宁,"上海市长宁区姚虹东路潘家塔8号"
上海市保安服务总公司静安区闸北公司,91310000133041551T,1989-06-06,N/A,龙伟生,"300(万元人民币)","门卫、巡逻、守护、随身护卫、安全检查、安全风险评估、区域秩序维护，研制、开发、设计、安装、保养、维护安全技术防范设备、防火、报警工程和保安装置等。【依法须经批准的项目，经相关部门批准后方可开展经营活动】",上海,N/A,"上海市天目中路600号103室"
上海海辉国际集装箱修理有限公司,91310000607227113J,1989-06-06,N/A,王海建,"142(万美元)","国际货运集装箱修理、保养、例检、预冷、翻新、清洗、堆存、装卸等业务。【依法须经批准的项目，经相关部门批准后方可开展经营活动】",上海,N/A,"上海市安达路240号"
上海远东电器厂,913101101332008660,1989-06-06,股份合作制,刘秀英,"34.6万人民币","电暖风器，镇流器，灯具，触发器，小型变压器，交直流电机，日用电热器具，注塑产品，空压机加工及修理。【依法须经批准的项目，经相关部门批准后方可开展经营活动】",上海,杨浦,"上海市杨浦区许昌路1469弄5号边门"
上海青浦虹桥塑料五金厂,9131011813431120XA,1989-06-07,集体所有制,肖光付,"7.3万人民币","塑料制品，金属弹簧，电机维修，并铝块。【依法须经批准的项目，经相关部门批准后方可开展经营活动】",上海,青浦,"青浦区朱家角镇小港11队"
上海十六铺储运有限公司,91310101132426492Q,1989-06-07,N/A,钱德宝,"50(万元人民币)","二类机动车维修",上海,黄浦,"上海市东江阴街237号"
上海西张春光电梯导轨有限公司,91310120134044447N,1989-06-07,N/A,郑以焕,"955(万元人民币)","电梯导轨，电梯零件，钣金冷作，五金，不锈钢制品加工，经营本企业自产产品的出口业务和本企业所需的机械设备、零配件、原辅材料的进口业务",上海,奉贤,"上海市奉贤区钱桥镇西张村"
上海精茂电子电器厂,913101061330018757,1989-06-08,股份合作制,裴国金,"10万人民币","电子元件。石英电子钟，电子玩具，灯具配件，水电安装。【依法须经批准的项目，经相关部门批准后方可开展经营活动】",上海,静安,"上海市静安区柳营路451号303室"
上海志章纸品包装厂,91310112133391965Y,1989-06-08,个人独资企业,李德志,"N/A","机械，木模制造，修理，机械产品，包装箱生产，纸品包装服务。【依法须经批准的项目，经相关部门批准后方可开展经营活动】",上海,闵行,"上海市闵行区德宏路88号"
上海铁源建筑安装工程有限公司,913102301344145083,1989-06-09,N/A,刘海宁,"2,500(万元人民币)","工业与民用建筑工程施工（叁级），地基与基础工程施工",上海,崇明,"崇明县堡镇镇大通路221号"
上海飞乐音响股份有限公司,91310000132805038E,1989-06-09,N/A,黄金刚,"98,892.2311(万元人民币)","计算机网络技术、智能卡应用、多媒体通信及智能化系统集成等领域的软件、系统开发及四技服务，数码电子及家电、智能卡及终端设备、照明电器、灯具、电光源的销售及技术服务，音响、电子、制冷设备、照明、音视频、制冷、安保电子网络系统工程（涉及专项审批按规定办）设计、安装、调试及技术服务，实业投资，本企业及控股成员企业进出口业务",上海,嘉定,"上海市嘉定区嘉新公路1001号第七幢"
上海浦江电梯安装维修有限公司,91310230134424351Y,1989-06-10,N/A,沈三保,"600(万元人民币)","电梯安装、改造、维修、保养，电梯内部装潢，电梯控制柜制造，电梯及配件、空调设备、建筑装潢材料、五金交电、家用电器的销售，机电设备安装、维修、保养、销售，商务咨询，会务服务，展览展示服务，为国内企业提供劳务派遣服务，附着升降脚手架专业承包二级，起重设备安装工程专业承包三级，质检技术服务。【依法须经批准的项目，经相关部门批准后方可开展经营活动】",上海,崇明,"上海市崇明区陈家镇前裕公路199号7幢108室"
上海嘉百商业投资发展有限公司,9131011413363682XR,1989-06-10,N/A,庞月根,"800(万元人民币)","实业投资，资产管理，物业管理，日用百货、针纺织品及原料、服装鞋帽、工艺品、钢材、建筑装潢材料、劳防用品、机电设备、通讯设备、五金交电、计算机、软件及辅助设备的销售，自有房屋租赁，以下限分支经营：预包装食品",上海,嘉定,"上海市嘉定区塔城东路292号303室、305室"
上海崇明绿华农贸总公司,91310230134426007R,1989-06-10,N/A,费汉昌,"50.6000(万元人民币)","金属材料，木材，建材，橡胶，五金交电，纺针织品，百货，（杂交作物、常规作物、瓜果、蔬菜）种子，化肥，农药，农膜，地产药材收购、销售；食用农产品（除生猪产品）销售；仓储服务；果蔬、粮食种植；预包装食品【不含熟食卤味、不含冷冻",上海,崇明,"崇明县绿华镇"
上海欣东建筑安装工程有限公司,91310230134405898W,1989-06-10,N/A,郭燕萍,"1,000(万元人民币)","土木工程建筑（叁级），园林绿化工程，市政工程，房屋拆解，土方工程，打桩，水电安装，钢结构建筑安装，水泥制品",上海,崇明,"上海市崇明县城桥镇秀山路101号12幢C区5121室"
上海市崇明区农副产品有限公司,913102301344080871,1989-06-10,N/A,陆昀,"250(万元人民币)","棉",上海,崇明,"上海市崇明区城桥镇人民路35号"
上海市闵行区工业供销有限公司,913101121333088858,1989-06-10,N/A,项佩忠,"50(万元人民币)","家用电器、针纺织品、工艺品、木器家具，日用百货、机电设备、机械设备、五金交电、化工原料（除危险化学品、监控化学品、烟花爆竹、民用爆炸物品、易制毒化学品）、消防器材、装饰材料、建筑材料、金属材料",上海,闵行,"上海市闵行区东风一村126号"
上海上审会计师事务所有限公司,91310101132517247R,1989-06-10,N/A,潘久文,"150(万元人民币)","审计查证，验证年检、咨询服务，验证企业资本、出具验资报告，办理企业合并、分立清算等审计业务；设计会计制度、投资项目可行性研究。【依法须经批准的项目，经相关部门批准后方可开展经营活动】",上海,黄浦,"上海市黄浦区河南南路665号18楼"
上海振华工程机械有限公司,91310101132504745J,1989-06-10,N/A,洪容容,"150(万元人民币)","国产烟、酒的零售、普通机械及配件、电器机械及器材、市政机械配件、通用零部件、柴油机配件、汽车配件、五金工具、家用电器、普通机械及电机维修，日用百货，服装鞋帽的销售，打包托运。【依法须经批准的项目，经相关部门批准后方可开展经营活动】",上海,黄浦,"上海市斜土路540号"
