上海南汇压力容器厂有限公司,91310115133969106U,1989-10-20,N/A,徐军,"2,000(万元人民币)","特种设备制造、安装，消防设备组装，水处理设备、机械设备、消防器材、环保设备的销售，消防设施建设工程专业施工，道路货物运输。【依法须经批准的项目，经相关部门批准后方可开展经营活动】",上海,浦东,"浦东新区泥城镇文采路158号"
上海长江电子仪器厂,91310230134420780Q,1989-10-20,股份合作制,王清,"6万人民币","稳压电源，仪器仪表，日用电器，电器柜，汽车电器，电线电缆，五金，普通机械配件，电子元器件。【依法须经批准的项目，经相关部门批准后方可开展经营活动】",上海,崇明,"崇明县长江农场"
上海市工艺品进出口公司南汇玩具联营厂,91310115133983012Y,1989-10-20,N/A,许锡康,"114(万元人民币)","长毛绒，玩具。【依法须经批准的项目，经相关部门批准后方可开展经营活动】",上海,浦东,"浦东新区宣桥镇张家桥车站东首"
上海广达运输有限公司,913102301344042543,1989-10-20,N/A,陈鑫源,"50(万元人民币)","普通货物运输（社会货物运输），化工原料及产品",上海,崇明,"崇明县长江农场黄河路东首"
上海东灵精细化工有限公司,91310115133941306X,1989-10-20,N/A,叶丽香,"258(万元人民币)","甲酚皂、软皂、抗氧化剂（BHA）、感光材料中间体、压敏材料、药化中间体、电子化学品及精细化工、染料助剂的生产、加工和销售，化工原料及产品",上海,浦东,"浦东新区书院镇滨果公路2389号"
上海南院汽车运输有限公司,91310115133903545R,1989-10-20,N/A,施正飞,"98(万元人民币)","普通货物运输，搬运装卸。【依法须经批准的项目，经相关部门批准后方可开展经营活动】",上海,浦东,"浦东新区书院镇书院大街1178号305室"
上海锅炉厂有限公司,91310112133385370K,1989-10-20,N/A,丘加友,"20,748.7000(万元人民币)","电站锅炉、工业锅炉、特种锅炉及其成套设备，生物质能发电设备，太阳能发电设备，核能发电设备，垃圾发电及其他能源设备，分布式能源及储能设备，化工设备，污泥及垃圾气化设备，海洋装备，建筑等钢结构，换热器，压力容器的研发、设计、制造、销售、安装、调试、维修、改造及技术服务，电力工程、化工工程、市政工程、海洋工程，经营本企业自产机电产品、成套设备及相关技术及服务的出口业务，经营本企业生产、科研所需的原辅材料、机械设备、仪器仪表、备品备件、零配件及技术的进口业务，进料加工，无损检测。【依法须经批准的项目，经相关部门批准后方可开展经营活动】",上海,闵行,"闵行区华宁路250号"
上海南汇祝桥磁性元件有限公司,91310115133950376M,1989-10-20,N/A,张昌来,"12(万元人民币)","五金机械、电子元器件、磁性材料制造、加工。【依法须经批准的项目，经相关部门批准后方可开展经营活动】",上海,浦东,"浦东新区祝桥镇金亭公路1346号"
上海洪星橡胶制品厂,91310115133951045M,1989-10-20,个人独资企业,王洪国,"N/A","钢木家具，铁床，塑料制品，钢门窗，橡胶制品，制造加工；五金加工。【依法须经批准的项目，经相关部门批准后方可开展经营活动】",上海,浦东,"浦东新区祝桥镇振兴街4号1幢-714"
上海崇明东平汽车修理有限公司,913102301344282138,1989-10-20,N/A,刘锦平,"10(万元人民币)","汽车各级保养小修。【依法须经批准的项目，经相关部门批准后方可开展经营活动】",上海,崇明,"上海市崇明县城桥镇育麟桥路392号"
上海申华打桩工程有限公司,9131010713292423X0,1989-10-20,N/A,陈贻顺,"100(万元人民币)","打桩工程，建筑装潢工程，水电安装工程（除承装承修承试电力设施），打桩工具及设备租赁",上海,普陀,"上海市普陀区大渡河路1142弄1号307室"
上海久港搪瓷有限公司,91310115133918712L,1989-10-20,N/A,杨永官,"245(万元人民币)","搪瓷制品、五金加工，自有房屋租赁，塑料制品的销售。【依法须经批准的项目，经相关部门批准后方可开展经营活动】",上海,浦东,"浦东新区老港镇南港公路1258号"
上海皓鑫五金制品有限公司,91310115133940661E,1989-10-20,N/A,吴宁皓,"281(万元人民币)","灯具、金属模具、紧固件、五金冲件的销售，电梯部件生产、加工、销售，电梯安装建设工程专业施工，机电设备安装建设工程专业施工，从事货物及技术的进出口业务，道路货物运输",上海,浦东,"浦东新区万祥镇万达路118号1幢、2幢、5幢"
上海夏龙标准件制造有限公司,913101131334251330,1989-10-20,N/A,夏顺龙,"210(万元人民币)","标准件制造；机械零件五金加工；本企业空余厂房出租。【依法须经批准的项目，经相关部门批准后方可开展经营活动】",上海,宝山,"上海市宝山区殷高西路111号101室"
上海良联金属制品有限公司,91310113133429097R,1989-10-20,有限责任公司,姚海鸣,"518万人民币","金属制品加工；金属材料、电线电缆、日用百货、建材、家电、普通劳防用品、棉麻织品批兼零、代购代销；停车场",上海,宝山,"上海市宝山区江杨南路120号"
上海南汇橡胶制品有限公司,91310115133960873G,1989-10-20,N/A,赵建明,"98(万元人民币)","橡胶零件，五金，模具制造，化工原料销售。【依法须经批准的项目，经相关部门批准后方可开展经营活动】",上海,浦东,"浦东新区祝桥镇众济街117号"
上海宝山江南摄影器材有限公司,91310113133425088Y,1989-10-20,N/A,汤文宝,"200(万元人民币)","摄影器材、光学仪器器材、轴承制造；机械五金加工；仓储。【依法须经批准的项目，经相关部门批准后方可开展经营活动】",上海,宝山,"上海市宝山区高境镇寿阳路1301号"
国网上海市电力公司,91310101132224671B,1989-10-20,N/A,钱朝阳,"13,216,206.3898(万元人民币)","发供电供热，燃气经营，电力建设工程施工，建设工程监理服务，电力设备设计、开发、销售及咨询，电力项目的设计、技术开发与咨询，电力设施、设备的运行管理、安装、调试、保养、维修和改造服务，通信建设工程施工及相关设计、咨询、开发，建设工程招标代理，新能源技术开发，从事电力科技、环保科技、节能科技、能源科技领域内技术开发、技术转让、技术咨询、技术服务。【依法须经批准的项目，经相关部门批准后方可开展经营活动】",上海,自贸区,"中国(上海)自由贸易试验区源深路1122号"
上海市浦东新区大团电站锅炉配件厂,91310115133954369T,1989-10-20,个人独资企业,潘展时,"N/A","电站锅炉配件、除氧器垫圈、自锁压板、金属丝网的制造、加工。【依法须经批准的项目，经相关部门批准后方可开展经营活动】",上海,浦东,"浦东新区大团镇洪波村"
上海书院塑料包装厂（普通合伙）,91310115133951950A,1989-10-20,普通合伙,严金育,"N/A","瓶盖的制造、加工。【依法须经批准的项目，经相关部门批准后方可开展经营活动】",上海,浦东,"浦东新区书院镇洋溢港出口处"
上海申江金属材料制品有限公司,913101131334249310,1989-10-20,N/A,谈全伟,"100(万元人民币)","货物储存；金属材料、五金交电、机电产品、机械配件、汽配、电工器材、百货、针纺织品、普通劳防用品、装潢玻璃批发零售；本企业空余房屋出租。【依法须经批准的项目，经相关部门批准后方可开展经营活动】",上海,宝山,"上海市宝山区殷高西路880号423室"
上海跃帆机电有限公司,91310115133934288L,1989-10-20,N/A,乔彬才,"50(万元人民币)","风罩、波型圈、五金、冲件、板金制造加工，道路货物运输",上海,浦东,"浦东新区书院镇新鹏路6号"
上海纪念电器制造有限公司,91310109133426443G,1989-10-20,N/A,李东波,"1,150(万元人民币)","销售电器及配件；物业管理；企业管理；生物科技、计算机、电子科技、通信设备技术专业领域内从事技术开发、技术转让、技术咨询、技术服务；本单位空余厂房出租。【依法须经批准的项目，经相关部门批准后方可开展经营活动】",上海,虹口,"上海市广纪路738号3幢201室"
上海全华能源工程有限公司,913101121333079893,1989-10-20,N/A,陈洪溪,"50(万元人民币)","能源工程，工矿企业改造工程的技术开发，技术咨询，技术服务和工程设备成套，产品设计制造，备品备件供应，机电产品，建材，装潢，设备安装及租赁，办公设备自动化，汽配。【依法须经批准的项目，经相关部门批准后方可开展经营活动】",上海,闵行,"闵行剑川路1115号"
上海市服装进出口公司老港联营服装厂,913101151339182102,1989-10-20,N/A,王龙根,"205.1000(万元人民币)","服装制造及经营服装进出口业务",上海,浦东,"浦东新区老港镇中港镇西首"
上海曼德琳模具有限公司,913101151339641961,1989-10-20,N/A,吴依雯,"80(万元人民币)","五金，电器，塑料，纸箱，不锈钢制品，皮革制品，建筑装潢材料，日用百货，针棉织品，橡胶，泡沫塑料。模具，紧固件，汽车配件，机电产品，金属材料，服装。【依法须经批准的项目，经相关部门批准后方可开展经营活动】",上海,浦东,"浦东新区川沙新镇六灶路100号"
上海邬桥化工机械厂,91310120134056640J,1989-10-21,股份合作制,刘水金,"50万人民币","三辊研磨机，无极调速搅拌机，卧式砂磨机，安瓶粘标机，金属冲件，冷作鈑金，附设一个分支机构",上海,奉贤,"奉贤区邬桥镇渔沥村"
上海坦直仁义木业有限公司,9131011513396521XW,1989-10-22,N/A,季夏才,"1,500(万元人民币)","锯板、木门窗、木制品、人造板、钉木箱的制造、加工、销售，金属材料、建筑材料、五金交电、机电产品、装璜材料、日用百货、木材的销售。【依法须经批准的项目，经相关部门批准后方可开展经营活动】",上海,浦东,"浦东新区新场镇仁义村902号"
上海市南汇火箭塑料机械厂,91310115133905209F,1989-10-22,个人独资企业,丁建国,"N/A","机电设备、机械设备、电线电缆、五金的销售。【依法须经批准的项目，经相关部门批准后方可开展经营活动】",上海,浦东,"上海市浦东新区新泽路25号1幢底楼南二间"
上海平桥吸塑包装制品厂,913101151339203533,1989-10-22,个人独资企业,张国华,"N/A","吸塑包装制品，包装袋、包装箱，制造加工。【依法须经批准的项目，经相关部门批准后方可开展经营活动】",上海,浦东,"浦东新区周浦镇平桥村"
上海吉绚金属材料有限公司,91310230134422436K,1989-10-22,有限责任公司,杨飞,"76万人民币","金属材料、不锈钢冲压件、不锈钢制品的销售。【依法须经批准的项目，经相关部门批准后方可开展经营活动】",上海,N/A,"合兴乡协力村"
上海南汇火箭塑料型材厂,91310115133905241T,1989-10-22,个人独资企业,奚永忠,"N/A","塑料制品、板材、电线电缆、五金机械的销售。【依法须经批准的项目，经相关部门批准后方可开展经营活动】",上海,浦东,"上海市浦东新区川周公路2645号6幢底层西北侧"
上海南汇祝桥机械有限公司,91310115133960689Q,1989-10-22,N/A,叶裕金,"52(万元人民币)","橡塑硫化压机、油压泵、包装机械、注塑机械、钢架结构、金属家具、橡塑五金、电器配件、密封件。【依法须经批准的项目，经相关部门批准后方可开展经营活动】",上海,浦东,"浦东新区祝桥镇川南奉公路5038号"
上海浦东新区东海标准件有限公司,913101151339614467,1989-10-22,N/A,徐锦炎,"500(万元人民币)","紧固件、稳压电源、建筑小五金、防盗铁门、钢带、标准件、机电机械、五金工具的制造、加工，金属材料、电工器材、管道零件、钢家具、模具、橡塑制品、日用百货的销售。【依法须经批准的项目，经相关部门批准后方可开展经营活动】",上海,浦东,"浦东新区祝桥镇东港公路3046号"
上海申江减速机厂有限公司,91310115133950026F,1989-10-22,N/A,张龙根,"57.8000(万元人民币)","减速器、齿轮、蜗轮、蜗杆轴的制造、加工，道路货物运输",上海,浦东,"浦东新区祝桥镇周祝公路3337号"
上海市南汇县祝桥电器五金厂,913101151339809899,1989-10-22,集体所有制,连正根,"3.1万人民币","整流器机床附件。【依法须经批准的项目，经相关部门批准后方可开展经营活动】",上海,浦东,"浦东新区祝桥镇西市街五十九号"
上海周浦冶金材料厂有限公司,913101151339349664,1989-10-22,N/A,唐永飞,"238(万元人民币)","防缩孔剂，保温板，发热板，粘合剂，有色金属，发泡剂，保护渣，增碳剂，引硫砂，脱氧铝，制造，加工，销售。【依法须经批准的项目，经相关部门批准后方可开展经营活动】",上海,浦东,"上海市浦东新区周浦镇周南村"
上海南泰整流器有限公司,9131011513390410XG,1989-10-22,N/A,刘炜,"100(万元人民币)","电力电子产品及原器件、机电产品的制造、加工、销售，电子科技专业领域内的技术开发、技术咨询、技术服务、技术转让。【依法须经批准的项目，经相关部门批准后方可开展经营活动】",上海,自贸区,"中国（上海）自由贸易试验区康桥东路905弄3号"
上海崇明合兴羊毛衫有限公司,913102301344228155,1989-10-22,N/A,施洪顺,"126.3000(万元人民币)","羊毛衫制造。【依法须经批准的项目，经相关部门批准后方可开展经营活动】",上海,崇明,"上海市崇明区港沿镇合兴村135丘"
上海南汇瓦屑塑料织印厂,913101151339204689,1989-10-22,股份合作制,朱友生,"150.58万人民币","塑料编织，包装袋，纸袋，包装印刷",上海,浦东,"浦东新区周浦镇周祝公路1768号"
上海朝阳锻压机床厂有限公司,91310115133925760M,1989-10-22,N/A,丘添元,"1,512.5350(万元人民币)","锻压机械制造、销售。【依法须经批准的项目，经相关部门批准后方可开展经营活动】",上海,浦东,"浦东新区航头镇沪南路5285号"
上海泓光机电物资有限公司,91310101132425481D,1989-10-22,N/A,陈幼方,"50(万元人民币)","机电物资，仪器仪表，电工电器，橡塑五金机械，磨料模具，电动器具，气动工具，工业密封产品，日用百货，办公用品。【依法须经批准的项目，经相关部门批准后方可开展经营活动】",上海,黄浦,"复兴东路649号－651号"
上海三阳泰食品有限公司,91310115133938772A,1989-10-22,N/A,毛逸清,"50(万元人民币)","食品流通。【依法须经批准的项目，经相关部门批准后方可开展经营活动】",上海,浦东,"上海市浦东新区康沈路2038号1-2层"
上海横沔特种电线电缆有限公司,91310115133905137N,1989-10-22,N/A,曹国安,"100(万元人民币)","电线、电缆、漆包线、黑铁丝、塑包、弹簧铜拉丝、金属的加工，机械配件、塑料造粒的制造、加工、销售，自有房屋租赁",上海,自贸区,"中国（上海）自由贸易试验区康桥东路819号"
上海市浦东新区东海服装有限公司,91310115133960224C,1989-10-22,N/A,沈兴龙,"580(万元人民币)","服装，帽子，领带，服饰制造加工。【依法须经批准的项目，经相关部门批准后方可开展经营活动】",上海,浦东,"浦东新区祝桥镇盐朝公路789号"
上海信佳电讯有限公司,91310101132409254M,1989-10-22,N/A,任海峰,"200(万元人民币)","空白磁带，家用电器，照相器材，通讯器材，电子器材，照明电器，纺织品，日用百货，服装，五金，文化用品，办公用品。【依法须经批准的项目，经相关部门批准后方可开展经营活动】",上海,黄浦,"上海市黄浦区学院路129号"
上海南汇瓦屑塑料电器厂,91310115133920126X,1989-10-22,个人独资企业,金根初,"N/A","塑料包装袋的编织加工，金属制品、陶瓷制品的加工，服装的制造、加工。【依法须经批准的项目，经相关部门批准后方可开展经营活动】",上海,浦东,"浦东新区周浦镇瓦屑瓦南村6组"
上海外贸瓦屑包装袋有限公司,913101151339208390,1989-10-22,N/A,朱顺权,"315(万元人民币)","复合包装、纸袋、包装纸、塑料拉丝、塑料织布、涂塑的生产，商标标识、印制制版、包装装潢印刷，从事货物进出口业务。【依法须经批准的项目，经相关部门批准后方可开展经营活动】",上海,浦东,"上海市浦东新区周浦镇瓦屑社区建设路74号"
上海浦东新区沙北金属制品厂,9131011513392571XA,1989-10-22,集体所有制,顾新伯,"17.2万人民币","五金制品，纸盒的制造、加工。【依法须经批准的项目，经相关部门批准后方可开展经营活动】",上海,浦东,"浦东新区航头镇梅园村沙北990号"
上海崇明港东汽车减振器配件厂,91310230134401184T,1989-10-23,股份制,施建生,"10万人民币","汽车配件、五金冲件、塑料制品、胶木电器、纸绳、纺织品的加工。【依法须经批准的项目，经相关部门批准后方可开展经营活动】",上海,崇明,"崇明县港东乡兴农村"
上海海工工程机械厂,91310110133240366J,1989-10-23,国有企业,缪士林,"100万人民币","工程机械设备成套制造、修理，汽车修理，起重设备修理，机械设备租赁服务，机械配件加工，冷作；销售工程机械配件。【依法须经批准的项目，经相关部门批准后方可开展经营活动】",上海,杨浦,"上海市杨浦区虬江码头3号"
上海永恒电测仪器有限公司,91310230134415033H,1989-10-23,有限责任公司,郑建利,"40万人民币","电测仪器、电测元件、仪器仪表、电子衡器配件、机械产品加工。【依法须经批准的项目，经相关部门批准后方可开展经营活动】",上海,崇明,"崇明县港西镇南盘效镇"
上海通顺实业总公司,91310112133304016R,1989-10-23,N/A,朱炳奎,"814(万元人民币)","内河货运，代办运输服务。【依法须经批准的项目，经相关部门批准后方可开展经营活动】",上海,闵行,"闵行浦江路17号"
上海金全织造有限公司,913102301344015049,1989-10-23,N/A,倪嘉雯,"1,581(万元人民币)","织布，棉纺生产加工，服装，呢绒，防缩拉绒销售，稻草、木柴收购，从事货物及技术的进出业务。【依法须经批准的项目，经相关部门批准后方可开展经营活动】",上海,崇明,"上海市崇明县港西镇静南村"
上海申嘉文教用品有限公司,913101176304434635,1989-10-23,N/A,庄毅,"337.2500(万元人民币)","文教用品，铅笔及配套零件的制造、销售。【依法须经批准的项目，经相关部门批准后方可开展经营活动】",上海,松江,"上海市松江区新浜镇文兵路120号"
上海大立包装器材厂有限公司,913101141336278943,1989-10-23,N/A,袁利勤,"22(万元人民币)","注塑，塑料制品、塑料薄膜、安瓿瓶、彩钢门窗、纸盒的加工、制造。【依法须经批准的项目，经相关部门批准后方可开展经营活动】",上海,嘉定,"上海市嘉定区徐行镇嘉行公路1305号1幢"
上海轻良造纸机械有限公司,91310118134328722F,1989-10-23,有限责任公司,苏桂川,"300万人民币","生产加工造纸机械、木工机械，板箱包装。【依法须经批准的项目，经相关部门批准后方可开展经营活动】",上海,青浦,"青浦区白鹤镇外青松公路3201号"
上海润盛百货合作公司,913101081330085328,1989-10-24,N/A,吴玉琪,"60(万元人民币)","服装鞋帽，皮革制品，日用百货，针棉织品，五金交电，家用电器，文体办公用品，照相器材，钟表，黄金饰品，装璜材料，机电产品，家俱。【依法须经批准的项目，经相关部门批准后方可开展经营活动】",上海,闸北,"中兴路1412号"
上海神安实业有限公司山景建材经营部,91310106069319298R,1989-10-24,N/A,章家麟,"N/A","销售装潢材料、日用五金、玻璃、日用百货、日用杂品、标牌、文化用品、非金银工艺品。【依法须经批准的项目，经相关部门批准后方可开展经营活动】",上海,静安,"上海市静安区康定路434号"
上海神安实业有限公司元清装饰经营部,91310106063798304M,1989-10-24,N/A,王道明,"N/A","日用五金，装璜建筑材料，文化用品。【依法须经批准的项目，经相关部门批准后方可开展经营活动】",上海,静安,"上海市静安区石门一路42号"
上海正泰消防器材有限公司,9131012013401394XQ,1989-10-24,N/A,孙庆法,"50(万元人民币)","金属防火门窗、木制防火门窗、防盗门、电器开关、电熨斗、金属切削、冷作钣金、五金机械、防火玻璃制造、加工",上海,奉贤,"上海市奉贤区青村镇工农村258号"
上海新新百货公司,913101061330005498,1989-10-24,N/A,娄永新,"40(万元人民币)","百货、通讯器材、五金交电、黄金饰品、家具、建筑及装璜材料、工艺品、汽车配件、机械设备、机电设备、电梯、自动扶梯的销售。【依法须经批准的项目，经相关部门批准后方可开展经营活动】",上海,静安,"上海市静安区共和新路567号"
上海神安实业有限公司胶奏文具礼品商店,91310106832807333R,1989-10-24,N/A,江根荣,"N/A","文具，文化用品，日用百货，日用杂品，餐具，服装，日用五金，装潢材料，电工器材。【依法须经批准的项目，经相关部门批准后方可开展经营活动】",上海,静安,"上海市静安区康定路736号"
上海市闸北区金属材料公司,91310106133010675C,1989-10-24,N/A,钱万华,"332.6000(万元人民币)","金属材料及原料，机电设备，建筑材料，五金交电，家用电器，汽车配件，日用杂品，日用百货，制冷设备安装、维修，家用电器安装、维修。【依法须经批准的项目，经相关部门批准后方可开展经营活动】",上海,静安,"永和路163号-183号"
上海润盛百货合作公司闻喜店,913101088330008736,1989-10-24,N/A,吴玉琪,"N/A","服装鞋帽，日用百货，针纺织品，五金交电，家用电器，文体办公用品，照相器材，钟表。皮革制品，装璜材料，机电产品。【依法须经批准的项目，经相关部门批准后方可开展经营活动】",上海,闸北,"闻喜路920号"
上海宝山丰乐五金塑料厂,913101131334345311,1989-10-24,国有企业,朱启元,"36万人民币","五金、模具加工；塑料制粒；塑料制品、包装材料制造加工。【依法须经批准的项目，经相关部门批准后方可开展经营活动】",上海,宝山,"上海市宝山区永乐路349号A－072室"
上海戈夯电器有限公司,91310120134057790L,1989-10-24,有限责任公司,蔡烈,"60万人民币","低压电器控制设备，医疗器械零部件加工，冷作钣金。【依法须经批准的项目，经相关部门批准后方可开展经营活动】",上海,奉贤,"上海市奉贤区柘林镇南胜村南宅607号第6幢"
上海古浦冷轧带钢有限公司,91310118134317601M,1989-10-24,N/A,钱亚平,"250(万元人民币)","销售金属制品、五金冲压件、钣金件、塑料制品。【依法须经批准的项目，经相关部门批准后方可开展经营活动】",上海,青浦,"上海市青浦区南巷路1号2层H区220室"
上海申马钢制家具有限公司,913101141336295311,1989-10-24,N/A,张会龙,"230(万元人民币)","钢制家具生产、加工，自有房屋租赁，物业管理，仓储。【依法须经批准的项目，经相关部门批准后方可开展经营活动】",上海,嘉定,"嘉定区马陆镇宝安公路2764号"
上海奉贤金汇汽车配件厂,913101201340019735,1989-10-24,集体所有制,乔益林,"4.3万人民币","汽车配件，金属冲件，针织化学助剂，金属切削，冷作钣金，塑料零件。【依法须经批准的项目，经相关部门批准后方可开展经营活动】",上海,奉贤,"奉贤区金汇镇新强村"
上海神安实业有限公司井记百货商店,91310106MA1FY61N9K,1989-10-24,N/A,朱龙喜,"N/A","日用百货、杂品，服装，装潢五金，人力车配件，非金银工艺美术品，文具，花卉。",上海,静安,"上海市静安区常德路629号"
中储发展股份有限公司上海沪闵分公司,913101121333082289,1989-10-25,N/A,韦明,"N/A","仓储，物资维护保养，金属材料，矿产品、化工原料",上海,闵行,"上海市闵行区剑川路2280号"
上海宝山回转支承有限公司,91310113133418945J,1989-10-25,N/A,谭妙生,"100(万元人民币)","汽车半挂车回转支承架生产、加工、销售；五金加工；钢材、汽配销售；自有房屋出租。【依法须经批准的项目，经相关部门批准后方可开展经营活动】",上海,宝山,"上海市宝山区罗店开发区（毛家路181号）"
