上海市黄浦住宅建设发展有限公司,91310101132409916F,1989-08-10,N/A,严泗祥,"5,000(万元人民币)","房屋建筑工程施工，地基与基础工程，建筑装修装饰工程，机电设备安装工程，钢结构工程，市政公用工程；建筑材料，金属材料；附设分支机构。【依法须经批准的项目，经相关部门批准后方可开展经营活动】",上海,黄浦,"上海市黄浦区白渡路256号339室A座"
上海南园设备检修有限公司,913101151339645400,1989-08-10,N/A,曹引官,"258(万元人民币)","道路货物运输，工业设备除垢清洗，机械设备、阀门、管道、制冷设备安装维修清洗（锅炉清洗），防腐油漆，管道保温，钣金加工，机电设备及配件、机械设备及配件的销售，工业设备、换热设备的维修、保养",上海,浦东,"浦东新区南汇新城镇征海村168号A幢101室"
上海市嘉定区曹王供销合作社生产资料门市部,91310114833608942L,1989-08-10,集体分支机构（非法人）,唐仁明,"N/A","薄膜、农具药械、机油、胶粘胶补、玻璃、脚盆、纤维板、便桶、胶合板、五金、建材、装璜材料、化肥、农药零售.【依法须经批准的项目，经相关部门批准后方可开展经营活动】",上海,N/A,"嘉定区曹王镇"
上海汽轮机厂有限公司,91310112133385442C,1989-08-10,N/A,阳虹,"24,667.5000(万元人民币)","汽轮机及辅机，燃气轮机及辅机，工矿备件，一、二级压力容器制造，工业设计，汽轮发电机组设计制造，二回路系统研发生产，发电和驱动设备的工程成套业务，设备维修，计量和理化检测，丙级建筑设计，纺织机械；鼓风、压缩、柴油、抽油机，食品机械，钢锭及铸件，公路、船舶货运，码头装卸，汽轮机动力机械四技服务，从事货物及技术的进出口业务。【依法须经批准的项目，经相关部门批准后方可开展经营活动】",上海,闵行,"闵行区江川路333号"
上海嘉定安亭装饰配件厂,91310114133620545D,1989-08-10,集体所有制,施世华,"294万人民币","铝合金门窗，吊顶及配件，生活用不锈钢制品，装饰配件，机械配件，吹塑；木制包装，小型轧钢加工，五金加工＊。",上海,嘉定,"上海市嘉定区安亭镇兰塘村"
上海景鸿贸易有限公司广林新包装分公司,913101011324141681,1989-08-10,N/A,徐水妙,"N/A","棕麻制品，塑料制品，包装材料，金属材料，装潢材料，五金配件，机电产品，电器维修，旧麻袋、旧塑料包装材料，酒类，办公用品，日用品，一般劳防用品，食用农产品（除生猪产品）；零售：预包装食品",上海,黄浦,"上海市黄浦区跨龙路23号2幢-1"
上海嘉定江桥荣泽塑料包装厂,913101141336101361,1989-08-10,集体所有制,归荣根,"118万人民币","包装装潢袋，编织袋。【依法须经批准的项目，经相关部门批准后方可开展经营活动】",上海,嘉定,"嘉定区江桥镇曹安路8号桥"
上海大通仪表有限公司,91310230134404879N,1989-08-11,N/A,陈福源,"18,000(万元人民币)","仪器仪表、阀门、塑料制品的生产、销售，维修服务，从事货物及技术的进出口业务。【依法须经批准的项目，经相关部门批准后方可开展经营活动】",上海,崇明,"上海市崇明区建设镇蟠龙公路999号"
上海市崇明建设玻璃仪器厂有限公司,913102301344071569,1989-08-11,N/A,陈依伦,"10.3800(万元人民币)","玻璃仪器制造，仪器仪表、化工产品",上海,N/A,"下三星镇东首"
上海市闸北区东方印刷装璜服务部有限公司,91310106133004152R,1989-08-11,N/A,许景海,"50(万元人民币)","零件印刷，打印，印刷机械及配件、铅字、灯具、家用电器、日用百货、服装、电工器材、纸张、标准件、五金工具的销售。",上海,静安,"上海市静安区华兴路121弄1、3号1楼"
上海市建设摩托车配件厂,91310230134407607K,1989-08-11,股份合作制,俞金达,"151.3万人民币","摩托车配件、小五金的加工与制造。【依法须经批准的项目，经相关部门批准后方可开展经营活动】",上海,崇明,"崇明县下三星镇北"
上海青浦练塘商业配货中心有限公司顾巷代购代销店,91310118MA1JL7DC0F,1989-08-11,N/A,陆文弟,"N/A","零售预包装食品（含冷冻冷藏，不含熟食卤味）、乳制品",上海,青浦,"青浦区练塘镇顾巷1队39号"
上海宏福酿造有限公司,91310230134401619F,1989-08-11,N/A,褚爱华,"50(万元人民币)","销售：预包装食品【不含熟食卤味、不含冷冻（冷藏）食品】，酒类商品的销售（限分支机构经营），电子元件、纺织品、服装的生产、销售，建筑装璜材料、五金机电配件、日用百货、清洁器材的销售，保洁清洗服务，",上海,崇明,"崇明区大同镇浜东村"
上海周浦化工利用有限公司,913101151339380005,1989-08-14,N/A,马永明,"100(万元人民币)","聚铁净水剂，废酸综合利用；，五金机械、模具、制造、加工；室内装潢；商务信息咨询；化工原料",上海,浦东,"浦东新区周浦镇周南村"
上海人民电机厂有限公司,91310118132816693E,1989-08-14,N/A,程耀文,"2,000(万元人民币)","销售交流电动机、各类电泵、特殊屏蔽电机、各类电机、农机配件。【依法须经批准的项目，经相关部门批准后方可开展经营活动】",上海,青浦,"上海市青浦区白石路2628号1幢3层C区332室"
上海上房绿建花鸟市场经营管理有限公司,913101131334009640,1989-08-14,N/A,张逸俊,"10(万元人民币)","为市场内经营者提供管理服务、场地出租；绿化工程；商务信息咨询；绿化工程项目咨询。【依法须经批准的项目，经相关部门批准后方可开展经营活动】",上海,宝山,"上海市宝山区爱晖路358号－500号"
上海假肢厂有限公司,91310106132805185U,1989-08-14,N/A,吴祖明,"300(万元人民币)","假肢，矫形器，病理鞋，假眼，假耳，假乳房，轮椅，拐杖，残疾人康复用品，老年人健康器具",上海,静安,"上海市静安区胶州路207号"
上海光明广告有限公司,913101201340562536,1989-08-14,N/A,何水章,"200(万元人民币)","设计、制作、发布、代理国内各类广告",上海,奉贤,"上海市奉贤区奉浦大道97号1023室"
上海衡昌实业有限公司,9131011513395000XL,1989-08-14,N/A,阮小龙,"800(万元人民币)","砖的制造、加工，建筑材料、金属材料的销售，商务信息咨询，花卉苗木种植，土石方建设工程专业施工，建筑装修装饰建设工程专业施工，地基与基础建设工程专业施工，计算机领域内的技术开发、技术服务、技术咨询、技术转让。【依法须经批准的项目，经相关部门批准后方可开展经营活动】",上海,浦东,"浦东新区祝桥镇祝西村"
上海汽车配件修配厂,913101061328126179,1989-08-14,股份合作制,汪子敏,"378.7万人民币","修理、制造、加工、销售机动车配件、非标电器、滑触线，附设分厂。【依法须经批准的项目，经相关部门批准后方可开展经营活动】",上海,静安,"上海市威海路333号"
上海市嘉定区饮食服务有限公司秋霞楼商场,91310114833615229J,1989-08-14,N/A,陈忠平,"N/A","五金交电、劳防用品、计量器材、百货、针纺织品、工艺品（除金银）、钢材、水泥、玻璃、建材、胶合板、装潢材料、仪器仪表、摇摆机、文体用品的销售，酒类（不含散装酒），预包装食品",上海,嘉定,"上海市嘉定区嘉定镇清河路6号"
上海泰康饼干机械总厂,91310120134020883Q,1989-08-14,股份制,何永林,"50万人民币","食品工业专用设备制造，暖通设备，建筑机械，风口，冷作钣金，木浆烘干整理，附设一个分支机构。【依法须经批准的项目，经相关部门批准后方可开展经营活动】",上海,奉贤,"上海市奉贤区胡桥镇立新村"
上海宝新电器厂,91310113133443366Q,1989-08-14,股份合作制,蔡中俭,"11.38万人民币","接触器；开关；低压电器零件；胶木；塑料制品；接线端子。【依法须经批准的项目，经相关部门批准后方可开展经营活动】",上海,宝山,"上海市宝山区罗南乡蔡家弄村"
上海工合广告展览有限公司,91310104132623939F,1989-08-14,N/A,裘东明,"100(万元人民币)","承办国内外各类广告设计、制作、发布、代理业务",上海,徐汇,"上海市徐汇区斜土路1175号2202室"
上海罗泾耐火材料有限公司,91310113133444692P,1989-08-14,N/A,王强,"300(万元人民币)","耐火材料制造（限分支机构经营）、加工（限分支机构经营）；冶金辅料（除专项规定）生产、加工（限分支机构经营）；普通机械设备制造",上海,宝山,"上海市宝山区飞黄路220弄16号1幢"
上海嘉定新澄锻造有限公司,91310114133633231C,1989-08-14,N/A,陈兴,"145(万元人民币)","五金加工、锻打，钢结构件、橡塑五金、水暖洁具的销售。【依法须经批准的项目，经相关部门批准后方可开展经营活动】",上海,嘉定,"嘉定区澄浏中路3658号"
上海青浦液压机械总厂,91310118134317433K,1989-08-15,股份合作制,沈培勤,"90万人民币","液压工具和压缩机连杆系列产品，毛纺针梳机和油泵及机械加工产品。【依法须经批准的项目，经相关部门批准后方可开展经营活动】",上海,青浦,"青浦区白鹤镇白石公路2864号"
上海市保安服务总公司静安区公司,91310000132816087F,1989-08-15,N/A,王忠,"1,000(万元人民币)","门卫、巡逻、守护、随身护卫、安全检查、安全风险评估、区域秩序维护，公共安全防范工程，建筑智能化工程，计算机系统集成，音响、环保、空调工程设计、安装、施工维修，机电、电子、消防产品、节能环保设备、建材、文教用品销售，物业管理，室内装潢，企业管理咨询。【依法须经批准的项目，经相关部门批准后方可开展经营活动】",上海,静安,"上海市静安区武宁南路480弄20号6楼"
上海梅氏华实业有限公司,91310114133623156G,1989-08-15,N/A,陈刚,"200(万元人民币)","纺织原料、服装、棉纱、棉布的销售。【依法须经批准的项目，经相关部门批准后方可开展经营活动】",上海,嘉定,"上海市嘉定区嘉定工业区嘉唐公路1633号"
中国建设银行股份有限公司上海田林支行,91310104832611226N,1989-08-15,N/A,胡之昊,"N/A","经中国银行业监督管理委员会批准并由总",上海,徐汇,"上海市徐汇区田林路16号"
上海晓红轴承有限公司,913101141336331353,1989-08-15,N/A,葛长青,"168(万元人民币)","轴承的销售，自有房屋租赁。【依法须经批准的项目，经相关部门批准后方可开展经营活动】",上海,嘉定,"嘉定区马陆镇浏翔公路3075号"
上海双安工贸合作公司,91310114630440967W,1989-08-16,N/A,陆文斌,"804(万元人民币)","桑塔纳轮胎装配，仓储，工位器具修理，五金加工，蓬垫、农副产品、百货、五金、钢材、建材、装潢材料的销售。【依法须经批准的项目，经相关部门批准后方可开展经营活动】",上海,嘉定,"上海市嘉定区曹安路5277号"
上海住远工程造价咨询有限公司,91310230132712130K,1989-08-16,N/A,周光人,"200(万元人民币)","甲级工程造价咨询。【依法须经批准的项目，经相关部门批准后方可开展经营活动】",上海,崇明,"上海市崇明区城桥镇育麟桥路293号2号楼205室"
上海交达科技实业公司,9131010613301377X2,1989-08-16,N/A,高正平,"30(万元人民币)","船舶工程、纺织、机电、轻工、化工、光盘复印专业领域四技服务，经销自身开发产品。【依法须经批准的项目，经相关部门批准后方可开展经营活动】",上海,静安,"中华新路272弄5号204室"
上海青浦沈巷生活资料商店有限公司安庄代购代销店,91310118MA1JL1GD19,1989-08-16,N/A,陆四金,"N/A","销售预包装食品（不含熟食卤味、含冷冻（冷藏）食品）、散装食品（不含熟食卤味、含冷冻",上海,青浦,"青浦区朱家角镇沈巷安庄村127号"
上海青浦朱家角供销社农村中心商店有限公司马家埭代购代销店,91310118MA1JL0Y15H,1989-08-16,有限责任公司,汤辉忠,"N/A","零售预包装食品",上海,N/A,"青浦区朱家角镇马家埭村"
上海申江旅游服务有限公司,91310101132436690M,1989-08-16,N/A,秦伟君,"240(万元人民币)","出租汽车业务，旅游小商品，日用百货，体育用品，健身器材。【依法须经批准的项目，经相关部门批准后方可开展经营活动】",上海,黄浦,"上海市黄浦区白渡路256号314室"
上海青浦沈巷生活资料商店有限公司李庄代购代销店,91310118MA1JL1H01H,1989-08-16,N/A,沈吉平,"N/A","零售预包装食品",上海,青浦,"青浦区朱家角镇（沈巷）李庄村"
上海青浦沈巷生活资料商店有限公司保卫代购代销店,91310118MA1JL1GX56,1989-08-16,N/A,夏雪龙,"N/A","零售预包装食品",上海,青浦,"青浦区朱家角镇（沈巷）保卫村"
上海青浦沈巷生活资料商店有限公司张马代购代销店,91310118MA1JL1H957,1989-08-16,N/A,阮伟忠,"N/A","零售预包装食品",上海,青浦,"青浦区朱家角镇（沈巷）张马村"
上海青浦沈巷生活资料商店有限公司星光代购代销店,91310118MA1JL1H52R,1989-08-16,有限责任公司,吴雪军,"N/A","零售预包装食品",上海,N/A,"青浦区朱家角镇（沈巷）星光村"
上海青浦沈巷生活资料商店有限公司倪马代购代销店,91310118MA1JL1GG6U,1989-08-16,N/A,钱云其,"N/A","零售预包装食品",上海,青浦,"青浦区朱家角镇（沈巷）倪马村"
上海东方造纸设备有限公司,91310101132429538G,1989-08-16,N/A,顾国平,"50(万元人民币)","轻工机械产品，机电产品设计，技术服务，安装纸机设备及备品备件，技术咨询、开发、协作，攻关纸机设备图纸，日用杂品，日用化学制品。【依法须经批准的项目，经相关部门批准后方可开展经营活动】",上海,黄浦,"上海市陆家浜路976号807室"
上海华艺异型砂轮厂有限公司,913101011324200585,1989-08-16,N/A,吴城英,"50(万元人民币)","医用砂石针，珩磨砂轮，普通超硬磨料磨具，小五金的加工，五金工具，电动工具，机电设备，汽车配件，金属材料，建筑材料，塑料原料及制品，纺织品的销售。",上海,黄浦,"上海市黄浦区陆家浜路285号907室A座"
上海沪南橡胶制品有限公司,91310115133910315D,1989-08-16,有限责任公司,郑国跃,"339.3万人民币","橡胶零件，牛奶瓶纸盖，乳品包装用品的制造，自有房屋租赁。【依法须经批准的项目，经相关部门批准后方可开展经营活动】",上海,浦东,"浦东新区惠南镇城南路42号"
中国石化销售有限公司上海南汇加油站,91310115833907694X,1989-08-16,N/A,王幼强,"N/A","汽油、煤油、柴油零售，机油、油品包装容器、日用百货、通信设备及相关产品、一类医疗器械、汽车用品的销售，洗车，预包装食品（含冷冻冷藏、不含熟食卤味）、乳制品",上海,浦东,"浦东新区惠南镇车站路28号"
上海青浦沈巷生活资料商店有限公司邱姚代购代销店,91310118MA1JL1GEX1,1989-08-16,N/A,吴阿旺,"N/A","零售预包装食品",上海,青浦,"青浦区朱家角镇（沈巷）邱姚村"
上海青浦沈巷生活资料商店有限公司和平代购代销店,91310118MA1JL1GF81,1989-08-16,N/A,谢志坚,"N/A","零售预包装食品",上海,青浦,"上海市青浦区和平村"
上海南市百货商场有限公司,9131010113242995XA,1989-08-16,N/A,夏金荣,"50(万元人民币)","百货，五金交电，通讯器材（除无线），文化用品，纸张，建筑材料，针纺织品，自行车，助动车，工艺品，电器维修，零售：预包装食品",上海,黄浦,"上海中山南路1700号"
上海青浦沈巷生活资料商店有限公司建新村代购代销店,91310118MA1JL1H44Y,1989-08-16,N/A,马惠云,"N/A","销售预包装食品（不含熟食卤味、含冷冻（冷藏）食品）、散装食品（不含熟食卤味、含冷冻",上海,青浦,"青浦区朱家角镇沈巷建新村228号"
上海青浦沈巷生活资料商店有限公司王新代购代销店,91310118MA1JL1H289,1989-08-16,N/A,杨海金,"N/A","本经营场所内从事卷烟、雪茄烟零售，零售预包装食品",上海,青浦,"青浦区朱家角镇(沈巷)沈砖路2205号"
上海市黄渡机械厂,913101141336152873,1989-08-16,个人独资企业,邢培元,"N/A","起重机械制造、安装、维修，五金加工，钢结构件加工，机械设备租赁。【依法须经批准的项目，经相关部门批准后方可开展经营活动】",上海,嘉定,"嘉定区黄渡镇星塔村"
上海海林大酒店有限公司,9131010613308093XR,1989-08-16,N/A,钟林,"73(万元人民币)","旅馆，餐饮服务，理发店，日用百货、食用农产品、食品销售，烟草专卖零售。【依法须经批准的项目，经相关部门批准后方可开展经营活动】",上海,静安,"沪太路975号"
上海华江电器设备有限公司,91310101132420306T,1989-08-16,N/A,陈依萍,"120(万元人民币)","可控硅电子开关系列三相电器控制柜电机及修理，金属冲制件，照明灯具，光学制品，附设分支机构。【依法须经批准的项目，经相关部门批准后方可开展经营活动】",上海,黄浦,"上海市黄浦区会馆街38号"
上海青浦沈巷生活资料商店有限公司童南代购代销店,91310118MA1JL1GR65,1989-08-16,N/A,何正明,"N/A","零售预包装食品",上海,青浦,"青浦区朱家角镇（沈巷）童南村"
上海青浦沈巷生活资料商店有限公司张巷代购代销店,91310118MA1JL1H364,1989-08-16,N/A,徐永生,"N/A","零售预包装食品",上海,青浦,"青浦区朱家角镇（沈巷）张巷村"
上海华兴机械厂,913101121333006563,1989-08-17,集体所有制,阮卫国,"200万人民币","机械产品，锰钢件；日用五金配件。【依法须经批准的项目，经相关部门批准后方可开展经营活动】",上海,闵行,"上海市闵行区华坪路5号"
上海嘉诚汽车配件厂,913101141336325707,1989-08-17,股份合作制,仇林元,"150万人民币","汽车配件，机械配件，五金，塑料胶木件，附设：经营部＊。【依法须经批准的项目，经相关部门批准后方可开展经营活动】",上海,嘉定,"上海市嘉定区戬浜镇周家村"
上海崇明新河粮油有限公司,9131023013441708XM,1989-08-17,N/A,沈悦敏,"50(万元人民币)","粮油收购，粮食销售，饲料，建材，百货，五金交电，装饰材料，汽车配件，金属材料的销售，电器修理。【依法须经批准的项目，经相关部门批准后方可开展经营活动】",上海,崇明,"上海市崇明县新河镇西河沿3号1室"
上海市保安服务总公司闵行区二公司,9131000013330661X0,1989-08-17,N/A,朱卫文,"3,000(万元人民币)","门卫、巡逻、守护、随身护卫、安全检查、安全风险评估、区域秩序维护，研制、开发、设计、安装、保养、维护安全技术防范设备、防火、报警工程和保安装置，电子工程，建筑智能化工程，为国内企业提供劳务派遣服务。【依法须经批准的项目，经相关部门批准后方可开展经营活动】",上海,闵行,"上海市闵行区沪闵路269号13号楼4楼"
上海市崇明县卫东冰箱配件厂,91310230134426744C,1989-08-17,股份合作制,高冠军,"30万人民币","冰箱配件、铝铸件、石印手帕、塑料制品、液压附件、木制品、玻璃雕刻、配电箱、厚膜板、针织内衣、服装、羊毛衫的加工与制造，木材收购。【依法须经批准的项目，经相关部门批准后方可开展经营活动】",上海,崇明,"崇明县新民镇卫东村"
上海电线五厂有限公司,9131011413360377XC,1989-08-17,N/A,王旭东,"1,400(万元人民币)","电线、电缆、电源插头线、塑料套管及相关产品、相关材料制造、加工。【依法须经批准的项目，经相关部门批准后方可开展经营活动】",上海,嘉定,"嘉定区南翔镇火车站路301号"
上海金闵建筑装潢工程有限公司,91310112133371171N,1989-08-17,N/A,王毓志,"100(万元人民币)","水电设备安装，修理，拷铲油漆，装修门面，土建，房屋修理，箱类制作，市政工程，设备安装，设备修理，绿化，建材，装潢材料，灯具。【依法须经批准的项目，经相关部门批准后方可开展经营活动】",上海,闵行,"闵行区龙吴路5530弄85号"
上海嘉定汽车检测有限公司,91310114133617944U,1989-08-18,N/A,高文兴,"200(万元人民币)","汽车、摩托车检测，五金加工，机动车照像。【依法须经批准的项目，经相关部门批准后方可开展经营活动】",上海,嘉定,"嘉定区菊园新区六里村嘉安公路2599号"
上海市嘉定区饮食服务有限公司,91310114133639174F,1989-08-18,N/A,陈忠平,"800(万元人民币)","限分支机构经营食品和饮食，服装、百货、五金交电、工艺品、针纺织品、计量器具、文体用品、建材、电脑的销售，自有房屋租赁，物业管理，市场营销策划，商务咨询，附设分支机构。【依法须经批准的项目，经相关部门批准后方可开展经营活动】",上海,嘉定,"嘉定区北大街55号－65号"
上海红星包装材料有限公司,913102301344198945,1989-08-18,N/A,张德庆,"150(万元人民币)","纸盒、纸箱的加工、制造，纸盒纸箱印刷。【依法须经批准的项目，经相关部门批准后方可开展经营活动】",上海,N/A,"上海市红星农场"
上海祝桥电镀有限公司,9131011513395086X8,1989-08-18,N/A,顾林昌,"107.8436(万元人民币)","电镀抛光，金属表面处理，机械五金加工，橡塑制品、服装、箱包、针棉织品、羊毛衫、服装辅料的制造、加工、销售。【依法须经批准的项目，经相关部门批准后方可开展经营活动】",上海,浦东,"浦东新区祝桥镇工业城甲勤星村"
上海前进轴瓦有限公司,91310230134423412C,1989-08-19,N/A,杨金荣,"160(万元人民币)","轴瓦，机械配件生产加工。【依法须经批准的项目，经相关部门批准后方可开展经营活动】",上海,崇明,"崇明县前进农场西首"
上海长江无线电元件五厂有限公司,91310230134420684F,1989-08-19,N/A,陆建平,"108(万元人民币)","电子元件、仪器仪表、电器、机械及配件、汽车配件、注塑件、接插件、通讯器材、电子玩具、灯具、服装装饰品的制造销售。【依法须经批准的项目，经相关部门批准后方可开展经营活动】",上海,崇明,"崇明县长江农场"
上海市新河电器厂,91310230134411075Y,1989-08-19,股份合作制,张中元,"108万人民币","低压电器元件、五金件、塑料制品、化工产品",上海,崇明,"上海市崇明区竖新镇明强村新生703号"
上海跃进医疗器械有限公司,913101151344294432,1989-08-19,N/A,朱胜利,"602(万元人民币)","生化仪器、医疗器械",上海,浦东,"浦东新区杨高南路6166号"
上海达华医疗器械有限公司,91310230134430145R,1989-08-19,N/A,陈华,"2,000(万元人民币)","塑料薄膜，造粒，瓶销售，经营本企业自产产品的出口业务和本企业所需的机械设备、零配件、原辅材料的进口业务（但国家限定公司经营或禁止进出口的商品及技术除外），（医疗器械、医用材料、电子、机械、保健用品）技术领域内的技术开发、技术转让、技术咨询和技术服务，医疗器械",上海,崇明,"上海崇明工业园区嵊山路85号"
中国核工业物资供销华东有限公司,91310101132205470L,1989-08-19,N/A,吴晋,"418(万元人民币)","系统内产品及计划外物资，金属材料，木材，水泥，油料，化工原料，机电设备，仪器仪表，为本系统的最终用户代购小轿车，通用零配件，汽车配件，五金交电，摩托车，家用电器，日用百货，核工业技术咨询，从事货物和技术的进出口业务，国内贸易代理服务，橡胶原料及制品、木材及制品、煤炭及制品、润滑油批发、零售，危险化学品经营",上海,黄浦,"北京东路444号"
上海卫生被服公司,91310106MA1FY0323C,1989-08-20,N/A,朱鸿,"50(万元人民币)","医疗用衣、被、服装，塑料制品，日用百货，装潢材料，交电商品。仪器仪表，电线电缆，汽车配件，印刷机械，电子计算机及配件，文教用品，纸张，附设酒家。【依法须经批准的项目，经相关部门批准后方可开展经营活动】",上海,静安,"上海市静安区陕西北路380号"
上海青浦冶金辅料厂,91310118134322179W,1989-08-20,集体所有制,乔建平,"175万人民币","金属制品的加工。【依法须经批准的项目，经相关部门批准后方可开展经营活动】",上海,青浦,"青浦区青安路1097号"
上海南驰物资有限公司,91310115132401391M,1989-08-20,N/A,葛维勇,"50(万元人民币)","金属材料、建筑材料、化工原料（除危险化学品、监控化学品、民用爆炸物品、易制毒化学品）、木材、装潢材料、厨房用品、机电产品、五金交电、家用电器、日用百货、食用农产品的销售，仓储（除危险品），自有设备租赁，洗衣服务",上海,自贸区,"中国（上海）自由贸易试验区蓝村路44号"
