云南省烟草公司丽江市公司永胜县分公司金官烟叶站,91530722919250486Y,1989-07-15,N/A,赵红斌,"N/A","烤烟收购;卷烟、雪茄烟零售。兼营范围:(依法须经批准的项目,经相关部门批准后方可开展经营活动)。",云南,丽江,"云南省丽江市永胜县三川镇金官街"
中国农业银行股份有限公司景东南郊分理处,91530823709835689J,1989-07-15,N/A,张永海,"N/A","吸收公众存款；发放短期、中期、长期贷款；办理国内结算，办理票据承兑与贴现；发行金融债券；买卖政府债券、金融债券；从事银行卡业务；代理收付款项；各类汇兑业务；代理开放式基金业务；电话银行、手机银行、网上银行业务；经国务院银行业监督管理机构等监管部门批准的其他业务；保险兼业代理业务。",云南,普洱,"云南省普洱市景东县锦屏镇天华路17号"
中国农业银行股份有限公司景东锦屏支行,91530823709835670M,1989-07-15,N/A,罗垚,"N/A","吸收公众存款；发放短期、中期、长期贷款；办理国内结算，办理票据承兑与贴现；发行金融债券；代理发行政府债券；买卖政府债券、金融债券；从事银行卡业务；代理收付款项；各类汇兑业务；代理开放式基金业务；电话银行、手机银行、网上银行业务；经国务院银行业监督管理机构批准的其他业务；保险兼业代理业务。",云南,普洱,"云南省普洱市景东县锦屏镇景川路131号"
云南省烟草公司丽江市公司永胜县分公司片角烟叶站,915307229192505235,1989-07-15,N/A,高崇亮,"N/A","烤烟收购。兼营范围：卷烟、雪茄烟零售",云南,丽江,"云南省丽江市永胜县片角镇片角街"
云南省烟草公司丽江市公司永胜县分公司期纳烟叶站,91530722919250507F,1989-07-15,N/A,廖志荣,"N/A","烤烟收购。兼营范围：卷烟、雪茄烟零售",云南,丽江,"云南省丽江市永胜县期纳镇期纳街"
安宁市饮食服务有限责任公司,9153018121682042XM,1989-07-15,N/A,杨永福,"55.5200(万元人民币)","五金交电、钢材、建筑材料的销售；以下经营范围仅限分公司经营：烘烤制品、冷冻食品、主食、热菜、烧烤、瓶装饮料、瓶装酒、预包装食品、卷烟、数字式蜂窝移动电话机及配件的销售；住宿、理发、烫发服务；停车服务（依法须经批准的项目，经相关部门批准后方可开展经营活动）",云南,昆明,"安宁市连然新街192号"
云南省烟草公司丽江市公司永胜县分公司,915307222192400760,1989-07-15,N/A,谭国超,"N/A","烤烟、卷烟、雪茄烟的收购、批发、零售、调拨。兼营范围：",云南,丽江,"云南省丽江市永胜县永北镇环城东路54号"
中国农业银行股份有限公司澄江县支行,9153042221773016X5,1989-07-16,N/A,曾伟忠,"N/A","吸收公众存款；发放人民币短期、中期和长期贷款；办理人民币结算；办理票据贴现；办理外汇存款，外汇贷款，外汇汇款，外币兑换;国际结算、结汇、售汇；经中国银行业监督管理委员会批准的其他业务；经中国保监会核准的财产险、人身险",云南,玉溪,"云南省玉溪市澄江县凤麓街道办事处凤翔路南4号"
中国农业银行股份有限公司澄江仙湖分理处,915304227998942869,1989-07-16,N/A,赵磊,"N/A","吸收公众存款；发放人民币短期、中期和长期贷款；办理人民币结算；办理票据贴现；办理外汇存款，外汇贷款，外汇汇款，外币兑换;国际结算、结汇、售汇；经中国银行业监督管理委员会批准的其他业务；经中国保监会核准的财产险、人身险",云南,玉溪,"云南省玉溪市澄江县凤麓街道办事处人民东路3号"
昆明茨坝矿山机械有限公司,91530103216711354K,1989-07-17,N/A,张慰平,"2,043.2000(万元人民币)","矿山通用输送机、建筑机具、成套选矿设备制造，选矿机械的设计、咨询；经营本企业自产产品及技术的出口业务；经营本企业生产所需的原辅材料、机械设备、仪器仪表、零配件及相关技术的进口业务（国家限定公司经营和国家禁止进出口的商品及技术除外）；经营进料加工和“三来一补”业务（依法须经批准的项目，经相关部门批准后方可开展经营活动）",云南,昆明,"云南省昆明市盘龙区茨坝花渔沟村398号"
云南省通海县轻工业供销公司,91530423217750259R,1989-07-17,N/A,公孙林,"66(万元人民币)","钢材、针纺织品、日用百货、日用化学品、化工产品、化工原料。兼营范围：食品、五金交电。",云南,玉溪,"云南省玉溪市通海县秀山镇南街32号"
景东彝族自治县电影发行放映公司,91530823781677902W,1989-07-17,N/A,方应成,"72(万元人民币)","电影放映；房屋租赁。",云南,普洱,"云南省普洱市景东县玉屏路5号"
澄江县农副产品采购公司百信购物广场,91530422795165756P,1989-07-17,N/A,施自龙,"N/A","预包装食品、散装食品、乳制品",云南,玉溪,"云南省玉溪市澄江县凤麓街道办事处人民西路100号"
昆明昆钢装饰福利有限公司,915301812168204626,1989-07-18,N/A,张春明,"1,152.1300(万元人民币)","涂料生产及加工；铝合金门窗、建材生产、塑钢门窗加工；装饰装璜工程；不锈钢、卷帘门、防盗栏生产销售；建筑防水工程；打字、复印、晒图；卫生洁具、灯具、墙砖、地砖、五金、PVC管、通讯器材、装饰装修材料、草坪砖、内外墙乳胶漆、内外墙腻子的销售；国内贸易、物资供销；房屋及场地租赁（依法须经批准的项目，经相关部门批准后方可开展经营活动）",云南,昆明,"安宁昆钢官庄十四冶山头"
安宁市志远盐业化学有限公司,91530181216820497Q,1989-07-19,N/A,段兴刚,"515(万元人民币)","岩盐开采、加工、销售（依法须经批准的项目，经相关部门批准后方可开展经营活动）",云南,昆明,"云南省连然镇小桃花村"
云南锡业股份有限公司老厂分公司工会委员会,815325010804217528,1989-07-20,N/A,伍大明,"N/A","白酒、复制酒制造；百货零售",云南,红河,"云南省个旧市老厂镇"
云南锡业集团(控股)有限责任公司老虎山酒厂,915325019179500670,1989-07-20,N/A,伍大明,"N/A","白酒、复制酒制造；百货零售",云南,红河,"云南省红河州个旧市大屯镇戴家庄"
云南锡业集团(控股)有限责任公司机关工会委员会,81530111584831202C,1989-07-20,N/A,伍大明,"N/A","白酒、复制酒制造；百货零售",云南,昆明,"云南省昆明市关上北路36号云锡大酒店"
丽江新华书店有限公司宁蒗分公司,91530724219280131X,1989-07-20,N/A,张学忠,"N/A","图书批发零售；音像制品、各种纸张、副食品销售，住宿服务，房屋出租。",云南,丽江,"宁蒗县大兴镇"
云南锡业集团控股有限责任公司工会委员会,815300005823760077,1989-07-20,N/A,伍大明,"N/A","白酒、复制酒制造；百货零售",云南,昆明,"昆明市官渡区关上北路30号云锡大酒店"
峨山彝族自治县大龙潭供销社,915304262178107090,1989-07-20,股份合作制,潘晓荣,"29.7万人民币","农业生产资料、中西成药销售；石油制品、卷烟零售。",云南,玉溪,"峨山县大龙潭乡大龙潭街"
昭通市昭阳宾馆有限公司,91530600709796974H,1989-07-21,N/A,马彭驰,"50(万元人民币)","住宿。",云南,昭通,"昭通市昭阳区沿河岔街100号"
玉溪市第九建筑工程公司,915304022176704949,1989-07-21,N/A,陈红喜,"2,060(万元人民币)","房屋建筑，房屋维修；室内外装饰；土石方工程；市政公用工程施工总承包；水利水电工程施工总承包；炉窑工程施工总承包。兼营范围：保暖管道，屋顶安装，水电安装。",云南,玉溪,"云南省玉溪市红塔区研和镇"
中国人民财产保险股份有限公司江川支公司,9153042121771053XT,1989-07-21,N/A,龚文萍,"N/A","财产损失保险、责任保险、信用保险、意外伤害保险、短期健康保险、保证保险等人民币或外币保险业务；与上述业务相关的再保险业务；各类财产保险、意外伤害保险、短期健康保险及其再保险的服务与咨询业务；代理保险机构办理有关业务；国家法律法规规定的或国家保险监管机构批准的其他业务（依法须经批准的项目，经相关部门批准后方可开展经营活动）",云南,玉溪,"云南省玉溪市江川区大街街道宁海路北段"
峨山彝族自治县农村信用合作联社塔甸信用社,91530426917812529L,1989-07-21,N/A,陈永兵,"N/A","吸收公众存款；发放短期、中期和长期贷款；办理国内结算；办理票据承兑与贴现；代理发行、代理兑付、承销政府债券；买卖政府债券、金融债券；从事同业拆借；代理收付款项及代理保险业务；提供保管箱服务；经银行业监督管理机构批准的其他业务。",云南,玉溪,"峨山县塔甸街"
金平县日杂采购公司,91532530218110085Y,1989-07-22,N/A,吴建国,"201(万元人民币)","日用百货、日用杂品、（包括烟花爆竹）食盐（加典盐、工业盐）批发零售；房屋租赁（依法须经批准的项目，经相关部门批准后方可开展经营活动）",云南,红河,"云南省红河州金平县前哨南路59号附1号"
玉溪红塔烟草劳动服务有限责任公司,915304022176603092,1989-07-23,N/A,杨琼,"1,500(万元人民币)","五金交电、百货、针纺织品、建筑材料、金属材料、工艺美术品（金银制品除外）、粮油制品、劳保用品加工及销售；农副产品收购及销售；家用电器修理；洗染服务（仅限分公司经营）；食品（含糕点、烘烤制品生产加工）、卷烟（限零售）、预包装食品、乳制品（不含婴幼儿配方乳粉）零售（仅限分公司经营）；皮革清洗、护理（仅限分公司经营）；货物装卸搬运服务；劳务派遣；清洗保洁服务；叉车修理；广告策划、设计、制作、代理发布；普通货运；住宿服务",云南,玉溪,"云南省玉溪市红塔区凤凰路上段"
澄江县供销合作社联合社生产资料公司龙街直营店,91530422MA6MEWFQXY,1989-07-24,集体分支机构(非法人),李凤兰,"26万人民币","农业生产资料、不再分装的包装种子、农具零售。",云南,玉溪,"云南省玉溪市澄江县龙街街道办事处"
昆明民族塑料化工有限公司,91530100216570619N,1989-07-25,有限责任公司,张继辉,"1228万人民币","塑料制品、橡胶制品的生产、销售；货车销售；经营本企业自产产品及技术的出口业务；经营本企业生产所需的原辅材料、机械设备、仪器仪表、零配件及相关技术的进口业务（国家限定公司经营和国家进出口的商品及技术除外）；经营进料加工和“三来一补”业务（依法须经批准的项目，经相关部门批准后方可开展经营活动）",云南,昆明,"云南省昆明市盘龙区北京路凤凰村110号"
会泽县福康药业有限公司名城大药房一分店,915303265823932614,1989-07-25,N/A,张莉,"N/A","中成药、化学药制剂、抗生素、生化药品、二类：（普通诊察器械，医用卫生材料及敷料，医用高分子材料及制品）、三类：（一次性使用注射器，一次性使用输液器）、保健食品零售（依法须经批准的项目，经相关部门批准后方可开展经营活动）",云南,曲靖,"云南省曲靖市会泽县古城街道龙湖花园小区二区21栋3号"
云南省百货公司砚山综合批发站,915326222182101318,1989-07-25,N/A,曾一宏,"328(万元人民币)","针纺织品、百货、五金、交电、化工、农业机械、汽车及配件、矿产品、农副产品",云南,文山,"云南省文山壮族苗族自治州砚山县江那镇新丰路86号"
云南玉溪冠南冶金矿山机械厂,915304022176780232,1989-07-25,集体所有制,李永齐,"202万人民币","铁制小农具，尾轮，铁铸件，矿山机械零配件,灯杆灯具，建筑材料,建筑五金,水暖器材,橡胶制品,塑料制品,灯杆灯具安装。",云南,玉溪,"云南省玉溪市红塔区北城镇古城村委会葛井庙村"
昆明金牛经贸有限责任公司,91530100216570686L,1989-07-25,N/A,李永久,"57.5800(万元人民币)","金属材料、建筑材料、装饰材料、消防器材、汽车配件、摩托车及配件、铸锻件及通用零部件、仪器仪表、普通机械、五金交电、电器机械及器材、百货、针纺织品、电子产品、通信器材、农副产品的销售；以下范围限分公司经营：住宿服务（依法须经批准的项目，经相关部门批准后方可开展经营活动）",云南,昆明,"昆明市人民西路295号"
昆明金河化工有限责任公司,91530111216711848X,1989-07-25,N/A,李凤鸣,"383.6000(万元人民币)","五金交电、建筑材料、汽车配件、钛白粉、立德粉的销售；以下经营范围限分公司经营：水性涂料的生产及销售",云南,昆明,"昆明市官渡区前卫镇金河办事处"
昆明再生资源(集团)有限公司,915301002165706437,1989-07-26,N/A,吴志强,"1,000(万元人民币)","废旧金属及报废汽车的收购；单位积压物资、残次物资的调剂处理；金属材料、汽车（不含小轿车）、电器机械及器材、矿产品、建筑材料、五金交电、橡胶制品、塑造制品、桐油的销售；自有房屋出租（依法须经批准的项目，经相关部门批准后方可开展经营活动）",云南,昆明,"昆明市书林街书林花园五幢五楼"
昆明市副食禽蛋总公司,91530100216570678R,1989-07-26,N/A,常锦华,"1,296(万元人民币)","国内贸易、物资供销、冷冻、仓储兼营、仓储理货（危险化学品除外）、冷藏冷冻食品保管；停车场服务（泊车位48个）；搬运装卸；物业管理；物业服务（依法须经批准的项目，经相关部门批准后方可开展经营活动）",云南,昆明,"昆明市东郊路１１１号"
昆明塑料包装材料厂,91530100216570600R,1989-07-26,集体所有制,蒋莹,"457.6万人民币","塑料中空容器制造＊兼营范围：日用塑料杂品加工＊",云南,昆明,"云南省昆明市关上镇日新村日新工业区规划路中苜蓿村"
云南铝业股份有限公司工会委员会,81530100688571070F,1989-07-27,N/A,李乡林,"645.6500(万元人民币)","精铝制品、铝板、片材、铝材、皮革制品的生产、加工、销售；百货、日杂用品、五金交电、普通机械、电器机械及器材、电子产品及通讯设备的零兼批；商业信息咨询服务；货物仓储、废旧铝来料加工、销售；经营本企业自产产品及技术的出口业务；经营本企业生产所需的原辅材料、机械设备、仪器仪表、零配件及相关技术的进出口业务（国家限定公司经营和国家禁止进出口的商品及技术除外）；经营进料加工和“三来一补”业务（依法须经批准的项目，经相关部门批准后方可开展经营活动）",云南,昆明,"昆明市呈贡云铝路1号"
昆明攀昆管业有限公司,91530100216599374W,1989-07-27,N/A,熊杨广,"2,191(万元人民币)","管材管件、钢材、金属材料、建筑材料、装饰材料、装璜材料、普通机械、五金交电、日用百货、文化用品的销售；企业管理咨询；会议策划及组织；自有房产租赁（依法须经批准的项目，经相关部门批准后方可开展经营活动）",云南,昆明,"云南省昆明市西山区春雨路1091号"
昆明长兴铝业有限公司,91530100216570694F,1989-07-27,N/A,李乡林,"645.6500(万元人民币)","精铝制品、铝板、片材、铝材、皮革制品的生产、加工、销售；百货、日杂用品、五金交电、普通机械、电器机械及器材、电子产品及通讯设备的零兼批；商业信息咨询服务；自有房屋租赁；货物仓储、废旧铝来料加工、销售；经营本企业自产产品及技术的出口业务；经营本企业生产所需的原辅材料、机械设备、仪器仪表、零配件及相关技术的进出口业务（国家限定公司经营和国家禁止进出口的商品及技术除外）；经营进料加工和“三来一补”业务（依法须经批准的项目，经相关部门批准后方可开展经营活动）",云南,昆明,"昆明市东郊贵昆路47号"
云南省石屏县百货公司,915325252180103162,1989-07-27,N/A,沈国英,"104(万元人民币)","日用百货、金银珠宝、钟表、眼镜、文体用品、针纺织品、家用电器、交通器材、化工、服装、五金交电、摩托车、通讯器材。",云南,红河,"云南省红河州石屏县异龙镇西山路新都昌商业广场A单元401、402、403、404室"
马关县农业生产资料有限责任公司篾厂分公司,91532625MA6K587H9F,1989-07-27,N/A,李金会,"N/A","化肥、零售；农药(不含危险化学药品)、农用塑料薄膜、农药机械、中小农具、日用百货、土产日杂、针纺织品、五金交电、销售（依法须经批准的项目，经相关部门批准后方可开展经营活动）",云南,文山,"马关县篾厂粑粑厂街"
会泽县福康药业有限公司名城大药房,91530326795189192E,1989-07-28,N/A,张俊华,"N/A","中成药、化学药制剂、抗生素、生化药品、中药材、中药饮片、生物药品、保健食品零售（依法须经批准的项目，经相关部门批准后方可开展经营活动）",云南,曲靖,"云南省曲靖市会泽县东内街22号"
鹤庆县农业生产资料公司,915329325718986435,1989-07-31,N/A,奚春泽,"120(万元人民币)","化肥、农药、农膜、钢材、农用机具、食盐、饲料兼营范围：五金、百货（依法须经批准的项目，经相关部门批准后方可开展经营活动）",云南,大理,"云南省大理白族自治州鹤庆县云鹤镇兴鹤路28号"
中国邮政集团公司云南省贡山县独龙江邮政所,91533324919360108K,1989-07-31,N/A,李春花,"N/A","邮政增值业务，邮政附属业务以及国家邮政局批准开办的其它邮政业务。兼营范围：与邮政业务相关的设计，施工等服务项目；代办电信各项业务；社会各类代办业务；代办开放经营的电信，信息业务以及国家允许开办的其它业务项目；本县范围内开展出版物连锁经营业务；可以在农村开展农药、化肥、种子等农业物资配送，日用消费品配送服务；经中国保监会核准的财产保险和人身险",云南,怒江,"贡山县独龙江乡"
思茅万达公司万达大酒店,91530802325232926F,1989-07-31,N/A,梁丽君,"N/A","住宿兼营范围：洗车。",云南,普洱,"云南省普洱市思茅区振兴大道18号"
中国邮政集团公司云南省贡山县丙中洛邮政所,915333249193600873,1989-07-31,N/A,李春花,"N/A","邮政基础业务，邮政增值业务，邮政附属业务以及国家邮政局批准开办的其它邮政业务。兼营范围：与邮政业务相关的设计，施工等服务项目；代办电信各项业务；社会各类代办业务；代办开放经营的电信，信息业务以及国家允许开办的其它业务项目；本县范围内开展出版物连锁经营业务；可以在农村开展农药、化肥、种子等农业物资配送，日用消费品配送服务；经中国保监会核准的财产保险和人身险",云南,怒江,"贡山县丙中洛乡"
思茅万达公司,91530802719461027Q,1989-07-31,N/A,王芳,"131(万元人民币)","锯材、房屋租赁、停车、洗车、住宿。兼营范围：",云南,普洱,"云南省普洱市思茅区振兴大道18号"
中国邮政集团公司云南省贡山县普拉底邮政所,91533324919360095X,1989-07-31,N/A,李春花,"N/A","邮政基础业务、邮政增值业务，邮政附属业务以及国家邮政局批准开办的其它邮政业务。兼营范围：与邮政业务相关的设计，施工等服务项目；代办电信各项业务；社会各类代办业务；代办开放经营的电信，信息业务以及国家允许开办的其它业务项目；本县范围内开展出版物连锁经营业务；可以在农村开展农药、化肥、种子等农业物资配送，日用消费品配送服务；经中国保监会核准的财产保险和人身险",云南,怒江,"贡山县普拉底乡"
云南省玉溪市农业生产资料有限责任公司,91530400217660173E,1989-08-01,N/A,高正旭,"1,045(万元人民币)","化肥、化学农药（不含危险品）、农用塑料薄膜、农药施肥及用具、建筑、装饰材料、化工产品及原料",云南,玉溪,"云南省玉溪市红塔区玉兴路31号"
元江县房地产综合开发公司,915304282178502923,1989-08-01,N/A,车青月,"207(万元人民币)","房地产开发",云南,玉溪,"元江县澧江街道办兴隆街6号"
呈贡县土产日用杂品公司,91530121216780341A,1989-08-02,N/A,方能,"43(万元人民币)","副食品、其它食品、土产品、日用杂品批发零售；农副食品购销、中药材收购。",云南,昆明,"云南省昆明市呈贡区县城"
泸西县白水供销股份合作社,9153252721805620XR,1989-08-02,股份合作制,张国良,"101万人民币","化肥、农药、农膜、中小农具、五金交电、针纺织品、百货、日用杂品、家具、棉絮、煤油、汽车、拖拉机零配件、建筑材料、中药材零售兼营范围：服装加工、完成订购任务的粮食、油料、国家政策允许的放开经营的农副产品、照像（依法须经批准的项目，经相关部门批准后方可开展经营活动）",云南,红河,"云南省红河州泸西县白水镇亮龙潭"
云南华云实业集团有限公司,91530181216820614J,1989-08-04,N/A,张海涛,"15,574(万元人民币)","国内贸易、物资供销；商品及日用百货零售；园林绿化工程的设计及施工；绿化养护；花卉、苗木种植、租赁、销售；绿化景观维护；园林绿化技术咨询服务；物业管理；家政、餐饮服务；农贸市场综合经营、城市环境卫生管理；市政公用工程施工总承包；机电设备安装、防腐工程；土石方工程、管道工程；建筑材料、混凝土砖的生产、销售；仓储；装卸、搬运；货物及技术进出口业务；油脂；润滑油等贸易（限下属分公司经营）；预包装食品、散装食品、冷冻食品、乳制品（含婴幼儿配方乳粉）、水产品、生鲜、水果、蔬菜的销售；普通货物的运输；（以下经营范围仅限分公司凭许可证经营）：卷烟、雪茄烟的零售（依法须经批准的项目，经相关部门批准后方可开展经营活动）",云南,昆明,"安宁市昆钢建设街"
云南玉溪水松纸厂、玉溪思润印刷有限公司联合工会委员会,815304026885924103,1989-08-05,N/A,何金星,"6,227.8000(万元人民币)","水松纸、经营本企业生产所需的原辅材料，机械设备，仪器仪表；货物技术的进出口业务",云南,玉溪,"玉溪市红塔区大营街工业区"
马关县第一建筑工程公司,91532625218270492C,1989-08-05,N/A,钟正龙,"712.1600(万元人民币)","三级土木工程、房屋建筑（含钢筋混凝土、框架、混合结构及线路、管道、设备安装）（依法须经批准的项目，经相关部门批准后方可开展经营活动）",云南,文山,"云南省文山州马关县马白镇平安街33号"
峨山彝族自治县小街供销合作社,91530426217810864C,1989-08-07,集体所有制,李英,"115万人民币","百货、农业生产资料销售；日用品、纺织品、服装、鞋帽、五金、交电、化工、不再分装的农作物包装种子销售。",云南,玉溪,"峨山县小街镇小街街子"
红河县农业机械修造厂,91532529218090344N,1989-08-07,股份合作制,姚恩志,"56万人民币","农机修造，机电、汽车、拖拉机修理及其配件、建材、大理石、棕制品加工、物业管理（依法须经批准的项目，经相关部门批准后方可开展经营活动）",云南,红河,"红河县迤萨镇东兴街59号"
昆明双凤金属冷作铆焊有限公司,91530111216712226T,1989-08-07,N/A,杨文新,"50(万元人民币)","结构性金属制品的制作、安装；塑料制品的生产、销售；建筑材料、装饰材料、金属（稀贵金属除外）、农副产品、五金交电、电器产品及配件、水暖器材的销售（依法须经批准的项目，经相关部门批准后方可开展经营活动）",云南,昆明,"昆明市官渡区前卫镇双凤"
昆明市永昌印刷有限责任公司,91530100216713018X,1989-08-07,N/A,赵华,"520(万元人民币)","文件、资料、图表、票证、名片(不含商标、有价证券）的印刷（依法须经批准的项目，经相关部门批准后方可开展经营活动）",云南,昆明,"昆明市度假区海埂街道办事处金家社区"
玉溪市江川区城市建设综合开发公司,915304212177107082,1989-08-08,N/A,沈家荣,"800万人民币元","房地产开发管理,房屋租赁(依法须经批准的项目,经相关部门批准后方可开展经营活动)",云南,玉溪,"云南省玉溪市江川区大街街道宁海路"
玉溪市李棋供销合作社,91530402217670582P,1989-08-08,集体所有制,周卫民,"83万人民币","日用百货、针纺织品、文化用品、五金、交电、家具、日用杂品。兼营范围：农药、化肥、收购农副产品，废旧物资。",云南,玉溪,"玉溪市红塔区李棋镇"
