天津市津海低压电器开关厂,91120223104114686F,1989-04-24,集体所有制,刘立权,"46万人民币","低压电器元件制造；开关扳制造。(国家有专营专项规定的按专营专项规定办理)",天津,静海,"静海县双塘镇东双塘村"
天津银利房产开发有限公司,9112011610431328XL,1989-04-25,N/A,张有发,"300(万元人民币)","商品房销售；工程技术咨询及代理。国家有专营、专项规定的按专营专项规定办理。",天津,滨海,"天津经济技术开发区第二大街泰达MSD-G1座11层1102-080"
天津市北方金属结构制造有限公司,91120221X008205191,1989-04-26,有限责任公司,李福生,"51万人民币","建筑钢隔板及配套附件制造、维修；暖气片加工、制造、批发、零售。",天津,宁河,"宁河县俵口乡洛里坨村"
正大集团(天津)实业有限公司,911201166005001647,1989-04-27,N/A,谢毅,"1,660(万美元)","生产、销售植物油相关产品的深加工（不含国家限制类或禁止类项目的生产、销售）；及上述商品的批发销售、佣金代理",天津,滨海,"天津经济技术开发区第七大街15号3号楼201室"
天津华鑫德贸易有限公司,911201161043148136,1989-04-28,N/A,王福利,"73.5000(万元人民币)","五金、交电、化工商品",天津,滨海,"天津开发区洪泽路17号"
中国银行股份有限公司天津十一经路支行,911201027612965473,1989-04-29,N/A,运晓坤,"N/A","办理人民币存款、贷款、结算业务；人民币信用卡业务；办理票据贴现；代理兑付、销售政府债券；代理收付款项及代理保险业务。外汇存款；外币贷款；外币兑换；国际结算；结汇、售汇；通过上级行办理代客外汇买卖；代理国外信用卡付款。总行在银监会批准的业务范围内授权的其他业务。",天津,河东,"天津市河东区六纬路503、505号"
天津市宝玉石研究所有限公司,91120103103307996A,1989-04-29,N/A,魏振环,"22(万元人民币)","宝石、玉石鉴定；地质矿产、工艺矿物新技术咨询；绘图、工艺照相；金银饰品、珠宝首饰、宝玉石、工艺美术品零售。",天津,河西,"河西区友谊路42号"
新蕾出版社(天津)有限公司,91120101401204872N,1989-05-01,N/A,马梅,"3,967.5899(万元人民币)","出版以15岁以下少年儿童为对象的政治、思想、品德教育读物，儿童文学作品、连环画、科普读物，以及少儿工作者和家长培养教育少儿的辅导读物；出版与新蕾出版社",天津,和平,"天津市和平区西康路35号12-13层"
天津市正士包装机械实业有限公司,91120102X00580244L,1989-05-04,N/A,郑志文,"336(万元人民币)","包装机械及备件、装饰材料制造；铝合金制品加工、安装；机电产品",天津,河东,"天津市河东区王串场一号路南头49号增1号"
天津市文教体育用品进出口公司运输贸易公司,911201021032067223,1989-05-05,N/A,樊欣元,"224(万元人民币)","汽车货运；百货、五金、交电、汽车配件、文教体育用品批发。",天津,河东,"河东区张贵庄路186号"
天津市良建机械租赁有限公司,911201057706382033,1989-05-05,N/A,魏俊岭,"53.2000(万元人民币)","建筑机械工具租赁、为企业及家庭提供劳务服务。经营范围中国家有专营专项规定的按专营专项规定办理",天津,河北,"河北区志成道4号"
天津瑞昌隆劳保用品销售有限公司,911201161036155936,1989-05-05,N/A,昌会芹,"8.7500(万元人民币)","劳保用品、铁木家具、苫布、电工器材",天津,滨海,"天津市滨海新区塘沽中心北路11栋底商"
天津中集北洋集装箱有限公司,9112011660055332X8,1989-05-08,N/A,陆振明,"1,546.9300(万美元)","生产、销售集装箱、集装箱专用车、船、设备及钢结构，金属器具的制造、修理和安装工程，集装箱材料、配件的加工和销售，仓储及集装箱售后服务＊＊＊",天津,滨海,"天津经济技术开发区"
天津纺织机械厂综合服务公司印刷厂,91120105103473177N,1989-05-09,集体所有制,雷好晖,"13万人民币","其他印刷品印刷；纸制品、塑料袋加工。经营范围中许可项目的经营期限以许可证为准、国家有专营专项规定的按专营专项规定办理*",天津,河北,"河北区万柳村大街56号"
中国建设银行股份有限公司天津建昌道支行,91120105752234774T,1989-05-09,N/A,董德智,"N/A","吸收公众存款；发放短期、中期和长期贷款；对私结售汇业务；办理国内结算；办理国内保理；办理住房公积金及单位、个人城市住房基金的归集、结算等业务；办理票据承兑与贴现；代理发行金融债券；代理发行、兑付、承销政府债券；代理买卖政府债券、金融债券；从事银行卡业务；代理收付款项；代理家庭财产保险、与贷款标的物相关的财产保险、机动车交通事故责任强制保险、人寿保险、意外伤害保险、健康保险；办理经中国银行业监督管理委员会批准和总行授权经营的其他业务。",天津,河北,"河北区建昌道建昌里首层110-113号"
天津市武清区种子公司,91120222401290803X,1989-05-09,N/A,诸葛树平,"178(万元人民币)","包装种子、农药、农膜、日用杂品批发兼零售；道路普通货物运输。",天津,武清,"杨村镇京津公路50号"
天津冠芳投资集团有限公司,91120000724487467C,1989-05-17,N/A,单玉明,"2,000(万元人民币)","以自有资金对食品业进行投资；塑料制品、手工具、服装的制造；劳务服务；商业、各类物资的批发、零售；经济信息咨询服务；限分支机构经营：汽车货运；果菜汁饮料制造；饮料、纯净水、矿泉水、冷冻食品、乳制品制造与销售",天津,武清,"天津市武清区开发区"
天津市津南区兴华机械模具厂,92120112X00790655Q,1989-05-18,个体工商户,宋金柱,"N/A","模具、机加工。加工。",天津,津南,"津南区双港镇小辛庄村"
中国建设银行股份有限公司天津怡和家园支行,911201066818813670,1989-05-18,N/A,韩海滨,"N/A","吸收公众存款；发放短期、中期和长期贷款；办理国内结算；办理国内保理；办理住房公积金及单位、个人城市住房基金的归集、结算等业务；办理票据承兑与贴现；代理发行金融债券；代理发行、兑付、承销政府债券；代理买卖政府债券、金融债券；从事银行卡业务；代理收付款项；办理经中国银行业监督管理委员会批准和总行授权经营的其他业务。(以上经营范围涉及行业许可的凭许可证件，在有效期限内经营，国家有专项专营规定的按规定办理)",天津,红桥,"红桥区怡德路2号"
中国黑色金属材料华北公司,911200001030620363,1989-05-19,N/A,边固,"14,845.8000(万元人民币)","钢材、生铁、铁合金、其它黑色金属材料及其压延产品、金属结构及构件锻铸件及通用零件、黑色金属矿产品、炉料；有色金属及其压延加工产品、建筑材料；机电产品、五金、汽车",天津,和平,"天津市和平区重庆道38号"
天津市双达科技实业有限公司,91120104600842586Y,1989-05-22,N/A,吴桂琴,"110(万元人民币)","机电一体化、电子与信息、生物医学工程技术及产品的开发、咨询、服务、转让；电子元器件、文化办公用机械、计算机及外围设备、电讯器材、汽车配件、化工",天津,南开,"天津市南开区复康路荣迁东里6号楼1-205-208（科技园）"
天津市种禽公司,91120111103806103J,1989-05-24,N/A,陈刚,"553(万元人民币)","家禽养殖。",天津,西青,"西青区京福公路"
天津大港油田盛通通信工程有限公司,911201161036953786,1989-05-24,N/A,王承顺,"1,000(万元人民币)","通信工程、土方工程、管道工程施工、维修；自动控制设备开发、制造、安装、技术转让、咨询服务；钻采技术服务；机房设备安装及调试；通信信息网络系统集成、设计、配置与工程施工；办公自动化局域网络安装与维护；室内外装修；环境绿化；物业管理；洗车；软件、计算机硬件开发；汽车普通货物运输；通信器材、建筑材料销售；家用电器、通信设备、办公用机械、计算机修理及零售；自有设备、自有房屋、汽车租赁；机站安装；土建铁塔建设；空调设备、视频监控设备安装及维修；油水井数字化建设及运营维护；安防监控系统设备安装与维护；自动化系统设备、电脑及配件、仪器仪表、井下工具、钻采配件、电子工业产品、电工材料、电线、电缆、机电产品、软件批发兼零售；计算机系统集成及维护；室内外暖气管线安装及维护；电子信息技术开发、咨询、服务、转让；广告设计、制作、发布；电子设备维修及保养；光、电缆维护。",天津,滨海,"天津市滨海新区油田三号院北区路口"
天津丸善食品有限公司,911201166005001722,1989-05-31,N/A,福山進,"426(万美元)","魔芋制品，食品包装制品的制造、加工、销售，新产品的开发及相关咨询服务。",天津,滨海,"天津经济技术开发区"
天津市裕华玻璃钢有限公司,911201121038688577,1989-06-01,N/A,王乐柱,"600(万元人民币)","玻璃钢纤维制品制造；塑料零件制造；型材拉挤设备制造；防火助剂（危险品除外）、机械设备、防火保温材料（危险品除外）的制造、销售；建筑用材料（水泥、玻璃等禁止类项目除外，危险品除外）的制造；建筑用材料批发兼零售；纸制品加工、制造",天津,津南,"天津市津南区双桥河镇王庄村"
天津市天拖劳动服务公司农机汽车配件经营部,91120104103409511B,1989-06-05,N/A,柴振起,"16(万元人民币)","机械配件、五金工具、拖拉机。",天津,南开,"南开区红旗路364号"
天津市孙庄农工商联合公司,91120110103746200W,1989-06-06,N/A,孙向河,"100(万元人民币)","限下属企业经营：机床附件制造；消防器材、塑料制品、服装、皮鞋、砖瓦制造；木箱加工；建筑。",天津,东丽,"东丽区金钟街道南孙庄村"
天津市西青区大稍口供销合作社东姜井收购站,91120111MA06C8835Y,1989-06-06,集体分支机构(非法人),颜世芳,"N/A","为物回公司代购废旧物资；农副产品收购。",天津,西青,"西青区东姜井村"
天津五金矿产进出口金山贸储公司,91120103103201235B,1989-06-07,N/A,邢丽红,"452(万元人民币)","仓储服务（危险化学品及易制毒品除外）；五金交电、化工",天津,河西,"河西区湘江道47号"
天津东利拔丝有限公司,91120102103208621Q,1989-06-12,N/A,马恒勤,"349(万元人民币)","有色金属制造、压延加工；热浸锡引线加工、制造；道路货物运输；房屋租赁、场地租赁。",天津,河东,"河东区富民路120号"
天津市津兰集团公司,91120111103066141A,1989-06-13,N/A,郭宝印,"36,800(万元人民币)","钢及有色金属压延加工；钢丝制造；经营本企业成员企业自产产品及相关技术的出口；经营本企业成员企业生产、科研所需的原辅材料、机械设备、仪器仪表、零配件及相关技术的进口业务；承办中外合资经营、合作生产及三来一补业务；商业；物资供销；市场开发服务",天津,西青,"西青区李七庄乡王兰庄村"
天津市灯塔永明涂料包装器材有限责任公司,9112011310391530XE,1989-06-13,N/A,陈洪友,"2,923(万元人民币)","金属包装物及金属容器、木箱、纸制品制造；劳务服务；包装装潢印刷品印刷、其他印刷品印刷；普通货运；（以下限分支机构经营：水性涂料、颜料、助剂制造",天津,北辰,"天津市北辰区天穆镇朝阳路东"
天津市滨海新区塘沽津海塑料制品厂,91120116103609425L,1989-06-17,国有企业,杨宝珠,"10万人民币","塑料瓶、管制造、膏状合成洗涤剂制造、塑钢门窗加工制品、不锈钢制品、铝合金制品、加工制作；塑钢门窗制作安装、不锈钢门窗、护栏制作安装、铝合金门窗制作安装、玻璃幕墙安装。国家有专营专项规定的按专营专项规定办理。",天津,滨海,"天津市滨海新区塘沽胡家园街义和庄村"
中国银行股份有限公司天津天山路支行,91120102761296643C,1989-06-22,N/A,杨宝玲,"N/A","办理人民币存款、贷款、结算业务；人民币信用卡业务；办理票据贴现；代理兑付、销售政府债券；代理收付款项及代理保险业务。外汇存款；外币贷款；外币兑换；国际结算；结汇、售汇；通过上级行办理代客外汇买卖；代理国外信用卡付款。总行在银监会批准的业务范围内授权的其他业务。",天津,东丽,"天津市东丽区成林道218号"
天津市变压器总厂机电加工部,91120103103294769J,1989-06-24,集体所有制,吴炳才,"6万人民币","变压器加工、制造；变压器、电焊机、电机、配电设备修理；变压器测试；变压器拆解。",天津,河西,"河西区解放南路西江道9号"
天津快捷洗染有限公司南京路门市部,911201017863771240,1989-07-01,N/A,张玉,"N/A","洗染织补各式服装、各种织物；修理清洗机及修配零部件。",天津,和平,"天津市和平区南京路59号"
中国银行股份有限公司天津犀地支行,91120101764322958H,1989-07-01,N/A,魏融,"N/A","办理人民币存款、贷款、结算业务；人民币信用卡业务；办理票据贴现；代理兑付；销售政府债券；代理收付款项及代理保险业务；外汇存款；外汇贷款；外汇汇款；外币兑换；国际结算；结汇、售汇；办理代客外汇买卖；代理国外信用卡付款；其总行在中国银行业监督管理委员会批准的业务范围内授权的业务。",天津,和平,"天津市和平区成都道183号"
天津市林工商公司,91120103103316702R,1989-07-02,N/A,杨忠海,"107(万元人民币)","林化产品、日用杂品、橡胶及其制品、矿产品、饲料、钢材、有色金属批发兼零售、代销。",天津,河西,"河西区友谊路西园道5号"
天津市东丽区正新塑料制品厂,91120110103742031T,1989-07-04,集体所有制,郭玉江,"18万人民币","塑料零件制造；塑料打包带。",天津,东丽,"小东庄乡大郑村"
中国建设银行股份有限公司天津大地十二城支行,911201116906755658,1989-07-04,N/A,张健,"N/A","吸收公众存款；发放短期、中期和长期贷款；办理国内结算；办理国内保理；办理住房公积金及单位、个人城市住房基金的归集、结算业务；办理票据承兑贴现；代理发行金融债券；代理发行、兑付、承销政府债券；代理买卖政府债券、金融债券；从事银行卡业务；代理收付款项；办理经中国银行业监督管理委员会批准和总行授权经营的其他业务。",天津,西青,"西青区中北大道78号"
天津市北辰区鸿丰小型特种钢材加工厂,91120113103933217N,1989-07-08,股份合作制,鲍维东,"1220万人民币","钢压延加工；纸制品制造；货物仓储、装卸；普通货运。",天津,北辰,"北辰区大张庄镇南麻疸村西"
天津市北辰区新兴五金加工厂,911201131039298244,1989-07-10,集体所有制,郝宝政,"4.3万人民币","冲压件加工;电气焊。",天津,北辰,"北辰区宜兴埠红旗路西"
铁道部第三勘测设计院工程承包公司,9112010510348508XC,1989-07-12,N/A,宋喜顺,"800(万元人民币)","对铁路、公路、桥梁、隧道、城市规划、工业与民用建筑、地铁、通信自动化、光缆通信、机车车辆机械工程、中小型发电站",天津,河北,"河北区中山路10号"
天津市东堼铁路储运公司,91120110103745793L,1989-07-12,N/A,毕连秀,"250(万元人民币)","物资储存；装卸、搬运货物。",天津,东丽,"东丽区军粮城镇东堼村"
天津市爱德计算机系统公司,91120104103402774K,1989-07-13,N/A,刘长利,"380(万元人民币)","计算机、通讯、信息、计算机机房工程技术及产品的开发、咨询、服务、转让",天津,南开,"天津市南开区罗平道6号1门-203-1(科技园"
天津市津南区永利金属制品厂,91120112X007815216,1989-07-14,私营企业,赵庆山,"N/A","金属加工；金属容器",天津,津南,"津南区八里台镇小黄庄村"
天津吉庆粮油贸易发展有限公司,91120111103810719L,1989-07-18,N/A,王强,"246.2000(万元人民币)","预包装食品批发；食用农产品",天津,西青,"西青区杨柳青新华道122号"
天津市凯伦电工机械有限公司.,911201106007466235,1989-07-21,N/A,张凯,"206(万元人民币)","电工机械、耐火材料制造、加工；机加工；有色金属来料加工；五金交电化工",天津,东丽,"东丽区大毕庄镇徐庄村"
天津滨海新区汉沽茶淀供销合作社,91120116103671173Y,1989-07-24,集体所有制,董克满,"27.1万人民币","棉.烟.麻.土畜产品；化工,饲料,以下限零售:食品,纺织品,百货,五金,交电,废旧物资收购,农业生产资料,民用建材,日用杂品,家具,图书,粮油*",天津,滨海,"天津市滨海新区汉沽茶淀乡茶淀村"
天津市滨海新区塘沽对外客运公司汽车修理厂,911201167182041410,1989-07-28,N/A,毕有利,"30(万元人民币)","小型客车整车修理、总成修理、整车维护、小修、维修救援、专项修理；代理机动车辆保险；汽车配件、消防器材销售；建筑材料加工、销售；汽车租赁；临时停车场。以下限分支经营：尸体冷藏；殡葬用品零售、租赁。",天津,滨海,"天津市滨海新区塘沽港滨路550号"
天津市蓟县高明生水泥制品厂,92120225L77929822B,1989-07-29,个体工商户,高明生,"N/A","制售：水泥构件。",天津,蓟州,"梁庄子村南"
天津市静海区洪祥纸制品厂,92120223MA05XU9N9D,1989-07-30,个体工商户,孙洪祥,"N/A","塑料加工、纸制品加工",天津,静海,"天津市静海区子牙镇三呼庄村中心街西侧"
天津市五美城福利纸制品加工厂,91120223MA06C6418J,1989-08-02,集体所有制,陈金苓,"10万人民币","纸制品制造。",天津,静海,"天津市静海区大邱庄镇五美城村村委会东50米"
天津金元宝集团新华装饰商场,91120116103614662E,1989-08-03,N/A,王祥禄,"134.2000(万元人民币)","建筑材料、五金、交电、化工(不含危险品及易制毒品)、针纺织品、日用百货、工艺美术品、日用杂品、家具零售兼批发；家用电器维修、玻璃加工。",天津,滨海,"天津市滨海新区塘沽解放路17号"
天津市长荣制鞋厂,911201131039247325,1989-08-03,股份合作制,周绍志,"160万人民币","制鞋、皮鞋、旅游鞋制造；鞋帽批发兼零售；鞋料加工；普通货运。",天津,北辰,"北辰区霍庄村"
天津市塘沽水产集团总公司冷冻厂,911201161036070402,1989-08-03,N/A,谢昆,"322(万元人民币)","水产品销售。",天津,滨海,"天津市滨海新区塘沽东江路2277号"
中国工商银行股份有限公司天津津南政府大楼支行,91120112777327598M,1989-08-04,N/A,马艳红,"N/A","金融业务。",天津,津南,"津南区咸水沽镇惠苑里25-12号"
中国建设银行股份有限公司天津咸阳北路分理处,911201066818588022,1989-08-08,N/A,王蕊,"N/A","吸收公众存款；发放短期、中期和长期贷款；办理国内结算；办理住房公积金及单位、个人城市住房基金的归集、结算等业务；办理票据承兑与贴现；代理发行金融债券；代理发行、代理兑付、承销政府债券；代理买卖政府债券、金融债券；从事银行卡业务；代理收付款项及代理保险业务；经总行授权的其他业务；经中国银行业监督管理委员会等监督管理机构批准的其他业务。",天津,红桥,"天津市红桥区同心楼28-31门"
天津市津绿宝农药制造有限公司,91120112103864186J,1989-08-14,N/A,王宝军,"9,600(万元人民币)","化学农药制剂制造；化肥、叶面肥的分装、技术咨询服务；化工产品",天津,津南,"天津经济技术开发区南港工业区南堤路以南、南港四街以东"
天津中林天立实业有限公司,91120116600553434H,1989-08-16,N/A,梁昊,"23,000(万元人民币)","木材及其制品、竹材及其制品、林副产品的批发兼零售；自营和代理各种货物进出口、技术进出口（国家有专营、专项规定的按专营专项规定办理）；仓储（危险品除外）；自有房屋租赁；钢材、煤炭、建筑材料、机械设备、家用电器、纸张、纸浆、铁矿粉、纺织品、服装、焦炭批发兼零售；国内、国际货运代理；商务信息咨询服务；有色金属、化工原料及制品（化学危险品及易燃易爆易制毒品除外）、电子产品、办公用品、通讯设备、初级农产品批发兼零售；林业咨询；工程项目管理；工程造价咨询；规划设计咨询；工程技术咨询；安全技术咨询服务；检测技术咨询服务；环保技术咨询服务；科技开发与技术转让；木材烘干设备、木材加工设备制造、零售兼批发；工程机械设备制造及租赁、销售；燃料油",天津,滨海,"天津开发区睦宁路69号-1"
天津同和文教用品实业有限公司,91120223600553442M,1989-08-21,N/A,侯震育,"600(万元人民币)","生产、销售铅笔、铅笔芯、铅笔漆、蜡笔、削刀、油墨文教用品及家具、家具五金配件",天津,静海,"天津市静海区胜利南路122号"
天津开发区鑫业肠衣有限公司,91120116104312439M,1989-08-26,N/A,孙季和,"70(万元人民币)","肠衣加工；房屋租赁。",天津,滨海,"天津开发区第四大街Ａ５－４－２号"
天津市盛裕春餐饮有限公司,91120110103732319T,1989-08-26,N/A,张洪春,"100(万元人民币)","大型餐馆",天津,东丽,"东丽区津塘公路十号桥"
天津市北方高效石化设备制造有限公司,911201111037919332,1989-08-28,N/A,杨桂旺,"1,000(万元人民币)","化工专用设备制造、研发、销售；钢材批发兼零售；机械加工；填料加工；化学工程技术开发、设计、咨询、服务、转让；仓储服务(危险化学品及易制毒品除外）；厂房租赁；设备租赁；劳务服务。",天津,西青,"天津市西青区杨柳青镇柳口路38号"
天津赣津经济协作公司,91120101103061770Q,1989-08-28,N/A,严铁良,"50(万元人民币)","纺织品、百货、五金交电（不含烟、音像制品、新闻纸、凸版纸、彩色电视机）；日用杂品、建筑陶瓷、土产建材、汽车配件",天津,和平,"天津市和平区大理道新中美里1号"
中国建设银行股份有限公司天津黄河道支行,9112010468185318X5,1989-08-28,N/A,田圣,"N/A","吸收公众存款；发放短期、中期和长期贷款；办理国内结算；办理国内保理；办理住房公积金及单位、个人城市住房基金的归集、结算等业务；办理票据承兑与贴现；代理发行金融债券；代理发行、兑付、承销政府债券；代理买卖政府债券、金融债券；从事银行卡业务；代理收付款项；代理家庭财产保险、与贷款标的物相关的财产保险、机动车交通事故责任强制保险、人寿保险、意外伤害保险、健康保险；办理经经中国银行业监督管理委员会批准和总行授权经营的其他业务。",天津,南开,"南开区黄河道永基花园旁"
天津光荣特库摩软件有限公司,91120104600553450T,1989-08-29,N/A,鲤沼久史,"130,000(万日元)","设计、开发、销售计算机软件；信息技术咨询服务；信息系统集成服务；自有房屋租赁。",天津,南开,"天津市南开区南京路309号环球置地广场21-22层"
中国银行股份有限公司天津乐金电子支行,91120113767642949R,1989-08-29,N/A,蔡楠楠,"N/A","办理人民币存款、贷款、结算业务；人民币信用卡业务；办理票据贴现；代理兑付、销售政府债券；代理收付款项；外汇存款；外汇贷款；外汇汇款；外币兑换；国际结算；通过上级行办理代客外汇买卖；代理国外信用卡付款；总行在银监会批准的业务范围内授权的其他业务；代理家庭财产保险、与贷款标的物相关的财产保险、人寿保险、意外伤害保险、健康保险、机动车交通事故责任强制保险、机动车商业保险；结汇、售汇业务。",天津,北辰,"北辰区津围公路西9号"
天津市津南区八里台镇建筑工程公司,9112011210386934X5,1989-08-30,N/A,张枫,"10,000(万元人民币)","土木工程建筑、电力通风设备安装",天津,津南,"天津市津南区八里台工业园区建设路6号A区117室"
中国银行股份有限公司天津大沽南路支行,911201037413793027,1989-08-31,N/A,张宏丽,"N/A","人民币业务：办理人民币存款、贷款、结算业务；人民币信用卡业务；办理票据贴现；代理兑付、销售政府债券；代理收付款项及代理保险业务；外汇业务：外汇存款；外汇贷款；外汇汇款；外币兑换；国际结算；结汇、售汇；通过上级行办理代客外汇买卖；代理国外信用卡付款；总行在银监会批准的业务范围内授权的其它业务。",天津,河西,"河西区大沽南路书苑里7-14号"
天津渤农清洁设备有限公司,911201136005534939,1989-09-05,N/A,杨翊军,"5,581(万元人民币)","环保设施制造、安装及相关技术咨询。",天津,北辰,"北辰区铁东路"
