天津市新世界汽车服务有限公司,91120102X00580930Y,1989-09-05,N/A,李学勤,"100(万元人民币)","涂漆、电气系统维修、供油系统维护和油品更换；洗车服务；汽车配件、汽车装具、汽车用品的批发兼零售。",天津,河东,"河东区六纬路117号"
天津市津南五金塑料厂,91120112103855685B,1989-09-07,集体所有制,赵长兰,"28.4万人民币","紧固件制造(螺钉)。日用塑料杂品制造；机加工。",天津,津南,"天津市津南区咸水沽新兴南路南头"
天津安传电子有限公司,911201026005002607,1989-09-08,N/A,张鹏志,"480(万美元)","生产、销售有线电视系统设备配件、相关组件、铝品压铸件以及相关的维修服务；道路货物运输。",天津,河东,"天津市河东区十一经路47号"
天津市轻化进出口有限公司,91120101103063880X,1989-09-15,N/A,付彤,"1,000(万元人民币)","经国家批准的三类商品的进出口业务；本市轻化行业技术、设备的进口业务；承办中外合资经营、合作生产及三来一补业务；上述范围内的内销业务；橡胶原料及制品；锅炉销售；预包装食品、食用农产品批发。",天津,和平,"天津市和平区小白楼街大沽路157号"
天津太平货柜有限公司,91120110600553514E,1989-09-15,N/A,陈国樑,"2,570(万美元)","制造、销售、修理集装箱；制造、销售集装箱相关产品和零配件；金属板材加工、焊接；集装箱储存业务。",天津,东丽,"天津市东丽区军粮城产业园区"
天津大略业辉制鞋有限公司,91120102712883761U,1989-09-19,有限责任公司,赵波,"700万人民币","皮鞋、合成革鞋制造；劳保用品制造。经营本企业自产产品的出口业务和本企业所需的机械设备、零配件、原辅材料的进口业务，但国家限定公司经营或禁止进口的商品及技术除外。皮艺、皮具加工。物业管理、自有房屋租赁。土木工程建筑。销售:钢材、木材、五金、化工产品",天津,河东,"天津市河东区津塘路138号"
天津市粮油购销公司,91120102103222394C,1989-09-21,N/A,康国海,"8,699(万元人民币)","食用农产品、麻袋、面袋、钢桶、粮油副产品(下脚)。",天津,河东,"河东区六纬路1号高层2号楼"
天津宏泰华凯科技有限公司,91120225104261934M,1989-09-25,N/A,李金友,"4,220.5961(万元人民币)","乳化炸药(胶状)制造；多孔粒状铵油炸药制造；民用爆破器材技术服务、技术开发、技术推广、技术转让、技术咨询；物流配货、普通货运；民用爆破器材仓储、仓储库租赁服务业务；化工机械设备制造、维修；安防工程设计、施工；五金交电制造、销售。",天津,蓟州,"蓟县洪水庄村北"
中国建设银行股份有限公司天津梅江南支行,91120103681857711P,1989-09-27,N/A,冯俊霞,"N/A","吸收公众存款；发放短期、中期和长期贷款；对私结售汇业务；办理国内结算；办理国内保理；办理住房公积金及单位、个人城市住房基金的归集、结算等业务；办理票据承兑与贴现；代理发行金融债券；代理发行、兑付、承销政府债券；代理买卖政府债券、金融债券；从事银行卡业务；代理收付款项；家庭财产保险、与贷款标的物相关的财产保险、机动车交通事故责任强制保险、人寿保险、意外伤害保险、健康保险；办理经中国银行业监督管理委员会批准和总行授权经营的其他业务。",天津,河西,"河西区友谊南路与潭江道交口东南侧天涛园13号楼-2-104、105"
中国建设银行股份有限公司天津凯祥支行,911201046818522758,1989-10-01,N/A,韩娟,"N/A","吸收公众存款；发放短期、中期和长期贷款；办理国内结算；办理国内保理业务；办理住房公积金及单位、个人城市住房基金的归集、结算等业务；办理票据承兑与贴现；代理发行金融债券；代理发行、代理兑付、承销政府债券；代理买卖政府债券、金融债券；从事银行卡业务；代理收付款项及代理保险业务。经总行授权的其他业务；经中国银行业监督管理委员会批准的其他业务。",天津,南开,"南开区水上公园北路凯祥别墅8号楼"
天津市津南三合水泵制造厂,91120112X007806844,1989-10-11,个人独资企业,徐金亭,"N/A","微型水泵制造，机械加工；金属结构、机电设备制造、加工、安装；铆焊加工。",天津,津南,"天津市津南区葛沽镇辛庄子村南葛万公路边"
天津市环海环保设备有限公司,91120113103931932J,1989-10-21,N/A,石宝太,"1,000(万元人民币)","环保工程设计、施工；环保设备制造、安装；机电设备安装；电气焊、机械加工；普通货运；市政工程、过街天桥、筑路施工；管道工程施工",天津,北辰,"北辰区科技园区华信道8号"
天津市津北东红五金加工厂,91120113X00803954T,1989-10-24,个人独资企业,靳玉田,"N/A","五金加工；煮黑。",天津,北辰,"北辰区西堤头镇韩盛庄村"
中国建设银行股份有限公司天津柳州路支行,911201016818541315,1989-11-01,N/A,吕春勇,"N/A","吸收公众存款；发放短期、中期和长期贷款；办理国内结算；办理国内保理；办理住房公积金及单位、个人城市住房基金的归集、结算等业务；办理票据承兑与贴现；代理发行金融债券；代理发行、兑付、承销政府债券；代理买卖政府债券、金融债券；从事银行卡业务；代理收付款项；办理经中国银行业监督管理委员会批准和总行授权经营的其他业务。",天津,和平,"天津市和平区柳州路20号"
天津市振兴工商实业公司,9112010110312767XU,1989-11-01,N/A,刘彦,"119(万元人民币)","五金；交电化工",天津,和平,"和平区气象台路兴河里综合楼"
蓟县翠屏山电锯加工厂,92120225MA0671P88L,1989-11-02,个体工商户,刘福和,"N/A","电锯加工，木质产品加工零售",天津,蓟州,"天津市蓟县别山镇瓦房村"
天津市宁河县船沽钢模制造厂,91120221X00820527U,1989-11-03,个人独资企业,李学玉,"N/A","钢模板、钢支撑、钢结构、Ｕ型卡扣件制造销售；修理钢模板。",天津,宁河,"天津市宁河区大北涧沽镇船沽村东侧"
天津市津南区兴华福利橡胶制品厂,91120112103861751C,1989-11-06,集体所有制,曹桂华,"6.5万人民币","橡胶零件制造。橡胶管及密封条制造、玻璃钢制品、电气焊、机加工、喷涂、磷化。",天津,津南,"津南区双桥河镇西官房村"
天津市社会福利实业开发公司,91120000103060938X,1989-11-07,N/A,张辉,"120(万元人民币)","残疾人用车、塑料包装箱及容器制造；日用电器修理；金属拔丝及制品；钢材、水泥、建筑材料、摩托车配件、汽车（小轿车除外）、仪器仪表、针纺织品、五金交电、百货、塑料制品、土产杂品、办公设备、电线、电缆、机电产品；纸制品制造；钢管制造、加工及镀锌；金属压延及制品",天津,和平,"天津市和平区重庆道36号"
中国建设银行股份有限公司天津江都支行,911201057522387408,1989-11-10,N/A,杨杰,"N/A","吸收公众存款；发放短期、中期和长期贷款；对私结售汇业务；办理国内结算；办理国内保理业务；办理住房公积金及单位、个人城市住房基金的归集、结算等业务；办理票据承兑与贴现；代理发行金融债券；代理发行、代理兑付、承销政府债券；代理买卖政府债券、金融债券；从事银行卡业务；代理收付款项；代理家庭财产保险、与贷款标的物相关的财产保险、机动车交通事故责任强制保险、人寿保险、意外伤害保险、健康保险；提供保管箱服务；办理经总授权的其他业务、经中国银行业监督管理委员会等监督管理机构批准的其他业务。",天津,河北,"天津市河北区幸福道99号"
天津市立津经济发展公司,91120103103060698K,1989-11-10,N/A,任宏仁,"230(万元人民币)","建筑机械技术开发、技术转让、技术咨询。",天津,河西,"天津市河西区南京路52号"
天津市津南区虎跃塑料彩印厂（普通合伙）,91120112X00780641N,1989-11-15,普通合伙,N/A,"N/A","其他印刷品印刷",天津,津南,"天津市津南区葛沽镇葛沽民营经济成长示范基地津沽路89号（天津市沅亨工业气体有限公司院内）"
中国银行股份有限公司天津宁河支行,9112022180399765X8,1989-11-20,N/A,毛磐,"N/A","1、人民币业务：办理人民币存款、贷款、结算业务；人民币信用卡业务；办理票据贴现；代理兑付、销售政府债券；代理收付款项及代理保险业务。2、外汇业务：外汇存款；外汇贷款；外汇汇款；外币兑换；国际结算；结汇、售汇；通过上级行办理代客外汇买卖；代理国外信用卡付款。3、总行在银监会批准的业务范围内授权的其它业务。",天津,宁河,"天津市宁河县芦台镇光明路44号"
中铁十六局集团第二工程有限公司铁道招待所,91120102103204049L,1989-11-22,N/A,阚志娟,"N/A","旅客住宿；主食、热菜加工经营。",天津,河东,"河东区万新村三区"
天津市西青区天发木器塑料加工厂,91120111X007672363,1989-11-22,私营企业,陈继军,"N/A","木箱制造；塑料加工",天津,西青,"西青区王稳庄乡小韩庄村"
天津市津北兴淀联合机械厂,91120113103929277G,1989-11-24,个人独资企业,杨立友,"N/A","机加工、非标准小型设备制造。",天津,北辰,"北辰区小淀镇政府旁"
粤港建筑装饰工程公司天津办事处,91120000MA05W025XM,1989-11-25,N/A,黄国英,"N/A","有关建筑装饰工程设计、施工及空调家具配套、水电安装业务的咨询服务",天津,东丽,"天津市东丽区小王庄南道5排14号"
天津市北光真空设备公司,91120101103119063Y,1989-12-01,N/A,孙文富,"30(万元人民币)","工业用电炉制造、塑料热合机、电真空专用设备制造；变压器制造、修理；开关控制设备制造、修理；电子测量仪器、电工热工仪表、家用电器修理；机电产品（不含小轿车）、五金交电化工",天津,和平,"和平区松江路4号"
天津市医药广告贸易公司,9112010110311334X3,1989-12-01,N/A,姚培春,"30(万元人民币)","设计、制作、发布、代理国内广告业务；百货、五金交电、日用杂品、金属材料、建筑材料、装饰装修材料、汽车配件、工艺美术品、字画、信息咨询",天津,和平,"和平区建设路72号1门201"
中国建设银行股份有限公司天津大都会支行,91120101681854326Y,1989-12-01,N/A,玄帅,"N/A","吸收公众存款；发放短期、中期和长期贷款；办理国内结算；办理国内保理；办理住房公积金及单位、个人城市住房基金的归集、结算等业务；办理票据承兑与贴现；代理发行金融债券；代理发行、兑付、承销政府债券；代理买卖政府债券、金融债券；从事银行卡业务；代理收付款项；代理家庭财产保险、与贷款标的物相关的财产保险、机动车交通事故责任强制保险、人寿保险、意外伤害保险、健康保险；办理经中国银行业监督管理委员会批准和总行授权经营的其他业务。",天津,和平,"天津市和平区荣业大街与华安大街交口天汇尚苑1-1-103、104、105、106、108、109、201、202、203、204商铺"
天津市北辰区兴华药材包装有限公司,91120113103928346Q,1989-12-04,N/A,张怀昌,"100(万元人民币)","中成药包装；自有房屋租赁。",天津,北辰,"北辰区宜兴埠外环线西"
天津金马机电工程有限公司,91120116600500324E,1989-12-08,N/A,汤小川,"20(万美元)","生产、销售研磨工具、机械工具及其材料；装配、销售热工设备、电子元器件等电器产品及上述产品的安装、调试和售后服务；工艺铁器、木器、橱柜的制造、加工和销售。",天津,滨海,"天津经济技术开发区"
中国银行股份有限公司天津三马路支行,911201058034709970,1989-12-08,N/A,金达莱,"N/A","办理人民币存款、贷款、结算业务、人民币信用卡业务、办理票据贴现、代理兑付、销售政府债券、代理收付款项及代理保险业务、外汇存款、外汇贷款、外汇汇款、外汇兑换、国际结算、结汇、售汇、办理代客外汇买卖、代理国外信用卡付款、其总行在中国银行监督管理委员会批准的业务范围内授权的业务。",天津,河北,"天津市河北区三马路83号"
天津经济技术开发区晋煤外运服务公司,91120116104312199T,1989-12-18,N/A,袁广居,"2,000(万元人民币)","代办货物托运、装卸搬运含海陆联运；代办煤炭经销；铁矿砂批发兼零售。",天津,滨海,"天津开发区广场东路20号滨海金融街E7507"
中国建设银行股份有限公司天津本溪路支行,911201066818590710,1989-12-19,N/A,刘浩,"N/A","吸收公众存款；发放短期、中期和长期贷款；办理国内结算；办理国内保理；办理住房公积金及单位、个人城市住房基金的归集、结算等业务；办理票据承兑与贴现；代理发行金融债券；代理发行、兑付、承销政府债券；代理买卖政府债券、金融债券；从事银行卡业务；代理收付款项及代理保险业务；办理经中国银行业监督管理委员会批准和总行授权经营的其他业务。",天津,红桥,"天津市红桥区本溪路红桥房产总公司办公楼底商"
天津工艺品进出口(集团)公司艺达储运贸易公司,91120113103934367Q,1989-12-21,N/A,王树春,"927(万元人民币)","仓储（危险化学品除外）；商品检验、结汇报关服务、代办货物托运、装卸搬运货物、商品信息咨询；工艺美术品、五金、化工",天津,北辰,"北辰区北仓道"
蓟县宏发水利机械厂,92120225MA066RPK10,1989-12-21,个体工商户,于洪秀,"N/A","打井机械制造；机床加工。",天津,蓟州,"蒙酄乡"
天津艺鑫进出口贸易有限公司,911201161037004054,1989-12-22,N/A,刘宝堂,"1,800(万元人民币)","自营和代理各类商品和技术的进出口；日用百货、酒、工艺美术品、草柳竹藤、苇编织品、针纺织品、办公用品、五金电料、汽车配件、建筑材料、装饰材料的销售；仓储",天津,滨海,"天津市滨海新区大港咸歧公路西板桥农场内"
天津工艺品进出口公司万辛庄仓库,911201021032217975,1989-12-23,N/A,唐玉祥,"572(万元人民币)","商品储存；劳务。",天津,河东,"河东区张贵庄路168号"
天津市北辰区新生福利制鞋厂,91120113103957147G,1989-12-27,集体所有制,周绍志,"54万人民币","制鞋。",天津,北辰,"北辰区姚庄村"
天津市正方工业有限公司,91120221600781285Q,1989-12-30,N/A,于学军,"6,000(万元人民币)","电子元件、绝缘垫、塑料制品（不可降解的超薄塑料袋及一次性发泡餐具除外）、玻璃纤维及制品；玻璃纤维增强塑料制品制造；输配电及控制设备、体育器材及配件制造；货物及技术进出口",天津,宁河,"天津市宁河区俵口镇安全村"
