中国农业银行股份有限公司固原城区分理处,916404006842488310,1999-06-30,N/A,哈娟,"N/A","办理人民币存款、贷款、结算业务、票据贴现；代理发行金融债券，发行、代理兑付、销售、买卖政府债券；代理收付款项及代理保险业务，经中国银行业监督管理委员会批准的其他业务。",宁夏,固原,"宁夏固原市原州区文化西街"
宁夏第一建筑公司第一分公司,9164000092768222X5,1999-06-30,N/A,王永生,"1,427(万)","工业与民用建筑，设备安装,建筑装潢、装饰，水利水电施工。预应力大型屋面板、预应力小孔板、预制混凝土空心板制造。(以资质证为准)。",宁夏,银川,"宁夏回族自治区银川市满城北街1号"
中国农业银行股份有限公司固原中山街支行,91640400684248743H,1999-06-30,N/A,王克国,"N/A","办理人民币存款、贷款、结算业务、票据贴现；代理发行金融债券，发行、代理兑付、销售、买卖政府债券；代理收付款项及代理保险业务，经中国银行业监督管理委员会批准的其他业务。",宁夏,固原,"宁夏固原市原州区中山街72号"
宁夏隆鼎电力有限公司,91640000710653364D,1999-06-30,N/A,胡学智,"4,000(万)","输、变、配电工程；进出口贸易",宁夏,N/A,"宁夏隆湖经济开发区六站"
中国农业银行股份有限公司固原新区支行,9164040068424868XG,1999-06-30,N/A,王红兵,"N/A","办理人民币存款、贷款、结算业务、票据贴现；代理发行金融债券，发行、代理兑付、销售、买卖政府债券；代理收付款项及代理保险业务，经中国银行业监督管理委员会批准的其他业务。",宁夏,固原,"宁夏固原市原州区新区北京路西侧派胜世茂城"
中国农业银行股份有限公司固原晨光分理处,9164040468424876XX,1999-06-30,N/A,沙晓平,"N/A","办理人民币存款、贷款、结算业务、票据贴现；代理发行金融债券，发行、代理兑付、销售、买卖政府债券；代理收付款项及代理保险业务，经中国银行业监督管理委员会批准的其他业务。(依法须经批准的项目，经相关部门批准后方可开展经营活动)",宁夏,固原,"固原经济开发区长城路"
中国农业银行股份有限公司固原钟楼分理处,91640400684248807F,1999-06-30,N/A,兰婷婷,"N/A","办理人民币存款、贷款、结算业务、票据贴现；代理发行金融债券，发行、代理兑付、销售、买卖政府债券；代理收付款项及代理保险业务，经中国银行业监督管理委员会批准的其他业务。",宁夏,固原,"宁夏固原市原州区月牙路东海宋家巷H区"
中国农业银行股份有限公司固原长城路支行,91640400684248815A,1999-06-30,N/A,马少栋,"N/A","办理人民币存款、贷款、结算业务、票据贴现；代理发行金融债券，发行、代理兑付、销售、买卖政府债券；代理收付款项及代理保险业务，经中国银行业监督管理委员会批准的其他业务。(依法须经批准的项目，经相关部门批准后方可开展经营活动)",宁夏,固原,"宁夏固原市长城路南侧外街1号楼"
宁夏金地房地产开发有限公司,91640221715043477W,1999-07-02,N/A,刘兴军,"2,509(万)","房地产开发经营",宁夏,石嘴山,"平罗县宝丰路534号"
宁夏同润华盛建设工程有限公司,9164020022799605X4,1999-07-05,N/A,贾瑛,"4,000(万)","房屋建筑工程(二级)，市政公用工程（二级），电力工程（三级）、建筑装修装饰工程(二级)，金属门窗工程，钢结构工程（三级），机电设备安装工程（三级），水利水电工程（三级），防水防腐保温工程(二级）；城市园林绿化（三级）；电力设施承装（四级）、承修（四级）、承试（四级）；环保工程专业承包叁级；地质灾害治理工程（丙级）；古建筑工程专业承包叁级；城市及道路照明工程专业承包叁级；施工劳务不分等级；五金建材，装饰材料的销售；房屋租赁；家政服务、社区服务；工程机械租赁(依法须经批准的项目，经相关部门批准后方可开展经营活动)",宁夏,石嘴山,"石嘴山市大武口区长庆东街荣达城市印象小区20幢402号"
宁夏石嘴山市兴泰房地产开发有限公司,916402007106553431,1999-07-05,N/A,张小平,"1,200(万)","房地产开发肆级",宁夏,石嘴山,"宁夏石嘴山市惠农区煤炭东路"
宁夏住宅物业服务有限公司,91640000710658958Y,1999-07-05,N/A,陶增山,"500(万)","物业管理，绿化，房屋修缮，水暖电维修，建材生产、销售,日用百货销售,文化体育活动(只限本公司小区内)；电梯安装、维修；供热；餐饮服务。",宁夏,银川,"银川市凤凰北街北安小区物业楼"
中宁县粮食购销公司,91640521MA75Y3702T,1999-07-05,N/A,胡兴生,"2,146(万)","粮食收购、储存、调拨、销售(依法须经批准的项目，经相关部门批准后方可开展经营活动)",宁夏,中卫,"宁夏回族自治区中宁县城北街"
宁夏丽容商贸有限公司,916400007106592568,1999-07-05,N/A,邹丽云,"52(万)","批发、零售建筑装饰材料、五金工具、水暖配件、家用电器、办公用品、日用百货、洗涤用品；美容、美发；家政服务；水产养殖.",宁夏,银川,"银川市兴庆区利民街80号（原利民街148号）"
宁夏吴忠市六丰永业塑胶有限公司,91640300710636839U,1999-07-06,N/A,贾云,"30(万)","塑料打包带、塑料编织袋、高分子材料、PP,PE,PVC涂料、塑料原料的销售；塑料包装制品的加工",宁夏,吴忠,"宁夏回族自治区吴忠市利通北街左营村"
宁夏紫荆花纸业有限公司,916401217106566292,1999-07-07,N/A,纳巨波,"17,440(万)","生产、销售生活用纸、工业用纸、文化用纸及卫生保健品；麦秸、芦草的收购（仅限分公司收购）；经营本企业自产产品及技术的出口业务；经营本企业生产所需原辅材料、机械、设备、零配件及技术的进口业务；有机肥、复混肥料、掺混肥料、有机-无机复混肥料、微肥、水溶性肥料、化工产品及化工原料（不含易燃易爆物品及危险化学品）的销售（国家规定的从其规定）（凡涉及许可证制度的凭证经营）",宁夏,银川,"宁夏永宁县城红星桥南侧"
宁夏惠渠水利建筑工程有限责任公司,91640122227963151W,1999-07-08,N/A,李鹏,"533(万)","中小型水利建筑工程。",宁夏,银川,"贺兰县城南街（惠管处）"
宁夏洁星商贸有限公司,9164000071065886XB,1999-07-08,N/A,陈玲,"500(万)","建筑装饰材料、电子产品、办公用品、化学管材、管件、化工产品、五金交电、水暖器材、电线电缆、机械设备、阀门、塑胶制品、金属材料、广告装饰材料、劳保用品、仪器仪表批发、零售。",宁夏,银川,"银川市兴庆区北京东路175号宁夏建筑材料研究院三楼"
宁夏科进防腐保温材料有限公司,91640381228313978T,1999-07-08,N/A,马建忠,"1,000(万)","硅酸铝耐火纤维系列制品、矿岩棉纤维及制品、复合硅酸盐系列保温材料、聚氨酯制品高分子防水涂料、玻璃钢系列制品、耐火浇注料、混凝土外加剂系列产品、其他建材产品生产销售（涉及前置审批许可项目的凭证经营）",宁夏,吴忠,"宁夏回族自治区青铜峡市青铜峡镇河西"
银川市凤城五金交电有限责任公司凤城歌舞厅,916401007150885799,1999-07-09,N/A,栗海峰,"N/A","娱乐",宁夏,银川,"银川市凤城五金大楼三楼营业厅"
宁夏凯维思计算机开发有限公司,91640100MA75Y39D1E,1999-07-09,N/A,闫锋,"30(万)","销售办公设备及耗材；计算机软件开发、销售；计算机局域网络布线、维修、技术咨询（不含中介服务）",宁夏,银川,"银川市宗睦巷38-1号"
德力西集团银川项目工程有限公司,91640100710622154P,1999-07-09,N/A,程会光,"50(万)","高低压成套电力设备、高低压电器元件、电线电缆、电力金具、高速公路护栏、五金交电、建筑装饰材料、劳保用品、机械设备的销售；电力电气设备",宁夏,银川,"宁夏银川市金凤区北京中路704号"
宁夏吉运建筑安装有限公司,91640100710658966Y,1999-07-12,N/A,张国存,"6,013.2436(万)","建筑施工及安装、装潢",宁夏,银川,"银川市北京中路802号"
宁夏贺兰农村商业银行股份有限公司,9164010022768286X1,1999-07-14,N/A,隋生秀,"12,658.8245(万)","吸收公众存款；发放短期、中期及长期贷款；办理国内结算；办理票据承兑与贴现；代理收付款项及代理保险业务；买卖政府债券、金融债券；代理发行、代理兑付、承销政府债券；提供保险箱服务；从事同业拆借；从事银行卡业务；提供保管箱服务业务；经中国银行业监督管理委员会批准的其他业务。",宁夏,银川,"宁夏回族自治区银川市贺兰县银河东路83号"
吴忠市兴水水利工程有限公司,91640300710637356F,1999-07-14,N/A,张向升,"600(万)","可承担单项合同额不超过企业注册资本金5倍的下列工程的施工：库容1000万立方米、装机容量10MW及以下水利水电工程及辅助生产设施的建筑、安装和基础工程施工",宁夏,吴忠,"吴忠市裕民西路北侧星河国际303室"
石嘴山市恒馨物业有限公司,91640200710655706W,1999-07-15,N/A,邓山,"313.4000(万)","物业管理(二级)；广告牌租赁；广告设计、制作、发布",宁夏,石嘴山,"大武口区台湾北路33、35号"
宁夏供销社副食土特产品公司,91640000710659192A,1999-07-15,集体所有制,王珲,"240万人民币","农副土特产品(不含粮食).副食品.饮料.酒.糖茶.日用百货.五金工具、家具.*(依法须经批准的项目，经相关部门批准后方可开展经营活动)",宁夏,银川,"银川市兴庆区长城东路406号"
盐池县麻黄山供销社后洼分社,91640323MA75XXWK19,1999-07-15,集体分支机构(非法人),刘顺邦,"N/A","百货，针纺织品，五金交电，化肥，农药，农地膜，日用杂品*(依法须经批准的项目，经相关部门批准后方可开展经营活动)",宁夏,吴忠,"盐池县麻黄山乡后洼中街"
中国建设银行股份有限公司固原分行,916404004550050439,1999-07-15,N/A,张志锋,"N/A","吸收公众存款；发放短期、中期、长期贷款；办理国内外结算；办事票据承兑与贴现；发行金融债券；代理发行、代理兑付、承销政府债券；买卖政府债券、金融债券；从事同业拆借；买卖、代理买卖外汇；从事银行卡业务；提供信用证服务及担保；代理收付款项及代理保险业务；提供保管箱服务；经中国银行业监督管理机构等监管部门批准的其他业务。",宁夏,固原,"宁夏固原市原州区中山南街127号"
国网宁夏电力有限公司吴忠供电公司,91640300228283035K,1999-07-16,N/A,贺文,"N/A","电力供应；电力设备、线路安装、维修；电力工程勘察设计(仅限分支机构经营)",宁夏,吴忠,"宁夏回族自治区吴忠市利通区南环路"
宁夏储备粮惠农储备库(有限公司),916402002279924038,1999-07-19,N/A,唐宝才,"2,000(万)","粮食、食油的收购、储存、销售",宁夏,石嘴山,"宁夏回族自治区惠农区花园路30号"
宁夏东方企业(有限公司),916400007106264893,1999-07-20,N/A,吴桂俊,"17,350(万)","煤炭批发、经营；承装（修、试）电力设施",宁夏,银川,"宁夏银川市金凤区丰登镇联丰村二队丰阅小区10#-1-402室"
银川市嘉德商贸有限公司,91640100710622330L,1999-07-20,N/A,李海,"30(万)","场地租赁,休闲健身。",宁夏,银川,"银川市金凤区北京中路608号"
宁夏吴忠市金元清真乳业有限公司,916403002282539790,1999-07-20,N/A,马金元,"1,000(万)","批发兼零售预包装食品、乳制品(含婴幼儿配方乳粉)",宁夏,吴忠,"宁夏回族自治区吴忠市南环西路58号"
银川信泰物资有限公司,91640121710622306H,1999-07-20,N/A,杨震,"500(万)","金属材料、建材、有色金属、机电产品、化工原料（不含易制毒及危险化学品）、水暖配件的销售",宁夏,银川,"永宁县望远现代金属物流园6-55号"
吴忠市广播电视微波网络有限公司,91640300710634243R,1999-07-22,N/A,赵自忠,"364(万)","MMDS传输，接受，有线网络建设，广播电视设备器材销售",宁夏,吴忠,"宁夏回族自治区吴忠市裕民东街54号"
宁夏惠恒电子商贸有限公司,91640100710623122M,1999-07-22,N/A,陈军辉,"30(万)","办公设备、电子产品、通讯器材、电脑及耗材、百货、厨房设备、化工产品（不含易制毒及危险化学品）、五金交电、建材、日杂的零售批发",宁夏,银川,"银川市凤凰北街247号"
宁夏红宝汽车运输有限公司,91640521710642905L,1999-07-23,N/A,万锋,"2,000(万)","道路普通货物运输；汽车配件、工程配件、批发、零售；二类机动车维修；工程机械修理及工程设施租赁；客运、国内旅行社服务；装卸搬运。",宁夏,中卫,"中宁县工业园区红宝公司生活区"
宁夏大可建材装饰有限公司,91640000710659651F,1999-07-23,N/A,陈斌,"800(万)","防弹复合玻璃、防弹防砸复合玻璃、防砸复合玻璃、汽车用安全玻璃、夹层玻璃生产、销售、安装；铝合金门窗、塑钢门窗、玻璃墙",宁夏,银川,"银川市新城区永青西街21号"
银川市利盛商贸有限公司,916411002277419541,1999-07-26,N/A,刘道连,"86(万)","五金交电产品、金属材料、建筑装饰材料、机械电子设备、汽车及摩托车配件、计算机、家具、日用百货、办公用品、服装、针纺织品、畜产品、焦炭、焦粉、石油焦、化工原料（不含易制毒及危险化学品）、酒类产品的批发零售（法律法规须经审批的，凭审批批准文件经营）",宁夏,银川,"开发区中苑大厦A座510室"
宁夏宁东宝塔化工助剂有限公司,91641200710640168P,1999-07-28,N/A,李文财,"550(万)","水处理剂产品的研发、推广及销售；金属缠绕垫、岩棉管批发零售；油罐和油管的防腐保温及设备维修；汽油、柴油、石脑油的批发；水性乳胶漆、防腐涂料、醇酸油漆、各类稀释剂的加工生产及销售。(依法须经批准的项目，经相关部门批准后方可开展经营活动)",宁夏,银川,"宁夏回族自治区灵武矿务局灵新矿区"
宁夏灵武宝塔大古储运有限公司,91641200710640176J,1999-07-28,N/A,纪静,"250,000(万)","建筑材料的储备、销售；棉花的批发零售及铁路运输；汽油、柴油、原油、重油、渣油、甲醇、二甲醚、甲基叔丁基醚、聚丙烯、凝析油、燃料油、液化石油气、油浆、蜡油、石脑油、煤焦油、丙烯、硝化沥青、溶剂油、苯、甲苯、二甲苯、醋酸乙烯",宁夏,银川,"灵武市磁窑堡矿务局中心区火车站"
银川长城商贸有限公司,91640100710623253H,1999-07-28,N/A,王光银,"501(万)","房屋租赁；建筑装饰材料、家具及饰品、灯饰、化工产品（不含危险品）、轻纺产品、二三类机电产品、汽车（不含小轿车）、摩托车及配件、五金、百货、日杂批发零售",宁夏,银川,"银古公路与东二环路交叉处西南侧"
宁夏鸿建建设监理有限公司,916402007106559257,1999-07-30,N/A,刘尚学,"301.2000(万)","房屋建筑工程监理甲级；市政公用工程监理甲级；人民防空工程丙级；地质灾害治理工程监理丙级，可以开展相应类别建设工程的项目管理、技术咨询等业务",宁夏,石嘴山,"宁夏石嘴山市大武口区裕民路88号"
宁夏平罗三阳实业有限公司,916402217106318519,1999-07-30,N/A,王利通,"500(万)","碳素制品、增炭剂、电极糊生产、销售",宁夏,石嘴山,"宁夏回族自治区平罗县太西镇西南侧"
宁夏正鑫源现代农业发展集团有限公司,916403817106387039,1999-08-02,N/A,包立新,"1,200(万)","农业机械、工程机械制造、代理销售；机械设备安装、维护；机电设备、农机配件、润滑油、五金工具、农用汽车、环保设备销售；林牧机械制造销售；大米加工及销售；农作物、苗木种植销售；园林绿化（凭资质证经营）；消防器材销售",宁夏,吴忠,"宁夏青铜峡市叶盛镇"
宁夏永宁县胜利填充板制造厂,91640121MA75Y2E47A,1999-08-03,个人独资企业,王玉成,"N/A","木制填充板门、家庭门件、刨花板生产、销售*(依法须经批准的项目，经相关部门批准后方可开展经营活动)",宁夏,银川,"永宁县胜利乡杨显桥西1公里"
宁夏通信服务有限公司,91640000710659950D,1999-08-04,N/A,张红星,"3,000(万)","集团公司投资形成的国有资产和国有股权。经营移动通信业务(包括话音、数据、多媒体等),IP电话业务，计算机信息网络国际联网以及基于移动通信业务的各类增值业务。经营与移动通信业务相关的系统集成、漫游结算清算、技术开发、技术服务、广告业务、设备销售等。根据市场发展需要，经集团公司同意后，由地方电信主管部门批准的其他区域性电信业务。集团公司授权经营的其他业务，通信线路及基站维护，通信工程设计，通信生产设施的建设与租赁，技术咨询及培训",宁夏,银川,"银川市金凤区新昌东路217号-3楼"
吴忠市鲁宁电杆电器有限公司,91640300710634307P,1999-08-05,N/A,高玖平,"1,100(万)","电杆、电线、水泥制品、塑料制品的生产及销售；五金交电；电工电料、通讯器材（不含无线电发射装置）、分纤箱、电缆桥架、井盖井圈的销售；铁附件、横担的生产及销售",宁夏,吴忠,"宁夏回族自治区吴忠市利通区高闸乡"
宁夏香山物资有限公司,91640500228358666M,1999-08-09,N/A,陆太保,"600(万)","金属材料、建材、五金产品、劳保用品、冶金炉料、化工原料",宁夏,中卫,"中卫市沙坡头区鼓楼东街加油站对面"
中国移动通信集团宁夏有限公司银川分公司,916400007106599850,1999-08-09,N/A,邵泉,"N/A","在本区内经营GSM数字移动通信业务；IP电话业务；因特网接入服务业务；移动通信、IP电话和因特网等设施的维修；提供相关技术服务、设备销售，以及其他电信及信息服务；出售、出租移动电话终端设备、IP电话设备、因特网设备及其配件，并提供售后服务；业务培训、会议服务。",宁夏,银川,"银川市兴庆区解放西街9号邮政大楼"
宁夏轻工工艺品进出口有限责任公司,91640100710659846E,1999-08-09,N/A,陈永安,"300(万)","自营和代理除国家组织统一联合经营的出口商品和国家实行核定公司经营的进口商品以外的其它商品及技术的进出口业务；经营进料加工和“三来一补”；经营对销贸易和转口贸易。(依法须经批准的项目，经相关部门批准后方可开展经营活动)",宁夏,银川,"银川市金凤区黄河东路888号-1恒泰商务大厦7层"
宁夏金泉置业有限公司,916402007106558619,1999-08-09,N/A,陶风军,"3,000(万)","房地产开发(肆级)；五金、化工(除化学危险品)、机电设备、建筑材料、木材、钢材、焦炭、日用杂品(除烟花爆竹)的销售",宁夏,石嘴山,"宁夏回族自治区惠农区南大街258号"
青铜峡市劳动就业局兴新实业开发总公司,91640381228317135W,1999-08-10,N/A,纳文琴,"60(万)","建材、五金交电、水暖配件、日用百货、针纺织品、服装鞋帽、装饰材料、生资日杂、农副土特产品(粮食批发除外)、机电产品",宁夏,吴忠,"宁夏回族自治区青铜峡市小坝镇"
银川市辉瑞商贸有限公司,91640100710623114T,1999-08-10,N/A,马丽萍,"1,600(万)","汽车",宁夏,银川,"银川市商都5号楼2-29号"
宁夏鲁西化工化肥有限公司,916400007106598544,1999-08-11,N/A,冯德学,"5,000(万)","化肥（磷酸一铵,磷酸二铵,普钙,过磷酸钙,复合肥、复混肥、缓控释肥、钾肥）的生产销售、装卸、搬运；硫酸,石膏粉、石膏制品的生产、销售，氟硅酸钠的生产、销售，农膜、编织袋，化工产品及化工原料的加工销售（不含危险化学品），建筑材料销售，塔类设备填料（不包括特种设备），内件生产、销售；电器、仪表、设备，管道安装、阀门维修、非标设备设备制作、安装",宁夏,银川,"银川市新市区北京西路38号"
宁夏青松乳业有限公司,91640122710626374X,1999-08-12,N/A,史俭,"3,279.9171(万)","奶、肉牛养殖、销售。",宁夏,银川,"贺兰县习岗镇红旗养殖区红旗村四社"
宁夏秦毅实业集团有限公司,91640521710642913F,1999-08-17,N/A,陈大和,"6,800(万)","铝锭冶炼深加工和销售及原材料的购销；摩托车、电器机械、农副产品销售；商品及技术的进出口业务；道路普通货物运输、搬运装卸；热食类食品制售。",宁夏,中卫,"宁夏回族自治区中宁县城北街"
银川市宁京网络通讯有限公司,91640100710623667M,1999-08-17,N/A,宗振华,"600(万)","计算机系统集成；强电弱电工程；安防监控工程及设备的销售（不含窃听窃照器材）；软硬件开发、通迅器材、电子产品、机械设备、办公用品、仪器仪表、五金交电、耗材、服务、修理、销售、批发",宁夏,银川,"银川市解放东街13-2-4号"
宁夏富盛机械制造有限公司,9164030071063733XL,1999-08-17,N/A,王金福,"100(万)","机械制造,维修;铁艺制作;经营本企业自产产品及技术的出口业务;经营本企业生产所需的原辅材料,仪器仪表,机械设备,零配件及技术的进口业务(国家限定公司经营和国家禁止进出口的商品及技术除外);经营本企业的进料加工和",宁夏,吴忠,"宁夏回族自治区吴忠市西环南路18号"
石嘴山市隆湖丰源工贸有限公司,916402007106533482,1999-08-17,N/A,张银英,"300(万)","电煅煤、焦粉、炭素制品、五金、化工产品（不含危险品）、建材、焦炭、沥青（不含危险品）、机械设备、电子产品的销售",宁夏,石嘴山,"石嘴山市隆湖开发区六站"
宁夏中宁县兰鑫五交化有限责任公司,91640521228360168T,1999-08-19,N/A,刘中雄,"45(万)","五金、家用电器、交电、化工、水暖、建材、机械、日用百货、办公用品、劳保用品、厨房用具及日用杂品销售；家用电器维修",宁夏,中卫,"宁夏回族自治区中宁县城市场街"
石嘴山市北海商贸有限公司,91640200624992474D,1999-08-19,N/A,周永平,"268(万)","仪器仪表、电工电料、水暖配件、润滑油、润滑脂、机械电子设备、钢材、建筑材料、五金、日用杂品（除烟花爆竹）、焦炭、汽车、化工产品（不含化学危险品）、橡胶产品、劳保用品、办公用品、矿山机械配件、电线电缆的销售；机电维修",宁夏,石嘴山,"石嘴山市大武口区长胜路潮湖村中庄子20号"
银川福源商贸有限公司,91640100710623720H,1999-08-19,N/A,胡耀礼,"300(万)","针纺品、鞋帽、日用百货、洗涤化妆品、文化用品、棉麻日杂、五金交电、建材、电缆、劳保用品、服装销售。",宁夏,银川,"银川市民族南街3-7号"
宁夏石嘴山市平生食品有限公司,916402027106800557,1999-08-19,N/A,赵静,"30.2800(万)","仓储、物流配送；道路普通货物运输；餐饮服务管理服务；生产加工方便食品；方便食品的批发零售(依法须经批准的项目，经相关部门批准后方可开展经营活动)",宁夏,石嘴山,"大武口区工业园区中兴街以南"
石嘴山市民族饭店有限公司,91640200710680143Q,1999-08-24,N/A,谢永强,"92.2000(万)","房屋租赁服务",宁夏,石嘴山,"大武口区朝阳东街14号"
固原经济开发区捷达汽车运输有限公司,916404047106507966,1999-08-24,N/A,张生宏,"200(万)","建材、装饰材料、门窗、暖气片、太阳能、办公用品销售。",宁夏,固原,"固原经济开发区民族路3号"
银川金健电子技术有限公司,91640100710624117B,1999-08-24,N/A,王健,"30(万)","电子、电器产品、计算机及办公设备配件、维修技术服务",宁夏,银川,"银川市兴庆区双富巷14号"
宁夏中卫市鸿鹏门窗制作有限责任公司,916405002283573647,1999-08-25,N/A,许家其,"100(万)","建筑外窗加工、制作、销售；铝合金型材、塑钢型材加工、制作、销售。",宁夏,中卫,"中卫市沙坡头区商业北街"
宁夏川东化工有限公司,91640121X24902682B,1999-08-25,N/A,胡宁,"50(万)","切削液、冷却液、脱模剂、防水涂料、脂肪酸、油酸等化工产品以及活性炭粘结剂的研制、开发、生产和销售；销售五金工具、化工产品",宁夏,银川,"宁夏永宁县望远工业园区"
宁夏银川泰富实业有限公司,916401007106249694,1999-08-25,N/A,何中存,"300(万)","计算机服务；办公设备及用品、五金交电、化工原料",宁夏,银川,"银川市新华东街258号金泰大厦B座10楼东C"
