宁夏宁北汽车贸易有限公司,916400007106607242,1999-08-25,N/A,席春明,"6,000(万)","长城品牌汽车、金杯品牌汽车、哈飞及松花江品牌汽车、众泰品牌汽车、中华品牌汽车销售，相关信息咨询服务；批发、零售办公设备、汽车（不含专项审批）、汽车配件、汽车装饰用品；汽车租赁；二类机动车维修（小型车整车维护及修理）（限分支机构经营）；保险兼业代理（按保险兼业代理许可证核定的范围）；压力容器的安装及维修；房屋租赁；新能源汽车充电桩经营及管理",宁夏,银川,"银川市兴庆区友爱中心路西侧兴庆科技园内宁夏宁北汽车贸易有限公司院"
银川青春称重技术有限公司,9164110071066053XN,1999-08-26,N/A,程继仓,"50(万)","计量器具及零配件、仪器仪表的开发、生产、销售，建筑材料、金属材料、五金工具、化工产品（不含剧毒危险品）、冶金炉料、机电产品批发、零售",宁夏,银川,"银川开发区中苑大厦四楼423室"
青铜峡市利源工贸有限公司,916403817106382444,1999-08-26,N/A,张春平,"1,052.9000(万)","化肥、硫精砂、化工原料批零兼营、 硫酸(含剧毒危险品)生产销售；危险货物运输(凭资质证经营)；货物仓储（不含危险化学品）；场地租赁；汽车租赁（凭资质证经营）",宁夏,吴忠,"宁夏回族自治区青铜峡市新材料基地"
中电投宁夏能源铝业青鑫炭素有限公司,91640381710638850T,1999-08-26,N/A,吴卫国,"6,490(万)","炭素制品生产销售出口,相关原材料销售、技术开发和技术服务；废旧塑料回收、加工、销售",宁夏,吴忠,"宁夏回族自治区青铜峡铝厂"
银川贝尔利科技开发有限公司,91641100710660716Q,1999-08-26,N/A,王辉,"50.5000(万)","工厂自动化工程、计算机系统集成，机电产品、文化用品、图书、橡胶制品销售，音像制品出租、零售。",宁夏,银川,"银川开发区17号规划路1-7号"
吴忠市利达贸易有限公司,91640300228280125J,1999-08-27,N/A,马红霞,"30(万)","生资日杂(不含农药,种子)、家电、陶瓷、农机及配件、家俱、日用百货、建材、塑料薄膜、办公用品的销售",宁夏,吴忠,"吴忠市利通区裕民东街39号"
宁夏永宁昊顺出租汽车有限公司,91640121710656530H,1999-08-27,N/A,周德倩,"30(万)","出租客运、客运服务",宁夏,银川,"宁夏永宁县宁和北街（伟林房产公司五楼）"
宁夏三新真空锅炉制造有限公司,91641100227749745H,1999-08-28,N/A,陈炜,"5,500(万)","锅炉、加热炉、压力容器（D1、D2）、热力系统设备及辅机附件、环保设备、配电箱",宁夏,银川,"银川高新技术产业开发区6号路"
德力西集团宁夏工业电气有限公司,916401007106606871,1999-08-30,N/A,N/A,"500(万)","机械电器、电子仪表、照明灯具、高低压成套设备、汽车摩托车配件、电线、电缆、五金交电、建材的销售。",宁夏,银川,"宁夏银川市兴庆区立达国际机电水暖汽配城2-2-04号"
中卫市通航渡运有限责任公司,91640500228357321R,1999-08-30,N/A,高生平,"70(万)","货物运输:内河客滚运输",宁夏,中卫,"中卫市沙坡头区常乐镇水车十队"
宁夏绿康物产有限公司,916400007106600110,1999-08-30,N/A,高桥日出男,"741.0200(万日元)","荞麦、绿豆、黑豆、大豆、青豆、枸杞等农副土特产品的种植、生产、精选、加工、销售。",宁夏,银川,"宁夏银川市高新技术开发区6号路中段3楼6层"
中国电信股份有限公司吴忠九公里营业厅,91640300MA75X14H1A,1999-08-31,N/A,李建涛,"N/A","基础电信业务：在全国范围内经营800MHzCDMA第二代数字蜂窝移动通信业务和CDMA2000第三代数字蜂窝移动通信业务。在本省范围内经营固定网本地电话业务（含本地无线环路业务）、固定网国内长途电话业务、固定网国际长途电话业务、IP电话业务",宁夏,吴忠,"宁夏回族自治区吴忠市利通区九公里镇"
宁夏恒利通经贸有限公司,91640000710660767F,1999-09-01,N/A,廉洁,"7,860(万)","投资、金属材料、钢材、水泥、木材、五金交电、电子产品、办公自动化设备、化工产品(不含专营)、建筑材料、装饰材料、家具、文化用品、日用百货、针纺织品、电线、电缆、农副产品(不含粮食)销售，汽车清洗、建筑清洗、计算机及配件、纸张。",宁夏,银川,"银川市兴庆区凤凰南街185号"
宁夏宏亚房地产开发有限公司,91640323710643852L,1999-09-01,N/A,杨学智,"4,000(万)","房地产开发经营",宁夏,吴忠,"盐池县福州南路东侧居安小区内"
宁夏虹安工矿物资有限公司,91640100710668128B,1999-09-01,N/A,胡爱斐,"30(万)","法律法规明确或国务院决定须经审批的项目，经相关部门批准后方可开展经营活动；无须审批的，企业自主选择经营项目开展经营活动。",宁夏,银川,"银川市兴庆区虹安花卉物流交易市场B区2号库房"
宁夏百力德建筑工程有限公司,91640000710660900Y,1999-09-06,N/A,白雪俊,"2,008(万)","房屋建筑工程二级、混凝土预制构件三级、起重设备安装工程三级、预拌商品混凝土二级、防水防腐保温工程专业承包二级、建筑装饰装修工程专业承包二级、钢结构工程专业承包二级、房地产开发（以上工程范围凭资质书经营）；土石方工程；建筑消防工程；园林绿化工程；水暖电安装；建筑装饰材料销售；砼制品、水泥粉磨、混凝土添加剂、商品混凝土生产",宁夏,银川,"银川保伏桥银通公司西侧"
宁夏林威房地产开发有限公司,91640000710663562A,1999-09-06,N/A,李建军,"2,500(万)","房地产开发(以资质证为准)，房屋销售、租赁。",宁夏,银川,"银川市胜利街1000号"
宁夏平罗县鹏源塑料厂,91640221710632168F,1999-09-07,个人独资企业,李长青,"30万人民币","塑料制品加工、批发、销售。(依法须经批准的项目，经相关部门批准后方可开展经营活动)",宁夏,石嘴山,"平罗县城北门玉皇阁市场内"
青铜峡市建设工程监理有限责任公司,916403817106891804,1999-09-10,N/A,周茂荣,"50(万)","工程高度16层以下、工程跨度24米以内、日产10万吨以下水厂、一级污水处理厂、长10公里以下排水工程、三级以下公路工程、40米以下全长200米以下公路桥梁及城市次干道路、建设项目为三级的各种工程建筑安装、市政公路等内容的建设监理",宁夏,吴忠,"宁夏回族自治区青铜峡市嘉宝工业园区(吴青公路南)"
宁夏北极星化工有限公司,91640122710680856H,1999-09-13,N/A,高靖国,"1,005(万)","防冻液（不冻液）、换能液、防冻隔离剂、抗燃液压油（液）、食品冷媒（载冷体）、导热油、刹车油、抑尘剂（封尘剂）、液压支柱乳化油（液）、乙二醇生产、销售及服务；润滑油经销；煤炭整平压实、防冻抑尘设备制造及安装；塑料膜",宁夏,银川,"银川德胜工业园区永胜大道东路8号"
吴忠市洪云建筑工程有限公司,91640300228282964F,1999-09-14,N/A,丁海军,"2,500(万)","可承担单项建安合同额不超过企业注册资本金5倍的下列房屋建筑工程的施工:14层及以下,单跨跨度24米及以下的房屋建筑工程;高度70米及以下的构筑物;建筑面积6万平方米及以下的住宅小区或建筑群体(依法须经批准的项目，经相关部门批准后方可开展经营活动)",宁夏,吴忠,"吴忠市利通区马家湖乡政府"
宁夏辰隆房地产开发有限公司,91640100710661559M,1999-09-15,N/A,邓世川,"2,500(万)","房地产开发及房屋销售、房屋租赁。",宁夏,银川,"银川市上海东路775号"
彭阳县粮食购销公司,91640425228562173L,1999-09-15,N/A,王固军,"69(万)","粮油收购、储存、调拨；散装食品、预包装食品",宁夏,固原,"彭阳县兴彭路67号"
银川市荣通商贸有限公司,91640100710668355G,1999-09-15,N/A,董伟荣,"60(万)","轮胎、汽车配件、汽车装璜、机电产品",宁夏,银川,"银川市兴庆区银横路北侧掌政安置区综合楼2号办公"
宁夏富兴达房地产开发集团有限公司,916400007106397578,1999-09-15,N/A,刘良富,"5,530.1800(万)","房地产开发与经营",宁夏,银川,"宁夏回族自治区灵武市南大街东侧"
宁夏小牛自动化设备有限公司,91640000710661540K,1999-09-16,N/A,王小牛,"750(万)","光机电一体化设备、太阳能发电设备的研发、生产及销售；普遍机械设备修理；软件开发及技术咨询服务；货物及技术的进出口；房屋租赁；设备租赁。",宁夏,银川,"银川经开区金凤工业园宝湖西路6号"
宁夏住宅建设工程有限公司,91640000710662092R,1999-09-18,N/A,王东生,"10,660(万)","房屋建筑工程施工总承包(一级)，建筑材料、建筑机械经销；建筑构件、金属结构件加工制作、建筑装修装饰工程二级、可承担二级市政公用工程、钢结构工程、体育场地设施工程施工、水利水电工程（三级）",宁夏,银川,"银川市高新技术开发区中央大道1号楼"
银川金泉泵业有限公司,916401007106618749,1999-09-20,N/A,李龙喜,"120(万)","水泵、阀门、电机、电线电缆、冶金炉料、劳保用品批发、零售、仪器仪表、泵及配件、石油钻采设备及配件、五金工具、建筑材料、机电设备、家用电器、焊接材料、管道配件、轴承、橡胶制品、电工电料、密封件、标准件、日用杂品、办公耗材、包装材料的销售。",宁夏,银川,"银川市兴庆区长城东路756号营业房"
永宁县金程建设监理有限公司,9164012171065659XH,1999-09-20,N/A,鲁锦霞,"50(万)","房屋建筑工程监理丙级",宁夏,银川,"宁夏永宁县宁和北街商贸广场1号楼"
宁夏科弘建筑安装工程有限公司,91640000710661882Y,1999-09-21,N/A,王余,"780(万)","房屋建筑工程三级",宁夏,银川,"银川市金凤区长城中路159号"
宁夏同心县荣华锦程工贸有限责任公司,916403247106561868,1999-09-21,N/A,马忠文,"30(万)","工程机械租赁、劳务输出、劳务分包、皮毛绒、土畜产品加工，购销；五金、百货销售",宁夏,吴忠,"宁夏同心县预海镇园艺村"
宁夏嘉誉热能动力技术装备有限公司,916401007106623757,1999-09-21,N/A,景正旗,"50(万)","批发、零售锅炉配件、化工产品",宁夏,银川,"银川市新城区北京东路3栋4号"
固原经济开发区永鑫蚕业有限公司,916404047150357175,1999-09-22,N/A,张福红,"218.3000(万)","蚕种、桑苗种植，蚕茧收购，蚕药、蚕具销售；蚕体粉、蚕沙枕、缫丝、纺织品加工及销售；蔬菜种植、销售",宁夏,固原,"固原市经济开发区同康街"
中国农业银行股份有限公司中宁县支行,91640521454845083D,1999-09-22,N/A,崔兴,"N/A","办理人民币存款、贷款、结算业务，办理票据贴现，代理发行金融债券，代理发行、兑付、销售政府债券及收付款项、保险业务；办理外汇存款、外汇贷款、外汇汇款、外币兑换、结汇、售汇、国际结算业务；办理常年财务顾问业务；通过上级行办理代客外汇买卖；经总行授权的外汇产品经营范围中个人外汇结构性存款、西联汇款；经中国人民银行批准的其他金融业务",宁夏,中卫,"宁夏回族自治区中宁县城北街"
中卫市广厦房地产开发有限公司,916405002283460911,1999-09-23,N/A,张学文,"8,600(万)","房地产开发经营（以企业资质",宁夏,中卫,"中卫市沙坡头区迎宾大道西侧广厦综合2#楼"
宁夏永宁鹏达汽车出租有限公司,916401217106566105,1999-09-23,N/A,姚学爱,"195.5000(万)","出租客运、班车客运（县内、县际、市际）；货运及信息服务；汽车配件、装饰材料、机电产品（不含小轿车）、化工产品（不含易制毒危险品）、日杂、百货零售；机动车辆保险(依法须经批准的项目，经相关部门批准后方可开展经营活动)",宁夏,银川,"宁夏永宁县快速通道西、永黄公路北"
中卫市军粮供应有限公司,91640500228348695X,1999-09-23,N/A,蒋军,"81(万)","粮食的收购（凭许可证经营）、仓储、销售；预包装食品兼散装食品批发兼零售；食用植物油",宁夏,中卫,"中卫市沙坡头区鸣沙路40号"
中国人寿保险股份有限公司固原分公司,91640400455045205M,1999-09-24,N/A,陈少伟,"N/A","人寿保险、健康保险、意外伤害保险等各类人身保险业务；人身保险的再保险业务；国家法律、法规允许或国务院批准的资金运用业务；各类人身保险服务、咨询和代理业务；国家保险监督管理部门批准的其他业务(依法须经批准的项目，经相关部门批准后方可开展经营活动)",宁夏,固原,"宁夏固原市原州区文化西街泰合嘉园A12-10#、11#"
宁夏中卫市丽的眼镜有限公司,91640500735977752X,1999-09-27,N/A,肖英帅,"68(万)","眼镜",宁夏,中卫,"中卫市沙坡头区鼓楼东街"
银川市良泰工贸有限公司,91640100710668945H,1999-09-28,N/A,曹金元,"430(万)","塑料制品、管材及管件的制造销售、零部件加工、化工原料（不含易制毒及危险化学品），机电产品（不含小轿车）的经销",宁夏,银川,"银川市郊区良田工业区4号东"
银川汇成科技有限公司,91641100710661911U,1999-09-28,N/A,张少峰,"500(万)","计算机软、硬件产品及配件、电教设备及配件、工业控制设备、机电设备及产品、家用电器、照相电器、办公自动化设备及相关耗材配件、办公用品、文体用品、化工产品",宁夏,银川,"银川开发区金凤区通达南街TMT育成中心科技大厦2306、2307、2309房间"
宁夏好利纸制品有限公司,91640100710662009B,1999-09-29,N/A,陈陵兵,"200(万)","纸制品包装箱、纸管、粘接剂的生产、销售；塑料制品、纸张批发、零售",宁夏,银川,"银川西夏区怀远西路501号"
银川云帆科技发展有限公司,91641100710662308M,1999-10-08,N/A,高建烜,"100(万)","软件开发；网络技术服务；数字媒体内容制作；软硬件产品代理；系统集成及管理咨询；光盘节目制作（不含文艺节目）",宁夏,银川,"银川市金凤区宁安大街490号银川IBI育成中心1号楼710室"
宁夏金维电子科技有限公司,91641100710663108H,1999-10-08,N/A,洪伟,"517(万)","建筑智能化工程、通信线路、综合布线及其配套设备工程建设的设计、施工；安防工程的设计、施工、维修、维护及其产品销售；通讯器材、家用电器、办公自动化设备、电子仪器、仪表的销售；房屋租赁。",宁夏,银川,"银川市金凤区和信商务中心A座4层"
宁夏天景山草业科技发展有限公司,91640100715095824P,1999-10-08,N/A,胡崇礼,"2,741(万)","优质牧草试验培育、种植、销售；林果苗木培育、种植、销售；造林绿化。",宁夏,银川,"银川市兴庆区中心巷58号"
吴忠市天隆房地产开发有限公司,916403007106783690,1999-10-09,N/A,马绍俊,"5,068(万)","房地产开发与经营；建筑安装工程；建筑材料、装饰材料、水暖配件、五金交电的销售；家用电器的销售及售后服务；房屋租赁(依法须经批准的项目，经相关部门批准后方可开展经营活动)",宁夏,吴忠,"吴忠市利通区文卫路东侧无线电路谦益花园二期四号楼1-3#"
银川福康制毡工贸有限公司,916401227106623160,1999-10-09,N/A,刘军,"1,000(万)","航空工业毡、民用毡、防火毡、吸油毡、军用帐篷、纯羊毛抛光毡轮、聚胺脂抛光轮及制毡品零件制造与加工；羊毛及羊毛制品、汽车配件、机电产品、化工产品",宁夏,银川,"银川市德胜工业区德翔东路十八号"
宁夏新新贸易有限公司,91640100710669841N,1999-10-10,N/A,叶文霖,"50(万)","预包装食品、办公用品、文具用品、服装百货、家用电器、电子器材、建筑材料、五金工具、洗涤化妆品、计生用品",宁夏,银川,"银川市兴庆区民族南路9-2-6-201"
宁夏永标生态农业发展有限公司,91640300710678131Q,1999-10-11,N/A,郭兴忠,"30(万)","花卉、苗木、农作物、果树的种植销售；家禽、肉牛、肉羊、水产的养殖销售；农产品、农用机械、农具的销售；花卉、盆景租赁；农业技术开发、服务、咨询及转让；园林绿化工程设计；生态农业观光",宁夏,吴忠,"宁夏吴忠市孙家滩开发区管委会东侧"
宁夏平罗陈桥建筑有限责任公司,91640221710632010U,1999-10-12,N/A,陈石帮,"2,052.6000(万)","工业与民用建筑工程、装饰装修工程、市政公用工程、水利水电工程、钢结构工程、城市道路照明、环保工程、防水防腐保温工程、建筑幕墙工程、城市园林绿化工程、电梯维修维护工程施工；特种工程",宁夏,石嘴山,"平罗县桥馨家园B区39幢2号门店三层"
宁夏兴俊实业集团有限公司,91640000710662949D,1999-10-12,N/A,杨兴义,"31,000(万)","批发、零售电器机械、五金交电、水暖配件、建筑材料、百货、园林机械、花卉；农副土畜产品加工；旧家具回收、搬家服务；原油购销；汽油、柴油批发。",宁夏,银川,"银川市银新南路西二环路口"
宁夏兴路物资有限公司,91640000710662690M,1999-10-12,N/A,路国智,"50(万)","批发、零售水泥、建材、汽车配件、五金工具、日用百货。",宁夏,银川,"宁夏贺兰山农牧场农二队"
宁夏新建设水利电力工程有限公司,91640400710645831Q,1999-10-18,N/A,蔺巍山,"5,658.5600(万)","水利水电工程施工总承包贰级；承装（修、试）电力设施业务；市政公用工程施工总承包叁级；水泥制品销售；工程机械设备租赁；道路普通货物运输",宁夏,固原,"宁夏固原市原州区清水河工业园区A四区"
宁夏平罗光辉煤炭有限公司,916402217106320614,1999-10-20,N/A,徐立军,"6,999(万)","精洗煤、煤炭加工销售，碳素制品、碳化硅、焦炭、兰炭、电极、电极糊、白灰、硅铁、硅锰合金、钢材、木材、化工产品、机电产品销售，农副产品购销。(依法须经批准的项目，经相关部门批准后方可开展经营活动)",宁夏,石嘴山,"宁夏回族自治区平罗县崇岗乡崇岗村"
宁夏东成影院文化传媒有限公司,91640100710663722N,1999-10-21,N/A,关挺,"150(万)","电影放映；设计、制作、代理、发布国内各类广告；企业营销策划；零售预包装食品兼散装食品乳制品",宁夏,银川,"银川市兴庆区新华东街290号1号营业房"
银川瑞恩生物技术有限公司,916411007106628851,1999-10-21,N/A,耿浩,"180(万)","生物化学试剂的研究；经营III类：医用超声仪器及有关设备、医用电子仪器设备、临床检验分析仪器及诊断试剂、医用高分子材料及制品、注射穿刺器械、医用化验和基础设备器具；百货、办公设备及用品、化工原料",宁夏,银川,"宁夏回族自治区开发区1号写字楼五楼"
四川长虹电器股份有限公司银川销售分公司,916401007106700335,1999-10-21,N/A,魏俊高,"N/A","电子产品、网络产品（不含信息安全产品）、电力设备、安防产品、机械设备、通讯产品、计算机及设备、五金交电、家用电器、电子元件、销售，集成电路、软件开发及销售；电子商务；设备租赁",宁夏,银川,"银川市兴庆区长城东路218号"
宁夏交通物流产业股份有限公司驾驶员培训学校,91640000710663220Y,1999-10-22,N/A,孟凡森,"N/A","汽车、摩托车驾驶培训。",宁夏,银川,"银川市兴庆区清和南街639号"
宁夏美利纸业集团废旧物资回收有限公司,91640500228348708K,1999-10-25,N/A,周胜令,"50(万)","废旧书刊、报纸、箱纸、纸盒、餐盒等废弃纸品和非金属的回收交易。(依法须经批准的项目，经相关部门批准后方可开展经营活动)",宁夏,中卫,"宁夏回族自治区中卫市沙坡头区柔远镇"
宁夏宝路华商贸有限公司,916402007106824728,1999-10-25,N/A,赵宝,"210(万)","服装、服饰、日用百货、办公用品、五金交电、电子产品、电线电缆、家用电器、建筑材料、装潢材料、陶瓷制品、电脑及配件、办公家具、办公设备、文体用品、纸制品、包装材料、工艺礼品（除金银）、鞋帽、皮件制品、皮塑皮革制品、纺织制品、洗涤用品、体育用品、过滤器材、布艺品的的销售；室内装饰用纺织品的加工、销售",宁夏,石嘴山,"大武口区游艺东街248号"
宁夏华控自动化工程有限公司,91640121710670498Y,1999-10-25,N/A,陈海,"50(万)","自动化工程设计、成套、安装、调试、维修、技术咨询服务；仪器仪表、机电产品、润滑油、五金交电、化玻仪器、通讯设备、管道泵阀、防腐材料、建材、橡胶制品、化工产品、日用百货、汽车配件、钢材、计算机产品、纸张批发、零售；体育器材销售及安装。",宁夏,银川,"宁夏永宁县望远建材商贸物流园D11-30号"
中国银行股份有限公司石嘴山市惠农区支行,91640200763208694U,1999-10-25,N/A,王红漫,"N/A","办理人民币存款、贷款、结算业务；办理票据贴现；代理发行金融债券；代理发行、代理兑付、销售政府债券；买卖政府债券；代理收付款项及代理保险业务；代理外汇存款、外汇贷款、外汇汇款、外币兑换、国际结算、结汇、售汇，通过上级行办理代客外汇买卖；其总行在中国银监会批准的业务范围内授权的业务；经银监会批准的其他金融业务(依法须经批准的项目，经相关部门批准后方可开展经营活动)",宁夏,石嘴山,"宁夏回族自治区惠农区静宁街401号"
宁夏长江汽车运输服务有限公司,9164012173598192XY,1999-10-26,N/A,周卫东,"100(万)","一级普通机动车驾驶员培训（A1、B2、C1、C2）、道路运输驾驶员从业资格培训（道路旅客运输、道路货物运输）(依法须经批准的项目，经相关部门批准后方可开展经营活动)",宁夏,银川,"宁夏永宁县望远镇板桥沟东侧一号综合教学办公楼"
宁夏石嘴山市瑞丰高岭土有限公司,9164020571068227XQ,1999-10-27,N/A,闫保领,"500(万)","高岭土的生产和销售(依法须经批准的项目，经相关部门批准后方可开展经营活动)",宁夏,石嘴山,"惠农区河滨工业园区(矿务局金兰瓷厂院内)"
宁夏宁东正林经济发展有限公司,91641200710640221K,1999-10-27,N/A,杜正林,"560(万)","绒毛加工销售；机电产品（不含小轿车）、矿山设备、五金交电、建筑材料、水暖配件、办公用品、消防器材、劳保用品、百货、化工产品",宁夏,银川,"宁夏回族自治区灵武矿务局中心区"
银川大地物业服务有限公司,91640100710670439E,1999-10-28,N/A,齐洁琳,"300(万)","物业管理；房屋租赁；维修服务；车辆管理；园林绿化工程；保洁服务；供热；秩序维护服务；保洁用品的销售。",宁夏,银川,"银川市兴庆区北京东路49号世纪小区综合楼三楼"
宁夏豪森房地产开发有限公司,916401227106266576,1999-10-29,N/A,金洪涛,"2,500(万)","房地产开发、民用建材。",宁夏,银川,"宁夏回族自治区贺兰县富兴南路"
宁夏伊品投资集团有限公司,916400007150828043,1999-10-29,N/A,闫晓平,"9,620(万)","对外投资(不含法律法规禁止和需要专项审批的投资业务）。",宁夏,银川,"银川市永宁县望远镇金盛物流信息中心4号楼423号房"
银川新振华电子科技有限公司,91640100710671271M,1999-11-01,N/A,张振华,"30(万)","电器产品、办公自动化设备、计算机及配件、电子产品、通讯器材、五金交电、仪器仪表、装饰材料、普通机械、建筑机械、金属材料、汽车配件销售",宁夏,银川,"银川市兴庆区解放东街龙马鼓楼市场地下负一层银川赛格数码城F-H031号"
银川市宏达化妆品有限公司,9164010071067048XH,1999-11-01,N/A,刘树全,"30(万)","洗涤化妆品、美容美发设备、保健用品、日用百货、通讯器材、计算机及耗材、办公用品、针纺织品、服装、装饰材料销售",宁夏,银川,"银川兴庆区永安巷永安花园7号5单元101室"
宁夏吴忠市针织有限公司,91640300928250031R,1999-11-01,N/A,高玉梅,"30(万)","针织品、劳保用品、五金家电、百货、文体办公用品、洗涤用品、日用杂品、化工建材、装饰材料的销售",宁夏,吴忠,"吴忠市利通区民乐东街16号"
银川人防建设开发有限公司,91640100710663124T,1999-11-01,N/A,程伟,"300(万)","房地产开发、防水工程施工及技术开发；建筑材料销售、仓储租赁",宁夏,银川,"宁夏回族自治区银川北京东路226号"
宁夏银弹机械有限责任公司,916401002278700948,1999-11-01,N/A,李春德,"101(万)","各种弹簧加工、制造；机械加工",宁夏,银川,"银川市金凤区上海西路455号"
