江阴市璜塘特种有色型材有限公司,91320281250356333W,1993-05-20,N/A,张建清,"70(万元人民币)","有色金属型材、金属门窗及栏栅嵌条、不锈钢制品的制造、加工、销售；铝氧化；有色金属浇铸；道路普通货物运输。",江苏,无锡,"江阴市徐霞客镇璜塘须毛路32号"
南京国电南自美康实业发展有限公司,913201061349473202,1993-05-20,N/A,李克成,"500(万元人民币)","住宿（限分支机构经营）。五金交电、电子产品及通讯设备（不含卫星地面接收设施及无线电发射设备）、劳保用品、灯具、水暖器材、百货、日用杂品、花卉、建筑材料、装饰材料",江苏,南京,"南京市鼓楼区新模范马路38号"
常州华宇印染有限公司,91320412X08168828Y,1993-05-20,N/A,戚湘华,"206.6093(万元人民币)","纺织品染色（染布）、印花",江苏,常州,"常州市武进区遥观镇"
无锡昱州环保集团炉顶密封有限公司,913202822504693113,1993-05-20,N/A,陈泉清,"1,888(万元人民币)","建筑防水材料、建筑保温材料的制造；炉窑工程专业承包；耐火、耐磨、防腐材料的批发、零售。",江苏,无锡,"宜兴市丁蜀镇周墅村"
南京海尔曼斯集团有限公司,91320115134947160U,1993-05-20,N/A,林宝忠,"10,100(万元人民币)","羊毛衫、羊绒衫及针织服装、梭织服装及职业服装、儿童服装、运动休闲服装、纺织原辅料、针织机械、床上用品、鞋、袜、帽、手套、眼镜、围巾、面罩、箱包、服装饰品、文体用品、劳保用品的生产、销售；服装及系列产品的设计研发、技术转让、培训及信息咨询；纺织新材料的技术开发、咨询、转让及服务；出口本产企业自产服装；进口本企业生产、科研所需的原辅材料、机械设备、仪器仪表及零配件；环境艺术设计与施工；房屋租赁；食品、乳制品",江苏,南京,"南京市江宁经济技术开发区双龙大道2881号"
常州亿联纺织器材有限公司,91320402137260831M,1993-05-20,N/A,姜东平,"3(万元人民币)","纺织机械专用配件及器材制造；金属冲压件加工；修布服务。",江苏,常州,"天宁区常锡路115-2号（至2012-08-31止）"
常州市恒源车辆配件有限公司,91320412250951714C,1993-05-20,有限责任公司,赵建元,"69.12万人民币","自行车零件、摩托车零件、电动车零件、铜铝铸件、塑料工业配件、太阳能设备制造，金属冷作加工。",江苏,常州,"武进区洛阳镇戴溪街"
无锡汇顺贸易有限公司,913202132505704606,1993-05-20,N/A,孙佐铭,"180(万元人民币)","汽车配件、通用机械及配件、五金交电、仪器仪表、金属材料、建筑材料、装饰装修材料、化工产品及原料（不含危险品）、针纺织品、百货、电子产品、通讯及广播电视设备",江苏,无锡,"无锡市江海东路351号"
吴江市东都经营公司,3205841103250,1993-05-20,N/A,马玲丽,"100(万元人民币)","批发另售：丝绸化纤织物、化学纤维、服装、五金、纺机配件。旅馆、餐厅服务。",江苏,苏州,"盛泽镇姚家坝桥西岸1号"
南京天龙综合经营公司,91320100134947195N,1993-05-20,N/A,张卫中,"350(万元人民币)","危险化学品销售（按危化品许可证范围经营）；五金交电、建筑材料、涂料、日用杂品、电子计算机及配件、文化办公机械、电子产品、电器机械及器材、服装、鞋帽、影视器材销售；电子系统工程",江苏,南京,"南京市鼓楼区姜家圩77号"
中国农业银行股份有限公司盱眙山城分理处,91320830750008351L,1993-05-20,N/A,贾绪民,"0(万元人民币)","吸收公众存款；发放短期、中期、长期贷款；办理国内外结算；办理票据承兑与贴现；发行金融债券；代理发行、代理兑付、承销政府债券；买卖政府债券；从事同业拆借；结汇、售汇；从事银行卡业务；提供信用证服务及担保；代理收付款项及代理保险业务；提供保管箱服务；代理资金清算；各类汇兑业务；代理政策性银行贷款业务；贷款承诺；组织或参加银团贷款；外汇存款；外汇贷款；外汇汇款；外汇票据承兑和贴现；自营、代客外汇买卖；外币兑换；外汇担保；资信调查、咨询、见证业务；企业、个人财务顾问服务；证券公司客户交易结算资金存管业务；证券投资基金托管业务；企业年金托管业务；产业投资基金托管业务；合格境外机构投资者境内证券投资托管业务；代理开放式基金业务；电话银行、手机银行、网上银行业务；金融衍生产品交易业务；经中国银行业监督管理机构等监管部门批准的其他业务。",江苏,淮安,"江苏省淮安市盱眙县盱城镇斩龙涧4号楼"
苏州福而康车料有限公司,913205856082688654,1993-05-20,N/A,张维岳,"380(万美元)","生产自行车、汽车、机车零件及加油设备",江苏,苏州,"太仓市陆渡镇"
泰州市天海包装材料有限公司,91321204140792580Y,1993-05-20,N/A,唐仁茂,"330(万元人民币)","包装装璜印刷品排版、制版、印刷、装订；其他印刷品印刷；塑料包装用品、纸制包装用品制造、自销。",江苏,泰州,"姜堰经济开发区石黄村"
南京祥和建筑工程有限责任公司,9132011577398403XC,1993-05-20,N/A,张成根,"50(万元人民币)","土木工程建筑，室内外装饰；建筑材料销售。",江苏,南京,"南京市江宁区陶吴镇甘西村"
常州长江齿轮有限公司,913204112510755177,1993-05-21,N/A,蔡钢伟,"880.8000(万元人民币)","汽车齿轮及摩托车齿轮、包装机械、链轮、链条、金属制包装用桶制造；金属冷作加工。",江苏,常州,"常州新北区春江镇百丈"
宜兴市律轩环保设备有限公司,91320282250470478B,1993-05-21,N/A,许寅,"70(万元人民币)","环境污染防治设备、机械设备及配件、玻璃钢制品、自粘性系列胶带、保温材料、防火包、防火堵料的制造；防火材料、化工产品及原料、电线电缆及附件、绝缘材料的销售。",江苏,无锡,"宜兴市周铁镇王茂村"
无锡申达空调设备有限公司,913202066282858730,1993-05-21,N/A,陈林昌,"1,000(万元人民币)","集中式空调机组、制冷机械及零部件、车辆方舱、冷暖电一体化空调机组的研发、生产、销售；分布式光伏发电。",江苏,无锡,"无锡市惠山区长安街道欣惠路519-6"
常州中理化工科技有限公司,913204041371874005,1993-05-21,N/A,王济伟,"1,000(万元人民币)","化工、机械、电子、美术装璜为主的技术服务及技术咨询；电子元器件、仪器仪表",江苏,常州,"常州市中吴大道1801号"
南京金陵石化建安劳动经济开发公司,91320113134947355Q,1993-05-21,N/A,刘俊,"50(万元人民币)","本公司废旧物资加工、销售；建筑材料、日用百货、五金交电、普通机械销售；提供劳务；室内装饰；人员技术咨询服务；电器机械及器材、仪器仪表、家用电器加工、制造、销售、服务；化工设备安装；机械装卸。",江苏,南京,"栖霞区甘家巷"
无锡市陶都锦达物资有限公司,91320282250470646D,1993-05-21,N/A,万勇,"58(万元人民币)","耐火原料、建筑材料、耐火制品、日用百货、日用化学品、日用杂货、汽车零部件、五金、陶瓷制品、机械设备及配件、塑料制品的销售。",江苏,无锡,"宜兴市丁蜀镇川埠村"
南京秦虹建筑安装工程有限公司,913201151351209078,1993-05-21,N/A,余立发,"68(万元人民币)","建筑工程；房屋维修；自来水管道安装及维修；土石方挖掘；室内装饰。",江苏,南京,"南京市江宁区横溪街道官长社区雇冲"
昆山航运公司船厂修船分厂,320583000004539,1993-05-21,N/A,王春洪,"10(万元人民币)","船舶修理。",江苏,苏州,"石牌镇毛许村"
宜兴市鹏穗科技有限公司,91320282250470507N,1993-05-21,N/A,钱志鹏,"50(万元人民币)","耐火材料制品、建筑保温材料、环保设备的技术研究、开发、制造、销售；金属冲压件的加工、销售；焊接材料的销售；自营和代理各类商品及技术的进出口业务",江苏,无锡,"宜兴市高塍镇范道村"
昆山市交通航务工程有限公司,91320583251248617Y,1993-05-21,N/A,张国伟,"4,927.1259(万元人民币)","拆除工程",江苏,苏州,"昆山市古城中路335号"
无锡申锡房地产实业有限公司,91320211607960294E,1993-05-21,N/A,孙玉春,"5,000(万元人民币)","房地产开发、经营；房地产租赁管理、建筑装潢服务；中型餐馆，饮品店",江苏,无锡,"无锡市滨湖区马山环山东路1号"
吴江丝路保险箱有限公司,91320509608297383H,1993-05-21,N/A,周科荣,"325(万元人民币)","生产销售保险箱、保险锁、钢木家具、厨房用不锈钢器皿、箱包五金、家具五金。",江苏,苏州,"江苏省吴江区莘塔镇"
常熟市白茆房地产开发有限公司,91320581713213815Q,1993-05-21,N/A,王寿康,"400(万元人民币)","房地产开发经营。",江苏,苏州,"常熟市古里镇白茆"
南京民福客运公司,91320100134947400Y,1993-05-21,N/A,方殿荣,"100(万元人民币)","客运服务；五金交电、汽车配件销售。",江苏,南京,"南京市鼓楼区五台山1-6号02幢602室"
常州春江资产经营有限公司,913204112510604893,1993-05-21,N/A,段敖庆,"5,000(万元人民币)","矿产品、工业生产资料（除专项规定）的销售；镇属资产的出租管理；化工原料及产品",江苏,常州,"常州市新北区春江镇魏村"
昆山市鑫龙贸易有限公司,91320583251248596E,1993-05-21,N/A,高峰,"850(万元人民币)","建材、钢材、纺织品及纺织原料、食用农产品（水产品）、家用电器、机电、五金、电子产品销售；以下仅限分支机构经营：洗浴服务、非医疗性保健按摩服务、棋牌服务、住宿服务、餐饮服务",江苏,苏州,"昆山市开发区朝阳西路8号"
江苏环球国际旅游有限公司,91321011140728044R,1993-05-21,N/A,韦晓明,"1,000(万元人民币)","出境旅游业务、国内旅游业务、入境旅游业务；旅游信息咨询服务；日用百货、服装、工艺美术品销售；火车票代理销售。",江苏,扬州,"扬子江中路279号"
泰兴市机械刃模具厂,9132128314077557XB,1993-05-21,集体所有制,徐学兵,"40万人民币","机械配件、模具、服装制造；印刷机械配件销售。",江苏,泰州,"泰兴市新街镇顾庄寺村"
江苏金石研磨有限公司,913202822504706030,1993-05-21,N/A,王俊甫,"1,800(万元人民币)","陶瓷研磨球的制造、销售；耐火制品的制造；矿产品、化工产品及原料（除危险化学品）的销售；分布式光伏发电；自营和代理各类商品及技术的进出口业务",江苏,无锡,"宜兴市丁蜀镇陶瓷产业园区亨鑫路"
沛县鸿祥建安工程公司,913203221368671565,1993-05-21,N/A,朱阳坤,"2,516(万元人民币)","工业厂房及民用住宅建筑工程、防腐保温工程施工，装璜装饰工程施工，予制构件加工、销售，钢结构工程施工，市政道路工程、工矿工程、土石方工程、其他土木工程建筑，建筑安装。",江苏,徐州,"沛县沛城镇歌风路6号"
徐州康宏供水有限责任公司,91320300136404274C,1993-05-21,N/A,王宝平,"300(万元人民币)","自来水经营、管理、服务，给排水工程施工，供水设备安装、维修，自来水储水设施清洗、消毒，供水器材、日用百货、日用杂品",江苏,徐州,"青年东路104号"
常州市武进洛阳光明印刷有限公司,9132041225095865XT,1993-05-21,N/A,章蕾,"50(万元人民币)","其他印刷品印刷；纸包装箱制造，无纺布包装袋加工。",江苏,常州,"武进区洛阳镇虞桥村章家头"
苏州市吴中区木渎金山农工商实业公司,91320506713234800B,1993-05-21,N/A,陈刚,"500(万元人民币)","销售：日用杂品、非油燃助动车、摩托车、金属材料、装潢材料。",江苏,苏州,"苏州市吴中区木渎镇金山村"
南京市玄武区城镇开发装饰物资公司,913201021349990676,1993-05-21,N/A,赵妙生,"100(万元人民币)","建材、木材、钢材、装饰材料；水暖器材、低压电器、建筑机械销售；室内外装饰工程。",江苏,南京,"玄武区太平北路118号"
常州市百达植绒制品有限公司,91320411251075488U,1993-05-21,N/A,曹伟骑,"120(万元人民币)","绒毛产品、植绒布、染色；五金加工。",江苏,常州,"常州市新北区春江镇百丈徐市村"
常州市城北液化气有限公司,9132041125107547XU,1993-05-21,N/A,周建国,"50(万元人民币)","石油液化气罐装、贮存销售；液化气钢瓶、灶具及零配件的销售。",江苏,常州,"常州市新北区春江镇百丈"
常州市华艺植绒材料有限公司,91320411251075496N,1993-05-21,N/A,杨志平,"60(万元人民币)","纱管、植绒、乳胶绒毛制造；绒毛漂洗加工；植绒制品、植绒材料、针纺织品、服装、电子产品及配件、电机、电气机械及器材、工具、金属材料、建筑材料、陶瓷洁具、五金、交电、化工产品",江苏,常州,"常州市新北区春江镇百丈"
南京海宁建设工程监理咨询有限公司,91320102134947478U,1993-05-21,N/A,李吉生,"1,000(万元人民币)","建筑工程监理、建设项目投资咨询；建筑业咨询服务；编审工程造价、测量。",江苏,南京,"玄武区珠江路88号2幢3810室"
南京市纺织品进出口公司购物商场,91320100134947443C,1993-05-21,N/A,周陈力,"50(万元人民币)","非酒精饮料、冷饮销售；针纺织品、百货、工艺美术品（不含专项管理商品）、五金交电、化工（不含化学危险品）、农副产品（不含国家专控商品）、日用杂货（不含烟花、爆竹）、电子计算机及配件、文化办公机械、建筑材料、家具（销售）；仓储",江苏,南京,"白下区正洪街18号"
常州市迅达标准件有限公司,320407000038284,1993-05-21,N/A,李杏元,"50(万元人民币)","标准件制造；机械零部件加工。",江苏,常州,"常州新北区春江镇百丈双坝村"
苏州市物建贸易有限公司,913205052516295244,1993-05-21,N/A,沈冰,"20(万元人民币)","经销：金属材料、建筑材料、装饰装潢材料、木材、化工产品",江苏,苏州,"苏州高新区横塘横越公路五福桥东南堍"
盐城市三隆达商贸有限公司,9132090214023866X7,1993-05-22,N/A,杨龙祥,"30.2500(万元人民币)","日用品、服装鞋帽、五金交电（除电动三轮车）、体育用品",江苏,盐城,"盐城市新西门路84号"
苏州花园俱乐部有限公司,91320505251632547L,1993-05-22,N/A,沈益华,"2,755.2500(万元人民币)","KTV包厢、浴室、美容美发",江苏,苏州,"苏州高新区狮山路118号"
无锡华东重机科技集团有限公司,91320211250116700N,1993-05-22,有限责任公司,翁耀根,"10000万人民币","采矿、采石设备的技术开发、技术咨询、技术转让及制造；利用自有资金对外投资；投资咨询服务",江苏,无锡,"无锡市滨湖区锦溪路100号科教创业园9号楼604-1"
宜兴市光明空调设备有限公司,9132028225047089X5,1993-05-22,N/A,凌成斌,"68(万元人民币)","空调配件、环境污染防治设备制备的制造、销售。",江苏,无锡,"宜兴市宜城街道文庄村"
无锡市城市道桥科技有限公司,91320200135924817J,1993-05-22,N/A,胡志军,"3,666.3000(万元人民币)","道桥施工新技术、新工艺、新材料的研发；沥青混合物、水泥稳定碎石、水泥制品的生产和销售；市政道路的施工及养护；建筑用材料的销售；机械设备的租赁",江苏,无锡,"无锡市丽新路108号"
常州市武进坂上化工有限公司,91320412250922219F,1993-05-22,N/A,韩锡荃,"118.6900(万元人民币)","危险化学品批发（限《危险化学品经营许可证》核定范围）；塑料粉末、机械零部件制造、加工；静电喷塑加工；化工产品",江苏,常州,"武进区礼嘉镇蒲岸村"
阜宁县城市综合开发公司,320923000001365,1993-05-22,N/A,周观文,"410(万元人民币)","房地产开发、市政道路建设",江苏,盐城,"县房地产大厦二楼"
江苏金波新材料科技有限公司,9132118214145521XF,1993-05-22,有限责任公司,陈霞,"8078.98万人民币","光电子产品研发、制造；电工器材、塑料制品、管阀件、桥架、母线、开关柜、铝制品、金属门窗、金属制品制造；自营和代理各类商品及技术的进出口业务",江苏,镇江,"扬中市永胜工业开发区"
南京通海水运公司,91320100134947494L,1993-05-22,N/A,管斐,"803(万元人民币)","水上运输（国内沿海、长江干线中下游及支流省际运输；长江、沿海内支线运输）；国内水运船舶代理；国际海运船舶代理；国际货物运输代理；代办运输；托运出口船舶；船舶技术咨询服务；船舶维修服务；沙石、建筑材料",江苏,南京,"南京市鼓楼区江边路17号滨江大厦"
南京海兴印务有限公司,91320115608918530T,1993-05-22,N/A,石耀东,"330(万美元)","出版物印刷；生产包装、广告等多种用途的纸制品；销售自产产品",江苏,南京,"南京市江宁区东山街道工业集中区丰泽路99号"
无锡市三联高科技开发有限公司,91320214135924884R,1993-05-22,N/A,徐建兰,"50(万元人民币)","生物、灵芝营养滋补品、计算机、自动控制、通信（不含限制项目）的新技术开发、转让、咨询服务；农副产品（不含限制项目）、五金交电、仪器仪表、计算机、自动控制设备、办公设备、金属材料，建筑装潢材料",江苏,无锡,"无锡市新区长江路7号34号地块科技园五区6楼"
波力食品工业(昆山)有限公司,91320583608276013P,1993-05-22,N/A,吴信忠,"1,934(万美元)","生产饼干、糖果制品（糖果）、调味料（半固态）、膨化食品、方便食品（方便面）、水产制品、蔬菜制品、食品干燥剂；食品机械制造装配（出口需许可证产品除外）；牧草种植；销售自产产品。从事与本企业生产同类产品的商业批发、零售、佣金代理",江苏,苏州,"江苏省昆山市玉山镇新南西路126号"
常州市业兴印务有限公司,913204042511599480,1993-05-22,N/A,孙培兴,"50(万元人民币)","其他印刷品印刷；复印纸加工。",江苏,常州,"钟楼区邹区镇卜弋常金东路49号"
昆山市康晖建设工程发展有限公司,9132058373116229XT,1993-05-22,N/A,沈晓平,"5,300(万元人民币)","房屋建筑施工，市政公用工程施工及养护，水电安装，混凝土预制构件制造及销售，钢结构安装及施工；销售建筑材料。",江苏,苏州,"玉山镇中山支路5号"
镇江市润州异型机械附件厂,91321111141574518F,1993-05-22,集体所有制,方国平,"35万人民币","紧固件制造；机械配件、机械附件、零部件、工艺品制造、加工；普通货物道路运输服务。",江苏,镇江,"润州路30号"
镇江市塑料对外贸易有限公司,91321100141418611D,1993-05-22,N/A,金仁祥,"88(万元人民币)","为外贸企业组织塑料、轻工、机械及其它三类商品的出口货源；化工产品",江苏,镇江,"镇江市观音桥巷41号101室"
溧阳市社渚物资综合贸易公司,91320481662723013D,1993-05-22,N/A,黄志兵,"60(万元人民币)","经销金属材料、建筑材料、饲料、水产品。",江苏,常州,"社渚镇"
吴江市新威达机械有限公司,913205092513014146,1993-05-22,有限责任公司,戴兴海,"82万人民币","许可经营项目：无 一般经营项目：塑料挤出机配件、锥形螺杆零件制造、加工、自产自销。",江苏,苏州,"吴江市横扇镇环湖路公路旁"
江阴市长城纺织品有限公司,91320281607989193J,1993-05-22,N/A,周军,"50(万元人民币)","纺织品、针织品、服装、床上用品的制造、加工、销售；制线；织带；绣花；纺织原料",江苏,无锡,"江阴市祝塘镇河湘村河湘路2号"
南京宁海聚氨酯有限公司,913201061352314043,1993-05-22,N/A,梁传东,"500(万元人民币)","聚氨酯塑胶跑道、球场、活动场地防水工程的施工；人造草坪施工；聚氨酯硬质泡沫制品、体育用品、健身器材销售；体育场所的设计及用品的销售；聚氨酯铺装材料的生产、销售（依法须经批准的项目，经相关部门批准后方可开展经营活动）",江苏,南京,"南京市鼓楼区北京西路17号513室"
常州市马蹄莲树脂有限公司,91320404251132294Y,1993-05-25,N/A,廖晓程,"84(万元人民币)","环氧绝缘烘漆、环氧绝缘漆、环氧漆固化剂",江苏,常州,"钟楼区邹区镇杨庄村"
南京新方达数控有限公司,91320115608917474E,1993-05-25,N/A,王宁,"57.6120(万元人民币)","数控机床、数控系统、机电一体化产品、工业自动化设备的开发、生产、销售、服务。",江苏,南京,"南京江宁科学园科宁路766号"
盐城万隆商贸有限公司,91320900140139928T,1993-05-25,N/A,徐国俊,"150(万元人民币)","建材、金属材料（国家有专项审批规定的项目除外）、化工原料及产品（除农药及其它危险化学品，化肥、农膜限零售）、胶合板、针纺织品、通用设备、电子计算机及配件、日用品、五金交电、专用作业车、汽车配件批发及零售；住宿、餐饮、沐浴服务",江苏,盐城,"盐城市旭日路2号"
如皋云达房地产开发有限公司,91320682608313099P,1993-05-25,N/A,王勇云,"212(万美元)","从事房地产开发、销售及建筑、装潢、物业管理。",江苏,南通,"江苏省如皋市如城镇福寿路388号(南通丽都假日酒店内)"
江阴市宝强包装有限公司,91320281250358259A,1993-05-25,有限责任公司,徐根宝,"200万人民币","塑料编织袋、集装袋、吊带的生产、销售。",江苏,无锡,"江阴市璜土镇北湖西村"
苏州市金阊区东吴贸易有限公司佳源不锈钢制品厂,91320508751402289M,1993-05-25,有限责任公司,倪洪芳,"0万人民币","许可经营项目：无 一般经营项目：不锈钢制品加工。",江苏,苏州,"苏州市山塘街800号（虎阜大桥堍）"
南京梅山工程技术新产业开发有限公司水处理厂,91320114MA1MF33Y6A,1993-05-25,N/A,鞠华,"0(万元人民币)","水处理设备清洗、技术咨询、技术服务；水处理剂的销售；冶金设备维修及保洁；机械设备维修。",江苏,南京,"雨花台区中华门外新建"
常州市武进贝斯特电子线缆有限公司,913204122508948522,1993-05-25,N/A,施建良,"3,000(万元人民币)","电线、电缆、同心连接器、模具、塑料工业配件、机械零部件、PVC电缆料、音响配件、电子冷热箱制造、加工；经营本企业自产产品及技术的出口业务；经营本企业生产、科研所需的原辅材料、仪器仪表、机械设备、零配件及技术的进口业务",江苏,常州,"武进区礼嘉镇秦巷村"
连云港云龙实业有限公司,91320700138994984Q,1993-05-25,N/A,刘卫华,"1,480.3000(万元人民币)","水产品养殖；金属材料、农业机械、农具、五金批发、零售。",江苏,连云港,"连云港市海州区云台农场普山路1号"
常州市天林物资有限公司,9132040213723844X9,1993-05-25,N/A,卞振亚,"30(万元人民币)","金属材料、建筑材料、普通机械、电器机械及配件、摩托车零部件、照相器材、针纺织品、五金、交电、文具用品的销售。",江苏,常州,"天宁区丽宝第花苑3幢乙单元101室"
江苏申利科技有限公司,91320412250871992N,1993-05-25,N/A,钟天明,"2,800(万元人民币)","模具，车胎成型机的研发、制造、加工；机械零部件加工；自营和代理各类商品及技术的进出口业务，国家限定企业经营或禁止进出口的商品和技术除外；轮胎销售；对外投资及资产管理。",江苏,常州,"武进区雪堰镇潘家东街15 号"
江苏荣晖水利工程有限公司,91320602138436536X,1993-05-26,N/A,徐晓荣,"2,080(万元人民币)","水利工程设计、施工；河湖整治工程服务；建筑材料批发、零售；国内货物运输代理。",江苏,南通,"南通市崇川区洪江路跃龙小苑6幢104室"
南京西门电子系统工程有限公司,913201022500039338,1993-05-26,N/A,袁波,"208(万元人民币)","通讯、广播影视、电视监控、防盗报警装置、电子系统工程技术开发、转让、咨询、服务；生产销售自研产品；为技术合同签订方代购有关设备、器材；电子产品、家用电器、仪表仪器销售、照相器材及耗品销售；照相服务。",江苏,南京,"玄武区珠江路573号-1"
江苏瀚瑞投资控股有限公司,9132119171686068X9,1993-05-26,N/A,王东晓,"500,000(万元人民币)","国有资产的经营、管理；对外投资；土地批租；投资开发；房屋租赁；咨询服务；土石方工程施工。",江苏,镇江,"镇江新区大港镇通港路东(金港大道98号)"
常州市武进雪堰房产开发公司,913204122508674755,1993-05-26,N/A,殷国良,"518(万元人民币)","房屋建筑、开发；建筑材料、装饰材料零售，批发。",江苏,常州,"武进区雪堰镇"
南京王朝国际展览中心有限公司,91320104250005111X,1993-05-26,N/A,王永豪,"60(万元人民币)","承办展览服务；室内外装璜；摄影服务；建筑材料、装饰材料、展柜、货架、家具生产、销售；五金交电、针纺织品、鞋帽、工艺美术品（不含国家专控商品）销售；自营和代理各类商品及技术的进出口业务",江苏,南京,"南京市白下区常府街85号乙楼8C座"
