常州市雪堰电工配件有限公司,320483000117478,1993-08-16,N/A,张菊兴,"50(万元人民币)","继电器、聚氨酯漆包线、铝线盘、铝铸件、铜拉丝、拉丝模具、有机玻璃灯罩制造、加工。",江苏,常州,"武进区雪堰镇绣衣村"
溧阳市华景港金属材料有限公司,91320481717492217C,1993-08-16,N/A,陶再平,"600(万元人民币)","钢压延加工。",江苏,常州,"溧阳市社渚镇河心建设东路26号"
南京市长江影视科技工程公司,91320100134954061K,1993-08-16,N/A,周勇,"200(万元人民币)","舞台设计、安装、调试；空调设备安装；室内装饰服务；电子机械维修；影视舞台设备、电器机械、金属材料、电子元件销售。",江苏,南京,"南京市雨花台区共青团路1号"
徐州海虹建筑工程机械有限公司,91320312136408144W,1993-08-16,有限责任公司,杨思科,"6000万人民币","普通货运，工程机械及配件制造、销售。",江苏,徐州,"铜山经济开发区陇海路9号"
泰兴市能源设备有限公司,91321283729015258E,1993-08-16,N/A,陆池明,"1,200(万元人民币)","电声器材及配件、音响箱锁及配件、高低压电柜制造；金属冲压件加工；柴油发电机组组装。",江苏,泰州,"泰兴市新街镇幸福路5号"
南通市通州区飞达汽车修配有限公司,320683000001349,1993-08-16,N/A,张强,"32.8000(万元人民币)","许可经营范围:二类汽车维修（大型货车）。一般经营范围:汽车配件、机动车配件、五金、化工",江苏,南通,"南通市通州区金沙镇金北村一组"
徐州市贾汪康宏多种经营公司,91320305836674689N,1993-08-16,N/A,徐顺,"30(万元人民币)","日用百货、针棉织品、建筑材料、卫生用品、服装、鞋帽、文化用品、毛线、建筑五金、门面房出租、劳保用品、摩托车配件、水暖器材、交电、汽车配件零售；验光配镜技术研发、视力保健信息咨询服务。",江苏,徐州,"贾汪区矿二院内"
中国银行股份有限公司常州鸣凰支行,91320412950916231D,1993-08-16,N/A,王亚娟,"0(万元人民币)","经营中国银行业监督管理委员会依照有关法律、行政法规和其他规定批准的业务，经营范围以批准文件所列的为准。保险兼业代理(以《保险兼业代理业务许可证》核定范围为准。）",江苏,常州,"武进区湖塘镇鸣凰街"
宜兴利达化学有限公司,913202826079988825,1993-08-16,N/A,胡昶,"200(万美元)","危险化学品经营",江苏,无锡,"宜兴市周铁镇彭干村"
江苏志鹏建工集团有限公司,91320682252010889E,1993-08-16,N/A,常亮,"12,000(万元人民币)","房屋建筑工程施工总承包、市政公用工程施工总承包、钢结构工程专业承包、起重设备安装工程专业承包、消防设施工程专业承包、建筑装修装饰工程专业承包；电力设施承装五级。",江苏,南通,"如皋市如城镇益寿南路185号"
常州耀伟制刷有限公司,9132041260812807XK,1993-08-16,N/A,李飞鹏,"90.0600(万元人民币)","制刷制造，加工。五金工具加工，道路普通货物运输。",江苏,常州,"武进区南夏墅街道三河村龙江南路6号"
南通濠河国际旅行社有限公司,91320602138318900B,1993-08-17,N/A,钱顺峰,"32(万元人民币)","境内旅游业务；入境旅游业务；出境旅游业务；食品、工艺品的销售；票务代理；会议及展览服务。",江苏,南通,"南通市濠南路--1号"
南通市通州区英雄勤发五金机械配件厂,91320612X08369099J,1993-08-17,个人独资企业,韩建成,"2.5万人民币","五金、机械配件加工、销售。",江苏,南通,"南通市通州区刘桥镇严园村七组"
常州市广才塑料有限公司,91320412714007407A,1993-08-17,N/A,王建文,"59.3800(万元人民币)","塑料制品、电源开关、电源插座、接插件、机械零部件制造，加工；电机、传动箱组装。",江苏,常州,"武进区洛阳镇天井村"
江阴市海达燃料有限公司,91320281250354426C,1993-08-17,N/A,沈建,"500(万元人民币)","煤炭销售；橡胶及制品、建材、纺织原料",江苏,无锡,"江阴市花东路88号"
中国人民财产保险股份有限公司丹阳支公司珥陵营业部,91321181576740837F,1993-08-17,N/A,陈国星,"0(万元人民币)","财产损失保险、责任保险、信用保险、意外伤害保险、短期健康保险、保证保险等人民币或外币保险业务；与上述业务相关的再保险业务；各类财产保险，意外伤害保险、短期健康保险及其再保险的服务与咨询业务；代理保险机构办理有关业务；国家法律、法规规定的或国家保险监管机构批准的其他业务",江苏,镇江,"丹阳市珥陵镇"
常州市宝邦金属制品有限公司,9132041225095195X9,1993-08-17,有限责任公司,顾东良,"60.56万人民币","邮箱、塑料工业配件、铝压铸件制造，机械零部件加工；道路普通货物运输。",江苏,常州,"武进区洛阳镇东尖村小东尖组"
盐城龙腾科技有限公司,91320903X08626534T,1993-08-17,N/A,王艺华,"50(万元人民币)","电器产品研发，电器、电热元件、化纤纺织机械设备制造，机电仪表、电器的销售。",江苏,盐城,"盐城市盐都区潘黄镇前进工业区"
江阴市金城纺织品有限公司,91320281250345132F,1993-08-17,N/A,李明,"200(万元人民币)","棉布、化纤布、服装的制造、加工、销售；金属制品、建材、纺织原料、针织品、纺织品的销售；自营和代理各类商品及技术的进出口业务，但国家限定企业经营或禁止进出口的商品和技术除外。",江苏,无锡,"江阴市周庄镇山泉村兴泉路"
中卫实业(南京)有限公司,91320115608915516M,1993-08-17,N/A,林铭田,"1,010.0015(万美元)","生产卫星天线系统，电脑周边设备，家用电器，运动器材，金属安全门及其他金属构件的加工，喷漆，烤漆，太阳能集热板、太阳能发电板及太阳能高功率高科技系列产品；销售自产产品。",江苏,南京,"南京市江宁经济技术开发区董村路8号"
无锡市欣丰化工有限公司,913202062501234920,1993-08-17,N/A,杨嘉树,"1,000(万元人民币)","N-甲基苯胺、N， N－二甲基苯胺、N-乙基苯胺、N，N－二乙基苯胺的制造、加工；自营和代理各类商品及技术的进出口业务",江苏,无锡,"无锡市惠山区洛社镇杨市镇北村"
江苏江星机械配件制造有限公司,91321282141115477B,1993-08-17,N/A,顾开国,"1,180(万元人民币)","机械配件制造、销售；自营和代理各类商品及技术的进出口业务",江苏,泰州,"靖江市季市北路48号"
宜兴市金渚航运有限公司,913202822504798190,1993-08-17,N/A,李学辉,"50(万元人民币)","货物运输",江苏,无锡,"宜兴市张渚镇银湖新村188号"
常州市东亚日照热油泵有限公司,91320412250983943D,1993-08-17,N/A,张文俊,"60(万元人民币)","热油泵、油泵、水泵制造。",江苏,常州,"武进区横林镇昌盛路5号"
中国银行股份有限公司常州永宁支行,91320400837210990A,1993-08-17,N/A,黄俊,"0(万元人民币)","办理人民币存款、贷款、结算业务；外币储蓄、外币兑换；代理收付款项及代理保险业务；办理其上级行在中国银行业监督管理委员会批准的业务范围内授权的业务；经中国银行业监督管理委员会批准的其他业务。",江苏,常州,"常州市飞龙东路108号-105、106、107"
常熟市龙灯毛条有限公司,91320581251421889X,1993-08-17,N/A,曹忠良,"60(万元人民币)","毛条、染色、毛纱、呢绒制造、加工。",江苏,苏州,"常熟市海虞镇龙灯村"
苏州市南星房地产开发有限公司,91320508137824879U,1993-08-17,N/A,蔡展根,"800(万元人民币)","房地产开发；室内装饰；销售：建筑材料。",江苏,苏州,"苏州市胥江路22号"
南通市崇川机电物资公司,320602000000470,1993-08-17,N/A,顾兴花,"31(万元人民币)","水暖器材、金属材料、健身器材、五金电器、电线电缆、电子元器件、机电产品、轴承、橡胶制品、阀门、建筑装潢材料（油漆除外）、机械设备及配件、润滑油、汽车配件、空调、家用纺织品、服装、鞋帽及辅料、日用百货、化工原料",江苏,南通,"孩儿巷南路8号楼7室"
南通市宝升工程服务有限公司,91320602251874976P,1993-08-19,N/A,于晓东,"214.4000(万元人民币)","土石方工程、建筑工程施工、建筑装饰工程服务、清洁服务、工程机械租赁、建筑装饰材料、五金产品、电器及配件销售。",江苏,南通,"南通市新桥新村43附7幢101室"
徐州和泰房产开发有限公司,91320322608004683H,1993-08-19,N/A,龙大强,"826(万元人民币)","房产开发，防腐保温、装饰装潢。",江苏,徐州,"江苏省徐州市沛县东风路58号"
苏州巨欣玻璃工业有限公司,320500400002321,1993-08-19,N/A,许志萍,"178(万美元)","许可经营范围:一般经营范围:生产镀膜玻璃、钢化玻璃、中空玻璃、夹胶玻璃、热弯玻璃、家俱玻璃和各种工艺玻璃，承接玻璃安装工程；销售公司自产产品；从事与本公司生产相同产品及玻璃机械设备、相关玻璃五金配件（贵金属除外）的批发及进出口业务",江苏,苏州,"江苏省苏州市相城区望亭镇"
中国人民财产保险股份有限公司启东支公司江海营业部,913206818388738411,1993-08-19,N/A,陆凯兵,"0(万元人民币)","财产损失保险、责任保险、信用保险、意外伤害保险、短期健康保险、保证保险等人民币或外币保险业务；与上述业务相关的再保险业务；各类财产保险，意外伤害保险、短期健康保险及其再保险的服务与咨询业务；代理保险机构办理有关业务；国家法律、法规规定的或国家保险监管机构批准的其他业务。",江苏,南通,"启东市惠萍镇永胜街118号"
南通市太平电器厂,91320611138485266G,1993-08-19,股份合作制,杨建华,"60万人民币","地面布线器材",江苏,南通,"幸福乡坚持村"
无锡龙达实业总公司,913202062501237240,1993-08-19,N/A,夏波清,"1,163.1000(万元人民币)","通用设备、电气机械和器材的制造、加工；文具用品、金属材料、化工原料",江苏,无锡,"无锡市惠山区洛社镇人民中路158号"
兴化市楚水汽车修理厂有限公司,913212817481985638,1993-08-19,N/A,袁粉兰,"30(万元人民币)","一类汽车维修（乘用车），三类汽车维修（装饰装潢），交通事故救援服务，停车服务、电热配件、汽车配件零售，汽车销售，二手车经销及经纪服务，汽车租赁",江苏,泰州,"兴化市环城西路(经济开发区葛家西路南)"
常熟市润丰纺织有限公司,91320581251422099Q,1993-08-20,N/A,张惠良,"600(万元人民币)","棉、涤、化纤纱加工制造；纺织原料销售。经营本企业自产产品及技术的出口业务；经营本企业生产、科研所需的原辅材料、仪器仪表、机械设备、零配件及技术的进口业务",江苏,苏州,"常熟市何市镇桂花街37号"
金湖金尚电力实业开发有限公司,91320831140043133G,1993-08-20,N/A,潘明祥,"3,409.6000(万元人民币)","电力工程（含土建）咨询、设计；电力设施承装、修、试（三级）；电力工程施工总承包三级；房屋建筑工程施工总承包三级；建筑装修装饰工程、建筑智能化工程、城市及道路照明工程、送变电工程、机电设备安装工程、地基与基础工程专业承包；汽车清洁维护、电器维修、供油系统维护及油品更换（限分公司经营）；自动化设备、家用电器、金属材料、通讯器材、化工产品（除危险化学品）、建筑材料、汽车配件、消防器材、电工器材、仪器、仪表、电气产品、日用百货、纺织品、化妆品及卫生用品销售；信息技术咨询服务；会议服务；物业管理；房屋、机械及电器设备、场地租赁；汽车租赁服务（不含营运业务）；高低压成套设备、箱式变电站、电源及自动化装置、终端电器、电缆桥架生产、销售；变压器、避雷器检修；金属材料加工；通信工程的设计、改造、施工；变电站、输电线路、光（电）缆线路运行、维护；计算机及配件、通信设备及器材（不含地面卫星接收设备及无线电发射设备）销售、安装、维修及技术服务；电子计算机网络及自动化工程的设计、安装、系统集成",江苏,淮安,"金湖县建设东路2号"
银河电子集团投资有限公司,91320582142189902D,1993-08-20,N/A,顾革新,"5,000(万元人民币)","对信息产业、软件行业、广播电视行业、机械行业、生物工程、医疗文教行业的投资；自营和代理各类商品和技术的进出口业务；电子元器件、集成电路、建筑材料、煤炭、铁矿石、有色金属、钢材、汽车购销。",江苏,苏州,"张家港经济技术开发区软件(动漫)产业园5楼519室"
淮安市粮食购销公司,913208037038476113,1993-08-20,N/A,王朴,"2,001(万元人民币)","粮食销售；粮油储运；器材、建筑材料、五金、交电、百货、日用杂品销售；房屋维修；货物仓储；货物装卸；房屋租赁；机械设备租赁；汽车租赁；粮食收购",江苏,淮安,"淮安市淮安区淮城镇淮楼西路32号"
中国银行股份有限公司无锡山北支行,91320200836216469H,1993-08-20,N/A,周晓雯,"0(万元人民币)","办理人民币存款、贷款、结算业务；代理兑付和销售政府债券；办理外汇存款、汇款、结算、售汇、外币兑换；代理收付款项；代理保险业务；代理销售基金和理财、贵金属；办理其上级行在中国银行业监督管理委员会批准的业务范围内授权的业务；经中国银行业监督管理委员会批准的其他业务。",江苏,无锡,"无锡市北塘区石门路79号7-10"
中国银行股份有限公司常熟徐市支行,913205815855977965,1993-08-20,N/A,管威,"0(万元人民币)","经营中国银行业监督管理委员会依照有关法律、行政法规和其他规定批准的业务，经营范围以批准文件所列的为准。",江苏,苏州,"常熟市董浜镇徐市塘南西路42号1幢"
南京莲悦文化传播有限公司,91320104135122283W,1993-08-20,有限责任公司,张友生,"50万人民币","文化艺术交流信息咨询；工艺美术品、字画（不含古字画及名人字画）、珠宝首饰、文化用品、日用百货、针纺织品批发、零售；自营和代理各类商品及技术的进出口业务",江苏,南京,"南京市秦淮区花露岗48号"
扬州经济技术开发区广陵开发总公司,91321002140845080W,1993-08-20,N/A,徐有勇,"200(万元人民币)","房地产开发。房地产销售、租赁；钢材、木材、建筑材料、工程机械销售。",江苏,扬州,"扬州市文昌中路548号"
常熟世昌皮革有限公司,913205816082470959,1993-08-20,N/A,郑炯线,"165(万美元)","生产销售以羊皮面料为主的皮革面料。 ",江苏,苏州,"江苏省常熟市碧溪镇吴市三湾村"
南京南华宝庆珠宝首饰有限公司,913201006089105988,1993-08-20,N/A,刘建德,"550(万元人民币)","加工、销售金、银、铂及珠宝首饰、工艺品、礼品及其相关的售后服务、促销服务。",江苏,南京,"南京市秦淮区太平南路107号"
南京苏强商务有限公司,320100000075488,1993-08-20,N/A,黄强,"105(万元人民币)","许可经营项目：餐饮服务",江苏,南京,"南京市秦淮区长乐路137号"
扬州海信运输有限公司,91321011720597466J,1993-08-21,N/A,张元海,"50(万元人民币)","普通货运，仓储服务，预包装食品批发及零售。",江苏,扬州,"平山乡中兴路90号"
南京宝瑞特养殖有限公司,91320100608939737T,1993-08-21,N/A,杨吉玉,"10(万美元)","淡水动物养殖；销售自产产品。",江苏,南京,"南京市浦口区盘城镇"
无锡市天乐通讯设备安装有限公司,91320203136128492E,1993-08-21,N/A,朱骏杰,"1,000(万元人民币)","通讯设备",江苏,无锡,"无锡市曹张新村520号-4"
南通市通州区环城不锈钢制品厂,91320612138399552L,1993-08-21,集体所有制,邱永富,"7.5万人民币","不锈钢制品、铝、铁皮制品、五金制品制造、加工。",江苏,南通,"南通市通州区西亭镇林店村"
南京大华声像电讯有限公司经营部,91320104558889785N,1993-08-21,N/A,杨培武,"0(万元人民币)","音像制品销售。",江苏,南京,"南京市白下区洪武路119号"
昆山金恺包装用品有限公司,91320583251253213F,1993-08-21,N/A,张英华,"1,800(万元人民币)","纸箱、泡沫包装材料、电子产品、木制包装用品生产、销售；经营本企业自产产品及技术的出口业务；经营本企业生产、科研所需的原辅材料、仪器仪表、机械设备、零配件及技术的进口业务",江苏,苏州,"昆山开发区顺帆南路188号"
常州市武进坂上纺织助剂有限公司,913204122509223586,1993-08-23,N/A,孙韶辉,"110(万元人民币)","纺织浆料、纺织辅料、纺织配件销售，塑料工业配件制造，机械零部件加工。",江苏,常州,"武进区礼嘉镇坂上村"
宜兴市昱合商贸有限公司,913202822504802549,1993-08-23,N/A,吴伯承,"60(万元人民币)","普通机械配件、挤压机、真空泵、电动机、仪器仪表、五金电器、工具量具、轴承、橡胶制品、劳保用品、电脑及配件、通讯器材",江苏,无锡,"宜兴市宜城街道人民中路247号"
常州市大帝摄影设计印刷有限责任公司,9132040413722227XT,1993-08-23,N/A,盛晓峰,"150(万元人民币)","包装装潢印刷品排版、制版、印刷、装订，其他印刷品印刷；设计、制作国内印刷品广告业务，平面设计；百货、五金、交电的销售。",江苏,常州,"钟楼区五星街道新岗村委沈家塘96号"
江阴名绅俱乐部有限公司,91320281607983672E,1993-08-23,N/A,陈少云,"90(万美元)","组织汽车自助游服务、汽车救援中介服务、为有汽车单位及驾驶员提供配套服务；商务信息服务；从事化工产品（不含危险品）、针织品、纺织品、服装、五金产品、矿产品、机械设备、农畜产品",江苏,无锡,"江苏省江阴市虹桥北路"
常州惠佳机械有限公司,913204112510468556,1993-08-23,有限责任公司,段春新,"89万人民币","水处理设备、机械零配件、电子元器件的制造、加工。",江苏,常州,"常州新北区新桥镇"
常州恒鼎轨道科技有限公司,91320405137286855A,1993-08-23,N/A,陈小立,"1,200(万元人民币)","研发、制造、销售、修理轨道交通装备零部件、柴油机零部件、电子电器产品、滤清器、金属波纹管、补偿器、阀类产品；轨道交通装备技术咨询及服务；房屋及设备租赁；自营和代理各类商品及技术的进出口业务",江苏,常州,"常州市五一路319号"
南京博雅汽车附件制造厂,91320111135660516H,1993-08-23,集体所有制,周亚平,"200万人民币","普通。机械、汽车零配件、纸制品生产、加工、销售。",江苏,南京,"南京市浦口区星甸镇工业园区"
如皋市粮食购销公司,913206821386483017,1993-08-23,N/A,吴建清,"396.2000(万元人民币)","粮食收购、销售；粮食整理、烘干；预包装食品批发与零售；本行政区划粮食系统内资产管理、资产经营、资产投资；一般货物仓储服务",江苏,南通,"如皋市丁堰镇皋南村一组"
宜兴市宝昌环保设备有限公司,913202822504802624,1993-08-23,N/A,许忠林,"50(万元人民币)","喷泉设备、水质污染防治设备的销售。",江苏,无锡,"宜兴经济开发区惠新北路6号"
吴江市汾湖镇集体资产经营公司,91320509251298702M,1993-08-23,N/A,包玲英,"15,000(万元人民币)","本镇镇级集体资产的对外投资、收益；房屋租赁。",江苏,苏州,"芦墟镇新马路"
南京台通桩基础工程公司,320100000014587,1993-08-23,N/A,王乃柱,"120(万元人民币)","许可经营范围:一般经营范围:桩基础工程施工。凿井；土石方工程；屋面防水工程；水电、建筑安装；室内装饰。",江苏,南京,"南京市建邺区莫愁新村45-2号"
江苏三泰轻工科技有限公司,91321183608880720T,1993-08-24,N/A,段超群,"1,057(万元人民币)","针纺织品、服装面辅料、复合材料的生产、加工；帐篷、服装、背包研发、生产、加工；自营和代理各类商品和技术的进出口业务",江苏,镇江,"句容经济开发区西环路转盘西南侧01幢"
无锡金凤毛织制品有限公司,913202006079726826,1993-08-24,N/A,李天一,"18(万元人民币)","生产服装。",江苏,无锡,"江苏省无锡市惠山区堰桥镇长安王家庄村"
常州华威电子有限公司,9132040060811863XD,1993-08-24,N/A,YAN HAN JING,"15,730.2442(万元人民币)","电容器的制造、销售；自营进出口业务。",江苏,常州,"常州市钟楼区邹区镇邹区村施桥300号"
南通宏济实业有限公司,91320600138528297J,1993-08-24,N/A,黄小旋,"100(万元人民币)","家居装饰及设计；自有房屋租赁；建筑装饰装璜材料、机械产品、纺织品、服装、文化用品、办公设备销售。",江苏,南通,"南通市人民东路6号王府大厦2幢6楼"
沛县大屯供销合作社金旺达超市,91320322MA1NX3QN1M,1993-08-24,集体分支机构(非法人),田中侠,"2万人民币","定型包装食品、卷烟、雪茄烟零售，日用百货、五金电料、文化用品、杂品",江苏,徐州,"沛县大屯中心街北侧八组"
南通名流名片有限公司,913206021383189273,1993-08-24,N/A,孙振,"50(万元人民币)","名片设计、制作，复印、影印、打印",江苏,南通,"南通市人民中路71号润友大厦5层"
南通十建集团有限公司,913206007185586442,1993-08-24,N/A,司光吾,"10,160(万元人民币)","建筑工程施工总承包（壹级）；机电工程施工总承包（壹级）；钢结构工程专业承包（壹级）；市政公用工程施工总承包（贰级）；消防设施工程专业承包（壹级）；建筑装修装饰工程专业承包（壹级）；建筑机电安装工程专业承包（壹级）；石油化工工程总承包（叁级）；地基基础工程专业承包",江苏,南通,"江苏省南通市崇川区中新一路6号"
南通跃华机械有限公司,91320612714183152W,1993-08-24,有限责任公司,陆跃,"500万人民币","铁路机车车辆配件、船舶配件生产、加工、销售。",江苏,南通,"南通市通州区金沙镇金北村"
南京金箔集团金宝市场有限公司,91320115135622093D,1993-08-24,N/A,周浩,"800(万元人民币)","市场服务设施租赁、市场管理服务；停车服务；五金交电、纺织品、服装、鞋帽、百货、装饰材料、黄金珠宝销售；场地、房屋租赁。",江苏,南京,"南京市江宁区东山镇金箔路197号"
江苏宝联新材料科技有限公司,91320413137421519N,1993-08-24,N/A,赵刚,"1,180(万元人民币)","生态环境材料的研究；化工产品的技术研究；特种水基石墨润滑剂、金属清洗剂、冷却液、切削液、金属防腐涂料产品（水性）的生产和销售；橡塑制品、包装材料、建筑材料、化肥、化工原料",江苏,常州,"常州市金坛区红山路28号"
宜兴市赛隆耐火材料有限公司,91320282250480297N,1993-08-24,N/A,徐浩兵,"98(万元人民币)","耐火材料制品、矿物棉制品、水质污染防治设备的制造、销售。",江苏,无锡,"宜兴市屺亭街道学圩村"
南通市龙川经贸有限公司,91320600138319161H,1993-08-24,N/A,顾宇人,"1,052.6500(万元人民币)","建筑材料，给排水设备，金属材料，普通机械及配件，木材，橡胶制品，水暖器材及管件，五金交电，仪器，针纺织品，日用百货，农副产品销售；水暖工程维修，水暖工程来料加工。",江苏,南通,"南通市人民中路133号"
苏州鸿仁窗饰有限公司,9132058560826897X5,1993-08-24,N/A,黄介仁,"602(万美元)","生产销售窗帘、窗饰件。",江苏,苏州,"江苏省太仓市城厢镇城区工业园"
江苏远东水泥有限公司,9132118360888174XX,1993-08-25,N/A,张扣华,"5,663.7000(万元人民币)","生产销售水泥",江苏,镇江,"句容市边城镇"
无锡市成名机械厂,91320206X291336321,1993-08-25,个人独资企业,陈敏,"51万人民币","印染机械、化工机械、通用设备及配件、环保设备、建筑机械及配件的制造、加工、销售、安装。",江苏,无锡,"无锡惠山经济开发区堰桥配套区堰丰路10号"
吴江市菀坪精工机械厂,91320509251305466E,1993-08-25,集体所有制,潘国明,"50万人民币","制造、加工：缝纫和服饰机械及配件。",江苏,苏州,"菀坪集镇"
苏州欣宇服装有限公司,913205856082691718,1993-08-25,N/A,陈土平,"50(万美元)","生产销售各类服装。",江苏,苏州,"江苏省太仓市浏河镇"
江苏省供销日用杂品有限公司,91320100134772794K,1993-08-25,有限责任公司,江竹青,"50万人民币","日用杂品、炊事用具、日用化学品、化工原料及产品、纺织原料、针纺织品、农副产品、家用电器、日用百货、服装、建筑材料、装饰材料的销售，自营和代理各类商品和技术的进出口。",江苏,南京,"南京市中山北路１０１号前二楼"
吴江市七都镇集体资产经营公司,91320509251302468Y,1993-08-25,N/A,于国良,"23,800(万元人民币)","对镇级集体资产的投资经营和收益管理。",江苏,苏州,"吴江市七都镇"
