扬中市兴华包装有限公司,91321182141759686T,1993-03-17,有限责任公司,朱桂林,"150万人民币","塑料包装制品、氟塑料制品制造；普通货物（不含危险品）道路运输；自营和代理各类商品和技术的进出口业务",江苏,镇江,"扬中市油坊镇同德村"
江苏诚达建筑有限公司,9132098114260888XH,1993-03-17,N/A,赵发如,"5,030.8000(万元人民币)","承包境外房屋建筑工程和境内国际招标工程及上述境外工程所需的设备、材料出口，对外派遣实施上述境外工程所需的劳务人员（按资质证书经营），房屋建筑工程施工总承包一级、地基与基础工程专业承包二级、建筑装修装饰工程专业承包二级、钢结构工程专业承包二级（按资质证书经营）；市政公用工程施工、建筑材料试验",江苏,盐城,"东台市鼓楼路377号(规划建设局7楼)"
盐城亚欧海产有限公司,913209826086847113,1993-03-17,N/A,王凤书,"790(万元人民币)","对虾、克氏螯虾、贝类、黑籽鳗及其它水产品养殖、加工",江苏,盐城,"盐城市大丰区三龙镇渔业创新路66号"
扬州市新业劳动服务公司,9132109114072641X8,1993-03-17,N/A,刘欣,"200(万元人民币)","劳务派遣经营（凭有效许可证件经营）；代办江苏省电信有限公司委托的电信业务；企业管理咨询；装卸搬运服务；软件及信息技术服务；物业管理",江苏,扬州,"扬州市兴城东路"
镇江市京口区谏壁电力安装公司,913211027141767458,1993-03-17,N/A,陶金,"50(万元人民币)","非标容器设备的制作；电力设备的安装；油漆、喷涂施工；电器的修理。",江苏,镇江,"镇江市谏壁镇6904叉道口"
海安县曲塘镇佳丰机电厂,92320621MA1N39M78T,1993-03-17,个体工商户,周俊,"13万人民币","机械及配件、电机、电器及配件加工；汽车配件、工业电炉零售。",江苏,南通,"海安县曲塘镇人民东路210号"
无锡市梁盛五金机电有限公司,91320213250108401C,1993-03-17,N/A,李勇,"53.7000(万元人民币)","五金交电，通用机械设备．金属材料，化工原料（不含危险品），机电设备",江苏,无锡,"无锡市五爱路171-2号"
宜兴市鑫浩石业有限公司,91320282250454945Q,1993-03-17,N/A,刘俊峰,"30(万元人民币)","大理石、花岗石板材的加工；家具的制造；普通货运。",江苏,无锡,"宜兴市万石镇余庄村"
宜兴市腾达化工有限公司,913202822504545074,1993-03-17,N/A,马国华,"80(万元人民币)","化工产品及原料（不含危险化学品）的销售；危险化学品的批发",江苏,无锡,"宜兴市高塍镇贺家渎"
盱眙县城建开发建筑安装有限公司,913208307827349640,1993-03-17,N/A,杨维祥,"2,050(万元人民币)","房屋建筑工程施工、安装、房屋维修、市政建设",江苏,淮安,"盱眙县盱城斩龙涧小区19号楼"
苏州市市政房地产发展有限公司,91320506713243096A,1993-03-17,N/A,毛惠生,"826(万元人民币)","房地产开发。房产中介、物业管理；销售：建筑材料、装潢材料、五金。",江苏,苏州,"苏州市吴中区西山镇东河新区东园公路111-1号"
中国银行股份有限公司南通港闸支行,9132060083830776XK,1993-03-17,N/A,周国华,"0(万元人民币)","按人民银行核发的金融许可证核准的经营范围经营。",江苏,南通,"城港路38号"
南京下关吉达经济技术实业公司,913201061352964196,1993-03-17,N/A,张萍,"50(万元人民币)","技术开发、百货、五金交电、建筑材料、装饰材料、工艺美术品、橡塑制品、机电设备销售。",江苏,南京,"南京市鼓楼区兴安路9号"
张家港市长江资源开发有限公司,913205921421800948,1993-03-17,N/A,施国琴,"21,000(万元人民币)","沿江滩涂开发利用，码头建设规划，沿江水资源开发，区域基础设施开发建设，环境管理咨询服务，金属材料、建筑材料、木材、纺织原料的购销。",江苏,苏州,"杨舍镇人民中路1号"
徐州华信国际贸易有限公司,91320302136482395K,1993-03-17,N/A,沈元奎,"100(万元人民币)","机械设备、电子产品、钢材、木材、建筑材料、装饰材料、汽车（小轿车除外）及配件、化工产品（危险品除外）、计算机配件及软件销售;自营和代理各类商品和技术的进出口",江苏,徐州,"徐州市黄河东路民生大厦1-1415室"
江阴市外轮供应有限公司,913202812503424921,1993-03-17,N/A,朱丽英,"1,000(万元人民币)","国际航行船舶食品供应；船舶港口服务业务经营（按《港口经营许可证》核准的范围经营）；普通货运；承办海运、陆运、空运、快递进出口货物的国际运输代理业务（包括：揽货、托运、订舱、仓储、中转、集装箱拼装拆箱、结算运杂费、报关、报验、相关的短途运输代理服务及运输咨询业务）；船用物资供应",江苏,无锡,"江阴市海港路18号321室"
南京盛茂房地产开发有限公司,9132010060896529X3,1993-03-17,N/A,肖梅,"1,742.4120(万元人民币)","销售、租赁自建商品房及租售后配套服务；物业管理。",江苏,南京,"白下区中山南路49号商茂广场大厦"
南通市龙丹化工有限公司,91320621138568838X,1993-03-17,N/A,景步林,"50(万元人民币)","硫酸生产；盐酸乙脒、盐酸丁脒（正丁脒、异丁脒）、氯化铵生产",江苏,南通,"海安县墩头镇仇湖村二十八组"
南京白云亭文化发展有限公司,91320106135295846F,1993-03-17,N/A,康世强,"40,655.1610(万元人民币)","文化艺术交流策划、舞台艺术造型策划、企业形象策划、市场营销策划、文化活动策划；会务服务、礼仪服务、摄影服务、 展示展览服务、文化创意和建筑设计服务、商务信息咨询服务、图书馆与档案馆管理服务、文化遗产保护服务；物业管理；图文设计制作；销售日用百货、服装鞋帽、家具、玩具、木制品、塑料制品、工艺品、摄影器材、音响设备及器材、体育用品、电子产品、通讯设备、电讯器材、仪器仪表、文化办公用品、电脑、计算机软件及配件；停车管理服务；自有房屋租赁。",江苏,南京,"南京市鼓楼区二板桥486号"
海门市铁路机车车辆配件厂有限公司,91320684703782221M,1993-03-17,有限责任公司,秦祖刚,"1500万人民币","机车车辆配件、千斤顶、收音机、收录机、模具、塑料制品、工艺品（金银饰品除外）的制造、加工、销售；机械配件加工；电器、电机维修；建材、日用五金制品、化工产品（危险化学品除外)、针织品、百货、汽车配件、金属材料、建筑装璜材料",江苏,南通,"海门市海门镇镇中路165号"
常州市武进爱利达纺织有限公司,91320412250855239U,1993-03-17,N/A,毛建荣,"658(万元人民币)","纯化纤纱、绳带制品、服装制造，毛纱加工，针纺织品、纺织原料、百货销售；自营和代理各类商品及技术的进出口业务，但国家限定企业经营或禁止进出口的商品及技术除外。",江苏,常州,"武进高新技术产业开发区龙惠路16号"
苏州市虎丘干燥设备制造有限公司,9132050813802892XQ,1993-03-17,N/A,沈杰,"50(万元人民币)","制造加工、销售：干燥设备、化工设备、制药设备、食品机械、冷作件；批发零售：金属材料、装饰装潢材料、日用百货。",江苏,苏州,"苏州市吴中区木渎镇勤奋路88号第4号标准厂房"
中国银行股份有限公司南通秦灶支行,913206006829741780,1993-03-17,N/A,陆玉华,"0(万元人民币)","按中国银行业监督管理委员会南通分局核发的金融许可证核定的范围经营。",江苏,南通,"南通市外环北路216号"
溧阳市南渡房地产开发有限公司,91320481137574291K,1993-03-17,N/A,朱和平,"800(万元人民币)","房地产开发、经营，经销建筑装璜材料。",江苏,常州,"溧阳市南渡镇永安路26号"
南京市浦口区桥林供销社,91320111MA1P9N652R,1993-03-17,集体所有制,陈礼华,"50万人民币","百货、农机配件、文件用品、针纺织品、五金交电、建筑材料、日用杂品、机电产品、电子仪器仪表销售；废旧物资",江苏,南京,"南京市浦口区桥林镇西街30号"
常州市新未来化工有限公司,91320412251035793X,1993-03-17,N/A,俞建伟,"1,800(万元人民币)","甲醇（副产）、盐酸",江苏,常州,"武进区横山桥镇金丰村"
常州强龙橡塑制品有限公司,913204022510283581,1993-03-17,有限责任公司,沈志强,"65.6万人民币","橡塑制品",江苏,常州,"天宁区郑陆镇施家巷村"
常州市武进晨光农机配件有限公司,91320412250818315R,1993-03-18,有限责任公司,张春树,"90.101898万人民币","垫片制造、金属冲件、金属冷作、机械零部件加工。",江苏,常州,"武进高新技术产业开发区马杭菱江路30号"
中国银行股份有限公司东台东园支行,913209818425517223,1993-03-18,N/A,仲维宽,"0(万元人民币)","办理人民币存款、结算业务；代理收付款项及代理保险",江苏,盐城,"东台市鼓楼东路166号"
常州市武进马杭华盛图书档案设备有限公司,91320412250937445D,1993-03-18,有限责任公司,张文美,"50万人民币","藏书设备、机械零部件制造，金属冷作、注塑加工。",江苏,常州,"武进高新技术产业开发区马杭菊花路1号"
宜兴市陶都水景设备有限公司,913202822504548655,1993-03-18,N/A,刘华娣,"108(万元人民币)","喷泉设备及配件的制造、销售；喷泉工程、景观工程、雾森及灯光工程的设计、施工。",江苏,无锡,"宜兴市和桥镇永兴村"
南京金陵石化美洁化工公司,91320100134940217P,1993-03-18,N/A,贾莉俊,"30(万元人民币)","化工产品、塑胶制品销售。",江苏,南京,"秦淮区许家巷17号4单元207室"
常州市诚信电器有限公司,91320412250941874G,1993-03-18,有限责任公司,王红德,"300万人民币","精密机械设备、机械零部件、医疗器械零部件、光学器件、车辆电器开关、汽车配件，塑料制品（除医用塑料制品）、服装制造、加工；金属冲压件加工；织布；针纺织品、纺织原料销售；自营和代理各类商品及技术的进出口业务",江苏,常州,"武进区牛塘镇丫河村"
苏州鸿明橡塑有限公司,91320500608289199E,1993-03-18,N/A,林进将,"158(万美元)","生产销售橡胶、橡塑鞋底等民用橡塑制品及鞋材辅料。",江苏,苏州,"江苏省苏州市吴中区长桥镇"
徐州市金悦饮食服务有限公司两来风酒楼分公司,91320300136554571D,1993-03-18,N/A,张美荣,"0(万元人民币)","早餐制售；房屋出租。",江苏,徐州,"徐州市云龙区民主南路266号"
南京港(集团)有限公司船舶修理厂,91320100834927689E,1993-03-18,N/A,夏则艮,"215(万元人民币)","许可经营项目：无 一般经营项目：船舶、内燃机修理、咨询、服务；机械加工；船用物资供应。",江苏,南京,"浦口区浦兴路26号"
常熟市种业有限公司,91320581142106046Q,1993-03-18,N/A,殷峰,"600(万元人民币)","农作物种子生产、销售；苗木、初级农产品销售。",江苏,苏州,"常熟市义虞路2号"
无锡和平电容器销售有限公司,913202131359205410,1993-03-18,N/A,陈善良,"55(万元人民币)","化工产品及原料（不含危险品）、金属材料、建筑材料、通用机械、针纺织品",江苏,无锡,"无锡市振奋路23-1号"
苏州市江通电讯器材有限公司,91320507608292806X,1993-03-18,N/A,徐火根,"4,000(万元人民币)","制造、加工：电缆电视分配系统设备、净化设备、五金电器。销售：电工器材、五金交电、化工产品",江苏,苏州,"苏州市相城区北桥街道"
江苏正大种子有限公司,91320623608353672J,1993-03-18,N/A,鲍国余,"389.4037(万美元)","蔬菜种子批发；瓜果、蔬菜种植、批发（不涉及国营贸易管理商品，涉及配额、许可证管理商品的，按国家有关规定办理申请）；生产销售化肥",江苏,南通,"江苏省如东县掘港镇城南工业集中区振兴一路南侧"
东台市粮食购销总公司,91320981142554164H,1993-03-18,N/A,杨琳,"2,086.6000(万元人民币)","粮食收购，粮食、植物油料、饲料批发、零售，普通货物仓储服务，道路普通货物运输",江苏,盐城,"东台市北海中路12号"
宜兴市耐环实业有限公司,320282000019196,1993-03-18,N/A,钱东明,"50(万元人民币)","许可经营项目：无 一般经营项目：环保水处理设备、耐火保温浇注料的制造、销售；水处理环保技术的咨询服务。",江苏,无锡,"宜兴市丁蜀镇大浦张泽村"
江阴市鑫欣制衣有限公司,913202812503427166,1993-03-18,N/A,黄桂珍,"358(万元人民币)","服装的制造、加工；印花；纺织原料（不含籽棉）、纺织品、金属材料、建材、五金塑料、化工产品",江苏,无锡,"江阴市祝塘镇祝陆路"
常熟市巨龙装饰工程有限公司,91320581713207642C,1993-03-18,N/A,姚龙根,"600(万元人民币)","承接室内外装饰装璜工程、建筑装饰装璜材料、汽车配件、家具批发零售、代购代销；钢木家具的制造、加工；家用电器销售。以下经营范围限分支机构经营：住宿、茶水服务；中餐制售；包装副食品、烟、床上用品、日用品零售。",江苏,苏州,"常熟市莫城镇言里村"
响水县金鑫典当有限责任公司,91320921140357896R,1993-03-18,N/A,谭飞,"501.2100(万元人民币)","动产质押典当业务；房地产",江苏,盐城,"响水县城黄海路102号"
常州兰翔机械总厂通海机械厂,91320400137185149U,1993-03-18,集体所有制,吴南生,"5万人民币","摩托车零部件、机械零部件、齿轮制造及加工；摄像服务，日用百货零售。",江苏,常州,"常澄路10号"
常州龙佳工艺品有限公司,913204122509374613,1993-03-18,N/A,徐惠秋,"52(万元人民币)","红木制品、竹木制品制造；机械零部件加工；织布；纺织原料销售。",江苏,常州,"武进区礼嘉镇蒲岸村"
南京起重机械总厂禄口配件厂经营公司,913201061352959931,1993-03-18,集体所有制,毛有飞,"45万人民币","起重机械及配件，五金，机电产品，汽车零部件销售；起重机械设备安装及售后服务。",江苏,南京,"南京市下关区五塘村68-18号"
江苏江安集团有限公司徐州工程处,91320300836482142C,1993-03-19,N/A,徐进,"N/A","工业与民用建设项目的设备、线路、压力管道、电气仪表及其整体生产装置的安装，消防工程、防腐、保温工程",江苏,徐州,"徐州市黄河新村83#楼1-201室"
江苏嘉力电力建设有限公司,91320282250460149J,1993-03-19,N/A,王铁君,"5,280(万元人民币)","按三级资质从事承装（修、试）电力设施业务；按二级资质从事建筑工程施工总承包业务；按三级资质从事电力工程施工总承包业务；按二级资质从事电子与智能化工程专业承包业务；按二级资质从事消防设施工程专业承包业务；按二级资质从事防水防腐保温工程专业承包业务；按二级资质从事建筑装修装饰工程专业承包业务；按三级资质从事输变电工程专业承包业务；不分等级从事特种工程",江苏,无锡,"宜兴经济技术开发区袁桥支路"
南京黎华铝业工程有限公司,913201171352365478,1993-03-19,N/A,杨俊杰,"3,000(万元人民币)","铝塑门窗设计、加工、施工；建筑幕墙工程设计、生产",江苏,南京,"南京市溧水经济开发区"
交通银行股份有限公司苏州高新技术产业开发区支行,91320505713240864A,1993-03-19,N/A,沈玲君,"0(万元人民币)","经营中国银行业监督管理委员会依照有关法律、行政法规和其他规定批准的业务，经营范围以批准文件所列的为准。代理保险业务",江苏,苏州,"苏州高新区狮山路25号"
苏州益友房地产有限公司,913205082516208027,1993-03-19,N/A,黄德明,"5,000(万元人民币)","房地产开发、经营。采购供应建筑材料、金属材料、装饰装璜材料。下设房地产物业管理分公司及房地产中介服务分公司。",江苏,苏州,"苏州市沧浪区竹辉路349号"
常熟市振新房地产开发有限公司,91320581142106126C,1993-03-19,N/A,霍振良,"818(万元人民币)","房地产开发、经营；建筑材料批发、零售。",江苏,苏州,"常熟市碧溪新区（东张）乐苑东路"
南京紫江有线电视器件厂,91320116135727039Y,1993-03-19,国有企业,邓健,"150万人民币","有线电视器件、电子产品生产、销售。",江苏,南京,"南京市六合区龙袍镇龙江路38号"
中油二建苏州兰江工程公司,91320509251300008K,1993-03-19,N/A,周自强,"1,000(万元人民币)","石油、化工设备及配件的设计、制造、建筑安装、工程总包；供应：金属材料（除贵金属）、建材、普通机械、仪器、仪表、润滑油、石蜡、精细化工产品（不含危险品）；制造钢制罐体（I类包装）；自营和代理各类商品及技术的进出口业务",江苏,苏州,"平望镇梅堰社区318国道旁"
南京宁电电力机械配件厂,91320116135727119J,1993-03-19,集体所有制,郭秀兰,"4.5万人民币","铜铝铸件、紧固件、机械零部件制造、销售；令克棒、接地棒加工。",江苏,南京,"南京市六合区程桥镇桂花村寺门组"
泰州市振兴工贸公司,321203000000646,1993-03-19,N/A,刘俊,"55.7000(万元人民币)","建筑材料、钢材、五金交电、机电设备、针纺织品、日用百货",江苏,泰州,"泰州市口岸镇北工业开发小区"
江阴市双达橡胶有限公司,913202812503361723,1993-03-19,N/A,吴秋林,"50.8000(万元人民币)","橡胶制品、橡塑制品的制造、加工。(依法须经批准的项目，经相关部门批准后方可开展经营活动)",江苏,无锡,"江阴市月城镇姚泾村"
扬州市兴武建设有限公司,91321012140811016K,1993-03-19,N/A,俞凤妹,"500(万元人民币)","可承担投资额800万元及以下的一般工业和公共、民用建设项目的设备、线路、管道的安装，非标准钢构件的制作、安装，防腐工程施工，建筑施工",江苏,扬州,"扬州市江都区仙女镇邓院村邓院组"
南通市恒通实业公司,320611000002960,1993-03-19,N/A,孙质君,"289(万元人民币)","摩托车销售及维修。",江苏,南通,"外环西路209号"
常州市能宝物资有限公司,91320412772013581G,1993-03-19,N/A,许龙华,"80(万元人民币)","金属材料、建筑装潢材料销售。",江苏,常州,"武进区湟里镇蒋埝村"
南京溧水白马粮油工贸公司,91320117135784332H,1993-03-19,N/A,孙明熙,"225.7100(万元人民币)","粮食收购；油菜子收购、饲料销售。",江苏,南京,"南京市溧水区白马集镇"
江苏旋力集团股份有限公司,9132050013476783XH,1993-03-19,N/A,戈益明,"9,212.4000(万元人民币)","锅炉钢管、合金钢管、不锈钢管、钢管生产、设计，金属材料、材料、钢管、工业生产资料的销售。自营和代理各类商品和技术的进出口业务。化工原料及产品、纺织原料、针纺织品的制造、销售。*",江苏,苏州,"常熟市通港路98号"
宜兴市丰烨化学有限公司,91320282250460245U,1993-03-19,N/A,张烨,"1,080(万元人民币)","化学医药技术的研发；水处理微生物技术的研发；（SGA）双硬脂酸酰胺环氧丙烷叔胺醋酸盐柔软剂、十二烷基二甲基氯化胺表面活性剂、D638破乳剂、过滤设备、环保设备、净化设备及配件、建筑保温材料、包装制品的制造；消泡剂、聚丙烯酰胺、药品、化工产品及原料（除危险化学品）、环保设备、过滤设备及配件、塑料制品、橡胶制品的销售；食品销售",江苏,无锡,"宜兴市芳桥街道龙眼村"
宜兴市佳达环保设备有限公司,91320282250460376P,1993-03-19,N/A,毕建军,"2,258(万元人民币)","环境污染防治设备、隔音门、通风百叶窗、装配式墙体的制造、安装、销售；环保工程的施工；建筑防火材料、金属材料、塑料制品、玻璃钢制品的销售；道路普通货物运输。",江苏,无锡,"宜兴市高塍镇天生圩村"
无锡富安橡塑有限公司,913202112501087943,1993-03-19,有限责任公司,秦雪梅,"108万人民币","橡塑制品的销售；自营和代理各类商品和技术的进出口业务",江苏,无锡,"无锡市滨湖区胡埭工业园南区环镇北路28号"
江苏秋艳集团有限公司,91320581716817542G,1993-03-19,N/A,潘旭明,"5,000(万元人民币)","服装、针织面料、服装面料、电脑绣花、针纺织呢绒、服装服饰设计、生产、销售；化纤制造、加工、销售；经营本企业自产产品及技术的出口业务；经营本企业生产、科研所需的原辅材料、仪器仪表、机械设备、零配件及技术的进出口业务",江苏,苏州,"常熟市海虞镇"
江阴市A派集团公司,320281000009207,1993-03-20,N/A,程惠宇,"2,500(万元人民币)","电子元件、电子器件、太阳能制品的生产；金属材料、针纺原料",江苏,无锡,"江阴市顾山镇北国张锡路555号"
常州市丰勤塑业有限公司,91320412250875758N,1993-03-20,N/A,沈永耀,"60(万元人民币)","塑料制品制造，化工原料及产品销售。",江苏,常州,"武进区雪堰镇新康村"
新沂市华东建筑工程有限公司,91320381137108004F,1993-03-20,N/A,王士端,"2,108(万元人民币)","土木工程建筑、安装；市政工程施工、园林绿化工程施工；装饰装璜材料、建筑材料批发、零售。",江苏,徐州,"江苏新沂经济开发区北京西路68号"
如皋透平叶片制造有限公司,91320682138639659M,1993-03-20,N/A,陈弢,"2,600(万元人民币)","汽轮机叶片生产；金属切削加工。",江苏,南通,"如皋市搬经镇湖刘村二十一组"
丹阳明盛机械有限公司,913211811424523955,1993-03-20,N/A,马友光,"50(万元人民币)","传动机械、纸包装制品、电热电器材料的生产，电子配件生产、加工，工业炉及配件的制造、修理，热处理加工，自营和代理各类商品及技术的进出口业务。",江苏,镇江,"丹阳市吕城镇运河军民东路"
句容市兴业房地产开发公司,913211837168261155,1993-03-20,N/A,夏强,"800(万元人民币)","房地产经营。水电安装；建筑装璜、建筑材料、五金、交电、金属材料、劳保用品零售兼批发。",江苏,镇江,"句容经济开发区华阳北路国土局5楼"
宜兴鲸皇科技化工有限公司,91320282250488512R,1993-03-20,N/A,吴秀娟,"2,000(万元人民币)","N-甲基二乙醇胺脱硫剂、3，5，6一三氯水杨酸、纳米乳胶涂料、CFA降凝剂、柴油稳定剂、汽油抗爆剂的技术研发、制造；汽、柴油抗静电剂、JH-SL型十六烷值改进剂、JHR-Ⅱ型柴油抗磨剂、化工产品及原料（除危险化学品外）的销售；自营和代理各类商品及技术的进出口业务",江苏,无锡,"宜兴市徐舍镇鲸塘东虹路"
南京通达广告装璜公司,91320100134940575Q,1993-03-20,N/A,张冬林,"40(万元人民币)","设计、制作、代理国内各类广告；室内外装饰设计、施工。",江苏,南京,"南京市鼓楼区湖北路34-1号"
悦达地产集团有限公司,91320991608607986X,1993-03-20,N/A,李彪,"100,000(万元人民币)","商品房开发经营；建材",江苏,盐城,"盐城经济技术开发区希望大道南路5号1幢602室"
江阴市健仕福器械有限公司,913202812503362954,1993-03-20,N/A,刘建文,"1,000(万元人民币)","一类医疗器械",江苏,无锡,"江阴市石庄小坎路48号"
宜兴市永丰加油服务有限公司,91320282250460691B,1993-03-20,N/A,夏木林,"500(万元人民币)","危险化学品经营（按许可证所列范围和方式经营）；食品销售",江苏,无锡,"宜兴市徐舍镇宜丰村"
南京铁路建筑有限公司,91320100134940508T,1993-03-20,N/A,陈平,"1,500(万元人民币)","建筑工程、铁路桥涵工程施工；水电安装；房屋、其他建筑物维修和产权产籍管理；室内外装饰、装潢；工程设计、咨询服务；给排水设备维修；房屋租赁、经纪；彩铝及塑料门窗生产、销售、安装；土石方工程；承接旧房屋、建筑物拆迁；铁路沿线造林、育林；园林绿化设计、施工、养护；花卉苗木生产、销售、租赁；建筑材料、装饰材料、园林机械、园林材料、矿产品销售；仓储服务；托运货物；白蚁灭治；物业管理。",江苏,南京,"南京市鼓楼区城河路69号"
南通市电站阀门有限公司,91320682138594948A,1993-03-21,N/A,姚统,"5,100(万元人民币)","电站阀门、电站辅机制造、销售；阀门检修；发电机组配件、发电成套设备销售；电站阀门生产技术研究、开发、转让、咨询服务；自营和代理各类商品和技术的进出口业务",江苏,南通,"如皋经济开发区盾安路1号"
如皋市龙飞电器制造有限公司,913206821385936899,1993-03-21,有限责任公司,陈葛菲,"550.08万人民币","高低压电器、低压成套电器、起重机械、印刷机械、钢木制品加工、销售；电镀。",江苏,南通,"如城镇庆余东路200号"
徐州市服务公司,91320302136496527J,1993-03-21,N/A,张尊刚,"54.2000(万元人民币)","企业经营管理、百货、非酒精饮料、干鲜果品零售、批发；房地产中介和代办证照",江苏,徐州,"淮海东路29号"
