天津滨海规划建筑设计有限公司,91120116239695203G,1995-10-06,N/A,李维新,"800(万元人民币)","工业与民用建筑设计、技术咨询；规划设计；室内外装饰设计；园林设计；建筑工程代理；工程质量监理；施工图设计文件审查；工程概预算；工程造价评估；工程项目总承包；物业管理。",天津,滨海,"天津经济技术开发区第二大街7号楼12层"
天津市宗源市场信息咨询有限责任公司,911201066007008795,1995-10-08,N/A,彭金福,"50(万元人民币)","市场调查研究；市场信息咨询(不含中介)；营销策划。",天津,红桥,"红桥区泉春里11-1-1401"
天津市滨海新区广发房屋拆迁有限公司,911201161036597210,1995-10-09,N/A,马长民,"3,150(万元人民币)","房屋拆迁、搬家；建筑材料批发零售。",天津,滨海,"天津市滨海新区塘沽大连道七号"
天津市津亚地毯有限公司,91120222600790763U,1995-10-09,N/A,马立新,"100(万元人民币)","地毯制造、底子布制造、服装加工、毛纺织、橡胶制品加工。",天津,武清,"武清区崔黄口镇幌刘庄"
天津市贯通汽车修理有限公司,911201102393004272,1995-10-09,N/A,印晓伟,"50(万元人民币)","小型客车整车修理、总成修理、整车维护、小修、维修救援、专项修理；汽车配件销售。",天津,东丽,"天津市东丽区新立街东杨场村村委会"
天津开发区爱达美工制作有限公司,91120116239695318N,1995-10-09,N/A,郭亚洲,"30(万元人民币)","文化用品设计、制作、美工创意、小型礼品制作。",天津,滨海,"天津开发区洞庭路131号"
天津开发区大德科技发展有限公司,91120116722958931Y,1995-10-10,N/A,刘宝林,"1,035(万元人民币)","计算机及软件开发；汽车配件技术开发、转让、服务；清洁消毒服务；灶具、建材、木材、炉料、电梯及电梯配件、汽车配件、计算机软硬件的销售；金属模型的技术开发、技术转让、技术咨询；以下限分支机构经营：灶具制造；金属模型制作；汽车配件制造。",天津,河西,"天津市河西区宾馆南道19号2楼206室"
天津市津东东明塑胶制品有限公司,911201106007429138,1995-10-10,N/A,梁治家,"50(万元人民币)","注塑制品制造、加工；木材、石材、金属结构件加工；室内外装饰；铝合金制品制造；机电维修；木材批发兼零售。(经营范围中涉及国家有专项、专营规定的，按规定执行)",天津,东丽,"东丽区武警医学院基地对过"
天津市市场建设发展有限公司,91120116239695377R,1995-10-10,N/A,郑发军,"280(万元人民币)","五交化产品",天津,滨海,"天津开发区欣园新村８门１０２室"
天津市天珩染织有限公司,91120104600685082M,1995-10-10,N/A,贾静麒,"50(万元人民币)","销售：纺织品、服装；零售兼批发：纺织品、五金（除消防器材）、交电",天津,南开,"天津市南开区长江道48号"
天津欧波精密仪器股份有限公司,91120116600892348Q,1995-10-11,N/A,金殿禄,"6,000(万元人民币)","生产、销售精密测量仪器及附件",天津,南开,"天津市南开区科研东路8号"
天津市新天马企业发展有限公司自选商场,91120103803319197M,1995-10-11,N/A,郭佳,"N/A","预包装食品、散装食品、日用百货、电工器材批发兼零售。",天津,河西,"河西区佟楼向荣里18门113、114室"
天津市希望房地产建设开发有限公司,9112010523969549XP,1995-10-11,N/A,张健,"3,000(万元人民币)","房地产开发及商品房销售、商品房租赁、房地产信息咨询；家具制造；家具、装饰装修材料、五金、交电、化工",天津,河北,"河北区王串场一号路康乐道清水园201(王串场街内)"
天津中豪房地产有限公司,9112011623969565XW,1995-10-11,N/A,袁其伟,"3,000(万元人民币)","房地产开发及商品房销售；物业管理；咨询服务。国家有专营、专项规定的按专营专项规定办理。",天津,滨海,"天津开发区晓园新村３０号楼一栋二层"
天津市烟草公司第三分公司,911201068035569428,1995-10-11,N/A,赵华国,"N/A","卷烟及制品。",天津,红桥,"红桥区子牙桥北西侧（勤俭道194号）"
天津津滨造纸有限责任公司,911200001030684466,1995-10-12,N/A,于志丹,"66,500(万元人民币)","机制纸、加工纸及纸制品的制造和制浆造纸设备、造纸原料的销售；机械设备（含制浆造纸设备）的租赁；房产租赁、信息咨询；物业管理；木制品生产加工；轻工、化工产品、建筑材料、钢材销售；劳务服务（以上经营范围涉及行业许可的凭许可证件，在有效期内经营，国家有专项专营规定的按规定办理）",天津,滨海,"天津经济技术开发区第一大街2号"
吉得泰(天津)电子工业有限公司,911201166008922760,1995-10-12,N/A,董继福,"275(万美元)","研制、生产、销售、高科技电路板以及相关的电子产品及相关的技术服务；国际贸易；简单加工",天津,保税区,"天津港保税区海滨八路118号A217"
中国农业银行股份有限公司天津四平道支行,91120101700475023M,1995-10-12,N/A,张军,"N/A","人民币存款、贷款及结算业务；办理票据贴现；代理发行金融债券；代理发行；代理兑付、销售政府债券；买卖政府债券；代理收付款项；外汇存款、外汇汇款，其总行在中国人民银行批准的业务范围；经中国人民银行批准的其他业务。",天津,和平,"天津市和平区四平西道11号"
京登威国际贸易(天津)有限公司,91120116600892305B,1995-10-12,N/A,周武霖,"50(万美元)","国际贸易，简单加工，高科技产品的生产开发，装饰装修咨询（依法须经批准的项目，经相关部门批准后方可开展经营活动）",天津,保税区,"天津自贸区（天津港保税区）海滨三路97号（物流园区内）302室"
天津港保税区迈佳伦万国机械设备销售有限公司,911201162396611262,1995-10-12,N/A,吴瑛,"90(万元人民币)","机械设备的销售；进口及国产汽车配件、汽车维修设备工具、仪器的经营；国际贸易；以上相关咨询服务（依法须经批准的项目，经相关部门批准后方可开展经营活动）",天津,保税区,"天津港保税区天保大道135号"
天津市众林工贸有限公司,911201042388216187,1995-10-13,N/A,刘中麟,"50(万元人民币)","加工（限分支经营）：机械设备；批发兼零售：金属材料、民用建材、五金交电、化工商品（危险品及易制毒品除外）、百货、日用杂品",天津,南开,"南开区临潼路116号"
天津中油渤星工程科技有限公司,91120116722991141Y,1995-10-13,N/A,宋有胜,"5,500(万元人民币)","水泥外加剂、钻井液材料、防腐材料、保温材料、筑路材料、建筑涂料的生产、销售；固井工程、管道防腐保温工程及旧管道修复工程；技术开发、技术咨询、技术服务、工程服务及相关产品的销售；建筑安装与施工、岩土及桩基工程；经营本企业自产产品的出口业务和本企业所需的机械设备、零配件、原辅材料的进口业务",天津,滨海,"天津滨海高新区塘沽海洋科技园黄山道269号"
天津特种包装机械有限公司,91120116239695609R,1995-10-13,N/A,孙立达,"1,000(万元人民币)","包装机械及相关机械产品的开发、咨询、加工及制造；机电设备、五金、百货、计算机批发兼零售；自营和代理货物及技术进出口；自有房屋租赁",天津,自贸区,"天津自贸试验区（空港经济区）中心大道557号"
天津市立鑫晟精细铸造有限公司,911202231041887060,1995-10-16,N/A,石卫东,"500(万元人民币)","铸件制造；机加工；货物进出口、技术进出口",天津,静海,"静海县良王庄乡良二村"
天津市北辰区康明医疗器材厂,91120113239429917U,1995-10-16,集体所有制,郎建玲,"15万人民币","手摇病床、骨科牵引床制造；金属床制造、金属文件柜加工、铆焊加工。",天津,北辰,"北辰区双街乡沙庄村"
天津大洋实业发展有限公司,911201166008923991,1995-10-16,N/A,刘彤,"2,000(万元人民币)","日用百货、五金交电、办公用品、体育用品、服装鞋帽的批发兼零售；商品展销；国际贸易；保税仓储；简单加工；照相冲扩；自有场地出租；以上相关咨询服务（依法须经批准的项目，经相关部门批准后方可开展经营活动）",天津,自贸区,"天津自贸试验区（空港经济区）保航路1号航空产业支持中心645D29房间"
天津大良晟驰工程技术股份有限公司,91120116600685568Y,1995-10-17,N/A,陈文颖,"500(万元人民币)","技术开发、咨询、服务、转让（电子信息的技术及产品）；计算机及外围设备、文化体育用品",天津,西青,"天津市滨海高新区华苑产业区（环外）海泰发展六道3号星企一号园区研发楼633-1"
天津市义林强工贸有限公司,91120112600761065M,1995-10-17,N/A,张庆林,"151(万元人民币)","紧固件(双头螺栓)制造、销售；机加工；金属表面处理",天津,津南,"天津市津南区辛庄镇中辛庄村"
国网天津市电力公司城西供电分公司,9112010480341053XA,1995-10-17,N/A,殷军,"N/A","电力销售；电力工程。",天津,南开,"南开区红旗路278号"
中国农业银行股份有限公司天津金耀支行,91120101681851731H,1995-10-17,N/A,马鸣,"N/A","人民币存、贷款及结算业务；其总行在中国银行业监督管理委员会批准的业务范围内授权的业务；经中国银行业监督管理委员会批准的其他业务。",天津,和平,"天津市和平区南门外大街9号滨江金耀广场底商"
天津市孚润得科工贸有限公司,91120104600685509F,1995-10-17,N/A,李妍玲,"30(万元人民币)","新材料、机电一体化技术及产品的开发、咨询、服务、转让；五金、交电、化工",天津,南开,"天津市南开区红旗路112号(科技园"
天津市东丽区城文木器加工厂,91120110X00742151X,1995-10-17,个人独资企业,宗伟,"N/A","木箱、起重配件、铁活毛坯机加工经营；金属材料、建筑材料、五金交电、电线电缆、机电设备、水暖器材、劳保用品、日用百货、电子产品、文化用品、体育用品、化工产品（化学危险品及易制毒品除外）、塑料制品、针纺织品、家具批发兼零售；劳务服务",天津,东丽,"天津市东丽区新立街城上村"
天津隆达复合包装制品有限公司,91120223600892380D,1995-10-17,N/A,闫家骥,"70(万美元)","生产，加工，销售各类中、高档塑料复合包装材料及相关印刷品",天津,静海,"天津市静海县唐官屯镇靳官屯村"
天津港保税区鑫益程国际工贸有限公司,91120116239661134W,1995-10-18,N/A,程涛,"500(万元人民币)","代办货物仓储；装卸服务，吊装、搬运服务；设备安装，国际货物运输代理服务（海、陆、空运）；自有设备租赁；普通货运、货物专用运输（集装箱）；保税仓储；自有房屋租赁；汽车的经营；商品展销；国际贸易；预包装食品的批发（依法须经批准的项目，经相关部门批准后方可开展经营活动）",天津,保税区,"天津自贸区(天津港保税区)东方大道138号"
天津市津瑞广告装饰工程有限公司,91120101238821757J,1995-10-18,N/A,缪津勇,"50(万元人民币)","服务：设计、制作、发布印刷品、灯箱、路牌、摄影、实物馈赠广告；摄影、照相器材设备修理；室内外装修、装饰（凭资质证经营）；机械设备安装、展览展示、计算机技术咨询、技术培训",天津,和平,"天津市和平区哈尔滨道18号907、910、911"
天津晶明新技术开发有限公司,91120116600834404X,1995-10-18,N/A,徐轶群,"100(万元人民币)","生物技术（不含药品的生产与销售）的开发、转让、咨询、中介；软件开发；医疗器械制造（按许可证核定的项目和期限经营）；五金、交电、化工",天津,西青,"天津市华苑产业区海泰发展六道6号海泰绿色产业基地K2座8门401室"
天津鸿立转印制品有限公司天津分公司,91120000MA05W6096J,1995-10-19,N/A,刘松,"N/A","销售本公司生产的产品",天津,河北,"天津市河北区中山路33号"
天津金兰纸业发展有限公司市内办事处,91120000MA05U32142,1995-10-19,N/A,张大钧,"N/A","负责本公司经营范围内的咨询与联络",天津,N/A,"N/A"
天津昌逸投资有限公司,911201162396958877,1995-10-19,N/A,王育英,"1,000(万元人民币)","国内外投资咨询服务及代理、行业等级评估；钢材、装饰材料、五金、机械电子设备、纺织品、工艺品批发兼零售；利用自有资金对商品制造业投资；商品信息咨询服务；焦炭经营；房屋中介服务；矿产品（国家专控、专管项目除外）、服装批发兼零售；货物进出口、技术进出口；食品销售",天津,河西,"天津市河西区友谊北路51号合众大厦B座1602室"
天津市津南区咸水沽建筑工程公司第四分公司,91120112803866967Y,1995-10-20,N/A,李庆文,"N/A","土木工程建筑。",天津,津南,"津南区咸水沽镇红旗路南头"
宝川国际运输有限公司天津办事处,91120000MA05W4007X,1995-10-20,N/A,王文涛,"N/A","负责本公司经营范围内的咨询与联络",天津,河西,"天津市河西区徐州道1号增1号利航宾馆415室"
天津市宝坻区口东乡鹏辉塑料制品厂,92120224MA0667WQ0X,1995-10-20,个体工商户,刘成,"N/A","塑料制品产销；普通货运。",天津,宝坻,"宝坻区口东镇东辛庄"
天津宝洁工业有限公司,91120111600892567T,1995-10-20,N/A,马睿思（Matthew Stuart Price）,"154,907.6158(万元人民币)","生产、加工液体洗衣用品、纤维柔顺剂和洗涤用品、个人清洁用品和洗发、护发用品、护肤用品、化妆品、抗菌制剂（液体）、抑菌制剂（液体）及其相关原料和包装物料；销售自产产品；从事相关商务服务包括咨询服务、业务协助、业务支援等；从事日用品相关生产设备和零部备件、配件、原材料、包装物料和半成品的进出口、批发业务、佣金代理",天津,西青,"天津市西青区经济开发小区兴华七支路12号"
天津市花都温泉宾馆有限公司,911201101037800974,1995-10-23,N/A,刘俊起,"600(万元人民币)","住宿、公共浴室",天津,东丽,"天津市东丽经济开发区"
天津永顺水泥制品厂,92120225MA05XDUU3X,1995-10-23,个体工商户,莫永顺,"N/A","水泥制品：制造。",天津,蓟州,"大杨各庄"
天津开发区盛运贸易货运有限公司,911201166008345787,1995-10-23,N/A,李炳盛,"500(万元人民币)","信息咨询；中介服务；家居装饰；国际货运代理服务",天津,滨海,"天津开发区海晶游乐城Ａ－２０６－２室"
天津川港国际货运代理有限公司,91120116600833049K,1995-10-23,N/A,张方海,"550(万元人民币)","货运代理；信息咨询；海上、航空、陆路国际货运代理（包括揽货、订舱、中转、集装箱拼装拆箱、结算运杂费、报检、报关、代办保险）；代理国际快递",天津,滨海,"天津开发区第三大街宏达路11号2号楼7门802室"
天津利益水力资源开发有限公司,91120103103378639R,1995-10-23,N/A,李小城,"100(万元人民币)","水力资源开发及利用；地热供暖技术开发；室内外装修装饰；配电柜制作；监控系统工程；城市道路、体育场馆照明及机电设备安装工程；绿地管理服务；音响设备、五金交电、水暖配件批发兼零售；物业管理；建筑工程施工；劳动服务；地热水销售",天津,河西,"河西区挂甲寺二中法北侧"
天津市佳顺商贸有限公司,911201031033786122,1995-10-23,N/A,刘汝钢,"149(万元人民币)","食品销售（取得经营许可后方可经营）；日用杂品、针纺织品、日用百货、服装、鞋帽、文具体育用品、五金、交电、化工（不含危险品）批发兼零售；卷烟零售；货物及技术进出口业务",天津,河西,"河西区卫津南路3号"
天津神鹿能源有限公司,91120110586432862F,1995-10-23,N/A,包启发,"10,000(万元人民币)","生产锂离子电池；开发、销售锂离子电池；销售电动车辆、智能微电网相关设备和软件、电源、充电设备、工艺品；锂离子电池管理系统、新型能源材料的技术开发、技术转让、技术咨询、技术服务；从事国家法律法规允许经营的进出口业务。",天津,东丽,"天津市东丽区华明大道22号第15号厂房"
中国银行股份有限公司天津迎水道支行,91120104741379839T,1995-10-25,N/A,曲丹,"N/A","1、人民币业务：办理人民币存款、贷款、结算业务；人民币信用卡业务；办理票据贴现；代理兑付、销售政府债券；代理收付款项及代理保险业务；2、外汇业务：外汇存款；外汇贷款；外汇汇款；外币兑换；国际结算；结汇、售汇；通过上级行办理代客外汇买卖；代理国外信用卡付款；3、总行在银监会批准的业务范围内授权的其它业务。",天津,南开,"天津市南开区迎水道22号增2号"
天津市欧瑞特商贸有限公司,911201031033786715,1995-10-25,N/A,葛永堂,"30(万元人民币)","五金交电化工",天津,河西,"河西区吴家窑大街佛山里41栋楼旁平房"
中国银行股份有限公司天津北辰支行,91120113803926325L,1995-10-25,N/A,张立波,"N/A","1、人民币业务：办理人民币存款、贷款、结算业务；办理票据贴现；代理兑付、销售政府债券；代理收付款项及代理保险业务；人民币信用卡业务；2、外汇业务：外汇存款；外汇贷款；外汇汇款；外币兑换；国际结算；外汇票据的承兑和贴现；结汇、售汇；通过上级行办理代客外汇买卖；外汇信用卡的发行；代理国外信用卡的发行及付款；资信调查、咨询、见证业务；3、总行在银监会批准的业务范围内授权其它的业务。",天津,北辰,"北辰区京津公路370号"
国网天津市电力公司东丽供电分公司,91120110803734649W,1995-10-25,N/A,郭铁军,"N/A","电力销售.电力咨询.电力设备修理.电力工程.",天津,东丽,"天津市东丽区先锋路"
中远散货运输有限公司,911201161011665951,1995-10-26,N/A,张治平,"629,000(万元人民币)","国际海上杂散货运输，揽货、订舱、租船，租赁、建造、买卖船舶以及与海运业务有关的船舶燃物料、伙食供应及其相关业务；国内沿海、长江中下游普通货船运输；国际贸易；国际船舶管理业务；国内沿海散货船海务、机务管理和安全与防污染管理；为外国籍或港澳台地区籍海船提供配员，代理外派海员办理申请培训、考试及申领相关证书（依法须经批准的项目，经相关部门批准后方可开展经营活动）",天津,自贸区,"天津自贸试验区(空港经济区)中心大道与东七路交口远航商务中心12号楼"
天津津强岩土工程有限公司,91120116239696193B,1995-10-26,N/A,贾旭,"5,800(万元人民币)","岩土工程勘察设计；岩土工程治理，包括桩基施工及地基处理；建筑基础工程施工；建筑材料、装饰材料批发兼零售；咨询服务；建筑安装、道路基础工程、建筑安装工程总承包；中介服务；土石方工程施工。",天津,滨海,"天津开发区翠园别墅16号楼"
天津市新时创科技发展有限公司,91120101600658631J,1995-10-26,N/A,王毅,"200(万元人民币)","电子与信息、机电一体化技术与产品、计算机软件技术的开发、转让、咨询、服务；计算机软、硬件维护；计算机网络设备调试、安装；计算机网络布线服务、图文设计；安防工程设计、施工。文化办公用品机械、计算机、计算机配套设备、制冷空调设备、电器设备、仪器仪表、金属材料、建筑材料、五金交电、百货、橡胶制品、乐器、音响设备批发兼零售。图书、报纸、期刊零售。",天津,和平,"天津市和平区卫津路149号云琅新居A座2门102室"
日兴(天津)国际贸易有限公司,9112011660089268XY,1995-10-26,N/A,陈静,"20(万美元)","国际贸易及相关的简单加工，高科技产品的开发和销售，咨询服务（依法须经批准的项目，经相关部门批准后方可开展经营活动）",天津,保税区,"天津自贸区（天津港保税区）海滨八路118号1-306室"
明联(天津)国际工贸有限公司,911201166008926717,1995-10-26,N/A,王东路,"20(万美元)","国际贸易及相关的简单加工，代办保税货物的仓储及相关服务，商品展示，高科技产品的研制与开发，经济技术咨询服务",天津,保税区,"天津港保税区海滨八路88号924"
天津开发区恒丰广告有限公司,91120116600830892T,1995-10-26,N/A,仝津超,"60(万元人民币)","设计、制作、发布、代理国内广告业务；五金、交电、化工",天津,滨海,"天津开发区恂园里36号二楼201号"
天津市岐钢钢铁贸易有限公司,911201137129372992,1995-10-26,N/A,许利元,"1,800(万元人民币)","金属材料、木材、化工轻工材料（危险化学品、易制毒品除外）零售兼批发；仓储",天津,北辰,"天津市北辰科技园区内(宜兴埠)"
天津市泰新办公设备新技术有限公司,91120101600653881Y,1995-10-29,N/A,侯惠强,"30(万元人民币)","零售兼批发：计算机软硬件及配套设备、五金交电、百货、印刷机械设备、制冷设备、机电产品（轿车除外）、装饰材料、工艺美术品",天津,和平,"和平区陕西路44号"
天津市中拓信商贸有限公司,91120104600653769B,1995-10-29,N/A,于娟,"520(万元人民币)","批发兼零售：服饰、服装、皮革制品、日用百货、文化办公用品、工艺美术品（金银饰品除外）、装饰装修材料、日用杂品、五金、交电、化工（易燃易爆易制毒化学品除外）、珠宝首饰（金银饰品限零售）；生产加工",天津,南开,"天津市南开区南丰路60号西湖道31号院内世新政江电子商场B座三层310号"
天津祥利机电轴承科贸有限公司,91120101239696222Y,1995-10-30,N/A,邢红哲,"50(万元人民币)","塑料制品、五金、交电、化工商品",天津,和平,"和平区解放北路72号津工大厦603室"
天津肯德基有限公司滨海餐厅,91120116X00509923K,1995-10-30,N/A,陆崇,"N/A","经营中西餐饮、制作各式餐厅食品和冷热饮料、酒类零售；预包装食品，图书、报刊、电子出版物的批发兼零售，预付卡销售，出售相关促销产品",天津,滨海,"天津市滨海新区塘沽上海道94号滨海商贸大世界A座"
天津市信九电子有限公司,911201046008625444,1995-10-30,N/A,王岁巧,"1,000(万元人民币)","技术开发、咨询服务；测温材料及元件、精密合金材料及元件、助听器、电子电器制造、销售；零售兼批发：电线、电缆、机械配件、金属材料、工艺美术品",天津,南开,"天津市南开区冶金路20号"
天津市鹰力制衣有限公司,91120112700588060E,1995-10-30,N/A,徐忠苓,"412(万元人民币)","服装制造 、加工、 销售； 服装辅料；经营本企业自产产品及技术的出口业务和本企业所需的机械设备、零配件、原辅材料及技术的进口业务，但国家限定公司经营或禁止进出口的商品及技术除外；炼钢辅料（危险化学品及易制毒品除外）、增发剂",天津,津南,"天津市津南区葛沽镇服装村"
天津市蓟县华龙化工有限公司,91120225600820678E,1995-10-31,N/A,张振宇,"50(万元人民币)","石蜡、润滑油、沥清制造；废旧能源回收再生技术与产品研发；废旧物资回收",天津,蓟州,"蓟县尤古庄乡邓各庄"
中国银行股份有限公司天津武清开发区支行,91120222741377809G,1995-10-31,N/A,杨春旺,"N/A","办理人民币存款、贷款、结算业务，人民币信用卡业务，办理票据贴现，代理兑付、销售政府债券，代理收付款项，外汇存款，外汇贷款，外汇汇款，外币兑换，国际结算，通过上级行办理代客外汇买卖，代理国外信用卡付款，总行在银监会批准的业务范围内授权的其它业务，结汇、售汇，保险兼业代理业务",天津,武清,"天津市武清开发区福源道北侧金融商务楼1-105"
天津泰仑工贸有限公司,91120102600712861P,1995-11-01,N/A,陈云亮,"30(万元人民币)","建筑材料、化工产品（易燃、易爆、易制毒品除外）、装饰材料、五金电料、家用电器、汽车配件、计算机、润滑油、日用百货、土产杂品、服装、金属材料、办公用品零售兼批发；服装加工",天津,河东,"天津市河东区卫国道翠阜新村翠荫里2-2-商店7-1"
天津宏浩传媒文化发展有限公司,91120116600720546N,1995-11-01,N/A,李金玲,"152(万元人民币)","设计、制作、发布、代理国内各类广告；五金交电、百货销售；室内外装饰；电器维修；电话卡销售；礼仪服务；通讯器材；企业商务服务；广播电视节目制作。",天津,滨海,"天津市滨海新区汉沽新开中路80号"
天津皇富车料有限公司,91120111600892903Y,1995-11-02,N/A,王庆诚,"50(万美元)","生产、销售自行车零部件",天津,西青,"天津市西青区西横堤玉门路28号"
