天津市龙盛达科工贸开发有限公司,911201102392806491,1995-06-19,N/A,商印文,"50(万元人民币)","物资供销、纸张批发兼零售；清洗剂、冷却剂制造加工；劳务服务；橡胶制品、特种密封材料、五金工具（手动工具）、机电产品",天津,东丽,"驯海路"
天津市普特起重设备有限公司,91120112600760679X,1995-06-19,N/A,赵玉恒,"60(万元人民币)","起重设备配套、配件、摩托车配件、机加工、金属结构制造加工；起重设备安装、维修。",天津,津南,"天津市津南区双港镇桃源沽村"
天津市思顺达化工有限公司,91120110239280665N,1995-06-19,N/A,张扬,"35(万元人民币)","工业生产用三类1项低闪点液体、三类2项中闪点液体、三类3项高闪点液体、八类1项酸性腐蚀品、八类2项碱性腐蚀品（剧毒、监控、一类易制毒化学品除外）批发",天津,东丽,"天津市东丽区万新街成林道万新庄供销合作社院内106室"
天津市瑞祥化学试剂有限公司,91120105239690218Y,1995-06-19,N/A,王瑞祥,"30(万元人民币)","化工批发",天津,河北,"天津市河北区新大路189号B座3楼319"
天津锦江装饰工程有限公司,911201166008881380,1995-06-20,N/A,关蒙蒙,"1,200(万元人民币)","室内外装饰工程、机电安装工程的施工及相关咨询服务；建材、家具、五金、文化体育用品及器材、纺织品、服装及日用品的批发；室内外装修材料、五金的零售（不设店铺）；雪茄配饰的零售",天津,滨海,"天津经济技术开发区欣园小区一号"
天津毕升印刷制品有限公司市内办事处,91120000MA05U8875H,1995-06-20,N/A,宇万福,"N/A","负责本公司经营范围内的咨询与联络",天津,红桥,"天津市红桥区估衣街189号"
天津市天扬电镀技术工程有限公司,911201166006834905,1995-06-20,N/A,杨智勇,"220(万元人民币)","机电一体化、电子与信息、新材料、能源技术及产品的开发、咨询、服务、转让；五金、交电、汽车配件、化工产品",天津,南开,"天津市南开区雅安道资阳路5号南开工业园A座B栋三层（科技园）"
天津市巴博房地产开发有限公司,911201021032728349,1995-06-20,N/A,李亚伦,"3,000(万元人民币)","房地产开发、销售、物业管理、装饰及售后服务、咨询",天津,南开,"天津市南开区士英路9号居祥西里1号楼4门601室"
天津市林海实业有限公司,91120222600790827R,1995-06-20,N/A,刘树广,"1,000(万元人民币)","胶合板、人造板制造，木制品",天津,武清,"天津市武清区黄庄街小王村路2号"
天津汽车工业交通出租车销售有限公司,91120103103376000A,1995-06-20,N/A,张文武,"1,000(万元人民币)","汽车及配件、汽车装具批发兼零售、小轿车销售；商品储存；汽车底盘、机电设备及其配件、仪器仪表、炉料、钢材、有色金属、建筑材料、木材、化工（危险品、易制毒品除外）销售；劳务服务、商品信息咨询服务、旧机动车交易、汽车租赁、房屋租赁；保险兼业代理：财产损失保险、短期健康保险和意外伤害保险、责任保险；小型客车整车修理、总成修理、整车维护、小修、维修救援、专项修理、维修竣工检验",天津,河西,"河西区台儿庄路40号"
天津第一饭店有限公司汽车队,91120101X00507776G,1995-06-20,N/A,王建,"N/A","汽车出租",天津,和平,"天津市和平区解放北路198号"
天津市联谊市政建设有限公司,911201012388190593,1995-06-21,N/A,王鹏,"2,177(万元人民币)","市政工程建筑安装施工、线路管道安装、信息咨询服务（不含中介）；建筑材料、五金、化工",天津,和平,"天津市和平区卫津路149号云琅新居B-2-102"
天津市大陆制氢设备有限公司,91120223239076680P,1995-06-21,N/A,赵迎春,"3,000(万元人民币)","制氢设备制造；制氢站设计、制氢设备安装、制氢设备技术咨询服务",天津,静海,"天津市静海区天宇科技园泰安路1号"
天津三方科技工程有限公司,911201162396903814,1995-06-21,N/A,朱泽林,"30(万元人民币)","光机电一体化技术及产品的开发、咨询、服务、转让；五金、交电、化工",天津,南开,"天津市南开区鞍山西道445号兴科大厦510室（科技园）"
天津市津协建筑安装工程有限公司,91120222239131766Y,1995-06-23,N/A,李学良,"16,000(万元人民币)","房屋建筑工程、室内外装饰装修工程、桥梁工程、内外墙保温工程、消防工程、防水防腐工程、线路管道工程、水利工程、土石方工程、地基与基础工程、建筑智能化工程、钢结构工程、市政道路工程、园林绿化工程施工，门窗安装，劳动服务，机械设备、起重设备、空调安装、租赁、维修。",天津,武清,"武清区石各庄"
天津深基工程有限公司,91120103103375868F,1995-06-23,N/A,周跃平,"6,020(万元人民币)","土木工程建筑；地基基础工程施工；港口码头工程施工；建筑技术、转让、服务；机械设备租赁。",天津,河西,"河西区大沽南路1472号"
天津市方华科贸有限公司,911201042389946312,1995-06-23,N/A,宋桂凤,"48.5000(万元人民币)","机电一体化、电子与信息、新材料技术及产品的开发、咨询、服务、转让；文化办公用机械、橡胶原料、橡胶制品、金属材料、金属包装制品、仪器仪表、化工",天津,南开,"天津市南开区鞍山西道338号2507（科技园）"
天津惠航拼箱货运有限公司,91120116239690576X,1995-06-23,N/A,郭丹丹,"650(万元人民币)","承接拆装集装箱业务、代理陆运海运业务、代办组织货源及相关的商务咨询服务；旅游用品生产、销售；五金、交电、化工商品（易燃、易爆、易致毒危险品除外）、百货、机电设备、金属材料、建材、针纺织品、土产品批发兼零售；中介服务；自营和代理各类商品及技术的进出口业务，但国家限定公司经营和禁止进出口的商品及技术除外；经营进料加工和“三来一补”业务；经营对销贸易和转口贸易；自有房屋租赁；国际货物运输代理；展览展示服务、会议服务、礼仪庆典服务、企业形象策划；从事企业中华人民共和国港口货物运输的无船承运业务",天津,滨海,"天津开发区新港四号路136号"
天津市施迪欧科技发展有限公司,9112011623899464X6,1995-06-23,N/A,曲刚,"120(万元人民币)","技术开发、咨询、服务、转让（新材料、电子与信息、机电一体化的技术及产品）；五金、交电、化工",天津,西青,"华苑产业区海泰绿色产业基地F座2门301-6室"
天津市亚博科技发展有限公司,911201042389946237,1995-06-23,N/A,冯雅春,"100(万元人民币)","新材料、机电一体化、电子与信息、能源技术及产品的开发、咨询、服务、转让；汽车配件、摩托车配件、润滑油脂、汽车装俱、交电、水处理设备、汽车节油器、预包装食品批发兼零售；电线、水处理设备制造。",天津,南开,"天津市南开区苏堤路41号（科技园）"
华金期货有限公司,911200001000221354,1995-06-26,N/A,李微欢,"60,000(万元人民币)","商品期货经纪、金融期货经纪、资产管理。",天津,和平,"天津市和平区五大道街南京路183号世纪都会商厦办公楼22层2203-2207室"
天津明星实业有限公司,9112022410422966XH,1995-06-26,N/A,陈建华,"100(万元人民币)","渔具、鞋、服装（制造）；针、纺织品面料涂层；民用五金、建筑材料、机电产品",天津,宝坻,"天津市宝坻区大口屯镇津围路东侧"
天津市佳信达彩印包装有限公司,91120101239690656R,1995-06-26,N/A,张顺利,"50(万元人民币)","服务：包装装潢印刷品印刷、其他印刷品印刷、电脑图文设计制作打样、机电设备安装维修；批发兼零售：印刷设备及材料、纸制品、五金交电、百货、服装。",天津,和平,"天津市和平区电台道香榭里6号楼B座201-203"
中国农业银行股份有限公司天津西青道支行,911201067440024206,1995-06-26,N/A,左敏,"N/A","办理人民币存款、贷款、结算业务；办理票据贴现；代理发行金融债券；代理发行、代理兑付、销售政府债券；买卖政府债券；代理收付款项；外汇存款、外汇贷款、外汇汇款、外币兑换；资信调查、咨询见证业务；办理其总行在中国银行业监督管理委员会批准的业务范围内授权的业务；经中国银行业监督管理委员会批准的其他业务。",天津,红桥,"红桥区西青道仁爱花园1号楼前商场101"
中国银行股份有限公司天津东方红路支行,911202237491042077,1995-06-26,N/A,李菲菲,"N/A","人民币业务：办理人民币存款、贷款、结算业务；人民币信用卡业务；办理票据贴现；代理兑付、销售政府债券；代理收付款项及代理保险业务。外汇业务：外汇存款；外汇贷款；外汇汇款；外币兑付；国际结算；结汇、售汇；通过上级行办理代客外汇买卖；代理国外信用卡付款。总行在银监会批准的业务范围内授权的其他业务。",天津,静海,"天津市静海县静海镇东城区永明里1号楼"
天津长芦海晶集团有限公司,9112000010306826X4,1995-06-26,N/A,张维忠,"90,000(万元人民币)","海盐开采、销售；泡菜盐、腌制盐、食用盐、多品种盐、低钠盐生产、销售；化工产品生产、销售（危化品、剧毒品、易制毒品除外）；聚酰胺切片（锦纶6切片）生产、销售；己内酰胺的销售及进出口业务；锦纶6纤维纺丝生产、销售；树脂、工程塑料及其辅助原料生产、销售、研发和技术服务；采盐机械、化工设备制造；货物运输；海水养殖；企业经营本企业自产产品及相关技术的出口业务；经营本企业生产、科研所需的原辅材料、机械设备、仪器仪表、零配件及相关技术进口业务；仓储",天津,滨海,"天津市滨海新区塘沽营口道1088号"
中国银行股份有限公司天津大邱庄支行,91120223749104178U,1995-06-26,N/A,吴宝泉,"N/A","人民币业务:办理人民币存款、贷款、结算业务；人民币信用卡业务；办理票据贴现；代理兑付、销售政府债券；代理收付款项及代理保险业务。外汇业务：外汇存款；外汇贷款；外汇汇款；外币兑换；国际结算；结汇、售汇；通过上级行办理代客外汇买卖；代理国外信用卡付款。总行在银监会批准的业务范围内授权的其它业务。",天津,静海,"静海县大邱庄镇黄山路"
天津市津感感光材料销售有限公司,911201031033760197,1995-06-26,N/A,李勤,"30(万元人民币)","感光材料、感光仪器、干版、石墨制品、感光胶片冲洗粉剂零售兼批发、代购代销。",天津,河西,"河西区新会道恒山里64-108室"
天津市益友房地产综合服务有限公司,911201012388192350,1995-06-27,N/A,韩起春,"30(万元人民币)","房屋租赁、托管、买卖、修缮；信息咨询",天津,和平,"天津市和平区沙市道40号"
中国建设银行股份有限公司天津福嘉园支行,911201056818620867,1995-06-27,N/A,董绍华,"N/A","吸收公众存款；发放短期、中期和长期贷款；办理贸易融资；办理国内外结算；办理保理业务；办理住房公积金及单位、个人城市住房基金的归集、结算等业务；办理票据承兑与贴现；代理发行金融债券；代理发行、代理兑付、承销政府债券；代理买卖政府债券、金融债券；代客外汇买卖；从事外币兑换；结汇、售汇；从事银行卡业务；提供信用证服务及担保；代理收付款项及代理保险业务；提供保险箱服务；从事咨信调查、查询、见证业务。经总行授权的其他业务；经中国银行业监督管理委员会等监督管理机构批准的其他业务。",天津,河北,"河北区天泰路福嘉园4-2-101-102"
天津市华钜科技开发有限公司,91120116600682893X,1995-06-27,N/A,王建芳,"10(万元人民币)","技术开发、咨询、服务、转让（新材料技术及产品）；化工原料",天津,西青,"华苑产业区科馨公寓19门502-8室"
天津纺织机械厂分厂销售中心,91120105239076736K,1995-06-27,集体所有制,张宝忠,"30万人民币","机械、电子设备、五金、交电、化工（不含易毒品、危险品）、民用建材零售兼批发、代购、代销；纺织机械技术咨询、信息咨询服务",天津,河北,"河北区万柳村大街56号"
天津市卫霞工贸有限公司,91120111600682834J,1995-06-27,N/A,张志强,"164(万元人民币)","加工、制造：塑料制品、模具、自行车零件、电工器材；机加工；批发兼零售：五金交电、日用百货。",天津,西青,"天津中北工业园南园红运路16号"
天津新明仓储设备有限公司,91120110239690736E,1995-06-27,N/A,赵卫,"2,000(万元人民币)","仪器、仪表、金属货架、输送设备、仓储设备、自动化立体仓库、自动化立体车库、冷弯型钢材批发兼零售；机电设备零售兼批发；从事国家法律法规允许经营的进出口业务；无人搬运车销售。",天津,东丽,"天津市东丽区东丽湖街东丽大道观澜御景庭苑32#-1-1504室"
天津市农垦房地产开发建设有限公司,91120103103376107M,1995-06-27,N/A,刘瑞成,"10,000(万元人民币)","房地产开发及商品房销售；房屋租赁。 ",天津,河西,"河西区洞庭路南（洞庭路与浯水道交口）"
中国银行股份有限公司天津利民道支行,91120103741379214Q,1995-06-27,N/A,王丽,"N/A","人民币业务：办理人民币存款、贷款、结算业务；人民币信用卡业务；办理票据贴现；代理兑付、销售政府债券；代理收付款项及代理保险业务；外汇业务：外汇存款；外汇贷款；外汇汇款；外币兑换；国际结算；结汇、售汇；通过上级行办理代客外汇买卖；代理国外信用卡付款；总行在银监会批准的业务范围内授权的其它业务。",天津,河西,"河西区围堤道146号"
中国建设银行股份有限公司天津强宜里支行,91120113681854553G,1995-06-27,N/A,王玲,"N/A","吸收公众存款；发放短期、中期和长期贷款；办理国内结算；办理国内保理；办理住房公积金及单位、个人城市住房基金的归集、结算等业务；办理票据承兑与贴现；代理发行金融债券；代理发行、兑付、承销政府债券；代理买卖政府债券、金融债券；从事银行卡业务；代理收付款项；办理经中国银行业监督管理委员会批准和总行授权经营的其他业务。",天津,北辰,"北辰区强宜里底商6-3"
天津市叉车总厂输送机械分厂,91120102103273079N,1995-06-28,集体所有制,赵晓洁,"10万人民币","输送机械制造；电滚筒制造；五金交电化工",天津,河东,"河东区津塘路172号"
天津市华厦汽车维修服务有限公司,9112010260067181XX,1995-06-28,N/A,张端灵,"30(万元人民币)","电气系统维修、供油系统维护和油品更换、涂漆。",天津,河东,"河东区建新路武警总队修理所院内"
天津市中原房地产开发有限公司,91120000239076779K,1995-06-28,N/A,欧阳旭津,"3,000(万元人民币)","房地产开发服务；纺织品、百货、金属材料、五金、交电批发兼零售、代购、代销",天津,河北,"天津市河北区靖江路7号"
交通银行股份有限公司天津真理道支行,9112010278937077X3,1995-06-28,N/A,黄凯,"N/A","办理人民币存款、贷款、结算业务；办理票据贴现；代理发行金融债券；代理发行、兑付、销售政府债券；代理收付款项；外币储蓄存款；办理其总行在中国人民银行批准的业务范围内授权的业务；办理经中国人民银行批准的其他业务。",天津,河东,"河东区真理道华悦大厦B座"
天津开发区正大环保设备有限公司,911201062396908837,1995-06-29,N/A,马政明,"500(万元人民币)","环保设备、制冷设备、钢结构、机电设备配件的制造、调试、安装、管道安装；司炉；起重机械安装、修理；环保设备、制冷设备、机电设备的技术开发、咨询(不含中介)、服务；五金、交电、电线电缆、建筑材料、机械、电子设备批发兼零售。",天津,西青,"西青区西营门街泰宁道南侧"
天津市和平贸易食品公司新兴园食品店,911201018031528335,1995-06-29,N/A,杨大成,"N/A","预包装食品兼散装食品、乳制品",天津,和平,"天津市和平区鞍山道125号"
天津市铭志科技发展有限公司,91120116600682682E,1995-06-29,N/A,么志会,"200(万元人民币)","技术开发、咨询、服务、转让",天津,西青,"华苑产业区开华道7号218室"
天津市科航机电有限责任公司,911201066007022843,1995-06-30,N/A,高焕涛,"50(万元人民币)","技术开发、咨询(不含中介)、服务、转让（机电一体化及产品）；设计安装、调试",天津,红桥,"红桥区光荣道竹山路4号（新华印铁制品厂）"
天津瑞华地毯有限公司,911201106008885090,1995-07-03,N/A,吴福禄,"160(万美元)","生产、销售簇绒地毯（非许可证配额产品）",天津,东丽,"天津市东丽区荒草坨村北地毯公司仓库内"
天津华堂投资发展有限公司,91120116238811786J,1995-07-03,N/A,王晓东,"3,000(万元人民币)","技术开发、技术转让；股权投资咨询；钢材、建材、五金、交电产品、办公用品批发兼零售。国家有专营、专项规定的按专营专项规定办理。",天津,滨海,"天津开发区欣园新村３３号"
天津市华驰房地产有限公司,91120102103273140D,1995-07-03,N/A,周迎玉,"3,000(万元人民币)","房地产开发及商品房销售、房产租赁；室内外装修。",天津,河东,"河东区华昌道39号"
天津开发区华兴工业气体有限公司,911201162396910504,1995-07-03,N/A,王希会,"40(万元人民币)","工业生产用二类1项易燃气体、二类2项不燃气体",天津,滨海,"天津经济技术开发区第二大街三号A419-2室"
天津宝一饲养设备有限公司,9112011060088855X3,1995-07-03,N/A,金俊锡,"61.5000(万美元)","生产、销售禽畜饲养设备、立体停车设备及相关配件和相应技术咨询、售后服务",天津,东丽,"天津市东丽区津塘公路四号桥"
三丰国际贸易(天津)有限公司,91120116600888461E,1995-07-03,N/A,李欣,"20(万美元)","国际贸易、简单加工、代办保税仓储；国内劳务派遣；会议会展服务；办公用品、劳保用品、日用品、工艺品、农副产品、五金电器、建筑及装修装饰用品的批发、零售及进出口；及以上相关咨询服务（以上商品进出口不涉及国营贸易、进出口配额许可证、出口配额招标、出口许可证等商品，其他专项规定管理的商品按照国家有关规定办理）（以上经营范围涉及行业许可的凭许可证件，在有效期限内经营，国家有专项专营规定的按规定办理）",天津,保税区,"天津港保税区海滨八路88号801－2室"
三联(天津)置业发展有限公司,911201106008884452,1995-07-03,N/A,黄振刚,"625(万美元)","房地产开发，物业管理，装饰装修工程（依法须经批准的项目，经相关部门批准后方可开展经营活动）",天津,东丽,"天津自贸试验区（空港经济区）中心大道与东五道交口颐景公寓9-2-204（佰卓（天津）商务秘书有限公司托管第010号）"
天津斯坦雷电气有限公司,91120116600888381T,1995-07-03,N/A,米谷光弘,"3,537.8820(万美元)","生产、销售新型电子元器件",天津,滨海,"天津经济技术开发区南海路140号"
天津弘泽物业发展有限公司,911202212396911491,1995-07-04,N/A,王加强,"5,000(万元人民币)","代理商品房销售；房地产中介服务；自有房屋租赁。",天津,滨海,"天津滨海新区弘城花园24号楼"
天津奇尔诺制衣有限公司,9112010123881950X8,1995-07-04,N/A,王群毅,"124.3000(万元人民币)","服装、服饰针织品制造、商业、物资供销业",天津,和平,"天津市和平区四平东道89号"
天津港保税区港湾加油服务有限责任公司,91120116239691130P,1995-07-04,N/A,刘明田,"127.9879(万元人民币)","汽油、煤油、柴油的零售，汽车配件、建筑装饰材料、批发兼零售、代购代销；机械设备出租；日用品经营（依法须经批准的项目，经相关部门批准后方可开展经营活动）",天津,滨海,"天津市滨海新区塘沽临港路69号"
天津市成齐广告企划发展有限公司,91120102103273159A,1995-07-05,N/A,张振国,"50(万元人民币)","服务：设计、制作、发布、代理国内各类广告；计算机软件设计、计算机维修与安装、装潢布展、劳务。",天津,河东,"河东区北长路79号44-45号"
天津市金涛装具有限公司,91120105600692805L,1995-07-05,N/A,韩金涛,"1,118(万元人民币)","皮革及制品制造、加工、修配；服饰及材料、百货、装饰装修材料、化工",天津,河北,"天津市河北区普济河道普安道2号"
中国农业银行股份有限公司天津正东支行,911201067440024393,1995-07-06,N/A,迟蕊,"N/A","办理人民币存款、贷款、结算业务；办理票据贴现、代理发行金融债券；代理发行、代理兑付、销售政府债券；买卖政府债券；代理收付款项；办理外币兑换业务；外币储蓄；外汇存款、外汇贷款、外汇汇款；资信调查、咨询见证业务；办理其总行在中国银行业监督管理委员会批准的业务范围内授权的业务；经中国银行业监督管理委员会批准的其他业务。",天津,红桥,"红桥区丁字沽一号路正东公寓1号楼底商"
天津港保税区新开元国际贸易工程有限公司,91120116239660844E,1995-07-06,N/A,周秋成,"150(万元人民币)","国际贸易及相关的简单加工，室内外建筑装饰、工艺美术品、木制品、服装加工，代办保税货运服务，咨询服务（不含中介）（依法须经批准的项目，经相关部门批准后方可开展经营活动）",天津,保税区,"天津自贸区(天津港保税区)海滨八路11号A-109室"
天津市新共同商贸有限公司,9112010423901456X7,1995-07-06,N/A,路雨亮,"30.3700(万元人民币)","预包装食品批发兼零售（经营范围以许可证为准）；化工原料",天津,南开,"天津市华苑产业区榕苑路15号4-A-901-A"
中国农业银行股份有限公司天津北洋支行,91120106744000222J,1995-07-06,N/A,王泉,"N/A","办理人民币存款、贷款、结算业务；办理票据贴现、代理发行金融债券；代理发行、代理兑付、销售政府债券；买卖政府债券；代理收付款项；办理外币兑换业务；外币储蓄、外汇存款、外汇贷款、外汇汇款；资信调查、咨询见证；国际结算、结汇、售汇、通过上级行办理代客外汇买卖、代理国外信用卡付款业务；办理其总行在中国银行业监督管理委员会批准的业务范围内授权的业务；经中国银行业监督管理委员会批准的其他业务。",天津,红桥,"天津市红桥区亿城堂庭商业中心光荣道115号、115号增1号、115号增2号底商"
天津市易达利昌商贸有限公司,911201136007717819,1995-07-06,N/A,于凤琪,"200(万元人民币)","汽车、小轿车销售；汽车销售咨询服务；汽车装具、机电产品（小轿车除外）、机电设备、金属材料、工程机械、五金电料、化工产品（危险化学品、易制毒品除外）、电器、汽车配件、机械设备、空调设备、木材、日用百货、日用杂品（烟花、爆竹除外）、仪器仪表、建筑材料批发兼零售；服装加工；从事国家法律法规允许经营的进出口业务；仓储",天津,北辰,"北辰区京津公路162号"
天津市朝日科贸有限公司,91120112238994818K,1995-07-07,N/A,万忠发,"1,770(万元人民币)","精细化工的技术及产品的开发、咨询、服务、转让；五金、交电、化工",天津,和平,"天津市和平区大理道90号208"
天津新方达设计制作有限公司,911201162396913417,1995-07-07,N/A,吕长清,"30(万元人民币)","企业标识、图样设计及咨询；设计、制作、发布、代理国内广告业务；家居装饰；商品展览展示服务；现代办公设备、文化用品、工艺美术品、百货、五金、化工商品",天津,滨海,"天津开发区第五大街５号"
天津市泰华煤业物资有限公司,91120110239280710P,1995-07-07,N/A,陈浩然,"1,000(万元人民币)","煤炭批发经营；洗煤；金属材料、机电产品（小轿车除外）、建筑材料、通用设备、五金交电、化工（易燃易爆、易制毒危险品除外）、日用百货、铁合金、铁矿石、焦碳批发零售；劳务服务",天津,东丽,"天津市东丽区军粮城街大安村"
花之大和(天津)种苗有限公司,911201046008886481,1995-07-07,N/A,吉田明史,"100(万美元)","生产，销售蔬菜、瓜类、花卉、草类种子、花卉苗木、种球，相关包装物，植物栽培基质类园艺资材及以上相关同类产品的零售、批发、进出口业务（上述涉及配额许可证管理、专项规定管理的商品按照国家有关规定办理）",天津,南开,"天津市南开区鞍山西道景湖里1-3-303"
