加德(天津)机电有限公司,91120116600543420C,1995-04-07,N/A,E．Augustin V．der Luehe,"15(万美元)","开发、生产、销售机电一体化小型设备、焊接设备、电子仪器仪表及相关的技术咨询服务；上述相关软件开发及销售；机电设备、化工设备、节能环保设备、仪器仪表、五金交电、塑料制品、金属制品、化工材料",天津,西青,"天津华苑产业区开华道3号华科创业中心1001-8室"
天津市西青区昌达建筑机械厂,91120111X00766460P,1995-04-07,私营企业,李富贵,"N/A","制造、加工、零售：搅拌机配件、五金制品、建筑材料。",天津,西青,"西青区辛口镇水高庄村北"
天津市北辰区双街农村信用合作社,91120113MA0677878B,1995-04-07,N/A,N/A,"518.400000","人民币存款、贷款、结算、代理、保管有价证券、委托存款贷款、代理收付款服务(按许可证办理)。",天津,北辰,"N/A"
天津市珠之明工贸发展有限公司,91120101238816659F,1995-04-07,N/A,赵碎珠,"50(万元人民币)","服装鞋帽、箱包制造加工。体育用品、工艺品",天津,和平,"天津市和平区和平路243-247号"
天津伊塞尔精细化工有限公司市内办事处,91120000MA05U8808K,1995-04-07,N/A,于健,"N/A","负责本公司经营范围内的咨询与联络",天津,河西,"天津市河西区紫金北里9号"
中国农业银行股份有限公司天津北辰支行,911201138039249447,1995-04-08,N/A,张敬涛,"N/A","办理人民币存款、贷款、结算业务；办理票据贴现；代理发行金融债券；代理发行、代理兑付、销售政府债券；买卖政府债券；代理收付款项；办理外汇存款、外汇贷款、外汇汇款、外币兑换、国际结算、结汇、售汇；办理资信调查、咨询见证业务；办理其总行在中国银行业监督管理委员会批准的业务范围内授权的业务；经中国银行业监督管理委员会批准的其他业务。",天津,北辰,"北辰区京津公路北辰区政府南"
天津市北辰区鑫泰塑料厂（普通合伙）,91120113X00801895X,1995-04-08,普通合伙,N/A,"N/A","塑料制品、纸制品加工；机加工。",天津,北辰,"天津市北辰区北仓镇延吉道东段天德路5号"
天津市静海县光辉纸制品加工厂,91120223104186735H,1995-04-08,集体所有制,白汉国,"30万人民币","花画工艺品制造。",天津,静海,"静海县大丰堆镇后明庄村"
天津开发区鹏达货运有限公司,91120116239686817F,1995-04-10,N/A,张树发,"500(万元人民币)","运输服务、国内货代服务；技术服务；建材、五交化、百货、现代办公用品、汽配、机电设备零售兼批发；涉及行业管理项目凭证经营；海上、陆路、航空国际货运代理服务。",天津,滨海,"天津开发区洞庭路89号"
天津市东线新技术开发有限公司,911201046006850585,1995-04-10,N/A,刘平,"30(万元人民币)","新材料、电子与信息、生物技术及产品的开发、咨询、服务、转让；计算机及外围设备、化工",天津,南开,"天津市南开区保山道盈江里2-2-102(科技园"
天津市都都文化办公用品有限公司,91120224700569070Q,1995-04-10,N/A,曹艳英,"100(万元人民币)","标准帐薄、办公用品、文化体育用品、缝纫机及配件、服装及辅料、日用百货、皮革制品、五金、交电、化工产品",天津,宝坻,"天津市宝坻区海滨街道东关街36号（京东第一集东侧，粮食大厦对面）"
天津开发区繁达贸易服务有限公司,91120116239686809L,1995-04-10,N/A,刘俊福,"150(万元人民币)","熏蒸服务、信息咨询服务；仓储；报检报验；木制品加工及销售",天津,滨海,"天津开发区恂园北街6号3号楼1008室"
天津港保税区华泰储运有限公司,91120116239686761C,1995-04-10,N/A,张文明,"4,000(万元人民币)","仓储服务；国内货运代理服务及多式联运代理服务；自有场地及房屋租赁（依法须经批准的项目，经相关部门批准后方可开展经营活动）",天津,滨海,"天津市塘沽区天津港集装箱物流中心内"
天津津国商商贸有限公司,911201012388166755,1995-04-10,N/A,霍江,"30(万元人民币)","机电产品（小轿车除外）、电梯、五金交电、化工（易毒化学品除外）、百货零售兼批发；电梯维修、安装服务",天津,和平,"天津市和平区常德道34号（原42号）一层"
天津新亚太工程建设监理有限公司,911201052390752663,1995-04-11,N/A,王笑,"2,000(万元人民币)","铁路、公路、工业与民用建筑、地下建筑、岩土、市政及城市交通",天津,河北,"河北区金沙江路33号增1号"
天津通达兴旺机械有限公司,91120113239424796H,1995-04-11,有限责任公司,薄连柱,"200万人民币","机械及配件、模具、电器及配件、铸件、木型制造、加工；电器控制设备、电器设备安装；机加工；劳务服务。",天津,北辰,"北辰区宜兴埠引滦泵站东侧"
天津市鑫利达针棉纺织印染有限责任公司,911201121039005622,1995-04-11,N/A,周耀光,"500(万元人民币)","针织、纺织品印染、服装、服饰、印染助剂制造，零售兼批发。",天津,津南,"津南区咸水沽镇刘家码头村西"
天津市红桥区亚美五金制品厂,91120106X006611166,1995-04-11,私营企业,傅秋路,"N/A","烤兰带钢、带扣；带钢剪裁、平断；冲压件、建筑和日用五金制品；五金机电产品技术咨询及服务。",天津,红桥,"红桥区湘潭道11号(地毯厂内D-5)"
天津市百思特机械有限公司,911201046006809193,1995-04-11,N/A,张桂兰,"50(万元人民币)","新型建筑材料、施工技术及设备、新材料、机电一体化技术及产品的开发、咨询、服务、转让；金属制品加工设备制造。",天津,南开,"天津市南开区长江道与咸阳路交口西北侧瑞湾花园3-1-402（科技园）"
天津开发区奥特石油工程技术有限公司,91120116239686876J,1995-04-12,N/A,孙进革,"100(万元人民币)","石油化工技术服务、技术咨询；监理服务；装置设计服务；石油技术开发、转让；石油化工装置配品、配件、石油化工设备、仪表、元器件销售；石油化工设备的检修。",天津,滨海,"天津经济技术开发区恂园里6号502室"
天津市东欣食品开发有限公司,9112010123881678X6,1995-04-12,N/A,陈亚南,"50(万元人民币)","食品技术的开发、咨询、服务（中介除外）；收购农产品",天津,和平,"和平区多伦道新福方里3号楼4号"
天津华住金属制品有限公司,9112022260054348X7,1995-04-12,N/A,村上宏,"2,580(万美元)","生产、加工、销售新型金属零件、材料，提供相关技术的开发、服务及上述产品、金属制品的批发、零售、进出口业务",天津,武清,"天津新技术产业园区武清开发区泉旺路7号"
天津隆达房地产开发有限公司,91120101600588100L,1995-04-12,N/A,刘春忠,"1,740(万元人民币)","房地产经营、物业管理、建筑装饰及相关的咨询服务。",天津,和平,"天津市和平区常德道117号"
津进(天津)国际贸易有限公司,91120116600543607B,1995-04-12,N/A,杨德江,"20(万美元)","国际贸易、代办保税仓储、简单加工、咨询服务",天津,保税区,"天津港保税区海滨五路92号204"
天津金晶储运有限公司,91120116103657507N,1995-04-13,N/A,苗连河,"5,000(万元人民币)","货运代理；矿产品加工；劳务服务；机加工；橡胶制品、棉花、木材、食用农产品、针纺织品、化工产品（危险品、剧毒品、易制毒产品除外）、塑料制品、五金交电、煤炭、焦炭、铁矿粉、钢材批发兼零售；对外贸易经营；装卸搬倒（港区内经营除外）；自有房屋、场地租赁；煤炭仓储",天津,滨海,"天津市滨海新区塘沽烟台道15号"
天津豪利汽车工程有限公司,91120110600588119J,1995-04-13,N/A,陈海涛,"30(万美元)","生产、销售汽车零部件及售后修配服务、技术管理培训和相关咨询服务",天津,东丽,"天津市东丽区华明镇李明庄村"
天津市天意成工贸有限公司,9112011323942493XX,1995-04-13,N/A,王洪瑜,"970(万元人民币)","水泥构件制造；建筑材料、五金、化工产品",天津,北辰,"北辰区宜兴埠津围公路东侧丰产河南"
天津市宜北电力设备有限公司,911201132394250860,1995-04-14,有限责任公司,张兰,"2000万人民币","避雷器、开关控制柜、美式跌开、隔离开关、箱式变电站、环网箱、变压器、环网柜、高压柜、配电箱制造；不锈钢制品及金属材料加工；承装",天津,北辰,"北辰区宜兴埠东外环线西"
天津市联大通讯发展有限公司,91120104600681153E,1995-04-14,N/A,卢国珠,"700(万元人民币)","电子与信息技术及产品的开发、咨询、服务、转让；计算机及外围设备、五金、交电、化工产品",天津,南开,"天津市南开区白堤路馨名园1-8-602（科技园）"
天津塘沽红楼机械化养殖厂,911201167004891854,1995-04-14,集体所有制,胡岩华,"300万人民币","种植、养殖、垂钓服务。",天津,滨海,"天津市滨海新区塘沽杨北公路北"
天津市南泰化工科技有限公司,9112010423899405XQ,1995-04-17,N/A,黄伟生,"30(万元人民币)","生物（不含药品的生产与销售）、新材料技术及产品的开发、咨询、服务、转让；化工",天津,南开,"天津市南开区南大西南村23-3-208（科技园）"
天津环发地热物产开发有限责任公司,911201031033740991,1995-04-17,N/A,王德忠,"50(万元人民币)","热水生产和供热；五金、交电、化工",天津,河西,"河西区澧水道36号"
天津市天惠科技有限公司,91120104600681137Q,1995-04-17,N/A,芦玉兰,"500(万元人民币)","电子与信息技术及产品的开发、咨询、服务、转让；计算机及外围设备、文化办公用机械、家用电器、家用电子产品、电讯器材批发兼零售；信息系统集成服务；软件开发；教育信息咨询；医疗器械销售",天津,南开,"天津市南开区鞍山西道338号1415（科技园）"
华博罗(天津)工业有限公司,91120113600543746N,1995-04-17,N/A,MICHAEL PHILLIP COYLE,"1,024.6500(万美元)","生产、销售汽车、摩托车配件",天津,北辰,"天津北辰经济技术开发区双原道10号"
天津市兰景工贸有限公司,91120101600651667M,1995-04-17,N/A,吕小带,"50(万元人民币)","生产、加工、销售：纸制品、妇幼卫生用品、塑料制品、化工原料及相关的原材料",天津,和平,"天津市和平区南京路305号附二楼203室"
天津华韩电子通信设备有限公司,91120104600588135J,1995-04-17,N/A,王泽清,"1,826.4840(万元人民币)","数据通信用终端机、移动通信终端机、电子元器件的生产、销售及以上产品技术咨询、服务；灯光照明系统施工及安装；电气设备维修、安装；批发和零售业。",天津,南开,"天津华苑产业区梓苑路6号B座二层、D座1009-1011室"
天津双寅实业开发有限公司,91120116239687262A,1995-04-18,N/A,丁华忠,"1,500(万元人民币)","房地产开发经营；高新技术开发、转让、咨询服务；自有房屋、自有设备租赁。",天津,滨海,"天津开发区洞庭路27号"
天津市再生资源回收利用河西公司解放南路经营部,91120103103374179L,1995-04-18,N/A,彭建国,"30(万元人民币)","废旧金属材料收购、加工；金属材料批发兼零售代购代销；仓储",天津,河西,"河西区解放南路南头"
天津市南开区黎明纸制品厂,91120104X006208598,1995-04-18,个人独资企业,崔金祥,"N/A","加工、制造、服务：纸制品；零售兼批发：塑料制品、印刷材料。",天津,南开,"南开区长江道73号"
中国农业银行股份有限公司天津佳荣里支行,9112011374139983X9,1995-04-19,N/A,郭磊,"N/A","办理人民币存款、贷款、结算业务；办理票据贴现；代理发行金融债券；代理发行、代理兑付、销售政府债券；买卖政府债券；代理收付款项；办理外币储蓄和外币兑换业务；其总行在中国银行业监督管理委员会批准的业务范围内授权的业务；经中国银行业监督管理委员会批准的其他业务。",天津,北辰,"天津市北辰区天穆镇佳荣里1号楼底商"
中国农业银行股份有限公司天津小淀支行,911201137413998489,1995-04-19,N/A,吴艳军,"N/A","办理人民币存款、贷款、结算业务；办理票据代理发行金融债券；代理发行、代理兑付、销售政府债券；买卖政府债券；代理收付款项；办理外汇存款、外汇贷款、外汇汇款；其总行在中国银行业监督管理委员会批准的业务范围内授权的业务；经中国银行业监督管理委员会批准的其他业务。",天津,北辰,"北辰区兴淀路西"
中国农业银行股份有限公司天津天穆支行,91120113679430217G,1995-04-19,N/A,佟燕,"N/A","办理人民币存款、贷款、结算业务；办理票据贴现；代理发行金融债券；代理发行、代理兑付、销售政府债券；买卖政府债券；代理收付款项；其总行在中国银行业监督管理委员会批准的业务范围内授权的业务；经中国银行业监督管理委员会批准的其他业务。",天津,北辰,"天津市北辰区顺义道北同玉楼一层"
中国农业银行股份有限公司天津友谊路金融街支行,91120103749138941G,1995-04-19,N/A,侯颖昉,"N/A","人民币存款、贷款、结算业务；办理票据贴现；代理发行金融债券；代理发行、代理兑付、销售政府债券；买卖政府债券；代理收付款项；外汇存款；外汇贷款；外汇汇款；国际结算；结汇、售汇；咨询及见证业务；其总行在中国人民银行批准的业务范围内授权的业务；经中国人民银行批准的其他业务。",天津,河西,"河西区友谊路41号大安大厦102底商"
中国农业银行股份有限公司天津辰星支行,911201136794301292,1995-04-19,N/A,米庆成,"N/A","吸收公众存款；发放短期、中期和长期贷款；办理国内外结算；办理票据承兑与贴现；代理发行、代理兑付、承销政府债券；代理收付款项；买卖、代理买卖外汇；办理外汇存贷款、外汇汇款、外币兑换；从事银行卡业务；提供信用证服务及担保；提供保管箱服务；提供资信调查、咨询、见证业务；经中国银行业监督管理机构批准，并由天津分行授权的各项业务。",天津,北辰,"天津市北辰区北辰西道与外环线交口(韩家墅海吉星农产品批发市场)信息办公楼一层"
天津华利保温建材有限公司,911201166007137095,1995-04-19,N/A,洪树全,"10,000(万元人民币)","保温隔热材料、耐火材料及外保护材料的研制、开发、销售；五金、交电、建筑材料、装饰材料销售；舾装材料、铝板制品生产、销售；钢结构、石油设备制造、加工及相关服务；保温工程、劳务服务；对外贸易经营。国家有专项专营规定的按规定执行",天津,滨海,"天津滨海高新区塘沽海洋科技园丹江路126号"
中国农业银行股份有限公司天津台儿庄路支行,911201037182590897,1995-04-19,N/A,杜颖,"N/A","人民币存款、贷款及结算业务；票据贴现；代理发行金融债券；代理发行、代理兑付、销售政府债券、买卖政府债券；代理收付款项；外币储蓄；其总行在中国人民银行批准的业务范围内授权的业务；经中国人民银行批准的其他业务。",天津,河西,"天津市河西区铂津湾南苑8-12号底商"
中国农业银行股份有限公司天津汉沽新滨支行,91120116679430102M,1995-04-19,N/A,齐利平,"N/A","办理人民币存款、贷款、结算业务；办理票据贴现；代理发行金融债券；代理发行、代理兑付、销售政府债券；买卖政府债券；代理收付款项；其总行在中国银行业监督管理委员会批准的业务范围内授权的业务；经中国银行业监督管理委员会批准的其他业务。",天津,滨海,"天津市滨海新区汉沽东风南路86、88号"
中国农业银行股份有限公司天津双街支行,911201136794301960,1995-04-19,N/A,范洪芹,"N/A","办理人民币存款、贷款、结算业务；办理票据贴现；代理发行金融债券；代理发行、代理兑付、销售政府债券；买卖政府债券；代理收付款项；办理外币储蓄、其总行在中国银行业监督管理委员会批准的业务范围内授权的业务，经中国银行业监督管理委员会批准的其他业务。",天津,北辰,"北辰区顺风东路24、25号龙顺道1号"
中国农业银行股份有限公司天津金牛支行,91120103749138933M,1995-04-19,N/A,卢嵩,"N/A","办理人民币存款、贷款、结算业务；办理票据贴现；代理发行金融债券；代理发行、代理兑付、销售政府债券；买卖政府债券；代理收付款项；外汇存款、外币兑换；其总行在中国人民银行批准的业务范围内授权的业务；经中国人民银行批准的其他业务。",天津,河西,"河西区珠江道68号A-102"
中国农业银行股份有限公司天津双口支行,9112011367943009XH,1995-04-19,N/A,郭起旺,"N/A","办理人民币存款、贷款、结算业务；办理票据贴现；代理发行金融债券；代理发行、代理兑付、销售政府债券；买卖政府债券；代理收付款项；办理外汇存款；外汇贷款；外汇汇款；外币兑换；其总行在中国银行业监督管理委员会批准的业务范围内授权的业务；经中国银行业监督管理委员会批准的其他业务。",天津,北辰,"天津市北辰区京福公路西侧、天津医药医疗器械工业园内"
天津市颐合货代运输有限公司,911201036006721693,1995-04-19,N/A,董英杰,"500(万元人民币)","联运业务（水路运输除外）；建筑材料、机械电子设备（小轿车除外）、百货、针纺织品、五金、交电、化工产品（危险化学品及易制毒品除外）批发兼零售；货物进出口业务（国家限定公司经营和禁止进出口的商品及技术除外）；餐饮企业管理；为企事业单位提供后勤化管理服务；建筑工程投标代理；工程造价咨询；工程预决算编制；工程项目管理；工程技术服务；商务信息咨询；食品销售",天津,河西,"天津市河西区琼州道与大沽南路交口恒华大厦2-1-2303-A"
中国农业银行股份有限公司天津宜兴埠支行,911201137413998564,1995-04-19,N/A,张强,"N/A","办理人民币存款、贷款、结算业务；办理票据贴现；代理发行金融债券；代理发行、代理兑付、销售政府债券；买卖政府债券；代理收付款项；外汇存款、外汇贷款、外汇汇款、外币兑换、因私购汇；国际结算、结汇、售汇；其总行在中国银行业监督管理委员会批准的业务范围内授权的业务；经中国银行业监督管理委员会批准的其他业务。",天津,北辰,"天津市北辰区宜兴埠三千路宜鹏园小区底商"
中国农业银行股份有限公司天津信济里支行,91120103777302921T,1995-04-19,N/A,何丽云,"N/A","吸收公众存款；发放短期、中期、长期贷款；办理国内结算；办理票据贴现；代理兑付、承销政府债券；代理收付款项；外汇存款；外汇贷款；外汇汇款；外币兑换；国际结算；通过上级行办理代客外汇买卖；代理国外信用卡付款；总行在银监会批准的业务范围内授权的其他业务。",天津,河西,"河西区宾友道16号"
中国农业银行股份有限公司天津青光支行,91120113741399813N,1995-04-19,N/A,王宗富,"N/A","办理人民币存款、贷款、结算业务；办理票据贴现；代理发行金融债券；代理发行、代理兑付、销售政府债券；买卖政府债券；代理收付款项；办理外汇存款；外汇贷款；外汇汇款；其总行在中国银行业监督管理委员会批准的业务范围内授权的业务；经中国银行业监督管理委员会批准的其他业务。",天津,北辰,"北辰区津坝公路青光镇青光村"
中国农业银行股份有限公司天津微山路支行,91120103718259038Y,1995-04-19,N/A,陶育强,"N/A","人民币存款、贷款、结算业务；票据贴现；代理发行金融债券；代理发行、代理兑付、销售政府债券；买卖政府债券；代理收付款项；外币储蓄；其总行在中国人民银行批准的业务范围内授权的业务；经中国人民银行批准的其他业务。",天津,河西,"河西区微山路11号"
中国农业银行股份有限公司天津宜东支行,91120113679430225B,1995-04-19,N/A,杨月利,"N/A","吸收公众存款；发放短期、中期、长期贷款；办理国内结算；办理票据贴现；代理兑付、承销政府债券；代理收付款项；外汇存款；外汇贷款；外汇汇款；外币兑换；国际结算；通过上级行办理代客外汇买卖；代理国外信用卡付款；总行在银监会批准的业务范围内授权的其他业务。",天津,北辰,"北辰区宜兴埠镇南下坡铁路北侧"
天津市三巨纸业发展有限公司,911201016006516248,1995-04-19,N/A,孟广强,"50(万元人民币)","批发兼零售：纸张、包装材料、建筑材料、百货、五金、交电、打印纸、印刷纸、办公用纸。",天津,和平,"天津市和平区成都道116号院内南楼204"
中国农业银行股份有限公司天津西堤头支行,911201138039251467,1995-04-19,N/A,付强,"N/A","办理人民币存款、贷款、结算业务；办理票据贴现；代理发行金融债券；代理发行、代理兑付、销售政府债券；买卖政府债券；代理收付款项；办理外汇存款、外汇贷款、外汇汇款；其总行在中国银行业监督管理委员会批准的业务范围内授权的业务；经中国银行业监督管理委员会批准的其他业务。",天津,北辰,"北辰区西堤头镇西堤头村"
中国农业银行股份有限公司天津柳滩支行,911201137413997926,1995-04-19,N/A,张瑞林,"N/A","办理人民币存款、贷款、结算业务；办理票据贴现；代理发行金融债券；代理发行、代理兑付、销售政府债券；买卖政府债券；代理收付款项；外汇存款；外汇贷款；外汇汇款；外币兑换；国际结算；结汇、售汇；其总行在中国银行业监督管理委员会批准的业务范围内授权的业务；经中国银行业监督管理委员会批准的其他业务。",天津,北辰,"北辰区京津公路柳滩村东"
中国农业银行股份有限公司天津大通绿岛支行,9112011367943017X5,1995-04-19,N/A,刘士芹,"N/A","吸收公众存款；发放短期、中期、长期贷款；办理国内结算；办理票据贴现；代理兑付、承销政府债券；代理收付款项；外汇存款；外汇贷款；外汇汇款；外币兑换；国际结算；通过上级行办理代客外汇买卖；代理国外信用卡付款；总行在银监会批准的业务范围内授权的其他业务。",天津,北辰,"北辰区京津公路320号大通绿岛家园61号楼32门"
天津市鑫通实业有限公司,91120113239425262W,1995-04-19,N/A,郑桐海,"494.5000(万元人民币)","纸张、照像器材、五金、交电、汽车配件、金属材料、建筑材料批发兼零售；铆焊加工、金属门窗制造、复合包装材料制造；自有厂房租赁。",天津,北辰,"北辰区京津公路柳滩农工商公司院内"
天津市京福石油制品销售有限公司,91120111752238572U,1995-04-19,N/A,邢志和,"50(万元人民币)","润滑油脂、金属材料批发兼零售；劳务服务",天津,西青,"天津市西青区张家窝镇古佛寺村东辛老路南侧"
中国农业银行股份有限公司天津化工支行,91120113679430161D,1995-04-19,N/A,靳惠萍,"N/A","吸收公众存款；发放短期、中期、长期贷款；办理国内结算；办理票据贴现；代理兑付、承销政府债券；代理收付款项；外汇存款；外汇贷款；外汇汇款；外币兑换；国际结算；通过上级行办理代客外汇买卖；代理国外信用卡付款；总行在银监会批准的业务范围内授权的其他业务。",天津,北辰,"北辰区京津公路天阳公寓底商"
中国农业银行股份有限公司天津长青支行,91120103718259070A,1995-04-19,N/A,张培鑫,"N/A","人民币存款、贷款、结算业务；办理票据贴现；代理发行金融债券；代理发行、代理兑付、销售政府债券；买卖政府债券；代理收付款项；外汇存款；外汇贷款；外汇汇款；国际结算；结汇、售汇；咨询及见证业务；其总行在中国人民银行批准的业务范围内授权的业务；经中国人民银行批准的其他业务。",天津,河西,"河西区尖山路72号南楼公寓底商"
中国农业银行股份有限公司天津佟楼支行,911201037182590972,1995-04-19,N/A,李伟,"N/A","吸收公众存款；发放短期、中期、长期贷款；办理国内结算；办理票据贴现；代理兑付、承销政府债券；代理收付款项；外汇存款；外汇贷款；外汇汇款；外币兑换；国际结算；通过上级行办理代客外汇买卖；代理国外信用卡付款；总行在银监会批准的业务范围内授权的其他业务。",天津,河西,"天津市河西区平山道森淼公寓101号"
